book	chapter	chapter-zfilled	verse	testament	testament-indexed	section	section-indexed	section-indexed-no-testament	book-indexed	Bohairic	Sahidic	English	Greek	Fayyumic	Akhmimic	OldBohairic	Mesokemic	DialectP	Lycopolitan
Genesis	27	27	5	OT	1. OT	Pentateuch	1. Pentateuch	01. Pentateuch	01. Genesis	ⲣⲉⲃⲉⲕⲕⲁ ⲇⲉ ⲁⲥⲥⲱⲧⲉⲙ ⲉ̀ⲓⲥⲁⲁⲕ ⲉϥⲥⲁϫⲓ ⲛⲉⲙ ⲏⲥⲁⲩ ⲡⲉϥϣⲏⲣⲓ ⲁ ⲏⲥⲁⲩ ⲇⲉ ϣⲉ ⲛⲁϥ ⲉ̀ⲧⲕⲟⲓ ⲉ̀ϫⲱⲣϫ ⲛ̀ⲟⲩϫⲟⲣϫⲥ ⲙ̀ⲡⲉϥⲓⲱⲧ		And Rebecca heard Isaac speaking to Esau his son; and Esau went to the plain to procure venison for his father.	Ρεβεκκα δὲ ἤκουσεν λαλοῦντος Ισαακ πρὸς Ησαυ τὸν υἱὸν αὐτοῦ. ἐπορεύθη δὲ Ησαυ εἰς τὸ πεδίον θηρεῦσαι θήραν τῷ πατρὶ αὐτοῦ·						
Genesis	27	27	6	OT	1. OT	Pentateuch	1. Pentateuch	01. Pentateuch	01. Genesis	ⲣⲉⲃⲉⲕⲕⲁ ⲇⲉ ⲡⲉϫⲁⲥ ⲛ̀ⲓⲁⲕⲱⲃ ⲡⲉⲥⲕⲟⲩϫⲓ ⲛ̀ϣⲏⲣⲓ ϫⲉ ϩⲏⲡⲡⲉ ⲁ̀ⲛⲟⲕ ⲁⲓⲥⲱⲧⲉⲙ ⲉ̀ⲡⲉⲕⲓⲱⲧ ⲉϥⲥⲁϫⲓ ⲛⲉⲙ ⲏⲥⲁⲩ ⲡⲉⲕⲥⲟⲛ ⲉϥϫⲱ ⲙ̀ⲙⲟⲥ		And Rebecca said to Jacob her younger son, Behold, I heard thy father speaking to Esau thy brother, saying,	Ρεβεκκα δὲ εἶπεν πρὸς Ιακωβ τὸν υἱὸν αὐτῆς τὸν ἐλάσσω ᾿Ιδὲ ἐγὼ ἤκουσα τοῦ πατρός σου λαλοῦντος πρὸς Ησαυ τὸν ἀδελφόν σου λέγοντος						
Genesis	27	27	7	OT	1. OT	Pentateuch	1. Pentateuch	01. Pentateuch	01. Genesis	ϫⲉ ⲁⲛⲓⲟⲩⲓ ⲛⲏⲓ ⲛ̀ⲟⲩϫⲟⲣϫⲥ ⲟⲩⲟϩ ⲙⲁⲑⲁⲙⲓⲟ ⲛⲏⲓ ⲛ̀ϩⲁⲛϧⲣⲏⲟⲩⲓ ϩⲓⲛⲁ ⲛ̀ⲧⲁⲟⲩⲱⲙ ⲛ̀ⲧⲁⲥⲙⲟⲩ ⲉ̀ⲣⲟⲕ ⲙ̀ⲡⲉⲙⲑⲟ ⲙ̀ⲡϭ̅ⲥ̅ ⲙ̀ⲡⲁϯⲙⲟⲩ		Bring me venison, and prepare me meats, that I may eat and bless thee before the Lord before I die.	῎Ενεγκόν μοι θήραν καὶ ποίησόν μοι ἐδέσματα, καὶ φαγὼν εὐλογήσω σε ἐναντίον κυρίου πρὸ τοῦ ἀποθανεῖν με.						
Genesis	27	27	8	OT	1. OT	Pentateuch	1. Pentateuch	01. Pentateuch	01. Genesis	ϯⲛⲟⲩ ⲟⲩⲛ ⲡⲁϣⲏⲣⲓ ⲥⲱⲧⲉⲙ ⲛ̀ⲥⲱⲓ ⲙ̀ⲫⲣⲏϯ ⲉ̀ϯⲛⲁϩⲉⲛϩⲱⲛⲕ ⲉ̀ⲣⲟϥ		Now then, my son, hearken to me, as I command thee.	νῦν οὖν, υἱέ, ἄκουσόν μου, καθὰ ἐγώ σοι ἐντέλλομαι,						
Genesis	27	27	9	OT	1. OT	Pentateuch	1. Pentateuch	01. Pentateuch	01. Genesis	ⲟⲩⲟϩ ⲙⲁϣⲉ ⲛⲁⲕ ⲉ̀ⲛⲓⲉⲥⲱⲟⲩ ϭⲓ ⲛⲏⲓ ⲉ̀ⲃⲟⲗ ⲙ̀ⲙⲁⲩ ⲙ̀ⲙⲁⲥ ⲃ̅ ⲙ̀ⲃⲁⲉⲙⲡⲓ ⲉⲩϫⲏⲛ ⲉ̀ⲛⲁⲛⲉⲩ ⲟⲩⲟϩ ⲛ̀ⲧⲁⲑⲁⲙⲓⲟ ⲛ̀ϩⲁⲛⲭⲟⲩⲱⲙ ⲙ̀ⲡⲉⲕⲓⲱⲧ ⲙ̀ⲫⲣⲏϯ ⲉⲧⲉϩⲛⲁϥ		And go to the cattle and take for me thence two kids, tender and good, and I will make them meats for thy father, as he likes.	καὶ πορευθεὶς εἰς τὰ πρόβατα λαβέ μοι ἐκεῖθεν δύο ἐρίφους ἁπαλοὺς καὶ καλούς, καὶ ποιήσω αὐτοὺς ἐδέσματα τῷ πατρί σου, ὡς φιλεῖ,						
Genesis	27	27	10	OT	1. OT	Pentateuch	1. Pentateuch	01. Pentateuch	01. Genesis	ⲟⲩⲟϩ ⲉⲕⲉ̀ⲟⲗⲟⲩ ⲉ̀ϧⲟⲩⲛ ⲙ̀ⲡⲉⲕⲓⲱⲧ ⲟⲩⲟϩ ⲉϥⲉ̀ⲟⲩⲱⲙ ϩⲓⲛⲁ ⲛ̀ⲧⲉ ⲡⲉⲕⲓⲱⲧ ⲥⲙⲟⲩ ⲉ̀ⲣⲟⲕ ⲙ̀ⲡⲁⲧⲉϥⲙⲟⲩ		And thou shalt bring them in to thy father, and he shall eat, that thy father may bless thee before he dies.	καὶ εἰσοίσεις τῷ πατρί σου, καὶ φάγεται, ὅπως εὐλογήσῃ σε ὁ πατήρ σου πρὸ τοῦ ἀποθανεῖν αὐτόν.						
Genesis	27	27	11	OT	1. OT	Pentateuch	1. Pentateuch	01. Pentateuch	01. Genesis	ⲡⲉϫⲉ ⲓⲁⲕⲱⲃ ⲇⲉ ⲛ̀ⲣⲉⲃⲉⲕⲕⲁ ⲧⲉϥⲙⲁⲩ ϫⲉ ⲏⲥⲁⲩ ⲡⲁⲥⲟⲛ ⲟⲩⲣⲱⲙⲓ ⲉϥⲣⲏⲧ ⲙ̀ϥⲱⲓ ⲡⲉ ⲁ̀ⲛⲟⲕ ⲇⲉ ⲁ̀ⲛⲟⲕ ⲟⲩⲣⲱⲙⲓ ⲉϥϫⲏⲛ		And Jacob said to his mother Rebecca, Esau my brother is a hairy man, and I a smooth man.	εἶπεν δὲ Ιακωβ πρὸς Ρεβεκκαν τὴν μητέρα αὐτοῦ ῎Εστιν Ησαυ ὁ ἀδελφός μου ἀνὴρ δασύς, ἐγὼ δὲ ἀνὴρ λεῖος·						
Genesis	27	27	12	OT	1. OT	Pentateuch	1. Pentateuch	01. Pentateuch	01. Genesis	ⲙⲏⲡⲟⲧⲉ ⲛ̀ⲧⲉϥϫⲟⲙϫⲉⲙ ⲉ̀ⲣⲟⲓ ⲛ̀ϫⲉ ⲡⲁⲓⲱⲧ ⲟⲩⲟϩ ⲛ̀ⲧⲁⲉⲣ ⲫⲣⲏϯ ⲉⲓⲉⲣⲕⲁⲧⲁⲫⲣⲟⲛⲓⲛ ⲙ̀ⲡⲉϥⲙ̀ⲑⲟ ⲟⲩⲟϩ ⲛ̀ⲧⲁⲓ̀ⲛⲓ ⲉ̀ϩⲣⲏⲓ ⲉ̀ϫⲱⲓ ⲛ̀ⲟⲩⲥⲁϩⲟⲩⲓ ⲟⲩⲟϩ ⲛ̀ⲟⲩⲥⲙⲟⲩ ⲁⲛ		Peradventure my father may feel me, and I shall be before him as one ill-intentioned, and I shall bring upon me a curse, and not a blessing.	μήποτε ψηλαφήσῃ με ὁ πατήρ μου, καὶ ἔσομαι ἐναντίον αὐτοῦ ὡς καταφρονῶν καὶ ἐπάξω ἐπ᾽ ἐμαυτὸν κατάραν καὶ οὐκ εὐλογίαν.						
Genesis	27	27	13	OT	1. OT	Pentateuch	1. Pentateuch	01. Pentateuch	01. Genesis	ⲡⲉϫⲉ ⲧⲉϥⲙⲁⲩ ⲇⲉ ⲛⲁϥ ϫⲉ ⲡⲉⲕⲥⲁϩⲟⲩⲓ ⲉ̀ϩⲣⲏⲓ ⲉ̀ϫⲱⲓ ⲡⲁϣⲏⲣⲓ ⲙⲟⲛⲟⲛ ⲥⲱⲧⲉⲙ ⲛ̀ⲥⲁ ⲧⲁⲥⲙⲏ ⲟⲩⲟϩ ⲙⲁϣⲉ ⲛⲁⲕ ⲁⲛⲓⲟⲩⲓ ⲛⲏⲓ		And his mother said to him, On me be thy curse, Son; only hearken to my voice, and go and bring them me.	εἶπεν δὲ αὐτῷ ἡ μήτηρ ᾿Επ᾽ ἐμὲ ἡ κατάρα σου, τέκνον· μόνον ὑπάκουσον τῆς φωνῆς μου καὶ πορευθεὶς ἔνεγκέ μοι.						
Genesis	27	27	14	OT	1. OT	Pentateuch	1. Pentateuch	01. Pentateuch	01. Genesis	ⲁϥϣⲉ ⲛⲁϥ ⲁϥϭⲓⲧⲟⲩ ⲁϥⲉⲛⲟⲩ ϩⲁ ⲧⲉϥⲙⲁⲩ ⲟⲩⲟϩ ⲁ ⲧⲉϥⲙⲁⲩ ⲑⲁⲙⲓⲟ ⲛ̀ⲛⲓⲭⲟⲩⲱⲙ ⲕⲁⲧⲁ ⲫⲣⲏϯ ⲉⲧⲉ ⲡⲉϥⲓⲱⲧ ⲙⲉⲓ ⲙ̀ⲙⲱⲟⲩ		So he went and took and brought them to his mother; and his mother made meats, as his father liked them.	πορευθεὶς δὲ ἔλαβεν καὶ ἤνεγκεν τῇ μητρί, καὶ ἐποίησεν ἡ μήτηρ αὐτοῦ ἐδέσματα, καθὰ ἐφίλει ὁ πατὴρ αὐτοῦ.						
Genesis	27	27	15	OT	1. OT	Pentateuch	1. Pentateuch	01. Pentateuch	01. Genesis	ⲟⲩⲟϩ ⲁⲥϭⲓ ⲛ̀ϫⲉ ⲣⲉⲃⲉⲕⲕⲁ ⲧⲉϥⲙⲁⲩ ⲛ̀ϯⲥⲧⲟⲗⲏ ⲛ̀ⲧⲉ ⲏⲥⲁⲩ ⲡⲉⲥⲛⲓϣϯ ⲛ̀ϣⲏⲣⲓ ⲑⲏ ⲉⲑⲛⲁⲛⲉⲥ ⲑⲏ ⲉ̀ⲛⲁⲥⲭⲏ ⲉ̀ϧⲟⲩⲛ ϧⲉⲛ ⲡⲉⲥⲏⲓ ⲟⲩⲟϩ ⲁⲥⲧⲏⲓⲥ ϩⲓϫⲉⲛ ⲓⲁⲕⲱⲃ ⲡⲉⲥⲕⲟⲩϫⲓ ⲛ̀ϣⲏⲣⲓ		And Rebecca having taken the fine raiment of her elder son Esau which was with her in the house, put it on Jacob her younger son.	καὶ λαβοῦσα Ρεβεκκα τὴν στολὴν Ησαυ τοῦ υἱοῦ αὐτῆς τοῦ πρεσβυτέρου τὴν καλήν, ἣ ἦν παρ᾽ αὐτῇ ἐν τῷ οἴκῳ, ἐνέδυσεν Ιακωβ τὸν υἱὸν αὐτῆς τὸν νεώτερον						
Genesis	27	27	16	OT	1. OT	Pentateuch	1. Pentateuch	01. Pentateuch	01. Genesis	ⲟⲩⲟϩ ⲛⲓϣⲁⲣ ⲛ̀ⲧⲉ ⲛⲓⲃⲁⲉⲙⲡⲓ ⲁⲥⲙⲟⲣⲟⲩ ⲉ̀ⲛⲉϥϣⲱⲃϣ ⲛⲉⲙ ⲛⲓⲙⲁ ⲉⲧⲃⲏϣ ⲉ̀ⲃⲟⲗ ϧⲉⲛ ⲛⲉϥⲙⲟϯ		And she put on his arms the skins of the kids, and on the bare parts of his neck.	καὶ τὰ δέρματα τῶν ἐρίφων περιέθηκεν ἐπὶ τοὺς βραχίονας αὐτοῦ καὶ ἐπὶ τὰ γυμνὰ τοῦ τραχήλου αὐτοῦ						
Genesis	27	27	17	OT	1. OT	Pentateuch	1. Pentateuch	01. Pentateuch	01. Genesis	ⲟⲩⲟϩ ⲁⲥϯ ⲛ̀ⲛⲓⲭⲟⲩⲱⲙ ⲛⲉⲙ ⲛⲓⲱⲓⲕ ⲉⲧⲁⲥⲑⲁⲙⲓⲱⲟⲩ ⲉ̀ϧⲣⲏⲓ ⲉ̀ⲛⲉⲛϫⲓϫ ⲛ̀ⲓⲁⲕⲱⲃ ⲡⲉⲥϣⲏⲣⲓ		And she gave the meats, and the loaves which she had prepared, into the hands of Jacob her son.	καὶ ἔδωκεν τὰ ἐδέσματα καὶ τοὺς ἄρτους, οὓς ἐποίησεν, εἰς τὰς χεῖρας Ιακωβ τοῦ υἱοῦ αὐτῆς.						
Genesis	27	27	18	OT	1. OT	Pentateuch	1. Pentateuch	01. Pentateuch	01. Genesis	ⲟⲩⲟϩ ⲉϥⲉⲛⲟⲩ ⲉ̀ϧⲟⲩⲛ ⲙ̀ⲡⲉϥⲓⲱⲧ ⲡⲉϫⲁϥ ⲇⲉ ϫⲉ ⲡⲁⲓⲱⲧ ⲛ̀ⲑⲟϥ ⲇⲉ ⲡⲉϫⲁϥ ϫⲉ ϩⲏⲡⲡⲉ ⲁ̀ⲛⲟⲕ ⲟⲩ ⲡⲉⲧϣⲟⲡ ⲡⲁϣⲏⲣⲓ		And he brought them to his father, and said, Father; and he said, Behold I am here; who art thou, son?	καὶ εἰσήνεγκεν τῷ πατρὶ αὐτοῦ. εἶπεν δέ Πάτερ. ὁ δὲ εἶπεν ᾿Ιδοὺ ἐγώ· τίς εἶ σύ, τέκνον;						
Genesis	27	27	19	OT	1. OT	Pentateuch	1. Pentateuch	01. Pentateuch	01. Genesis	ⲟⲩⲟϩ ⲡⲉϫⲉ ⲓⲁⲕⲱⲃ ⲙ̀ⲡⲉϥⲓⲱⲧ ϫⲉ ⲁ̀ⲛⲟⲕ ⲡⲉ ⲏⲥⲁⲩ ⲡⲉⲕϣⲟⲣⲡ ⲙ̀ⲙⲓⲥⲓ ⲁⲓⲓⲣⲓ ⲙ̀ⲫⲣⲏϯ ⲉⲧⲁⲕⲥⲁϫⲓ ⲛⲉⲙⲏⲓ ⲙ̀ⲙⲟϥ ⲧⲱⲛⲕ ϩⲉⲙⲥⲓ ⲟⲩⲱⲙ ⲉ̀ⲃⲟⲗ ϧⲉⲛ ⲧⲁϫⲟⲣϫⲥ ϩⲓⲛⲁ ⲛ̀ⲧⲉ ⲧⲉⲕⲯⲩⲭⲏ ⲥⲙⲟⲩ ⲉ̀ⲣⲟⲓ		And Jacob said to his father, I, Esau thy first-born, have done as thou toldest me, rise, sit, and eat of my venison, that thy soul may bless me.	καὶ εἶπεν Ιακωβ τῷ πατρὶ αὐτοῦ ᾿Εγὼ Ησαυ ὁ πρωτότοκός σου· ἐποίησα, καθὰ ἐλάλησάς μοι· ἀναστὰς κάθισον καὶ φάγε τῆς θήρας μου, ὅπως εὐλογήσῃ με ἡ ψυχή σου.						
Genesis	27	27	20	OT	1. OT	Pentateuch	1. Pentateuch	01. Pentateuch	01. Genesis	ⲟⲩⲟϩ ⲡⲉϫⲉ ⲓⲥⲁⲁⲕ ⲙ̀ⲡⲉϥϣⲏⲣⲓ ϫⲉ ⲟⲩ ⲡⲉ ⲫⲁⲓ ⲉⲧⲁⲕϫⲉⲙϥ ⲛ̀ⲭⲱⲗⲉⲙ ⲡⲁϣⲏⲣⲓ ⲛ̀ⲑⲟϥ ⲇⲉ ⲡⲉϫⲁϥ ϫⲉ ⲫⲏ ⲉⲧⲁ ⲫϯ ⲧⲏⲓϥ ⲙ̀ⲡⲁⲙⲑⲟ		And Isaac said to his son, What is this which thou hast quickly found? And he said, That which the Lord thy God presented before me.	εἶπεν δὲ Ισαακ τῷ υἱῷ αὐτοῦ Τί τοῦτο, ὃ ταχὺ εὗρες, ὦ τέκνον; ὁ δὲ εἶπεν ῝Ο παρέδωκεν κύριος ὁ θεός σου ἐναντίον μου.						
Genesis	27	27	21	OT	1. OT	Pentateuch	1. Pentateuch	01. Pentateuch	01. Genesis	ⲡⲉϫⲉ ⲓⲥⲁⲁⲕ ⲇⲉ ⲛ̀ⲓⲁⲕⲱⲃ ϫⲉ ϩⲉⲛⲕ ⲉ̀ⲣⲟⲓ ⲡⲁϣⲏⲣⲓ ⲛ̀ⲧⲁϫⲟⲙϫⲉⲙ ⲉ̀ⲣⲟⲕ ϫⲉ ⲁⲛ ⲛ̀ⲑⲟⲕ ⲡⲉ ⲡⲁϣⲏⲣⲓ ⲏⲥⲁⲩ ϣⲁⲛ ⲙ̀ⲙⲟⲛ		And Isaac said to Jacob, Draw nigh to me, and I will feel thee, son, if thou art my son Esau or not.	εἶπεν δὲ Ισαακ τῷ Ιακωβ ῎Εγγισόν μοι, καὶ ψηλαφήσω σε, τέκνον, εἰ σὺ εἶ ὁ υἱός μου Ησαυ ἢ οὔ.						
Genesis	27	27	22	OT	1. OT	Pentateuch	1. Pentateuch	01. Pentateuch	01. Genesis	ⲁϥϩⲉⲛϥ ⲇⲉ ⲛ̀ϫⲉ ⲓⲁⲕⲱⲃ ϩⲁ ⲓⲥⲁⲁⲕ ⲡⲉϥⲓⲱⲧ ⲟⲩⲟϩ ⲁϥϫⲟⲙϫⲉⲙ ⲉ̀ⲣⲟϥ ⲟⲩⲟϩ ⲡⲉϫⲁϥ ϫⲉ ϯⲥⲙⲏ ⲙⲉⲛ ⲧⲥⲙⲏ ⲛ̀ⲓⲁⲕⲱⲃ ⲧⲉ ⲛⲓϫⲓϫ ⲇⲉ ⲛⲉⲛϫⲓϫ ⲛ̀ⲏⲥⲁⲩ ⲛⲉ		And Jacob drew nigh to his father Isaac, and he felt him, and said, The voice is Jacob’s voice, but the hands are the hands of Esau.	ἤγγισεν δὲ Ιακωβ πρὸς Ισαακ τὸν πατέρα αὐτοῦ, καὶ ἐψηλάφησεν αὐτὸν καὶ εἶπεν ῾Η μὲν φωνὴ φωνὴ Ιακωβ, αἱ δὲ χεῖρες χεῖρες Ησαυ.						
Genesis	27	27	23	OT	1. OT	Pentateuch	1. Pentateuch	01. Pentateuch	01. Genesis	ⲟⲩⲟϩ ⲙ̀ⲡⲉϥⲥⲟⲩⲱⲛϥ ⲛⲁⲣⲉ ⲛⲉϥϫⲓϫ ⲅⲁⲣ ⲟϣ ⲙ̀ϥⲱⲓ ⲙ̀ⲫⲣⲏϯ ⲛ̀ⲛⲁ ⲏⲥⲁⲩ ⲡⲉϥⲥⲟⲛ ⲟⲩⲟϩ ⲁϥⲥⲙⲟⲩ ⲉ̀ⲣⲟϥ		And he knew him not, for his hands were as the hands of his brother Esau, hairy; and he blessed him,	καὶ οὐκ ἐπέγνω αὐτόν· ἦσαν γὰρ αἱ χεῖρες αὐτοῦ ὡς αἱ χεῖρες Ησαυ τοῦ ἀδελφοῦ αὐτοῦ δασεῖαι· καὶ ηὐλόγησεν αὐτόν.						
Genesis	27	27	24	OT	1. OT	Pentateuch	1. Pentateuch	01. Pentateuch	01. Genesis	ⲟⲩⲟϩ ⲡⲉϫⲁϥ ϫⲉ ⲛ̀ⲑⲟⲕ ⲡⲉ ⲡⲁϣⲏⲣⲓ ⲏⲥⲁⲩ ⲡⲉϫⲁϥ ϫⲉ ⲁ̀ⲛⲟⲕ ⲡⲉ		and he said, Art thou my son Esau? and he said, I am.	καὶ εἶπεν Σὺ εἶ ὁ υἱός μου Ησαυ; ὁ δὲ εἶπεν ᾿Εγώ.						
Genesis	27	27	25	OT	1. OT	Pentateuch	1. Pentateuch	01. Pentateuch	01. Genesis	ⲟⲩⲟϩ ⲡⲉϫⲁϥ ϫⲉ ⲁⲛⲓⲟⲩⲓ ⲛⲏⲓ ⲛ̀ⲧⲁⲟⲩⲱⲙ ⲉ̀ⲃⲟⲗ ϧⲉⲛ ⲧⲉⲕϫⲟⲣϫⲥ ⲡⲁϣⲏⲣⲓ ϩⲓⲛⲁ ⲛ̀ⲧⲉ ⲧⲁⲯⲩⲭⲏ ⲥⲙⲟⲩ ⲉ̀ⲣⲟⲕ ⲟⲩⲟϩ ⲁϥⲓⲛⲓ ⲛⲁϥ ⲟⲩⲟϩ ⲁϥⲟⲩⲱⲙ ⲟⲩⲟϩ ⲁϥⲉⲛ ⲏⲣⲡ ⲛⲁϥ ⲉ̀ϧⲟⲩⲛ ⲟⲩⲟϩ ⲁϥⲥⲱ		And he said, Bring hither, and I will eat of thy venison, Son, that my soul may bless thee; and he brought it near to him, and he ate, and he brought him wine, and he drank.	καὶ εἶπεν Προσάγαγέ μοι, καὶ φάγομαι ἀπὸ τῆς θήρας σου, τέκνον, ἵνα εὐλογήσῃ σε ἡ ψυχή μου. καὶ προσήγαγεν αὐτῷ, καὶ ἔφαγεν· καὶ εἰσήνεγκεν αὐτῷ οἶνον, καὶ ἔπιεν.						
Genesis	27	27	26	OT	1. OT	Pentateuch	1. Pentateuch	01. Pentateuch	01. Genesis	ⲟⲩⲟϩ ⲡⲉϫⲉ ⲓⲥⲁⲁⲕ ⲡⲉϥⲓⲱⲧ ⲛⲁϥ ϫⲉ ϩⲉⲛⲕ ⲉ̀ⲣⲟⲓ ⲙⲁ ⲟⲩⲫⲓ ⲉ̀ⲣⲱⲓ ⲡⲁϣⲏⲣⲓ		And Isaac his father said to him, Draw nigh to me, and kiss me, son.	καὶ εἶπεν αὐτῷ Ισαακ ὁ πατὴρ αὐτοῦ ῎Εγγισόν μοι καὶ φίλησόν με, τέκνον.						
Genesis	27	27	27	OT	1. OT	Pentateuch	1. Pentateuch	01. Pentateuch	01. Genesis	ⲟⲩⲟϩ ⲁϥϩⲉⲛϥ ⲉ̀ⲣⲟϥ ⲁϥϯⲫⲓ ⲉⲣⲱϥ ⲟⲩⲟϩ ⲁϥϣⲱⲗⲉⲙ ⲉ̀ⲡⲥⲑⲟⲓ ⲛ̀ⲛⲉϥϩⲃⲱⲥ ⲟⲩⲟϩ ⲁϥⲥⲙⲟⲩ ⲉ̀ⲣⲟϥ ⲡⲉϫⲁϥ ϫⲉ ϩⲏⲡⲡⲉ ⲓⲥ ⲡⲥⲑⲟⲓ ⲛ̀ⲛⲉⲛϩⲃⲱⲥ ⲙ̀ⲡⲁϣⲏⲣⲓ ⲙ̀ⲫⲣⲏϯ ⲙ̀ⲡⲥⲑⲟⲓ ⲛ̀ⲧⲕⲟⲓ ⲉⲧϫⲏⲕ ⲉ̀ⲃⲟⲗ ⲑⲏ ⲉⲧⲁ ⲡϭ̅ⲥ̅ ⲥⲙⲟⲩ ⲉ̀ⲣⲟⲥ		And he drew nigh and kissed him, and smelled the smell of his garments, and blessed him, and said, Behold, the smell of my son is as the smell of an abundant field, which the Lord has blessed.	καὶ ἐγγίσας ἐφίλησεν αὐτόν, καὶ ὠσφράνθη τὴν ὀσμὴν τῶν ἱματίων αὐτοῦ καὶ ηὐλόγησεν αὐτὸν καὶ εἶπεν ᾿Ιδοὺ ὀσμὴ τοῦ υἱοῦ μου ὡς ὀσμὴ ἀγροῦ πλήρους, ὃν ηὐλόγησεν κύριος.						
Genesis	27	27	28	OT	1. OT	Pentateuch	1. Pentateuch	01. Pentateuch	01. Genesis	ⲟⲩⲟϩ ⲉⲣⲉ ⲫϯ ϯ ⲛⲁⲕ ⲉ̀ⲃⲟⲗ ϧⲉⲛ ϯⲓⲱϯ ⲛ̀ⲧⲉ ⲧⲫⲉ ⲛⲉⲙ ⲉ̀ⲃⲟⲗ ϧⲉⲛ ⲡⲓⲕⲉⲛⲓ ⲛ̀ⲧⲉ ⲡⲕⲁϩⲓ ⲛⲉⲙ ⲡⲁ̀ϣⲁⲓ ⲛ̀ⲧⲉ ⲟⲩⲥⲟⲩⲟ ⲛⲉⲙ ⲟⲩⲏⲣⲡ		And may God give thee of the dew of heaven, and of the fatness of the earth, and abundance of corn and wine.	καὶ δῴη σοι ὁ θεὸς ἀπὸ τῆς δρόσου τοῦ οὐρανοῦ καὶ ἀπὸ τῆς πιότητος τῆς γῆς καὶ πλῆθος σίτου καὶ οἴνου.						
Genesis	27	27	29	OT	1. OT	Pentateuch	1. Pentateuch	01. Pentateuch	01. Genesis	ⲟⲩⲟϩ ⲙⲁⲣⲟⲩⲉⲣⲃⲱⲕ ⲛⲁⲕ ⲛ̀ϫⲉ ϩⲁⲛⲉⲑⲛⲟⲥ ⲟⲩⲟϩ ⲙⲁⲣⲟⲩⲟⲩⲱϣⲧ ⲙ̀ⲙⲟⲕ ⲛ̀ϫⲉ ϩⲁⲛⲁⲣⲭⲱⲛ ⲟⲩⲟϩ ϣⲱⲡⲓ ⲉⲕⲟⲓ ⲛ̀ϭ̅ⲥ̅ ⲉ̀ⲡⲉⲕⲥⲟⲛ ⲟⲩⲟϩ ⲉⲩⲉ̀ⲟⲩⲱϣⲧ ⲙ̀ⲙⲟⲕ ⲛ̀ϫⲉ ⲛⲓϣⲏⲣⲓ ⲛ̀ⲧⲉ ⲡⲉⲕⲓⲱⲧ ⲫⲏ ⲉⲧⲥⲁϩⲟⲩⲓ ⲉ̀ⲣⲟⲕ ϥⲥϩⲟⲩⲟⲣⲧ ⲫⲏ ⲇⲉ ⲉⲧⲥⲙⲟⲩ ⲉ̀ⲣⲟⲕ ϥⲥⲙⲁⲙⲁⲧ		And let nations serve thee, and princes bow down to thee, and be thou lord of thy brother, and the sons of thy father shall do thee reverence; accursed is he that curses thee, and blessed is he that blesses thee.	καὶ δουλευσάτωσάν σοι ἔθνη, καὶ προσκυνήσουσίν σοι ἄρχοντες· καὶ γίνου κύριος τοῦ ἀδελφοῦ σου, καὶ προσκυνήσουσίν σοι οἱ υἱοὶ τοῦ πατρός σου. ὁ καταρώμενός σε ἐπικατάρατος, ὁ δὲ εὐλογῶν σε εὐλογημένος.						
Genesis	27	27	30	OT	1. OT	Pentateuch	1. Pentateuch	01. Pentateuch	01. Genesis	ⲁⲥϣⲱⲡⲓ ⲇⲉ ⲉⲧⲁϥⲟⲩⲱ ⲛ̀ϫⲉ ⲓⲥⲁⲁⲕ ⲉϥⲥⲙⲟⲩ ⲉ̀ⲓⲁⲕⲱⲃ ⲡⲉϥϣⲏⲣⲓ ⲟⲩⲟϩ ⲁⲥϣⲱⲡⲓ ⲉⲧⲁϥⲓ̀ ⲉ̀ⲃⲟⲗ ⲛ̀ϫⲉ ⲓⲁⲕⲱⲃ ⲉ̀ⲃⲟⲗ ϩⲁ ⲡϩⲟ ⲛ̀ⲓⲥⲁⲁⲕ ⲡⲉϥⲓⲱⲧ ⲟⲩⲟϩ ⲏⲥⲁⲩ ⲡⲉϥⲥⲟⲛ ⲁϥⲓ ⲉ̀ⲃⲟⲗ ϧⲉⲛ ϯϫⲟⲣϫⲥ		And it came to pass after Isaac had ceased blessing his son Jacob, it even came to pass, just when Jacob had gone out from the presence of Isaac his father, that Esau his brother came in from his hunting.	Καὶ ἐγένετο μετὰ τὸ παύσασθαι Ισαακ εὐλογοῦντα Ιακωβ τὸν υἱὸν αὐτοῦ καὶ ἐγένετο ὡς ἐξῆλθεν Ιακωβ ἀπὸ προσώπου Ισαακ τοῦ πατρὸς αὐτοῦ, καὶ Ησαυ ὁ ἀδελφὸς αὐτοῦ ἦλθεν ἀπὸ τῆς θήρας.						
Genesis	27	27	31	OT	1. OT	Pentateuch	1. Pentateuch	01. Pentateuch	01. Genesis	ⲟⲩⲟϩ ⲁϥⲑⲁⲙⲓⲟ ϩⲱϥ ⲛ̀ϩⲁⲛⲭⲟⲩⲱⲙ ⲟⲩⲟϩ ⲁϥⲉⲛⲟⲩ ⲉ̀ϧⲟⲩⲛ ⲙ̀ⲡⲉϥⲓⲱⲧ ⲟⲩⲟϩ ⲡⲉϫⲁϥ ⲙⲡⲉϥⲓⲱⲧ ϫⲉ ⲙⲁⲣⲉ ⲡⲁⲓⲱⲧ ⲧⲱⲛϥ ⲛ̀ⲧⲉϥⲟⲩⲱⲙ ⲉ̀ⲃⲟⲗ ϧⲉⲛ ϯϫⲟⲣϫⲥ ⲛ̀ⲧⲉ ⲡⲉϥϣⲏⲣⲓ ϩⲓⲛⲁ ⲛ̀ⲧⲉ ⲧⲉϥⲯⲩⲭⲏ ⲥⲙⲟⲩ ⲉ̀ⲣⲟⲓ		And he also had made meats and brought them to his father; and he said to his father, Let my father arise and eat of his son’s venison, that thy soul may bless me.	καὶ ἐποίησεν καὶ αὐτὸς ἐδέσματα καὶ προσήνεγκεν τῷ πατρὶ αὐτοῦ καὶ εἶπεν τῷ πατρί ᾿Αναστήτω ὁ πατήρ μου καὶ φαγέτω τῆς θήρας τοῦ υἱοῦ αὐτοῦ, ὅπως εὐλογήσῃ με ἡ ψυχή σου.						
Genesis	27	27	32	OT	1. OT	Pentateuch	1. Pentateuch	01. Pentateuch	01. Genesis	ⲟⲩⲟϩ ⲡⲉϫⲉ ⲓⲥⲁⲁⲕ ⲡⲉϥⲓⲱⲧ ⲛⲁϥ ϫⲉ ⲛ̀ⲑⲟⲕ ⲛⲓⲙ ⲛ̀ⲑⲟⲕ ⲛ̀ⲑⲟϥ ⲇⲉ ⲡⲉϫⲁϥ ϫⲉ ⲁ̀ⲛⲟⲕ ⲡⲉ ⲡⲉⲕϣⲏⲣⲓ ⲡⲉⲕϣⲟⲣⲡ ⲙ̀ⲙⲓⲥⲓ ⲏⲥⲁⲩ		And Isaac his father said to him, Who art thou? And he said, I am thy first-born son Esau.	καὶ εἶπεν αὐτῷ Ισαακ ὁ πατὴρ αὐτοῦ Τίς εἶ σύ; ὁ δὲ εἶπεν ᾿Εγώ εἰμι ὁ υἱός σου ὁ πρωτότοκος Ησαυ.						
Genesis	27	27	33	OT	1. OT	Pentateuch	1. Pentateuch	01. Pentateuch	01. Genesis	ⲁϥⲧⲱⲙⲧ ⲇⲉ ⲛ̀ϫⲉ ⲓⲥⲁⲁⲕ ϧⲉⲛ ⲟⲩⲛⲓϣϯ ⲛ̀ⲧⲱⲙⲧ ⲉ̀ⲙⲁϣⲱ ⲟⲩⲟϩ ⲡⲉϫⲁϥ ϫⲉ ⲛⲓⲙ ⲟⲩⲛ ⲁϥϫⲉⲣϫ ⲟⲩϫⲟⲣϫⲥ ⲛⲏⲓ ⲟⲩⲟϩ ⲁϥⲉⲛⲥ ⲛⲏⲓ ⲉ̀ϧⲟⲩⲛ ⲟⲩⲟϩ ⲁⲓⲟⲩⲱⲙ ⲉ̀ⲃⲟⲗ ⲛ̀ϧⲏⲧⲟⲩ ⲧⲏⲣⲟⲩ ⲙ̀ⲡⲁⲧⲉⲕⲓ̀ ⲟⲩⲟϩ ⲁⲓⲥⲙⲟⲩ ⲉ̀ⲣⲟϥ ⲟⲩⲟϩ ⲉϥⲉ̀ϣⲱⲡⲓ ⲉϥⲥⲙⲁⲙⲁⲧ		And Isaac was amazed with very great amazement, and said, Who then is it that has procured venison for me and brought it to me? and I have eaten of all before thou camest, and I have blessed him; and he shall be blessed.	ἐξέστη δὲ Ισαακ ἔκστασιν μεγάλην σφόδρα καὶ εἶπεν Τίς οὖν ὁ θηρεύσας μοι θήραν καὶ εἰσενέγκας μοι; καὶ ἔφαγον ἀπὸ πάντων πρὸ τοῦ σε ἐλθεῖν καὶ ηὐλόγησα αὐτόν, καὶ εὐλογημένος ἔστω.						
Genesis	27	27	34	OT	1. OT	Pentateuch	1. Pentateuch	01. Pentateuch	01. Genesis	ⲁⲥϣⲱⲡⲓ ⲇⲉ ⲉⲧⲁϥⲥⲱⲧⲉⲙ ⲛ̀ϫⲉ ⲏⲥⲁⲩ ⲉ̀ⲛⲓⲥⲁϫⲓ ⲛ̀ⲧⲉ ⲓⲥⲁⲁⲕ ⲡⲉϥⲓⲱⲧ ⲁϥⲱϣ ⲉ̀ⲃⲟⲗ ϧⲉⲛ ⲟⲩⲛⲓϣϯ ⲛ̀ⲥⲙⲏ ⲟⲩⲟϩ ⲉⲥⲛ̀ϣⲁϣⲓ ⲉ̀ⲙⲁϣⲱ ⲟⲩⲟϩ ⲡⲉϫⲁϥ ⲙ̀ⲡⲉϥⲓⲱⲧ ϫⲉ ⲥⲙⲟⲩ ⲉ̀ⲣⲟⲓ ϩⲱ ⲡⲁⲓⲱⲧ		And it came to pass when Esau heard the words of his father Isaac, he cried out with a great and very bitter cry, and said, Bless, I pray thee, me also, father.	ἐγένετο δὲ ἡνίκα ἤκουσεν Ησαυ τὰ ῥήματα Ισαακ τοῦ πατρὸς αὐτοῦ, ἀνεβόησεν φωνὴν μεγάλην καὶ πικρὰν σφόδρα καὶ εἶπεν Εὐλόγησον δὴ κἀμέ, πάτερ.						
Genesis	27	27	35	OT	1. OT	Pentateuch	1. Pentateuch	01. Pentateuch	01. Genesis	ⲡⲉϫⲁϥ ⲇⲉ ⲛⲁϥ ϫⲉ ⲁϥⲓ̀ ⲛ̀ϫⲉ ⲡⲉⲕⲥⲟⲛ ϧⲉⲛ ⲟⲩⲭⲣⲟϥ ⲁϥⲱⲗⲓ ⲙ̀ⲡⲉⲕⲥⲙⲟⲩ		And he said to him, Thy brother has come with subtlety, and taken thy blessing.	εἶπεν δὲ αὐτῷ ᾿Ελθὼν ὁ ἀδελφός σου μετὰ δόλου ἔλαβεν τὴν εὐλογίαν σου.						
Genesis	27	27	36	OT	1. OT	Pentateuch	1. Pentateuch	01. Pentateuch	01. Genesis	ⲟⲩⲟϩ ⲡⲉϫⲉ ⲏⲥⲁⲩ ϫⲉ ϧⲉⲛ ⲟⲩⲙⲉⲑⲙⲏⲓ ⲁⲩϯⲣⲉⲛϥ ϫⲉ ⲓⲁⲕⲱⲃ ⲁϥϭⲓⲑⲓⲃⲥ ⲅⲁⲣ ⲙ̀ⲙⲟⲓ ⲫⲁⲓ ⲫⲙⲁϩⲥⲟⲡⲃ̅ ⲡⲉ ⲛⲁⲙⲉⲧϣⲟⲣⲡ ⲙ̀ⲙⲓⲥⲓ ⲁϥⲟⲗⲟⲩ ⲟⲩⲟϩ ϯⲛⲟⲩ ⲓⲥ ⲡⲁⲕⲉⲥⲙⲟⲩ ⲁϥϭⲓⲧϥ ⲡⲉϫⲉ ⲏⲥⲁⲩ ⲇⲉ ⲙ̀ⲡⲉϥⲓⲱⲧ ϫⲉ ⲙ̀ⲡⲉⲕⲥⲉϫⲡ ⲟⲩⲥⲙⲟⲩ ⲛⲏⲓ ⲣⲱ ⲁ̀ⲛⲟⲕ ⲡⲁⲓⲱⲧ		And he said, Rightly was his name called Jacob, for lo! this second time has he supplanted me; he has both taken my birthright, and now he has taken my blessing; and Esau said to his father, Hast thou not left a blessing for me, father?	καὶ εἶπεν Δικαίως ἐκλήθη τὸ ὄνομα αὐτοῦ Ιακωβ· ἐπτέρνικεν γάρ με ἤδη δεύτερον τοῦτο· τά τε πρωτοτόκιά μου εἴληφεν καὶ νῦν εἴληφεν τὴν εὐλογίαν μου. καὶ εἶπεν Ησαυ τῷ πατρὶ αὐτοῦ Οὐχ ὑπελίπω μοι εὐλογίαν, πάτερ;						
Genesis	27	27	37	OT	1. OT	Pentateuch	1. Pentateuch	01. Pentateuch	01. Genesis	ⲁϥⲉⲣⲟⲩⲱ ⲇⲉ ⲛ̀ϫⲉ ⲓⲥⲁⲁⲕ ⲡⲉϫⲁϥ ⲛ̀ⲏⲥⲁⲩ ϫⲉ ⲓⲥ ϫⲉ ⲁⲓⲁⲓϥ ⲛ̀ϭ̅ⲥ̅ ⲉ̀ⲣⲟⲕ ⲟⲩⲟϩ ⲛⲉϥⲥⲛⲏⲟⲩ ⲧⲏⲣⲟⲩ ⲁⲓⲁⲓⲧⲟⲩ ⲙ̀ⲃⲱⲕ ⲛⲁϥ ⲁⲓⲧⲁϫⲣⲟϥ ϧⲉⲛ ⲡⲥⲟⲩⲟ ⲛⲉⲙ ⲡⲏⲣⲡ ⲛ̀ⲑⲟⲕ ⲇⲉ ⲟⲩ ⲡⲉ ⲉ̀ϯⲛⲁⲁⲓϥ ⲛⲁⲕ ⲡⲁϣⲏⲣⲓ		And Isaac answered and said to Esau, If I have made him thy lord, and have made all his brethren his servants, and have strengthened him with corn and wine, what then shall I do for thee, Son?	ἀποκριθεὶς δὲ Ισαακ εἶπεν τῷ Ησαυ Εἰ κύριον αὐτὸν ἐποίησά σου καὶ πάντας τοὺς ἀδελφοὺς αὐτοῦ ἐποίησα αὐτοῦ οἰκέτας, σίτῳ καὶ οἴνῳ ἐστήρισα αὐτόν, σοὶ δὲ τί ποιήσω, τέκνον;						
