book	chapter	chapter-zfilled	verse	testament	testament-indexed	section	section-indexed	section-indexed-no-testament	book-indexed	Bohairic	Sahidic	English	Greek	Fayyumic	Akhmimic	OldBohairic	Mesokemic	DialectP	Lycopolitan
Genesis	31	31	26	OT	1. OT	Pentateuch	1. Pentateuch	01. Pentateuch	01. Genesis	ⲡⲉϫⲉ ⲗⲁⲃⲁⲛ ⲇⲉ ⲛ̀ⲓⲁⲕⲱⲃ ϫⲉ ⲟⲩ ⲡⲉ ⲉⲧⲁⲕⲁⲓϥ ⲉⲑⲃⲉⲟⲩ ⲁⲕⲫⲱⲧ ⲛ̀ⲭⲱⲡ ⲉ̀ⲣⲟⲓ ⲟⲩⲟϩ ⲁⲕⲕⲟⲗⲡⲧ ⲁⲕⲉⲗ ⲛⲁϣⲉⲣⲓ ⲙ̀ⲫⲣⲏϯ ⲛϩⲁⲛⲉⲭⲙⲁⲗⲱⲧⲟⲥ ⲛ̀ⲧⲥⲏϥⲓ		And Laban said to Jacob, What hast thou done? wherefore didst thou run away secretly, and pillage me, and lead away my daughters as captives taken with the sword?	εἶπεν δὲ Λαβαν τῷ Ιακωβ Τί ἐποίησας; ἵνα τί κρυφῇ ἀπέδρας καὶ ἐκλοποφόρησάς με καὶ ἀπήγαγες τὰς θυγατέρας μου ὡς αἰχμαλώτιδας μαχαίρᾳ;						
Genesis	31	31	27	OT	1. OT	Pentateuch	1. Pentateuch	01. Pentateuch	01. Genesis	ⲟⲩⲟϩ ⲉⲛⲉ ⲁⲕⲧⲁⲙⲟⲓ ⲡⲉ ⲛⲁⲓⲛⲁⲟⲩⲟⲣⲡⲕ ⲡⲉ ϧⲉⲛ ⲟⲩⲟⲩⲛⲟϥ ⲛⲉⲙ ϩⲁⲛϩⲱⲥ ⲛⲉⲙ ϩⲁⲛⲕⲉⲙⲕⲉⲙ ⲛⲉⲙ ⲟⲩⲟⲩⲱⲓⲛⲓ		Whereas if thou hadst told me, I would have sent thee away with mirth, and with songs, and timbrels, and harp.	καὶ εἰ ἀνήγγειλάς μοι, ἐξαπέστειλα ἄν σε μετ᾽ εὐφροσύνης καὶ μετὰ μουσικῶν, τυμπάνων καὶ κιθάρας.						
Genesis	31	31	28	OT	1. OT	Pentateuch	1. Pentateuch	01. Pentateuch	01. Genesis	ⲟⲩⲟϩ ⲙ̀ⲡⲓⲙ̀ⲡϣⲁ ⲉ̀ϯ ⲛ̀ⲟⲩⲫⲓ ⲉ̀ⲣⲱⲟⲩ ⲛ̀ⲛⲁⲗⲱⲟⲩⲓ ⲛⲉⲙ ⲛⲁϣⲉⲣⲓ ϯⲛⲟⲩ ⲇⲉ ⲁⲕⲉⲣϩⲱⲃ ϧⲉⲛ ⲟⲩⲙⲉⲧⲁⲧϩⲏⲧ		And I was not counted worthy to embrace my children and my daughters; now then thou hast wrought foolishly.	οὐκ ἠξιώθην καταφιλῆσαι τὰ παιδία μου καὶ τὰς θυγατέρας μου. νῦν δὲ ἀφρόνως ἔπραξας.						
Genesis	31	31	29	OT	1. OT	Pentateuch	1. Pentateuch	01. Pentateuch	01. Genesis	ϯⲛⲟⲩ ⲧⲁϫⲓϫ ϫⲉⲙϫⲟⲙ ⲉ̀ⲉⲣ ⲡⲉⲧϩⲱⲟⲩ ⲛⲁⲕ ⲫϯ ⲇⲉ ⲙ̀ⲡⲉⲕⲓⲱⲧ ⲛ̀ⲥⲁϥ ⲁϥϫⲟⲥ ⲛⲏⲓ ⲉϥϫⲱ ⲙ̀ⲙⲟⲥ ϫⲉ ⲁⲣⲉϩ ⲉ̀ⲣⲟⲕ ⲙⲏⲡⲟⲧⲉ ⲛ̀ⲧⲉⲕⲥⲁϫⲓ ⲛⲉⲙ ⲓⲁⲕⲱⲃ ⲛ̀ϩⲁⲛⲡⲉⲧϩⲱⲟⲩ		And now my hand has power to hurt thee; but the God of thy father spoke to me yesterday, saying, Take heed to thyself that thou speak not evil words to Jacob.	καὶ νῦν ἰσχύει ἡ χείρ μου κακοποιῆσαί σε· ὁ δὲ θεὸς τοῦ πατρός σου ἐχθὲς εἶπεν πρός με λέγων Φύλαξαι σεαυτόν, μήποτε λαλήσῃς μετὰ Ιακωβ πονηρά.						
Genesis	31	31	30	OT	1. OT	Pentateuch	1. Pentateuch	01. Pentateuch	01. Genesis	ϯⲛⲟⲩ ⲇⲉ ⲁⲕϣⲉ ⲛⲁⲕ ϧⲉⲛ ⲟⲩⲉ̀ⲡⲓⲑⲩⲙⲓⲁ ⲅⲁⲣ ⲁⲕⲉⲣⲉ̀ⲡⲓⲑⲩⲙⲓⲛ ⲉ̀ϣⲉ ⲉ̀ⲡⲏⲓ ⲙ̀ⲡⲉⲕⲓⲱⲧ ⲉⲑⲃⲉⲟⲩ ⲁⲕⲕⲱⲗⲡ ⲛ̀ⲛⲁⲛⲟⲩϯ		Now then go on thy way, for thou hast earnestly desired to depart to the house of thy father; wherefore hast thou stolen my gods?	νῦν οὖν πεπόρευσαι· ἐπιθυμίᾳ γὰρ ἐπεθύμησας ἀπελθεῖν εἰς τὸν οἶκον τοῦ πατρός σου· ἵνα τί ἔκλεψας τοὺς θεούς μου;						
Genesis	31	31	31	OT	1. OT	Pentateuch	1. Pentateuch	01. Pentateuch	01. Genesis	ⲁϥⲉⲣⲟⲩⲱ ⲇⲉ ⲛ̀ϫⲉ ⲓⲁⲕⲱⲃ ⲡⲉϫⲁϥ ⲛ̀ⲗⲁⲃⲁⲛ ϫⲉ ⲁⲓϫⲟⲥ ϫⲉ ⲙⲏⲡⲟⲧⲉ ⲛ̀ⲧⲉⲕⲉⲗ ⲛⲉⲕϣⲉⲣⲓ ⲛ̀ⲧⲟⲧ ⲛⲉⲙ ⲛⲏ ⲉⲧⲉⲛⲟⲩⲓ ⲧⲏⲣⲟⲩ ⲥⲟⲩⲉⲛ ⲟⲩⲛ̀ⲭⲁⲓ ⲛ̀ⲧⲁⲕ ⲛ̀ⲧⲟⲧ ⲉ̀ⲟⲩϭⲓⲟⲩⲓ ⲡⲉ ⲟⲩⲟϩ ϭⲓⲧϥ ⲟⲩⲟϩ ⲙ̀ⲡⲉϥⲥⲟⲩⲉⲛ ϩⲗⲓ ⲛ̀ⲧⲁϥ ⲛ̀ⲧⲟⲧϥ		And Jacob answered and said to Laban, Because I was afraid; for I said, Lest at any time thou shouldest take away thy daughters from me, and all my possessions.	ἀποκριθεὶς δὲ Ιακωβ εἶπεν τῷ Λαβαν Εἶπα γάρ Μήποτε ἀφέλῃς τὰς θυγατέρας σου ἀπ᾽ ἐμοῦ καὶ πάντα τὰ ἐμά·						
Genesis	31	31	32	OT	1. OT	Pentateuch	1. Pentateuch	01. Pentateuch	01. Genesis	ⲡⲉϫⲉ ⲓⲁⲕⲱⲃ ⲇⲉ ⲛⲁϥ ϫⲉ ⲫⲏ ⲉⲧⲉⲕⲛⲁϫⲉⲙ ⲛⲉⲕⲛⲟⲩϯ ⲛ̀ⲧⲟⲧϥ ⲛ̀ⲛⲉϥⲱⲛϧ ⲙ̀ⲡⲉⲙ̀ⲑⲟ ⲛ̀ⲛⲉϥⲥⲛⲏⲟⲩ ⲛⲁϥⲉⲙⲓ ⲇⲉ ⲁⲛ ⲡⲉ ⲛ̀ϫⲉ ⲓⲁⲕⲱⲃ ϫⲉ ⲣⲁⲭⲏⲗ ⲧⲉϥⲥϩⲓⲙⲓ ⲡⲉⲧⲁⲥⲕⲟⲗⲡⲟⲩ		And Jacob said, With whomsoever thou shalt find thy gods, he shall not live in the presence of our brethren; take notice of what I have of thy property, and take it; and he observed nothing with him, but Jacob knew not that his wife Rachel had stolen them.	ἐπίγνωθι, τί ἐστιν τῶν σῶν παρ᾽ ἐμοί, καὶ λαβέ. καὶ οὐκ ἐπέγνω παρ᾽ αὐτῷ οὐθέν. καὶ εἶπεν αὐτῷ Ιακωβ Παρ᾽ ᾧ ἐὰν εὕρῃς τοὺς θεούς σου, οὐ ζήσεται ἐναντίον τῶν ἀδελφῶν ἡμῶν. οὐκ ᾔδει δὲ Ιακωβ ὅτι Ραχηλ ἡ γυνὴ αὐτοῦ ἔκλεψεν αὐτούς.						
Genesis	31	31	33	OT	1. OT	Pentateuch	1. Pentateuch	01. Pentateuch	01. Genesis	ⲁϥϣⲉ ⲛⲁϥ ⲇⲉ ⲛ̀ϫⲉ ⲗⲁⲃⲁⲛ ⲉ̀ϧⲟⲩⲛ ⲉ̀ⲡⲏⲓ ⲛ̀ⲗⲓⲁ ⲁϥϧⲟⲑϧⲉⲧ ⲟⲩⲟϩ ⲙ̀ⲡⲉϥϫⲉⲙⲟⲩ ⲟⲩⲟϩ ⲁϥⲓ̀ ⲉ̀ⲃⲟⲗ ϧⲉⲛ ⲡⲏⲓ ⲛ̀ⲗⲓⲁ ⲟⲩⲟϩ ⲁϥϧⲟⲧϧⲉⲧ ϧⲉⲛ ⲡⲏⲓ ⲛ̀ⲓⲁⲕⲱⲃ ⲛⲉⲙ ϧⲉⲛ ⲡⲏⲓ ⲛ̀ϯⲃⲱⲕⲓ ⲃ̅ϯ ⲟⲩⲟϩ ⲙ̀ⲡⲉϥϫⲉⲙⲟⲩ ⲟⲩⲟϩ ⲁϥϣⲉ ⲛⲁϥ ⲉ̀ϧⲟⲩⲛ ⲉ̀ⲡⲏⲓ ⲛ̀ⲣⲁⲭⲏⲗ		And Laban went in and searched in the house of Lea, and found them not; and he went out of the house of Lea, and searched in the house of Jacob, and in the house of the two maid-servants, and found them not; and he went also into the house of Rachel.	εἰσελθὼν δὲ Λαβαν ἠρεύνησεν εἰς τὸν οἶκον Λειας καὶ οὐχ εὗρεν· καὶ ἐξελθὼν ἐκ τοῦ οἴκου Λειας ἠρεύνησεν τὸν οἶκον Ιακωβ καὶ ἐν τῷ οἴκῳ τῶν δύο παιδισκῶν καὶ οὐχ εὗρεν. εἰσῆλθεν δὲ καὶ εἰς τὸν οἶκον Ραχηλ.						
Genesis	31	31	34	OT	1. OT	Pentateuch	1. Pentateuch	01. Pentateuch	01. Genesis	ⲣⲁⲭⲏⲗ ⲇⲉ ⲁⲥϭⲓ ⲛ̀ⲛⲓⲓⲇⲱⲗⲟⲛ ⲟⲩⲟϩ ⲁⲥϩⲓⲧⲟⲩ ϧⲁ ϯϣⲉⲛϯ ⲛ̀ⲧⲉ ϯϫⲁⲙⲁⲩⲗⲓ ⲟⲩⲟϩ ⲁⲥϩⲉⲙⲥⲓ ϩⲓϫⲱⲟⲩ		And Rachel took the idols, and cast them among the camels’ packs, and sat upon them.	Ραχηλ δὲ ἔλαβεν τὰ εἴδωλα καὶ ἐνέβαλεν αὐτὰ εἰς τὰ σάγματα τῆς καμήλου καὶ ἐπεκάθισεν αὐτοῖς						
Genesis	31	31	35	OT	1. OT	Pentateuch	1. Pentateuch	01. Pentateuch	01. Genesis	ⲟⲩⲟϩ ⲡⲉϫⲁⲥ ⲙ̀ⲡⲉⲥⲓⲱⲧ ϫⲉ ⲙ̀ⲡⲉⲛⲑⲣⲉ ⲡⲓϩⲱⲃ ⲛ̀ϣⲟⲧ ⲙ̀ⲡⲉⲙ̀ⲑⲟ ⲙ̀ⲡⲁϭ̅ⲥ̅ ⲙ̀ⲙⲟⲛ ϣ̀ϫⲟⲙ ⲙ̀ⲙⲟⲓ ⲉ̀ⲧⲱⲛⲧ ⲙ̀ⲡⲉⲕⲙ̀ⲑⲟ ϫⲉ ϯⲟⲓ ⲙ̀ⲫⲣⲏϯ ⲛ̀ⲛⲓϩⲓⲟⲙⲓ ⲁϥϧⲟⲧϧⲉⲧ ⲇⲉ ⲛ̀ϫⲉ ⲗⲁⲃⲁⲛ ϧⲉⲛ ⲡⲓⲏⲓ ⲧⲏⲣϥ ⲟⲩⲟϩ ⲙ̀ⲡⲉϥϫⲓⲙⲓ ⲛ̀ⲛⲓⲓⲇⲱⲗⲟⲛ		And she said to her father, Be not indignant, Sir: I cannot rise up before thee, for it is with me according to the manner of women. Laban searched in all the house, and found not the images.	καὶ εἶπεν τῷ πατρὶ αὐτῆς Μὴ βαρέως φέρε, κύριε· οὐ δύναμαι ἀναστῆναι ἐνώπιόν σου, ὅτι τὸ κατ᾽ ἐθισμὸν τῶν γυναικῶν μοί ἐστιν. ἠρεύνησεν δὲ Λαβαν ἐν ὅλῳ τῷ οἴκῳ καὶ οὐχ εὗρεν τὰ εἴδωλα.						
Genesis	31	31	36	OT	1. OT	Pentateuch	1. Pentateuch	01. Pentateuch	01. Genesis	ⲁϥϫⲟⲛⲧ ⲇⲉ ⲛ̀ϫⲉ ⲓⲁⲕⲱⲃ ⲟⲩⲟϩ ⲁϥϣⲟⲛⲧ ⲛⲉⲙ ⲗⲁⲃⲁⲛ ⲁϥⲉⲣⲟⲩⲱ ⲇⲉ ⲛ̀ϫⲉ ⲓⲁⲕⲱⲃ ⲡⲉϫⲁϥ ⲛ̀ⲗⲁⲃⲁⲛ ϫⲉ ⲟⲩ ⲡⲉ ⲡⲁϭⲓⲛ̀ϫⲟⲛⲥ ⲛⲉⲙ ⲡⲁⲛⲟⲃⲓ ϫⲉ ⲁⲕϭⲟϫⲓ ⲛ̀ⲥⲁⲙⲉⲛϩⲏⲓ		And Jacob was angry, and strove with Laban; and Jacob answered and said to Laban, What is my injustice, and what my sin, that thou hast pursued after me,	ὠργίσθη δὲ Ιακωβ καὶ ἐμαχέσατο τῷ Λαβαν· ἀποκριθεὶς δὲ Ιακωβ εἶπεν τῷ Λαβαν Τί τὸ ἀδίκημά μου καὶ τί τὸ ἁμάρτημά μου, ὅτι κατεδίωξας ὀπίσω μου						
Genesis	31	31	37	OT	1. OT	Pentateuch	1. Pentateuch	01. Pentateuch	01. Genesis	ⲁⲕϧⲟⲧϧⲉⲧ ⲛ̀ⲛⲓⲥⲕⲉⲩⲟⲥ ⲧⲏⲣⲟⲩ ⲛ̀ⲧⲉ ⲡⲁⲏⲓ ⲟⲩ ⲡⲉⲧⲁⲕϫⲉⲙϥ ⲉ̀ⲃⲟⲗ ϧⲉⲛ ⲛⲓⲥⲕⲉⲩⲟⲥ ⲧⲏⲣⲟⲩ ⲛ̀ⲧⲉ ⲡⲉⲕⲏⲓ ⲥⲉⲙⲛⲏⲧⲟⲩ ⲙ̀ⲡⲁⲓⲙⲁ ⲙ̀ⲡⲉⲙ̀ⲑⲟ ⲛ̀ⲛⲉⲕⲥⲛⲏⲟⲩ ⲛⲉⲙ ⲛⲁⲥⲛⲏⲟⲩ ⲟⲩⲟϩ ⲙⲁⲣⲟⲩⲥⲟϩⲓ ϧⲉⲛ ⲧⲉⲛⲙⲏϯ ⲙ̀ⲡⲃ̅		and that thou hast searched all the furniture of my house? what hast thou found of all the furniture of thine house? set it here between thy relations and my relations, and let them decide between us two.	καὶ ὅτι ἠρεύνησας πάντα τὰ σκεύη μου; τί εὗρες ἀπὸ πάντων τῶν σκευῶν τοῦ οἴκου σου; θὲς ὧδε ἐναντίον τῶν ἀδελφῶν μου καὶ τῶν ἀδελφῶν σου, καὶ ἐλεγξάτωσαν ἀνὰ μέσον τῶν δύο ἡμῶν.						
Genesis	31	31	38	OT	1. OT	Pentateuch	1. Pentateuch	01. Pentateuch	01. Genesis	ⲛⲁⲓ ⲕ̅ ⲛ̀ⲣⲟⲙⲡⲓ ⲛⲉ ⲉⲓⲭⲏ ⲛⲉⲙⲁⲕ ⲛⲉⲕⲉⲥⲱⲟⲩ ⲛⲉⲙ ⲛⲉⲕⲃⲁⲉⲙⲡⲓ ⲙ̀ⲡⲟⲩⲉⲣⲁⲧϣⲏⲣⲓ ⲟⲩⲱⲓⲗⲓ ⲛ̀ⲧⲉ ⲛⲉⲕⲉⲥⲱⲟⲩ ⲙ̀ⲡⲓⲟⲩⲟⲙϥ		These twenty years have I been with thee; thy sheep, and thy she-goats have not failed in bearing; I devoured not the rams of thy cattle.	ταῦτά μοι εἴκοσι ἔτη ἐγώ εἰμι μετὰ σοῦ· τὰ πρόβατά σου καὶ αἱ αἶγές σου οὐκ ἠτεκνώθησαν· κριοὺς τῶν προβάτων σου οὐ κατέφαγον·						
Genesis	31	31	39	OT	1. OT	Pentateuch	1. Pentateuch	01. Pentateuch	01. Genesis	ⲟⲩⲁⲓ ⲉⲁ ⲡⲑⲏⲣⲓⲟⲛ ⲟⲩⲟⲙϥ ⲙ̀ⲡⲓⲉⲛϥ ⲛⲁⲕ ⲁ̀ⲛⲟⲕ ⲉ̀ⲛⲁⲓϯ ⲉ̀ⲃⲟⲗ ϩⲓⲧⲟⲧ ⲛ̀ⲛⲓϭⲓⲟⲩⲓ ⲛ̀ⲧⲉ ⲡⲓⲉϩⲟⲟⲩ ⲛⲉⲙ ⲛⲓϭⲓⲟⲩⲓ ⲛ̀ⲧⲉ ⲡⲓⲉϫⲱⲣϩ		That which was taken of beasts I brought not to thee; I made good of myself the thefts of the day, and the thefts of the night.	θηριάλωτον οὐκ ἀνενήνοχά σοι, ἐγὼ ἀπετίννυον παρ᾽ ἐμαυτοῦ κλέμματα ἡμέρας καὶ κλέμματα νυκτός·						
Genesis	31	31	40	OT	1. OT	Pentateuch	1. Pentateuch	01. Pentateuch	01. Genesis	ⲛⲁⲓⲣⲟⲕϩ ϧⲉⲛ ⲡⲕⲁⲩⲙⲁ ⲛ̀ⲧⲉ ⲡⲓⲉϩⲟⲟⲩ ⲛⲉⲙ ⲡⲓϫⲁϥ ⲛ̀ⲧⲉ ⲡⲓⲉϫⲱⲣϩ ⲡⲓϩⲓⲛⲓⲙ ⲁϥϣⲉ ⲛⲁϥ ⲉ̀ⲃⲟⲗ ϩⲁ ⲛⲁⲃⲁⲗ		I was parched with heat by day, and chilled with frost by night, and my sleep departed from my eyes.	ἐγινόμην τῆς ἡμέρας συγκαιόμενος τῷ καύματι καὶ παγετῷ τῆς νυκτός, καὶ ἀφίστατο ὁ ὕπνος ἀπὸ τῶν ὀφθαλμῶν μου.						
Genesis	31	31	41	OT	1. OT	Pentateuch	1. Pentateuch	01. Pentateuch	01. Genesis	ⲛⲁⲓ ⲕ̅ ⲛ̀ⲣⲟⲙⲡⲓ ⲛⲉ ⲉⲓⲭⲏ ⲛⲉⲙⲁⲕ ⲉⲓⲉⲣⲃⲱⲕ ⲛⲁⲕ ⲙ̀ⲓ̅ⲇ̅ ⲛ̀ⲣⲟⲙⲡⲓ ⲉⲑⲃⲉ ⲛⲉⲕϣⲉⲣⲓ ⲟⲩⲟϩ ⲋ̅ ⲛ̀ⲣⲟⲙⲡⲓ ϧⲉⲛ ⲛⲉⲕⲉⲥⲱⲟⲩ ⲟⲩⲟϩ ⲁⲕϣⲱⲃⲧ ⲙ̀ⲡⲁⲃⲉⲭⲉ ⲛ̀ⲧⲉ ϯⲙⲏϯ ⲛ̀ϩⲓⲉⲃⲓ		These twenty years have I been in thy house; I served thee fourteen years for thy two daughters, and six years among thy sheep, and thou didst falsely rate my wages for ten lambs.	ταῦτά μοι εἴκοσι ἔτη ἐγώ εἰμι ἐν τῇ οἰκίᾳ σου· ἐδούλευσά σοι δέκα τέσσαρα ἔτη ἀντὶ τῶν δύο θυγατέρων σου καὶ ἓξ ἔτη ἐν τοῖς προβάτοις σου, καὶ παρελογίσω τὸν μισθόν μου δέκα ἀμνάσιν.						
Genesis	31	31	42	OT	1. OT	Pentateuch	1. Pentateuch	01. Pentateuch	01. Genesis	ⲉ̀ⲃⲏⲗ ϫⲉ ⲫϯ ⲛ̀ⲁⲃⲣⲁⲁⲙ ⲡⲁⲓⲱⲧ ϥⲭⲏ ⲛⲉⲙⲏⲓ ⲛⲉⲙ ⲧϩⲟϯ ⲛ̀ⲓⲥⲁⲁⲕ ϯⲛⲟⲩ ⲛⲁⲕⲛⲁⲭⲁⲧ ⲉ̀ⲃⲟⲗ ⲉⲓϣⲟⲩⲓⲧ ⲡⲁⲑⲉⲃⲓⲟ ⲛⲉⲙ ⲛⲓⲙⲕⲁϩ ⲛ̀ⲧⲉ ⲛⲁϫⲓϫ ⲁ ⲫϯ ⲛⲁⲩ ⲉ̀ⲣⲟϥ ⲟⲩⲟϩ ⲁϥⲥⲁϩⲱⲕ ⲛ̀ⲥⲁϥ		Unless I had the God of my father Abraam, and the fear of Isaac, now thou wouldest have sent me away empty; God saw my humiliation, and the labour of my hands, and rebuked thee yesterday.	εἰ μὴ ὁ θεὸς τοῦ πατρός μου Αβρααμ καὶ ὁ φόβος Ισαακ ἦν μοι, νῦν ἂν κενόν με ἐξαπέστειλας· τὴν ταπείνωσίν μου καὶ τὸν κόπον τῶν χειρῶν μου εἶδεν ὁ θεὸς καὶ ἤλεγξέν σε ἐχθές.						
Genesis	31	31	43	OT	1. OT	Pentateuch	1. Pentateuch	01. Pentateuch	01. Genesis	ⲁϥⲉⲣⲟⲩⲱ ⲇⲉ ⲛ̀ϫⲉ ⲗⲁⲃⲁⲛ ⲡⲉϫⲁϥ ⲛ̀ⲓⲁⲕⲱⲃ ϫⲉ ⲛⲁⲓϣⲉⲣⲓ ⲛⲁϣⲉⲣⲓ ⲛⲉ ⲟⲩⲟϩ ⲛⲁⲓϣⲏⲣⲓ ⲛⲁϣⲏⲣⲓ ⲛⲉ ⲟⲩⲟϩ ⲛⲁⲓⲧⲉⲃⲛⲱⲟⲩⲓ ⲛⲁⲧⲉⲃⲛⲱⲟⲩⲓ ⲛⲉ ⲟⲩⲟϩ ⲛⲁⲓ ⲧⲏⲣⲟⲩ ⲉⲧⲁⲕⲛⲁⲩ ⲉ̀ⲣⲱⲟⲩ ⲛⲟⲩⲓ ⲛⲉ ⲛⲉⲙ ⲛⲁϣⲉⲣⲓ ⲟⲩ ϫⲉ ⲡⲉϯⲛⲁⲁⲓϥ ⲛ̀ⲛⲁϣⲉⲣⲓ ⲙ̀ⲫⲟⲟⲩ ⲓⲉ ⲛ̀ⲟⲩϣⲏⲣⲓ ⲉⲧⲁⲩⲙⲁⲥⲟⲩ		And Laban answered and said to Jacob, The daughters are my daughters, and the sons my sons, and the cattle are my cattle, and all things which thou seest are mine, and the property of my daughters; what shall I do to them to-day, or their children which they bore?	ἀποκριθεὶς δὲ Λαβαν εἶπεν τῷ Ιακωβ Αἱ θυγατέρες θυγατέρες μου, καὶ οἱ υἱοὶ υἱοί μου, καὶ τὰ κτήνη κτήνη μου, καὶ πάντα, ὅσα σὺ ὁρᾷς, ἐμά ἐστιν καὶ τῶν θυγατέρων μου. τί ποιήσω ταύταις σήμερον ἢ τοῖς τέκνοις αὐτῶν, οἷς ἔτεκον;						
Genesis	31	31	44	OT	1. OT	Pentateuch	1. Pentateuch	01. Pentateuch	01. Genesis	ϯⲛⲟⲩ ⲟⲩⲛ ⲁⲙⲟⲩ ⲛ̀ⲧⲉⲛⲥⲉⲙⲛⲏ ⲛ̀ⲟⲩⲇⲓⲁⲑⲏⲕⲏ ⲁ̀ⲛⲟⲕ ⲛⲉⲙⲁⲕ ⲟⲩⲟϩ ⲉⲥⲉ̀ϣⲱⲡⲓ ⲉⲩⲙⲉⲧⲙⲉⲑⲣⲉ ⲟⲩⲧⲱⲓ ⲛⲉⲙⲁⲕ ϩⲏⲡⲡⲉ ⲙ̀ⲙⲟⲛ ϩⲗⲓ ⲛⲉⲙⲁⲛ ⲓⲥ ⲫϯ ⲡⲉⲧⲉⲣⲙⲉⲑⲣⲉ ⲟⲩⲧⲱⲓ ⲛⲉⲙⲁⲕ		Now then come, let me make a covenant, both I and thou, and it shall be for a witness between me and thee; and he said to him, Behold, there is no one with us; behold, God is witness between me and thee.	νῦν οὖν δεῦρο διαθώμεθα διαθήκην ἐγὼ καὶ σύ, καὶ ἔσται εἰς μαρτύριον ἀνὰ μέσον ἐμοῦ καὶ σοῦ. εἶπεν δὲ αὐτῷ ᾿Ιδοὺ οὐθεὶς μεθ᾽ ἡμῶν ἐστιν, ἰδὲ ὁ θεὸς μάρτυς ἀνὰ μέσον ἐμοῦ καὶ σοῦ.						
Genesis	31	31	45	OT	1. OT	Pentateuch	1. Pentateuch	01. Pentateuch	01. Genesis	ⲁϥϭⲓ ⲇⲉ ⲛ̀ϫⲉ ⲓⲁⲕⲱⲃ ⲛ̀ⲟⲩⲱⲛⲓ ⲁϥⲧⲁϩⲟϥ ⲉ̀ⲣⲁⲧϥ ⲛ̀ⲟⲩⲥⲧⲩⲗⲏ		And Jacob having taken a stone, set it up for a pillar.	λαβὼν δὲ Ιακωβ λίθον ἔστησεν αὐτὸν στήλην.						
Genesis	31	31	46	OT	1. OT	Pentateuch	1. Pentateuch	01. Pentateuch	01. Genesis	ⲡⲉϫⲉ ⲓⲁⲕⲱⲃ ⲇⲉ ⲛ̀ⲛⲉϥⲥⲛⲏⲟⲩ ϫⲉ ⲥⲉⲕ ⲱⲛⲓ ⲟⲩⲟϩ ⲁⲩⲥⲱⲕⲓ ⲛ̀ϩⲁⲛⲱⲛⲓ ⲟⲩⲟϩ ⲁⲩⲑⲁⲙⲓⲟ ⲛ̀ⲟⲩⲑⲁⲗ ⲟⲩⲟϩ ⲁⲩⲟⲩⲱⲙ ⲟⲩⲟϩ ⲁⲩⲥⲱ ϩⲓ ⲡⲓⲑⲁⲗ ⲟⲩⲟϩ ⲡⲉϫⲉ ⲗⲁⲃⲁⲛ ⲛⲁϥ ϫⲉ ⲡⲁⲓⲑⲁⲗ ⲉⲧⲉⲣⲙⲉⲑⲣⲉ ⲟⲩⲧⲱⲓ ⲛⲉⲙⲁⲕ ⲙ̀ⲫⲟⲟⲩ		And Jacob said to his brethren, Gather stones; and they gathered stones and made a heap; and ate there upon the heap, and Laban said to him, This heap witnesses between me and thee to-day.	εἶπεν δὲ Ιακωβ τοῖς ἀδελφοῖς αὐτοῦ Συλλέγετε λίθους. καὶ συνέλεξαν λίθους καὶ ἐποίησαν βουνόν, καὶ ἔφαγον καὶ ἔπιον ἐκεῖ ἐπὶ τοῦ βουνοῦ. καὶ εἶπεν αὐτῷ Λαβαν ῾Ο βουνὸς οὗτος μαρτυρεῖ ἀνὰ μέσον ἐμοῦ καὶ σοῦ σήμερον.						
Genesis	31	31	47	OT	1. OT	Pentateuch	1. Pentateuch	01. Pentateuch	01. Genesis	ⲟⲩⲟϩ ⲁ ⲗⲁⲃⲁⲛ ϯⲣⲉⲛ ⲡⲉϥⲣⲁⲛ ϫⲉ ⲡⲓⲑⲁⲗ ⲛ̀ⲧⲉ ϯⲙⲉⲧⲙⲉⲑⲣⲉ ⲓⲁⲕⲱⲃ ⲇⲉ ⲁϥⲙⲟⲩϯ ⲉ̀ⲣⲟϥ ϫⲉ ⲡⲓⲑⲁⲗ ⲉⲧⲟⲓ ⲙ̀ⲙⲉⲑⲣⲉ		And Laban called it, the Heap of Testimony; and Jacob called it, the Witness Heap.	καὶ ἐκάλεσεν αὐτὸν Λαβαν Βουνὸς τῆς μαρτυρίας, Ιακωβ δὲ ἐκάλεσεν αὐτὸν Βουνὸς μάρτυς.						
Genesis	31	31	48	OT	1. OT	Pentateuch	1. Pentateuch	01. Pentateuch	01. Genesis	ⲡⲉϫⲉ ⲗⲁⲃⲁⲛ ⲇⲉ ⲛ̀ⲓⲁⲕⲱⲃ ϫⲉ ϩⲏⲡⲡⲉ ⲓⲥ ⲡⲁⲓⲑⲁⲗ ⲛⲉⲙ ⲧⲁⲓⲥⲧⲩⲗⲏ ⲉⲧⲁⲓⲧⲁϩⲟⲥ ⲟⲩⲧⲱⲓ ⲛⲉⲙⲁⲕ ϥⲉⲣⲙⲉⲑⲣⲉ ⲛ̀ϫⲉ ⲡⲁⲓⲑⲁⲗ ⲟⲩⲟϩ ⲥⲉⲣⲙⲉⲑⲣⲉ ⲛ̀ϫⲉ ⲧⲁⲓⲥⲧⲩⲗⲏ ⲉⲑⲃⲉⲫⲁⲓ ⲁⲩϯⲣⲉⲛϥ ϫⲉ ⲡⲓⲑⲁⲗ ⲛ̀ⲧⲉ ϯⲙⲉⲧⲙⲉⲑⲣⲉ		And Laban said to Jacob, Behold this heap, and the pillar, which I have set between me and thee; this heap witnesses, and this pillar witnesses; therefore its name was called, the Heap witnesses.	εἶπεν δὲ Λαβαν τῷ Ιακωβ ᾿Ιδοὺ ὁ βουνὸς οὗτος καὶ ἡ στήλη αὕτη, ἣν ἔστησα ἀνὰ μέσον ἐμοῦ καὶ σοῦ, μαρτυρεῖ ὁ βουνὸς οὗτος καὶ μαρτυρεῖ ἡ στήλη αὕτη· διὰ τοῦτο ἐκλήθη τὸ ὄνομα αὐτοῦ Βουνὸς μαρτυρεῖ						
Genesis	31	31	49	OT	1. OT	Pentateuch	1. Pentateuch	01. Pentateuch	01. Genesis	ⲛⲉⲙ ϯϩⲟⲣⲁⲥⲓⲥ ⲉⲧⲁϥϫⲟⲥ ⲉϥⲉ̀ⲛⲁⲩ ⲛ̀ϫⲉ ⲫϯ ⲟⲩⲧⲱⲓ ⲛⲉⲙⲁⲕ ϫⲉ ⲧⲉⲛⲛⲁⲫⲱⲣϫ ⲉ̀ⲃⲟⲗ ⲛ̀ⲛⲉⲛⲉ̀ⲣⲏⲟⲩ		And the vision of which he said—Let God look to it between me and thee, because we are about to depart from each other,—	καὶ ῾Η ὅρασις, ἣν εἶπεν ᾿Επίδοι ὁ θεὸς ἀνὰ μέσον ἐμοῦ καὶ σοῦ, ὅτι ἀποστησόμεθα ἕτερος ἀπὸ τοῦ ἑτέρου.						
Genesis	31	31	50	OT	1. OT	Pentateuch	1. Pentateuch	01. Pentateuch	01. Genesis	ϫⲉ ⲁⲛ ⲛ̀ⲛⲉⲕⲑⲉⲃⲓⲟ ⲛ̀ⲛⲁϣⲉⲣⲓ ϫⲉ ⲁⲛ ⲛ̀ⲛⲉⲕϭⲓⲥϩⲓⲙⲓ ⲉ̀ϫⲉⲛ ⲛⲁϣⲉⲣⲓ ⲁ̀ⲛⲁⲩ ⲙ̀ⲙⲟⲛ ϩⲗⲓ ⲛⲉⲙⲁⲛ		If thou shalt humble my daughters, if thou shouldest take wives in addition to my daughters, see, there is no one with us looking on. God is witness between me and thee.	εἰ ταπεινώσεις τὰς θυγατέρας μου, εἰ λήμψῃ γυναῖκας ἐπὶ ταῖς θυγατράσιν μου, ὅρα οὐθεὶς μεθ᾽ ἡμῶν ἐστιν·						
Genesis	31	31	51	OT	1. OT	Pentateuch	1. Pentateuch	01. Pentateuch	01. Genesis	ⲟⲩⲟϩ ⲡⲉϫⲉ ⲗⲁⲃⲁⲛ ⲛ̀ⲓⲁⲕⲱⲃ ϫⲉ ϩⲏⲡⲡⲉ ⲓⲥ ⲡⲁⲓⲑⲁⲗ ⲛⲉⲙ ⲧⲁⲓⲥⲧⲩⲗⲏ ⲥⲉⲣⲙⲉⲑⲣⲉ		And Laban said to Jacob, Behold, this heap, and this pillar are a witness.							
Genesis	31	31	52	OT	1. OT	Pentateuch	1. Pentateuch	01. Pentateuch	01. Genesis	ⲉ̀ϣⲱⲡ ⲇⲉ ⲁ̀ⲛⲟⲕ ⲛ̀ⲧⲁϣⲧⲉⲙⲥⲓⲛⲓ ϩⲁⲣⲟⲕ ⲟⲩⲇⲉ ⲛ̀ⲑⲟⲕ ⲛ̀ⲧⲉⲕϣ̀ⲧⲉⲙⲥⲓⲛⲓ ϩⲁⲣⲟⲓ ⲡⲁⲓⲑⲁⲗ ⲛⲉⲙ ⲧⲁⲓⲥⲧⲩⲗⲏ ⲉ̀ϫⲉⲛ ⲟⲩⲕⲁⲕⲓⲁ		For if I should not cross over unto thee, neither shouldest thou cross over to me, for mischief beyond this heap and this pillar.	ἐάν τε γὰρ ἐγὼ μὴ διαβῶ πρὸς σὲ μηδὲ σὺ διαβῇς πρός με τὸν βουνὸν τοῦτον καὶ τὴν στήλην ταύτην ἐπὶ κακίᾳ,						
Genesis	31	31	53	OT	1. OT	Pentateuch	1. Pentateuch	01. Pentateuch	01. Genesis	ⲫϯ ⲛ̀ⲁⲃⲣⲁⲁⲙ ⲛⲉⲙ ⲫϯ ⲛ̀ⲛⲁⲭⲱⲣ ⲉϥⲉ̀ϯϩⲁⲡ ⲟⲩⲧⲱⲛ ⲟⲩⲟϩ ⲁ ⲓⲁⲕⲱⲃ ⲱⲣⲕ ⲛ̀ⲧϩⲟϯ ⲛ̀ⲓⲥⲁⲁⲕ ⲡⲉϥⲓⲱⲧ		The God of Abraam and the God of Nachor judge between us; and Jacob swore by the Fear of his father Isaac.	ὁ θεὸς Αβρααμ καὶ ὁ θεὸς Ναχωρ κρινεῖ ἀνὰ μέσον ἡμῶν. καὶ ὤμοσεν Ιακωβ κατὰ τοῦ φόβου τοῦ πατρὸς αὐτοῦ Ισαακ.						
Genesis	31	31	54	OT	1. OT	Pentateuch	1. Pentateuch	01. Pentateuch	01. Genesis	ⲟⲩⲟϩ ⲁ ⲓⲁⲕⲱⲃ ϣⲉⲧ ϣⲟⲩϣⲱⲟⲩϣⲓ ⲉ̀ϩⲣⲏⲓ ⲉ̀ϫⲉⲛ ⲡⲓⲧⲱⲟⲩ ⲟⲩⲟϩ ⲁϥⲙⲟⲩϯ ⲟⲩⲃⲉ ⲛⲉϥⲥⲛⲏⲟⲩ ⲟⲩⲟϩ ⲁⲩⲟⲩⲱⲙ ⲟⲩⲟϩ ⲁⲩⲥⲱ ⲟⲩⲟϩ ⲁⲩⲛ̀ⲕⲟⲧ ⲛ̀ϩⲣⲏⲓ ϩⲓ ⲡⲓⲧⲱⲟⲩ		And he offered a sacrifice in the mountain, and called his brethren, and they ate and drank, and slept in the mountain.	καὶ ἔθυσεν Ιακωβ θυσίαν ἐν τῷ ὄρει καὶ ἐκάλεσεν τοὺς ἀδελφοὺς αὐτοῦ, καὶ ἔφαγον καὶ ἔπιον καὶ ἐκοιμήθησαν ἐν τῷ ὄρει.						
Genesis	31	31	55	OT	1. OT	Pentateuch	1. Pentateuch	01. Pentateuch	01. Genesis	ⲁϥⲧⲱⲛϥ ⲇⲉ ⲛ̀ϫⲉ ⲗⲁⲃⲁⲛ ⲛ̀ⲧⲟⲟⲩⲓ ⲁϥϯⲫⲓ ⲉ̀ϩⲣⲉⲛ ⲛⲉϥϣⲏⲣⲓ ⲛⲉⲙ ⲛⲉϥϣⲉⲣⲓ ⲟⲩⲟϩ ⲁϥⲥⲙⲟⲩ ⲉ̀ⲣⲱⲟⲩ ⲟⲩⲟϩ ⲁϥⲕⲟⲧϥ ⲛ̀ϫⲉ ⲗⲁⲃⲁⲛ ⲁϥϣⲉ ⲛⲁϥ ⲉ̀ⲡⲉϥⲙⲁ		And Laban rose up in the morning, kissed his sons and his daughters, and blessed them; and Laban having turned back, departed to his place.	ἀναστὰς δὲ Λαβαν τὸ πρωὶ κατεφίλησεν τοὺς υἱοὺς αὐτοῦ καὶ τὰς θυγατέρας αὐτοῦ καὶ εὐλόγησεν αὐτούς, καὶ ἀποστραφεὶς Λαβαν ἀπῆλθεν εἰς τὸν τόπον αὐτοῦ.						
Genesis	32	32	1	OT	1. OT	Pentateuch	1. Pentateuch	01. Pentateuch	01. Genesis	ⲟⲩⲟϩ ⲓⲁⲕⲱⲃ ⲁϥϣⲉ ⲛⲁϥ ⲉ̀ⲡⲉϥⲙⲱⲓⲧ ⲟⲩⲟϩ ⲁϥϫⲟⲩϣⲧ ⲉ̀ⲡϣⲱⲓ ⲁϥⲛⲁⲩ ⲉ̀ⲟⲩⲡⲁⲣⲉⲙⲃⲟⲗⲏ ⲛ̀ⲧⲉ ⲫϯ ⲉ̀ⲁⲥⲑⲱⲟⲩϯ ⲟⲩⲟϩ ⲁⲩⲓ̀ ⲉ̀ⲃⲟⲗ ⲉ̀ϩⲣⲁϥ ⲛ̀ϫⲉ ⲛⲓⲁⲅⲅⲉⲗⲟⲥ ⲛ̀ⲧⲉ ⲫϯ		And Jacob departed for his journey; and having looked up, he saw the host of God encamped; and the angels of God met him.	Καὶ Ιακωβ ἀπῆλθεν εἰς τὴν ἑαυτοῦ ὁδόν. καὶ ἀναβλέψας εἶδεν παρεμβολὴν θεοῦ παρεμβεβληκυῖαν, καὶ συνήντησαν αὐτῷ οἱ ἄγγελοι τοῦ θεοῦ.						
