book	chapter	chapter-zfilled	verse	testament	testament-indexed	section	section-indexed	section-indexed-no-testament	book-indexed	Bohairic	Sahidic	English	Greek	Fayyumic	Akhmimic	OldBohairic	Mesokemic	DialectP	Lycopolitan
Genesis	32	32	2	OT	1. OT	Pentateuch	1. Pentateuch	01. Pentateuch	01. Genesis	ⲡⲉϫⲉ ⲓⲁⲕⲱⲃ ⲇⲉ ⲉⲧⲁϥⲛⲁⲩ ⲉ̀ⲣⲱⲟⲩ ϫⲉ ⲟⲩⲡⲁⲣⲉⲙⲃⲟⲗⲏ ⲛ̀ⲧⲉ ⲫϯ ⲧⲉ ⲧⲁⲓ ⲟⲩⲟϩ ⲁϥϯⲣⲉⲛ ⲫⲣⲁⲛ ⲙ̀ⲡⲓⲙⲁ ⲉⲧⲉⲙ̀ⲙⲁⲩ ϫⲉ ⲛⲓⲡⲁⲣⲉⲙⲃⲟⲗⲏ		And Jacob said, when he saw them, This is the Camp of God; and he called the name of that place, Encampments.	εἶπεν δὲ Ιακωβ, ἡνίκα εἶδεν αὐτούς Παρεμβολὴ θεοῦ αὕτη· καὶ ἐκάλεσεν τὸ ὄνομα τοῦ τόπου ἐκείνου Παρεμβολαί.						
Genesis	32	32	3	OT	1. OT	Pentateuch	1. Pentateuch	01. Pentateuch	01. Genesis	ⲁϥⲟⲩⲱⲣⲡ ⲇⲉ ⲛ̀ϫⲉ ⲓⲁⲕⲱⲃ ⲛ̀ϩⲁⲛⲣⲉⲙⲛϩⲱⲃ ϧⲁϫⲱϥ ϩⲁ ⲏⲥⲁⲩ ⲡⲉϥⲥⲟⲛ ⲉ̀ⲡⲕⲁϩⲓ ⲛ̀ⲥⲏⲓⲣ ⲉ̀ⲧⲭⲱⲣⲁ ⲛ̀ⲉⲇⲱⲙ		And Jacob sent messengers before him to Esau his brother to the land of Seir, to the country of Edom.	᾿Απέστειλεν δὲ Ιακωβ ἀγγέλους ἔμπροσθεν αὐτοῦ πρὸς Ησαυ τὸν ἀδελφὸν αὐτοῦ εἰς γῆν Σηιρ εἰς χώραν Εδωμ						
Genesis	32	32	4	OT	1. OT	Pentateuch	1. Pentateuch	01. Pentateuch	01. Genesis	ⲟⲩⲟϩ ⲁϥϩⲟⲛϩⲉⲛ ⲛⲱⲟⲩ ⲉϥϫⲱ ⲙ̀ⲙⲟⲥ ϫⲉ ⲡⲁⲓⲣⲏϯ ⲁϫⲟⲥ ⲙ̀ⲡⲁϭ̅ⲥ̅ ⲏⲥⲁⲩ ϫⲉ ⲫⲁⲓ ⲡⲉ ⲙ̀ⲫⲣⲏϯ ⲉⲧⲉϥϫⲱ ⲙ̀ⲙⲟⲥ ⲛ̀ϫⲉ ⲡⲉⲕⲁⲗⲟⲩ ⲓⲁⲕⲱⲃ ϫⲉ ⲁⲓϣⲱⲡⲓ ⲛⲉⲙ ⲗⲁⲃⲁⲛ ⲟⲩⲟϩ ⲁⲓⲱⲥⲕ ϣⲁ ϯⲛⲟⲩ		And he charged them, saying, Thus shall ye say to my lord Esau: Thus saith thy servant Jacob; I have sojourned with Laban and tarried until now.	καὶ ἐνετείλατο αὐτοῖς λέγων Οὕτως ἐρεῖτε τῷ κυρίῳ μου Ησαυ Οὕτως λέγει ὁ παῖς σου Ιακωβ Μετὰ Λαβαν παρῴκησα καὶ ἐχρόνισα ἕως τοῦ νῦν,						
Genesis	32	32	5	OT	1. OT	Pentateuch	1. Pentateuch	01. Pentateuch	01. Genesis	ⲟⲩⲟϩ ⲁⲩϣⲱⲡⲓ ⲛⲏⲓ ⲛ̀ϫⲉ ϩⲁⲛⲉϩⲱⲟⲩ ⲛⲉⲙ ϩⲁⲛⲉⲉⲩ ⲛⲉⲙ ϩⲁⲛⲉⲥⲱⲟⲩ ⲛⲉⲙ ϩⲁⲛⲃⲱⲕ ⲛⲉⲙ ϩⲁⲛⲃⲱⲕⲓ ⲟⲩⲟϩ ⲁⲓⲟⲩⲱⲣⲡ ⲉ̀ⲧⲁⲙⲉ ⲡⲁϭ̅ⲥ̅ ⲏⲥⲁⲩ ϩⲓⲛⲁ ⲛ̀ⲧⲉ ⲡⲉⲕⲁⲗⲟⲩ ϫⲓⲙⲓ ⲛ̀ⲟⲩϩⲙⲟⲧ ⲙ̀ⲡⲉⲕⲙ̀ⲑⲟ		And there were born to me oxen, and asses, and sheep, and men-servants and women-servants; and I sent to tell my lord Esau, that thy servant might find grace in thy sight.	καὶ ἐγένοντό μοι βόες καὶ ὄνοι καὶ πρόβατα καὶ παῖδες καὶ παιδίσκαι, καὶ ἀπέστειλα ἀναγγεῖλαι τῷ κυρίῳ μου Ησαυ, ἵνα εὕρῃ ὁ παῖς σου χάριν ἐναντίον σου.						
Genesis	32	32	6	OT	1. OT	Pentateuch	1. Pentateuch	01. Pentateuch	01. Genesis	ⲟⲩⲟϩ ⲁⲩⲧⲁⲥⲑⲟ ⲛ̀ϫⲉ ⲛⲓⲣⲉⲙⲛ̀ϩⲱⲃ ϩⲁ ⲓⲁⲕⲱⲃ ⲉⲩϫⲱ ⲙ̀ⲙⲟⲥ ϫⲉ ⲁⲛⲓ̀ ϩⲁ ⲏⲥⲁⲩ ⲡⲉⲕⲥⲟⲛ ⲟⲩⲟϩ ϩⲏⲡⲡⲉ ⲛ̀ⲑⲟϥ ϥⲛⲏⲟⲩ ⲉ̀ⲃⲟⲗ ⲉ̀ϩⲣⲁⲕ ⲛⲉⲙ ⲩ̅ ⲛ̀ⲣⲱⲙⲓ ⲛⲉⲙⲁϥ		And the messengers returned to Jacob, saying, We came to thy brother Esau, and lo! he comes to meet thee, and four hundred men with him.	καὶ ἀνέστρεψαν οἱ ἄγγελοι πρὸς Ιακωβ λέγοντες ῎Ηλθομεν πρὸς τὸν ἀδελφόν σου Ησαυ, καὶ ἰδοὺ αὐτὸς ἔρχεται εἰς συνάντησίν σοι καὶ τετρακόσιοι ἄνδρες μετ᾽ αὐτοῦ.						
Genesis	32	32	7	OT	1. OT	Pentateuch	1. Pentateuch	01. Pentateuch	01. Genesis	ⲁϥⲉⲣϩⲟϯ ⲇⲉ ⲛ̀ϫⲉ ⲓⲁⲕⲱⲃ ⲉ̀ⲙⲁϣⲱ ⲟⲩⲟϩ ⲛⲁϥϣⲟⲗϩ ⲛ̀ϩⲏⲧ ⲡⲉ ⲟⲩⲟϩ ⲁϥⲫⲱⲣϫ ⲙ̀ⲡⲓⲙⲏϣ ⲉⲑⲛⲉⲙⲁϥ ⲛⲉⲙ ⲛⲓⲉⲥⲱⲟⲩ ⲛⲉⲙ ⲛⲓⲉϩⲱⲟⲩ ⲉ̀ⲡⲁⲣⲉⲙⲃⲟⲗⲏ ⲃ̅ϯ		And Jacob was greatly terrified, and was perplexed; and he divided the people that was with him, and the cows, and the camels, and the sheep, into two camps.	ἐφοβήθη δὲ Ιακωβ σφόδρα καὶ ἠπορεῖτο. καὶ διεῖλεν τὸν λαὸν τὸν μετ᾽ αὐτοῦ καὶ τοὺς βόας καὶ τὰ πρόβατα εἰς δύο παρεμβολάς,						
Genesis	32	32	8	OT	1. OT	Pentateuch	1. Pentateuch	01. Pentateuch	01. Genesis	ⲟⲩⲟϩ ⲡⲉϫⲉ ⲓⲁⲕⲱⲃ ϫⲉ ⲉ̀ϣⲱⲡ ⲁϥϣⲁⲛⲓ̀ ⲛ̀ϫⲉ ⲏⲥⲁⲩ ⲉ̀ⲟⲩⲓ ⲛ̀ⲛⲓⲡⲁⲣⲉⲙⲃⲟⲗⲏ ⲟⲩⲟϩ ⲛ̀ⲧⲉϥϭⲉⲧϭⲱⲧⲥ ⲉⲥⲉ̀ϣⲱⲡⲓ ⲛ̀ϫⲉ ϯⲡⲁⲣⲉⲙⲃⲟⲗⲏ ⲙ̀ⲙⲁϩⲃ̅ϯ ⲉ̀ⲫⲛⲟϩⲉⲙ		And Jacob said, If Esau should come to one camp, and smite it, the other camp shall be in safety.	καὶ εἶπεν Ιακωβ ᾿Εὰν ἔλθῃ Ησαυ εἰς παρεμβολὴν μίαν καὶ ἐκκόψῃ αὐτήν, ἔσται ἡ παρεμβολὴ ἡ δευτέρα εἰς τὸ σῴζεσθαι.						
Genesis	32	32	9	OT	1. OT	Pentateuch	1. Pentateuch	01. Pentateuch	01. Genesis	ⲡⲉϫⲉ ⲓⲁⲕⲱⲃ ⲇⲉ ϫⲉ ⲫϯ ⲙ̀ⲡⲁⲓⲱⲧ ⲁⲃⲣⲁⲁⲙ ⲛⲉⲙ ⲫϯ ⲙ̀ⲡⲁⲓⲱⲧ ⲓⲥⲁⲁⲕ ⲡϭ̅ⲥ̅ ⲫⲏ ⲉⲧⲁϥϫⲟⲥ ⲛⲏⲓ ϫⲉ ⲙⲁⲧⲁⲥⲑⲟ ⲉ̀ⲡⲕⲁϩⲓ ⲛ̀ⲧⲉ ⲡⲉⲕϫⲓⲛⲙⲓⲥⲓ ⲟⲩⲟϩ ⲉⲓⲉ̀ⲉⲣⲡⲉⲑⲛⲁⲛⲉϥ ⲛⲁⲕ		And Jacob said, God of my father Abraam, and God of my father Isaac, O Lord, thou art he that said to me, Depart quickly to the land of thy birth, and I will do thee good.	εἶπεν δὲ Ιακωβ ῾Ο θεὸς τοῦ πατρός μου Αβρααμ καὶ ὁ θεὸς τοῦ πατρός μου Ισαακ, κύριε ὁ εἴπας μοι ᾿Απότρεχε εἰς τὴν γῆν τῆς γενέσεώς σου καὶ εὖ σε ποιήσω,						
Genesis	32	32	10	OT	1. OT	Pentateuch	1. Pentateuch	01. Pentateuch	01. Genesis	ⲣⲱϣⲓ ⲉ̀ϫⲱⲓ ⲉ̀ⲃⲟⲗ ϧⲉⲛ ⲇⲓⲕⲉⲟⲥⲩⲛⲏ ⲛⲓⲃⲉⲛ ⲛⲉⲙ ⲉ̀ⲃⲟⲗ ϧⲉⲛ ⲙⲉⲑⲙⲏⲓ ⲛⲓⲃⲉⲛ ⲑⲏ ⲉⲧⲁⲕⲁⲓⲥ ⲛⲉⲙ ⲡⲉⲕⲁⲗⲟⲩ ⲛ̀ϩⲣⲏⲓ ⲅⲁⲣ ϧⲉⲛ ⲡⲁϣⲃⲱⲧ ⲁⲓⲉⲣϫⲓⲛⲓⲟⲣ ⲙ̀ⲡⲓⲓⲟⲣⲇⲁⲛⲏⲥ ϯⲛⲟⲩ ⲇⲉ ⲁⲓϣⲱⲡⲓ ⲙ̀ⲡⲁⲣⲉⲙⲃⲟⲗⲏ ⲃ̅ϯ		Let there be to me a sufficiency of all the justice and all the truth which thou hast wrought with thy servant; for with this my staff I passed over this Jordan, and now I am become two camps.	ἱκανοῦταί μοι ἀπὸ πάσης δικαιοσύνης καὶ ἀπὸ πάσης ἀληθείας, ἧς ἐποίησας τῷ παιδί σου· ἐν γὰρ τῇ ῥάβδῳ μου διέβην τὸν Ιορδάνην τοῦτον, νῦν δὲ γέγονα εἰς δύο παρεμβολάς.						
Genesis	32	32	11	OT	1. OT	Pentateuch	1. Pentateuch	01. Pentateuch	01. Genesis	ⲛⲁϩⲙⲉⲧ ⲉ̀ⲃⲟⲗ ϧⲉⲛ ⲧϫⲓϫ ⲙ̀ⲡⲁⲥⲟⲛ ⲉ̀ⲃⲟⲗ ϧⲉⲛ ⲧϫⲓϫ ⲛ̀ⲏⲥⲁⲩ ϫⲉ ϯⲉⲣϩⲟϯ ⲁ̀ⲛⲟⲕ ϩⲁⲧⲉϥϩⲏ ⲙⲏⲡⲟⲧⲉ ⲛ̀ⲧⲉϥⲓ̀ ⲛ̀ⲧⲉϥϣⲁⲣⲓ ⲉ̀ⲣⲟⲓ ⲛⲉⲙ ϩⲁⲛⲙⲁⲩ ⲉ̀ϫⲉⲛ ϩⲁⲛϣⲏⲣⲓ		Deliver me from the hand of my brother, from the hand of Esau, for I am afraid of him, lest haply he should come and smite me, and the mother upon the children.	ἐξελοῦ με ἐκ χειρὸς τοῦ ἀδελφοῦ μου Ησαυ, ὅτι φοβοῦμαι ἐγὼ αὐτόν, μήποτε ἐλθὼν πατάξῃ με καὶ μητέρα ἐπὶ τέκνοις.						
Genesis	32	32	12	OT	1. OT	Pentateuch	1. Pentateuch	01. Pentateuch	01. Genesis	ⲛ̀ⲑⲟⲕ ⲇⲉ ⲁⲕϫⲟⲥ ⲛⲏⲓ ϫⲉ ⲉⲓⲉ̀ⲉⲣⲡⲉⲑⲛⲁⲛⲉϥ ⲛⲁⲕ ⲟⲩⲟϩ ⲉⲓⲉ̀ⲭⲁ ⲡⲉⲕϫⲣⲟϫ ⲙ̀ⲫⲣⲏϯ ⲙ̀ⲡⲓϣⲱ ⲛ̀ⲧⲉ ⲫⲓⲟⲙ ⲫⲏ ⲉⲧⲉⲛⲛⲟⲩϣⲟⲡϥ ⲉ̀ⲃⲟⲗ ϧⲉⲛ ⲡⲉϥⲁϣⲁⲓ		But thou saidst, I will do thee good, and will make thy seed as the sand of the sea, which shall not be numbered for multitude.	σὺ δὲ εἶπας Καλῶς εὖ σε ποιήσω καὶ θήσω τὸ σπέρμα σου ὡς τὴν ἄμμον τῆς θαλάσσης, ἣ οὐκ ἀριθμηθήσεται ἀπὸ τοῦ πλήθους.						
Genesis	32	32	13	OT	1. OT	Pentateuch	1. Pentateuch	01. Pentateuch	01. Genesis	ⲟⲩⲟϩ ⲁϥⲛ̀ⲕⲟⲧ ⲙ̀ⲙⲁⲩ ϧⲉⲛ ⲡⲓⲉ̀ϫⲱⲣϩ ⲉⲧⲉⲙ̀ⲙⲁⲩ ⲟⲩⲟϩ ⲁϥϭⲓ ⲉ̀ⲃⲟⲗ ϧⲉⲛ ⲛⲓⲧⲁⲓⲟ ⲉ̀ⲛⲁϥⲓⲛⲓ ⲙ̀ⲙⲱⲟⲩ ⲟⲩⲟϩ ⲁϥⲟⲩⲟⲣⲡⲟⲩ ϩⲁ ⲏⲥⲁⲩ ⲡⲉϥⲥⲟⲛ		And he slept there that night, and took of the gifts which he carried with him, and sent out to Esau his brother,	καὶ ἐκοιμήθη ἐκεῖ τὴν νύκτα ἐκείνην. καὶ ἔλαβεν ὧν ἔφερεν δῶρα καὶ ἐξαπέστειλεν Ησαυ τῷ ἀδελφῷ αὐτοῦ,						
Genesis	32	32	14	OT	1. OT	Pentateuch	1. Pentateuch	01. Pentateuch	01. Genesis	ⲥ̅ ⲙ̀ⲃⲁⲉⲙⲡⲓ ⲕ̅ ⲙ̀ⲃⲁⲣⲏⲓⲧ ⲥ̅ ⲛ̀ⲉⲥⲱⲟⲩ ⲕ̅ ⲛ̀ⲱⲓⲗⲓ		two hundred she-goats, twenty he-goats, two hundred sheep, twenty rams,	αἶγας διακοσίας, τράγους εἴκοσι, πρόβατα διακόσια, κριοὺς εἴκοσι,						
Genesis	32	32	15	OT	1. OT	Pentateuch	1. Pentateuch	01. Pentateuch	01. Genesis	ⲗ ⲛ̀ϫⲁⲙⲁⲩⲗⲓ ⲛⲉⲙ ⲛⲟⲩϧⲣⲟϯ ⲉⲩϭⲓⲙⲛⲟⲧ ⲗ̅ ⲛ̀ⲉϩⲉ ⲓ̅ ⲙ̀ⲙⲁⲥⲓ ⲕ̅ ⲛ̀ⲓⲱ ⲓ̅ ⲛ̀ⲥⲏϫ		milch camels, and their foals, thirty, forty kine, ten bulls, twenty asses, and ten colts.	καμήλους θηλαζούσας καὶ τὰ παιδία αὐτῶν τριάκοντα, βόας τεσσαράκοντα, ταύρους δέκα, ὄνους εἴκοσι καὶ πώλους δέκα.						
Genesis	32	32	16	OT	1. OT	Pentateuch	1. Pentateuch	01. Pentateuch	01. Genesis	ⲟⲩⲟϩ ⲁϥⲧⲏⲓⲧⲟⲩ ⲛ̀ⲛⲉϥⲁⲗⲱⲟⲩⲓ ⲡⲓⲟϩⲓ ⲡⲓⲟϩⲓ ⲥⲁ ⲟⲩ ⲥⲁ ⲙ̀ⲙⲁⲩⲁⲧϥ ⲁϥϫⲟⲥ ⲇⲉ ⲛ̀ⲛⲉϥⲁⲗⲱⲟⲩⲓ ϫⲉ ⲙⲟϣⲓ ϧⲁϫⲱⲓ ⲟⲩⲟϩ ⲭⲁ ⲟⲩⲟⲩⲱϣ ⲟⲩⲧⲱϥ ⲛ̀ⲟϩⲓ ⲛⲉⲙ ⲟϩⲓ		And he gave them to his servants each drove apart; and he said to his servants, Go on before me, and put a space between drove and drove.	καὶ ἔδωκεν διὰ χειρὸς τοῖς παισὶν αὐτοῦ ποίμνιον κατὰ μόνας. εἶπεν δὲ τοῖς παισὶν αὐτοῦ Προπορεύεσθε ἔμπροσθέν μου καὶ διάστημα ποιεῖτε ἀνὰ μέσον ποίμνης καὶ ποίμνης.						
Genesis	32	32	17	OT	1. OT	Pentateuch	1. Pentateuch	01. Pentateuch	01. Genesis	ⲟⲩⲟϩ ⲁϥϩⲟⲛϩⲉⲛ ⲛ̀ⲧⲉⲛ ⲡⲓϩⲟⲩⲓⲧ ⲉϥϫⲱ ⲙ̀ⲙⲟⲥ ϫⲉ ⲉ̀ϣⲱⲡ ⲁϥϣⲁⲛⲓ̀ ⲉ̀ⲃⲟⲗ ⲉϩⲣⲁⲕ ⲛ̀ϫⲉ ⲡⲁⲥⲟⲛ ⲏⲥⲁⲩ ⲟⲩⲟϩ ⲛ̀ⲧⲉϥϣⲉⲛⲕ ⲉϥϫⲱ ⲙ̀ⲙⲟⲥ ϫⲉ ⲛ̀ⲑⲟⲕ ⲫⲁ ⲛⲓⲙ ⲟⲩⲟϩ ⲁⲕⲛⲁ ⲉ̀ⲑⲱⲛ ⲟⲩⲟϩ ⲛⲁ ⲛⲓⲙ ⲛⲉ ⲛⲁⲓ ⲉⲑⲙⲟϣⲓ ϧⲁϫⲱⲕ		And he charged the first, saying, If Esau my brother meet thee, and he ask thee, saying, Whose art thou? and whither wouldest thou go, and whose are these possessions advancing before thee?	καὶ ἐνετείλατο τῷ πρώτῳ λέγων ᾿Εάν σοι συναντήσῃ Ησαυ ὁ ἀδελφός μου καὶ ἐρωτᾷ σε λέγων Τίνος εἶ καὶ ποῦ πορεύῃ, καὶ τίνος ταῦτα τὰ προπορευόμενά σου;						
Genesis	32	32	18	OT	1. OT	Pentateuch	1. Pentateuch	01. Pentateuch	01. Genesis	ⲟⲩⲟϩ ⲉⲕⲉ̀ϫⲟⲥ ϫⲉ ⲛⲁ ⲡⲉⲕⲁⲗⲟⲩ ⲓⲁⲕⲱⲃ ⲛⲉ ϩⲁⲛⲧⲁⲓⲟ ⲁϥⲟⲩⲟⲣⲡⲟⲩ ⲙ̀ⲡⲉϥϭ̅ⲥ̅ ⲏⲥⲁⲩ ⲟⲩⲟϩ ϩⲏⲡⲡⲉ ⲛ̀ⲑⲟϥ ϥⲛⲏⲟⲩ ⲥⲁⲙⲉⲛϩⲏⲛ		Thou shalt say, Thy servant Jacob’s; he hath sent gifts to my lord Esau, and lo! he is behind us.	ἐρεῖς Τοῦ παιδός σου Ιακωβ· δῶρα ἀπέσταλκεν τῷ κυρίῳ μου Ησαυ, καὶ ἰδοὺ αὐτὸς ὀπίσω ἡμῶν.						
Genesis	32	32	19	OT	1. OT	Pentateuch	1. Pentateuch	01. Pentateuch	01. Genesis	ⲟⲩⲟϩ ⲁϥϩⲟⲛϩⲉⲛ ⲛ̀ⲧⲉⲛ ⲡⲓϩⲟⲩⲓⲧ ⲛⲉⲙ ⲡⲓⲙⲁϩⲃ̅ ⲛⲉⲙ ⲡⲓⲙⲁϩⲅ̅ ⲛⲉⲙ ⲛⲏ ⲧⲏⲣⲟⲩ ⲉⲑⲙⲟϣⲓ ϧⲁϫⲱϥ ϩⲓⲫⲁϩⲟⲩ ⲛ̀ⲛⲓⲟϩⲓ ⲉϥϫⲱ ⲙ̀ⲙⲟⲥ ϫⲉ ⲕⲁⲧⲁ ⲡⲁⲓⲥⲁϫⲓ ⲉⲣⲉⲧⲉⲛⲉ̀ⲥⲁϫⲓ ⲛⲉⲙ ⲏⲥⲁⲩ ϧⲉⲛ ⲡϫⲓⲛⲑⲣⲉⲧⲉⲛϫⲉⲙϥ		And he charged the first and the second and the third, and all that went before him after these flocks, saying, Thus shall ye speak to Esau when ye find him;	καὶ ἐνετείλατο τῷ πρώτῳ καὶ τῷ δευτέρῳ καὶ τῷ τρίτῳ καὶ πᾶσι τοῖς προπορευομένοις ὀπίσω τῶν ποιμνίων τούτων λέγων Κατὰ τὸ ῥῆμα τοῦτο λαλήσατε Ησαυ ἐν τῷ εὑρεῖν ὑμᾶς αὐτὸν						
Genesis	32	32	20	OT	1. OT	Pentateuch	1. Pentateuch	01. Pentateuch	01. Genesis	ⲟⲩⲟϩ ⲉⲣⲉⲧⲉⲛⲉ̀ϫⲟⲥ ϫⲉ ⲓⲥ ⲡⲉⲕⲁⲗⲟⲩ ⲓⲁⲕⲱⲃ ϥⲛⲏⲟⲩ ⲥⲁⲙⲉⲛϩⲏⲛ ⲁϥϫⲟⲥ ⲅⲁⲣ ϫⲉ ⲉⲓⲉ̀ⲟⲩⲱϣⲧ ⲙ̀ⲡⲉϥϩⲟ ϧⲉⲛ ⲛⲁⲓⲧⲁⲓⲟ ⲉⲧⲉⲣϣⲟⲣⲡ ⲙ̀ⲙⲟϣⲓ ϧⲁϫⲱⲓ ⲟⲩⲟϩ ⲙⲉⲛⲉⲛⲥⲁ ⲛⲁⲓ ⲉⲓⲉ̀ⲛⲁⲩ ⲉ̀ⲡⲉϥϩⲟ ⲡⲁⲓⲣⲏϯ ⲅⲁⲣ ⲉϥⲉ̀ϣⲉⲡ ⲡⲁϩⲟ ⲉ̀ⲣⲟϥ		and ye shall say, Behold thy servant Jacob comes after us. For he said, I will propitiate his countenance with the gifts going before his presence, and afterwards I will behold his face, for peradventure he will accept me.	καὶ ἐρεῖτε ᾿Ιδοὺ ὁ παῖς σου Ιακωβ παραγίνεται ὀπίσω ἡμῶν. εἶπεν γάρ ᾿Εξιλάσομαι τὸ πρόσωπον αὐτοῦ ἐν τοῖς δώροις τοῖς προπορευομένοις αὐτοῦ, καὶ μετὰ τοῦτο ὄψομαι τὸ πρόσωπον αὐτοῦ· ἴσως γὰρ προσδέξεται τὸ πρόσωπόν μου.						
Genesis	32	32	21	OT	1. OT	Pentateuch	1. Pentateuch	01. Pentateuch	01. Genesis	ⲟⲩⲟϩ ⲛⲁⲩⲉⲣϣⲟⲣⲡ ⲙ̀ⲙⲟϣⲓ ⲡⲉ ⲛ̀ϫⲉ ⲛⲓⲧⲁⲓⲟ ⲙ̀ⲡⲉϥⲙⲑⲟ ⲛ̀ⲑⲟϥ ⲇⲉ ⲁϥⲉⲛⲕⲟⲧ ϧⲉⲛ ⲡⲓⲉϫⲱⲣϩ ⲉⲧⲉⲙ̀ⲙⲁⲩ ϧⲉⲛ ϯⲡⲁⲣⲉⲙⲃⲟⲗⲏ		So the presents went on before him, but he himself lodged that night in the camp.	καὶ παρεπορεύοντο τὰ δῶρα κατὰ πρόσωπον αὐτοῦ, αὐτὸς δὲ ἐκοιμήθη τὴν νύκτα ἐκείνην ἐν τῇ παρεμβολῇ.						
Genesis	32	32	22	OT	1. OT	Pentateuch	1. Pentateuch	01. Pentateuch	01. Genesis	ⲁϥⲧⲱⲛϥ ⲇⲉ ϧⲉⲛ ⲡⲓⲉϫⲱⲣϩ ⲉⲧⲉⲙ̀ⲙⲁⲩ ⲁϥϭⲓ ⲛ̀ϯⲥϩⲓⲙⲓ ⲃ̅ϯ ⲛⲉⲙ ϯⲃⲱⲕⲓ ⲃ̅ϯ ⲛⲉⲙ ⲡⲉϥⲓⲁ ⲛ̀ϣⲏⲣⲓ ⲟⲩⲟϩ ⲁϥⲥⲓⲛⲓ ⲙ̀ⲡⲓϫⲓⲛⲥⲓⲛⲓ ⲛ̀ⲧⲉ ⲓⲁⲃⲟⲕ		And he rose up in that night, and took his two wives and his two servant-maids, and his eleven children, and crossed over the ford of Jaboch.	᾿Αναστὰς δὲ τὴν νύκτα ἐκείνην ἔλαβεν τὰς δύο γυναῖκας καὶ τὰς δύο παιδίσκας καὶ τὰ ἕνδεκα παιδία αὐτοῦ καὶ διέβη τὴν διάβασιν τοῦ Ιαβοκ·						
Genesis	32	32	23	OT	1. OT	Pentateuch	1. Pentateuch	01. Pentateuch	01. Genesis	ⲟⲩⲟϩ ⲁϥϭⲓⲧⲟⲩ ⲟⲩⲟϩ ⲁϥⲉⲣϫⲓⲛⲓⲟⲣ ⲙ̀ⲡⲓⲙⲟⲩⲛⲥⲱⲣⲉⲙ ⲁϥϫⲓⲛⲓⲟⲣ ⲛ̀ⲛⲉⲧⲉⲛⲧⲁϥ ⲧⲏⲣⲟⲩ		And he took them, and passed over the torrent, and brought over all his possessions.	καὶ ἔλαβεν αὐτοὺς καὶ διέβη τὸν χειμάρρουν καὶ διεβίβασεν πάντα τὰ αὐτοῦ.						
Genesis	32	32	24	OT	1. OT	Pentateuch	1. Pentateuch	01. Pentateuch	01. Genesis	ⲁϥⲥⲱϫⲡ ⲇⲉ ⲛ̀ϫⲉ ⲓⲁⲕⲱⲃ ⲙ̀ⲙⲁⲩⲁⲧϥ ⲟⲩⲟϩ ⲛⲁϥϯ ⲛⲉⲙⲁϥ ⲛ̀ϫⲉ ⲟⲩⲣⲱⲙⲓ ϣⲁ ϣⲟⲣⲡ		And Jacob was left alone; and a man wrestled with him till the morning.	ὑπελείφθη δὲ Ιακωβ μόνος, καὶ ἐπάλαιεν ἄνθρωπος μετ᾽ αὐτοῦ ἕως πρωί.						
Genesis	32	32	25	OT	1. OT	Pentateuch	1. Pentateuch	01. Pentateuch	01. Genesis	ⲁϥⲛⲁⲩ ⲇⲉ ϫⲉ ⲙ̀ⲙⲟⲛ ϣϫⲟⲙ ⲙ̀ⲙⲟϥ ⲉⲣⲟϥ ⲟⲩⲟϩ ⲁϥϭⲓ ⲛⲉⲙ ⲑⲟⲩⲏϣⲥⲓ ⲙ̀ⲡⲉϥⲁⲗⲟϫ ⲟⲩⲟϩ ⲁϥⲛⲟⲩϣⲡ ⲛ̀ⲟⲩⲙⲟⲩⲧ ϩⲓ ⲑⲟⲩⲏϣⲥⲓ ⲙ̀ⲡⲁⲗⲟϫ ⲛ̀ⲓⲁⲕⲱⲃ ϧⲉⲛ ⲡϫⲓⲛⲑⲣⲉϥϯ ⲛⲉⲙⲁϥ		And he saw that he prevailed not against him; and he touched the broad part of his thigh, and the broad part of Jacob’s thigh was benumbed in his wrestling with him.	εἶδεν δὲ ὅτι οὐ δύναται πρὸς αὐτόν, καὶ ἥψατο τοῦ πλάτους τοῦ μηροῦ αὐτοῦ, καὶ ἐνάρκησεν τὸ πλάτος τοῦ μηροῦ Ιακωβ ἐν τῷ παλαίειν αὐτὸν μετ᾽ αὐτοῦ.						
Genesis	32	32	26	OT	1. OT	Pentateuch	1. Pentateuch	01. Pentateuch	01. Genesis	ⲟⲩⲟϩ ⲡⲉϫⲁϥ ⲛⲁϥ ϫⲉ ⲟⲩⲟⲣⲡⲧ ⲁ ϣⲱⲣⲡ ⲅⲁⲣ ϣⲱⲡⲓ ⲛ̀ⲑⲟϥ ⲇⲉ ⲡⲉϫⲁϥ ⲛⲁϥ ϫⲉ ϯⲛⲁⲟⲩⲟⲣⲡⲕ ⲁⲛ ⲁⲕϣⲧⲉⲙⲥⲙⲟⲩ ⲉ̀ⲣⲟⲓ		And he said to him, Let me go, for the day has dawned; but he said, I will not let thee go, except thou bless me.	καὶ εἶπεν αὐτῷ ᾿Απόστειλόν με· ἀνέβη γὰρ ὁ ὄρθρος. ὁ δὲ εἶπεν Οὐ μή σε ἀποστείλω, ἐὰν μή με εὐλογήσῃς.						
Genesis	32	32	27	OT	1. OT	Pentateuch	1. Pentateuch	01. Pentateuch	01. Genesis	ⲡⲉϫⲁϥ ⲇⲉ ⲛⲁϥ ϫⲉ ⲛⲓⲙ ⲡⲉ ⲡⲉⲕⲣⲁⲛ ⲛ̀ⲑⲟϥ ⲇⲉ ⲡⲉϫⲁϥ ϫⲉ ⲓⲁⲕⲱⲃ		And he said to him, What is thy name? and he answered, Jacob.	εἶπεν δὲ αὐτῷ Τί τὸ ὄνομά σού ἐστιν; ὁ δὲ εἶπεν Ιακωβ.						
Genesis	32	32	28	OT	1. OT	Pentateuch	1. Pentateuch	01. Pentateuch	01. Genesis	ⲡⲉϫⲁϥ ⲛⲁϥ ϫⲉ ⲛ̀ⲛⲟⲩⲙⲟⲩϯ ⲉ̀ⲡⲉⲕⲣⲁⲛ ϫⲉ ⲓⲁⲕⲱⲃ ⲁⲗⲗⲁ ⲉⲣⲉ ⲡⲉⲕⲣⲁⲛ ϣⲱⲡⲓ ϫⲉ ⲡⲓⲥ̅ⲗ̅ ϫⲉ ⲁⲕϫⲉⲙϫⲟⲙ ⲛⲉⲙ ⲫϯ ⲟⲩⲟϩ ⲟⲩⲟⲛ ϣϫⲟⲙ ⲙ̀ⲙⲟⲕ ⲛⲉⲙ ⲛⲓⲣⲱⲙⲓ		And he said to him, Thy name shall no longer be called Jacob, but Israel shall be thy name; for thou hast prevailed with God, and shalt be mighty with men.	εἶπεν δὲ αὐτῷ Οὐ κληθήσεται ἔτι τὸ ὄνομά σου Ιακωβ, ἀλλὰ Ισραηλ ἔσται τὸ ὄνομά σου, ὅτι ἐνίσχυσας μετὰ θεοῦ καὶ μετὰ ἀνθρώπων δυνατός.						
Genesis	32	32	29	OT	1. OT	Pentateuch	1. Pentateuch	01. Pentateuch	01. Genesis	ⲁϥϣⲓⲛⲓ ⲇⲉ ⲛ̀ϫⲉ ⲓⲁⲕⲱⲃ ⲟⲩⲟϩ ⲡⲉϫⲁϥ ϫⲉ ⲙⲁⲧⲁⲙⲟⲓ ⲉ̀ⲡⲉⲕⲣⲁⲛ ⲟⲩⲟϩ ⲡⲉϫⲁϥ ϫⲉ ϩⲓⲛⲁ ⲟⲩ ⲕϣⲓⲛⲓ ⲛ̀ⲥⲁ ⲡⲁⲣⲁⲛ ⲛ̀ⲑⲟⲕ ⲟⲩⲟϩ ⲁϥⲥⲙⲟⲩ ⲉ̀ⲣⲟϥ ⲙ̀ⲙⲁⲩ		And Jacob asked and said, Tell me thy name; and he said, Wherefore dost thou ask after my name? and he blessed him there.	ἠρώτησεν δὲ Ιακωβ καὶ εἶπεν ᾿Ανάγγειλόν μοι τὸ ὄνομά σου. καὶ εἶπεν ῞Ινα τί τοῦτο ἐρωτᾷς τὸ ὄνομά μου; καὶ ηὐλόγησεν αὐτὸν ἐκεῖ.						
Genesis	32	32	30	OT	1. OT	Pentateuch	1. Pentateuch	01. Pentateuch	01. Genesis	ⲟⲩⲟϩ ⲁ ⲓⲁⲕⲱⲃ ϯⲣⲉⲛ ⲫⲣⲁⲛ ⲙ̀ⲡⲓⲙⲁ ⲉⲧⲉⲙ̀ⲙⲁⲩ ϫⲉ ⲫⲛⲁⲩ ⲙ̀ⲫϯ ⲁⲓⲛⲁⲩ ⲅⲁⲣ ⲉ̀ⲟⲩⲛⲟⲩϯ ⲛ̀ϩⲟ ⲟⲩⲃⲉ ϩⲟ ⲟⲩⲟϩ ⲁⲥⲛⲟϩⲉⲙ ⲛ̀ϫⲉ ⲧⲁⲯⲩⲭⲏ		And Jacob called the name of that place, the Face of God; for, said he, I have seen God face to face, and my life was preserved.	καὶ ἐκάλεσεν Ιακωβ τὸ ὄνομα τοῦ τόπου ἐκείνου Εἶδος θεοῦ· εἶδον γὰρ θεὸν πρόσωπον πρὸς πρόσωπον, καὶ ἐσώθη μου ἡ ψυχή.						
Genesis	32	32	31	OT	1. OT	Pentateuch	1. Pentateuch	01. Pentateuch	01. Genesis	ⲁ ⲫⲣⲏ ⲇⲉ ϣⲁⲓ ⲉⲣⲟϥ ⲉⲧⲁϥⲥⲓⲛⲓ ⲛ̀ϫⲉ ⲡⲓⲛⲁⲩ ⲛ̀ⲧⲉ ⲫϯ ⲛ̀ⲑⲟϥ ⲇⲉ ⲁϥⲫⲱϧ ⲙ̀ⲡⲉϥⲁⲗⲟϫ		And the sun rose upon him, when he passed the Face of God; and he halted upon his thigh.	ἀνέτειλεν δὲ αὐτῷ ὁ ἥλιος, ἡνίκα παρῆλθεν τὸ Εἶδος τοῦ θεοῦ· αὐτὸς δὲ ἐπέσκαζεν τῷ μηρῷ αὐτοῦ.						
Genesis	32	32	32	OT	1. OT	Pentateuch	1. Pentateuch	01. Pentateuch	01. Genesis	ⲉⲑⲃⲉⲫⲁⲓ ⲛ̀ⲛⲟⲩⲟⲩⲱⲙ ⲛ̀ϫⲉ ⲛⲉⲛϣⲏⲣⲓ ⲙ̀ⲡⲓⲥ̅ⲗ̅ ⲙ̀ⲡⲓⲙⲟⲩⲧ ⲉⲧⲁϥⲛⲟⲩϣⲡ ⲫⲏ ⲉⲧϩⲓ ⲑⲟⲩⲏϣⲥⲓ ⲙ̀ⲡⲓⲁⲗⲟϫ ϣⲁ ⲉ̀ϧⲟⲩⲛ ⲉ̀ⲫⲟⲟⲩ ϫⲉ ⲁϥϭⲓ ⲛⲉⲙ ⲑⲟⲩⲏϣⲥⲓ ⲙ̀ⲡⲁⲗⲟϫ ⲛ̀ⲓⲁⲕⲱⲃ ⲟⲩⲟϩ ⲁϥⲛⲟⲩϣⲡ ⲛ̀ⲟⲩⲙⲟⲩⲧ ϩⲓⲱⲧϥ		Therefore the children of Israel will by no means eat of the sinew which was benumbed, which is on the broad part of the thigh, until this day, because the angel touched the broad part of the thigh of Jacob—even the sinew which was benumbed.	ἕνεκεν τούτου οὐ μὴ φάγωσιν οἱ υἱοὶ Ισραηλ τὸ νεῦρον, ὃ ἐνάρκησεν, ὅ ἐστιν ἐπὶ τοῦ πλάτους τοῦ μηροῦ, ἕως τῆς ἡμέρας ταύτης, ὅτι ἥψατο τοῦ πλάτους τοῦ μηροῦ Ιακωβ τοῦ νεύρου καὶ ἐνάρκησεν.						
Genesis	33	33	1	OT	1. OT	Pentateuch	1. Pentateuch	01. Pentateuch	01. Genesis	ⲁϥϫⲟⲩϣⲧ ⲇⲉ ⲛ̀ϫⲉ ⲓⲁⲕⲱⲃ ⲟⲩⲟϩ ⲁϥⲛⲁⲩ ϩⲏⲡⲡⲉ ⲓⲥ ⲏⲥⲁⲩ ⲡⲉϥⲥⲟⲛ ⲉϥⲛⲏⲟⲩ ⲛⲉⲙ ⲩ̅ ⲛ̀ⲣⲱⲙⲓ ⲛⲉⲙⲁϥ ⲟⲩⲟϩ ⲁ ⲓⲁⲕⲱⲃ ⲫⲱⲣϫ ⲛ̀ⲛⲓⲁⲗⲱⲟⲩⲓ ⲉ̀ϫⲉⲛ ⲗⲓⲁ ⲛⲉⲙ ⲉ̀ϫⲉⲛ ⲣⲁⲭⲏⲗ ⲛⲉⲙ ⲉ̀ϫⲉⲛ ϯⲃⲱⲕⲓ ⲃ̅ϯ		And Jacob lifted up his eyes, and beheld, and lo! Esau his brother coming, and four hundred men with him; and Jacob divided the children to Lea and to Rachel, and the two handmaidens.	᾿Αναβλέψας δὲ Ιακωβ εἶδεν καὶ ἰδοὺ Ησαυ ὁ ἀδελφὸς αὐτοῦ ἐρχόμενος καὶ τετρακόσιοι ἄνδρες μετ᾽ αὐτοῦ. καὶ ἐπιδιεῖλεν Ιακωβ τὰ παιδία ἐπὶ Λειαν καὶ Ραχηλ καὶ τὰς δύο παιδίσκας						
Genesis	33	33	2	OT	1. OT	Pentateuch	1. Pentateuch	01. Pentateuch	01. Genesis	ⲟⲩⲟϩ ⲁϥⲑⲣⲉ ϯⲃⲱⲕⲓ ⲃ̅ϯ ⲥⲱⲕ ϩⲓⲧϩⲏ ⲛⲉⲙ ⲛⲟⲩϣⲏⲣⲓ ⲗⲓⲁ ⲇⲉ ⲛⲉⲙ ⲛⲉⲥⲁⲗⲱⲟⲩⲓ ϩⲓⲫⲁϩⲟⲩ ⲙ̀ⲙⲱⲟⲩ ⲟⲩⲟϩ ⲣⲁⲭⲏⲗ ⲛⲉⲙ ⲓⲱⲥⲏⲫ ⲉ̀ⲡⲁϧⲁⲉ		And he put the two handmaidens and their children with the first, and Lea and her children behind, and Rachel and Joseph last.	καὶ ἐποίησεν τὰς δύο παιδίσκας καὶ τοὺς υἱοὺς αὐτῶν ἐν πρώτοις καὶ Λειαν καὶ τὰ παιδία αὐτῆς ὀπίσω καὶ Ραχηλ καὶ Ιωσηφ ἐσχάτους.						
