book	chapter	chapter-zfilled	verse	testament	testament-indexed	section	section-indexed	section-indexed-no-testament	book-indexed	Bohairic	Sahidic	English	Greek	Fayyumic	Akhmimic	OldBohairic	Mesokemic	DialectP	Lycopolitan
Exodus	12	12	13	OT	1. OT	Pentateuch	1. Pentateuch	01. Pentateuch	02. Exodus	ⲟⲩⲟϩ ⲉϥⲉ̀ϣⲱⲡⲓ ⲛⲱⲧⲉⲛ ⲛ̀ϫⲉ ⲡⲓⲥⲛⲟϥ ϧⲉⲛ ⲟⲩⲙⲏⲓⲛⲓ ϩⲓϫⲉⲛ ⲛⲓⲏⲓ ⲛⲏ ⲛ̀ⲑⲱⲧⲉⲛ ⲉⲧⲉⲧⲉⲛⲭⲏ ⲛ̀ϧⲏⲧⲟⲩ ⲟⲩⲟϩ ⲉⲓⲉ̀ⲛⲁⲩ ⲉ̀ⲡⲓⲥⲛⲟϥ ⲟⲩⲟϩ ⲉⲓⲉ̀ϩⲱⲃⲥ ⲉ̀ⲃⲟⲗ ⲉ̀ϫⲱⲧⲉⲛ ⲟⲩⲟϩ ⲛ̀ⲛⲉ ⲉⲣϧⲟⲧ ϣⲱⲡⲓ ϧⲉⲛ ⲑⲏⲛⲟⲩ ⲉ̀ⲡϧⲟⲙϧⲉⲙ ϩⲟⲧⲁⲛ ⲁⲓϣⲁⲛϣⲁⲣⲓ ϧⲉⲛ ⲡⲕⲁϩⲓ ⲛ̀ⲭⲏⲙⲓ		And the blood shall be for a sign to you on the houses in which ye are, and I will see the blood, and will protect you, and there shall not be on you the plague of destruction, when I smite in the land of Egypt.	καὶ ἔσται τὸ αἷµα ὑµῖν ἐν σηµείῳ ἐπὶ τῶν οἰκιῶν, ἐν αἷς ὑµεῖς ἐστε ἐκεῖ, καὶ ὄψοµαι τὸ αἷµα καὶ σκεπάσω ὑµᾶς, καὶ οὐκ ἔσται ἐν ὑµῖν πληγὴ τοῦ ἐκτριβῆναι, ὅταν παίω ἐν γῇ Αἰγύπτῳ.						
Exodus	12	12	14	OT	1. OT	Pentateuch	1. Pentateuch	01. Pentateuch	02. Exodus	ⲟⲩⲟϩ ⲉϥⲉ̀ϣⲱⲡⲓ ⲛⲱⲧⲉⲛ ⲛ̀ϫⲉ ⲡⲓⲉϩⲟⲟⲩ ⲛ̀ⲟⲩⲉⲣⲫⲙⲉⲩⲓ ⲟⲩⲟϩ ⲉⲣⲉⲧⲉⲛⲉ̀ⲁⲓϥ ⲙ̀ⲡϭ̅ⲥ̅ ϣⲁ ⲛⲉⲧⲉⲛϫⲱⲟⲩ ⲟⲩⲛⲟⲙⲟⲥ ⲛ̀ⲉⲛⲉϩ ⲉⲣⲉⲧⲉⲛⲉ̀ⲁⲓϥ ⲛ̀ϣⲁⲓ		And this day shall be to you a memorial, and ye shall keep it a feast to the Lord through all your generations; ye shall keep it a feast for a perpetual ordinance.	καὶ ἔσται ἡ ἡµέρα ὑµῖν αὕτη µνηµόσυνον, καὶ ἑορτάσετε αὐτὴν ἑορτὴν κυρίῳ εἰς πάσας τὰς γενεὰς ὑµῶν· νόµιµον αἰώνιον ἑορτάσετε αὐτήν.						
Exodus	12	12	15	OT	1. OT	Pentateuch	1. Pentateuch	01. Pentateuch	02. Exodus	ⲍ̅ ⲛ̀ⲉϩⲟⲟⲩ ⲉⲣⲉⲧⲉⲛⲉ̀ⲟⲩⲉⲙ ⲁⲧϣⲉⲙⲏⲣ ⲓⲥϫⲉⲛ ⲡⲓⲉϩⲟⲟⲩ ⲛ̀ϩⲟⲩⲓⲧ ⲉⲣⲉⲧⲉⲛⲉ̀ⲧⲁⲕⲉ ⲟⲩϣⲉⲙⲏⲣ ⲉ̀ⲃⲟⲗ ϧⲉⲛ ⲛⲉⲧⲉⲛⲏⲟⲩ ⲟⲩⲟⲛ ⲛⲓⲃⲉⲛ ⲉⲑⲛⲁⲟⲩⲱⲙ ϣⲉⲙⲏⲣ ⲉⲩⲉ̀ϥⲱϯ ⲛ̀ϯⲯⲩⲭⲏ ⲉⲧⲉⲙ̀ⲙⲁⲩ ⲉ̀ⲃⲟⲗ ϧⲉⲛ ⲡⲓⲥ̅ⲗ̅ ⲓⲥϫⲉⲛ ⲡⲓⲉϩⲟⲟⲩ ⲛ̀ϩⲟⲩⲓⲧ ϣⲁ ⲡⲓⲉϩⲟⲟⲩ ⲙ̀ⲙⲁϩⲍ̅		Seven days ye shall eat unleavened bread, and from the first day ye shall utterly remove leaven from your houses: whoever shall eat leaven, that soul shall be utterly destroyed from Israel, from the first day until the seventh day.	ἑπτὰ ἡµέρας ἄζυµα ἔδεσθε, ἀπὸ δὲ τῆς ἡµέρας τῆς πρώτης ἀφανιεῖτε ζύµην ἐκ τῶν οἰκιῶν ὑµῶν· πᾶς, ὃς ἂν φάγῃ ζύµην, ἐξολεθρευθήσεται ἡ ψυχὴ ἐκείνη ἐξ Ισραηλ ἀπὸ τῆς ἡµέρας τῆς πρώτης ἕως τῆς ἡµέρας τῆς ἑβδόµης.						
Exodus	12	12	16	OT	1. OT	Pentateuch	1. Pentateuch	01. Pentateuch	02. Exodus	ⲟⲩⲟϩ ⲡⲓⲉϩⲟⲟⲩ ⲛ̀ϩⲟⲩⲓⲧ ⲉⲩⲉ̀ⲙⲟⲩϯ ⲉ̀ⲣⲟϥ ϫⲉ ϥⲟⲩⲁⲃ ⲟⲩⲟϩ ⲡⲓⲉϩⲟⲟⲩ ⲙ̀ⲙⲁϩⲍ̅ ⲉⲩⲉ̀ⲙⲟⲩϯ ⲉ̀ⲣⲟϥ ϫⲉ ϥⲟⲩⲁⲃ ⲛⲱⲧⲉⲛ ϩⲱⲃ ⲛⲓⲃⲉⲛ ⲛ̀ϣⲉⲙϣⲓ ⲛ̀ⲛⲉⲧⲉⲛⲁⲓⲧⲟⲩ ⲛ̀ϧⲣⲏⲓ ⲛ̀ϧⲏⲧⲟⲩ ⲉ̀ⲃⲏⲗ ⲉ̀ⲛⲏ ⲧⲏⲣⲟⲩ ⲉⲧⲁⲩⲑⲁⲙⲓⲟ ⲙ̀ⲙⲱⲟⲩ ⲙ̀ⲯⲩⲭⲏ ⲛⲓⲃⲉⲛ ⲫⲁⲓ ⲙ̀ⲙⲁⲩⲁⲧϥ ⲉⲩⲉ̀ⲑⲁⲙⲓⲟϥ ⲛⲱⲧⲉⲛ		And the first day shall be called holy, and the seventh day shall be a holy convocation to you: ye shall do no servile work on them, only as many things as will necessarily be done by every soul, this only shall be done by you.	καὶ ἡ ἡµέρα ἡ πρώτη κληθήσεται ἁγία, καὶ ἡ ἡµέρα ἡ ἑβδόµη κλητὴ ἁγία ἔσται ὑµῖν· πᾶν ἔργον λατρευτὸν οὐ ποιήσετε ἐν αὐταῖς, πλὴν ὅσα ποιηθήσεται πάσῃ ψυχῇ, τοῦτο µόνον ποιηθήσεται ὑµῖν.						
Exodus	12	12	17	OT	1. OT	Pentateuch	1. Pentateuch	01. Pentateuch	02. Exodus	ⲟⲩⲟϩ ⲉⲣⲉⲧⲉⲛⲉ̀ⲁⲣⲉϩ ⲉⲧⲁⲓⲉⲛⲧⲟⲗⲏ ⲛ̀ϧⲣⲏⲓ ϧⲉⲛ ⲡⲁⲓⲉϩⲟⲟⲩ ⲉⲓⲉ̀ⲓⲛⲓ ⲛ̀ⲧⲉⲧⲉⲛϫⲟⲙ ⲉ̀ⲃⲟⲗ ϧⲉⲛ ⲡⲕⲁϩⲓ ⲛ̀ⲭⲏⲙⲓ ⲟⲩⲟϩ ⲉⲣⲉⲧⲉⲛⲉ̀ⲓⲣⲓ ⲙ̀ⲡⲁⲓⲉϩⲟⲟⲩ ϣⲁ ⲛⲉⲧⲉⲛϫⲱⲟⲩ ⲛ̀ⲟⲩⲛⲟⲙⲟⲥ ⲛ̀ⲉⲛⲉϩ		And ye shall keep this commandment, for on this day will I bring out your force out of the land of Egypt; and ye shall make this day a perpetual ordinance for you throughout your generations.	καὶ φυλάξεσθε τὴν ἐντολὴν ταύτην· ἐν γὰρ τῇ ἡµέρᾳ ταύτῃ ἐξάξω τὴν δύναµιν ὑµῶν ἐκ γῆς Αἰγύπτου, καὶ ποιήσετε τὴν ἡµέραν ταύτην εἰς γενεὰς ὑµῶν νόµιµον αἰώνιον.						
Exodus	12	12	18	OT	1. OT	Pentateuch	1. Pentateuch	01. Pentateuch	02. Exodus	ⲉⲩⲛⲁⲉⲣϩⲏⲧⲥ ⲛ̀ⲥⲟⲩⲓ̅ⲇ̅ ⲙ̀ⲡⲓⲁⲃⲟⲧ ⲛ̀ϩⲟⲩⲓⲧ ⲓⲥϫⲉⲛ ⲫⲛⲁⲩ ⲛ̀ϩⲁⲛⲁⲣⲟⲩϩⲓ ⲉⲣⲉⲧⲉⲛⲉ̀ⲟⲩⲉⲙ ⲁⲧϣⲉⲙⲏⲣ ϣⲁ ⲥⲟⲩⲕⲁ ⲙ̀ⲡⲓⲁⲃⲟⲧ ϣⲁⲧⲉ ⲣⲟⲩϩⲓ ϣⲱⲡⲓ		Beginning the fourteenth day of the first month, ye shall eat unleavened bread from evening, till the twenty-first day of the month, till evening.	ἐναρχοµένου τῇ τεσσαρεσκαιδεκάτῃ ἡµέρᾳ τοῦ µηνὸς τοῦ πρώτου ἀφ’ ἑσπέρας ἔδεσθε ἄζυµα ἕως ἡµέρας µιᾶς καὶ εἰκάδος τοῦ µηνὸς ἕως ἑσπέρας.						
Exodus	12	12	19	OT	1. OT	Pentateuch	1. Pentateuch	01. Pentateuch	02. Exodus	ⲍ̅ ⲛ̀ⲉϩⲟⲟⲩ ⲛ̀ⲛⲟⲩϫⲉⲙ ϣⲉⲙⲏⲣ ϧⲉⲛ ⲛⲉⲧⲉⲛⲏⲟⲩ ⲟⲩⲟⲛ ⲛⲓⲃⲉⲛ ⲉⲑⲛⲁⲟⲩⲱⲙ ⲉ̀ⲟⲩⲟⲛ ϣⲉⲙⲏⲣ ⲙ̀ⲙⲟϥ ⲉⲩⲉ̀ϥⲱϯ ⲛ̀ϯⲯⲩⲭⲏ ⲉⲧⲉⲙ̀ⲙⲁⲩ ⲉ̀ⲃⲟⲗ ϧⲉⲛ ϯⲥⲩⲛⲁⲅⲱⲅⲏ ⲛ̀ⲧⲉ ⲛⲉⲛϣⲏⲣⲓ ⲙ̀ⲡⲓⲥ̅ⲗ̅ ϧⲉⲛ ⲛⲓϣⲉⲙⲙⲱⲟⲩ ⲛⲉⲙ ⲛⲓⲣⲉⲙⲛϯⲙⲓ ⲛ̀ⲧⲉ ⲡⲓⲕⲁϩⲓ		Seven days leaven shall not be found in your houses; whosoever shall eat anything leavened, that soul shall be cut off from the congregation of Israel, both among the occupiers of the land and the original inhabitants.	ἑπτὰ ἡµέρας ζύµη οὐχ εὑρεθήσεται ἐν ταῖς οἰκίαις ὑµῶν· πᾶς, ὃς ἂν φάγῃ ζυµωτόν, ἐξολεθρευθήσεται ἡ ψυχὴ ἐκείνη ἐκ συναγωγῆς Ισραηλ ἔν τε τοῖς γειώραις καὶ αὐτόχθοσιν τῆς γῆς·						
Exodus	12	12	20	OT	1. OT	Pentateuch	1. Pentateuch	01. Pentateuch	02. Exodus	ⲛⲛⲉⲧⲉⲛⲟⲩⲱⲙ ⲛ̀ϩⲱⲃ ⲛⲓⲃⲉⲛ ⲉ̀ⲟⲩⲟⲛ ϣⲉⲙⲏⲣ ⲙ̀ⲙⲟϥ ϧⲉⲛ ⲙⲁⲛ̀ϣⲱⲡⲓ ⲛⲓⲃⲉⲛ ⲛ̀ⲧⲱⲧⲉⲛ ⲉⲣⲉⲧⲉⲛⲟⲩⲱⲙ ⲁⲧϣⲉⲙⲏⲣ		Ye shall eat nothing leavened, but in every habitation of your ye shall eat unleavened bread.	πᾶν ζυµωτὸν οὐκ ἔδεσθε, ἐν παντὶ δὲ κατοικητηρίῳ ὑµῶν ἔδεσθε ἄζυµα.						
Exodus	12	12	21	OT	1. OT	Pentateuch	1. Pentateuch	01. Pentateuch	02. Exodus	ⲁϥⲙⲟⲩϯ ⲇⲉ ⲛ̀ϫⲉ ⲙⲱⲩ̀ⲥⲏⲥ ⲉ̀ⲛⲓϧⲉⲗⲗⲟⲓ ⲧⲏⲣⲟⲩ ⲛ̀ⲧⲉ ⲡⲓⲥ̅ⲗ̅ ⲟⲩⲟϩ ⲡⲉϫⲁϥ ⲛⲱⲟⲩ ϫⲉ ⲙⲁϣⲉ ⲛⲱⲧⲉⲛ ϭⲓ ⲛ̀ⲟⲩⲉⲥⲱⲟⲩ ⲕⲁⲧⲁ ⲛⲉⲧⲉⲛⲥⲩⲅⲅⲉⲛⲓⲁ ⲟⲩⲟϩ ϣⲱⲧ ⲙ̀ⲡⲓⲡⲁⲥⲭⲁ ⲙ̀ⲡϭ̅ⲥ̅		And Moses called all the elders of the children of Israel, and said to them, Go away and take to yourselves a lamb according to your kindreds, and slay the passover.	Ἐκάλεσεν δὲ Μωυσῆς πᾶσαν γερουσίαν υἱῶν Ισραηλ καὶ εἶπεν πρὸς αὐτούς Ἀπελθόντες λάβετε ὑµῖν ἑαυτοῖς πρόβατον κατὰ συγγενείας ὑµῶν καὶ θύσατε τὸ πασχα.						
Exodus	12	12	22	OT	1. OT	Pentateuch	1. Pentateuch	01. Pentateuch	02. Exodus	ⲉⲣⲉⲧⲉⲛⲉ̀ϭⲓ ⲇⲉ ⲛⲟ̀ⲩϣⲟⲗ ⲛ̀ϩⲩⲥⲱⲡⲟⲥ ⲟⲩⲟϩ ⲉⲣⲉⲧⲉⲛⲉ̀ⲥⲱⲡ ⲉ̀ⲃⲟⲗ ϧⲉⲛ ⲡⲓⲥⲛⲟϥ ⲫⲏ ⲉⲧϧⲁⲧⲉⲛ ⲡⲓⲣⲟ ⲟⲩⲟϩ ⲉⲣⲉⲧⲉⲛⲉ̀ⲗⲁⲗⲉ ⲛⲉⲧⲉⲛⲑⲟⲩⲁⲓ ⲛⲉⲙ ϯⲟⲩⲉϫⲣⲟ ⲥⲛⲟⲩϯ ⲉ̀ⲃⲟⲗ ϧⲉⲛ ⲡⲓⲥⲛⲟϥ ⲉⲧϧⲁⲧⲉⲛ ⲡⲓⲣⲟ ⲛ̀ⲑⲱⲧⲉⲛ ⲇⲉ ⲛ̀ⲛⲉⲧⲉⲛⲓ̀ ⲉ̀ⲃⲟⲗ ⲫⲟⲩⲁⲓ ⲫⲟⲩⲁⲓ ⲙ̀ⲫⲣⲟ ⲛ̀ⲧⲉ ⲡⲉϥⲏⲓ ϣⲁ ϩⲁⲛⲁⲧⲟⲟⲩⲓ		And ye shall take a bunch of hyssop, and having dipped it into some of the blood that is by the door, ye shall touch the lintel, and shall put it upon both door-posts, even of the blood which is by the door; but ye shall not go out every one from the door of his house till the morning.	λήµψεσθε δὲ δέσµην ὑσσώπου καὶ βάψαντες ἀπὸ τοῦ αἵµατος τοῦ παρὰ τὴν θύραν καθίξετε τῆς φλιᾶς καὶ ἐπ’ ἀµφοτέρων τῶν σταθµῶν ἀπὸ τοῦ αἵµατος, ὅ ἐστιν παρὰ τὴν θύραν· ὑµεῖς δὲ οὐκ ἐξελεύσεσθε ἕκαστος τὴν θύραν τοῦ οἴκου αὐτοῦ ἕως πρωί.						
Exodus	12	12	23	OT	1. OT	Pentateuch	1. Pentateuch	01. Pentateuch	02. Exodus	ⲟⲩⲟϩ ⲉϥⲉ̀ⲥⲓⲛⲓ ⲛ̀ϫⲉ ⲡϭ̅ⲥ̅ ⲉ̀ϣⲁⲣⲓ ⲉ̀ⲛⲓⲣⲉⲙⲛ̀ⲭⲏⲙⲓ ⲟⲩⲟϩ ⲉϥⲉ̀ⲛⲁⲩ ⲉ̀ⲡⲓⲥⲛⲟϥ ϩⲓϫⲉⲛ ⲡⲓⲑⲟⲩⲁⲓ ⲛⲉⲙ ϩⲓϫⲉⲛ ϯⲟⲩⲉϫⲣⲟ ⲃ̅ϯ ⲟⲩⲟϩ ⲉⲣⲉ ⲡϭ̅ⲥ̅ ⲥⲉⲛ ⲡⲓⲣⲟ ⲟⲩⲟϩ ⲛ̀ⲛⲉϥⲭⲁ ⲡⲓⲣⲉϥⲧⲁⲕⲟ ⲉ̀ⲓ ̀ⲉ̀ϧⲟⲩⲛ ⲉ̀ⲛⲉⲧⲉⲛⲏⲟⲩ ⲉ̀ϣⲁⲣⲓ ⲉ̀ⲣⲱⲧⲉⲛ		And the Lord shall pass by to smite the Egyptians, and shall see the blood upon the lintel, and upon both the door-posts; and the Lord shall pass by the door, and shall not suffer the destroyer to enter into your houses to smite you.	καὶ παρελεύσεται κύριος πατάξαι τοὺς Αἰγυπτίους καὶ ὄψεται τὸ αἷµα ἐπὶ τῆς φλιᾶς καὶ ἐπ’ ἀµφοτέρων τῶν σταθµῶν, καὶ παρελεύσεται κύριος τὴν θύραν καὶ οὐκ ἀφήσει τὸν ὀλεθρεύοντα εἰσελθεῖν εἰς τὰς οἰκίας ὑµῶν πατάξαι.						
Exodus	12	12	24	OT	1. OT	Pentateuch	1. Pentateuch	01. Pentateuch	02. Exodus	ⲟⲩⲟϩ ⲉⲣⲉⲧⲉⲛⲉ̀ⲁⲣⲉϩ ⲉ̀ⲡⲁⲓⲥⲁϫⲓ ⲛ̀ⲟⲩⲛⲟⲙⲟⲥ ⲛ̀ⲉⲛⲉϩ ⲛⲁⲕ ⲛⲉⲙ ⲛⲉⲕϣⲏⲣⲓ ϣⲁ ⲉ̀ⲛⲉϩ		And keep ye this thing as an ordinance for thyself and for thy children for ever.	καὶ φυλάξεσθε τὸ ῥῆµα τοῦτο νόµιµον σεαυτῷ καὶ τοῖς υἱοῖς σου ἕως αἰῶνος.						
Exodus	12	12	25	OT	1. OT	Pentateuch	1. Pentateuch	01. Pentateuch	02. Exodus	ⲉ̀ϣⲱⲡ ⲇⲉ ⲁⲣⲉⲧⲉⲛϣⲁⲛϣⲉ ⲛⲱⲧⲉⲛ ⲉ̀ϧⲟⲩⲛ ⲉ̀ⲡⲓⲕⲁϩⲓ ⲫⲏ ⲉⲧⲉ ⲡϭ̅ⲥ̅ ⲛⲁⲧⲏⲓϥ ⲛⲱⲧⲉⲛ ⲙ̀ⲫⲣⲏϯ ⲉⲧⲁϥⲥⲁϫⲓ ⲉⲣⲉⲧⲉⲛⲉ̀ⲁⲣⲉϩ ⲉ̀ⲡⲁⲓϣⲉⲙϣⲓ		And if ye should enter into the land, which the Lord shall give you, as he has spoken, keep this service.	ἐὰν δὲ εἰσέλθητε εἰς τὴν γῆν, ἣν ἂν δῷ κύριος ὑµῖν, καθότι ἐλάλησεν, φυλάξεσθε τὴν λατρείαν ταύτην.						
Exodus	12	12	26	OT	1. OT	Pentateuch	1. Pentateuch	01. Pentateuch	02. Exodus	ⲟⲩⲟϩ ⲉⲥⲉ̀ϣⲱⲡⲓ ⲁⲩϣⲁⲛϫⲟⲥ ⲛⲱⲧⲉⲛ ⲛ̀ϫⲉ ⲛⲉⲧⲉⲛϣⲏⲣⲓ ϫⲉ ⲡⲁⲓϣⲉⲙϣⲓ ⲟⲩ ⲡⲉ		And it shall come to pass, if your sons say to you, What is this service?	καὶ ἔσται, ἐὰν λέγωσιν πρὸς ὑµᾶς οἱ υἱοὶ ὑµῶν Τίς ἡ λατρεία αὕτη;						
Exodus	12	12	27	OT	1. OT	Pentateuch	1. Pentateuch	01. Pentateuch	02. Exodus	ⲟⲩⲟϩ ⲉⲣⲉⲧⲉⲛⲉ̀ϫⲟⲥ ϫⲉ ⲟⲩϣⲟⲩϣⲱⲟⲩϣⲓ ⲙ̀ⲡϭ̅ⲥ̅ ⲡⲉ ⲡⲁⲓⲡⲁⲥⲭⲁ ⲙ̀ⲫⲣⲏϯ ⲉⲧⲁϥⲧⲟⲩϫⲟ ⲛ̀ⲛⲉⲛⲏⲟⲩ ⲛ̀ⲛⲉⲛϣⲏⲣⲓ ⲙ̀ⲡⲓⲥ̅ⲗ̅ ϧⲉⲛ ⲭⲏⲙⲓ ϩⲟⲧⲉ ⲉⲧⲁϥϣⲁⲣⲓ ⲉ̀ⲛⲓⲣⲉⲙⲛ̀ⲭⲏⲙⲓ ⲛⲉⲛⲏⲟⲩ ⲇⲉ ⲁ̀ⲛⲟⲛ ⲁϥⲛⲁϩⲙⲟⲩ ⲟⲩⲟϩ ⲁϥϩⲓⲧϥ ⲉ̀ⲡⲉⲥⲏⲧ ⲛ̀ϫⲉ ⲡⲓⲗⲁⲟⲥ ⲁϥⲟⲩⲱϣⲧ		that ye shall say to them, This passover is a sacrifice to the Lord, as he defended the houses of the children of Israel in Egypt, when he smote the Egyptians, but delivered our houses.	καὶ ἐρεῖτε αὐτοῖς Θυσία τὸ πασχα τοῦτο κυρίῳ, ὡς ἐσκέπασεν τοὺς οἴκους τῶν υἱῶν Ισραηλ ἐν Αἰγύπτῳ, ἡνίκα ἐπάταξεν τοὺς Αἰγυπτίους, τοὺς δὲ οἴκους ἡµῶν ἐρρύσατο. καὶ κύψας ὁ λαὸς προσεκύνησεν.						
Exodus	12	12	28	OT	1. OT	Pentateuch	1. Pentateuch	01. Pentateuch	02. Exodus	ⲟⲩⲟϩ ⲁⲩϣⲉ ⲛⲱⲟⲩ ⲛ̀ϫⲉ ⲛⲉⲛϣⲏⲣⲓ ⲙ̀ⲡⲓⲥ̅ⲗ̅ ⲁⲩⲓⲣⲓ ⲕⲁⲧⲁ ⲫⲣⲏϯ ⲉⲧⲁ ⲡϭ̅ⲥ̅ ϩⲟⲛϩⲉⲛ ⲉ̀ⲧⲟⲧϥ ⲙ̀ⲙⲱⲩ̀ⲥⲏⲥ ⲛⲉⲙ ⲁⲁⲣⲱⲛ ⲁⲩⲓⲣⲓ ⲙ̀ⲡⲁⲓⲣⲏϯ		And the people bowed and worshipped. And the children of Israel departed and did as the Lord commanded Moses and Aaron, so did they.	καὶ ἀπελθόντες ἐποίησαν οἱ υἱοὶ Ισραηλ καθὰ ἐνετείλατο κύριος τῷ Μωυσῇ καὶ Ααρων, οὕτως ἐποίησαν.						
Exodus	12	12	29	OT	1. OT	Pentateuch	1. Pentateuch	01. Pentateuch	02. Exodus	ⲁⲥϣⲱⲡⲓ ⲇⲉ ⲉⲧⲁ ⲧⲫⲁϣⲓ ⲙ̀ⲡⲓⲉϫⲱⲣϩ ϣⲱⲡⲓ ⲁ ⲡϭ̅ⲥ̅ ϣⲁⲣⲓ ⲉ̀ϣⲁⲙⲓⲥⲓ ⲛⲓⲃⲉⲛ ⲉⲧϧⲉⲛ ⲭⲏⲙⲓ ⲓⲥϫⲉⲛ ⲡϣⲟⲣⲡ ⲙ̀ⲙⲓⲥⲓ ⲙ̀ⲫⲁⲣⲁⲱ ⲫⲏ ⲉⲧϩⲉⲙⲥⲓ ϩⲓϫⲉⲛ ⲡⲑⲣⲟⲛⲟⲥ ϣⲁ ⲡϣⲟⲣⲡ ⲙ̀ⲙⲓⲥⲓ ⲛ̀ϯⲉⲭⲙⲁⲗⲱⲧⲟⲥ ⲑⲏ ⲉⲧⲭⲏ ϧⲉⲛ ⲡⲓⲗⲁⲕⲕⲟⲥ ⲛⲉⲙ ⲡϣⲟⲣⲡ ⲙⲙⲓⲥⲓ ⲛ̀ⲧⲉⲃⲛⲏ ⲛⲓⲃⲉⲛ		And it came to pass at midnight that the Lord smote all the first-born in the land of Egypt, from the first-born of Pharao that sat on the throne, to the first-born of the captive-maid in the dungeon, and the first-born of all cattle.	Ἐγενήθη δὲ µεσούσης τῆς νυκτὸς καὶ κύριος ἐπάταξεν πᾶν πρωτότοκον ἐν γῇ Αἰγύπτῳ ἀπὸ πρωτοτόκου Φαραω τοῦ καθηµένου ἐπὶ τοῦ θρόνου ἕως πρωτοτόκου τῆς αἰχµαλωτίδος τῆς ἐν τῷ λάκκῳ καὶ ἕως πρωτοτόκου παντὸς κτήνους.						
Exodus	12	12	30	OT	1. OT	Pentateuch	1. Pentateuch	01. Pentateuch	02. Exodus	ⲟⲩⲟϩ ⲁϥⲧⲱⲛϥ ⲛ̀ϫⲉ ⲫⲁⲣⲁⲱ ⲛ̀ϫⲱⲣϩ ⲛⲉⲙ ⲛⲉϥⲁⲗⲱⲟⲩⲓ ⲧⲏⲣⲟⲩ ⲛⲉⲙ ⲛⲓⲣⲉⲙⲛ̀ⲭⲏⲙⲓ ⲧⲏⲣⲟⲩ ⲟⲩⲟϩ ⲁ ⲟⲩⲛⲓϣϯ ⲛ̀ϧⲣⲱⲟⲩ ϣⲱⲡⲓ ϧⲉⲛ ⲡⲕⲁϩⲓ ⲧⲏⲣϥ ⲛ̀ⲧⲉ ⲭⲏⲙⲓ ⲛⲉ ⲙ̀ⲙⲟⲛ ⲏⲓ ⲅⲁⲣ ⲡⲉ ⲙ̀ⲡⲉ ⲟⲩⲟⲛ ⲙⲟⲩ ⲛ̀ϧⲏⲧϥ		And Pharao rose up by night, and his servants, and all the Egyptians; and there was a great cry in all the land of Egypt, for there was not a house in which there was not one dead.	καὶ ἀναστὰς Φαραω νυκτὸς καὶ πάντες οἱ θεράποντες αὐτοῦ καὶ πάντες οἱ Αἰγύπτιοι καὶ ἐγενήθη κραυγὴ µεγάλη ἐν πάσῃ γῇ Αἰγύπτῳ· οὐ γὰρ ἦν οἰκία, ἐν ᾗ οὐκ ἦν ἐν αὐτῇ τεθνηκώς.						
Exodus	12	12	31	OT	1. OT	Pentateuch	1. Pentateuch	01. Pentateuch	02. Exodus	ⲟⲩⲟϩ ⲁϥⲙⲟⲩϯ ⲛ̀ϫⲉ ⲫⲁⲣⲁⲱ ⲉ̀ⲙⲱⲩ̀ⲥⲏⲥ ⲛⲉⲙ ⲁⲁⲣⲱⲛ ⲛ̀ϫⲱⲣϩ ⲟⲩⲟϩ ⲡⲉϫⲁϥ ⲛⲱⲟⲩ ϫⲉ ⲧⲉⲛ ⲑⲏⲛⲟⲩ ⲙⲁϣⲉ ⲛⲱⲧⲉⲛ ⲉ̀ⲃⲟⲗ ϧⲉⲛ ⲡⲁⲗⲁⲟⲥ ⲛ̀ⲑⲱⲧⲉⲛ ⲛⲉⲙ ⲛⲉⲛϣⲏⲣⲓ ⲙ̀ⲡⲓⲥ̅ⲗ̅ ⲙⲁϣⲉ ⲛⲱⲧⲉⲛ ϣⲉⲙϣⲓ ⲙ̀ⲡϭ̅ⲥ̅ ⲡⲉⲧⲉⲛⲛⲟⲩϯ ⲙ̀ⲫⲣⲏϯ ⲉⲧⲉⲧⲉⲛϫⲱ ⲙ̀ⲙⲟⲥ		And Pharao called Moses and Aaron by night, and said to them, Rise and depart from my people, both ye and the children of Israel. Go and serve the Lord your God, even as ye say.	καὶ ἐκάλεσεν Φαραω Μωυσῆν καὶ Ααρων νυκτὸς καὶ εἶπεν αὐτοῖς Ἀνάστητε καὶ ἐξέλθατε ἐκ τοῦ λαοῦ µου καὶ ὑµεῖς καὶ οἱ υἱοὶ Ισραηλ· βαδίζετε καὶ λατρεύσατε κυρίῳ τῷ θεῷ ὑµῶν, καθὰ λέγετε·						
Exodus	12	12	32	OT	1. OT	Pentateuch	1. Pentateuch	01. Pentateuch	02. Exodus	ⲟⲩⲟϩ ⲛⲉⲧⲉⲛⲉⲥⲱⲟⲩ ⲛⲉⲙ ⲛⲉⲧⲉⲛⲉϩⲱⲟⲩ ϭⲓⲧⲟⲩ ⲙⲁϣⲉ ⲛⲱⲧⲉⲛ ⲕⲁⲧⲁ ⲫⲣⲏϯ ⲉⲧⲉⲣⲉⲧⲉⲛϫⲟⲥ ⲥⲙⲟⲩ ⲇⲉ ⲉ̀ⲣⲟⲓ ϩⲱ		And take with you your sheep, and your oxen: bless me also, I pray you.	καὶ τὰ πρόβατα καὶ τοὺς βόας ὑµῶν ἀναλαβόντες πορεύεσθε, εὐλογήσατε δὲ κἀµέ.						
Exodus	12	12	33	OT	1. OT	Pentateuch	1. Pentateuch	01. Pentateuch	02. Exodus	ⲟⲩⲟϩ ⲛⲁⲣⲉ ⲛⲓⲣⲉⲙⲛ̀ⲭⲏⲙⲓ ϭⲓ ⲙ̀ⲡⲓⲗⲁⲟⲥ ⲛ̀ϫⲟⲛⲥ ϧⲉⲛ ⲟⲩⲓⲱⲥ ⲉ̀ϩⲓⲧⲟⲩ ⲉ̀ⲃⲟⲗ ϧⲉⲛ ⲡⲓⲕⲁϩⲓ ⲁⲩϫⲟⲥ ⲅⲁⲣ ϫⲉ ⲁ̀ⲛⲟⲛ ⲧⲏⲣⲉⲛ ⲧⲉⲛⲛⲁⲙⲟⲩ		And the Egyptians constrained the people, so that they cast them out of the land with haste, for they said, We all shall die.	καὶ κατεβιάζοντο οἱ Αἰγύπτιοι τὸν λαὸν σπουδῇ ἐκβαλεῖν αὐτοὺς ἐκ τῆς γῆς· εἶπαν γὰρ ὅτι Πάντες ἡµεῖς ἀποθνῄσκοµεν.						
Exodus	12	12	34	OT	1. OT	Pentateuch	1. Pentateuch	01. Pentateuch	02. Exodus	ⲁϥϭⲓ ⲇⲉ ⲛ̀ϫⲉ ⲡⲓⲗⲁⲟⲥ ⲙ̀ⲡⲓⲛⲓϣϯ ⲙ̀ⲡⲁⲧⲟⲩϭⲓϣⲉⲙⲏⲣ ⲛ̀ϫⲉ ⲛ̀ⲟⲩⲟⲩⲱϣⲉⲙ ⲉⲩⲙⲏⲣ ϧⲉⲛ ⲛⲟⲩϩⲃⲱⲥ ϩⲓ ⲧⲟⲩⲛⲁϩⲃⲓ		And the people took their dough before their meal was leavened, bound up as it was in their garments, on their shoulders.	ἀνέλαβεν δὲ ὁ λαὸς τὸ σταῖς πρὸ τοῦ ζυµωθῆναι, τὰ φυράµατα αὐτῶν ἐνδεδεµένα ἐν τοῖς ἱµατίοις αὐτῶν ἐπὶ τῶν ὤµων.						
Exodus	12	12	35	OT	1. OT	Pentateuch	1. Pentateuch	01. Pentateuch	02. Exodus	ⲛⲉⲛϣⲏⲣⲓ ⲇⲉ ⲙ̀ⲡⲓⲥ̅ⲗ̅ ⲁⲩⲓⲣⲓ ⲕⲁⲧⲁ ⲫⲣⲏϯ ⲉⲧⲁ ⲙⲱⲩ̀ⲥⲏⲥ ⲟⲩⲁϩⲥⲁϩⲛⲓ ⲛⲱⲟⲩ ⲟⲩⲟϩ ⲁⲩⲉⲣⲉⲧⲓⲛ ⲛ̀ⲧⲟⲧⲟⲩ ⲛ̀ⲛⲓⲣⲉⲙⲛ̀ⲭⲏⲙⲓ ⲛ̀ϩⲁⲛⲥⲕⲉⲩⲟⲥ ⲛ̀ⲛⲟⲩⲃ ⲛⲉⲙ ϩⲁⲛⲥⲕⲉⲩⲟⲥ ⲛ̀ϩⲁⲧ ⲛⲉⲙ ϩⲁⲛϭⲓϩⲃⲱⲥ		And the children of Israel did as Moses commanded them, and they asked of the Egyptians articles of silver and gold and apparel.	οἱ δὲ υἱοὶ Ισραηλ ἐποίησαν καθὰ συνέταξεν αὐτοῖς Μωυσῆς, καὶ ᾔτησαν παρὰ τῶν Αἰγυπτίων σκεύη ἀργυρᾶ καὶ χρυσᾶ καὶ ἱµατισµόν·						
Exodus	12	12	36	OT	1. OT	Pentateuch	1. Pentateuch	01. Pentateuch	02. Exodus	ⲟⲩⲟϩ ⲁ ⲡϭ̅ⲥ̅ ϯ ⲛ̀ⲟⲩϩⲙⲟⲧ ⲙ̀ⲡⲉϥⲗⲁⲟⲥ ⲙ̀ⲡⲉⲙ̀ⲑⲟ ⲛ̀ⲛⲓⲣⲉⲙⲛ̀ⲭⲏⲙⲓ ⲟⲩⲟϩ ⲁⲩϯ ⲛⲱⲟⲩ ⲟⲩⲟϩ ⲁⲩϣⲉⲗ ⲛⲓⲣⲉⲙⲛ̀ⲭⲏⲙⲓ		And the Lord gave his people favour in the sight of the Egyptians, and they lent to them; and they spoiled the Egyptians.	καὶ κύριος ἔδωκεν τὴν χάριν τῷ λαῷ αὐτοῦ ἐναντίον τῶν Αἰγυπτίων, καὶ ἔχρησαν αὐτοῖς· καὶ ἐσκύλευσαν τοὺς Αἰγυπτίους.						
Exodus	12	12	37	OT	1. OT	Pentateuch	1. Pentateuch	01. Pentateuch	02. Exodus	ⲁⲩⲟⲩⲱⲧⲉⲃ ⲇⲉ ⲛ̀ϫⲉ ⲛⲉⲛϣⲏⲣⲓ ⲙ̀ⲡⲓⲥ̅ⲗ̅ ⲉ̀ⲃⲟⲗ ϧⲉⲛ ⲣⲁⲙⲁⲥⲥⲏ ⲉ̀ⲥⲟⲕⲭⲱⲑ ⲭ̅ ⲛ̀ϣⲟ ⲛ̀ⲣⲉⲙⲛ̀ⲣⲁⲧⲟⲩ ⲥⲁⲃⲟⲗ ⲙ̀ⲡⲟⲩⲥⲟⲃϯ		And the children Israel departed from Ramesses to Socchoth, to the full number of six hundred thousand footmen, even men, besides the baggage.	Ἀπάραντες δὲ οἱ υἱοὶ Ισραηλ ἐκ Ραµεσση εἰς Σοκχωθα εἰς ἑξακοσίας χιλιάδας πεζῶν οἱ ἄνδρες πλὴν τῆς ἀποσκευῆς,						
Exodus	12	12	38	OT	1. OT	Pentateuch	1. Pentateuch	01. Pentateuch	02. Exodus	ⲟⲩⲟϩ ⲟⲩⲛⲓϣϯ ⲙ̀ⲙⲏϣ ⲉϥⲙⲟϫⲧ ⲁⲩϣⲉ ⲉ̀ⲡϣⲱⲓ ⲛⲉⲙⲱⲟⲩ ⲛⲉⲙ ϩⲁⲛⲉⲥⲱⲟⲩ ⲛⲉⲙ ϩⲁⲛⲉϩⲱⲟⲩ ⲛⲉⲙ ϩⲁⲛⲧⲉⲃⲛⲱⲟⲩⲓ ⲉⲩⲟϣ ⲉ̀ⲙⲁϣⲱ ⲉⲩⲥⲱⲕ ⲉ̀ⲃⲟⲗ ⲛⲉⲙⲱⲟⲩ		And a great mixed company went up with them, and sheep and oxen and very much cattle.	καὶ ἐπίµικτος πολὺς συνανέβη αὐτοῖς καὶ πρόβατα καὶ βόες καὶ κτήνη πολλὰ σφόδρα.						
Exodus	12	12	39	OT	1. OT	Pentateuch	1. Pentateuch	01. Pentateuch	02. Exodus	ⲟⲩⲟϩ ⲁⲩϫⲱϫ ⲙ̀ⲡⲓϣⲱϯ ⲫⲏ ⲉⲧⲁⲩⲉⲛϥ ⲉ̀ⲃⲟⲗ ϧⲉⲛ ⲛ̀ⲭⲏⲙⲓ ⲛ̀ϩⲁⲛⲕⲉⲛⲉⲫⲓⲧⲉⲛ ⲛ̀ⲁⲧϣⲉⲙⲏⲣ ⲛⲉ ⲙ̀ⲡⲉϥϭⲓϣⲉⲙⲏⲣ ⲅⲁⲣ ⲡⲉ ⲁⲩϩⲓⲧⲟⲩ ⲉ̀ⲃⲟⲗ ⲛ̀ϫⲉ ⲛⲓⲣⲉⲙⲛ̀ⲭⲏⲙⲓ ϧⲉⲛ ⲟⲩⲓⲱⲥ ⲟⲩⲟϩ ⲙ̀ⲡⲟⲩϣϫⲉⲙϫⲟⲙ ⲛ̀ⲟϩⲓ ⲟⲩⲇⲉ ⲙ̀ⲡⲟⲩⲑⲁⲙⲓⲉ ϧⲣⲉ ⲛⲱⲟⲩ ϩⲓ ⲫⲙⲱⲓⲧ		And they baked the dough which they brought out of Egypt, unleavened cakes, for it had not been leavened; for the Egyptians cast them out, and they could not remain, neither did they prepare provision for themselves for the journey.	καὶ ἔπεψαν τὸ σταῖς, ὃ ἐξήνεγκαν ἐξ Αἰγύπτου, ἐγκρυφίας ἀζύµους· οὐ γὰρ ἐζυµώθη· ἐξέβαλον γὰρ αὐτοὺς οἱ Αἰγύπτιοι, καὶ οὐκ ἠδυνήθησαν ἐπιµεῖναι οὐδὲ ἐπισιτισµὸν ἐποίησαν ἑαυτοῖς εἰς τὴν ὁδόν.						
Exodus	12	12	40	OT	1. OT	Pentateuch	1. Pentateuch	01. Pentateuch	02. Exodus	ⲡⲓϫⲓⲛϫⲱⲓⲗⲓ ⲇⲉ ⲛ̀ⲧⲉ ⲛⲉⲛϣⲏⲣⲓ ⲙ̀ⲡⲓⲥ̅ⲗ̅ ⲉⲧⲁⲩⲉⲣⲣⲉⲙⲛ̀ϫⲱⲓⲗⲓ ⲙ̀ⲙⲟϥ ϧⲉⲛ ⲡⲕⲁϩⲓ ⲛ̀ⲭⲏⲙⲓ ⲛⲉⲙ ϧⲉⲛ ⲡⲕⲁϩⲓ ⲛ̀ⲭⲁⲛⲁⲁⲛ ⲛ̀ⲑⲱⲟⲩ ⲛⲉⲙ ⲛⲟⲩⲓⲟϯ ⲩ̅ⲗ̅ ⲛ̀ⲣⲟⲙⲡⲓ ⲛⲉ		And the sojourning of the children of Israel, while they sojourned in the land of Egypt and the land of Chanaan, was four hundred and thirty years.	ἡ δὲ κατοίκησις τῶν υἱῶν Ισραηλ, ἣν κατῴκησαν ἐν γῇ Αἰγύπτῳ καὶ ἐν γῇ Χανααν, ἔτη τετρακόσια τριάκοντα,						
Exodus	12	12	41	OT	1. OT	Pentateuch	1. Pentateuch	01. Pentateuch	02. Exodus	ⲟⲩⲟϩ ⲁⲥϣⲱⲡⲓ ⲙⲉⲛⲉⲛⲥⲁ ϯⲩ̅ⲗ̅ ⲛ̀ⲣⲟⲙⲡⲓ ⲁⲥⲓ̀ ⲛ̀ϫⲉ ϯϫⲟⲙ ⲧⲏⲣⲥ ⲛ̀ⲧⲉ ⲡϭ̅ⲥ̅ ⲉ̀ⲃⲟⲗ ϧⲉⲛ ⲡⲕⲁϩⲓ ⲛ̀ⲭⲏⲙⲓ ⲛ̀ϫⲱⲣϩ		And it came to pass after the four hundred and thirty years, all the forces of the Lord came forth out of the land of Egypt by night.	καὶ ἐγένετο µετὰ τὰ τετρακόσια τριάκοντα ἔτη ἐξῆλθεν πᾶσα ἡ δύναµις κυρίου ἐκ γῆς Αἰγύπτου.						
