book	chapter	chapter-zfilled	verse	testament	testament-indexed	section	section-indexed	section-indexed-no-testament	book-indexed	Bohairic	Sahidic	English	Greek	Fayyumic	Akhmimic	OldBohairic	Mesokemic	DialectP	Lycopolitan
Exodus	10	10	22	OT	1. OT	Pentateuch	1. Pentateuch	01. Pentateuch	02. Exodus	ⲟⲩⲟϩ ⲁ ⲙⲱⲩ̀ⲥⲏⲥ ⲥⲟⲩⲧⲉⲛ ⲧⲉϥϫⲓϫ ⲉ̀ⲡϣⲱⲓ ⲉ̀ⲧⲫⲉ ⲟⲩⲟϩ ⲁϥϣⲱⲡⲓ ⲛ̀ϫⲉ ⲟⲩⲭⲁⲕⲓ ⲛ̀ϫⲟⲙϫⲉⲙ ϩⲓϫⲉⲛ ⲡⲕⲁϩⲓ ⲧⲏⲣϥ ⲛ̀ⲭⲏⲙⲓ ⲛ̀ⲅ̅ ⲛ̀ⲉϩⲟⲟⲩ		And Moses stretched out his hand to heaven, and there was darkness very black, even a storm over all the land of Egypt three days.	ἐξέτεινεν δὲ Μωυσῆς τὴν χεῖρα εἰς τὸν οὐρανόν, καὶ ἐγένετο σκότος γνόφος θύελλα ἐπὶ πᾶσαν γῆν Αἰγύπτου τρεῖς ἡµέρας,						
Exodus	10	10	23	OT	1. OT	Pentateuch	1. Pentateuch	01. Pentateuch	02. Exodus	ⲟⲩⲟϩ ⲙ̀ⲡⲉ ϩⲗⲓ ⲛⲁⲩ ⲉ̀ⲡⲉϥⲥⲟⲛ ⲟⲩⲇⲉ ⲙ̀ⲡⲉ ϩⲗⲓ ⲧⲱⲛϥ ⲉ̀ⲃⲟⲗ ϩⲓϫⲉⲛ ⲡⲉϥⲙⲁⲛ̀ⲛⲕⲟⲧ ⲛ̀ⲅ̅ ⲛ̀ⲉϩⲟⲟⲩ ⲛⲉⲛϣⲏⲣⲓ ⲇⲉ ⲙ̀ⲡⲓⲥ̅ⲗ̅ ⲧⲏⲣⲟⲩ ⲛⲁⲣⲉ ⲫⲟⲩⲱⲓⲛⲓ ϣⲟⲡ ⲛⲱⲟⲩ ⲡⲉ ϧⲉⲛ ϩⲱⲃ ⲛⲓⲃⲉⲛ ⲉ̀ⲛⲁⲩϣⲟⲡ ⲛ̀ϧⲏⲧⲟⲩ ⲛ̀ϫⲉ ⲛⲉⲛϣⲏⲣⲓ ⲙ̀ⲡⲓⲥ̅ⲗ̅		And for three days no man saw his brother, and no man rose up from his bed for three days: but all the children of Israel had light in all the places where they were.	καὶ οὐκ εἶδεν οὐδεὶς τὸν ἀδελφὸν αὐτοῦ τρεῖς ἡµέρας, καὶ οὐκ ἐξανέστη οὐδεὶς ἐκ τῆς κοίτης αὐτοῦ τρεῖς ἡµέρας· πᾶσι δὲ τοῖς υἱοῖς Ισραηλ ἦν φῶς ἐν πᾶσιν, οἷς κατεγίνοντο.						
Exodus	10	10	24	OT	1. OT	Pentateuch	1. Pentateuch	01. Pentateuch	02. Exodus	ⲟⲩⲟϩ ⲁϥⲙⲟⲩϯ ⲛ̀ϫⲉ ⲫⲁⲣⲁⲱ ⲉ̀ⲙⲱⲩ̀ⲥⲏⲥ ⲛⲉⲙ ⲁⲁⲣⲱⲛ ⲉϥϫⲱ ⲙ̀ⲙⲟⲥ ϫⲉ ⲙⲁϣⲉ ⲛⲱⲧⲉⲛ ϣⲉⲙϣⲓ ⲙ̀ⲡϭ̅ⲥ̅ ⲡⲉⲧⲉⲛⲛⲟⲩϯ ⲡⲗⲏⲛ ⲛⲉⲧⲉⲛⲉⲥⲱⲟⲩ ⲛⲉⲙ ⲛⲉⲧⲉⲛⲉϩⲱⲟⲩ ⲉⲣⲉⲧⲉⲛⲉ̀ⲥⲟϫⲡⲟⲩ ⲟⲩⲟϩ ⲡⲉⲧⲉⲛⲥⲟⲃϯ ⲙⲁⲣⲉϥϣⲉ ⲛⲁϥ ⲛⲉⲙⲱⲧⲉⲛ		And Pharao called Moses and Aaron, saying, Go, serve the Lord your God, only leave your sheep and your oxen, and let your store depart with you.	καὶ ἐκάλεσεν Φαραω Μωυσῆν καὶ Ααρων λέγων Βαδίζετε, λατρεύσατε κυρίῳ τῷ θεῷ ὑµῶν· πλὴν τῶν προβάτων καὶ τῶν βοῶν ὑπολίπεσθε· καὶ ἡ ἀποσκευὴ ὑµῶν ἀποτρεχέτω µεθ’ ὑµῶν.						
Exodus	10	10	25	OT	1. OT	Pentateuch	1. Pentateuch	01. Pentateuch	02. Exodus	ⲟⲩⲟϩ ⲡⲉϫⲉ ⲙⲱⲩ̀ⲥⲏⲥ ϫⲉ ⲁⲗⲗⲁ ⲛⲉⲙ ⲛ̀ⲑⲟⲕ ϩⲱⲕ ⲉⲕⲉ̀ϯ ⲛⲁⲛ ⲛϩⲁⲛϭⲗⲓⲗ ⲛⲉⲙ ϩⲁⲛϣⲟⲩϣⲱⲟⲩϣⲓ ⲛⲏ ⲉⲧⲉⲛⲛⲁⲁⲓⲧⲟⲩ ⲙ̀ⲡϭ̅ⲥ̅ ⲡⲉⲛⲛⲟⲩϯ		And Moses said, Nay, but thou shalt give to us whole burnt-offerings and sacrifices, which we will sacrifice to the Lord our God.	καὶ εἶπεν Μωυσῆς Ἀλλὰ καὶ σὺ δώσεις ἡµῖν ὁλοκαυτώµατα καὶ θυσίας, ἃ ποιήσοµεν κυρίῳ τῷ θεῷ ἡµῶν,						
Exodus	10	10	26	OT	1. OT	Pentateuch	1. Pentateuch	01. Pentateuch	02. Exodus	ⲟⲩⲟϩ ⲛⲉⲛⲧⲉⲃⲛⲱⲟⲩⲓ ⲉⲩⲉ̀ⲙⲟϣⲓ ⲛⲉⲙⲁⲛ ⲟⲩⲟϩ ⲛ̀ⲛⲉⲛⲥⲉϫⲡ ⲟⲩϩⲓⲏⲃ ⲉ̀ⲃⲟⲗ ⲛ̀ϧⲏⲧⲟⲩ ⲁⲛⲛⲁϭⲓ ⲅⲁⲣ ⲉ̀ⲃⲟⲗ ⲛ̀ϧⲏⲧⲟⲩ ⲉ̀ⲡϣⲉⲙϣⲓ ⲙ̀ⲡϭ̅ⲥ̅ ⲡⲉⲛⲛⲟⲩϯ ⲁ̀ⲛⲟⲛ ⲇⲉ ⲧⲉⲛⲉⲙⲓ ⲁⲛ ϫⲉ ⲟⲩ ⲡⲉⲧⲉⲛⲛⲁϣⲉⲙϣⲓ ⲙ̀ⲙⲟϥ ⲙ̀ⲡϭ̅ⲥ̅ ⲡⲉⲛⲛⲟⲩϯ ϣⲁⲧⲉⲛϣⲉ ⲛⲁⲛ ⲉ̀ϧⲟⲩⲛ ⲉ̀ⲙⲁⲩ		And our cattle shall go with us, and we will not leave a hoof behind, for of them we will take to serve the Lord our God: but we know not in what manner we shall serve the Lord our God, until we arrive there.	καὶ τὰ κτήνη ἡµῶν πορεύσεται µεθ’ ἡµῶν, καὶ οὐχ ὑπολειψόµεθα ὁπλήν· ἀπ’ αὐτῶν γὰρ ληµψόµεθα λατρεῦσαι κυρίῳ τῷ θεῷ ἡµῶν· ἡµεῖς δὲ οὐκ οἴδαµεν, τί λατρεύσωµεν κυρίῳ τῷ θεῷ ἡµῶν, ἕως τοῦ ἐλθεῖν ἡµᾶς ἐκεῖ.						
Exodus	10	10	27	OT	1. OT	Pentateuch	1. Pentateuch	01. Pentateuch	02. Exodus	ⲁ ⲡϭ̅ⲥ̅ ⲇⲉ ⲑⲣⲉ ⲡϩⲏⲧ ⲙ̀ⲫⲁⲣⲁⲱ ⲛ̀ϣⲟⲧ ⲟⲩⲟϩ ⲙ̀ⲡⲉϥⲟⲩⲱϣ ⲉ̀ⲟⲩⲟⲣⲡⲟⲩ ⲉ̀ⲃⲟⲗ		But the Lord hardened the heart of Pharao, and he would not let them go.	ἐσκλήρυνεν δὲ κύριος τὴν καρδίαν Φαραω, καὶ οὐκ ἐβουλήθη ἐξαποστεῖλαι αὐτούς.						
Exodus	10	10	28	OT	1. OT	Pentateuch	1. Pentateuch	01. Pentateuch	02. Exodus	ⲟⲩⲟϩ ⲡⲉϫⲉ ⲫⲁⲣⲁⲱ ϫⲉ ⲙⲁϣⲉ ⲛⲁⲕ ⲉ̀ⲃⲟⲗ ϩⲁⲣⲟⲓ ⲙⲁϩⲑⲏⲕ ⲉ̀ⲣⲟⲕ ⲙ̀ⲡⲉⲣⲟⲩⲁϩⲧⲟⲧⲕ ϫⲉ ⲉ̀ⲛⲁⲩ ⲉ̀ⲡⲁϩⲟ ⲡⲓⲉ̀ϩⲟⲟⲩ ⲇⲉ ⲉⲧⲉⲕⲛⲁⲛⲁⲩ ⲉ̀ⲣⲟⲓ ⲛ̀ϧⲏⲧϥ ⲭⲛⲁⲙⲟⲩ		And Pharao says, Depart from me, beware of seeing my face again, for in what day thou shalt appear before me, thou shalt die.	καὶ λέγει Φαραω Ἄπελθε ἀπ’ ἐµοῦ, πρόσεχε σεαυτῷ ἔτι προσθεῖναι ἰδεῖν µου τὸ πρόσωπον· ᾗ δ’ ἂν ἡµέρᾳ ὀφθῇς µοι, ἀποθανῇ.						
Exodus	10	10	29	OT	1. OT	Pentateuch	1. Pentateuch	01. Pentateuch	02. Exodus	ⲟⲩⲟϩ ⲡⲉϫⲉ ⲙⲱⲩ̀ⲥⲏⲥ ϫⲉ ⲁⲕϫⲟⲥ ϫⲉ ⲛ̀ⲛⲁⲟⲩⲁϩⲧⲟⲧ ϫⲉ ⲙ̀ⲡⲉⲕⲙ̀ⲑⲟ		And Moses says, Thou hast said, I will not appear in thy presence again.	λέγει δὲ Μωυσῆς Εἴρηκας· οὐκέτι ὀφθήσοµαί σοι εἰς πρόσωπον.						
Exodus	11	11	1	OT	1. OT	Pentateuch	1. Pentateuch	01. Pentateuch	02. Exodus	ⲡⲉϫⲉ ⲡϭ̅ⲥ̅ ⲇⲉ ⲙ̀ⲙⲱⲩ̀ⲥⲏⲥ ϫⲉ ⲉⲧⲓ ⲕⲉⲉⲣϧⲟⲧ ⲙ̀ⲙⲁⲩⲁⲧϥ ⲉϯⲛⲁⲉⲛϥ ⲉ̀ϫⲉⲛ ⲫⲁⲣⲁⲱ ⲛⲉⲙ ⲉ̀ϫⲉⲛ ⲭⲏⲙⲓ ⲟⲩⲟϩ ⲙⲉⲛⲉⲛⲥⲁ ⲛⲁⲓ ⲉϥⲉ̀ⲟⲩⲟⲣⲡ ⲑⲏⲛⲟⲩ ⲉ̀ⲃⲟⲗ ⲧⲁⲓ ϩⲟⲧⲁⲛ ⲇⲉ ⲁϥϣⲁⲛⲟⲩⲟⲣⲡ ⲑⲏⲛⲟⲩ ⲉ̀ⲃⲟⲗ ⲉϥⲉ̀ϩⲓ ⲑⲏⲛⲟⲩ ⲉ̀ⲃⲟⲗ ⲛⲉⲙ ϩⲱⲃ ⲛⲓⲃⲉⲛ ϧⲉⲛ ⲟⲩϩⲓⲟⲩⲓ ⲉ̀ⲃⲟⲗ		And the Lord said to Moses, I will yet bring one plague upon Pharao and upon Egypt, and after that he will send you forth thence; and whenever he sends you forth with every thing, he will indeed drive you out.	Εἶπεν δὲ κύριος πρὸς Μωυσῆν Ἔτι µίαν πληγὴν ἐπάξω ἐπὶ Φαραω καὶ ἐπ’ Αἴγυπτον, καὶ µετὰ ταῦτα ἐξαποστελεῖ ὑµᾶς ἐντεῦθεν· ὅταν δὲ ἐξαποστέλλῃ ὑµᾶς, σὺν παντὶ ἐκβαλεῖ ὑµᾶς ἐκβολῇ.						
Exodus	11	11	2	OT	1. OT	Pentateuch	1. Pentateuch	01. Pentateuch	02. Exodus	ⲥⲁϫⲓ ⲟⲩⲛ ⲛⲭⲱⲡ ϧⲉⲛ ⲛⲉⲛⲙⲁϣϫ ⲙⲡⲓⲗⲁⲟⲥ ⲟⲩⲟϩ ⲙⲁⲣⲉ ⲫⲟⲩⲁⲓ ⲫⲟⲩⲁⲓ ⲉⲣⲉⲧⲓⲛ ⲛ̀ⲧⲉⲛ ⲡⲉϥϣⲫⲏⲣ ⲟⲩⲟϩ ⲟⲩⲥϩⲓⲙⲓ ⲛ̀ⲧⲉⲛ ⲧⲉⲥϣⲫⲉⲣⲓ ⲛ̀ϩⲁⲛⲥⲕⲉⲩⲟⲥ ⲛ̀ϩⲁⲧ ⲛⲉⲙ ϩⲁⲛⲛⲟⲩⲃ ⲛⲉⲙ ⲟⲩϭⲓϩⲃⲟⲥ		Speak therefore secretly in the ears of the people, and let every one ask of his neighbour jewels of silver and gold, and raiment.	λάλησον οὖν κρυφῇ εἰς τὰ ὦτα τοῦ λαοῦ, καὶ αἰτησάτω ἕκαστος παρὰ τοῦ πλησίον καὶ γυνὴ παρὰ τῆς πλησίον σκεύη ἀργυρᾶ καὶ χρυσᾶ καὶ ἱµατισµόν.						
Exodus	11	11	3	OT	1. OT	Pentateuch	1. Pentateuch	01. Pentateuch	02. Exodus	ⲡϭ̅ⲥ̅ ⲇⲉ ⲁϥϯ ⲛ̀ⲟⲩϩⲙⲟⲧ ⲙ̀ⲡⲉϥⲗⲁⲟⲥ ⲙ̀ⲡⲉⲙ̀ⲑⲟ ⲛ̀ⲛⲓⲣⲉⲙⲛ̀ⲭⲏⲙⲓ ⲟⲩⲟϩ ⲁⲩⲧⲉⲛϩⲟⲩⲧⲟⲩ ⲟⲩⲟϩ ⲡⲓⲣⲱⲙⲓ ϫⲉ ⲙⲱⲩ̀ⲥⲏⲥ ⲁϥⲉⲣⲛⲓϣϯ ⲉ̀ⲙⲁϣⲱ ⲙ̀ⲡⲉⲙ̀ⲑⲟ ⲙ̀ⲫⲁⲣⲁⲱ ⲛⲉⲙ ⲡⲉⲙ̀ⲑⲟ ⲛ̀ⲛⲉϥⲁⲗⲱⲟⲩⲓ		And the Lord gave his people favour in the sight of the Egyptians, and they lent to them; and the man Moses was very great before the Egyptians, and before Pharao, and before his servants.	κύριος δὲ ἔδωκεν τὴν χάριν τῷ λαῷ αὐτοῦ ἐναντίον τῶν Αἰγυπτίων, καὶ ἔχρησαν αὐτοῖς· καὶ ὁ ἄνθρωπος Μωυσῆς µέγας ἐγενήθη σφόδρα ἐναντίον τῶν Αἰγυπτίων καὶ ἐναντίον Φαραω καὶ ἐναντίον πάντων τῶν θεραπόντων αὐτοῦ.						
Exodus	11	11	4	OT	1. OT	Pentateuch	1. Pentateuch	01. Pentateuch	02. Exodus	ⲟⲩⲟϩ ⲡⲉϫⲁϥ ⲛ̀ϫⲉ ⲙⲱⲩ̀ⲥⲏⲥ ϫⲉ ⲛⲁⲓ ⲛⲉ ⲛⲏ ⲉⲧⲁϥϫⲱ ⲙ̀ⲙⲱⲟⲩ ⲛ̀ϫⲉ ⲡϭ̅ⲥ̅ ϫⲉ ⲛ̀ϧⲣⲏⲓ ϧⲉⲛ ⲧⲫⲁϣⲓ ⲙ̀ⲡⲓⲉϫⲱⲣϩ ⲁ̀ⲛⲟⲕ ϯⲛⲁⲓ ⲉ̀ϧⲟⲩⲛ ϧⲉⲛ ⲑⲙⲏϯ ⲛ̀ⲭⲏⲙⲓ		And Moses said, These things saith the Lord, About midnight I go forth into the midst of Egypt.	Καὶ εἶπεν Μωυσῆς Τάδε λέγει κύριος Περὶ µέσας νύκτας ἐγὼ εἰσπορεύοµαι εἰς µέσον Αἰγύπτου,						
Exodus	11	11	5	OT	1. OT	Pentateuch	1. Pentateuch	01. Pentateuch	02. Exodus	ⲟⲩⲟϩ ⲉⲩⲉ̀ⲙⲟⲩ ⲛ̀ϫⲉ ϣⲁⲙⲓⲥⲓ ⲛⲓⲃⲉⲛ ⲉⲧⲉ ⲛ̀ϩⲣⲏⲓ ϧⲉⲛ ⲡⲕⲁϩⲓ ⲛ̀ⲭⲏⲙⲓ ⲓⲥϫⲉⲛ ⲡϣⲟⲣⲡ ⲙ̀ⲙⲓⲥⲓ ⲙ̀ⲫⲁⲣⲁⲱ ⲫⲏ ⲉⲧϩⲉⲙⲥⲓ ϩⲓϫⲉⲛ ⲡⲓⲑⲣⲟⲛⲟⲥ ϣⲁ ⲡϣⲟⲣⲡ ⲙ̀ⲙⲓⲥⲓ ⲛ̀ϯⲃⲱⲕⲓ ⲑⲏ ⲉⲧϩⲉⲙⲥⲓ ϧⲁⲧⲉⲛ ϯⲙⲟⲩⲗⲟⲛ ⲛⲉⲙ ϣⲁ ⲡϣⲟⲣⲡ ⲙ̀ⲙⲓⲥⲓ ⲛ̀ⲧⲉⲃⲛⲏ ⲛⲓⲃⲉⲛ		And every first-born in the land of Egypt shall die, from the first-born of Pharao that sits on the throne, even to the first-born of the woman-servant that is by the mill, and to the first-born of all cattle.	καὶ τελευτήσει πᾶν πρωτότοκον ἐν γῇ Αἰγύπτῳ ἀπὸ πρωτοτόκου Φαραω, ὃς κάθηται ἐπὶ τοῦ θρόνου, καὶ ἕως πρωτοτόκου τῆς θεραπαίνης τῆς παρὰ τὸν µύλον καὶ ἕως πρωτοτόκου παντὸς κτήνους,						
Exodus	11	11	6	OT	1. OT	Pentateuch	1. Pentateuch	01. Pentateuch	02. Exodus	ⲟⲩⲟϩ ⲉⲣⲉ ⲟⲩⲛⲓϣϯ ⲛ̀ϧⲣⲱⲟⲩ ϣⲱⲡⲓ ϧⲉⲛ ⲡⲕⲁϩⲓ ⲧⲏⲣϥ ⲛ̀ⲭⲏⲙⲓ ⲫⲁⲓ ⲉⲧⲉ ⲙ̀ⲡⲉ ⲟⲩⲟⲛ ϣⲱⲡⲓ ⲙ̀ⲡⲉϥⲣⲏϯ ⲟⲩⲟϩ ⲛ̀ⲛⲉ ⲟⲩⲟⲛ ⲙ̀ⲡⲁⲓⲣⲏϯ ⲟⲩⲁϩⲧⲟⲧϥ ⲉ̀ϣⲱⲡⲓ ⲙ̀ⲡⲉϥⲣⲏϯ		And there shall be a great cry through all the land of Egypt, such as has not been, and such shall not be repeated any more.	καὶ ἔσται κραυγὴ µεγάλη κατὰ πᾶσαν γῆν Αἰγύπτου, ἥτις τοιαύτη οὐ γέγονεν καὶ τοιαύτη οὐκέτι προστεθήσεται.						
Exodus	11	11	7	OT	1. OT	Pentateuch	1. Pentateuch	01. Pentateuch	02. Exodus	ⲛ̀ϧⲣⲏⲓ ⲇⲉ ϧⲉⲛ ⲛⲉⲛϣⲏⲣⲓ ⲙ̀ⲡⲓⲥ̅ⲗ̅ ⲛ̀ⲛⲉ ⲟⲩⲟⲩϩⲟⲣ ⲟⲩⲁϩϥ ⲙ̀ⲡⲉϥⲗⲁⲥ ⲓⲥϫⲉⲛ ⲫⲣⲱⲙⲓ ϣⲁ ⲡⲧⲉⲃⲛⲏ ϩⲟⲡⲱⲥ ⲛ̀ⲧⲉⲕⲛⲁⲩ ⲉ̀ϩⲱⲃ ⲛⲓⲃⲉⲛ ⲉⲧⲉ ⲡϭ̅ⲥ̅ ⲛⲁϭⲓⲱⲟⲩ ⲛ̀ϧⲏⲧⲟⲩ ⲟⲩⲧⲉ ⲛⲓⲣⲉⲙⲛ̀ⲭⲏⲙⲓ ⲛⲉⲙ ⲟⲩⲧⲉ ⲡⲓⲥ̅ⲗ̅		But among all the children of Israel shall not a dog snarl with his tongue, either at man or beast; that thou mayest know how wide a distinction the Lord will make between the Egyptians and Israel.	καὶ ἐν πᾶσι τοῖς υἱοῖς Ισραηλ οὐ γρύξει κύων τῇ γλώσσῃ αὐτοῦ ἀπὸ ἀνθρώπου ἕως κτήνους, ὅπως εἰδῇς ὅσα παραδοξάσει κύριος ἀνὰ µέσον τῶν Αἰγυπτίων καὶ τοῦ Ισραηλ.						
Exodus	11	11	8	OT	1. OT	Pentateuch	1. Pentateuch	01. Pentateuch	02. Exodus	ⲟⲩⲟϩ ⲉⲩⲉ̀ⲓ̀ ⲉ̀ϧⲣⲏⲓ ϩⲁⲣⲟⲓ ⲛ̀ϫⲉ ⲛⲉⲕⲁⲗⲱⲟⲩⲓ ⲧⲏⲣⲟⲩ ⲛⲁⲓ ⲟⲩⲟϩ ⲉⲩⲉ̀ⲟⲩⲱϣⲧ ⲙ̀ⲙⲟⲓ ⲉⲩϫⲱ ⲙ̀ⲙⲟⲥ ϫⲉ ⲙⲁϣⲉ ⲛⲁⲕ ⲛ̀ⲑⲟⲕ ⲛⲉⲙ ⲡⲉⲕⲗⲁⲟⲥ ⲫⲏ ⲛ̀ⲑⲟⲕ ⲉⲧⲉⲕⲙⲟϣⲓ ϧⲁϫⲱϥ ⲟⲩⲟϩ ⲙⲉⲛⲉⲛⲥⲁ ⲛⲁⲓ ⲉⲓⲉ̀ϣⲉ ⲛⲏⲓ ⲁϥⲓ̀ ⲇⲉ ⲛ̀ϫⲉ ⲙⲱⲩ̀ⲥⲏⲥ ⲉ̀ⲃⲟⲗ ϩⲁ ⲡϩⲟ ⲙ̀ⲫⲁⲣⲁⲱ ϧⲉⲛ ⲟⲩⲙ̀ⲃⲟⲛ		And all these thy servants shall come down to me, and do me reverence, saying, Go forth, thou and all the people over whom thou presidest, and afterwards I will go forth.	καὶ καταβήσονται πάντες οἱ παῖδές σου οὗτοι πρός µε καὶ προσκυνήσουσίν µε λέγοντες Ἔξελθε σὺ καὶ πᾶς ὁ λαός σου, οὗ σὺ ἀφηγῇ· καὶ µετὰ ταῦτα ἐξελεύσοµαι. ἐξῆλθεν δὲ Μωυσῆς ἀπὸ Φαραω µετὰ θυµοῦ.						
Exodus	11	11	9	OT	1. OT	Pentateuch	1. Pentateuch	01. Pentateuch	02. Exodus	ⲡⲉϫⲉ ⲡϭ̅ⲥ̅ ⲇⲉ ⲙ̀ⲙⲱⲩ̀ⲥⲏⲥ ϫⲉ ⲫⲁⲣⲁⲱ ⲛⲁⲥⲱⲧⲉⲙ ⲛ̀ⲥⲁ ⲑⲏⲛⲟⲩ ⲁⲛ ϩⲓⲛⲁ ⲛ̀ⲧⲁⲑⲣⲉ ⲛ̀ⲁⲙⲏⲓⲛⲓ ⲛⲉⲙ ⲛⲁϣⲫⲏⲣⲓ ⲁϣⲁⲓ ϧⲉⲛ ⲡⲕⲁϩⲓ ⲛ̀ⲭⲏⲙⲓ		And Moses went forth from Pharao with wrath. And the Lord said to Moses, Pharao will not hearken to you, that I may greatly multiply my signs and wonders in the land of Egypt.	εἶπεν δὲ κύριος πρὸς Μωυσῆν Οὐκ εἰσακούσεται ὑµῶν Φαραω, ἵνα πληθύνων πληθύνω µου τὰ σηµεῖα καὶ τὰ τέρατα ἐν γῇ Αἰγύπτῳ.						
Exodus	11	11	10	OT	1. OT	Pentateuch	1. Pentateuch	01. Pentateuch	02. Exodus	ⲙⲱⲩ̀ⲥⲏⲥ ⲇⲉ ⲛⲉⲙ ⲁⲁⲣⲱⲛ ⲁⲩⲓⲣⲓ ⲛ̀ⲛⲁⲓⲙⲏⲓⲛⲓ ⲛⲉⲙ ⲛⲁⲓϣⲫⲏⲣⲓ ⲙ̀ⲡⲉⲙ̀ⲑⲟ ⲙ̀ⲫⲁⲣⲁⲱ ⲁ ⲡϭ̅ⲥ̅ ⲇⲉ ⲑⲣⲉ ⲡϩⲏⲧ ⲙ̀ⲫⲁⲣⲁⲱ ⲛ̀ϣⲟⲧ ⲟⲩⲟϩ ⲙ̀ⲡⲉϥⲟⲩⲱϣ ⲉ̀ⲟⲩⲱⲣⲡ ⲛ̀ⲛⲉⲛϣⲏⲣⲓ ⲙ̀ⲡⲓⲥ̅ⲗ̅ ⲉ̀ⲃⲟⲗ ϧⲉⲛ ⲡⲕⲁϩⲓ ⲛ̀ⲭⲏⲙⲓ		And Moses and Aaron wrought all these signs and wonders in the land of Egypt before Pharao; and the Lord hardened the heart of Pharao, and he did not hearken to send forth the children of Israel out of the land of Egypt.	Μωυσῆς δὲ καὶ Ααρων ἐποίησαν πάντα τὰ σηµεῖα καὶ τὰ τέρατα ταῦτα ἐν γῇ Αἰγύπτῳ ἐναντίον Φαραω· ἐσκλήρυνεν δὲ κύριος τὴν καρδίαν Φαραω, καὶ οὐκ ἠθέλησεν ἐξαποστεῖλαι τοὺς υἱοὺς Ισραηλ ἐκ γῆς Αἰγύπτου.						
Exodus	12	12	1	OT	1. OT	Pentateuch	1. Pentateuch	01. Pentateuch	02. Exodus	ⲡⲉϫⲉ ⲡϭ̅ⲥ̅ ⲇⲉ ⲙ̀ⲙⲱⲩ̀ⲥⲏⲥ ⲛⲉⲙ ⲁⲁⲣⲱⲛ ϧⲉⲛ ⲡⲕⲁϩⲓ ⲛ̀ⲭⲏⲙⲓ ⲉϥϫⲱ ⲙ̀ⲙⲟⲥ		And the Lord spoke to Moses and Aaron in the land of Egypt, saying,	Εἶπεν δὲ κύριος πρὸς Μωυσῆν καὶ Ααρων ἐν γῇ Αἰγύπτου λέγων						
Exodus	12	12	2	OT	1. OT	Pentateuch	1. Pentateuch	01. Pentateuch	02. Exodus	ϫⲉ ⲡⲁⲓⲁⲃⲟⲧ ⲫⲁⲓ ⲧⲁⲣⲭⲏ ⲛ̀ⲧⲉ ⲛⲓⲉⲃⲏⲧ ⲛⲱⲧⲉⲛ ⲡⲉ ⲫⲁⲓ ⲡⲓϩⲟⲩⲓⲧ ⲛ̀ⲁⲃⲟⲧ ⲛⲱⲧⲉⲛ ⲡⲉ ϧⲉⲛ ⲛⲓⲉⲃⲏⲧ ⲛ̀ⲧⲉ ϯⲣⲟⲙⲡⲓ		This month shall be to you the beginning of months: it is the first to you among the months of the year.	Ὁ µὴν οὗτος ὑµῖν ἀρχὴ µηνῶν, πρῶτός ἐστιν ὑµῖν ἐν τοῖς µησὶν τοῦ ἐνιαυτοῦ.						
Exodus	12	12	3	OT	1. OT	Pentateuch	1. Pentateuch	01. Pentateuch	02. Exodus	ⲥⲁϫⲓ ⲛⲉⲙ ϯⲥⲩⲛⲁⲅⲱⲅⲏ ⲧⲏⲣⲥ ⲛ̀ⲧⲉ ⲛⲉⲛϣⲏⲣⲓ ⲧⲏⲣⲟⲩ ⲙ̀ⲡⲓⲥ̅ⲗ̅ ⲉⲕϫⲱ ⲙ̀ⲙⲟⲥ ϫⲉ ⲛ̀ϧⲣⲏⲓ ϧⲉⲛ ⲥⲟⲩⲓ ⲙ̀ⲡⲓⲁⲃⲟⲧ ⲙⲁⲣⲉ ⲡⲓⲟⲩⲁⲓ ⲡⲓⲟⲩⲁⲓ ϭⲓ ⲛⲁϥ ⲛ̀ⲟⲩⲉⲥⲱⲟⲩ ⲕⲁⲧⲁ ⲛⲉⲛⲏⲟⲩ ⲛ̀ⲛⲟⲩⲓⲟϯ ⲟⲩⲉⲥⲱⲟⲩ ⲕⲁⲧⲁ ⲏⲓ		Speak to all the congregation of the children of Israel, saying, On the tenth of this month let them take each man a lamb according to the houses of their families, every man a lamb for his household.	λάλησον πρὸς πᾶσαν συναγωγὴν υἱῶν Ισραηλ λέγων Τῇ δεκάτῃ τοῦ µηνὸς τούτου λαβέτωσαν ἕκαστος πρόβατον κατ’ οἴκους πατριῶν, ἕκαστος πρόβατον κατ’ οἰκίαν.						
Exodus	12	12	4	OT	1. OT	Pentateuch	1. Pentateuch	01. Pentateuch	02. Exodus	ⲉ̀ϣⲱⲡ ⲇⲉ ⲉⲩⲥⲃⲟⲕ ⲛ̀ϫⲉ ⲛⲏ ⲉⲧϧⲉⲛ ⲡⲓⲏⲓ ϩⲱⲥⲧⲉ ⲉ̀ϣ̀ⲧⲉⲙⲣⲱϣⲓ ⲉ̀ⲡⲓⲉⲥⲱⲟⲩ ⲉϥⲉ̀ϭⲓ ⲙ̀ⲡⲉϥⲑⲉϣⲉ ⲛⲉⲙⲁϥ ⲛⲉⲙ ⲡⲉϥϣⲫⲏⲣ ⲕⲁⲧⲁ ⲛⲓⲏⲡⲓ ⲙ̀ⲯⲩⲭⲏ ⲫⲟⲩⲁⲓ ⲫⲟⲩⲁⲓ ⲙ̀ⲡⲉϥⲣⲱϣⲓ ⲉϥⲉ̀ϭⲓⲏⲡⲓ ⲙ̀ⲙⲟϥ ⲉ̀ⲟⲩⲉⲥⲱⲟⲩ		And if they be few in a household, so that there are not enough for the lamb, he shall take with himself his neighbour that lives near to him, —as to the number of souls, every one according to that which suffices him shall make a reckoning for the lamb.	ἐὰν δὲ ὀλιγοστοὶ ὦσιν οἱ ἐν τῇ οἰκίᾳ ὥστε µὴ ἱκανοὺς εἶναι εἰς πρόβατον, συλλήµψεται µεθ’ ἑαυτοῦ τὸν γείτονα τὸν πλησίον αὐτοῦ κατὰ ἀριθµὸν ψυχῶν· ἕκαστος τὸ ἀρκοῦν αὐτῷ συναριθµήσεται εἰς πρόβατον.						
Exodus	12	12	5	OT	1. OT	Pentateuch	1. Pentateuch	01. Pentateuch	02. Exodus	ⲟⲩⲉⲥⲱⲟⲩ ⲛ̀ϩⲱⲟⲩⲧ ⲉϥϫⲏⲕ ⲉ̀ⲃⲟⲗ ⲉ̀ⲁϥⲉⲣⲟⲩⲣⲟⲙⲡⲓ ⲉϥⲉ̀ϣⲱⲡⲓ ⲛⲱⲧⲉⲛ ⲉ̀ⲃⲟⲗ ϧⲉⲛ ⲛⲓϩⲓⲏⲃ ⲛⲉⲙ ⲉ̀ⲃⲟⲗ ϧⲉⲛ ⲛⲓⲃⲁⲉⲙⲡⲓ ⲉⲣⲉⲧⲉⲛⲉ̀ϭⲓ		It shall be to you a lamb unblemished, a male of a year old: ye shall take it of the lambs and the kids.	πρόβατον τέλειον ἄρσεν ἐνιαύσιον ἔσται ὑµῖν· ἀπὸ τῶν ἀρνῶν καὶ τῶν ἐρίφων λήµψεσθε.						
Exodus	12	12	6	OT	1. OT	Pentateuch	1. Pentateuch	01. Pentateuch	02. Exodus	ⲟⲩⲟϩ ⲉϥⲉ̀ϣⲱⲡⲓ ⲉⲩⲁⲣⲉϩ ⲉ̀ⲣⲟϥ ⲛⲱⲧⲉⲛ ϣⲁ ⲥⲟⲩⲓ̅ⲇ̅ ⲙ̀ⲡⲓⲁⲃⲟⲧ ⲟⲩⲟϩ ⲉⲩⲉ̀ϣⲁⲧϥ ⲛ̀ϫⲉ ⲡⲓⲙⲏϣ ⲧⲏⲣϥ ⲛ̀ⲧⲉ ϯⲥⲩⲛⲁⲅⲱⲅⲏ ⲛ̀ⲧⲉ ⲛⲉⲛϣⲏⲣⲓ ⲙ̀ⲡⲓⲥ̅ⲗ̅ ⲙ̀ⲫⲛⲁⲩ ⲛ̀ⲣⲟⲩϩⲓ		And it shall be kept by you till the fourteenth of this month, and all the multitude of the congregation of the children of Israel shall kill it toward evening.	καὶ ἔσται ὑµῖν διατετηρηµένον ἕως τῆς τεσσαρεσκαιδεκάτης τοῦ µηνὸς τούτου, καὶ σφάξουσιν αὐτὸ πᾶν τὸ πλῆθος συναγωγῆς υἱῶν Ισραηλ πρὸς ἑσπέραν.						
Exodus	12	12	7	OT	1. OT	Pentateuch	1. Pentateuch	01. Pentateuch	02. Exodus	ⲟⲩⲟϩ ⲉⲩⲉ̀ϭⲓ ⲉ̀ⲃⲟⲗ ϧⲉⲛ ⲡⲓⲥⲛⲟϥ ⲟⲩⲟϩ ⲉⲩⲉ̀ⲭⲱ ϩⲓϫⲉⲛ ϯⲟⲩⲉϫⲣⲟ ⲃ̅ϯ ⲛⲉⲙ ϩⲓϫⲉⲛ ⲛⲓⲑⲟⲩⲁⲓ ϧⲉⲛ ⲛⲓⲏⲓ ⲉⲧⲟⲩⲛⲁⲟⲩⲟⲙⲟⲩ ⲛ̀ϧⲏⲧⲟⲩ		And they shall take of the blood, and shall put it on the two door-posts, and on the lintel, in the houses in which soever they shall eat them.	καὶ λήµψονται ἀπὸ τοῦ αἵµατος καὶ θήσουσιν ἐπὶ τῶν δύο σταθµῶν καὶ ἐπὶ τὴν φλιὰν ἐν τοῖς οἴκοις, ἐν οἷς ἐὰν φάγωσιν αὐτὰ ἐν αὐτοῖς.						
Exodus	12	12	8	OT	1. OT	Pentateuch	1. Pentateuch	01. Pentateuch	02. Exodus	ⲟⲩⲟϩ ⲉⲩⲉ̀ⲟⲩⲱⲙ ⲛ̀ⲛⲓⲁϥ ⲛ̀ϩⲣⲏⲓ ϧⲉⲛ ⲡⲁⲓⲉϫⲱⲣϩ ⲉⲩⲫⲟⲥⲓ ϧⲉⲛ ⲟⲩⲭⲣⲱⲙ ⲟⲩⲟϩ ϩⲁⲛⲁⲧϣⲉⲙⲏⲣ ϩⲓ ϣⲁⲛϣⲁϣⲓ ⲉⲩⲉ̀ⲟⲩⲟⲙⲟⲩ		And they shall eat the flesh in this night roast with fire, and they shall eat unleavened bread with bitter herbs.	καὶ φάγονται τὰ κρέα τῇ νυκτὶ ταύτῃ· ὀπτὰ πυρὶ καὶ ἄζυµα ἐπὶ πικρίδων ἔδονται.						
Exodus	12	12	9	OT	1. OT	Pentateuch	1. Pentateuch	01. Pentateuch	02. Exodus	ⲛ̀ⲛⲉⲧⲉⲛⲟⲩⲱⲙ ⲉ̀ⲃⲟⲗ ⲛ̀ϧⲏⲧⲟⲩ ⲉϥⲟⲩⲱⲧ ⲟⲩⲇⲉ ⲉϥⲫⲟⲥⲓ ϧⲉⲛ ⲟⲩⲙⲱⲟⲩ ⲁⲗⲗⲁ ⲉϥϫⲉϥϫⲱϥ ϧⲉⲛ ⲟⲩⲭⲣⲱⲙ ϯⲁⲫⲉ ⲇⲉ ⲛⲉⲙ ⲛⲓϭⲁⲗⲁⲩϫ ⲛⲉⲙ ⲛⲏ ⲉⲧⲥⲁϧⲟⲩⲛ		Ye shall not eat of it raw nor sodden in water, but only roast with fire, the head with the feet and the appurtenances.	οὐκ ἔδεσθε ἀπ’ αὐτῶν ὠµὸν οὐδὲ ἡψηµένον ἐν ὕδατι, ἀλλ’ ἢ ὀπτὰ πυρί, κεφαλὴν σὺν τοῖς ποσὶν καὶ τοῖς ἐνδοσθίοις.						
Exodus	12	12	10	OT	1. OT	Pentateuch	1. Pentateuch	01. Pentateuch	02. Exodus	ⲛ̀ⲛⲉⲧⲉⲛⲭⲱ ⲉ̀ⲃⲟⲗ ⲙ̀ⲙⲟϥ ⲉ̀ⲥⲱϫⲡ ⲉ̀ϣⲱⲣⲡ ⲟⲩⲟϩ ⲟⲩⲕⲁⲥ ⲛ̀ⲛⲉⲧⲉⲛⲕⲁϣϥ ⲉ̀ⲃⲟⲗ ⲙ̀ⲙⲟϥ ⲛⲏ ⲇⲉ ⲉⲑⲛⲁⲥⲱϫⲡ ⲉ̀ⲃⲟⲗ ⲙ̀ⲙⲟϥ ⲉ̀ϣⲱⲣⲡ ⲉⲣⲉⲧⲉⲛⲉ̀ⲣⲟⲕϩⲟⲩ ϧⲉⲛ ⲟⲩⲭⲣⲱⲙ		Nothing shall be left of it till the morning, and a bone of it ye shall not break; but that which is left of it till the morning ye shall burn with fire.	οὐκ ἀπολείψετε ἀπ’ αὐτοῦ ἕως πρωὶ καὶ ὀστοῦν οὐ συντρίψετε ἀπ’ αὐτοῦ· τὰ δὲ καταλειπόµενα ἀπ’ αὐτοῦ ἕως πρωὶ ἐν πυρὶ κατακαύσετε.						
Exodus	12	12	11	OT	1. OT	Pentateuch	1. Pentateuch	01. Pentateuch	02. Exodus	ⲉⲣⲉⲧⲉⲛⲉ̀ⲟⲩⲟⲙⲟⲩ ⲇⲉ ⲙ̀ⲡⲁⲓⲣⲏϯ ⲉⲩⲙⲏⲣ ⲛ̀ϫⲉ ⲛⲉⲧⲉⲛϯⲡⲓ ⲟⲩⲟϩ ⲛⲉⲧⲉⲛⲑⲱⲟⲩⲓ ⲉⲩϧⲉⲛ ⲛⲉⲧⲉⲛϭⲁⲗⲁⲩϫ ⲟⲩⲟϩ ⲛⲉⲧⲉⲛϣⲃⲟϯ ⲉⲩϧⲉⲛ ⲛⲉⲧⲉⲛϫⲓϫ ⲟⲩⲟϩ ⲉⲣⲉⲧⲉⲛⲉ̀ⲟⲩⲟⲙϥ ϧⲉⲛ ⲟⲩⲓⲱⲥ ⲟⲩⲡⲁⲥⲭⲁ ⲙ̀ⲡϭ̅ⲥ̅ ⲡⲉ		And thus shall ye eat it: your loins girded, and your sandals on your feet, and your staves in your hands, and ye shall eat it in haste. It is a passover to the Lord.	οὕτως δὲ φάγεσθε αὐτό· αἱ ὀσφύες ὑµῶν περιεζωσµέναι, καὶ τὰ ὑποδήµατα ἐν τοῖς ποσὶν ὑµῶν, καὶ αἱ βακτηρίαι ἐν ταῖς χερσὶν ὑµῶν· καὶ ἔδεσθε αὐτὸ µετὰ σπουδῆς· πασχα ἐστὶν κυρίῳ.						
Exodus	12	12	12	OT	1. OT	Pentateuch	1. Pentateuch	01. Pentateuch	02. Exodus	ⲟⲩⲟϩ ⲉⲓⲉ̀ⲥⲓⲛⲓ ϧⲉⲛ ⲡⲕⲁϩⲓ ⲛ̀ⲭⲏⲙⲓ ϧⲉⲛ ⲡⲁⲓⲉϫⲱⲣϩ ⲟⲩⲟϩ ⲉⲓⲉ̀ϣⲁⲣⲓ ⲉ̀ϣⲁⲙⲓⲥⲓ ⲛⲓⲃⲉⲛ ⲉⲧⲉ ⲛ̀ϧⲣⲏⲓ ϧⲉⲛ ⲡⲕⲁϩⲓ ⲛ̀ⲭⲏⲙⲓ ⲓⲥϫⲉⲛ ⲫⲣⲱⲙⲓ ϣⲁ ⲡⲧⲉⲃⲛⲏ ⲟⲩⲟϩ ⲛ̀ϩⲣⲏⲓ ϧⲉⲛ ⲛⲓⲛⲟⲩϯ ⲧⲏⲣⲟⲩ ⲛ̀ⲧⲉ ⲛⲓⲣⲉⲙⲛ̀ⲭⲏⲙⲓ ⲉⲓⲉ̀ⲓⲣⲓ ⲙ̀ⲡⲓϭⲓⲙ̀ⲡϣⲓϣ ⲁ̀ⲛⲟⲕ ⲡϭ̅ⲥ̅		and I will go throughout the land of Egypt in that night, and will smite every first-born in the land of Egypt both man and beast, and on all the gods of Egypt will I execute vengeance: I am the Lord.	καὶ διελεύσοµαι ἐν γῇ Αἰγύπτῳ ἐν τῇ νυκτὶ ταύτῃ καὶ πατάξω πᾶν πρωτότοκον ἐν γῇ Αἰγύπτῳ ἀπὸ ἀνθρώπου ἕως κτήνους καὶ ἐν πᾶσι τοῖς θεοῖς τῶν Αἰγυπτίων ποιήσω τὴν ἐκδίκησιν· ἐγὼ κύριος.						
