book	chapter	chapter-zfilled	verse	testament	testament-indexed	section	section-indexed	section-indexed-no-testament	book-indexed	Bohairic	Sahidic	English	Greek	Fayyumic	Akhmimic	OldBohairic	Mesokemic	DialectP	Lycopolitan
Leviticus	17	17	4	OT	1. OT	Pentateuch	1. Pentateuch	01. Pentateuch	03. Leviticus	ⲟⲩⲟϩ ⲛ̀ⲧⲉϥϣ̀ⲧⲉⲙⲉⲛϥ ⲉ̀ϩⲣⲉⲛ ⲫⲣⲟ ⲛ̀ϯⲥⲕⲩⲛⲏ ⲛ̀ⲧⲉ ϯⲙⲉⲧⲙⲉⲑⲣⲉ ϩⲱⲥⲇⲉ ⲉ̀ⲑⲁⲙⲓⲟϥ ⲛ̀ⲟⲩϭⲗⲓⲗ ⲛ̀ϫⲟϥϫⲉϥ ⲓⲉ ⲟⲩⲟⲩϫⲁⲓ ⲙ̀ⲡϭ̅ⲥ̅ ⲉϥϣⲏⲡ ⲉⲩⲥⲑⲟⲓ ⲛ̀ⲥⲑⲩⲛⲟⲩϥⲓ ⲟⲩⲟϩ ⲫⲏ ⲉⲧⲛⲁϣⲱⲧ ⲥⲁⲃⲟⲗ ⲛ̀ϯⲡⲁⲣⲉⲙⲃⲟⲗⲏ ⲟⲩⲟϩ ⲛ̀ⲧⲉϥϣ̀ⲧⲉⲙⲉⲛϥ ϩⲓⲣⲉⲛ ⲫ̀ⲣⲟ ⲛ̀ϯⲥⲕⲩⲛⲏ ⲛ̀ⲧⲉ ϯⲙⲉⲧⲙⲉⲑⲣⲉ ϩⲱⲥⲇⲉ ⲉ̀ⲓⲛⲓ ⲛ̀ⲟⲩⲇⲱⲣⲟⲛ ⲙ̀ⲡϭ̅ⲥ̅ ⲙ̀ⲡⲉⲙ̀ⲑⲟ ⲛ̀ϯⲥⲕⲩⲛⲏ ⲛ̀ⲧⲉ ⲡϭ̅ⲥ̅ ⲉⲩⲉ̀ⲱⲡ ⲛ̀ⲟⲩⲥⲛⲟϥ ⲙ̀ⲡⲓⲣⲱⲙⲓ ⲉⲧⲉ̀ⲙⲙⲁⲩ ⲟⲩⲥⲛⲟϥ ⲁϥⲫⲟⲛϥ ⲉ̀ⲃⲟⲗ ⲉⲥⲉ̀ϥⲱϯ ⲉ̀ⲃⲟⲗ ⲛ̀ϫⲉ ϯⲯⲩⲭⲏ ⲉⲧⲉ̀ⲙⲙⲁⲩ ⲉ̀ⲃⲟⲗ ϧⲉⲛ ⲡⲉⲥⲗⲁⲟⲥ		and shall not bring it to the door of the tabernacle of witness, so as to sacrifice it for a whole-burnt-offering or peace-offering to the Lord to be acceptable for a sweet-smelling savour: and whosoever shall slay it without, and shall not bring it to the door of the tabernacle of witness, so as to offer it as a gift to the Lord before the tabernacle of the Lord; blood shall be imputed to that man, he has shed blood; that soul shall be cut off from his people.	καὶ ἐπὶ τὴν θύραν τῆς σκηνῆς τοῦ µαρτυρίου µὴ ἐνέγκῃ ὥστε ποιῆσαι αὐτὸ εἰς ὁλοκαύτωµα ἢ σωτήριον κυρίῳ δεκτὸν εἰς ὀσµὴν εὐωδίας, καὶ ὃς ἂν σφάξῃ ἔξω καὶ ἐπὶ τὴν θύραν τῆς σκηνῆς τοῦ µαρτυρίου µὴ ἐνέγκῃ αὐτὸ ὥστε µὴ προσενέγκαι δῶρον κυρίῳ ἀπέναντι τῆς σκηνῆς κυρίου, καὶ λογισθήσεται τῷ ἀνθρώπῳ ἐκείνῳ αἷµα· αἷµα ἐξέχεεν, ἐξολεθρευθήσεται ἡ ψυχὴ ἐκείνη ἐκ τοῦ λαοῦ αὐτῆς·						
Leviticus	17	17	5	OT	1. OT	Pentateuch	1. Pentateuch	01. Pentateuch	03. Leviticus	ϩⲟⲡⲱⲥ ⲛ̀ⲧⲟⲩⲓⲛⲓ ⲛ̀ϫⲉ ⲛⲉⲛϣⲏⲣⲓ ⲙ̀ⲡⲓⲥ̅ⲗ̅ ⲛ̀ⲛⲟⲩϣⲟⲩϣⲱⲟⲩϣⲓ ⲛⲏ ⲧⲏⲣⲟⲩ ⲉⲧⲟⲩⲛⲁϧⲉⲗϧⲱⲗⲟⲩ ϧⲉⲛ ⲛⲓⲙⲉϣϣⲟϯ ⲉⲩⲉ̀ⲉⲛⲟⲩ ⲙ̀ⲡϭ̅ⲥ̅ ϩⲓⲣⲉⲛ ⲫⲣⲟ ⲛ̀ϯⲥⲕⲩⲛⲏ ⲛ̀ⲧⲉ ϯⲙⲉⲧⲙⲉⲑⲣⲉ ϩⲁ ⲡⲓⲟⲩⲏⲃ ⲟⲩⲟϩ ⲉⲩⲉ̀ϣⲱⲧ ⲛ̀ⲟⲩϣⲟⲩϣⲱⲟⲩϣⲓ ⲛ̀ⲟⲩϫⲁⲓ ⲙ̀ⲡϭ̅ⲥ̅		That the children of Israel may offer their sacrifices, all that they shall slay in the fields, and bring them to the Lord unto the doors of the tabernacle of witness to the priest, and they shall sacrifice them as a peace-offering to the Lord.	ὅπως ἀναφέρωσιν οἱ υἱοὶ Ισραηλ τὰς θυσίας αὐτῶν, ὅσας ἂν αὐτοὶ σφάξουσιν ἐν τοῖς πεδίοις, καὶ οἴσουσιν τῷ κυρίῳ ἐπὶ τὰς θύρας τῆς σκηνῆς τοῦ µαρτυρίου πρὸς τὸν ἱερέα καὶ θύσουσιν θυσίαν σωτηρίου τῷ κυρίῳ αὐτά·						
Leviticus	17	17	6	OT	1. OT	Pentateuch	1. Pentateuch	01. Pentateuch	03. Leviticus	ⲟⲩⲟϩ ⲉⲣⲉ ⲡⲓⲟⲩⲏⲃ ϫⲱϣ ⲙ̀ⲡⲓⲥⲛⲟϥ ⲉ̀ϫⲉⲛ ⲡⲓⲙⲁⲛ̀ⲉⲣϣⲱⲟⲩϣⲓ ⲙ̀ⲡⲉⲙ̀ⲑⲟ ⲙ̀ⲡϭ̅ⲥ̅ ϧⲁⲧⲉⲛ ⲫⲣⲟ ⲛ̀ϯⲥⲕⲩⲛⲏ ⲛ̀ⲧⲉ ϯⲙⲉⲧⲙⲉⲑⲣⲉ ⲟⲩⲟϩ ⲉϥⲉ̀ⲓⲛⲓ ⲙ̀ⲡⲓⲱⲧ ⲉⲩⲥⲑⲟⲓ ⲛ̀ⲥⲑⲩⲛⲟⲩϥⲓ ⲙ̀ⲡϭ̅ⲥ̅		And the priest shall pour the blood on the altar round about before the Lord by the doors of the tabernacle of witness, and shall offer the fat for a sweet-smelling savour to the Lord.	καὶ προσχεεῖ ὁ ἱερεὺς τὸ αἷµα ἐπὶ τὸ θυσιαστήριον κύκλῳ ἀπέναντι κυρίου παρὰ τὰς θύρας τῆς σκηνῆς τοῦ µαρτυρίου καὶ ἀνοίσει τὸ στέαρ εἰς ὀσµὴν εὐωδίας κυρίῳ·						
Leviticus	17	17	7	OT	1. OT	Pentateuch	1. Pentateuch	01. Pentateuch	03. Leviticus	ⲟⲩⲟϩ ⲛ̀ⲛⲟⲩⲟⲩⲁϩⲧⲟⲧⲟⲩ ϫⲉ ⲉ̀ϣⲱⲧ ⲛ̀ⲛⲟⲩϣⲟⲩϣⲱⲟⲩϣⲓ ⲛ̀ⲛⲓⲙⲉⲧⲉⲫⲗⲏⲟⲩ ⲛⲏ ⲛ̀ⲑⲱⲟⲩ ⲉⲧⲁⲩⲉⲣⲡⲟⲣⲛⲉⲩⲓⲛ ⲥⲁⲙⲉⲛϩⲏⲟⲩ ⲟⲩⲛⲟⲙⲓⲙⲟⲛ ⲛ̀ⲉⲛⲉϩ ⲉϥⲉ̀ϣⲱⲡⲓ ⲛⲱⲧⲉⲛ ⲉ̀ⲛⲉⲧⲉⲛϫⲱⲟⲩ		And they shall no longer offer their sacrifices to vain gods after which they go a whoring; it shall be a perpetual statute to you for your generations.	καὶ οὐ θύσουσιν ἔτι τὰς θυσίας αὐτῶν τοῖς µαταίοις, οἷς αὐτοὶ ἐκπορνεύουσιν ὀπίσω αὐτῶν· νόµιµον αἰώνιον ἔσται ὑµῖν εἰς τὰς γενεὰς ὑµῶν.						
Leviticus	17	17	8	OT	1. OT	Pentateuch	1. Pentateuch	01. Pentateuch	03. Leviticus	ⲟⲩⲟϩ ⲉⲕⲉ̀ϫⲟⲥ ⲛⲱⲟⲩ ϫⲉ ⲫⲣⲱⲙⲓ ⲫⲣⲱⲙⲓ ⲉ̀ⲃⲟⲗ ϧⲉⲛ ⲛⲉⲛϣⲏⲣⲓ ⲙ̀ⲡⲓⲥ̅ⲗ̅ ⲓⲉ ⲉ̀ⲃⲟⲗ ϧⲉⲛ ⲛⲓϣⲉⲙⲙⲱⲟⲩ ⲉⲩⲟⲩⲉϩ ⲉ̀ⲣⲱⲧⲉⲛ ⲫⲏ ⲉⲧⲛⲁⲓⲣⲓ ⲛ̀ⲟⲩϭⲗⲓⲗ ⲛ̀ϫⲟϥϫⲉϥ ⲓⲉ ⲟⲩϣⲟⲩϣⲱⲟⲩϣⲓ		And thou shalt say to them, Whatever man of the children of Israel, or of the sons of the proselytes abiding among you, shall offer a whole-burnt-offering or a sacrifice,	Καὶ ἐρεῖς πρὸς αὐτούς Ἄνθρωπος ἄνθρωπος τῶν υἱῶν Ισραηλ καὶ ἀπὸ τῶν υἱῶν τῶν προσηλύτων τῶν προσκειµένων ἐν ὑµῖν, ὃς ἂν ποιήσῃ ὁλοκαύτωµα ἢ θυσίαν						
Leviticus	17	17	9	OT	1. OT	Pentateuch	1. Pentateuch	01. Pentateuch	03. Leviticus	ⲟⲩⲟϩ ⲛ̀ⲧⲉϥϣ̀ⲧⲉⲙⲉⲛϥ ϩⲓⲣⲉⲛ ⲫⲣⲟ ⲛ̀ϯⲥⲕⲩⲛⲏ ⲛ̀ⲧⲉ ϯⲙⲉⲧⲙⲉⲑⲣⲉ ⲉ̀ⲁⲓϥ ⲙ̀ⲡϭ̅ⲥ̅ ⲉⲥⲉ̀ϥⲱϯ ⲉ̀ⲃⲟⲗ ⲛ̀ϫⲉ ϯⲯⲩⲭⲏ ⲉⲧⲉ̀ⲙⲙⲁⲩ ⲉ̀ⲃⲟⲗ ϧⲉⲛ ⲡⲉⲥⲗⲁⲟⲥ		and shall not bring it to the door of the tabernacle of witness to sacrifice it to the Lord, that man shall be destroyed from among his people.	καὶ ἐπὶ τὴν θύραν τῆς σκηνῆς τοῦ µαρτυρίου µὴ ἐνέγκῃ ποιῆσαι αὐτὸ τῷ κυρίῳ, ἐξολεθρευθήσεται ὁ ἄνθρωπος ἐκεῖνος ἐκ τοῦ λαοῦ αὐτοῦ.						
Leviticus	17	17	10	OT	1. OT	Pentateuch	1. Pentateuch	01. Pentateuch	03. Leviticus	ⲟⲩⲟϩ ⲫⲣⲱⲙⲓ ⲫⲣⲱⲙⲓ ⲛ̀ⲧⲉ ⲛⲉⲛϣⲏⲣⲓ ⲙ̀ⲡⲓⲥ̅ⲗ̅ ⲓⲉ ⲉ̀ⲃⲟⲗ ϧⲉⲛ ⲛⲓϣⲉⲙⲙⲱⲟⲩ ⲉⲧⲟⲩⲉϩ ϧⲉⲛ ⲑⲏⲛⲟⲩ ⲫⲏ ⲉⲧⲛⲁⲟⲩⲉⲙ ⲥⲛⲟϥ ⲛⲓⲃⲉⲛ ϧⲉⲛ ⲑⲏⲛⲟⲩ ⲟⲩⲟϩ ⲉⲓⲉ̀ⲥⲉⲙⲛⲉ ⲡⲁϩⲟ ⲉ̀ϫⲉⲛ ϯⲯⲩⲭⲏ ⲉⲧⲉ̀ⲙⲙⲁⲩ ⲉⲧⲛⲁⲟⲩⲱⲙ ⲙ̀ⲡⲓⲥⲛⲟϥ ⲟⲩⲟϩ ⲉⲓⲉ̀ⲧⲁⲕⲟⲥ ⲉ̀ⲃⲟⲗ ϧⲉⲛ ⲡⲉⲥⲗⲁⲟⲥ		And whatever man of the children of Israel, or of the strangers abiding among you, shall eat any blood, I will even set my face against that soul that eats blood, and will destroy it from its people.	Καὶ ἄνθρωπος ἄνθρωπος τῶν υἱῶν Ισραηλ ἢ τῶν προσηλύτων τῶν προσκειµένων ἐν ὑµῖν, ὃς ἂν φάγῃ πᾶν αἷµα, καὶ ἐπιστήσω τὸ πρόσωπόν µου ἐπὶ τὴν ψυχὴν τὴν ἔσθουσαν τὸ αἷµα καὶ ἀπολῶ αὐτὴν ἐκ τοῦ λαοῦ αὐτῆς.						
Leviticus	17	17	11	OT	1. OT	Pentateuch	1. Pentateuch	01. Pentateuch	03. Leviticus	ϯⲯⲩⲭⲏ ⲅⲁⲣ ⲛ̀ⲧⲉ ⲥⲁⲣⲝ ⲛⲓⲃⲉⲛ ⲡⲉ ⲡⲉⲥⲥⲛⲟϥ ⲟⲩⲟϩ ⲁ̀ⲛⲟⲕ ⲁⲓⲧⲏⲓϥ ⲛⲱⲧⲉⲛ ⲉ̀ϫⲉⲛ ⲡⲓⲙⲁⲛ̀ⲉⲣϣⲱⲟⲩϣⲓ ⲉ̀ⲧⲱⲃϩ ⲉⲑⲃⲉ ⲡⲧⲟⲩⲃⲟ ⲛ̀ⲧⲉ ⲛⲉⲧⲉⲛⲯⲩⲭⲏ ⲡⲉⲥⲥⲛⲟϥ ⲅⲁⲣ ⲛ̀ⲧϣⲉⲃⲓⲱ ⲛ̀ⲟⲩⲯⲩⲭⲏ ⲉϥⲉ̀ⲧⲱⲃϩ ⲉ̀ⲡϫⲓⲛⲧⲟⲩⲃⲟ		For the life of flesh is its blood, and I have given it to you on the altar to make atonement for your souls; for its blood shall make atonement for the soul.	ἡ γὰρ ψυχὴ πάσης σαρκὸς αἷµα αὐτοῦ ἐστιν, καὶ ἐγὼ δέδωκα αὐτὸ ὑµῖν ἐπὶ τοῦ θυσιαστηρίου ἐξιλάσκεσθαι περὶ τῶν ψυχῶν ὑµῶν· τὸ γὰρ αἷµα αὐτοῦ ἀντὶ τῆς ψυχῆς ἐξιλάσεται.						
Leviticus	17	17	12	OT	1. OT	Pentateuch	1. Pentateuch	01. Pentateuch	03. Leviticus	ⲉⲑⲃⲉⲫⲁⲓ ⲁⲓϫⲟⲥ ⲛ̀ⲛⲉⲛϣⲏⲣⲓ ⲙ̀ⲡⲓⲥ̅ⲗ̅ ϫⲉ ⲯⲩⲭⲏ ⲛⲓⲃⲉⲛ ⲉ̀ⲃⲟⲗ ϧⲉⲛ ⲑⲏⲛⲟⲩ ⲛ̀ⲛⲉϥⲟⲩⲉⲙ ⲥⲛⲟϥ ⲟⲩⲟϩ ⲡⲓϣⲉⲙⲙⲟ ⲉⲧⲟⲩⲉϩ ⲉ̀ⲣⲱⲧⲉⲛ ⲛ̀ⲛⲉϥⲟⲩⲉⲙ ⲥⲛⲟϥ		Therefore I said to the children of Israel, No soul of you shall eat blood, and the stranger that abides among you shall not eat blood.	διὰ τοῦτο εἴρηκα τοῖς υἱοῖς Ισραηλ Πᾶσα ψυχὴ ἐξ ὑµῶν οὐ φάγεται αἷµα, καὶ ὁ προσήλυτος ὁ προσκείµενος ἐν ὑµῖν οὐ φάγεται αἷµα.						
Leviticus	17	17	13	OT	1. OT	Pentateuch	1. Pentateuch	01. Pentateuch	03. Leviticus	ⲟⲩⲟϩ ⲫⲣⲱⲙⲓ ⲫⲣⲱⲙⲓ ⲛ̀ⲧⲉ ⲛⲉⲛϣⲏⲣⲓ ⲙ̀ⲡⲓⲥ̅ⲗ̅ ⲓⲉ ⲉ̀ⲃⲟⲗ ϧⲉⲛ ⲛⲓϣⲉⲙⲙⲱⲟⲩ ⲉⲧⲟⲩⲉϩ ϧⲉⲛ ⲑⲏⲛⲟⲩ ⲫⲏ ⲉⲧⲛⲁⲧⲁϩⲟ ⲛ̀ⲟⲩϫⲟⲣϫⲥ ⲓⲧⲉ ⲟⲩⲑⲏⲣⲓⲟⲛ ⲓⲧⲉ ⲟⲩϩⲁⲗⲏⲧ ⲫⲏ ⲉⲑⲟⲩⲟⲩⲱⲙ ⲙ̀ⲙⲟϥ ⲉϥⲉ̀ⲫⲱⲛ ⲙ̀ⲡⲉϥⲥⲛⲟϥ ⲉ̀ⲃⲟⲗ ⲉϥⲉ̀ϩⲟⲃⲥϥ ϧⲉⲛ ⲡⲓⲕⲁϩⲓ		And whatever man of the children of Israel, or of the strangers abiding among you shall take any animal in hunting, beast, or bird, which is eaten, then shall he pour out the blood, and cover it in the dust.	καὶ ἄνθρωπος ἄνθρωπος τῶν υἱῶν Ισραηλ καὶ τῶν προσηλύτων τῶν προσκειµένων ἐν ὑµῖν, ὃς ἂν θηρεύσῃ θήρευµα θηρίον ἢ πετεινόν, ὃ ἔσθεται, καὶ ἐκχεεῖ τὸ αἷµα καὶ καλύψει αὐτὸ τῇ γῇ·						
Leviticus	17	17	14	OT	1. OT	Pentateuch	1. Pentateuch	01. Pentateuch	03. Leviticus	ϯⲯⲩⲭⲏ ⲅⲁⲣ ⲛ̀ⲧⲉ ⲥⲁⲣⲝ ⲛⲓⲃⲉⲛ ⲡⲉ ⲡⲉⲥⲥⲛⲟϥ ⲟⲩⲟϩ ⲁϫⲟⲥ ⲛ̀ⲛⲉⲛϣⲏⲣⲓ ⲙ̀ⲡⲓⲥ̅ⲗ̅ ϫⲉ ⲛ̀ⲛⲉⲧⲉⲛⲟⲩⲉⲙ ⲥⲛⲟϥ ⲛ̀ⲧⲉ ⲥⲁⲣⲝ ⲛⲓⲃⲉⲛ ϫⲉ ⲧⲯⲩⲭⲏ ⲛ̀ⲧⲉ ⲥⲁⲣⲝ ⲛⲓⲃⲉⲛ ⲡⲉ ⲡⲉⲥⲥⲛⲟϥ ⲫⲏ ⲛⲓⲃⲉⲛ ⲉⲧⲛⲁⲟⲩⲱⲙ ⲙ̀ⲙⲟϥ ⲉϥⲉ̀ϥⲱϯ ⲉ̀ⲃⲟⲗ		For the blood of all flesh is its life; and I said to the children of Israel, Ye shall not eat the blood of any flesh, for the life of all flesh is its blood: every one that eats it shall be destroyed.	ἡ γὰρ ψυχὴ πάσης σαρκὸς αἷµα αὐτοῦ ἐστιν, καὶ εἶπα τοῖς υἱοῖς Ισραηλ Αἷµα πάσης σαρκὸς οὐ φάγεσθε, ὅτι ἡ ψυχὴ πάσης σαρκὸς αἷµα αὐτοῦ ἐστιν· πᾶς ὁ ἔσθων αὐτὸ ἐξολεθρευθήσεται.						
Leviticus	17	17	15	OT	1. OT	Pentateuch	1. Pentateuch	01. Pentateuch	03. Leviticus	ⲟⲩⲟϩ ⲯⲩⲭⲏ ⲛⲓⲃⲉⲛ ⲉⲧⲛⲁⲟⲩⲱⲙ ⲙ̀ⲡⲉⲧⲙⲱⲟⲩⲧ ⲓⲉ ⲫⲏ ⲉⲧⲁ ⲡⲑⲏⲣⲓⲟⲛ ⲟⲩⲟⲙϥ ⲓⲧⲉ ϧⲉⲛ ⲛⲓⲣⲉⲙⲛ̀ϯⲙⲓ ⲓⲧⲉ ϧⲉⲛ ⲛⲓϣⲉⲙⲙⲱⲟⲩ ⲉϥⲉ̀ⲣⲱϧⲓ ⲛ̀ⲛⲉϥϩⲃⲱⲥ ⲟⲩⲟϩ ⲉϥⲉ̀ϫⲱⲕⲉⲙ ⲙ̀ⲡⲉϥⲥⲱⲙⲁ ϧⲉⲛ ⲟⲩⲙⲱⲟⲩ ⲟⲩⲟϩ ⲉϥⲉ̀ϣⲱⲡⲓ ⲉϥϭⲁϧⲉⲙ ϣⲁ ⲫⲛⲁⲩ ⲛ̀ϩⲁⲛⲁⲣⲟⲩϩⲓ ⲟⲩⲟϩ ⲉϥⲉ̀ϣⲱⲡⲓ ⲉϥⲧⲟⲩⲃⲏⲟⲩⲧ		And every soul which eats that which has died of itself, or is taken of beasts, either among the natives or among the strangers, shall wash his garments, and bathe himself in water, and shall be unclean until evening: then shall he be clean.	Καὶ πᾶσα ψυχή, ἥτις φάγεται θνησιµαῖον ἢ θηριάλωτον ἐν τοῖς αὐτόχθοσιν ἢ ἐν τοῖς προσηλύτοις, πλυνεῖ τὰ ἱµάτια αὐτοῦ καὶ λούσεται ὕδατι καὶ ἀκάθαρτος ἔσται ἕως ἑσπέρας καὶ καθαρὸς ἔσται·						
Leviticus	17	17	16	OT	1. OT	Pentateuch	1. Pentateuch	01. Pentateuch	03. Leviticus	ⲉ̀ϣⲱⲡ ⲇⲉ ⲁϥϣ̀ⲧⲉⲙⲣⲱϧⲓ ⲛ̀ⲛⲉϥϩⲃⲱⲥ ⲟⲩⲟϩ ⲛ̀ⲧⲉϥϣ̀ⲧⲉⲙϫⲱⲕⲉⲙ ⲙ̀ⲡⲉϥⲥⲱⲙⲁ ϧⲉⲛ ⲟⲩⲙⲱⲟⲩ ⲉϥⲉ̀ϭⲓ ⲙ̀ⲡⲉϥⲛⲟⲃⲓ		But if he do not wash his garments, and do not bathe his body in water, then shall he bear his iniquity.	ἐὰν δὲ µὴ πλύνῃ τὰ ἱµάτια καὶ τὸ σῶµα µὴ λούσηται ὕδατι, καὶ λήµψεται ἀνόµηµα αὐτοῦ.						
Leviticus	18	18	1	OT	1. OT	Pentateuch	1. Pentateuch	01. Pentateuch	03. Leviticus	ⲟⲩⲟϩ ⲁ ⲡϭ̅ⲥ̅ ⲥⲁϫⲓ ⲛⲉⲙ ⲙⲱⲩ̀ⲥⲏⲥ ⲉϥϫⲱ ⲙ̀ⲙⲟⲥ		And the Lord spoke to Moses, saying,	Καὶ εἶπεν κύριος πρὸς Μωυσῆν λέγων						
Leviticus	18	18	2	OT	1. OT	Pentateuch	1. Pentateuch	01. Pentateuch	03. Leviticus	ϫⲉ ⲥⲁϫⲓ ⲛⲉⲙ ⲛⲉⲛϣⲏⲣⲓ ⲙ̀ⲡⲓⲥ̅ⲗ̅ ⲟⲩⲟϩ ⲉⲕⲉ̀ϫⲟⲥ ⲛⲱⲟⲩ ϫⲉ ⲁ̀ⲛⲟⲕ ⲡⲉ ⲡϭ̅ⲥ̅ ⲡⲉⲧⲉⲛⲛⲟⲩϯ		Speak to the children of Israel, and thou shalt say to them, I am the Lord your God.	Λάλησον τοῖς υἱοῖς Ισραηλ καὶ ἐρεῖς πρὸς αὐτούς Ἐγὼ κύριος ὁ θεὸς ὑµῶν.						
Leviticus	18	18	3	OT	1. OT	Pentateuch	1. Pentateuch	01. Pentateuch	03. Leviticus	ⲛ̀ⲛⲉⲧⲉⲛⲓⲣⲓ ⲕⲁⲧⲁ ⲛⲓⲙⲉⲧⲁⲧⲥⲃⲱ ⲛ̀ⲧⲉ ⲡⲕⲁϩⲓ ⲛ̀ⲭⲏⲙⲓ ⲫⲁⲓ ⲉⲧⲁⲣⲉⲧⲉⲛⲉⲣⲣⲉⲙⲛ̀ϫⲱⲓⲗⲓ ⲛ̀ϧⲏⲧϥ ⲟⲩⲟϩ ⲛ̀ⲛⲉⲧⲉⲛⲓⲣⲓ ⲕⲁⲧⲁ ⲛⲓⲙⲉⲧⲁⲧⲥⲃⲱ ⲛ̀ⲧⲉ ⲡⲕⲁϩⲓ ⲛ̀ⲭⲁⲛⲁⲁⲛ ⲫⲁⲓ ⲁ̀ⲛⲟⲕ ⲉ̀ϯⲛⲁⲉⲛ ⲑⲏⲛⲟⲩ ⲉ̀ϧⲟⲩⲛ ⲉ̀ⲣⲟϥ ⲟⲩⲟϩ ⲛ̀ⲛⲉⲧⲉⲛⲙⲟϣⲓ ⲛ̀ⲥⲁ ⲛ̀ⲟⲩⲛⲟⲙⲓⲙⲟⲛ		Ye shall not do according to the devices of Egypt, in which ye dwelt: and according to the devices of the land of Chanaan, into which I bring you, ye shall not do; and ye shall not walk in their ordinances.	κατὰ τὰ ἐπιτηδεύµατα γῆς Αἰγύπτου, ἐν ᾗ κατῳκήσατε ἐπ’ αὐτῇ, οὐ ποιήσετε καὶ κατὰ τὰ ἐπιτηδεύµατα γῆς Χανααν, εἰς ἣν ἐγὼ εἰσάγω ὑµᾶς ἐκεῖ, οὐ ποιήσετε καὶ τοῖς νοµίµοις αὐτῶν οὐ πορεύσεσθε·						
Leviticus	18	18	4	OT	1. OT	Pentateuch	1. Pentateuch	01. Pentateuch	03. Leviticus	ⲟⲩⲟϩ ⲛⲁϩⲁⲡ ⲉⲣⲉⲧⲉⲛⲉ̀ⲁⲓⲧⲟⲩ ⲟⲩⲟϩ ⲛⲁⲟⲩⲁϩⲥⲁϩⲛⲓ ⲉⲣⲉⲧⲉⲛⲉ̀ⲁⲣⲉϩ ⲉ̀ⲣⲱⲟⲩ ⲟⲩⲟϩ ⲙⲟϣⲓ ⲛ̀ϧⲣⲏⲓ ⲛ̀ϧⲏⲧⲟⲩ ⲁ̀ⲛⲟⲕ ⲡⲉ ⲡϭ̅ⲥ̅ ⲡⲉⲧⲉⲛⲛⲟⲩϯ		Ye shall observe my judgments, and shall keep my ordinances, and shall walk in them: I am the Lord your God.	τὰ κρίµατά µου ποιήσετε καὶ τὰ προστάγµατά µου φυλάξεσθε πορεύεσθαι ἐν αὐτοῖς· ἐγὼ κύριος ὁ θεὸς ὑµῶν.						
Leviticus	18	18	5	OT	1. OT	Pentateuch	1. Pentateuch	01. Pentateuch	03. Leviticus	ⲟⲩⲟϩ ⲉⲣⲉⲧⲉⲛⲉ̀ⲁⲣⲉϩ ⲉ̀ⲛⲁⲟⲩⲁϩⲥⲁϩⲛⲓ ⲧⲏⲣⲟⲩ ⲛⲉⲙ ⲛⲁϩⲁⲡ ⲧⲏⲣⲟⲩ ⲟⲩⲟϩ ⲉⲣⲉⲧⲉⲛⲉ̀ⲁⲓⲧⲟⲩ ⲛⲁⲓ ⲉⲧⲉ ⲫⲣⲱⲙⲓ ⲛⲁⲁⲓⲧⲟⲩ ⲉϥⲉ̀ⲱⲛϧ ⲛ̀ϧⲏⲧⲟⲩ ⲁ̀ⲛⲟⲕ ⲡⲉ ⲡϭ̅ⲥ̅ ⲡⲉⲧⲉⲛⲛⲟⲩϯ		So ye shall keep all my ordinances, and all my judgments, and do them; which if a man do, he shall live in them: I am the Lord your God.	καὶ φυλάξεσθε πάντα τὰ προστάγµατά µου καὶ πάντα τὰ κρίµατά µου καὶ ποιήσετε αὐτά, ἃ ποιήσας ἄνθρωπος ζήσεται ἐν αὐτοῖς· ἐγὼ κύριος ὁ θεὸς ὑµῶν.						
Leviticus	18	18	6	OT	1. OT	Pentateuch	1. Pentateuch	01. Pentateuch	03. Leviticus	ⲫⲣⲱⲙⲓ ⲫⲣⲱⲙⲓ ⲛ̀ⲛⲉϥⲧⲟⲙϥ ⲉ̀ⲉⲛⲭⲁⲓ ⲛⲓⲃⲉⲛ ⲉⲧⲏⲡ ⲉ̀ⲧⲉϥⲥⲁⲣⲝ ⲉ̀ⲃⲱϣ ⲛ̀ⲛⲟⲩϣⲓⲡⲓ ⲉ̀ⲃⲟⲗ ⲁ̀ⲛⲟⲕ ⲡϭ̅ⲥ̅		No man shall draw nigh to any of his near kindred to uncover their nakedness; I am the Lord.	Ἄνθρωπος ἄνθρωπος πρὸς πάντα οἰκεῖα σαρκὸς αὐτοῦ οὐ προσελεύσεται ἀποκαλύψαι ἀσχηµοσύνην· ἐγὼ κύριος.						
Leviticus	18	18	7	OT	1. OT	Pentateuch	1. Pentateuch	01. Pentateuch	03. Leviticus	ⲟⲩϣⲓⲡⲓ ⲛ̀ⲧⲉ ⲡⲉⲕⲓⲱⲧ ⲛⲉⲙ ⲟⲩϣⲓⲡⲓ ⲛ̀ⲧⲉ ⲧⲉⲕⲙⲁⲩ ⲛ̀ⲛⲉⲕϭⲟⲣⲡϥ ⲉ̀ⲃⲟⲗ ⲧⲉⲕⲙⲁⲩ ⲅⲁⲣ ⲧⲉ ⲛ̀ⲛⲉⲕϭⲱⲣⲡ ⲙ̀ⲡⲉⲥϣⲓⲡⲓ ⲉ̀ⲃⲟⲗ		Thou shalt not uncover the nakedness of thy father, or the nakedness of thy mother, for she is thy mother; thou shalt not uncover her nakedness.	ἀσχηµοσύνην πατρός σου καὶ ἀσχηµοσύνην µητρός σου οὐκ ἀποκαλύψεις· µήτηρ γάρ σού ἐστιν, καὶ οὐκ ἀποκαλύψεις τὴν ἀσχηµοσύνην αὐτῆς.						
Leviticus	18	18	8	OT	1. OT	Pentateuch	1. Pentateuch	01. Pentateuch	03. Leviticus	ⲡϣⲓⲡⲓ ⲛ̀ⲧⲉ ⲧⲥϩⲓⲙⲓ ⲙ̀ⲡⲉⲕⲓⲱⲧ ⲛ̀ⲛⲉⲕϭⲟⲣⲡϥ ⲉ̀ⲃⲟⲗ ⲟⲩϣⲓⲡⲓ ⲅⲁⲣ ⲡⲉ ⲛ̀ⲧⲉ ⲡⲉⲕⲓⲱⲧ		Thou shalt not uncover the nakedness of thy father’s wife; it is thy father’s nakedness.	ἀσχηµοσύνην γυναικὸς πατρός σου οὐκ ἀποκαλύψεις· ἀσχηµοσύνη πατρός σού ἐστιν.						
Leviticus	18	18	9	OT	1. OT	Pentateuch	1. Pentateuch	01. Pentateuch	03. Leviticus	ⲛ̀ⲛⲉⲕϭⲱⲣⲡ ⲉ̀ⲃⲟⲗ ⲙ̀ⲡϣⲓⲡⲓ ⲛ̀ⲧⲉ ⲧⲉⲕⲥⲱⲛⲓ ⲛ̀ϣⲉⲛⲓⲱⲧ ⲓⲉ ⲛ̀ϣⲉⲛⲙⲁⲩ ⲉ̀ⲁⲩⲙⲁⲥⲥ ⲛ̀ϧⲟⲩⲛ ⲓⲉ ⲟⲩⲙⲁⲥⲥ ⲙ̀ⲃⲟⲗ ⲛ̀ⲛⲉⲕϭⲱⲣⲡ ⲙ̀ⲡⲟⲩϣⲓⲡⲓ ⲉ̀ⲃⲟⲗ		The nakedness of thy sister by thy father or by thy mother, born at home or abroad, their nakedness thou shalt not uncover.	ἀσχηµοσύνην τῆς ἀδελφῆς σου ἐκ πατρός σου ἢ ἐκ µητρός σου, ἐνδογενοῦς ἢ γεγεννηµένης ἔξω, οὐκ ἀποκαλύψεις ἀσχηµοσύνην αὐτῆς.						
Leviticus	18	18	10	OT	1. OT	Pentateuch	1. Pentateuch	01. Pentateuch	03. Leviticus	ⲟⲩϣⲓⲡⲓ ⲛ̀ⲧⲉ ⲧϣⲉⲣⲓ ⲛ̀ⲟⲩϣⲏⲣⲓ ⲛ̀ⲧⲁⲕ ⲓⲉ ⲧϣⲉⲣⲓ ⲛ̀ⲟⲩϣⲉⲣⲓ ⲛ̀ⲛⲉⲕϭⲟⲣⲡϥ ⲉ̀ⲃⲟⲗ ϫⲉ ⲟⲩⲏⲓ ⲅⲁⲣ ⲟⲩϣⲓⲡⲓ ⲛ̀ⲧⲁⲕ ⲡⲉ		The nakedness of thy son’s daughter, or thy daughter’s daughter, their nakedness thou shalt not uncover; because it is thy nakedness.	ἀσχηµοσύνην θυγατρὸς υἱοῦ σου ἢ θυγατρὸς θυγατρός σου, οὐκ ἀποκαλύψεις τὴν ἀσχηµοσύνην αὐτῶν, ὅτι σὴ ἀσχηµοσύνη ἐστίν.						
Leviticus	18	18	11	OT	1. OT	Pentateuch	1. Pentateuch	01. Pentateuch	03. Leviticus	ⲟⲩϣⲓⲡⲓ ⲛ̀ⲧⲉ ⲧϣⲉⲣⲓ ⲛ̀ⲧⲥϩⲓⲙⲓ ⲙ̀ⲡⲉⲕⲓⲱⲧ ⲛ̀ⲛⲉⲕϭⲟⲣⲡϥ ⲉ̀ⲃⲟⲗ ⲧⲉⲕⲥⲱⲛⲓ ⲅⲁⲣ ⲛ̀ϣⲉⲛⲓⲱⲧ ⲧⲉ ⲛ̀ⲛⲉⲕϭⲱⲣⲡ ⲙ̀ⲡⲉⲥϣⲓⲡⲓ ⲉ̀ⲃⲟⲗ		Thou shalt not uncover the nakedness of the daughter of thy father’s wife; she is thy sister by the same father: thou shalt not uncover her nakedness.	ἀσχηµοσύνην θυγατρὸς γυναικὸς πατρός σου οὐκ ἀποκαλύψεις· ὁµοπατρία ἀδελφή σού ἐστιν, οὐκ ἀποκαλύψεις τὴν ἀσχηµοσύνην αὐτῆς.						
Leviticus	18	18	12	OT	1. OT	Pentateuch	1. Pentateuch	01. Pentateuch	03. Leviticus	ⲟⲩϣⲓⲡⲓ ⲛ̀ⲧⲉ ⲧⲥⲱⲛⲓ ⲙ̀ⲡⲉⲕⲓⲱⲧ ⲛ̀ⲛⲉⲕϭⲟⲣⲡϥ ⲉ̀ⲃⲟⲗ ⲟⲩⲣⲉⲙⲛ̀ⲏⲓ ⲅⲁⲣ ⲛ̀ⲧⲉ ⲡⲉⲕⲓⲱⲧ ⲧⲉ		Thou shalt not uncover the nakedness of thy father’s sister, for she is near akin to thy father.	ἀσχηµοσύνην ἀδελφῆς πατρός σου οὐκ ἀποκαλύψεις· οἰκεία γὰρ πατρός σού ἐστιν.						
Leviticus	18	18	13	OT	1. OT	Pentateuch	1. Pentateuch	01. Pentateuch	03. Leviticus	ⲟⲩϣⲓⲡⲓ ⲛ̀ⲧⲉ ⲧⲥⲱⲛⲓ ⲛ̀ⲧⲉⲕⲙⲁⲩ ⲛ̀ⲛⲉⲕϭⲟⲣⲡϥ ⲉ̀ⲃⲟⲗ ⲟⲩⲣⲉⲙⲛ̀ⲏⲓ ⲅⲁⲣ ⲛ̀ⲧⲉ ⲧⲉⲕⲙⲁⲩ ⲧⲉ		Thou shalt not uncover the nakedness of thy mother’s sister, for she is near akin to thy mother.	ἀσχηµοσύνην ἀδελφῆς µητρός σου οὐκ ἀποκαλύψεις· οἰκεία γὰρ µητρός σού ἐστιν.						
Leviticus	18	18	14	OT	1. OT	Pentateuch	1. Pentateuch	01. Pentateuch	03. Leviticus	ⲟⲩϣⲓⲡⲓ ⲛ̀ⲧⲉ ⲡⲥⲟⲛ ⲙ̀ⲡⲉⲕⲓⲱⲧ ⲛ̀ⲛⲉⲕϭⲟⲣⲡϥ ⲉ̀ⲃⲟⲗ ⲛ̀ⲛⲉⲕϣⲉ ⲉ̀ϧⲟⲩⲛ ϩⲁ ⲧⲉϥⲥϩⲓⲙⲓ ⲟⲩⲥⲩⲅⲅⲉⲛⲏⲥ ⲛ̀ⲧⲁⲕ ⲧⲉ		Thou shalt not uncover the nakedness of thy father’s brother, and thou shalt not go in to his wife; for she is thy relation.	ἀσχηµοσύνην ἀδελφοῦ τοῦ πατρός σου οὐκ ἀποκαλύψεις καὶ πρὸς τὴν γυναῖκα αὐτοῦ οὐκ εἰσελεύσῃ· συγγενὴς γάρ σού ἐστιν.						
Leviticus	18	18	15	OT	1. OT	Pentateuch	1. Pentateuch	01. Pentateuch	03. Leviticus	ⲟⲩϣⲓⲡⲓ ⲛ̀ⲧⲉ ⲟⲩϣⲉⲗⲉⲧ ⲛ̀ⲧⲁⲕ ⲛ̀ⲛⲉⲕϭⲟⲣⲡϥ ⲉ̀ⲃⲟⲗ ⲟⲩⲥϩⲓⲙⲓ ⲛ̀ⲧⲉ ⲡⲉⲕϣⲏⲣⲓ ⲧⲉ ⲛ̀ⲛⲉⲕϭⲱⲣⲡ ⲙ̀ⲡⲉⲥϣⲓⲡⲓ ⲉ̀ⲃⲟⲗ		Thou shalt not uncover the nakedness of thy daughter-in-law, for she is thy son’s wife, thou shalt not uncover her nakedness.	ἀσχηµοσύνην νύµφης σου οὐκ ἀποκαλύψεις· γυνὴ γὰρ υἱοῦ σού ἐστιν, οὐκ ἀποκαλύψεις τὴν ἀσχηµοσύνην αὐτῆς.						
Leviticus	18	18	16	OT	1. OT	Pentateuch	1. Pentateuch	01. Pentateuch	03. Leviticus	ⲟⲩϣⲓⲡⲓ ⲛ̀ⲧⲉ ⲧⲥϩⲓⲙⲓ ⲙ̀ⲡⲉⲕⲥⲟⲛ ⲛ̀ⲛⲉⲕϭⲟⲣⲡϥ ⲉ̀ⲃⲟⲗ ⲟⲩϣⲓⲡⲓ ⲅⲁⲣ ⲡⲉ ⲛ̀ⲧⲉ ⲡⲉⲕⲥⲟⲛ		Thou shalt not uncover the nakedness of thy brother’s wife: it is thy brother’s nakedness.	ἀσχηµοσύνην γυναικὸς ἀδελφοῦ σου οὐκ ἀποκαλύψεις· ἀσχηµοσύνη ἀδελφοῦ σού ἐστιν.						
Leviticus	18	18	17	OT	1. OT	Pentateuch	1. Pentateuch	01. Pentateuch	03. Leviticus	ⲛ̀ⲛⲉⲕϭⲱⲣⲡ ⲉ̀ⲃⲟⲗ ⲙ̀ⲡϣⲓⲡⲓ ⲛ̀ⲧⲉ ⲟⲩⲥϩⲓⲙⲓ ⲛⲉⲙ ⲟⲩϣⲉⲣⲓ ⲛ̀ⲧⲁⲥ ⲛ̀ⲛⲉⲕϭⲓ ⲛ̀ⲧϣⲉⲣⲓ ⲛ̀ⲧⲉ ⲡⲉⲥϣⲏⲣⲓ ⲛⲉⲙ ⲧϣⲉⲣⲓ ⲛ̀ⲧⲉ ⲧⲉⲥϣⲉⲣⲓ ⲉ̀ⲡϭⲱⲣⲡ ⲙ̀ⲡⲟⲩϣⲓⲡⲓ ⲉ̀ⲃⲟⲗ ϩⲁⲛⲣⲉⲙϧⲉⲛⲏⲓ ⲅⲁⲣ ⲛ̀ⲧⲁⲕ ⲛⲉ ⲟⲩⲙⲉⲧⲁⲥⲉⲃⲏⲥ ⲧⲉ		The nakedness of a woman and her daughter shalt thou not uncover; her son’s daughter, and her daughter’s daughter, shalt thou not take, to uncover their nakedness, for they are thy kinswomen: it is impiety.	ἀσχηµοσύνην γυναικὸς καὶ θυγατρὸς αὐτῆς οὐκ ἀποκαλύψεις· τὴν θυγατέρα τοῦ υἱοῦ αὐτῆς καὶ τὴν θυγατέρα τῆς θυγατρὸς αὐτῆς οὐ λήµψῃ ἀποκαλύψαι τὴν ἀσχηµοσύνην αὐτῶν· οἰκεῖαι γάρ σού εἰσιν, ἀσέβηµά ἐστιν.						
