book	chapter	chapter-zfilled	verse	testament	testament-indexed	section	section-indexed	section-indexed-no-testament	book-indexed	Bohairic	Sahidic	English	Greek	Fayyumic	Akhmimic	OldBohairic	Mesokemic	DialectP	Lycopolitan
Leviticus	19	19	23	OT	1. OT	Pentateuch	1. Pentateuch	01. Pentateuch	03. Leviticus	ⲉ̀ϣⲱⲡ ⲇⲉ ⲁⲣⲉⲧⲉⲛϣⲁⲛϣⲉ ⲛⲱⲧⲉⲛ ⲉ̀ϧⲟⲩⲛ ⲉ̀ⲡⲓⲕⲁϩⲓ ⲫⲏ ⲉⲧⲉ ⲡϭ̅ⲥ̅ ⲡⲉⲧⲉⲛⲛⲟⲩϯ ⲛⲁⲧⲏⲓϥ ⲛⲱⲧⲉⲛ ⲟⲩⲟϩ ⲛ̀ⲧⲉⲧⲉⲛϭⲟ ⲛ̀ϣϣⲏⲛ ⲛⲓⲃⲉⲛ ⲙ̀ⲙⲁⲥ ⲟⲩⲧⲁϩ ⲉ̀ⲫⲟⲩⲟⲙϥ ⲟⲩⲟϩ ⲉⲣⲉⲧⲉⲛⲉ̀ⲧⲟⲩⲃⲟ ⲙ̀ⲡⲉϥϭⲱϧⲉⲙ ⲡⲉϥⲟⲩⲧⲁϩ ⲉϥⲉ̀ϣⲱⲡⲓ ⲛⲱⲧⲉⲛ ⲛ̀ⲅ̅ ⲛ̀ϯⲣⲟⲙⲡⲓ ⲉϥϭⲁϧⲉⲙ ⲛ̀ⲛⲉⲧⲉⲛⲟⲩⲟⲙϥ		And whenever ye shall enter into the land which the Lord your God gives you, and shall plant any fruit-tree, then shall ye purge away its uncleanness; its fruit shall be three years uncleansed to you, it shall not be eaten.	Ὅταν δὲ εἰσέλθητε εἰς τὴν γῆν, ἣν κύριος ὁ θεὸς ὑµῶν δίδωσιν ὑµῖν, καὶ καταφυτεύσετε πᾶν ξύλον βρώσιµον καὶ περικαθαριεῖτε τὴν ἀκαθαρσίαν αὐτοῦ· ὁ καρπὸς αὐτοῦ τρία ἔτη ἔσται ὑµῖν ἀπερικάθαρτος, οὐ βρωθήσεται·						
Leviticus	19	19	24	OT	1. OT	Pentateuch	1. Pentateuch	01. Pentateuch	03. Leviticus	ⲟⲩⲟϩ ϧⲉⲛ ϯⲙⲁϩⲇ̅ ⲉϥⲉ̀ϣⲱⲡⲓ ⲛ̀ϫⲉ ⲡⲉϥⲟⲩⲧⲁϩ ⲧⲏⲣϥ ⲉϥⲟⲩⲁⲃ ⲉⲩⲱϣ ⲙ̀ⲙⲟϥ ⲙ̀ⲡϭ̅ⲥ̅		And in the fourth year all its fruit shall be holy, a subject of praise to the Lord.	καὶ τῷ ἔτει τῷ τετάρτῳ ἔσται πᾶς ὁ καρπὸς αὐτοῦ ἅγιος αἰνετὸς τῷ κυρίῳ·						
Leviticus	19	19	25	OT	1. OT	Pentateuch	1. Pentateuch	01. Pentateuch	03. Leviticus	ⲛ̀ϩⲣⲏⲓ ⲇⲉ ϧⲉⲛ ϯⲣⲟⲙⲡⲓ ⲙ̀ⲙⲁϩⲉ̅ ⲉⲣⲉⲧⲉⲛⲉ̀ⲟⲩⲱⲙ ⲙ̀ⲡⲉϥⲟⲩⲧⲁϩ ⲟⲩⲧⲟⲩϩⲟ ⲛⲱⲧⲉⲛ ⲡⲉ ⲛⲉϥⲅⲉⲛⲏⲙⲁ ⲁ̀ⲛⲟⲕ ⲡⲉ ⲡϭ̅ⲥ̅ ⲡⲉⲧⲉⲛⲛⲟⲩϯ		And in the fifth year ye shall eat the fruit, its produce is an increase to you. I am the Lord your God.	ἐν δὲ τῷ ἔτει τῷ πέµπτῳ φάγεσθε τὸν καρπόν, πρόσθεµα ὑµῖν τὰ γενήµατα αὐτοῦ· ἐγώ εἰµι κύριος ὁ θεὸς ὑµῶν.						
Leviticus	19	19	26	OT	1. OT	Pentateuch	1. Pentateuch	01. Pentateuch	03. Leviticus	ⲙ̀ⲡⲉⲣⲟⲩⲱⲙ ϩⲓϫⲉⲛ ⲛⲓⲧⲱⲟⲩ ⲟⲩⲟϩ ⲛ̀ⲛⲉⲧⲉⲛϭⲓⲛⲓ ⲟⲩⲟϩ ⲛ̀ⲛⲉⲧⲉⲛⲉⲣⲣⲉϥϭⲓϣⲏⲙ ϧⲉⲛ ⲛⲓϩⲁⲗⲁϯ		Eat not on the mountains, nor shall ye employ auguries, nor divine by inspection of birds.	Μὴ ἔσθετε ἐπὶ τῶν ὀρέων καὶ οὐκ οἰωνιεῖσθε οὐδὲ ὀρνιθοσκοπήσεσθε.						
Leviticus	19	19	27	OT	1. OT	Pentateuch	1. Pentateuch	01. Pentateuch	03. Leviticus	ⲛ̀ⲛⲉⲧⲉⲛⲑⲁⲙⲓⲉ ϫⲓϭⲱⲓ ⲉ̀ⲃⲟⲗ ϧⲉⲛ ⲡϥⲱⲓ ⲛ̀ⲧⲉⲧⲉⲛⲁⲫⲉ ⲟⲩⲇⲉ ⲛ̀ⲛⲉⲧⲉⲛⲧⲁⲕⲉ ⲡϩⲟ ⲛ̀ⲧⲉ ⲛⲉⲧⲉⲛⲙⲟⲣⲧ		Ye shall not make a round cutting of the hair of your head, nor disfigure your beard.	οὐ ποιήσετε σισόην ἐκ τῆς κόµης τῆς κεφαλῆς ὑµῶν οὐδὲ φθερεῖτε τὴν ὄψιν τοῦ πώγωνος ὑµῶν.						
Leviticus	19	19	28	OT	1. OT	Pentateuch	1. Pentateuch	01. Pentateuch	03. Leviticus	ⲟⲩⲟϩ ϩⲁⲛϣⲱⲧ ⲛ̀ϭⲟⲧϭⲉⲧ ⲛ̀ⲛⲉⲧⲉⲛⲑⲁⲙⲓⲱⲟⲩ ϧⲉⲛ ⲛⲉⲧⲉⲛⲥⲱⲙⲁ ⲉ̀ϩⲣⲏⲓ ⲉ̀ϫⲉⲛ ⲟⲩⲯⲩⲭⲏ ⲟⲩⲟϩ ϩⲁⲛⲥϧⲁⲓ ⲉⲩⲑⲉⲕⲑⲱⲕ ⲛ̀ⲛⲉⲧⲉⲛⲑⲁⲙⲓⲱⲟⲩ ϧⲉⲛ ⲑⲏⲛⲟⲩ ⲁ̀ⲛⲟⲕ ⲡⲉ ⲡϭ̅ⲥ̅ ⲡⲉⲧⲉⲛⲛⲟⲩϯ		And ye shall not make cuttings in your body for a dead body, and ye shall not inscribe on yourselves any marks. I am the Lord your God.	καὶ ἐντοµίδας ἐπὶ ψυχῇ οὐ ποιήσετε ἐν τῷ σώµατι ὑµῶν καὶ γράµµατα στικτὰ οὐ ποιήσετε ἐν ὑµῖν· ἐγώ εἰµι κύριος ὁ θεὸς ὑµῶν.						
Leviticus	19	19	29	OT	1. OT	Pentateuch	1. Pentateuch	01. Pentateuch	03. Leviticus	ⲛ̀ⲛⲉⲕⲥⲱϥ ⲛ̀ⲧⲉⲕϣⲉⲣⲓ ⲉ̀ⲑⲣⲉⲥⲉⲣⲡⲟⲣⲛⲉⲩⲓⲛ ⲟⲩⲟϩ ⲛ̀ⲛⲉ ⲡⲕⲁϩⲓ ⲉⲣⲡⲟⲣⲛⲉⲩⲓⲛ ⲟⲩⲟϩ ⲛ̀ⲧⲉϥⲙⲟϩ ⲛ̀ϫⲉ ⲡⲕⲁϩⲓ ⲛ̀ⲁⲛⲟⲙⲓⲁ		Thou shalt not profane thy daughter to prostitute her; so the land shall not go a whoring, and the land be filled with iniquity.	οὐ βεβηλώσεις τὴν θυγατέρα σου ἐκπορνεῦσαι αὐτήν, καὶ οὐκ ἐκπορνεύσει ἡ γῆ καὶ ἡ γῆ πλησθήσεται ἀνοµίας.						
Leviticus	19	19	30	OT	1. OT	Pentateuch	1. Pentateuch	01. Pentateuch	03. Leviticus	ⲛⲁⲥⲁⲃⲃⲁⲧⲟⲛ ⲉⲣⲉⲧⲉⲛⲉ̀ⲁⲣⲉϩ ⲉ̀ⲣⲱⲟⲩ ⲟⲩⲟϩ ⲉⲣⲉⲧⲉⲛⲉ̀ⲉⲣϩⲟϯ ϧⲁⲧϩⲏ ⲛⲛⲏ ⲉⲑⲟⲩⲁⲃ ⲛ̀ⲧⲏⲓ ⲁ̀ⲛⲟⲕ ⲡⲉ ⲡϭ̅ⲥ̅ ⲡⲉⲧⲉⲛⲛⲟⲩϯ		Ye shall keep my sabbaths, and reverence my sanctuaries: I am the Lord.	Τὰ σάββατά µου φυλάξεσθε καὶ ἀπὸ τῶν ἁγίων µου φοβηθήσεσθε· ἐγώ εἰµι κύριος.						
Leviticus	19	19	31	OT	1. OT	Pentateuch	1. Pentateuch	01. Pentateuch	03. Leviticus	ⲛ̀ⲛⲉⲧⲉⲛⲙⲟϣⲓ ⲛ̀ⲥⲁ ⲛⲓⲣⲉϥⲙⲟⲩϯ ϧⲉⲛ ⲑⲛⲉϫⲓ ⲛⲉⲙ ⲛⲓⲣⲉϥϣⲉⲛϩⲓⲛ ⲛ̀ⲛⲉⲧⲉⲛⲧⲉⲙ ⲑⲏⲛⲟⲩ ⲉ̀ⲣⲱⲟⲩ ϫⲉ ⲛ̀ⲛⲉⲧⲉⲛϭⲱϧⲉⲙ ⲛ̀ϧⲏⲧⲟⲩ ⲁ̀ⲛⲟⲕ ⲡⲉ ⲡϭ̅ⲥ̅ ⲡⲉⲧⲉⲛⲛⲟⲩϯ		Ye shall not attend to those who have in them divining spirits, nor attach yourselves to enchanters, to pollute yourselves with them: I am the Lord your God.	οὐκ ἐπακολουθήσετε ἐγγαστριµύθοις καὶ τοῖς ἐπαοιδοῖς οὐ προσκολληθήσεσθε ἐκµιανθῆναι ἐν αὐτοῖς· ἐγώ εἰµι κύριος ὁ θεὸς ὑµῶν.						
Leviticus	19	19	32	OT	1. OT	Pentateuch	1. Pentateuch	01. Pentateuch	03. Leviticus	ⲧⲱⲛⲕ ϧⲁϫⲱϥ ⲛ̀ⲟⲩⲣⲉⲙⲛ̀ⲥⲭⲓⲙ ⲟⲩⲟϩ ⲙⲁⲧⲁⲓⲉ ⲙⲟⲩϯ ⲛ̀ⲛⲓϧⲉⲗⲗⲟⲓ ⲁⲣⲓϩⲟϯ ϧⲁⲧϩⲏ ⲙ̀ⲡⲉⲕⲛⲟⲩϯ ⲁ̀ⲛⲟⲕ ⲡⲉ ⲡϭ̅ⲥ̅ ⲡⲉⲧⲉⲛⲛⲟⲩϯ		Thou shalt rise up before the hoary head, and honour the face of the old man, and shalt fear thy God: I am the Lord your God.	ἀπὸ προσώπου πολιοῦ ἐξαναστήσῃ καὶ τιµήσεις πρόσωπον πρεσβυτέρου καὶ φοβηθήσῃ τὸν θεόν σου· ἐγώ εἰµι κύριος ὁ θεὸς ὑµῶν.						
Leviticus	19	19	33	OT	1. OT	Pentateuch	1. Pentateuch	01. Pentateuch	03. Leviticus	ⲉ̀ϣⲱⲡ ⲁϥϣⲁⲛⲓ̀ ϩⲁⲣⲱⲧⲉⲛ ⲛ̀ϫⲉ ⲟⲩϣⲉⲙⲙⲟ ⲉ̀ϧⲟⲩⲛ ⲉ̀ⲡⲉⲧⲉⲛⲕⲁϩⲓ ⲛ̀ⲛⲉⲧⲉⲛϩⲉϫϩⲱϫϥ		And if there should come to you a stranger in your land, ye shall not afflict him.	Ἐὰν δέ τις προσέλθῃ προσήλυτος ὑµῖν ἐν τῇ γῇ ὑµῶν, οὐ θλίψετε αὐτόν·						
Leviticus	19	19	34	OT	1. OT	Pentateuch	1. Pentateuch	01. Pentateuch	03. Leviticus	ⲉϥⲉ̀ϣⲱⲡⲓ ϧⲉⲛ ⲑⲏⲛⲟⲩ ⲙ̀ⲫⲣⲏϯ ⲙ̀ⲡⲓⲣⲉⲙⲛϯⲙⲓ ⲛ̀ϫⲉ ⲡⲓϣⲉⲙⲙⲟ ⲉⲧⲛⲏⲟⲩ ϩⲁⲣⲱⲧⲉⲛ ⲟⲩⲟϩ ⲉⲕⲉ̀ⲙⲉⲛⲣⲓⲧϥ ⲙ̀ⲡⲉⲕⲣⲏϯ ϫⲉ ⲁⲣⲉⲧⲉⲛϣⲱⲡⲓ ϩⲱⲧⲉⲛ ⲛ̀ϣⲉⲙ̀ⲙⲟ ϧⲉⲛ ⲡⲕⲁϩⲓ ⲛ̀ⲭⲏⲙⲓ ⲁ̀ⲛⲟⲕ ⲡⲉ ⲡϭ̅ⲥ̅ ⲡⲉⲧⲉⲛⲛⲟⲩϯ		The stranger that comes to you shall be among you as the native, and thou shalt love him as thyself; for ye were strangers in the land of Egypt: I am the Lord your God.	ὡς ὁ αὐτόχθων ἐν ὑµῖν ἔσται ὁ προσήλυτος ὁ προσπορευόµενος πρὸς ὑµᾶς, καὶ ἀγαπήσεις αὐτὸν ὡς σεαυτόν, ὅτι προσήλυτοι ἐγενήθητε ἐν γῇ Αἰγύπτῳ· ἐγώ εἰµι κύριος ὁ θεὸς ὑµῶν.						
Leviticus	19	19	35	OT	1. OT	Pentateuch	1. Pentateuch	01. Pentateuch	03. Leviticus	ⲛ̀ⲛⲉⲧⲉⲛⲓⲣⲓ ⲛ̀ⲟⲩϭⲓⲛ̀ϫⲟⲛⲥ ϧⲉⲛ ⲟⲩϩⲁⲡ ϧⲉⲛ ϩⲁⲛϣⲓ ⲛⲉⲙ ϩⲁⲛⲥⲧⲁⲙⲛⲟⲥ ⲛⲉⲙ ϩⲁⲛⲙⲁϣⲓ		Ye shall not act unrighteously in judgment, in measures and weights and scales.	οὐ ποιήσετε ἄδικον ἐν κρίσει ἐν µέτροις καὶ ἐν σταθµίοις καὶ ἐν ζυγοῖς·						
Leviticus	19	19	36	OT	1. OT	Pentateuch	1. Pentateuch	01. Pentateuch	03. Leviticus	ϩⲁⲛⲙⲁϣⲓ ⲛ̀ⲑⲙⲏⲓ ⲛⲉⲙ ⲟⲩϣⲓ ⲛ̀ⲑⲙⲏⲓ ⲛⲉⲙ ⲟⲩⲭⲟⲩⲥ ⲛ̀ⲑⲙⲏⲓ ⲉⲩⲉ̀ϣⲱⲡⲓ ⲛⲱⲧⲉⲛ ⲁ̀ⲛⲟⲕ ⲡⲉ ⲡϭ̅ⲥ̅ ⲡⲉⲧⲉⲛⲛⲟⲩϯ ⲫⲏ ⲉⲧⲁϥⲉⲛ ⲑⲏⲛⲟⲩ ⲉ̀ⲃⲟⲗ ϧⲉⲛ ⲡⲕⲁϩⲓ ⲛ̀ⲭⲏⲙⲓ		There shall be among you just balances and just weights and just liquid measure. I am the Lord your God, who brought you out of the land of Egypt.	ζυγὰ δίκαια καὶ στάθµια δίκαια καὶ χοῦς δίκαιος ἔσται ὑµῖν· ἐγώ εἰµι κύριος ὁ θεὸς ὑµῶν ὁ ἐξαγαγὼν ὑµᾶς ἐκ γῆς Αἰγύπτου.						
Leviticus	19	19	37	OT	1. OT	Pentateuch	1. Pentateuch	01. Pentateuch	03. Leviticus	ⲟⲩⲟϩ ⲁⲣⲉϩ ⲉ̀ⲡⲁⲛⲟⲙⲟⲥ ⲧⲏⲣϥ ⲛⲉⲙ ⲛⲁⲟⲩⲁϩⲥⲁϩⲛⲓ ⲧⲏⲣⲟⲩ ⲉⲣⲉⲧⲉⲛⲉ̀ⲁⲓⲧⲟⲩ ⲁ̀ⲛⲟⲕ ⲡⲉ ⲡϭ̅ⲥ̅		And ye shall keep all my law and all my ordinances, and ye shall do them: I am the Lord your God.	Καὶ φυλάξεσθε πάντα τὸν νόµον µου καὶ πάντα τὰ προστάγµατά µου καὶ ποιήσετε αὐτά· ἐγώ εἰµι κύριος ὁ θεὸς ὑµῶν.						
Leviticus	20	20	1	OT	1. OT	Pentateuch	1. Pentateuch	01. Pentateuch	03. Leviticus	ⲟⲩⲟϩ ⲁ ⲡϭ̅ⲥ̅ ⲥⲁϫⲓ ⲛⲉⲙ ⲙⲱⲩ̀ⲥⲏⲥ ⲉϥϫⲱ ⲙ̀ⲙⲟⲥ		And the Lord spoke to Moses, saying,	Καὶ ἐλάλησεν κύριος πρὸς Μωυσῆν λέγων						
Leviticus	20	20	2	OT	1. OT	Pentateuch	1. Pentateuch	01. Pentateuch	03. Leviticus	ϫⲉ ⲉⲕⲉ̀ⲥⲁϫⲓ ⲛⲉⲙ ⲛⲉⲛϣⲏⲣⲓ ⲙ̀ⲡⲓⲥ̅ⲗ̅ ϫⲉ ⲉ̀ϣⲱⲡ ⲛ̀ⲧⲉ ⲟⲩⲁⲓ ⲉ̀ⲃⲟⲗ ϧⲉⲛ ⲛⲉⲛϣⲏⲣⲓ ⲙ̀ⲡⲓⲥ̅ⲗ̅ ⲓⲉ ⲉ̀ⲃⲟⲗ ϧⲉⲛ ⲛⲓϣⲉⲙⲙⲱⲟⲩ ⲉⲧⲁⲩⲟⲩⲟϩ ϧⲉⲛ ⲡⲓⲥ̅ⲗ̅ ⲛ̀ⲧⲉϥϯ ⲉ̀ⲃⲟⲗ ϧⲉⲛ ⲡⲉϥϫⲣⲟϫ ⲛ̀ⲟⲩⲁⲣⲭⲱⲛ ϧⲉⲛ ⲟⲩⲙⲟⲩ ⲙⲁⲣⲟⲩϧⲟⲑⲃⲉϥ ⲟⲩⲟϩ ⲡⲓⲉⲑⲛⲟⲥ ⲉⲧϩⲓϫⲉⲛ ⲡⲓⲕⲁϩⲓ ⲉⲩⲉ̀ϩⲓⲱⲛⲓ ⲉ̀ϫⲱϥ ϧⲉⲛ ϩⲁⲛⲱⲛⲓ		Thou shalt also say to the children of Israel, If there shall be any of the children of Israel, or of those who have become proselytes in Israel, who shall give of his seed to Moloch, let him be surely put to death; the nation upon the land shall stone him with stones.	Καὶ τοῖς υἱοῖς Ισραηλ λαλήσεις Ἐάν τις ἀπὸ τῶν υἱῶν Ισραηλ ἢ ἀπὸ τῶν προσγεγενηµένων προσηλύτων ἐν Ισραηλ, ὃς ἂν δῷ τοῦ σπέρµατος αὐτοῦ ἄρχοντι, θανάτῳ θανατούσθω· τὸ ἔθνος τὸ ἐπὶ τῆς γῆς λιθοβολήσουσιν αὐτὸν ἐν λίθοις.						
Leviticus	20	20	3	OT	1. OT	Pentateuch	1. Pentateuch	01. Pentateuch	03. Leviticus	ⲟⲩⲟϩ ⲁ̀ⲛⲟⲕ ϯⲛⲁⲥⲉⲙⲛⲓ ⲙ̀ⲡⲁϩⲟ ⲉ̀ϫⲉⲛ ⲡⲓⲣⲱⲙⲓ ⲉⲧⲉ̀ⲙⲙⲁⲩ ⲟⲩⲟϩ ⲉⲓⲉ̀ⲧⲁⲕⲟϥ ⲉ̀ⲃⲟⲗ ϧⲉⲛ ⲡⲉϥⲗⲁⲟⲥ ϫⲉ ⲟⲩⲏⲓ ⲁϥϯ ⲉ̀ⲃⲟⲗ ϧⲉⲛ ⲡⲉϥϫⲣⲟϫ ⲛ̀ⲟⲩⲁⲣⲭⲱⲛ ϩⲓⲛⲁ ⲛ̀ⲧⲉϥⲥⲱϥ ⲛ̀ⲛⲏ ⲉⲑⲟⲩⲁⲃ ⲛ̀ⲧⲏⲓ ⲟⲩⲟϩ ⲛ̀ⲧⲉϥⲥⲱϥ ⲙ̀ⲫⲣⲁⲛ ⲛ̀ⲛⲏ ⲉⲧⲁⲩϣⲱⲡⲓ ⲛⲏⲓ ⲉⲩⲟⲩⲁⲃ		And I will set my face against that man, and will cut him off from his people, because he has given of his seed to Moloch, to defile my sanctuary, and profane the name of them that are consecrated to me.	καὶ ἐγὼ ἐπιστήσω τὸ πρόσωπόν µου ἐπὶ τὸν ἄνθρωπον ἐκεῖνον καὶ ἀπολῶ αὐτὸν ἐκ τοῦ λαοῦ αὐτοῦ, ὅτι τοῦ σπέρµατος αὐτοῦ ἔδωκεν ἄρχοντι, ἵνα µιάνῃ τὰ ἅγιά µου καὶ βεβηλώσῃ τὸ ὄνοµα τῶν ἡγιασµένων µοι.						
Leviticus	20	20	4	OT	1. OT	Pentateuch	1. Pentateuch	01. Pentateuch	03. Leviticus	ⲉ̀ϣⲱⲡ ⲇⲉ ϧⲉⲛ ⲟⲩϩⲓⲡϩⲟ ⲛ̀ⲧⲟⲩϩⲓⲡϩⲟ ⲛ̀ϫⲉ ⲛⲓⲣⲉⲙⲛ̀ϯⲙⲓ ⲛ̀ⲧⲉ ⲡⲓⲕⲁϩⲓ ⲟⲩⲟϩ ⲛ̀ⲧⲟⲩⲱⲗⲓ ⲛ̀ⲛⲟⲩⲃⲁⲗ ⲉ̀ⲃⲟⲗ ϩⲁ ⲡⲓⲣⲱⲙⲓ ⲉⲧⲉ̀ⲙⲙⲁⲩ ϧⲉⲛ ⲡϫⲓⲛⲑⲣⲉϥϯ ⲉ̀ⲃⲟⲗ ϧⲉⲛ ⲡⲉϥϫⲣⲟϫ ⲛ̀ⲟⲩⲁⲣⲭⲱⲛ ϩⲱⲥⲇⲉ ⲉϣ̀ⲧⲉⲙϧⲟⲑⲃⲉϥ		And if the natives of the land should in anywise overlook that man in giving of his seed to Moloch, so as not to put him to death;	ἐὰν δὲ ὑπερόψει ὑπερίδωσιν οἱ αὐτόχθονες τῆς γῆς τοῖς ὀφθαλµοῖς αὐτῶν ἀπὸ τοῦ ἀνθρώπου ἐκείνου ἐν τῷ δοῦναι αὐτὸν τοῦ σπέρµατος αὐτοῦ ἄρχοντι τοῦ µὴ ἀποκτεῖναι αὐτόν,						
Leviticus	20	20	5	OT	1. OT	Pentateuch	1. Pentateuch	01. Pentateuch	03. Leviticus	ⲟⲩⲟϩ ⲉⲓⲉ̀ⲥⲉⲙⲛⲓ ⲙ̀ⲡⲁϩⲟ ⲉ̀ϫⲉⲛ ⲡⲓⲣⲱⲙⲓ ⲉⲧⲉ̀ⲙⲙⲁⲩ ⲛⲉⲙ ⲧⲉϥⲥⲩⲅⲅⲉⲛⲓⲁ ⲟⲩⲟϩ ⲉⲓⲉ̀ⲧⲁⲕⲟϥ ⲛⲉⲙ ⲟⲩⲟⲛ ⲛⲓⲃⲉⲛ ⲉⲧⲁⲩϯⲙⲁϯ ⲛⲉⲙⲁϥ ϩⲱⲥⲇⲉ ⲉ̀ⲑⲣⲟⲩⲉⲣⲡⲟⲣⲛⲉⲩⲓⲛ ⲉ̀ⲛⲓⲁⲣⲭⲱⲛ ⲉ̀ⲃⲟⲗ ϧⲉⲛ ⲡⲟⲩⲗⲁⲟⲥ		then will I set my face against that man and his family, and I will destroy him, and all who have been of one mind with him, so that he should go a whoring to the princes, from their people.	καὶ ἐπιστήσω τὸ πρόσωπόν µου ἐπὶ τὸν ἄνθρωπον ἐκεῖνον καὶ τὴν συγγένειαν αὐτοῦ καὶ ἀπολῶ αὐτὸν καὶ πάντας τοὺς ὁµονοοῦντας αὐτῷ ὥστε ἐκπορνεύειν αὐτὸν εἰς τοὺς ἄρχοντας ἐκ τοῦ λαοῦ αὐτῶν.						
Leviticus	20	20	6	OT	1. OT	Pentateuch	1. Pentateuch	01. Pentateuch	03. Leviticus	ⲟⲩⲟϩ ϯⲯⲩⲭⲏ ⲉⲧⲛⲁⲙⲟϣⲓ ⲛ̀ⲥⲁ ⲛⲏ ⲉⲧⲙⲟⲩϯ ⲉ̀ⲃⲟⲗ ϧⲉⲛ ⲑⲛⲉϫⲓ ⲓⲉ ⲛⲓⲣⲉϥϣⲉⲛϩⲓⲛ ϩⲱⲥⲇⲉ ⲉ̀ⲉⲣⲡⲟⲣⲛⲉⲩⲓⲛ ⲥⲁⲫⲁϩⲟⲩ ⲙ̀ⲙⲱⲟⲩ ⲉⲓⲉ̀ⲥⲉⲙⲛⲓ ⲙ̀ⲡⲁϩⲟ ⲉ̀ϫⲉⲛ ϯⲯⲩⲭⲏ ⲉⲧⲉ̀ⲙⲙⲁⲩ ⲟⲩⲟϩ ⲉⲓⲉ̀ⲧⲁⲕⲟⲥ ⲉ̀ⲃⲟⲗ ϧⲉⲛ ⲡⲉⲥⲗⲁⲟⲥ		And the soul that shall follow those who have in them divining spirits, or enchanters, so as to go a whoring after them; I will set my face against that soul, and will destroy it from among its people.	καὶ ψυχή, ἣ ἐὰν ἐπακολουθήσῃ ἐγγαστριµύθοις ἢ ἐπαοιδοῖς ὥστε ἐκπορνεῦσαι ὀπίσω αὐτῶν, ἐπιστήσω τὸ πρόσωπόν µου ἐπὶ τὴν ψυχὴν ἐκείνην καὶ ἀπολῶ αὐτὴν ἐκ τοῦ λαοῦ αὐτῆς.						
Leviticus	20	20	7	OT	1. OT	Pentateuch	1. Pentateuch	01. Pentateuch	03. Leviticus	ⲟⲩⲟϩ ⲉⲣⲉⲧⲉⲛⲉ̀ϣⲱⲡⲓ ⲉⲣⲉⲧⲉⲛⲟⲩⲁⲃ ϫⲉ ϯⲟⲩⲁⲃ ⲁ̀ⲛⲟⲕ ⲡϭ̅ⲥ̅ ⲡⲉⲧⲉⲛⲛⲟⲩϯ		And ye shall be holy, for I the Lord your God am holy.	καὶ ἔσεσθε ἅγιοι, ὅτι ἅγιος ἐγὼ κύριος ὁ θεὸς ὑµῶν·						
Leviticus	20	20	8	OT	1. OT	Pentateuch	1. Pentateuch	01. Pentateuch	03. Leviticus	ⲟⲩⲟϩ ⲉⲣⲉⲧⲉⲛⲉ̀ⲁⲣⲉϩ ⲉ̀ⲛⲁⲟⲩⲁϩⲥⲁϩⲛⲓ ⲧⲏⲣⲟⲩ ⲟⲩⲟϩ ⲉⲣⲉⲧⲉⲛⲉ̀ⲁⲓⲧⲟⲩ ⲁ̀ⲛⲟⲕ ⲡⲉ ⲡϭ̅ⲥ̅ ⲡⲉⲧⲧⲟⲩⲃⲟ ⲙ̀ⲙⲱⲧⲉⲛ		And ye shall observe my ordinances, and do them: I am the Lord that sanctifies you.	καὶ φυλάξεσθε τὰ προστάγµατά µου καὶ ποιήσετε αὐτά· ἐγὼ κύριος ὁ ἁγιάζων ὑµᾶς.						
Leviticus	20	20	9	OT	1. OT	Pentateuch	1. Pentateuch	01. Pentateuch	03. Leviticus	ⲫⲣⲱⲙⲓ ⲫⲣⲱⲙⲓ ⲉⲧⲛⲁϫⲉ ⲟⲩⲥⲁϫⲓ ⲉϥϩⲱⲟⲩ ⲛ̀ⲥⲁ ⲡⲉϥⲓⲱⲧ ⲓⲉ ⲧⲉϥⲙⲁⲩ ϧⲉⲛ ⲟⲩⲙⲟⲩ ⲙⲁⲣⲟⲩϧⲟⲑⲃⲟⲩ ⲁϥϫⲉ ⲡⲉⲧϩⲱⲟⲩ ϧⲁ ⲡⲉϥⲓⲱⲧ ⲓⲉ ⲧⲉϥⲙⲁⲩ ⲉϥⲉ̀ϣⲱⲡⲓ ⲉϥⲟⲓ ⲛ̀ⲉⲛⲟⲭⲟⲥ		Every man who shall speak evil of his father or of his mother, let him die the death; has he spoken evil of his father or his mother? he shall be guilty.	ἄνθρωπος ἄνθρωπος, ὃς ἂν κακῶς εἴπῃ τὸν πατέρα αὐτοῦ ἢ τὴν µητέρα αὐτοῦ, θανάτῳ θανατούσθω· πατέρα αὐτοῦ ἢ µητέρα αὐτοῦ κακῶς εἶπεν, ἔνοχος ἔσται.						
Leviticus	20	20	10	OT	1. OT	Pentateuch	1. Pentateuch	01. Pentateuch	03. Leviticus	ⲫⲣⲱⲙⲓ ⲫⲣⲱⲙⲓ ⲉⲧⲛⲁⲉⲣⲛⲱⲓⲕ ⲉⲧⲥϩⲓⲙⲓ ⲛ̀ⲟⲩⲣⲱⲙⲓ ⲓⲉ ⲫⲏ ⲉⲧⲛⲁⲉⲣⲛⲱⲓⲕ ⲉ̀ⲧⲥϩⲓⲙⲓ ⲙ̀ⲡⲉϥϣⲫⲏⲣ ϧⲉⲛ ⲟⲩⲙⲟⲩ ⲉⲩⲉ̀ϧⲟⲑⲃⲉϥ ⲫⲏ ⲉⲧⲟⲓ ⲛ̀ⲛⲱⲓⲕ ⲛⲉⲙ ⲑⲏ ⲉⲧⲟⲩⲟⲓ ⲛ̀ⲛⲱⲓⲕ ⲉ̀ⲣⲟⲥ		Whatever man shall commit adultery with the wife of a man, or whoever shall commit adultery with the wife of his neighbour, let them die the death, the adulterer and the adulteress.	ἄνθρωπος, ὃς ἂν µοιχεύσηται γυναῖκα ἀνδρὸς ἢ ὃς ἂν µοιχεύσηται γυναῖκα τοῦ πλησίον, θανάτῳ θανατούσθωσαν ὁ µοιχεύων καὶ ἡ µοιχευοµένη.						
Leviticus	20	20	11	OT	1. OT	Pentateuch	1. Pentateuch	01. Pentateuch	03. Leviticus	ⲟⲩⲟϩ ⲉ̀ϣⲱⲡ ⲁⲣⲉϣⲁⲛ ⲟⲩⲁⲓ ⲛ̀ⲕⲟⲧ ⲛⲉⲙ ⲧⲥϩⲓⲙⲓ ⲙ̀ⲡⲉϥⲓⲱⲧ ⲡⲓϣⲓⲡⲓ ⲙ̀ⲡⲉϥⲓⲱⲧ ⲁϥϭⲟⲣⲡϥ ⲉ̀ⲃⲟⲗ ϧⲉⲛ ⲟⲩⲙⲟⲩ ⲙⲁⲣⲟⲩϧⲟⲑⲃⲟⲩ ⲙ̀ⲡⲃ̅ ⲟⲩⲟⲛ ⲉ̀ⲣⲱⲟⲩ		And if any one should lie with his father’s wife, he has uncovered his father’s nakedness: let them both die the death, they are guilty.	ἐάν τις κοιµηθῇ µετὰ γυναικὸς τοῦ πατρὸς αὐτοῦ, ἀσχηµοσύνην τοῦ πατρὸς αὐτοῦ ἀπεκάλυψεν, θανάτῳ θανατούσθωσαν ἀµφότεροι, ἔνοχοί εἰσιν.						
Leviticus	20	20	12	OT	1. OT	Pentateuch	1. Pentateuch	01. Pentateuch	03. Leviticus	ⲟⲩⲟϩ ⲉ̀ϣⲱⲡ ⲛ̀ⲧⲉ ⲟⲩⲁⲓ ⲛ̀ⲕⲟⲧ ⲛⲉⲙ ⲟⲩϣⲉⲗⲉⲧ ⲛ̀ⲧⲁϥ ϧⲉⲛ ⲟⲩⲙⲟⲩ ⲙⲁⲣⲟⲩϧⲟⲑⲃⲟⲩ ⲙ̀ⲡⲃ̅ ⲉ̀ⲁⲩⲉⲣⲁⲥⲉⲃⲏⲥ ⲅⲁⲣ ⲟⲩⲟⲛ ⲉ̀ⲣⲱⲟⲩ		And if any one should lie with his daughter-in-law, let them both be put to death; for they have wrought impiety, they are guilty.	καὶ ἐάν τις κοιµηθῇ µετὰ νύµφης αὐτοῦ, θανάτῳ θανατούσθωσαν ἀµφότεροι· ἠσεβήκασιν γάρ, ἔνοχοί εἰσιν.						
Leviticus	20	20	13	OT	1. OT	Pentateuch	1. Pentateuch	01. Pentateuch	03. Leviticus	ⲟⲩⲟϩ ⲫⲏ ⲉⲧⲛⲁⲛⲕⲟⲧ ⲛⲉⲙ ⲟⲩϩⲱⲟⲩⲧ ⲉ̀ⲟⲩϣⲁⲓⲣⲓ ⲛ̀ⲥϩⲓⲙⲓ ⲟⲩⲥⲱϥ ⲅⲁⲣ ⲁⲩⲁⲓϥ ⲙ̀ⲡⲃ̅ ϧⲉⲛ ⲟⲩⲙⲟⲩ ⲙⲁⲣⲟⲩϧⲟⲑⲃⲟⲩ ⲟⲩⲟⲛ ⲉ̀ⲣⲱⲟⲩ		And whoever shall lie with a male as with a woman, they have both wrought abomination; let them die the death, they are guilty.	καὶ ὃς ἂν κοιµηθῇ µετὰ ἄρσενος κοίτην γυναικός, βδέλυγµα ἐποίησαν ἀµφότεροι· θανατούσθωσαν, ἔνοχοί εἰσιν.						
Leviticus	20	20	14	OT	1. OT	Pentateuch	1. Pentateuch	01. Pentateuch	03. Leviticus	ⲫⲏ ⲉⲧⲛⲁϭⲓ ⲛ̀ⲟⲩⲥϩⲓⲙⲓ ⲛⲉⲙ ⲧⲉⲥⲙⲁⲩ ⲟⲩⲁⲛⲟⲙⲓⲁ ⲧⲉ ⲉⲩⲉ̀ⲣⲟⲕϩϥ ϧⲉⲛ ⲟⲩⲭⲣⲱⲙ ⲛⲉⲙ ⲛⲓⲕⲉⲭⲱⲟⲩⲛⲓ ⲟⲩⲟϩ ⲛ̀ⲛⲉ ⲁⲛⲟⲙⲓⲁ ϣⲱⲡⲓ ϧⲉⲛ ⲑⲏⲛⲟⲩ		Whosoever shall take a woman and her mother, it is iniquity: they shall burn him and them with fire; so there shall not be iniquity among you.	ὃς ἐὰν λάβῃ γυναῖκα καὶ τὴν µητέρα αὐτῆς, ἀνόµηµά ἐστιν· ἐν πυρὶ κατακαύσουσιν αὐτὸν καὶ αὐτάς, καὶ οὐκ ἔσται ἀνοµία ἐν ὑµῖν.						
Leviticus	20	20	15	OT	1. OT	Pentateuch	1. Pentateuch	01. Pentateuch	03. Leviticus	ⲟⲩⲟϩ ⲫⲏ ⲉⲧⲛⲁⲛ̀ⲕⲟⲧ ⲛⲉⲙ ⲧⲉⲃⲛⲏ ⲛⲓⲃⲉⲛ ϧⲉⲛ ⲟⲩⲙⲟⲩ ⲙⲁⲣⲟⲩϧⲟⲑⲃⲉϥ ⲟⲩⲟϩ ⲡⲓⲧⲉⲃⲛⲏ ⲉⲣⲉⲧⲉⲛⲉ̀ϧⲟⲑⲃⲉϥ		And whosoever shall lie with a beast, let him die the death; and ye shall kill the beast.	καὶ ὃς ἂν δῷ κοιτασίαν αὐτοῦ ἐν τετράποδι, θανάτῳ θανατούσθω, καὶ τὸ τετράπουν ἀποκτενεῖτε.						
Leviticus	20	20	16	OT	1. OT	Pentateuch	1. Pentateuch	01. Pentateuch	03. Leviticus	ⲟⲩⲟϩ ϯⲥϩⲓⲙⲓ ⲉⲧⲛⲁϣⲉ ⲛⲁⲥ ϧⲁⲧⲉⲛ ⲧⲉⲃⲛⲏ ⲛⲓⲃⲉⲛ ⲉ̀ⲉⲛⲕⲟⲧ ⲛⲉⲙⲁⲥ ⲉⲣⲉⲧⲉⲛⲉ̀ϧⲱⲧⲉⲃ ⲛ̀ϯⲥϩⲓⲙⲓ ⲛⲉⲙ ⲡⲓⲧⲉⲃⲛⲏ ϧⲉⲛ ⲟⲩⲙⲟⲩ ⲙⲁⲣⲟⲩⲙⲟⲩ ⲟⲩⲟⲛ ⲉ̀ⲣⲱⲟⲩ		And whatever woman shall approach any beast, so as to have connexion with it, ye shall kill the woman and the beast: let them die the death, they are guilty.	καὶ γυνή, ἥτις προσελεύσεται πρὸς πᾶν κτῆνος βιβασθῆναι αὐτὴν ὑπ’ αὐτοῦ, ἀποκτενεῖτε τὴν γυναῖκα καὶ τὸ κτῆνος· θανάτῳ θανατούσθωσαν, ἔνοχοί εἰσιν.						
Leviticus	20	20	17	OT	1. OT	Pentateuch	1. Pentateuch	01. Pentateuch	03. Leviticus	ⲫⲏ ⲉⲧⲛⲁϭⲓ ⲛ̀ⲧⲉϥⲥⲱⲛⲓ ⲛ̀ϣⲉⲛⲓⲱⲧ ⲓⲉ ⲛ̀ϣⲉⲛⲙⲁⲩ ⲟⲩⲟϩ ⲛ̀ⲧⲉϥⲛⲁⲩ ⲉ̀ⲡⲉⲥϣⲓⲡⲓ ⲟⲩⲟϩ ⲛ̀ⲑⲟⲥ ϩⲱⲥ ⲛ̀ⲧⲉⲥⲛⲁⲩ ⲉ̀ⲡⲉϥϣⲓⲡⲓ ⲟⲩϣⲱϣ ⲡⲉ ⲉⲩⲉ̀ϥⲱϯ ⲉ̀ⲃⲟⲗ ⲙ̀ⲡⲉⲙ̀ⲑⲟ ⲛ̀ⲛⲓϣⲏⲣⲓ ⲛ̀ⲧⲉ ⲡⲉϥⲅⲉⲛⲟⲥ ⲟⲩϣⲓⲡⲓ ⲛ̀ⲧⲉ ⲧⲉϥⲥⲱⲛⲓ ⲁϥϭⲟⲣⲡϥ ⲉ̀ⲃⲟⲗ ⲉϥⲉ̀ϭⲓ ⲙ̀ⲡⲉϥⲛⲟⲃⲓ		Whosoever shall take his sister by his father or by his mother, and shall see her nakedness, and she see his nakedness, it is a reproach: they shall be destroyed before the children of their family; he has uncovered his sister’s nakedness, they shall bear their sin.	ὃς ἐὰν λάβῃ τὴν ἀδελφὴν αὐτοῦ ἐκ πατρὸς αὐτοῦ ἢ ἐκ µητρὸς αὐτοῦ καὶ ἴδῃ τὴν ἀσχηµοσύνην αὐτῆς καὶ αὕτη ἴδῃ τὴν ἀσχηµοσύνην αὐτοῦ, ὄνειδός ἐστιν, ἐξολεθρευθήσονται ἐνώπιον υἱῶν γένους αὐτῶν· ἀσχηµοσύνην ἀδελφῆς αὐτοῦ ἀπεκάλυψεν, ἁµαρτίαν κοµιοῦνται.						
