book	chapter	chapter-zfilled	verse	testament	testament-indexed	section	section-indexed	section-indexed-no-testament	book-indexed	Bohairic	Sahidic	English	Greek	Fayyumic	Akhmimic	OldBohairic	Mesokemic	DialectP	Lycopolitan
Leviticus	26	26	44	OT	1. OT	Pentateuch	1. Pentateuch	01. Pentateuch	03. Leviticus	ⲟⲩⲇⲉ ⲙ̀ⲡⲁⲓⲣⲏϯ ⲟⲛ ⲉⲩⲭⲏ ϧⲉⲛ ⲡⲕⲁϩⲓ ⲛ̀ⲧⲉ ⲛⲟⲩϫⲁϫⲓ ⲙ̀ⲡⲓϩⲓⲡϩⲟ ⲙ̀ⲙⲱⲟⲩ ⲟⲩⲇⲉ ⲁⲓⲙⲉⲥⲧⲱⲟⲩ ϩⲱⲥⲇⲉ ⲉ̀ⲙⲟⲛⲕⲟⲩ ⲉ̀ⲃⲟⲗ ⲉ̀ⲡϫⲓⲛϫⲉⲣ ⲧⲁⲇⲓⲁⲑⲏⲕⲏ ⲉ̀ⲃⲟⲗ ⲉⲧϣⲟⲡ ϩⲁⲣⲱⲟⲩ ⲁ̀ⲛⲟⲕ ⲡⲉ ⲡϭ̅ⲥ̅ ⲡⲉⲧⲉⲛⲛⲟⲩϯ		And yet not even thus, while they were in the land of their enemies, did I overlook them, nor did I loathe them so as to consume them, to break my covenant made with them; for I am the Lord their God.	καὶ οὐδ’ ὧς ὄντων αὐτῶν ἐν τῇ γῇ τῶν ἐχθρῶν αὐτῶν οὐχ ὑπερεῖδον αὐτοὺς οὐδὲ προσώχθισα αὐτοῖς ὥστε ἐξαναλῶσαι αὐτοὺς τοῦ διασκεδάσαι τὴν διαθήκην µου τὴν πρὸς αὐτούς· ὅτι ἐγώ εἰµι κύριος ὁ θεὸς αὐτῶν.						
Leviticus	26	26	45	OT	1. OT	Pentateuch	1. Pentateuch	01. Pentateuch	03. Leviticus	ⲟⲩⲟϩ ⲉⲓⲉ̀ⲉⲣⲫⲙⲉⲩⲓ ⲛ̀ⲟⲩⲇⲓⲁⲑⲏⲕⲏ ⲛ̀ⲧⲱⲟⲩ ⲛ̀ϣⲟⲣⲡ ϫⲉ ⲁⲓⲉⲛⲟⲩ ⲉ̀ⲃⲟⲗ ϧⲉⲛ ⲡⲕⲁϩⲓ ⲛ̀ⲭⲏⲙⲓ ⲉ̀ⲃⲟⲗ ϧⲉⲛ ⲡⲏⲓ ⲛ̀ⲧⲉ ⲟⲩⲙⲉⲧⲃⲱⲕ ⲙ̀ⲡⲉⲙ̀ⲑⲟ ⲛ̀ⲛⲓⲉⲑⲛⲟⲥ ⲉ̀ⲡϫⲓⲛⲧⲁϣⲱⲡⲓ ⲛⲱⲟⲩ ⲛ̀ⲛⲟⲩϯ ϫⲉ ⲁ̀ⲛⲟⲕ ⲡⲉ ⲡϭ̅ⲥ̅		And I will remember their former covenant, when I brought them out of the land of Egypt, out of the house of bondage before the nation, to be their God; I am the Lord.	καὶ µνησθήσοµαι αὐτῶν τῆς διαθήκης τῆς προτέρας, ὅτε ἐξήγαγον αὐτοὺς ἐκ γῆς Αἰγύπτου ἐξ οἴκου δουλείας ἔναντι τῶν ἐθνῶν τοῦ εἶναι αὐτῶν θεός· ἐγώ εἰµι κύριος.						
Leviticus	26	26	46	OT	1. OT	Pentateuch	1. Pentateuch	01. Pentateuch	03. Leviticus	ⲛⲁⲓ ⲛⲉ ⲛⲓϩⲁⲡ ⲛⲉⲙ ⲛⲓⲟⲩⲁϩⲥⲁϩⲛⲓ ⲛⲉⲙ ⲡⲓⲛⲟⲙⲟⲥ ⲫⲏ ⲉⲧⲁ ⲡϭ̅ⲥ̅ ⲧⲏⲓϥ ⲟⲩⲧⲱϥ ⲛⲉⲙ ⲟⲩⲧⲉ ⲛⲉⲛϣⲏⲣⲓ ⲙ̀ⲡⲓⲥ̅ⲗ̅ ϩⲓ ⲡⲧⲱⲟⲩ ⲛ̀ⲥⲓⲛⲁ ϧⲉⲛ ⲧϫⲓϫ ⲙ̀ⲙⲱⲩ̀ⲥⲏⲥ		These are my judgments and my ordinances, and the law which the Lord gave between himself and the children of Israel, in the mount Sina, by the hand of Moses.	Ταῦτα τὰ κρίµατα καὶ τὰ προστάγµατα καὶ ὁ νόµος, ὃν ἔδωκεν κύριος ἀνὰ µέσον αὐτοῦ καὶ ἀνὰ µέσον τῶν υἱῶν Ισραηλ ἐν τῷ ὄρει Σινα ἐν χειρὶ Μωυσῆ.						
Leviticus	27	27	1	OT	1. OT	Pentateuch	1. Pentateuch	01. Pentateuch	03. Leviticus	ⲟⲩⲟϩ ⲁ ⲡϭ̅ⲥ̅ ⲥⲁϫⲓ ⲛⲉⲙ ⲙⲱⲩ̀ⲥⲏⲥ ⲉϥϫⲱ ⲙ̀ⲙⲟⲥ		And the Lord spoke to Moses, saying,	Καὶ ἐλάλησεν κύριος πρὸς Μωυσῆν λέγων						
Leviticus	27	27	2	OT	1. OT	Pentateuch	1. Pentateuch	01. Pentateuch	03. Leviticus	ϫⲉ ⲥⲁϫⲓ ⲛⲉⲙ ⲛⲉⲛϣⲏⲣⲓ ⲙ̀ⲡⲓⲥ̅ⲗ̅ ⲟⲩⲟϩ ⲉⲕⲉ̀ϫⲟⲥ ⲛⲱⲟⲩ ϫⲉ ⲫⲣⲱⲙⲓ ⲫⲣⲱⲙⲓ ⲫⲏ ⲉⲧⲛⲁⲱϣ ⲛ̀ⲟⲩⲉⲩⲭⲏ ϩⲱⲥⲇⲉ ⲉ̀ϯ ⲛ̀ⲧⲧⲓⲙⲏ ⲛ̀ⲑⲏ ⲉⲧⲉⲑⲱϥ ⲙ̀ⲯⲩⲭⲏ ⲙ̀ⲡϭ̅ⲥ̅		Speak to the children of Israel, and thou shalt say to them, Whosoever shall vow a vow as the valuation of his soul for the Lord,	Λάλησον τοῖς υἱοῖς Ισραηλ καὶ ἐρεῖς αὐτοῖς Ὃς ἂν εὔξηται εὐχὴν ὥστε τιµὴν τῆς ψυχῆς αὐτοῦ τῷ κυρίῳ,						
Leviticus	27	27	3	OT	1. OT	Pentateuch	1. Pentateuch	01. Pentateuch	03. Leviticus	ⲉⲥⲉ̀ϣⲱⲡⲓ ⲛ̀ϫⲉ ϯⲧⲓⲙⲏ ⲛ̀ⲧⲉ ⲡⲓϩⲱⲟⲩⲧ ⲓⲥϫⲉⲛ ⲕ̅ ⲛ̀ⲣⲟⲙⲡⲓ ϣⲁ ⲝ̅ ⲛ̀ⲣⲟⲙⲡⲓ ⲉⲥⲉ̀ϣⲱⲡⲓ ⲛ̀ϫⲉ ⲧⲉϥⲧⲓⲙⲏ ⲉⲛ ⲛ̀ⲥⲁⲑⲉⲣⲓ ⲉⲩⲕⲏⲃ ϧⲉⲛ ⲡⲓϣⲓ ⲛ̀ⲧⲉ ϯⲙⲁϣⲓ ⲉⲑⲟⲩⲁⲃ		the valuation of a male from twenty years old to sixty years old shall be his valuation shall be fifty didrachms of silver by the standard of the sanctuary.	ἔσται ἡ τιµὴ τοῦ ἄρσενος ἀπὸ εἰκοσαετοῦς ἕως ἑξηκονταετοῦς, ἔσται αὐτοῦ ἡ τιµὴ πεντήκοντα δίδραχµα ἀργυρίου τῷ σταθµῷ τῷ ἁγίῳ,						
Leviticus	27	27	4	OT	1. OT	Pentateuch	1. Pentateuch	01. Pentateuch	03. Leviticus	ϯⲥϩⲓⲙⲓ ⲇⲉ ⲉⲥⲉ̀ϣⲱⲡⲓ ⲛ̀ϫⲉ ⲧⲉⲥⲧⲓⲙⲏ ⲉ̀ⲗ̅ ⲛ̀ⲥⲁⲑⲉⲣⲓ ⲉⲩⲕⲏⲃ		And the valuation of a female shall be thirty didrachms.	τῆς δὲ θηλείας ἔσται ἡ συντίµησις τριάκοντα δίδραχµα.						
Leviticus	27	27	5	OT	1. OT	Pentateuch	1. Pentateuch	01. Pentateuch	03. Leviticus	ⲉ̀ϣⲱⲡ ⲇⲉ ⲉϥⲭⲏ ϧⲉⲛ ⲉ̅ ⲛ̀ⲣⲟⲙⲡⲓ ϣⲁ ⲕ̅ ⲛ̀ⲣⲟⲙⲡⲓ ⲉⲥⲉ̀ϣⲱⲡⲓ ⲛ̀ϫⲉ ϯⲧⲓⲙⲏ ⲛ̀ⲧⲉ ⲡⲓϩⲱⲟⲩⲧ ⲉ̀ⲕ̅ ⲛ̀ⲥⲁⲑⲉⲣⲓ ⲉⲩⲕⲏⲃ ϯⲥϩⲓⲙⲓ ⲇⲉ ⲉ̀ⲓ̅ ⲛ̀ⲥⲁⲑⲉⲣⲓ ⲉⲩⲕⲏⲃ		And if it be from five years old to twenty, the valuation of a male shall be twenty didrachms, and of a female ten didrachms.	ἐὰν δὲ ἀπὸ πενταετοῦς ἕως εἴκοσι ἐτῶν, ἔσται ἡ τιµὴ τοῦ ἄρσενος εἴκοσι δίδραχµα, τῆς δὲ θηλείας δέκα δίδραχµα.						
Leviticus	27	27	6	OT	1. OT	Pentateuch	1. Pentateuch	01. Pentateuch	03. Leviticus	ⲓⲥϫⲉⲛ ⲟⲩⲁⲃⲟⲧ ⲇⲉ ⲉ̀ⲡϣⲱⲓ ϣⲁ ⲉ̅ ⲛ̀ⲣⲟⲙⲡⲓ ⲉⲥⲉ̀ϣⲱⲡⲓ ⲛ̀ϫⲉ ⲧⲧⲓⲙⲏ ⲛ̀ⲧⲉ ⲡⲓϩⲱⲟⲩⲧ ⲉ̀ⲉ̅ ⲛ̀ⲥⲁⲑⲉⲣⲓ ⲛ̀ϩⲁⲧ ⲉⲩⲕⲏⲃ ϯⲥϩⲓⲙⲓ ⲇⲉ ⲉ̀ⲅ̅ ⲛ̀ⲥⲁⲑⲉⲣⲓ ⲉⲩⲕⲏⲃ		And from a month old to five years old, the valuation of a male shall be five didrachms, and of a female, three didrachms of silver.	ἀπὸ δὲ µηνιαίου ἕως πενταετοῦς ἔσται ἡ τιµὴ τοῦ ἄρσενος πέντε δίδραχµα ἀργυρίου, τῆς δὲ θηλείας τρία δίδραχµα.						
Leviticus	27	27	7	OT	1. OT	Pentateuch	1. Pentateuch	01. Pentateuch	03. Leviticus	ⲉ̀ϣⲱⲡ ⲇⲉ ⲓⲥϫⲉⲛ ⲝ̅ ⲛ̀ⲣⲟⲙⲡⲓ ⲟⲩⲟϩ ⲉ̀ⲡϣⲱⲓ ⲉ̀ϣⲱⲡ ⲙⲉⲛ ⲟⲩϩⲱⲟⲩⲧ ⲡⲉ ⲉⲥⲉ̀ϣⲱⲡⲓ ⲛ̀ϫⲉ ⲧⲉϥⲧⲓⲙⲏ ⲙ̀ⲓ̅ⲉ̅ ⲛ̀ⲥⲁⲑⲉⲣⲓ ⲛϩⲁⲧ ⲉⲩⲕⲏⲃ ⲉ̀ϣⲱⲡ ⲇⲉ ⲟⲩⲥϩⲓⲙⲓ ⲧⲉ ⲉ̀ⲓ̅ ⲛ̀ⲥⲁⲑⲉⲣⲓ ⲉⲩⲕⲏⲃ		And if from sixty year old and upward, if it be a male, his valuation shall be fifteen didrachms of silver, and if a female, ten didrachms.	ἐὰν δὲ ἀπὸ ἑξηκονταετῶν καὶ ἐπάνω, ἐὰν µὲν ἄρσεν ᾖ, ἔσται ἡ τιµὴ πεντεκαίδεκα δίδραχµα ἀργυρίου, ἐὰν δὲ θήλεια, δέκα δίδραχµα.						
Leviticus	27	27	8	OT	1. OT	Pentateuch	1. Pentateuch	01. Pentateuch	03. Leviticus	ⲉ̀ϣⲱⲡ ⲇⲉ ⲉϥⲑⲉⲃⲓⲏⲟⲩⲧ ϧⲉⲛ ϯⲧⲓⲙⲏ ⲉϥⲉ̀ⲟϩⲓ ⲉ̀ⲣⲁⲧϥ ⲙ̀ⲡⲉⲙ̀ⲑⲟ ⲙ̀ⲡⲓⲟⲩⲏⲃ ⲟⲩⲟϩ ⲉⲣⲉ ⲡⲓⲟⲩⲏⲃ ⲉⲣⲧⲓⲙⲏ ⲙ̀ⲙⲟϥ ⲕⲁⲧⲁ ⲫⲣⲏϯ ⲉⲧⲉ ⲟⲩⲟⲛ ϣ̀ϫⲟⲙ ⲛ̀ⲧϫⲓϫ ⲙ̀ⲫⲏ ⲉⲧⲁϥⲱϣ ⲡⲁⲓⲣⲏϯ ⲉϥⲉ̀ⲉⲣⲧⲓⲙⲏ ⲙ̀ⲙⲟϥ ⲛ̀ϫⲉ ⲡⲓⲟⲩⲏⲃ		And if the man be too poor for the valuation, he shall stand before the priest; and the priest shall value him: according to what the man who has vowed can afford, the priest shall value him.	ἐὰν δὲ ταπεινὸς ᾖ τῇ τιµῇ, στήσεται ἐναντίον τοῦ ἱερέως, καὶ τιµήσεται αὐτὸν ὁ ἱερεύς· καθάπερ ἰσχύει ἡ χεὶρ τοῦ εὐξαµένου, τιµήσεται αὐτὸν ὁ ἱερεύς.						
Leviticus	27	27	9	OT	1. OT	Pentateuch	1. Pentateuch	01. Pentateuch	03. Leviticus	ⲉ̀ϣⲱⲡ ⲇⲉ ⲉ̀ⲃⲟⲗ ϧⲉⲛ ⲛⲓⲧⲉⲃⲛⲱⲟⲩⲓ ⲉⲧⲟⲩⲓⲛⲓ ⲙ̀ⲙⲱⲟⲩ ⲉ̀ϧⲟⲩⲛ ⲙ̀ⲡϭ̅ⲥ̅ ⲛ̀ⲧⲁⲓⲟ ⲛ̀ⲧⲉ ⲟⲩⲁⲓ ϯ ⲉ̀ⲃⲟⲗ ⲛ̀ϧⲏⲧⲟⲩ ⲙ̀ⲡϭ̅ⲥ̅ ⲉϥⲉ̀ϣⲱⲡⲓ ⲉϥⲟⲩⲁⲃ		And if it be from the cattle that are offered as a gift to the Lord, whoever shall offer one of these to the Lord, it shall be holy.	Ἐὰν δὲ ἀπὸ τῶν κτηνῶν τῶν προσφεροµένων ἀπ’ αὐτῶν δῶρον τῷ κυρίῳ, ὃς ἂν δῷ ἀπὸ τούτων τῷ κυρίῳ, ἔσται ἅγιον.						
Leviticus	27	27	10	OT	1. OT	Pentateuch	1. Pentateuch	01. Pentateuch	03. Leviticus	ⲛ̀ⲛⲉϥϣⲉⲃⲓⲉ ⲡⲉⲑⲛⲁⲛⲉϥ ϧⲁ ⲡⲉⲧϩⲱⲟⲩ ⲟⲩⲇⲉ ⲡⲉⲧϩⲱⲟⲩ ϧⲁ ⲡⲉⲑⲛⲁⲛⲉϥ ⲉ̀ϣⲱⲡ ⲇⲉ ⲉϥⲛⲁϣⲓⲃϯ ⲛ̀ⲧⲉϥϣⲉⲃⲓⲉ ⲟⲩⲧⲉⲃⲛⲏ ϧⲁ ⲟⲩⲧⲉⲃⲛⲏ ⲉⲩⲉ̀ϣⲱⲡⲓ ⲉⲩⲟⲩⲁⲃ ⲛ̀ⲑⲟϥ ⲛⲉⲙ ⲧⲉϥϣⲉⲃⲓⲱ		He shall not change it, a good for a bad, or a bad for a good; and if he do at all change it, a beast for a beast, it and the substitute shall be holy.	οὐκ ἀλλάξει αὐτὸ καλὸν πονηρῷ οὐδὲ πονηρὸν καλῷ· ἐὰν δὲ ἀλλάσσων ἀλλάξῃ αὐτὸ κτῆνος κτήνει, ἔσται αὐτὸ καὶ τὸ ἄMαγµα ἅγια.						
Leviticus	27	27	11	OT	1. OT	Pentateuch	1. Pentateuch	01. Pentateuch	03. Leviticus	ⲉ̀ϣⲱⲡ ⲇⲉ ⲟⲩⲧⲉⲃⲛⲏ ⲉϥϭⲁϧⲉⲙ ⲡⲉ ⲟⲩⲁⲓ ⲉ̀ⲃⲟⲗ ϧⲉⲛ ⲛⲏ ⲉⲧⲉ ⲛ̀ⲥϣⲉ ⲁⲛ ⲉ̀ⲓⲛⲓ ⲉ̀ⲃⲟⲗ ⲛ̀ϧⲏⲧⲟⲩ ⲛ̀ⲟⲩⲧⲁⲓⲟ ⲙ̀ⲡϭ̅ⲥ̅ ⲉϥⲉ̀ⲧⲁϩⲉ ⲡⲓⲧⲉⲃⲛⲏ ⲉ̀ⲣⲁⲧϥ ⲙ̀ⲡⲉⲙ̀ⲑⲟ ⲙ̀ⲡⲓⲟⲩⲏⲃ		And if it be any unclean beast, of which none are offered as a gift to the Lord, he shall set the beast before the priest.	ἐὰν δὲ πᾶν κτῆνος ἀκάθαρτον, ἀφ’ ὧν οὐ προσφέρεται ἀπ’ αὐτῶν δῶρον τῷ κυρίῳ, στήσει τὸ κτῆνος ἔναντι τοῦ ἱερέως,						
Leviticus	27	27	12	OT	1. OT	Pentateuch	1. Pentateuch	01. Pentateuch	03. Leviticus	ⲟⲩⲟϩ ⲉϥⲉ̀ⲉⲣⲧⲓⲙⲏ ⲉ̀ⲣⲟϥ ⲛ̀ϫⲉ ⲡⲓⲟⲩⲏⲃ ⲟⲩⲧⲉ ⲟⲩⲁⲓ ⲉⲑⲛⲁⲛⲉϥ ⲛⲉⲙ ⲟⲩⲧⲉ ⲟⲩⲁⲓ ⲉϥϩⲱⲟⲩ ⲕⲁⲧⲁ ⲫⲏ ⲉⲧⲉ ⲡⲓⲟⲩⲏⲃ ⲉⲣⲧⲓⲙⲏ ⲉ̀ⲣⲟϥ ⲉϥⲉⲟϩⲓ ⲉ̀ⲣⲁⲧϥ ⲙ̀ⲡⲁⲓⲣⲏϯ		And the priest shall make a valuation between the good and the bad, and accordingly as the priest shall value it, so shall it stand.	καὶ τιµήσεται αὐτὸ ὁ ἱερεὺς ἀνὰ µέσον καλοῦ καὶ ἀνὰ µέσον πονηροῦ, καὶ καθότι ἂν τιµήσεται ὁ ἱερεύς, οὕτως στήσεται.						
Leviticus	27	27	13	OT	1. OT	Pentateuch	1. Pentateuch	01. Pentateuch	03. Leviticus	ⲉ̀ϣⲱⲡ ⲇⲉ ϧⲉⲛ ⲟⲩⲥⲱϯ ⲛ̀ⲧⲉϥⲥⲟⲧϥ ⲉϥⲉ̀ⲧⲟⲩϩⲉ ⲡⲓⲣⲉⲉ̅ ⲉ̀ϫⲉⲛ ⲧⲉϥⲧⲓⲙⲏ		And if the worshipper will at all redeem it, he shall add the fifth part to its value.	ἐὰν δὲ λυτρούµενος λυτρώσηται αὐτό, προσθήσει τὸ ἐπίπεµπτον πρὸς τὴν τιµὴν αὐτοῦ.						
Leviticus	27	27	14	OT	1. OT	Pentateuch	1. Pentateuch	01. Pentateuch	03. Leviticus	ⲟⲩⲟϩ ⲫⲣⲱⲙⲓ ⲫⲏ ⲉⲧⲛⲁⲉⲣⲁⲅⲓⲁⲍⲓⲛ ⲙ̀ⲡⲉϥⲏⲓ ⲉϥⲟⲩⲁⲃ ⲙ̀ⲡϭ̅ⲥ̅ ⲟⲩⲟϩ ⲉϥⲉ̀ⲉⲣⲧⲓⲙⲏ ⲉ̀ⲣⲟϥ ⲛ̀ϫⲉ ⲡⲓⲟⲩⲏⲃ ⲟⲩⲧⲉ ⲫⲏ ⲉⲧⲛⲁⲛⲉϥ ⲛⲉⲙ ⲟⲩⲧⲉ ⲫⲏ ⲉⲧϩⲱⲟⲩ ⲙ̀ⲫⲣⲏϯ ⲉⲧⲉ ⲡⲓⲟⲩⲏⲃ ⲛⲁⲉⲣⲧⲓⲙⲏ ⲉ̀ⲣⲟϥ ⲡⲁⲓⲣⲏϯ ⲉϥⲉ̀ⲟϩⲓ		And whatsoever man shall consecrate his house as holy to the Lord, the priest shall make a valuation of it between the good and the bad: as the priest shall value it, so shall it stand.	Καὶ ἄνθρωπος, ὃς ἂν ἁγιάσῃ τὴν οἰκίαν αὐτοῦ ἁγίαν τῷ κυρίῳ, καὶ τιµήσεται αὐτὴν ὁ ἱερεὺς ἀνὰ µέσον καλῆς καὶ ἀνὰ µέσον πονηρᾶς· ὡς ἂν τιµήσεται αὐτὴν ὁ ἱερεύς, οὕτως σταθήσεται.						
Leviticus	27	27	15	OT	1. OT	Pentateuch	1. Pentateuch	01. Pentateuch	03. Leviticus	ⲉ̀ϣⲱⲡ ⲇⲉ ⲛ̀ϫⲉ ⲫⲏ ⲉⲧⲁϥⲉⲣⲁⲅⲓⲁⲍⲓⲛ ⲙ̀ⲡⲉϥⲏⲓ ⲛ̀ⲧⲉϥⲥⲱϯ ⲙ̀ⲡⲉϥⲏⲓ ⲉϥⲉ̀ⲧⲟⲩϩⲟ ⲉ̀ϩⲣⲏⲓ ⲉ̀ϫⲱϥ ⲙ̀ⲡⲓⲣⲉⲉ̅ ⲛ̀ⲧⲉ ⲡⲓϩⲁⲧ ⲛ̀ⲧⲉ ⲧⲉϥⲧⲓⲙⲏ ⲟⲩⲟϩ ⲉϥⲉ̀ϣⲱⲡⲓ ⲛⲁϥ		And if he that has sanctified it should redeem his house, he shall add to it the fifth part of the money of the valuation, and it shall be his.	ἐὰν δὲ ὁ ἁγιάσας αὐτὴν λυτρῶται τὴν οἰκίαν αὐτοῦ, προσθήσει ἐπ’ αὐτὸ τὸ ἐπίπεµπτον τοῦ ἀργυρίου τῆς τιµῆς, καὶ ἔσται αὐτῷ.						
Leviticus	27	27	16	OT	1. OT	Pentateuch	1. Pentateuch	01. Pentateuch	03. Leviticus	ⲉ̀ϣⲱⲡ ⲇⲉ ⲛ̀ⲧⲉ ⲡⲓⲣⲱⲙⲓ ⲉⲣⲁⲅⲓⲁⲍⲓⲛ ⲉ̀ⲃⲟⲗ ϧⲉⲛ ⲧⲕⲟⲓ ⲛ̀ⲧⲉ ⲡⲉϥⲁⲙⲁϩⲓ ⲙ̀ⲡϭ̅ⲥ̅ ⲟⲩⲟϩ ⲉⲥⲉ̀ϣⲱⲡⲓ ⲛ̀ϫⲉ ⲧⲉϥⲧⲓⲙⲏ ⲕⲁⲧⲁ ⲡⲉϥϫⲣⲟϫ ⲛ̀ⲛ̅ ⲛ̀ⲥⲁⲑⲉⲣⲓ ⲉⲩⲕⲏⲃ ϧⲁ ⲟⲩⲕⲟⲣⲟⲥ ⲛ̀ⲓⲱⲧ		And if a man should hallow to the Lord a part of the field of his possession, then the valuation shall be according to its seed, fifty didrachms of silver for a homer of barley.	Ἐὰν δὲ ἀπὸ τοῦ ἀγροῦ τῆς κατασχέσεως αὐτοῦ ἁγιάσῃ ἄνθρωπος τῷ κυρίῳ, καὶ ἔσται ἡ τιµὴ κατὰ τὸν σπόρον αὐτοῦ, κόρου κριθῶν πεντήκοντα δίδραχµα ἀργυρίου.						
Leviticus	27	27	17	OT	1. OT	Pentateuch	1. Pentateuch	01. Pentateuch	03. Leviticus	ⲉ̀ϣⲱⲡ ⲇⲉ ⲁϥϣⲁⲛⲧⲟⲩⲃⲟ ⲙ̀ⲡⲉϥⲓⲟϩⲓ ⲓⲥϫⲉⲛ ϯⲣⲟⲙⲡⲓ ⲛ̀ⲧⲉ ⲡⲓⲭⲱ ⲉ̀ⲃⲟⲗ ⲉⲩⲉ̀ⲥⲉⲙⲛⲏⲧϥ ⲕⲁⲧⲁ ⲧⲉϥⲧⲓⲙⲏ		And if he should sanctify his field from the year of release, it shall stand according to his valuation.	ἐὰν δὲ ἀπὸ τοῦ ἐνιαυτοῦ τῆς ἀφέσεως ἁγιάσῃ τὸν ἀγρὸν αὐτοῦ, κατὰ τὴν τιµὴν αὐτοῦ στήσεται.						
Leviticus	27	27	18	OT	1. OT	Pentateuch	1. Pentateuch	01. Pentateuch	03. Leviticus	ⲉ̀ϣⲱⲡ ⲇⲉ ⲉ̀ⲡϧⲁⲉ̀ ⲙⲉⲛⲉⲛⲥⲁ ⲡⲓⲭⲱ ⲉ̀ⲃⲟⲗ ⲛ̀ⲧⲉϥⲉⲣⲁⲅⲓⲁⲍⲓⲛ ⲙ̀ⲡⲉϥⲓⲟϩⲓ ⲟⲩⲟϩ ⲉⲣⲉ ⲡⲓⲟⲩⲏⲃ ⲉⲡ ⲡⲓϩⲁⲧ ⲉⲣⲟϥ ⲓⲥϫⲉⲛ ⲛⲓⲣⲟⲙⲡⲓ ⲉⲧⲥⲟϫⲡ ϣⲁ ϯⲣⲟⲙⲡⲓ ⲛ̀ⲧⲉ ⲡⲓⲭⲱ ⲉ̀ⲃⲟⲗ ⲟⲩⲟϩ ⲉⲩⲉ̀ⲱⲗⲓ ⲛ̀ⲧⲉϥϣⲉⲃⲓⲱ ⲉ̀ⲃⲟⲗ ϧⲉⲛ ⲧⲉϥⲧⲓⲙⲏ		And if he should sanctify his field in the latter time after the release, the priest shall reckon to him the money for the remaining years, until the next year of release, and it shall be deducted as an equivalent from his full valuation.	ἐὰν δὲ ἔσχατον µετὰ τὴν ἄφεσιν ἁγιάσῃ τὸν ἀγρὸν αὐτοῦ, προσλογιεῖται αὐτῷ ὁ ἱερεὺς τὸ ἀργύριον ἐπὶ τὰ ἔτη τὰ ἐπίλοιπα ἕως εἰς τὸν ἐνιαυτὸν τῆς ἀφέσεως, καὶ ἀνθυφαιρεθήσεται ἀπὸ τῆς συντιµήσεως αὐτοῦ.						
Leviticus	27	27	19	OT	1. OT	Pentateuch	1. Pentateuch	01. Pentateuch	03. Leviticus	ⲟⲩⲟϩ ⲉ̀ϣⲱⲡ ⲉϥⲛⲁⲥⲱϯ ⲙ̀ⲡⲉϥⲓⲟϩⲓ ⲛ̀ϫⲉ ⲫⲏ ⲉⲧⲁϥⲉⲣⲁⲅⲓⲁⲍⲓⲛ ⲙ̀ⲙⲟϥ ⲉϥⲉ̀ⲧⲟⲩϩⲉ ⲡⲓⲣⲉⲉ̅ ⲛ̀ⲧⲉ ⲡⲓϩⲁⲧ ⲛ̀ⲧⲉ ⲧⲉϥⲧⲓⲙⲏ ⲟⲩⲟϩ ⲉϥⲉ̀ϣⲱⲡⲓ ⲛⲁϥ		And if he that sanctified the field would redeem it, he shall add to its value the fifth part of the money, and it shall be his.	ἐὰν δὲ λυτρῶται τὸν ἀγρὸν ὁ ἁγιάσας αὐτόν, προσθήσει τὸ ἐπίπεµπτον τοῦ ἀργυρίου πρὸς τὴν τιµὴν αὐτοῦ, καὶ ἔσται αὐτῷ.						
Leviticus	27	27	20	OT	1. OT	Pentateuch	1. Pentateuch	01. Pentateuch	03. Leviticus	ⲉ̀ϣⲱⲡ ⲇⲉ ⲛ̀ⲧⲉϥⲥⲱϯ ⲙ̀ⲡⲓⲓⲟϩⲓ ⲟⲩⲟϩ ⲛ̀ⲧⲉϥϯ ⲙ̀ⲡⲓⲓⲟϩⲓ ⲉ̀ⲃⲟⲗ ⲛ̀ⲕⲉⲥⲟⲡ ⲛ̀ⲕⲉⲣⲱⲙⲓ ⲛ̀ⲛⲉϥⲥⲉⲧ ⲡⲓⲓⲟϩⲓ ϫⲉ		And if he do not redeem the field, but should sell the field to another man, he shall not after redeem it.	ἐὰν δὲ µὴ λυτρῶται τὸν ἀγρὸν καὶ ἀποδῶται τὸν ἀγρὸν ἀνθρώπῳ ἑτέρῳ, οὐκέτι µὴ λυτρώσηται αὐτόν,						
Leviticus	27	27	21	OT	1. OT	Pentateuch	1. Pentateuch	01. Pentateuch	03. Leviticus	ⲁⲗⲗⲁ ⲉ̀ϣⲱⲡ ⲁⲣⲉϣⲁⲛ ϯⲣⲟⲙⲡⲓ ⲛ̀ⲧⲉ ⲡⲓⲭⲱ ⲉ̀ⲃⲟⲗ ⲥⲓⲛⲓ ⲉϥⲉ̀ϣⲱⲡⲓ ⲉϥⲟⲩⲁⲃ ⲉⲩⲉ̀ⲱⲥϧ ⲙ̀ⲙⲟϥ ⲙ̀ⲡϭ̅ⲥ̅ ⲙ̀ⲫⲣⲏϯ ⲙ̀ⲡⲓⲕⲁϩⲓ ⲉⲧⲁⲩⲥⲟⲧϥ ⲉ̀ⲃⲟⲗ ⲙ̀ⲡⲓⲟⲩⲏⲃ ⲟⲩⲟϩ ⲉϥⲉ̀ϣⲱⲡⲓ ⲛⲁϥ ⲛ̀ⲟⲩⲁⲙⲁϩⲓ		But the field shall be holy to the Lord after the release, as separated land; the priest shall have possession of it.	ἀλλ’ ἔσται ὁ ἀγρὸς ἐξεληλυθυίας τῆς ἀφέσεως ἅγιος τῷ κυρίῳ ὥσπερ ἡ γῆ ἡ ἀφωρισµένη· τῷ ἱερεῖ ἔσται κατάσχεσις.						
Leviticus	27	27	22	OT	1. OT	Pentateuch	1. Pentateuch	01. Pentateuch	03. Leviticus	ⲉ̀ϣⲱⲡ ⲇⲉ ⲛ̀ⲧⲉϥⲉⲣⲁⲅⲓⲁⲍⲓⲛ ⲙ̀ⲡϭ̅ⲥ̅ ⲉ̀ⲃⲟⲗ ϧⲉⲛ ⲟⲩⲓⲟϩⲓ ⲉⲧⲁϥϣⲟⲡϥ ⲉⲛⲉ ⲉ̀ⲃⲟⲗ ϧⲉⲛ ⲡⲓⲓⲟϩⲓ ⲁⲛ ⲡⲉ ⲛ̀ⲧⲉ ⲡⲉϥⲁⲙⲁϩⲓ		And if he should consecrate to the Lord of a field which he has bought, which is not of the field of his possession,	Ἐὰν δὲ ἀπὸ τοῦ ἀγροῦ, οὗ κέκτηται, ὃς οὐκ ἔστιν ἀπὸ τοῦ ἀγροῦ τῆς κατασχέσεως αὐτοῦ, ἁγιάσῃ τῷ κυρίῳ,						
Leviticus	27	27	23	OT	1. OT	Pentateuch	1. Pentateuch	01. Pentateuch	03. Leviticus	ⲉϥⲉ̀ϥⲓⲱⲡ ⲛⲉⲙⲁϥ ⲛ̀ϫⲉ ⲡⲓⲟⲩⲏⲃ ⲉ̀ⲡⲓⲧⲉⲗⲟⲥ ⲛ̀ⲧⲉ ϯⲧⲓⲙⲏ ⲉ̀ⲃⲟⲗ ϧⲉⲛ ϯⲣⲟⲙⲡⲓ ⲛ̀ⲧⲉ ⲡⲓⲭⲱ ⲉ̀ⲃⲟⲗ ⲟⲩⲟϩ ⲉϥⲉ̀ϯ ⲛ̀ϯⲧⲓⲙⲏ ϧⲉⲛ ϯⲣⲟⲙⲡⲓ ⲉⲧⲉ̀ⲙⲙⲁⲩ ⲉⲥⲟⲩⲁⲃ ⲙ̀ⲡϭ̅ⲥ̅		the priest shall reckon to him the full valuation from the year of release, and he shall pay the valuation in that day as holy to the Lord.	λογιεῖται πρὸς αὐτὸν ὁ ἱερεὺς τὸ τέλος τῆς τιµῆς ἐκ τοῦ ἐνιαυτοῦ τῆς ἀφέσεως, καὶ ἀποδώσει τὴν τιµὴν ἐν τῇ ἡµέρᾳ ἐκείνῃ ἅγιον τῷ κυρίῳ·						
Leviticus	27	27	24	OT	1. OT	Pentateuch	1. Pentateuch	01. Pentateuch	03. Leviticus	ⲟⲩⲟϩ ϧⲉⲛ ϯⲣⲟⲙⲡⲓ ⲛ̀ⲧⲉ ⲡⲓⲭⲱ ⲉ̀ⲃⲟⲗ ⲉⲩⲉ̀ϯ ⲙ̀ⲡⲓⲓⲟϩⲓ ⲙ̀ⲡⲓⲣⲱⲙⲓ ⲫⲏ ⲉⲧⲁϥϣⲟⲡϥ ⲛ̀ⲧⲟⲧϥ ⲫⲏ ⲉⲧⲉⲫⲱϥ ⲡⲉ ⲡⲓⲓⲟϩⲓ		And in the year of release the land shall be restored to the man of whom the other bought it, whose the possession of the land was.	καὶ ἐν τῷ ἐνιαυτῷ τῆς ἀφέσεως ἀποδοθήσεται ὁ ἀγρὸς τῷ ἀνθρώπῳ, παρ’ οὗ κέκτηται αὐτόν, οὗ ἦν ἡ κατάσχεσις τῆς γῆς.						
Leviticus	27	27	25	OT	1. OT	Pentateuch	1. Pentateuch	01. Pentateuch	03. Leviticus	ⲟⲩⲟϩ ⲧⲓⲙⲏ ⲛⲓⲃⲉⲛ ⲉⲥⲉ̀ϣⲱⲡⲓ ⲉⲩϣⲓ ⲙ̀ⲙⲟⲥ ϧⲉⲛ ϩⲁⲛⲙⲁϣⲓ ⲉⲩⲟⲩⲁⲃ ⲟⲩⲟϩ ⲉⲥⲉ̀ϣⲱⲡⲓ ⲛ̀ϫⲉ ϯⲥⲁⲑⲉⲣⲓ ⲉⲥⲕⲏⲃ ⲛ̀ⲕ̅ ⲛ̀ⲟⲃⲟⲗⲟⲥ		And every valuation shall be by holy weights: the didrachm shall be twenty oboli.	καὶ πᾶσα τιµὴ ἔσται σταθµίοις ἁγίοις· εἴκοσι ὀβολοὶ ἔσται τὸ δίδραχµον.						
Leviticus	27	27	26	OT	1. OT	Pentateuch	1. Pentateuch	01. Pentateuch	03. Leviticus	ⲟⲩⲟϩ ϣⲁⲙⲓⲥⲓ ⲛⲓⲃⲉⲛ ⲉⲧⲛⲁϣⲱⲡⲓ ϧⲉⲛ ⲛⲉⲧⲉⲛⲧⲉⲃⲛⲱⲟⲩⲓ ⲉϥⲉ̀ϣⲱⲡⲓ ⲙⲡϭ̅ⲥ̅ ⲟⲩⲟϩ ⲛ̀ⲛⲉ ϩⲗⲓ ϣⲉⲃⲓⲏⲧϥ ⲓⲧⲉ ⲟⲩⲙⲁⲥⲓ ⲓⲧⲉ ⲟⲩⲉⲥⲱⲟⲩ ⲉⲩⲉ̀ϣⲱⲡⲓ ⲙ̀ⲡϭ̅ⲥ̅		And every first-born which shall be produced among thy cattle shall be the Lord’s, and no man shall sanctify it: whether calf or sheep, it is the Lord’s.	Καὶ πᾶν πρωτότοκον, ὃ ἂν γένηται ἐν τοῖς κτήνεσίν σου, ἔσται τῷ κυρίῳ, καὶ οὐ καθαγιάσει οὐθεὶς αὐτό· ἐάν τε µόσχον ἐάν τε πρόβατον, τῷ κυρίῳ ἐστίν.						
Leviticus	27	27	27	OT	1. OT	Pentateuch	1. Pentateuch	01. Pentateuch	03. Leviticus	ⲉ̀ϣⲱⲡ ⲇⲉ ⲉ̀ⲃⲟⲗ ϧⲉⲛ ⲛⲓϥⲧⲉⲫⲁⲧ ⲉⲧϭⲁϧⲉⲙ ⲉϥⲉ̀ϣⲓⲃϯ ⲕⲁⲧⲁ ⲧⲉϥⲧⲓⲙⲏ ⲟⲩⲟϩ ⲉϥⲉ̀ⲧⲟⲩϩⲟ ⲉ̀ϫⲱϥ ⲙ̀ⲡⲉϥⲣⲉⲉ̅ ⲟⲩⲟϩ ⲉϥⲉ̀ϣⲱⲡⲓ ⲛⲁϥ ⲉ̀ϣⲱⲡ ⲇⲉ ⲁϥϣ̀ⲧⲉⲙⲥⲟⲧϥ ⲉⲩⲉ̀ⲧⲏⲓϥ ⲉ̀ⲃⲟⲗ ⲕⲁⲧⲁ ⲧⲉϥⲧⲓⲙⲏ		But if he should redeem an unclean beast, according to its valuation, then he shall add the fifth part to it, and it shall be his; and if he redeem it not, it shall be sold according to its valuation.	ἐὰν δὲ τῶν τετραπόδων τῶν ἀκαθάρτων, ἀλλάξει κατὰ τὴν τιµὴν αὐτοῦ καὶ προσθήσει τὸ ἐπίπεµπτον πρὸς αὐτό, καὶ ἔσται αὐτῷ· ἐὰν δὲ µὴ λυτρῶται, πραθήσεται κατὰ τὸ τίµηµα αὐτοῦ.						
Leviticus	27	27	28	OT	1. OT	Pentateuch	1. Pentateuch	01. Pentateuch	03. Leviticus	ⲁⲛⲁⲑⲉⲙⲁ ⲇⲉ ⲛⲓⲃⲉⲛ ⲫⲏ ⲉⲧⲉ ⲫⲣⲱⲙⲓ ⲛⲁⲧⲏⲓϥ ⲙ̀ⲡϭ̅ⲥ̅ ⲉ̀ⲃⲟⲗ ϧⲉⲛ ⲛ̀ⲭⲁⲓ ⲛⲓⲃⲉⲛ ⲉⲧⲉ ⲛ̀ⲧⲁϥ ⲓⲥϫⲉⲛ ⲫⲣⲱⲙⲓ ϣⲁ ⲡⲧⲉⲃⲛⲏ ⲟⲩⲟϩ ⲛ̀ⲛⲉϥϯ ⲉ̀ⲃⲟⲗ ϧⲉⲛ ⲟⲩⲓⲟϩⲓ ⲛ̀ⲧⲉ ⲟⲩⲁⲙⲁϩⲓ ⲛ̀ⲧⲁϥ ⲟⲩⲇⲉ ⲛ̀ⲛⲉϥⲥⲉⲧ ⲁⲛⲁⲑⲉⲙⲁ ⲛⲓⲃⲉⲛ ⲉⲧⲉϥⲛⲁⲱϣ ⲙ̀ⲙⲱⲟⲩ ϫⲉ ⲡⲉⲑⲟⲩⲁⲃ ⲡⲉ ⲛ̀ⲧⲉ ⲛⲏ ⲉⲑⲟⲩⲁⲃ ⲙ̀ⲡϭ̅ⲥ̅		And every dedicated thing which a man shall dedicate to the Lord of all that he has, whether man or beast, or of the field of his possession, he shall not sell it, nor redeem it: every devoted thing shall be most holy to the Lord.	πᾶν δὲ ἀνάθεµα, ὃ ἐὰν ἀναθῇ ἄνθρωπος τῷ κυρίῳ ἀπὸ πάντων, ὅσα αὐτῷ ἐστιν, ἀπὸ ἀνθρώπου ἕως κτήνους καὶ ἀπὸ ἀγροῦ κατασχέσεως αὐτοῦ, οὐκ ἀποδώσεται οὐδὲ λυτρώσεται· πᾶν ἀνάθεµα ἅγιον ἁγίων ἔσται τῷ κυρίῳ.						
Leviticus	27	27	29	OT	1. OT	Pentateuch	1. Pentateuch	01. Pentateuch	03. Leviticus	ⲟⲩⲟϩ ⲛ̀ⲭⲁⲓ ⲛⲓⲃⲉⲛ ⲛ̀ⲁⲛⲁⲑⲉⲙⲁ ⲉⲧⲟⲩⲛⲁⲉⲛⲟⲩ ⲉ̀ϩⲣⲏⲓ ⲉ̀ϫⲉⲛ ⲛⲓⲣⲱⲙⲓ ⲛ̀ⲛⲟⲩⲥⲟⲧⲟⲩ ⲁⲗⲗⲁ ϧⲉⲛ ⲟⲩⲙⲟⲩ ⲉⲩⲉ̀ⲙⲟⲩ		And whatever shall be dedicated of men, shall not be ransomed, but shall be surely put to death.	καὶ πᾶν, ὃ ἐὰν ἀνατεθῇ ἀπὸ τῶν ἀνθρώπων, οὐ λυτρωθήσεται, ἀλλὰ θανάτῳ θανατωθήσεται.						
