book	chapter	chapter-zfilled	verse	testament	testament-indexed	section	section-indexed	section-indexed-no-testament	book-indexed	Bohairic	Sahidic	English	Greek	Fayyumic	Akhmimic	OldBohairic	Mesokemic	DialectP	Lycopolitan
Leviticus	26	26	15	OT	1. OT	Pentateuch	1. Pentateuch	01. Pentateuch	03. Leviticus	ⲁⲗⲗⲁ ⲛ̀ⲧⲉⲧⲉⲛⲉⲣⲁⲧⲑⲱⲧ ⲛ̀ϩⲏⲧ ⲉ̀ⲣⲱⲟⲩ ⲟⲩⲟϩ ⲛⲁϩⲁⲡ ⲛ̀ⲧⲉⲧⲉⲛⲙⲉⲥⲧⲱⲟⲩ ϧⲉⲛ ⲛⲉⲧⲉⲛⲯⲩⲭⲏ ϩⲱⲥⲇⲉ ⲛ̀ⲑⲱⲧⲉⲛ ⲛ̀ⲧⲉⲧⲉⲛϣ̀ⲧⲉⲙⲓⲣⲓ ⲛ̀ⲛⲁⲉⲛⲧⲟⲗⲏ ⲧⲏⲣⲟⲩ ϩⲱⲥⲇⲉ ⲛ̀ⲧⲉⲧⲉⲛϫⲱⲣ ⲛⲧⲁⲇⲓⲁⲑⲏⲕⲏ ⲉ̀ⲃⲟⲗ		but disobey them, and your soul should loathe my judgments, so that ye should not keep all my commands, so as to break my covenant,	ἀλλὰ ἀπειθήσητε αὐτοῖς καὶ τοῖς κρίµασίν µου προσοχθίσῃ ἡ ψυχὴ ὑµῶν ὥστε ὑµᾶς µὴ ποιεῖν πάσας τὰς ἐντολάς µου ὥστε διασκεδάσαι τὴν διαθήκην µου,						
Leviticus	26	26	16	OT	1. OT	Pentateuch	1. Pentateuch	01. Pentateuch	03. Leviticus	ⲟⲩⲟϩ ⲁ̀ⲛⲟⲕ ϩⲱ ⲉⲓⲉ̀ⲓⲣⲓ ⲛⲱⲧⲉⲛ ⲙ̀ⲡⲁⲓⲣⲏϯ ⲟⲩⲟϩ ⲉⲓⲉ̀ⲧⲟⲩϩⲟ ⲉ̀ϫⲉⲛ ⲑⲏⲛⲟⲩ ⲛ̀ϯⲙⲉⲧⲁⲧϣⲁϣⲛⲓ ⲛⲉⲙ ϯⲯⲱⲣⲁ ⲛⲉⲙ ⲡⲓⲥⲑⲉⲣⲧⲉⲣ ⲛⲉⲧⲉⲛⲃⲁⲗ ⲉⲩⲧⲏⲥ ⲟⲩⲟϩ ⲉⲩⲧⲟⲙⲧ ⲟⲩⲟϩ ⲛⲉⲧⲉⲛⲯⲩⲭⲏ ⲉⲩⲃⲏⲗ ⲉ̀ⲃⲟⲗ ⲟⲩⲟϩ ⲉⲣⲉⲧⲉⲛⲉ̀ⲥⲓϯ ⲙ̀ⲡⲉⲧⲉⲛϫⲣⲟϫ ⲉ̀ⲡⲉⲧϣⲟⲩⲓⲧ ⲟⲩⲟϩ ⲉⲩⲉ̀ⲟⲩⲟⲙⲟⲩ ⲛ̀ϫⲉ ⲛⲏ ⲉⲧϯ ⲟⲩⲃⲉ ⲑⲏⲛⲟⲩ		then will I do thus to you: I will even bring upon you perplexity and the itch, and the fever that causes your eyes to waste away, and disease that consumes your life; and ye shall sow your seeds in vain, and your enemies shall eat them.	καὶ ἐγὼ ποιήσω οὕτως ὑµῖν καὶ ἐπισυστήσω ἐφ’ ὑµᾶς τὴν ἀπορίαν τήν τε ψώραν καὶ τὸν ἴκτερον καὶ σφακελίζοντας τοὺς ὀφθαλµοὺς ὑµῶν καὶ τὴν ψυχὴν ὑµῶν ἐκτήκουσαν, καὶ σπερεῖτε διὰ κενῆς τὰ σπέρµατα ὑµῶν, καὶ ἔδονται οἱ ὑπεναντίοι ὑµῶν·						
Leviticus	26	26	17	OT	1. OT	Pentateuch	1. Pentateuch	01. Pentateuch	03. Leviticus	ⲟⲩⲟϩ ⲉⲓⲉ̀ⲧⲁϫⲣⲟ ⲙ̀ⲡⲁϩⲟ ⲉ̀ϫⲉⲛ ⲑⲏⲛⲟⲩ ⲟⲩⲟϩ ⲉⲣⲉⲧⲉⲛⲉ̀ϩⲉⲓ ⲙ̀ⲡⲉⲙ̀ⲑⲟ ⲛ̀ⲛⲉⲧⲉⲛϫⲁϫⲓ ⲟⲩⲟϩ ⲉⲩⲉ̀ϭⲟϫⲓ ⲛ̀ⲥⲱⲧⲉⲛ ⲛ̀ϫⲉ ⲛⲏ ⲉⲑⲙⲟⲥϯ ⲙ̀ⲙⲱⲧⲉⲛ ⲟⲩⲟϩ ⲉⲣⲉⲧⲉⲛⲉ̀ⲫⲱⲧ ⲙ̀ⲙⲟⲛ ⲡⲉⲧϭⲟϫⲓ ⲛ̀ⲥⲁ ⲑⲏⲛⲟⲩ		And I will set my face against you, and ye shall fall before your enemies, and they that hate you shall pursue you; and ye shall flee, no one pursuing you.	καὶ ἐπιστήσω τὸ πρόσωπόν µου ἐφ’ ὑµᾶς, καὶ πεσεῖσθε ἐναντίον τῶν ἐχθρῶν ὑµῶν, καὶ διώξονται ὑµᾶς οἱ µισοῦντες ὑµᾶς, καὶ φεύξεσθε οὐθενὸς διώκοντος ὑµᾶς. —						
Leviticus	26	26	18	OT	1. OT	Pentateuch	1. Pentateuch	01. Pentateuch	03. Leviticus	ⲟⲩⲟϩ ϣⲁ ⲫⲁⲓ ⲁⲣⲉⲧⲉⲛϣ̀ⲧⲉⲙⲥⲱⲧⲉⲙ ⲛ̀ⲥⲱⲓ ⲟⲩⲟϩ ⲉⲓⲉ̀ⲟⲩⲁϩⲧⲟⲧ ⲉ̀ⲉⲣⲡⲉⲇⲉⲩⲓⲛ ⲙ̀ⲙⲱⲧⲉⲛ ϧⲉⲛ ⲍ̅ ⲛ̀ⲉⲣϧⲟⲧ ⲉ̀ϫⲉⲛ ⲛⲉⲧⲉⲛⲛⲟⲃⲓ		And if ye still refuse to hearken to me, then will I chasten you yet more even seven times for your sins.	καὶ ἐὰν ἕως τούτου µὴ ὑπακούσητέ µου, καὶ προσθήσω τοῦ παιδεῦσαι ὑµᾶς ἑπτάκις ἐπὶ ταῖς ἁµαρτίαις ὑµῶν						
Leviticus	26	26	19	OT	1. OT	Pentateuch	1. Pentateuch	01. Pentateuch	03. Leviticus	ⲟⲩⲟϩ ⲉⲓⲉ̀ϧⲟⲙϧⲉⲙ ⲙ̀ⲡϣⲱⲃϣ ⲛ̀ⲧⲉⲧⲉⲛⲙⲉⲧⲣⲉϥϩⲓⲡϩⲟ ⲟⲩⲟϩ ⲉⲓⲉ̀ⲭⲱ ⲛ̀ⲧⲫⲉ ⲛⲱⲧⲉⲛ ⲙ̀ⲫⲣⲏϯ ⲛ̀ⲟⲩⲃⲉⲛⲓⲡⲓ ⲛⲉⲙ ⲡⲓⲕⲁϩⲓ ⲙ̀ⲫⲣⲏϯ ⲛ̀ⲟⲩϩⲟⲙⲧ ⲛⲱⲧⲉⲛ		And I will break down the haughtiness of your pride; and I will make your heaven iron, and your earth as it were brass.	καὶ συντρίψω τὴν ὕβριν τῆς ὑπερηφανίας ὑµῶν καὶ θήσω τὸν οὐρανὸν ὑµῖν σιδηροῦν καὶ τὴν γῆν ὑµῶν ὡσεὶ χαλκῆν,						
Leviticus	26	26	20	OT	1. OT	Pentateuch	1. Pentateuch	01. Pentateuch	03. Leviticus	ⲟⲩⲟϩ ⲧⲉⲧⲉⲛϫⲟⲙ ⲉⲥⲉ̀ϣⲱⲡⲓ ⲉ̀ⲡⲉⲧϣⲟⲩⲓⲧ ⲟⲩⲟϩ ⲛ̀ⲛⲉ ⲡⲉⲧⲉⲛⲕⲁϩⲓ ϯ ⲙ̀ⲡⲉϥⲟⲩⲧⲁϩ ⲟⲩⲟϩ ⲡⲓϣϣⲏⲛ ⲛ̀ⲧⲉⲧⲉⲛⲕⲟⲓ ⲛ̀ⲛⲉϥϯ ⲙ̀ⲡⲉϥⲟⲩⲧⲁϩ		And your strength shall be in vain; and your land shall not yield its seed, and the tree of your field shall not yield its fruit.	καὶ ἔσται εἰς κενὸν ἡ ἰσχὺς ὑµῶν, καὶ οὐ δώσει ἡ γῆ ὑµῶν τὸν σπόρον αὐτῆς, καὶ τὸ ξύλον τοῦ ἀγροῦ ὑµῶν οὐ δώσει τὸν καρπὸν αὐτοῦ. —						
Leviticus	26	26	21	OT	1. OT	Pentateuch	1. Pentateuch	01. Pentateuch	03. Leviticus	ⲟⲩⲟϩ ⲙⲉⲛⲉⲛⲥⲁ ⲛⲁⲓ ⲉ̀ϣⲱⲡ ⲛ̀ⲧⲉⲧⲉⲛⲙⲟϣⲓ ⲉⲣⲉⲧⲉⲛⲣⲁⲕⲓ ⲟⲩⲟϩ ⲛ̀ⲧⲉⲧⲉⲛϣ̀ⲧⲉⲙⲥⲱⲧⲉⲙ ⲛ̀ⲥⲱⲓ ⲟⲩⲟϩ ⲉⲓⲉⲧⲟⲩϩⲟ ⲉ̀ⲣⲱⲧⲉⲛ ⲛ̀ⲍ̅ ⲛ̀ⲉⲣϧⲟⲧ ⲕⲁⲧⲁ ⲛⲉⲧⲉⲛⲛⲟⲃⲓ		And if after this ye should walk perversely, and not be willing to obey me, I will further bring upon you seven plagues according to your sins.	καὶ ἐὰν µετὰ ταῦτα πορεύησθε πλάγιοι καὶ µὴ βούλησθε ὑπακούειν µου, προσθήσω ὑµῖν πληγὰς ἑπτὰ κατὰ τὰς ἁµαρτίας ὑµῶν						
Leviticus	26	26	22	OT	1. OT	Pentateuch	1. Pentateuch	01. Pentateuch	03. Leviticus	ⲟⲩⲟϩ ⲉⲓⲉ̀ⲟⲩⲱⲣⲡ ⲉ̀ϫⲉⲛ ⲑⲏⲛⲟⲩ ⲛ̀ⲛⲓⲑⲏⲣⲓⲟⲛ ⲛ̀ⲁⲅⲣⲓⲟⲛ ⲛ̀ⲧⲉ ⲡⲓⲕⲁϩⲓ ⲟⲩⲟϩ ⲉⲩⲉ̀ⲟⲩⲉⲙ ⲑⲏⲛⲟⲩ ⲟⲩⲟϩ ⲉⲩⲉ̀ⲙⲟⲩⲛⲕ ⲛ̀ⲛⲉⲧⲉⲛⲧⲉⲃⲛⲱⲟⲩⲓ ⲟⲩⲟϩ ⲉⲩⲉ̀ⲉⲣ ⲑⲏⲛⲟⲩ ⲛ̀ⲕⲟⲩϫⲓ ⲟⲩⲟϩ ⲉⲩⲉ̀ϣⲱⲡⲓ ⲉⲩϣⲏϥ ⲛ̀ϫⲉ ⲛⲉⲧⲉⲛⲙⲱⲓⲧ		And I will send upon you the wild beasts of the land, and they shall devour you, and shall consume your cattle: and I will make you few in number, and your ways shall be desolate.	καὶ ἀποστελῶ ἐφ’ ὑµᾶς τὰ θηρία τὰ ἄγρια τῆς γῆς, καὶ κατέδεται ὑµᾶς καὶ ἐξαναλώσει τὰ κτήνη ὑµῶν καὶ ὀλιγοστοὺς ποιήσει ὑµᾶς, καὶ ἐρηµωθήσονται αἱ ὁδοὶ ὑµῶν. —						
Leviticus	26	26	23	OT	1. OT	Pentateuch	1. Pentateuch	01. Pentateuch	03. Leviticus	ⲟⲩⲟϩ ⲉ̀ϣⲱⲡ ⲉ̀ϩⲣⲏⲓ ⲉ̀ϫⲉⲛ ⲛⲁⲓ ⲛ̀ⲧⲉⲧⲉⲛϣ̀ⲧⲉⲙϭⲓⲥⲃⲱ ⲁⲗⲗⲁ ⲛ̀ⲧⲉⲧⲉⲛⲙⲟϣⲓ ⲛⲉⲙⲏⲓ ⲉⲣⲉⲧⲉⲛⲣⲁⲕⲓ		And if hereupon ye are not corrected, but walk perversely towards me,	καὶ ἐπὶ τούτοις ἐὰν µὴ παιδευθῆτε, ἀλλὰ πορεύησθε πρός µε πλάγιοι,						
Leviticus	26	26	24	OT	1. OT	Pentateuch	1. Pentateuch	01. Pentateuch	03. Leviticus	ⲁ̀ⲛⲟⲕ ϩⲱ ⲉⲓⲉ̀ⲙⲟϣⲓ ⲛⲉⲙⲱⲧⲉⲛ ϧⲉⲛ ⲟⲩϫⲱⲛⲧ ⲉϥⲣⲁⲕⲓ ⲟⲩⲟϩ ⲉⲓⲉ̀ϣⲁⲣⲓ ⲉ̀ⲣⲱⲧⲉⲛ ⲕⲉⲅⲉ ⲛ̀ⲍ̅ ⲛ̀ⲥⲟⲡ ⲛ̀ⲧϣⲉⲃⲓⲱ ⲛ̀ⲛⲉⲧⲉⲛⲛⲟⲃⲓ		I also will walk with you with a perverse spirit, and I also will smite you seven times for your sins.	πορεύσοµαι κἀγὼ µεθ’ ὑµῶν θυµῷ πλαγίῳ καὶ πατάξω ὑµᾶς κἀγὼ ἑπτάκις ἀντὶ τῶν ἁµαρτιῶν ὑµῶν						
Leviticus	26	26	25	OT	1. OT	Pentateuch	1. Pentateuch	01. Pentateuch	03. Leviticus	ⲟⲩⲟϩ ⲉⲓⲉ̀ⲓⲛⲓ ⲉ̀ϩⲣⲏⲓ ⲉ̀ϫⲱⲧⲉⲛ ⲛ̀ⲟⲩⲥⲏϥⲓ ⲉⲥϭⲓⲙ̀ⲡϣⲓϣ ⲛ̀ⲟⲩϩⲁⲡ ⲛ̀ⲧⲉ ⲟⲩⲇⲓⲁⲑⲏⲕⲏ ⲟⲩⲟϩ ⲉⲣⲉⲧⲉⲛⲉ̀ⲫⲱⲧ ⲉ̀ⲛⲉⲧⲉⲛⲃⲁⲕⲓ ⲟⲩⲟϩ ⲉⲓⲉ̀ⲟⲩⲱⲣⲡ ⲛ̀ⲟⲩⲙⲟⲩ ⲉ̀ϧⲟⲩⲛ ⲉ̀ⲣⲱⲧⲉⲛ ⲟⲩⲟϩ ⲉⲩⲉ̀ϯ ⲑⲏⲛⲟⲩ ⲉ̀ϧⲣⲏⲓ ⲉ̀ⲛⲉⲛϫⲓϫ ⲛ̀ⲧⲉ ⲛⲉⲧⲉⲛϫⲁϫⲓ		And I will bring upon you a sword avenging the cause of my covenant, and ye shall flee for refuge to your cities; and I will send out death against you, and ye shall be delivered into the hands of your enemies.	καὶ ἐπάξω ἐφ’ ὑµᾶς µάχαιραν ἐκδικοῦσαν δίκην διαθήκης, καὶ καταφεύξεσθε εἰς τὰς πόλεις ὑµῶν· καὶ ἐξαποστελῶ θάνατον εἰς ὑµᾶς, καὶ παραδοθήσεσθε εἰς χεῖρας ἐχθρῶν.						
Leviticus	26	26	26	OT	1. OT	Pentateuch	1. Pentateuch	01. Pentateuch	03. Leviticus	ϧⲉⲛ ⲡϫⲓⲛⲑⲣⲟⲩϩⲉϫϩⲉϫ ⲑⲏⲛⲟⲩ ϧⲉⲛ ⲡⲓⲥⲟⲩⲟ ⲛⲉⲙ ⲡⲓⲱⲓⲕ ⲟⲩⲟϩ ⲉⲣⲉ ⲙⲏϯ ⲛ̀ⲥϩⲓⲙⲓ ⲉⲩⲉ̀ϫⲱϫ ⲛ̀ⲛⲉⲧⲉⲛⲱⲓⲕ ϧⲉⲛ ⲟⲩⲑⲣⲓⲣ ⲛ̀ⲟⲩⲱⲧ ⲟⲩⲟϩ ⲉⲩⲉ̀ϯ ⲛ̀ⲛⲓⲱⲓⲕ ⲛⲱⲧⲉⲛ ϧⲉⲛ ⲟⲩⲙⲁϣⲓ ⲟⲩⲟϩ ⲉⲣⲉⲧⲉⲛⲉ̀ⲟⲩⲱⲙ ⲛ̀ⲛⲉⲧⲉⲛⲥⲓ		When I afflict you with famine of bread, then ten women shall bake your loaves in one oven, and they shall render your loaves by weight; and ye shall eat, and not be satisfied.	ἐν τῷ θλῖψαι ὑµᾶς σιτοδείᾳ ἄρτων καὶ πέψουσιν δέκα γυναῖκες τοὺς ἄρτους ὑµῶν ἐν κλιβάνῳ ἑνὶ καὶ ἀποδώσουσιν τοὺς ἄρτους ὑµῶν ἐν σταθµῷ, καὶ φάγεσθε καὶ οὐ µὴ ἐµπλησθῆτε. —						
Leviticus	26	26	27	OT	1. OT	Pentateuch	1. Pentateuch	01. Pentateuch	03. Leviticus	ⲉ̀ϣⲱⲡ ⲇⲉ ⲉ̀ϩⲣⲏⲓ ⲉ̀ϫⲉⲛ ⲛⲁⲓ ⲛ̀ⲧⲉⲧⲉⲛϣ̀ⲧⲉⲙⲥⲱⲧⲉⲙ ⲛ̀ⲥⲱⲓ ⲁⲗⲗⲁ ⲛ̀ⲧⲉⲧⲉⲛⲙⲟϣⲓ ⲛⲉⲙⲏⲓ ⲉⲣⲉⲧⲉⲛⲣⲁⲕⲓ		And if hereupon ye will not obey me, but walk perversely towards me,	ἐὰν δὲ ἐπὶ τούτοις µὴ ὑπακούσητέ µου καὶ πορεύησθε πρός µε πλάγιοι,						
Leviticus	26	26	28	OT	1. OT	Pentateuch	1. Pentateuch	01. Pentateuch	03. Leviticus	ⲁ̀ⲛⲟⲕ ϩⲱ ⲉⲓⲉ̀ⲙⲟϣⲓ ⲛⲉⲙⲱⲧⲉⲛ ϧⲉⲛ ⲟⲩϫⲱⲛⲧ ⲉϥⲣⲁⲕⲓ ⲟⲩⲟϩ ⲉⲓⲉ̀ϯϣⲉⲃⲓⲱ ⲛⲱⲧⲉⲛ ⲁ̀ⲛⲟⲕ ⲛ̀ⲍ̅ ⲛ̀ⲥⲟⲡ ⲕⲁⲧⲁ ⲛⲉⲧⲉⲛⲛⲟⲃⲓ		then will I walk with you with a froward mind, and I will chasten you seven-fold according to your sins.	καὶ αὐτὸς πορεύσοµαι µεθ’ ὑµῶν ἐν θυµῷ πλαγίῳ καὶ παιδεύσω ὑµᾶς ἐγὼ ἑπτάκις κατὰ τὰς ἁµαρτίας ὑµῶν,						
Leviticus	26	26	29	OT	1. OT	Pentateuch	1. Pentateuch	01. Pentateuch	03. Leviticus	ⲟⲩⲟϩ ⲉⲣⲉⲧⲉⲛⲉ̀ⲟⲩⲱⲙ ⲛ̀ⲛⲓⲥⲁⲣⲝ ⲛ̀ⲧⲉ ⲛⲉⲧⲉⲛϣⲏⲣⲓ ⲛⲉⲙ ⲛⲓⲥⲁⲣⲝ ⲛ̀ⲧⲉ ⲛⲉⲧⲉⲛϣⲉⲣⲓ ⲉⲣⲉⲧⲉⲛⲉ̀ⲟⲩⲟⲙⲟⲩ		And ye shall eat the flesh of your sons, and the flesh of your daughters shall ye eat.	καὶ φάγεσθε τὰς σάρκας τῶν υἱῶν ὑµῶν καὶ τὰς σάρκας τῶν θυγατέρων ὑµῶν φάγεσθε·						
Leviticus	26	26	30	OT	1. OT	Pentateuch	1. Pentateuch	01. Pentateuch	03. Leviticus	ⲟⲩⲟϩ ⲉⲓⲉ̀ϣⲱϥ ⲛ̀ⲧⲉⲧⲉⲛⲥⲧⲩⲗⲏ ⲟⲩⲟϩ ⲉⲓⲉ̀ϥⲱϯ ⲉ̀ⲃⲟⲗ ⲛ̀ⲛⲉⲧⲉⲛⲓⲉⲃⲛ̀ϣⲉ ⲛⲉⲙ ⲛⲉⲧⲉⲛⲙⲟⲩⲛⲕ ⲛ̀ϫⲓϫ ⲟⲩⲟϩ ⲉⲓⲉ̀ⲭⲱ ⲛ̀ⲛⲉⲧⲉⲛⲕⲉⲗⲓ ⲉ̀ϫⲉⲛ ⲛⲓⲕⲉⲗⲓ ⲛ̀ⲧⲉ ⲛⲉⲧⲉⲛⲓⲇⲱⲗⲟⲛ ⲟⲩⲟϩ ⲉⲣⲉ ⲧⲁⲯⲩⲭⲏ ⲙⲉⲥⲧⲉ ⲑⲏⲛⲟⲩ		And I will render your pillars desolate, and will utterly destroy your wooden images made with hands; and I will lay your carcases on the carcases of your idols, and my soul shall loathe you.	καὶ ἐρηµώσω τὰς στήλας ὑµῶν καὶ ἐξολεθρεύσω τὰ ξύλινα χειροποίητα ὑµῶν καὶ θήσω τὰ κῶλα ὑµῶν ἐπὶ τὰ κῶλα τῶν εἰδώλων ὑµῶν, καὶ προσοχθιεῖ ἡ ψυχή µου ὑµῖν·						
Leviticus	26	26	31	OT	1. OT	Pentateuch	1. Pentateuch	01. Pentateuch	03. Leviticus	ⲟⲩⲟϩ ⲉⲓⲉ̀ⲭⲱ ⲛ̀ⲛⲉⲧⲉⲛⲃⲁⲕⲓ ⲉ̀ⲡϣⲱϥ ⲟⲩⲟϩ ⲉⲓⲉ̀ⲥⲱϥ ⲛ̀ⲛⲏ ⲉⲑⲟⲩⲁⲃ ⲛ̀ⲧⲱⲧⲉⲛ ⲟⲩⲟϩ ⲛ̀ⲛⲁϣⲱⲗⲉⲙ ⲉ̀ⲡⲥⲑⲟⲓ ⲛ̀ⲧⲉ ⲛⲉⲧⲉⲛϣⲟⲩϣⲱⲟⲩϣⲓ		And I will lay your cities waste, and I will make your sanctuaries desolate, and I will not smell the savour of your sacrifices.	καὶ θήσω τὰς πόλεις ὑµῶν ἐρήµους καὶ ἐξερηµώσω τὰ ἅγια ὑµῶν καὶ οὐ µὴ ὀσφρανθῶ τῆς ὀσµῆς τῶν θυσιῶν ὑµῶν·						
Leviticus	26	26	32	OT	1. OT	Pentateuch	1. Pentateuch	01. Pentateuch	03. Leviticus	ⲟⲩⲟϩ ⲉⲓⲉ̀ϣⲱϥ ⲙ̀ⲡⲉⲧⲉⲛⲕⲁϩⲓ ⲟⲩⲟϩ ⲉⲩⲉ̀ⲉⲣϣⲫⲏⲣⲓ ⲉ̀ϩⲣⲏⲓ ⲉ̀ϫⲱϥ ⲛ̀ϫⲉ ⲛⲉⲧⲉⲛϫⲁϫⲓ ⲛⲏ ⲉⲧϣⲟⲡ ⲛ̀ϧⲏⲧϥ		And I will lay your land desolate, and your enemies who dwell in it shall wonder at it.	καὶ ἐξερηµώσω ἐγὼ τὴν γῆν ὑµῶν, καὶ θαυµάσονται ἐπ’ αὐτῇ οἱ ἐχθροὶ ὑµῶν οἱ ἐνοικοῦντες ἐν αὐτῇ·						
Leviticus	26	26	33	OT	1. OT	Pentateuch	1. Pentateuch	01. Pentateuch	03. Leviticus	ⲟⲩⲟϩ ⲉⲓⲉ̀ϫⲉⲣ ⲑⲏⲛⲟⲩ ⲉ̀ⲃⲟⲗ ϧⲉⲛ ⲛⲓⲉⲑⲛⲟⲥ ⲟⲩⲟϩ ⲉⲥⲉ̀ⲙⲉⲛⲕ ⲑⲏⲛⲟⲩ ⲛ̀ϫⲉ ⲟⲩⲥⲏϥⲓ ⲉⲥⲙⲟϣⲓ ⲉ̀ϫⲉⲛ ⲑⲏⲛⲟⲩ ⲟⲩⲟϩ ⲉⲣⲉ ⲡⲉⲧⲉⲛⲕⲁϩⲓ ϣⲱⲡⲓ ⲉ̀ⲡϣⲱϥ ⲛⲉⲙ ⲛⲉⲧⲉⲛⲡⲟⲗⲓⲥ ⲉⲩⲉ̀ϣⲱⲡⲓ ⲉⲩϣⲏϥ		And I will scatter you among the nations, and the sword shall come upon you and consume you; and your land shall be desolate, and your cities shall be desolate.	καὶ διασπερῶ ὑµᾶς εἰς τὰ ἔθνη, καὶ ἐξαναλώσει ὑµᾶς ἐπιπορευοµένη ἡ µάχαιρα· καὶ ἔσται ἡ γῆ ὑµῶν ἔρηµος, καὶ αἱ πόλεις ὑµῶν ἔσονται ἔρηµοι.						
Leviticus	26	26	34	OT	1. OT	Pentateuch	1. Pentateuch	01. Pentateuch	03. Leviticus	ⲟⲩⲟϩ ⲧⲟⲧⲉ ⲉⲣⲉ ⲡⲕⲁϩⲓ ϯⲙⲁϯ ⲛ̀ⲛⲉϥⲥⲁⲃⲃⲁⲧⲟⲛ ϧⲉⲛ ⲛⲓⲉϩⲟⲟⲩ ⲧⲏⲣⲟⲩ ⲛ̀ⲧⲉ ⲡⲉϥϣⲱϥ ⲟⲩⲟϩ ⲛ̀ⲑⲱⲧⲉⲛ ϩⲱⲧⲉⲛ ⲉⲣⲉⲧⲉⲛⲉ̀ϣⲱⲡⲓ ϧⲉⲛ ⲡⲕⲁϩⲓ ⲛ̀ⲧⲉ ⲛⲉⲧⲉⲛϫⲁϫⲓ ⲟⲩⲟϩ ⲧⲟⲧⲉ ⲉⲣⲉ ⲡⲓⲕⲁϩⲓ ⲉⲣⲥⲁⲃⲃⲁⲧⲓⲍⲓⲛ ⲟⲩⲟϩ ⲉϥⲉ̀ϯⲙⲁϯ ⲛ̀ⲛⲉϥⲥⲁⲃⲃⲁⲧⲟⲛ		Then the land shall enjoy its sabbaths all the days of its desolation.	τότε εὐδοκήσει ἡ γῆ τὰ σάββατα αὐτῆς καὶ πάσας τὰς ἡµέρας τῆς ἐρηµώσεως αὐτῆς, καὶ ὑµεῖς ἔσεσθε ἐν τῇ γῇ τῶν ἐχθρῶν ὑµῶν· τότε σαββατιεῖ ἡ γῆ καὶ εὐδοκήσει τὰ σάββατα αὐτῆς.						
Leviticus	26	26	35	OT	1. OT	Pentateuch	1. Pentateuch	01. Pentateuch	03. Leviticus	ⲛ̀ⲛⲓⲉϩⲟⲟⲩ ⲧⲏⲣⲟⲩ ⲛ̀ⲧⲉ ⲡⲉϥϣⲱϥ ⲉϥⲉ̀ⲉⲣⲥⲁⲃⲃⲁⲧⲓⲍⲓⲛ ⲛ̀ⲛⲏ ⲉⲧⲉ ⲙ̀ⲡⲉϥⲉⲣⲥⲁⲃⲃⲁⲧⲓⲍⲓⲛ ⲙ̀ⲙⲱⲟⲩ ϧⲉⲛ ⲛⲉⲧⲉⲛⲥⲁⲃⲃⲁⲧⲟⲛ ⲙ̀ⲡⲓⲥⲏⲟⲩ ⲉ̀ⲛⲁⲣⲉⲧⲉⲛϣⲟⲡ ϩⲓⲱⲧϥ		And ye shall be in the land of your enemies; then the land shall keep its sabbaths, and the land shall enjoy its sabbaths all the days of its desolation: it shall keep sabbaths which it kept not among your sabbaths, when ye dwelt in it.	πάσας τὰς ἡµέρας τῆς ἐρηµώσεως αὐτῆς σαββατιεῖ ἃ οὐκ ἐσαββάτισεν ἐν τοῖς σαββάτοις ὑµῶν, ἡνίκα κατῳκεῖτε αὐτήν.						
Leviticus	26	26	36	OT	1. OT	Pentateuch	1. Pentateuch	01. Pentateuch	03. Leviticus	ⲟⲩⲟϩ ⲛⲏ ⲉ̀ⲁⲩⲥⲱϫⲡ ⲉ̀ⲃⲟⲗ ϧⲉⲛ ⲑⲏⲛⲟⲩ ϯⲛⲁϯ ⲛ̀ⲟⲩϩⲉⲗⲓ ⲉ̀ϧⲣⲏⲓ ⲉ̀ⲡⲟⲩϩⲏⲧ ⲛ̀ϧⲣⲏⲓ ϧⲉⲛ ⲡⲓⲕⲁϩⲓ ⲛ̀ⲧⲉ ⲛⲟⲩϫⲁϫⲓ ⲟⲩⲟϩ ⲉϥⲉ̀ϭⲟϫⲓ ⲛ̀ⲥⲱⲟⲩ ⲛ̀ϫⲉ ⲡϧⲣⲱⲟⲩ ⲛ̀ⲟⲩϫⲱⲃⲓ ⲉⲩⲓⲛⲓ ⲙ̀ⲙⲟⲥ ⲟⲩⲟϩ ⲉⲩⲉ̀ⲫⲱⲧ ⲙ̀ⲫⲣⲏϯ ⲛ̀ϩⲁⲛⲟⲩⲟⲛ ⲉⲩⲫⲏⲧ ⲉ̀ⲃⲟⲗ ϧⲉⲛ ⲡⲓⲡⲟⲗⲉⲙⲟⲥ ⲟⲩⲟϩ ⲉⲩⲉ̀ϩⲉⲓ ⲙ̀ⲙⲟⲛ ⲡⲉⲧϭⲟϫⲓ ⲛ̀ⲥⲱⲟⲩ		And to those who are left of you I will bring bondage into their heart in the land of their enemies; and the sound of a shaken leaf shall chase them, and they shall flee as fleeing from war, and shall fall when none pursues them.	καὶ τοῖς καταλειφθεῖσιν ἐξ ὑµῶν ἐπάξω δειλίαν εἰς τὴν καρδίαν αὐτῶν ἐν τῇ γῇ τῶν ἐχθρῶν αὐτῶν, καὶ διώξεται αὐτοὺς φωνὴ φύλλου φεροµένου, καὶ φεύξονται ὡς φεύγοντες ἀπὸ πολέµου καὶ πεσοῦνται οὐθενὸς διώκοντος·						
Leviticus	26	26	37	OT	1. OT	Pentateuch	1. Pentateuch	01. Pentateuch	03. Leviticus	ⲟⲩⲟϩ ⲉϥⲉ̀ϩⲓⲡϩⲟ ⲛ̀ϫⲉ ⲟⲩⲥⲟⲛ ⲙ̀ⲡⲉϥⲥⲟⲛ ⲙ̀ⲫⲣⲏϯ ⲛ̀ⲟⲩⲡⲟⲗⲉⲙⲟⲥ ⲙ̀ⲙⲟⲛ ⲡⲉⲧϭⲟϫⲓ ⲛ̀ⲥⲱⲟⲩ ⲟⲩⲟϩ ⲛ̀ⲛⲉⲧⲉⲛϣϫⲉⲙϫⲟⲙ ⲛ̀ⲟϩⲓ ⲉ̀ϧⲟⲩⲛ ⲉ̀ϩⲣⲉⲛ ⲛⲉⲧⲉⲛϫⲁϫⲓ		And brother shall disregard brother as in war, when none pursues; and ye shall not be able to withstand your enemies.	καὶ ὑπερόψεται ὁ ἀδελφὸς τὸν ἀδελφὸν ὡσεὶ ἐν πολέµῳ οὐθενὸς κατατρέχοντος, καὶ οὐ δυνήσεσθε ἀντιστῆναι τοῖς ἐχθροῖς ὑµῶν.						
Leviticus	26	26	38	OT	1. OT	Pentateuch	1. Pentateuch	01. Pentateuch	03. Leviticus	ⲟⲩⲟϩ ⲉⲣⲉⲧⲉⲛⲉ̀ⲧⲁⲕⲟ ϧⲉⲛ ⲛⲓⲉⲑⲛⲟⲥ ⲟⲩⲟϩ ⲉⲣⲉ ⲡⲓⲕⲁϩⲓ ⲛ̀ⲧⲉ ⲛⲉⲧⲉⲛϫⲁϫⲓ ⲉϥⲉ̀ⲟⲩⲉⲙ ⲑⲏⲛⲟⲩ		And ye shall perish among the Gentiles, and the land of your enemies shall devour you.	καὶ ἀπολεῖσθε ἐν τοῖς ἔθνεσιν, καὶ κατέδεται ὑµᾶς ἡ γῆ τῶν ἐχθρῶν ὑµῶν.						
Leviticus	26	26	39	OT	1. OT	Pentateuch	1. Pentateuch	01. Pentateuch	03. Leviticus	ⲟⲩⲟϩ ⲛⲏ ⲉⲧⲁⲩⲥⲱϫⲡ ⲉ̀ⲃⲟⲗ ϧⲉⲛ ⲑⲏⲛⲟⲩ ⲉⲩⲉ̀ⲧⲁⲕⲟ ⲉⲑⲃⲉ ⲛⲟⲩⲛⲟⲃⲓ ⲟⲩⲟϩ ⲉⲑⲃⲉ ⲛⲉⲛⲛⲟⲃⲓ ⲛ̀ⲧⲉ ⲛⲟⲩⲓⲟϯ ϧⲉⲛ ⲡⲕⲁϩⲓ ⲛ̀ⲧⲉ ⲛⲟⲩϫⲁϫⲓ ⲉⲩⲉ̀ⲃⲱⲗ ⲉ̀ⲃⲟⲗ		And those who are left of you shall perish, because of their sins, and because of the sins of their fathers: in the land of their enemies shall they consume away.	καὶ οἱ καταλειφθέντες ἀφ’ ὑµῶν καταφθαρήσονται διὰ τὰς ἁµαρτίας ὑµῶν, ἐν τῇ γῇ τῶν ἐχθρῶν αὐτῶν τακήσονται.						
Leviticus	26	26	40	OT	1. OT	Pentateuch	1. Pentateuch	01. Pentateuch	03. Leviticus	ⲟⲩⲟϩ ⲉⲩⲉ̀ⲟⲩⲱⲛϩ ⲛ̀ⲛⲟⲩⲛⲟⲃⲓ ⲉ̀ⲃⲟⲗ ⲛⲉⲙ ⲛⲓⲛⲟⲃⲓ ⲛ̀ⲧⲉ ⲛⲟⲩⲓⲟϯ ϫⲉ ⲟⲩⲏⲓ ⲁⲩⲉⲣⲡⲁⲣⲁⲃⲉⲛⲓⲛ ⲁⲩϩⲓⲡϩⲟ ⲙ̀ⲙⲟⲓ ⲟⲩⲟϩ ϫⲉ ⲁⲩⲙⲟϣⲓ ⲙ̀ⲡⲁⲙ̀ⲑⲟ ⲉⲩⲣⲁⲕⲓ		And they shall confess their sins, and the sins of their fathers, that they have transgressed and neglected me, and that they have walked perversely before me,	Καὶ ἐξαγορεύσουσιν τὰς ἁµαρτίας αὐτῶν καὶ τὰς ἁµαρτίας τῶν πατέρων αὐτῶν, ὅτι παρέβησαν καὶ ὑπερεῖδόν µε, καὶ ὅτι ἐπορεύθησαν ἐναντίον µου πλάγιοι,						
Leviticus	26	26	41	OT	1. OT	Pentateuch	1. Pentateuch	01. Pentateuch	03. Leviticus	ⲁ̀ⲛⲟⲕ ϩⲱ ⲁⲓⲙⲟϣⲓ ⲛⲉⲙⲱⲟⲩ ϧⲉⲛ ⲟⲩϫⲱⲛⲧ ⲉϥⲣⲁⲕⲓ ⲟⲩⲟϩ ⲉⲓⲉ̀ⲧⲁⲕⲱⲟⲩ ⲉ̀ⲃⲟⲗ ϧⲉⲛ ⲡⲕⲁϩⲓ ⲛ̀ⲧⲉ ⲛⲟⲩϫⲁϫⲓ ⲧⲟⲧⲉ ⲉϥⲉ̀ϣⲫⲓⲧ ⲛ̀ϫⲉ ⲡⲟⲩϩⲏⲧ ⲛ̀ⲁⲧⲥⲉⲃⲓ ⲟⲩⲟϩ ⲧⲟⲧⲉ ⲉⲩⲉ̀ⲕⲁϯ ⲉ̀ⲛⲟⲩⲛⲟⲃⲓ		and I walked with them with a perverse mind; and I will destroy them in the land of their enemies: then shall their uncircumcised heart be ashamed, and then shall they acquiesce in the punishment of their sins.	καὶ ἐγὼ ἐπορεύθην µετ’ αὐτῶν ἐν θυµῷ πλαγίῳ καὶ ἀπολῶ αὐτοὺς ἐν τῇ γῇ τῶν ἐχθρῶν αὐτῶν· τότε ἐντραπήσεται ἡ καρδία αὐτῶν ἡ ἀπερίτµητος, καὶ τότε εὐδοκήσουσιν τὰς ἁµαρτίας αὐτῶν.						
Leviticus	26	26	42	OT	1. OT	Pentateuch	1. Pentateuch	01. Pentateuch	03. Leviticus	ⲟⲩⲟϩ ⲉⲓⲉ̀ⲉⲣⲫⲙⲉⲩⲓ ⲛ̀ϯⲇⲓⲁⲑⲏⲕⲏ ⲛ̀ⲧⲉ ⲓⲁⲕⲱⲃ ⲛⲉⲙ ϯⲇⲓⲁⲑⲏⲕⲏ ⲛ̀ⲧⲉ ⲓⲥⲁⲁⲕ ⲛⲉⲙ ϯⲇⲓⲁⲑⲏⲕⲏ ⲛ̀ⲧⲉ ⲁⲃⲣⲁⲁⲙ ⲉⲓⲉ̀ⲉⲣⲡⲟⲩⲙⲉⲩⲓ ⲟⲩⲟϩ ⲉⲓⲉ̀ⲉⲣⲫⲙⲉⲩⲓ ⲙ̀ⲡⲓⲕⲁϩⲓ		And I will remember the covenant of Jacob, and the covenant of Isaac, and the covenant of Abraam will I remember.	καὶ µνησθήσοµαι τῆς διαθήκης Ιακωβ καὶ τῆς διαθήκης Ισαακ καὶ τῆς διαθήκης Αβρααµ µνησθήσοµαι καὶ τῆς γῆς µνησθήσοµαι.						
Leviticus	26	26	43	OT	1. OT	Pentateuch	1. Pentateuch	01. Pentateuch	03. Leviticus	ⲟⲩⲟϩ ⲡⲓⲕⲁϩⲓ ⲉϥⲉ̀ⲥⲱϫⲡ ⲉ̀ⲃⲟⲗ ϩⲁⲣⲱⲟⲩ ⲟⲩⲟϩ ⲧⲟⲧⲉ ⲉⲣⲉ ⲡⲓⲕⲁϩⲓ ϣⲱⲡ ⲉ̀ⲣⲟϥ ⲛ̀ⲛⲉϥⲥⲁⲃⲃⲁⲧⲟⲛ ϧⲉⲛ ⲡϫⲓⲛⲧⲉϥϣⲱϥ ⲉⲑⲃⲏⲧⲟⲩ ⲟⲩⲟϩ ⲛ̀ⲑⲱⲟⲩ ϩⲱⲟⲩ ⲉⲩⲉ̀ϣⲱⲡ ⲉ̀ⲣⲱⲟⲩ ⲛ̀ⲛⲟⲩⲁⲛⲟⲙⲓⲁ ⲛ̀ⲧϣⲉⲃⲓⲱ ϫⲉ ⲛⲁϩⲁⲡ ⲁⲩϩⲓⲡϩⲟ ⲙ̀ⲙⲱⲟⲩ ⲟⲩⲟϩ ⲛⲁⲟⲩⲁϩⲥⲁϩⲛⲓ ⲁⲩⲙⲉⲥⲧⲱⲟⲩ ϧⲉⲛ ⲛⲟⲩⲯⲩⲭⲏ		And I will remember the land, and the land shall be left of them; then the land shall enjoy her sabbaths, when it is deserted through them: and they shall accept the punishment of their iniquities, because they neglected my judgments, and in their soul loathed my ordinances.	καὶ ἡ γῆ ἐγκαταλειφθήσεται ὑπ’ αὐτῶν· τότε προσδέξεται ἡ γῆ τὰ σάββατα αὐτῆς ἐν τῷ ἐρηµωθῆναι αὐτὴν δι’ αὐτούς, καὶ αὐτοὶ προσδέξονται τὰς αὐτῶν ἀνοµίας, ἀνθ’ ὧν τὰ κρίµατά µου ὑπερεῖδον καὶ τοῖς προστάγµασίν µου προσώχθισαν τῇ ψυχῇ αὐτῶν.						
