book	chapter	chapter-zfilled	verse	testament	testament-indexed	section	section-indexed	section-indexed-no-testament	book-indexed	Bohairic	Sahidic	English	Greek	Fayyumic	Akhmimic	OldBohairic	Mesokemic	DialectP	Lycopolitan
Deuteronomy	8	08	3	OT	1. OT	Pentateuch	1. Pentateuch	01. Pentateuch	05. Deuteronomy	ⲟⲩⲟϩ ⲁϥⲧϩⲉⲙⲕⲟⲕ ⲁϥⲑⲣⲉⲕϩⲕⲟ ⲟⲩⲟϩ ⲁϥⲧⲉⲙⲙⲟⲕ ⲙ̀ⲡⲓⲙⲁⲛⲛⲁ ϩⲓ ⲡϣⲁϥⲉ ⲫⲏ ⲉ̀ⲛⲁⲣⲉ ⲛⲉⲕⲓⲟϯ ⲥⲱⲟⲩⲛ ⲙ̀ⲙⲟϥ ⲁⲛ ϩⲓⲛⲁ ⲛ̀ⲧⲉϥⲧⲁⲙⲟⲕ ϫⲉ ⲛⲁⲣⲉ ⲡⲓⲣⲱⲙⲓ ⲛⲁⲱⲛϧ ⲉ̀ⲱⲓⲕ ⲙ̀ⲙⲁⲩⲁⲧϥ ⲁⲛ ⲁⲗⲗⲁ ⲉ̀ϫⲉⲛ ⲥⲁϫⲓ ⲛⲓⲃⲉⲛ ⲉⲧⲛⲁⲓ ⲉ̀ⲃⲟⲗ ϧⲉⲛ ⲣⲱϥ ⲙ̀ⲫϯ ⲉϥⲉ̀ⲱⲛϧ ⲛ̀ϫⲉ ⲡⲓⲣⲱⲙⲓ		And he afflicted thee and straitened thee with hunger, and fed thee with manna, which thy fathers knew not; that he might teach thee that man shall not live by bread alone, but by every word that proceeds out of the mouth of God shall man live.	καὶ ἐκάκωσέν σε καὶ ἐλιµαγχόνησέν σε καὶ ἐψώµισέν σε τὸ µαννα, ὃ οὐκ εἴδησαν οἱ πατέρες σου, ἵνα ἀναγγείλῃ σοι ὅτι οὐκ ἐπ’ ἄρτῳ µόνῳ ζήσεται ὁ ἄνθρωπος, ἀλλ’ ἐπὶ παντὶ ῥήµατι τῷ ἐκπορευοµένῳ διὰ στόµατος θεοῦ ζήσεται ὁ ἄνθρωπος.						
Deuteronomy	8	08	4	OT	1. OT	Pentateuch	1. Pentateuch	01. Pentateuch	05. Deuteronomy	ⲛⲉⲕϩⲃⲱⲥ ⲙ̀ⲡⲟⲩϧⲓϯ ϩⲓⲱⲧⲕ ⲟⲩⲟϩ ⲛⲉⲕⲫⲁⲧ ⲙ̀ⲡⲟⲩⲉⲣϣⲁϣⲓ ⲓⲥϫⲉⲛ ⲙ̅ ⲛ̀ⲣⲟⲙⲡⲓ		Thy garments grew not old from off thee, thy shoes were not worn from off thee, thy feet were not painfully hardened, lo! these forty years.	τὰ ἱµάτιά σου οὐ κατετρίβη ἀπὸ σοῦ, οἱ πόδες σου οὐκ ἐτυλώθησαν, ἰδοὺ τεσσαράκοντα ἔτη.						
Deuteronomy	8	08	5	OT	1. OT	Pentateuch	1. Pentateuch	01. Pentateuch	05. Deuteronomy	ⲁⲣⲓⲉⲙⲓ ϧⲉⲛ ⲡⲉⲕϩⲏⲧ ϫⲉ ⲙ̀ⲫⲣⲏϯ ⲛ̀ⲟⲩⲣⲱⲙⲓ ⲉϥϯⲥⲃⲟ ⲙ̀ⲡⲉϥϣⲏⲣⲓ ⲡⲁⲓⲣⲏϯ ⲡϭ̅ⲥ̅ ⲡⲉⲕⲛⲟⲩϯ ⲉϥⲉ̀ϯⲥⲃⲱ ⲛⲁⲕ		And thou shalt know in thine heart, that as if any man should chasten his son, so the Lord thy God will chasten thee.	καὶ γνώσῃ τῇ καρδίᾳ σου ὅτι ὡς εἴ τις παιδεύσαι ἄνθρωπος τὸν υἱὸν αὐτοῦ, οὕτως κύριος ὁ θεός σου παιδεύσει σε,						
Deuteronomy	8	08	6	OT	1. OT	Pentateuch	1. Pentateuch	01. Pentateuch	05. Deuteronomy	ⲟⲩⲟϩ ⲉⲕⲉ̀ⲁⲣⲉϩ ⲉ̀ⲛⲓⲉⲛⲧⲟⲗⲏ ⲛ̀ⲧⲉ ⲡϭ̅ⲥ̅ ⲡⲉⲕⲛⲟⲩϯ ⲉ̀ⲙⲟϣⲓ ϩⲓ ⲛⲉϥⲙⲱⲓⲧ ⲉ̀ⲉⲣϩⲟϯ ϧⲁⲧⲉϥϩⲏ		And thou shalt keep the commands of the Lord thy God, to walk in his ways, and to fear him.	καὶ φυλάξῃ τὰς ἐντολὰς κυρίου τοῦ θεοῦ σου πορεύεσθαι ἐν ταῖς ὁδοῖς αὐτοῦ καὶ φοβεῖσθαι αὐτόν.						
Deuteronomy	8	08	7	OT	1. OT	Pentateuch	1. Pentateuch	01. Pentateuch	05. Deuteronomy	ⲡϭ̅ⲥ̅ ⲅⲁⲣ ⲡⲉⲕⲛⲟⲩϯ ⲉϥⲉ̀ϭⲓⲧⲕ ⲉ̀ϧⲟⲩⲛ ⲉ̀ⲟⲩⲕⲁϩⲓ ⲛ̀ⲁⲅⲁⲑⲟⲛ ⲟⲩⲟϩ ⲉ̀ⲛⲁϣⲱϥ ⲡⲓⲙⲁ ⲉⲧⲉ ⲟⲩⲟⲛ ϩⲁⲛⲙⲟⲩⲛⲥⲱⲣⲉⲙ ⲙ̀ⲙⲟϥ ⲛⲉⲙ ϩⲁⲛⲙⲟⲩⲙⲓ ⲛ̀ⲧⲉ ⲛⲓⲛⲟⲩⲛ ⲉⲩⲛⲏⲟⲩ ⲉ̀ⲃⲟⲗ ϧⲉⲛ ⲛⲓⲙⲉϣϣⲟϯ ⲛⲉⲙ ⲉ̀ⲃⲟⲗ ϧⲉⲛ ⲛⲓⲧⲱⲟⲩ		For the Lord thy God will bring thee into a good and extensive land, where there are torrents of waters, and fountains of deep places issuing through the plains and through the mountains:	ὁ γὰρ κύριος ὁ θεός σου εἰσάγει σε εἰς γῆν ἀγαθὴν καὶ πολλήν, οὗ χείµαρροι ὑδάτων καὶ πηγαὶ ἀβύσσων ἐκπορευόµεναι διὰ τῶν πεδίων καὶ διὰ τῶν ὀρέων·						
Deuteronomy	8	08	8	OT	1. OT	Pentateuch	1. Pentateuch	01. Pentateuch	05. Deuteronomy	ⲟⲩⲕⲁϩⲓ ⲛ̀ⲥⲟⲩⲟ ⲛⲉⲙ ⲓⲱⲧ ϩⲁⲛⲓⲁϩⲁⲗⲟⲗⲓ ⲛⲉⲙ ϩⲁⲛⲃⲱ ⲛ̀ⲕⲉⲛⲧⲉ ⲛⲉⲙ ϩⲁⲛⲉⲣⲙⲁⲛ ⲟⲩⲕⲁϩⲓ ⲛ̀ϫⲱⲓⲧ ⲛ̀ⲛⲉϩ ⲛⲉⲙ ⲉⲃⲓⲱ		a land of wheat and barley, wherein are vines, figs, pomegranates; a land of olive oil and honey;	γῆ πυροῦ καὶ κριθῆς, ἄµπελοι, συκαῖ, ῥόαι, γῆ ἐλαίας ἐλαίου καὶ µέλιτος·						
Deuteronomy	8	08	9	OT	1. OT	Pentateuch	1. Pentateuch	01. Pentateuch	05. Deuteronomy	ⲟⲩⲕⲁϩⲓ ⲛ̀ⲕⲛⲁⲟⲩⲱⲙ ⲙ̀ⲡⲉⲕⲱⲓⲕ ⲁⲛ ϩⲓⲱⲧϥ ϧⲉⲛ ⲟⲩⲙⲉⲧϩⲏⲕⲓ ⲛ̀ⲛⲉⲕⲉⲣϧⲁⲉ ⲛ̀ϩⲗⲓ ϩⲓⲱⲧϥ ⲟⲩⲕⲁϩⲓ ⲉⲣⲉ ⲛⲉϥⲱⲛⲓ ⲙ̀ⲃⲉⲛⲓⲡⲓ ⲛⲉ ⲉⲕⲉ̀ϫⲱϫⲓ ⲛ̀ⲟⲩϩⲟⲙⲧ ⲉ̀ⲃⲟⲗ ϩⲓ ⲛⲉϥⲧⲱⲟⲩ		a land on which thou shalt not eat thy bread with poverty, and thou shalt not want any thing upon it; a land whose stones are iron, and out of its mountains thou shalt dig brass.	γῆ, ἐφ’ ἧς οὐ µετὰ πτωχείας φάγῃ τὸν ἄρτον σου καὶ οὐκ ἐνδεηθήσῃ οὐδὲν ἐπ’ αὐτῆς· γῆ, ἧς οἱ λίθοι σίδηρος, καὶ ἐκ τῶν ὀρέων αὐτῆς µεταλλεύσεις χαλκόν·						
Deuteronomy	8	08	10	OT	1. OT	Pentateuch	1. Pentateuch	01. Pentateuch	05. Deuteronomy	ⲉⲕⲉ̀ⲟⲩⲱⲙ ⲟⲩⲟϩ ⲉⲕⲉ̀ⲥⲓ ⲉⲕⲉ̀ⲥⲙⲟⲩ ⲉ̀ⲡϭ̅ⲥ̅ ⲡⲉⲕⲛⲟⲩϯ ⲛ̀ϧⲣⲏⲓ ϧⲉⲛ ⲡⲓⲕⲁϩⲓ ⲉⲑⲛⲁⲛⲉϥ ⲫⲏ ⲉⲧⲁϥⲧⲏⲓϥ ⲛⲁⲕ ⲛ̀ϫⲉ ⲡϭ̅ⲥ̅ ⲡⲉⲕⲛⲟⲩϯ		And thou shalt eat and be filled, and shalt bless the Lord thy God on the good land, which he has given thee.	καὶ φάγῃ καὶ ἐµπλησθήσῃ καὶ εὐλογήσεις κύριον τὸν θεόν σου ἐπὶ τῆς γῆς τῆς ἀγαθῆς, ἧς ἔδωκέν σοι.						
Deuteronomy	8	08	11	OT	1. OT	Pentateuch	1. Pentateuch	01. Pentateuch	05. Deuteronomy	ⲙⲁϩⲑⲏⲕ ⲉ̀ⲣⲟⲕ ⲙ̀ⲡⲉⲣⲉⲣⲡⲱⲃϣ ⲙ̀ⲡϭ̅ⲥ̅ ⲡⲉⲕⲛⲟⲩϯ ⲉ̀ϣ̀ⲧⲉⲙⲁⲣⲉϩ ⲉ̀ⲛⲉϥⲉⲛⲧⲟⲗⲏ ⲛⲉⲙ ⲛⲉϥϩⲁⲡ ⲛⲉⲙ ⲛⲉϥⲙⲉⲑⲙⲏⲓ ⲛⲏ ⲉ̀ϯϩⲟⲛϩⲉⲛ ⲙ̀ⲙⲱⲟⲩ ⲛⲁⲕ ⲙ̀ⲫⲟⲟⲩ		Take heed to thyself that thou forget not the Lord thy God, so as not to keep his commands, and his judgments, and ordinances, which I command thee this day:	πρόσεχε σεαυτῷ, µὴ ἐπιλάθῃ κυρίου τοῦ θεοῦ σου τοῦ µὴ φυλάξαι τὰς ἐντολὰς αὐτοῦ καὶ τὰ κρίµατα καὶ τὰ δικαιώµατα αὐτοῦ, ὅσα ἐγὼ ἐντέλλοµαί σοι σήµερον,						
Deuteronomy	8	08	12	OT	1. OT	Pentateuch	1. Pentateuch	01. Pentateuch	05. Deuteronomy	ⲙⲏⲡⲱⲥ ⲛ̀ⲧⲉⲕⲟⲩⲱⲙ ⲛ̀ⲧⲉⲕⲥⲓ ⲟⲩⲟϩ ⲁⲛϣⲁⲛⲕⲱⲧ ⲛ̀ϩⲁⲛⲏⲓ ⲉ̀ⲛⲁⲛⲉⲩ ⲟⲩⲟϩ ⲛ̀ⲧⲉⲕϣⲱⲡⲓ ⲛ̀ϧⲏⲧⲟⲩ		lest when thou hast eaten and art full, and hast built goodly houses, and dwelt in them;	µὴ φαγὼν καὶ ἐµπλησθεὶς καὶ οἰκίας καλὰς οἰκοδοµήσας καὶ κατοικήσας ἐν αὐταῖς						
Deuteronomy	8	08	13	OT	1. OT	Pentateuch	1. Pentateuch	01. Pentateuch	05. Deuteronomy	ⲟⲩⲟϩ ⲛⲉⲕⲉϩⲱⲟⲩ ⲛⲉⲙ ⲛⲉⲕⲉⲥⲱⲟⲩ ⲁⲩϣⲁⲛⲁϣⲁⲓ ⲛⲁⲕ ⲟⲩϩⲁⲧ ⲛⲉⲙ ⲟⲩⲛⲟⲩⲃ ⲁⲩϣⲁⲛⲁϣⲁⲓ ⲛⲁⲕ ⲟⲩⲟϩ ⲉⲛⲭⲁⲓ ⲛⲓⲃⲉⲛ ⲉⲧⲉ ⲛ̀ⲧⲁⲕ ⲁⲩϣⲁⲛⲁϣⲁⲓ ⲛⲁⲕ		and thy oxen and thy sheep are multiplied to thee, and thy silver and thy gold are multiplied to thee, and all thy possessions are multiplied to thee,	καὶ τῶν βοῶν σου καὶ τῶν προβάτων σου πληθυνθέντων σοι, ἀργυρίου καὶ χρυσίου πληθυνθέντος σοι καὶ πάντων, ὅσων σοι ἔσται, πληθυνθέντων σοι						
Deuteronomy	8	08	14	OT	1. OT	Pentateuch	1. Pentateuch	01. Pentateuch	05. Deuteronomy	ⲛ̀ⲧⲉⲕϭⲓⲥⲓ ϧⲉⲛ ⲡⲉⲕϩⲏⲧ ⲟⲩⲟϩ ⲛ̀ⲧⲉⲕⲉⲣⲡⲱⲃϣ ⲙ̀ⲡϭ̅ⲥ̅ ⲡⲉⲕⲛⲟⲩϯ ⲫⲏ ⲉⲧⲁϥⲉⲛⲕ ⲉ̀ⲃⲟⲗ ϧⲉⲛ ⲡⲕⲁϩⲓ ⲛ̀ⲭⲏⲙⲓ ⲉ̀ⲃⲟⲗ ϧⲉⲛ ⲡⲏⲓ ⲛ̀ⲧⲉ ϯⲙⲉⲧⲃⲱⲕ		thou shouldest be exalted in heart, and forget the Lord thy God, who brought thee out of the land of Egypt, out of the house of bondage:	ὑψωθῇς τῇ καρδίᾳ καὶ ἐπιλάθῃ κυρίου τοῦ θεοῦ σου τοῦ ἐξαγαγόντος σε ἐκ γῆς Αἰγύπτου ἐξ οἴκου δουλείας,						
Deuteronomy	8	08	15	OT	1. OT	Pentateuch	1. Pentateuch	01. Pentateuch	05. Deuteronomy	ⲫⲏ ⲉⲧⲁϥⲉⲛⲕ ⲉ̀ⲃⲟⲗ ϧⲉⲛ ⲡϣⲁϥⲉ ⲡⲓⲛⲓϣϯ ⲉⲧⲉⲙ̀ⲙⲁⲩ ⲟⲩⲟϩ ⲉⲧⲟⲓ ⲛ̀ϩⲟϯ ⲫⲏ ⲉⲧⲉϥⲙ̀ⲙⲁⲩ ⲛ̀ϫⲉ ⲟⲩϩⲟϥ ⲉϥϭⲓⲗⲁⲡⲥⲓ ⲛⲉⲙ ⲟⲩϭⲗⲏ ⲛⲉⲙ ⲟⲩⲓⲃⲓ ⲙ̀ⲙⲟⲛ ⲙⲱⲟⲩ ⲙ̀ⲙⲁⲩ ⲫⲏ ⲉⲧⲁϥⲓⲛⲓ ⲛⲁⲕ ⲛ̀ⲟⲩⲙⲟⲩⲙⲓ ⲙ̀ⲙⲱⲟⲩ ⲉ̀ⲃⲟⲗ ϧⲉⲛ ⲟⲩⲡⲉⲧⲣⲁ ⲛ̀ⲕⲟϩ ⲛ̀ϣⲱⲧ		who brought thee through that great and terrible wilderness, where is the biting serpent, and scorpion, and drought, where there was no water; who brought thee a fountain of water out of the flinty rock:	τοῦ ἀγαγόντος σε διὰ τῆς ἐρήµου τῆς µεγάλης καὶ τῆς φοβερᾶς ἐκείνης, οὗ ὄφις δάκνων καὶ σκορπίος καὶ δίψα, οὗ οὐκ ἦν ὕδωρ, τοῦ ἐξαγαγόντος σοι ἐκ πέτρας ἀκροτόµου πηγὴν ὕδατος,						
Deuteronomy	8	08	16	OT	1. OT	Pentateuch	1. Pentateuch	01. Pentateuch	05. Deuteronomy	ⲫⲏ ⲉⲧⲁϥⲧⲉⲙⲙⲟⲕ ⲙ̀ⲡⲓⲙⲁⲛⲛⲁ ϩⲓ ⲡϣⲁϥⲉ ⲫⲏ ⲉⲧⲉ ⲛⲁⲕⲥⲱⲟⲩⲛ ⲙ̀ⲙⲟϥ ⲁⲛ ⲛ̀ⲑⲟⲕ ⲟⲩⲇⲉ ⲛⲁⲩⲥⲱⲟⲩⲛ ⲙ̀ⲙⲟϥ ⲁⲛ ⲛ̀ϫⲉ ⲛⲉⲕⲓⲟϯ ϩⲓⲛⲁ ⲛ̀ⲧⲉϥⲧϩⲉⲙⲕⲟⲕ ⲟⲩⲟϩ ⲛ̀ⲧⲉϥⲉⲣⲡⲓⲣⲁⲍⲓⲛ ⲙ̀ⲙⲟⲕ ⲉⲑⲣⲉ ⲡⲓⲡⲉⲑⲛⲁⲛⲉϥ ϣⲱⲡⲓ ⲙ̀ⲙⲟⲕ ⲉ̀ⲡϧⲁⲉ̀ ⲛ̀ⲧⲉ ⲛⲓⲉϩⲟⲟⲩ		who fed thee with manna in the wilderness, which thou knewest not, and thy fathers knew not; that he might afflict thee, and thoroughly try thee, and do thee good in thy latter days.	τοῦ ψωµίσαντός σε τὸ µαννα ἐν τῇ ἐρήµῳ, ὃ οὐκ εἴδησαν οἱ πατέρες σου, ἵνα κακώσῃ σε καὶ ἐκπειράσῃ σε καὶ εὖ σε ποιήσῃ ἐπ’ ἐσχάτων τῶν ἡµερῶν σου.						
Deuteronomy	8	08	17	OT	1. OT	Pentateuch	1. Pentateuch	01. Pentateuch	05. Deuteronomy	ⲙ̀ⲡⲉⲣϫⲟⲥ ϧⲉⲛ ⲡⲉⲕϩⲏⲧ ϫⲉ ⲧⲁⲛⲟⲙϯ ⲛⲉⲙ ⲡⲁⲙⲁϩⲓ ⲛ̀ⲧⲉ ⲧⲁϫⲓϫ ⲁⲩⲓⲣⲓ ⲛⲏⲓ ⲛ̀ⲧⲁⲓⲛⲓϣϯ ⲛ̀ϫⲟⲙ		Lest thou shouldest say in thine heart, My strength, and the power of mine hand have wrought for me this great wealth.	µὴ εἴπῃς ἐν τῇ καρδίᾳ σου Ἡ ἰσχύς µου καὶ τὸ κράτος τῆς χειρός µου ἐποίησέν µοι τὴν δύναµιν τὴν µεγάλην ταύτην·						
Deuteronomy	8	08	18	OT	1. OT	Pentateuch	1. Pentateuch	01. Pentateuch	05. Deuteronomy	ⲉⲕⲉ̀ⲉⲙⲓ ϧⲉⲛ ⲡⲉⲕϩⲏⲧ ⲟⲩⲟϩ ⲉⲕⲉ̀ⲉⲣⲫⲙⲉⲩⲓ ⲙ̀ⲡϭ̅ⲥ̅ ⲡⲉⲕⲛⲟⲩϯ ϫⲉ ⲛ̀ⲑⲟϥ ⲉⲧϯⲛⲟⲙϯ ⲛⲁⲕ ⲉ̀ⲓⲣⲓ ⲛ̀ⲟⲩϫⲟⲙ ϩⲓⲛⲁ ⲛ̀ⲧⲉϥⲧⲁϩⲟ ⲛ̀ϯⲇⲓⲁⲑⲏⲕⲏ ⲉ̀ⲣⲁⲧⲥ ⲑⲏ ⲉⲧⲁϥⲱⲣⲕ ⲙ̀ⲙⲟⲥ ⲛ̀ϫⲉ ⲡϭ̅ⲥ̅ ⲛ̀ⲛⲉⲕⲓⲟϯ ⲙ̀ⲫⲣⲏϯ ⲙ̀ⲫⲟⲟⲩ		But thou shalt remember the Lord thy God, that he gives thee strength to get wealth; even that he may establish his covenant, which the Lord sware to thy fathers, as at this day.	καὶ µνησθήσῃ κυρίου τοῦ θεοῦ σου, ὅτι αὐτός σοι δίδωσιν ἰσχὺν τοῦ ποιῆσαι δύναµιν καὶ ἵνα στήσῃ τὴν διαθήκην αὐτοῦ, ἣν ὤµοσεν κύριος τοῖς πατράσιν σου, ὡς σήµερον.						
Deuteronomy	8	08	19	OT	1. OT	Pentateuch	1. Pentateuch	01. Pentateuch	05. Deuteronomy	ⲟⲩⲟϩ ⲉⲥⲉ̀ϣⲱⲡⲓ ⲁⲕϣⲁⲛⲉⲣⲡⲱⲃϣ ⲙ̀ⲡϭ̅ⲥ̅ ⲡⲉⲕⲛⲟⲩϯ ϧⲉⲛ ⲟⲩⲉⲃϣⲓ ⲟⲩⲟϩ ⲛ̀ⲧⲉⲕϣⲉ ⲛⲁⲕ ⲥⲁⲫⲁϩⲟⲩ ⲛ̀ϩⲁⲛⲕⲉⲛⲟⲩϯ ⲛ̀ⲧⲉⲕϣⲉⲙϣⲓ ⲙ̀ⲙⲱⲟⲩ ⲟⲩⲟϩ ϯⲉⲣⲙⲉⲑⲣⲉ ⲛⲱⲧⲉⲛ ⲙ̀ⲫⲟⲟⲩ ⲛ̀ⲧⲫⲉ ⲛⲉⲙ ⲡⲕⲁϩⲓ ϫⲉ ϧⲉⲛ ⲟⲩⲧⲁⲕⲟ ⲉⲣⲉⲧⲉⲛⲉ̀ⲧⲁⲕⲟ		And it shall come to pass if thou do at all forget the Lord thy God, and shouldest go after other gods, and serve them, and worship them, I call heaven and earth to witness against you this day, that ye shall surely perish.	καὶ ἔσται ἐὰν λήθῃ ἐπιλάθῃ κυρίου τοῦ θεοῦ σου καὶ πορευθῇς ὀπίσω θεῶν ἑτέρων καὶ λατρεύσῃς αὐτοῖς καὶ προσκυνήσῃς αὐτοῖς, διαµαρτύροµαι ὑµῖν σήµερον τόν τε οὐρανὸν καὶ τὴν γῆν ὅτι ἀπωλείᾳ ἀπολεῖσθε·						
Deuteronomy	8	08	20	OT	1. OT	Pentateuch	1. Pentateuch	01. Pentateuch	05. Deuteronomy	ⲙ̀ⲫⲣⲏϯ ⲛ̀ⲛⲓⲕⲉⲥⲱϫⲡ ⲛ̀ⲉⲑⲛⲟⲥ ⲛⲏ ⲉⲧⲉ ⲡϭ̅ⲥ̅ ⲫϯ ⲛⲁⲧⲁⲕⲱⲟⲩ ϧⲁⲧϩⲏ ⲙ̀ⲡⲉⲧⲉⲛϩⲟ ⲡⲁⲓⲣⲏϯ ⲧⲉⲧⲉⲛⲛⲁⲧⲁⲕⲟ ⲉ̀ⲫⲙⲁ ϫⲉ ⲙ̀ⲡⲉⲧⲉⲛⲥⲱⲧⲉⲙ ⲛ̀ⲥⲁ ⲡⲥⲁϫⲓ ⲙ̀ⲡϭ̅ⲥ̅ ⲡⲉⲧⲉⲛⲛⲟⲩϯ		As also the other nations which the Lord God destroys before your face, so shall ye perish, because ye hearkened not to the voice of the Lord your God.	καθὰ καὶ τὰ λοιπὰ ἔθνη, ὅσα κύριος ἀπολλύει πρὸ προσώπου ὑµῶν, οὕτως ἀπολεῖσθε, ἀνθ’ ὧν οὐκ ἠκούσατε τῆς φωνῆς κυρίου τοῦ θεοῦ ὑµῶν.						
Deuteronomy	9	09	1	OT	1. OT	Pentateuch	1. Pentateuch	01. Pentateuch	05. Deuteronomy	ⲥⲱⲧⲉⲙ ⲡⲓⲥ̅ⲗ̅ ⲛ̀ⲑⲟⲕ ⲉⲧⲛⲁⲉⲣϫⲓⲛⲓⲟⲣ ⲙ̀ⲡⲓⲓⲟⲣⲇⲁⲛⲏⲥ ⲙ̀ⲫⲟⲟⲩ ⲉ̀ϣⲉ ⲉ̀ϧⲟⲩⲛ ⲉ̀ⲉⲣⲕⲗⲏⲣⲟⲛⲟⲙⲓⲛ ⲛ̀ϩⲁⲛⲛⲓϣϯ ⲛ̀ⲉⲑⲛⲟⲥ ⲉⲩϫⲟⲣ ⲉ̀ϩⲟⲧⲉⲣⲱⲧⲉⲛ ⲛⲉⲙ ϩⲁⲛⲛⲓϣϯ ⲙ̀ⲃⲁⲕⲓ ⲉⲩⲧⲁⲕⲧⲏⲟⲩⲧ ⲛ̀ⲥⲟⲃϯ ϣⲁ ⲉ̀ϩⲣⲏⲓ ⲉ̀ⲧⲫⲉ		Hear, O Israel: Thou goest this day across Jordan to inherit nations greater and stronger than yourselves, cities great and walled up to heaven;	Ἄκουε, Ισραηλ· σὺ διαβαίνεις σήµερον τὸν Ιορδάνην εἰσελθεῖν κληρονοµῆσαι ἔθνη µεγάλα καὶ ἰσχυρότερα µᾶλλον ἢ ὑµεῖς, πόλεις µεγάλας καὶ τειχήρεις ἕως τοῦ οὐρανοῦ,						
Deuteronomy	9	09	2	OT	1. OT	Pentateuch	1. Pentateuch	01. Pentateuch	05. Deuteronomy	ⲟⲩⲛⲓϣϯ ⲛ̀ⲗⲁⲟⲥ ⲉ̀ⲛⲁϣⲱϥ ⲟⲩⲟϩ ⲉ̀ⲛⲁⲛⲉϥ ⲛ̀ϣⲓⲏ ⲛⲓϣⲏⲣⲓ ⲛ̀ⲧⲉ ⲉⲛⲁⲕ ⲛⲏ ⲉⲧⲉⲕⲥⲱⲟⲩⲛ ⲙ̀ⲙⲱⲟⲩ ⲟⲩⲟϩ ⲁⲕⲥⲱⲧⲉⲙ ⲉⲑⲃⲏⲧⲟⲩ ⲛⲓⲙ ⲉⲑⲃⲏⲧⲟⲩ ⲛⲓⲙ ⲉⲑⲛⲁϣⲟϩⲓ ⲉ̀ⲣⲁⲧϥ ⲙ̀ⲡⲉⲙ̀ⲑⲟ ⲛ̀ⲛⲓϣⲏⲣⲓ ⲛ̀ⲧⲉ ⲉⲛⲁⲕ		a people great and many and tall, the sons of Enac, whom thou knowest, and concerning whom thou hast heard say, Who can stand before the children of Enac?	λαὸν µέγαν καὶ πολὺν καὶ εὐµήκη, υἱοὺς Ενακ, οὓς σὺ οἶσθα καὶ σὺ ἀκήκοας Τίς ἀντιστήσεται κατὰ πρόσωπον υἱῶν Ενακ;						
Deuteronomy	9	09	3	OT	1. OT	Pentateuch	1. Pentateuch	01. Pentateuch	05. Deuteronomy	ⲉⲕⲉ̀ⲉⲙⲓ ⲙ̀ⲫⲟⲟⲩ ϫⲉ ⲡϭ̅ⲥ̅ ⲡⲉⲕⲛⲟⲩϯ ⲫⲁⲓ ⲉⲧⲛⲁϣⲟⲣⲡ ⲙ̀ⲙⲟϣⲓ ϧⲁⲧϩⲏ ⲙ̀ⲡⲉⲕϩⲟ ⲟⲩⲭⲣⲱⲙ ⲉϥⲟⲩⲱⲙ ⲡⲉ ⲫⲁⲓ ⲉϥⲉ̀ϥⲟⲧⲟⲩ ⲉ̀ⲃⲟⲗ ⲟⲩⲟϩ ⲫⲁⲓ ⲉϥⲉ̀ⲧⲁⲥⲑⲱⲟⲩ ⲉ̀ⲃⲟⲗ ϧⲁⲧϩⲏ ⲙ̀ⲡⲉⲕϩⲟ ⲉϥⲉ̀ϥⲟⲧⲟⲩ ⲉ̀ⲃⲟⲗ ⲟⲩⲟϩ ⲉϥⲉ̀ⲧⲁⲕⲱⲟⲩ ⲉ̀ⲭⲱⲗⲉⲙ ⲕⲁⲧⲁ ⲫⲣⲏϯ ⲉⲧⲁϥⲥⲁϫⲓ ⲛ̀ϫⲉ ⲡϭ̅ⲥ̅		And thou shalt know to-day, that the Lord thy God he shall go before thy face: he is a consuming fire; he shall destroy them, and he shall turn them back before thee, and shall destroy them quickly, as the Lord said to thee.	καὶ γνώσῃ σήµερον ὅτι κύριος ὁ θεός σου, οὗτος προπορεύεται πρὸ προσώπου σου· πῦρ καταναλίσκον ἐστίν· οὗτος ἐξολεθρεύσει αὐτούς, καὶ οὗτος ἀποστρέψει αὐτοὺς ἀπὸ προσώπου σου, καὶ ἀπολεῖς αὐτούς, καθάπερ εἶπέν σοι κύριος.						
Deuteronomy	9	09	4	OT	1. OT	Pentateuch	1. Pentateuch	01. Pentateuch	05. Deuteronomy	ⲙ̀ⲡⲉⲣϫⲟⲥ ϧⲉⲛ ⲡⲉⲕϩⲏⲧ ϧⲉⲛ ⲡϫⲓⲛⲑⲣⲉ ⲡϭ̅ⲥ̅ ⲡⲉⲕⲛⲟⲩϯ ⲧⲁⲕⲉ ⲛⲁⲓⲉⲑⲛⲟⲥ ⲉ̀ⲃⲟⲗ ϧⲁⲧϩⲏ ⲙ̀ⲡⲉⲕϩⲟ ⲉⲕϫⲱ ⲙ̀ⲙⲟⲥ ϫⲉ ⲉⲑⲃⲉ ⲛⲁⲙⲉⲑⲙⲏⲓ ⲁϥⲉⲛⲧⲉⲛ ⲉ̀ϧⲟⲩⲛ ⲛ̀ϫⲉ ⲡϭ̅ⲥ̅ ⲉ̀ⲉⲣⲕⲗⲏⲣⲟⲛⲟⲙⲓⲛ ⲙ̀ⲡⲁⲓⲕⲁϩⲓ ⲛ̀ⲁⲅⲁⲑⲟⲛ ⲁⲗⲗⲁ ⲉⲑⲃⲉ ϯⲙⲉⲧⲁⲥⲉⲃⲏⲥ ⲛ̀ⲧⲉ ⲛⲁⲓⲉⲑⲛⲟⲥ ⲡϭ̅ⲥ̅ ⲛⲁϥⲟⲧⲟⲩ ⲉ̀ⲃⲟⲗ ϧⲁⲧϩⲏ ⲙ̀ⲡⲉⲕϩⲟ		Speak not in thine heart, when the Lord thy God has destroyed these nations before thy face, saying, For my righteousness the Lord brought me in to inherit this good land.	µὴ εἴπῃς ἐν τῇ καρδίᾳ σου ἐν τῷ ἐξαναλῶσαι κύριον τὸν θεόν σου τὰ ἔθνη ταῦτα ἀπὸ προσώπου σου λέγων Διὰ τὰς δικαιοσύνας µου εἰσήγαγέν µε κύριος κληρονοµῆσαι τὴν γῆν τὴν ἀγαθὴν ταύτην· ἀλλὰ διὰ τὴν ἀσέβειαν τῶν ἐθνῶν τούτων κύριος ἐξολεθρεύσει αὐτοὺς πρὸ προσώπου σου.						
Deuteronomy	9	09	5	OT	1. OT	Pentateuch	1. Pentateuch	01. Pentateuch	05. Deuteronomy	ⲉⲑⲃⲉ ⲧⲉⲕⲙⲉⲑⲙⲏⲓ ⲁⲛ ⲟⲩⲇⲉ ⲉⲑⲃⲉ ⲡⲧⲟⲩⲃⲟ ⲁⲛ ⲙ̀ⲡⲉⲕϩⲏⲧ ⲛ̀ⲑⲟⲕ ⲕⲛⲁϣⲉ ⲛⲁⲕ ⲛ̀ⲧⲉⲕⲉⲣⲕⲗⲏⲣⲟⲛⲟⲙⲓⲛ ⲙ̀ⲡⲟⲩⲕⲁϩⲓ ⲁⲗⲗⲁ ⲉⲑⲃⲉ ϯⲙⲉⲧⲁⲥⲉⲃⲏⲥ ⲛ̀ⲧⲉ ⲛⲁⲓⲉⲑⲛⲟⲥ ⲛ̀ϫⲉ ⲡϭ̅ⲥ̅ ⲉϥⲉ̀ϥⲟⲧⲟⲩ ⲉ̀ⲃⲟⲗ ϧⲁⲧϩⲏ ⲙ̀ⲡⲉⲕϩⲟ ϩⲓⲛⲁ ⲛ̀ⲧⲉϥⲧⲁϩⲉ ϯⲇⲓⲁⲑⲏⲕⲏ ⲉ̀ⲣⲁⲧⲥ ⲑⲏ ⲉⲧⲁ ⲡϭ̅ⲥ̅ ⲱⲣⲕ ⲙ̀ⲙⲟⲥ ⲛ̀ⲛⲉⲧⲉⲛⲓⲟϯ ⲁⲃⲣⲁⲁⲙ ⲛⲉⲙ ⲓⲥⲁⲁⲕ ⲛⲉⲙ ⲓⲁⲕⲱⲃ		Not for thy righteousness, nor for the holiness of thy heart, dost thou go in to inherit their land, but because of the wickedness of these nations the Lord will destroy them from before thee, and that he may establish the covenant, which the Lord sware to our fathers, to Abraam, and to Isaac, and to Jacob.	οὐχὶ διὰ τὴν δικαιοσύνην σου οὐδὲ διὰ τὴν ὁσιότητα τῆς καρδίας σου σὺ εἰσπορεύῃ κληρονοµῆσαι τὴν γῆν αὐτῶν, ἀλλὰ διὰ τὴν ἀσέβειαν τῶν ἐθνῶν τούτων κύριος ἐξολεθρεύσει αὐτοὺς ἀπὸ προσώπου σου καὶ ἵνα στήσῃ τὴν διαθήκην αὐτοῦ, ἣν ὤµοσεν τοῖς πατράσιν ὑµῶν, τῷ Αβρααµ καὶ τῷ Ισαακ καὶ τῷ Ιακωβ.						
Deuteronomy	9	09	6	OT	1. OT	Pentateuch	1. Pentateuch	01. Pentateuch	05. Deuteronomy	ⲟⲩⲟϩ ⲉⲕⲉ̀ⲉⲙⲓ ⲙ̀ⲫⲟⲟⲩ ϫⲉ ⲉⲑⲃⲉ ⲧⲉⲕⲙⲉⲑⲙⲏⲓ ⲁⲛ ⲡϭ̅ⲥ̅ ⲛⲁϯ ⲛⲁⲕ ⲙ̀ⲡⲁⲓⲕⲁϩⲓ ⲉⲑⲛⲁⲛⲉϥ ⲉ̀ⲉⲣⲕⲗⲏⲣⲟⲛⲟⲙⲓⲛ ⲙ̀ⲙⲟϥ ϫⲉ ⲛ̀ⲑⲟⲕ ⲟⲩⲗⲁⲟⲥ ⲛ̀ⲛⲁϣⲧⲛⲁϩⲃⲓ		And thou shalt know to-day, that it is not for thy righteousnesses the Lord thy God gives thee this good land to inherit, for thou art a stiff-necked people.	καὶ γνώσῃ σήµερον ὅτι οὐχὶ διὰ τὰς δικαιοσύνας σου κύριος ὁ θεός σου δίδωσίν σοι τὴν γῆν τὴν ἀγαθὴν ταύτην κληρονοµῆσαι, ὅτι λαὸς σκληροτράχηλος εἶ.						
Deuteronomy	9	09	7	OT	1. OT	Pentateuch	1. Pentateuch	01. Pentateuch	05. Deuteronomy	ⲁⲣⲓⲫⲙⲉⲩⲓ ⲙ̀ⲡⲉⲣⲉⲣⲡⲱⲃϣ ϫⲉ ⲁⲕϯ ⲟⲩⲏⲡ ⲛ̀ϫⲱⲛⲧ ⲙ̀ⲡϭ̅ⲥ̅ ⲡⲉⲕⲛⲟⲩϯ ⲛ̀ϩⲣⲏⲓ ϩⲓ ⲡϣⲁϥⲉ ⲓⲥϫⲉⲛ ⲡⲓⲉϩⲟⲟⲩ ⲉⲧⲁⲣⲉⲧⲉⲛⲓ̀ ⲉ̀ⲃⲟⲗ ϧⲉⲛ ⲡⲕⲁϩⲓ ⲛ̀ⲭⲏⲙⲓ ϣⲁⲧⲉⲧⲉⲛⲓ̀ ⲉ̀ⲡⲁⲓⲙⲁ ⲉⲣⲉⲧⲉⲛⲟⲓ ⲛ̀ⲁⲧⲑⲱⲧ ⲛ̀ϩⲏⲧ ⲟⲩⲃⲉ ⲡϭ̅ⲥ̅		Remember, forget not, how much thou provokedst the Lord thy God in the wilderness: from the day that ye came forth out of Egypt, even till ye came into this place, ye continued to be disobedient toward the Lord.	µνήσθητι µὴ ἐπιλάθῃ ὅσα παρώξυνας κύριον τὸν θεόν σου ἐν τῇ ἐρήµῳ· ἀφ’ ἧς ἡµέρας ἐξήλθετε ἐξ Αἰγύπτου ἕως ἤλθετε εἰς τὸν τόπον τοῦτον, ἀπειθοῦντες διετελεῖτε τὰ πρὸς κύριον.						
Deuteronomy	9	09	8	OT	1. OT	Pentateuch	1. Pentateuch	01. Pentateuch	05. Deuteronomy	ⲟⲩⲟϩ ϧⲉⲛ ⲭⲱⲣⲏⲃ ⲟⲛ ⲁⲣⲉⲧⲉⲛϯϫⲱⲛⲧ ⲙ̀ⲡϭ̅ⲥ̅ ⲟⲩⲟϩ ⲁϥⲉⲙⲃⲟⲛ ⲉ̀ϫⲉⲛ ⲑⲏⲛⲟⲩ ⲛ̀ϫⲉ ⲡϭ̅ⲥ̅ ⲉ̀ϥⲉⲧ ⲑⲏⲛⲟⲩ ⲉ̀ⲃⲟⲗ		Also in Choreb ye provoked the Lord, and the Lord was angry with you to destroy you;	καὶ ἐν Χωρηβ παρωξύνατε κύριον, καὶ ἐθυµώθη κύριος ἐφ’ ὑµῖν ἐξολεθρεῦσαι ὑµᾶς						
Deuteronomy	9	09	9	OT	1. OT	Pentateuch	1. Pentateuch	01. Pentateuch	05. Deuteronomy	ⲉⲓⲛⲁϣⲉ ⲛⲏⲓ ⲉ̀ϩⲣⲏⲓ ⲉ̀ⲡⲓⲧⲱⲟⲩ ⲉ̀ϭⲓ ⲛ̀ϯⲡⲗⲁⲝ ⲥⲛⲟⲩϯ ⲛ̀ⲱⲛⲓ ⲛⲓⲡⲗⲁⲝ ⲛ̀ⲧⲉ ϯⲇⲓⲁⲑⲏⲕⲏ ⲛⲏ ⲉⲧⲁϥⲥⲉⲙⲛⲏⲧⲟⲩ ⲛⲉⲙⲱⲧⲉⲛ ⲛ̀ϫⲉ ⲡϭ̅ⲥ̅ ⲟⲩⲟϩ ⲛⲁⲓⲭⲏ ⲡⲉ ⲛ̀ϩⲣⲏⲓ ϩⲓ ⲡⲓⲧⲱⲟⲩ ⲛ̀ⲙ̅ ⲛ̀ⲉϩⲟⲟⲩ ⲛⲉⲙ ⲙ̅ ⲛ̀ⲉϫⲱⲣϩ ⲱⲓⲕ ⲙ̀ⲡⲓⲟⲩⲱⲙ ⲟⲩⲟϩ ⲙⲱⲟⲩ ⲙ̀ⲡⲓⲥⲱ		when I went up into the mountain to receive the tables of stone, the tables of the covenant, which the Lord made with you, and I was in the mountain forty days and forty nights, I ate no bread and drank no water.	ἀναβαίνοντός µου εἰς τὸ ὄρος λαβεῖν τὰς πλάκας τὰς λιθίνας, πλάκας διαθήκης, ἃς διέθετο κύριος πρὸς ὑµᾶς. καὶ κατεγινόµην ἐν τῷ ὄρει τεσσαράκοντα ἡµέρας καὶ τεσσαράκοντα νύκτας· ἄρτον οὐκ ἔφαγον καὶ ὕδωρ οὐκ ἔπιον.						
