book	chapter	chapter-zfilled	verse	testament	testament-indexed	section	section-indexed	section-indexed-no-testament	book-indexed	Bohairic	Sahidic	English	Greek	Fayyumic	Akhmimic	OldBohairic	Mesokemic	DialectP	Lycopolitan
Deuteronomy	9	09	10	OT	1. OT	Pentateuch	1. Pentateuch	01. Pentateuch	05. Deuteronomy	ⲟⲩⲟϩ ⲁϥϯ ⲛⲏⲓ ⲛ̀ϫⲉ ⲡϭ̅ⲥ̅ ⲛ̀ϯⲡⲗⲁⲝ ⲃ̅ϯ ⲛ̀ⲱⲛⲓ ⲉⲩⲥϧⲏⲧⲟⲩ ⲙ̀ⲡⲓⲧⲏⲃ ⲛ̀ⲧⲉ ⲫϯ ⲟⲩⲟϩ ⲛⲁⲩⲥϧⲏⲟⲩⲧ ϩⲓⲱⲧⲟⲩ ⲛ̀ϫⲉ ⲛⲓⲥⲁϫⲓ ⲧⲏⲣⲟⲩ ⲛⲏ ⲉⲧⲁ ⲡϭ̅ⲥ̅ ⲥⲁϫⲓ ⲙ̀ⲙⲱⲟⲩ ⲛⲉⲙⲱⲧⲉⲛ ϩⲓ ⲡⲓⲧⲱⲟⲩ ⲙ̀ⲡⲓⲉϩⲟⲟⲩ ⲛ̀ⲧⲉ ⲡⲓⲑⲱⲟⲩϯ		And the Lord gave me the two tables of stone written with the finger of God, and on them there had been written all the words which the Lord spoke to you in the mountain in the day of the assembly.	καὶ ἔδωκεν κύριος ἐµοὶ τὰς δύο πλάκας τὰς λιθίνας γεγραµµένας ἐν τῷ δακτύλῳ τοῦ θεοῦ, καὶ ἐπ’ αὐταῖς ἐγέγραπτο πάντες οἱ λόγοι, οὓς ἐλάλησεν κύριος πρὸς ὑµᾶς ἐν τῷ ὄρει ἡµέρᾳ ἐκκλησίας·						
Deuteronomy	9	09	11	OT	1. OT	Pentateuch	1. Pentateuch	01. Pentateuch	05. Deuteronomy	ⲟⲩⲟϩ ⲁⲥϣⲱⲡⲓ ⲉ̀ⲃⲟⲗ ϩⲓⲧⲉⲛ ϩⲙⲉ ⲛ̀ⲉϩⲟⲟⲩ ⲛⲉⲙ ⲙ̅ ⲛ̀ⲉϫⲱⲣϩ ⲁ ⲡϭ̅ⲥ̅ ϯ ⲛⲏⲓ ⲛ̀ϯⲡⲗⲁⲝ ⲥⲛⲟⲩϯ ⲛ̀ⲱⲛⲓ ⲛⲓⲡⲗⲁⲝ ⲛ̀ⲧⲉ ϯⲇⲓⲁⲑⲏⲕⲏ		And it came to pass after forty days and forty nights, the Lord gave me the two tables of stone, the tables of the covenant.	καὶ ἐγένετο διὰ τεσσαράκοντα ἡµερῶν καὶ τεσσαράκοντα νυκτῶν ἔδωκεν κύριος ἐµοὶ τὰς δύο πλάκας τὰς λιθίνας, πλάκας διαθήκης.						
Deuteronomy	9	09	12	OT	1. OT	Pentateuch	1. Pentateuch	01. Pentateuch	05. Deuteronomy	ⲟⲩⲟϩ ⲡⲉϫⲉ ⲡϭ̅ⲥ̅ ⲛⲏⲓ ϫⲉ ⲧⲱⲛⲕ ⲙⲁϣⲉ ⲛⲁⲕ ⲉ̀ⲡⲉⲥⲏⲧ ⲉ̀ⲃⲟⲗ ⲧⲁⲓ ⲛ̀ⲭⲱⲗⲉⲙ ϫⲉ ⲁϥⲉⲣⲁⲛⲟⲙⲓⲛ ⲛ̀ϫⲉ ⲡⲉⲕⲗⲁⲟⲥ ⲛⲏ ⲉⲧⲁⲕⲉⲛⲟⲩ ⲉ̀ⲃⲟⲗ ϧⲉⲛ ⲡⲕⲁϩⲓ ⲛ̀ⲭⲏⲙⲓ ⲁⲩⲉⲣⲡⲁⲣⲁⲃⲉⲛⲓⲛ ⲛ̀ⲭⲱⲗⲉⲙ ⲉ̀ⲃⲟⲗ ϩⲓ ⲡⲓⲙⲱⲓⲧ ⲉⲧⲁⲕϩⲉⲛϩⲱⲛⲟⲩ ⲉ̀ⲣⲟϥ ⲁⲩⲑⲁⲙⲓⲟ ⲛⲱⲟⲩ ⲛ̀ⲟⲩⲱⲧϩ		And the Lord said to me, Arise, go down quickly from hence, for thy people whom thou broughtest out of the land of Egypt have transgressed; they have gone aside quickly out of the way which I commanded them, and have made themselves a molten image.	καὶ εἶπεν κύριος πρός µε Ἀνάστηθι κατάβηθι τὸ τάχος ἐντεῦθεν, ὅτι ἠνόµησεν ὁ λαός σου, οὓς ἐξήγαγες ἐκ γῆς Αἰγύπτου· παρέβησαν ταχὺ ἐκ τῆς ὁδοῦ, ἧς ἐνετείλω αὐτοῖς· ἐποίησαν ἑαυτοῖς χώνευµα.						
Deuteronomy	9	09	13	OT	1. OT	Pentateuch	1. Pentateuch	01. Pentateuch	05. Deuteronomy	ⲟⲩⲟϩ ⲡⲉϫⲉ ⲡϭ̅ⲥ̅ ⲛⲏⲓ ϫⲉ ⲁⲓⲥⲁϫⲓ ⲛⲉⲙⲁⲕ ⲛ̀ⲟⲩⲥⲟⲡ ⲛⲉⲙ ⲃ̅ ⲉⲓϫⲱ ⲙ̀ⲙⲟⲥ ϫⲉ ⲁⲓⲛⲁⲩ ⲉ̀ⲡⲁⲓⲗⲁⲟⲥ ϩⲏⲡⲡⲉ ⲟⲩⲗⲁⲟⲥ ⲛ̀ⲛⲁϣⲧⲛⲁϩⲃⲓ ⲡⲉ		And the Lord spoke to me, saying, I have spoken to thee once and again, saying, I have seen this people, and, behold, it is a stiff-necked people.	καὶ εἶπεν κύριος πρός µε Λελάληκα πρὸς σὲ ἅπαξ καὶ δὶς λέγων Ἑώρακα τὸν λαὸν τοῦτον, καὶ ἰδοὺ λαὸς σκληροτράχηλός ἐστιν·						
Deuteronomy	9	09	14	OT	1. OT	Pentateuch	1. Pentateuch	01. Pentateuch	05. Deuteronomy	ⲭⲁⲧ ⲛ̀ⲧⲁϥⲟⲧⲟⲩ ⲉ̀ⲃⲟⲗ ⲟⲩⲟϩ ⲛ̀ⲧⲁϥⲉⲧ ⲡⲟⲩⲣⲁⲛ ⲥⲁⲡⲉⲥⲏⲧ ⲛ̀ⲧⲫⲉ ⲟⲩⲟϩ ⲛ̀ⲧⲁⲁⲓⲕ ⲛ̀ⲟⲩⲛⲓϣϯ ⲛ̀ⲉⲑⲛⲟⲥ ⲟⲩⲟϩ ⲉϥϫⲟⲣ ⲉ̀ⲛⲁϣⲱϥ ⲉ̀ϩⲟⲧⲉ ⲫⲁⲓ		And now suffer me utterly to destroy them, and I will blot out their name from under heaven, and will make of thee a nation great and strong, and more numerous than this.	ἔασόν µε ἐξολεθρεῦσαι αὐτούς, καὶ ἐξαλείψω τὸ ὄνοµα αὐτῶν ὑποκάτωθεν τοῦ οὐρανοῦ καὶ ποιήσω σὲ εἰς ἔθνος µέγα καὶ ἰσχυρὸν καὶ πολὺ µᾶλλον ἢ τοῦτο.						
Deuteronomy	9	09	15	OT	1. OT	Pentateuch	1. Pentateuch	01. Pentateuch	05. Deuteronomy	ⲉⲧⲁⲓⲕⲟⲧⲧ ⲁⲓⲓ̀ ⲉ̀ⲡⲉⲥⲏⲧ ⲉ̀ⲃⲟⲗ ϩⲓ ⲡⲓⲧⲱⲟⲩ ⲟⲩⲟϩ ⲡⲓⲧⲱⲟⲩ ⲛⲁϥⲙⲟϩ ⲛ̀ⲭⲣⲱⲙ ⲟⲩⲟϩ ϯⲡⲗⲁⲝ ⲃ̅ϯ ⲛ̀ⲱⲛⲓ ⲛⲁⲩϩⲓ ⲧⲁϫⲓϫ ⲃ̅ϯ		And I turned and went down from the mountain; and the mountain burned with fire to heaven; and the two tables of the testimonies were in my two hands.	καὶ ἐπιστρέψας κατέβην ἐκ τοῦ ὄρους, καὶ τὸ ὄρος ἐκαίετο πυρί, καὶ αἱ δύο πλάκες ἐπὶ ταῖς δυσὶ χερσίν µου.						
Deuteronomy	9	09	16	OT	1. OT	Pentateuch	1. Pentateuch	01. Pentateuch	05. Deuteronomy	ⲟⲩⲟϩ ⲉⲧⲁⲓⲛⲁⲩ ϫⲉ ⲁⲧⲉⲧⲉⲛⲉⲣⲛⲟⲃⲓ ⲙ̀ⲡⲉⲙ̀ⲑⲟ ⲙ̀ⲡϭ̅ⲥ̅ ⲫϯ ⲁⲣⲉⲧⲉⲛⲑⲁⲙⲓⲟ ⲛⲱⲧⲉⲛ ⲛ̀ⲟⲩⲙⲁⲥⲓ ⲛ̀ⲟⲩⲱⲧϩ ⲁⲣⲉⲧⲉⲛⲉⲣⲡⲁⲣⲁⲃⲉⲛⲓⲛ ⲉ̀ⲃⲟⲗ ϩⲓ ⲡⲓⲙⲱⲓⲧ ⲉⲧⲁ ⲡϭ̅ⲥ̅ ϩⲉⲛϩⲉⲛ ⲑⲏⲛⲟⲩ ⲉ̀ⲣⲟϥ		And when I saw that ye had sinned against the Lord your God, and had made to yourselves a molten image, and had gone astray out of the way, which the Lord commanded you to keep;	καὶ ἰδὼν ὅτι ἡµάρτετε ἐναντίον κυρίου τοῦ θεοῦ ὑµῶν καὶ ἐποιήσατε ὑµῖν ἑαυτοῖς χωνευτὸν καὶ παρέβητε ἀπὸ τῆς ὁδοῦ, ἧς ἐνετείλατο ὑµῖν κύριος,						
Deuteronomy	9	09	17	OT	1. OT	Pentateuch	1. Pentateuch	01. Pentateuch	05. Deuteronomy	ⲟⲩⲟϩ ⲁⲓⲁⲙⲟⲛⲓ ⲛ̀ϯⲡⲗⲁⲝ ⲃ̅ϯ ⲁⲓⲃⲉⲣⲃⲱⲣⲟⲩ ⲉ̀ⲃⲟⲗ ϧⲉⲛ ⲧⲁϫⲓϫ ⲥⲛⲟⲩϯ ⲁⲓϧⲉⲙϧⲱⲙⲟⲩ ⲙ̀ⲡⲉⲧⲉⲛⲙⲑⲟ ⲉ̀ⲃⲟⲗ		then I took hold of the two tables, and cast them out of my two hands, and broke them before you.	καὶ ἐπιλαβόµενος τῶν δύο πλακῶν ἔρριψα αὐτὰς ἀπὸ τῶν δύο χειρῶν µου καὶ συνέτριψα ἐναντίον ὑµῶν.						
Deuteronomy	9	09	18	OT	1. OT	Pentateuch	1. Pentateuch	01. Pentateuch	05. Deuteronomy	ⲟⲩⲟϩ ⲁⲓϯϩⲟ ⲉ̀ⲡϭ̅ⲥ̅ ⲙ̀ⲫⲙⲁϩ ⲥⲟⲡ ⲃ̅ ⲕⲁⲧⲁ ⲫⲣⲏϯ ⲛ̀ϣⲟⲣⲡ ⲟⲛ ⲛ̀ϩⲙⲉ ⲛ̀ⲉϩⲟⲟⲩ ⲛⲉⲙ ⲙ̅ ⲛ̀ⲉϫⲱⲣϩ ⲱⲓⲕ ⲙ̀ⲡⲓⲟⲩⲱⲙ ⲟⲩⲟϩ ⲙⲱⲟⲩ ⲙ̀ⲡⲓⲥⲱ ⲉⲑⲃⲉ ⲛⲉⲧⲉⲛⲛⲟⲃⲓ ⲧⲏⲣⲟⲩ ⲛⲏ ⲉⲧⲁⲣⲉⲧⲉⲛϣⲱϥⲧ ⲙ̀ⲙⲱⲟⲩ ⲉ̀ⲓⲣⲓ ⲙ̀ⲡⲓⲡⲉⲧϩⲱⲟⲩ ⲙ̀ⲡⲉⲙ̀ⲑⲟ ⲙ̀ⲡϭ̅ⲥ̅ ⲉ̀ϯϫⲱⲛⲧ ⲛⲁϥ		And I made my petition before the Lord as also at the first forty days and forty nights: I ate no bread and drank no water, on account of all your sins which ye sinned in doing evil before the Lord God to provoke him.	καὶ ἐδεήθην ἐναντίον κυρίου δεύτερον καθάπερ καὶ τὸ πρότερον τεσσαράκοντα ἡµέρας καὶ τεσσαράκοντα νύκτας — ἄρτον οὐκ ἔφαγον καὶ ὕδωρ οὐκ ἔπιον — περὶ πασῶν τῶν ἁµαρτιῶν ὑµῶν, ὧν ἡµάρτετε ποιῆσαι τὸ πονηρὸν ἐναντίον κυρίου τοῦ θεοῦ ὑµῶν παροξῦναι αὐτόν.						
Deuteronomy	9	09	19	OT	1. OT	Pentateuch	1. Pentateuch	01. Pentateuch	05. Deuteronomy	ⲟⲩⲟϩ ϯⲉⲣϩⲟϯ ⲉⲑⲃⲉ ⲡⲓϫⲱⲛⲧ ⲛⲉⲙ ⲡⲓⲉⲙⲃⲟⲛ ϫⲉ ⲁϥϫⲱⲛⲧ ⲛ̀ϫⲉ ⲡϭ̅ⲥ̅ ⲉ̀ϫⲉⲛ ⲑⲏⲛⲟⲩ ⲉ̀ϥⲉⲧ ⲑⲏⲛⲟⲩ ⲉ̀ⲃⲟⲗ ⲁϥⲥⲱⲧⲉⲙ ⲉ̀ⲣⲟⲓ ⲛ̀ϫⲉ ⲡϭ̅ⲥ̅ ϧⲉⲛ ⲡⲓⲥⲏⲟⲩ ⲉⲧⲉⲙ̀ⲙⲁⲩ		And I was greatly terrified because of the wrath and anger, because the Lord was provoked with you utterly to destroy you; yet the Lord hearkened to me at this time also.	καὶ ἔκφοβός εἰµι διὰ τὴν ὀργὴν καὶ τὸν θυµόν, ὅτι παρωξύνθη κύριος ἐφ’ ὑµῖν ἐξολεθρεῦσαι ὑµᾶς· καὶ εἰσήκουσεν κύριος ἐµοῦ καὶ ἐν τῷ καιρῷ τούτῳ.						
Deuteronomy	9	09	20	OT	1. OT	Pentateuch	1. Pentateuch	01. Pentateuch	05. Deuteronomy	ⲟⲩⲟϩ ⲁ ⲡϭ̅ⲥ̅ ϫⲱⲛⲧ ⲉ̀ϫⲉⲛ ⲁⲁⲣⲱⲛ ⲉ̀ⲙⲁϣⲱ ⲉ̀ϥⲟⲧϥ ⲉ̀ⲃⲟⲗ ⲟⲩⲟϩ ⲁⲓⲧⲱⲃϩ ⲉ̀ϫⲉⲛ ⲁⲁⲣⲱⲛ ϧⲉⲛ ⲡⲓⲥⲏⲟⲩ ⲉⲧⲉⲙ̀ⲙⲁⲩ		And he was angry with Aaron to destroy him utterly, and I prayed for Aaron also at that time.	καὶ ἐπὶ Ααρων ἐθυµώθη κύριος σφόδρα ἐξολεθρεῦσαι αὐτόν, καὶ ηὐξάµην καὶ περὶ Ααρων ἐν τῷ καιρῷ ἐκείνῳ.						
Deuteronomy	9	09	21	OT	1. OT	Pentateuch	1. Pentateuch	01. Pentateuch	05. Deuteronomy	ⲟⲩⲟϩ ⲡⲉⲧⲉⲛⲛⲟⲃⲓ ⲉⲧⲁⲣⲉⲧⲉⲛⲁⲓϥ ⲡⲓⲙⲁⲥⲓ ⲁⲓϭⲓⲧϥ ⲁⲓⲣⲟⲕϩϥ ϧⲉⲛ ⲟⲩⲭⲣⲱⲙ ⲟⲩⲟϩ ⲁⲓϭⲉⲧϭⲱⲧϥ ⲁⲓⲙⲟⲛⲕϥ ⲉ̀ⲙⲁϣⲱ ϣⲁⲧⲉϥϣⲱⲡⲓ ⲉϥϣⲟⲙ ⲟⲩⲟϩ ⲁϥⲉⲣ ⲙ̀ⲫⲣⲏϯ ⲛ̀ⲟⲩϣⲱⲓϣ ⲟⲩⲟϩ ⲁⲓϩⲓⲟⲩⲓ ⲙ̀ⲡⲓϣⲱⲓϣ ⲉ̀ⲡⲓⲙⲟⲩⲛⲥⲱⲣⲉⲙ ⲉⲑⲛⲏⲟⲩ ⲉ̀ⲡⲉⲥⲏⲧ ⲉ̀ⲃⲟⲗ ϩⲓ ⲡⲓⲧⲱⲟⲩ		And your sin which ye had made, even the calf, I took, and burnt it with fire, and pounded it and ground it down till it became fine; and it became like dust, and I cast the dust into the brook that descended from the mountain.	καὶ τὴν ἁµαρτίαν ὑµῶν, ἣν ἐποιήσατε, τὸν µόσχον, ἔλαβον αὐτὸν καὶ κατέκαυσα αὐτὸν ἐν πυρὶ καὶ συνέκοψα αὐτὸν καταλέσας σφόδρα, ἕως οὗ ἐγένετο λεπτόν· καὶ ἐγενήθη ὡσεὶ κονιορτός, καὶ ἔρριψα τὸν κονιορτὸν εἰς τὸν χειµάρρουν τὸν καταβαίνοντα ἐκ τοῦ ὄρους. —						
Deuteronomy	9	09	22	OT	1. OT	Pentateuch	1. Pentateuch	01. Pentateuch	05. Deuteronomy	ⲟⲩⲟϩ ϧⲉⲛ ⲡⲓⲣⲱⲕϩ ⲟⲩⲟϩ ϧⲉⲛ ⲡⲓⲡⲓⲣⲁⲥⲙⲟⲥ ϧⲉⲛ ⲛⲓⲙϩⲁⲩ ⲛ̀ⲧⲉ ϯⲉⲡⲓⲑⲩⲙⲓⲁ ⲛⲁⲣⲉⲧⲉⲛϯϫⲱⲛⲧ ⲙ̀ⲡϭ̅ⲥ̅ ⲡⲉⲧⲉⲛⲛⲟⲩϯ		Also in the burning, and in the temptation, and at the graves of lust, ye provoked the Lord.	καὶ ἐν τῷ Ἐµπυρισµῷ καὶ ἐν τῷ Πειρασµῷ καὶ ἐν τοῖς Μνήµασιν τῆς ἐπιθυµίας παροξύνοντες ἦτε κύριον τὸν θεὸν ὑµῶν.						
Deuteronomy	9	09	23	OT	1. OT	Pentateuch	1. Pentateuch	01. Pentateuch	05. Deuteronomy	ⲟⲩⲟϩ ϩⲟⲧⲉ ⲉⲧⲁ ⲡϭ̅ⲥ̅ ⲟⲩⲉⲣⲡ ⲑⲏⲛⲟⲩ ⲉ̀ⲃⲟⲗ ϧⲉⲛ ⲕⲁⲇⲏⲥ ⲃⲁⲣⲛⲏ ⲉϥϫⲱ ⲙ̀ⲙⲟⲥ ϫⲉ ⲙⲁϣⲉ ⲛⲱⲧⲉⲛ ⲉ̀ϩⲣⲏⲓ ⲁⲣⲓⲕⲗⲏⲣⲟⲛⲟⲙⲓⲛ ⲙ̀ⲡⲓⲕⲁϩⲓ ⲫⲏ ⲁ̀ⲛⲟⲕ ⲉ̀ϯⲛⲁⲧⲏⲓϥ ⲛⲱⲧⲉⲛ ⲟⲩⲟϩ ⲁⲣⲉⲧⲉⲛⲉⲣⲁⲧⲥⲱⲧⲉⲙ ⲛ̀ⲥⲁ ⲡⲥⲁϫⲓ ⲙ̀ⲡϭ̅ⲥ̅ ⲡⲉⲧⲉⲛⲛⲟⲩϯ ⲟⲩⲟϩ ⲙ̀ⲡⲉⲧⲉⲛⲛⲁϩϯ ⲉ̀ⲣⲟϥ ⲟⲩⲇⲉ ⲙ̀ⲡⲉⲧⲉⲛⲥⲱⲧⲉⲙ ⲛ̀ⲥⲁ ⲧⲉϥⲥⲙⲏ		And when the Lord sent you forth from Cades Barne, saying, Go up and inherit the land which I give to you, then ye disobeyed the word of the Lord your God, and believed him not, and hearkened not to his voice.	καὶ ὅτε ἐξαπέστειλεν κύριος ὑµᾶς ἐκ Καδης Βαρνη λέγων Ἀνάβητε καὶ κληρονοµήσατε τὴν γῆν, ἣν δίδωµι ὑµῖν, καὶ ἠπειθήσατε τῷ ῥήµατι κυρίου τοῦ θεοῦ ὑµῶν καὶ οὐκ ἐπιστεύσατε αὐτῷ καὶ οὐκ εἰσηκούσατε τῆς φωνῆς αὐτοῦ.						
Deuteronomy	9	09	24	OT	1. OT	Pentateuch	1. Pentateuch	01. Pentateuch	05. Deuteronomy	ⲛⲁⲣⲉⲧⲉⲛⲟⲓ ⲅⲁⲣ ⲛ̀ⲁⲧⲥⲱⲧⲉⲙ ⲛ̀ⲥⲁ ⲡϭ̅ⲥ̅ ⲓⲥϫⲉⲛ ⲡⲓⲉϩⲟⲟⲩ ⲉⲧⲁϥⲟⲩⲟⲛϩϥ ⲉ̀ⲣⲱⲧⲉⲛ		Ye were disobedient in the things relating to the Lord from the day in which he became known to you.	ἀπειθοῦντες ἦτε τὰ πρὸς κύριον ἀπὸ τῆς ἡµέρας, ἧς ἐγνώσθη ὑµῖν. —						
Deuteronomy	9	09	25	OT	1. OT	Pentateuch	1. Pentateuch	01. Pentateuch	05. Deuteronomy	ⲟⲩⲟϩ ⲁⲓϯϩⲟ ⲙ̀ⲡⲉⲙ̀ⲑⲟ ⲙ̀ⲡϭ̅ⲥ̅ ⲛ̀ⲙ̅ ⲛ̀ⲉϩⲟⲟⲩ ⲛⲉⲙ ⲙ̅ ⲛ̅ⲉϫⲱⲣϩ ⲛⲏ ⲉⲧⲁⲓⲁⲓⲧⲟⲩⲉⲓ ⲧⲱⲃϩ ⲛⲉ ⲁϥϫⲟⲥ ⲅⲁⲣ ⲛ̀ϫⲉ ⲡϭ̅ⲥ̅ ⲉ̀ϥⲉⲧ ⲑⲏⲛⲟⲩ ⲉ̀ⲃⲟⲗ		And I prayed before the Lord forty days and forty nights, the number that I prayed before, for the Lord said that he would utterly destroy you.	καὶ ἐδεήθην ἐναντίον κυρίου τεσσαράκοντα ἡµέρας καὶ τεσσαράκοντα νύκτας, ὅσας ἐδεήθην — εἶπεν γὰρ κύριος ἐξολεθρεῦσαι ὑµᾶς —						
Deuteronomy	9	09	26	OT	1. OT	Pentateuch	1. Pentateuch	01. Pentateuch	05. Deuteronomy	ⲁⲓⲧⲱⲃϩ ⲙ̀ⲫϯ ⲟⲩⲟϩ ⲁⲓϫⲟⲥ ϫⲉ ⲡϭ̅ⲥ̅ ⲡϭ̅ⲥ̅ ⲡⲟⲩⲣⲟ ⲛ̀ⲧⲉ ⲛⲓⲉⲑⲛⲟⲥ ⲙ̀ⲡⲉⲣϥⲱϯ ⲉ̀ⲃⲟⲗ ⲙ̀ⲡⲉⲕⲗⲁⲟⲥ ⲛⲉⲙ ⲧⲉⲕⲕⲗⲏⲣⲟⲛⲟⲙⲓⲁ ⲑⲏ ⲉⲧⲁⲕⲥⲟⲧⲥ ϧⲉⲛ ⲧⲉⲕⲛⲓϣϯ ⲛ̀ϫⲟⲙ ⲛⲏ ⲉⲧⲁⲕⲉⲛⲟⲩ ⲉ̀ⲃⲟⲗ ϧⲉⲛ ⲡⲕⲁϩⲓ ⲛ̀ⲭⲏⲙⲓ ϧⲉⲛ ⲧⲉⲕⲛⲓϣϯ ⲛ̀ϫⲟⲙ ⲛⲉⲙ ⲧⲉⲕϫⲓϫ ⲉⲧⲁⲙⲁϩⲓ ⲛⲉⲙ ⲡⲉⲕϫⲫⲟⲓ ⲉⲧϭⲟⲥⲓ		And I prayed to God, and said, O Lord, King of gods, destroy not thy people and thine inheritance, whom thou didst redeem, whom thou broughtest out of the land of Egypt with thy great power, and with thy strong hand, and with thy high arm.	καὶ εὐξάµην πρὸς τὸν θεὸν καὶ εἶπα Κύριε κύριε βασιλεῦ τῶν θεῶν, µὴ ἐξολεθρεύσῃς τὸν λαόν σου καὶ τὴν µερίδα σου, ἣν ἐλυτρώσω ἐν τῇ ἰσχύι σου τῇ µεγάλῃ, οὓς ἐξήγαγες ἐκ γῆς Αἰγύπτου ἐν τῇ ἰσχύι σου τῇ µεγάλῃ καὶ ἐν τῇ χειρί σου τῇ κραταιᾷ καὶ ἐν τῷ βραχίονί σου τῷ ὑψηλῷ·						
Deuteronomy	9	09	27	OT	1. OT	Pentateuch	1. Pentateuch	01. Pentateuch	05. Deuteronomy	ⲁⲣⲓⲫⲙⲉⲩⲓ ⲛ̀ⲁⲃⲣⲁⲁⲙ ⲛⲉⲙ ⲓⲥⲁⲁⲕ ⲛⲉⲙ ⲓⲁⲕⲱⲃ ⲛⲉⲕⲉⲃⲓⲁⲕ ⲛⲏ ⲉⲧⲁⲕⲱⲣⲕ ⲛⲱⲟⲩ ⲉϩⲣⲁⲕ ⲙ̀ⲙⲓⲛ ⲙ̀ⲙⲟⲕ ⲙ̀ⲡⲉⲣϫⲟⲩϣⲧ ⲉ̀ϫⲉⲛ ⲡⲉⲛϣⲟⲧ ⲙ̀ⲡⲁⲓⲗⲁⲟⲥ ⲛⲉⲙ ⲛⲟⲩⲙⲉⲧⲁⲥⲉⲃⲏⲥ ⲛⲉⲙ ⲛⲟⲩⲛⲟⲃⲓ		Remember Abraam, and Isaac, and Jacob thy servants, to whom thou swarest by thyself: look not upon the hardness of heart of this people, and their impieties, and their sins.	µνήσθητι Αβρααµ καὶ Ισαακ καὶ Ιακωβ τῶν θεραπόντων σου, οἷς ὤµοσας κατὰ σεαυτοῦ· µὴ ἐπιβλέψῃς ἐπὶ τὴν σκληρότητα τοῦ λαοῦ τούτου καὶ τὰ ἀσεβήµατα καὶ τὰ ἁµαρτήµατα αὐτῶν,						
Deuteronomy	9	09	28	OT	1. OT	Pentateuch	1. Pentateuch	01. Pentateuch	05. Deuteronomy	ⲙⲏⲡⲱⲥ ⲛ̀ⲧⲟⲩϫⲟⲥ ⲛ̀ϫⲉ ⲛⲏ ⲉⲧϣⲟⲡ ϧⲉⲛ ⲡⲓⲕⲁϩⲓ ⲡⲓⲙⲁ ⲉⲧⲁⲕⲉⲛⲟⲩ ⲉ̀ⲃⲟⲗ ⲛ̀ϧⲏⲧϥ ⲉⲩϫⲱ ⲙ̀ⲙⲟⲥ ϫⲉ ⲉⲑⲃⲉ ϫⲉ ⲙ̀ⲡⲉϥϣϫⲉⲙϫⲟⲙ ⲛ̀ϫⲉ ⲡϭ̅ⲥ̅ ⲉ̀ϭⲓⲧⲟⲩ ⲉ̀ϧⲟⲩⲛ ⲉ̀ⲡⲓⲕⲁϩⲓ ⲉⲧⲁϥϫⲟⲥ ⲛⲱⲟⲩ ⲟⲩⲟϩ ⲉⲑⲃⲉ ϫⲉ ϥⲙⲟⲥϯ ⲙ̀ⲙⲱⲟⲩ ⲁϥⲉⲛⲟⲩ ⲉ̀ⲃⲟⲗ ⲉ̀ϧⲟⲑⲃⲟⲩ ϩⲓ ⲡϣⲁϥⲉ		Lest the inhabitants of the land whence thou broughtest us out speak, saying, Because the Lord could not bring them into the land of which he spoke to them, and because he hated them, has he brought them forth to slay them in the wilderness.	µὴ εἴπωσιν οἱ κατοικοῦντες τὴν γῆν, ὅθεν ἐξήγαγες ἡµᾶς ἐκεῖθεν, λέγοντες Παρὰ τὸ µὴ δύνασθαι κύριον εἰσαγαγεῖν αὐτοὺς εἰς τὴν γῆν, ἣν εἶπεν αὐτοῖς, καὶ παρὰ τὸ µισῆσαι αὐτοὺς ἐξήγαγεν αὐτοὺς ἀποκτεῖναι ἐν τῇ ἐρήµῳ.						
Deuteronomy	9	09	29	OT	1. OT	Pentateuch	1. Pentateuch	01. Pentateuch	05. Deuteronomy	ⲟⲩⲟϩ ⲫⲁⲓ ⲡⲉ ⲡⲉⲕⲗⲁⲟⲥ ⲛⲉⲙ ⲧⲉⲕⲕⲗⲏⲣⲟⲛⲟⲙⲓⲁ ⲛⲏ ⲉⲧⲁⲕⲉⲛⲟⲩ ⲉ̀ⲃⲟⲗ ϧⲉⲛ ⲡⲕⲁϩⲓ ⲛ̀ⲭⲏⲙⲓ ϧⲉⲛ ⲧⲉⲕⲛⲓϣϯ ⲛ̀ϫⲟⲙ ⲛⲉⲙ ϧⲉⲛ ⲧⲉⲕϫⲓϫ ⲉⲧⲁⲙⲁϩⲓ ⲛⲉⲙ ϧⲉⲛ ⲡⲉⲕϫⲫⲟⲓ ⲉⲧϭⲟⲥⲓ		And these are thy people and thy portion, whom thou broughtest out of the land of Egypt with thy great strength, and with thy mighty hand, and with thy high arm.	καὶ οὗτοι λαός σου καὶ κλῆρός σου, οὓς ἐξήγαγες ἐκ γῆς Αἰγύπτου ἐν τῇ ἰσχύι σου τῇ µεγάλῃ καὶ ἐν τῷ βραχίονί σου τῷ ὑψηλῷ.						
Deuteronomy	10	10	1	OT	1. OT	Pentateuch	1. Pentateuch	01. Pentateuch	05. Deuteronomy	ϧⲉⲛ ⲡⲓⲥⲏⲟⲩ ⲉⲧⲉⲙ̀ⲙⲁⲩ ⲁϥϫⲟⲥ ⲛⲏⲓ ⲛ̀ϫⲉ ⲡϭ̅ⲥ̅ ϫⲉ ⲫⲱⲧϩ ⲛⲁⲕ ⲙ̀ⲡⲗⲁⲝ ⲃ̅ ⲛ̀ⲱⲛⲓ ⲙ̀ⲫⲣⲏϯ ⲛ̀ⲛⲓϩⲟⲩⲁϯ ⲁⲙⲟⲩ ⲉ̀ⲡϣⲱⲓ ϩⲁⲣⲟⲓ ϩⲓϫⲉⲛ ⲡⲓⲧⲱⲟⲩ ⲟⲩⲟϩ ⲙⲁⲑⲁⲙⲓⲟ ⲛⲁⲕ ⲛ̀ⲟⲩⲕⲩⲃⲱⲧⲟⲥ ⲛ̀ϣⲉ		At that time the Lord said to me, Hew for thyself two stone tables as the first, and come up to me into the mountain, and thou shalt make for thyself an ark of wood.	Ἐν ἐκείνῳ τῷ καιρῷ εἶπεν κύριος πρός µε Λάξευσον σεαυτῷ δύο πλάκας λιθίνας ὥσπερ τὰς πρώτας καὶ ἀνάβηθι πρός µε εἰς τὸ ὄρος· καὶ ποιήσεις σεαυτῷ κιβωτὸν ξυλίνην·						
Deuteronomy	10	10	2	OT	1. OT	Pentateuch	1. Pentateuch	01. Pentateuch	05. Deuteronomy	ⲟⲩⲟϩ ⲛ̀ⲧⲁⲥϧⲁⲓ ϩⲓ ⲛⲓⲡⲗⲁⲝ ⲛ̀ⲛⲓⲥⲁϫⲓ ⲛⲏ ⲉ̀ⲛⲁⲩ ϩⲓ ⲛⲓⲡⲗⲁⲝ ⲛ̀ϩⲟⲩⲁϯ ⲛⲏ ⲉⲧⲁⲕϧⲉⲙϧⲱⲙⲟⲩ ⲟⲩⲟϩ ⲉⲕⲉ̀ϩⲓⲧⲟⲩ ⲉ̀ϧⲟⲩⲛ ⲉ̀ϯⲕⲩⲃⲱⲧⲟⲥ		And thou shalt write upon the tables the words which were on the first tables which thou didst break, and thou shalt put them into the ark.	καὶ γράψω ἐπὶ τὰς πλάκας τὰ ῥήµατα, ἃ ἦν ἐν ταῖς πλαξὶν ταῖς πρώταις, ἃς συνέτριψας, καὶ ἐµβαλεῖς αὐτὰς εἰς τὴν κιβωτόν.						
Deuteronomy	10	10	3	OT	1. OT	Pentateuch	1. Pentateuch	01. Pentateuch	05. Deuteronomy	ⲟⲩⲟϩ ⲁⲓⲑⲁⲙⲓⲟ ⲛ̀ⲟⲩⲕⲩⲃⲱⲧⲟⲥ ⲉ̀ⲃⲟⲗ ϧⲉⲛ ϩⲁⲛϣⲉ ⲛ̀ⲁⲧⲉⲣϩⲟⲗⲓ ⲟⲩⲟϩ ⲁⲓⲫⲱⲧϩ ⲛ̀ϯⲡⲗⲁⲝ ⲃ̅ϯ ⲛ̀ⲱⲛⲓ ⲙ̀ⲫⲣⲏϯ ⲛ̀ⲛⲓϩⲟⲩⲁϯ ⲁⲓϣⲉ ⲛⲏⲓ ⲉ̀ϩⲣⲏⲓ ⲉ̀ϫⲉⲛ ⲡⲓⲧⲱⲟⲩ ⲟⲩⲟϩ ϯⲡⲗⲁⲝ ⲃ̅ϯ ⲛⲁⲩⲭⲏ ϧⲉⲛ ⲛⲁϫⲓϫ		So I made an ark of boards of incorruptible wood, and I hewed tables of stone like the first, and I went up to the mountain, and the two tables were in my hand.	καὶ ἐποίησα κιβωτὸν ἐκ ξύλων ἀσήπτων καὶ ἐλάξευσα τὰς δύο πλάκας τὰς λιθίνας ὡς αἱ πρῶται· καὶ ἀνέβην εἰς τὸ ὄρος, καὶ αἱ δύο πλάκες ἐπὶ ταῖς χερσίν µου.						
Deuteronomy	10	10	4	OT	1. OT	Pentateuch	1. Pentateuch	01. Pentateuch	05. Deuteronomy	ⲟⲩⲟϩ ⲁϥⲥϧⲁⲓ ϩⲓ ⲛⲓⲡⲗⲁⲝ ⲕⲁⲧⲁ ϯⲅⲣⲁⲫⲏ ⲛ̀ϩⲟⲩⲓϯ ⲡⲓⲓ̅ ⲛ̀ⲥⲁϫⲓ ⲛⲏ ⲉⲧⲁϥⲥⲁϫⲓ ⲙ̀ⲙⲱⲟⲩ ⲛⲉⲙⲱⲧⲉⲛ ⲛ̀ϫⲉ ⲡϭ̅ⲥ̅ ϩⲓ ⲡⲓⲧⲱⲟⲩ ⲉ̀ⲃⲟⲗ ϧⲉⲛ ⲑⲙⲏϯ ⲙ̀ⲡⲓⲭⲣⲱⲙ ⲁϥⲧⲏⲓⲧⲟⲩ ⲛⲏⲓ ⲛ̀ϫⲉ ⲡϭ̅ⲥ̅		And he wrote upon the tables according to the first writing the ten commandments, which the Lord spoke to you in the mountain out of the midst of the fire, and the Lord gave them to me.	καὶ ἔγραψεν ἐπὶ τὰς πλάκας κατὰ τὴν γραφὴν τὴν πρώτην τοὺς δέκα λόγους, οὓς ἐλάλησεν κύριος πρὸς ὑµᾶς ἐν τῷ ὄρει ἐκ µέσου τοῦ πυρός, καὶ ἔδωκεν αὐτὰς κύριος ἐµοί.						
Deuteronomy	10	10	5	OT	1. OT	Pentateuch	1. Pentateuch	01. Pentateuch	05. Deuteronomy	ⲟⲩⲟϩ ⲉⲧⲁⲓⲕⲟⲧⲧ ⲁⲓⲓ̀ ⲉ̀ⲡⲉⲥⲏⲧ ⲉ̀ⲃⲟⲗ ϩⲓϫⲉⲛ ⲡⲓⲧⲱⲟⲩ ⲟⲩⲟϩ ⲁⲓϩⲓⲟⲩⲓ ⲛ̀ⲛⲓⲡⲗⲁⲝ ⲉ̀ϧⲟⲩⲛ ⲉ̀ϯⲕⲩⲃⲱⲧⲟⲥ ⲉⲧⲁⲓⲑⲁⲙⲓⲟⲥ ⲟⲩⲟϩ ⲥⲉⲭⲏ ⲙ̀ⲙⲁⲩ ⲕⲁⲧⲁ ⲫⲣⲏϯ ⲉⲧⲁϥⲟⲩⲁϩⲥⲁϩⲛⲓ ⲛⲏⲓ ⲛ̀ϫⲉ ⲡϭ̅ⲥ̅		And I turned and came down from the mountain, and I put the tables into the ark which I had made; and there they were, as the Lord commanded me.	καὶ ἐπιστρέψας κατέβην ἐκ τοῦ ὄρους καὶ ἐνέβαλον τὰς πλάκας εἰς τὴν κιβωτόν, ἣν ἐποίησα, καὶ ἦσαν ἐκεῖ, καθὰ ἐνετείλατό µοι κύριος. —						
Deuteronomy	10	10	6	OT	1. OT	Pentateuch	1. Pentateuch	01. Pentateuch	05. Deuteronomy	ⲟⲩⲟϩ ⲛⲉⲛϣⲏⲣⲓ ⲙ̀ⲡⲓⲥ̅ⲗ̅ ⲁⲩⲟⲩⲱⲧⲉⲃ ⲉ̀ⲃⲟⲗ ϧⲉⲛ ⲃⲉⲣⲱⲑ ⲛ̀ⲧⲉ ⲛⲉⲛϣⲏⲣⲓ ⲛ̀ⲁⲕⲓⲙ ⲙⲓⲥⲁⲇⲁⲓⲙ ⲉⲧⲁϥⲙⲟⲩ ⲙ̀ⲙⲁⲩ ⲛ̀ϫⲉ ⲁⲁⲣⲱⲛ ⲟⲩⲟϩ ⲁⲩⲕⲟⲥϥ ⲙ̀ⲙⲁⲩ ⲟⲩⲟϩ ⲁϥⲉⲣⲟⲩⲏⲃ ⲛ̀ϫⲉ ⲉⲗⲉⲁⲍⲁⲣ ⲡⲉϥϣⲏⲣⲓ ⲛ̀ⲧⲉϥϣⲉⲃⲓⲱ		And the children of Israel departed from Beeroth of the sons of Jakim to Misadai: there Aaron died, and there he was buried, and Eleazar his son was priest in his stead.	καὶ οἱ υἱοὶ Ισραηλ ἀπῆραν ἐκ Βηρωθ υἱῶν Ιακιµ Μισαδαι· ἐκεῖ ἀπέθανεν Ααρων καὶ ἐτάφη ἐκεῖ, καὶ ἱεράτευσεν Ελεαζαρ υἱὸς αὐτοῦ ἀντ’ αὐτοῦ.						
Deuteronomy	10	10	7	OT	1. OT	Pentateuch	1. Pentateuch	01. Pentateuch	05. Deuteronomy	ⲁⲩⲟⲩⲱⲧⲉⲃ ⲉ̀ⲃⲟⲗ ⲙ̀ⲙⲁⲩ ⲉ̀ⲅⲁⲇⲅⲁⲇ ⲟⲩⲟϩ ⲉ̀ⲃⲟⲗ ϧⲉⲛ ⲅⲁⲇⲅⲁⲇ ⲉⲧⲉⲑⲉⲃⲉⲑⲁ ⲟⲩⲕⲁϩⲓ ⲉⲣⲉ ⲟⲩⲟⲛ ϩⲁⲛⲙⲟⲩⲛⲥⲱⲣⲉⲙ ⲛ̀ϧⲏⲧϥ		Thence they departed to Gadgad; and from Gadgad to Etebatha, a land wherein are torrents of water.	ἐκεῖθεν ἀπῆραν εἰς Γαδγαδ καὶ ἀπὸ Γαδγαδ εἰς Ετεβαθα, γῆ χείµαρροι ὑδάτων.						
