book	chapter	chapter-zfilled	verse	testament	testament-indexed	section	section-indexed	section-indexed-no-testament	book-indexed	Bohairic	Sahidic	English	Greek	Fayyumic	Akhmimic	OldBohairic	Mesokemic	DialectP	Lycopolitan
Psalms	104	104	25	OT	1. OT	Poetic Books	3. Poetic Books	03. Poetic Books	01. Psalms	(11) ⲁϥⲫⲉⲛϩ ⲡⲟⲩϩⲏⲧ ⲉ̀ⲙⲉⲥⲧⲉ ⲡⲉϥⲗⲁⲟⲥ: ⲉ̀ⲡϫⲓⲛⲉⲣⲭⲣⲟϥ ϧⲉⲛ ⲛⲉϥⲉⲃⲓⲁⲓⲕ.	ⲁϥⲕⲧⲉ ⲡⲉϥϩⲏⲧ ⲉⲙⲉⲥⲧⲉ ⲡⲉϥⲗⲁⲟⲥ. ⲁⲩⲱ ⲉⲣⲕⲣⲟϥ ϩⲛ̅ ⲛⲉϥϩⲙ̅ϩⲁⲗ.	And he turned their heart to hate his people, to deal craftily with his servants.	µετέστρεψεν τὴν καρδίαν αὐτῶν τοῦ µισῆσαι τὸν λαὸν αὐτοῦ, τοῦ δολιοῦσθαι ἐν τοῖς δούλοις αὐτοῦ.						
Psalms	104	104	26	OT	1. OT	Poetic Books	3. Poetic Books	03. Poetic Books	01. Psalms	(12) ⲁϥⲟⲩⲱⲣⲡ ⲙ̀ⲙⲱⲩ̀ⲥⲏⲥ ⲡⲉϥⲃⲱⲕ: ⲛⲉⲙ ⲁⲁⲣⲱⲛ ⲫⲏ ⲉⲧⲁϥⲥⲟⲧⲡϥ:	ⲁϥϫⲉⲩ ⲙⲱⲩ̈ⲥⲏⲥ ⲡⲉϥϩⲙ̅ϩⲁⲗ. ⲙⲛ̅ ⲁⲁⲣⲱⲛ ⲡⲉⲛⲧⲁϥⲥⲟⲧⲡϥ̅.	He sent fort Moses his servant, and Aaron whom he had chosen.	ἐξαπέστειλεν Μωυσῆν τὸν δοῦλον αὐτοῦ, Ααρων, ὃν ἐξελέξατο αὐτόν·						
Psalms	104	104	27	OT	1. OT	Poetic Books	3. Poetic Books	03. Poetic Books	01. Psalms	(12) ⲁϥⲭⲱ ⲛ̀ϧⲏⲧⲟⲩ ⲛ̀ⲛⲓⲥⲁϫⲓ ⲛ̀ⲧⲉ ⲛⲉϥⲙⲏⲓⲛⲓ: ⲛⲉⲙ ⲛⲉϥϣⲫⲏⲣⲓ ϧⲉⲛ ⲡⲕⲁϩⲓ ⲛ̀ⲭⲁⲙ.	ⲁϥⲕⲱ ⲛ̅ϩⲏⲧⲟⲩ ⲛ̅ⲛ̅ϣⲁϫⲉ ⲛ̅ⲛⲉϥⲙⲁⲉⲓⲛ. ⲁⲩⲱ ⲛⲉϥϣⲡⲏⲣⲉ ϩⲙ̅ ⲡⲕⲁϩ ⲛ̅ⲭⲁⲙ.	He established among them his signs, and his wonders in the land of Cham.	ἔθετο ἐν αὐτοῖς τοὺς λόγους τῶν σηµείων αὐτοῦ καὶ τῶν τεράτων ἐν γῇ Χαµ.						
Psalms	104	104	28	OT	1. OT	Poetic Books	3. Poetic Books	03. Poetic Books	01. Psalms	(13) ⲁϥⲟⲩⲱⲣⲡ ⲛ̀ⲟⲩⲭⲁⲕⲓ ⲁϥⲉⲣⲭⲣⲉⲙⲧⲥ: ⲟⲩⲟϩ ⲁⲩϯϫⲱⲛⲧ ⲛ̀ⲛⲉϥⲥⲁϫⲓ.	ⲁϥϫⲟⲟⲩ ⲛ̅ⲟⲩⲕⲁⲕⲉ ⲁϥϩⲟⲃⲥⲟⲩ. ⲁⲩⲱ ⲁⲩϯ ⲛⲟⲩϭⲥ̅ ⲛ̅ⲛⲉϥϣⲁϫⲉ.	He sent forth darkness, and made it dark; yet they rebelled against his words.	ἐξαπέστειλεν σκότος, καὶ ἐσκότασεν, καὶ παρεπίκραναν τοὺς λόγους αὐτοῦ.						
Psalms	104	104	29	OT	1. OT	Poetic Books	3. Poetic Books	03. Poetic Books	01. Psalms	(14) ⲁϥⲫⲱⲛϩ ⲛ̀ⲛⲟⲩⲙⲱⲟⲩ ⲉⲩⲥⲛⲟϥ: ⲟⲩⲟϩ ⲁϥϧⲱⲧⲉⲃ ⲛ̀ⲛⲟⲩⲕⲉⲧⲉⲃⲧ.	ⲁϥⲕⲧⲟ ⲛ̅ⲛⲉⲩⲙⲟⲟⲩ ⲉⲩⲥⲛⲟϥ. ⲁⲩⲱ ⲁϥⲙⲟⲩⲟⲩⲧ ⲛ̅ⲛⲉⲩⲧⲃⲧ̅.	He turned their waters into blood, and slew their fish.	µετέστρεψεν τὰ ὕδατα αὐτῶν εἰς αἷµα καὶ ἀπέκτεινεν τοὺς ἰχθύας αὐτῶν.						
Psalms	104	104	30	OT	1. OT	Poetic Books	3. Poetic Books	03. Poetic Books	01. Psalms	(15) ⲡⲟⲩⲕⲁϩⲓ ⲁϥⲃⲉⲃⲓ ⲛ̀ϩⲁⲛⲭⲣⲟⲩⲣ ϧⲉⲛ ⲛⲓⲧⲁⲙⲓⲟⲛ ⲛ̀ⲧⲉ ⲛⲟⲩⲟⲩⲣⲱⲟⲩ.	ⲁ ⲡⲉⲩⲕⲁϩ ⲧⲁⲩⲟ ⲉϩⲣⲁⲓ ⲛ̅ϩⲉⲛⲕⲣⲟⲩⲣ ϩⲛ̅ ⲛ̅ⲧⲁⲙⲓⲟⲛ ⲛ̅ⲛⲉⲩⲣⲣⲱⲟⲩ.	Their land produced frogs abundantly, in the chambers of their kings.	ἐξῆρψεν ἡ γῆ αὐτῶν βατράχους ἐν τοῖς ταµιείοις τῶν βασιλέων αὐτῶν.						
Psalms	104	104	31	OT	1. OT	Poetic Books	3. Poetic Books	03. Poetic Books	01. Psalms	(16) ⲁϥϫⲟⲥ ⲁϥⲓ̀ ⲛ̀ϫⲉ ⲟⲩⲁϥ ⲛ̀ⲟⲩϩⲟⲣ: ⲛⲉⲙ ϩⲁⲛⲗⲉϩⲗⲉⲙ ϧⲉⲛ ⲛⲟⲩϭⲓⲏ ⲧⲏⲣⲟⲩ:	ⲁϥϫⲟⲟⲥ ⲁϥⲉⲓ ⲛ̅ϭⲓ ⲡⲁϥ ⲛ̅ⲟⲩϩⲟⲣ. ⲁⲩⲱ ⲡⲉϩⲗⲱⲙ ϩⲛ̅ ⲛⲉⲩⲧⲟϣ ⲧⲏⲣⲟⲩ.	He spoke, and the dog-fly came, and lice in all their coasts.	εἶπεν, καὶ ἦλθεν κυνόµυια καὶ σκνῖπες ἐν πᾶσι τοῖς ὁρίοις αὐτῶν.						
Psalms	104	104	32	OT	1. OT	Poetic Books	3. Poetic Books	03. Poetic Books	01. Psalms	(16) ⲁϥⲭⲱ ⲛ̀ⲛⲟⲩⲙⲟⲩⲛϩⲱⲟⲩ ⲛ̀ⲟⲩⲁⲗ ⲙ̀ⲫⲉ. (17) ⲟⲩⲭⲣⲱⲙ ⲁϥⲙⲟϩ ϧⲉⲛ ⲡⲟⲩⲕⲁϩⲓ:	ⲁϥⲕⲱ ⲛ̅ⲛⲉⲩϩⲱⲟⲩ ⲛ̅ⲁⲗ ⲛ̅ⲡⲉ. ⲛ̅ⲕⲱϩⲧ̅ ⲉϥⲙⲟⲩϩ ϩⲙ̅ ⲡⲉⲩⲕⲁϩ.	He turned their rain into hail, and sent flaming fire in their land.	ἔθετο τὰς βροχὰς αὐτῶν χάλαζαν, πῦρ καταφλέγον ἐν τῇ γῇ αὐτῶν,						
Psalms	104	104	33	OT	1. OT	Poetic Books	3. Poetic Books	03. Poetic Books	01. Psalms	(17) ⲁϥϣⲁⲣⲓ ⲉ̀ⲛⲟⲩⲃⲱ ⲛ̀ⲁⲗⲟⲗⲓ ⲛⲉⲙ ⲛⲟⲩⲃⲱ ⲛ̀ⲕⲉⲛ̀ⲧⲉ:	ⲁϥⲡⲁⲧⲁⲥⲥⲉ ⲛ̅ⲛⲉⲩⲃⲱ ⲛ̅ⲉⲗⲟⲟⲗⲉ ⲙⲛ̅ ⲛ̅ⲉⲩⲃⲱ ⲛ̅ⲕⲛ̅ⲧⲉ.	And he smote their vines and their fig trees;	καὶ ἐπάταξεν τὰς ἀµπέλους αὐτῶν καὶ τὰς συκᾶς αὐτῶν						
Psalms	104	104		OT	1. OT	Poetic Books	3. Poetic Books	03. Poetic Books	01. Psalms	(17) ⲟⲩⲟϩ ϣϣⲏⲛ ⲛⲓⲃⲉⲛ ⲛ̀ⲧⲉ ⲡⲟⲩⲑⲱϣ ⲁϥϧⲉⲙϧⲱⲙⲟⲩ. (18) ⲁϥϫⲟⲥ ⲟⲩⲟϩ ⲁϥⲓ̀ ⲛ̀ϫⲉ ⲟⲩϣϫⲉ ⲛⲉⲙ ⲟⲩⲃⲣⲟⲩⲭⲟⲥ ⲫⲏ ⲉⲧⲉ ⲙ̀ⲙⲟⲛ ⲏⲡⲓ ⲛ̀ⲧⲁϥ.	ⲁⲩⲟⲩⲱϣϥ̅ ⲛ̅ϣⲏⲛ ⲛⲓⲙ ⲛ̅ⲛⲉⲩⲧⲟϣ. ⲁϥϫⲟⲟⲥ ⲁϥⲉⲓ ⲛ̅ϭⲓ ⲡⲉϣϫⲉ ⲁⲩⲱ ⲡⲉⲃⲣⲟⲩⲭⲟⲥ ⲉⲧⲉⲙⲛ̅ⲧϥ̅ ⲏⲡⲉ.	and broke every tree of their coast. (34) He spoke, and the locust came, and caterpillars innumerable,	καὶ συνέτριψεν πᾶν ξύλον ὁρίου αὐτῶν. (34) εἶπεν, καὶ ἦλθεν ἀκρὶς καὶ βροῦχος, οὗ οὐκ ἦν ἀριθµός,						
Psalms	104	104	35	OT	1. OT	Poetic Books	3. Poetic Books	03. Poetic Books	01. Psalms	(19) ⲁϥⲟⲩⲱⲙ ⲛ̀ⲛⲓⲥⲙⲉϩ ⲧⲏⲣⲟⲩ ⲛ̀ⲧⲉ ⲡⲟⲩⲕⲁϩⲓ: ⲟⲩⲟϩ ⲁϥⲟⲩⲱⲙ ⲙ̀ⲡⲟⲩⲧⲁϩ ⲛ̀ⲧⲉ ⲡⲟⲩⲕⲁϩⲓ:	ⲁϥⲟⲩⲱⲙ ⲙ̅ⲡⲉⲭⲣⲟⲧⲟⲥ ⲧⲏⲣϥ̅ ⲙ̅ⲡⲉⲩⲕⲁϩ.	and devoured all the grass in their land, and devoured the fruit of the ground.	καὶ κατέφαγεν πάντα τὸν χόρτον ἐν τῇ γῇ αὐτῶν καὶ κατέφαγεν τὸν καρπὸν τῆς γῆς αὐτῶν.						
Psalms	104	104	36	OT	1. OT	Poetic Books	3. Poetic Books	03. Poetic Books	01. Psalms	(19) ⲁϥϣⲁⲣⲓ ⲉ̀ϣⲁⲙⲓⲥⲓ ⲛⲓⲃⲉⲛ ⲉⲧϧⲉⲛ ⲡⲟⲩⲕⲁϩⲓ: ⲛⲉⲙ ⲧⲁⲡⲁⲣⲭⲏ ⲛ̀ⲧⲉ ⲡⲟⲩϧⲓⲥⲓ ⲧⲏⲣϥ.	ⲁϥⲡⲁⲧⲁⲁⲥⲉ ⲛ̅ϣⲣⲡ̅ ⲙ̅ⲙⲓⲥⲉ ⲛⲓⲙ ⲙ̅ⲡⲉⲩⲕⲁϩ. ⲧⲁⲡⲁⲣⲭⲏ ⲛ̅ⲛⲉⲩϩⲓⲥⲉ ⲧⲏⲣⲟⲩ.	He smote also every first-born of their land, the first-fruits of all their labour.	καὶ ἐπάταξεν πᾶν πρωτότοκον ἐν τῇ γῇ αὐτῶν, ἀπαρχὴν παντὸς πόνου αὐτῶν,						
Psalms	104	104	37	OT	1. OT	Poetic Books	3. Poetic Books	03. Poetic Books	01. Psalms	(20) ⲁϥⲉⲛⲟⲩ ⲉ̀ⲃⲟⲗ ϧⲉⲛ ϩⲁⲛⲓⲉⲃ ⲛ̀ϩⲁⲧ ⲛⲉⲙ ϩⲁⲛⲓⲉⲃ ⲛ̀ⲛⲟⲩⲃ: ⲟⲩⲟϩ ⲛⲉ ⲙ̀ⲙⲟⲛ ⲡⲉⲧϣⲱⲛⲓ ϧⲉⲛ ⲛⲟⲩⲫⲩⲗⲏ.	ⲁϥⲛ̅ⲧⲟⲩ ⲉⲃⲟⲗ ϩⲙ̅ ⲡϩⲁⲧ ⲙⲛ̅ ⲡⲛⲟⲩⲃ. ⲛⲉ ⲙⲛ̅ ⲡⲉⲧϭⲟⲟⲃ ϩⲛ̅ ⲛⲉⲩⲫⲩⲗⲏ.	And he brought them out with silver and gold; and there was not a feeble one among their tribes.	καὶ ἐξήγαγεν αὐτοὺς ἐν ἀργυρίῳ καὶ χρυσίῳ καὶ οὐκ ἦν ἐν ταῖς φυλαῖς αὐτῶν ἀσθενῶν.						
Psalms	104	104	38	OT	1. OT	Poetic Books	3. Poetic Books	03. Poetic Books	01. Psalms	(21) ⲁϥⲟⲩⲛⲟϥ ⲛ̀ϫⲉ ⲭⲏⲙⲓ ⲉ̀ϫⲉⲛ ⲡⲟⲩϫⲓⲛⲙⲟϣⲓ ⲉ̀ⲃⲟⲗ: ϫⲉ ⲁⲥⲓ̀ ⲉ̀ϩⲣⲏⲓ ⲉ̀ϫⲱⲟⲩ ⲛ̀ϫⲉ ⲧⲟⲩϩⲟϯ.	ⲁ ⲕⲏⲙⲉ ⲉⲩⲫⲣⲁⲛⲉ ϩⲙ̅ ⲡⲉⲩⲉⲓ ⲉⲃⲟⲗ. ϫⲉ ⲁ ⲧⲉⲩϩⲟⲧⲉ ⲉⲓ ⲉϩⲣⲁⲓ ⲉϫⲱⲟⲩ.	Egypt rejoiced at their departing; for the fear of them fell upon them.	εὐφράνθη Αἴγυπτος ἐν τῇ ἐξόδῳ αὐτῶν, ὅτι ἐπέπεσεν ὁ φόβος αὐτῶν ἐπ’ αὐτούς.						
Psalms	104	104	39	OT	1. OT	Poetic Books	3. Poetic Books	03. Poetic Books	01. Psalms	(22) ⲁϥⲫⲱⲣϣ ⲛ̀ⲟⲩϭⲏⲡⲓ ⲉⲩϧⲏⲓⲃⲓ ⲛⲱⲟⲩ: ⲛⲉⲙ ⲟⲩⲭⲣⲱⲙ ⲉ̀ⲡϫⲓⲛ̀ⲧⲉϥⲉⲣⲟⲩⲱⲓⲛⲓ ⲉ̀ⲣⲱⲟⲩ ϧⲉⲛ ⲡⲓⲉϫⲱⲣϩ.	ⲁϥⲡⲉⲣϣ̅ ⲟⲩⲕⲗⲟⲟⲗⲉ ⲉⲃⲟⲗ ⲉⲣϩⲁⲓⲃⲉⲥ ⲉⲣⲟⲟⲩ. ⲙⲛ̅ ⲟⲩⲕⲱϩⲧ̅ ⲉⲣ̅ⲟⲩⲟⲉⲓⲛ ⲉⲣⲟⲟⲩ ⲛ̅ⲧⲉⲩϣⲏ.	He spread out a cloud for a covering to them, and fire to give them light by night.	διεπέτασεν νεφέλην εἰς σκέπην αὐτοῖς καὶ πῦρ τοῦ φωτίσαι αὐτοῖς τὴν νύκτα.						
Psalms	104	104	40	OT	1. OT	Poetic Books	3. Poetic Books	03. Poetic Books	01. Psalms	(23) ⲁⲩⲉⲣⲉⲧⲓⲛ ⲟⲩⲟϩ ⲁⲥⲓ̀ ⲛⲱⲟⲩ ⲛ̀ϫⲉ ⲟⲩⲙⲉⲥⲓⲱϯ ⲙ̀ⲡⲏⲣⲓ: ⲟⲩⲟϩ ⲟⲩⲱⲓⲕ ⲛ̀ⲧⲉ ⲧⲫⲉ ⲁϥⲧⲥⲓⲱⲟⲩ ⲙ̀ⲙⲟϥ.	ⲁⲩⲁⲓⲧⲉⲓ ⲛ̅ϩⲉⲛⲁϥ ⲁⲥⲉⲓ ⲛⲁⲩ ⲛ̅ϭⲓ ⲟⲩϩⲏ ⲙ̅ⲡⲏⲣⲉ. ⲁϥⲧⲥⲓⲟⲟⲩ ⲙ̅ⲡⲟⲉⲓⲕ ⲛ̅ⲧⲡⲉ.	They asked, and the quail came, and he satisfied them with the bread of heaven.	ᾔτησαν, καὶ ἦλθεν ὀρτυγοµήτρα, καὶ ἄρτον οὐρανοῦ ἐνέπλησεν αὐτούς·						
Psalms	104	104	41	OT	1. OT	Poetic Books	3. Poetic Books	03. Poetic Books	01. Psalms	(24) ⲁϥⲫⲱϫⲓ ⲛ̀ϯⲡⲉⲧⲣⲁ ⲟⲩⲟϩ ⲁⲩϧⲁϯ ⲉ̀ⲃⲟⲗ ⲛ̀ϫⲉ ϩⲁⲛⲙⲱⲟⲩ: ⲁⲩⲙⲟϣⲓ ϧⲉⲛ ϩⲁⲛⲓⲁⲣⲱⲟⲩ ⲉ̀ϩⲁⲛⲙⲁ ⲛ̀ⲁⲑⲙⲱⲟⲩ:	ⲁϥⲡⲱϩ ⲛ̅ⲟⲩⲡⲉⲧⲣⲁ ⲁ ϩⲉⲛⲙⲟⲟⲩ ϣⲟⲩⲟ ⲉⲃⲟⲗ. ⲁ ϩⲉⲛⲉⲓⲉⲣⲱⲟⲩ ⲥⲱⲕ ϩⲛ̅ ϩⲉⲛⲙⲁ ⲉⲙⲛ̅ⲙⲟⲟⲩ ⲛ̅ϩⲏⲧⲟⲩ.	He clave the rock, and the waters flowed, rivers ran in dry places.	διέρρηξεν πέτραν, καὶ ἐρρύησαν ὕδατα, ἐπορεύθησαν ἐν ἀνύδροις ποταµοί.						
Psalms	104	104	42	OT	1. OT	Poetic Books	3. Poetic Books	03. Poetic Books	01. Psalms	(24) ϫⲉ ⲁϥⲉⲣⲫⲙⲉⲩⲓ ⲙ̀ⲡⲉϥⲥⲁϫⲓ ⲉⲑⲟⲩⲁⲃ: ⲫⲏ ⲉⲧⲁϥⲥⲉⲙⲛⲏⲧϥ ⲛⲉⲙ ⲁⲃⲣⲁⲁⲙ ⲡⲉϥⲃⲱⲕ.	ϫⲉ ⲁϥⲣ̅ⲙⲉⲉⲩⲉ ⲙ̅ⲡⲉϥϣⲁϫⲉ ⲉⲧⲟⲩⲁⲁⲃ ⲉⲛ̅ⲧⲁϥⲥⲙⲛ̅ⲧϥ̅ ⲙⲛ̅ ⲁⲃⲣⲁϩⲁⲙ ⲡⲉϥϩⲙ̅ϩⲁⲗ.	For he remembered his holy word, which he promised to Abraam his servant.	ὅτι ἐµνήσθη τοῦ λόγου τοῦ ἁγίου αὐτοῦ τοῦ πρὸς Αβρααµ τὸν δοῦλον αὐτοῦ						
Psalms	104	104	43	OT	1. OT	Poetic Books	3. Poetic Books	03. Poetic Books	01. Psalms	(25) ⲟⲩⲟϩ ⲁϥⲓⲛⲓ ⲙ̀ⲡⲉϥⲗⲁⲟⲥ ⲉ̀ⲃⲟⲗ ϧⲉⲛ ⲟⲩⲑⲉⲗⲏⲗ: ⲛⲉⲙ ⲛⲉϥⲥⲱⲧⲡ ϧⲉⲛ ⲟⲩⲟⲩⲛⲟϥ.	ⲁϥⲛ̅ ⲡⲉϥⲗⲁⲟⲥ ⲉⲃⲟⲗ ϩⲛ̅ ⲟⲩⲧⲉⲗⲏⲗ. ⲁⲩⲱ ⲛⲉϥⲥⲱⲧⲡ̅ ϩⲛ̅ ⲟⲩⲟⲩⲛⲟϥ.	And he brought out his people with exultation, and his chosen with joy;	καὶ ἐξήγαγεν τὸν λαὸν αὐτοῦ ἐν ἀγαλλιάσει καὶ τοὺς ἐκλεκτοὺς αὐτοῦ ἐν εὐφροσύνῃ.						
Psalms	104	104	44	OT	1. OT	Poetic Books	3. Poetic Books	03. Poetic Books	01. Psalms	(26) ⲟⲩⲟϩ ⲁϥϯ ⲛⲱⲟⲩ ⲛ̀ⲛⲓⲭⲱⲣⲁ ⲛ̀ⲧⲉ ϩⲁⲛⲉⲑⲛⲟⲥ: ⲟⲩⲟϩ ϩⲁⲛϧⲓⲥⲓ ⲛ̀ⲧⲉ ϩⲁⲛⲗⲁⲟⲥ ⲁⲩⲉⲣⲕⲗⲏⲣⲟⲛⲟⲙⲓⲛ ⲙ̀ⲙⲱⲟⲩ:	ⲁϥϯ ⲛⲁⲩ ⲛ̅ⲛⲉⲩⲭⲱⲣⲁ ⲛ̅ⲛ̅ϩⲉⲑⲛⲟⲥ. ⲁⲩⲕⲗⲏⲣⲟⲛⲟⲙⲉⲓ ⲛ̅ⲛ̅ϩⲓⲥⲉ ⲛ̅ⲛ̅ⲗⲁⲟⲥ.	and gave them the lands of the heathen; and they inherited the labours of the people;	καὶ ἔδωκεν αὐτοῖς χώρας ἐθνῶν, καὶ πόνους λαῶν ἐκληρονόµησαν,						
Psalms	104	104	45	OT	1. OT	Poetic Books	3. Poetic Books	03. Poetic Books	01. Psalms	(26) ϩⲟⲡⲱⲥ ⲛ̀ⲧⲟⲩⲁⲣⲉϩ ⲉ̀ⲛⲉϥⲙⲉⲑⲙⲏⲓ: ⲟⲩⲟϩ ⲛ̀ⲧⲟⲩⲕⲱϯ ⲛ̀ⲥⲁ ⲡⲉϥⲛⲟⲙⲟⲥ	ϫⲉⲕⲁⲥ ⲉⲩⲉϩⲁⲣⲉϩ ⲉⲛⲉϥⲇⲓⲕⲁⲓⲱⲙⲁ ⲁⲩⲱ ⲛ̅ⲥⲉϣⲓⲛⲉ ⲛ̅ⲥⲁ ⲡⲉϥⲛⲟⲙⲟⲥ	that they might keep his ordinances, and diligently seek his law.	ὅπως ἂν φυλάξωσιν τὰ δικαιώµατα αὐτοῦ καὶ τὸν νόµον αὐτοῦ ἐκζητήσωσιν.						
Psalms	105	105		OT	1. OT	Poetic Books	3. Poetic Books	03. Poetic Books	01. Psalms	ⲡⲓⲯⲁⲗⲙⲟⲥ ⲣ̅ⲉ̅. ⲁⲗⲗⲏⲗⲟⲩⲓⲁ.	ⲣ̅ⲉ̅. ⲁⲗⲗⲏⲗⲟⲩⲓⲁ	Alleluia.	Αλληλουια.						
Psalms	105	105	1	OT	1. OT	Poetic Books	3. Poetic Books	03. Poetic Books	01. Psalms	ⲟⲩⲱⲛϩ ⲉ̀ⲃⲟⲗ ⲙ̀ⲡϭ̅ⲥ̅ ϫⲉ ⲟⲩⲭⲣ̅ⲥ̅ ⲡⲉ ϫⲉ ⲡⲉϥⲛⲁⲓ ϣⲟⲡ ϣⲁ ⲉⲛⲉϩ:	ⲟⲩⲱⲛϩ̅ ⲉⲃⲟⲗ ⲙ̅ⲡϫⲟⲉⲓⲥ ϫⲉ ⲟⲩⲭ̅ⲥ̅ ⲡⲉ ⲁⲩⲱ ⲡⲉϥⲛⲁ ϣⲟⲟⲡ ϣⲁ ⲉⲛⲉϩ.	Give thanks to the Lord; for he is good: for his mercy endures for ever.	Ἐξοµολογεῖσθε τῷ κυρίῳ, ὅτι χρηστός, ὅτι εἰς τὸν αἰῶνα τὸ ἔλεος αὐτοῦ.						
Psalms	105	105	2	OT	1. OT	Poetic Books	3. Poetic Books	03. Poetic Books	01. Psalms	(1) ⲛⲓⲙ ⲉⲑⲛⲁϣⲥⲁϫⲓ ⲛ̀ⲛⲓⲙⲉⲧϫⲱⲣⲓ ⲧⲏⲣⲟⲩ ⲛ̀ⲧⲉ ⲡϭ̅ⲥ̅: ⲉϥⲉ̀ⲑⲣⲟⲩⲥⲱⲧⲉⲙ ⲉⲥⲙⲟⲩ ⲛⲓⲃⲉⲛ ⲛ̀ⲧⲁϥ.	ⲛⲓⲙ ⲡⲉⲧⲛⲁϫⲱ ⲛ̅ⲛ̅ϭⲟⲙ ⲙ̅ⲡϫⲟⲉⲓⲥ ⲛϥ̅ⲧⲣⲉⲩⲥⲱⲧⲙ̅ ⲉⲛⲉϥⲥⲙⲟⲩ ⲧⲏⲣⲟⲩ.	Who shall tell the mighty acts of the Lord? who shall cause all his praises to be heard?	τίς λαλήσει τὰς δυναστείας τοῦ κυρίου, ἀκουστὰς ποιήσει πάσας τὰς αἰνέσεις αὐτοῦ;						
Psalms	105	105	3	OT	1. OT	Poetic Books	3. Poetic Books	03. Poetic Books	01. Psalms	(2) ⲱⲟⲩⲛⲓⲁⲧⲟⲩ ⲛ̀ⲛⲏ ⲉⲧⲁⲩⲁⲣⲉϩ ⲉ̀ⲡϩⲁⲡ: ⲟⲩⲟϩ ⲉⲧⲓⲣⲓ ⲛ̀ϯⲙⲉⲑⲙⲏⲓ ⲛ̀ⲥⲏⲟⲩ ⲛⲓⲃⲉⲛ.	ⲛⲁⲓⲁⲧⲟⲩ ⲛ̅ⲛⲉⲧϩⲁⲣⲉϩ ⲉⲫⲁⲡ ⲉⲧⲉⲓⲣⲉ ⲛ̅ⲧⲇⲓⲕⲁⲓⲟⲥⲩⲛⲏ ⲛ̅ⲟⲩⲟⲉⲓϣ ⲛⲓⲙ.	Blessed are they that keep judgment, and do righteousness at all times.	µακάριοι οἱ φυλάσσοντες κρίσιν καὶ ποιοῦντες δικαιοσύνην ἐν παντὶ καιρῷ.						
Psalms	105	105	4	OT	1. OT	Poetic Books	3. Poetic Books	03. Poetic Books	01. Psalms	(3) ⲁⲣⲓⲡⲉⲛⲙⲉⲩⲓ ⲡϭ̅ⲥ̅ ϧⲉⲛ ⲡϯⲙⲁϯ ⲛ̀ⲧⲉ ⲡⲉⲕⲗⲁⲟⲥ: ⲟⲩⲟϩ ϫⲉⲙⲡⲉⲛϣⲓⲛⲓ ϧⲉⲛ ⲡⲉⲕⲟⲩϫⲁⲓ.	ⲁⲣⲓⲡⲉⲛⲙⲉⲉⲩⲉ ⲡϫⲟⲉⲓⲥ ϩⲙ̅ ⲡⲟⲩⲱϣ ⲙ̅ⲡⲉⲕⲗⲁⲟⲥ. ⲛⲅ̅ϭⲙ̅ⲡⲉⲛϣⲓⲛⲉ ϩⲙ̅ ⲡⲉⲕⲟⲩϫⲁⲓ.	Remember us, O Lord, with the favour thou hast to thy people: visit us with thy salvation;	µνήσθητι ἡµῶν, κύριε, ἐν τῇ εὐδοκίᾳ τοῦ λαοῦ σου, ἐπίσκεψαι ἡµᾶς ἐν τῷ σωτηρίῳ σου						
Psalms	105	105	5	OT	1. OT	Poetic Books	3. Poetic Books	03. Poetic Books	01. Psalms	(4) ⲉ̀ⲡϫⲓⲛⲑⲣⲉⲛⲛⲁⲩ ϧⲉⲛ ϯⲙⲉⲧⲭⲣ̅ⲥ̅ ⲛ̀ⲧⲉ ⲛⲉⲕⲥⲱⲧⲡ: ⲉ̀ⲑⲣⲉⲛⲟⲩⲛⲟϥ ϧⲉⲛ ⲟⲩⲟⲩⲛⲟϥ ⲛ̀ⲧⲉ ⲡⲉⲕⲉⲑⲛⲟⲥ: ⲉ̀ⲑⲣⲉⲛϣⲟⲩϣⲟⲩ ⲙ̀ⲙⲟⲛ ⲛⲉⲙ ⲧⲉⲕⲕⲗⲏⲣⲟⲛⲟⲙⲓⲁ:	ⲉⲧⲣⲉⲛⲛⲁⲩ ϩⲛ̅ ⲧⲙⲛ̅ⲧⲭⲣ̅ⲥ̅ ⲛ̅ⲛⲉⲕⲥⲱⲧⲡ̅. ⲛ̅ⲧⲛ̅ⲉⲩⲫⲣⲁⲛⲉ ϩⲙ̅ ⲡⲟⲩⲛⲟϥ ⲙ̅ⲡⲉⲕϩⲉⲑⲛⲟⲥ. ⲉⲧⲣⲉⲛϫⲓⲧⲁⲉⲓⲟ ⲙⲛ̅ ⲧⲉⲕⲕⲗⲏⲣⲟⲛⲟⲙⲓⲁ.	that we may behold the good of thine elect, that we may rejoice in the gladness of thy nation, that we may glory with thine inheritance.	τοῦ ἰδεῖν ἐν τῇ χρηστότητι τῶν ἐκλεκτῶν σου, τοῦ εὐφρανθῆναι ἐν τῇ εὐφροσύνῃ τοῦ ἔθνους σου, τοῦ ἐπαινεῖσθαι µετὰ τῆς κληρονοµίας σου.						
Psalms	105	105	6	OT	1. OT	Poetic Books	3. Poetic Books	03. Poetic Books	01. Psalms	(4) ϫⲉ ⲁⲛⲉⲣⲛⲟⲃⲓ ⲛⲉⲙ ⲛⲉⲛⲓⲟϯ: ⲁⲛⲉⲣⲁⲛⲟⲙⲓⲛ ⲁⲛϭⲓⲛ̀ϫⲟⲛⲥ.	ϫⲉ ⲁⲛⲣ̅ⲛⲟⲃⲉ ⲙⲛ̅ ⲛⲉⲛⲉⲓⲟⲧⲉ. ⲁⲛⲁⲛⲟⲙⲉⲓⲁ ⲛ̅ϫⲓⲛ̅ϭⲟⲛⲥ̅.	We have sinned with our fathers, we have transgressed, we have done unrighteously.	ἡµάρτοµεν µετὰ τῶν πατέρων ἡµῶν, ἠνοµήσαµεν, ἠδικήσαµεν.						
Psalms	105	105	7	OT	1. OT	Poetic Books	3. Poetic Books	03. Poetic Books	01. Psalms	(5) ⲛⲉⲛⲓⲟϯ ⲉⲩⲭⲏ ϧⲉⲛ ⲭⲏⲙⲓ ⲙ̀ⲡⲟⲩⲕⲁϯ ⲉ̀ⲛⲉⲕϣⲫⲏⲣⲓ: ⲟⲩⲇⲉ ⲙ̀ⲡⲟⲩⲉⲣⲫⲙⲉⲩⲓ ⲙ̀ⲡⲁϣⲁⲓ ⲛ̀ⲧⲉ ⲡⲉⲕⲛⲁⲓ. (6) ⲁⲩϯϫⲱⲛⲧ ⲉⲩⲛⲏⲟⲩ ⲉ̀ϩⲣⲏⲓ ϧⲉⲛ ⲫⲓⲟⲙ ⲛ̀ϣⲁⲣⲓ:	ⲛⲉⲛⲉⲓⲟⲧⲉ ⲙ̅ⲡⲟⲩⲉⲓⲙⲉ ⲉⲛⲉⲕϣⲡⲏⲣⲉ ϩⲛ̅ ⲕⲏⲙⲉ. ⲙ̅ⲡⲟⲩⲣⲡⲙⲉⲉⲩⲉ ⲙ̅ⲡⲁϣⲁⲓ ⲙ̅ⲡⲉⲕⲛⲁ. ⲁⲩϯ ⲛ̅ⲟⲩϭⲥ̅ ⲉⲩⲛⲏⲩ ⲉϩⲣⲁⲓ ϩⲛ̅ ⲧⲉⲣⲩⲑⲣⲁ ⲑⲁⲗⲁⲥⲥⲁ.	Our fathers in Egypt understood not thy wonders, and remembered not the multitude of thy mercy; but provoked him as they went up by the Red Sea.	οἱ πατέρες ἡµῶν ἐν Αἰγύπτῳ οὐ συνῆκαν τὰ θαυµάσιά σου οὐκ ἐµνήσθησαν τοῦ πλήθους τοῦ ἐλέους σου καὶ παρεπίκραναν ἀναβαίνοντες ἐν τῇ ἐρυθρᾷ θαλάσσῃ.						
Psalms	105	105	8	OT	1. OT	Poetic Books	3. Poetic Books	03. Poetic Books	01. Psalms	(6) ⲟⲩⲟϩ ⲁϥⲛⲁϩⲙⲟⲩ ⲉⲑⲃⲉ ⲡⲉϥⲣⲁⲛ ⲉ̀ⲡϫⲓⲛ̀ⲧⲉϥⲟⲩⲱⲛϩ ⲛ̀ⲧⲉϥϫⲟⲙ ⲉ̀ⲃⲟⲗ.	ⲁⲩⲱ ⲁϥⲧⲟⲩϫⲟⲟⲩ ⲉⲧⲃⲉ ⲡⲉϥⲣⲁⲛ. ⲉⲟⲩⲱⲛϩ̅ ⲉⲃⲟⲗ ⲛ̅ⲧⲉϥϭⲟⲙ.	Yet he saved them for his name’s sake, that he might cause his mighty power to be known.	καὶ ἔσωσεν αὐτοὺς ἕνεκεν τοῦ ὀνόµατος αὐτοῦ τοῦ γνωρίσαι τὴν δυναστείαν αὐτοῦ·						
Psalms	105	105	9	OT	1. OT	Poetic Books	3. Poetic Books	03. Poetic Books	01. Psalms	(7) ⲁϥⲉⲣⲉⲡⲓⲧⲓⲙⲁⲛ ⲙ̀ⲫⲓⲟⲙ ⲛ̀ϣⲁⲣⲓ ⲟⲩⲟϩ ⲁϥϣⲱⲟⲩⲓ: ⲟⲩⲟϩ ⲁϥϭⲓⲙⲱⲓⲧ ⲛⲱⲟⲩ ϧⲉⲛ ⲫⲛⲟⲩⲛ ⲙ̀ⲫⲣⲏϯ ϩⲓ ⲡϣⲁϥⲉ.	ⲁϥⲉⲡⲓⲧⲓⲙⲁ ⲛ̅ⲧⲉⲣⲩⲑⲣⲁ ⲑⲁⲗⲁⲥⲥⲁ ⲁⲥϣⲟⲟⲩⲉ. ⲁϥϫⲓⲙⲟⲉⲓⲧ ϩⲏⲧⲟⲩ ϩⲛ̅ ⲛ̅ⲛⲟⲩⲛ ⲛ̅ⲑⲉ ⲛ̅ⲟⲩϫⲁⲓⲉ.	And he rebuked the Red Sea, and it was dried up: so he led them through the deep as through the wilderness.	καὶ ἐπετίµησεν τῇ ἐρυθρᾷ θαλάσσῃ, καὶ ἐξηράνθη, καὶ ὡδήγησεν αὐτοὺς ἐν ἀβύσσῳ ὡς ἐν ἐρήµῳ·						
Psalms	105	105	10	OT	1. OT	Poetic Books	3. Poetic Books	03. Poetic Books	01. Psalms	(8) ⲟⲩⲟϩ ⲁϥⲛⲁϩⲙⲟⲩ ⲉ̀ⲃⲟⲗ ⲛ̀ⲧⲟⲧⲟⲩ ⲛ̀ⲛⲏ ⲉⲑⲙⲟⲥϯ ⲙ̀ⲙⲱⲟⲩ: ⲟⲩⲟϩ ⲁϥⲥⲟⲧⲟⲩ ⲉ̀ⲃⲟⲗ ϧⲉⲛ ⲧϫⲓϫ ⲛ̀ⲧⲉ ⲛⲟⲩϫⲁϫⲓ.	ⲁϥⲧⲟⲩϫⲟⲟⲩ ⲉⲧϭⲓϫ ⲛ̅ⲛⲉⲧⲙⲟⲥⲧⲉ. ⲁϥⲥⲟⲧⲟⲩ ⲉⲃⲟⲗ ϩⲛ̅ ⲧϭⲓϫ ⲙ̅ⲡϫⲁϫⲉ	And he saved them out of the hand of them that hated them, and redeemed them out of the hand of the enemy.	καὶ ἔσωσεν αὐτοὺς ἐκ χειρὸς µισούντων καὶ ἐλυτρώσατο αὐτοὺς ἐκ χειρὸς ἐχθροῦ·						
Psalms	105	105	11	OT	1. OT	Poetic Books	3. Poetic Books	03. Poetic Books	01. Psalms	(9) ⲟⲩⲟϩ ⲟⲩⲙⲱⲟⲩ ⲁϥϩⲱⲃⲥ ⲉ̀ϩⲣⲏⲓ ⲉ̀ϫⲉⲛ ⲛⲏ ⲉⲧϩⲟϫϩⲉϫ ⲙ̀ⲙⲱⲟⲩ: ⲟⲩⲁⲓ ⲉ̀ⲃⲟⲗ ⲛ̀ϧⲏⲧⲟⲩ ⲙ̀ⲡⲉϥⲥⲱϫⲡ.	ⲁ ⲡⲙⲟⲟⲩ ϩⲱⲃⲥ̅ ⲉϫⲛ̅ ⲛⲉⲧⲑⲗⲓⲃⲉ ⲙ̅ⲙⲟⲟⲩ. ⲙ̅ⲡⲉ ⲟⲩⲁ ϣⲱϫⲡ̅ ⲛ̅ϩⲏⲧⲟⲩ	The water covered those that oppressed them: there was not one of them left.	καὶ ἐκάλυψεν ὕδωρ τοὺς θλίβοντας αὐτούς, εἷς ἐξ αὐτῶν οὐχ ὑπελείφθη.						
Psalms	105	105	12	OT	1. OT	Poetic Books	3. Poetic Books	03. Poetic Books	01. Psalms	(10) ⲟⲩⲟϩ ⲁⲩⲛⲁϩϯ ϧⲉⲛ ⲡⲉϥⲥⲁϫⲓ: ⲟⲩⲟϩ ⲁⲩϩⲱⲥ ϧⲉⲛ ⲡⲉϥⲥⲙⲟⲩ:	ⲁⲩⲡⲓⲥⲧⲉⲩⲉ ϩⲛ̅ ⲛⲉϥϣⲁϫⲉ ⲁⲩⲥⲙⲟⲩ ϩⲛ̅ ⲡⲉϥⲥⲙⲟⲩ.	Then they believed his words, and celebrated his praise.	καὶ ἐπίστευσαν ἐν τοῖς λόγοις αὐτοῦ καὶ ᾖσαν τὴν αἴνεσιν αὐτοῦ.						
Psalms	105	105	13	OT	1. OT	Poetic Books	3. Poetic Books	03. Poetic Books	01. Psalms	(10) ⲟⲩⲟϩ ⲁⲩⲭⲱⲗⲉⲙ ⲁⲩⲉⲣⲡⲱⲃϣ ⲛ̀ⲛⲉϥϩⲃⲏⲟⲩⲓ: ⲟⲩⲟϩ ⲙ̀ⲡⲟⲩⲁⲙⲟⲛⲓ ⲛ̀ⲧⲟⲧⲟⲩ ϧⲉⲛ ⲡⲉϥⲥⲟϭⲛⲓ:	ⲁⲩϭⲉⲡⲏ ⲉⲣ̅ⲡⲱⲃϣ̅ ⲛ̅ⲛⲉϥϩⲃⲏⲩⲉ ⲙ̅ⲡⲟⲩϩⲩⲡⲟⲙⲉⲓⲛⲉ ϩⲙ̅ ⲡⲉϥϣⲟϫⲛⲉ.	They made haste, they forgot his works; they waited not for his counsel.	ἐτάχυναν ἐπελάθοντο τῶν ἔργων αὐτοῦ, οὐχ ὑπέµειναν τὴν βουλὴν αὐτοῦ·						
Psalms	105	105	14	OT	1. OT	Poetic Books	3. Poetic Books	03. Poetic Books	01. Psalms	(10) ⲁⲩⲉⲣⲉⲡⲓⲑⲩⲙⲓⲛ ⲉ̀ⲟⲩⲉⲡⲓⲑⲩⲙⲓⲁ ϩⲓ ⲡϣⲁϥⲉ: ⲟⲩⲟϩ ⲁⲩⲉⲣⲡⲓⲣⲁⲍⲓⲛ ⲙ̀ⲫϯ ϧⲉⲛ ⲟⲩⲙⲁ ⲛ̀ⲁⲑⲙⲱⲟⲩ.	ⲁⲩⲉⲡⲓⲑⲩⲙⲉⲓ ⲉⲩⲉⲡⲓⲑⲩⲙⲓⲁ ϩⲓ ⲡϫⲁⲓⲉ. ⲁⲩⲡⲉⲓⲣⲁⲍⲉ ⲙ̅ⲡⲛⲟⲩⲧⲉ ϩⲛ̅ ⲟⲩⲙⲁ ⲉⲙⲛ̅ⲙⲟⲟⲩ ⲛ̅ϩⲏⲧϥ̅.	And they lusted exceedingly in the wilderness, and tempted God in the dry land.	καὶ ἐπεθύµησαν ἐπιθυµίαν ἐν τῇ ἐρήµῳ καὶ ἐπείρασαν τὸν θεὸν ἐν ἀνύδρῳ.						
Psalms	105	105	15	OT	1. OT	Poetic Books	3. Poetic Books	03. Poetic Books	01. Psalms	(11) ⲟⲩⲟϩ ⲁϥϯ ⲛⲱⲟⲩ ⲙ̀ⲫⲏ ⲉⲧⲁⲩⲉⲣⲉⲧⲓⲛ ⲙ̀ⲙⲟϥ: ⲁϥⲧⲁⲟⲩⲟ ⲛ̀ⲟⲩⲥⲓ ⲉ̀ϫⲉⲛ ⲛⲟⲩⲯⲩⲭⲏ	ⲁϥϯ ⲛⲁⲩ ⲙ̅ⲡⲉⲧⲟⲩⲟⲩⲁϣϥ̅. ⲁϥϫⲟⲟⲩ ⲛ̅ⲟⲩⲥⲉⲓ ⲛ̅ⲛⲉⲩⲯⲩⲭⲏ.	And he gave them their request, and sent fullness into their souls.	καὶ ἔδωκεν αὐτοῖς τὸ αἴτηµα αὐτῶν καὶ ἐξαπέστειλεν πλησµονὴν εἰς τὰς ψυχὰς αὐτῶν.						
Psalms	105	105	16	OT	1. OT	Poetic Books	3. Poetic Books	03. Poetic Books	01. Psalms	(12) ⲁⲩⲑⲣⲉ ⲙⲱⲩ̀ⲥⲏⲥ ϫⲱⲛⲧ ϧⲉⲛ ϯⲡⲁⲣⲉⲙⲃⲟⲗⲏ ⲛⲉⲙ ⲁⲁⲣⲱⲛ ⲡⲉⲑⲟⲩⲁⲃ ⲛ̀ⲧⲉ ⲡϭ̅ⲥ̅.	ⲁϥϯ ⲛⲟⲩϭⲥ̅ ⲙ̅ⲙⲱⲩ̈ⲥⲏⲥ ϩⲛ̅ ⲧⲡⲁⲣⲉⲙⲃⲟⲗⲏ. ⲙⲛ̅ ⲁⲁⲣⲱⲛ ⲡⲉⲧⲟⲩⲁⲁⲃ ⲙ̅ⲡϫⲟⲉⲓⲥ.	They provoked Moses also in the camp, and Aaron the holy one of the Lord.	καὶ παρώργισαν Μωυσῆν ἐν τῇ παρεµβολῇ καὶ Ααρων τὸν ἅγιον κυρίου·						
Psalms	105	105	17	OT	1. OT	Poetic Books	3. Poetic Books	03. Poetic Books	01. Psalms	(13) ⲡⲕⲁϩⲓ ⲁϥⲟⲩⲱⲛ ⲛ̀ⲣⲱϥ ⲁϥⲱⲙⲕ ⲛ̀ⲇⲁⲑⲁⲛ: ⲟⲩⲟϩ ⲁϥϩⲱⲃⲥ ⲉ̀ϫⲉⲛ ⲧⲥⲩⲛⲁⲅⲱⲅⲏ ⲛ̀ⲁⲃⲓⲣⲱⲛ:	ⲁ ⲡⲕⲁϩ ⲟⲩⲱⲛ ⲁϥⲱⲙⲕ̅ ⲛ̅ⲇⲁⲑⲁⲛ. ⲁϥϩⲱⲃⲥ ⲛ̅ⲧⲥⲩⲛⲁⲅⲱⲅⲏ ⲛ̅ⲁⲃⲓⲣⲱⲛ.	The earth opened and swallowed up Dathan, and closed upon the congregation of Abiron.	ἠνοίχθη ἡ γῆ καὶ κατέπιεν Δαθαν καὶ ἐκάλυψεν ἐπὶ τὴν συναγωγὴν Αβιρων·						
