book	chapter	chapter-zfilled	verse	testament	testament-indexed	section	section-indexed	section-indexed-no-testament	book-indexed	Bohairic	Sahidic	English	Greek	Fayyumic	Akhmimic	OldBohairic	Mesokemic	DialectP	Lycopolitan
Job	3	03	25	OT	1. OT	Poetic Books	3. Poetic Books	03. Poetic Books	02. Job	ϯϩⲟϯ ⲅⲁⲣ ⲉ̀ⲛⲁⲓϥⲓ ⲙ̀ⲡⲉⲥⲣⲱⲟⲩϣ ⲁⲥⲓ ⲛⲏⲓ ⲟⲩⲟϩ ⲑⲏ ⲉ̀ⲛⲁⲓⲉⲣϩⲟϯ ϧⲁⲧⲉⲥϩⲏ ⲁⲥⲓ̀ ⲉ̀ϧⲟⲩⲛ ⲉ̀ϩⲣⲁⲓ	ⲑⲟⲧⲉ ⲅⲁⲣ ⲉⲛⲉⲓϥⲉⲓ ⲙ̅ⲡⲉⲥⲣⲟⲟⲩϣ ⲁⲥⲓ ⲛⲁⲓ. ⲁⲩⲱ ⲡⲉϯⲣ̅ϩⲟⲧⲉ ϩⲏⲧϥ̅ ⲁϥⲧⲱⲙⲛ̅ⲧ ⲉⲣⲟⲓ.	For the terror of which I meditated has come upon me, and that which I had feared has befallen me.	φόβος γάρ, ὃν ἐφρόντισα, ἦλθέν µοι, καὶ ὃν ἐδεδοίκειν, συνήντησέν µοι.						
Job	3	03	26	OT	1. OT	Poetic Books	3. Poetic Books	03. Poetic Books	02. Job	ⲟⲩⲇⲉ ⲙ̀ⲡⲓⲉⲣϩⲓⲣⲏⲛⲏ ⲟⲩⲇⲉ ⲙ̀ⲡⲓⲉⲣⲏⲥⲩⲭⲁⲍⲓⲛ ⲟⲩⲇⲉ ⲙ̀ⲡⲓⲙⲧⲟⲛ ⲙ̀ⲙⲟⲓ ⲁϥⲓ̀ ⲛⲏⲓ ⲛ̀ϫⲉ ⲟⲩϫⲱⲛⲧ	ⲙ̅ⲡⲓⲣⲉⲓⲣⲏⲛⲏ ⲙ̅ⲡⲉⲓⲕⲁⲣⲱⲓ ⲙ̅ⲡⲉⲓⲙ̅ⲧⲟⲛ. ⲁⲩⲟⲣⲅⲏ ⲇⲉ ⲉⲓ ⲛⲁⲓ.	I was not at peace, nor quiet, nor had I rest; yet wrath came upon me.	οὔτε εἰρήνευσα οὔτε ἡσύχασα οὔτε ἀνεπαυσάµην, ἦλθεν δέ µοι ὀργή.						
Job	4	04	1	OT	1. OT	Poetic Books	3. Poetic Books	03. Poetic Books	02. Job	ⲁϥⲉⲣⲟⲩⲱ ⲛ̀ϫⲉ ⲉⲗⲓⲥⲁⲫ ⲡⲓⲑⲉⲙⲁⲛⲓⲧⲏⲥ ⲡⲉϫⲁϥ	ⲁϥⲟⲩⲱϣⲃ̅ ⲇⲉ ⲛ̅ϭⲓ ⲉⲗⲓⲫⲁⲥ ⲡⲉⲑⲁⲓⲙⲁⲛⲓⲧⲏⲥ ⲡⲉϫⲁϥ.	Then Eliphaz the Thaemanite answered and said,	Ὑπολαβὼν δὲ Ελιφας ὁ Θαιµανίτης λέγει						
Job	4	04	2	OT	1. OT	Poetic Books	3. Poetic Books	03. Poetic Books	02. Job	ϫⲉ ⲙⲏⲧⲓ ⲁⲩⲥⲁϫⲓ ⲛⲉⲙⲁⲕ ϧⲉⲛ ⲟⲩϧⲓⲥⲓ ⲛ̀ⲟⲩⲙⲏϣ ⲛ̀ⲥⲟⲡ ϯϫⲟⲙ ⲇⲉ ⲛ̀ⲧⲉ ⲛⲉⲕⲥⲁϫⲓ ⲛⲓⲙ ⲉⲧⲛⲁϣ̀ϥⲓⲧⲥ	ϫⲉ ⲙⲉ ⲁⲩϣⲁϫⲉ ⲛⲙ̅ⲙⲁⲕ ⲛ̅ϩⲁϩ ⲛ̅ⲥⲟⲡ ϩⲛ̅ ⲟⲩϩⲓⲥⲉ. ⲛⲓⲙ ⲇⲉ ⲡⲉⲧⲛⲁϣϥⲉⲓ ϩⲁ ⲧϭⲟⲙ ⲛ̅ⲛⲉⲕϣⲁϫⲉ.	Hast thou been often spoken to in distress? but who shall endure the force of thy words?	Μὴ πολλάκις σοι λελάληται ἐν κόπῳ; ἰσχὺν δὲ ῥηµάτων σου τίς ὑποίσει;						
Job	4	04	3	OT	1. OT	Poetic Books	3. Poetic Books	03. Poetic Books	02. Job	ⲓⲥϫⲉ ⲅⲁⲣ ⲛ̀ⲑⲟⲕ ⲁⲕϯⲥⲃⲱ ⲛ̀ⲟⲩⲙⲏϣ ⲟⲩⲟϩ ϩⲁⲛϫⲓϫ ⲛ̀ⲧⲉ ϩⲁⲛⲁⲧϫⲟⲙ	ⲉϣϫⲉ ⲛ̅ⲧⲟⲕ ⲁⲕϯⲥⲃⲱ ⲛ̅ⲟⲩⲙⲏⲏϣⲉ. ⲁⲩⲱ ⲁⲕⲥⲉⲡⲥ̅ ⲛ̅ϭⲓϫ ⲛ̅ⲛ̅ϭⲱⲃ.	For whereas thou hast instructed many, and hast strengthened the hands of the weak one,	εἰ γὰρ σὺ ἐνουθέτησας πολλοὺς καὶ χεῖρας ἀσθενοῦς παρεκάλεσας						
Job	4	04	4	OT	1. OT	Poetic Books	3. Poetic Books	03. Poetic Books	02. Job	ⲁⲕϯⲛⲟⲙϯ ⲛⲱⲟⲩ ϩⲁⲛⲟⲩⲟⲛ ⲇⲉ ⲉⲩϣⲱⲛⲓ ⲁⲕⲧⲁϩⲱⲟⲩ ⲉ̀ⲣⲁⲧⲟⲩ ϧⲉⲛ ϩⲁⲛⲥⲁϫⲓ ϩⲁⲛⲕⲉⲗⲓ ⲇⲉ ⲉⲩⲟⲓ ⲛ̀ⲁⲧϫⲟⲙ ⲁⲕϯⲛⲟⲙϯ ⲛⲱⲟⲩ	ⲁⲕⲧⲟⲩⲛⲉⲥ ⲛⲉⲧϣⲱⲛⲉ ϩⲛ̅ ⲛⲉⲕϣⲁϫⲉ. ⲁⲕϯⲧⲱⲕ ⲛ̅ⲙ̅ⲡⲁⲧ ⲛ̅ⲛ̅ϭⲱⲃ.	and hast supported the failing with words, and hast imparted courage to feeble knees.	ἀσθενοῦντάς τε ἐξανέστησας ῥήµασιν γόνασίν τε ἀδυνατοῦσιν θάρσος περιέθηκας,						
Job	4	04	5	OT	1. OT	Poetic Books	3. Poetic Books	03. Poetic Books	02. Job	ϯⲛⲟⲩ ⲇⲉ ⲁϥⲓ̀ ⲉ̀ϫⲱⲕ ⲛ̀ϫⲉ ⲟⲩⲉⲙⲕⲁϩ ⲟⲩⲟϩ ⲁϥϭⲟϩ ⲉ̀ⲣⲟⲕ ⲛ̀ⲑⲟⲕ ⲇⲉ ⲁⲕⲓⲏⲥ	ⲧⲉⲛⲟⲩ ⲇⲉ ⲁ ⲡϩⲓⲥⲉ ⲉⲓ ⲉϩⲣⲁⲓ ⲉϫⲱⲕ ⲁϥϫⲱϩ ⲉⲣⲟⲕ ⲛ̅ⲧⲟⲕ ⲇⲉ ⲁⲕϣⲧⲟⲣⲧⲣ̅.	Yet now that pain has come upon thee, and touched thee, thou art troubled.	νῦν δὲ ἥκει ἐπὶ σὲ πόνος καὶ ἥψατό σου, σὺ δὲ ἐσπούδασας.						
Job	4	04	6	OT	1. OT	Poetic Books	3. Poetic Books	03. Poetic Books	02. Job	ⲙⲏ ⲁⲣⲉ ⲧⲉⲕϩⲟϯ ⲁⲛ ϫⲉ ϣⲟⲡ ϧⲉⲛ ⲟⲩⲙⲉⲧⲁⲧϩⲏⲧ ⲛⲉⲙ ⲧⲉⲕϩⲉⲗⲡⲓⲥ ϧⲉⲛ ϯⲕⲁⲕⲓⲁ ⲛ̀ⲧⲉ ⲡⲉⲕⲙⲱⲓⲧ	ⲉⲓⲉ ⲉⲣⲉ ⲧⲉⲕϩⲟⲧⲉ ϣⲟⲟⲡ ⲁⲛ ϩⲛ̅ ⲟⲩⲙⲛ̅ⲧⲁⲑⲏⲧ. ⲁⲩⲱ ⲧⲉⲕϩⲉⲗⲡⲓⲥ ⲙⲛ̅ ⲧⲕⲁⲕⲓⲁ ⲛ̅ⲧⲉⲕϩⲓⲏ.	Is not thy fear founded in folly, thy hope also, and the mischief of thy way?	πότερον οὐχ ὁ φόβος σού ἐστιν ἐν ἀφροσύνῃ καὶ ἡ ἐλπίς σου καὶ ἡ ἀκακία τῆς ὁδοῦ σου;						
Job	4	04	7	OT	1. OT	Poetic Books	3. Poetic Books	03. Poetic Books	02. Job	ⲁⲣⲓⲫⲙⲉⲩⲓ ϫⲉ ⲛⲓⲙ ⲁϥⲧⲁⲕⲟ ⲉϥⲟⲩⲁⲃ ⲓⲉ ⲉⲧⲁ ϩⲁⲛⲑⲙⲏⲓ ⲧⲁⲕⲟ ⲛ̀ⲑⲛⲁⲩ ⲛⲉⲙ ⲧⲟⲩⲛⲟⲩⲛⲓ ⲧⲏⲣⲥ	ⲁⲣⲓⲡⲙⲉⲉⲩⲉ ϫⲉ ⲛⲓⲙ ⲡⲉⲛⲧⲁϥϩⲉ ⲉⲃⲟⲗ ⲉϥⲟⲩⲁⲁⲃ. ⲏ ⲛⲓⲙ ⲛ̅ⲣⲙ̅ⲙ̅ⲙⲉ ⲡⲉⲛⲧⲁϥⲡⲱⲣⲕ̅ ⲁϥⲧⲁⲕⲟ.	Remember then who has perished, being pure? or when were the true-hearted utterly destroyed?	µνήσθητι οὖν τίς καθαρὸς ὢν ἀπώλετο ἢ πότε ἀληθινοὶ ὁλόρριζοι ἀπώλοντο.						
Job	4	04	8	OT	1. OT	Poetic Books	3. Poetic Books	03. Poetic Books	02. Job	ⲕⲁⲧⲁ ⲫⲣⲏϯ ⲉⲧⲁⲛⲛⲁⲩ ⲛ̀ⲛⲏ ⲉⲧⲥⲭⲁⲓ ⲛ̀ⲛⲓⲁⲧⲟⲡⲟⲛ ⲛⲏ ⲉⲧⲥⲓϯ ⲙ̀ⲙⲱⲟⲩ ⲉⲩⲉ̀ⲱⲥϧ ⲛⲱⲟⲩ ⲛ̀ϩⲁⲛⲙⲕⲁϩ ⲛ̀ϩⲏⲧ	ⲕⲁⲧⲁ ⲑⲉ ⲛ̅ⲧⲁⲓⲛⲁⲩ ⲉⲛⲉⲧⲥⲕⲁⲓ ⲛ̅ⲛⲉⲧⲉⲙⲉϣϣⲉ. ⲛⲉⲧϫⲟ ⲇⲉ ⲙ̅ⲙⲟⲟⲩ ⲉⲩⲛⲁⲱϩⲥ̅ ⲛⲁⲩ ⲛ̅ϩⲉⲛϩⲓⲥⲉ.	Accordingly as I have seen men ploughing barren places, and they that sow them will reap sorrows for themselves.	καθ’ ὃν τρόπον εἶδον τοὺς ἀροτριῶντας τὰ ἄτοπα, οἱ δὲ σπείροντες αὐτὰ ὀδύνας θεριοῦσιν ἑαυτοῖς.						
Job	4	04	9	OT	1. OT	Poetic Books	3. Poetic Books	03. Poetic Books	02. Job	ⲉ̀ⲃⲟⲗ ϧⲉⲛ ⲡⲓⲟⲩⲁϩⲥⲁϩⲛⲓ ⲛ̀ⲧⲉ ⲡϭ̅ⲥ̅ ⲉⲩⲉ̀ⲧⲁⲕⲟ ⲉ̀ⲃⲟⲗ ⲇⲉ ϧⲉⲛ ⲡⲓⲡⲛ̅ⲁ̅ ⲛ̀ⲧⲉ ⲡⲉϥⲙⲃⲟⲛ ⲉⲩⲉ̀ⲃⲟⲗⲟⲩ ⲉ̀ⲃⲟⲗ	ⲥⲉⲛⲁϩⲉ ⲇⲉ ⲉⲃⲟⲗ ϩⲓⲧⲙ̅ ⲡⲉⲡⲣⲟⲥⲇⲁⲅⲙⲁ ⲙ̅ⲡϫⲟⲉⲓⲥ. ⲁⲩⲱ ⲥⲉⲛⲁⲧⲁⲕⲟ ϩⲓⲧⲙ̅ ⲡⲉⲡⲛ̅ⲁ̅ ⲛ̅ⲧⲟⲣⲅⲏ.	They shall perish by the command of the Lord, and shall be utterly consumed by the breath of his wrath.	ἀπὸ προστάγµατος κυρίου ἀπολοῦνται, ἀπὸ δὲ πνεύµατος ὀργῆς αὐτοῦ ἀφανισθήσονται.						
Job	4	04	10	OT	1. OT	Poetic Books	3. Poetic Books	03. Poetic Books	02. Job	ϯϫⲟⲙ ⲛ̀ⲧⲉ ⲡⲓⲙⲟⲩⲓ ϯⲥⲙⲏ ⲛ̀ⲧⲉ ϯⲙⲓⲏ ⲡϣⲟⲩϣⲟⲩ ⲛ̀ⲧⲉ ⲡⲓⲇⲣⲁⲕⲱⲛ ⲁϥϭⲉⲛⲟ	ⲧϭⲟⲙ ⲛ̅ⲟⲩⲙⲟⲩⲓ. ⲧⲉⲥⲙⲏ ⲇⲉ ⲛ̅ⲟⲩⲗⲁⲃⲁⲓ. ⲡϣⲟⲩϣⲟⲩ ⲇⲉ ⲛ̅ⲛⲉⲇⲣⲁⲕⲱⲛ ⲁϥⲱϣⲙ̅.	The strength of the lion, and the voice of the lioness, and the exulting cry of serpents are quenched.	σθένος λέοντος, φωνὴ δὲ λεαίνης, γαυρίαµα δὲ δρακόντων ἐσβέσθη·						
Job	4	04	11	OT	1. OT	Poetic Books	3. Poetic Books	03. Poetic Books	02. Job	ⲡⲓⲙⲩⲣⲙⲏⲅⲟⲗⲉⲟⲛ ⲁϥⲧⲁⲕⲟ ϫⲉ ⲙ̀ⲙⲟⲛⲧⲉϥ ϧⲣⲉ ⲙ̀ⲙⲁⲩ ⲛⲓⲙⲁⲥ ⲛ̀ⲧⲉ ⲛⲓⲙⲟⲩⲓ ⲁⲩⲙⲟⲩⲛⲕ ⲛ̀ⲛⲟⲩⲉⲣⲏⲟⲩ	ⲁ ⲡⲙⲩⲣⲙⲏⲕⲟⲗⲏⲱⲛ ⲧⲁⲕⲟ ϫⲉ ⲙⲛ̅ⲧⲉϥ ϩⲣⲏ ⲙ̅ⲙⲁⲩ. ⲁ ⲙ̅ⲙⲁⲥ ⲇⲉ ⲙ̅ⲙⲟⲩⲉⲓ ⲱϫⲛ̅ ⲛ̅ⲛⲉⲩⲉⲣⲏⲩ.	The old lion has perished for want of food, and the lions’ whelps have forsaken one another.	µυρµηκολέων ὤλετο παρὰ τὸ µὴ ἔχειν βοράν, σκύµνοι δὲ λεόντων ἔλιπον ἀλλήλους.						
Job	4	04	12	OT	1. OT	Poetic Books	3. Poetic Books	03. Poetic Books	02. Job	ⲉⲛⲉ ϩⲗⲓ ⲅⲁⲣ ⲙ̀ⲙⲉⲑⲙⲏⲓ ϣⲱⲡⲓ ϧⲉⲛ ⲛⲉⲕⲥⲁϫⲓ ⲛⲉ ⲙ̀ⲙⲟⲛ ϩⲗⲓ ϧⲉⲛ ⲛⲁⲓⲡⲉⲧϩⲱⲟⲩ ⲛⲁϣⲱⲡⲓ ⲙ̀ⲙⲟⲛ ⲙⲏ ⲡⲁⲙⲁϣϫ ⲛⲁⲥⲱⲧⲉⲙ ⲁⲛ ⲉ̀ϩⲁⲛϣⲫⲏⲣⲓ ⲉ̀ⲃⲟⲗ ϩⲓⲧⲟⲧϥ	ⲉⲛⲉ ⲛ̅ⲧⲁ ϣⲁϫⲉ ⲇⲉ ⲙ̅ⲙⲉ ϣⲱⲡⲉ ϩⲛ̅ ⲛⲉⲕϣⲁϫⲉ. ⲛⲉ ⲙⲛ̅ⲗⲁⲁⲩ ⲛ̅ⲛⲉⲓⲡⲉⲑⲟⲟⲩ ⲛⲁⲧⲱⲙⲛ̅ⲧ ⲉⲣⲟⲕ. ⲙⲏ ⲡⲁⲙⲁⲁϫⲉ ⲛⲁⲥⲱⲧⲙ̅ ⲁⲛ ⲉϩⲉⲛϣⲡⲏⲣⲉ ⲉⲃⲟⲗ ϩⲓⲧⲟⲟⲧϥ̅.	But if there had been any truth in thy words, none of these evils would have befallen thee. Shall not mine ear receive excellent revelations from him?	εἰ δέ τι ῥῆµα ἀληθινὸν ἐγεγόνει ἐν λόγοις σου, οὐθὲν ἄν σοι τούτων κακὸν ἀπήντησεν. πότερον οὐ δέξεταί µου τὸ οὖς ἐξαίσια παρ’ αὐτοῦ;						
Job	4	04	13	OT	1. OT	Poetic Books	3. Poetic Books	03. Poetic Books	02. Job	ⲟⲩϩⲟϯ ⲇⲉ ⲛⲉⲙ ⲟⲩⲥⲙⲏ ⲛ̀ⲧⲉ ⲡⲓⲉϫⲱⲣϩ ⲉⲥⲛⲏⲟⲩ ⲛ̀ϫⲉ ⲟⲩϩⲟϯ ⲉ̀ϫⲉⲛ ⲛⲓⲣⲱⲙⲓ	ⲉⲟⲩϩⲟⲧⲉ ⲙⲛ̅ ⲟⲩϩⲣⲟⲟⲩ ⲛ̅ϭⲱⲣϩ̅. ⲉⲣⲉ ⲑⲟⲧⲉ ϩⲏⲩ ⲉϫⲛ̅ ⲛ̅ⲣⲱⲙⲉ.	But as when terror falls upon men, with dread and a sound in the night,	φόβοι δὲ καὶ ἠχὼ νυκτερινή, ἐπιπίπτων φόβος ἐπ’ ἀνθρώπους,						
Job	4	04	14	OT	1. OT	Poetic Books	3. Poetic Books	03. Poetic Books	02. Job	ⲟⲩⲛϩⲟⲩⲣ ⲇⲉ ⲛⲉⲙ ⲟⲩⲥⲑⲉⲣⲧⲉⲣ ⲁⲩⲓ ⲉ̀ϩⲣⲏⲓ ⲉ̀ϫⲱⲓ ⲟⲩⲟϩ ⲁϥⲕⲓⲙ ⲉ̀ⲡⲁⲕⲁⲥ ⲉ̀ⲙⲁϣⲱ	ⲁⲩⲛⲉϩϣⲗϥ̅ ⲇⲉ ⲧⲱⲙⲛ̅ⲧ ⲉⲣⲟⲓ ⲙⲛ̅ ⲟⲩⲥⲧⲱⲧ. ⲁⲩⲱ ⲁϥⲛⲟⲉⲓⲛ ⲛ̅ⲛⲁⲕⲉⲉⲥ ⲉⲙⲁⲧⲉ.	horror and trembling seized me, and caused all my bones greatly to shake.	φρίκη δέ µοι συνήντησεν καὶ τρόµος καὶ µεγάλως µου τὰ ὀστᾶ συνέσεισεν,						
Job	4	04	15	OT	1. OT	Poetic Books	3. Poetic Books	03. Poetic Books	02. Job	ⲟⲩⲡⲛ̅ⲁ̅ ⲁϥⲓ̀ ⲉ̀ϩⲣⲏⲓ ⲉ̀ϫⲉⲛ ⲡⲁϩⲟ ⲁⲩⲥⲑⲉⲣⲧⲉⲣ ⲇⲉ ⲛ̀ϫⲉ ⲛⲁϥⲱⲓ ⲛⲉⲙ ⲛⲁⲥⲁⲣⲝ	ⲁⲩⲡⲛ̅ⲁ̅ ⲉⲓ ⲁϩⲣⲁⲓ ϩⲓ ⲡⲁϩⲟ. ⲁ ⲛⲁⲃⲱ ⲇⲉ ⲛⲉϩϣⲗϥ̅ ⲙⲛ̅ ⲛⲁⲥⲁⲣⲝ̅	And a spirit came before my face; and my hair and flesh quivered.	καὶ πνεῦµα ἐπὶ πρόσωπόν µου ἐπῆλθεν, ἔφριξαν δέ µου τρίχες καὶ σάρκες.						
Job	4	04	16	OT	1. OT	Poetic Books	3. Poetic Books	03. Poetic Books	02. Job	ⲁⲓⲧⲱⲙⲧ ⲟⲩⲟϩ ⲙ̀ⲡⲓⲥⲱⲟⲩⲛ ⲁⲓⲛⲁⲩ ⲟⲩⲟϩ ⲛⲉ ⲙ̀ⲙⲟⲛ ⲙⲟⲣⲫⲏ ⲙ̀ⲡⲉⲙ̀ⲑⲟ ⲛ̀ⲛⲁⲃⲁⲗ ⲁⲗⲗⲁ ⲟⲩϩⲟⲣⲧϥ ⲛⲉⲙ ⲟⲩⲥⲙⲏ ⲡⲉ ⲉ̀ⲛⲁⲓⲥⲱⲧⲉⲙ ⲉ̀ⲣⲱⲟⲩ	ⲁⲓⲧⲱⲟⲩⲛ ⲙ̅ⲡⲉⲓⲛⲁⲩ. ⲁⲓϭⲱϣⲧ̅ ⲙ̅ⲡⲉⲓϭⲛ̅ ⲥⲙⲟⲧ ⲙ̅ⲡⲁⲙ̅ⲧⲟ ⲉⲃⲟⲗ. ⲁⲗⲗⲁ ⲛⲉⲩⲟ ⲉⲓⲁⲁⲧⲉ ⲁⲩⲱ ⲛⲉⲩⲥⲱⲧⲙ̅ ⲉⲟⲩⲥⲙⲏ.	I arose and perceived it not: I looked, and there, was no form before my eyes: but I only heard a breath and a voice, saying,	ἀνέστην, καὶ οὐκ ἐπέγνων· εἶδον, καὶ οὐκ ἦν µορφὴ πρὸ ὀφθαλµῶν µου, ἀλλ’ ἢ αὔραν καὶ φωνὴν ἤκουον						
Job	4	04	17	OT	1. OT	Poetic Books	3. Poetic Books	03. Poetic Books	02. Job	ⲟⲩ ⲅⲁⲣ ⲙⲏ ϥⲛⲁϣⲱⲡⲓ ⲛ̀ϫⲉ ⲟⲩⲣⲱⲙⲓ ⲉϥⲧⲟⲩⲃⲏⲟⲩⲧ ⲙ̀ⲡⲉⲙ̀ⲑⲟ ⲙ̀ⲡϭ̅ⲥ̅ ⲓⲉ ⲟⲩⲟⲛ ⲟⲩⲣⲱⲙⲓ ⲛⲁⲉⲣⲁⲧⲁⲣⲓⲕⲓ ⲉ̀ⲃⲟⲗ ϧⲉⲛ ⲛⲉϥϩⲃⲏⲟⲩⲓ	ⲉϣⲁⲣⲉ ⲟⲩ ⲅⲁⲣ ϣⲱⲡⲉ. ⲙⲏ ⲟⲩ ⲛ̅ⲣⲱⲙⲉ ⲛ̅ⲁⲧⲃ̅ⲃⲟ ⲙ̅ⲡⲙ̅ⲧⲟ ⲉⲃⲟⲗ ⲙ̅ⲡϫⲟⲉⲓⲥ. ⲏ ⲡⲣⲱⲙⲉ ⲛⲁϣⲱⲡⲉ ⲛ̅ⲁⲧⲛⲟⲃⲉ ϩⲛ̅ ⲛⲉϥϩⲃⲏⲩⲉ.	What, shall a mortal be pure before the Lord? or a man be blameless in regard to his works?	Τί γάρ; µὴ καθαρὸς ἔσται βροτὸς ἐναντίον κυρίου ἢ ἀπὸ τῶν ἔργων αὐτοῦ ἄµεµπτος ἀνήρ;						
Job	4	04	18	OT	1. OT	Poetic Books	3. Poetic Books	03. Poetic Books	02. Job	ⲓⲥϫⲉ ϥⲧⲉⲛϩⲟⲩⲧ ⲙ̀ⲙⲟⲥ ⲁⲛ ϧⲁ ⲛⲉϥⲁⲗⲱⲟⲩⲓ ⲛⲉϥⲁⲅⲅⲉⲗⲟⲥ ⲇⲉ ⲁϥⲙⲟⲕⲙⲉⲕ ⲉ̀ⲟⲩϩⲱⲃ ⲉϥϧⲟⲥⲓ ϧⲁⲣⲱⲟⲩ	ⲉϣϫⲉ ⲙⲉϥⲧⲁⲛϩⲟⲩⲧϥ̅ ⲣⲱ ⲙⲛ̅ ⲛⲉϥϩⲙ̅ϩⲁⲗ. ⲁϥⲙⲉⲉⲩⲉ ⲇⲉ ⲉⲩϭⲱⲱⲙⲉ ⲉⲛⲉϥⲁⲅⲅⲉⲗⲟⲥ.	Whereas he trust not in his servants, and perceives perverseness in his angels.	εἰ κατὰ παίδων αὐτοῦ οὐ πιστεύει, κατὰ δὲ ἀγγέλων αὐτοῦ σκολιόν τι ἐπενόησεν,						
Job	4	04	19	OT	1. OT	Poetic Books	3. Poetic Books	03. Poetic Books	02. Job	ⲛⲏ ⲇⲉ ⲉⲧϣⲟⲡ ϧⲉⲛ ϩⲁⲛⲏⲓ ⲛ̀ⲟⲙⲓ ⲉⲧⲉ ⲁ̀ⲛⲟⲛ ϩⲱⲛ ⲁ̀ⲛⲟⲛ ϩⲁⲛⲉ̀ⲃⲟⲗ ϧⲉⲛ ⲡⲁⲓⲟⲙⲓ ⲛ̀ⲟⲩⲱⲧ ⲁϥϯ ⲛ̀ⲟⲩⲉⲣϧⲟⲧ ⲛⲱⲟⲩ ⲙ̀ⲫⲣⲏϯ ⲛ̀ⲟⲩϩⲟⲗⲓ	ⲉⲓⲉ ⲛⲉⲧⲟⲩⲏϩ ⲣⲱ ϩⲛ̅ ⲛⲉⲓⲏⲓ ⲛ̅ⲟⲙⲉ. ⲉⲁⲛ ϩⲉⲛ ⲉⲃⲟⲗ ϩⲱⲱⲛ ϩⲙ̅ ⲡⲉⲓⲟⲙⲉ ⲛ̅ⲟⲩⲱⲧ. ⲁⲩⲥⲙⲟⲧ ⲇⲉ ⲛ̅ϫⲟⲟⲗⲉⲥ ⲧⲁⲕⲟⲟⲩ.	But as for them that dwell in houses of clay, of whom we also are formed of the same clay, he smites them like a moth.	τοὺς δὲ κατοικοῦντας οἰκίας πηλίνας, ἐξ ὧν καὶ αὐτοὶ ἐκ τοῦ αὐτοῦ πηλοῦ ἐσµεν, ἔπαισεν αὐτοὺς σητὸς τρόπον·						
Job	4	04	20	OT	1. OT	Poetic Books	3. Poetic Books	03. Poetic Books	02. Job	ⲟⲩⲟϩ ⲓⲥϫⲉⲛ ϣⲱⲣⲡ ϣⲁ ⲣⲟⲩϩⲓ ⲥⲉϣⲟⲡ ⲁⲛ ϫⲉ ⲉⲑⲃⲉⲫⲁⲓ ϫⲉ ⲙ̀ⲙⲟⲛ ϣ̀ϫⲟⲙ ⲙ̀ⲙⲱⲟⲩ ⲉ̀ⲉⲣⲃⲟⲏⲑⲓⲛ ⲉ̀ⲣⲱⲟⲩ ⲙ̀ⲙⲓⲛ ⲙ̀ⲙⲱⲟⲩ ⲁⲩⲧⲁⲕⲟ	ⲁⲩⲱ ⲛ̅ⲥⲉϣⲟⲟⲡ ⲁⲛ ϫⲓⲛ ϩⲧⲟⲟⲩⲉ ϣⲁ ⲣⲟⲩϩⲉ. ⲁⲩⲧⲁⲕⲟ ⲇⲉ ϫⲉ ⲙⲛ̅ ϣϭⲟⲙ ⲙ̅ⲙⲟⲟⲩ ⲉⲃⲟⲏⲑⲉⲓ ⲉⲣⲟⲟⲩ.	And from the morning to evening they no longer exist: they have perished, because they cannot help themselves.	καὶ ἀπὸ πρωίθεν ἕως ἑσπέρας οὐκέτι εἰσίν, παρὰ τὸ µὴ δύνασθαι αὐτοὺς ἑαυτοῖς βοηθῆσαι ἀπώλοντο·						
Job	4	04	21	OT	1. OT	Poetic Books	3. Poetic Books	03. Poetic Books	02. Job	ⲁϥⲛⲓϥⲓ ⲅⲁⲣ ⲛ̀ⲥⲱⲟⲩ ⲁⲩϣⲱⲟⲩⲓ ⲟⲩⲟϩ ⲁⲩⲧⲁⲕⲟ ϫⲉ ⲙ̀ⲙⲟⲛⲧⲟⲩ ⲥⲟⲫⲓⲁ ⲙ̀ⲙⲁⲩ	ⲁⲩⲛⲓⲃⲉ ⲅⲁⲣ ⲉⲣⲟⲟⲩ ⲁⲩⲱ ⲁⲩϣⲟⲟⲩⲉ. ⲁⲩⲧⲁⲕⲟ ⲇⲉ ϫⲉ ⲙⲛ̅ⲧⲁⲩ ⲧⲥⲟⲫⲓⲁ.	For he blows upon them, and they are withered: they have perished for lack of wisdom.	ἐνεφύσησεν γὰρ αὐτοῖς καὶ ἐξηράνθησαν, ἀπώλοντο παρὰ τὸ µὴ ἔχειν αὐτοὺς σοφίαν.						
Job	5	05	1	OT	1. OT	Poetic Books	3. Poetic Books	03. Poetic Books	02. Job	ⲱϣ ⲇⲉ ⲉ̀ϩⲣⲏⲓ ⲟⲩⲟϩ ⲁⲛⲁⲩ ϫⲉ ⲛⲓⲙ ⲁϥⲥⲱⲧⲉⲙ ⲉ̀ⲣⲟⲕ ⲓⲉ ϫⲉ ⲭⲛⲁⲛⲁⲩ ⲉ̀ⲟⲩⲁⲓ ⲛ̀ⲛⲓⲁⲅⲅⲉⲗⲟⲥ ⲉⲑⲟⲩⲁⲃ	ⲙⲟⲩⲧⲉ ⲛⲅ̅ⲛⲁⲩ ϫⲉ ⲟⲩⲛ̅ ⲡⲉⲧⲛⲁⲥⲱⲧⲙ̅ ⲉⲣⲟⲕ. ⲏ ϫⲉ ⲛⲅ̅ⲛⲁⲛⲁⲩ ⲉⲗⲁⲁⲩ ⲛ̅ⲁⲅⲅⲉⲗⲟⲥ ⲉϥⲟⲩⲁⲁⲃ.	But call, if any one will hearken to thee, or if thou shalt see any of the holy angels.	ἐπικάλεσαι δέ, εἴ τίς σοι ὑπακούσεται, ἢ εἴ τινα ἀγγέλων ἁγίων ὄψῃ.						
Job	5	05	2	OT	1. OT	Poetic Books	3. Poetic Books	03. Poetic Books	02. Job	ⲕⲉ ⲅⲁⲣ ϣⲁⲣⲉ ⲡⲓϫⲱⲛⲧ ⲧⲁⲕⲟ ⲛ̀ⲛⲓⲁⲧϩⲏⲧ ⲡⲓⲭⲟϩ ⲇⲉ ϣⲁϥϧⲱⲧⲉⲃ ⲙ̀ⲫⲏ ⲉⲧⲥⲟⲣⲉⲙ	ⲕⲁⲓ ⲅⲁⲣ ϣⲁⲣⲉ ⲧⲟⲣⲅⲏ ⲧⲁⲕⲉ ⲡⲁⲑⲏⲧ. ϣⲁⲣⲉ ⲡⲕⲱϩ ⲇⲉ ⲙⲉⲩⲧ̅ ⲡⲉⲧⲥⲟⲣⲙ̅.	For wrath destroys the foolish one, and envy slays him that has gone astray.	καὶ γὰρ ἄφρονα ἀναιρεῖ ὀργή, πεπλανηµένον δὲ θανατοῖ ζῆλος.						
Job	5	05	3	OT	1. OT	Poetic Books	3. Poetic Books	03. Poetic Books	02. Job	ⲁ̀ⲛⲟⲕ ⲇⲉ ⲁⲓⲛⲁⲩ ⲉ̀ϩⲁⲛⲁⲧϩⲏⲧ ⲉ̀ⲁⲩϩⲓ ⲛⲟⲩⲛⲓ ⲉ̀ⲃⲟⲗ ⲟⲩⲟϩ ⲥⲁⲧⲟⲧϥ ⲁϥⲟⲩⲱⲙ ⲙ̀ⲡⲟⲩⲥⲱϯ	ⲁⲛⲟⲕ ⲇⲉ ⲁⲓⲛⲁⲩ ⲉⲛ̅ⲁⲑⲏⲧ ⲉⲩⲛⲉϫ ⲛⲟⲩⲛⲉ ⲉⲃⲟⲗ. ⲁⲗⲗⲁ ⲛ̅ⲧⲉⲩⲛⲟⲩ ⲁⲩⲱϫⲛ̅ ϩⲙ̅ ⲡⲉⲩⲙⲁ.	And I have seen foolish ones taking root: but suddenly their habitation was devoured.	ἐγὼ δὲ ἑώρακα ἄφρονας ῥίζαν βάλλοντας, ἀλλ’ εὐθέως ἐβρώθη αὐτῶν ἡ δίαιτα.						
Job	5	05	4	OT	1. OT	Poetic Books	3. Poetic Books	03. Poetic Books	02. Job	ⲛⲟⲩϣⲏⲣⲓ ⲇⲉ ⲉⲩⲉ̀ϩⲉⲓ ⲙ̀ⲡⲓⲟⲩϫⲁⲓ ⲉⲩⲉ̀ⲧϩⲉⲙⲕⲱⲟⲩ ⲇⲉ ϩⲓⲣⲉⲛ ⲛⲓⲣⲱⲟⲩ ⲛ̀ⲧⲉ ⲛⲏ ⲉⲧⲥⲃⲟⲕ ⲉ̀ⲣⲱⲟⲩ ⲟⲩⲟϩ ⲛ̀ⲛⲉϥϣⲱⲡⲓ ⲛ̀ϫⲉ ⲫⲏ ⲉⲧⲛⲁⲛⲁϩⲙⲟⲩ	ⲉⲣⲉ ⲛⲉⲩϣⲏⲣⲉ ⲟⲩⲉ ⲙ̅ⲡⲟⲩϫⲁⲓ. ⲉⲩϩⲓⲟⲩⲉ ⲇⲉ ⲉⲣⲟⲟⲩ ϩⲓⲧⲛ̅ ⲛ̅ⲣⲟ ⲛ̅ⲛⲉⲧⲃ̅ⲃⲓⲏⲩ ⲉⲣⲟⲟⲩ. ⲁⲩⲱ ⲛϥ̅ⲧⲙ̅ϣⲱⲡⲉ ⲛ̅ϭⲓ ⲡⲉⲧⲛ̅ⲟⲩϩⲙ ⲙ̅ⲙⲟⲟⲩ.	Let their children be far from safety, and let them be crushed at the doors of vile men, and let there be no deliverer.	πόρρω γένοιντο οἱ υἱοὶ αὐτῶν ἀπὸ σωτηρίας, κολαβρισθείησαν δὲ ἐπὶ θύραις ἡσσόνων, καὶ οὐκ ἔσται ὁ ἐξαιρούµενος·						
Job	5	05	5	OT	1. OT	Poetic Books	3. Poetic Books	03. Poetic Books	02. Job	ⲛⲏ ⲅⲁⲣ ⲉⲧⲁⲩⲑⲟⲩⲱⲧⲟⲩ ⲛ̀ϫⲉ ⲛⲏ ⲉⲧⲉⲙ̀ⲙⲁⲩ ϩⲁⲛⲑⲙⲏⲓ ⲉⲩⲉ̀ⲟⲩⲟⲙⲟⲩ ⲛ̀ⲑⲱⲟⲩ ⲇⲉ ⲛ̀ⲛⲟⲩⲉⲣ ⲉ̀ⲃⲟⲗ ⲉϩⲁⲛⲡⲉⲧϩⲱⲟⲩ ⲉⲥⲉ̀ⲙⲟⲩⲛⲕ ⲛ̀ϫⲉ ⲧⲟⲩⲛⲟⲙϯ	ⲛⲉⲛⲧⲁ ⲛⲁⲓ ⲅⲁⲣ ⲥⲟⲟⲩϩⲟⲩ ⲉϩⲟⲩⲛ ⲛ̅ⲇⲓⲕⲁⲓⲟⲥ ⲛⲉⲧⲛⲁⲟⲩⲟⲙⲟⲩ. ⲛ̅ⲧⲟⲟⲩ ⲇⲉ ⲛ̅ⲛⲉⲩⲟⲩϫⲁⲓ ⲉⲡⲉⲑⲟⲟⲩ. ⲉⲣⲉ ⲧⲉⲩϭⲟⲙ ⲱϫⲛ̅.	For what they have collected, the just shall eat; but they shall not be delivered out of calamities: let their strength be utterly exhausted.	ἃ γὰρ ἐκεῖνοι συνήγαγον, δίκαιοι ἔδονται, αὐτοὶ δὲ ἐκ κακῶν οὐκ ἐξαίρετοι ἔσονται, ἐκσιφωνισθείη αὐτῶν ἡ ἰσχύς.						
Job	5	05	6	OT	1. OT	Poetic Books	3. Poetic Books	03. Poetic Books	02. Job	ⲛ̀ⲛⲉϥⲓ̀ ⲅⲁⲣ ⲛ̀ϫⲉ ⲟⲩϧⲓⲥⲓ ⲉ̀ⲃⲟⲗ ϧⲉⲛ ⲡⲕⲁϩⲓ ⲟⲩⲇⲉ ⲛ̀ⲛⲉϥⲣⲱⲧ ϧⲉⲛ ⲛⲓⲧⲱⲟⲩ ⲛ̀ϫⲉ ⲟⲩⲙⲕⲁϩ	ⲙⲉⲣⲉ ϩⲓⲥⲉ ⲅⲁⲣ ⲉⲓ ⲉⲃⲟⲗ ϩⲙ̅ ⲡⲕⲁϩ ⲟⲩⲇⲉ ⲙⲉⲣⲉ ⲙⲟⲕϩⲥ̅ ϯⲟⲩⲱ ϩⲓ ⲧⲟⲟⲩ.	For labour cannot by any means come out of the earth, nor shall trouble spring out of the mountains:	οὐ γὰρ µὴ ἐξέλθῃ ἐκ τῆς γῆς κόπος, οὐδὲ ἐξ ὀρέων ἀναβλαστήσει πόνος·						
Job	5	05	7	OT	1. OT	Poetic Books	3. Poetic Books	03. Poetic Books	02. Job	ⲁⲗⲗⲁ ⲫⲣⲱⲙⲓ ⲉⲧⲟⲩⲙⲓⲥⲓ ⲙ̀ⲙⲟϥ ⲉ̀ⲃⲟⲗ ϧⲉⲛ ⲟⲩϧⲓⲥⲓ ⲛⲓⲙⲁⲥ ⲛ̀ⲧⲉ ⲛⲓⲁϧⲱⲙ ⲥⲉϩⲏⲗ ⲉ̀ⲡϭⲓⲥⲓ	ⲁⲗⲗⲁ ⲉⲩϫⲡⲟ ⲙ̅ⲡⲣⲱⲙⲉ ⲉⲡϩⲓⲥⲉ. ⲉⲣⲉ ⲙ̅ⲙⲁⲥ ⲇⲉ ⲛ̅ⲛⲟⲩⲣⲉ ϩⲏⲗ ϩⲛ̅ ⲛⲉⲧϫⲟⲥⲉ.	yet man is born to labour, and even so the vulture’s young seek the high places.	ἀλλὰ ἄνθρωπος γεννᾶται κόπῳ, νεοσσοὶ δὲ γυπὸς τὰ ὑψηλὰ πέτονται.						
Job	5	05	8	OT	1. OT	Poetic Books	3. Poetic Books	03. Poetic Books	02. Job	ⲡⲁⲓⲣⲏϯ ⲇⲉ ⲁⲛ ⲁⲗⲗⲁ ⲁ̀ⲛⲟⲕ ϯⲧⲱⲃϩ ⲙ̀ⲡϭ̅ⲥ̅ ⲡϭ̅ⲥ̅ ⲇⲉ ⲫⲛⲏⲃ ⲛ̀ⲧⲉ ⲟⲩⲟⲛ ⲛⲓⲃⲉⲛ ϯⲛⲁⲱϣ ⲉ̀ⲡϣⲱⲓ ϧⲁⲣⲟϥ	ⲙ̅ⲙⲟⲛ ⲇⲉ ⲁⲛⲟⲕ ϩⲱ ϯⲛⲁⲥⲉⲡⲥ̅ ⲡϫⲟⲉⲓⲥ. ϯⲛⲁⲱϣ ⲇⲉ ⲉϩⲣⲁⲓ ⲉⲡϫⲟⲉⲓⲥ ⲡⲉⲧϩⲓϫⲛ̅ ⲟⲩⲟⲛ ⲛⲓⲙ.	Nevertheless I will beseech the Lord, and will call upon the Lord, the sovereign of all;	οὐ µὴν δὲ ἀλλὰ ἐγὼ δεηθήσοµαι κυρίου, κύριον δὲ τὸν πάντων δεσπότην ἐπικαλέσοµαι						
Job	5	05	9	OT	1. OT	Poetic Books	3. Poetic Books	03. Poetic Books	02. Job	ⲫⲏ ⲉⲧⲓⲣⲓ ⲛ̀ϩⲁⲛⲛⲓϣϯ ⲟⲩⲟϩ ⲛ̀ⲁⲧϧⲉⲧϧⲱⲧⲟⲩ ⲛⲉⲙ ϩⲁⲛϩⲃⲏⲟⲩⲓ ⲉⲩϧⲉⲛ ⲡⲱⲟⲩ ⲛⲉⲙ ϩⲁⲛϣⲫⲏⲣⲓ ⲙ̀ⲙⲟⲛⲧⲟⲩ ⲏⲡⲓ	ⲡⲉⲛⲧⲁϥⲧⲁⲙⲓⲉ ⲛⲉⲓⲛⲟϭ ⲙⲛ̅ ⲛⲉⲓⲁⲧⲁⲣⲏϫⲛⲟⲩ. ⲛⲉⲧⲧⲁⲉⲓⲏⲩ ⲁⲩⲱ ⲛⲉⲓϣⲡⲏⲣⲉ ⲉⲧⲉ ⲙⲛ̅ⲧⲟⲩ ⲏⲡⲉ.	who does great things and untraceable, glorious things also, and marvellous, of which there is no number:	τὸν ποιοῦντα µεγάλα καὶ ἀνεξιχνίαστα, ἔνδοξά τε καὶ ἐξαίσια, ὧν οὐκ ἔστιν ἀριθµός·						
Job	5	05	10	OT	1. OT	Poetic Books	3. Poetic Books	03. Poetic Books	02. Job	ⲫⲏ ⲉⲧϯ ⲛ̀ⲟⲩⲙⲟⲩ ⲛ̀ϩⲱⲟⲩ ϩⲓϫⲉⲛ ⲡⲓⲕⲁϩⲓ ⲫⲏ ⲉⲧⲧⲁⲟⲩⲉ ⲙⲱⲟⲩ ⲉ̀ϫⲉⲛ ⲛⲏ ⲉⲧⲥⲁⲡⲉⲥⲏⲧ ⲛ̀ⲧⲫⲉ	ⲡⲉⲧϯ ⲙ̅ⲡϩⲟⲟⲩ ⲉϫⲙ̅ ⲡⲕⲁϩ.  ⲡⲉⲧⲧⲛ̅ⲛⲟⲟⲩ ⲛ̅ⲟⲩⲙⲟⲟⲩ ϩⲁ ⲧⲡⲉ.	who gives rain upon the earth, sending water on the earth:	τὸν διδόντα ὑετὸν ἐπὶ τὴν γῆν, ἀποστέλλοντα ὕδωρ ἐπὶ τὴν ὑπ’ οὐρανόν·						
Job	5	05	11	OT	1. OT	Poetic Books	3. Poetic Books	03. Poetic Books	02. Job	ⲫⲏ ⲉⲧϭⲓⲥⲓ ⲛ̀ⲛⲏ ⲉⲧⲑⲉⲃⲓⲏⲟⲩⲧ ⲟⲩⲟϩ ⲉⲧⲧⲟⲩⲛⲟⲥ ⲛ̀ⲛⲏ ⲉⲧⲁⲩⲧⲁⲕⲟ	ⲡⲉⲧϫⲓⲥⲉ ⲛ̅ⲛⲉⲑⲃ̅ⲃⲓⲏⲩ. ⲡⲉⲧⲧⲟⲩⲛⲟⲩⲥ ⲛ̅ⲛⲉⲧⲧⲁⲕⲟ.	who exalts the lowly, and raises up them that are lost:	τὸν ποιοῦντα ταπεινοὺς εἰς ὕψος καὶ ἀπολωλότας ἐξεγείροντα·						
Job	5	05	12	OT	1. OT	Poetic Books	3. Poetic Books	03. Poetic Books	02. Job	ⲫⲏ ⲉⲧⲫⲱⲛϩ ⲛ̀ⲛⲓⲥⲟϭⲛⲓ ⲛ̀ⲧⲉ ⲛⲓⲡⲁⲛⲟⲩⲣⲅⲟⲥ ⲟⲩⲟϩ ⲛ̀ⲛⲟⲩⲉⲣ ϩⲗⲓ ⲙ̀ⲙⲉⲑⲙⲏⲓ ⲛ̀ϫⲉ ⲛⲟⲩϫⲓϫ	ⲡⲉⲧϣⲓⲃⲉ ⲙ̅ⲡϣⲟϫⲛⲉ ⲛ̅ⲛ̅ⲣⲙ̅ⲛ̅ϩⲏⲧ. ⲁⲩⲱ ⲛ̅ⲛⲉ ⲛⲉⲩϭⲓϫ ⲣ̅ ⲗⲁⲁⲩ ⲙ̅ⲙⲉ.	frustrating the counsels of the crafty, and their hands shall not perform the truth:	διαλλάσσοντα βουλὰς πανούργων, καὶ οὐ µὴ ποιήσουσιν αἱ χεῖρες αὐτῶν ἀληθές.						
Job	5	05	13	OT	1. OT	Poetic Books	3. Poetic Books	03. Poetic Books	02. Job	ⲫⲏ ⲉⲧⲧⲁϩⲟ ⲛ̀ⲛⲓⲥⲁⲃⲉⲩ ϧⲉⲛ ⲧⲟⲩⲥⲃⲱ ⲡⲥⲟϭⲛⲓ ⲇⲉ ⲛ̀ⲧⲉ ⲛⲓⲥⲁⲛⲕⲟⲧⲥ ⲁϥⲑⲣⲉϥⲧⲱⲙⲧ	ⲡⲉⲧⲧⲁϩⲟ ⲛ̅ⲛⲉⲓⲥⲟⲫⲟⲥ ϩⲛ̅ ⲛⲉⲩⲙⲛ̅ⲧⲥⲁⲃⲉ. ⲁϥⲡⲱϣⲥ̅ ⲇⲉ ⲙ̅ⲡϣⲟϫⲛⲉ ⲛ̅ⲛⲉⲓⲥⲁⲛⲕⲟⲧⲥ̅.	who takes the wise in their wisdom, and subverts the counsel of the crafty	ὁ καταλαµβάνων σοφοὺς ἐν τῇ φρονήσει, βουλὴν δὲ πολυπλόκων ἐξέστησεν·						
