book	chapter	chapter-zfilled	verse	testament	testament-indexed	section	section-indexed	section-indexed-no-testament	book-indexed	Bohairic	Sahidic	English	Greek	Fayyumic	Akhmimic	OldBohairic	Mesokemic	DialectP	Lycopolitan
Ezekiel	1	01	19	OT	1. OT	Major Prophets	4. Major Prophets	04. Major Prophets	06. Ezekiel	ⲟⲩⲟϩ ϧⲉⲛ ⲡϫⲓⲛⲑⲣⲟⲩⲙⲟϣⲓ ⲛ̀ϫⲉ ⲛⲓⲍⲱⲟⲛ. ⲛⲁⲩⲙⲟϣⲓ ⲛ̀ϫⲉ ⲛⲓⲧⲣⲟⲭⲟⲥ. ⲉⲩϧⲉⲛⲧ ⲉ̀ϧⲟⲩⲛ ⲉ̀ⲣⲱⲟⲩ. ⲟⲩⲟϩ ϧⲉⲛ ⲡϫⲓⲛⲑⲣⲟⲩϥⲁⲓ ⲙ̀ⲙⲱⲟⲩ ⲛ̀ϫⲉ ⲛⲓⲍⲱⲟⲛ ⲉ̀ⲃⲟⲗ ϩⲁ ⲡⲕⲁϩⲓ. ϣⲁⲩϥⲁⲓ ⲙ̀ⲙⲱⲟⲩ ⲛ̀ϫⲉ ⲛⲓⲧⲣⲟⲭⲟⲥ.		And when the living creatures went, the wheels went by them: and when the living creatures lifted themselves off the earth, the wheels were lifted off.	καὶ ἐν τῷ πορεύεσθαι τὰ ζῷα ἐπορεύοντο οἱ τροχοὶ ἐχόµενοι αὐτῶν, καὶ ἐν τῷ ἐξαίρειν τὰ ζῷα ἀπὸ τῆς γῆς ἐξῄροντο οἱ τροχοί.						
Ezekiel	1	01	20	OT	1. OT	Major Prophets	4. Major Prophets	04. Major Prophets	06. Ezekiel	ⲫⲙⲁ ⲉⲧⲉ ϯϭⲏⲡⲓ ⲙ̀ⲙⲟϥ ϣⲁϥϣⲉ ⲛⲁϥ ⲉ̀ⲙⲁⲩ ⲛ̀ϫⲉ ⲡⲓⲡⲛ̅ⲁ̅ ⲉ̀ⲡϫⲓⲛⲑⲣⲟⲩⲙⲟϣⲓ ⲛⲁⲩⲙⲟϣⲓ ⲡⲉ ⲛ̀ϫⲉ ⲛⲓⲍⲱⲟⲛ ⲛⲉⲙ ⲛⲓⲧⲣⲟⲭⲟⲥ. ⲟⲩⲟϩ ⲛⲁⲩϥⲁⲓ ⲙ̀ⲙⲱⲟⲩ ⲛⲉⲙⲱⲟⲩ ⲡⲉ. ϫⲉ ⲟⲩⲏⲓ ⲛⲉ ⲟⲩⲡⲛ̅ⲁ̅ ⲛ̀ⲱⲛϧ ⲉ̀ⲛⲁϥϧⲉⲛ ⲛⲓⲧⲣⲟⲭⲟⲥ.		Wherever the cloud happened to be, there was the spirit ready to go: the wheels went and were lifted up with them; because the spirit of life was in the wheels.	οὗ ἂν ἦν ἡ νεφέλη, ἐκεῖ τὸ πνεῦµα τοῦ πορεύεσθαι· ἐπορεύοντο τὰ ζῷα καὶ οἱ τροχοὶ καὶ ἐξῄροντο σὺν αὐτοῖς, διότι πνεῦµα ζωῆς ἦν ἐν τοῖς τροχοῖς.						
Ezekiel	1	01	21	OT	1. OT	Major Prophets	4. Major Prophets	04. Major Prophets	06. Ezekiel	ⲟⲩⲟϩ ϧⲉⲛ ⲡϫⲓⲛⲑⲣⲟⲩⲙⲟϣⲓ. ⲛⲁⲩⲙⲟϣⲓ ⲡⲉ ⲟⲩⲟϩ ϧⲉⲛ ⲡϫⲓⲛⲑⲣⲟⲩⲟϩⲓ ⲉ̀ⲣⲁⲧⲟⲩ. ϣⲁⲩⲟϩⲓ ⲉ̀ⲣⲁⲧⲟⲩ ϩⲱⲟⲩ. ⲟⲩⲟϩ ϧⲉⲛ ⲡϫⲓⲛⲧⲟⲩϥⲁⲓ ⲛⲱⲟⲩ ⲉ̀ⲃⲟⲗ ϩⲁ ⲡⲕⲁϩⲓ. ϣⲁⲩϥⲁⲓ ⲛⲱⲟⲩ ⲛⲉⲙⲱⲟⲩ. ϫⲉ ⲟⲩⲡⲛ̅ⲁ̅ ⲛ̀ⲱⲛϧ ⲉ̀ⲛⲁϥϧⲉⲛ ⲛⲓⲧⲣⲟⲭⲟⲥ.		When those went, the wheels went; and when those stood, the wheels stood; and when those lifted themselves off the earth, they were lifted off with them: for the spirit of life was in the wheels.	ἐν τῷ πορεύεσθαι αὐτὰ ἐπορεύοντο καὶ ἐν τῷ ἑστάναι αὐτὰ εἱστήκεισαν καὶ ἐν τῷ ἐξαίρειν αὐτὰ ἀπὸ τῆς γῆς ἐξῄροντο σὺν αὐτοῖς, ὅτι πνεῦµα ζωῆς ἦν ἐν τοῖς τροχοῖς.						
Ezekiel	1	01	22	OT	1. OT	Major Prophets	4. Major Prophets	04. Major Prophets	06. Ezekiel	ⲟⲩⲟϩ ⲡⲓⲥⲙⲟⲧ ⲉ̀ⲛⲁϥⲭⲏ ϩⲓϫⲉⲛ ⲧⲁⲫⲉ ⲛ̀ⲛⲓⲍⲱⲟⲛ. ⲛⲁϥⲟⲓ ⲙ̀ⲫⲣⲏϯ ⲙ̀ⲡⲓⲥⲧⲉⲣⲉⲱⲙⲁ. ⲙ̀ⲫⲣⲏϯ ⲛ̀ⲟⲩϩⲟⲣⲁⲥⲓⲥ ⲛ̀ⲧⲉ ⲟⲩⲭⲣⲩⲥⲧⲁⲗⲟⲥ ⲉϥϭⲟⲗⲕ ⲉ̀ⲃⲟⲗ ⲉ̀ϫⲉⲛ ⲛ̀ⲟⲩⲧⲉⲛϩ ⲥⲁⲡϣⲱⲓ.		And the likeness over the heads of the living creatures was as a firmament, as the appearance of crystal, spread out over their wings above.	καὶ ὁµοίωµα ὑπὲρ κεφαλῆς αὐτοῖς τῶν ζῴων ὡσεὶ στερέωµα ὡς ὅρασις κρυστάλλου ἐκτεταµένον ἐπὶ τῶν πτερύγων αὐτῶν ἐπάνωθεν·						
Ezekiel	1	01	23	OT	1. OT	Major Prophets	4. Major Prophets	04. Major Prophets	06. Ezekiel	ⲟⲩⲟϩ ⲥⲁⲡⲉⲥⲏⲧ ⲙ̀ⲡⲓⲥⲧⲉⲣⲉⲱⲙⲁ. ⲛⲁⲣⲉ ⲛⲟⲩⲧⲉⲛϩ ⲫⲟⲣϣ ⲉ̀ⲃⲟⲗ. ⲉⲩϩⲏⲗ ⲛ̀ⲟⲩⲁⲓ ⲉ̀ⲟⲩⲁⲓ ⲙ̀ⲙⲱⲟⲩ. ⲫⲟⲩⲁⲓ ⲫⲟⲩⲁⲓ ⲛⲉ ⲟⲩⲟⲛ ⲃ̅ ⲉ̀ⲣⲟϥ ⲡⲉ. ⲉⲩϩⲱⲃⲥ ⲉ̀ⲃⲟⲗ ⲉ̀ϫⲉⲛ ⲛⲟⲩⲥⲱⲙⲁ.		And their wings were spread out under the firmament, reaching one to the other; two wings to each, covering their bodies.	καὶ ὑποκάτω τοῦ στερεώµατος αἱ πτέρυγες αὐτῶν ἐκτεταµέναι, πτερυσσόµεναι ἑτέρα τῇ ἑτέρᾳ, ἑκάστῳ δύο συνεζευγµέναι ἐπικαλύπτουσαι τὰ σώµατα αὐτῶν.						
Ezekiel	1	01	24	OT	1. OT	Major Prophets	4. Major Prophets	04. Major Prophets	06. Ezekiel	ⲟⲩⲟϩ ⲛⲁⲓⲥⲱⲧⲉⲙ ⲉ̀ⲧⲥⲙⲏ ⲛ̀ⲧⲉ ⲛⲟⲩⲧⲉⲛϩ ⲡⲉ ϧⲉⲛ ⲡⲟⲩϫⲓⲛⲙⲟϣⲓ. ⲙ̀ⲫⲣⲏϯ ⲛ̀ⲧⲥⲙⲏ ⲛ̀ⲧⲉ ⲟⲩⲙⲱⲟⲩ ⲉϥⲟϣ. ⲙ̀ⲫⲣⲏϯ ⲛ̀ⲧⲥⲙⲏ ⲙ̀ⲡⲓϩⲓⲕⲁⲛⲟⲥ. ϧⲉⲛ ⲡⲟⲩϫⲓⲛⲙⲟϣⲓ. ⲧⲥⲙⲏ ⲙ̀ⲡⲓⲥⲁϫⲓ ⲙ̀ⲫⲣⲏϯ ⲛ̀ⲧⲥⲙⲏ ⲛ̀ⲟⲩⲡⲁⲣⲉⲙⲃⲟⲗⲏ. ⲟⲩⲟϩ ϧⲉⲛ ⲡϫⲓⲛⲑⲣⲉϥⲟϩⲓ ⲉ̀ⲣⲁⲧϥ. ϣⲁⲩⲙⲧⲟⲛ ⲙ̀ⲙⲱⲟⲩ ⲛ̀ϫⲉ ⲛⲟⲩⲧⲉⲛϩ.		And I heard the sound of their wings when they went, as the sound of much water: and when they stood, their wings were let down.	καὶ ἤκουον τὴν φωνὴν τῶν πτερύγων αὐτῶν ἐν τῷ πορεύεσθαι αὐτὰ ὡς φωνὴν ὕδατος πολλοῦ· καὶ ἐν τῷ ἑστάναι αὐτὰ κατέπαυον αἱ πτέρυγες αὐτῶν.						
Ezekiel	1	01	25	OT	1. OT	Major Prophets	4. Major Prophets	04. Major Prophets	06. Ezekiel	ⲟⲩⲟϩ ⲓⲥ ⲟⲩⲥⲙⲏ ⲁⲥⲓ̀ ⲉ̀ⲃⲟⲗ ⲥⲁⲡϣⲱⲓ ⲙ̀ⲡⲓⲥⲧⲉⲣⲉⲱⲙⲁ. ⲫⲏ ⲉⲧϩⲓϫⲉⲛ ⲧⲟⲩⲁⲫⲉ.		And lo! a voice from above the firmament	καὶ ἰδοὺ φωνὴ ὑπεράνωθεν τοῦ στερεώµατος τοῦ ὄντος ὑπὲρ κεφαλῆς αὐτῶν.						
Ezekiel	1	01	26	OT	1. OT	Major Prophets	4. Major Prophets	04. Major Prophets	06. Ezekiel	ϧⲉⲛ ⲡϫⲓⲛⲑⲣⲟⲩⲟϩⲓ ⲉ̀ⲣⲁⲧⲟⲩ ϣⲁⲣⲉ ⲛⲟⲩⲧⲉⲛϩ ϩⲉⲛⲟⲩ ⲛⲱⲟⲩ. ⲟⲩⲟϩ ⲥⲁⲡϣⲱⲓ ⲙ̀ⲡⲓⲥⲧⲉⲣⲉⲱⲙⲁ ⲫⲏ ⲉⲧϩⲓϫⲉⲛ ⲧⲟⲩⲁⲫⲉ. ⲛⲁϥⲟⲓ ⲙ̀ⲫⲣⲏϯ ⲛ̀ⲟⲩϩⲟⲣⲁⲥⲓⲥ ⲛ̀ⲧⲉ ⲟⲩⲱⲛⲓ ⲛ̀ⲥⲁⲡⲫⲓⲣⲟⲥ. ⲡⲓⲛⲓ ⲛ̀ⲟⲩⲑⲣⲟⲛⲟⲥ ⲛⲁϥ ϩⲓϫⲱϥ ⲟⲩⲟϩ ϩⲓϫⲉⲛ ⲡⲓⲛⲓ ⲛ̀ⲧⲉ ⲡⲓⲑⲣⲟⲛⲟⲥ ⲟⲩⲓⲛⲓ ⲙ̀ⲫⲣⲏϯ ⲙ̀ⲡⲥⲙⲟⲧ ⲛ̀ⲟⲩⲣⲱⲙⲓ ⲥⲁⲡϣⲱⲓ		that was over their head, there was as the appearance of a sapphire stone, and the likeness of a throne upon it: and upon the likeness of the throne was the likeness as an appearance of a man above.	ὡς ὅρασις λίθου σαπφείρου ὁµοίωµα θρόνου ἐπ’ αὐτοῦ, καὶ ἐπὶ τοῦ ὁµοιώµατος τοῦ θρόνου ὁµοίωµα ὡς εἶδος ἀνθρώπου ἄνωθεν.						
Ezekiel	1	01	27	OT	1. OT	Major Prophets	4. Major Prophets	04. Major Prophets	06. Ezekiel	ⲟⲩⲟϩ ⲁⲓⲛⲁⲩ ⲙ̀ⲫⲣⲏϯ ⲙ̀ⲡϩⲟ ⲛ̀ⲟⲩϩⲓⲗⲉⲕⲧⲣⲟⲛ. ⲙ̀ⲫⲣⲏϯ ⲛ̀ⲟⲩϩⲟⲣⲁⲥⲓⲥ ⲛ̀ⲧⲉ ⲟⲩⲭⲣⲱⲙ ⲥⲁϧⲟⲩⲛ ⲙ̀ⲙⲟϥ ⲉϥⲕⲱϯ. ⲓⲥϫⲉⲛ ⲟⲩϩⲟⲣⲁⲥⲓⲥ ⲛ̀ⲧⲉ ⲟⲩϯⲡⲓ ⲛⲉⲙ ⲥⲁⲡϣⲱⲓ. ⲛⲉⲙ ⲓⲥϫⲉⲛ ⲟⲩϩⲟⲣⲁⲥⲓⲥ ⲛ̀ⲧⲉ ⲟⲩϯⲡⲓ. ⲛⲉⲙ ⲥⲁⲡⲉⲥⲏⲧ. ⲟⲩⲟϩ ⲁⲓⲛⲁⲩ ⲙ̀ⲫⲣⲏϯ ⲛ̀ⲟⲩϩⲟⲣⲁⲥⲓⲥ ⲛ̀ⲭⲣⲱⲙ. ⲟⲩⲟϩ ⲡⲉϥⲙⲟⲩⲉ ⲉϥⲕⲱϯ.		And I saw as it were the resemblance of amber from the appearance of the loins and upwards, and from the appearance of the loins and under I saw an appearance of fire, and the brightness thereof round about.	καὶ εἶδον ὡς ὄψιν ἠλέκτρου ἀπὸ ὁράσεως ὀσφύος καὶ ἐπάνω, καὶ ἀπὸ ὁράσεως ὀσφύος καὶ ἕως κάτω εἶδον ὡς ὅρασιν πυρὸς καὶ τὸ φέγγος αὐτοῦ κύκλῳ.						
Ezekiel	1	01	28	OT	1. OT	Major Prophets	4. Major Prophets	04. Major Prophets	06. Ezekiel	ⲙ̀ⲫⲣⲏϯ ⲛ̀ⲟⲩϩⲟⲣⲁⲥⲓⲥ ⲛ̀ⲧⲉ ⲟⲩⲫⲓϯ. ϩⲟⲧⲁⲛ ⲁⲥϣⲁⲛϣⲱⲡⲓ ϧⲉⲛ ⲛⲓϭⲏⲡⲓ ϧⲉⲛ ⲟⲩⲉϩⲟⲟⲩ ⲛ̀ⲧⲉ ⲟⲩⲙⲟⲩⲛϩⲱⲟⲩ. ⲫⲁⲓ ⲡⲉ ⲙ̀ⲫⲣⲏϯ ⲙ̀ⲡⲓϫⲓⲛⲟϩⲓ ⲉ̀ⲣⲁⲧϥ ⲙ̀ⲡⲓⲙⲟⲩⲉ ⲉϥⲕⲱϯ.		As the appearance of the bow when it is in the cloud in days of rain, so was the form of brightness round about.	ὡς ὅρασις τόξου, ὅταν ᾖ  ἐν τῇ νεφέλῃ ἐν ἡµέρᾳ ὑετοῦ, οὕτως ἡ στάσις τοῦ φέγγους κυκλόθεν. αὕτη ἡ ὅρασις ὁµοιώµατος δόξης κυρίου· καὶ εἶδον καὶ πίπτω ἐπὶ πρόσωπόν µου καὶ ἤκουσα φωνὴν λαλοῦντος.						
Ezekiel	2	02	1	OT	1. OT	Major Prophets	4. Major Prophets	04. Major Prophets	06. Ezekiel	ⲧⲁⲓϩⲟⲣⲁⲥⲓⲥ ⲟⲩⲓⲛⲓ ⲧⲉ ⲛ̀ⲧⲉ ⲡⲱⲟⲩ ⲙ̀ⲡϭ̅ⲥ̅. ⲟⲩⲟϩ ⲁⲓⲛⲁⲩ ⲟⲩⲟϩ ⲁⲓϩⲓⲧⲧ ⲉ̀ϫⲉⲛ ⲡⲁϩⲟ. ⲟⲩⲟϩ ⲁⲓⲥⲱⲧⲉⲙ ⲉ̀ⲟⲩⲥⲙⲏ ⲛ̀ⲧⲉ ⲡⲉⲧⲥⲁϫⲓ. ⲟⲩⲟϩ ⲡⲉϫⲁϥ ⲛⲏⲓ. ϫⲉ ⲡϣⲏⲣⲓ ⲙ̀ⲫⲣⲱⲙⲓ ⲟϩⲓ ⲉ̀ⲣⲁⲧⲕ ⲉ̀ϫⲉⲛ ⲛⲉⲕϭⲁⲗⲁⲩϫ. ⲟⲩⲟϩ ⲛ̀ⲧⲁⲥⲁϫⲓ ⲛⲉⲙⲁⲕ.		This was the appearance of the likeness of the glory of the Lord. And I saw and fell upon my face, and heard the voice of one speaking: and he said to me, Son of man, stand upon thy feet, and I will speak to thee.	Καὶ εἶπεν πρός µε Υἱὲ ἀνθρώπου, στῆθι ἐπὶ τοὺς πόδας σου, καὶ λαλήσω πρὸς σέ.						
Ezekiel	2	02	2	OT	1. OT	Major Prophets	4. Major Prophets	04. Major Prophets	06. Ezekiel	ⲟⲩⲟϩ ⲁϥⲓ̀ ⲉ̀ϫⲱⲓ ⲛ̀ϫⲉ ⲟⲩⲡⲛ̅ⲁ̅ ⲁϥⲟⲗⲧ ⲁϥϥⲓⲧⲧ. ⲟⲩⲟϩ ⲁϥⲧⲁϩⲟⲓ ⲉ̀ⲣⲁⲧ ⲉ̀ϫⲉⲛ ⲛⲁϭⲁⲗⲁⲩϫ. ⲟⲩⲟϩ ⲁⲓⲥⲱⲧⲉⲙ ⲉ̀ⲣⲟϥ ⲉϥⲥⲁϫⲓ ⲛⲉⲙⲏⲓ.		And the Spirit came upon me, and took me up, and raised me, and set me on my feet: and I heard him speaking to me.	καὶ ἦλθεν ἐπ’ ἐµὲ πνεῦµα καὶ ἀνέλαβέν µε καὶ ἐξῆρέν µε καὶ ἔστησέν µε ἐπὶ τοὺς πόδας µου, καὶ ἤκουον αὐτοῦ λαλοῦντος πρός µε,						
Ezekiel	2	02	3	OT	1. OT	Major Prophets	4. Major Prophets	04. Major Prophets	06. Ezekiel	ⲟⲩⲟϩ ⲡⲉϫⲁϥ ⲛⲏⲓ ϫⲉ ⲡϣⲏⲣⲓ ⲙ̀ⲫⲣⲱⲙⲓ. ⲁ̀ⲛⲟⲕ ϯⲟⲩⲱⲣⲡ ⲙ̀ⲙⲟⲕ ϣⲁ ⲡⲏⲓ ⲙ̀ⲡⲓⲥ̅ⲗ̅ ⲛⲏ ⲉⲧϯϫⲱⲛⲧ ⲛⲏⲓ. ⲛⲁⲓ ⲉⲧⲁⲩϯϫⲱⲛⲧ ⲛⲏⲓ ⲛ̀ⲑⲱⲟⲩ ⲛⲉⲙ ⲛⲟⲩⲓⲟϯ. ⲁⲩⲉⲣⲁⲧⲥⲱⲧⲉⲙ ⲛ̀ϧⲣⲏⲓ ⲛ̀ϧⲏⲧ ϣⲁ ⲉ̀ϧⲟⲩⲛ ⲉ̀ⲫⲟⲟⲩ ⲛ̀ⲉϩⲟⲟⲩ.		And he said to me, Son of Man, I send thee forth to the house of Israel, them that provoke me; who have provoked me, they and their fathers to this day.	καὶ εἶπεν πρός µε Υἱὲ ἀνθρώπου, ἐξαποστέλλω ἐγώ σε πρὸς τὸν οἶκον τοῦ  Ισραηλ τοὺς παραπικραίνοντάς µε, οἵτινες παρεπίκρανάν µε αὐτοὶ καὶ οἱ πατέρες αὐτῶν ἕως τῆς σήµερον ἡµέρας,						
Ezekiel	2	02	4	OT	1. OT	Major Prophets	4. Major Prophets	04. Major Prophets	06. Ezekiel	ϩⲁⲛϣⲏⲣⲓ ⲛⲉ ⲉⲣⲉ ⲡⲟⲩϩⲟ ϫⲟⲣ ⲉⲣⲉ ⲡⲟⲩϩⲏⲧ ⲛⲁϣⲧ. ⲛⲁⲓ ⲁ̀ⲛⲟⲕ ⲉ̀ϯⲛⲁⲟⲩⲟⲣⲡⲕ ϩⲁⲣⲱⲟⲩ. ⲟⲩⲟϩ ⲉⲕⲉ̀ϫⲟⲥ ⲛⲱⲟⲩ. ϫⲉ ⲛⲁⲓ ⲛⲉ ⲛⲏ ⲉⲧⲉϥϫⲱ ⲙ̀ⲙⲱⲟⲩ ⲛ̀ϫⲉ ⲡϭ̅ⲥ̅.		And thou shalt say to them, Thus saith the Lord.	καὶ ἐρεῖς πρὸς αὐτούς Τάδε λέγει κύριος						
Ezekiel	2	02	5	OT	1. OT	Major Prophets	4. Major Prophets	04. Major Prophets	06. Ezekiel	ⲁⲣⲏⲟⲩ ⲛ̀ⲥⲉⲥⲱⲧⲉⲙ. ⲓⲉ ⲛ̀ⲥⲉⲛⲟⲩϣⲡ ϫⲉ ⲟⲩⲏⲓ ⲟⲩⲏⲓ ⲛ̀ⲣⲉϥϯϫⲱⲛⲧ ⲛⲉ. ⲟⲩⲟϩ ⲉⲩⲉ̀ⲉⲙⲓ ϫⲉ ⲛ̀ⲑⲟⲕ ⲟⲩⲡⲣⲟⲫⲏⲧⲏⲥ ⲛ̀ⲑⲟⲕ ϧⲉⲛ ⲧⲟⲩⲙⲏϯ.		Whether then indeed they shall hear or fear, (for it is a provoking house,) yet they shall know that thou art a prophet in the midst of them.	Ἐὰν ἄρα ἀκούσωσιν ἢ πτοηθῶσιν — διότι οἶκος παραπικραίνων ἐστίν —, καὶ γνώσονται ὅτι προφήτης εἶ σὺ ἐν µέσῳ αὐτῶν.						
Ezekiel	2	02	6	OT	1. OT	Major Prophets	4. Major Prophets	04. Major Prophets	06. Ezekiel	ⲟⲩⲟϩ ⲛ̀ⲑⲟⲕ ⲡϣⲏⲣⲓ ⲙ̀ⲫⲣⲱⲙⲓ. ⲙ̀ⲡⲉⲣⲉⲣϩⲟϯ ϧⲁⲧⲟⲩϩⲏ ⲟⲩⲇⲉ ⲙ̀ⲡⲉⲣⲧⲱⲙⲧ ⲙ̀ⲡⲉⲙ̀ⲑⲟ ⲙ̀ⲡⲟⲩϩⲟ. ϫⲉ ⲥⲉⲛⲁⲑⲱⲟⲩϯ. ⲟⲩⲟϩ ⲥⲉⲓ̀ ⲉ̀ϩⲣⲏⲓ ⲉ̀ϫⲱⲕ ⲙ̀ⲡⲉⲕⲕⲱϯ. ⲟⲩⲟϩ ⲁⲕϣⲟⲡ ⲛ̀ⲑⲟⲕ ϧⲉⲛ ⲑⲙⲏϯ ⲛ̀ϩⲁⲛϭⲗⲏ. ⲙ̀ⲡⲉⲣⲉⲣϩⲟϯ ⲛ̀ⲑⲟⲕ ϧⲁⲧϩⲏ ⲛ̀ⲛⲟⲩϫⲓϫ. ⲟⲩⲇⲉ ⲙ̀ⲡⲉⲣⲧⲱⲙⲧ ϧⲁⲧϩⲏ ⲙ̀ⲡⲟⲩϩⲟ. ϫⲉ ⲟⲩⲏⲓ. ⲟⲩⲏⲓ ⲛ̀ⲣⲉϥϯϫⲱⲛⲧ ⲛⲉ.		And thou, son of man, fear them not, nor be dismayed at their face; (for they will madden and will rise up against thee round about, and thou dwellest in the midst of scorpions): be not afraid of their words, nor be dismayed at their countenance, for it is a provoking house.	καὶ σύ, υἱὲ ἀνθρώπου, µὴ φοβηθῇς αὐτοὺς µηδὲ ἐκστῇς ἀπὸ προσώπου αὐτῶν, διότι παροιστρήσουσι καὶ ἐπισυστήσονται ἐπὶ σὲ κύκλῳ, καὶ ἐν µέσῳ σκορπίων σὺ κατοικεῖς· τοὺς λόγους αὐτῶν µὴ φοβηθῇς καὶ ἀπὸ προσώπου αὐτῶν µὴ ἐκστῇς, διότι οἶκος παραπικραίνων ἐστίν.						
Ezekiel	2	02	7	OT	1. OT	Major Prophets	4. Major Prophets	04. Major Prophets	06. Ezekiel	ⲟⲩⲟϩ ⲛⲁⲥⲁϫⲓ ϫⲟⲧⲟⲩ ⲉ̀ⲣⲱⲟⲩ ⲉ̀ϣⲱⲡ ⲉⲩⲛⲁⲥⲱⲧⲉⲙ ⲛ̀ⲥⲉⲉⲣϩⲟϯ ⲉⲑⲃⲉ ϫⲉ ⲟⲩⲏⲓ ⲛ̀ⲣⲉϥϯⲙⲃⲟⲛ.		And thou shalt speak my words to them, whether they will hear or fear: for it is a provoking house.	καὶ λαλήσεις τοὺς λόγους µου πρὸς αὐτούς, ἐὰν ἄρα ἀκούσωσιν ἢ πτοηθῶσιν, διότι οἶκος παραπικραίνων ἐστίν.						
Ezekiel	2	02	8	OT	1. OT	Major Prophets	4. Major Prophets	04. Major Prophets	06. Ezekiel	ⲁⲣⲓⲉⲙⲓ ⲛ̀ⲑⲟⲕ ϩⲱⲕ ⲡϣⲏⲣⲓ ⲙ̀ⲫⲣⲱⲙⲓ. ⲟⲩⲟϩ ⲥⲱⲧⲉⲙ ⲉ̀ⲫⲏ ⲉⲧⲥⲁϫⲓ ⲛⲉⲙⲁⲕ. ⲙ̀ⲡⲉⲣϣⲱⲡⲓ ⲛ̀ⲣⲉϥϯϫⲱⲛⲧ. ⲙ̀ⲫⲣⲏϯ ⲙ̀ⲡⲓⲏⲓ ⲉⲧϯⲙⲃⲟⲛ ⲁⲟⲩⲱⲛ ⲛ̀ⲣⲱⲕ ⲟⲩⲱⲙ ⲛ̀ⲛⲏ ⲉ̀ϯⲛⲁⲧⲏⲓⲧⲟⲩ ⲛⲁⲕ.		And thou, son of man, hear him that speaks to thee; be not thou provoking, as the provoking house: open thy mouth, and eat what I give thee.	καὶ σύ, υἱὲ ἀνθρώπου, ἄκουε τοῦ λαλοῦντος πρὸς σέ, µὴ γίνου παραπικραίνων καθὼς ὁ οἶκος ὁ παραπικραίνων· χάνε τὸ στόµα σου καὶ φάγε ἃ ἐγὼ δίδωµί σοι.						
Ezekiel	2	02	9	OT	1. OT	Major Prophets	4. Major Prophets	04. Major Prophets	06. Ezekiel	ⲁⲓⲛⲁⲩ ⲟⲩⲟϩ ϩⲏⲡⲡⲉ ⲓⲥ ⲟⲩϫⲓϫ ⲉⲥⲥⲱⲟⲩⲧⲉⲛ ⲉ̀ⲃⲟⲗ ⲛⲁϩⲣⲁⲓ ⲉⲣⲉ ⲟⲩⲕⲉⲫⲁⲗⲓⲥ ⲛ̀ϫⲱⲙ ⲛ̀ϧⲏⲧⲥ.		And I looked, and behold, a hand stretched out to me, and in it a volume of a book.	καὶ εἶδον καὶ ἰδοὺ χεὶρ ἐκτεταµένη πρός µε, καὶ ἐν αὐτῇ κεφαλὶς βιβλίου·						
Ezekiel	2	02	10	OT	1. OT	Major Prophets	4. Major Prophets	04. Major Prophets	06. Ezekiel	ⲟⲩⲟϩ ⲁϥⲕⲟⲩⲗⲟⲗⲥ ⲙ̀ⲡⲁⲙ̀ⲑⲟ ⲉ̀ⲃⲟⲗ. ⲥⲉⲥϧⲏⲟⲩⲧ ⲥⲁϧⲟⲩⲛ ⲛⲉⲙ ⲥⲁⲃⲟⲗ. ⲟⲩⲟϩ ⲉ̀ⲟⲩⲟⲛ ⲟⲩⲛⲉϩⲡⲓ ⲛⲉⲙ ⲟⲩϩⲱⲇⲏ ⲛⲉⲙ ⲟⲩⲟⲩⲟⲓ ⲥϧⲏⲟⲩⲧ ⲉ̀ⲣⲟⲥ.		And he unrolled it before me: and in it the front and the back were written upon: and there was written in it Lamentation, and mournful song, and woe.	καὶ ἀνείλησεν αὐτὴν ἐνώπιον ἐµοῦ, καὶ ἐν αὐτῇ γεγραµµένα ἦν τὰ ὄπισθεν καὶ τὰ ἔµπροσθεν, καὶ ἐγέγραπτο εἰς αὐτὴν θρῆνος καὶ µέλος καὶ οὐαί.						
Ezekiel	3	03	1	OT	1. OT	Major Prophets	4. Major Prophets	04. Major Prophets	06. Ezekiel	ⲟⲩⲟϩ ⲡⲉϫⲁϥ ⲛⲏⲓ. ϫⲉ ⲡϣⲏⲣⲓ ⲙ̀ⲫⲣⲱⲙⲓ ⲟⲩⲱⲙ ⲛ̀ⲧⲁⲓⲕⲉⲫⲁⲗⲓⲥ ⲛ̀ϫⲱⲙ ⲟⲩⲟϩ ⲙⲁϣⲉ ⲛⲁⲕ ⲟⲩⲟϩ ⲥⲁϫⲓ ⲛⲉⲙ ⲛⲉⲛϣⲏⲣⲓ ⲙ̀ⲡⲓⲥ̅ⲗ̅.		And he said to me, Son of Man, eat this volume, and go and speak to the children of Israel.	καὶ εἶπεν πρός µε Υἱὲ ἀνθρώπου, κατάφαγε τὴν κεφαλίδα ταύτην καὶ πορεύθητι καὶ λάλησον τοῖς υἱοῖς Ισραηλ.						
Ezekiel	3	03	2	OT	1. OT	Major Prophets	4. Major Prophets	04. Major Prophets	06. Ezekiel	ⲟⲩⲟϩ ⲁϥⲟⲩⲱⲛ ⲛ̀ⲣⲱⲓ ⲁϥⲧⲉⲙⲙⲟⲓ ⲛ̀ϯⲕⲉⲫⲁⲗⲓⲥ ⲛ̀ϫⲱⲙ		So he opened my mouth, and caused me to eat the volume.	καὶ διήνοιξα τὸ στόµα µου, καὶ ἐψώµισέν µε τὴν κεφαλίδα.						
Ezekiel	3	03		OT	1. OT	Major Prophets	4. Major Prophets	04. Major Prophets	06. Ezekiel	ⲟⲩⲟϩ ⲡⲉϫⲁϥ ⲛⲏⲓ. ϫⲉ ⲡϣⲏⲣⲓ ⲙ̀ⲫⲣⲱⲙⲓ ⲣⲱⲕ ⲛⲁⲟⲩⲱⲙ ⲟⲩⲟϩ ⲧⲉⲕⲛⲉϫⲓ ⲛⲁⲙⲟϩ ϧⲉⲛ ⲧⲁⲓⲕⲉⲫⲁⲗⲓⲥ ⲛ̀ϫⲱⲙ ⲉⲧⲁⲓⲧⲏⲓⲥ ⲛⲁⲕ. ⲁⲓⲟⲩⲱⲙⲥ ⲇⲉ ⲁⲥϣⲱⲡⲓ ϧⲉⲛ ⲣⲱⲓ ⲙ̀ⲫⲣⲏϯ ⲛ̀ⲟⲩⲉⲃⲓⲱ ⲉϥϩⲟⲗϫ.		And he said to me, Son of man, (3) thy mouth shall eat, and thy belly shall be filled with this volume that is given to thee. So I ate it; and it was in my mouth as sweet as honey.	καὶ εἶπεν πρός µε Υἱὲ ἀνθρώπου, τὸ στόµα σου φάγεται, καὶ ἡ κοιλία σου πλησθήσεται τῆς κεφαλίδος ταύτης τῆς δεδοµένης εἰς σέ. καὶ ἔφαγον αὐτήν, καὶ ἐγένετο ἐν τῷ στόµατί µου ὡς µέλι γλυκάζον.						
Ezekiel	3	03	4	OT	1. OT	Major Prophets	4. Major Prophets	04. Major Prophets	06. Ezekiel	ⲟⲩⲟϩ ⲡⲉϫⲁϥ ⲛⲏⲓ ϫⲉ ⲡϣⲏⲣⲓ ⲙ̀ⲫⲣⲱⲙⲓ. ⲙⲟϣⲓ ⲟⲩⲟϩ ϣⲉ ⲉ̀ϧⲟⲩⲛ ⲉ̀ⲡⲏⲓ ⲙ̀ⲡⲓⲥ̅ⲗ̅ ⲙⲁⲧⲁⲙⲱⲟⲩ ⲉ̀ⲛⲁⲥⲁϫⲓ.		And he said to me, Son of man, go thy way, and go in to the house of Israel, and speak my words to them.	καὶ εἶπεν πρός µε Υἱὲ ἀνθρώπου, βάδιζε εἴσελθε πρὸς τὸν οἶκον τοῦ Ισραηλ καὶ λάλησον τοὺς λόγους µου πρὸς αὐτούς·						
Ezekiel	3	03	5	OT	1. OT	Major Prophets	4. Major Prophets	04. Major Prophets	06. Ezekiel	ⲉⲑⲃⲉ ϫⲉ ⲙ̀ⲡⲓⲟⲩⲟⲣⲡⲕ ⲛ̀ⲑⲟⲕ ⲉ̀ⲣⲁⲧⲟⲩ ⲛ̀ⲛⲉⲛϣⲏⲣⲓ ⲙ̀ⲡⲓⲥ̅ⲗ̅ ⲙ̀ⲫⲣⲏϯ ⲉ̀ⲣⲁⲧϥ ⲛ̀ⲟⲩⲗⲁⲟⲥ ⲉⲣⲉ ⲧⲉϥϫⲓⲛⲥⲁϫⲓ ϩⲟⲣϣ.		For thou art not sent to a people of hard speech, but to the house of Israel;	διότι οὐ πρὸς λαὸν βαθύχειλον καὶ βαρύγλωσσον σὺ ἐξαποστέλλῃ πρὸς τὸν οἶκον τοῦ Ισραηλ						
Ezekiel	3	03	6	OT	1. OT	Major Prophets	4. Major Prophets	04. Major Prophets	06. Ezekiel	ⲟⲩⲇⲉ ⲉ̀ⲟⲩⲗⲁⲟⲥ ⲉϥⲟϣ ⲉⲣⲉ ⲛⲟⲩⲥⲙⲏ ϩⲟⲣϣ. ⲓⲉ ⲉⲣⲉ ⲧⲟⲩⲁⲥⲡⲓ ϩⲟⲣϣ. ⲟⲩⲇⲉ ⲉⲩⲛⲁϣⲧ ϧⲉⲛ ⲧⲟⲩϫⲓⲛⲥⲁϫⲓ. ⲭⲛⲁϣ̀ⲥⲱⲧⲉⲙ ⲁⲛ ⲉ̀ⲛⲟⲩⲥⲁϫⲓ. ⲟⲩⲟϩ ⲭⲁⲛ ⲁⲓⲟⲩⲱⲣⲡ ⲙ̀ⲙⲟⲕ ϩⲁ ⲛⲁⲓ ⲙ̀ⲡⲁⲓⲣⲏϯ. ⲛⲁⲩⲥⲱⲧⲉⲙ ⲛ̀ⲥⲱⲕ		neither to many nations of other speech and other tongues, nor of harsh language, whose words thou wouldest not understand: although if I had sent thee to such, they would have hearkened to thee.	οὐδὲ πρὸς λαοὺς πολλοὺς ἀλλοφώνους ἢ ἀλλογλώσσους οὐδὲ στιβαροὺς τῇ γλώσσῃ ὄντας, ὧν οὐκ ἀκούσῃ τοὺς λόγους αὐτῶν· καὶ εἰ πρὸς τοιούτους ἐξαπέστειλά σε, οὗτοι ἂν εἰσήκουσάν σου.						
Ezekiel	3	03	7	OT	1. OT	Major Prophets	4. Major Prophets	04. Major Prophets	06. Ezekiel	ϫⲉ. ⲡⲏⲓ ⲇⲉ ⲙ̀ⲡⲓⲥ̅ⲗ̅ ⲛⲁⲩⲟⲩⲱϣ ⲁⲛ ϫⲉ ⲉ̀ⲥⲱⲧⲉⲙ ⲛ̀ⲥⲱⲕ. ⲉⲑⲃⲉ ϫⲉ ⲛⲁⲩⲟⲩⲱϣ ⲁⲛ ⲉ̀ⲥⲱⲧⲉⲙ ⲛ̀ⲥⲱⲓ. ϫⲉ ⲡⲏⲓ ⲧⲏⲣϥ ⲙ̀ⲡⲓⲥ̅ⲗ̅ ϩⲁⲛⲣⲉϥϯ ⲟⲩⲃⲉ ⲛⲉ. ⲟⲩⲟϩ ϩⲁⲛⲛⲁϣⲧϩⲏⲧ ⲛⲉ.		But the house of Israel will not be willing to hearken to thee; for they will not hearken to me: for all the house of Israel are stubborn and hard-hearted.	ὁ δὲ οἶκος τοῦ Ισραηλ οὐ µὴ θελήσωσιν εἰσακοῦσαί σου, διότι οὐ βούλονται εἰσακούειν µου· ὅτι πᾶς ὁ οἶκος Ισραηλ φιλόνεικοί εἰσιν καὶ σκληροκάρδιοι.						
Ezekiel	3	03	8	OT	1. OT	Major Prophets	4. Major Prophets	04. Major Prophets	06. Ezekiel	ϩⲏⲡⲡⲉ ⲁⲓⲑⲣⲉ ⲡⲉⲕϩⲟ ⲧⲁϫⲣⲏⲟⲩⲧ ⲙ̀ⲡⲟⲩⲙ̀ⲑⲟ ⲉ̀ⲃⲟⲗ. ⲟⲩⲟϩ ⲡⲉⲕϭⲣⲟ ϯⲛⲁⲑⲣⲉϥϫⲉⲙⲛⲟⲙϯ ⲙ̀ⲡⲉⲙ̀ⲑⲟ ⲉ̀ⲃⲟⲗ ⲙ̀ⲡⲟⲩϭⲣⲟ.		And, behold, I have made thy face strong against their faces, and I will strengthen thy power against their power.	καὶ ἰδοὺ δέδωκα τὸ πρόσωπόν σου δυνατὸν κατέναντι τῶν προσώπων αὐτῶν καὶ τὸ νεῖκός σου κατισχύσω κατέναντι τοῦ νείκους αὐτῶν,						
Ezekiel	3	03	9	OT	1. OT	Major Prophets	4. Major Prophets	04. Major Prophets	06. Ezekiel	ⲟⲩⲟϩ ⲡⲉⲕϩⲟ ⲛⲁϣⲱⲡⲓ ⲛ̀ⲥⲏⲟⲩ ⲛⲓⲃⲉⲛ ⲉϥⲧⲁϫⲣⲏⲟⲩⲧ ⲉ̀ϩⲟⲧⲉ ⲟⲩⲡⲉⲧⲣⲁ. ⲙⲡⲉⲣⲉⲣϩⲟϯ ϧⲁⲧⲟⲩϩⲏ. ⲟⲩⲟϩ ⲙ̀ⲡⲉⲣⲥⲑⲉⲣⲧⲉⲣ ⲙ̀ⲡⲟⲩⲙ̀ⲑⲟ ⲉ̀ⲃⲟⲗ. ϫⲉ ⲟⲩⲏⲓ ⲛ̀ⲣⲉϥϯϫⲱⲛⲧ ⲛⲉ.		And it shall be continually stronger than a rock: be not afraid of them, neither be dismayed at their faces, because it is a provoking house.	καὶ ἔσται διὰ παντὸς κραταιότερον πέτρας· µὴ φοβηθῇς ἀπ’ αὐτῶν µηδὲ πτοηθῇς ἀπὸ προσώπου αὐτῶν, διότι οἶκος παραπικραίνων ἐστίν.						
Ezekiel	3	03	10	OT	1. OT	Major Prophets	4. Major Prophets	04. Major Prophets	06. Ezekiel	ⲟⲩⲟϩ ⲡⲉϫⲁϥ ⲛⲏⲓ ϫⲉ ⲡϣⲏⲣⲓ ⲙ̀ⲫⲣⲱⲙⲓ ⲛⲓⲥⲁϫⲓ ⲧⲏⲣⲟⲩ ⲉⲧⲁⲓϫⲟⲧⲟⲩ ⲛⲁⲕ ⲭⲁⲩ ϧⲉⲛ ⲡⲉⲕϩⲏⲧ. ⲟⲩⲟϩ ⲥⲱⲧⲉⲙ ϧⲉⲛ ⲛⲉⲕⲙⲁϣϫ.		And he said to me, Son of man, receive into thine heart all the words that I have spoken to thee, and hear them with thine ears.	καὶ εἶπεν πρός µε Υἱὲ ἀνθρώπου, πάντας τοὺς λόγους, οὓς λελάληκα µετὰ σοῦ, λαβὲ εἰς τὴν καρδίαν σου καὶ τοῖς ὠσίν σου ἄκουε						
