book	chapter	chapter-zfilled	verse	testament	testament-indexed	section	section-indexed	section-indexed-no-testament	book-indexed	Bohairic	Sahidic	English	Greek	Fayyumic	Akhmimic	OldBohairic	Mesokemic	DialectP	Lycopolitan
Ezekiel	3	03	11	OT	1. OT	Major Prophets	4. Major Prophets	04. Major Prophets	06. Ezekiel	ⲙⲁϣⲉ ⲛⲁⲕ ⲟⲩⲟϩ ϣⲉ ⲉ̀ϧⲟⲩⲛ ⲉ̀ϯⲉⲭⲙⲁⲗⲱⲥⲓⲁ ⲛⲁϩⲣⲉⲛ ⲛⲉⲛϣⲏⲣⲓ ⲙ̀ⲡⲉⲕⲗⲁⲟⲥ. ⲟⲩⲟϩ ⲥⲁϫⲓ ⲛⲉⲙⲱⲟⲩ. ⲟⲩⲟϩ ⲁϫⲟⲥ ⲛⲱⲟⲩ. ϫⲉ ⲛⲁⲓ ⲛⲉ ⲛⲏ ⲉⲧⲉϥϫⲱ ⲙ̀ⲙⲱⲟⲩ ⲛ̀ϫⲉ ⲡϭ̅ⲥ̅. ⲓⲥϫⲉ ϩⲁⲣⲁ ⲥⲉⲥⲱⲧⲉⲙ. ⲓⲥϫⲉ ϩⲁⲣⲁ ⲥⲉⲑⲉⲃⲓⲱ.		And go thy way, go in to the captivity, to the children of thy people, and thou shalt speak to them, and say to them, Thus saith the Lord; whether they will hear, or whether they will forbear.	καὶ βάδιζε εἴσελθε εἰς τὴν αἰχµαλωσίαν πρὸς τοὺς υἱοὺς τοῦ λαοῦ σου καὶ λαλήσεις πρὸς αὐτοὺς καὶ ἐρεῖς πρὸς αὐτούς Τάδε λέγει κύριος, ἐὰν ἄρα ἀκούσωσιν, ἐὰν ἄρα ἐνδῶσιν.						
Ezekiel	3	03	12	OT	1. OT	Major Prophets	4. Major Prophets	04. Major Prophets	06. Ezekiel	ⲟⲩⲟϩ ⲟⲩⲡⲛ̅ⲁ̅ ⲁϥⲟⲗⲧ ⲟⲩⲟϩ ⲁⲩⲥⲱⲧⲉⲙ ⲥⲁⲫⲁϩⲟⲩ ⲙ̀ⲙⲟⲓ ⲉ̀ⲧⲥⲙⲏ ⲛ̀ⲟⲩⲛⲓϣϯ ⲙ̀ⲙⲟⲛⲙⲉⲛ. ϫⲉ ϥⲥⲙⲁⲣⲱⲟⲩⲧ ⲛ̀ϫⲉ ⲡⲓⲱⲟⲩ ⲛ̀ⲧⲉ ⲡϭ̅ⲥ̅ ϧⲉⲛ ⲡⲉϥⲙⲁ.		Then the Spirit took me up, and I heard behind me the voice as of a great earthquake, saying, Blessed be the glory of the Lord from his place.	καὶ ἀνέλαβέν µε πνεῦµα, καὶ ἤκουσα κατόπισθέν µου φωνὴν σεισµοῦ µεγάλου Εὐλογηµένη ἡ δόξα κυρίου ἐκ τοῦ τόπου αὐτοῦ.						
Ezekiel	3	03	13	OT	1. OT	Major Prophets	4. Major Prophets	04. Major Prophets	06. Ezekiel	ⲟⲩⲟϩ ⲁⲓⲛⲁⲩ ϩⲏⲡⲡⲉ ⲓⲥ ⲡϧⲣⲱⲟⲩ ⲛ̀ⲛⲓⲧⲉⲛϩ ⲛ̀ⲧⲉ ⲛⲓⲍⲱⲟⲛ ⲉⲩϩⲓⲟⲩⲓ ⲉ̀ϧⲟⲩⲛ ⲉ̀ϩⲣⲉⲛ ⲛⲟⲩⲉⲣⲏⲟⲩ. ⲟⲩⲁⲓ ⲛⲁϩⲣⲉⲛ ⲟⲩⲁⲓ. ⲟⲩⲟϩ ⲧⲥⲙⲏ ⲛ̀ⲧⲉ ⲛⲓⲧⲣⲟⲭⲟⲥ ϧⲉⲛⲧ ⲉ̀ϧⲟⲩⲛ ⲉ̀ⲣⲱⲟⲩ. ⲛⲉⲙ ⲧⲥⲙⲏ ⲙ̀ⲡⲓⲙⲟⲛⲙⲉⲛ.		And I perceived the sound of the wings of the living creatures clapping one to the other, and the sound of the wheels was near them, and the sound of the earthquake.	καὶ εἶδον φωνὴν πτερύγων τῶν ζῴων πτερυσσοµένων ἑτέρα πρὸς τὴν ἑτέραν, καὶ φωνὴ τῶν τροχῶν ἐχοµένη αὐτῶν καὶ φωνὴ τοῦ σεισµοῦ.						
Ezekiel	3	03	14	OT	1. OT	Major Prophets	4. Major Prophets	04. Major Prophets	06. Ezekiel	ⲟⲩⲟϩ ⲡⲓⲡⲛ̅ⲁ̅ ⲛ̀ⲧⲉ ⲡϭ̅ⲥ̅ ⲁϥⲟⲗⲧ ⲁϥϭⲓⲧⲧ ⲟⲩⲟϩ ⲁⲓⲙⲟϣⲓ ϧⲉⲛ ϯⲡⲣⲟϩⲉⲣⲉⲥⲓⲥ ⲛ̀ⲧⲉ ⲡⲁⲡⲛ̅ⲁ̅. ⲟⲩⲟϩ ⲧϫⲓϫ ⲙ̀ⲡϭ̅ⲥ̅ ⲁⲥϣⲱⲡⲓ ϩⲓϫⲱⲓ ⲉⲥⲧⲁϫⲣⲏⲟⲩⲧ		And the Spirit lifted me, and took me up, and I went in the impulse of my spirit; and the hand of the Lord was mighty upon me.	καὶ τὸ πνεῦµα ἐξῆρέν µε καὶ ἀνέλαβέν µε, καὶ ἐπορεύθην ἐν ὁρµῇ τοῦ πνεύµατός µου, καὶ χεὶρ κυρίου ἐγένετο ἐπ’ ἐµὲ κραταιά.						
Ezekiel	3	03	15	OT	1. OT	Major Prophets	4. Major Prophets	04. Major Prophets	06. Ezekiel	ⲁⲓϣⲉ ⲉ̀ϧⲟⲩⲛ ⲉ̀ϯⲉⲭⲙⲁⲗⲱⲥⲓⲁ ⲉ̀ⲓⲟⲣⲉⲙ. ⲟⲩⲟϩ ⲁⲓⲕⲱϯ ⲉ̀ⲛⲏ ⲉⲧϣⲟⲡ ϩⲓϫⲉⲛ ⲫⲓⲁⲣⲟ ⲭⲟⲩⲃⲁⲣ. ⲛⲏ ⲉⲧϣⲟⲡ ϧⲉⲛ ⲡⲓⲙⲁ ⲉⲧⲉⲙ̀ⲙⲁⲩ ⲁⲓϩⲉⲙⲥⲓ ϧⲉⲛ ⲡⲓⲙⲁ ⲉⲧⲉⲙ̀ⲙⲁⲩ ⲛ̀ⲍ̅ ⲛ̀ⲉϩⲟⲟⲩ ⲉⲓⲭⲏ ϧⲉⲛ ⲧⲟⲩⲙⲏϯ.		Then I passed through the air and came into the captivity, and went round to them that dwelt by the river of Chobar who were there; and I sat there seven days, conversant in the midst of them.	καὶ εἰσῆλθον εἰς τὴν αἰχµαλωσίαν µετέωρος καὶ περιῆλθον τοὺς κατοικοῦντας ἐπὶ τοῦ ποταµοῦ τοῦ Χοβαρ τοὺς ὄντας ἐκεῖ καὶ ἐκάθισα ἐκεῖ ἑπτὰ ἡµέρας ἀναστρεφόµενος ἐν µέσῳ αὐτῶν.						
Ezekiel	3	03	16	OT	1. OT	Major Prophets	4. Major Prophets	04. Major Prophets	06. Ezekiel	ⲁⲥϣⲱⲡⲓ ⲇⲉ ⲙⲉⲛⲉⲛⲥⲁ ⲡⲓⲍ̅ ⲛ̀ⲉϩⲟⲟⲩ. ⲁ ⲡⲓⲥⲁϫⲓ ⲛ̀ⲧⲉ ⲡϭ̅ⲥ̅ ϣⲱⲡⲓ ϩⲁⲣⲟⲓ ⲉϥϫⲱ ⲙ̀ⲙⲟⲥ.		And after the seven days the word of the Lord came to me, saying,	Καὶ ἐγένετο µετὰ τὰς ἑπτὰ ἡµέρας λόγος κυρίου πρός µε λέγων						
Ezekiel	3	03		OT	1. OT	Major Prophets	4. Major Prophets	04. Major Prophets	06. Ezekiel	ϫⲉ ⲡϣⲏⲣⲓ ⲙ̀ⲫⲣⲱⲙⲓ ⲁⲓⲧⲏⲓⲕ ⲛ̀ⲟⲩⲥⲕⲟⲡⲟⲥ ⲙ̀ⲡⲏⲓ ⲙ̀ⲡⲓⲥ̅ⲗ̅. ⲟⲩⲟϩ ⲉⲕⲉ̀ⲥⲱⲧⲉⲙ ⲉ̀ϩⲁⲛⲥⲁϫⲓ ⲉ̀ⲃⲟⲗ ϧⲉⲛ ⲣⲱⲓ. ⲟⲩⲟϩ ⲉⲕⲉ̀ⲧⲟⲛϣⲟⲩ ⲉ̀ⲃⲟⲗ ϩⲓⲧⲟⲧ.		Son of man, (17) I have made thee a watchman to the house of Israel; and thou shalt hear a word of my mouth, and shalt threaten them from me.	Υἱὲ ἀνθρώπου, σκοπὸν δέδωκά σε τῷ οἴκῳ Ισραηλ, καὶ ἀκούσῃ ἐκ στόµατός µου λόγον καὶ διαπειλήσῃ αὐτοῖς παρ’ ἐµοῦ.						
Ezekiel	3	03	18	OT	1. OT	Major Prophets	4. Major Prophets	04. Major Prophets	06. Ezekiel	ϧⲉⲛ ⲡϫⲓⲛⲑⲣⲓϫⲟⲥ ⲙ̀ⲡⲓⲁⲛⲟⲙⲟⲥ. ϫⲉ ϧⲉⲛ ⲟⲩⲙⲟⲩ ⲭⲛⲁⲙⲟⲩ. ⲟⲩⲟϩ ⲛ̀ⲛⲉⲕⲧⲟⲩⲛⲓⲁⲧϥ ⲉ̀ⲃⲟⲗ ⲟⲩⲟϩ ⲙ̀ⲡⲉⲕⲥⲁϫⲓ. ⲉ̀ⲡϫⲓⲛⲧⲟⲩⲛⲓⲁⲧϥ ⲙ̀ⲡⲓⲁⲛⲟⲙⲟⲥ ⲉ̀ⲃⲟⲗ ϩⲓⲛⲁ ⲛ̀ⲧⲉϥⲕⲟⲧϥ ⲉ̀ⲃⲟⲗ ϩⲁ ⲛⲉϥⲙⲱⲓⲧ. ϫⲉ ⲛ̀ⲧⲉϥⲱⲛϧ ⲡⲓⲁⲛⲟⲙⲟⲥ ⲉⲧⲉⲙ̀ⲙⲁⲩ ⲉϥⲉ̀ⲙⲟⲩ ϧⲉⲛ ⲧⲉϥⲁⲇⲓⲕⲓⲁ ⲟⲩⲟϩ ⲡⲉϥⲥⲛⲟϥ ϯⲛⲁⲕⲱϯ ⲛ̀ⲥⲱϥ ⲉ̀ⲃⲟⲗ ϧⲉⲛ ⲧⲉⲕϫⲓϫ.		When I say to the wicked, Thou shalt surely die; and thou hast not warned him, to give warning to the wicked, to turn from his ways, that he should live; that wicked man shall die in his iniquity; but his blood will I require at thy hand.	ἐν τῷ λέγειν µε τῷ ἀνόµῳ Θανάτῳ θανατωθήσῃ, καὶ οὐ διεστείλω αὐτῷ οὐδὲ ἐλάλησας τοῦ διαστείλασθαι τῷ ἀνόµῳ ἀποστρέψαι ἀπὸ τῶν ὁδῶν αὐτοῦ τοῦ ζῆσαι αὐτόν, ὁ ἄνοµος ἐκεῖνος τῇ ἀδικίᾳ αὐτοῦ ἀποθανεῖται, καὶ τὸ αἷµα αὐτοῦ ἐκ χειρός σου ἐκζητήσω.						
Ezekiel	3	03	19	OT	1. OT	Major Prophets	4. Major Prophets	04. Major Prophets	06. Ezekiel	ⲟⲩⲟϩ ⲛ̀ⲑⲟⲕ ⲁⲕϣⲁⲛⲧⲟⲩⲛⲓⲁⲧϥ ⲙ̀ⲡⲓⲁⲛⲟⲙⲟⲥ ⲉ̀ⲃⲟⲗ ⲟⲩⲟϩ ⲛ̀ⲧⲉϥϣ̀ⲧⲉⲙⲕⲟⲧϥ ⲥⲁⲃⲟⲗ ⲛ̀ⲛⲉϥⲁⲛⲟⲙⲓⲁ ⲛⲉⲙ ⲛⲉϥⲙⲱⲓⲧ. ⲡⲓⲁⲛⲟⲙⲟⲥ ⲉⲧⲉⲙ̀ⲙⲁⲩ ⲉϥⲉ̀ⲙⲟⲩ ϧⲉⲛ ⲧⲉϥⲁⲇⲓⲕⲓⲁ. ⲟⲩⲟϩ ⲛ̀ⲑⲟⲕ ϩⲱⲕ ⲉⲕⲉ̀ⲛⲟϩⲉⲙ ⲛ̀ⲧⲉⲕⲯⲩⲭⲏ.		But if thou warn the wicked, and he turn not from his wickedness, and from his way, that wicked man shall die in his iniquity, and thou shalt deliver thy soul.	καὶ σὺ ἐὰν διαστείλῃ τῷ ἀνόµῳ, καὶ µὴ ἀποστρέψῃ ἀπὸ τῆς ἀνοµίας αὐτοῦ καὶ τῆς ὁδοῦ αὐτοῦ, ὁ ἄνοµος ἐκεῖνος ἐν τῇ ἀδικίᾳ αὐτοῦ ἀποθανεῖται, καὶ σὺ τὴν ψυχήν σου ῥύσῃ.						
Ezekiel	3	03	20	OT	1. OT	Major Prophets	4. Major Prophets	04. Major Prophets	06. Ezekiel	ⲟⲩⲟϩ ϧⲉⲛ ⲡϫⲓⲛⲑⲣⲉ ⲡⲓⲑⲙⲏⲓ ⲕⲟⲧϥ ⲥⲁⲃⲟⲗ ⲛ̀ⲛⲉϥⲙⲉⲑⲙⲏⲓ. ⲟⲩⲟϩ ⲛ̀ⲧⲉϥⲓⲣⲓ ⲛ̀ⲟⲩⲡⲁⲣⲁⲡⲧⲱⲙⲁ. ⲉⲓⲉ̀ϯ ⲛ̀ⲟⲩⲙⲕⲁϩ ⲛⲁϩⲣⲉⲛ ⲡⲉϥϩⲟ ⲛ̀ⲑⲟϥ ϥⲛⲁⲙⲟⲩ. ϫⲉ ⲙ̀ⲡⲉⲕⲧⲟⲩⲛⲓⲁⲧϥ ⲉ̀ⲃⲟⲗ ⲟⲩⲟϩ ⲉϥⲉ̀ⲙⲟⲩ ϧⲉⲛ ⲛⲉϥⲛⲟⲃⲓ ϫⲉ ⲟⲩⲏⲓ ⲛ̀ⲛⲟⲩⲉⲣⲫⲙⲟⲩⲓ ⲛ̀ⲛⲉϥⲙⲉⲑⲙⲏⲓ ⲉⲧⲁϥⲁⲓⲧⲟⲩ. ⲟⲩⲟϩ ⲡⲉϥⲥⲛⲟϥ ϯⲛⲁⲕⲱϯ ⲛ̀ⲥⲱϥ ϧⲉⲛ ⲧⲉⲕϫⲓϫ.		And when the righteous turns away from his righteousness, and commits a trespass, and I shall bring punishment before him, he shall die, because thou didst not warn him: he shall even die in his sins, because his righteousness shall not be remembered; but his blood will I require at thine hand.	καὶ ἐν τῷ ἀποστρέφειν δίκαιον ἀπὸ τῶν δικαιοσυνῶν αὐτοῦ καὶ ποιήσῃ παράπτωµα καὶ δώσω τὴν βάσανον εἰς πρόσωπον αὐτοῦ, αὐτὸς ἀποθανεῖται, ὅτι οὐ διεστείλω αὐτῷ, καὶ ἐν ταῖς ἁµαρτίαις αὐτοῦ ἀποθανεῖται, διότι οὐ µὴ µνησθῶσιν αἱ δικαιοσύναι αὐτοῦ, ἃς ἐποίησεν, καὶ τὸ αἷµα αὐτοῦ ἐκ τῆς χειρός σου ἐκζητήσω.						
Ezekiel	3	03	21	OT	1. OT	Major Prophets	4. Major Prophets	04. Major Prophets	06. Ezekiel	ⲛ̀ⲑⲟⲕ ⲇⲉ ⲁⲕϣⲁⲛⲧⲟⲩⲛⲓⲁⲧϥ ⲙ̀ⲡⲓⲑⲙⲏⲓ ⲉ̀ⲃⲟⲗ. ϫⲉ ⲛ̀ⲧⲉϥϣ̀ⲧⲉⲙⲉⲣⲛⲟⲃⲓ. ⲟⲩⲟϩ ⲛ̀ⲑⲟϥ ⲛ̀ⲧⲉϥϣ̀ⲧⲉⲙⲉⲣⲛⲟⲃⲓ. ⲡⲓⲑⲙⲏⲓ ϥⲛⲁⲱⲛϧ ϧⲉⲛ ⲟⲩⲱⲛϧ ϫⲉ ⲁⲕⲧⲟⲩⲛⲓⲁⲧϥ ⲉ̀ⲃⲟⲗ. ⲟⲩⲟϩ ⲛ̀ⲑⲟⲕ ϩⲱⲕ ⲭⲛⲁⲛⲟϩⲉⲙ ⲛ̀ⲧⲉⲕⲯⲩⲭⲏ.		But if thou warn the righteous not to sin, and he sin not, the righteous shall surely live, because thou hast warned him; and thou shalt deliver thine own soul.	σὺ δὲ ἐὰν διαστείλῃ τῷ δικαίῳ τοῦ µὴ ἁµαρτεῖν, καὶ αὐτὸς µὴ ἁµάρτῃ, ὁ δίκαιος ζωῇ ζήσεται, ὅτι διεστείλω αὐτῷ, καὶ σὺ τὴν σεαυτοῦ ψυχὴν ῥύσῃ.						
Ezekiel	3	03	22	OT	1. OT	Major Prophets	4. Major Prophets	04. Major Prophets	06. Ezekiel	ⲟⲩⲟϩ ⲧϫⲓϫ ⲙ̀ⲡϭ̅ⲥ̅ ⲁⲥϣⲱⲡⲓ ϩⲓϫⲱⲓ. ⲡⲉϫⲁϥ ⲛⲏⲓ ϫⲉ ⲧⲱⲛⲕ ⲙⲁϣⲉ ⲛⲁⲕ ⲉ̀ⲃⲟⲗ ⲉ̀ⲧⲕⲟⲓ. ⲟⲩⲟϩ ϧⲉⲛ ⲡⲓⲙⲁ ⲉⲧⲉⲙ̀ⲙⲁⲩ ⲉⲩⲉ̀ⲥⲁϫⲓ ⲛⲉⲙⲁⲕ		And the hand of the Lord came upon me; and he said to me, Arise, and go forth into the plain, and there shalt thou be spoken to.	Καὶ ἐγένετο ἐπ’ ἐµὲ χεὶρ κυρίου, καὶ εἶπεν πρός µε Ἀνάστηθι καὶ ἔξελθε εἰς τὸ πεδίον, καὶ ἐκεῖ λαληθήσεται πρὸς σέ.						
Ezekiel	3	03	23	OT	1. OT	Major Prophets	4. Major Prophets	04. Major Prophets	06. Ezekiel	ⲁⲓⲧⲱⲟⲩⲛ ⲁⲓϣⲉ ⲛⲏⲓ ⲉ̀ⲃⲟⲗ ⲉ̀ⲧⲕⲟⲓ ⲟⲩⲟϩ ϩⲏⲡⲡⲉ ⲓⲥ ⲡⲓⲱⲟⲩ ⲛ̀ⲧⲉ ⲡϭ̅ⲥ̅ ⲛⲁϥⲟϩⲓ ⲉ̀ⲣⲁⲧϥ ϧⲉⲛ ⲡⲓⲙⲁ ⲉⲧⲉⲙ̀ⲙⲁⲩ. ⲕⲁⲧⲁ ϯϩⲟⲣⲁⲥⲓⲥ ⲉⲧⲁⲓⲛⲁⲩ ⲉ̀ⲣⲟⲥ. ⲟⲩⲟϩ ⲕⲁⲧⲁ ⲫⲣⲏϯ ⲙ̀ⲡⲓⲱⲟⲩ ⲉⲧⲁⲓⲛⲁⲩ ⲉ̀ⲣⲟϥ ϩⲓϫⲉⲛ ⲫⲓⲁⲣⲟ ⲭⲟⲩⲃⲁⲣ. ⲟⲩⲟϩ ⲉⲧⲁⲓⲛⲁⲩ ⲁⲓϩⲉⲓ ⲉ̀ϩⲣⲏⲓ ⲉ̀ϫⲉⲛ ⲡⲁϩⲟ.		And I arose, and went forth to the plain: and, behold, the glory of the Lord stood there, according to the vision, and according to the glory of the Lord, which I saw by the river of Chobar: and I fell on my face.	καὶ ἀνέστην καὶ ἐξῆλθον εἰς τὸ πεδίον, καὶ ἰδοὺ ἐκεῖ δόξα κυρίου εἱστήκει καθὼς ἡ ὅρασις καὶ καθὼς ἡ δόξα, ἣν εἶδον ἐπὶ τοῦ ποταµοῦ τοῦ Χοβαρ, καὶ πίπτω ἐπὶ πρόσωπόν µου.						
Ezekiel	3	03	24	OT	1. OT	Major Prophets	4. Major Prophets	04. Major Prophets	06. Ezekiel	ⲟⲩⲟϩ ⲟⲩⲡⲛ̅ⲁ̅ ⲁϥⲓ̀ ⲉ̀ϩⲣⲏⲓ ⲉ̀ϫⲱⲓ ⲁϥⲧⲁϩⲟ ⲙ̀ⲙⲟⲓ ⲉ̀ⲣⲁⲧ ⲉ̀ϫⲉⲛ ⲛⲁϭⲁⲗⲁⲩϫ. ⲟⲩⲟϩ ⲁϥⲥⲁϫⲓ ⲛⲉⲙⲏⲓ ⲉϥϫⲱ ⲙ̀ⲙⲟⲥ. ϫⲉ ϣⲉ ⲉ̀ϧⲟⲩⲛ ⲉⲑⲙⲏϯ ⲙ̀ⲡⲉⲕⲏⲓ. ⲟⲩⲟϩ ⲙⲁϣⲑⲁⲙ ⲉ̀ⲣⲟⲕ.		Then the Spirit came upon me, and set me on my feet, and spoke to me, and said to me, Go in, and shut thyself up in the midst of thine house.	καὶ ἦλθεν ἐπ’ ἐµὲ πνεῦµα καὶ ἔστησέν µε ἐπὶ πόδας µου, καὶ ἐλάλησεν πρός µε καὶ εἶπέν µοι Εἴσελθε καὶ ἐγκλείσθητι ἐν µέσῳ τοῦ οἴκου σου.						
Ezekiel	3	03	25	OT	1. OT	Major Prophets	4. Major Prophets	04. Major Prophets	06. Ezekiel	ⲛ̀ⲑⲟⲕ ϩⲱⲕ ⲡϣⲏⲣⲓ ⲙ̀ⲫⲣⲱⲙⲓ. ⲁⲓϯ ⲛ̀ϩⲁⲛⲥⲛⲁⲩϩ ⲉ̀ϩⲣⲏⲓ ⲉ̀ϫⲱⲕ. ⲟⲩⲟϩ ⲉⲩⲉ̀ⲙⲟⲩⲣ ⲙ̀ⲙⲟⲕ ⲛ̀ϧⲏⲧⲟⲩ.		And thou, son of man, behold, bonds are prepared for thee, and they shall bind thee with them, and thou shalt not come forth of the midst of them.	καὶ σύ, υἱὲ ἀνθρώπου, ἰδοὺ δέδονται ἐπὶ σὲ δεσµοί, καὶ δήσουσίν σε ἐν αὐτοῖς, καὶ οὐ µὴ ἐξέλθῃς ἐκ µέσου αὐτῶν.						
Ezekiel	3	03	26	OT	1. OT	Major Prophets	4. Major Prophets	04. Major Prophets	06. Ezekiel	ⲟⲩⲟϩ ϯⲛⲁⲙⲟⲩⲣ ⲙ̀ⲡⲉⲕⲗⲁⲥ ⲛ̀ⲕⲉⲣⲟⲙⲡⲓ. ⲟⲩⲟϩ ⲭⲛⲁϣⲱⲡⲓ ⲁⲛ ⲛⲱⲟⲩ ⲛ̀ⲟⲩⲣⲱⲙⲓ ⲛ̀ⲣⲉϥⲥⲟϩⲓ ⲉⲑⲃⲉ ϫⲉ ⲛ̀ⲑⲱⲟⲩ ⲟⲩⲏⲓ ⲛ̀ⲣⲉϥϯⲙⲃⲟⲛ ϫⲉ.		Also I will bind thy tongue, and thou shalt be dumb, and shalt not be to them a reprover: because it is a provoking house.	καὶ τὴν γλῶσσάν σου συνδήσω, καὶ ἀποκωφωθήσῃ καὶ οὐκ ἔσῃ αὐτοῖς εἰς ἄνδρα ἐλέγχοντα, διότι οἶκος παραπικραίνων ἐστίν.						
Ezekiel	3	03	27	OT	1. OT	Major Prophets	4. Major Prophets	04. Major Prophets	06. Ezekiel	ⲟⲩⲟϩ ϩⲟϯ ⲁⲓϣⲁⲛⲕⲏⲛ ⲉ̀ⲥⲁϫⲓ ⲛⲉⲙⲁⲕ ϯⲛⲁⲟⲩⲱⲛ ⲛ̀ⲣⲱⲕ ⲟⲩⲟϩ ⲥⲁϫⲓ ⲛⲉⲙⲱⲟⲩ. ϫⲉ ⲛⲁⲓ ⲛⲉ ⲛⲏ ⲉⲧⲉϥϫⲱ ⲙ̀ⲙⲱⲟⲩ ⲛ̀ϫⲉ ⲡϭ̅ⲥ̅. ϫⲉ ⲫⲏ ⲉⲧⲥⲱⲧⲉⲙ ⲙⲁⲣⲉϥⲥⲱⲧⲉⲙ. ⲟⲩⲟϩ ⲫⲏ ⲉⲧⲟⲓ ⲛ̀ⲁⲧⲥⲱⲧⲉⲙ. ⲙⲁⲣⲉϥⲓⲣⲓ ϫⲉ ⲟⲩⲏⲓ ⲛ̀ⲣⲉϥϯⲙⲃⲟⲛ ⲛⲉ		But when I speak to thee, I will open thy mouth, and thou shalt say to them, Thus saith the Lord, He that hears, let him hear; and he that is disobedient, let him be disobedient: because it is a provoking house.	καὶ ἐν τῷ λαλεῖν µε πρὸς σὲ ἀνοίξω τὸ στόµα σου, καὶ ἐρεῖς πρὸς αὐτούς Τάδε λέγει κύριος Ὁ ἀκούων ἀκουέτω, καὶ ὁ ἀπειθῶν ἀπειθείτω, διότι οἶκος παραπικραίνων ἐστίν.						
Ezekiel	4	04	1	OT	1. OT	Major Prophets	4. Major Prophets	04. Major Prophets	06. Ezekiel	ⲛ̀ⲑⲟⲕ ϩⲱⲕ ⲡϣⲏⲣⲓ ⲙ̀ⲫⲣⲱⲙⲓ ϭⲓ ⲛⲁⲕ ⲛ̀ⲟⲩⲧⲱⲃⲓ ⲭⲁⲥ ϧⲁⲧϩⲏ ⲙ̀ⲡⲉⲕϩⲟ ⲥϧⲁⲓ ⲉ̀ϫⲱⲥ ⲛ̀ϯⲡⲟⲗⲓⲥ ⲓⲗ̅ⲏ̅ⲙ̅.		And thou, son of man, take thee a brick, and thou shalt set it before thy face, and shalt portray on it the city, even Jerusalem.	Καὶ σύ, υἱὲ ἀνθρώπου, λαβὲ σεαυτῷ πλίνθον καὶ θήσεις αὐτὴν πρὸ προσώπου σου καὶ διαγράψεις ἐπ’ αὐτὴν πόλιν τὴν Ιερουσαληµ						
Ezekiel	4	04	2	OT	1. OT	Major Prophets	4. Major Prophets	04. Major Prophets	06. Ezekiel	ⲟⲩⲟϩ ⲕⲱϯ ⲉ̀ⲣⲟⲥ ⲛ̀ⲟⲩϩⲓϣⲁⲧⲥ. ⲟⲩⲟϩ ⲕⲱⲧ ⲛ̀ϩⲁⲛⲥⲟⲃⲧ ⲉ̀ⲣⲟⲥ. ⲟⲩⲟϩ ⲭⲱ ⲉ̀ϩⲣⲏⲓ ⲉ̀ϫⲱⲥ ⲛ̀ϩⲁⲛⲡⲁⲣⲉⲙⲃⲟⲗⲏ. ⲥⲉⲙⲛⲉ ⲛ̀ϩⲁⲛⲙⲁⲛⲭⲁⲥⲟⲑⲛⲉϥ ⲙ̀ⲡⲉⲥⲕⲱϯ.		And thou shalt besiege it, and build works against it, and throw up a mound round about it, and pitch camps against it, and set up engines round about.	καὶ δώσεις ἐπ’ αὐτὴν περιοχὴν καὶ οἰκοδοµήσεις ἐπ’ αὐτὴν προµαχῶνας καὶ περιβαλεῖς ἐπ’ αὐτὴν χάρακα καὶ δώσεις ἐπ’ αὐτὴν παρεµβολὰς καὶ τάξεις τὰς βελοστάσεις κύκλῳ·						
Ezekiel	4	04	3	OT	1. OT	Major Prophets	4. Major Prophets	04. Major Prophets	06. Ezekiel	ⲟⲩⲟϩ ⲛ̀ⲑⲟⲕ ϭⲓ ⲛⲁⲕ ⲛ̀ⲟⲩⲗⲁⲕⲉⲛⲧ ⲙ̀ⲃⲉⲛⲓⲡⲓ ⲙⲁⲑⲁⲙⲓⲟ ⲛⲁϥ ⲛ̀ⲟⲩϫⲱⲓ ⲙ̀ⲃⲉⲛⲓⲡⲓ ϧⲉⲛ ⲧⲉⲕⲙⲏϯ ⲛⲉⲙ ⲑⲙⲏϯ ⲛ̀ϯⲡⲟⲗⲓⲥ ⲟⲩⲟϩ ⲙⲁⲧⲁϫⲣⲉ ⲡⲉⲕϩⲟ ⲉ̀ϩⲣⲏⲓ ⲉ̀ϫⲱⲟⲩ ⲟⲩⲟϩ ⲉⲥⲉ̀ϣⲱⲡⲓ ⲉⲩⲟⲣϥ ⲉ̀ϧⲟⲩⲛ ⲫⲁⲓ ⲡⲉ ⲟⲩⲙⲏⲓⲛⲓ ⲛ̀ⲛⲉⲛϣⲏⲣⲓ ⲙ̀ⲡⲓⲥ̅ⲗ̅.		And take thou to thyself an iron pan, and thou shalt set it for an iron wall between thee and the city: and thou shalt set thy face against it, and it shall be in a siege, and thou shalt besiege it. This is a sign to the children of Israel.	καὶ σὺ λαβὲ σεαυτῷ τήγανον σιδηροῦν καὶ θήσεις αὐτὸ τοῖχον σιδηροῦν ἀνὰ µέσον σοῦ καὶ ἀνὰ µέσον τῆς πόλεως καὶ ἑτοιµάσεις τὸ πρόσωπόν σου ἐπ’ αὐτήν, καὶ ἔσται ἐν συγκλεισµῷ, καὶ συγκλείσεις αὐτήν· σηµεῖόν ἐστιν τοῦτο τοῖς υἱοῖς Ισραηλ. —						
Ezekiel	4	04	4	OT	1. OT	Major Prophets	4. Major Prophets	04. Major Prophets	06. Ezekiel	ⲛ̀ⲑⲟⲕ ϩⲱⲕ ⲭⲛⲁⲛⲕⲟⲧ ⲉ̀ϫⲉⲛ ⲡⲉⲕⲥⲫⲓⲣ ⲛ̀ϫⲁϭⲏ ⲭⲱ ⲛ̀ⲛⲓⲁⲇⲓⲕⲓⲁ ⲛ̀ⲧⲉ ⲡⲏⲓ ⲙ̀ⲡⲓⲥ̅ⲗ̅ ⲉ̀ϩⲣⲏⲓ ⲉ̀ϫⲱϥ. ⲕⲁⲧⲁ ⲧⲏⲡⲓ ⲛ̀ⲛⲓⲉϩⲟⲟⲩ. ⲣ̅ ⲛⲉⲙ ⲛ̅ ⲛ̀ⲉϩⲟⲟⲩ. ⲛⲏ ⲉⲧⲉⲕⲛⲁⲁⲓⲧⲟⲩ ⲭⲛⲕⲟⲧ ⲉ̀ϩⲣⲏⲓ ⲉ̀ϫⲱϥ. ⲟⲩⲟϩ ⲁ̀ⲛⲟⲕ ϩⲱ ⲉⲓⲉ̀ϭⲓ ⲛ̀ⲛⲟⲩⲁⲇⲓⲕⲓⲁ.		And thou shalt lie upon thy left side, and lay the iniquities of the house of Israel upon it, according to the number of the hundred and fifty days during which thou shalt lie upon it: and thou shalt bear their iniquities.	καὶ σὺ κοιµηθήσῃ ἐπὶ τὸ πλευρόν σου τὸ ἀριστερὸν καὶ θήσεις τὰς ἀδικίας τοῦ οἴκου Ισραηλ ἐπ’ αὐτοῦ κατὰ ἀριθµὸν τῶν ἡµερῶν πεντήκοντα καὶ ἑκατόν, ἃς κοιµηθήσῃ ἐπ’ αὐτοῦ, καὶ λήµψῃ τὰς ἀδικίας αὐτῶν.						
Ezekiel	4	04	5	OT	1. OT	Major Prophets	4. Major Prophets	04. Major Prophets	06. Ezekiel	ⲟⲩⲟϩ ⲟⲛ ⲁ̀ⲛⲟⲕ ϯⲛⲟⲩ ⲁⲓϯ ⲛⲁⲕ ⲛ̀ⲧⲟⲩⲏⲡⲓ ⲛ̀ⲉϩⲟⲟⲩ ⲣ̅ ⲛⲉⲙ ϥ̅ ⲛ̀ⲉϩⲟⲟⲩ ⲟⲩⲟϩ ϭⲓ ⲛ̀ⲛⲓⲁⲇⲓⲕⲓⲁ ⲛ̀ⲧⲉ ⲡⲏⲓ ⲙ̀ⲡⲓⲥ̅ⲗ̅		For I have appointed thee their iniquities for a number of days, for a hundred and ninety days: so thou shalt bear the iniquities of the house of Israel.	καὶ ἐγὼ δέδωκά σοι τὰς δύο ἀδικίας αὐτῶν εἰς ἀριθµὸν ἡµερῶν ἐνενήκοντα καὶ ἑκατὸν ἡµέρας. καὶ λήµψῃ τὰς ἀδικίας τοῦ οἴκου Ισραηλ						
Ezekiel	4	04	6	OT	1. OT	Major Prophets	4. Major Prophets	04. Major Prophets	06. Ezekiel	ⲟⲩⲟϩ ϫⲱⲕ ⲉ̀ⲃⲟⲗ ⲛ̀ⲛⲁⲓ ⲟⲩⲟϩ ⲛ̀ⲕⲟⲧ ⲉ̀ϫⲉⲛ ⲡⲉⲕⲥⲫⲓⲣ ⲛ̀ⲟⲩⲓⲛⲁⲙ ⲟⲩⲟϩ ϭⲓ ⲛ̀ⲛⲓⲁⲇⲓⲕⲓⲁ ⲛ̀ⲧⲉ ⲡⲏⲓ ⲛ̀ⲓⲟⲩⲇⲁ ⲛ̀ⲙ̅ ⲛ̀ⲉϩⲟⲟⲩ ⲁⲓⲭⲱ ⲛⲁⲕ ⲙ̀ⲡⲓⲉϩⲟⲟⲩ ⲛ̀ⲟⲩⲣⲟⲙⲡⲓ.		And thou shalt accomplish this, and then shalt lie on thy right side, and shalt bear the iniquities of the house of Juda forty days: I have appointed thee a day for a year.	καὶ συντελέσεις ταῦτα πάντα· καὶ κοιµηθήσῃ ἐπὶ τὸ πλευρόν σου τὸ δεξιὸν καὶ λήµψῃ τὰς ἀδικίας τοῦ οἴκου Ιουδα τεσσαράκοντα ἡµέρας. ἡµέραν εἰς ἐνιαυτὸν τέθεικά σοι.						
Ezekiel	4	04	7	OT	1. OT	Major Prophets	4. Major Prophets	04. Major Prophets	06. Ezekiel	ⲟⲩⲟϩ ⲙⲁⲧⲁϫⲣⲉ ⲡⲉⲕϩⲟ ⲉ̀ϫⲉⲛ ⲡⲓⲟⲣϥ ⲉ̀ϧⲟⲩⲛ ⲛ̀ⲧⲉ ⲓⲗ̅ⲏ̅ⲙ̅ ⲟⲩ ⲙⲁⲧⲁϫⲣⲉ ⲡⲉⲕϣⲱⲃϣ ⲁⲣⲓⲡⲣⲟⲫⲏⲧⲉⲩⲓⲛ.		So thou shalt set thy face to the siege of Jerusalem, and shalt strengthen thine arm, and shalt prophesy against it.	καὶ εἰς τὸν συγκλεισµὸν Ιερουσαληµ ἑτοιµάσεις τὸ πρόσωπόν σου καὶ τὸν βραχίονά σου στερεώσεις καὶ προφητεύσεις ἐπ’ αὐτήν.						
Ezekiel	4	04	8	OT	1. OT	Major Prophets	4. Major Prophets	04. Major Prophets	06. Ezekiel	ⲟⲩⲟϩ ϩⲏⲡⲡⲉ ⲁ̀ⲛⲟⲕ ⲁⲓⲭⲱ ⲉ̀ϩⲣⲏⲓ ⲉ̀ϫⲱⲕ ⲛ̀ϩⲁⲛⲥⲛⲁⲩϩ ⲟⲩⲟϩ ⲛ̀ⲛⲉⲕⲫⲱⲛϩ ϩⲓϫⲉⲛ ⲡⲉⲕⲥⲫⲓⲣ ϣⲁⲧⲟⲩϫⲱⲕ ⲉ̀ⲃⲟⲗ ⲛ̀ϫⲉ ⲛⲓⲉϩⲟⲟⲩ ⲛ̀ⲧⲉ ⲡⲉⲕⲟⲣϥ ⲉ̀ϧⲟⲩⲛ.		And, behold, I have prepared bonds for thee, land thou mayest not turn from thy one side to the other, until the days of thy siege shall be accomplished.	καὶ ἐγὼ ἰδοὺ δέδωκα ἐπὶ σὲ δεσµούς, καὶ µὴ στραφῇς ἀπὸ τοῦ πλευροῦ σου ἐπὶ τὸ πλευρόν σου, ἕως οὗ συντελεσθῶσιν αἱ ἡµέραι τοῦ συγκλεισµοῦ σου. —						
Ezekiel	4	04	9	OT	1. OT	Major Prophets	4. Major Prophets	04. Major Prophets	06. Ezekiel	ⲟⲩⲟϩ ⲛ̀ⲑⲟⲕ ϩⲱⲕ ϭⲓ ⲛⲁⲕ ⲛ̀ϩⲁⲛⲥⲟⲩⲟ ⲛⲉⲙ ϩⲁⲛⲓⲱⲧ. ⲛⲉⲙ ϩⲁⲛⲉⲣⲉⲅⲙⲟⲥ ⲛⲉⲙ ⲟⲩⲁⲣϣⲓⲛ ⲛⲉⲙ ⲟⲩⲕⲉⲅⲭⲉⲃⲟⲥ. ⲛⲉⲙ ⲟⲩⲃⲟϯ ⲉⲕⲉ̀ⲭⲱ ⲙ̀ⲙⲱⲟⲩ ϧⲉⲛ ⲟⲩⲥⲕⲉⲩⲟⲥ ⲙ̀ⲃⲉⲗϫ ⲉⲕⲉ̀ⲑⲁⲙⲓⲱⲟⲩ ⲛⲁⲕ ⲛ̀ϩⲁⲛⲱⲓⲕ ⲕⲁⲧⲁ ⲧⲏⲡⲓ ⲛ̀ⲛⲓⲉϩⲟⲟⲩ ⲛⲏ ⲉⲧⲉⲕⲛⲁⲛⲕⲟⲧ ⲛ̀ⲑⲟⲕ ⲉ̀ϫⲉⲛ ⲡⲉⲕⲥⲫⲓⲣ. ⲣ̅ ⲛⲉⲙ ϥ̅ ⲛ̀ⲉϩⲟⲟⲩ ⲛⲉ ⲉⲕⲉ̀ⲟⲩⲱⲙⲟⲩ.		Take thou also to thee wheat, and barley, and beans, and lentils, and millet, and bread-corn; and thou shalt cast them into one earthen vessel, and shalt make them into loaves for thyself; and thou shalt eat them a hundred and ninety days, according to the number of the days during which thou sleepest on thy side.	καὶ σὺ λαβὲ σεαυτῷ πυροὺς καὶ κριθὰς καὶ κύαµον καὶ φακὸν καὶ κέγχρον καὶ ὄλυραν καὶ ἐµβαλεῖς αὐτὰ εἰς ἄγγος ἓν ὀστράκινον καὶ ποιήσεις αὐτὰ σαυτῷ εἰς ἄρτους, καὶ κατ’ ἀριθµὸν τῶν ἡµερῶν, ἃς σὺ καθεύδεις ἐπὶ τοῦ πλευροῦ σου, ἐνενήκοντα καὶ ἑκατὸν ἡµέρας φάγεσαι αὐτά.						
Ezekiel	4	04	10	OT	1. OT	Major Prophets	4. Major Prophets	04. Major Prophets	06. Ezekiel	ⲟⲩⲟϩ ⲧⲉⲕϧⲣⲉ ⲉⲕⲉ̀ⲟⲩⲱⲙ ⲙ̀ⲙⲟⲥ ϧⲉⲛ ⲟⲩϣⲓ. ⲕ̅ ⲛ̀ⲥⲓⲕⲗⲟⲥ ⲛ̀ϩⲣⲏϣⲓ ⲉⲕⲉ̀ⲟⲩⲟⲙⲟⲩ ϧⲉⲛ ⲡⲓⲉϩⲟⲟⲩ		And thou shalt eat thy food by weight, twenty shekels a day: from time to time shalt thou eat them.	καὶ τὸ βρῶµά σου, ὃ φάγεσαι, ἐν σταθµῷ εἴκοσι σίκλους τὴν ἡµέραν· ἀπὸ καιροῦ ἕως καιροῦ φάγεσαι αὐτά.						
