book	chapter	chapter-zfilled	verse	testament	testament-indexed	section	section-indexed	section-indexed-no-testament	book-indexed	Bohairic	Sahidic	English	Greek	Fayyumic	Akhmimic	OldBohairic	Mesokemic	DialectP	Lycopolitan
Ezekiel	12	12	3	OT	1. OT	Major Prophets	4. Major Prophets	04. Major Prophets	06. Ezekiel	ⲛ̀ⲑⲟⲕ ϩⲱⲕ ⲡϣⲏⲣⲓ ⲙ̀ⲫⲣⲱⲙⲓ. ⲙⲁⲑⲁⲙⲓⲟ ⲛⲁⲕ ⲛ̀ϩⲁⲛⲥⲕⲉⲩⲟⲥ ⲛ̀ⲉⲭⲙⲁⲗⲱⲥⲓⲁ ⲙ̀ⲡⲟⲩⲙ̀ⲑⲟ ⲉ̀ⲃⲟⲗ ⲙ̀ⲡⲓⲉϩⲟⲟⲩ. ⲟⲩⲟϩ ⲉⲩⲛⲁⲉⲣⲉⲭⲙⲁⲗⲱⲧⲓⲍⲓⲛ ⲙ̀ⲙⲟⲕ ⲉ̀ⲃⲟⲗ ϧⲉⲛ ⲡⲉⲕⲙⲁ. ϣⲁ ⲉ̀ϧⲣⲏⲓ ⲉ̀ⲕⲉⲙⲁ. ⲙ̀ⲡⲟⲩⲙ̀ⲑⲟ ⲉ̀ⲃⲟⲗ ϩⲓⲛⲁ ⲛ̀ⲧⲟⲩⲛⲁⲩ. ⲉⲑⲃⲉ ϫⲉ ⲟⲩⲏⲓ ⲛ̀ⲣⲉϥϯϫⲱⲛⲧ ⲛⲉ.		Thou therefore, son of man, prepare thyself baggage for going into captivity by day in their sight; and thou shalt be led into captivity from thy place into another place in their sight; that they may see that it is a provoking house.	καὶ σύ, υἱὲ ἀνθρώπου, ποίησον σεαυτῷ σκεύη αἰχµαλωσίας ἡµέρας ἐνώπιον αὐτῶν καὶ αἰχµαλωτευθήσῃ ἐκ τοῦ τόπου σου εἰς ἕτερον τόπον ἐνώπιον αὐτῶν, ὅπως ἴδωσιν, διότι οἶκος παραπικραίνων ἐστίν.						
Ezekiel	12	12	4	OT	1. OT	Major Prophets	4. Major Prophets	04. Major Prophets	06. Ezekiel	ⲟⲩⲟϩ ⲉⲕⲉ̀ⲓⲛⲓ ⲉ̀ⲃⲟⲗ ⲛ̀ϩⲁⲛⲥⲕⲉⲩⲏ ⲛ̀ⲉⲭⲙⲁⲗⲱⲥⲓⲁ ⲙ̀ⲡⲓⲉϩⲟⲟⲩ ⲙ̀ⲡⲉⲙ̀ⲑⲟ ⲛ̀ⲛⲟⲩⲃⲁⲗ. ⲟⲩⲟϩ ⲛ̀ⲑⲟⲕ ⲉⲕⲉ̀ⲓ̀ ⲉ̀ⲃⲟⲗ ⲙ̀ⲫⲛⲁⲩ ⲛ̀ϩⲁⲛⲁⲣⲟⲩϩⲓ ⲙ̀ⲡⲟⲩⲙ̀ⲑⲟ ⲉ̀ⲃⲟⲗ. ⲙ̀ⲫⲣⲏϯ ⲉ̀ϣⲁϥⲓ̀ ⲉ̀ⲃⲟⲗ ⲛ̀ϫⲉ ⲟⲩⲉⲭⲙⲁⲗⲱⲧⲟⲥ.		And thou shalt carry forth thy baggage, baggage for captivity, by day before their eyes: and thou shalt go forth at even, as a captive goes forth, in their sight.	καὶ ἐξοίσεις τὰ σκεύη σου ὡς σκεύη αἰχµαλωσίας ἡµέρας κατ’ ὀφθαλµοὺς αὐτῶν, καὶ σὺ ἐξελεύσῃ ἑσπέρας ὡς ἐκπορεύεται αἰχµάλωτος·						
Ezekiel	12	12	5	OT	1. OT	Major Prophets	4. Major Prophets	04. Major Prophets	06. Ezekiel	ϣⲟⲕϩ ⲛⲁⲕ ⲉⲩϫⲟⲓ. ⲛ̀ⲧⲉⲕⲓ ⲉ̀ⲃⲟⲗ ⲛ̀ϧⲏⲧⲥ		Dig for thyself into the wall of the house, and thou shalt pass through it in their sight:	ἐνώπιον αὐτῶν διόρυξον σεαυτῷ εἰς τὸν τοῖχον καὶ διεξελεύσῃ δι’ αὐτοῦ·						
Ezekiel	12	12	6	OT	1. OT	Major Prophets	4. Major Prophets	04. Major Prophets	06. Ezekiel	ⲙ̀ⲡⲟⲩⲙ̀ⲑⲟ ⲉ̀ⲃⲟⲗ. ⲉⲩⲱⲗⲓ ⲙ̀ⲙⲟⲕ ϩⲓϫⲉⲛ ⲛⲟⲩⲛⲁϩⲃⲓ ⲉⲕⲉ̀ⲓ̀ ⲉ̀ⲃⲟⲗ ⲉⲕⲭⲏⲡ ϩⲱⲃⲥ ⲙ̀ⲡⲉⲕϩⲟ. ⲟⲩⲟϩ ⲙ̀ⲡⲉⲣϫⲟⲩϣⲧ ⲉ̀ⲡⲕⲁϩⲓ. ⲉ̀ⲃⲟⲗ ϫⲉ ⲁⲓⲭⲁⲕ ⲛ̀ⲟⲩⲙⲏⲓⲛⲓ ⲙ̀ⲡⲉⲙ̀ⲑⲟ ⲉ̀ⲃⲟⲗ ⲙ̀ⲡⲏⲓ ⲙ̀ⲡⲓⲥ̅ⲗ̅.		thou shalt be lifted up on men’s shoulders, and shalt go forth in secret: thou shalt cover thy face, and shalt not see the ground: because I have made thee a sign to the house of Israel.	ἐνώπιον αὐτῶν ἐπ’ ὤµων ἀναληµφθήσῃ καὶ κεκρυµµένος ἐξελεύσῃ, τὸ πρόσωπόν σου συγκαλύψεις καὶ οὐ µὴ ἴδῃς τὴν γῆν· διότι τέρας δέδωκά σε τῷ οἴκῳ Ισραηλ.						
Ezekiel	12	12	7	OT	1. OT	Major Prophets	4. Major Prophets	04. Major Prophets	06. Ezekiel	ⲟⲩⲟϩ ⲁⲓⲓⲣⲓ ⲙ̀ⲡⲁⲓⲣⲏϯ ⲕⲁⲧⲁ ⲫⲣⲏϯ ⲛ̀ϩⲱⲃ ⲛⲓⲃⲉⲛ ⲉⲧⲁϥϩⲉⲛϩⲟⲛⲧ ⲙ̀ⲙⲱⲟⲩ. ⲁⲓⲓⲛⲓ ⲉ̀ⲃⲟⲗ ⲛ̀ⲛⲓⲥⲕⲉⲩⲏ ⲛ̀ϯⲉⲭⲙⲁⲗⲱⲥⲓⲁ ⲙ̀ⲡⲓⲉϩⲟⲟⲩ. ⲟⲩⲟϩ ⲣⲟⲩϩⲓ ⲁⲓϣⲟⲕ ⲛⲏⲓ ⲛ̀ϯϫⲟⲓ. ⲟⲩⲟϩ ⲁⲓⲓ̀ ⲉ̀ⲃⲟⲗ ⲉⲓⲕⲏⲡ. ⲉⲩⲱⲗⲓ ⲙ̀ⲙⲟⲓ ϩⲓϫⲉⲛ ⲛⲟⲩⲛⲁϩⲃⲓ ⲙ̀ⲡⲟⲩⲙⲑⲟ ⲉ̀ⲃⲟⲗ.		And I did thus according to all that he commanded me; and I carried forth my baggage for captivity by day, and in the evening I dug through the wall for myself, and went out secretly; I was taken up on men’s shoulders before them.	καὶ ἐποίησα οὕτως κατὰ πάντα, ὅσα ἐνετείλατό µοι, καὶ σκεύη ἐξήνεγκα ὡς σκεύη αἰχµαλωσίας ἡµέρας καὶ ἑσπέρας διώρυξα ἐµαυτῷ τὸν τοῖχον καὶ κεκρυµµένος ἐξῆλθον, ἐπ’ ὤµων ἀνελήµφθην ἐνώπιον αὐτῶν. —						
Ezekiel	12	12	8	OT	1. OT	Major Prophets	4. Major Prophets	04. Major Prophets	06. Ezekiel	ⲡⲥⲁϫⲓ ⲙ̀ⲡϭ̅ⲥ̅ ⲁϥϣⲱⲡⲓ ϩⲁⲣⲟⲓ ⲙ̀ⲫⲛⲁⲩ ⲛ̀ϩⲁⲛⲁⲧⲟⲟⲩⲓ ⲉϥϫⲱ ⲙ̀ⲙⲟⲥ.		And the word of the Lord came to me in the morning, saying,	καὶ ἐγένετο λόγος κυρίου πρός µε τὸ πρωὶ λέγων						
Ezekiel	12	12	9	OT	1. OT	Major Prophets	4. Major Prophets	04. Major Prophets	06. Ezekiel	ϫⲉ ⲡϣⲏⲣⲓ ⲙ̀ⲫⲣⲱⲙⲓ ⲙ̀ⲡⲟⲩϫⲟⲥ ⲛⲁⲕ ⲛ̀ϫⲉ ⲛⲁ ⲡⲏⲓ ⲙ̀ⲡⲓⲥ̅ⲗ̅. ⲛⲁⲓ ⲉⲧϯϫⲱⲛⲧ. ϫⲉ ⲉⲧⲁⲕⲉⲣⲟⲩ ⲛ̀ⲑⲟⲕ ϩⲓ ⲛⲁⲓ.		Son of man, have not the house of Israel, the provoking house, said to thee, What doest thou?	Υἱὲ ἀνθρώπου, οὐκ εἶπαν πρὸς σὲ ὁ οἶκος τοῦ Ισραηλ οἶκος ὁ παραπικραίνων Τί σὺ ποιεῖς;						
Ezekiel	12	12	10	OT	1. OT	Major Prophets	4. Major Prophets	04. Major Prophets	06. Ezekiel	ⲟⲩⲟϩ ⲁϫⲟⲥ ⲛⲱⲟⲩ. ϫⲉ ⲛⲁⲓ ⲛⲉ ⲛⲏ ⲉⲧⲉϥϫⲱ ⲙ̀ⲙⲱⲟⲩ ⲛ̀ϫⲉ ⲡϭ̅ⲥ̅. ϫⲉ ⲡⲓⲁⲣⲭⲱⲛ ⲛⲉⲙ ⲡⲓϩⲩⲅⲟⲩⲙⲉⲛⲟⲥ ⲉⲧϧⲉⲛ ⲓⲗ̅ⲏ̅ⲙ̅. ⲛⲉⲙ ⲡⲏⲓ ⲧⲏⲣϥ ⲙ̀ⲡⲓⲥ̅ⲗ̅. ⲛⲏ ⲉⲧⲉⲕϣⲟⲡ. ϧⲉⲛ ⲧⲟⲩⲙⲏϯ.		Say to them, Thus saith the Lord God, the Prince and the Ruler in Israel, even to all the house of Israel who are in the midst of them:	εἰπὸν πρὸς αὐτούς Τάδε λέγει κύριος κύριος Ὁ ἄρχων καὶ ὁ ἀφηγούµενος ἐν Ιερουσαληµ καὶ παντὶ οἴκῳ Ισραηλ, οἵ εἰσιν ἐν µέσῳ αὐτῶν,						
Ezekiel	12	12	11	OT	1. OT	Major Prophets	4. Major Prophets	04. Major Prophets	06. Ezekiel	ⲁϫⲟⲥ ⲛⲱⲟⲩ ϫⲉ ϩⲁⲛⲙⲏⲓⲛⲓ ⲛⲏ ⲉ̀ϯⲣⲁ ⲙ̀ⲙⲱⲟⲩ ⲁ̀ⲛⲟⲕ. ⲙ̀ⲫⲣⲏϯ ⲉⲧⲁⲓⲁⲓⲥ. ⲡⲁⲓⲣⲏϯ ⲡⲉⲑⲛⲁϣⲱⲡⲓ ⲛⲱⲟⲩ ϧⲉⲛ ⲡⲓⲟⲩⲱⲧⲉⲃ ⲉ̀ⲃⲟⲗ. ⲟⲩⲟϩ ⲥⲉⲛⲁϣⲉ ⲛⲱⲟⲩ ⲉ̀ⲟⲩⲉⲭⲙⲁⲗⲱⲥⲓⲁ.		say, I am performing signs: as I have done, so shall it be to him: they shall go into banishment and captivity.	εἰπὸν ὅτι ἐγὼ τέρατα ποιῶ ἐν µέσῳ αὐτῆς· ὃν τρόπον πεποίηκα, οὕτως ἔσται αὐτοῖς· ἐν µετοικεσίᾳ καὶ ἐν αἰχµαλωσίᾳ πορεύσονται,						
Ezekiel	12	12	12	OT	1. OT	Major Prophets	4. Major Prophets	04. Major Prophets	06. Ezekiel	ⲟⲩⲟϩ ⲡⲟⲩⲁⲣⲭⲱⲛ ⲉⲩⲛⲁⲟⲗϥ ϩⲓϫⲉⲛ ⲧⲟⲩⲛⲁϩⲃⲓ ϧⲉⲛ ⲧⲉⲥⲙⲏϯ. ⲟⲩⲟϩ ⲉϥⲉ̀ⲓ̀ ⲉ̀ⲃⲟⲗ ϧⲉⲛ ⲟⲩϫⲟⲓ ⲉϥⲭⲏⲡ. ⲉϥⲉ̀ϣⲟⲕⲓ ⲛ̀ϯϫⲟⲓ ⲉ̀ⲑⲣⲉϥⲓ̀ ⲉ̀ⲃⲟⲗ ⲛ̀ϧⲏⲧⲥ. ⲟⲩⲟϩ ⲉϥⲉ̀ϩⲱⲃⲥ ⲙ̀ⲡⲉϥϩⲟ. ⲉ̀ϣ̀ⲧⲉⲙⲛⲁⲩ ⲉ̀ⲣⲟϥ ⲛ̀ϫⲉ ⲣⲱⲙⲓ. ⲛ̀ⲑⲟϥ ϩⲱϥ ⲉϥⲉ̀ⲛⲁⲩ ⲁⲛ ⲉ̀ⲡⲕⲁϩⲓ.		And the prince in the midst of them shall be borne upon shoulders, and shall go forth in secret through the wall, and shall dig so that he may go forth thereby: he shall cover his face, that he may not be seen by any eye, and he himself shall not see the ground.	καὶ ὁ ἄρχων ἐν µέσῳ αὐτῶν ἐπ’ ὤµων ἀρθήσεται καὶ κεκρυµµένος ἐξελεύσεται διὰ τοῦ τοίχου, καὶ διορύξει τοῦ ἐξελθεῖν αὐτὸν δι’ αὐτοῦ· τὸ πρόσωπον αὐτοῦ συγκαλύψει, ὅπως µὴ ὁραθῇ ὀφθαλµῷ, καὶ αὐτὸς τὴν γῆν οὐκ ὄψεται.						
Ezekiel	12	12	13	OT	1. OT	Major Prophets	4. Major Prophets	04. Major Prophets	06. Ezekiel	ⲟⲩⲟϩ ϯⲛⲁⲫⲱⲣϣ ⲛ̀ⲧⲁⲥⲁⲅⲏⲓⲛⲓ ⲉ̀ϩⲣⲏⲓ ⲉ̀ϫⲱⲟⲩ. ⲉⲩⲛⲁⲁⲙⲁϩⲓ ⲉ̀ϫⲱⲟⲩ ϧⲉⲛ ⲡⲓⲙⲁ ⲉⲧⲁⲓⲟⲣϥⲟⲩ ⲉ̀ϧⲟⲩⲛ ⲉ̀ⲣⲟϥ. ⲟⲩⲟϩ ⲉⲓⲉ̀ⲟⲗⲧⲟⲩ ⲉ̀ϧⲣⲏⲓ ⲉ̀ⲑⲃⲁⲃⲩⲗⲱⲛ ⲉ̀ⲡⲕⲁϩⲓ ⲛ̀ⲛⲓⲭⲁⲗⲇⲉⲟⲥ. ⲛⲉϥⲛⲁⲩ ⲁⲛ ⲉ̀ⲡⲕⲁϩⲓ. ⲟⲩⲟϩ ϥⲛⲁⲙⲟⲩ ϧⲉⲛ ⲡⲓⲙⲁ ⲉⲧⲉⲙ̀ⲙⲁⲩ.		And I will spread out my net upon him, and he shall be caught in my toils: and I will bring him to Babylon to the land of the Chaldeans; but he shall not see it, though he shall die there.	καὶ ἐκπετάσω τὸ δίκτυόν µου ἐπ’ αὐτόν, καὶ συλληµφθήσεται ἐν τῇ περιοχῇ µου, καὶ ἄξω αὐτὸν εἰς Βαβυλῶνα εἰς γῆν Χαλδαίων, καὶ αὐτὴν οὐκ ὄψεται καὶ ἐκεῖ τελευτήσει.						
Ezekiel	12	12	14	OT	1. OT	Major Prophets	4. Major Prophets	04. Major Prophets	06. Ezekiel	ⲟⲩⲟϩ ⲛⲏ ⲉⲧϧⲉⲛ ⲡⲉϥⲕⲱϯ ⲧⲏⲣⲟⲩ ⲉⲧⲉⲣⲃⲟⲏⲑⲓⲛ ⲉ̀ⲣⲟϥ. ⲛⲉⲙ ⲟⲩⲟⲛ ⲛⲓⲃⲉⲛ ⲉⲧϯ ⲧⲟⲧϥ. ϯⲛⲁϫⲟⲣⲟⲩ ⲛⲉⲙ ⲑⲏⲛⲟⲩ ⲛⲓⲃⲉⲛ. ⲟⲩⲟϩ ⲉⲓⲉ̀ϫⲱϣ ⲛ̀ⲟⲩⲥⲏϥⲓ ⲥⲁⲫⲁϩⲟⲩ ⲙ̀ⲙⲱⲟⲩ.		And I will scatter to every wind all his assistants round about him, and all that help him; and I will draw out a sword after them;	καὶ πάντας τοὺς κύκλῳ αὐτοῦ τοὺς βοηθοὺς αὐτοῦ καὶ πάντας τοὺς ἀντιλαµβανοµένους αὐτοῦ διασπερῶ εἰς πάντα ἄνεµον καὶ ῥοµφαίαν ἐκκενώσω ὀπίσω αὐτῶν·						
Ezekiel	12	12	15	OT	1. OT	Major Prophets	4. Major Prophets	04. Major Prophets	06. Ezekiel	ⲟⲩⲟϩ ⲛ̀ⲧⲟⲩⲉⲙⲓ ϫⲉ ⲁ̀ⲛⲟⲕ ⲡⲉ ⲡϭ̅ⲥ̅. ϧⲉⲛ ⲡϫⲓⲛⲑⲣⲓϫⲟⲣⲟⲩ ⲉ̀ⲃⲟⲗ ϧⲉⲛ ⲛⲓⲉⲑⲛⲟⲥ. ⲛ̀ⲧⲁϫⲟⲣⲟⲩ ⲉ̀ⲃⲟⲗ ϧⲉⲛ ⲛⲓⲭⲱⲣⲁ.		And they shall know that I am the Lord, when I have scattered them among the nations; and I will disperse them in the countries.	καὶ γνώσονται διότι ἐγὼ κύριος ἐν τῷ διασκορπίσαι µε αὐτοὺς ἐν τοῖς ἔθνεσιν, καὶ διασπερῶ αὐτοὺς ἐν ταῖς χώραις.						
Ezekiel	12	12	16	OT	1. OT	Major Prophets	4. Major Prophets	04. Major Prophets	06. Ezekiel	ⲟⲩⲟϩ ⲉⲓⲉ̀ⲥⲱϫⲡ ⲉ̀ⲃⲟⲗ ⲛ̀ϧⲏⲧⲟⲩ ⲛ̀ϩⲁⲛⲣⲱⲙⲓ ϧⲉⲛ ⲟⲩⲏⲡⲓ. ϧⲉⲛ ⲧⲥⲏϥⲓ ⲛⲉⲙ ⲫⲙⲟⲩ. ⲛⲉⲙ ⲡⲓϩⲃⲱⲛ ϩⲓⲛⲁ ⲉⲩⲉ̀ⲙⲟⲩⲛⲕ ⲛ̀ⲛⲟⲩⲁⲛⲟⲙⲓⲁ ⲧⲏⲣⲟⲩ. ϧⲉⲛ ⲛⲓⲉⲑⲛⲟⲥ. ⲡⲓⲙⲁ ⲉ̀ϣⲁⲩϣⲉ ⲉ̀ϧⲟⲩⲛ ⲉ̀ⲣⲟϥ. ⲟⲩⲟϩ ⲛ̀ⲧⲟⲩⲉⲙⲓ ϫⲉ ⲁ̀ⲛⲟⲕ ⲡⲉ ⲡϭ̅ⲥ̅.		And I will leave of them a few men in number spared from the sword, and from famine, and pestilence; that they may declare all their iniquities among the nations whither they have gone; and they shall know that I am the Lord.	καὶ ὑπολείψοµαι ἐξ αὐτῶν ἄνδρας ἀριθµῷ ἐκ ῥοµφαίας καὶ ἐκ λιµοῦ καὶ ἐκ θανάτου, ὅπως ἐκδιηγῶνται πάσας τὰς ἀνοµίας αὐτῶν ἐν τοῖς ἔθνεσιν, οὗ εἰσήλθοσαν ἐκεῖ· καὶ γνώσονται ὅτι ἐγὼ κύριος. —						
Ezekiel	12	12	17	OT	1. OT	Major Prophets	4. Major Prophets	04. Major Prophets	06. Ezekiel	ⲡⲥⲁϫⲓ ⲙ̀ⲡϭ̅ⲥ̅ ⲁϥϣⲱⲡⲓ ϩⲁⲣⲟⲓ ⲉϥϫⲱ ⲙ̀ⲙⲟⲥ.		And the word of the Lord came to me, saying,	καὶ ἐγένετο λόγος κυρίου πρός µε λέγων						
Ezekiel	12	12	18	OT	1. OT	Major Prophets	4. Major Prophets	04. Major Prophets	06. Ezekiel	ϫⲉ ⲡϣⲏⲣⲓ ⲙ̀ⲫⲣⲱⲙⲓ. ⲁⲟⲩⲱⲙ ⲙ̀ⲡⲉⲕⲱⲓⲕ ϧⲉⲛ ⲟⲩⲙⲕⲁϩ ⲛ̀ϩⲏⲧ. ⲟⲩⲟϩ ⲥⲱ ⲡⲉⲕⲙⲱⲟⲩ ϧⲉⲛ ⲟⲩⲃⲁⲥⲁⲛⲟⲥ. ⲛⲉⲙ ⲟⲩϩⲟϫϩⲉϫ.		Son of man, eat thy bread with sorrow, and drink thy water with torment and affliction.	Υἱὲ ἀνθρώπου, τὸν ἄρτον σου µετ’ ὀδύνης φάγεσαι καὶ τὸ ὕδωρ σου µετὰ βασάνου καὶ θλίψεως πίεσαι						
Ezekiel	12	12	19	OT	1. OT	Major Prophets	4. Major Prophets	04. Major Prophets	06. Ezekiel	ⲟⲩⲟϩ ⲁϫⲟⲥ ⲛⲁϩⲣⲉⲛ ⲡⲓⲗⲁⲟⲥ ⲛ̀ⲧⲉ ⲡⲕⲁϩⲓ. ϫⲉ ⲛⲁⲓ ⲛⲉ ⲛⲏ ⲉⲧⲉϥϫⲱ ⲙ̀ⲙⲱⲟⲩ ⲛ̀ϫⲉ ⲡϭ̅ⲥ̅. ⲛ̀ⲛⲏ ⲉⲧϣⲟⲡ ϧⲉⲛ ⲓⲗ̅ⲏ̅ⲙ̅. ϫⲉ ⲥⲉⲛⲁⲟⲩⲱⲙ ⲙ̀ⲡⲟⲩⲱⲓⲕ ϧⲉⲛ ⲟⲩϭⲣⲟϩ. ⲟⲩⲟϩ ⲉⲩⲉ̀ⲥⲱ ⲙ̀ⲡⲟⲩⲙⲱⲟⲩ ϧⲉⲛ ⲟⲩⲙⲕⲁϩ ⲛ̀ϩⲏⲧ. ϩⲓⲛⲁ ⲉⲣⲉ ⲡⲉϥⲕⲁϩⲓ ⲧⲁⲕⲟ. ⲛⲉⲙ ⲡⲉϥϫⲱⲕ ⲉ̀ⲃⲟⲗ ⲉⲩϣⲟⲡ ⲅⲁⲣ ϧⲉⲛ ⲟⲩⲙⲉⲧⲁⲥⲉⲃⲏⲥ ⲛ̀ϫⲉ ⲛⲏ ⲉⲧϣⲟⲡ ⲛ̀ϩⲣⲏⲓ ⲛ̀ϧⲏⲧϥ.		And thou shalt say to the people of the land, Thus saith the Lord to the inhabitants of Jerusalem, on the land of Israel; They shall eat their bread in scarcity, and shall drink their water in desolation, that the land may be desolate with all that it contains: for all that dwell in it are ungodly.	καὶ ἐρεῖς πρὸς τὸν λαὸν τῆς γῆς Τάδε λέγει κύριος τοῖς κατοικοῦσιν Ιερουσαληµ ἐπὶ τῆς γῆς τοῦ Ισραηλ Τοὺς ἄρτους αὐτῶν µετ’ ἐνδείας φάγονται καὶ τὸ ὕδωρ αὐτῶν µετὰ ἀφανισµοῦ πίονται, ὅπως ἀφανισθῇ ἡ γῆ σὺν πληρώµατι αὐτῆς, ἐν ἀσεβείᾳ γὰρ πάντες οἱ κατοικοῦντες ἐν αὐτῇ·						
Ezekiel	12	12	20	OT	1. OT	Major Prophets	4. Major Prophets	04. Major Prophets	06. Ezekiel	ⲟⲩⲟϩ ⲛⲟⲩⲡⲟⲗⲓⲥ ⲉⲧϫⲟⲣ ⲥⲉⲛⲁⲉⲣϣⲁϥⲉ. ⲟⲩⲟϩ ⲡⲕⲁϩⲓ ⲛⲁⲧⲁⲕⲟ. ⲉⲣⲉⲧⲉⲛⲉⲙⲓ ϫⲉ ⲁ̀ⲛⲟⲕ ⲡⲉ ⲡϭ̅ⲥ̅ ⲫϯ.		And their inhabited cities shall be laid utterly waste, and the land shall be desolate; and ye shall know that I am the Lord.	καὶ αἱ πόλεις αὐτῶν αἱ κατοικούµεναι ἐξερηµωθήσονται, καὶ ἡ γῆ εἰς ἀφανισµὸν ἔσται· καὶ ἐπιγνώσεσθε διότι ἐγὼ κύριος.						
Ezekiel	12	12	21	OT	1. OT	Major Prophets	4. Major Prophets	04. Major Prophets	06. Ezekiel	ⲟⲩⲟϩ ⲡⲥⲁϫⲓ ⲙ̀ⲫϯ ⲁϥϣⲱⲡⲓ ϩⲁⲣⲟⲓ ⲉϥϫⲱ ⲙ̀ⲙⲟⲥ.		And the word of the Lord came to me, saying,	Καὶ ἐγένετο λόγος κυρίου πρός µε λέγων						
Ezekiel	12	12	22	OT	1. OT	Major Prophets	4. Major Prophets	04. Major Prophets	06. Ezekiel	ϫⲉ ⲡϣⲏⲣⲓ ⲙ̀ⲫⲣⲱⲙⲓ. ⲟⲩ ⲧⲉ ⲧⲁⲓⲡⲁⲣⲁⲃⲟⲗⲏ ⲉⲧϣⲟⲡ ϧⲉⲛ ⲡⲕⲁϩⲓ ⲙ̀ⲡⲓⲥ̅ⲗ̅. ⲉⲣⲉⲧⲉⲛϫⲱ ⲙ̀ⲙⲟⲥ. ϫⲉ ⲛⲓⲉϩⲟⲟⲩ ⲟⲩⲏⲟⲩ. ⲟⲩⲟϩ ⲁ ϯϩⲟⲣⲁⲥⲓⲥ ⲧⲁⲕⲟ.		Son of man, what is your parable on the land of Israel, that ye say, The days are long, the vision has perished?	Υἱὲ ἀνθρώπου, τίς ὑµῖν ἡ παραβολὴ αὕτη ἐπὶ τῆς γῆς τοῦ Ισραηλ λέγοντες Μακρὰν αἱ ἡµέραι ἀπόλωλεν ὅρασις;						
Ezekiel	12	12	23	OT	1. OT	Major Prophets	4. Major Prophets	04. Major Prophets	06. Ezekiel	ⲉⲑⲃⲉ ⲫⲁⲓ ⲁϫⲟⲥ ⲛⲱⲟⲩ. ϫⲉ ⲛⲁⲓ ⲛⲉ ⲛⲏ ⲉⲧⲉϥϫⲱ ⲙ̀ⲙⲱⲟⲩ ⲛ̀ϫⲉ ⲡϭ̅ⲥ̅. ϫⲉ ϯⲛⲁⲧⲁⲥⲑⲟ ⲛ̀ⲧⲁⲓⲡⲁⲣⲁⲃⲟⲗⲏ ⲛ̀ϫⲉ ⲡⲏⲓ ⲧⲏⲣϥ ⲙ̀ⲡⲓⲥ̅ⲗ̅. ⲟⲩⲟϩ ⲁϫⲟⲥ ⲛⲱⲟⲩ ϫⲉ ⲁⲩϧⲱⲛⲧ ⲉ̀ϧⲟⲩⲛ ⲛ̀ϫⲉ ⲛⲓⲉϩⲟⲟⲩ. ⲟⲩⲟϩ ⲡⲥⲁϫⲓ ⲛ̀ϩⲟⲣⲁⲥⲓⲥ ⲛⲓⲃⲉⲛ.		Therefore say to them, Thus saith the Lord; I will even set aside this parable, and the house of Israel shall no more at all use this parable: for thou shalt say to them, The days are at hand, and the import of every vision.	διὰ τοῦτο εἰπὸν πρὸς αὐτούς Τάδε λέγει κύριος Ἀποστρέψω τὴν παραβολὴν ταύτην, καὶ οὐκέτι µὴ εἴπωσιν τὴν παραβολὴν ταύτην οἶκος τοῦ Ισραηλ, ὅτι λαλήσεις πρὸς αὐτούς Ἠγγίκασιν αἱ ἡµέραι καὶ λόγος πάσης ὁράσεως·						
Ezekiel	12	12	24	OT	1. OT	Major Prophets	4. Major Prophets	04. Major Prophets	06. Ezekiel	ϫⲉ ⲙ̀ⲙⲟⲛ ϩⲟⲣⲁⲥⲓⲥ ⲙ̀ⲙⲉⲑⲛⲟⲩϫ ⲛⲁϣⲱⲡⲓ ⲓⲥϫⲉⲛ ϯⲛⲟⲩ. ⲟⲩⲟϩ ⲫⲏ ⲉⲧϣⲓⲛⲓ ϧⲉⲛ ⲑⲙⲏϯ ⲛ̀ⲛⲉⲛϣⲏⲣⲓ ⲙ̀ⲡⲓⲥ̅ⲗ̅ ⲛⲏ ⲉⲧϭⲓ ⲉ̀ϧⲟⲩⲛ ⲛ̀ⲛⲟⲩⲱϣ.		For there shall no more be any false vision, nor any one prophesying flatteries in the midst of the children of Israel.	ὅτι οὐκ ἔσται ἔτι πᾶσα ὅρασις ψευδὴς καὶ µαντευόµενος τὰ πρὸς χάριν ἐν µέσῳ τῶν υἱῶν Ισραηλ,						
Ezekiel	12	12	25	OT	1. OT	Major Prophets	4. Major Prophets	04. Major Prophets	06. Ezekiel	ϫⲉ ⲁ̀ⲛⲟⲕ ⲡⲉ ⲡϭ̅ⲥ̅. ⲛⲁⲥⲁϫⲓ ⲉⲓⲉ̀ϫⲟⲧⲟⲩ. ⲟⲩⲟϩ ⲉⲓⲉ̀ⲁⲓⲧⲟⲩ. ⲛ̀ⲧⲁϣ̀ⲧⲉⲙⲱⲥⲕ ⲓⲥϫⲉⲛ ϯⲛⲟⲩ. ϫⲉ ⲛ̀ϩⲣⲏⲓ ϧⲉⲛ ⲛⲉⲧⲉⲛⲉϩⲟⲟⲩ. ⲡⲓⲏⲓ ⲉⲧϯⲙⲃⲟⲛ. ⲉⲓⲉ̀ϫⲱ ⲛⲟⲩⲥⲁϫⲓ. ⲟⲩⲟϩ ⲛ̀ⲧⲁⲁⲓϥ ⲡⲉϫⲉ ⲡϭ̅ⲥ̅.		For I the Lord will speak my words; I will speak and perform them, and will no more delay, for in your days, O provoking house, I will speak the word, and will perform it, saith the Lord.	διότι ἐγὼ κύριος λαλήσω τοὺς λόγους µου, λαλήσω καὶ ποιήσω καὶ οὐ µὴ µηκύνω ἔτι, ὅτι ἐν ταῖς ἡµέραις ὑµῶν, οἶκος ὁ παραπικραίνων, λαλήσω λόγον καὶ ποιήσω, λέγει κύριος. —						
Ezekiel	12	12	26	OT	1. OT	Major Prophets	4. Major Prophets	04. Major Prophets	06. Ezekiel	ⲟⲩⲟϩ ⲡⲥⲁϫⲓ ⲙ̀ⲡϭ̅ⲥ̅ ⲁϥϣⲱⲡⲓ ϩⲁⲣⲟⲓ ⲉϥϫⲱ ⲙ̀ⲙⲟⲥ.		Moreover the word of the Lord came to me, saying,	καὶ ἐγένετο λόγος κυρίου πρός µε λέγων						
Ezekiel	12	12	27	OT	1. OT	Major Prophets	4. Major Prophets	04. Major Prophets	06. Ezekiel	ϫⲉ ⲡϣⲏⲣⲓ ⲙ̀ⲫⲣⲱⲙⲓ. ⲓⲥ ⲡⲏⲓ ⲙ̀ⲡⲓⲥ̅ⲗ̅ ⲉⲧϯϫⲱⲛⲧ ϧⲉⲛ ⲟⲩϫⲱ ⲉⲩϫⲱ ⲙ̀ⲙⲟⲥ. ϫⲉ ⲧⲁⲓϩⲟⲣⲁⲥⲓⲥ ⲑⲏ ⲉⲧⲁ ⲫⲁⲓ ⲛⲁⲩ ⲉ̀ⲣⲟⲥ. ⲥⲉⲭⲏ ϧⲉⲛ ϩⲁⲛⲉϩⲟⲟⲩ ⲉⲩⲟⲩⲏⲟⲩ ⲟⲩⲟϩ ⲫⲁⲓ ⲉϥⲉ̀ⲉⲣⲡⲣⲟⲫⲏⲧⲉⲩⲓⲛ ⲉ̀ϩⲁⲛⲥⲏⲟⲩ ⲉⲩⲟⲩⲏⲟⲩ.		Son of man, behold, the provoking house of Israel boldly say, The vision which this man sees is for many days, and he prophesies for times afar off.	Υἱὲ ἀνθρώπου, ἰδοὺ οἶκος Ισραηλ ὁ παραπικραίνων λέγοντες λέγουσιν Ἡ ὅρασις, ἣν οὗτος ὁρᾷ, εἰς ἡµέρας πολλάς, καὶ εἰς καιροὺς µακροὺς οὗτος προφητεύει.						
Ezekiel	12	12	28	OT	1. OT	Major Prophets	4. Major Prophets	04. Major Prophets	06. Ezekiel	ⲉⲑⲃⲉ ⲫⲁⲓ ⲁϫⲟⲥ ⲛⲱⲟⲩ ϫⲉ ⲛⲁⲓ ⲛⲉ ⲛⲏ ⲉⲧⲉϥϫⲱ ⲙ̀ⲙⲱⲟⲩ ⲛ̀ϫⲉ ⲡϭ̅ⲥ̅ ϫⲉ ⲛⲁⲥⲁϫⲓ ⲧⲏⲣⲟⲩ ⲥⲉⲛⲁⲱⲥⲕ ⲁⲛ ⲓⲥϫⲉⲛ ϯⲛⲟⲩ. ⲛⲏ ⲉ̀ϯⲛⲁϫⲟⲧⲟⲩ. ϯⲛⲁⲁⲓⲧⲟⲩ ⲡⲉϫⲉ ⲡϭ̅ⲥ̅		Therefore say to them, Thus saith the Lord; Henceforth none of my words shall linger, which I shall speak: I will speak and do, saith the Lord.	διὰ τοῦτο εἰπὸν πρὸς αὐτούς Τάδε λέγει κύριος Οὐ µὴ µηκύνωσιν οὐκέτι πάντες οἱ λόγοι µου, οὓς ἂν λαλήσω· λαλήσω καὶ ποιήσω, λέγει κύριος.						
Ezekiel	13	13	1	OT	1. OT	Major Prophets	4. Major Prophets	04. Major Prophets	06. Ezekiel	ⲡⲥⲁϫⲓ ⲙ̀ⲡϭ̅ⲥ̅ ⲁϥϣⲱⲡⲓ ϩⲁⲣⲟⲓ ⲉϥϫⲱ ⲙ̀ⲙⲟⲥ.		And the word of the Lord came to me, saying,	Καὶ ἐγένετο λόγος κυρίου πρός µε λέγων						
Ezekiel	13	13	2	OT	1. OT	Major Prophets	4. Major Prophets	04. Major Prophets	06. Ezekiel	ϫⲉ ⲡϣⲏⲣⲓ ⲙ̀ⲫⲣⲱⲙⲓ ⲁⲣⲓⲡⲣⲟⲫⲏⲧⲉⲩⲓⲛ ⲉ̀ϫⲉⲛ ⲛⲓⲡⲣⲟⲫⲏⲧⲏⲥ ⲙ̀ⲡⲓⲥ̅ⲗ̅. ⲛⲏ ⲉⲧⲉⲣⲡⲣⲟⲫⲏⲧⲉⲩⲓⲛ ϧⲉⲛ ⲡⲟⲩϩⲏⲧ. ⲟⲩⲟϩ ⲁⲣⲓⲡⲣⲟⲫⲏⲧⲉⲩⲓⲛ ⲁϫⲟⲥ ⲛⲱⲟⲩ.		Son of man, prophesy against the prophets of Israel, and thou shalt prophesy, and shalt say to them, Hear ye the word of the Lord:	Υἱὲ ἀνθρώπου, προφήτευσον ἐπὶ τοὺς προφήτας τοῦ Ισραηλ καὶ προφητεύσεις καὶ ἐρεῖς πρὸς αὐτούς Ἀκούσατε λόγον κυρίου						
Ezekiel	13	13	3	OT	1. OT	Major Prophets	4. Major Prophets	04. Major Prophets	06. Ezekiel	ϫⲉ ⲛⲁⲓ ⲛⲉ ⲛⲏ ⲉⲧⲉϥϫⲱ ⲙ̀ⲙⲱⲟⲩ ⲛ̀ϫⲉ ⲡϭ̅ⲥ̅ ϫⲉ ⲟⲩⲟⲓ ⲛ̀ⲛⲏ ⲉⲧⲉⲣⲡⲣⲟⲫⲏⲧⲉⲩⲓⲛ ⲉ̀ⲃⲟⲗ ϧⲉⲛ ⲛⲟⲩϩⲏⲧ ⲙ̀ⲙⲓⲛ ⲙ̀ⲙⲱⲟⲩ. ⲉⲩⲉ̀ⲛⲁⲩ ⲁⲛ ⲉ̀ⲃⲟⲗ ⲉ̀ⲡⲧⲏⲣϥ.		Thus saith the Lord, Woe to them that prophesy out of their own heart, and who see nothing at all.	Τάδε λέγει κύριος Οὐαὶ τοῖς προφητεύουσιν ἀπὸ καρδίας αὐτῶν καὶ τὸ καθόλου µὴ βλέπουσιν.						
Ezekiel	13	13	4	OT	1. OT	Major Prophets	4. Major Prophets	04. Major Prophets	06. Ezekiel	ⲛⲉⲕⲡⲣⲟⲫⲏⲧⲏⲥ ⲡⲓⲥ̅ⲗ̅ ⲉⲩⲟⲓ ⲙ̀ⲫⲣⲏϯ ⲛ̀ϩⲁⲛⲃⲁϣⲟⲣ ϩⲓ ⲡϣⲁϥⲉ.		Thy prophets, O Israel, are like foxes in the deserts.	οἱ προφῆταί σου, Ισραηλ, ὡς ἀλώπεκες ἐν ταῖς ἐρήµοις·						
Ezekiel	13	13	5	OT	1. OT	Major Prophets	4. Major Prophets	04. Major Prophets	06. Ezekiel	ⲟⲩⲟϩ ⲙ̀ⲡⲟⲩⲟϩⲓ ⲉ̀ⲣⲁⲧⲟⲩ ϧⲉⲛ ⲟⲩⲧⲁϫⲣⲟ. ⲟⲩⲟϩ ⲁⲩⲑⲱⲟⲩϯ ⲉ̀ϧⲟⲩⲛ ⲛ̀ϩⲁⲛⲟϩⲓ ⲉ̀ϫⲉⲛ ⲡⲏⲓ ⲙ̀ⲡⲓⲥ̅ⲗ̅ ⲙ̀ⲡⲟⲩⲧⲱⲟⲩⲛⲟⲩ. ⲛⲏ ⲉⲧϫⲱ ⲙ̀ⲙⲟⲥ. ϧⲉⲛ ⲡⲓⲉϩⲟⲟⲩ ⲛ̀ⲧⲉ ⲡϭ̅ⲥ̅.		They have not continued steadfast, and they have gathered flocks against the house of Israel, they that say,	οὐκ ἔστησαν ἐν στερεώµατι καὶ συνήγαγον ποίµνια ἐπὶ τὸν οἶκον τοῦ Ισραηλ, οὐκ ἀνέστησαν οἱ λέγοντες Ἐν ἡµέρᾳ κυρίου·						
Ezekiel	13	13	6	OT	1. OT	Major Prophets	4. Major Prophets	04. Major Prophets	06. Ezekiel	ⲉⲩⲉ̀ⲛⲁⲩ ⲛ̀ϩⲁⲛⲙⲉⲑⲛⲟⲩϫ ⲉⲩⲕⲁϯ ⲛ̀ⲥⲁ ϩⲁⲛⲙⲉⲧⲉⲫⲗⲏⲟⲩ. ⲛⲏ ⲉⲧϫⲱ ⲙ̀ⲙⲟⲥ ϫⲉ ⲛⲁⲓ ⲛⲉ ⲛⲏ ⲉⲧⲉϥϫⲱ ⲙ̀ⲙⲱⲟⲩ ⲛ̀ϫⲉ ⲡϭ̅ⲥ̅. ⲟⲩⲟϩ ⲙ̀ⲡⲉ ⲡϭ̅ⲥ̅ ⲟⲩⲱⲣⲡⲟⲩ. ⲟⲩⲟϩ ⲁⲩⲉⲣϩⲏⲧⲥ ⲛ̀ⲧⲁϩⲟ ⲛ̀ⲟⲩⲥⲟϭⲛⲓ ⲉ̀ⲣⲁⲧϥ.		In the day of the Lord, have not stood, seeing false visions, prophesying vanities, who say, The Lord saith, and the Lord has not sent them, and they began to try to confirm the word.	βλέποντες ψευδῆ, µαντευόµενοι µάταια οἱ λέγοντες Λέγει κύριος, καὶ κύριος οὐκ ἀπέσταλκεν αὐτούς, καὶ ἤρξαντο τοῦ ἀναστῆσαι λόγον.						
