book	chapter	chapter-zfilled	verse	testament	testament-indexed	section	section-indexed	section-indexed-no-testament	book-indexed	Bohairic	Sahidic	English	Greek	Fayyumic	Akhmimic	OldBohairic	Mesokemic	DialectP	Lycopolitan
Ezekiel	13	13	7	OT	1. OT	Major Prophets	4. Major Prophets	04. Major Prophets	06. Ezekiel	ⲙⲏ ⲟⲩϩⲟⲣⲁⲥⲓⲥ ⲙ̀ⲙⲉⲑⲛⲟⲩϫ ⲁⲛ ⲑⲏ ⲉⲧⲁⲣⲉⲧⲉⲛⲛⲁⲩ ⲉ̀ⲣⲟⲥ. ⲟⲩⲟϩ ϩⲁⲛϣⲓⲛⲓ ⲙ̀ⲙⲉⲧⲉⲫⲗⲏⲟⲩ. ⲛⲏ ⲉⲧⲁⲣⲉⲧⲉⲛⲛⲁⲩ ⲉ̀ⲣⲱⲟⲩ. ⲟⲩⲟϩ ⲧⲉⲧⲉⲛϫⲱ ⲙ̀ⲙⲟⲥ ϫⲉ ⲁ ⲡϭ̅ⲥ̅ ϫⲟⲥ. ⲟⲩⲟϩ ⲙ̀ⲡⲓⲥⲁϫⲓ.		Have ye not seen a false vision? and spoken vain prophecies?	οὐχ ὅρασιν ψευδῆ ἑωράκατε καὶ µαντείας µαταίας εἰρήκατε;						
Ezekiel	13	13	8	OT	1. OT	Major Prophets	4. Major Prophets	04. Major Prophets	06. Ezekiel	ⲉⲑⲃⲉ ⲫⲁⲓ ⲁϫⲟⲥ ⲛⲱⲟⲩ. ϫⲉ ⲛⲁⲓ ⲛⲉ ⲛⲏ ⲉⲧⲉϥϫⲱ ⲙ̀ⲙⲱⲟⲩ ⲛ̀ϫⲉ ⲡϭ̅ⲥ̅. ϫⲉ ⲉ̀ⲃⲟⲗ ϫⲉ ⲛⲉⲧⲉⲛⲥⲁϫⲓ ϩⲁⲛⲙⲉⲑⲛⲟⲩϫ ⲛⲉ. ⲟⲩⲟϩ ⲛⲉⲧⲉⲛϣⲓⲛⲓ ⲉⲩϣⲟⲩⲓⲧ. ⲉⲑⲃⲉ ⲫⲁⲓ ϩⲏⲡⲡⲉ ⲁ̀ⲛⲟⲕ ⲉⲓⲉ̀ⲓⲛⲓ ⲉ̀ϫⲉⲛ ⲑⲏⲛⲟⲩ ⲡⲉϫⲉ ⲡϭ̅ⲥ̅.		And therefore say, Thus saith the Lord; Because your words are false, and your prophecies are vain, therefore, behold, I am against you, saith the Lord.	διὰ τοῦτο εἰπόν Τάδε λέγει κύριος Ἀνθ’ ὧν οἱ λόγοι ὑµῶν ψευδεῖς καὶ αἱ µαντεῖαι ὑµῶν µάταιαι, διὰ τοῦτο ἰδοὺ ἐγὼ ἐφ’ ὑµᾶς, λέγει κύριος,						
Ezekiel	13	13	9	OT	1. OT	Major Prophets	4. Major Prophets	04. Major Prophets	06. Ezekiel	ⲉⲓⲉ̀ⲥⲟⲩⲧⲱⲛ ⲧⲁϫⲓϫ ⲉ̀ϫⲉⲛ ⲛⲉⲧⲉⲛⲡⲣⲟⲫⲏⲧⲏⲥ ⲛⲁⲓ ⲉⲑⲛⲁⲩ ⲉ̀ϩⲁⲛⲙⲉⲑⲛⲟⲩϫ ⲟⲩⲟϩ ⲛⲏ ⲉⲧϫⲱ ⲛ̀ϩⲁⲛⲙⲉⲧⲉⲫⲗⲏⲟⲩ. ⲉⲩⲉ̀ϣⲱⲡⲓ ⲁⲛ ϧⲉⲛ ϯⲥⲃⲱ ⲛ̀ⲧⲉ ⲡⲓⲗⲁⲟⲥ ⲟⲩⲇⲉ ⲛ̀ⲛⲟⲩⲥϧⲏⲧⲟⲩ ⲁⲛ ϧⲉⲛ ϯⲅⲣⲁⲫⲏ ⲛ̀ⲧⲉ ⲡⲏⲓ ⲙ̀ⲡⲓⲥ̅ⲗ̅. ⲟⲩⲟϩ ⲛ̀ⲛⲟⲩϣⲉ ⲉ̀ϧⲟⲩⲛ ⲉ̀ⲡⲕⲁϩⲓ ⲙ̀ⲡⲓⲥ̅ⲗ̅. ⲉⲩⲉⲉⲙⲓ ϫⲉ ⲁ̀ⲛⲟⲕ ⲡⲉ ⲡϭ̅ⲥ̅.		And I will stretch forth my hand against the prophets that see false visions, and those that utter vanities: they shall not partake of the instruction of my people, neither shall they be written in the roll of the house of Israel, and they shall not enter into the land of Israel; and they shall know that I am the Lord.	καὶ ἐκτενῶ τὴν χεῖρά µου ἐπὶ τοὺς προφήτας τοὺς ὁρῶντας ψευδῆ καὶ τοὺς ἀποφθεγγοµένους µάταια· ἐν παιδείᾳ τοῦ λαοῦ µου οὐκ ἔσονται οὐδὲ ἐν γραφῇ οἴκου Ισραηλ οὐ γραφήσονται καὶ εἰς τὴν γῆν τοῦ Ισραηλ οὐκ εἰσελεύσονται· καὶ γνώσονται διότι ἐγὼ κύριος.						
Ezekiel	13	13	10	OT	1. OT	Major Prophets	4. Major Prophets	04. Major Prophets	06. Ezekiel	ⲉⲑⲃⲉ ϫⲉ ⲛ̀ⲑⲱⲟⲩ ⲁⲩⲥⲱⲣⲉⲙ ⲙ̀ⲡⲁⲗⲁⲟⲥ ⲉⲩϫⲱ ⲙ̀ⲙⲟⲥ. ϫⲉ ⲧϩⲓⲣⲏⲛⲏ ⲧϩⲓⲣⲏⲛⲏ. ⲟⲩⲟϩ ⲙ̀ⲙⲟⲛ ϩⲓⲣⲏⲛⲏ. ⲫⲁⲓ ⲉϥⲉ̀ⲕⲱⲧ ⲛ̀ⲟⲩϫⲟⲓ. ϩⲁⲛⲕⲉⲭⲱⲟⲩⲛⲓ ⲉⲩⲉ̀ⲑⲱϩⲥ ⲙ̀ⲙⲟϥ.		Because they have caused my people to err, saying, Peace; and there is no peace; and one builds a wall, and they plaster it, —it shall fall.	ἀνθ’ ὧν τὸν λαόν µου ἐπλάνησαν λέγοντες Εἰρήνη εἰρήνη, καὶ οὐκ ἦν εἰρήνη, καὶ οὗτος οἰκοδοµεῖ τοῖχον, καὶ αὐτοὶ ἀλείφουσιν αὐτόν, εἰ πεσεῖται,						
Ezekiel	13	13	11	OT	1. OT	Major Prophets	4. Major Prophets	04. Major Prophets	06. Ezekiel	ⲁϫⲟⲥ ⲛ̀ⲛⲏ ⲉⲧⲟⲩⲑⲱϩⲥ ⲙ̀ⲙⲟϥ ϫⲉ ⲉϥⲉ̀ϩⲏⲓ. ⲟⲩⲟϩ ⲉϥⲉ̀ϣⲱⲡⲓ ⲛ̀ϫⲉ ⲟⲩⲙⲟⲩⲛϩⲱⲟⲩ ⲉϥⲉ̀ⲱⲙⲥ ⲙ̀ⲙⲱⲟⲩ. ⲟⲩⲟϩ ϩⲁⲛⲱⲛⲓ ⲙ̀ⲡⲉⲧⲣⲁ ⲉⲓⲉ̀ⲧⲏⲓⲧⲟⲩ ⲉ̀ϧⲣⲏⲓ. ϧⲉⲛ ⲛⲟⲩⲟⲩⲱϣ ⲉⲩⲉ̀ϩⲉⲓ ⲉϧⲣⲏⲓ. ⲟⲩⲟϩ ⲟⲩⲡⲛ̅ⲁ̅ ⲛ̀ⲥⲁⲣⲁⲑⲏⲟⲩ ⲉⲓⲉ̀ⲧⲏⲓϥ ⲉⲩϩⲉⲓ.		Say to them that plaster it, It shall fall; and there shall be a flooding rain; and I will send great stones upon their joinings, and they shall fall; and there shall be a sweeping wind, and it shall be broken.	εἰπὸν πρὸς τοὺς ἀλείφοντας Πεσεῖται, καὶ ἔσται ὑετὸς κατακλύζων, καὶ δώσω λίθους πετροβόλους εἰς τοὺς ἐνδέσµους αὐτῶν, καὶ πεσοῦνται, καὶ πνεῦµα ἐξαῖρον, καὶ ῥαγήσεται.						
Ezekiel	13	13	12	OT	1. OT	Major Prophets	4. Major Prophets	04. Major Prophets	06. Ezekiel	ⲟⲩⲟϩ ϩⲏⲡⲡⲉ ⲁ ϯϫⲟⲓ ϩⲉⲓ ⲉ̀ϧⲣⲏⲓ. ⲉⲩⲉ̀ϫⲟⲥ ⲛⲱⲧⲉⲛ ϫⲉ ⲁϥⲑⲱⲛ ⲡⲉⲧⲉⲛⲟϣϫ ⲉ̀ⲁⲣⲉⲧⲉⲛⲟϣϫϥ.		And lo! the wall has fallen; and will they not say to you, Where is your plaster wherewith ye plastered it?	καὶ ἰδοὺ πέπτωκεν ὁ τοῖχος, καὶ οὐκ ἐροῦσιν πρὸς ὑµᾶς Ποῦ ἐστιν ἡ ἀλοιφὴ ὑµῶν, ἣν ἠλείψατε;						
Ezekiel	13	13	13	OT	1. OT	Major Prophets	4. Major Prophets	04. Major Prophets	06. Ezekiel	ⲉⲑⲃⲉ ⲫⲁⲓ ⲛⲁⲓ ⲛⲉ ⲛⲏ ⲉⲧⲉϥϫⲱ ⲙ̀ⲙⲱⲟⲩ ⲛ̀ϫⲉ ⲡϭ̅ⲥ̅ ϫⲉ ϯⲛⲁϭⲉⲧϭⲱⲧ ⲛ̀ⲟⲩⲑⲏⲟⲩ ⲉϥⲉⲛϣⲟⲧ ϧⲉⲛ ⲡⲁϫⲱⲛⲧ ⲟⲩⲟϩ ⲟⲩⲙⲟⲩⲛϩⲱⲟⲩ ⲉϥⲉⲛϣⲟⲧ ϧⲉⲛ ⲡⲁⲙⲃⲟⲛ ⲉϥⲉ̀ϣⲱⲡⲓ. ⲟⲩⲟϩ ⲛⲓⲱⲛⲓ ⲙ̀ⲡⲉⲧⲣⲁ ⲉⲓⲉ̀ⲉⲛⲟⲩ ϧⲉⲛ ⲡⲁϫⲱⲛⲧ ⲉ̀ⲙⲟⲩⲛⲕⲟⲩ.		Therefore thus saith the Lord; I will even cause to burst forth a sweeping blast with fury, and there shall be a flooding rain in my wrath; and in my fury I will bring on great stones for complete destruction.	διὰ τοῦτο τάδε λέγει κύριος Καὶ ῥήξω πνοὴν ἐξαίρουσαν µετὰ θυµοῦ, καὶ ὑετὸς κατακλύζων ἐν ὀργῇ µου ἔσται, καὶ τοὺς λίθους τοὺς πετροβόλους ἐν θυµῷ ἐπάξω εἰς συντέλειαν						
Ezekiel	13	13	14	OT	1. OT	Major Prophets	4. Major Prophets	04. Major Prophets	06. Ezekiel	ⲟⲩⲟϩ ⲉⲓⲉ̀ⲥⲱⲥ ⲛϯϫⲟⲓ ⲉ̀ⲁⲣⲉⲧⲉⲛⲟϣϫ ⲙ̀ⲙⲟⲥ. ⲉⲓⲉ̀ⲣⲁϧⲧ ⲙ̀ⲙⲟⲥ ⲉ̀ϩⲣⲏⲓ ⲉ̀ϫⲉⲛ ⲡⲓⲕⲁϩⲓ. ⲉⲩⲉ̀ϭⲱⲣⲡ ⲉ̀ⲃⲟⲗ ⲛ̀ϫⲉ ⲛⲉⲥⲥⲉⲛϯ ⲉⲩⲉ̀ϩⲉⲓ ⲉ̀ϧⲣⲏⲓ. ⲟⲩⲟϩ ⲉⲩⲉ̀ⲙⲟⲩⲛⲕ ⲑⲏⲛⲟⲩ ϧⲉⲛ ⲟⲩⲥⲟϩⲓ. ⲉⲣⲉⲧⲉⲛⲉⲙⲓ ϫⲉ ⲁ̀ⲛⲟⲕ ⲡⲉ ⲡϭ̅ⲥ̅.		And I will break down the wall which ye have plastered, and it shall fall; and I will lay it on the ground, and its foundations shall be discovered, and it shall fall; and ye shall be consumed with rebukes: and ye shall know that I am the Lord.	καὶ κατασκάψω τὸν τοῖχον, ὃν ἠλείψατε, καὶ πεσεῖται· καὶ θήσω αὐτὸν ἐπὶ τὴν γῆν, καὶ ἀποκαλυφθήσεται τὰ θεµέλια αὐτοῦ, καὶ πεσεῖται, καὶ συντελεσθήσεσθε µετ’ ἐλέγχων· καὶ ἐπιγνώσεσθε διότι ἐγὼ κύριος.						
Ezekiel	13	13	15	OT	1. OT	Major Prophets	4. Major Prophets	04. Major Prophets	06. Ezekiel	ⲟⲩⲟϩ ⲉⲓⲉ̀ϫⲱⲕ ⲉ̀ⲃⲟⲗ ⲙ̀ⲡⲁϫⲱⲛⲧ ⲉ̀ϫⲉⲛ ϯϫⲟⲓ. ⲉⲥⲉ̀ⲓ̀ ⲉ̀ϩⲣⲏⲓ ⲉ̀ϫⲉⲛ ⲛⲏ ⲉⲧⲁⲩⲟϣϫ ⲙ̀ⲙⲟⲥ. ⲟⲩⲟϩ ⲁⲓϫⲟⲥ ⲛⲱⲧⲉⲛ ϫⲉ ⲙⲏ ⲧⲁⲓϫⲟⲓ ⲁⲛ ⲧⲉ. ⲙⲏ ⲛⲏ ⲉⲧⲁⲩⲟϣϫ ⲙ̀ⲙⲟⲥ ⲁⲛ ⲛⲉ		And I will accomplish my wrath upon the wall, and upon them that plaster it; it shall fall: and I said to you, The wall is not, nor they that plaster it,	καὶ συντελέσω τὸν θυµόν µου ἐπὶ τὸν τοῖχον καὶ ἐπὶ τοὺς ἀλείφοντας αὐτόν, καὶ πεσεῖται. καὶ εἶπα πρὸς ὑµᾶς Οὐκ ἔστιν ὁ τοῖχος οὐδὲ οἱ ἀλείφοντες αὐτὸν						
Ezekiel	13	13	16	OT	1. OT	Major Prophets	4. Major Prophets	04. Major Prophets	06. Ezekiel	ⲛⲓⲡⲣⲟⲫⲏⲧⲏⲥ ⲙ̀ⲡⲓⲥ̅ⲗ̅. ⲛⲏ ⲉⲧⲉⲣⲡⲣⲟⲫⲏⲧⲉⲩⲓⲛ ⲉ̀ϫⲉⲛ ⲓⲗ̅ⲏ̅ⲙ̅ ⲉⲩⲉ̀ⲛⲁⲩ ⲛⲁⲥ ⲉ̀ⲟⲩϩⲟⲣⲁⲥⲓⲥ ⲛ̀ϩⲓⲣⲏⲛⲏ. ⲟⲩⲟϩ ⲙ̀ⲙⲟⲛ ϩⲓⲣⲏⲛⲏ. ⲡⲉϫⲉ ⲡϭ̅ⲥ̅.		even the prophets of Israel, who prophesy concerning Jerusalem, and who see visions of peace for her, and there is no peace, saith the Lord.	προφῆται τοῦ Ισραηλ οἱ προφητεύοντες ἐπὶ Ιερουσαληµ καὶ οἱ ὁρῶντες αὐτῇ εἰρήνην, καὶ εἰρήνη οὐκ ἔστιν, λέγει κύριος. —						
Ezekiel	13	13	17	OT	1. OT	Major Prophets	4. Major Prophets	04. Major Prophets	06. Ezekiel	ⲛ̀ⲑⲟⲕ ϩⲱⲕ ⲡϣⲏⲣⲓ ⲙ̀ⲫⲣⲱⲙⲓ ⲙⲁⲧⲁϫⲣⲉ ⲡⲉⲕϩⲟ ⲉ̀ϫⲉⲛ ⲧϣⲉⲣⲓ ⲙ̀ⲡⲉⲕⲗⲁⲟⲥ. ⲛⲏ ⲉⲧⲉⲣⲡⲣⲟⲫⲏⲧⲉⲩⲓⲛ ϧⲉⲛ ⲡⲟⲩϩⲏⲧ ⲙ̀ⲙⲓⲛ ⲙ̀ⲙⲱⲟⲩ. ⲁⲣⲓⲡⲣⲟⲫⲏⲧⲉⲩⲓⲛ		And thou, son of man, set thy face firmly against the daughters of thy people, that prophesy out of their own heart; and prophesy against them.	καὶ σύ, υἱὲ ἀνθρώπου, στήρισον τὸ πρόσωπόν σου ἐπὶ τὰς θυγατέρας τοῦ λαοῦ σου τὰς προφητευούσας ἀπὸ καρδίας αὐτῶν καὶ προφήτευσον ἐπ’ αὐτὰς						
Ezekiel	13	13	18	OT	1. OT	Major Prophets	4. Major Prophets	04. Major Prophets	06. Ezekiel	ⲟⲩⲟϩ ⲁϫⲟⲥ ⲛⲱⲟⲩ ϫⲉ ⲛⲁⲓ ⲛⲉ ⲛⲏ ⲉⲧⲉϥϫⲱ ⲙ̀ⲙⲱⲟⲩ ⲛ̀ϫⲉ ⲡϭ̅ⲥ̅. ϫⲉ ⲟⲩⲟⲓ ⲛ̀ⲛⲏ ⲉⲧⲑⲱⲣⲡ ⲛ̀ϩⲁⲛϣⲟϯ. ϧⲁ ⲕⲁⲗⲁⲛⲕⲁϩ ⲛⲓⲃⲉⲛ ⲛ̀ϫⲓϫ. ⲟⲩⲟϩ ⲉⲩⲑⲁⲙⲓⲟ ⲛ̀ϩⲁⲛϩⲃⲱⲥ ⲉ̀ϫⲉⲛ ⲁⲫⲉ ⲛⲓⲃⲉⲛ. ⲛⲉⲙ ⲙⲁⲓⲏ ⲛⲓⲃⲉⲛ. ⲉ̀ⲑⲣⲟⲩⲫⲱϣ ⲉ̀ⲃⲟⲗ ⲛ̀ϩⲁⲛⲯⲩⲭⲏ. ⲁⲩⲣⲓⲕⲓ ⲉ̀ⲃⲟⲗ ⲛ̀ϫⲉ ⲛⲓⲯⲩⲭⲏ ⲙ̀ⲡⲁⲗⲁⲟⲥ. ⲁⲩⲑⲱⲟⲩϯ ⲛⲱⲟⲩ ⲉ̀ϧⲟⲩⲛ ⲛ̀ϩⲁⲛⲯⲩⲭⲏ.		And thou shalt say, Thus saith the Lord, Woe to the women that sew pillows under every elbow, and make kerchiefs on the head of every stature to pervert souls! The souls of my people are perverted, and they have saved souls alive.	καὶ ἐρεῖς Τάδε λέγει κύριος Οὐαὶ ταῖς συρραπτούσαις προσκεφάλαια ἐπὶ πάντα ἀγκῶνα χειρὸς καὶ ποιούσαις ἐπιβόλαια ἐπὶ πᾶσαν κεφαλὴν πάσης ἡλικίας τοῦ διαστρέφειν ψυχάς· αἱ ψυχαὶ διεστράφησαν τοῦ λαοῦ µου, καὶ ψυχὰς περιεποιοῦντο.						
Ezekiel	13	13	19	OT	1. OT	Major Prophets	4. Major Prophets	04. Major Prophets	06. Ezekiel	ⲟⲩⲟϩ ⲁⲩⲃⲟϯ ⲙ̀ⲙⲟⲓ ⲛⲁϩⲣⲉⲛ ⲡⲁⲗⲁⲟⲥ. ⲉⲑⲃⲉ ⲟⲩϫⲓϫ ⲛ̀ⲓⲱⲧ. ⲟⲩⲟϩ ⲉⲑⲃⲉ ⲟⲩⲗⲁⲕϩ ⲛ̀ⲱⲓⲕ. ⲉ̀ⲑⲣⲟⲩⲙⲱⲟⲩⲧ ⲛϩⲁⲛⲯⲩⲭⲏ. ⲛⲁⲓ ⲉⲛⲉⲥϣⲉ ⲁⲛ ⲉ̀ⲙⲱⲟⲩⲧⲟⲩ. ⲟⲩⲟϩ ⲉⲩⲉ̀ⲧⲁⲛϧⲟ ⲛ̀ϩⲁⲛⲯⲩⲭⲏ. ⲛⲁⲓ ⲉⲛⲉⲥϣⲉ ⲁⲛ ⲉⲧⲁⲛϧⲱⲟⲩ. ϧⲉⲛ ⲡϫⲓⲛⲑⲣⲉ ⲧⲉⲧⲉⲛⲥⲁϫⲓ ⲛⲁϩⲣⲉⲛ ⲡⲓⲗⲁⲟⲥ ⲉⲧⲥⲱⲧⲉⲙ ⲉ̀ϩⲁⲛⲥⲁϫⲓ ⲙ̀ⲫⲗⲏⲟⲩ.		And they have dishonoured me before my people for a handful of barley, and for pieces of bread, to slay the souls which should not die, and to save alive the souls which should not live, while ye speak to a people hearing vain speeches.	καὶ ἐβεβήλουν µε πρὸς τὸν λαόν µου ἕνεκεν δρακὸς κριθῶν καὶ ἕνεκεν κλασµάτων ἄρτου τοῦ ἀποκτεῖναι ψυχάς, ἃς οὐκ ἔδει ἀποθανεῖν, καὶ τοῦ περιποιήσασθαι ψυχάς, ἃς οὐκ ἔδει ζῆσαι, ἐν τῷ ἀποφθέγγεσθαι ὑµᾶς λαῷ εἰσακούοντι µάταια ἀποφθέγµατα.						
Ezekiel	13	13	20	OT	1. OT	Major Prophets	4. Major Prophets	04. Major Prophets	06. Ezekiel	ⲉⲑⲃⲉ ⲫⲁⲓ ⲛⲁⲓ ⲛⲉ ⲛⲏ ⲉⲧⲉϥϫⲱ ⲙ̀ⲙⲱⲟⲩ ⲛ̀ϫⲉ ⲡϭ̅ⲥ̅. ϫⲉ ϩⲏⲡⲡⲉ ⲁ̀ⲛⲟⲕ ⲉⲓⲉ̀ⲓⲛⲓ ⲉ̀ϫⲉⲛ ⲛⲉⲧⲉⲛϣⲟϯ. ⲛⲁⲓ ⲛ̀ⲑⲱⲧⲉⲛ ⲁⲧⲉⲧⲉⲛⲭⲱ ⲙ̀ⲡⲓⲙⲁ ⲉⲧⲉⲙ̀ⲙⲁⲩ ⲛ̀ϩⲁⲛⲯⲩⲭⲏ. ⲉⲓⲉ̀ⲫⲁϧⲟⲩ ⲉ̀ⲃⲟⲗ ϧⲉⲛ ⲛⲉⲧⲉⲛϣⲱⲃϣ. ⲉⲓⲉ̀ϫⲟⲣⲟⲩ ⲉ̀ⲃⲟⲗ ϧⲉⲛ ⲛⲓⲯⲩⲭⲏ. ⲛⲁⲓ ⲛ̀ⲑⲱⲧⲉⲛ ⲉ̀ⲁⲧⲉⲧⲉⲛⲫⲱϣ ⲙ̀ⲙⲱⲟⲩ. ⲛⲓⲯⲩⲭⲏ ⲉⲓⲉ̀ⲧⲏⲓⲧⲟⲩ ⲉⲩϫⲱⲣ ⲉ̀ⲃⲟⲗ.		Therefore thus saith the Lord God, Behold, I am against your pillows, whereby ye there confound souls, and I will tear them away from your arms, and will set at liberty their souls which ye pervert to scatter them.	διὰ τοῦτο τάδε λέγει κύριος κύριος Ἰδοὺ ἐγὼ ἐπὶ τὰ προσκεφάλαια ὑµῶν, ἐφ’ ἃ ὑµεῖς συστρέφετε ἐκεῖ ψυχάς, καὶ διαρρήξω αὐτὰ ἀπὸ τῶν βραχιόνων ὑµῶν καὶ ἐξαποστελῶ τὰς ψυχάς, ἃς ὑµεῖς ἐκστρέφετε τὰς ψυχὰς αὐτῶν, εἰς διασκορπισµόν·						
Ezekiel	13	13	21	OT	1. OT	Major Prophets	4. Major Prophets	04. Major Prophets	06. Ezekiel	ⲟⲩⲟϩ ⲉⲩⲉ̀ⲫⲱϧ ⲛ̀ⲛⲉⲧⲉⲛϩⲃⲱⲥ. ⲉⲓⲉ̀ⲛⲟϩⲉⲙ ⲙ̀ⲡⲁⲗⲁⲟⲥ ⲉ̀ⲃⲟⲗ ϧⲉⲛ ⲛⲉⲧⲉⲛϫⲓϫ. ⲟⲩⲟϩ ⲛ̀ⲧⲟⲩϣⲱⲡⲓ ⲁⲛ ϫⲉ ϧⲉⲛ ⲛⲉⲧⲉⲛϫⲓϫ ⲓⲥϫⲉⲛ ϯⲛⲟⲩ. ⲉⲧⲁⲥⲑⲱⲟⲩ ⲉ̀ⲣⲉⲛ ⲑⲏⲛⲟⲩ. ⲉⲣⲉⲧⲉⲛⲉⲙⲓ ϫⲉ ⲁ̀ⲛⲟⲕ ⲡⲉ ⲡϭ̅ⲥ̅.		And I will tear your kerchiefs, and will rescue my people out of your hands, and they shall no longer be in your hands to be confounded; and ye shall know that I am the Lord.	καὶ διαρρήξω τὰ ἐπιβόλαια ὑµῶν καὶ ῥύσοµαι τὸν λαόν µου ἐκ χειρὸς ὑµῶν, καὶ οὐκέτι ἔσονται ἐν χερσὶν ὑµῶν εἰς συστροφήν· καὶ ἐπιγνώσεσθε διότι ἐγὼ κύριος.						
Ezekiel	13	13	22	OT	1. OT	Major Prophets	4. Major Prophets	04. Major Prophets	06. Ezekiel	ⲉⲑⲃⲉ ϫⲉ ⲁⲣⲉⲧⲉⲛⲧⲟⲙⲧ ⲉ̀ⲃⲟⲗ ⲙ̀ⲡϩⲏⲧ ⲙ̀ⲡⲓⲑⲙⲏⲓ. ⲉ̀ⲁ̀ⲛⲟⲕ ⲇⲉ ⲙ̀ⲡⲓⲧⲟⲙϥ ⲉ̀ⲃⲟⲗ. ⲟⲩⲟϩ ⲁⲧⲉⲧⲉⲛϯⲛⲟⲙϯ ⲉ̀ⲧϫⲓϫ ⲙ̀ⲡⲓⲁⲛⲟⲙⲟⲥ. ⲉ̀ϣ̀ⲧⲉⲙⲧⲁⲥⲑⲟϥ ⲉ̀ⲃⲟⲗ ⲉ̀ⲡⲧⲏⲣϥ ϧⲉⲛ ⲛⲉϥⲙⲱⲓⲧ ⲉⲧϩⲱⲟⲩ ⲛ̀ⲧⲉϥⲱⲛϧ.		Because ye have perverted the heart of the righteous, whereas I perverted him not, and that in order to strengthen the hands of the wicked, that he should not at all turn from his evil way and live:	ἀνθ’ ὧν διεστρέφετε καρδίαν δικαίου ἀδίκως καὶ ἐγὼ οὐ διέστρεφον αὐτὸν καὶ τοῦ κατισχῦσαι χεῖρας ἀνόµου τὸ καθόλου µὴ ἀποστρέψαι ἀπὸ τῆς ὁδοῦ αὐτοῦ τῆς πονηρᾶς καὶ ζῆσαι αὐτόν,						
Ezekiel	13	13	23	OT	1. OT	Major Prophets	4. Major Prophets	04. Major Prophets	06. Ezekiel	ⲉⲑⲃⲉ ⲫⲁⲓ ⲧⲉⲧⲉⲛⲛⲁⲩ ⲁⲛ ⲉ̀ⲙⲉⲑⲛⲟⲩϫ. ⲟⲩⲇⲉ ⲉⲣⲉⲧⲉⲛⲧⲁⲥⲑⲟ ⲁⲛ ⲓⲥϫⲉⲛ ϯⲛⲟⲩ ⲉ̀ⲧⲁⲟⲩⲟ ⲛ̀ϩⲁⲛϣⲓⲛⲓ. ⲉⲓⲉ̀ⲛⲟϩⲉⲙ ⲅⲁⲣ ⲙ̀ⲡⲁⲗⲁⲟⲥ ⲉ̀ⲃⲟⲗ ϧⲉⲛ ⲛⲉⲧⲉⲛϫⲓϫ ⲉⲣⲉⲧⲉⲛⲉⲙⲓ ϫⲉ ⲁ̀ⲛⲟⲕ ⲡⲉ ⲡϭ̅ⲥ̅.		therefore ye shall not see false visions, and ye shall no more utter prophecies: but I will deliver my people out of your hand; and ye shall know that I am the Lord.	διὰ τοῦτο ψευδῆ οὐ µὴ ἴδητε καὶ µαντείας οὐ µὴ µαντεύσησθε ἔτι, καὶ ῥύσοµαι τὸν λαόν µου ἐκ χειρὸς ὑµῶν· καὶ γνώσεσθε ὅτι ἐγὼ κύριος.						
Ezekiel	14	14	1	OT	1. OT	Major Prophets	4. Major Prophets	04. Major Prophets	06. Ezekiel	ⲟⲩⲟϩ ⲁⲩⲓ ϩⲁⲣⲟⲓ ⲛ̀ϫⲉ ϩⲁⲛⲣⲱⲙⲓ ⲉ̀ⲃⲟⲗ ϧⲉⲛ ⲛⲓⲡⲣⲉⲥⲃⲩⲧⲉ̀ⲣⲟⲥ ⲙ̀ⲡⲓⲥ̅ⲗ̅. ⲁⲩϩⲉⲙⲥⲓ ⲙ̀ⲡⲁⲙ̀ⲑⲟ ⲉ̀ⲃⲟⲗ.		And there came to me men of the people of Israel, of the elders, and sat before me.	Καὶ ἦλθον πρός µε ἄνδρες ἐκ τῶν πρεσβυτέρων τοῦ Ισραηλ καὶ ἐκάθισαν πρὸ προσώπου µου.						
Ezekiel	14	14	2	OT	1. OT	Major Prophets	4. Major Prophets	04. Major Prophets	06. Ezekiel	ⲟⲩⲟϩ ⲡⲥⲁϫⲓ ⲙ̀ⲡϭ̅ⲥ̅ ⲁϥϣⲱⲡⲓ ϩⲁⲣⲟⲓ ⲉϥϫⲱ ⲙ̀ⲙⲟⲥ.		And the word of the Lord came to me, saying,	καὶ ἐγένετο λόγος κυρίου πρός µε λέγων						
Ezekiel	14	14	3	OT	1. OT	Major Prophets	4. Major Prophets	04. Major Prophets	06. Ezekiel	ϫⲉ ⲡϣⲏⲣⲓ ⲙ̀ⲫⲣⲱⲙⲓ. ⲛⲁⲓⲣⲱⲙⲓ ⲁⲩⲭⲱ ⲛ̀ⲛⲁⲓⲙⲟⲕⲙⲉⲕ ϧⲉⲛ ⲡⲟⲩϩⲏⲧ. ⲟⲩⲟϩ ϯⲕⲟⲗⲁⲥⲓⲥ ⲛ̀ⲧⲉ ⲡⲟⲩϭⲓⲛ̀ϫⲟⲛⲥ ⲁⲩⲭⲁⲥ ⲙ̀ⲡⲟⲩⲙⲑⲟ ⲉ̀ⲃⲟⲗ. ⲙⲏ ϧⲉⲛ ⲟⲩ ⲉⲣⲟⲩⲱ ⲉⲓⲉ̀ⲉⲣⲟⲩⲱ ⲛⲱⲟⲩ.		Son of man, these men have conceived their devices in their hearts, and have set before their faces the punishment of their iniquities: shall I indeed answer them?	Υἱὲ ἀνθρώπου, οἱ ἄνδρες οὗτοι ἔθεντο τὰ διανοήµατα αὐτῶν ἐπὶ τὰς καρδίας αὐτῶν καὶ τὴν κόλασιν τῶν ἀδικιῶν αὐτῶν ἔθηκαν πρὸ προσώπου αὐτῶν· εἰ ἀποκρινόµενος ἀποκριθῶ αὐτοῖς;						
Ezekiel	14	14	4	OT	1. OT	Major Prophets	4. Major Prophets	04. Major Prophets	06. Ezekiel	ⲉⲑⲃⲉ ⲫⲁⲓ ⲥⲁϫⲓ ⲛⲉⲙⲱⲟⲩ ⲁϫⲟⲥ ⲛⲱⲟⲩ. ϫⲉ ⲛⲁⲓ ⲛⲉ ⲛⲏ ⲉⲧⲉϥϫⲱ ⲙ̀ⲙⲱⲟⲩ ⲛ̀ϫⲉ ⲡϭ̅ⲥ̅. ϫⲉ ⲫⲣⲱⲙⲓ ⲫⲣⲱⲙⲓ ⲉ̀ⲃⲟⲗ ϧⲉⲛ ⲡⲏⲓ ⲙ̀ⲡⲓⲥ̅ⲗ̅. ⲫⲏ ⲉⲧⲭⲱ ⲛ̀ⲛⲉϥⲙⲉⲩⲓ ϧⲉⲛ ⲡⲉϥϩⲏⲧ. ⲟⲩⲟϩ ϯⲕⲟⲗⲁⲥⲓⲥ ⲛ̀ⲧⲉ ⲡⲉϥϭⲓⲛ̀ϫⲟⲛⲥ. ⲉϥⲉ̀ⲭⲁⲥ ⲙ̀ⲡⲉⲙ̀ⲑⲟ ⲉ̀ⲃⲟⲗ ⲙ̀ⲡⲉϥϩⲟ. ϣⲁϥⲓ̀ ϩⲁ ⲡⲓⲡⲣⲟⲫⲏⲧⲏⲥ ϣⲁϥϣⲉⲛϥ ⲛ̀ϧⲏⲧ. ⲁ̀ⲛⲟⲕ ⲡϭ̅ⲥ̅ ⲉⲓⲉ̀ⲉⲣⲟⲩⲱ ⲛⲁϥ ⲕⲁⲧⲁ ⲛⲓⲙⲉⲩⲓ ⲛ̀ⲧⲉ ⲡⲉϥϩⲏⲧ.		Therefore speak to them, and thou shalt say to them, Thus saith the Lord; Any man of the house of Israel, who shall conceive his devices in his heart, and shall set the punishment of his iniquity before his face, and shall come to the prophet; I the Lord will answer him according to the things in which his mind is entangled,	διὰ τοῦτο λάλησον αὐτοῖς καὶ ἐρεῖς πρὸς αὐτούς Τάδε λέγει κύριος Ἄνθρωπος ἄνθρωπος ἐκ τοῦ οἴκου Ισραηλ, ὃς ἂν θῇ τὰ διανοήµατα αὐτοῦ ἐπὶ τὴν καρδίαν αὐτοῦ καὶ τὴν κόλασιν τῆς ἀδικίας αὐτοῦ τάξῃ πρὸ προσώπου αὐτοῦ καὶ ἔλθῃ πρὸς τὸν προφήτην, ἐγὼ κύριος ἀποκριθήσοµαι αὐτῷ ἐν οἷς ἐνέχεται ἡ διάνοια αὐτοῦ,						
Ezekiel	14	14	5	OT	1. OT	Major Prophets	4. Major Prophets	04. Major Prophets	06. Ezekiel	ϩⲓⲛⲁ ⲉϥⲉ̀ⲧⲟⲙⲧ ⲙ̀ⲡⲏⲓ ⲙ̀ⲡⲓⲥ̅ⲗ̅ ⲕⲁⲧⲁ ⲛⲟⲩϩⲏⲧ ⲉⲧⲁⲩⲉⲣϣⲉⲙⲙⲟ ⲉ̀ⲣⲟⲓ ϧⲉⲛ ⲛⲟⲩⲙⲉⲩⲓ ⲛ̀ϩⲏⲧ.		that he should turn aside the house of Israel, according to their hearts that are estranged from me in their thoughts.	ὅπως πλαγιάσῃ τὸν οἶκον τοῦ Ισραηλ κατὰ τὰς καρδίας αὐτῶν τὰς ἀπηλλοτριωµένας ἀπ’ ἐµοῦ ἐν τοῖς ἐνθυµήµασιν αὐτῶν.						
Ezekiel	14	14	6	OT	1. OT	Major Prophets	4. Major Prophets	04. Major Prophets	06. Ezekiel	ⲉⲑⲃⲉ ⲫⲁⲓ ⲁϫⲟⲥ ⲛ̀ⲛⲉⲛϣⲏⲣⲓ ⲙ̀ⲡⲓⲥ̅ⲗ̅. ϫⲉ ⲛⲁⲓ ⲛⲉ ⲛⲏ ⲉⲧⲉϥϫⲱ ⲙ̀ⲙⲱⲟⲩ ⲛ̀ϫⲉ ⲡϭ̅ⲥ̅. ϫⲉ ⲧⲁⲥⲑⲟ ⲑⲏⲛⲟⲩ ⲉⲣⲉⲧⲉⲛⲕⲏⲛ ⲉ̀ⲃⲟⲗ ϧⲉⲛ ⲛⲉⲧⲉⲛϩⲃⲏⲟⲩⲓ. ⲟⲩⲟϩ ⲉ̀ⲃⲟⲗ ϧⲉⲛ ⲛⲉⲧⲉⲛⲙⲉⲧⲁⲥⲉⲃⲏⲥ ⲧⲏⲣⲟⲩ. ⲟⲩⲟϩ ⲉⲣⲉⲧⲉⲛⲧⲁⲥⲑⲟ ⲛ̀ⲛⲉⲧⲉⲛϩⲟ.		Therefore say to the house of Israel, Thus saith the Lord God, Be converted, and turn from your evil practices, and from all your sins, and turn your faces back again.	διὰ τοῦτο εἰπὸν πρὸς τὸν οἶκον τοῦ Ισραηλ Τάδε λέγει κύριος κύριος Ἐπιστράφητε καὶ ἀποστρέψατε ἀπὸ τῶν ἐπιτηδευµάτων ὑµῶν καὶ ἀπὸ πασῶν τῶν ἀσεβειῶν ὑµῶν καὶ ἐπιστρέψατε τὰ πρόσωπα ὑµῶν.						
Ezekiel	14	14	7	OT	1. OT	Major Prophets	4. Major Prophets	04. Major Prophets	06. Ezekiel	ϫⲉ ⲫⲣⲱⲙⲓ ⲉⲧϣⲟⲡ ⲉ̀ⲃⲟⲗ ϧⲉⲛ ⲡⲏⲓ ⲙ̀ⲡⲓⲥ̅ⲗ̅. ⲟⲩⲟϩ ⲉ̀ⲃⲟⲗ ϧⲉⲛ ⲛⲓⲡⲣⲉⲥⲃⲩⲧⲉ̀ⲣⲟⲥ ⲙ̀ⲡⲓⲥ̅ⲗ̅ ⲉⲧⲉⲣϣⲉⲙⲙⲟ ⲉ̀ⲣⲟⲓ. ⲟⲩⲟϩ ⲉϥⲉ̀ⲭⲱ ⲛ̀ⲛⲉϥⲙⲉⲩⲓ ϧⲉⲛ ⲡⲉϥϩⲏⲧ. ⲟⲩⲟϩ ϯⲕⲟⲗⲁⲥⲓⲥ ⲛ̀ⲧⲉϥⲕⲁⲕⲓⲁ ⲉϥⲉ̀ⲭⲁⲥ ⲙ̀ⲡⲉⲙ̀ⲑⲟ ⲉ̀ⲃⲟⲗ ⲙ̀ⲡⲉϥϩⲟ. ⲟⲩⲟϩ ⲉϥⲉ̀ⲓ̀ ϩⲁ ⲡⲓⲡⲣⲟⲫⲏⲧⲏⲥ ⲉ̀ϣⲉⲛϥ ⲛ̀ϧⲣⲏⲓ ⲛ̀ϧⲏⲧ. ⲁ̀ⲛⲟⲕ ⲡϭ̅ⲥ̅ ⲉⲓⲉ̀ⲉⲣⲟⲩⲱ ⲛⲁϥ ⲕⲁⲧⲁ ⲡⲉϥϩⲏⲧ.		For any man of the house of Israel, or of the strangers that sojourn in Israel, who shall separate himself from me, and conceive his imaginations in his heart, and set before his face the punishment of his iniquity, and come to the prophet to enquire of him concerning me; I the Lord will answer him, according to the things wherein he is entangled.	διότι ἄνθρωπος ἄνθρωπος ἐκ τοῦ οἴκου Ισραηλ καὶ ἐκ τῶν προσηλύτων τῶν προσηλυτευόντων ἐν τῷ Ισραηλ, ὃς ἂν ἀπαλλοτριωθῇ ἀπ’ ἐµοῦ καὶ θῆται τὰ ἐνθυµήµατα αὐτοῦ ἐπὶ τὴν καρδίαν αὐτοῦ καὶ τὴν κόλασιν τῆς ἀδικίας αὐτοῦ τάξῃ πρὸ προσώπου αὐτοῦ καὶ ἔλθῃ πρὸς τὸν προφήτην τοῦ ἐπερωτῆσαι αὐτὸν ἐν ἐµοί, ἐγὼ κύριος ἀποκριθήσοµαι αὐτῷ ἐν ᾧ ἐνέχεται ἐν αὐτῷ·						
Ezekiel	14	14	8	OT	1. OT	Major Prophets	4. Major Prophets	04. Major Prophets	06. Ezekiel	ⲉⲓⲉ̀ⲧⲁϫⲣⲉ ⲡⲁϩⲟ ⲉ̀ϫⲉⲛ ⲫⲣⲱⲙⲓ ⲉⲧⲉⲙ̀ⲙⲁⲩ ⲉⲓⲉ̀ⲭⲁϥ ⲉⲩϣⲁϥⲉ. ⲛⲉⲙ ⲟⲩⲧⲁⲕⲟ. ⲟⲩⲟϩ ⲉⲓⲉ̀ⲟⲗϥ ⲉ̀ⲃⲟⲗ ϧⲉⲛ ⲑⲙⲏϯ ⲙ̀ⲡⲁⲗⲁⲟⲥ. ⲉⲣⲉⲧⲉⲛⲉⲙⲓ ϫⲉ ⲁ̀ⲛⲟⲕ ⲡⲉ ⲡϭ̅ⲥ̅.		And I will set my face against that man, and will make him desolate and ruined, and will cut him off from the midst of my people; and ye shall know that I am the Lord.	καὶ στηριῶ τὸ πρόσωπόν µου ἐπὶ τὸν ἄνθρωπον ἐκεῖνον καὶ θήσοµαι αὐτὸν εἰς ἔρηµον καὶ εἰς ἀφανισµὸν καὶ ἐξαρῶ αὐτὸν ἐκ µέσου τοῦ λαοῦ µου· καὶ ἐπιγνώσεσθε ὅτι ἐγὼ κύριος.						
