book	chapter	chapter-zfilled	verse	testament	testament-indexed	section	section-indexed	section-indexed-no-testament	book-indexed	Bohairic	Sahidic	English	Greek	Fayyumic	Akhmimic	OldBohairic	Mesokemic	DialectP	Lycopolitan
Ezekiel	20	20	17	OT	1. OT	Major Prophets	4. Major Prophets	04. Major Prophets	06. Ezekiel	ⲁ ⲡⲁⲃⲁⲗ ϯⲁⲥⲟ ⲉ̀ⲣⲱⲟⲩ ⲉ̀ϣ̀ⲧⲉⲙϥⲟⲧⲟⲩ ⲉ̀ⲃⲟⲗ ⲟⲩⲟϩ ⲙ̀ⲡⲓⲓⲣⲓ ⲛⲱⲟⲩ ⲛ̀ⲟⲩⲥⲩⲛⲧⲉⲗⲓⲁ ϧⲉⲛ ⲡϣⲁϥⲉ.		Yet mine eyes spared them, so as not to destroy them utterly, and I did not make an end of them in the wilderness.	καὶ ἐφείσατο ὁ ὀφθαλµός µου ἐπ’ αὐτοὺς τοῦ ἐξαλεῖψαι αὐτοὺς καὶ οὐκ ἐποίησα αὐτοὺς εἰς συντέλειαν ἐν τῇ ἐρήµῳ.						
Ezekiel	20	20	18	OT	1. OT	Major Prophets	4. Major Prophets	04. Major Prophets	06. Ezekiel	ⲟⲩⲟϩ ⲁⲓϫⲟⲥ ⲛ̀ⲛⲟⲩϣⲏⲣⲓ ϩⲓ ⲡϣⲁϥⲉ. ϫⲉ ⲙ̀ⲡⲉⲣⲙⲟϣⲓ ϧⲉⲛ ⲛⲓⲛⲟⲙⲟⲥ ⲛ̀ⲛⲉⲧⲉⲛⲓⲟϯ. ⲟⲩⲟϩ ⲛⲟⲩⲙⲉⲑⲙⲏⲓ ⲙ̀ⲡⲉⲣⲁⲣⲉϩ ⲉ̀ⲣⲱⲟⲩ. ⲟⲩⲟϩ ⲙ̀ⲡⲉⲣⲑⲱϧ ⲛⲉⲙⲱⲟⲩ. ⲟⲩⲟϩ ⲙ̀ⲡⲉⲣϭⲱϧⲉⲙ ⲑⲏⲛⲟⲩ.		And I said to their children in the wilderness, Walk not ye in the customs of your fathers, and keep not their ordinances, and have no fellowship with their practices, nor defile yourselves with them.	καὶ εἶπα πρὸς τὰ τέκνα αὐτῶν ἐν τῇ ἐρήµῳ Ἐν τοῖς νοµίµοις τῶν πατέρων ὑµῶν µὴ πορεύεσθε καὶ τὰ δικαιώµατα αὐτῶν µὴ φυλάσσεσθε καὶ ἐν τοῖς ἐπιτηδεύµασιν αὐτῶν µὴ συναναµίσγεσθε καὶ µὴ µιαίνεσθε·						
Ezekiel	20	20	19	OT	1. OT	Major Prophets	4. Major Prophets	04. Major Prophets	06. Ezekiel	ⲁ̀ⲛⲟⲕ ⲡⲉ ⲡϭ̅ⲥ̅ ⲡⲉⲧⲉⲛⲛⲟⲩϯ. ⲁⲗⲗⲁ ⲙⲟϣⲓ ϧⲉⲛ ⲛⲁⲟⲩⲁϩⲥⲁϩⲛⲓ. ⲟⲩⲟϩ ⲁⲣⲉϩ ⲉ̀ⲛⲁⲙⲉⲑⲙⲏⲓ ⲉⲣⲉⲧⲉⲛⲁⲓⲧⲟⲩ.		I am the Lord your God; walk in my commandments, and keep mine ordinances, and do them;	ἐγὼ κύριος ὁ θεὸς ὑµῶν, ἐν τοῖς προστάγµασίν µου πορεύεσθε καὶ τὰ δικαιώµατά µου φυλάσσεσθε καὶ ποιεῖτε αὐτὰ						
Ezekiel	20	20	20	OT	1. OT	Major Prophets	4. Major Prophets	04. Major Prophets	06. Ezekiel	ⲟⲩⲟϩ ⲛⲁⲥⲁⲃⲃⲁⲧⲟⲛ ⲙⲁⲧⲟⲩⲃⲱⲟⲩ. ⲉⲩⲉ̀ϣⲱⲡⲓ ⲉⲩⲙⲏⲓⲛⲓ. ϧⲉⲛ ⲧⲁⲙⲏϯ ⲛⲉⲙ ⲧⲉⲧⲉⲛⲙⲏϯ. ⲉⲣⲉⲧⲉⲛⲉⲙⲓ ϫⲉ ⲁ̀ⲛⲟⲕ ⲡⲉ ⲡϭ̅ⲥ̅ ⲡⲉⲧⲉⲛⲛⲟⲩϯ.		and hallow my sabbaths, and let them be a sign between me and you, that ye may know that I am the Lord your God.	καὶ τὰ σάββατά µου ἁγιάζετε, καὶ ἔστω εἰς σηµεῖον ἀνὰ µέσον ἐµοῦ καὶ ὑµῶν τοῦ γινώσκειν διότι ἐγὼ κύριος ὁ θεὸς ὑµῶν.						
Ezekiel	20	20	21	OT	1. OT	Major Prophets	4. Major Prophets	04. Major Prophets	06. Ezekiel	ⲛ̀ⲑⲱⲟⲩ ⲇⲉ ⲁⲩϯϫⲱⲛⲧ ⲛⲏⲓ ⲛⲉⲙ ⲛⲟⲩϣⲏⲣⲓ. ⲙ̀ⲡⲟⲩⲙⲟϣⲓ ϧⲉⲛ ⲛⲁⲟⲩⲁϩⲥⲁϩⲛⲓ. ⲟⲩⲟϩ ⲙ̀ⲡⲟⲩⲁⲣⲉϩ ⲉ̀ⲛⲁⲙⲉⲑⲙⲏⲓ ⲉ̀ⲁⲓⲧⲟⲩ ⲛⲁⲓ ⲁϥϣⲁⲛⲁⲓⲧⲟⲩ ⲛ̀ϫⲉ ⲫⲣⲱⲙⲓ ϣⲁϥⲱⲛϧ ⲛ̀ϧⲏⲧⲟⲩ. ⲁⲩϭⲱϧⲉⲙ ⲛ̀ⲛⲁⲥⲁⲃⲃⲁⲧⲟⲛ ⲁⲓϫⲟⲥ ⲉ̀ⲑⲣⲓϫⲱϣ ⲙ̀ⲡⲁϫⲱⲛⲧ ⲉ̀ϩⲣⲏⲓ ⲉ̀ϫⲱⲟⲩ ⲛ̀ϩⲣⲏⲓ ϩⲓ ⲡϣⲁϥⲉ. ⲉ̀ⲑⲣⲓϫⲱⲕ ⲉ̀ⲃⲟⲗ ⲙ̀ⲡⲁⲙⲃⲟⲛ ⲉ̀ϫⲱⲟⲩ.		But they provoked me, and their children walked not in my commandments, and they took no heed to mine ordinances to do them, which if a man shall do, he shall even live in them, and they profaned my sabbaths: then I said that I would pour out my wrath upon them in the wilderness, to accomplish mine anger upon them.	καὶ παρεπίκρανάν µε καὶ τὰ τέκνα αὐτῶν, ἐν τοῖς προστάγµασίν µου οὐκ ἐπορεύθησαν, καὶ τὰ δικαιώµατά µου οὐκ ἐφυλάξαντο τοῦ ποιεῖν αὐτά, ἃ ποιήσει ἄνθρωπος καὶ ζήσεται ἐν αὐτοῖς, καὶ τὰ σάββατά µου ἐβεβήλουν. καὶ εἶπα τοῦ ἐκχέαι τὸν θυµόν µου ἐπ’ αὐτοὺς ἐν τῇ ἐρήµῳ τοῦ συντελέσαι τὴν ὀργήν µου ἐπ’ αὐτούς·						
Ezekiel	20	20	22	OT	1. OT	Major Prophets	4. Major Prophets	04. Major Prophets	06. Ezekiel	ⲟⲩⲟϩ ⲁⲓⲓⲣⲓ ϩⲓⲛⲁ ⲉ̀ϣ̀ⲧⲉⲙϭⲱϧⲉⲙ ⲙ̀ⲡⲁⲣⲁⲛ ⲉ̀ⲡⲧⲏⲣϥ ⲙ̀ⲡⲉⲙ̀ⲑⲟ ⲉ̀ⲃⲟⲗ ⲛ̀ⲛⲓⲉⲑⲛⲟⲥ. ⲛⲁⲓ ⲉⲧⲁⲓⲉⲛⲟⲩ ⲉ̀ⲃⲟⲗ ⲙ̀ⲡⲟⲩⲙ̀ⲑⲟ ⲉ̀ⲃⲟⲗ.		But I wrought so that my name might not be at all profaned before the Gentiles; and I brought them out in their sight.	καὶ ἐποίησα ὅπως τὸ ὄνοµά µου τὸ παράπαν µὴ βεβηλωθῇ ἐνώπιον τῶν ἐθνῶν, ὧν ἐξήγαγον αὐτοὺς κατ’ ὀφθαλµοὺς αὐτῶν.						
Ezekiel	20	20	23	OT	1. OT	Major Prophets	4. Major Prophets	04. Major Prophets	06. Ezekiel	ⲟⲩⲟϩ ⲁⲓⲓⲛⲓ ⲛ̀ⲧⲁϫⲓϫ ⲉ̀ϩⲣⲏⲓ ⲉ̀ϫⲱⲟⲩ ϧⲉⲛ ⲡϣⲁϥⲉ. ⲉ̀ⲑⲣⲓϫⲟⲣⲟⲩ ⲉ̀ⲃⲟⲗ ϧⲉⲛ ⲛⲓⲉⲑⲛⲟⲥ. ⲟⲩⲟϩ ⲉ̀ⲑⲣⲓϩⲓⲧⲟⲩ ⲉ̀ϧⲣⲏⲓ ϧⲉⲛ ⲛⲓⲭⲱⲣⲁ.		I lifted up my hand against them in the wilderness, that I would scatter them among the Gentiles, and disperse them in the countries;	καὶ ἐξῆρα τὴν χεῖρά µου ἐπ’ αὐτοὺς ἐν τῇ ἐρήµῳ τοῦ διασκορπίσαι αὐτοὺς ἐν τοῖς ἔθνεσιν καὶ διασπεῖραι αὐτοὺς ἐν ταῖς χώραις,						
Ezekiel	20	20	24	OT	1. OT	Major Prophets	4. Major Prophets	04. Major Prophets	06. Ezekiel	ⲉ̀ⲃⲟⲗ ϫⲉ ⲙ̀ⲡⲟⲩⲓⲣⲓ ⲛ̀ⲛⲁⲙⲉⲑⲙⲏⲓ. ⲁⲩⲭⲱ ⲛ̀ⲥⲱⲟⲩ ⲛ̀ⲛⲁⲡⲣⲟⲥⲧⲟⲅⲙⲁ. ⲁⲩϭⲱϧⲉⲙ ⲛ̀ⲛⲁⲥⲁⲃⲃⲁⲧⲟⲛ. ⲟⲩⲟϩ ⲛⲟⲩⲃⲁⲗ ⲛⲁⲩ ⲥⲁⲫⲁϩⲟⲩ ⲛ̀ⲛⲓⲟⲩⲱϣ ⲛ̀ⲧⲉ ⲛⲟⲩⲓⲟϯ.		because they kept not mine ordinances, and rejected my commandments, and profaned my sabbaths, and their eyes went after the imaginations of their fathers.	ἀνθ’ ὧν τὰ δικαιώµατά µου οὐκ ἐποίησαν καὶ τὰ προστάγµατά µου ἀπώσαντο καὶ τὰ σάββατά µου ἐβεβήλουν, καὶ ὀπίσω τῶν ἐνθυµηµάτων τῶν πατέρων αὐτῶν ἦσαν οἱ ὀφθαλµοὶ αὐτῶν.						
Ezekiel	20	20	25	OT	1. OT	Major Prophets	4. Major Prophets	04. Major Prophets	06. Ezekiel	ⲁ̀ⲛⲟⲕ ϩⲱ ⲁⲓϯ ⲛⲱⲟⲩ ⲛ̀ϩⲁⲛⲡⲣⲟⲥⲧⲟⲅⲙⲁ ⲉ̀ⲛⲁⲛⲉⲩ ⲁⲛ. ⲛⲉⲙ ϩⲁⲛⲙⲉⲑⲙⲏⲓ ⲛ̀ⲥⲉϣ̀ⲧⲉⲙⲱⲛϧ ⲁⲛ ⲛ̀ϩⲣⲏⲓ ⲛ̀ϧⲏⲧⲟⲩ.		So I gave them commandments that were not good, and ordinances in which they should not live.	καὶ ἐγὼ ἔδωκα αὐτοῖς προστάγµατα οὐ καλὰ καὶ δικαιώµατα ἐν οἷς οὐ ζήσονται ἐν αὐτοῖς.						
Ezekiel	20	20	26	OT	1. OT	Major Prophets	4. Major Prophets	04. Major Prophets	06. Ezekiel	ⲉⲓⲉ̀ϭⲱϧⲉⲙ ⲙ̀ⲙⲱⲟⲩ ϧⲉⲛ ⲛⲏ ⲉⲧⲟⲩϯ ⲙ̀ⲙⲱⲟⲩ. ϧⲉⲛ ⲡϫⲓⲛⲑⲣⲓⲓ̀ ⲉ̀ϫⲉⲛ ϩⲱⲟⲩⲧ ⲛⲓⲃⲉⲛ ⲉⲑⲟⲩⲱⲛ ⲛ̀ⲧⲟϯ ⲛ̀ⲧⲉ ⲧⲉϥⲙⲁⲩ ⲉⲧⲁⲕⲱⲟⲩ. ⲉ̀ⲑⲣⲟⲩⲉⲙⲓ ϫⲉ ⲁ̀ⲛⲟⲕ ⲡⲉ ⲡϭ̅ⲥ̅		And I will defile them by their own decrees, when I pass through upon every one that opens the womb, that I may destroy them.	καὶ µιανῶ αὐτοὺς ἐν τοῖς δόµασιν αὐτῶν ἐν τῷ διαπορεύεσθαί µε πᾶν διανοῖγον µήτραν ὅπως ἀφανίσω αὐτούς.						
Ezekiel	20	20	27	OT	1. OT	Major Prophets	4. Major Prophets	04. Major Prophets	06. Ezekiel	ⲉⲑⲃⲉ ⲫⲁⲓ ⲥⲁϫⲓ ⲛⲁϩⲣⲉⲛ ⲡⲏⲓ ⲙ̀ⲡⲓⲥ̅ⲗ̅. ⲡϣⲏⲣⲓ ⲙ̀ⲫⲣⲱⲙⲓ ⲁϫⲟⲥ ⲛⲱⲟⲩ ϫⲉ ⲛⲁⲓ ⲛⲉ ⲛⲏ ⲉⲧⲉϥϫⲱ ⲙ̀ⲙⲱⲟⲩ ⲛ̀ϫⲉ ⲡϭ̅ⲥ̅. ϫⲉ ϣⲁ ⲉ̀ϧⲟⲩⲛ ⲉ̀ϯⲛⲟⲩ ⲁⲩϯⲙⲃⲟⲛ ⲛⲏⲓ ⲛ̀ϫⲉ ⲛⲉⲧⲉⲛⲓⲟϯ ϧⲉⲛ ⲛⲟⲩⲡⲁⲣⲁⲡⲧⲱⲙⲁ ⲉⲧⲁⲩⲁⲓⲧⲟⲩ ⲉ̀ϧⲟⲩⲛ ⲉ̀ⲣⲟⲓ.		Therefore, son of man, speak to the house of Israel, and thou shalt say to them, Thus saith the Lord: Hitherto have your fathers provoked me in their trespasses in which they transgressed against me.	Διὰ τοῦτο λάλησον πρὸς τὸν οἶκον τοῦ Ισραηλ, υἱὲ ἀνθρώπου, καὶ ἐρεῖς πρὸς αὐτούς Τάδε λέγει κύριος Ἕως τούτου παρώργισάν µε οἱ πατέρες ὑµῶν ἐν τοῖς παραπτώµασιν αὐτῶν, ἐν οἷς παρέπεσον εἰς ἐµέ.						
Ezekiel	20	20	28	OT	1. OT	Major Prophets	4. Major Prophets	04. Major Prophets	06. Ezekiel	ⲟⲩⲟϩ ⲁⲓϭⲓⲧⲟⲩ ⲉ̀ϧⲟⲩⲛ ⲉ̀ⲡⲕⲁϩⲓ. ⲫⲁⲓ ⲉⲧⲁⲓⲥⲟⲩⲧⲉⲛ ⲧⲁϫⲓϫ ⲉ̀ϩⲣⲏⲓ ⲉ̀ϫⲱϥ ⲉ̀ⲧⲏⲓϥ ⲛⲱⲟⲩ. ⲁⲩⲛⲁⲩ ⲉ̀ⲕⲁⲗⲁⲙⲫⲟ ⲛⲓⲃⲉⲛ ⲉⲧϭⲟⲥⲓ. ⲛⲉⲙ ϣϣⲏⲛ ⲛⲓⲃⲉⲛ ⲉⲧⲟⲓ ⲛ̀ϧⲏⲓⲃⲓ. ⲁⲩⲧⲁⲗⲟ ⲑⲩⲥⲓⲁ ⲉ̀ⲡϣⲱⲓ ϧⲉⲛ ⲡⲓⲙⲁ ⲉⲧⲉⲙ̀ⲙⲁⲩ ⲛ̀ⲛⲟⲩⲛⲟⲩϯ. ⲟⲩⲟϩ ⲁⲩⲧⲁⲗⲟ ⲉ̀ⲡϣⲱⲓ ⲙ̀ⲙⲁⲩ ⲛ̀ϩⲁⲛⲥⲑⲟⲓⲛⲟⲩϥⲓ. ⲟⲩⲟϩ ⲁⲩϣⲱⲧ ⲉ̀ⲃⲟⲗ ⲙ̀ⲙⲁⲩ ⲛ̀ϩⲁⲛⲟⲩⲱⲧⲉⲛ ⲉ̀ⲃⲟⲗ.		Whereas I brought them into the land concerning which I lifted up mine hand to give it them; and they looked upon every high hill, and every shady tree, and they sacrificed there to their gods, and offered there sweet-smelling savour, and there they poured out their drink-offerings.	καὶ εἰσήγαγον αὐτοὺς εἰς τὴν γῆν, ἣν ἦρα τὴν χεῖρά µου τοῦ δοῦναι αὐτοῖς, καὶ εἶδον πᾶν βουνὸν ὑψηλὸν καὶ πᾶν ξύλον κατάσκιον καὶ ἔθυσαν ἐκεῖ τοῖς θεοῖς αὐτῶν καὶ ἔταξαν ἐκεῖ ὀσµὴν εὐωδίας καὶ ἔσπεισαν ἐκεῖ σπονδὰς αὐτῶν.						
Ezekiel	20	20	29	OT	1. OT	Major Prophets	4. Major Prophets	04. Major Prophets	06. Ezekiel	ⲟⲩⲟϩ ⲁⲓϫⲟⲥ ⲛⲱⲟⲩ ϫⲉ ⲛⲓⲙ ⲡⲉ ⲁⲃⲁⲛⲁ. ϫⲉ ⲉⲧⲉⲧⲉⲛϣⲉ ⲉ̀ⲙⲁⲩ ⲛ̀ⲑⲱⲧⲉⲛ. ⲟⲩⲟϩ ⲁⲩⲙⲟⲩϯ ⲉ̀ⲡⲉϥⲣⲁⲛ ϫⲉ ⲁⲃⲁⲛⲁ. ϣⲁ ⲉ̀ϧⲟⲩⲛ ⲉ̀ⲫⲟⲟⲩ ⲛ̀ⲉϩⲟⲟⲩ.		And I said to them, What is Abama, that ye go in thither? and they called its name Abama, until this day.	καὶ εἶπον πρὸς αὐτούς Τί ἐστιν Αβαµα, ὅτι ὑµεῖς εἰσπορεύεσθε ἐκεῖ; καὶ ἐπεκάλεσαν τὸ ὄνοµα αὐτοῦ Αβαµα ἕως τῆς σήµερον ἡµέρας.						
Ezekiel	20	20	30	OT	1. OT	Major Prophets	4. Major Prophets	04. Major Prophets	06. Ezekiel	ⲉⲑⲃⲉ ⲫⲁⲓ ⲁϫⲟⲥ ⲛⲁϩⲣⲉⲛ ⲡⲏⲓ ⲙ̀ⲡⲓⲥ̅ⲗ̅. ϫⲉ ⲛⲁⲓ ⲛⲉ ⲛⲏ ⲉⲧⲉϥϫⲱ ⲙ̀ⲙⲱⲟⲩ ⲛ̀ϫⲉ ⲡϭ̅ⲥ̅ ⲡϭ̅ⲥ̅ ⲫϯ. ϫⲉ ⲉ̀ⲛⲁⲣⲉⲧⲉⲧⲉⲛϭⲱϧⲉⲙ ⲙ̀ⲙⲱⲧⲉⲛ ϧⲉⲛ ⲛⲁⲙⲟⲙⲓⲟⲛ. ⲛⲉⲙ ⲛⲓⲁⲛⲟⲙⲓⲁ ⲛ̀ⲧⲉ ⲛⲉⲧⲉⲛⲓⲟϯ. ⲟⲩⲟϩ ⲉ̀ⲛⲁⲣⲉⲧⲉⲛⲛⲁⲡⲟⲣⲛⲉⲩⲓⲛ ⲛ̀ⲑⲱⲧⲉⲛ ϧⲉⲛ ⲛⲓϩⲃⲏⲟⲩⲓ ⲛ̀ⲛⲉⲧⲉⲛϫⲓϫ. ⲥⲁⲫⲁϩⲟⲩ ⲛ̀ⲛⲟⲩⲃⲟϯ.		Therefore say to the house of Israel, Thus saith the Lord, Do ye pollute yourselves with the iniquities of your fathers, and do ye go a-whoring after their abominations,	διὰ τοῦτο εἰπὸν πρὸς τὸν οἶκον τοῦ Ισραηλ Τάδε λέγει κύριος Εἰ ἐν ταῖς ἀνοµίαις τῶν πατέρων ὑµῶν ὑµεῖς µιαίνεσθε καὶ ὀπίσω τῶν βδελυγµάτων αὐτῶν ὑµεῖς ἐκπορνεύετε;						
Ezekiel	20	20	31	OT	1. OT	Major Prophets	4. Major Prophets	04. Major Prophets	06. Ezekiel	ⲟⲩⲟϩ ⲛⲁⲣⲉⲧⲉⲛϭⲱϧⲉⲙ ⲑⲏⲛⲟⲩ ϧⲉⲛ ⲛⲓⲁⲡⲁⲣⲭⲏ ⲉⲣⲉⲧⲉⲛⲙⲏⲓⲧⲟⲩ. ϧⲉⲛ ⲛⲏ ⲉⲣⲉⲧⲉⲛⲫⲱⲣϫ ⲙ̀ⲙⲱⲟⲩ ⲉ̀ⲃⲟⲗ ϧⲉⲛ ⲛⲉⲧⲉⲛⲟⲩⲱϣ ⲧⲏⲣⲟⲩ. ϣⲁ ⲉ̀ϧⲟⲩⲛ ⲉ̀ⲡⲁⲓⲉϩⲟⲟⲩ ⲫⲁⲓ. ⲟⲩⲟϩ ⲁ̀ⲛⲟⲕ ⲙⲏ ⲉⲓⲉ̀ⲉⲣⲟⲩⲱ ⲛⲱⲧⲉⲛ ⲡⲏⲓ ⲙ̀ⲡⲓⲥ̅ⲗ̅. ϯⲟⲛϧ ⲁ̀ⲛⲟⲕ ⲡⲉϫⲉ ⲡϭ̅ⲥ̅ ϫⲉ ⲛ̀ⲛⲁⲉⲣⲟⲩⲱ ⲛⲱⲧⲉⲛ ⲁⲛ. ⲟⲩⲟϩ ⲉ̀ϣⲱⲡ ⲫⲁⲓ ⲛⲁⲓ ⲉ̀ϩⲣⲏⲓ ⲉ̀ϫⲉⲛ ⲡⲉⲧⲉⲛⲡⲛ̅ⲁ̅.		and do ye pollute yourselves with the first-fruits of your gifts, in the offerings wherewith ye pollute yourselves in all your imaginations, until this day; and shall I answer you, O house of Israel? As I live, saith the Lord, I will not answer you, neither shall this thing come upon your spirit.	καὶ ἐν ταῖς ἀπαρχαῖς τῶν δοµάτων ὑµῶν ἐν τοῖς ἀφορισµοῖς ὑµεῖς µιαίνεσθε ἐν πᾶσιν τοῖς ἐνθυµήµασιν ὑµῶν ἕως τῆς σήµερον ἡµέρας. καὶ ἐγὼ ἀποκριθῶ ὑµῖν, οἶκος τοῦ Ισραηλ; ζῶ ἐγώ, λέγει κύριος, εἰ ἀποκριθήσοµαι ὑµῖν, καὶ εἰ ἀναβήσεται ἐπὶ τὸ πνεῦµα ὑµῶν τοῦτο.						
Ezekiel	20	20	32	OT	1. OT	Major Prophets	4. Major Prophets	04. Major Prophets	06. Ezekiel	ⲟⲩⲟϩ ⲉϥⲉ̀ϣⲱⲡⲓ ⲁⲛ ⲕⲁⲧⲁ ⲫⲣⲏϯ ⲉⲣⲉⲧⲉⲛϫⲱ ⲙ̀ⲙⲟⲥ. ⲛ̀ⲑⲱⲧⲉⲛ. ϫⲉ ⲧⲉⲛⲛⲁⲉⲣ ⲙ̀ⲫⲣⲏϯ ⲛ̀ⲛⲓⲉⲑⲛⲟⲥ. ⲟⲩⲟϩ ⲙ̀ⲫⲣⲏϯ ⲛ̀ⲛⲓⲫⲩⲗⲏ ⲛ̀ⲧⲉ ⲡⲕⲁϩⲓ. ⲉ̀ⲑⲣⲉⲛϣⲉⲙϣⲓ ⲛ̀ⲛⲓϣⲉ ⲛⲉⲙ ⲛⲓⲱⲛⲓ.		And it shall not be as ye say, We will be as the nations, and as the tribes of the earth, to worship stocks and stones.	καὶ οὐκ ἔσται ὃν τρόπον ὑµεῖς λέγετε Ἐσόµεθα ὡς τὰ ἔθνη καὶ ὡς αἱ φυλαὶ τῆς γῆς τοῦ λατρεύειν ξύλοις καὶ λίθοις.						
Ezekiel	20	20	33	OT	1. OT	Major Prophets	4. Major Prophets	04. Major Prophets	06. Ezekiel	ⲉⲑⲃⲉ ⲫⲁⲓ ϯⲟⲛϧ ⲁ̀ⲛⲟⲕ ⲡⲉϫⲉ ⲡϭ̅ⲥ̅. ϫⲉ ϧⲉⲛ ⲟⲩϫⲓϫ ⲉⲥⲁⲙⲁϩⲓ. ⲛⲉⲙ ⲟⲩϣⲱⲃϣ ⲉϥϭⲟⲥⲓ. ⲛⲉⲙ ⲟⲩⲛⲓϣϯ ⲛ̀ⲙⲃⲟⲛ. ϯⲛⲁⲉⲣⲟⲩⲣⲟ ⲉ̀ϫⲉⲛ ⲑⲏⲛⲟⲩ.		Therefore, as I live, saith the Lord, I will reign over you with a strong hand, and with a high arm, and with outpoured wrath:	διὰ τοῦτο ζῶ ἐγώ, λέγει κύριος, ἐν χειρὶ κραταιᾷ καὶ ἐν βραχίονι ὑψηλῷ καὶ ἐν θυµῷ κεχυµένῳ βασιλεύσω ἐφ’ ὑµᾶς·						
Ezekiel	20	20	34	OT	1. OT	Major Prophets	4. Major Prophets	04. Major Prophets	06. Ezekiel	ⲉⲓⲉ̀ⲉⲛ ⲑⲏⲛⲟⲩ ⲉ̀ⲃⲟⲗ ϧⲉⲛ ⲛⲓⲉⲑⲛⲟⲥ. ⲟⲩⲟϩ ⲉⲓⲉ̀ϣⲉⲡ ⲑⲏⲛⲟⲩ ⲉⲣⲟⲓ ⲉ̀ⲃⲟⲗ ϧⲉⲛ ⲛⲓⲭⲱⲣⲁ. ⲛⲁⲓ ⲉⲧⲁⲩϫⲉⲣ ⲑⲏⲛⲟⲩ ⲉ̀ⲃⲟⲗ ⲛ̀ϧⲏⲧⲟⲩ. ϧⲉⲛ ⲟⲩϫⲓϫ ⲉⲥⲁⲙⲁϩⲓ. ⲛⲉⲙ ⲟⲩϣⲱⲃϣ ⲉϥϭⲟⲥⲓ. ⲛⲉⲙ ⲟⲩⲛⲓϣϯ ⲛ̀ⲉⲙⲃⲟⲛ.		I will bring you out from the nations, and will take you out of the lands wherein ye were dispersed, with a strong hand, and with a high arm, and with outpoured wrath.	καὶ ἐξάξω ὑµᾶς ἐκ τῶν λαῶν καὶ εἰσδέξοµαι ὑµᾶς ἐκ τῶν χωρῶν, οὗ διεσκορπίσθητε ἐν αὐταῖς, ἐν χειρὶ κραταιᾷ καὶ ἐν βραχίονι ὑψηλῷ καὶ ἐν θυµῷ κεχυµένῳ·						
Ezekiel	20	20	35	OT	1. OT	Major Prophets	4. Major Prophets	04. Major Prophets	06. Ezekiel	ⲧⲁⲉⲛ ⲑⲏⲛⲟⲩ ⲉ̀ⲃⲟⲗ ⲉ̀ⲟⲩⲕⲁϩⲓ ⲛ̀ϣⲁϥⲉ ⲙ̀ⲙⲟⲛ ⲗⲁⲟⲥ ⲛ̀ϧⲏⲧϥ. ⲉⲓⲉ̀ϭⲓϩⲁⲡ ⲛⲉⲙⲱⲧⲉⲛ ϧⲉⲛ ⲡⲓⲙⲁ ⲉⲧⲉⲙ̀ⲙⲁⲩ ⲛ̀ϩⲟ ⲟⲩⲃⲉ ϩⲟ.		And I will bring you into the wilderness of the nations, and will plead with you there face to face.	καὶ ἄξω ὑµᾶς εἰς τὴν ἔρηµον τῶν λαῶν καὶ διακριθήσοµαι πρὸς ὑµᾶς ἐκεῖ πρόσωπον κατὰ πρόσωπον.						
Ezekiel	20	20	36	OT	1. OT	Major Prophets	4. Major Prophets	04. Major Prophets	06. Ezekiel	ⲙ̀ⲫⲣⲏϯ ⲉⲧⲁⲓϭⲓϩⲁⲡ ⲛⲉⲙ ⲛⲉⲧⲉⲛⲓⲟϯ ϧⲉⲛ ϯⲉⲣⲉⲙⲓⲁ. ϧⲉⲛ ⲡⲕⲁϩⲓ ⲛ̀ⲭⲏⲙⲓ. ⲡⲉϫⲉ ⲡϭ̅ⲥ̅.		As I pleaded with your fathers in the wilderness of the land of Egypt, so will I judge you, saith the Lord.	ὃν τρόπον διεκρίθην πρὸς τοὺς πατέρας ὑµῶν ἐν τῇ ἐρήµῳ γῆς Αἰγύπτου, οὕτως κρινῶ ὑµᾶς, λέγει κύριος·						
Ezekiel	20	20	37	OT	1. OT	Major Prophets	4. Major Prophets	04. Major Prophets	06. Ezekiel	ⲉⲓⲉ̀ⲉⲛ ⲑⲏⲛⲟⲩ ϧⲉⲛ ⲡⲁϣⲃⲱⲧ. ⲟⲩⲟϩ ⲉⲓⲉ̀ⲉⲛ ⲑⲏⲛⲟⲩ		And I will cause you to pass under my rod, and I will bring you in by number.	καὶ διάξω ὑµᾶς ὑπὸ τὴν ῥάβδον µου καὶ εἰσάξω ὑµᾶς ἐν ἀριθµῷ						
Ezekiel	20	20	38	OT	1. OT	Major Prophets	4. Major Prophets	04. Major Prophets	06. Ezekiel	ϧⲉⲛ ⲡⲟⲩⲙⲁⲛϣⲱⲡⲓ. ⲉ̀ϣ̀ⲧⲉⲙϣⲉ ⲉ̀ϧⲟⲩⲛ ⲉ̀ⲡⲕⲁϩⲓ ⲙ̀ⲡⲓⲥ̅ⲗ̅ ⲉⲣⲉⲧⲉⲛⲉⲙⲓ ϫⲉ ⲁ̀ⲛⲟⲕ ⲡⲉ ⲡϭ̅ⲥ̅.		And I will separate from among you the ungodly and the revolters; for I will lead them forth out of their place of sojourning, and they shall not enter into the land of Israel: and ye shall know that I am the Lord, even the Lord.	καὶ ἐκλέξω ἐξ ὑµῶν τοὺς ἀσεβεῖς καὶ τοὺς ἀφεστηκότας, διότι ἐκ τῆς παροικεσίας αὐτῶν ἐξάξω αὐτούς, καὶ εἰς τὴν γῆν τοῦ Ισραηλ οὐκ εἰσελεύσονται· καὶ ἐπιγνώσεσθε διότι ἐγὼ κύριος.						
Ezekiel	20	20	39	OT	1. OT	Major Prophets	4. Major Prophets	04. Major Prophets	06. Ezekiel	ⲟⲩⲟϩ ⲛ̀ⲑⲱⲧⲉⲛ ⲡⲏⲓ ⲙ̀ⲡⲓⲥ̅ⲗ̅. ⲛⲁⲓ ⲛⲉ ⲛⲏ ⲉⲧⲉϥϫⲱ ⲙ̀ⲙⲱⲟⲩ ⲛ̀ϫⲉ ⲁⲇⲱⲛⲁⲓ ⲡϭ̅ⲥ̅ ϫⲉ ⲙⲁⲣⲉ ⲫⲟⲩⲁⲓ ⲫⲟⲩⲁⲓ ⲓⲛⲓ ⲉ̀ⲃⲟⲗ ⲛ̀ϧⲏⲧϥ ⲛ̀ⲛⲉϥⲡⲉⲧϩⲱⲟⲩ. ⲟⲩⲟϩ ⲙⲉⲛⲉⲛⲥⲁ ⲛⲁⲓ ⲉⲣⲉⲧⲉⲛⲥⲱⲧⲉⲙ ⲛ̀ⲥⲱⲓ. ⲟⲩⲟϩ ⲙ̀ⲡⲉⲣϭⲱϧⲉⲙ ⲙ̀ⲡⲁⲣⲁⲛ ⲉⲑⲟⲩⲁⲃ ⲓⲥϫⲉⲛ ϯⲛⲟⲩ. ϧⲉⲛ ⲛⲉⲧⲉⲛⲇⲱⲣⲟⲛ ⲛⲉⲙ ⲛⲉⲧⲉⲛϩⲃⲏⲟⲩⲓ. ⲛⲉⲙ ⲛⲉⲧⲉⲛⲑⲩⲥⲓⲁ.		And as to you, O house of Israel, thus saith the Lord, even the Lord; Put away each one his evil practices, and hereafter if ye hearken to me, then shall ye no more profane my holy name by your gifts and by devices.	καὶ ὑµεῖς, οἶκος Ισραηλ, τάδε λέγει κύριος κύριος Ἕκαστος τὰ ἐπιτηδεύµατα αὐτοῦ ἐξάρατε· καὶ µετὰ ταῦτα εἰ µὴ ὑµεῖς εἰσακούετέ µου καὶ τὸ ὄνοµά µου τὸ ἅγιον οὐ βεβηλώσετε οὐκέτι ἐν τοῖς δώροις ὑµῶν καὶ ἐν τοῖς ἐπιτηδεύµασιν ὑµῶν·						
Ezekiel	20	20	40	OT	1. OT	Major Prophets	4. Major Prophets	04. Major Prophets	06. Ezekiel	ⲉⲑⲃⲉ ϫⲉ ⲡⲁⲧⲱⲟⲩ ⲉⲑⲟⲩⲁⲃ. ⲡⲓⲧⲱⲟⲩ ⲉⲧϭⲏⲥ ⲉⲩⲉ̀ⲉⲣⲃⲱⲕ ⲛⲏⲓ ⲙ̀ⲙⲁⲩ ϣⲁ ⲉ̀ⲃⲟⲗ ⲛ̀ϫⲉ ⲡⲏⲓ ⲧⲏⲣϥ ⲙ̀ⲡⲓⲥ̅ⲗ̅. ⲡⲉϫⲉ ⲁⲇⲱⲛⲁⲓ ⲡϭ̅ⲥ̅. ⲟⲩⲟϩ ϧⲉⲛ ⲡⲓⲙⲁ ⲉⲧⲉⲙ̀ⲙⲁⲩ ϯⲛⲁϣⲟⲡⲟⲩ ⲉ̀ⲣⲟⲓ. ⲉⲓⲉ̀ϫⲉⲙⲡϣⲓⲛⲓ ⲛ̀ⲛⲉⲧⲉⲛⲁⲡⲁⲣⲭⲏ ⲛⲉⲙ ⲛⲓⲁⲡⲁⲣⲭⲏ. ⲛⲏ ⲉⲣⲉⲧⲉⲛⲑⲁϣⲟⲩ ⲉ̀ⲃⲟⲗ ϧⲉⲛ ⲛⲉⲧⲉⲛⲡⲉⲑⲟⲩⲁⲃ ⲧⲏⲣⲟⲩ.		For upon my holy mountain, on the high mountain, saith the Lord, even the Lord, there shall all the house of Israel serve me for ever: and there will I accept you, and there will I have respect to your first-fruits, and the first-fruits of your offerings, in all your holy things.	διότι ἐπὶ τοῦ ὄρους τοῦ ἁγίου µου, ἐπ’ ὄρους ὑψηλοῦ, λέγει κύριος κύριος, ἐκεῖ δουλεύσουσίν µοι πᾶς οἶκος Ισραηλ εἰς τέλος, καὶ ἐκεῖ προσδέξοµαι καὶ ἐκεῖ ἐπισκέψοµαι τὰς ἀπαρχὰς ὑµῶν καὶ τὰς ἀπαρχὰς τῶν ἀφορισµῶν ὑµῶν ἐν πᾶσιν τοῖς ἁγιάσµασιν ὑµῶν·						
Ezekiel	20	20	41	OT	1. OT	Major Prophets	4. Major Prophets	04. Major Prophets	06. Ezekiel	ϯⲛⲁϣⲉⲡ ⲑⲏⲛⲟⲩ ⲉ̀ⲣⲟⲓ ϧⲉⲛ ⲟⲩⲥⲑⲟⲓⲛⲟⲩϥⲓ. ϧⲉⲛ ⲡϫⲓⲛⲉⲑⲣⲓⲉⲛ ⲑⲏⲛⲟⲩ ⲉ̀ⲃⲟⲗ ϧⲉⲛ ⲛⲓⲗⲁⲟⲥ ⲟⲩⲟϩ ⲉⲓⲉ̀ϣⲉⲡ ⲑⲏⲛⲟⲩ ⲉ̀ⲣⲟⲓ ⲉ̀ⲃⲟⲗ ϧⲉⲛ ⲛⲓⲭⲱⲣⲁ. ⲛⲁⲓ ⲉⲧⲁⲩϫⲉⲣ ⲑⲏⲛⲟⲩ ⲉ̀ⲃⲟⲗ ⲛ̀ϧⲏⲧⲟⲩ. ⲧⲁϣⲱⲡⲓ ⲉⲓⲟⲩⲁⲃ ϧⲉⲛ ⲑⲏⲛⲟⲩ ⲙ̀ⲡⲉⲙ̀ⲑⲟ ⲉ̀ⲃⲟⲗ ⲛ̀ⲛⲓⲉⲑⲛⲟⲥ.		I will accept you with a sweet-smelling savour, when I bring you out from the nations, and take you out of the countries wherein ye have been dispersed; and I will be sanctified among you in the sight of the nations.	ἐν ὀσµῇ εὐωδίας προσδέξοµαι ὑµᾶς ἐν τῷ ἐξαγαγεῖν µε ὑµᾶς ἐκ τῶν λαῶν καὶ εἰσδέχεσθαι ὑµᾶς ἐκ τῶν χωρῶν, ἐν αἷς διεσκορπίσθητε ἐν αὐταῖς, καὶ ἁγιασθήσοµαι ἐν ὑµῖν κατ’ ὀφθαλµοὺς τῶν λαῶν.						
Ezekiel	20	20	42	OT	1. OT	Major Prophets	4. Major Prophets	04. Major Prophets	06. Ezekiel	ⲉⲣⲉⲧⲉⲛⲉⲙⲓ ϫⲉ ⲁ̀ⲛⲟⲕ ⲡⲉ ⲡϭ̅ⲥ̅. ϧⲉⲛ ⲡϫⲓⲛⲉⲑⲣⲓϭⲓ ⲑⲏⲛⲟⲩ ⲉ̀ϧⲟⲩⲛ ⲉ̀ⲡⲕⲁϩⲓ ⲙ̀ⲡⲓⲥ̅ⲗ̅. ⲡⲓⲕⲁϩⲓ ⲉⲧⲁⲓⲥⲟⲩⲧⲉⲛ ⲧⲁϫⲓϫ ⲉ̀ⲃⲟⲗ ⲉ̀ⲣⲟϥ. ⲉ̀ⲑⲣⲓⲧⲏⲓϥ ⲛ̀ⲛⲉⲧⲉⲛⲓⲟϯ.		And ye shall know that I am the Lord, when I have brought you into the land of Israel, into the land concerning which I lifted up my hand to give it to your fathers.	καὶ ἐπιγνώσεσθε διότι ἐγὼ κύριος ἐν τῷ εἰσαγαγεῖν µε ὑµᾶς εἰς τὴν γῆν τοῦ Ισραηλ εἰς τὴν γῆν, εἰς ἣν ἦρα τὴν χεῖρά µου τοῦ δοῦναι αὐτὴν τοῖς πατράσιν ὑµῶν.						
Ezekiel	20	20	43	OT	1. OT	Major Prophets	4. Major Prophets	04. Major Prophets	06. Ezekiel	ⲟⲩⲟϩ ⲉⲣⲉⲧⲉⲛⲓⲣⲓ ⲙ̀ⲡⲁⲙⲉⲩⲓ. ϧⲉⲛ ⲡⲓⲙⲁ ⲉⲧⲉⲙ̀ⲙⲁⲩ ⲛⲉⲙ ⲛⲉⲧⲉⲛϩⲃⲏⲟⲩⲓ. ⲛⲁⲓ ⲉⲧⲁⲣⲉⲧⲉⲛϭⲱϧⲉⲙ ⲛ̀ϧⲣⲏⲓ ⲛ̀ϧⲏⲧⲟⲩ. ⲉⲣⲉⲧⲉⲛⲛⲁⲩ ⲉ̀ⲛⲉⲧⲉⲛϩⲟ ϧⲉⲛ ⲛⲉⲧⲉⲛⲕⲁⲕⲓⲁ ⲧⲏⲣⲟⲩ.		And ye shall there remember your ways, and your devices wherewith ye defiled yourselves; and ye shall bewail yourselves for all your wickedness.	καὶ µνησθήσεσθε ἐκεῖ τὰς ὁδοὺς ὑµῶν καὶ τὰ ἐπιτηδεύµατα ὑµῶν, ἐν οἷς ἐµιαίνεσθε ἐν αὐτοῖς, καὶ κόψεσθε τὰ πρόσωπα ὑµῶν ἐν πάσαις ταῖς κακίαις ὑµῶν.						
