book	chapter	chapter-zfilled	verse	testament	testament-indexed	section	section-indexed	section-indexed-no-testament	book-indexed	Bohairic	Sahidic	English	Greek	Fayyumic	Akhmimic	OldBohairic	Mesokemic	DialectP	Lycopolitan
Ezekiel	19	19	2	OT	1. OT	Major Prophets	4. Major Prophets	04. Major Prophets	06. Ezekiel	ⲁϫⲟⲥ ϫⲉ ⲉⲑⲃⲉ ⲟⲩ ⲧⲉⲕⲙⲁⲩ. ⲁⲥⲉⲣ ⲟⲩⲙⲁⲥ ⲙ̀ⲙⲟⲩⲓ. ϧⲉⲛ ⲑⲙⲏϯ ⲛ̀ⲛⲓⲙⲟⲩⲓ ⲁⲥⲧⲁϣⲉ ⲛⲉⲥⲙⲁⲥ ⲙ̀ⲙⲟⲩⲓ. ϧⲉⲛ ⲑⲙⲏϯ ⲛ̀ⲛⲓⲙⲟⲩⲓ. ⲟⲩⲟϩ ⲟⲩⲟⲧ ⲡⲉ ⲡⲥⲙⲟⲧ ⲛ̀ⲛⲉⲥⲙⲁⲥ ⲙ̀ⲙⲟⲩⲓ.		and say, Why is thy mother become a whelp in the midst of lions? in the midst of lions she has multiplied her whelps.	καὶ ἐρεῖς Τί ἡ µήτηρ σου; σκύµνος· ἐν µέσῳ λεόντων ἐγενήθη, ἐν µέσῳ λεόντων ἐπλήθυνεν σκύµνους αὐτῆς.						
Ezekiel	19	19	3	OT	1. OT	Major Prophets	4. Major Prophets	04. Major Prophets	06. Ezekiel	ⲁϥⲫⲱⲧ ⲉ̀ⲃⲟⲗ ⲛ̀ϫⲉ ⲟⲩⲁⲓ ϧⲉⲛ ⲛⲉⲥⲙⲁⲥ ⲁϥⲉⲣⲟⲩⲙⲟⲩⲓ. ⲁϥϭⲓⲥⲃⲱ ⲉ̀ϩⲱⲗⲉⲙ ⲛ̀ⲟⲩϩⲱⲗⲉⲙ ⲁϥⲟⲩⲉⲙ ⲣⲱⲙⲓ.		And one of her whelps sprang forth; he became a lion, and learned to take prey, he devoured men.	καὶ ἀπεπήδησεν εἷς τῶν σκύµνων αὐτῆς, λέων ἐγένετο καὶ ἔµαθεν τοῦ ἁρπάζειν ἁρπάγµατα, ἀνθρώπους ἔφαγεν.						
Ezekiel	19	19	4	OT	1. OT	Major Prophets	4. Major Prophets	04. Major Prophets	06. Ezekiel	ⲁⲩⲥⲱⲧⲉⲙ ⲉⲑⲃⲏⲧϥ ⲛ̀ϫⲉ ⲛⲓⲉⲑⲛⲟⲥ. ⲁⲩⲧⲁϩⲟϥ ϧⲉⲛ ⲡⲉϥⲧⲁⲕⲟ. ⲟⲩⲟϩ ⲁⲩⲓⲛⲓ ⲙ̀ⲙⲟϥ ϧⲉⲛ ⲟⲩϣⲧⲟϥ ⲉ̀ⲡϣⲱⲓ ⲉ̀ⲭⲏⲙⲓ.		And the nations heard a report of him; he was caught in their pit, and they brought him into the land of Egypt in chains.	καὶ ἤκουσαν κατ’ αὐτοῦ ἔθνη, ἐν τῇ διαφθορᾷ αὐτῶν συνελήµφθη, καὶ ἤγαγον αὐτὸν ἐν κηµῷ εἰς γῆν Αἰγύπτου.						
Ezekiel	19	19	5	OT	1. OT	Major Prophets	4. Major Prophets	04. Major Prophets	06. Ezekiel	ⲟⲩⲟϩ ⲁⲥⲛⲁⲩ ϫⲉ ⲁⲩⲟⲗϥ ⲛ̀ⲧⲟⲧⲥ. ⲟⲩⲟϩ ϫⲉ ⲁ ⲧⲉⲥϫⲟⲙ ⲧⲁⲕⲟ. ⲁⲥϭⲓ ⲕⲉⲟⲩⲁⲓ ⲉ̀ⲃⲟⲗ ϧⲉⲛ ⲛⲉⲥⲙⲁⲥ ⲙ̀ⲙⲟⲩⲓ ⲁⲥⲓⲣⲓ ⲙ̀ⲙⲟϥ ⲛ̀ⲟⲩⲙⲟⲩⲓ.		And she saw that he was driven away from her, and her hope of him perished, and she took another of her whelps; she made him a lion.	καὶ εἶδεν ὅτι ἀπῶσται ἀπ’ αὐτῆς καὶ ἀπώλετο ἡ ὑπόστασις αὐτῆς, καὶ ἔλαβεν ἄMον ἐκ τῶν σκύµνων αὐτῆς, λέοντα ἔταξεν αὐτόν.						
Ezekiel	19	19	6	OT	1. OT	Major Prophets	4. Major Prophets	04. Major Prophets	06. Ezekiel	ⲁϥϣⲱⲡⲓ ϧⲉⲛ ⲑⲙⲏϯ ⲛ̀ⲛⲓⲙⲟⲩⲓ. ⲟⲩⲟϩ ⲁϥⲉⲣ ⲟⲩⲙⲟⲩⲓ ⲟⲩⲟϩ ⲁϥϭⲓⲥⲃⲱ ⲉ̀ϩⲱⲗⲉⲙ ⲛ̀ϩⲁⲛϩⲱⲗⲉⲙ. ⲁϥⲟⲩⲉⲙ ⲣⲱⲙⲓ.		And he went up and down in the midst of lions, he became a lion, and learned to take prey, he devoured men.	καὶ ἀνεστρέφετο ἐν µέσῳ λεόντων, λέων ἐγένετο καὶ ἔµαθεν ἁρπάζειν ἁρπάγµατα, ἀνθρώπους ἔφαγεν·						
Ezekiel	19	19	7	OT	1. OT	Major Prophets	4. Major Prophets	04. Major Prophets	06. Ezekiel	ⲟⲩⲟϩ ⲛⲁϥⲙⲟϣⲓ ϧⲉⲛ ⲡⲉϥⲉⲛϣⲟⲧ. ⲁϥϣⲱϥ ⲛ̀ⲛⲟⲩⲡⲟⲗⲓⲥ. ⲁϥⲧⲁⲕⲉ ⲡⲓⲕⲁϩⲓ ⲛⲉⲙ ⲡⲉϥϫⲱⲕ ⲉ̀ⲃⲟⲗ. ⲡϧⲣⲱⲟⲩ ⲙ̀ⲡⲉϥϩⲉⲙϩⲉⲙ		And he prowled in his boldness and laid waste their cities, and made the land desolate, and the fullness of it, by the voice of his roaring.	καὶ ἐνέµετο τῷ θράσει αὐτοῦ καὶ τὰς πόλεις αὐτῶν ἐξηρήµωσεν καὶ ἠφάνισεν γῆν καὶ τὸ πλήρωµα αὐτῆς ἀπὸ φωνῆς ὠρύµατος αὐτοῦ.						
Ezekiel	19	19	8	OT	1. OT	Major Prophets	4. Major Prophets	04. Major Prophets	06. Ezekiel	ⲛⲁϥⲟⲓ ⲛ̀ⲛⲓϣϯ. ⲁⲩϯ ⲛ̀ϫⲉ ⲛⲓⲉⲑⲛⲟⲥ ⲛ̀ⲥⲱϥ ⲉ̀ⲃⲟⲗ ϧⲉⲛ ⲛⲓⲭⲱⲣⲁ ⲉⲧⲟⲓ ⲙⲡⲉϥⲕⲱϯ. ⲟⲩⲟϩ ⲁⲩϩⲓⲟⲩⲓ ⲛ̀ⲛⲟⲩϣⲛⲏⲟⲩ ⲉ̀ϩⲣⲏⲓ ⲉ̀ϫⲱϥ ⲁⲩⲧⲁϩⲟϥ ϧⲉⲛ ⲧⲟⲩϫⲟⲣϫⲥ.		Then the nations set upon him from the countries round about, and they spread their nets upon him: he was taken in their pit.	καὶ ἔδωκαν ἐπ’ αὐτὸν ἔθνη ἐκ χωρῶν κυκλόθεν καὶ ἐξεπέτασαν ἐπ’ αὐτὸν δίκτυα αὐτῶν, ἐν διαφθορᾷ αὐτῶν συνελήµφθη·						
Ezekiel	19	19	9	OT	1. OT	Major Prophets	4. Major Prophets	04. Major Prophets	06. Ezekiel	ⲁⲩⲭⲁϥ ϧⲉⲛ ⲟⲩϣⲧⲟϥ. ⲁⲩⲓⲛⲓ ⲙ̀ⲙⲟϥ ϧⲉⲛ ⲟⲩⲅⲁⲗⲉⲁⲅⲣⲁ ⲉ̀ⲣⲁⲧϥ ⲙ̀ⲡⲟⲩⲣⲟ ⲛ̀ⲧⲃⲁⲃⲩⲗⲱⲛ. ⲟⲩⲟϩ ⲁⲩϭⲓⲧϥ ⲉ̀ϧⲟⲩⲛ ⲉ̀ⲟⲩϣⲧⲉⲕⲟ. ϫⲉ ⲛ̀ⲛⲟⲩⲥⲱⲧⲉⲙ ⲁⲛ ⲉ̀ⲡⲉϥϧⲣⲱⲟⲩ ϩⲓϫⲉⲛ ⲛⲓⲧⲱⲟⲩ ⲛ̀ⲧⲉ ⲡⲓⲥ̅ⲗ̅.		And they put him in chains and in a cage, and he came to the king of Babylon; and he cast him into prison, that his voice should not be heard on the mountains of Israel.	καὶ ἔθεντο αὐτὸν ἐν κηµῷ καὶ ἐν γαλεάγρᾳ, ἦλθεν πρὸς βασιλέα Βαβυλῶνος, καὶ εἰσήγαγεν αὐτὸν εἰς φυλακήν, ὅπως µὴ ἀκουσθῇ ἡ φωνὴ αὐτοῦ ἐπὶ τὰ ὄρη τοῦ Ισραηλ. —						
Ezekiel	19	19	10	OT	1. OT	Major Prophets	4. Major Prophets	04. Major Prophets	06. Ezekiel	ⲧⲉⲕⲙⲁⲩ ⲉⲥⲟⲓ ⲙ̀ⲫⲣⲏϯ ⲛ̀ⲟⲩⲃⲱ ⲛ̀ⲁⲗⲟⲗⲓ ⲙ̀ⲫⲣⲏϯ ⲛ̀ⲟⲩϩⲣⲏⲣⲓ ϧⲉⲛ ⲟⲩⲃⲱ ⲛ̀ⲉⲣⲙⲁⲛ ⲉⲥϯ ⲛ̀ⲟⲩⲟⲩⲧⲁϩ ϩⲓϫⲉⲛ ⲟⲩⲙⲟⲩⲙⲓ ⲙ̀ⲙⲱⲟⲩ. ⲁϥϣⲱⲡⲓ ⲉ̀ⲃⲟⲗ ϧⲉⲛ ⲟⲩⲙⲱⲟⲩ ⲉϥⲟϣ.		Thy mother was as a vine and as a blossom on a pomegranate tree, planted by water: her fruit and her shoot abounded by reason of much water.	ἡ µήτηρ σου ὡς ἄµπελος, ὡς ἄνθος ἐν ῥόᾳ ἐν ὕδατι πεφυτευµένη, ὁ καρπὸς αὐτῆς καὶ ὁ βλαστὸς αὐτῆς ἐγένετο ἐξ ὕδατος πολλοῦ.						
Ezekiel	19	19	11	OT	1. OT	Major Prophets	4. Major Prophets	04. Major Prophets	06. Ezekiel	ⲟⲩⲟϩ ⲟⲩϣⲃⲱⲧ ⲁϥϣⲱⲡⲓ ⲛ̀ϧⲏⲧⲥ ⲉ̀ϩⲣⲏⲓ ⲉ̀ϫⲉⲛ ϯⲫⲩⲗⲏ ⲛ̀ⲛⲓϩⲩⲅⲟⲩⲙⲉⲛⲟⲥ. ⲁⲥϭⲓⲥⲓ ϧⲉⲛ ⲧⲉⲥⲙⲁⲓⲏ ϧⲉⲛ ⲑⲙⲏϯ ⲛϩⲁⲛϫⲁⲗ. ⲟⲩⲟϩ ⲁⲥⲛⲁⲩ ⲉ̀ⲧⲉⲥⲙⲁⲓⲏ. ϧⲉⲛ ⲡⲁϣⲁⲓ ⲛ̀ⲛⲉⲥϫⲁⲗ.		And she became a rod for a tribe of princes, and was elevated in her bulk in the midst of other trees, and she saw her bulk in the multitude of her branches.	καὶ ἐγένετο αὐτῇ ῥάβδος ἰσχύος ἐπὶ φυλὴν ἡγουµένων, καὶ ὑψώθη τῷ µεγέθει αὐτῆς ἐν µέσῳ στελεχῶν καὶ εἶδεν τὸ µέγεθος αὐτῆς ἐν πλήθει κληµάτων αὐτῆς.						
Ezekiel	19	19	12	OT	1. OT	Major Prophets	4. Major Prophets	04. Major Prophets	06. Ezekiel	ⲟⲩⲟϩ ⲁⲩϫⲱϫⲓ ⲙ̀ⲙⲟⲥ ϧⲉⲛ ⲟⲩⲙⲃⲟⲛ. ⲟⲩⲟϩ ⲁⲩϩⲓⲧⲥ ϩⲓϫⲉⲛ ⲡⲓⲕⲁϩⲓ. ⲟⲩⲟϩ ⲟⲩⲑⲏⲟⲩ ⲛ̀ⲕⲁⲩⲙⲁ ⲁϥⲉⲣ ⲛⲉⲥⲥⲱⲧⲡ ϣⲱⲟⲩⲓ. ⲁϥⲙⲡϣⲓϣ ⲙ̀ⲙⲱⲟⲩ. ⲟⲩⲟϩ ⲁϥϣⲱⲟⲩⲓ ⲛ̀ϫⲉ ⲡⲓϣⲃⲱⲧ ⲛ̀ⲧⲉ ⲧⲉϥϫⲟⲙ ⲟⲩⲭⲣⲱⲙ ⲁϥⲙⲟⲩⲛⲕ ⲙ̀ⲙⲟϥ.		But she was broken down in wrath, she was cast upon the ground, and the east wind dried up her choice branches: vengeance came upon them, and the rod of her strength was withered; fire consumed it.	καὶ κατεκλάσθη ἐν θυµῷ, ἐπὶ γῆν ἐρρίφη, καὶ ἄνεµος ὁ καύσων ἐξήρανεν τὰ ἐκλεκτὰ αὐτῆς· ἐξεδικήθη καὶ ἐξηράνθη ἡ ῥάβδος ἰσχύος αὐτῆς, πῦρ ἀνήλωσεν αὐτήν.						
Ezekiel	19	19	13	OT	1. OT	Major Prophets	4. Major Prophets	04. Major Prophets	06. Ezekiel	ϯⲛⲟⲩ ⲁⲩⲧⲱϫⲓ ⲙ̀ⲙⲟⲥ ϩⲓ ⲡϣⲁϥⲉ ϧⲉⲛ ⲟⲩⲕⲁϩⲓ ⲛ̀ⲁⲑⲙⲱⲟⲩ.		And now they have planted her in the wilderness, in a dry land.	καὶ νῦν πεφύτευκαν αὐτὴν ἐν τῇ ἐρήµῳ, ἐν γῇ ἀνύδρῳ·						
Ezekiel	19	19	14	OT	1. OT	Major Prophets	4. Major Prophets	04. Major Prophets	06. Ezekiel	ⲟⲩⲭⲣⲱⲙ ⲁϥⲓ̀ ⲉ̀ⲃⲟⲗ ϧⲉⲛ ⲡϣⲃⲱⲧ ⲛ̀ⲛⲉⲥⲥⲱⲧⲡ. ⲁϥⲟⲩⲱⲙ ⲙ̀ⲙⲟⲥ. ⲟⲩⲟϩ ⲛⲁϥϣⲟⲡ ⲁⲛ ⲛ̀ϧⲏⲧⲥ ⲛ̀ϫⲉ ⲟⲩϣⲃⲱⲧ ⲉϥϫⲟⲣ. ϯⲫⲩⲗⲏ ⲉⲥⲉ̀ϣⲱⲡⲓ ⲉⲩⲡⲁⲣⲁⲃⲟⲗⲏ ⲛ̀ⲛⲉϩⲡⲓ. ⲟⲩⲟϩ ⲉⲥⲉ̀ϣⲱⲡⲓ ⲉⲩⲛⲉϩⲡⲓ.		And fire is gone out of a rod of her choice boughs, and has devoured her; and there was no rod of strength in her. Her race is become a parable of lamentation, and it shall be for a lamentation.	καὶ ἐξῆλθεν πῦρ ἐκ ῥάβδου ἐκλεκτῶν αὐτῆς καὶ κατέφαγεν αὐτήν, καὶ οὐκ ἦν ἐν αὐτῇ ῥάβδος ἰσχύος. φυλὴ εἰς παραβολὴν θρήνου ἐστὶν καὶ ἔσται εἰς θρῆνον.						
Ezekiel	20	20	1	OT	1. OT	Major Prophets	4. Major Prophets	04. Major Prophets	06. Ezekiel	ⲟⲩⲟϩ ⲁⲥϣⲱⲡⲓ ϧⲉⲛ ϯⲙⲁϩⲍ̅ ⲛ̀ⲣⲟⲙⲡⲓ. ϧⲉⲛ ⲡⲓⲙⲁϩⲉ̅ ⲛ̀ⲁⲃⲟⲧ ϧⲉⲛ ⲡⲓⲉϩⲟⲟⲩ ⲙ̀ⲙⲁϩⲓ̅ ⲙ̀ⲡⲓⲁⲃⲟⲧ. ⲁⲩⲓ̀ ⲛ̀ϫⲉ ϩⲁⲛⲣⲱⲙⲓ ⲉ̀ⲃⲟⲗ ϧⲉⲛ ⲛⲓⲡⲣⲉⲥⲃⲩⲧⲉⲣⲟⲥ ⲙ̀ⲡⲓⲥ̅ⲗ̅. ⲉ̀ⲑⲣⲟⲩⲉⲣⲉⲧⲓⲛ ⲙ̀ⲡϭ̅ⲥ̅. ⲁⲩϩⲉⲙⲥⲓ ⲙ̀ⲡⲁⲙ̀ⲑⲟ ⲉ̀ⲃⲟⲗ.		And it came to pass in the seventh year, on the fifteenth day of the month, there came men of the elders of the house of Israel to enquire of the Lord, and they sat before me.	Καὶ ἐγένετο ἐν τῷ ἔτει τῷ ἑβδόµῳ ἐν τῷ πέµπτῳ µηνὶ δεκάτῃ τοῦ µηνὸς ἦλθον ἄνδρες ἐκ τῶν πρεσβυτέρων οἴκου Ισραηλ ἐπερωτῆσαι τὸν κύριον καὶ ἐκάθισαν πρὸ προσώπου µου.						
Ezekiel	20	20	2	OT	1. OT	Major Prophets	4. Major Prophets	04. Major Prophets	06. Ezekiel	ⲡⲥⲁϫⲓ ⲙ̀ⲡϭ̅ⲥ̅ ⲁϥϣⲱⲡⲓ ϩⲁⲣⲟⲓ ⲉϥϫⲱ ⲙ̀ⲙⲟⲥ.		And the word of the Lord came to me, saying,	καὶ ἐγένετο λόγος κυρίου πρός µε λέγων						
Ezekiel	20	20	3	OT	1. OT	Major Prophets	4. Major Prophets	04. Major Prophets	06. Ezekiel	ϫⲉ ⲡϣⲏⲣⲓ ⲙ̀ⲫⲣⲱⲙⲓ ⲥⲁϫⲓ ⲛⲉⲙ ⲛⲓⲡⲣⲉⲥⲃⲩⲧⲉⲣⲟⲥ ⲙ̀ⲡⲁⲗⲁⲟⲥ ⲁϫⲟⲥ ⲛⲱⲟⲩ. ϫⲉ ⲛⲁⲓ ⲛⲉ ⲛⲏ ⲉⲧⲉϥϫⲱ ⲙ̀ⲙⲱⲟⲩ ⲛ̀ϫⲉ ⲡϭ̅ⲥ̅. ϫⲉ ⲁⲣⲉⲧⲉⲛⲓ̀ ⲛ̀ⲑⲱⲧⲉⲛ ⲉ̀ϣⲛⲟⲩⲓ. ⲉ̀ⲑⲣⲓⲉⲣⲟⲩⲱ ⲛⲱⲧⲉⲛ.		Son of man, speak to the elders of the house of Israel, and thou shalt say to them, Thus saith the Lord; Are ye come to enquire of me? As I live, I will not be enquired of by you, saith the Lord.	Υἱὲ ἀνθρώπου, λάλησον πρὸς τοὺς πρεσβυτέρους τοῦ Ισραηλ καὶ ἐρεῖς πρὸς αὐτούς Τάδε λέγει κύριος Εἰ ἐπερωτῆσαί µε ὑµεῖς ἔρχεσθε; ζῶ ἐγὼ εἰ ἀποκριθήσοµαι ὑµῖν, λέγει κύριος;						
Ezekiel	20	20	4	OT	1. OT	Major Prophets	4. Major Prophets	04. Major Prophets	06. Ezekiel	ϯⲟⲛϧ ⲁ̀ⲛⲟⲕ. ϫⲉ ⲉ̀ϣⲱⲡ ϧⲉⲛ ⲟⲩⲉⲣⲟⲩⲱ ⲉⲓⲉ̀ⲉⲣⲟⲩⲱ ⲛⲱⲟⲩ. ⲓⲉ ϧⲉⲛ ⲟⲩϭⲓⲙ̀ⲡϣⲓϣ. ⲉⲓⲉ̀ϭⲓ ⲙ̀ⲡⲟⲩϭⲓⲙ̀ⲡϣⲓϣ. ⲡϣⲏⲣⲓ ⲙ̀ⲫⲣⲱⲙⲓ ⲁⲣⲓⲙⲉⲑⲣⲉ ⲛⲱⲟⲩ ⲛ̀ⲛⲓⲁⲛⲟⲙⲓⲁ ⲛ̀ⲧⲉ ⲛⲟⲩⲓⲟϯ.		Shall I utterly take vengeance on them, son of man? testify to them of the iniquities of their fathers:	εἰ ἐκδικήσω αὐτοὺς ἐκδικήσει; υἱὲ ἀνθρώπου, τὰς ἀνοµίας τῶν πατέρων αὐτῶν διαµάρτυραι αὐτοῖς						
Ezekiel	20	20	5	OT	1. OT	Major Prophets	4. Major Prophets	04. Major Prophets	06. Ezekiel	ⲟⲩⲟϩ ⲁϫⲟⲥ ⲛⲱⲟⲩ ϫⲉ ⲛⲁⲓ ⲛⲉ ⲛⲏ ⲉⲧⲉϥϫⲱ ⲙ̀ⲙⲱⲟⲩ ⲛ̀ϫⲉ ⲡϭ̅ⲥ̅ ⲫϯ ⲙ̀ⲡⲓⲥ̅ⲗ̅. ϫⲉ ⲓⲥϫⲉⲛ ⲡⲓⲉϩⲟⲟⲩ ⲉⲧⲁⲓⲥⲱⲧⲡ ⲙ̀ⲡⲏⲓ ⲙ̀ⲡⲓⲥ̅ⲗ̅. ⲟⲩⲟϩ ⲁⲓⲟⲩⲱⲛϩ ⲉ̀ⲃⲟⲗ ⲙ̀ⲡϫⲣⲟϫ ⲛ̀ⲓⲁⲕⲱⲃ. ⲟⲩⲟϩ ⲁⲓⲑⲣⲟⲩⲥⲱⲟⲩⲛ ⲙ̀ⲙⲟⲓ ϧⲉⲛ ⲡⲕⲁϩⲓ ⲛ̀ⲭⲏⲙⲓ. ⲟⲩⲟϩ ⲁⲓϣⲟⲡⲟⲩ ⲉ̀ⲣⲟⲓ ⲉⲓϫⲱ ⲙ̀ⲙⲟⲥ ⲛⲱⲟⲩ ϫⲉ ⲁ̀ⲛⲟⲕ ⲡⲉ ⲡϭ̅ⲥ̅ ⲡⲉⲧⲉⲛⲛⲟⲩϯ.		and thou shalt say to them, Thus saith the Lord; From the day that I chose the house of Israel, and became known to the seed of the house of Jacob, and was known to them in the land of Egypt, and helped them with my hand, saying, I am the Lord your God;	καὶ ἐρεῖς πρὸς αὐτούς Τάδε λέγει κύριος Ἀφ’ ἧς ἡµέρας ᾑρέτισα τὸν οἶκον Ισραηλ καὶ ἐγνωρίσθην τῷ σπέρµατι οἴκου Ιακωβ καὶ ἐγνώσθην αὐτοῖς ἐν γῇ Αἰγύπτου καὶ ἀντελαβόµην τῇ χειρί µου αὐτῶν λέγων Ἐγὼ κύριος ὁ θεὸς ὑµῶν,						
Ezekiel	20	20	6	OT	1. OT	Major Prophets	4. Major Prophets	04. Major Prophets	06. Ezekiel	ϧⲉⲛ ⲡⲓⲉϩⲟⲟⲩ ⲉⲧⲉⲙ̀ⲙⲁⲩ ⲁⲓⲁⲙⲁϩⲓ ⲙ̀ⲙⲱⲟⲩ ϧⲉⲛ ⲧⲁϫⲓϫ ⲉ̀ⲑⲣⲓⲉⲛⲟⲩ ⲉ̀ⲃⲟⲗ ϧⲉⲛ ⲡⲕⲁϩⲓ ⲛ̀ⲭⲏⲙⲓ. ⲉ̀ϧⲟⲩⲛ ⲉ̀ⲡⲓⲕⲁϩⲓ ⲉⲧⲁⲓⲥⲉⲃⲧⲱⲧϥ ⲛⲱⲟⲩ. ⲟⲩⲕⲁϩⲓ ⲉϥϧⲁϯ ⲛ̀ⲟⲩⲉⲣⲱϯ ⲛⲉⲙ ⲟⲩⲉⲃⲓⲱ. ⲟⲩⲙⲟⲩⲗϩ ⲡⲉ ⲡⲁⲣⲁ ⲡⲕⲁϩⲓ ⲧⲏⲣϥ.		in that day I helped them with my hand, to bring them out of the land of Egypt into the land which I prepared for them, a land flowing with milk and honey, it is abundant beyond every land.	ἐν ἐκείνῃ τῇ ἡµέρᾳ ἀντελαβόµην τῇ χειρί µου αὐτῶν τοῦ ἐξαγαγεῖν αὐτοὺς ἐκ γῆς Αἰγύπτου εἰς τὴν γῆν, ἣν ἡτοίµασα αὐτοῖς, γῆν ῥέουσαν γάλα καὶ µέλι, κηρίον ἐστὶν παρὰ πᾶσαν τὴν γῆν.						
Ezekiel	20	20	7	OT	1. OT	Major Prophets	4. Major Prophets	04. Major Prophets	06. Ezekiel	ⲟⲩⲟϩ ⲁⲓϫⲟⲥ ⲛⲱⲟⲩ ϫⲉ ⲙⲁⲣⲉ ⲫⲟⲩⲁⲓ ⲫⲟⲩⲁⲓ ⲙ̀ⲙⲱⲧⲉⲛ. ϩⲓⲟⲩⲓ ⲙ̀ⲙⲟϥ ⲉ̀ⲃⲟⲗ ⲛ̀ⲛⲉϥⲃⲟϯ. ⲟⲩⲟϩ ⲙ̀ⲡⲉⲣϭⲱϧⲉⲙ ϧⲉⲛ ⲛⲓϩⲃⲏⲟⲩⲓ ⲛ̀ⲭⲏⲙⲓ. ⲁ̀ⲛⲟⲕ ⲅⲁⲣ ⲡⲉ ⲡϭ̅ⲥ̅ ⲡⲉⲧⲉⲛⲛⲟⲩϯ.		And I said to them, Let every one cast away the abominations of his eyes, and defile not yourselves with the devices of Egypt: I am the Lord your God.	καὶ εἶπα πρὸς αὐτούς Ἕκαστος τὰ βδελύγµατα τῶν ὀφθαλµῶν αὐτοῦ ἀπορριψάτω, καὶ ἐν τοῖς ἐπιτηδεύµασιν Αἰγύπτου µὴ µιαίνεσθε· ἐγὼ κύριος ὁ θεὸς ὑµῶν.						
Ezekiel	20	20	8	OT	1. OT	Major Prophets	4. Major Prophets	04. Major Prophets	06. Ezekiel	ⲁⲩⲣⲓⲕⲓ ⲥⲁⲃⲟⲗ ⲙ̀ⲙⲟⲓ. ⲟⲩⲟϩ ⲙ̀ⲡⲟⲩⲟⲩⲱϣ ⲉ̀ⲥⲱⲧⲉⲙ ⲛ̀ⲥⲱⲓ. ⲙ̀ⲡⲟⲩϩⲓⲟⲩⲓ ⲉ̀ⲃⲟⲗ ⲛ̀ⲛⲓⲃⲟϯ ⲛ̀ⲛⲟⲩⲃⲁⲗ. ⲟⲩⲟϩ ⲛⲟⲩϩⲃⲏⲟⲩⲓ ⲉⲧϧⲉⲛ ⲭⲏⲙⲓ ⲙ̀ⲡⲟⲩⲭⲁⲩ ⲛ̀ⲥⲱⲟⲩ. ⲁⲓϫⲟⲥ ϫⲉ ϯⲛⲁϫⲱϣ ⲙ̀ⲡⲁϫⲱⲛⲧ ⲉ̀ϧⲣⲏⲓ ⲉ̀ϫⲱⲟⲩ. ⲉ̀ⲑⲣⲓϫⲱⲕ ⲉ̀ⲃⲟⲗ ⲙ̀ⲡⲁⲙⲃⲟⲛ ⲛ̀ϩⲣⲏⲓ ⲛ̀ϧⲏⲧⲟⲩ ϧⲉⲛ ⲑⲙⲏϯ ⲙ̀ⲡⲕⲁϩⲓ ⲛ̀ⲭⲏⲙⲓ.		But they revolted from me, and would not hearken to me: they cast not away the abominations of their eyes, and forsook not the devices of Egypt: then I said that I would pour out my wrath upon them, to accomplish my wrath upon them in the midst of Egypt.	καὶ ἀπέστησαν ἀπ’ ἐµοῦ καὶ οὐκ ἠθέλησαν εἰσακοῦσαί µου, τὰ βδελύγµατα τῶν ὀφθαλµῶν αὐτῶν οὐκ ἀπέρριψαν καὶ τὰ ἐπιτηδεύµατα Αἰγύπτου οὐκ ἐγκατέλιπον. καὶ εἶπα τοῦ ἐκχέαι τὸν θυµόν µου ἐπ’ αὐτοὺς τοῦ συντελέσαι τὴν ὀργήν µου ἐν αὐτοῖς ἐν µέσῳ γῆς Αἰγύπτου.						
Ezekiel	20	20	9	OT	1. OT	Major Prophets	4. Major Prophets	04. Major Prophets	06. Ezekiel	ⲁⲓⲁⲓⲥ ϩⲓⲛⲁ ⲉ̀ϣ̀ⲧⲉⲙϭⲱϧⲉⲙ ⲙ̀ⲡⲁⲣⲁⲛ ⲉ̀ⲡⲧⲏⲣϥ ⲙ̀ⲡⲉⲙ̀ⲑⲟ ⲉ̀ⲃⲟⲗ ⲛ̀ⲛⲓⲉⲑⲛⲟⲥ ⲉⲩϧⲉⲛ ⲧⲟⲩⲙⲏϯ. ⲛⲏ ⲉⲧⲁⲓⲟⲩⲱⲛϩ ⲙ̀ⲙⲟⲓ ⲛ̀ⲛⲁϩⲣⲁⲩ ⲙ̀ⲡⲟⲩⲙ̀ⲑⲟ ⲉ̀ⲃⲟⲗ. ⲉ̀ⲑⲣⲓⲉⲛⲟⲩ ⲉ̀ⲃⲟⲗ ϧⲉⲛ ⲡⲕⲁϩⲓ ⲛ̀ⲭⲏⲙⲓ.		But I wrought so that my name should not be at all profaned in the sight of the Gentiles, in the midst of whom they are, among whom I was made known to them in their sight, to bring them out of the land of Egypt.	καὶ ἐποίησα ὅπως τὸ ὄνοµά µου τὸ παράπαν µὴ βεβηλωθῇ ἐνώπιον τῶν ἐθνῶν, ὧν αὐτοί εἰσιν ἐν µέσῳ αὐτῶν, ἐν οἷς ἐγνώσθην πρὸς αὐτοὺς ἐνώπιον αὐτῶν τοῦ ἐξαγαγεῖν αὐτοὺς ἐκ γῆς Αἰγύπτου.						
Ezekiel	20	20	10	OT	1. OT	Major Prophets	4. Major Prophets	04. Major Prophets	06. Ezekiel	ⲟⲩⲟϩ ⲁⲓⲉⲛⲟⲩ ⲉ̀ⲃⲟⲗ ϧⲉⲛ ⲡⲕⲁϩⲓ ⲛ̀ⲭⲏⲙⲓ. ⲁⲓϭⲓⲧⲟⲩ ⲉ̀ϩⲣⲏⲓ ⲉ̀ⲡϣⲁϥⲉ.		And I brought them into the wilderness.	καὶ ἐξήγαγον αὐτοὺς ἐκ γῆς Αἰγύπτου καὶ ἤγαγον αὐτοὺς εἰς τὴν ἔρηµον						
Ezekiel	20	20	11	OT	1. OT	Major Prophets	4. Major Prophets	04. Major Prophets	06. Ezekiel	ⲁⲓϯ ⲛⲱⲟⲩ ⲛ̀ⲛⲁⲡⲣⲟⲥⲧⲟⲅⲙⲁ. ⲟⲩⲟϩ ⲛⲁⲙⲉⲑⲙⲏⲓ ⲁⲓⲟⲩⲟⲛϩⲟⲩ ⲛⲱⲟⲩ ⲉ̀ⲃⲟⲗ. ⲛⲁⲓ ⲁϥϣⲁⲛⲓⲣⲓ ⲙ̀ⲙⲱⲟⲩ ⲛ̀ϫⲉ ⲫⲣⲱⲙⲓ. ϣⲁϥⲱⲛϧ ⲛ̀ϧⲏⲧⲟⲩ.		And I gave them my commandments, and made known to them mine ordinances, all which if a man shall do, he shall even live in them.	καὶ ἔδωκα αὐτοῖς τὰ προστάγµατά µου καὶ τὰ δικαιώµατά µου ἐγνώρισα αὐτοῖς, ὅσα ποιήσει αὐτὰ ἄνθρωπος καὶ ζήσεται ἐν αὐτοῖς.						
Ezekiel	20	20	12	OT	1. OT	Major Prophets	4. Major Prophets	04. Major Prophets	06. Ezekiel	ⲟⲩⲟϩ ⲛⲁⲥⲁⲃⲃⲁⲧⲟⲛ ⲁⲓⲧⲏⲓⲧⲟⲩ ⲛⲱⲟⲩ. ⲉ̀ⲑⲣⲟⲩϣⲱⲡⲓ ⲛⲱⲟⲩ ⲛ̀ⲟⲩⲙⲏⲓⲛⲓ ϧⲉⲛ ⲧⲁⲙⲏϯ ⲛⲉⲙ ⲧⲟⲩⲙⲏϯ. ⲉ̀ⲑⲣⲟⲩⲉⲙⲓ ϫⲉ ⲁ̀ⲛⲟⲕ ⲡⲉ ⲡϭ̅ⲥ̅ ⲉⲧⲧⲟⲩⲃⲟ ⲙ̀ⲙⲱⲟⲩ.		And I gave them my sabbaths, that they should be for a sign between me and them, that they should know that I am the Lord that sanctify them.	καὶ τὰ σάββατά µου ἔδωκα αὐτοῖς τοῦ εἶναι εἰς σηµεῖον ἀνὰ µέσον ἐµοῦ καὶ ἀνὰ µέσον αὐτῶν τοῦ γνῶναι αὐτοὺς διότι ἐγὼ κύριος ὁ ἁγιάζων αὐτούς.						
Ezekiel	20	20	13	OT	1. OT	Major Prophets	4. Major Prophets	04. Major Prophets	06. Ezekiel	ⲟⲩⲟϩ ⲁⲓϫⲟⲥ ⲙ̀ⲡⲏⲓ ⲙ̀ⲡⲓⲥ̅ⲗ̅ ϧⲉⲛ ⲡϣⲁϥⲉ. ϫⲉ ⲙⲟϣⲓ ϧⲉⲛ ⲛⲁⲟ̀ⲩⲁϩⲥⲁϩⲛⲓ. ⲟⲩⲟϩ ⲁⲣⲉϩ ⲉ̀ⲛⲁⲙⲉⲑⲙⲏⲓ. ϩⲓⲛⲁ ⲛ̀ⲧⲉⲧⲉⲛⲁⲓⲧⲟⲩ ⲛⲏ ⲉⲧⲁϥⲁⲓⲧⲟⲩ ⲛ̀ϫⲉ ⲫⲣⲱⲙⲓ ϣⲁϥⲱⲛϧ ⲛ̀ϧⲏⲧⲟⲩ. ⲁⲩϯϫⲱⲛⲧ ⲛⲏⲓ ⲛ̀ϫⲉ ⲛⲉⲛϣⲏⲣⲓ ⲙ̀ⲡⲓⲥ̅ⲗ̅ ⲛ̀ϩⲣⲏⲓ ϩⲓ ⲡϣⲁϥⲉ. ⲟⲩⲟϩ ⲙ̀ⲡⲟⲩⲙⲟϣⲓ ϧⲉⲛ ⲛⲁⲟⲩⲁϩⲥⲁϩⲛⲓ. ⲁⲩⲭⲱ ⲛ̀ⲥⲱⲟⲩ ⲛ̀ⲛⲁⲙⲉⲑⲙⲏⲓ. ⲛⲁⲓ ⲁϥϣⲁⲛⲁⲓⲧⲟⲩ ⲛ̀ϫⲉ ⲫⲣⲱⲙⲓ. ϣⲁϥⲱⲛϧ ⲛ̀ϧⲣⲏⲓ ⲛ̀ϧⲏⲧⲟⲩ. ⲟⲩⲟϩ ⲛⲁⲥⲁⲃⲃⲁⲧⲱⲛ ⲁⲩϭⲱϧⲉⲙ ⲙ̀ⲙⲱⲟⲩ ⲉ̀ⲙⲁϣⲱ. ⲁⲓϫⲟⲥ ϫⲉ ϯⲛⲁϫⲱϣ ⲙ̀ⲡⲁϫⲱⲛⲧ ⲉ̀ϩⲣⲏⲓ ⲉ̀ϫⲱⲟⲩ. ⲛ̀ϩⲣⲏⲓ ϩⲓ ⲡϣⲁϥⲉ ⲉ̀ϥⲟⲧⲟⲩ ⲉ̀ⲃⲟⲗ.		And I said to the house of Israel in the wilderness, Walk ye in my commandments: but they walked not in them, and they rejected mine ordinances, which if a man shall do, he shall even live in them; and they grievously profaned my sabbaths: and I said that I would pour out my wrath upon them in the wilderness, to consume them.	καὶ εἶπα πρὸς τὸν οἶκον τοῦ Ισραηλ ἐν τῇ ἐρήµῳ Ἐν τοῖς προστάγµασίν µου πορεύεσθε. καὶ οὐκ ἐπορεύθησαν καὶ τὰ δικαιώµατά µου ἀπώσαντο, ἃ ποιήσει αὐτὰ ἄνθρωπος καὶ ζήσεται ἐν αὐτοῖς, καὶ τὰ σάββατά µου ἐβεβήλωσαν σφόδρα. καὶ εἶπα τοῦ ἐκχέαι τὸν θυµόν µου ἐπ’ αὐτοὺς ἐν τῇ ἐρήµῳ τοῦ ἐξαναλῶσαι αὐτούς.						
Ezekiel	20	20	14	OT	1. OT	Major Prophets	4. Major Prophets	04. Major Prophets	06. Ezekiel	ⲟⲩⲟϩ ⲁⲓⲓⲣⲓ ϩⲓⲛⲁ ⲛ̀ⲧⲟⲩϣ̀ⲧⲉⲙⲥⲱϥ ⲙ̀ⲡⲁⲣⲁⲛ ⲉ̀ⲡⲧⲏⲣϥ ⲙ̀ⲡⲉⲙ̀ⲑⲟ ⲉ̀ⲃⲟⲗ ⲛ̀ⲛⲓⲉⲑⲛⲟⲥ. ⲛⲁⲓ ⲉⲧⲁⲓⲉⲛⲟⲩ ⲙ̀ⲡⲟⲩⲙ̀ⲑⲟ ⲉ̀ⲃⲟⲗ.		But I wrought so that my name should not be at all profaned before the Gentiles, before whose eyes I brought them out.	καὶ ἐποίησα ὅπως τὸ ὄνοµά µου τὸ παράπαν µὴ βεβηλωθῇ ἐνώπιον τῶν ἐθνῶν, ὧν ἐξήγαγον αὐτοὺς κατ’ ὀφθαλµοὺς αὐτῶν.						
Ezekiel	20	20	15	OT	1. OT	Major Prophets	4. Major Prophets	04. Major Prophets	06. Ezekiel	ⲁ̀ⲛⲟⲕ ϩⲱ ⲁⲓⲓⲛⲓ ⲛ̀ⲧⲁϫⲓϫ ⲉ̀ϩⲣⲏⲓ ⲉ̀ϫⲱⲟⲩ ⲛ̀ϩⲣⲏⲓ ϩⲓ ⲡϣⲁϥⲉ. ϩⲓⲛⲁ ⲛ̀ⲧⲁϣ̀ⲧⲉⲙϭⲓⲧⲟⲩ ⲉ̀ϧⲟⲩⲛ ⲉ̀ⲡⲕⲁϩⲓ ⲉ̀ⲡⲧⲏⲣϥ. ⲫⲁⲓ ⲉⲧⲁⲓⲧⲏⲓϥ ⲛⲱⲟⲩ ⲟⲩⲕⲁϩⲓ ⲉϥϧⲁϯ ⲉ̀ⲃⲟⲗ ⲛ̀ⲟⲩⲉⲣⲱϯ ⲛⲉⲙ ⲟⲩⲉⲃⲓⲱ. ⲟⲩⲙⲟⲩⲗϩ ⲡⲉ ⲉ̀ϩⲟⲧⲉ ⲕⲁϩⲓ ⲛⲓⲃⲉⲛ.		But I lifted up my hand against them in the wilderness once for all, that I would not bring them into the land which I gave them, a land flowing with milk and honey, it is sweeter than all lands:	καὶ ἐγὼ ἐξῆρα τὴν χεῖρά µου ἐπ’ αὐτοὺς ἐν τῇ ἐρήµῳ τὸ παράπαν τοῦ µὴ εἰσαγαγεῖν αὐτοὺς εἰς τὴν γῆν, ἣν ἔδωκα αὐτοῖς, γῆν ῥέουσαν γάλα καὶ µέλι, κηρίον ἐστὶν παρὰ πᾶσαν τὴν γῆν,						
Ezekiel	20	20	16	OT	1. OT	Major Prophets	4. Major Prophets	04. Major Prophets	06. Ezekiel	ⲉ̀ⲃⲟⲗ ϫⲉ ⲙ̀ⲡⲟⲩⲁⲣⲉϩ ⲉ̀ⲛⲁⲙⲉⲑⲙⲏⲓ. ⲟⲩⲟϩ ⲙ̀ⲡⲟⲩⲙⲟϣⲓ ϧⲉⲛ ⲛⲁⲟⲩⲁϩⲥⲁϩⲛⲓ. ⲛⲁⲥⲁⲃⲃⲁⲧⲟⲛ ⲁⲩϭⲱϧⲉⲙ ⲙ̀ⲙⲱⲟⲩ. ⲟⲩⲟϩ ⲁⲩⲟⲩⲁϩⲟⲩ ⲛ̀ⲥⲁ ⲛⲓⲟⲩⲱϣ ⲛ̀ⲧⲉ ⲡⲟⲩϩⲏⲧ.		because they rejected mine ordinances, and walked not in my commandments, but profaned my sabbaths, and went after the imaginations of their hearts.	ἀνθ’ ὧν τὰ δικαιώµατά µου ἀπώσαντο καὶ ἐν τοῖς προστάγµασίν µου οὐκ ἐπορεύθησαν ἐν αὐτοῖς καὶ τὰ σάββατά µου ἐβεβήλουν καὶ ὀπίσω τῶν ἐνθυµηµάτων τῶν καρδιῶν αὐτῶν ἐπορεύοντο.						
