book	chapter	chapter-zfilled	verse	testament	testament-indexed	section	section-indexed	section-indexed-no-testament	book-indexed	Bohairic	Sahidic	English	Greek	Fayyumic	Akhmimic	OldBohairic	Mesokemic	DialectP	Lycopolitan
Numbers	9	09	6	OT	1. OT	Pentateuch	1. Pentateuch	01. Pentateuch	04. Numbers	ⲟⲩⲟϩ ⲁⲩⲓ ⲛ̀ϫⲉ ϩⲁⲛⲟⲩⲟⲛ ⲉⲩϭⲁϧⲉⲙ ⲉ̀ϫⲉⲛ ⲧⲯⲩⲭⲏ ⲛ̀ⲟⲩⲣⲱⲙⲓ ⲟⲩⲟϩ ⲙ̀ⲡⲟⲩϣ̀ϫⲉⲙϫⲟⲙ ⲉ̀ⲓⲣⲓ ⲙ̀ⲡⲓⲡⲁⲥⲭⲁ ϧⲉⲛ ⲡⲓⲉϩⲟⲟⲩ ⲉⲧⲉⲙ̀ⲙⲁⲩ ⲟⲩⲟϩ ⲁⲩⲓ̀ ⲙ̀ⲡⲉⲙ̀ⲑⲟ ⲙ̀ⲙⲱⲩ̀ⲥⲏⲥ ⲛⲉⲙ ⲁⲁⲣⲱⲛ ϧⲉⲛ ⲡⲓⲉϩⲟⲟⲩ ⲉⲧⲉⲙ̀ⲙⲁⲩ		And there came men who were unclean by reason of a dead body, and they were not able to keep the passover on that day; and they came before Moses and Aaron on that day.	Καὶ παρεγένοντο οἱ ἄνδρες, οἳ ἦσαν ἀκάθαρτοι ἐπὶ ψυχῇ ἀνθρώπου καὶ οὐκ ἠδύναντο ποιῆσαι τὸ πασχα ἐν τῇ ἡµέρᾳ ἐκείνῃ, καὶ προσῆλθον ἐναντίον Μωυσῆ καὶ Ααρων ἐν ἐκείνῃ τῇ ἡµέρᾳ,						
Numbers	9	09	7	OT	1. OT	Pentateuch	1. Pentateuch	01. Pentateuch	04. Numbers	ⲟⲩⲟϩ ⲡⲉϫⲱⲟⲩ ⲛⲱⲟⲩ ⲛ̀ϫⲉ ⲛⲓⲣⲱⲙⲓ ϫⲉ ⲁ̀ⲛⲟⲛ ⲧⲉⲛϭⲁϧⲉⲙ ⲉ̀ϫⲉⲛ ⲧⲯⲩⲭⲏ ⲛ̀ⲟⲩⲣⲱⲙⲓ ⲙⲏⲧⲓ ⲧⲉⲛⲛⲁϭⲟϩ ⲉ̀ⲓⲛⲓ ⲙ̀ⲡⲓⲇⲱⲣⲟⲛ ⲉ̀ϧⲟⲩⲛ ⲙ̀ⲡϭ̅ⲥ̅ ⲕⲁⲧⲁ ⲡⲉϥⲥⲏⲟⲩ ϧⲉⲛ ⲑⲙⲏϯ ⲛ̀ⲛⲉⲛϣⲏⲣⲓ ⲙ̀ⲡⲓⲥ̅ⲗ̅		And those men said to Moses, We are unclean by reason of the dead body of a man: shall we therefore fail to offer the gift to the Lord in its season in the midst of the children of Israel?	καὶ εἶπαν οἱ ἄνδρες ἐκεῖνοι πρὸς αὐτόν Ἡµεῖς ἀκάθαρτοι ἐπὶ ψυχῇ ἀνθρώπου· µὴ οὖν ὑστερήσωµεν προσενέγκαι τὸ δῶρον κυρίῳ κατὰ καιρὸν αὐτοῦ ἐν µέσῳ υἱῶν Ισραηλ;						
Numbers	9	09	8	OT	1. OT	Pentateuch	1. Pentateuch	01. Pentateuch	04. Numbers	ⲟⲩⲟϩ ⲡⲉϫⲉ ⲙⲱⲩ̀ⲥⲏⲥ ⲛⲱⲟⲩ ϫⲉ ⲟϩⲓ ⲉ̀ⲣⲁⲧⲉⲛ ⲑⲏⲛⲟⲩ ⲙ̀ⲡⲁⲓⲙⲁ ⲟⲩⲟϩ ⲛ̀ⲧⲁⲥⲱⲧⲉⲙ ϫⲉ ⲟⲩ ⲡⲉⲧⲉ ⲡϭ̅ⲥ̅ ⲛⲁϩⲟⲛϩⲉⲛ ⲙ̀ⲙⲟϥ ⲉⲑⲃⲉ ⲑⲏⲛⲟⲩ		And Moses said to them, stand there, and I will hear what charge the Lord will give concerning you.	καὶ εἶπεν πρὸς αὐτοὺς Μωυσῆς Στῆτε αὐτοῦ, καὶ ἀκούσοµαι, τί ἐντελεῖται κύριος περὶ ὑµῶν. —						
Numbers	9	09	9	OT	1. OT	Pentateuch	1. Pentateuch	01. Pentateuch	04. Numbers	ⲟⲩⲟϩ ⲁ ⲡϭ̅ⲥ̅ ⲥⲁϫⲓ ⲛⲉⲙ ⲙⲱⲩ̀ⲥⲏⲥ ⲉϥϫⲱ ⲙ̀ⲙⲟⲥ		And the Lord spoke to Moses, saying,	καὶ ἐλάλησεν κύριος πρὸς Μωυσῆν λέγων						
Numbers	9	09	10	OT	1. OT	Pentateuch	1. Pentateuch	01. Pentateuch	04. Numbers	ϫⲉ ⲥⲁϫⲓ ⲛⲉⲙ ⲛⲉⲛϣⲏⲣⲓ ⲙ̀ⲡⲓⲥ̅ⲗ̅ ⲉⲕϫⲱ ⲙ̀ⲙⲟⲥ ϫⲉ ⲟⲩⲣⲱⲙⲓ ⲫⲏ ⲉⲧⲛⲁϣⲱⲡⲓ ⲉϥϭⲁϧⲉⲙ ⲉ̀ϫⲉⲛ ⲧⲯⲩⲭⲏ ⲛ̀ⲟⲩⲣⲱⲙⲓ ⲓⲉ ϧⲉⲛ ⲟⲩⲙⲱⲓⲧ ⲉϥⲟⲩⲏⲟⲩ ⲙ̀ⲙⲱⲧⲉⲛ ⲓⲉ ⲛⲉⲧⲉⲛⲅⲉⲛⲉⲁ ⲟⲩⲟϩ ⲛ̀ⲧⲉϥⲓⲣⲓ ⲙ̀ⲡⲓⲡⲁⲥⲭⲁ ⲙ̀ⲡϭ̅ⲥ̅		Speak to the children of Israel, saying, Whatever man shall be unclean by reason of a dead body, or on a journey far off, among you, or among your posterity; he shall then keep the passover to the Lord,	Λάλησον τοῖς υἱοῖς Ισραηλ λέγων Ἄνθρωπος ἄνθρωπος, ὃς ἐὰν γένηται ἀκάθαρτος ἐπὶ ψυχῇ ἀνθρώπου ἢ ἐν ὁδῷ µακρὰν ὑµῖν ἢ ἐν ταῖς γενεαῖς ὑµῶν, καὶ ποιήσει τὸ πασχα κυρίῳ·						
Numbers	9	09	11	OT	1. OT	Pentateuch	1. Pentateuch	01. Pentateuch	04. Numbers	ϧⲉⲛ ⲡⲓⲁⲃⲟⲧ ⲙ̀ⲙⲁϩⲃ̅ ϧⲉⲛ ⲥⲟⲩⲓ̅ⲇ̅ ⲙ̀ⲡⲓⲁⲃⲟⲧ ⲉⲣⲉ ⲣⲟⲩϩⲓ ⲛⲁϣⲱⲡⲓ ⲉⲩⲉ̀ⲁⲓϥ ⲟⲩⲟϩ ⲉⲩⲉ̀ⲟⲩⲟⲙϥ ϩⲓ ϩⲁⲛⲁⲧϣⲉⲙⲏⲣ ⲛⲉⲙ ϩⲁⲛϣⲁϣⲓ		in the second month, on the fourteenth day; in the evening they shall offer it, with unleavened bread and bitter herbs shall they eat it.	ἐν τῷ µηνὶ τῷ δευτέρῳ ἐν τῇ τεσσαρεσκαιδεκάτῃ ἡµέρᾳ τὸ πρὸς ἑσπέραν ποιήσουσιν αὐτό, ἐπ’ ἀζύµων καὶ πικρίδων φάγονται αὐτό,						
Numbers	9	09	12	OT	1. OT	Pentateuch	1. Pentateuch	01. Pentateuch	04. Numbers	ⲛ̀ⲛⲟⲩⲥⲱϫⲡ ϫⲉ ⲉ̀ⲃⲟⲗ ⲙ̀ⲙⲟϥ ⲉ̀ϩⲁⲛⲁⲧⲟⲟⲩⲓ ⲟⲩⲟϩ ⲟⲩⲕⲁⲥ ⲛ̀ⲛⲟⲩⲕⲁϣϥ ⲉ̀ⲃⲟⲗ ⲙ̀ⲙⲟϥ ⲕⲁⲧⲁ ⲫⲛⲟⲙⲟⲥ ⲙ̀ⲡⲓⲡⲁⲥⲭⲁ ⲉⲩⲉⲁⲓϥ		They shall not leave of it until the morrow, and they shall not break a bone of it; they shall sacrifice it according to the ordinance of the passover.	οὐ καταλείψουσιν ἀπ’ αὐτοῦ εἰς τὸ πρωὶ καὶ ὀστοῦν οὐ συντρίψουσιν ἀπ’ αὐτοῦ· κατὰ τὸν νόµον τοῦ πασχα ποιήσουσιν αὐτό.						
Numbers	9	09	13	OT	1. OT	Pentateuch	1. Pentateuch	01. Pentateuch	04. Numbers	ⲟⲩⲟϩ ⲡⲓⲣⲱⲙⲓ ⲉⲧⲛⲁϣⲱⲡⲓ ⲉϥⲧⲟⲩⲃⲏⲟⲩⲧ ⲟⲩⲟϩ ⲉϥϧⲉⲛ ⲟⲩⲙⲱⲓⲧ ⲉ̀ⲛ̀ϥⲟⲩⲏⲟⲩ ⲁⲛ ⲟⲩⲟϩ ⲛ̀ⲧⲉϥϭⲓϩⲟ ⲉ̀ⲓⲣⲓ ⲙ̀ⲡⲓⲡⲁⲥⲭⲁ ⲉⲩⲉ̀ϥⲱϯ ⲛ̀ϯⲯⲩⲭⲏ ⲉⲧⲉⲙ̀ⲙⲁⲩ ⲉ̀ⲃⲟⲗ ϧⲉⲛ ⲡⲉⲥⲗⲁⲟⲥ ⲟⲩⲟϩ ⲡⲓⲇⲱⲣⲟⲛ ⲛ̀ⲧⲉ ⲡϭ̅ⲥ̅ ⲙ̀ⲡⲉϥⲉⲛϥ ⲉ̀ϩⲣⲏⲓ ⲕⲁⲧⲁ ⲡⲉϥⲥⲏⲟⲩ ⲉϥⲉ̀ϭⲓ ⲙ̀ⲡⲉϥⲛⲟⲃⲓ ⲛ̀ϫⲉ ⲡⲓⲣⲱⲙⲓ ⲉⲧⲉⲙ̀ⲙⲁⲩ		And whatsoever man shall be clean, and is not far off on a journey, and shall fail to keep the passover, that soul shall be cut off from his people, because he has not offered the gift to the Lord in its season: that man shall bear his iniquity.	καὶ ἄνθρωπος, ὃς ἐὰν καθαρὸς ᾖ καὶ ἐν ὁδῷ µακρᾷ οὐκ ἔστιν καὶ ὑστερήσῃ ποιῆσαι τὸ πασχα, ἐξολεθρευθήσεται ἡ ψυχὴ ἐκείνη ἐκ τοῦ λαοῦ αὐτῆς· ὅτι τὸ δῶρον κυρίῳ οὐ προσήνεγκεν κατὰ τὸν καιρὸν αὐτοῦ, ἁµαρτίαν αὐτοῦ λήµψεται ὁ ἄνθρωπος ἐκεῖνος. —						
Numbers	9	09	14	OT	1. OT	Pentateuch	1. Pentateuch	01. Pentateuch	04. Numbers	ⲉ̀ϣⲱⲡ ⲇⲉ ⲁϥϣⲁⲛⲓ̀ ϩⲁⲣⲱⲧⲉⲛ ⲛ̀ϫⲉ ⲟⲩϣⲉⲙⲙⲟ ⲟⲩⲟϩ ⲛ̀ⲧⲉϥⲓⲣⲓ ⲙ̀ⲡⲓⲡⲁⲥⲭⲁ ⲛ̀ⲧⲉ ⲡϭ̅ⲥ̅ ⲕⲁⲧⲁ ⲫⲛⲟⲙⲟⲥ ⲙ̀ⲡⲓⲡⲁⲥⲭⲁ ⲛⲉⲙ ⲕⲁⲧⲁ ⲡⲉϥⲟⲩⲁϩⲥⲁϩⲛⲓ ⲉϥⲉ̀ⲁⲓϥ ⲟⲩⲛⲟⲙⲟⲥ ⲛ̀ⲟⲩⲱⲧ ⲉϥⲉ̀ϣⲱⲡⲓ ⲛⲱⲧⲉⲛ ⲛⲉⲙ ⲡⲓϣⲉⲙⲙⲟ ⲛⲉⲙ ⲡⲓⲣⲉⲙⲛ̀ⲏⲓ ⲛ̀ⲧⲉ ⲡⲉⲧⲉⲛⲕⲁϩⲓ		And if there should come to you a stranger in your land, and should keep the passover to the Lord, he shall keep it according to the law of the passover and according to its ordinance: there shall be one law for you, both for the stranger, and for the native of the land.	ἐὰν δὲ προσέλθῃ πρὸς ὑµᾶς προσήλυτος ἐν τῇ γῇ ὑµῶν καὶ ποιήσει τὸ πασχα κυρίῳ, κατὰ τὸν νόµον τοῦ πασχα καὶ κατὰ τὴν σύνταξιν αὐτοῦ ποιήσει αὐτό· νόµος εἷς ἔσται ὑµῖν καὶ τῷ προσηλύτῳ καὶ τῷ αὐτόχθονι τῆς γῆς.						
Numbers	9	09	15	OT	1. OT	Pentateuch	1. Pentateuch	01. Pentateuch	04. Numbers	ⲟⲩⲟϩ ϧⲉⲛ ⲡⲓⲉϩⲟⲟⲩ ⲉⲧⲁⲩⲧⲁϩⲉ ϯⲥⲕⲩⲛⲏ ⲉ̀ⲣⲁⲧⲥ ⲁ ϯϭⲏⲡⲓ ϩⲱⲃⲥ ⲛ̀ϯⲥⲕⲩⲛⲏ ⲡⲓⲏⲓ ⲛ̀ⲧⲉ ϯⲙⲉⲧⲙⲉⲑⲣⲉ ⲟⲩⲟϩ ⲛ̀ϩⲁⲛⲁⲣⲟⲩϩⲓ ⲛⲁϥⲭⲏ ϩⲓϫⲉⲛ ϯⲥⲕⲩⲛⲏ ⲙ̀ⲫⲣⲏϯ ⲛ̀ⲟⲩⲥⲙⲟⲧ ⲛ̀ⲭⲣⲱⲙ ϣⲁ ϩⲁⲛⲁⲧⲟⲟⲩⲓ		And in the day in which the tabernacle was pitched the cloud covered the tabernacle, the place of the testimony; and in the evening there was upon the tabernacle as the appearance of fire till the morning.	Καὶ τῇ ἡµέρᾳ, ᾗ ἐστάθη ἡ σκηνή, ἐκάλυψεν ἡ νεφέλη τὴν σκηνήν, τὸν οἶκον τοῦ µαρτυρίου· καὶ τὸ ἑσπέρας ἦν ἐπὶ τῆς σκηνῆς ὡς εἶδος πυρὸς ἕως πρωί.						
Numbers	9	09	16	OT	1. OT	Pentateuch	1. Pentateuch	01. Pentateuch	04. Numbers	ⲡⲁⲓⲣⲏϯ ⲛⲁϥϣⲟⲡ ⲡⲉ ⲛ̀ⲥⲏⲟⲩ ⲛⲓⲃⲉⲛ ⲟⲩⲟϩ ⲛⲁⲣⲉ ϯϭⲏⲡⲓ ϩⲱⲃⲥ ⲙ̀ⲙⲟⲥ ⲡⲉ ⲙ̀ⲡⲓⲉϩⲟⲟⲩ ⲟⲩⲟϩ ⲟⲩⲥⲙⲟⲧ ⲛ̀ⲭⲣⲱⲙ ⲙ̀ⲡⲓⲉϫⲱⲣϩ		So it was continually: the cloud covered it by day, and the appearance of fire by night.	οὕτως ἐγίνετο διὰ παντός· ἡ νεφέλη ἐκάλυπτεν αὐτὴν ἡµέρας καὶ εἶδος πυρὸς τὴν νύκτα.						
Numbers	9	09	17	OT	1. OT	Pentateuch	1. Pentateuch	01. Pentateuch	04. Numbers	ⲟⲩⲟϩ ⲉ̀ϣⲱⲡ ⲁⲣⲉϣⲁⲛ ϯϭⲏⲡⲓ ϣⲉ ⲛⲁⲥ ⲉ̀ⲃⲟⲗ ϩⲁ ϯⲥⲕⲩⲛⲏ ⲙⲉⲛⲉⲛⲥⲁ ⲛⲁⲓ ϣⲁⲩⲟⲩⲱⲧⲉⲃ ⲛ̀ϫⲉ ⲛⲉⲛϣⲏⲣⲓ ⲙ̀ⲡⲓⲥ̅ⲗ̅ ϧⲉⲛ ⲡⲓⲙⲁ ⲉ̀ϣⲁⲣⲉ ϯϭⲏⲡⲓ ⲟϩⲓ ⲉ̀ⲣⲁⲧⲥ ⲙ̀ⲙⲟϥ ϣⲁⲩϩⲓⲕⲟⲧ ⲉ̀ⲙⲁⲩ ⲛ̀ϫⲉ ⲛⲉⲛϣⲏⲣⲓ ⲙ̀ⲡⲓⲥ̅ⲗ̅		And when the cloud went up from the tabernacle, then after that the children of Israel departed; and in whatever place the cloud rested, there the children of Israel encamped.	καὶ ἡνίκα ἀνέβη ἡ νεφέλη ἀπὸ τῆς σκηνῆς, καὶ µετὰ ταῦτα ἀπῆραν οἱ υἱοὶ Ισραηλ· καὶ ἐν τῷ τόπῳ, οὗ ἂν ἔστη ἡ νεφέλη, ἐκεῖ παρενέβαλον οἱ υἱοὶ Ισραηλ.						
Numbers	9	09	18	OT	1. OT	Pentateuch	1. Pentateuch	01. Pentateuch	04. Numbers	ⲉ̀ⲃⲟⲗ ϩⲓⲧⲉⲛ ⲡⲓⲟⲩⲁϩⲥⲁϩⲛⲓ ⲛ̀ⲧⲉ ⲡϭ̅ⲥ̅ ⲉⲩⲉ̀ϩⲓⲕⲟⲧ ⲛ̀ϫⲉ ⲛⲉⲛϣⲏⲣⲓ ⲙ̀ⲡⲓⲥ̅ⲗ̅ ⲟⲩⲟϩ ⲉ̀ⲃⲟⲗ ϩⲓⲧⲉⲛ ⲡⲓⲟⲩⲁϩⲥⲁϩⲛⲓ ⲛ̀ⲧⲉ ⲡϭ̅ⲥ̅ ⲉⲩⲉ̀ⲟⲩⲱⲧⲉⲃ ⲛ̀ⲛⲓⲉϩⲟⲟⲩ ⲧⲏⲣⲟⲩ ⲉ̀ϣⲁⲣⲉ ϯϭⲏⲡⲓ ⲉⲣϧⲏⲓⲃⲓ ⲙ̀ⲙⲱⲟⲩ ⲉ̀ϫⲉⲛ ϯⲥⲕⲩⲛⲏ ⲉⲩⲉ̀ϩⲓⲕⲟⲧ ⲛ̀ϫⲉ ⲛⲉⲛϣⲏⲣⲓ ⲙ̀ⲡⲓⲥ̅ⲗ̅		The children of Israel shall encamp by the command of the Lord, and by the command of the Lord they shall remove: all the days in which the cloud overshadows the tabernacle, the children of Israel shall encamp.	διὰ προστάγµατος κυρίου παρεµβαλοῦσιν οἱ υἱοὶ Ισραηλ καὶ διὰ προστάγµατος κυρίου ἀπαροῦσιν· πάσας τὰς ἡµέρας, ἐν αἷς σκιάζει ἡ νεφέλη ἐπὶ τῆς σκηνῆς, παρεµβαλοῦσιν οἱ υἱοὶ Ισραηλ·						
Numbers	9	09	19	OT	1. OT	Pentateuch	1. Pentateuch	01. Pentateuch	04. Numbers	ⲟⲩⲟϩ ⲉ̀ϣⲱⲡ ⲁⲣⲉϣⲁⲛ ϯϭⲏⲡⲓ ⲱⲥⲕ ϩⲓϫⲉⲛ ϯⲥⲕⲩⲛⲏ ⲛ̀ⲟⲩⲙⲏϣ ⲛ̀ⲉϩⲟⲟⲩ ⲟⲩⲟϩ ⲉⲩⲉ̀ⲁⲣⲉϩ ⲛ̀ϫⲉ ⲛⲉⲛϣⲏⲣⲓ ⲙ̀ⲡⲓⲥ̅ⲗ̅ ⲉ̀ϯⲟⲩⲉⲣϣⲓ ⲛ̀ⲧⲉ ⲡϭ̅ⲥ̅ ⲟⲩⲟϩ ⲛ̀ⲛⲟⲩⲟⲩⲱⲧⲉⲃ		And whenever the cloud shall be drawn over the tabernacle for many days, then the children of Israel shall keep the charge of God, and they shall not remove.	καὶ ὅταν ἐφέλκηται ἡ νεφέλη ἐπὶ τῆς σκηνῆς ἡµέρας πλείους, καὶ φυλάξονται οἱ υἱοὶ Ισραηλ τὴν φυλακὴν τοῦ θεοῦ καὶ οὐ µὴ ἐξάρωσιν·						
Numbers	9	09	20	OT	1. OT	Pentateuch	1. Pentateuch	01. Pentateuch	04. Numbers	ⲟⲩⲟϩ ⲉⲥⲉ̀ϣⲱⲡⲓ ⲁⲣⲉϣⲁⲛ ϯϭⲏⲡⲓ ϩⲱⲃⲥ ⲛ̀ϯⲥⲕⲩⲛⲏ ⲛ̀ⲟⲩⲙⲏϣ ⲛ̀ⲉϩⲟⲟⲩ ⲉⲩⲉ̀ϩⲓⲕⲟⲧ ⲉ̀ⲃⲟⲗ ϩⲓⲧⲉⲛ ϯⲥⲙⲏ ⲛ̀ⲧⲉ ⲡϭ̅ⲥ̅ ⲟⲩⲟϩ ⲉ̀ⲃⲟⲗ ϩⲓⲧⲉⲛ ⲡⲓⲟⲩⲁϩⲥⲁϩⲛⲓ ⲛ̀ⲧⲉ ⲡϭ̅ⲥ̅ ⲉⲩⲉ̀ⲟⲩⲱⲧⲉⲃ		And it shall be, whenever the cloud overshadows the tabernacle a number of days, they shall encamp by the word of the Lord, and shall remove by the command of the Lord.	καὶ ἔσται ὅταν σκεπάσῃ ἡ νεφέλη ἡµέρας ἀριθµῷ ἐπὶ τῆς σκηνῆς, διὰ φωνῆς κυρίου παρεµβαλοῦσιν καὶ διὰ προστάγµατος κυρίου ἀπαροῦσιν·						
Numbers	9	09	21	OT	1. OT	Pentateuch	1. Pentateuch	01. Pentateuch	04. Numbers	ⲟⲩⲟϩ ⲉⲥⲉ̀ϣⲱⲡⲓ ⲁⲣⲉϣⲁⲛ ϯϭⲏⲡⲓ ⲟϩⲓ ⲓⲥϫⲉⲛ ϣⲱⲣⲡ ϣⲁ ⲣⲟⲩϩⲓ ⲟⲩⲟϩ ⲉ̀ϣⲱⲡ ⲁⲣⲉϣⲁⲛ ϯϭⲏⲡⲓ ⲓ̀ ⲉ̀ⲡϣⲱⲓ ⲛ̀ϣⲱⲣⲡ ⲟⲩⲟϩ ⲉⲩⲉ̀ⲟⲩⲱⲧⲉⲃ ⲙ̀ⲡⲓⲉϩⲟⲟⲩ ⲓⲉ ⲡⲓⲉϫⲱⲣϩ		And it shall come to pass, whenever the cloud shall remain from the evening till the morning, and in the morning the cloud shall go up, then shall they remove by day or by night.	καὶ ἔσται ὅταν γένηται ἡ νεφέλη ἀφ’ ἑσπέρας ἕως πρωὶ καὶ ἀναβῇ ἡ νεφέλη τὸ πρωί, καὶ ἀπαροῦσιν ἡµέρας ἢ νυκτός·						
Numbers	9	09	22	OT	1. OT	Pentateuch	1. Pentateuch	01. Pentateuch	04. Numbers	ⲙ̀ⲡⲓⲉϩⲟⲟⲩ ⲓⲉ ⲡⲓⲁⲃⲟⲧ ⲉⲩⲉ̀ⲁϣⲁⲓ ⲛ̀ϫⲉ ⲡⲓⲉϩⲟⲟⲩ ⲉⲥⲉ̀ⲉⲣϧⲏⲓⲃⲓ ⲉ̀ϫⲱⲥ ⲛ̀ϫⲉ ϯϭⲏⲡⲓ ⲉⲩⲉ̀ϩⲓⲕⲟⲧ ⲛ̀ϫⲉ ⲛⲉⲛϣⲏⲣⲓ ⲙ̀ⲡⲓⲥ̅ⲗ̅ ⲟⲩⲟϩ ⲛ̀ⲛⲟⲩⲟⲩⲱⲧⲉⲃ		When the cloud continues a full month overshadowing the tabernacle, the children of Israel shall encamp, and shall not depart.	µηνὸς ἡµέρας πλεοναζούσης τῆς νεφέλης σκιαζούσης ἐπ’ αὐτῆς παρεµβαλοῦσιν οἱ υἱοὶ Ισραηλ καὶ οὐ µὴ ἀπάρωσιν.						
Numbers	9	09	23	OT	1. OT	Pentateuch	1. Pentateuch	01. Pentateuch	04. Numbers	ϫⲉ ⲉ̀ⲃⲟⲗ ϩⲓⲧⲉⲛ ⲡⲓⲟⲩⲁϩⲥⲁϩⲛⲓ ⲛ̀ⲧⲉ ⲡϭ̅ⲥ̅ ϣⲁⲩⲟⲩⲱⲧⲉⲃ ⲛⲁⲩⲁⲣⲉϩ ⲉ̀ⲛⲓⲟⲩⲉⲣϣⲓ ⲛ̀ⲧⲉ ⲡϭ̅ⲥ̅ ⲉ̀ⲃⲟⲗ ϩⲓⲧⲉⲛ ⲡⲓⲟⲩⲁϩⲥⲁϩⲛⲓ ⲛ̀ⲧⲉ ⲡϭ̅ⲥ̅ ϧⲉⲛ ⲛⲉⲛϫⲓϫ ⲙ̀ⲙⲱⲩ̀ⲥⲏⲥ		For they shall depart by the command of the Lord:—they kept the charge of the Lord by the command of the Lord by the hand of Moses.	ὅτι διὰ προστάγµατος κυρίου ἀπαροῦσιν, τὴν φυλακὴν κυρίου ἐφυλάξαντο διὰ προστάγµατος κυρίου ἐν χειρὶ Μωυσῆ.						
Numbers	10	10	1	OT	1. OT	Pentateuch	1. Pentateuch	01. Pentateuch	04. Numbers	ⲟⲩⲟϩ ⲁ ⲡϭ̅ⲥ̅ ⲥⲁϫⲓ ⲛⲉⲙ ⲙⲱⲩ̀ⲥⲏⲥ ⲉϥϫⲱ ⲙ̀ⲙⲟⲥ		And the Lord spoke to Moses, saying,	Καὶ ἐλάλησεν κύριος πρὸς Μωυσῆν λέγων						
Numbers	10	10	2	OT	1. OT	Pentateuch	1. Pentateuch	01. Pentateuch	04. Numbers	ϫⲉ ⲙⲁⲑⲁⲙⲓⲟ ⲛⲁⲕ ⲛ̀ⲥⲁⲗⲡⲓⲅⲝ ⲥⲛⲟⲩϯ ⲛ̀ϫⲁϫϩ ⲉⲕⲉ̀ⲑⲁⲙⲓⲱⲟⲩ ⲛ̀ϩⲁⲧ ⲟⲩⲟϩ ⲉⲩⲉ̀ϣⲱⲡⲓ ⲛⲁⲕ ⲉ̀ⲡϫⲓⲛ̀ⲑⲱⲟⲩϯ ⲛ̀ϯⲥⲩⲛⲁⲅⲱⲅⲏ ⲛⲉⲙ ⲉ̀ⲑⲣⲟⲩⲧⲱⲟⲩⲛⲟⲩ ⲛ̀ϫⲉ ⲛⲓⲡⲁⲣⲉⲙⲃⲟⲗⲏ		Make to thyself two silver trumpets: thou shalt make them of beaten work; and they shall be to thee for the purpose of calling the assembly, and of removing the camps.	Ποίησον σεαυτῷ δύο σάλπιγγας ἀργυρᾶς, ἐλατὰς ποιήσεις αὐτάς, καὶ ἔσονταί σοι ἀνακαλεῖν τὴν συναγωγὴν καὶ ἐξαίρειν τὰς παρεµβολάς.						
Numbers	10	10	3	OT	1. OT	Pentateuch	1. Pentateuch	01. Pentateuch	04. Numbers	ⲟⲩⲟϩ ⲉⲕⲉ̀ⲉⲣⲥⲁⲗⲡⲓⲍⲓⲛ ⲛ̀ϧⲏⲧⲟⲩ ⲟⲩⲟϩ ⲉⲥⲉ̀ⲑⲱⲟⲩϯ ⲛ̀ϫⲉ ϯⲥⲩⲛⲁⲅⲱⲅⲏ ⲧⲏⲣⲥ ϩⲓⲣⲉⲛ ⲛⲓⲣⲱⲟⲩ ⲛ̀ⲧⲉ ϯⲥⲕⲩⲛⲏ ⲛ̀ⲧⲉ ϯⲙⲉⲧⲙⲉⲑⲣⲉ		And thou shalt sound with them, and all the congregation shall be gathered to the door of the tabernacle of witness.	καὶ σαλπίσεις ἐν αὐταῖς, καὶ συναχθήσεται πᾶσα ἡ συναγωγὴ ἐπὶ τὴν θύραν τῆς σκηνῆς τοῦ µαρτυρίου·						
Numbers	10	10	4	OT	1. OT	Pentateuch	1. Pentateuch	01. Pentateuch	04. Numbers	ⲉ̀ϣⲱⲡ ⲇⲉ ⲁⲩϣⲁⲛⲉⲣⲥⲁⲗⲡⲓⲍⲓⲛ ϧⲉⲛ ⲟⲩⲓ ⲉⲩⲉ̀ⲓ̀ ϩⲁⲣⲟⲕ ⲧⲏⲣⲟⲩ ⲛ̀ϫⲉ ⲛⲓⲁⲣⲭⲱⲛ ⲛ̀ⲧⲉ ⲛⲉⲛϣⲏⲣⲓ ⲙ̀ⲡⲓⲥ̅ⲗ̅		And if they shall sound with one, all the rulers even the princes of Israel shall come to thee.	ἐὰν δὲ ἐν µιᾷ σαλπίσωσιν, προσελεύσονται πρὸς σὲ πάντες οἱ ἄρχοντες, ἀρχηγοὶ Ισραηλ.						
Numbers	10	10	5	OT	1. OT	Pentateuch	1. Pentateuch	01. Pentateuch	04. Numbers	ⲟⲩⲟϩ ⲉⲣⲉⲧⲉⲛⲉ̀ⲉⲣⲥⲁⲗⲡⲓⲍⲓⲛ ϧⲉⲛ ⲟⲩⲙⲏⲓⲛⲓ ⲟⲩⲟϩ ⲉⲩⲉ̀ⲟⲩⲱⲧⲉⲃ ⲛ̀ϫⲉ ⲛⲓⲡⲁⲣⲉⲙⲃⲟⲗⲏ ⲉⲧϩⲓⲕⲟⲧ ⲉ̀ⲛⲓⲙⲁⲛ̀ϣⲁⲓ		And ye shall sound an alarm, and the camps pitched eastward shall begin to move.	καὶ σαλπιεῖτε σηµασίαν, καὶ ἐξαροῦσιν αἱ παρεµβολαὶ αἱ παρεµβάλλουσαι ἀνατολάς·						
Numbers	10	10	6	OT	1. OT	Pentateuch	1. Pentateuch	01. Pentateuch	04. Numbers	ⲟⲩⲟϩ ⲉⲣⲉⲧⲉⲛⲉ̀ⲉⲣⲥⲁⲗⲡⲓⲍⲓⲛ ϧⲉⲛ ⲟⲩⲙⲏⲓⲛⲓ ⲙ̀ⲙⲁϩⲃ̅ ⲟⲩⲟϩ ⲉⲩⲉ̀ⲟⲩⲱⲧⲉⲃ ⲛ̀ϫⲉ ⲛⲓⲡⲁⲣⲉⲙⲃⲟⲗⲏ ⲛⲏ ⲉⲧϩⲓⲕⲟⲧ ⲉ̀ⲡⲉⲙⲉⲛⲧ ⲟⲩⲟϩ ⲉⲣⲉⲧⲉⲛⲉ̀ⲉⲣⲥⲁⲗⲡⲓⲍⲓⲛ ϧⲉⲛ ⲟⲩⲙⲏⲓⲛⲓ ⲙ̀ⲙⲁϩⲅ̅ ⲟⲩⲟϩ ⲉⲩⲉ̀ⲟⲩⲱⲧⲉⲃ ⲛ̀ϫⲉ ⲛⲓⲡⲁⲣⲉⲙⲃⲟⲗⲏ ⲛⲏ ⲉⲧϩⲓⲕⲟⲧ ⲉⲡⲥⲁ ⲙ̀ⲫⲓⲟⲙ ⲟⲩⲟϩ ⲉⲣⲉⲧⲉⲛⲉ̀ⲉⲣⲥⲁⲗⲡⲓⲍⲓⲛ ϧⲉⲛ ⲟⲩⲙⲏⲓⲛⲓ ⲙ̀ⲙⲁϩⲇ̅ ⲟⲩⲟϩ ⲉⲩⲉ̀ⲟⲩⲱⲧⲉⲃ ⲛ̀ϫⲉ ⲛⲓⲡⲁⲣⲉⲙⲃⲟⲗⲏ ⲛⲏ ⲉⲧϩⲓⲕⲟⲧ ⲉ̀ⲡⲉⲙϩⲓⲧ ϧⲉⲛ ⲟⲩⲙⲏⲓⲛⲓ ⲉⲩⲉ̀ⲉⲣⲥⲁⲗⲡⲓⲍⲓⲛ ϧⲉⲛ ⲟⲩϫⲓⲛⲧⲱⲟⲩⲛⲟⲩ		And ye shall sound a second alarm, and the camps pitched southward shall move; and ye shall sound a third alarm, and the camps pitched westward shall move forward; and ye shall sound a fourth alarm, and they that encamp toward the north shall move forward: they shall sound an alarm at their departure.	καὶ σαλπιεῖτε σηµασίαν δευτέραν, καὶ ἐξαροῦσιν αἱ παρεµβολαὶ αἱ παρεµβάλλουσαι λίβα· καὶ σαλπιεῖτε σηµασίαν τρίτην, καὶ ἐξαροῦσιν αἱ παρεµβολαὶ αἱ παρεµβάλλουσαι παρὰ θάλασσαν· καὶ σαλπιεῖτε σηµασίαν τετάρτην, καὶ ἐξαροῦσιν αἱ παρεµβολαὶ αἱ παρεµβάλλουσαι πρὸς βορρᾶν· σηµασίᾳ σαλπιοῦσιν ἐν τῇ ἐξάρσει αὐτῶν.						
Numbers	10	10	7	OT	1. OT	Pentateuch	1. Pentateuch	01. Pentateuch	04. Numbers	ⲟⲩⲟϩ ⲉⲥⲉ̀ϣⲱⲡⲓ ⲁⲥϣⲁⲛⲑⲱⲟⲩϯ ⲛ̀ϫⲉ ϯⲥⲩⲛⲁⲅⲱⲅⲏ ⲉⲣⲉⲧⲉⲛⲉ̀ⲉⲣⲥⲁⲗⲡⲓⲍⲓⲛ ⲟⲩⲟϩ ϧⲉⲛ ⲟⲩⲙⲏⲓⲛⲓ ⲁⲛ		And whenever ye shall gather the assembly, ye shall sound, but not an alarm.	καὶ ὅταν συναγάγητε τὴν συναγωγήν, σαλπιεῖτε καὶ οὐ σηµασίᾳ.						
Numbers	10	10	8	OT	1. OT	Pentateuch	1. Pentateuch	01. Pentateuch	04. Numbers	ⲟⲩⲟϩ ⲉⲣⲉ ⲛⲓⲟⲩⲏⲃ ⲛⲓϣⲏⲣⲓ ⲛ̀ⲧⲉ ⲁⲁⲣⲱⲛ ⲉⲩⲉ̀ⲉⲣⲥⲁⲗⲡⲓⲍⲓⲛ ϧⲉⲛ ⲛⲓⲥⲁⲗⲡⲓⲅⲝ ⲟⲩⲟϩ ⲉϥⲉ̀ϣⲱⲡⲓ ⲛⲱⲧⲉⲛ ⲛ̀ⲛⲟⲙⲟⲥ ϣⲁ ⲉ̀ⲛⲉϩ ⲛⲉⲙ ϣⲁ ⲛⲉⲧⲉⲛϫⲱⲟⲩ		And the priests the sons of Aaron shall sound with the trumpets; and it shall be a perpetual ordinance for you throughout your generations.	καὶ οἱ υἱοὶ Ααρων οἱ ἱερεῖς σαλπιοῦσιν ταῖς σάλπιγξιν, καὶ ἔσται ὑµῖν νόµιµον αἰώνιον εἰς τὰς γενεὰς ὑµῶν.						
Numbers	10	10	9	OT	1. OT	Pentateuch	1. Pentateuch	01. Pentateuch	04. Numbers	ⲉ̀ϣⲱⲡ ⲇⲉ ⲁⲣⲉⲧⲉⲛϣⲁⲛⲓ ⲉ̀ⲡⲓⲃⲱⲧⲥ ϧⲉⲛ ⲡⲉⲧⲉⲛⲕⲁϩⲓ ⲉ̀ϫⲉⲛ ⲛⲓϫⲁϫⲓ ⲛⲏ ⲉⲧⲟϩⲓ ⲉ̀ⲣⲁⲧⲟⲩ ⲟⲩⲃⲉ ⲑⲏⲛⲟⲩ ⲉⲣⲉⲧⲉⲛⲉ̀ⲙⲟⲩϯ ϧⲉⲛ ⲛⲓⲥⲁⲗⲡⲓⲅⲝ ⲟⲩⲟϩ ⲉⲩⲉ̀ⲉⲣ ⲡⲉⲧⲉⲛⲙⲉⲩⲓ ⲙ̀ⲡⲉⲙ̀ⲑⲟ ⲙ̀ⲡϭ̅ⲥ̅ ⲟⲩⲟϩ ⲉⲣⲉⲧⲉⲛⲉ̀ⲛⲟϩⲉⲙ ⲛ̀ⲧⲟⲧⲟⲩ ⲛ̀ⲛⲉⲧⲉⲛϫⲁϫⲓ ⲛⲏ ⲉⲧⲭⲏ ⲙ̀ⲡⲉⲧⲉⲛⲙ̀ⲑⲟ		And if ye shall go forth to war in your land against your enemies that are opposed to you, then shall ye sound with the trumpets; and ye shall be had in remembrance before the Lord, and ye shall be saved from your enemies.	ἐὰν δὲ ἐξέλθητε εἰς πόλεµον ἐν τῇ γῇ ὑµῶν πρὸς τοὺς ὑπεναντίους τοὺς ἀνθεστηκότας ὑµῖν, καὶ σηµανεῖτε ταῖς σάλπιγξιν καὶ ἀναµνησθήσεσθε ἔναντι κυρίου καὶ διασωθήσεσθε ἀπὸ τῶν ἐχθρῶν ὑµῶν.						
Numbers	10	10	10	OT	1. OT	Pentateuch	1. Pentateuch	01. Pentateuch	04. Numbers	ⲟⲩⲟϩ ⲛ̀ϩⲣⲏⲓ ϧⲉⲛ ⲡⲓⲉϩⲟⲟⲩ ⲛ̀ⲧⲉ ⲡⲉⲧⲉⲛⲟⲩⲛⲟϥ ⲛⲉⲙ ϧⲉⲛ ⲛⲉⲧⲉⲛϣⲁⲓ ⲛⲉⲙ ϧⲉⲛ ⲛⲉⲧⲉⲛⲥⲟⲩⲁⲓ ⲉⲣⲉⲧⲉⲛⲉ̀ⲉⲣⲥⲁⲗⲡⲓⲍⲓⲛ ϧⲉⲛ ⲛⲉⲧⲉⲛⲥⲁⲗⲡⲓⲅⲝ ⲉ̀ϩⲣⲏⲓ ⲉ̀ϫⲉⲛ ⲛⲉⲧⲉⲛϭⲗⲓⲗ ⲛⲉⲙ ⲛⲓϣⲟⲩϣⲱⲟⲩϣⲓ ⲛ̀ⲧⲉ ⲛⲉⲧⲉⲛⲟⲩϫⲁⲓ ⲟⲩⲟϩ ⲉⲥⲉ̀ϣⲱⲡⲓ ⲛⲱⲧⲉⲛ ⲛ̀ⲟⲩⲉⲣⲫⲙⲉⲩⲓ ⲙ̀ⲡⲉⲙ̀ⲑⲟ ⲙ̀ⲡⲉⲧⲉⲛⲛⲟⲩϯ ⲁ̀ⲛⲟⲕ ⲡⲉ ⲡϭ̅ⲥ̅ ⲡⲉⲧⲉⲛⲛⲟⲩϯ		And in the days of your gladness, and in your feasts, and in your new moons, ye shall sound with the trumpets at your whole-burnt-offerings, and at the sacrifices of your peace-offerings; and there shall be a memorial for you before your God: I am the Lord your God.	καὶ ἐν ταῖς ἡµέραις τῆς εὐφροσύνης ὑµῶν καὶ ἐν ταῖς ἑορταῖς ὑµῶν καὶ ἐν ταῖς νουµηνίαις ὑµῶν σαλπιεῖτε ταῖς σάλπιγξιν ἐπὶ τοῖς ὁλοκαυτώµασιν καὶ ἐπὶ ταῖς θυσίαις τῶν σωτηρίων ὑµῶν, καὶ ἔσται ὑµῖν ἀνάµνησις ἔναντι τοῦ θεοῦ ὑµῶν· ἐγὼ κύριος ὁ θεὸς ὑµῶν.						
Numbers	10	10	11	OT	1. OT	Pentateuch	1. Pentateuch	01. Pentateuch	04. Numbers	ⲟⲩⲟϩ ⲁⲥϣⲱⲡⲓ ϧⲉⲛ ϯⲣⲟⲙⲡⲓ ⲙ̀ⲙⲁϩ ⲥⲛⲟⲩϯ ϧⲉⲛ ⲡⲓⲁⲃⲟⲧ ⲙ̀ⲙⲁϩ ⲥⲛⲁⲩ ⲛ̀ⲥⲟⲩⲕ̅ ⲙ̀ⲡⲓⲁⲃⲟⲧ ⲁⲥϣⲉ ⲛⲁⲥ ⲉ̀ⲡϣⲱⲓ ⲛ̀ϫⲉ ϯϭⲏⲡⲓ ⲉ̀ⲃⲟⲗ ϩⲁ ϯⲥⲕⲩⲛⲏ ⲛ̀ⲧⲉ ϯⲙⲉⲧⲙⲉⲑⲣⲉ		And it came to pass in the second year, in the second month, on the twentieth day of the month, the cloud went up from the tabernacle of witness.	Καὶ ἐγένετο ἐν τῷ ἐνιαυτῷ τῷ δευτέρῳ ἐν τῷ µηνὶ τῷ δευτέρῳ εἰκάδι τοῦ µηνὸς ἀνέβη ἡ νεφέλη ἀπὸ τῆς σκηνῆς τοῦ µαρτυρίου,						
