book	chapter	chapter-zfilled	verse	testament	testament-indexed	section	section-indexed	section-indexed-no-testament	book-indexed	Bohairic	Sahidic	English	Greek	Fayyumic	Akhmimic	OldBohairic	Mesokemic	DialectP	Lycopolitan
Numbers	7	07	89	OT	1. OT	Pentateuch	1. Pentateuch	01. Pentateuch	04. Numbers	ⲟⲩⲟϩ ϧⲉⲛ ⲡϫⲓⲛⲓ̀ ⲉ̀ϧⲟⲩⲛ ⲛ̀ⲧⲉ ⲙⲱⲩ̀ⲥⲏⲥ ⲉ̀ϯⲥⲕⲩⲛⲏ ⲛ̀ⲧⲉ ϯⲙⲉⲧⲙⲉⲑⲣⲉ ⲉ̀ⲥⲁϫⲓ ⲛⲉⲙⲁϥ ⲟⲩⲟϩ ⲁϥⲥⲱⲧⲉⲙ ⲉ̀ϯⲥⲙⲏ ⲛ̀ⲧⲉ ⲡϭ̅ⲥ̅ ⲉⲥⲥⲁϫⲓ ⲛⲉⲙⲁϥ ⲥⲁⲡϣⲱⲓ ⲛ̀ϯⲥⲉⲥⲃⲟϩ ϧⲉⲛ ⲑⲙⲏϯ ⲙ̀ⲡⲓⲭⲉⲣⲟⲩⲃⲓⲙ ⲃ̅ ⲛⲏ ⲉⲧϩⲓϫⲉⲛ ϯⲕⲩⲃⲱⲧⲟⲥ ⲛ̀ⲧⲉ ϯⲙⲉⲧⲙⲉⲑⲣⲉ ⲟⲩⲟϩ ϣⲁϥⲥⲁϫⲓ ⲛⲉⲙⲁϥ ⲛ̀ϫⲉ ⲡϭ̅ⲥ̅		When Moses went into the tabernacle of witness to speak to God, then he heard the voice of the Lord speaking to him from off the mercy-seat, which is upon the ark of the testimony, between the two cherubs; and he spoke to him.	ἐν τῷ εἰσπορεύεσθαι Μωυσῆν εἰς τὴν σκηνὴν τοῦ µαρτυρίου λαλῆσαι αὐτῷ καὶ ἤκουσεν τὴν φωνὴν κυρίου λαλοῦντος πρὸς αὐτὸν ἄνωθεν τοῦ ἱλαστηρίου, ὅ ἐστιν ἐπὶ τῆς κιβωτοῦ τοῦ µαρτυρίου, ἀνὰ µέσον τῶν δύο χερουβιµ· καὶ ἐλάλει πρὸς αὐτόν.						
Numbers	8	08	1	OT	1. OT	Pentateuch	1. Pentateuch	01. Pentateuch	04. Numbers	ⲟⲩⲟϩ ⲁϥⲥⲁϫⲓ ⲛ̀ϫⲉ ⲡϭ̅ⲥ̅ ⲛⲉⲙ ⲙⲱⲩ̀ⲥⲏⲥ ⲉϥϫⲱ ⲙ̀ⲙⲟⲥ		And the Lord spoke to Moses, saying,	Καὶ ἐλάλησεν κύριος πρὸς Μωυσῆν λέγων						
Numbers	8	08	2	OT	1. OT	Pentateuch	1. Pentateuch	01. Pentateuch	04. Numbers	ϫⲉ ⲥⲁϫⲓ ⲛⲉⲙ ⲁⲁⲣⲱⲛ ⲟⲩⲟϩ ⲉⲕⲉ̀ϫⲟⲥ ⲛⲁϥ ϫⲉ ⲉ̀ϣⲱⲡ ⲁⲕϣⲁⲛⲭⲱ ⲛ̀ⲛⲓϧⲏⲃⲥ ϩⲓ ⲟⲩⲙⲉⲣⲟⲥ ⲛ̀ⲧⲉ ϯⲗⲩⲭⲛⲓⲁ ⲉⲩⲉ̀ⲉⲣⲟⲩⲱⲓⲛⲓ ⲛ̀ϫⲉ ⲡⲓ̅ⲍ ⲛ̀ϧⲏⲃⲥ		Speak to Aaron, and thou shalt say to him, Whenever thou shalt set the lamps in order, the seven lamps shall give light opposite the candlestick.	Λάλησον τῷ Ααρων καὶ ἐρεῖς πρὸς αὐτόν Ὅταν ἐπιτιθῇς τοὺς λύχνους, ἐκ µέρους κατὰ πρόσωπον τῆς λυχνίας φωτιοῦσιν οἱ ἑπτὰ λύχνοι.						
Numbers	8	08	3	OT	1. OT	Pentateuch	1. Pentateuch	01. Pentateuch	04. Numbers	ⲟⲩⲟϩ ⲁϥⲓⲣⲓ ⲛ̀ϫⲉ ⲁⲁⲣⲱⲛ ⲙ̀ⲡⲁⲓⲣⲏϯ ϧⲉⲛ ⲟⲩⲙⲉⲣⲟⲥ ⲙ̀ⲡⲉⲙ̀ⲑⲟ ⲛ̀ϯⲗⲩⲭⲛⲓⲁ ⲟⲩⲟϩ ⲁϥϭⲉⲣⲟ ⲛ̀ⲛⲓϧⲏⲃⲥ ⲕⲁⲧⲁ ⲫⲣⲏϯ ⲉⲧⲁ ⲡϭ̅ⲥ̅ ϩⲟⲛϩⲉⲛ ⲉ̀ⲧⲟⲧϥ ⲙ̀ⲙⲱⲩ̀ⲥⲏⲥ		And Aaron did so: on one side opposite the candlestick he lighted its lamps, as the Lord appointed Moses.	καὶ ἐποίησεν οὕτως Ααρων· ἐκ τοῦ ἑνὸς µέρους κατὰ πρόσωπον τῆς λυχνίας ἐξῆψεν τοὺς λύχνους αὐτῆς, καθὰ συνέταξεν κύριος τῷ Μωυσῇ.						
Numbers	8	08	4	OT	1. OT	Pentateuch	1. Pentateuch	01. Pentateuch	04. Numbers	ⲟⲩⲟϩ ⲫⲁⲓ ⲡⲉ ⲡⲓⲥⲟⲃϯ ⲛ̀ⲧⲉ ϯⲗⲩⲭⲛⲓⲁ ⲉⲥϫⲟⲣϫ ⲛ̀ⲛⲟⲩⲃ ⲟⲩⲟϩ ⲟⲩⲛⲟⲩⲃ ⲡⲉ ⲡⲉⲥⲕⲁϣ ⲛⲉⲙ ⲡⲉⲥϫⲁⲗ ⲉⲥⲧⲁϫⲣⲏⲟⲩⲧ ⲧⲏⲣⲥ ⲕⲁⲧⲁ ⲡⲓⲥⲙⲟⲧ ⲉⲧⲁ ⲡϭ̅ⲥ̅ ⲧⲁⲙⲉ ⲙⲱⲩ̀ⲥⲏⲥ ⲉ̀ⲣⲟϥ ⲡⲁⲓⲣⲏϯ ⲁϥⲑⲁⲙⲓⲟ ⲛ̀ϯⲗⲩⲭⲛⲓⲁ		And this is the construction of the candlestick: it is solid, golden—its stem, and its lilies—all solid: according to the pattern which the Lord shewed Moses, so he made the candlestick.	καὶ αὕτη ἡ κατασκευὴ τῆς λυχνίας· στερεὰ χρυσῆ, ὁ καυλὸς αὐτῆς καὶ τὰ κρίνα αὐτῆς, στερεὰ ὅλη· κατὰ τὸ εἶδος, ὃ ἔδειξεν κύριος τῷ Μωυσῇ, οὕτως ἐποίησεν τὴν λυχνίαν.						
Numbers	8	08	5	OT	1. OT	Pentateuch	1. Pentateuch	01. Pentateuch	04. Numbers	ⲟⲩⲟϩ ⲁ ⲡϭ̅ⲥ̅ ⲥⲁϫⲓ ⲛⲉⲙ ⲙⲱⲩ̀ⲥⲏⲥ ⲉϥϫⲱ ⲙ̀ⲙⲟⲥ		And the Lord spoke to Moses, saying,	Καὶ ἐλάλησεν κύριος πρὸς Μωυσῆν λέγων						
Numbers	8	08	6	OT	1. OT	Pentateuch	1. Pentateuch	01. Pentateuch	04. Numbers	ϫⲉ ϭⲓ ⲛ̀ⲛⲓⲗⲉⲩⲓⲧⲏⲥ ⲉ̀ⲃⲟⲗ ϧⲉⲛ ⲑⲙⲏϯ ⲛ̀ⲛⲉⲛϣⲏⲣⲓ ⲙ̀ⲡⲓⲥ̅ⲗ̅ ⲟⲩⲟϩ ⲉⲕⲉ̀ⲧⲟⲩⲃⲱⲟⲩ		Take the Levites out of the midst of the children of Israel, and thou shalt purify them.	Λαβὲ τοὺς Λευίτας ἐκ µέσου υἱῶν Ισραηλ καὶ ἀφαγνιεῖς αὐτούς.						
Numbers	8	08	7	OT	1. OT	Pentateuch	1. Pentateuch	01. Pentateuch	04. Numbers	ⲟⲩⲟϩ ⲡⲁⲓⲣⲏϯ ⲉⲕⲉ̀ⲓⲣⲓ ⲛⲱⲟⲩ ⲙ̀ⲡⲟⲩⲧⲟⲩⲃⲟ ⲉⲕⲉ̀ⲛⲟⲩϫϧ ⲉ̀ϫⲱⲟⲩ ⲛ̀ⲟⲩⲙⲱⲟⲩ ⲛ̀ⲧⲟⲩⲃⲟ ⲟⲩⲟϩ ⲉⲕⲉ̀ⲓⲛⲓ ⲛ̀ⲟⲩⲑⲟⲕ ⲉ̀ⲃⲟⲗ ⲉ̀ϫⲉⲛ ⲡⲟⲩⲥⲱⲙⲁ ⲧⲏⲣϥ ⲟⲩⲟϩ ⲉⲩⲉ̀ⲣⲱϧⲓ ⲛ̀ⲛⲟⲩϩⲃⲱⲥ ⲟⲩⲟϩ ⲉⲩⲉ̀ϣⲱⲡⲓ ⲉⲩⲧⲟⲩⲃⲏⲟⲩⲧ		And thus shalt thou perform their purification: thou shalt sprinkle them with water of purification, and a razor shall come upon the whole of their body, and they shall wash their garments, and shall be clean.	καὶ οὕτως ποιήσεις αὐτοῖς τὸν ἁγνισµὸν αὐτῶν· περιρρανεῖς αὐτοὺς ὕδωρ ἁγνισµοῦ, καὶ ἐπελεύσεται ξυρὸν ἐπὶ πᾶν τὸ σῶµα αὐτῶν, καὶ πλυνοῦσιν τὰ ἱµάτια αὐτῶν καὶ καθαροὶ ἔσονται.						
Numbers	8	08	8	OT	1. OT	Pentateuch	1. Pentateuch	01. Pentateuch	04. Numbers	ⲟⲩⲟϩ ⲉⲩⲉ̀ϭⲓ ⲛ̀ⲟⲩⲙⲁⲥⲓ ⲉ̀ⲃⲟⲗ ϧⲉⲛ ϩⲁⲛⲉϩⲱⲟⲩ ⲫⲁⲓ ⲉⲩⲉ̀ⲉⲛϥ ⲉ̀ϩⲣⲏⲓ ⲛ̀ⲟⲩϣⲟⲩϣⲱⲟⲩϣⲓ ⲛⲉⲙ ⲟⲩⲥⲓⲙⲉⲇⲁⲗⲓⲟⲛ ⲉϥⲟⲩⲟϣⲉⲙ ϧⲉⲛ ⲟⲩⲛⲉϩ ⲟⲩⲟϩ ⲟⲩⲙⲁⲥⲓ ⲉ̀ⲁϥⲉⲣⲟⲩⲣⲟⲙⲡⲓ ⲉⲕⲉ̀ϭⲓⲧϥ ⲉ̀ⲃⲟⲗ ϧⲉⲛ ϩⲁⲛⲉϩⲱⲟⲩ ⲉ̀ϫⲉⲛ ⲫⲛⲟⲃⲓ		And they shall take one calf of the herd, and its meat-offering, fine flour mingled with oil: and thou shalt take a calf of a year old of the herd for a sin-offering.	καὶ λήµψονται µόσχον ἕνα ἐκ βοῶν καὶ τούτου θυσίαν σεµιδάλεως ἀναπεποιηµένην ἐν ἐλαίῳ, καὶ µόσχον ἐνιαύσιον ἐκ βοῶν λήµψῃ περὶ ἁµαρτίας.						
Numbers	8	08	9	OT	1. OT	Pentateuch	1. Pentateuch	01. Pentateuch	04. Numbers	ⲉⲕⲉ̀ⲓⲛⲓ ⲛ̀ⲛⲓⲗⲉⲩⲓⲧⲏⲥ ⲙ̀ⲡⲉⲙ̀ⲑⲟ ⲛ̀ϯⲥⲕⲩⲛⲏ ⲛ̀ⲧⲉ ϯⲙⲉⲧⲙⲉⲑⲣⲉ ⲟⲩⲟϩ ⲉⲕⲉ̀ⲑⲱⲟⲩϯ ⲛ̀ϯⲥⲩⲛⲁⲅⲱⲅⲏ ⲧⲏⲣⲥ ⲛ̀ⲧⲉ ⲛⲉⲛϣⲏⲣⲓ ⲙ̀ⲡⲓⲥ̅ⲗ̅		And thou shalt bring the Levites before the tabernacle of witness; and thou shalt assemble all the congregation of the sons of Israel.	καὶ προσάξεις τοὺς Λευίτας ἔναντι τῆς σκηνῆς τοῦ µαρτυρίου καὶ συνάξεις πᾶσαν συναγωγὴν υἱῶν Ισραηλ						
Numbers	8	08	10	OT	1. OT	Pentateuch	1. Pentateuch	01. Pentateuch	04. Numbers	ⲟⲩⲟϩ ⲉⲕⲉ̀ⲓⲛⲓ ⲛ̀ⲛⲓⲗⲉⲩⲓⲧⲏⲥ ⲙ̀ⲡⲉⲙ̀ⲑⲟ ⲙ̀ⲡϭ̅ⲥ̅ ⲟⲩⲟϩ ⲉⲣⲉ ⲛⲉⲛϣⲏⲣⲓ ⲙ̀ⲡⲓⲥ̅ⲗ̅ ⲧⲁⲗⲟ ⲛ̀ⲛⲟⲩϫⲓϫ ⲉ̀ϩⲣⲏⲓ ⲉ̀ϫⲉⲛ ⲛⲓⲗⲉⲩⲓⲧⲏⲥ		And thou shalt bring the Levites before the Lord; and the sons of Israel shall lay their hands upon the Levites.	καὶ προσάξεις τοὺς Λευίτας ἔναντι κυρίου, καὶ ἐπιθήσουσιν οἱ υἱοὶ Ισραηλ τὰς χεῖρας αὐτῶν ἐπὶ τοὺς Λευίτας,						
Numbers	8	08	11	OT	1. OT	Pentateuch	1. Pentateuch	01. Pentateuch	04. Numbers	ⲟⲩⲟϩ ⲉⲣⲉ ⲁⲁⲣⲱⲛ ⲫⲱⲣϫ ⲛ̀ⲛⲓⲗⲉⲩⲓⲧⲏⲥ ⲉ̀ⲃⲟⲗ ⲛ̀ⲟⲩⲧⲁⲓⲟ ⲙ̀ⲡⲉⲙ̀ⲑⲟ ⲙ̀ⲡϭ̅ⲥ̅ ⲉ̀ⲃⲟⲗ ϩⲓⲧⲟⲧⲟⲩ ⲛ̀ⲛⲉⲛϣⲏⲣⲓ ⲙ̀ⲡⲓⲥ̅ⲗ̅ ⲟⲩⲟϩ ⲉⲩⲉ̀ϣⲱⲡⲓ ϩⲱⲥⲧⲉ ⲉ̀ⲉⲣϩⲱⲃ ⲉ̀ⲛⲓϩⲃⲏⲟⲩⲓ ⲛ̀ⲧⲉ ⲡϭ̅ⲥ̅		And Aaron shall separate the Levites for a gift before the Lord from the children of Israel: and they shall be prepared to perform the works of the Lord.	καὶ ἀφοριεῖ Ααρων τοὺς Λευίτας ἀπόδοµα ἔναντι κυρίου παρὰ τῶν υἱῶν Ισραηλ, καὶ ἔσονται ὥστε ἐργάζεσθαι τὰ ἔργα κυρίου.						
Numbers	8	08	12	OT	1. OT	Pentateuch	1. Pentateuch	01. Pentateuch	04. Numbers	ⲛⲓⲗⲉⲩⲓⲧⲏⲥ ⲇⲉ ⲉⲩⲉ̀ⲧⲁⲗⲟ ⲛ̀ⲛⲟⲩϫⲓϫ ⲉ̀ϩⲣⲏⲓ ⲉ̀ϫⲉⲛ ⲧⲁⲫⲉ ⲛ̀ⲛⲓⲙⲁⲥⲓ ⲟⲩⲟϩ ⲉⲩⲉ̀ⲓⲛⲓ ⲛⲟⲩⲁⲓ ⲉ̀ϩⲣⲏⲓ ⲉ̀ϫⲉⲛ ⲫⲛⲟⲃⲓ ⲟⲩⲟϩ ⲡⲓⲕⲉⲟⲩⲁⲓ ⲉⲩϭⲗⲓⲗ ⲙ̀ⲡϭ̅ⲥ̅ ⲉ̀ⲧⲱⲃϩ ⲉ̀ϩⲣⲏⲓ ⲉ̀ϫⲱⲟⲩ		And the Levites shall lay their hands on the heads of the calves; and thou shalt offer one for a sin-offering, and the other for a whole-burnt-offering to the Lord, to make atonement for them.	οἱ δὲ Λευῖται ἐπιθήσουσιν τὰς χεῖρας ἐπὶ τὰς κεφαλὰς τῶν µόσχων, καὶ ποιήσει τὸν ἕνα περὶ ἁµαρτίας καὶ τὸν ἕνα εἰς ὁλοκαύτωµα κυρίῳ ἐξιλάσασθαι περὶ αὐτῶν.						
Numbers	8	08	13	OT	1. OT	Pentateuch	1. Pentateuch	01. Pentateuch	04. Numbers	ⲟⲩⲟϩ ⲉⲕⲉ̀ⲧⲁϩⲟ ⲛ̀ⲛⲓⲗⲉⲩⲓⲧⲏⲥ ⲙ̀ⲡⲉⲙ̀ⲑⲟ ⲙ̀ⲡϭ̅ⲥ̅ ⲛⲉⲙ ⲙ̀ⲡⲉⲙ̀ⲑⲟ ⲛ̀ⲁⲁⲣⲱⲛ ⲛⲉⲙ ⲙ̀ⲡⲉⲙ̀ⲑⲟ ⲛ̀ⲛⲉϥϣⲏⲣⲓ ⲟⲩⲟϩ ⲉⲕⲉ̀ⲧⲏⲓⲧⲟⲩ ⲛ̀ⲟⲩⲧⲁⲓⲟ ⲙ̀ⲡⲉⲙ̀ⲑⲟ ⲙ̀ⲡϭ̅ⲥ̅		And thou shalt set the Levites before the Lord, and before Aaron, and before his sons; and thou shalt give them as a gift before the Lord.	καὶ στήσεις τοὺς Λευίτας ἔναντι κυρίου καὶ ἔναντι Ααρων καὶ ἔναντι τῶν υἱῶν αὐτοῦ καὶ ἀποδώσεις αὐτοὺς ἀπόδοµα ἔναντι κυρίου·						
Numbers	8	08	14	OT	1. OT	Pentateuch	1. Pentateuch	01. Pentateuch	04. Numbers	ⲟⲩⲟϩ ⲉⲕⲉ̀ⲟⲩⲱϯ ⲛ̀ⲛⲓⲗⲉⲩⲓⲧⲏⲥ ⲉ̀ⲃⲟⲗ ϧⲉⲛ ⲑⲙⲏϯ ⲛ̀ⲛⲉⲛϣⲏⲣⲓ ⲙ̀ⲡⲓⲥ̅ⲗ̅ ⲟⲩⲟϩ ⲉⲩⲉ̀ϣⲱⲡⲓ ⲛⲏⲓ		And thou shalt separate the Levites from the midst of the sons of Israel, and they shall be mine.	καὶ διαστελεῖς τοὺς Λευίτας ἐκ µέσου υἱῶν Ισραηλ, καὶ ἔσονται ἐµοί.						
Numbers	8	08	15	OT	1. OT	Pentateuch	1. Pentateuch	01. Pentateuch	04. Numbers	ⲟⲩⲟϩ ⲙⲉⲛⲉⲛⲥⲁ ⲛⲁⲓ ⲉⲩⲉ̀ⲓ̀ ⲉ̀ϧⲟⲩⲛ ⲛ̀ϫⲉ ⲛⲓⲗⲉⲩⲓⲧⲏⲥ ⲉ̀ⲉⲣϩⲱⲃ ⲉ̀ⲛⲓϩⲃⲏⲟⲩⲓ ⲛ̀ⲧⲉ ϯⲥⲕⲩⲛⲏ ⲛ̀ⲧⲉ ϯⲙⲉⲧⲙⲉⲑⲣⲉ ⲟⲩⲟϩ ⲉⲕⲉ̀ⲧⲟⲩⲃⲱⲟⲩ ⲟⲩⲟϩ ⲉⲕⲉ̀ⲧⲏⲓⲧⲟⲩ ⲛ̀ⲟⲩⲧⲁⲓⲟ ⲙ̀ⲡⲉⲙ̀ⲑⲟ ⲙ̀ⲡϭ̅ⲥ̅		And afterwards the Levites shall go in to perform the works of the tabernacle of witness; and thou shalt purify them, and present them before the Lord.	καὶ µετὰ ταῦτα εἰσελεύσονται οἱ Λευῖται ἐργάζεσθαι τὰ ἔργα τῆς σκηνῆς τοῦ µαρτυρίου, καὶ καθαριεῖς αὐτοὺς καὶ ἀποδώσεις αὐτοὺς ἔναντι κυρίου.						
Numbers	8	08	16	OT	1. OT	Pentateuch	1. Pentateuch	01. Pentateuch	04. Numbers	ϫⲉ ⲟⲩⲧⲁⲓⲟ ⲉϥⲧⲟⲓ ⲛⲏⲓ ⲡⲉ ⲫⲁⲓ ⲉ̀ⲃⲟⲗ ϧⲉⲛ ⲑⲙⲏϯ ⲛ̀ⲛⲉⲛϣⲏⲣⲓ ⲙ̀ⲡⲓⲥ̅ⲗ̅ ⲛ̀ⲧϣⲉⲃⲓⲱ ⲛ̀ⲟⲩⲟⲛ ⲛⲓⲃⲉⲛ ⲉⲧⲛⲁⲟⲩⲱⲛ ⲛ̀ⲧⲉϥⲧⲟϯ ⲛ̀ⲧⲉ ⲛⲓϣⲟⲣⲡ ⲙ̀ⲙⲓⲥⲓ ⲛ̀ⲧⲉ ⲛⲉⲛϣⲏⲣⲓ ⲙ̀ⲡⲓⲥ̅ⲗ̅ ⲁⲓϭⲓⲧⲟⲩ ⲛⲏⲓ		For these are given to me for a present out of the midst of the children of Israel: I have taken them to myself instead of all the first-born of the sons of Israel that open every womb.	ὅτι ἀπόδοµα ἀποδεδοµένοι οὗτοί µοί εἰσιν ἐκ µέσου υἱῶν Ισραηλ· ἀντὶ τῶν διανοιγόντων πᾶσαν µήτραν πρωτοτόκων πάντων ἐκ τῶν υἱῶν Ισραηλ εἴληφα αὐτοὺς ἐµοί.						
Numbers	8	08	17	OT	1. OT	Pentateuch	1. Pentateuch	01. Pentateuch	04. Numbers	ϫⲉ ⲛ̀ⲧⲏⲓ ⲟⲩϣⲟⲣⲡ ⲙ̀ⲙⲓⲥⲓ ⲛⲓⲃⲉⲛ ϧⲉⲛ ⲛⲉⲛϣⲏⲣⲓ ⲙ̀ⲡⲓⲥ̅ⲗ̅ ⲓⲥϫⲉⲛ ⲫⲣⲱⲙⲓ ϣⲁ ⲡⲧⲉⲃⲛⲏ ϧⲉⲛ ⲡⲓⲉϩⲟⲟⲩ ⲉⲧⲁⲓϣⲁⲣⲓ ⲉ̀ϣⲟⲣⲡ ⲙ̀ⲙⲓⲥⲓ ⲛⲓⲃⲉⲛ ϧⲉⲛ ⲡⲕⲁϩⲓ ⲛ̀ⲭⲏⲙⲓ ⲁⲓⲧⲟⲩⲃⲱⲟⲩ ⲛⲏⲓ		For every first-born among the children of Israel is mine, whether of man or beast: in the day in which I smote every first-born in the land of Egypt, I sanctified them to myself.	ὅτι ἐµοὶ πᾶν πρωτότοκον ἐν υἱοῖς Ισραηλ ἀπὸ ἀνθρώπου ἕως κτήνους· ᾗ ἡµέρᾳ ἐπάταξα πᾶν πρωτότοκον ἐν γῇ Αἰγύπτῳ, ἡγίασα αὐτοὺς ἐµοὶ						
Numbers	8	08	18	OT	1. OT	Pentateuch	1. Pentateuch	01. Pentateuch	04. Numbers	ⲟⲩⲟϩ ⲁⲓϭⲓ ⲛ̀ⲛⲓⲗⲉⲩⲓⲧⲏⲥ ⲛ̀ⲧϣⲉⲃⲓⲱ ⲛ̀ϣⲟⲣⲡ ⲙ̀ⲙⲓⲥⲓ ⲛⲓⲃⲉⲛ ϧⲉⲛ ⲛⲉⲛϣⲏⲣⲓ ⲙ̀ⲡⲓⲥ̅ⲗ̅		And I took the Levites in the place of every first-born among the children of Israel.	καὶ ἔλαβον τοὺς Λευίτας ἀντὶ παντὸς πρωτοτόκου ἐν υἱοῖς Ισραηλ.						
Numbers	8	08	19	OT	1. OT	Pentateuch	1. Pentateuch	01. Pentateuch	04. Numbers	ⲟⲩⲟϩ ⲁⲓϯ ⲛ̀ⲛⲓⲗⲉⲩⲓⲧⲏⲥ ⲛ̀ⲧⲁⲓⲟ ⲛ̀ⲁⲁⲣⲱⲛ ⲛⲉⲙ ⲛⲉϥϣⲏⲣⲓ ⲉ̀ⲃⲟⲗ ϧⲉⲛ ⲑⲙⲏϯ ⲛ̀ⲛⲉⲛϣⲏⲣⲓ ⲙ̀ⲡⲓⲥ̅ⲗ̅ ⲉ̀ⲉⲣϩⲱⲃ ⲉ̀ⲛⲓϩⲃⲏⲟⲩⲓ ϧⲉⲛ ϯⲥⲕⲩⲛⲏ ⲛ̀ⲧⲉ ϯⲙⲉⲧⲙⲉⲑⲣⲉ ⲟⲩⲟϩ ⲉ̀ⲧⲱⲃϩ ⲉ̀ϫⲉⲛ ⲛⲉⲛϣⲏⲣⲓ ⲙ̀ⲡⲓⲥ̅ⲗ̅ ⲟⲩⲟϩ ⲛ̀ⲛⲉ ⲟⲩⲟⲛ ϣⲱⲡⲓ ϧⲉⲛ ⲛⲉⲛϣⲏⲣⲓ ⲙ̀ⲡⲓⲥ̅ⲗ̅ ⲉϥϧⲉⲛⲧ ⲉ̀ⲛⲏ ⲉⲑⲟⲩⲁⲃ		And I gave the Levites presented as a gift to Aaron and his sons out of the midst of the children of Israel, to do the service of the children of Israel in the tabernacle of witness, and to make atonement for the children of Israel: thus there shall be none among the sons of Israel to draw nigh to the holy things.	καὶ ἀπέδωκα τοὺς Λευίτας ἀπόδοµα δεδοµένους Ααρων καὶ τοῖς υἱοῖς αὐτοῦ ἐκ µέσου υἱῶν Ισραηλ ἐργάζεσθαι τὰ ἔργα τῶν υἱῶν Ισραηλ ἐν τῇ σκηνῇ τοῦ µαρτυρίου καὶ ἐξιλάσκεσθαι περὶ τῶν υἱῶν Ισραηλ, καὶ οὐκ ἔσται ἐν τοῖς υἱοῖς Ισραηλ προσεγγίζων πρὸς τὰ ἅγια. —						
Numbers	8	08	20	OT	1. OT	Pentateuch	1. Pentateuch	01. Pentateuch	04. Numbers	ⲟⲩⲟϩ ⲁϥⲓⲣⲓ ⲛ̀ϫⲉ ⲙⲱⲩ̀ⲥⲏⲥ ⲛⲉⲙ ⲁⲁⲣⲱⲛ ⲛⲉⲙ ϯⲥⲩⲛⲁⲅⲱⲅⲏ ⲧⲏⲣⲥ ⲛ̀ⲧⲉ ⲛⲉⲛϣⲏⲣⲓ ⲙ̀ⲡⲓⲥ̅ⲗ̅ ⲛ̀ⲛⲓⲗⲉⲩⲓⲧⲏⲥ ⲕⲁⲧⲁ ⲫⲣⲏϯ ⲉⲧⲁ ⲡϭ̅ⲥ̅ ⲟⲩⲁϩⲥⲁϩⲛⲓ ⲉ̀ⲧⲟⲧϥ ⲙ̀ⲙⲱⲩ̀ⲥⲏⲥ ⲉⲑⲃⲉ ⲛⲓⲗⲉⲩⲓⲧⲏⲥ ⲁⲩⲓⲣⲓ ⲛⲱⲟⲩ ⲙ̀ⲡⲁⲓⲣⲏϯ ⲛ̀ϫⲉ ⲛⲉⲛϣⲏⲣⲓ ⲙ̀ⲡⲓⲥ̅ⲗ̅		And Moses and Aaron, and all the congregation of the children of Israel, did to the Levites as the Lord commanded Moses concerning the Levites, so the sons of Israel did to them.	καὶ ἐποίησεν Μωυσῆς καὶ Ααρων καὶ πᾶσα συναγωγὴ υἱῶν Ισραηλ τοῖς Λευίταις καθὰ ἐνετείλατο κύριος τῷ Μωυσῇ περὶ τῶν Λευιτῶν, οὕτως ἐποίησαν αὐτοῖς οἱ υἱοὶ Ισραηλ.						
Numbers	8	08	21	OT	1. OT	Pentateuch	1. Pentateuch	01. Pentateuch	04. Numbers	ⲟⲩⲟϩ ⲁⲩⲧⲟⲩⲃⲱⲟⲩ ⲛ̀ϫⲉ ⲛⲓⲗⲉⲩⲓⲧⲏⲥ ⲁⲩⲣⲱϧⲓ ⲛ̀ⲛⲟⲩϩⲃⲱⲥ ⲁⲩⲧⲏⲓⲧⲟⲩ ⲛ̀ⲁⲁⲣⲱⲛ ⲛ̀ⲧⲁⲓⲟ ⲙ̀ⲡⲉⲙ̀ⲑⲟ ⲙ̀ⲡϭ̅ⲥ̅ ⲟⲩⲟϩ ⲁϥⲧⲱⲃϩ ⲉ̀ϩⲣⲏⲓ ⲉ̀ϫⲱⲟⲩ ⲛ̀ϫⲉ ⲁⲁⲣⲱⲛ ⲉ̀ⲧⲟⲩⲃⲱⲟⲩ		So the Levites purified themselves and washed their garments; and Aaron presented them as a gift before the Lord, and Aaron made atonement for them to purify them.	καὶ ἡγνίσαντο οἱ Λευῖται καὶ ἐπλύναντο τὰ ἱµάτια, καὶ ἀπέδωκεν αὐτοὺς Ααρων ἀπόδοµα ἔναντι κυρίου, καὶ ἐξιλάσατο περὶ αὐτῶν Ααρων ἀφαγνίσασθαι αὐτούς.						
Numbers	8	08	22	OT	1. OT	Pentateuch	1. Pentateuch	01. Pentateuch	04. Numbers	ⲟⲩⲟϩ ⲙⲉⲛⲉⲛⲥⲁ ⲛⲁⲓ ⲁⲩⲓ̀ ⲉ̀ϧⲟⲩⲛ ⲛ̀ϫⲉ ⲛⲓⲗⲉⲩⲓⲧⲏⲥ ⲉ̀ⲫⲱϣⲉⲛ ⲙ̀ⲡⲟⲩⲫⲱϣⲉⲛ ϧⲉⲛ ϯⲥⲕⲩⲛⲏ ⲛ̀ⲧⲉ ϯⲙⲉⲧⲙⲉⲑⲣⲉ ⲙ̀ⲡⲉⲙ̀ⲑⲟ ⲛ̀ⲁⲁⲣⲱⲛ ⲛⲉ ⲙ̀ⲡⲉⲙ̀ⲑⲟ ⲛ̀ⲛⲉϥϣⲏⲣⲓ ⲕⲁⲧⲁ ⲫⲣⲏϯ ⲉⲧⲁ ⲡϭ̅ⲥ̅ ϩⲟⲛϩⲉⲛ ⲉ̀ⲧⲟⲧϥ ⲙ̀ⲙⲱⲩ̀ⲥⲏⲥ ⲉⲑⲃⲉ ⲛⲓⲗⲉⲩⲓⲧⲏⲥ ⲁⲩⲓⲣⲓ ⲙ̀ⲡⲁⲓⲣⲏϯ		And afterwards the Levites went in to minister in their service in the tabernacle of witness before Aaron, and before his sons; as the Lord appointed Moses concerning the Levites, so they did to them.	καὶ µετὰ ταῦτα εἰσῆλθον οἱ Λευῖται λειτουργεῖν τὴν λειτουργίαν αὐτῶν ἐν τῇ σκηνῇ τοῦ µαρτυρίου ἔναντι Ααρων καὶ ἔναντι τῶν υἱῶν αὐτοῦ· καθὼς συνέταξεν κύριος τῷ Μωυσῇ περὶ τῶν Λευιτῶν, οὕτως ἐποίησαν αὐτοῖς.						
Numbers	8	08	23	OT	1. OT	Pentateuch	1. Pentateuch	01. Pentateuch	04. Numbers	ⲟⲩⲟϩ ⲁ ⲡϭ̅ⲥ̅ ⲥⲁϫⲓ ⲛⲉⲙ ⲙⲱⲩ̀ⲥⲏⲥ ⲉϥϫⲱ ⲙ̀ⲙⲟⲥ		And the Lord spoke to Moses, saying,	Καὶ ἐλάλησεν κύριος πρὸς Μωυσῆν λέγων						
Numbers	8	08	24	OT	1. OT	Pentateuch	1. Pentateuch	01. Pentateuch	04. Numbers	ϫⲉ ⲫⲁⲓ ⲫⲁ ⲛⲓⲗⲉⲩⲓⲧⲏⲥ ⲡⲉ ⲓⲥϫⲉⲛ ⲕ̅ ⲛ̀ⲣⲟⲙⲡⲓ ⲛⲉⲙ ⲥⲁⲡϣⲱⲓ ⲉⲩⲉ̀ⲓ̀ ⲉ̀ϧⲟⲩⲛ ⲉ̀ⲡⲓⲫⲱϣⲉⲛ ϧⲉⲛ ϯⲥⲕⲩⲛⲏ ⲛ̀ⲧⲉ ϯⲙⲉⲧⲙⲉⲑⲣⲉ		This is the ordinance for the Levites; From five and twenty years old and upward, they shall go in to minister in the tabernacle of witness.	Τοῦτό ἐστιν τὸ περὶ τῶν Λευιτῶν· ἀπὸ πεντεκαιεικοσαετοῦς καὶ ἐπάνω εἰσελεύσονται ἐνεργεῖν ἐν τῇ σκηνῇ τοῦ µαρτυρίου·						
Numbers	8	08	25	OT	1. OT	Pentateuch	1. Pentateuch	01. Pentateuch	04. Numbers	ⲟⲩⲟϩ ⲓⲥϫⲉⲛ ⲛ̅ ⲛ̀ⲣⲟⲙⲡⲓ ⲉⲩⲉ̀ϩⲉⲛⲟⲩ ⲉ̀ⲃⲟⲗ ϧⲉⲛ ⲡⲓⲫⲱϣⲉⲛ ⲟⲩⲟϩ ⲛ̀ⲛⲟⲩⲉⲣϩⲱⲃ ϫⲉ		And from fifty years old the Levites shall cease from the ministry, and shall not work any longer.	καὶ ἀπὸ πεντηκονταετοῦς ἀποστήσεται ἀπὸ τῆς λειτουργίας καὶ οὐκ ἐργᾶται ἔτι,						
Numbers	8	08	26	OT	1. OT	Pentateuch	1. Pentateuch	01. Pentateuch	04. Numbers	ⲟⲩⲟϩ ⲉⲣⲉ ⲡⲉϥⲥⲟⲛ ⲫⲱϣⲉⲛ ϧⲉⲛ ϯⲥⲕⲩⲛⲏ ⲛ̀ⲧⲉ ϯⲙⲉⲧⲙⲉⲑⲣⲉ ⲉ̀ⲁⲣⲉϩ ⲉ̀ⲛⲓⲟⲩⲉⲣϣⲓ ϩⲱⲃ ⲇⲉ ⲛ̀ⲛⲉϥⲉⲣϩⲱⲃ ⲙ̀ⲡⲁⲓⲣⲏϯ ⲉⲕⲉ̀ⲓⲣⲓ ⲛ̀ⲛⲓⲗⲉⲩⲓⲧⲏⲥ ϧⲉⲛ ⲛⲟⲩⲟⲩⲉⲣϣⲓ		And his brother shall serve in the tabernacle of witness to keep charges, but he shall not do works: so shalt thou do to the Levites in their charges.	καὶ λειτουργήσει ὁ ἀδελφὸς αὐτοῦ ἐν τῇ σκηνῇ τοῦ µαρτυρίου φυλάσσειν φυλακάς, ἔργα δὲ οὐκ ἐργᾶται. οὕτως ποιήσεις τοῖς Λευίταις ἐν ταῖς φυλακαῖς αὐτῶν.						
Numbers	9	09	1	OT	1. OT	Pentateuch	1. Pentateuch	01. Pentateuch	04. Numbers	ⲟⲩⲟϩ ⲁ ⲡϭ̅ⲥ̅ ⲥⲁϫⲓ ⲛⲉⲙ ⲙⲱⲩ̀ⲥⲏⲥ ϩⲓ ⲡⲧⲱⲟⲩ ⲛ̀ⲥⲓⲛⲁ ⲛ̀ϩⲣⲏⲓ ϧⲉⲛ ⲑⲙⲁϩ ⲣⲟⲙⲡⲓ ⲥⲛⲟⲩϯ ⲉⲧⲁⲩⲓ̀ ⲉ̀ⲃⲟⲗ ϧⲉⲛ ⲡⲕⲁϩⲓ ⲛ̀ⲭⲏⲙⲓ ϧⲉⲛ ⲡⲓⲁⲃⲟⲧ ⲛ̀ϩⲟⲩⲓⲧ ⲉϥϫⲱ ⲙ̀ⲙⲟⲥ		And the Lord spoke to Moses in the wilderness of Sina in the second year after they had gone forth from the land of Egypt, in the first month, saying,	Καὶ ἐλάλησεν κύριος πρὸς Μωυσῆν ἐν τῇ ἐρήµῳ Σινα ἐν τῷ ἔτει τῷ δευτέρῳ ἐξελθόντων αὐτῶν ἐκ γῆς Αἰγύπτου ἐν τῷ µηνὶ τῷ πρώτῳ λέγων						
Numbers	9	09	2	OT	1. OT	Pentateuch	1. Pentateuch	01. Pentateuch	04. Numbers	ϫⲉ ⲙⲁⲣⲟⲩⲓⲣⲓ ⲛ̀ϫⲉ ⲛⲉⲛϣⲏⲣⲓ ⲙ̀ⲡⲓⲥ̅ⲗ̅ ⲙ̀ⲡⲓⲡⲁⲥⲭⲁ ⲛ̀ϩⲣⲏⲓ ϧⲉⲛ ⲡⲉϥⲥⲏⲟⲩ		Speak, and let the children of Israel keep the passover in its season.	Εἰπὸν καὶ ποιείτωσαν οἱ υἱοὶ Ισραηλ τὸ πασχα καθ’ ὥραν αὐτοῦ·						
Numbers	9	09	3	OT	1. OT	Pentateuch	1. Pentateuch	01. Pentateuch	04. Numbers	ⲛⲥⲟⲩⲓ̅ⲇ̅ ⲙ̀ⲡⲓⲁⲃⲟⲧ ⲛ̀ϩⲟⲩⲓⲧ ⲙ̀ⲫⲛⲁⲩ ⲛ̀ϩⲁⲛⲁⲣⲟⲩϩⲓ ⲉⲕⲉ̀ⲁⲓϥ ⲕⲁⲧⲁ ⲡⲉϥⲥⲏⲟⲩ ⲕⲁⲧⲁ ⲡⲉϥⲛⲟⲙⲟⲥ ⲛⲉⲙ ⲕⲁⲧⲁ ⲡⲉϥϩⲁⲡ ⲉⲕⲉ̀ⲁⲓϥ		On the fourteenth day of the first month at even, thou shalt keep it in its season; thou shalt keep it according to its law, and according to its ordinance.	τῇ τεσσαρεσκαιδεκάτῃ ἡµέρᾳ τοῦ µηνὸς τοῦ πρώτου πρὸς ἑσπέραν ποιήσεις αὐτὸ κατὰ καιρούς· κατὰ τὸν νόµον αὐτοῦ καὶ κατὰ τὴν σύγκρισιν αὐτοῦ ποιήσεις αὐτό.						
Numbers	9	09	4	OT	1. OT	Pentateuch	1. Pentateuch	01. Pentateuch	04. Numbers	ⲟⲩⲟϩ ⲁϥⲥⲁϫⲓ ⲛ̀ϫⲉ ⲙⲱⲩ̀ⲥⲏⲥ ⲛⲉⲙ ⲛⲉⲛϣⲏⲣⲓ ⲙ̀ⲡⲓⲥ̅ⲗ̅ ⲉ̀ⲓⲣⲓ ⲙ̀ⲡⲓⲡⲁⲥⲭⲁ		And Moses ordered the children of Israel to sacrifice the passover,	καὶ ἐλάλησεν Μωυσῆς τοῖς υἱοῖς Ισραηλ ποιῆσαι τὸ πασχα.						
Numbers	9	09	5	OT	1. OT	Pentateuch	1. Pentateuch	01. Pentateuch	04. Numbers	ⲉ̀ⲉⲣϩⲏⲧⲥ ⲛ̀ⲥⲟⲩⲓ̅ⲇ̅ ⲙ̀ⲡⲓⲁⲃⲟⲧ ⲛ̀ϩⲟⲩⲓⲧ ⲛ̀ϩⲣⲏⲓ ϩⲓ ⲡⲧⲱⲟⲩ ⲛ̀ⲥⲓⲛⲁ ⲕⲁⲧⲁ ⲫⲣⲏϯ ⲉⲧⲁ ⲡϭ̅ⲥ̅ ϩⲟⲛϩⲉⲛ ⲉ̀ⲧⲟⲧϥ ⲙ̀ⲙⲱⲩ̀ⲥⲏⲥ ⲁⲩⲓⲣⲓ ⲙ̀ⲡⲁⲓⲣⲏϯ ⲛ̀ϫⲉ ⲛⲉⲛϣⲏⲣⲓ ⲙ̀ⲡⲓⲥ̅ⲗ̅		on the fourteenth day of the first month in the wilderness of Sina, as the Lord appointed Moses, so the children of Israel did.	ἐναρχοµένου τῇ τεσσαρεσκαιδεκάτῃ ἡµέρᾳ τοῦ µηνὸς ἐν τῇ ἐρήµῳ τοῦ Σινα, καθὰ συνέταξεν κύριος τῷ Μωυσῇ, οὕτως ἐποίησαν οἱ υἱοὶ Ισραηλ.						
