book	chapter	chapter-zfilled	verse	testament	testament-indexed	section	section-indexed	section-indexed-no-testament	book-indexed	Bohairic	Sahidic	English	Greek	Fayyumic	Akhmimic	OldBohairic	Mesokemic	DialectP	Lycopolitan
Numbers	11	11	15	OT	1. OT	Pentateuch	1. Pentateuch	01. Pentateuch	04. Numbers	ⲓⲥϫⲉ ⲕⲛⲁⲓⲣⲓ ⲛⲏⲓ ⲙ̀ⲡⲁⲓⲣⲏϯ ⲓⲥ ϧⲟⲑⲃⲉⲧ ϧⲉⲛ ⲟⲩⲙⲟⲩ ⲓⲥϫⲉ ⲁⲓϫⲓⲙⲓ ⲛ̀ⲟⲩϩⲙⲟⲧ ⲙ̀ⲡⲉⲕⲙ̀ⲑⲟ ϩⲓⲛⲁ ⲛ̀ⲧⲁϣⲧⲉⲙⲛⲁⲩ ⲉ̀ⲡⲧϩⲉⲙⲕⲟ ⲙⲡⲁⲓⲗⲁⲟⲥ		And if thou doest thus to me, slay me utterly, if I have found favour with thee, that I may not see my affliction.	εἰ δὲ οὕτως σὺ ποιεῖς µοι, ἀπόκτεινόν µε ἀναιρέσει, εἰ εὕρηκα ἔλεος παρὰ σοί, ἵνα µὴ ἴδω µου τὴν κάκωσιν. —						
Numbers	11	11	16	OT	1. OT	Pentateuch	1. Pentateuch	01. Pentateuch	04. Numbers	ⲟⲩⲟϩ ⲡⲉϫⲉ ⲡϭ̅ⲥ̅ ⲙ̀ⲙⲱⲩ̀ⲥⲏⲥ ϫⲉ ⲑⲱⲟⲩϯ ⲛⲏⲓ ⲛ̀ⲟ̅ ⲛ̀ⲣⲱⲙⲓ ⲉ̀ⲃⲟⲗ ϧⲉⲛ ⲛⲉⲛϧⲉⲗⲗⲟⲓ ⲙ̀ⲡⲓⲥ̅ⲗ̅ ⲛⲏ ⲛ̀ⲑⲟⲕ ⲉⲧⲉⲕⲥⲱⲟⲩⲛ ⲙ̀ⲙⲱⲟⲩ ϫⲉ ϩⲁⲛⲡⲣⲉⲥⲃⲩⲧⲉⲣⲟⲥ ⲛ̀ⲧⲉ ⲡⲁⲓⲗⲁⲟⲥ ⲛⲉ ⲛⲉⲙ ⲛⲟⲩⲥⲁϧ ⲟⲩⲟϩ ⲉⲕⲉ̀ⲉⲛⲟⲩ ⲉ̀ϯⲥⲕⲩⲛⲏ ⲛ̀ⲧⲉ ϯⲙⲉⲧⲙⲉⲑⲣⲉ ⲟⲩⲟϩ ⲉⲩⲉ̀ⲟϩⲓ ⲉ̀ⲣⲁⲧⲟⲩ ⲙ̀ⲙⲁⲩ ⲛⲉⲙⲁⲕ		And the Lord said to Moses, Gather me seventy men from the elders of Israel, whom thou thyself knowest that they are the elders of the people, and their scribes; and thou shalt bring them to the tabernacle of witness, and they shall stand there with thee.	καὶ εἶπεν κύριος πρὸς Μωυσῆν Συνάγαγέ µοι ἑβδοµήκοντα ἄνδρας ἀπὸ τῶν πρεσβυτέρων Ισραηλ, οὓς αὐτὸς σὺ οἶδας ὅτι οὗτοί εἰσιν πρεσβύτεροι τοῦ λαοῦ καὶ γραµµατεῖς αὐτῶν, καὶ ἄξεις αὐτοὺς πρὸς τὴν σκηνὴν τοῦ µαρτυρίου, καὶ στήσονται ἐκεῖ µετὰ σοῦ.						
Numbers	11	11	17	OT	1. OT	Pentateuch	1. Pentateuch	01. Pentateuch	04. Numbers	ⲟⲩⲟϩ ⲉⲓⲉ̀ⲓ̀ ⲉ̀ⲡⲉⲥⲏⲧ ⲛ̀ⲧⲁⲥⲁϫⲓ ⲛⲉⲙⲁⲕ ⲙ̀ⲙⲁⲩ ⲟⲩⲟϩ ⲉⲓⲉ̀ⲱⲗⲓ ⲉ̀ⲃⲟⲗ ϧⲉⲛ ⲡⲓⲡⲛ̅ⲁ̅ ⲉⲧⲭⲏ ϩⲓϫⲱⲕ ⲟⲩⲟϩ ⲉⲓⲉ̀ⲭⲱ ϩⲓϫⲱⲟⲩ ⲟⲩⲟϩ ⲉⲩⲉ̀ϥⲁⲓ ⲛⲉⲙⲁⲕ ⲙ̀ⲡⲉⲛⲟⲩⲟⲓ ⲙ̀ⲡⲁⲓⲗⲁⲟⲥ ⲟⲩⲟϩ ⲛ̀ⲛⲉⲕⲟⲗⲟⲩ ⲙ̀ⲙⲁⲩⲁⲧⲕ		And I will go down, and speak there with thee; and I will take of the spirit that is upon thee, and will put it upon them; and they shall bear together with thee the burden of the people, and thou shalt not bear them alone.	καὶ καταβήσοµαι καὶ λαλήσω ἐκεῖ µετὰ σοῦ καὶ ἀφελῶ ἀπὸ τοῦ πνεύµατος τοῦ ἐπὶ σοὶ καὶ ἐπιθήσω ἐπ’ αὐτούς, καὶ συναντιλήµψονται µετὰ σοῦ τὴν ὁρµὴν τοῦ λαοῦ, καὶ οὐκ οἴσεις αὐτοὺς σὺ µόνος.						
Numbers	11	11	18	OT	1. OT	Pentateuch	1. Pentateuch	01. Pentateuch	04. Numbers	ⲟⲩⲟϩ ⲉⲕⲉ̀ϫⲟⲥ ⲙ̀ⲡⲁⲓⲗⲁⲟⲥ ϫⲉ ⲙⲁⲧⲟⲩⲃⲉ ⲑⲏⲛⲟⲩ ⲛ̀ⲣⲁⲥϯ ⲟⲩⲟϩ ⲉⲣⲉⲧⲉⲛⲉ̀ⲟⲩⲉⲙ ⲁϥ ϫⲉ ⲁⲣⲉⲧⲉⲛⲣⲓⲙⲓ ⲙ̀ⲡⲉⲙ̀ⲑⲟ ⲙ̀ⲡϭ̅ⲥ̅ ⲉⲣⲉⲧⲉⲛϫⲱ ⲙ̀ⲙⲟⲥ ϫⲉ ⲛⲓⲙ ⲉⲑⲛⲁϯ ⲁϥ ⲛⲁⲛ ⲉ̀ⲟⲩⲱⲙ ⲟⲩⲟϩ ϫⲉ ⲛⲁⲛⲉⲥ ⲛⲁⲛ ⲉ̀ⲁⲛϣⲱⲡⲓ ϧⲉⲛ ⲭⲏⲙⲓ ⲡⲉ ⲟⲩⲟϩ ⲉⲣⲉ ⲡϭ̅ⲥ̅ ϯ ⲁϥ ⲛⲱⲧⲉⲛ ⲉ̀ⲟⲩⲱⲙ ⲟⲩⲟϩ ⲉⲣⲉⲧⲉⲛⲉ̀ⲟⲩⲉⲙ ⲁϥ		And to the people thou shalt say, Purify yourselves for the morrow, and ye shall eat flesh; for ye wept before the Lord, saying, Who shall give us flesh to eat? for it was well with us in Egypt: and the Lord shall allow you to eat flesh, and ye shall eat flesh.	καὶ τῷ λαῷ ἐρεῖς Ἁγνίσασθε εἰς αὔριον, καὶ φάγεσθε κρέα, ὅτι ἐκλαύσατε ἔναντι κυρίου λέγοντες Τίς ἡµᾶς ψωµιεῖ κρέα; ὅτι καλὸν ἡµῖν ἐστιν ἐν Αἰγύπτῳ. καὶ δώσει κύριος ὑµῖν κρέα φαγεῖν, καὶ φάγεσθε κρέα.						
Numbers	11	11	19	OT	1. OT	Pentateuch	1. Pentateuch	01. Pentateuch	04. Numbers	ⲛ̀ⲟⲩⲉϩⲟⲟⲩ ⲁⲛ ⲡⲉ ⲉⲣⲉⲧⲉⲛⲛⲁⲟⲩⲱⲙ ⲛ̀ϧⲏⲧϥ ⲟⲩⲇⲉ ⲃ̅ ⲁⲛ ⲛⲉ ⲟⲩⲇⲉ ⲉ̅ ⲛ̀ⲉϩⲟⲟⲩ ⲁⲛ ⲛⲉ ⲟⲩⲇⲉ ⲓ̅ ⲁⲛ ⲛⲉ ⲟⲩⲇⲉ ⲕ̅		Ye shall not eat one day, nor two, nor five days, nor ten days, nor twenty days;	οὐχ ἡµέραν µίαν φάγεσθε οὐδὲ δύο οὐδὲ πέντε ἡµέρας οὐδὲ δέκα ἡµέρας οὐδὲ εἴκοσι ἡµέρας·						
Numbers	11	11	20	OT	1. OT	Pentateuch	1. Pentateuch	01. Pentateuch	04. Numbers	ϣⲁ ⲟⲩⲁⲃⲟⲧ ⲛ̀ⲉϩⲟⲟⲩ ⲉⲣⲉⲧⲉⲛⲉ̀ⲟⲩⲉⲙ ⲁϥ ϣⲁⲧⲉϥⲓ ⲉ̀ⲃⲟⲗ ϧⲉⲛ ⲛⲉⲧⲉⲛϣⲁⲓ ⲟⲩⲟϩ ⲉϥⲉ̀ϣⲱⲡⲓ ⲛⲱⲧⲉⲛ ⲉ̀ⲭⲟⲗⲉⲣⲁ ϫⲉ ⲁⲣⲉⲧⲉⲛⲉⲣⲁⲧⲥⲱⲧⲉⲙ ⲛ̀ⲥⲁ ⲡϭ̅ⲥ̅ ⲫⲏ ⲉⲧϧⲉⲛ ⲑⲏⲛⲟⲩ ⲟⲩⲟϩ ⲁⲣⲉⲧⲉⲛⲣⲓⲙⲓ ⲙ̀ⲡⲉϥⲙ̀ⲑⲟ ⲉⲣⲉⲧⲉⲛϫⲱ ⲙ̀ⲙⲟⲥ ϫⲉ ⲉⲣⲟⲩ ⲛⲁⲛ ⲉⲓ ⲉ̀ⲃⲟⲗ ϧⲉⲛ ⲭⲏⲙⲓ		ye shall eat for a full month, until the flesh come out at your nostrils; and it shall be nausea to you, because ye disobeyed the Lord, who is among you, and wept before him, saying, What had we to do to come out of Egypt?	ἕως µηνὸς ἡµερῶν φάγεσθε, ἕως ἂν ἐξέλθῃ ἐκ τῶν µυκτήρων ὑµῶν, καὶ ἔσται ὑµῖν εἰς χολέραν, ὅτι ἠπειθήσατε κυρίῳ, ὅς ἐστιν ἐν ὑµῖν, καὶ ἐκλαύσατε ἐναντίον αὐτοῦ λέγοντες Ἵνα τί ἡµῖν ἐξελθεῖν ἐξ Αἰγύπτου;						
Numbers	11	11	21	OT	1. OT	Pentateuch	1. Pentateuch	01. Pentateuch	04. Numbers	ⲟⲩⲟϩ ⲡⲉϫⲉ ⲙⲱⲩ̀ⲥⲏⲥ ϫⲉ ⲡⲁⲓⲗⲁⲟⲥ ⲉ̀ϯ ⲛ̀ϧⲏⲧϥ ⲥⲉⲉⲣ ⲭ̅ ⲛ̀ϣⲟ ⲛ̀ⲣⲉⲙⲛⲣⲁⲧⲟⲩ ⲟⲩⲟϩ ⲛ̀ⲑⲟⲕ ⲕϫⲱ ⲙ̀ⲙⲟⲥ ϫⲉ ϯⲛⲁϯ ⲁϥ ⲛⲱⲟⲩ ⲛ̀ⲟⲩⲁⲃⲟⲧ ⲛ̀ⲉϩⲟⲟⲩ		And Moses said, The people among whom I am are six hundred thousand footmen; and thou saidst, I will give them flesh to eat, and they shall eat a whole month.	καὶ εἶπεν Μωυσῆς Ἑξακόσιαι χιλιάδες πεζῶν ὁ λαός, ἐν οἷς εἰµι ἐν αὐτοῖς, καὶ σὺ εἶπας Κρέα δώσω αὐτοῖς φαγεῖν, καὶ φάγονται µῆνα ἡµερῶν;						
Numbers	11	11	22	OT	1. OT	Pentateuch	1. Pentateuch	01. Pentateuch	04. Numbers	ⲙⲏ ⲛⲓⲉⲥⲱⲟⲩ ⲛⲉⲙ ⲛⲓⲉϩⲱⲟⲩ ⲁⲩϣⲁⲛϧⲉⲗϧⲱⲗⲟⲩ ⲙⲏ ⲥⲉⲛⲁⲣⲁϣⲟⲩ ⲓⲉ ⲡⲓⲧⲉⲃⲧ ⲧⲏⲣϥ ⲛ̀ⲧⲉ ⲫⲓⲟⲙ ⲁϥϣⲁⲛ̀ⲑⲱⲟⲩϯ ⲙⲏ ϥⲛⲁⲣⲁϣⲟⲩ		Shall sheep and oxen be slain for them, and shall it suffice them? or shall all the fish of the sea be gathered together for them, and shall it suffice them?	µὴ πρόβατα καὶ βόες σφαγήσονται αὐτοῖς, καὶ ἀρκέσει αὐτοῖς; ἢ πᾶν τὸ ὄψος τῆς θαλάσσης συναχθήσεται αὐτοῖς, καὶ ἀρκέσει αὐτοῖς;						
Numbers	11	11	23	OT	1. OT	Pentateuch	1. Pentateuch	01. Pentateuch	04. Numbers	ⲟⲩⲟϩ ⲡⲉϫⲉ ⲡϭ̅ⲥ̅ ⲙ̀ⲙⲱⲩ̀ⲥⲏⲥ ϫⲉ ⲙⲏ ⲧϫⲓϫ ⲙ̀ⲡϭ̅ⲥ̅ ⲛⲁⲣⲁϣⲟⲩ ⲁⲛ ϩⲏⲇⲏ ⲕⲛⲁⲉⲙⲓ ϫⲉ ⲁⲛ ⲡⲁⲥⲁϫⲓ ⲛⲁⲧⲁϩⲟⲕ ϣⲁⲛ ⲙ̀ⲙⲟⲛ		And the Lord said to Moses, Shall not the hand of the Lord be fully sufficient? now shalt thou know whether my word shall come to pass to thee or not.	καὶ εἶπεν κύριος πρὸς Μωυσῆν Μὴ χεὶρ κυρίου οὐκ ἐξαρκέσει; ἤδη γνώσει εἰ ἐπικαταλήµψεταί σε ὁ λόγος µου ἢ οὔ.						
Numbers	11	11	24	OT	1. OT	Pentateuch	1. Pentateuch	01. Pentateuch	04. Numbers	ⲟⲩⲟϩ ⲁϥⲓ̀ ⲉ̀ⲃⲟⲗ ⲛ̀ϫⲉ ⲙⲱⲩ̀ⲥⲏⲥ ⲁϥⲥⲁϫⲓ ⲛⲉⲙ ⲡⲓⲗⲁⲟⲥ ⲧⲏⲣϥ ⲛ̀ⲛⲓⲥⲁϫⲓ ⲛ̀ⲧⲉ ⲡϭ̅ⲥ̅ ⲟⲩⲟϩ ⲁϥⲑⲱⲟⲩϯ ⲛ̀ⲟ̅ ⲛ̀ⲣⲱⲙⲓ ⲉ̀ⲃⲟⲗ ϧⲉⲛ ⲛⲓⲡⲣⲉⲥⲃⲩⲧⲉⲣⲟⲥ ⲛ̀ⲧⲉ ⲡⲓⲗⲁⲟⲥ ⲟⲩⲟϩ ⲁϥⲧⲁϩⲱⲟⲩ ⲉ̀ⲣⲁⲧⲟⲩ ⲙ̀ⲡⲕⲱϯ ⲉ̀ϯⲥⲕⲩⲛⲏ		And Moses went out, and spoke the words of the Lord to the people; and he gathered seventy men of the elders of the people, and he set them round about the tabernacle.	καὶ ἐξῆλθεν Μωυσῆς καὶ ἐλάλησεν πρὸς τὸν λαὸν τὰ ῥήµατα κυρίου καὶ συνήγαγεν ἑβδοµήκοντα ἄνδρας ἀπὸ τῶν πρεσβυτέρων τοῦ λαοῦ καὶ ἔστησεν αὐτοὺς κύκλῳ τῆς σκηνῆς.						
Numbers	11	11	25	OT	1. OT	Pentateuch	1. Pentateuch	01. Pentateuch	04. Numbers	ⲟⲩⲟϩ ⲁϥⲓ̀ ⲉ̀ⲡⲉⲥⲏⲧ ⲛ̀ϫⲉ ⲡϭ̅ⲥ̅ ϧⲉⲛ ⲟⲩϭⲏⲡⲓ ⲟⲩⲟϩ ⲁϥⲥⲁϫⲓ ⲛⲉⲙⲁϥ ⲟⲩⲟϩ ⲁϥⲱⲗⲓ ⲉ̀ⲃⲟⲗ ϧⲉⲛ ⲡⲓⲡⲛ̅ⲁ̅ ⲉⲧⲭⲏ ϩⲓϫⲱϥ ⲟⲩⲟϩ ⲁϥⲭⲱ ϩⲓϫⲉⲛ ⲡⲓⲟ̅ ⲛ̀ⲣⲱⲙⲓ ⲙ̀ⲡⲣⲉⲥⲃⲩⲧⲉⲣⲟⲥ ϩⲱⲥ ⲇⲉ ⲉⲧⲁϥⲉⲙⲧⲟⲛ ⲙ̀ⲙⲟϥ ⲉ̀ϫⲱⲟⲩ ⲛ̀ϫⲉ ⲡⲓⲡⲛ̅ⲁ̅ ⲁⲩⲉⲣⲡⲣⲟⲫⲏⲧⲉⲩⲓⲛ ϧⲉⲛ ϯⲡⲁⲣⲉⲙⲃⲟⲗⲏ ⲟⲩⲟϩ ⲙ̀ⲡⲟⲩⲟⲩⲁϩⲧⲟⲧⲟⲩ ϫⲉ		And the Lord came down in a cloud, and spoke to him, and took of the spirit that was upon him, and put it upon the seventy men that were elders; and when the spirit rested upon them, they prophesied and ceased.	καὶ κατέβη κύριος ἐν νεφέλῃ καὶ ἐλάλησεν πρὸς αὐτόν· καὶ παρείλατο ἀπὸ τοῦ πνεύµατος τοῦ ἐπ’ αὐτῷ καὶ ἐπέθηκεν ἐπὶ τοὺς ἑβδοµήκοντα ἄνδρας τοὺς πρεσβυτέρους· ὡς δὲ ἐπανεπαύσατο τὸ πνεῦµα ἐπ’ αὐτούς, καὶ ἐπροφήτευσαν καὶ οὐκέτι προσέθεντο.						
Numbers	11	11	26	OT	1. OT	Pentateuch	1. Pentateuch	01. Pentateuch	04. Numbers	ⲟⲩⲟϩ ⲁⲩⲥⲱϫⲡ ⲛ̀ϫⲉ ⲣⲱⲙⲓ ⲃ̅ ϧⲉⲛ ϯⲡⲁⲣⲉⲙⲃⲟⲗⲏ ⲫⲣⲁⲛ ⲛ̀ⲟⲩⲁⲓ ⲙ̀ⲙⲱⲟⲩ ⲡⲉ ⲉⲗⲇⲁⲇ ⲫⲣⲁⲛ ⲙ̀ⲡⲓⲙⲁϩⲃ̅ ⲡⲉ ⲙⲱⲇⲁⲇ ⲟⲩⲟϩ ⲁϥⲉⲙⲧⲟⲛ ⲙ̀ⲙⲟϥ ⲛ̀ϫⲉ ⲟⲩⲡⲛ̅ⲁ̅ ⲉ̀ϩⲣⲏⲓ ⲉ̀ϫⲱⲟⲩ ⲟⲩⲟϩ ϩⲁⲛⲉ̀ⲃⲟⲗ ⲛⲉ ϧⲉⲛ ⲛⲏ ⲉⲧⲁⲩⲥⲁϧⲟⲩ ⲉ̀ϧⲟⲩⲛ ⲟⲩⲟϩ ⲙ̀ⲡⲟⲩⲓ̀ ϩⲁ ϯⲥⲕⲩⲛⲏ ⲟⲩⲟϩ ⲁⲩⲉⲣⲡⲣⲟⲫⲏⲧⲉⲩⲓⲛ ϧⲉⲛ ϯⲡⲁⲣⲉⲙⲃⲟⲗⲏ		And there were two men left in the camp, the name of the one was Eldad, and the name of the other Modad; and the spirit rested upon them, and these were of the number of them that were enrolled, but they did not come to the tabernacle; and they prophesied in the camp.	καὶ κατελείφθησαν δύο ἄνδρες ἐν τῇ παρεµβολῇ, ὄνοµα τῷ ἑνὶ Ελδαδ καὶ ὄνοµα τῷ δευτέρῳ Μωδαδ, καὶ ἐπανεπαύσατο ἐπ’ αὐτοὺς τὸ πνεῦµα — καὶ οὗτοι ἦσαν τῶν καταγεγραµµένων καὶ οὐκ ἦλθον πρὸς τὴν σκηνήν — καὶ ἐπροφήτευσαν ἐν τῇ παρεµβολῇ.						
Numbers	11	11	27	OT	1. OT	Pentateuch	1. Pentateuch	01. Pentateuch	04. Numbers	ⲟⲩⲟϩ ⲁϥϭⲟϫⲓ ⲛ̀ϫⲉ ⲟⲩϧⲉⲗϣⲓⲣⲓ ⲁϥⲧⲁⲙⲉ ⲙⲱⲩ̀ⲥⲏⲥ ⲟⲩⲟϩ ⲡⲉϫⲁϥ ⲉϥϫⲱ ⲙ̀ⲙⲟⲥ ϫⲉ ⲉⲗⲇⲁⲇ ⲛⲉⲙ ⲙⲱⲇⲁⲇ ⲥⲉⲉⲣⲡⲣⲟⲫⲏⲧⲉⲩⲓⲛ ϧⲉⲛ ϯⲡⲁⲣⲉⲙⲃⲟⲗⲏ		And a young man ran and told Moses, and spoke, saying, Eldad and Modad prophesy in the camp.	Καὶ προσδραµὼν ὁ νεανίσκος ἀπήγγειλεν Μωυσῇ καὶ εἶπεν λέγων Ελδαδ καὶ Μωδαδ προφητεύουσιν ἐν τῇ παρεµβολῇ.						
Numbers	11	11	28	OT	1. OT	Pentateuch	1. Pentateuch	01. Pentateuch	04. Numbers	ⲟⲩⲟϩ ⲁϥⲉⲣⲟⲩⲱ ⲛ̀ϫⲉ ⲓⲏⲥⲟⲩ ⲡϣⲏⲣⲓ ⲛ̀ⲛⲁⲩⲏ ⲡⲓⲥⲱⲧⲡ ⲫⲏ ⲉⲧⲟϩⲓ ⲉ̀ⲣⲁⲧϥ ⲙ̀ⲡⲉⲙ̀ⲑⲟ ⲙ̀ⲙⲱⲩ̀ⲥⲏⲥ ⲡⲉϫⲁϥ ϫⲉ ⲡⲁϭ̅ⲥ̅ ⲙⲱⲩ̀ⲥⲏⲥ ⲙⲁⲧⲁϩⲛⲟ ⲙ̀ⲙⲱⲟⲩ		And Joshua the son of Naue, who attended on Moses, the chosen one, said, My lord Moses, forbid them.	καὶ ἀποκριθεὶς Ἰησοῦς ὁ τοῦ Ναυη ὁ παρεστηκὼς Μωυσῇ ὁ ἐκλεκτὸς εἶπεν Κύριε Μωυσῆ, κώλυσον αὐτούς.						
Numbers	11	11	29	OT	1. OT	Pentateuch	1. Pentateuch	01. Pentateuch	04. Numbers	ⲟⲩⲟϩ ⲡⲉϫⲉ ⲙⲱⲩ̀ⲥⲏⲥ ⲛⲁϥ ϫⲉ ⲙⲏ ⲛ̀ⲑⲟⲕ ⲉⲧⲛⲁϯⲭⲟϩ ⲛⲏⲓ ⲟⲩⲟϩ ⲛⲓⲙ ⲉⲧⲛⲁⲧⲏⲓⲥ ⲛ̀ⲧⲉ ⲡⲁⲓⲗⲁⲟⲥ ⲧⲏⲣϥ ⲛ̀ⲧⲉ ⲡϭ̅ⲥ̅ ⲉⲣⲡⲣⲟⲫⲏⲧⲉⲩⲓⲛ ϩⲟⲧⲁⲛ ⲁⲣⲉϣⲁⲛ ⲡϭ̅ⲥ̅ ϯ ⲙ̀ⲡⲉϥⲡⲛ̅ⲁ̅ ⲉ̀ϩⲣⲏⲓ ⲉ̀ϫⲱⲟⲩ		And Moses said to him, Art thou jealous on my account? and would that all the Lord’s people were prophets; whenever the Lord shall put his spirit upon them.	καὶ εἶπεν αὐτῷ Μωυσῆς Μὴ ζηλοῖς σύ µοι; καὶ τίς δῴη πάντα τὸν λαὸν κυρίου προφήτας, ὅταν δῷ κύριος τὸ πνεῦµα αὐτοῦ ἐπ’ αὐτούς;						
Numbers	11	11	30	OT	1. OT	Pentateuch	1. Pentateuch	01. Pentateuch	04. Numbers	ⲟⲩⲟϩ ⲁϥϣⲉ ⲛⲁϥ ⲛ̀ϫⲉ ⲙⲱⲩ̀ⲥⲏⲥ ⲉ̀ϯⲡⲁⲣⲉⲙⲃⲟⲗⲏ ⲛ̀ⲑⲟϥ ⲛⲉⲙ ⲛⲓⲡⲣⲉⲥⲃⲩⲧⲉⲣⲟⲥ ⲛ̀ⲧⲉ ⲡⲓⲥ̅ⲗ̅		And Moses departed into the camp, himself and the elders of Israel.	καὶ ἀπῆλθεν Μωυσῆς εἰς τὴν παρεµβολήν, αὐτὸς καὶ οἱ πρεσβύτεροι Ισραηλ. —						
Numbers	11	11	31	OT	1. OT	Pentateuch	1. Pentateuch	01. Pentateuch	04. Numbers	ⲟⲩⲟϩ ⲁ ⲟⲩⲡⲛ̅ⲁ̅ ⲓ̀ ⲉ̀ⲃⲟⲗ ϩⲓⲧⲉⲛ ⲡϭ̅ⲥ̅ ⲟⲩⲟϩ ⲁϥⲉⲣϫⲓⲛⲓⲟⲣ ⲛ̀ⲟⲩⲙⲉⲥⲓⲱϯ ⲙ̀ⲡⲏⲣⲓ ⲉ̀ⲃⲟⲗ ϧⲉⲛ ⲫⲓⲟⲙ ⲟⲩⲟϩ ⲁϥⲉⲛⲥ ⲉ̀ϫⲉⲛ ϯⲡⲁⲣⲉⲙⲃⲟⲗⲏ ⲙ̀ⲫⲙⲱⲓⲧ ⲛ̀ⲟⲩⲉϩⲟⲟⲩ ⲙ̀ⲙⲟϣⲓ ⲥⲁⲙ̀ⲛⲁⲓ ⲛⲉⲙ ⲟⲩⲉϩⲟⲟⲩ ⲙ̀ⲙⲟϣⲓ ⲥⲁⲙ̀ⲛⲁⲓ ⲙ̀ⲡⲕⲱϯ ⲛ̀ϯⲡⲁⲣⲉⲙⲃⲟⲗⲏ ⲛⲁⲩ ⲙⲁϩⲓ ⲃ̅ ⲉ̀ⲃⲟⲗ ϩⲁ ⲡⲕⲁϩⲓ		And there went forth a wind from the Lord, and brought quails over from the sea; and it brought them down upon the camp a day’s journey on this side, and a day’s journey on that side, round about the camp, as it were two cubits from the earth.	καὶ πνεῦµα ἐξῆλθεν παρὰ κυρίου καὶ ἐξεπέρασεν ὀρτυγοµήτραν ἀπὸ τῆς θαλάσσης καὶ ἐπέβαλεν ἐπὶ τὴν παρεµβολὴν ὁδὸν ἡµέρας ἐντεῦθεν καὶ ὁδὸν ἡµέρας ἐντεῦθεν κύκλῳ τῆς παρεµβολῆς ὡσεὶ δίπηχυ ἀπὸ τῆς γῆς.						
Numbers	11	11	32	OT	1. OT	Pentateuch	1. Pentateuch	01. Pentateuch	04. Numbers	ⲟⲩⲟϩ ⲁϥⲧⲱⲛϥ ⲛ̀ϫⲉ ⲡⲓⲗⲁⲟⲥ ⲙ̀ⲡⲓⲉϩⲟⲟⲩ ⲧⲏⲣϥ ⲛⲉⲙ ⲡⲓⲉϫⲱⲣϩ ⲧⲏⲣϥ ⲛⲉⲙ ⲡⲓⲉϩⲟⲟⲩ ⲧⲏⲣϥ ⲙ̀ⲡⲉϥⲣⲁⲥϯ ⲟⲩⲟϩ ⲁⲩⲑⲱⲟⲩϯ ⲛ̀ϯⲙⲉⲥⲓⲱϯ ⲙ̀ⲡⲏⲣⲓ ⲟⲩⲟϩ ⲫⲏ ⲉⲧⲁϥⲑⲟⲩⲉⲧ ⲡⲓⲕⲟⲩϫⲓ ⲓ ⲛ̀ⲕⲟⲣⲟⲥ ⲟⲩⲟϩ ⲁⲩϫⲉⲗϫⲱⲗⲟⲩ ⲛⲱⲟⲩ ⲛ̀ϩⲁⲛ̀ϫⲉⲗϫⲱⲗ ⲙ̀ⲡⲕⲱϯ ⲛ̀ϯⲡⲁⲣⲉⲙⲃⲟⲗⲏ		And the people rose up all the day, and all the night, and all the next day, and gathered quails; he that gathered least, gathered ten measures; and they refreshed themselves round about the camp.	καὶ ἀναστὰς ὁ λαὸς ὅλην τὴν ἡµέραν καὶ ὅλην τὴν νύκτα καὶ ὅλην τὴν ἡµέραν τὴν ἐπαύριον καὶ συνήγαγον τὴν ὀρτυγοµήτραν, ὁ τὸ ὀλίγον συνήγαγεν δέκα κόρους, καὶ ἔψυξαν ἑαυτοῖς ψυγµοὺς κύκλῳ τῆς παρεµβολῆς.						
Numbers	11	11	33	OT	1. OT	Pentateuch	1. Pentateuch	01. Pentateuch	04. Numbers	ⲛⲓⲁϥ ⲉⲧⲓ ⲛⲁⲩⲭⲏ ϧⲉⲛ ⲛⲟⲩⲛⲁϫϩⲓ ⲙ̀ⲡⲁⲧⲟⲩⲙⲟⲩⲛⲕ ⲟⲩⲟϩ ⲁϥⲙⲃⲟⲛ ⲛ̀ϫⲉ ⲡϭ̅ⲥ̅ ⲉ̀ϫⲉⲛ ⲡⲓⲗⲁⲟⲥ ⲟⲩⲟϩ ⲁ ⲡϭ̅ⲥ̅ ϣⲁⲣⲓ ⲉⲡⲓⲗⲁⲟⲥ ϧⲉⲛ ⲟⲩⲛⲓϣϯ ⲛ̀ⲉⲣϧⲟⲧ ⲉ̀ⲙⲁϣⲱ		The flesh was yet between their teeth, before it failed, when the Lord was wroth with the people, and the Lord smote the people with a very great plague.	τὰ κρέα ἔτι ἦν ἐν τοῖς ὀδοῦσιν αὐτῶν πρὶν ἢ ἐκλείπειν, καὶ κύριος ἐθυµώθη εἰς τὸν λαόν, καὶ ἐπάταξεν κύριος τὸν λαὸν πληγὴν µεγάλην σφόδρα.						
Numbers	11	11	34	OT	1. OT	Pentateuch	1. Pentateuch	01. Pentateuch	04. Numbers	ⲟⲩⲟϩ ⲁⲩϯⲣⲉⲛ ⲫⲣⲁⲛ ⲛ̀ⲛⲓⲙⲁ ⲉⲧⲉⲙ̀ⲙⲁⲩ ϫⲉ ⲛⲓⲙ̀ϩⲁⲩ ⲛ̀ⲧⲉ ⲛⲓⲉⲡⲓⲑⲩⲙⲓⲁ ϫⲉ ⲁⲩⲑⲉⲙⲥ ⲡⲓⲗⲁⲟⲥ ⲙ̀ⲙⲁⲩ ⲛ̀ⲣⲉϥⲉⲣⲉⲡⲓⲑⲩⲙⲓⲛ		And the name of that place was called the Graves of Lust; for there they buried the people that lusted.	καὶ ἐκλήθη τὸ ὄνοµα τοῦ τόπου ἐκείνου Μνήµατα τῆς ἐπιθυµίας, ὅτι ἐκεῖ ἔθαψαν τὸν λαὸν τὸν ἐπιθυµητήν.						
Numbers	11	11	35	OT	1. OT	Pentateuch	1. Pentateuch	01. Pentateuch	04. Numbers	ⲟⲩⲟϩ ⲡⲓⲗⲁⲟⲥ ⲁϥⲟⲩⲱⲧⲉⲃ ⲉ̀ⲃⲟⲗ ϧⲉⲛ ⲛⲓⲙ̀ϩⲁⲩ ⲛ̀ⲧⲉ ϯⲉⲡⲓⲑⲩⲙⲓⲁ ⲉ̀ⲁⲥⲏⲣⲱⲑ ⲟⲩⲟϩ ⲁϥϣⲱⲡⲓ ⲛ̀ϫⲉ ⲡⲓⲗⲁⲟⲥ ϧⲉⲛ ⲁⲥⲏⲣⲱⲑ		The people departed from the Graves of Lust to Aseroth; and the people halted at Aseroth.	Ἀπὸ Μνηµάτων ἐπιθυµίας ἐξῆρεν ὁ λαὸς εἰς Ασηρωθ, καὶ ἐγένετο ὁ λαὸς ἐν Ασηρωθ.						
Numbers	12	12	1	OT	1. OT	Pentateuch	1. Pentateuch	01. Pentateuch	04. Numbers	ⲟⲩⲟϩ ⲁⲥⲥⲁϫⲓ ⲛ̀ϫⲉ ⲙⲁⲣⲓⲁⲙ ⲛⲉⲙ ⲁⲁⲣⲱⲛ ⲛ̀ⲥⲁ ⲙⲱⲩ̀ⲥⲏⲥ ⲉⲑⲃⲉ ϯⲥϩⲓⲙⲓ ⲛ̀ⲉⲑⲟϣⲓ ⲉⲧⲁϥϭⲓⲧⲥ ⲛ̀ϫⲉ ⲙⲱⲩ̀ⲥⲏⲥ ϫⲉ ⲟⲩⲥϩⲓⲙⲓ ⲛ̀ⲉⲑⲟϣⲓ ⲁϥϭⲓⲧⲥ		And Mariam and Aaron spoke against Moses, because of the Ethiopian woman whom Moses took; for he had taken an Ethiopian woman.	Καὶ ἐλάλησεν Μαριαµ καὶ Ααρων κατὰ Μωυσῆ ἕνεκεν τῆς γυναικὸς τῆς Αἰθιοπίσσης, ἣν ἔλαβεν Μωυσῆς, ὅτι γυναῖκα Αἰθιόπισσαν ἔλαβεν,						
Numbers	12	12	2	OT	1. OT	Pentateuch	1. Pentateuch	01. Pentateuch	04. Numbers	ⲟⲩⲟϩ ⲡⲉϫⲱⲟⲩ ϫⲉ ⲙⲏ ⲙⲱⲩ̀ⲥⲏⲥ ⲙ̀ⲙⲁⲩⲁⲧϥ ⲉⲧⲁ ⲡϭ̅ⲥ̅ ⲥⲁϫⲓ ⲛⲉⲙⲁϥ ⲙⲏ ⲙⲡⲉϥⲥⲁϫⲓ ⲛⲉⲙⲁⲛ ⲁ̀ⲛⲟⲛ ⲟⲩⲟϩ ⲁϥⲥⲱⲧⲉⲙ ⲛ̀ϫⲉ ⲡϭ̅ⲥ̅		And they said, Has the Lord spoken to Moses only? has he not also spoken to us? and the Lord heard it.	καὶ εἶπαν Μὴ Μωυσῇ µόνῳ λελάληκεν κύριος; οὐχὶ καὶ ἡµῖν ἐλάλησεν; καὶ ἤκουσεν κύριος.						
Numbers	12	12	3	OT	1. OT	Pentateuch	1. Pentateuch	01. Pentateuch	04. Numbers	ⲟⲩⲟϩ ⲡⲓⲣⲱⲙⲓ ⲙⲱⲩ̀ⲥⲏⲥ ⲛⲉ ⲟⲩⲣⲉⲙⲣⲁⲩϣ ⲡⲉ ⲉ̀ⲙⲁϣⲱ ⲉ̀ⲃⲟⲗ ⲟⲩⲧⲉ ⲣⲱⲙⲓ ⲛⲓⲃⲉⲛ ⲉⲧϣⲟⲡ ϩⲓϫⲉⲛ ⲡⲕⲁϩⲓ		And the man Moses was very meek beyond all the men that were upon the earth.	καὶ ὁ ἄνθρωπος Μωυσῆς πραῢς σφόδρα παρὰ πάντας τοὺς ἀνθρώπους τοὺς ὄντας ἐπὶ τῆς γῆς.						
Numbers	12	12	4	OT	1. OT	Pentateuch	1. Pentateuch	01. Pentateuch	04. Numbers	ⲟⲩⲟϩ ⲡⲉϫⲉ ⲡϭ̅ⲥ̅ ⲛ̀ϯⲟⲩⲛⲟⲩ ⲙ̀ⲙⲱⲩ̀ⲥⲏⲥ ⲛⲉⲙ ⲁⲁⲣⲱⲛ ⲛⲉⲙ ⲙⲁⲣⲓⲁⲙ ϫⲉ ⲁⲙⲱⲓⲛⲓ ⲉ̀ⲃⲟⲗ ⲙ̀ⲡⲅ̅ ⲉ̀ϯⲥⲕⲩⲛⲏ ⲛ̀ⲧⲉ ϯⲙⲉⲧⲙⲉⲑⲣⲉ ⲟⲩⲟϩ ⲁⲩⲓ̀ ⲉ̀ⲃⲟⲗ ⲛ̀ⲑⲱⲟⲩ ⲙ̀ⲡⲅ̅ ⲉ̀ϯⲥⲕⲩⲛⲏ ⲛ̀ⲧⲉ ϯⲙⲉⲧⲙⲉⲑⲣⲉ		And the Lord said immediately to Moses and Aaron and Mariam, Come forth all three of you to the tabernacle of witness.	καὶ εἶπεν κύριος παραχρῆµα πρὸς Μωυσῆν καὶ Μαριαµ καὶ Ααρων Ἐξέλθατε ὑµεῖς οἱ τρεῖς εἰς τὴν σκηνὴν τοῦ µαρτυρίου· καὶ ἐξῆλθον οἱ τρεῖς εἰς τὴν σκηνὴν τοῦ µαρτυρίου.						
Numbers	12	12	5	OT	1. OT	Pentateuch	1. Pentateuch	01. Pentateuch	04. Numbers	ⲟⲩⲟϩ ⲁϥⲓ̀ ⲉ̀ⲡⲉⲥⲏⲧ ⲛ̀ϫⲉ ⲡϭ̅ⲥ̅ ϧⲉⲛ ⲟⲩⲥⲧⲩⲗⲗⲟⲥ ⲛ̀ϭⲏⲡⲓ ⲟⲩⲟϩ ⲁϥⲟϩⲓ ⲉ̀ⲣⲁⲧϥ ϩⲓⲣⲉⲛ ⲛⲓⲣⲱⲟⲩ ⲛ̀ⲧⲉ ϯⲥⲕⲩⲛⲏ ⲛ̀ⲧⲉ ϯⲙⲉⲧⲙⲉⲑⲣⲉ ⲟⲩⲟϩ ⲁⲩⲙⲟⲩϯ ⲉ̀ⲁⲁⲣⲱⲛ ⲛⲉⲙ ⲙⲁⲣⲓⲁⲙ ⲟⲩⲟϩ ⲁⲩⲓ̀ ⲉ̀ⲃⲟⲗ ⲙ̀ⲡⲃ̅		And the three came forth to the tabernacle of witness; and the Lord descended in a pillar of a cloud, and stood at the door of the tabernacle of witness; and Aaron and Mariam were called; and both came forth.	καὶ κατέβη κύριος ἐν στύλῳ νεφέλης καὶ ἔστη ἐπὶ τῆς θύρας τῆς σκηνῆς τοῦ µαρτυρίου, καὶ ἐκλήθησαν Ααρων καὶ Μαριαµ καὶ ἐξήλθοσαν ἀµφότεροι.						
Numbers	12	12	6	OT	1. OT	Pentateuch	1. Pentateuch	01. Pentateuch	04. Numbers	ⲟⲩⲟϩ ⲡⲉϫⲁϥ ⲛⲱⲟⲩ ϫⲉ ⲥⲱⲧⲉⲙ ⲉ̀ⲛⲁⲥⲁϫⲓ ⲉ̀ϣⲱⲡ ⲁϥϣⲁⲛϣⲱⲡⲓ ⲙ̀ⲡϭ̅ⲥ̅ ⲛ̀ϫⲉ ⲟⲩⲡⲣⲟⲫⲏⲧⲏⲥ ⲛ̀ⲧⲱⲧⲉⲛ ϧⲉⲛ ⲟⲩϩⲟⲣⲟⲙⲁ ϣⲁⲓⲟⲩⲟⲛϩⲧ ⲉ̀ⲣⲟϥ ⲟⲩⲟϩ ϣⲁⲓⲥⲁϫⲓ ⲛⲉⲙⲁϥ ϧⲉⲛ ⲟⲩⲣⲁⲥⲟⲩⲓ		And he said to them, Hear my words: If there should be of you a prophet to the Lord, I will be made known to him in a vision, and in sleep will I speak to him.	καὶ εἶπεν πρὸς αὐτούς Ἀκούσατε τῶν λόγων µου· ἐὰν γένηται προφήτης ὑµῶν κυρίῳ, ἐν ὁράµατι αὐτῷ γνωσθήσοµαι καὶ ἐν ὕπνῳ λαλήσω αὐτῷ.						
Numbers	12	12	7	OT	1. OT	Pentateuch	1. Pentateuch	01. Pentateuch	04. Numbers	ⲙ̀ⲫⲣⲏϯ ⲁⲛ ⲙ̀ⲡⲁⲁⲗⲟⲩ ⲙⲱⲩ̀ⲥⲏⲥ ⲫⲏ ⲉⲧⲉⲛϩⲟⲧ ϧⲉⲛ ⲡⲁⲏⲓ ⲧⲏⲣϥ		My servant Moses is not so; he is faithful in all my house.	οὐχ οὕτως ὁ θεράπων µου Μωυσῆς· ἐν ὅλῳ τῷ οἴκῳ µου πιστός ἐστιν·						
Numbers	12	12	8	OT	1. OT	Pentateuch	1. Pentateuch	01. Pentateuch	04. Numbers	ϯⲛⲁⲥⲁϫⲓ ⲛⲉⲙⲁϥ ⲛ̀ⲣⲱ ⲟⲩⲃⲉ ⲣⲱ ϧⲉⲛ ⲟⲩⲛⲁⲩ ⲟⲩⲟϩ ϧⲉⲛ ⲟⲩⲥⲙⲟⲧ ⲁⲛ ⲟⲩⲟϩ ⲡⲱⲟⲩ ⲙ̀ⲡϭ̅ⲥ̅ ⲁϥⲛⲁⲩ ⲉ̀ⲣⲟϥ ⲟⲩⲟϩ ⲉⲑⲃⲉⲟⲩ ⲙ̀ⲡⲉⲧⲉⲛⲉⲣϩⲟϯ ⲉ̀ⲥⲁϫⲓ ⲛ̀ⲥⲁ ⲙⲱⲩ̀ⲥⲏⲥ ⲡⲁⲃⲱⲕ		I will speak to him mouth to mouth apparently, and not in dark speeches; and he has seen the glory of the Lord; and why were ye not afraid to speak against my servant Moses?	στόµα κατὰ στόµα λαλήσω αὐτῷ, ἐν εἴδει καὶ οὐ δι’ αἰνιγµάτων, καὶ τὴν δόξαν κυρίου εἶδεν· καὶ διὰ τί οὐκ ἐφοβήθητε καταλαλῆσαι κατὰ τοῦ θεράποντός µου Μωυσῆ;						
