book	chapter	chapter-zfilled	verse	testament	testament-indexed	section	section-indexed	section-indexed-no-testament	book-indexed	Bohairic	Sahidic	English	Greek	Fayyumic	Akhmimic	OldBohairic	Mesokemic	DialectP	Lycopolitan
Numbers	13	13	33	OT	1. OT	Pentateuch	1. Pentateuch	01. Pentateuch	04. Numbers	ⲟⲩⲟϩ ⲁⲩⲉⲛ ⲟⲩϣⲱϣ ⲛ̀ⲥⲁ ⲡⲓⲕⲁϩⲓ ⲉⲧⲁⲩϫⲟⲣϥ ϧⲁⲧⲉⲛ ⲛⲉⲛϣⲏⲣⲓ ⲙ̀ⲡⲓⲥ̅ⲗ̅ ⲉⲩϫⲱ ⲙ̀ⲙⲟⲥ ϫⲉ ⲡⲕⲁϩⲓ ⲉⲧⲁⲛϣⲉ ⲉ̀ⲣⲟϥ ⲟⲩⲕⲁϩⲓ ⲡⲉ ⲉϥⲟⲩⲱⲙ ⲛ̀ⲛⲏ ⲉⲧϣⲟⲡ ϩⲓⲱⲧϥ ⲡⲓⲗⲁⲟⲥ ⲅⲁⲣ ⲧⲏⲣϥ ⲉⲧⲁⲛⲛⲁⲩ ⲉ̀ⲣⲟϥ ⲙ̀ⲙⲁⲩ ϩⲁⲛϣⲏⲣⲓ ⲛⲉ ⲉⲩϭⲟⲥⲓ		And they brought a horror of that land which they surveyed upon the children of Israel, saying, The land which we passed by to survey it, is a land that eats up its inhabitants; and all the people whom we saw in it are men of extraordinary stature.	καὶ ἐξήνεγκαν ἔκστασιν τῆς γῆς, ἣν κατεσκέψαντο αὐτήν, πρὸς τοὺς υἱοὺς Ισραηλ λέγοντες Τὴν γῆν, ἣν παρήλθοµεν αὐτὴν κατασκέψασθαι, γῆ κατέσθουσα τοὺς κατοικοῦντας ἐπ’ αὐτῆς ἐστιν· πᾶς ὁ λαός, ὃν ἑωράκαµεν ἐν αὐτῇ, ἄνδρες ὑπερµήκεις·						
Numbers	13	13	34	OT	1. OT	Pentateuch	1. Pentateuch	01. Pentateuch	04. Numbers	ⲟⲩⲟϩ ⲁⲛⲛⲁⲩ ⲉ̀ⲛⲓⲁⲫⲱⲫ ⲙ̀ⲙⲁⲩ ⲟⲩⲟϩ ⲁⲛⲟⲓ ⲙ̀ⲫⲣⲏϯ ⲛ̀ϩⲁⲛϣϫⲏⲟⲩ ⲙ̀ⲡⲟⲩⲙ̀ⲑⲟ ⲁⲗⲗⲁ ⲫⲁⲓ ⲡⲉ ⲡⲓⲣⲏϯ ⲉ̀ⲛⲁⲛⲟⲓ ⲙ̀ⲙⲟϥ ⲙ̀ⲡⲟⲩⲙ̀ⲑⲟ ⲉ̀ⲃⲟⲗ		And there we saw the giants; and we were before them as locusts, yea even so were we before them.	καὶ ἐκεῖ ἑωράκαµεν τοὺς γίγαντας καὶ ἦµεν ἐνώπιον αὐτῶν ὡσεὶ ἀκρίδες, ἀλλὰ καὶ οὕτως ἦµεν ἐνώπιον αὐτῶν.						
Numbers	14	14	1	OT	1. OT	Pentateuch	1. Pentateuch	01. Pentateuch	04. Numbers	ⲟⲩⲟϩ ⲁⲥⲱϣ ⲉ̀ⲃⲟⲗ ⲛ̀ϫⲉ ϯⲥⲩⲛⲁⲅⲱⲅⲏ ⲧⲏⲣⲥ ⲁⲩϯ ⲛ̀ⲛⲟⲩⲥⲙⲏ ⲟⲩⲟϩ ⲁⲩⲣⲓⲙⲓ ⲛ̀ϫⲉ ⲡⲓⲗⲁⲟⲥ ⲙ̀ⲡⲓⲉϫⲱⲣϩ ⲧⲏⲣϥ ⲉⲧⲉⲙ̀ⲙⲁⲩ		And all the congregation lifted up their voice and cried; and the people wept all that night.	Καὶ ἀναλαβοῦσα πᾶσα ἡ συναγωγὴ ἔδωκεν φωνήν, καὶ ἔκλαιεν ὁ λαὸς ὅλην τὴν νύκτα ἐκείνην.						
Numbers	14	14	2	OT	1. OT	Pentateuch	1. Pentateuch	01. Pentateuch	04. Numbers	ⲟⲩⲟϩ ⲛⲁⲩⲭⲣⲉⲙⲣⲉⲙ ⲉ̀ϫⲉⲛ ⲙⲱⲩ̀ⲥⲏⲥ ⲛⲉⲙ ⲁⲁⲣⲱⲛ ⲛ̀ϫⲉ ⲛⲉⲛϣⲏⲣⲓ ⲧⲏⲣⲟⲩ ⲙ̀ⲡⲓⲥ̅ⲗ̅ ⲟⲩⲟϩ ⲡⲉϫⲱⲟⲩ ⲛⲱⲟⲩ ⲛ̀ϫⲉ ϯⲥⲩⲛⲁⲅⲱⲅⲏ ⲧⲏⲣⲥ ϫⲉ ⲁⲙⲟⲓ ⲉⲛⲉ ⲁⲛⲙⲟⲩ ⲡⲉ ϧⲉⲛ ⲡⲕⲁϩⲓ ⲛ̀ⲭⲏⲙⲓ ⲉ̀ϩⲟⲧⲉ ⲛ̀ⲧⲉⲛⲙⲟⲩ ⲛ̀ϩⲣⲏⲓ ϩⲓ ⲡⲁⲓϣⲁϥⲉ		And all the children of Israel murmured against Moses and Aaron; and all the congregation said to them,	καὶ διεγόγγυζον ἐπὶ Μωυσῆν καὶ Ααρων πάντες οἱ υἱοὶ Ισραηλ, καὶ εἶπαν πρὸς αὐτοὺς πᾶσα ἡ συναγωγή Ὄφελον ἀπεθάνοµεν ἐν γῇ Αἰγύπτῳ, ἢ ἐν τῇ ἐρήµῳ ταύτῃ εἰ ἀπεθάνοµεν·						
Numbers	14	14	3	OT	1. OT	Pentateuch	1. Pentateuch	01. Pentateuch	04. Numbers	ⲟⲩⲟϩ ⲉⲑⲃⲉⲟⲩ ϥⲛⲁⲟⲗⲧⲉⲛ ⲛ̀ϫⲉ ⲡϭ̅ⲥ̅ ⲉ̀ϧⲟⲩⲛ ⲉ̀ⲡⲁⲓⲕⲁϩⲓ ⲉ̀ⲑⲣⲉⲛϩⲉⲓ ϧⲉⲛ ⲫⲃⲱⲧⲥ ⲟⲩⲟϩ ⲛⲉⲛϩⲓⲟⲙⲓ ⲛⲉⲙ ⲛⲉⲛⲁⲗⲱⲟⲩⲓ ⲥⲉⲛⲁϣⲱⲡⲓ ⲉ̀ⲡϩⲱⲗⲉⲙ ϯⲛⲟⲩ ⲟⲩⲛ ⲛⲁⲛⲉⲥ ⲛⲁⲛ ⲉⲑⲣⲉⲛⲕⲟⲧⲧⲉⲛ ⲉ̀ϧⲣⲏⲓ ⲉ̀ⲭⲏⲙⲓ		Would we had died in the land of Egypt! or in this wilderness, would we had died! and why does the Lord bring us into this land to fall in war? our wives and our children shall be for a prey: now then it is better to return into Egypt.	καὶ ἵνα τί κύριος εἰσάγει ἡµᾶς εἰς τὴν γῆν ταύτην πεσεῖν ἐν πολέµῳ; αἱ γυναῖκες ἡµῶν καὶ τὰ παιδία ἔσονται εἰς διαρπαγήν· νῦν οὖν βέλτιον ἡµῖν ἐστιν ἀποστραφῆναι εἰς Αἴγυπτον.						
Numbers	14	14	4	OT	1. OT	Pentateuch	1. Pentateuch	01. Pentateuch	04. Numbers	ⲟⲩⲟϩ ⲡⲉϫⲉ ⲡⲓⲟⲩⲁⲓ ⲡⲓⲟⲩⲁⲓ ⲙ̀ⲡⲉϥϣⲫⲏⲣ ϫⲉ ⲙⲁⲣⲉⲛϯ ⲛ̀ⲟⲩⲁⲣⲭⲏⲅⲟⲥ ϧⲁϫⲱⲛ ⲟⲩⲟϩ ⲛ̀ⲧⲉⲛⲕⲟⲧⲧⲉⲛ ⲉ̀ϧⲣⲏⲓ ⲉ̀ⲭⲏⲙⲓ		And they said one to another, Let us make a ruler, and return into Egypt.	καὶ εἶπαν ἕτερος τῷ ἑτέρῳ Δῶµεν ἀρχηγὸν καὶ ἀποστρέψωµεν εἰς Αἴγυπτον.						
Numbers	14	14	5	OT	1. OT	Pentateuch	1. Pentateuch	01. Pentateuch	04. Numbers	ⲟⲩⲟϩ ⲁ ⲙⲱⲩ̀ⲥⲏⲥ ⲛⲉⲙ ⲁⲁⲣⲱⲛ ⲁⲩϩⲓⲧⲟⲩ ⲉ̀ϫⲉⲛ ⲡⲟⲩϩⲟ ⲙ̀ⲡⲉⲙ̀ⲑⲟ ⲛ̀ϯⲥⲩⲛⲁⲅⲱⲅⲏ ⲧⲏⲣⲥ ⲛ̀ⲧⲉ ⲛⲉⲛϣⲏⲣⲓ ⲙ̀ⲡⲓⲥ̅ⲗ̅		And Moses and Aaron fell upon their face before all the congregation of the children of Israel.	καὶ ἔπεσεν Μωυσῆς καὶ Ααρων ἐπὶ πρόσωπον ἐναντίον πάσης συναγωγῆς υἱῶν Ισραηλ.						
Numbers	14	14	6	OT	1. OT	Pentateuch	1. Pentateuch	01. Pentateuch	04. Numbers	ⲓⲏⲥⲟⲩ ⲇⲉ ⲡϣⲏⲣⲓ ⲛ̀ⲛⲁⲩⲏ ⲛⲉⲙ ⲭⲁⲗⲉⲃ ⲡϣⲏⲣⲓ ⲛ̀ⲓⲉⲫⲱⲛⲏ ⲉ̀ⲃⲟⲗ ϧⲉⲛ ⲛⲏ ⲉⲧⲁⲩϫⲉⲣ ⲡⲓⲕⲁϩⲓ ⲁⲩⲫⲱϧ ⲛ̀ⲛⲟⲩϩⲃⲱⲥ		But Joshua the son of Naue, and Chaleb the son of Jephonne, of the number of them that spied out the land, rent their garments,	Ἰησοῦς δὲ ὁ τοῦ Ναυη καὶ Χαλεβ ὁ τοῦ Ιεφοννη τῶν κατασκεψαµένων τὴν γῆν διέρρηξαν τὰ ἱµάτια αὐτῶν						
Numbers	14	14	7	OT	1. OT	Pentateuch	1. Pentateuch	01. Pentateuch	04. Numbers	ⲟⲩⲟϩ ⲡⲉϫⲱⲟⲩ ⲛ̀ϯⲥⲩⲛⲁⲅⲱⲅⲏ ⲧⲏⲣⲥ ⲛ̀ⲧⲉ ⲛⲉⲛϣⲏⲣⲓ ⲙ̀ⲡⲓⲥ̅ⲗ̅ ⲉⲩϫⲱ ⲙ̀ⲙⲟⲥ ϫⲉ ⲡⲓⲕⲁϩⲓ ⲉⲧⲁⲛϫⲟⲣϥ ⲛⲁⲛⲉϥ ⲉ̀ⲙⲁϣⲱ		and spoke to all the congregation of the children of Israel, saying, The land which we surveyed is indeed extremely good.	καὶ εἶπαν πρὸς πᾶσαν συναγωγὴν υἱῶν Ισραηλ λέγοντες Ἡ γῆ, ἣν κατεσκεψάµεθα αὐτήν, ἀγαθή ἐστιν σφόδρα σφόδρα·						
Numbers	14	14	8	OT	1. OT	Pentateuch	1. Pentateuch	01. Pentateuch	04. Numbers	ⲓⲥϫⲉ ϥⲥⲱⲧⲡ ⲙ̀ⲙⲟⲛ ⲛ̀ϫⲉ ⲡϭ̅ⲥ̅ ϥⲛⲁⲟⲗⲧⲉⲛ ⲉ̀ϧⲟⲩⲛ ⲉ̀ⲡⲓⲕⲁϩⲓ ⲟⲩⲟϩ ϥⲛⲁⲧⲏⲓϥ ⲛⲁⲛ ⲡⲓⲕⲁϩⲓ ⲫⲁⲓ ⲉⲧϧⲁϯ ⲛ̀ⲉⲣⲱϯ ⲛⲉⲙ ⲉⲃⲓⲱ		If the Lord choose us, he will bring us into this land, and give it us; a land which flows with milk and honey.	εἰ αἱρετίζει ἡµᾶς κύριος, εἰσάξει ἡµᾶς εἰς τὴν γῆν ταύτην καὶ δώσει αὐτὴν ἡµῖν, γῆ ἥτις ἐστὶν ῥέουσα γάλα καὶ µέλι.						
Numbers	14	14	9	OT	1. OT	Pentateuch	1. Pentateuch	01. Pentateuch	04. Numbers	ⲁⲗⲗⲁ ⲙ̀ⲡⲉⲣϩⲉⲛ ⲑⲏⲛⲟⲩ ⲥⲁⲃⲟⲗ ⲙ̀ⲡϭ̅ⲥ̅ ⲛ̀ⲑⲱⲧⲉⲛ ⲇⲉ ⲙ̀ⲡⲉⲣⲉⲣϩⲟϯ ϧⲁⲧϩⲏ ⲙ̀ⲡⲓⲙⲏϣ ⲛ̀ⲧⲉ ⲡⲓⲕⲁϩⲓ ϫⲉ ϥⲛⲁϣⲱⲡⲓ ⲛⲁⲛ ⲉⲩϧⲣⲉ ⲁ ⲡⲟⲩⲥⲏⲟⲩ ⲅⲁⲣ ⲙⲟⲩⲛⲕ ⲡϭ̅ⲥ̅ ⲇⲉ ⲛ̀ϧⲣⲏⲓ ⲛ̀ϧⲏⲧⲉⲛ ⲙ̀ⲡⲉⲣⲉⲣϩⲟϯ ⲟⲩⲛ ϧⲁⲧⲟⲩϩⲏ		Only depart not from the Lord; and fear ye not the people of the land, for they are meat for us; for the season of prosperity is departed from them, but the Lord is among us: fear them not.	ἀλλὰ ἀπὸ τοῦ κυρίου µὴ ἀποστάται γίνεσθε· ὑµεῖς δὲ µὴ φοβηθῆτε τὸν λαὸν τῆς γῆς, ὅτι κατάβρωµα ἡµῖν ἐστιν· ἀφέστηκεν γὰρ ὁ καιρὸς ἀπ’ αὐτῶν, ὁ δὲ κύριος ἐν ἡµῖν· µὴ φοβηθῆτε αὐτούς.						
Numbers	14	14	10	OT	1. OT	Pentateuch	1. Pentateuch	01. Pentateuch	04. Numbers	ⲟⲩⲟϩ ⲁⲥϫⲟⲥ ⲛ̀ϫⲉ ϯⲥⲩⲛⲁⲅⲱⲅⲏ ⲧⲏⲣⲥ ⲉ̀ϩⲓⲱⲛⲓ ⲉ̀ⲣⲱⲟⲩ ϧⲉⲛ ⲡⲱⲛⲓ ⲟⲩⲟϩ ⲡⲱⲟⲩ ⲙ̀ⲡϭ̅ⲥ̅ ⲁϥⲟⲩⲟⲛϩϥ ⲥⲁⲡϣⲱⲓ ϧⲉⲛ ϯϭⲏⲡⲓ ⲥⲁⲡϣⲱⲓ ⲛ̀ϯⲥⲕⲩⲛⲏ ⲛ̀ⲧⲉ ϯⲙⲉⲧⲙⲉⲑⲣⲉ ϧⲉⲛ ⲛⲉⲛϣⲏⲣⲓ ⲧⲏⲣⲟⲩ ⲙ̀ⲡⲓⲥ̅ⲗ̅		And all the congregation bade stone them with stones; and the glory of the Lord appeared in the cloud on the tabernacle of witness to all the children of Israel.	καὶ εἶπεν πᾶσα ἡ συναγωγὴ καταλιθοβολῆσαι αὐτοὺς ἐν λίθοις. καὶ ἡ δόξα κυρίου ὤφθη ἐν νεφέλῃ ἐπὶ τῆς σκηνῆς τοῦ µαρτυρίου ἐν πᾶσι τοῖς υἱοῖς Ισραηλ.						
Numbers	14	14	11	OT	1. OT	Pentateuch	1. Pentateuch	01. Pentateuch	04. Numbers	ⲟⲩⲟϩ ⲡⲉϫⲉ ⲡϭ̅ⲥ̅ ⲙ̀ⲙⲱⲩ̀ⲥⲏⲥ ϫⲉ ϣⲁ ⲑⲛⲁⲩ ϫⲉ ⲡⲁⲓⲗⲁⲟⲥ ⲑⲣⲟ ⲙ̀ⲙⲟⲓ ⲉⲙⲃⲟⲛ ⲟⲩⲟϩ ϣⲁ ⲑⲛⲁⲩ ⲥⲉⲛⲁϩϯ ⲁⲛ ⲉ̀ⲣⲟⲓ ϧⲉⲛ ⲛⲓⲙⲏⲓⲛⲓ ⲛⲉⲙ ⲛⲓϣⲫⲏⲣⲓ ⲉⲧⲁⲓⲁⲓⲧⲟⲩ ⲛ̀ϧⲣⲏⲓ ⲛ̀ϧⲏⲧⲟⲩ		And the Lord said to Moses, How long does this people provoke me? and how long do they refuse to believe me for all the signs which I have wrought among them?	καὶ εἶπεν κύριος πρὸς Μωυσῆν Ἕως τίνος παροξύνει µε ὁ λαὸς οὗτος καὶ ἕως τίνος οὐ πιστεύουσίν µοι ἐν πᾶσιν τοῖς σηµείοις, οἷς ἐποίησα ἐν αὐτοῖς;						
Numbers	14	14	12	OT	1. OT	Pentateuch	1. Pentateuch	01. Pentateuch	04. Numbers	ϯⲛⲁϣⲁⲣⲓ ⲉ̀ⲣⲱⲟⲩ ⲙ̀ⲙⲟⲩ ⲟⲩⲟϩ ⲛ̀ⲧⲁⲧⲁⲕⲱⲟⲩ ⲟⲩⲟϩ ⲛ̀ⲧⲁⲁⲓⲕ ⲛⲉⲙ ⲡⲏⲓ ⲙ̀ⲡⲉⲕⲓⲱⲧ ⲛ̀ⲟⲩⲛⲓϣϯ ⲛ̀ⲉⲑⲛⲟⲥ ⲟⲩⲟϩ ⲉ̀ⲛⲁϣⲱϥ ⲙⲁⲗⲗⲟⲛ ⲉ̀ϩⲟⲧⲉ ⲫⲁⲓ		I will smite them with death, and destroy them; and I will make of thee and of thy father’s house a great nation, and much greater than this.	πατάξω αὐτοὺς θανάτῳ καὶ ἀπολῶ αὐτοὺς καὶ ποιήσω σὲ καὶ τὸν οἶκον τοῦ πατρός σου εἰς ἔθνος µέγα καὶ πολὺ µᾶλλον ἢ τοῦτο.						
Numbers	14	14	13	OT	1. OT	Pentateuch	1. Pentateuch	01. Pentateuch	04. Numbers	ⲟⲩⲟϩ ⲡⲉϫⲉ ⲙⲱⲩ̀ⲥⲏⲥ ⲙ̀ⲡϭ̅ⲥ̅ ϫⲉ ϥⲛⲁⲥⲱⲧⲉⲙ ⲛ̀ϫⲉ ⲭⲏⲙⲓ ϫⲉ ⲁⲕⲉⲛ ⲡⲁⲓⲗⲁⲟⲥ ⲉ̀ⲃⲟⲗ ⲛ̀ϧⲏⲧⲟⲩ ϧⲉⲛ ⲧⲉⲕϫⲟⲙ		And Moses said to the Lord, So Egypt shall hear, for thou hast brought up this people from them by thy might.	καὶ εἶπεν Μωυσῆς πρὸς κύριον Καὶ ἀκούσεται Αἴγυπτος ὅτι ἀνήγαγες τῇ ἰσχύι σου τὸν λαὸν τοῦτον ἐξ αὐτῶν,						
Numbers	14	14	14	OT	1. OT	Pentateuch	1. Pentateuch	01. Pentateuch	04. Numbers	ⲁⲗⲗⲁ ⲛⲉⲙ ⲟⲩⲟⲛ ⲛⲓⲃⲉⲛ ⲉⲧϣⲟⲡ ϩⲓϫⲉⲛ ⲡⲁⲓⲕⲁϩⲓ ⲁⲩⲥⲱⲧⲉⲙ ϫⲉ ⲛ̀ⲑⲟⲕ ⲡⲉ ⲡϭ̅ⲥ̅ ϧⲉⲛ ⲡⲁⲓⲗⲁⲟⲥ ⲟⲩⲟϩ ⲕⲟⲩⲟⲛϩ ⲉ̀ⲣⲱⲟⲩ ⲡϭ̅ⲥ̅ ⲙ̀ⲃⲁⲗ ⲟⲩⲃⲉ ⲃⲁⲗ ⲟⲩⲟϩ ⲧⲉⲕϭⲏⲡⲓ ⲥⲟϩⲓ ⲉ̀ⲣⲁⲧⲥ ⲉϫⲱⲟⲩ ⲟⲩⲟϩ ϧⲉⲛ ⲟⲩⲥⲧⲩⲗⲟⲥ ⲛϭⲏⲡⲓ ⲕⲥⲱⲕ ϧⲁϫⲱⲟⲩ ⲙ̀ⲡⲓⲉϩⲟⲟⲩ ⲛⲉⲙ ϧⲉⲛ ⲟⲩⲥⲧⲩⲗⲟⲥ ⲛ̀ⲭⲣⲱⲙ ϧⲉⲛ ⲡⲓⲉϫⲱⲣϩ		Moreover all the dwellers upon this land have heard that thou art Lord in the midst of this people, who, O Lord, art seen by them face to face, and thy cloud rests upon them, and thou goest before them by day in a pillar of a cloud, and by night in a pillar of fire.	ἀλλὰ καὶ πάντες οἱ κατοικοῦντες ἐπὶ τῆς γῆς ταύτης ἀκηκόασιν ὅτι σὺ εἶ κύριος ἐν τῷ λαῷ τούτῳ, ὅστις ὀφθαλµοῖς κατ’ ὀφθαλµοὺς ὀπτάζῃ, κύριε, καὶ ἡ νεφέλη σου ἐφέστηκεν ἐπ’ αὐτῶν, καὶ ἐν στύλῳ νεφέλης σὺ πορεύῃ πρότερος αὐτῶν τὴν ἡµέραν καὶ ἐν στύλῳ πυρὸς τὴν νύκτα.						
Numbers	14	14	15	OT	1. OT	Pentateuch	1. Pentateuch	01. Pentateuch	04. Numbers	ⲟⲩⲟϩ ⲕⲛⲁϥⲉⲧ ⲡⲓⲗⲁⲟⲥ ⲉ̀ⲃⲟⲗ ⲙ̀ⲫⲣⲏϯ ⲛ̀ⲟⲩⲣⲱⲙⲓ ⲛ̀ⲟⲩⲱⲧ ⲟⲩⲟϩ ⲥⲉⲛⲁϫⲟⲥ ⲛ̀ϫⲉ ⲛⲓⲉⲑⲛⲟⲥ ⲧⲏⲣⲟⲩ ⲛⲏ ⲉⲧⲁⲩⲥⲱⲧⲉⲙ ⲉ̀ⲡⲉⲕⲣⲁⲛ ⲉⲩϫⲱ ⲙ̀ⲙⲟⲥ		And if thou shalt destroy this nation as one man; then all the nations that have heard thy name shall speak, saying,	καὶ ἐκτρίψεις τὸν λαὸν τοῦτον ὡσεὶ ἄνθρωπον ἕνα, καὶ ἐροῦσιν τὰ ἔθνη, ὅσοι ἀκηκόασιν τὸ ὄνοµά σου, λέγοντες						
Numbers	14	14	16	OT	1. OT	Pentateuch	1. Pentateuch	01. Pentateuch	04. Numbers	ϫⲉ ⲉⲧⲉ ⲙ̀ⲡⲉϥϣ̀ϫⲉⲙϫⲟⲙ ⲉ̀ⲱⲗⲓ ⲙ̀ⲡⲁⲓⲗⲁⲟⲥ ⲉ̀ϧⲟⲩⲛ ⲉ̀ⲡⲓⲕⲁϩⲓ ⲉⲧⲁϥⲱⲣⲕ ⲙ̀ⲙⲟϥ ⲛⲱⲟⲩ ⲁϥⲫⲟⲣϣⲟⲩ ⲛ̀ϩⲣⲏⲓ ϩⲓ ⲡϣⲁϥⲉ		Because the Lord could not bring this people into the land which he sware to them, he has overthrown them in the wilderness.	Παρὰ τὸ µὴ δύνασθαι κύριον εἰσαγαγεῖν τὸν λαὸν τοῦτον εἰς τὴν γῆν, ἣν ὤµοσεν αὐτοῖς, κατέστρωσεν αὐτοὺς ἐν τῇ ἐρήµῳ.						
Numbers	14	14	17	OT	1. OT	Pentateuch	1. Pentateuch	01. Pentateuch	04. Numbers	ⲟⲩⲟϩ ϯⲛⲟⲩ ⲙⲁⲣⲉⲥϭⲓⲥⲓ ⲛ̀ϫⲉ ⲧⲉⲕϫⲟⲙ ⲡϭ̅ⲥ̅ ⲙ̀ⲫⲣⲏϯ ⲉⲧⲁⲕϫⲟⲥ ⲉⲕϫⲱ ⲙ̀ⲙⲟⲥ		And now, O Lord, let thy strength be exalted, as thou spakest, saying,	καὶ νῦν ὑψωθήτω ἡ ἰσχύς σου, κύριε, ὃν τρόπον εἶπας λέγων						
Numbers	14	14	18	OT	1. OT	Pentateuch	1. Pentateuch	01. Pentateuch	04. Numbers	ϫⲉ ⲡϭ̅ⲥ̅ ⲡⲓⲣⲉϥⲱⲟⲩ ⲛ̀ϩⲏⲧ ⲫⲁ ⲡⲓⲛⲓϣϯ ⲛ̀ⲛⲁⲓ ⲟⲩⲟϩ ⲛ̀ⲑⲙⲏⲓ ⲫⲏ ⲉⲧⲱⲗⲓ ⲛ̀ⲛⲓⲁⲛⲟⲙⲓⲁ ⲛⲉⲙ ⲛⲓⲁⲇⲓⲕⲓⲁ ⲛⲉⲙ ⲛⲓⲛⲟⲃⲓ ⲟⲩⲟϩ ϧⲉⲛ ⲟⲩⲧⲟⲩⲃⲟ ϥⲧⲟⲩⲃⲟ ⲁⲛ ⲙ̀ⲡⲓⲣⲉϥⲉⲣⲛⲟⲃⲓ ⲉϥⲓⲛⲓ ⲛ̀ⲛⲓⲛⲟⲃⲓ ⲛ̀ⲧⲉ ⲛⲓⲓⲟϯ ⲉ̀ϫⲉⲛ ⲛⲓϣⲏⲣⲓ ϣⲁ ⲫⲙⲁϩⲅ̅ ⲛⲉⲙ ⲫⲙⲁϩⲇ̅ ⲛ̀ϫⲱⲟⲩ		The Lord is long-suffering and merciful, and true, removing transgressions and iniquities and sins, and he will by no means clear the guilty, visiting the sins of the fathers upon the children to the third and fourth generation.	Κύριος µακρόθυµος καὶ πολυέλεος καὶ ἀληθινός, ἀφαιρῶν ἀνοµίας καὶ ἀδικίας καὶ ἁµαρτίας, καὶ καθαρισµῷ οὐ καθαριεῖ τὸν ἔνοχον ἀποδιδοὺς ἁµαρτίας πατέρων ἐπὶ τέκνα ἕως τρίτης καὶ τετάρτης.						
Numbers	14	14	19	OT	1. OT	Pentateuch	1. Pentateuch	01. Pentateuch	04. Numbers	ⲭⲁ ⲫⲛⲟⲃⲓ ⲙ̀ⲡⲁⲓⲗⲁⲟⲥ ⲛⲁϥ ⲉ̀ⲃⲟⲗ ⲕⲁⲧⲁ ⲡⲉⲕⲛⲓϣϯ ⲛ̀ⲛⲁⲓ ⲙ̀ⲫⲣⲏϯ ⲉⲧⲁⲕⲭⲱ ⲛⲱⲟⲩ ⲉ̀ⲃⲟⲗ ⲓⲥϫⲉⲛ ⲭⲏⲙⲓ ϣⲁ ⲉ̀ϧⲟⲩⲛ ⲉ̀ϯⲛⲟⲩ		Forgive this people their sin according to thy great mercy, as thou wast favourable to them from Egypt until now.	ἄφες τὴν ἁµαρτίαν τῷ λαῷ τούτῳ κατὰ τὸ µέγα ἔλεός σου, καθάπερ ἵλεως αὐτοῖς ἐγένου ἀπ’ Αἰγύπτου ἕως τοῦ νῦν.						
Numbers	14	14	20	OT	1. OT	Pentateuch	1. Pentateuch	01. Pentateuch	04. Numbers	ⲟⲩⲟϩ ⲡⲉϫⲉ ⲡϭ̅ⲥ̅ ⲙ̀ⲙⲱⲩ̀ⲥⲏⲥ ϫⲉ ϯⲛⲁⲭⲱ ⲛⲱⲟⲩ ⲉ̀ⲃⲟⲗ ⲕⲁⲧⲁ ⲡⲉⲕⲥⲁϫⲓ		And the Lord said to Moses, I am gracious to them according to thy word.	καὶ εἶπεν κύριος πρὸς Μωυσῆν Ἵλεως αὐτοῖς εἰµι κατὰ τὸ ῥῆµά σου·						
Numbers	14	14	21	OT	1. OT	Pentateuch	1. Pentateuch	01. Pentateuch	04. Numbers	ⲁⲗⲗⲁ ϯⲟⲛϧ ⲁ̀ⲛⲟⲕ ⲡϭ̅ⲥ̅ ⲟⲩⲟϩ ϥⲟⲛϧ ⲛ̀ϫⲉ ⲡⲁⲣⲁⲛ ⲟⲩⲟϩ ⲡⲱⲟⲩ ⲙ̀ⲡϭ̅ⲥ̅ ⲉϥⲉ̀ⲙⲁϩ ⲙ̀ⲡⲕⲁϩⲓ ⲧⲏⲣϥ		But as I live and my name is living, so the glory of the Lord shall fill all the earth.	ἀλλὰ ζῶ ἐγὼ καὶ ζῶν τὸ ὄνοµά µου καὶ ἐµπλήσει ἡ δόξα κυρίου πᾶσαν τὴν γῆν,						
Numbers	14	14	22	OT	1. OT	Pentateuch	1. Pentateuch	01. Pentateuch	04. Numbers	ϫⲉ ⲛⲓⲣⲱⲙⲓ ⲧⲏⲣⲟⲩ ⲉⲧⲁⲩⲛⲁⲩ ⲉ̀ⲡⲁⲱⲟⲩ ⲛⲉⲙ ⲛⲁⲙⲏⲓⲛⲓ ⲉⲧⲁⲓⲁⲓⲧⲟⲩ ϧⲉⲛ ⲭⲏⲙⲓ ⲛⲉⲙ ⲛ̀ϩⲣⲏⲓ ϩⲓ ⲡϣⲁϥⲉ ⲟⲩⲟϩ ⲁⲩⲉⲣⲡⲓⲣⲁⲍⲓⲛ ⲙ̀ⲙⲟⲓ ⲫⲙⲁϩⲓ ⲛ̀ⲥⲟⲡ ⲡⲉ ⲫⲁⲓ ⲟⲩⲟϩ ⲙⲡⲟⲩⲥⲱⲧⲉⲙ ⲛ̀ⲥⲁ ⲧⲁⲥⲙⲏ		For all the men who see my glory, and the signs which I wrought in Egypt, and in the wilderness, and have tempted me this tenth time, and have not hearkened to my voice,	ὅτι πάντες οἱ ἄνδρες οἱ ὁρῶντες τὴν δόξαν µου καὶ τὰ σηµεῖα, ἃ ἐποίησα ἐν Αἰγύπτῳ καὶ ἐν τῇ ἐρήµῳ ταύτῃ, καὶ ἐπείρασάν µε τοῦτο δέκατον καὶ οὐκ εἰσήκουσάν µου τῆς φωνῆς,						
Numbers	14	14	23	OT	1. OT	Pentateuch	1. Pentateuch	01. Pentateuch	04. Numbers	ⲉⲑⲃⲉⲫⲁⲓ ⲛ̀ⲛⲟⲩⲛⲁⲩ ⲉ̀ⲡⲓⲕⲁϩⲓ ⲉⲧⲁⲓⲱⲣⲕ ⲙ̀ⲙⲟϥ ⲛ̀ⲛⲟⲩⲓⲟϯ ⲁⲗⲗⲁ ⲛⲟⲩϣⲏⲣⲓ ⲉⲧⲛⲉⲙⲏⲓ ⲙ̀ⲫⲟⲟⲩ ⲙ̀ⲡⲁⲓⲙⲁ ⲛⲏ ⲉⲧⲉ ⲛ̀ⲥⲉⲥⲱⲟⲩⲛ ⲁⲛ ⲛ̀ⲟⲩⲡⲉⲧϩⲱⲟⲩ ⲟⲩⲇⲉ ⲟⲩⲡⲉⲑⲛⲁⲛⲉϥ ⲕⲟⲩϫⲓ ⲛ̀ⲁⲗⲟⲩ ⲛⲓⲃⲉⲛ ⲛ̀ⲁⲧⲉⲙⲓ ⲛⲁⲓ ⲉ̀ϯⲛⲁϯ ⲛⲱⲟⲩ ⲙ̀ⲡⲓⲕⲁϩⲓ ⲛⲏ ⲇⲉ ⲉⲧⲁⲩⲑⲣⲓϫⲱⲛⲧ ⲛ̀ⲛⲟⲩⲛⲁⲩ ⲉ̀ⲣⲟϥ		surely they shall not see the land, which I sware to their fathers; but their children which are with me here, as many as know not good or evil, every inexperienced youth, to them will I give the land; but none who have provoked me shall see it.	ἦ µὴν οὐκ ὄψονται τὴν γῆν, ἣν ὤµοσα τοῖς πατράσιν αὐτῶν, ἀλλ’ ἢ τὰ τέκνα αὐτῶν, ἅ ἐστιν µετ’ ἐµοῦ ὧδε, ὅσοι οὐκ οἴδασιν ἀγαθὸν οὐδὲ κακόν, πᾶς νεώτερος ἄπειρος, τούτοις δώσω τὴν γῆν, πάντες δὲ οἱ παροξύναντές µε οὐκ ὄψονται αὐτήν.						
Numbers	14	14	24	OT	1. OT	Pentateuch	1. Pentateuch	01. Pentateuch	04. Numbers	ⲡⲁⲁⲗⲟⲩ ⲇⲉ ⲭⲁⲗⲉⲃ ϫⲉ ⲁ ⲡⲁⲡⲛ̅ⲁ̅ ϣⲱⲡⲓ ⲛ̀ϧⲏⲧϥ ⲟⲩⲟϩ ⲁϥⲥⲱⲧⲉⲙ ⲉ̀ⲟⲩⲁϩϥ ⲛ̀ⲥⲱⲓ ϯⲛⲁⲟⲗϥ ⲉ̀ϧⲟⲩⲛ ⲉ̀ⲡⲓⲕⲁϩⲓ ⲫⲏ ⲉⲧⲁϥϣⲉ ⲉ̀ϧⲟⲩⲛ ⲉ̀ⲣⲟϥ ⲟⲩⲟϩ ⲡⲉϥϫⲣⲟϫ ⲉϥⲉ̀ⲉⲣⲕⲗⲏⲣⲟⲛⲟⲙⲓⲛ ⲙ̀ⲙⲟϥ		But my servant Chaleb, because there was another spirit in him, and he followed me, I will bring him into the land into which he entered, and his seed shall inherit it.	ὁ δὲ παῖς µου Χαλεβ, ὅτι ἐγενήθη πνεῦµα ἕτερον ἐν αὐτῷ καὶ ἐπηκολούθησέν µοι, εἰσάξω αὐτὸν εἰς τὴν γῆν, εἰς ἣν εἰσῆλθεν ἐκεῖ, καὶ τὸ σπέρµα αὐτοῦ κληρονοµήσει αὐτήν.						
Numbers	14	14	25	OT	1. OT	Pentateuch	1. Pentateuch	01. Pentateuch	04. Numbers	ⲡⲓⲁⲙⲁⲗⲏⲕ ⲇⲉ ⲛⲉⲙ ⲡⲓⲭⲁⲛⲁⲛⲉⲟⲥ ⲥⲉϣⲟⲡ ϧⲉⲛ ϯϧⲉⲗⲗⲟⲧ ⲣⲁⲥϯ ⲕⲉⲧ ⲑⲏⲛⲟⲩ ⲛ̀ⲑⲱⲧⲉⲛ ⲟⲩⲟϩ ⲙⲁϣⲉ ⲛⲱⲧⲉⲛ ϩⲓ ⲡϣⲁϥⲉ ⲉ̀ⲫⲙⲱⲓⲧ ⲙ̀ⲫⲓⲟⲙ ⲛ̀ϣⲁⲣⲓ		But Amalec and the Chananite dwell in the valley: to-morrow turn and depart for the wilderness by the way of the Red Sea.	Ὁ δὲ Αµαληκ καὶ ὁ Χαναναῖος κατοικοῦσιν ἐν τῇ κοιλάδι· αὔριον ἐπιστράφητε ὑµεῖς καὶ ἀπάρατε εἰς τὴν ἔρηµον ὁδὸν θάλασσαν ἐρυθράν.						
Numbers	14	14	26	OT	1. OT	Pentateuch	1. Pentateuch	01. Pentateuch	04. Numbers	ⲟⲩⲟϩ ⲡⲉϫⲉ ⲡϭ̅ⲥ̅ ⲙ̀ⲙⲱⲩ̀ⲥⲏⲥ ⲛⲉⲙ ⲁⲁⲣⲱⲛ ⲉϥϫⲱ ⲙ̀ⲙⲟⲥ		And the Lord spoke to Moses and Aaron, saying,	Καὶ εἶπεν κύριος πρὸς Μωυσῆν καὶ Ααρων λέγων						
Numbers	14	14	27	OT	1. OT	Pentateuch	1. Pentateuch	01. Pentateuch	04. Numbers	ϫⲉ ϣⲁ ⲑⲛⲁⲩ ϫⲉ ⲧⲁⲓⲥⲩⲛⲁⲅⲱⲅⲏ ⲉⲧϩⲱⲟⲩ ⲛⲏ ⲉⲧⲟⲩⲭⲣⲉⲙⲣⲉⲙ ⲙ̀ⲙⲱⲟⲩ ⲛ̀ⲑⲱⲟⲩ ⲙ̀ⲡⲁⲙ̀ⲑⲟ ⲡⲭⲣⲉⲙⲣⲉⲙ ⲇⲉ ⲛ̀ⲧⲉ ⲛⲉⲛϣⲏⲣⲓ ⲙ̀ⲡⲓⲥ̅ⲗ̅ ⲫⲏ ⲉⲧⲟⲩⲭⲣⲉⲙⲣⲉⲙ ⲙ̀ⲙⲟϥ ⲉ̀ϫⲉⲛ ⲑⲏⲛⲟⲩ ⲁⲓⲥⲱⲧⲉⲙ ⲉ̀ⲣⲟϥ		How long shall I endure this wicked congregation? I have heard their murmurings against me, even the murmuring of the children of Israel, which they have murmured concerning you.	Ἕως τίνος τὴν συναγωγὴν τὴν πονηρὰν ταύτην; ἃ αὐτοὶ γογγύζουσιν ἐναντίον ἐµοῦ, τὴν γόγγυσιν τῶν υἱῶν Ισραηλ, ἣν ἐγόγγυσαν περὶ ὑµῶν, ἀκήκοα.						
Numbers	14	14	28	OT	1. OT	Pentateuch	1. Pentateuch	01. Pentateuch	04. Numbers	ⲁϫⲟⲥ ⲛⲱⲟⲩ ϫⲉ ϯⲟⲛϧ ⲁ̀ⲛⲟⲕ ⲡⲉϫⲉ ⲡϭ̅ⲥ̅ ⲙ̀ⲫⲣⲏϯ ⲉⲧⲁⲣⲉⲧⲉⲛⲥⲁϫⲓ ⲉ̀ϧⲣⲏⲓ ⲉ̀ⲛⲁⲙⲁϣϫ ⲡⲁⲓⲣⲏϯ ϯⲛⲁⲓⲣⲓ ⲛⲱⲧⲉⲛ		Say to them, As I live, saith the Lord: surely as ye spoke into my ears, so will I do to you.	εἰπὸν αὐτοῖς Ζῶ ἐγώ, λέγει κύριος, ἦ µὴν ὃν τρόπον λελαλήκατε εἰς τὰ ὦτά µου, οὕτως ποιήσω ὑµῖν·						
Numbers	14	14	29	OT	1. OT	Pentateuch	1. Pentateuch	01. Pentateuch	04. Numbers	ϩⲓ ⲡϣⲁϥⲉ ⲉⲩⲉ̀ϩⲉⲓ ⲛ̀ϫⲉ ⲛⲉⲧⲉⲛⲕⲉⲗⲓ ⲛⲉⲙ ⲧⲉⲧⲉⲛⲉⲡⲓⲥⲕⲟⲡⲏ ⲧⲏⲣⲥ ⲟⲩⲟϩ ⲛⲏ ⲉⲧⲁⲩϭⲓⲏⲡⲓ ⲙ̀ⲙⲱⲟⲩ ⲛ̀ⲧⲱⲧⲉⲛ ⲓⲥϫⲉⲛ ⲕ̅ ⲛ̀ⲣⲟⲙⲡⲓ ⲛⲉⲙ ⲥⲁⲡϣⲱⲓ ⲟⲩⲟⲛ ⲛⲓⲃⲉⲛ ⲉⲧⲁⲩⲭⲣⲉⲙⲣⲉⲙ ⲉ̀ϩⲣⲏⲓ ⲉ̀ϫⲱⲓ		Your carcases shall fall in this wilderness; and all those of you that were reviewed, and those of you that were numbered from twenty years old and upward, all that murmured against me,	ἐν τῇ ἐρήµῳ ταύτῃ πεσεῖται τὰ κῶλα ὑµῶν καὶ πᾶσα ἡ ἐπισκοπὴ ὑµῶν καὶ οἱ κατηριθµηµένοι ὑµῶν ἀπὸ εἰκοσαετοῦς καὶ ἐπάνω, ὅσοι ἐγόγγυσαν ἐπ’ ἐµοί·						
Numbers	14	14	30	OT	1. OT	Pentateuch	1. Pentateuch	01. Pentateuch	04. Numbers	ϫⲉ ⲁⲛ ⲧⲉⲧⲉⲛⲛⲁϣⲉ ⲛⲱⲧⲉⲛ ⲉ̀ϧⲟⲩⲛ ⲉ̀ⲡⲓⲕⲁϩⲓ ⲉⲧⲁⲓⲥⲟⲩⲧⲉⲛ ⲧⲁϫⲓϫ ⲉ̀ⲃⲟⲗ ⲉ̀ϩⲣⲏⲓ ⲉ̀ϫⲱϥ ⲉ̀ⲑⲣⲉⲧⲉⲧⲉⲛϣⲱⲡⲓ ϩⲓⲱⲧϥ ⲁⲗⲗⲁ ⲭⲁⲗⲉⲃ ⲡϣⲏⲣⲓ ⲛ̀ⲓⲉⲫⲱⲛⲏ ⲛⲉⲙ ⲓⲏⲥⲟⲩ ⲡϣⲏⲣⲓ ⲛ̀ⲛⲁⲩⲏ		ye shall not enter into the land for which I stretched out my hand to establish you upon it; except only Chaleb the son of Jephonne, and Joshua the son of Naue.	εἰ ὑµεῖς εἰσελεύσεσθε εἰς τὴν γῆν, ἐφ’ ἣν ἐξέτεινα τὴν χεῖρά µου κατασκηνῶσαι ὑµᾶς ἐπ’ αὐτῆς, ἀλλ’ ἢ Χαλεβ υἱὸς Ιεφοννη καὶ Ἰησοῦς ὁ τοῦ Ναυη.						
