book	chapter	chapter-zfilled	verse	testament	testament-indexed	section	section-indexed	section-indexed-no-testament	book-indexed	Bohairic	Sahidic	English	Greek	Fayyumic	Akhmimic	OldBohairic	Mesokemic	DialectP	Lycopolitan
First Samuel	10	10	15	OT	1. OT	Historical Books	2. Historical Books	02. Historical Books	04. First Samuel		ⲁⲩⲱ ϭⲓⲥ ⲡⲉϫⲁϥ ⲛ̅ⲥⲁⲟⲩⲗ. ϫⲉ ⲙⲁⲧⲁⲙⲟⲓ̈. ϫⲉ ⲛ̅ⲧⲁ ⲥⲁⲙⲟⲩⲏⲗ ϫⲟⲟⲥ ⲛⲁⲕ ϫⲉ ⲟⲩ.	And his kinsman said to Saul, Tell me, I pray thee, What did Samuel say to thee?	καὶ εἶπεν ὁ οἰκεῖος πρὸς Σαουλ Ἀπάγγειλον δή µοι τί εἶπέν σοι Σαµουηλ.						
First Samuel	10	10	16	OT	1. OT	Historical Books	2. Historical Books	02. Historical Books	04. First Samuel		ⲡⲉϫⲉ ⲥⲁⲟⲩⲗ ⲙ̅ⲡⲉϥⲉⲓⲱⲧ ϫⲉ ϩⲛ̅ ⲟⲩⲧⲁⲙⲟ. ⲁϥⲧⲁⲙⲟⲓ̈. ϫⲉ ⲁⲩϩⲉ ⲉⲛⲉⲟⲟⲩ. ⲡϣⲁϫⲉ ⲇⲉ ⲛ̅ⲧⲙⲛ̅ⲧⲣ̅ⲣⲟ ⲙ̅ⲡⲉϥⲟⲩⲟⲛϩϥ̅ ⲉⲣⲟϥ	And Saul said to his kinsman, he verily told me that the asses were found. But the matter of the kingdom he told him not.	καὶ εἶπεν Σαουλ πρὸς τὸν οἰκεῖον αὐτοῦ Ἀπήγγειλεν ἀπαγγέλλων µοι ὅτι εὕρηνται αἱ ὄνοι· τὸ δὲ ῥῆµα τῆς βασιλείας οὐκ ἀπήγγειλεν αὐτῷ.						
First Samuel	10	10	17	OT	1. OT	Historical Books	2. Historical Books	02. Historical Books	04. First Samuel		ⲁⲩⲱ ⲥⲁⲙⲟⲩⲏⲗ ⲁϥⲡⲁⲣⲁⲅⲅⲓⲗⲉ ⲙ̅ⲡⲗⲁⲟⲥ ⲧⲏⲣϥ̅ ⲉⲧⲣⲉⲩⲉⲓ ⲉⲣⲁⲧϥ̅ ⲙ̅ⲡϫⲟⲉⲓⲥ ⲉϩⲣⲁⲓ̈ ⲉⲙⲁⲥⲏⲫⲁⲑ	And Samuel summoned all the people before the Lord to Massephath.	Καὶ παρήγγειλεν Σαµουηλ παντὶ τῷ λαῷ πρὸς κύριον εἰς Μασσηφα						
First Samuel	10	10	18	OT	1. OT	Historical Books	2. Historical Books	02. Historical Books	04. First Samuel		ⲥⲁⲙⲟⲩⲏⲗ ⲇⲉ ⲡⲉϫⲁϥ ⲛ̅ⲛ̅ϣⲏⲣⲉ ⲙ̅ⲡⲓⲏ̅ⲗ̅ ϫⲉ ⲛⲁⲓ̈ ⲛⲉⲧⲉⲣⲉ ⲡϫⲟⲉⲓⲥ ⲡⲛⲟⲩⲧⲉ ⲙ̅ⲡⲓⲏ̅ⲗ̅ ϫⲱ ⲙ̅ⲙⲟⲟⲩ. ϫⲉ ⲁⲛⲟⲕ ⲁⲓ̈ⲉⲓⲛⲉ. ⲛ̅ⲛⲉϣⲏⲣⲉ ⲙ̅ⲡⲓⲏ̅ⲗ̅ ⲉⲃⲟⲗ ϩⲛ̅ ⲕⲏⲙⲉ. ⲁⲩⲱ ⲁⲓ̈ⲛⲉϩⲙ̅ ⲧⲏⲩⲧⲛ̅ ⲛ̅ⲧⲟⲟⲧϥ̅ ⲙ̅ⲫⲁⲣⲁⲱ ⲡⲣ̅ⲣⲟ ⲛ̅ⲕⲏⲙⲉ. ⲁⲩⲱ ⲛ̅ⲧⲟⲟⲧⲟⲩ ⲛ̅ⲛⲉⲣⲱⲙⲉ ⲧⲏⲣⲟⲩ ⲉⲧϩⲟϫϩⲉϫ ⲙ̅ⲙⲱⲧⲛ̅.	And he said to the children of Israel, Thus has the Lord God of Israel spoken, saying, I brought up the children of Israel out of Egypt, and I rescued you out of the hand of Pharao king of Egypt, and out of all the kingdoms that afflicted you.	καὶ εἶπεν πρὸς υἱοὺς Ισραηλ Τάδε εἶπεν κύριος ὁ θεὸς Ισραηλ λέγων Ἐγὼ ἀνήγαγον τοὺς υἱοὺς Ισραηλ ἐξ Αἰγύπτου καὶ ἐξειλάµην ὑµᾶς ἐκ χειρὸς Φαραω βασιλέως Αἰγύπτου καὶ ἐκ πασῶν τῶν βασιλειῶν τῶν θλιβουσῶν ὑµᾶς·						
First Samuel	10	10	19	OT	1. OT	Historical Books	2. Historical Books	02. Historical Books	04. First Samuel		ⲛ̅ⲧⲱⲧⲛ̅ ⲇⲉ ⲙ̅ⲡⲟⲟⲩ. ⲁⲧⲉⲧⲛ̅ⲥⲉϣϥ̅ ⲡⲛⲟⲩⲧⲉ. ⲛ̅ⲧⲟϥ ⲡⲉ ⲡⲉⲧⲛ̅ⲥⲱ̅ⲣ̅. ⲉⲃⲟⲗ ϩⲛ̅ ⲛⲉⲧⲛ̅ϩⲓⲥⲉ ⲧⲏⲣⲟⲩ ⲙⲛ̅ ⲛⲉⲧⲛ̅ⲑⲗⲓⲯⲓⲥ ⲁⲩⲱ ⲡⲉϫⲏⲧⲛ̅. ϫⲉ ⲛ̅ⲧⲛ̅ⲛⲁϭⲱ ⲁⲛ ϩⲓ̈ⲛⲁⲓ̈. ⲁⲗⲗⲁ ⲕⲱ ⲛ̅ⲟⲩⲣ̅ⲣⲟ ϩⲓ̈ϫⲱⲛ. ⲧⲉⲛⲟⲩ ϭⲉ ⲁϩⲉⲣⲁⲧ ⲧⲏⲩⲧⲛ̅ ⲙ̅ⲡⲙⲧⲟ ⲉⲃⲟⲗ ⲙ̅ⲡϫⲟⲉⲓⲥ. ⲕⲁⲧⲁ ⲛⲉⲧⲛ̅ⲧⲱϣ. ⲕⲁⲧⲁ ⲛ̅ϣⲟ. ⲛ̅ⲛⲉⲧⲛ̅ⲫⲩⲗⲏ.	And ye have this day rejected God, who is himself your Deliverer out of all your evils and afflictions; and ye said, Nay, but thou shalt set a king over us: and now stand before the Lord according to your tribes, and according to your families.	καὶ ὑµεῖς σήµερον ἐξουθενήκατε τὸν θεόν, ὃς αὐτός ἐστιν ὑµῶν σωτὴρ ἐκ πάντων τῶν κακῶν ὑµῶν καὶ θλίψεων ὑµῶν, καὶ εἴπατε Οὐχί, ἀλλ’ ἢ ὅτι βασιλέα στήσεις ἐφ’ ἡµῶν· καὶ νῦν κατάστητε ἐνώπιον κυρίου κατὰ τὰ σκῆπτρα ὑµῶν καὶ κατὰ τὰς φυλὰς ὑµῶν.						
First Samuel	10	10	20	OT	1. OT	Historical Books	2. Historical Books	02. Historical Books	04. First Samuel		ⲥⲁⲙⲟⲩⲏⲗ ⲇⲉ ⲁϥⲧⲁϩⲟ ⲉⲣⲁⲧϥ̅ ⲙ̅ⲡⲙⲏⲏϣⲉ ⲧⲏⲣϥ̅ ⲙ̅ⲡⲓⲏ̅ⲗ̅. ⲁⲩⲱ ⲁ ⲡⲉⲕⲗⲏⲣⲟⲥ ⲧⲁϩⲉ ⲡⲙⲏⲏϣⲉ ⲛ̅ⲃⲉⲛⲓⲁⲙⲓⲛ.	And Samuel brought nigh all the tribes of Israel, and the tribe of Benjamin is taken by lot.	καὶ προσήγαγεν Σαµουηλ πάντα τὰ σκῆπτρα Ισραηλ, καὶ κατακληροῦται σκῆπτρον Βενιαµιν·						
First Samuel	10	10	21	OT	1. OT	Historical Books	2. Historical Books	02. Historical Books	04. First Samuel		ⲁϥⲧⲁϩⲟ ⲉⲣⲁⲧϥ̅ ⲙ̅ⲡⲙⲏⲏϣⲉ ⲛ̅ⲃⲉⲛⲓⲁⲙⲓⲛ ⲕⲁⲧⲁ ⲛⲉϥⲫⲩⲗⲏ. ⲁ ⲡⲉⲕⲗⲏⲣⲟⲥ ⲉⲓ ⲉϫⲛ̅ ⲧⲉⲫⲩⲗⲏ ⲙ̅ⲙⲁⲧⲧⲁⲣⲓⲛ. ⲁⲩⲱ ⲁϥⲧⲁϩⲟ ⲉⲣⲁⲧⲥ̅ ⲛ̅ⲧⲉⲫⲩⲗⲏ ⲙ̅ⲙⲁⲧⲧⲁⲣⲓⲛ ⲕⲁⲧⲁ ⲣⲱⲙⲉ ⲁ ⲡⲉⲕⲗⲏⲣⲟⲥ ⲉⲓ ⲉϫⲛ̅ ⲥⲁⲟⲩⲗ ⲡϣⲏⲣⲉ ⲛ̅ϭⲓⲥ. ⲁⲩⲱ ⲁⲩⲕⲱⲧⲉ ⲛ̅ⲥⲱϥ ⲙ̅ⲡⲟⲩϩⲉ ⲉⲣⲟϥ.	And he brings near the tribe of Benjamin by families, and the family of Mattari is taken by lot: and they bring near the family of Mattari, man by man, and Saul the son of Kis is taken; and he sought him, but he was not found.	καὶ προσάγει σκῆπτρον Βενιαµιν εἰς φυλάς, καὶ κατακληροῦται φυλὴ Ματταρι· καὶ προσάγουσιν τὴν φυλὴν Ματταρι εἰς ἄνδρας, καὶ κατακληροῦται Σαουλ υἱὸς Κις. καὶ ἐζήτει αὐτόν, καὶ οὐχ εὑρίσκετο.						
First Samuel	10	10	22	OT	1. OT	Historical Books	2. Historical Books	02. Historical Books	04. First Samuel		ⲥⲁⲙⲟⲏⲗ ⲇⲉ ⲁϥⲕⲟⲧϥ̅ ⲁϥϫⲛⲉ ⲡϫⲟⲉⲓⲥ. ϫⲉ ⲉⲛⲉⲣⲉ ⲡⲣⲱⲙⲉ ⲛⲁⲉⲓ ⲉⲡⲉⲓ̈ⲙⲁ. ⲡⲉϫⲉ ⲡϫⲟⲉⲓⲥ ⲛⲁϥ ϫⲉ ⲉⲓⲥ ϩⲏⲏⲧⲉ ϥⲗⲏϭ ϩⲛ̅ ⲛⲉⲥⲕⲩⲛⲏ.	And Samuel asked yet again of the Lord, Will the man come hither? and the Lord said, Behold, he is hid among the stuff.	καὶ ἐπηρώτησεν Σαµουηλ ἔτι ἐν κυρίῳ Εἰ ἔρχεται ὁ ἀνὴρ ἐνταῦθα; καὶ εἶπεν κύριος Ἰδοὺ αὐτὸς κέκρυπται ἐν τοῖς σκεύεσιν.						
First Samuel	10	10	23	OT	1. OT	Historical Books	2. Historical Books	02. Historical Books	04. First Samuel		ⲥⲁⲙⲟⲩⲏⲗ ⲇⲉ ⲁϥⲡⲱⲧ ⲁϥⲛ̅ⲧϥ̅ ⲉⲃⲟⲗ ϩⲙ̅ ⲡⲙⲁ ⲉⲧⲙ̅ⲙⲁⲩ. ⲁϥⲧⲁϩⲟϥ ⲉⲣⲁⲧϥ̅ ϩⲛ̅ ⲧⲙⲏⲧⲉ ⲙ̅ⲡⲗⲁⲟⲥ ⲁⲩⲱ ⲁϥϫⲓⲥⲉ ⲉⲡⲗⲁⲟⲥ ⲧⲏⲣϥ̅. ⲛ̅ⲟⲩϩⲟⲩⲉ ϣⲓ̈ⲏ ⲛ̅ⲛⲁϩⲃⲉ.	And he ran and took him thence, and he set him in the midst of the people; and he was higher than all the people by his shoulders and upwards.	καὶ ἔδραµεν καὶ λαµβάνει αὐτὸν ἐκεῖθεν καὶ κατέστησεν ἐν µέσῳ τοῦ λαοῦ, καὶ ὑψώθη ὑπὲρ πάντα τὸν λαὸν ὑπὲρ ὠµίαν καὶ ἐπάνω.						
First Samuel	10	10	24	OT	1. OT	Historical Books	2. Historical Books	02. Historical Books	04. First Samuel		ⲡⲉϫⲉ ⲥⲁⲙⲟⲩⲏⲗ ⲉϩⲟⲩⲛ ϩⲙ̅ ⲡⲗⲁⲟⲥ ⲧⲏⲣϥ̅. ϫⲉ ⲉⲛⲉ ⲁⲧⲉⲧⲛ̅ⲛⲁⲩ ⲉⲡⲉⲛⲧⲁ ⲡϫⲟⲉⲓⲥ ⲥⲟⲧⲡϥ̅ ⲛⲁϥ. ϫⲉ ⲙⲛ̅ ⲡⲉⲧⲧⲛ̅ⲧⲱⲛ ⲉⲣⲟϥ ⲛ̅ϩⲏⲧ ⲧⲏⲩⲧⲛ̅ ⲧⲏⲣⲧⲛ̅. ⲁⲩⲱ ⲡⲗⲁⲟⲥ ⲧⲏⲣϥ̅. ⲁⲩⲉⲓⲙⲉ. ⲁⲩⲱ ⲁⲩⲱϣ ⲉⲃⲟⲗ ⲉⲩϫⲱ ⲙ̅ⲙⲟⲥ ϫⲉ ⲙⲁⲣⲉ ⲡⲣ̅ⲣⲟ ⲱⲛϩ̅.	And Samuel said to all the people, Have ye seen whom the Lord has chosen to himself, that there is none like to him among you all? And all the people took notice, and said, Let the king live!	καὶ εἶπεν Σαµουηλ πρὸς πάντα τὸν λαόν Εἰ ἑοράκατε ὃν ἐκλέλεκται ἑαυτῷ κύριος, ὅτι οὐκ ἔστιν αὐτῷ ὅµοιος ἐν πᾶσιν ὑµῖν; καὶ ἔγνωσαν πᾶς ὁ λαὸς καὶ εἶπαν Ζήτω ὁ βασιλεύς.						
First Samuel	10	10	25	OT	1. OT	Historical Books	2. Historical Books	02. Historical Books	04. First Samuel		ⲁⲩⲱ ⲥⲁⲙⲟⲩⲏⲗ ⲁϥⲧⲁⲩⲟ ⲉⲡⲗⲁⲟⲥ ⲧⲏⲣϥ̅ ⲙ̅ⲡⲇⲓⲕⲁⲓⲱⲙⲁ ⲛ̅ⲧⲙⲛ̅ⲧⲣ̅ⲣⲟ. ⲁⲩⲱ ⲁϥⲥⲁϩϥ ⲉⲩϫⲱⲱⲙⲉ. ⲁϥⲕⲁⲁϥ ⲙ̅ⲡⲙⲧⲟ ⲉⲃⲟⲗ ⲙ̅ⲡϫⲟⲉⲓⲥ. ⲥⲁⲙⲟⲩⲏⲗ ⲇⲉ ⲁϥⲕⲱ ⲉⲃⲟⲗ ⲙⲡⲗⲁⲟⲥ ⲧⲏⲣϥ̅ ⲁ ⲡⲟⲩⲁ ⲡⲟⲩⲁ ⲃⲱⲕ ⲉϩⲣⲁⲓ̈ ⲉⲡⲉϥⲙⲁ.	And Samuel told the people the manner of the king, and wrote it in a book, and set it before the Lord: and Samuel sent away all the people, and each went to his place.	καὶ εἶπεν Σαµουηλ πρὸς τὸν λαὸν τὸ δικαίωµα τοῦ βασιλέως καὶ ἔγραψεν ἐν βιβλίῳ καὶ ἔθηκεν ἐνώπιον κυρίου. καὶ ἐξαπέστειλεν Σαµουηλ πάντα τὸν λαόν, καὶ ἀπῆλθεν ἕκαστος εἰς τὸν τόπον αὐτοῦ.						
First Samuel	10	10	26	OT	1. OT	Historical Books	2. Historical Books	02. Historical Books	04. First Samuel		ⲥⲁⲟⲩⲗ ϩⲱⲱϥ. ⲁϥⲃⲱⲕ ⲉϩⲣⲁⲓ̈ ⲉⲡⲉϥⲏⲓ̈ ⲉⲕⲁⲃⲁⲁ. ⲁⲩⲱ ϩⲛ̅ⲣⲱⲙⲉ ⲛ̅ϫⲱⲱⲣⲉ. ⲛⲁⲓ̈ ⲛ̅ⲧⲁ ⲡⲛⲟⲩⲧⲉ ⲧⲁⲁⲥ ⲉϩⲣⲁⲓ̈ ⲉⲡⲉⲩϩⲏⲧ. ⲁⲩⲃⲱⲕ ⲁⲩⲟⲩⲁϩⲟⲩ ⲛ̅ⲥⲁ ⲥⲁⲟⲩⲗ.	And Saul departed to his house to Gabaa; and there went with Saul mighty men whose hearts God had touched.	καὶ Σαουλ ἀπῆλθεν εἰς τὸν οἶκον αὐτοῦ εἰς Γαβαα· καὶ ἐπορεύθησαν υἱοὶ δυνάµεων, ὧν ἥψατο κύριος καρδίας αὐτῶν, µετὰ Σαουλ.						
First Samuel	10	10	27	OT	1. OT	Historical Books	2. Historical Books	02. Historical Books	04. First Samuel		ϩⲛ̅ⲣⲱⲙⲉ ⲇⲉ ⲛ̅ⲗⲟⲓⲙⲟⲥ ⲁⲩⲟⲩⲱⲛ ⲉⲣⲱⲟⲩ ⲉⲩϫⲱ ⲙ̅ⲙⲟⲥ. ϫⲉ ⲛⲓⲙ ⲡⲉⲧⲛⲁⲛⲁϩⲙⲉⲛ. ⲡⲁⲓ̈ ⲡⲉ. ⲁⲩϯⲥⲱϣ ⲛⲁϥ ⲁⲩⲱ ⲙ̅ⲡⲟⲩⲉⲛ ⲇⲱⲣⲟⲛ ⲛⲁϥ.	But evil men said, Who is this man that shall save us? and they despised him, and brought him no gifts.	καὶ υἱοὶ λοιµοὶ εἶπαν Τί σώσει ἡµᾶς οὗτος; καὶ ἠτίµασαν αὐτὸν καὶ οὐκ ἤνεγκαν αὐτῷ δῶρα.						
First Samuel	11	11	1	OT	1. OT	Historical Books	2. Historical Books	02. Historical Books	04. First Samuel		ⲁⲥϣⲱⲡⲉ ⲇⲉ ⲙⲛ̅ⲛ̅ⲥⲁ ⲟⲩⲉⲃⲟⲧ. ⲁϥⲓ̈ ⲉϩⲣⲁⲓ̈ ⲛ̅ϭⲓ ⲛⲁⲁⲥ ⲡⲁⲙⲁⲛⲓⲧⲏⲥ. ⲁϥⲃⲱⲕ ⲉϩⲣⲁⲓ̈ ⲉⲣⲉⲛ ⲓⲁⲃⲓⲥ ⲛ̅ⲧⲉ ⲅⲁⲗⲁⲁⲇ. ⲛ̅ⲣⲱⲙⲉ ⲇⲉ ⲧⲏⲣⲟⲩ ⲛ̅ⲓⲁⲃⲓⲥ. ⲡⲉϫⲁⲩ ⲛⲁⲁⲥ (sic) ⲡⲁⲙⲁⲛⲓⲧⲏⲥ. ϫⲉ ⲥⲙⲓ̈ⲛⲉ ⲛⲙ̅ⲙⲁⲛ ⲛ̅ⲟⲩⲇⲓⲁⲑⲏⲕⲏ. ⲛ̅ⲧⲉⲛⲣ̅ϩⲙ̅ϩⲁⲗ ⲛⲁⲕ.	And it came to pass about a month after this, that Naas the Ammanite went up, and encamped against Jabis Galaad: and all the men of Jabis said to Naas the Ammanite, Make a covenant with us, and we will serve thee.	Καὶ ἐγενήθη ὡς µετὰ µῆνα καὶ ἀνέβη Ναας ὁ Αµµανίτης καὶ παρεµβάλλει ἐπὶ Ιαβις Γαλααδ. καὶ εἶπον πάντες οἱ ἄνδρες Ιαβις πρὸς Ναας τὸν Αµµανίτην Διάθου ἡµῖν διαθήκην, καὶ δουλεύσοµέν σοι.						
First Samuel	11	11	2	OT	1. OT	Historical Books	2. Historical Books	02. Historical Books	04. First Samuel		ⲡⲉϫⲉ ⲛⲁⲁⲥ ⲡⲁⲙⲁⲛⲓⲧⲏⲥ ⲛⲁⲩ. ϫⲉ ϯⲛⲁⲥⲙⲓ̈ⲛⲉ ⲛⲙ̅ⲙⲏⲧⲛ̅ ⲛ̅ⲧⲇⲓⲁⲑⲩⲕⲏ. ϩⲙ̅ ⲡⲧⲣⲉ ⲡⲟⲩⲁ ⲡⲟⲩⲁ ⲙ̅ⲙⲱⲧⲛ̅. ⲡⲱⲣⲕ̅ ⲙ̅ⲡⲉϥⲃⲁⲗ ⲛ̅ⲟⲩⲛⲁⲙ. ϫⲉⲕⲁⲥ ⲉⲓ̈ⲉⲕⲱ ⲛ̅ⲟⲩⲛⲟϭⲛⲉϭ ⲉϫⲙ̅ ⲡⲓⲏ̅ⲗ̅.	Naas the Ammanite said to them, On these terms will I make a covenant with you, that I should put out all your right eyes, and I will lay a reproach upon Israel.	καὶ εἶπεν πρὸς αὐτοὺς Ναας ὁ Αµµανίτης Ἐν ταύτῃ διαθήσοµαι ὑµῖν διαθήκην, ἐν τῷ ἐξορύξαι ὑµῶν πάντα ὀφθαλµὸν δεξιόν, καὶ θήσοµαι ὄνειδος ἐπὶ Ισραηλ.						
First Samuel	11	11	3	OT	1. OT	Historical Books	2. Historical Books	02. Historical Books	04. First Samuel		ⲡⲉϫⲉ ⲛ̅ⲣⲱⲙⲉ ⲛ̅ⲓⲁⲃⲓⲥ ⲛⲁϥ. ϫⲉ ⲕⲁⲁⲛ ⲛ̅ⲥⲁϣϥ̅ ⲛ̅ϩⲟⲟⲩ ⲁⲩⲱ ⲧⲉⲛⲛⲁϫⲟⲟⲩ ⲉⲃⲟⲗ ⲛ̅ϩⲛ̅ⲃⲁⲓ̈ϣⲓ̈ⲛⲉ. ⲉⲛⲧⲟϣ ⲧⲏⲣⲟⲩ ⲙ̅ⲡⲓⲏ̅ⲗ̅. ⲁⲩⲱ ⲉⲩⲧⲙ̅ⲛⲁϩⲙⲉⲛ ⲧⲛ̅ⲛⲏⲩ ⲉⲃⲟⲗ ⲛⲏⲧⲛ̅.	And the men of Jabis say to him, Allow us seven days, and we will send messengers into all the coasts of Israel: if there should be no one to deliver us, we will come out to you.	καὶ λέγουσιν αὐτῷ οἱ ἄνδρες Ιαβις Ἄνες ἡµῖν ἑπτὰ ἡµέρας, καὶ ἀποστελοῦµεν ἀγγέλους εἰς πᾶν ὅριον Ισραηλ· ἐὰν µὴ ᾖ ὁ σῴζων ἡµᾶς, ἐξελευσόµεθα πρὸς ὑµᾶς.						
First Samuel	11	11	4	OT	1. OT	Historical Books	2. Historical Books	02. Historical Books	04. First Samuel		ⲁⲩⲱ ⲛ̅ⲃⲁⲓ̈ϣⲓ̈ⲛⲉ ⲛ̅ⲓⲁⲃⲓⲥ. ⲁⲩⲉⲓ ⲉⲃⲟⲗ ⲉⲅⲁⲃⲁⲁ. ⲉⲣⲁⲧϥ̅ ⲛ̅ⲥⲁⲟⲩⲗ. ⲁⲩⲧⲁⲩⲟ ⲛ̅ⲛⲉϣⲁϫⲉ ⲉϩⲣⲁⲓ̈ ⲉⲙⲙⲁⲁϫⲉ ⲙ̅ⲡⲗⲁⲟⲥ. ⲁⲩⲱ ⲡⲗⲁⲟⲥ ⲧⲏⲣϥ̅. ⲁⲩϥⲓ̈ ϩⲣⲁⲩ ⲉⲃⲟⲗ ⲁⲩⲣⲓⲙⲉ.	And the messengers came to Gabaa to Saul, and they speak the words into the ears of the people; and all the people lifted up their voice, and wept.	καὶ ἔρχονται οἱ ἄγγελοι εἰς Γαβαα πρὸς Σαουλ καὶ λαλοῦσιν τοὺς λόγους εἰς τὰ ὦτα τοῦ λαοῦ, καὶ ἦραν πᾶς ὁ λαὸς τὴν φωνὴν αὐτῶν καὶ ἔκλαυσαν.						
First Samuel	11	11	5	OT	1. OT	Historical Books	2. Historical Books	02. Historical Books	04. First Samuel		ⲥⲁⲟⲩⲗ ⲇⲉ ⲙⲛ̅ⲛ̅ⲥⲁ ⲡⲛⲁⲩ ⲛ̅ϩⲧⲟⲟⲩⲉ. ⲁϥⲓ̈ ⲉⲃⲟⲗ ϩⲛ̅ ⲧⲥⲱϣⲉ ⲡⲉϫⲉ ⲥⲁⲟⲩⲗ ϫⲉ ⲉⲧⲃⲉⲟⲩ ⲡⲗⲁⲟⲥ ⲣⲓⲙⲉ. ⲁⲩⲧⲁⲩⲟ ⲉⲣⲟϥ ⲛ̅ⲛⲉϣⲁϫⲉ ⲧⲏⲣⲟⲩ ⲛ̅ⲛ̅ϣⲏⲣⲉ ⲛ̅ⲓⲁⲃⲓⲥ.	And, behold, Saul came after the early morning out of the field: and Saul said, Why does the people week? and they tell him the words of the men of Jabis.	καὶ ἰδοὺ Σαουλ ἤρχετο µετὰ τὸ πρωὶ ἐξ ἀγροῦ, καὶ εἶπεν Σαουλ Τί ὅτι κλαίει ὁ λαός; καὶ διηγοῦνται αὐτῷ τὰ ῥήµατα τῶν υἱῶν Ιαβις.						
First Samuel	11	11	6	OT	1. OT	Historical Books	2. Historical Books	02. Historical Books	04. First Samuel		ⲁⲩⲱ ⲡⲉⲡⲛ̅ⲁ̅ ⲙ̅ⲡϫⲟⲉⲓⲥ ⲁϥⲃⲱϭⲉ ⲉϫⲛ̅ ⲥⲁⲟⲩⲗ. ⲛ̅ⲧⲉⲣⲉϥⲥⲱⲧⲙ̅ ⲉⲛⲉⲓ̈ϣⲁϫⲉ. ⲧⲉϥⲟⲣⲅⲏ ⲁⲥⲙⲟⲩϩ ⲉⲙⲁⲧⲉ.	And the Spirit of the Lord came upon Saul when he heard these words, and his anger was greatly kindled against them.	καὶ ἐφήλατο πνεῦµα κυρίου ἐπὶ Σαουλ, ὡς ἤκουσεν τὰ ῥήµατα ταῦτα, καὶ ἐθυµώθη ἐπ’ αὐτοὺς ὀργὴ αὐτοῦ σφόδρα.						
First Samuel	11	11	7	OT	1. OT	Historical Books	2. Historical Books	02. Historical Books	04. First Samuel		ⲁⲩⲱ ⲁϥϫⲓ̈ ⲛ̅ⲉϩⲉ ⲥⲛ̅ⲧⲉ ⲁϥⲁⲁⲩ ⲛ̅ϣⲁⲩ ϣⲁⲩ. ⲁⲩϫⲟⲟⲩⲥⲟⲩ ⲉⲃⲟⲗ ⲉⲛⲧⲟϣ ⲧⲏⲣⲟⲩ ⲙ̅ⲡⲓⲏ̅ⲗ̅. ⲛ̅ⲧⲟⲟⲧⲟⲩ ⲛ̅ⲛⲉⲃⲁⲓ̈ϣⲓ̈ⲛⲉ ⲉϥϫⲱ ⲙ̅ⲙⲟⲥ. ϫⲉ ⲡⲉⲧⲛ̅ϥⲛⲁⲉⲓ ⲁⲛ ⲉⲃⲟⲗ ⲉⲟⲩⲁϩϥ ⲛ̅ⲥⲁ ⲥⲁⲟⲩⲗ. ⲁⲩⲱ ⲛ̅ⲥⲁ ⲥⲁⲙⲟⲩⲏⲗ. ⲉⲩⲉⲉⲓⲣⲉ ⲛ̅ⲧⲉⲓ̈ϩⲉ ϩⲱⲱϥ ⲛ̅ⲛⲉϥⲉⲟⲟⲩ. ⲁⲩⲱ ⲑⲟⲧⲉ ⲙ̅ⲡϫⲟⲉⲓⲥ. ⲁⲥⲉⲓ ⲉϩⲣⲁⲓ̈ ⲉϫⲙ̅ ⲡⲗⲁⲟⲥ ⲙ̅ⲡⲓⲏ̅ⲗ̅. ⲁⲩⲱ ⲁⲩⲱϣ ⲉⲃⲟⲗ ϩⲓ̈ⲟⲩⲥⲟⲡ ⲧⲏⲣⲟⲩ ⲛ̅ⲑⲉ ⲛ̅ⲟⲩⲣⲱⲙⲉ ⲛ̅ⲟⲩⲱⲧ.	And he took two cows, and cut them in pieces, and sent them into all the coasts of Israel by the hand of messengers, saying, Whoso comes not forth after Saul and after Samuel, so shall they do to his oxen: and a transport from the Lord came upon the people of Israel, and they came out to battle as one man.	καὶ ἔλαβεν δύο βόας καὶ ἐµέλισεν αὐτὰς καὶ ἀπέστειλεν εἰς πᾶν ὅριον Ισραηλ ἐν χειρὶ ἀγγέλων λέγων Ὃς οὐκ ἔστιν ἐκπορευόµενος ὀπίσω Σαουλ καὶ ὀπίσω Σαµουηλ, κατὰ τάδε ποιήσουσιν τοῖς βουσὶν αὐτοῦ. καὶ ἐπῆλθεν ἔκστασις κυρίου ἐπὶ τὸν λαὸν Ισραηλ, καὶ ἐβόησαν ὡς ἀνὴρ εἷς.						
First Samuel	11	11	8	OT	1. OT	Historical Books	2. Historical Books	02. Historical Books	04. First Samuel		ⲁⲩⲱ ⲁⲃⲓⲙⲉⲥⲉⲕ ⲁϥϭⲙ̅ ⲡⲉⲩϣⲓ̈ⲛⲉ ϩⲛ̅ ⲃⲁⲙⲁ. ⲛ̅ⲣⲱⲙⲉ ⲇⲉ ⲧⲏⲣⲟⲩ ⲙ̅ⲡⲓⲏ̅ⲗ̅ ⲉⲩⲛⲁⲣ̅ ⲥⲉ ⲛ̅ⲧⲃⲁ ⲙ̅ⲙⲏⲏϣⲉ. ⲁⲩⲱ ⲛ̅ⲣⲱⲙⲉ ⲛ̅ⲓ̈ⲟⲩⲇⲁ ⲉⲩⲛⲁⲣ ⲥⲁϣϥ̅ ⲛ̅ⲧⲃⲁ ⲙ̅ⲙⲏⲏϣⲉ.	And he reviews them at Bezec in Bama, every man of Israel six hundred thousand, and the men of Juda seventy thousand.	καὶ ἐπισκέπτεται αὐτοὺς Αβιεζεκ ἐν Βαµα, πᾶν ἄνδρα Ισραηλ ἑξακοσίας χιλιάδας καὶ ἄνδρας Ιουδα ἑβδοµήκοντα χιλιάδας.						
First Samuel	11	11	9	OT	1. OT	Historical Books	2. Historical Books	02. Historical Books	04. First Samuel		ⲡⲉϫⲁϥ ⲛ̅ⲛⲉⲃⲁⲓ̈ϣⲓ̈ⲛⲉ ⲛ̅ⲧⲁⲩⲉⲓ. ϫⲉ ⲛⲁⲓ̈ ⲛⲉⲧⲉⲧⲛⲁϫⲟⲟⲩ ⲛ̅ⲛ̅ⲣⲱⲙⲉ ⲛ̅ⲓⲁⲃⲓⲥ. ϫⲉ ⲣⲁⲥⲧⲉ ⲡⲟⲩϫⲁⲓ̈ ⲛⲁϣⲱⲡⲉ ⲛⲏⲧⲛ̅ ϩⲙ̅ ⲡⲧⲣⲉ ⲡⲣⲏ ϯ ⲛ̅ⲧⲉϥϩⲙ̅ⲙⲉ. ⲁⲩⲱ ⲛ̅ⲃⲁⲓ̈ϣⲓ̈ⲛⲉ ⲁⲩⲉⲓ ⲉϩⲣⲁⲓ̈ ⲉⲧⲉⲩⲡⲟⲗⲓⲥ. ⲁⲩⲧⲁⲩⲉ ⲉⲛ̅ϣⲁϫⲉ ⲉⲛⲉⲣⲱⲙⲉ ⲛ̅ⲓⲁⲃⲓⲥ ⲁⲩⲟⲩⲛⲟϥ.	And he said to the messengers that came, Thus shall ye say to the men of Jabis, To-morrow ye shall have deliverance when the sun is hot; and the messengers came to the city, and told the men of Jabis, and they rejoiced.	καὶ εἶπεν τοῖς ἀγγέλοις τοῖς ἐρχοµένοις Τάδε ἐρεῖτε τοῖς ἀνδράσιν Ιαβις Αὔριον ὑµῖν ἡ σωτηρία διαθερµάναντος τοῦ ἡλίου. καὶ ἦλθον οἱ ἄγγελοι εἰς τὴν πόλιν καὶ ἀπαγγέλλουσιν τοῖς ἀνδράσιν Ιαβις, καὶ εὐφράνθησαν.						
First Samuel	11	11	10	OT	1. OT	Historical Books	2. Historical Books	02. Historical Books	04. First Samuel		ⲛ̅ⲣⲱⲙⲉ ⲇⲉ ⲛ̅ⲓⲁⲃⲓⲥ. ⲡⲉϫⲁⲩ ⲛⲁⲁⲥ (sic) ⲡⲁⲙⲁⲛⲓⲧⲏⲥ. ϫⲉ ⲣⲁⲥⲧⲉ ⲧⲛ̅ⲛⲏⲩ ⲉⲃⲟⲗ ⲛⲏⲧⲛ̅. ⲛ̅ⲧⲛ̅ⲉⲓⲣⲉ ⲙ̅ⲡⲉⲧⲉⲣⲁⲛⲏⲧⲛ̅ ⲙ̅ⲡⲉⲧⲉⲛⲉⲙⲧⲟ ⲉⲃⲟⲗ.	And the men of Jabis said to Naas the Ammanite, To-morrow we will come forth to you, and ye shall do to us what seems good in your sight.	καὶ εἶπαν οἱ ἄνδρες Ιαβις πρὸς Ναας τὸν Αµµανίτην Αὔριον ἐξελευσόµεθα πρὸς ὑµᾶς, καὶ ποιήσετε ἡµῖν τὸ ἀγαθὸν ἐνώπιον ὑµῶν.						
First Samuel	11	11	11	OT	1. OT	Historical Books	2. Historical Books	02. Historical Books	04. First Samuel		ⲁⲥϣⲱⲡⲉ ⲇⲉ ⲙⲛ̅ⲛ̅ⲥⲁ ⲡⲉϥⲣⲁⲥⲧⲉ. ⲥⲁⲟⲩⲗ. ⲁϥⲕⲱ ⲙ̅ⲡⲗⲁⲟⲥ ⲛ̅ϣⲟⲙⲛ̅ⲧ. ⲛ̅ⲧⲁⲅⲙⲁ. ⲁⲩⲱ ⲁϥⲙⲟⲟϣⲉ ⲉϩⲟⲩⲛ ⲉⲧⲡⲁⲣⲉⲙⲃⲟⲗⲏ ⲛ̅ϣⲱⲣⲡ ⲙ̅ⲡⲛⲁⲩ ⲛ̅ϩⲧⲟⲟⲩⲉ. ⲁⲩϩⲓ̈ⲟⲩⲉ ⲛ̅ⲥⲁ ⲛ̅ϣⲏⲣⲉ ⲛ̅ⲁⲙⲙⲁⲛ. ϣⲁⲛⲧⲉ ⲡⲣⲏ ϯ ⲛ̅ⲧⲉϥϩⲙ̅ⲙⲉ. ⲁⲩⲱ ⲛⲉⲛⲧⲁⲩⲥⲉⲉⲡⲉ ⲛ̅ϩⲏⲧⲟⲩ ⲁⲩϫⲱⲱⲣⲉ ⲉⲃⲟⲗ. ⲙ̅ⲡⲉⲥⲛⲁⲩ ⲗⲁⲁⲩ ⲛ̅ϩⲏⲧⲟⲩ ϭⲱ ϩⲓ̈ ⲛⲉⲩⲉⲣⲏⲩ.	And it came to pass on the morrow, that Saul divided the people into three companies, and they go into the midst of the camp in the morning watch, and they smote the children of Ammon until the day was hot; at it came to pass that those who were left were scattered, and there were not left among them two together.	καὶ ἐγενήθη µετὰ τὴν αὔριον καὶ ἔθετο Σαουλ τὸν λαὸν εἰς τρεῖς ἀρχάς, καὶ εἰσπορεύονται µέσον τῆς παρεµβολῆς ἐν φυλακῇ τῇ πρωινῇ καὶ ἔτυπτον τοὺς υἱοὺς Αµµων, ἕως διεθερµάνθη ἡ ἡµέρα, καὶ ἐγενήθησαν οἱ ὑπολελειµµένοι διεσπάρησαν, καὶ οὐχ ὑπελείφθησαν ἐν αὐτοῖς δύο κατὰ τὸ αὐτό.						
First Samuel	11	11	12	OT	1. OT	Historical Books	2. Historical Books	02. Historical Books	04. First Samuel		ⲡⲉϫⲉ ⲡⲗⲁⲟⲥ ⲛ̅ⲥⲁⲙⲟⲩⲏⲗ. ϫⲉ ⲛⲓⲙ ⲡⲉ ⲛ̅ⲧⲁϥϫⲟⲟⲥ. ϫⲉ ⲛ̅ⲥⲁⲟⲩⲗ ⲛⲁⲣ̅ⲣ̅ⲣⲟ ⲁⲛ ⲉϩⲣⲁⲓ̈ ⲉϫⲱⲛ. ⲡⲁⲣⲁⲇⲓⲇⲟⲩ ⲛ̅ⲛ̅ⲣⲱⲙⲉ ⲉⲧⲟⲟⲧⲛ̅. ⲛ̅ⲧⲛ̅ⲙⲟⲟⲩⲧⲟⲩ.	And the people said to Samuel, Who has said that Saul shall not reign over us? Give up the men, and we will put them to death.	καὶ εἶπεν ὁ λαὸς πρὸς Σαµουηλ Τίς ὁ εἴπας ὅτι Σαουλ οὐ βασιλεύσει ἡµῶν; παράδος τοὺς ἄνδρας, καὶ θανατώσοµεν αὐτούς.						
First Samuel	11	11	13	OT	1. OT	Historical Books	2. Historical Books	02. Historical Books	04. First Samuel		ⲡⲉϫⲉ ⲥⲁⲟⲩⲗ. ϫⲉ ⲙⲛ̅ ⲗⲁⲁⲩ ⲛⲁⲙⲟⲩ ⲙ̅ⲡⲟⲟⲩ ⲛ̅ϩⲟⲟⲩ. ϫⲉ ⲡⲟⲟⲩ ⲡⲉ ⲛ̅ⲧⲁ ⲡϫⲟⲉⲓⲥ ⲉⲓⲣⲉ ⲙ̅ⲡⲓ̈ⲟⲩϫⲁⲓ̈ ϩⲙ̅ ⲡⲓⲏ̅ⲗ̅.	And Saul said, No man shall die this day, for to-day the Lord has wrought deliverance in Israel.	καὶ εἶπεν Σαουλ Οὐκ ἀποθανεῖται οὐδεὶς ἐν τῇ ἡµέρᾳ ταύτῃ, ὅτι σήµερον κύριος ἐποίησεν σωτηρίαν ἐν Ισραηλ.						
First Samuel	11	11	14	OT	1. OT	Historical Books	2. Historical Books	02. Historical Books	04. First Samuel		ⲥⲁⲙⲟⲩⲏⲗ ⲇⲉ ⲡⲉϫⲁϥ ⲙ̅ⲡⲗⲁⲟⲥ. ϫⲉ ⲙⲁⲣⲟⲛ ⲉϩⲣⲁⲓ̈ ⲉⲅⲁⲗⲅⲁⲗⲁ. ⲛ̅ⲧⲁⲧⲁϩⲟ ⲉⲣⲁⲧⲥ̅. ⲛ̅ⲧⲙⲛ̅ⲧⲣ̅ⲣⲟ ϩⲙ̅ ⲡⲙⲁ ⲉⲧⲙ̅ⲙⲁⲩ.	And Samuel spoke to the people, saying, Let us go to Galgala, and there renew the kingdom.	Καὶ εἶπεν Σαµουηλ πρὸς τὸν λαὸν λέγων Πορευθῶµεν εἰς Γαλγαλα καὶ ἐγκαινίσωµεν ἐκεῖ τὴν βασιλείαν.						
