book	chapter	chapter-zfilled	verse	testament	testament-indexed	section	section-indexed	section-indexed-no-testament	book-indexed	Bohairic	Sahidic	English	Greek	Fayyumic	Akhmimic	OldBohairic	Mesokemic	DialectP	Lycopolitan
First Samuel	14	14	25	OT	1. OT	Historical Books	2. Historical Books	02. Historical Books	04. First Samuel		ⲛⲉⲣⲉ ⲟⲩⲙⲁ ⲛ̅ϣⲏⲛ ⲇⲉ ⲛ̅ϯϩⲙⲉϥ ⲛ̅ⲉⲃⲓⲱ ϣⲟⲟⲡ ⲙ̅ⲡⲙⲧⲟ ⲉⲃⲟⲗ ⲛ̅ⲧⲥⲱϣⲉ.	And Jaal was a wood abounding in swarms of bees on the face of the ground.	καὶ πᾶσα ἡ γῆ ἠρίστα. καὶ ιααρ δρυµὸς ἦν µελισσῶνος κατὰ πρόσωπον τοῦ ἀγροῦ,						
First Samuel	14	14	26	OT	1. OT	Historical Books	2. Historical Books	02. Historical Books	04. First Samuel		ⲁⲩⲱ ⲡⲗⲁⲟⲥ ⲁϥⲧⲁⲁϥ ⲉϩⲣⲁⲓ̈. ⲉⲡⲙⲁ ⲛ̅ϯϩⲙⲉϥ ⲛ̅ⲉⲃⲓⲱ. ⲛⲉⲣⲉ ⲡⲗⲁⲟⲥ ⲇⲉ ⲙⲟⲟϣⲉ ⲉϥϣⲁϫⲉ. ⲉⲙⲛ̅ ⲗⲁⲁⲩ ⲕⲧⲟ ⲛ̅ⲧⲉϥϭⲓϫ ⲉϩⲟⲩⲛ ⲉⲧⲉϥⲧⲁⲡⲣⲟ ϫⲉ ⲡⲗⲁⲟⲥ ⲁϥⲣ̅ϩⲟⲧⲉ ⲛ̅ϩⲏⲧϥ ⲙ̅ⲡⲁⲛⲁϣ. ⲙ̅ⲡϫⲟⲉⲓⲥ.	And the people went into the place of the bees, and, behold, they continued speaking; and, behold, there was none that put his hand to his mouth, for the people feared the oath of the Lord.	καὶ εἰσῆλθεν ὁ λαὸς εἰς τὸν µελισσῶνα, καὶ ἰδοὺ ἐπορεύετο λαλῶν, καὶ ἰδοὺ οὐκ ἦν ἐπιστρέφων τὴν χεῖρα αὐτοῦ εἰς τὸ στόµα αὐτοῦ, ὅτι ἐφοβήθη ὁ λαὸς τὸν ὅρκον κυρίου.						
First Samuel	14	14	27	OT	1. OT	Historical Books	2. Historical Books	02. Historical Books	04. First Samuel		ⲓ̈ⲱⲛⲁⲑⲁⲛ ⲇⲉ ⲙ̅ⲡⲉϥⲥⲱⲧⲙ ϫⲉ ⲁ ⲡⲉϥⲉⲓⲱⲧ ⲧⲁⲣⲕⲉ ⲡⲗⲁⲟⲥ. ⲁⲩⲱ ⲓ̈ⲱⲛⲁⲑⲁⲛ ⲁϥⲥⲟⲩⲧⲛ̅ ϩⲧⲏϥ ⲉⲃⲟⲗ ⲙ̅ⲡⲉϥϭⲉⲣⲱⲃ ⲉⲧϩⲛ̅ ⲧⲉϥϭⲓϫ. ⲁϥⲥⲟⲡϥ̅ ϩⲙ̅ ⲡⲙⲟⲩⲗϩ ⲛ̅ⲉⲃⲓⲱ. ⲁϥⲕⲧⲟ ⲛ̅ⲧⲉϥϭⲓϫ ⲉϩⲟⲩⲛ ⲉⲣⲱϥ. ⲁ ⲛⲉϥⲃⲁⲗ ⲛⲁⲩ ⲁⲩϫⲱⲧⲉ.	And Jonathan had not heard when his father adjured the people; and he reached forth the end of the staff that was in his hand, an dipped it into the honeycomb, and returned his hand to his mouth, and his eyes recovered their sight.	καὶ Ιωναθαν οὐκ ἀκηκόει ἐν τῷ ὁρκίζειν τὸν πατέρα αὐτοῦ τὸν λαόν· καὶ ἐξέτεινεν τὸ ἄκρον τοῦ σκήπτρου αὐτοῦ τοῦ ἐν τῇ χειρὶ αὐτοῦ καὶ ἔβαψεν αὐτὸ εἰς τὸ κηρίον τοῦ µέλιτος καὶ ἐπέστρεψεν τὴν χεῖρα αὐτοῦ εἰς τὸ στόµα αὐτοῦ, καὶ ἀνέβλεψαν οἱ ὀφθαλµοὶ αὐτοῦ.						
First Samuel	14	14	28	OT	1. OT	Historical Books	2. Historical Books	02. Historical Books	04. First Samuel		ⲟⲩⲁ ⲇⲉ ⲉⲃⲟⲗ ϩⲙ̅ ⲡⲗⲁⲟⲥ ⲛⲉϥϫⲱ ⲙ̅ⲙⲟⲥ ⲛⲁϥ. ϫⲉ ϩⲛ̅ ⲟⲩⲁⲛⲁϣ. ⲡⲉⲕⲉⲓⲱⲧ. ⲁϥⲧⲁⲣⲕⲉ ⲡⲗⲁⲟⲥ ⲉϥϫⲱ ⲙ̅ⲙⲟⲥ. ϫⲉ ϥⲥϩⲟⲩⲟⲣⲧ̅ ⲛ̅ϭⲓ ⲟⲩⲣⲱⲙⲉ ⲉⲧⲛⲁⲟⲩⲉⲙ ⲟⲉⲓⲕ ⲙ̅ⲡⲟⲟⲩ. ⲡⲗⲁⲟⲥ ⲇⲉ ⲁϥⲥⲱϣⲙ̅.	And one of the people answered and said, Thy father solemnly adjured the people, saying, Cursed is the man who shall eat bread to-day. And the people were very faint,	καὶ ἀπεκρίθη εἷς ἐκ τοῦ λαοῦ καὶ εἶπεν Ὁρκίσας ὥρκισεν ὁ πατήρ σου τὸν λαὸν λέγων Ἐπικατάρατος ὁ ἄνθρωπος, ὃς φάγεται ἄρτον σήµερον, καὶ ἐξελύθη ὁ λαός.						
First Samuel	14	14	29	OT	1. OT	Historical Books	2. Historical Books	02. Historical Books	04. First Samuel		ⲁⲩⲱ ⲓ̈ⲱⲛⲁⲑⲁⲛ ⲁϥⲉⲓⲙⲉ ⲡⲉϫⲁϥ ϫⲉ ⲡⲁⲉⲓⲱⲧ ⲁϥⲑⲉⲙⲕⲉ ⲡⲕⲁϩ. ⲁⲛⲁⲩ ⲉⲑⲉ ⲛ̅ⲧⲁ ⲛⲁⲃⲁⲗ ϫⲱⲧⲉ ⲉⲃⲟⲗ ϫⲉ ⲁⲓ̈ⲧⲉⲡ ⲟⲩϣⲏⲙ ⲉⲃⲟⲗ ϩⲙ̅ ⲡⲓ̈ⲉⲃⲓ̈ⲱ	and Jonathan knew it, and said, My father has destroyed the land: see how my eyes have received sight now that I have tasted a little of this honey.	καὶ ἔγνω Ιωναθαν καὶ εἶπεν Ἀπήλλαχεν ὁ πατήρ µου τὴν γῆν· ἰδὲ δὴ ὅτι εἶδον οἱ ὀφθαλµοί µου, ὅτι ἐγευσάµην βραχὺ τοῦ µέλιτος τούτου·						
First Samuel	14	14	30	OT	1. OT	Historical Books	2. Historical Books	02. Historical Books	04. First Samuel		ⲉⲓ̈ⲉ ⲉⲛⲉ ⲛ̅ⲧⲁ ⲡⲗⲁⲟⲥ ϭⲉ ⲟⲩⲱⲙ. ϩⲙ̅ ⲟⲩⲱⲙ (sic) ⲙ̅ⲡⲟⲟⲩ. ⲉⲃⲟⲗ ϩⲛ̅ ⲛⲉϣⲱⲗ ⲛ̅ⲛⲉⲩϫⲁϫⲉ. ⲛⲁⲓ̈ ⲛ̅ⲧⲁϥϩⲉ ⲉⲣⲟⲟⲩ ⲧⲉⲛⲟⲩ. ⲛⲉⲣⲉ ⲧⲉⲡⲗⲏⲅⲏ ⲛⲁⲁϣⲁⲓ̈ ⲡⲉ ⲉϫⲛ̅ ⲛ̅ⲁⲗⲗⲟⲫⲩⲗⲟⲥ.	Surely if the people had this day eaten freely of the spoils of their enemies which they found, the slaughter among the Philistines would have been greater.	ἀλλ’ ὅτι εἰ ἔφαγεν ἔσθων ὁ λαὸς σήµερον τῶν σκύλων τῶν ἐχθρῶν αὐτῶν, ὧν εὗρεν, ὅτι νῦν ἂν µείζων ἦν ἡ πληγὴ ἐν τοῖς ἀλλοφύλοις.						
First Samuel	14	14	31	OT	1. OT	Historical Books	2. Historical Books	02. Historical Books	04. First Samuel		ⲁⲩⲱ ⲁϥⲡⲁⲧⲁⲥⲥⲉ ⲉⲃⲟⲗ ϩⲛ̅ ⲛ̅ⲁⲗⲗⲟⲫⲩⲗⲟⲥ ⲙ̅ⲡⲉϩⲟⲟⲩ ⲉⲧⲙ̅ⲙⲁⲩ. ϩⲙ̅ ⲙⲁⲭⲙⲁⲥ. ⲡⲗⲁⲟⲥ ⲇⲉ ⲁϥϩⲓ̈ⲥⲉ ⲉⲙⲁⲧⲉ.	And on that day he smote some of the Philistines in Machmas; and the people were very weary.	καὶ ἐπάταξεν ἐν τῇ ἡµέρᾳ ἐκείνῃ ἐκ τῶν ἀλλοφύλων ἐν Μαχεµας, καὶ ἐκοπίασεν ὁ λαὸς σφόδρα.						
First Samuel	14	14	32	OT	1. OT	Historical Books	2. Historical Books	02. Historical Books	04. First Samuel		ⲁⲩⲱ ⲡⲗⲁⲟⲥ. ⲁϥⲧⲁⲁϥ ⲉⲛ̅ϣⲱⲗ. ⲁ ⲡⲗⲁⲟⲥ ϫⲓ̈ ⲛ̅ϩⲛ̅ⲟϩⲉ ⲛ̅ⲉⲥⲟⲟⲩ. ⲙⲛ̅ ϩⲉⲛⲁϩⲟⲟⲩ. ⲁⲩⲱ ϩⲛ̅ⲕⲧⲏⲣ ⲛ̅ⲉϩⲉ. ⲁⲩϣⲱⲱⲧ ⲙ̅ⲙⲟⲟⲩ ϩⲓ̈ϫⲙ̅ ⲡⲕⲁϩ. ⲁⲩⲱ ⲡⲗⲁⲟⲥ. ⲛⲉϥⲟⲩⲱⲙ ⲙⲛ̅ ⲡⲉϥⲥⲛⲟϥ.	And the people turned to the spoil; and the people took flocks, and herds, and calves, and slew them on the ground, and the people ate with the blood.	καὶ ἐκλίθη ὁ λαὸς εἰς τὰ σκῦλα, καὶ ἔλαβεν ὁ λαὸς ποίµνια καὶ βουκόλια καὶ τέκνα βοῶν καὶ ἔσφαξεν ἐπὶ τὴν γῆν, καὶ ἤσθιεν ὁ λαὸς σὺν τῷ αἵµατι.						
First Samuel	14	14	33	OT	1. OT	Historical Books	2. Historical Books	02. Historical Books	04. First Samuel		ⲁⲩⲧⲁⲙⲉ ⲥⲁⲟⲩⲗ ⲇⲉ ⲉⲩϫⲱ ⲙ̅ⲙⲟⲥ ⲛⲁϥ ϫⲉ ⲁ ⲡⲗⲁⲟⲥ ⲉⲣ̅ⲛⲟⲃⲉ ⲉⲡϫⲟⲉⲓⲥ ⲁϥⲟⲩⲉⲙ ⲁϥ. ⲙⲛ̅ ⲡⲉϥⲥⲛⲟϥ. ⲁⲩⲱ ⲡⲉϫⲉ ⲥⲁⲟⲩⲗ ⲛⲁⲩ. ϫⲉ ⲁⲛⲓ̈ ⲟⲩⲛⲟϭ ⲛ̅ⲱⲛⲉ ⲉⲡⲉⲓ̈ⲙⲁ. ⲉⲃⲟⲗ ϩⲛ̅ ⲅⲑⲁⲉⲓⲙ.	And it was reported to Saul, saying, The people have sinned against the Lord, eating with the blood: and Saul said, Out of Getthaim roll a great stone to me hither.	καὶ ἀπηγγέλη τῷ Σαουλ λέγοντες Ἡµάρτηκεν ὁ λαὸς τῷ κυρίῳ φαγὼν σὺν τῷ αἵµατι. καὶ εἶπεν Σαουλ ἐν Γεθθεµ Κυλίσατέ µοι λίθον ἐνταῦθα µέγαν.						
First Samuel	14	14	34	OT	1. OT	Historical Books	2. Historical Books	02. Historical Books	04. First Samuel		ⲡⲉϫⲉ ⲥⲁⲟⲩⲗ ⲇⲉ ⲛⲁⲩ ϫⲉ ⲃⲱⲕ ⲉⲃⲟⲗ ϩⲙ̅ ⲡⲗⲁⲟⲥ ⲛ̅ⲧⲉⲧⲛ̅ϫⲟⲟⲥ ⲛⲁⲩ. ϫⲉ ⲙⲁⲣⲉ ⲡⲟⲩⲁ ⲡⲟⲩⲁ ⲙ̅ⲙⲱⲧⲛ̅. ⲉⲓⲛⲉ ⲉⲡⲉϥⲙⲁ (sic) ⲙ̅ⲡⲉϥⲣⲁⲥⲧⲉ. ⲁⲩⲱ ⲡⲉϥⲉⲥⲟⲟⲩ. ⲛϥ̅ϣⲁⲁⲧϥ̅ ϩⲓ̈ϫⲙ̅ ⲡⲓ̈ⲱⲛⲉ ϫⲉ ⲛ̅ⲛⲉⲧⲛⲉⲣⲛⲟⲃⲉ ⲉⲡϫⲟⲉⲓⲥ ⲉⲧⲣⲉⲧⲉⲧⲛ̅ⲟⲩⲉⲙ ⲁϥ ⲙⲛ̅ ⲡⲉϥⲥⲛⲟϥ. ⲁⲩⲱ ⲡⲗⲁⲟⲥ ⲧⲏⲣϥ ⲡⲟⲩⲁ ⲡⲟⲩⲁ. ⲁϥⲉⲓⲛⲉ ⲙ̅ⲡⲉⲧⲛ̅ⲧⲟⲟⲧϥ. ⲁⲩϣⲱⲱⲧ ⲙ̅ⲙⲟⲟⲩ ⲙ̅ⲡⲙⲁ ⲉⲧⲙ̅ⲙⲁⲩ.	And Saul said, Disperse yourselves among the people, and tell them to bring hither every one his calf, and every one his sheep: and let them slay it on this stone and sin not against the Lord in eating with the blood: and the people brought each one that which was in his hand, and they slew them there.	καὶ εἶπεν Σαουλ Διασπάρητε ἐν τῷ λαῷ καὶ εἴπατε αὐτοῖς προσαγαγεῖν ἐνταῦθα ἕκαστος τὸν µόσχον αὐτοῦ καὶ ἕκαστος τὸ πρόβατον αὐτοῦ, καὶ σφαζέτω ἐπὶ τούτου, καὶ οὐ µὴ ἁµάρτητε τῷ κυρίῳ τοῦ ἐσθίειν σὺν τῷ αἵµατι· καὶ προσῆγεν πᾶς ὁ λαὸς ἕκαστος τὸ ἐν τῇ χειρὶ αὐτοῦ καὶ ἔσφαζον ἐκεῖ.						
First Samuel	14	14	35	OT	1. OT	Historical Books	2. Historical Books	02. Historical Books	04. First Samuel		ⲁⲩⲱ ⲥⲁⲟⲩⲗ ⲁϥⲕⲱⲧ ⲙ̅ⲡⲙⲁ ⲉⲧⲙ̅ⲙⲁⲩ ⲛ̅ⲟⲩⲑⲩⲥⲓⲁⲥⲧⲏⲣⲓⲟⲛ ⲙ̅ⲡϫⲟⲉⲓⲥ. ⲡⲁⲓ̈ ⲡⲉ ⲡⲉⲑⲩⲥⲓⲁⲥⲧⲏⲣⲓⲟⲛ. ⲛ̅ⲧⲁ ⲥⲁⲟⲩⲗ ⲁⲣⲭⲓⲥⲑⲁⲓ. ⲛ̅ⲕⲟⲧϥ ⲙ̅ⲡϫⲟⲉⲓⲥ.	And Saul built an altar there to the Lord: this was the first altar that Saul built to the Lord.	καὶ ᾠκοδόµησεν ἐκεῖ Σαουλ θυσιαστήριον τῷ κυρίῳ· τοῦτο ἤρξατο Σαουλ οἰκοδοµῆσαι θυσιαστήριον τῷ κυρίῳ.						
First Samuel	14	14	36	OT	1. OT	Historical Books	2. Historical Books	02. Historical Books	04. First Samuel		ⲁⲩⲱ ⲡⲉϫⲉ ⲥⲁⲟⲩⲗ ⲙ̅ⲡⲗⲁⲟⲥ. ϫⲉ ⲙⲁⲣⲉⲛⲃⲱⲕ ⲉϫⲛ̅ ⲛ̅ⲁⲗⲗⲟⲫⲩⲗⲟⲥ ⲛ̅ⲧⲉⲩϣⲏ. ⲛ̅ⲧⲉⲛϩⲁⲣⲡⲁⲍⲉ ⲉⲃⲟⲗ ⲛ̅ϩⲏⲧⲟⲩ. ϣⲁ ⲡⲛⲁⲩ ⲛ̅ϩⲧⲟⲟⲩⲉ ⲛ̅ⲧⲉⲛⲧⲙ̅ϣⲉϫⲡ̅ ⲟⲩⲣⲱⲙⲉ ⲉⲃⲟⲗ ⲛ̅ϩⲏⲧⲟⲩ. ⲡⲉϫⲁⲩ ⲛⲁϥ ϫⲉ ⲡⲁⲅⲁⲑⲟⲛ ⲧⲏⲣϥ̅. ⲁⲣⲓ̈ϥ ⲛⲁϩⲣⲁⲕ. ⲡⲉϫⲉ ⲡⲟⲩⲏⲏⲃ ϫⲉ ⲙⲁⲣⲉⲛϯ ⲙ̅ⲡⲉⲛⲟⲩⲟⲓ̈. ⲉⲡⲉⲓ̈ⲙⲁ ⲉⲣⲁⲧϥ̅ ⲙ̅ⲡⲛⲟⲩⲧⲉ ⲛ̅ⲧⲛ̅ϫⲛⲟⲩϥ.	And Saul said, Let us go down after the Philistines this night, and let us plunder among them till the day break, and let us not leave a man among them. And they said, Do all that is good in thy sight: and the priest said, let us draw nigh hither to God.	Καὶ εἶπεν Σαουλ Καταβῶµεν ὀπίσω τῶν ἀλλοφύλων τὴν νύκτα καὶ διαρπάσωµεν ἐν αὐτοῖς, ἕως διαφαύσῃ ἡ ἡµέρα, καὶ µὴ ὑπολίπωµεν ἐν αὐτοῖς ἄνδρα. καὶ εἶπαν Πᾶν τὸ ἀγαθὸν ἐνώπιόν σου ποίει. καὶ εἶπεν ὁ ἱερεύς Προσέλθωµεν ἐνταῦθα πρὸς τὸν θεόν.						
First Samuel	14	14	37	OT	1. OT	Historical Books	2. Historical Books	02. Historical Books	04. First Samuel		ⲁⲩⲱ ⲥⲁⲟⲩⲗ ⲁϥϫⲛⲉ ⲡⲛⲟⲩⲧⲉ. ϫⲉ ⲉⲛⲉ ⲧⲁⲃⲱⲕ ⲉⲣⲁⲧⲟⲩ ⲛ̅ⲛ̅ⲁⲗⲗⲟⲫⲩⲗⲟⲥ ⲁⲩⲱ ⲛⲉⲕⲛⲁⲧⲁⲁⲩ ⲉϩⲣⲁⲓ̈ ⲉⲛ̅ϭⲓϫ ⲙ̅ⲡⲓⲏ̅ⲗ̅. ⲙ̅ⲡⲉ ⲡϫⲟⲉⲓⲥ ⲇⲉ ⲉⲣⲟⲩⲱ ⲛⲁϥ ⲙ̅ⲡⲉϩⲟⲟⲩ ⲉⲧⲙ̅ⲙⲁⲩ	And Saul enquired of God, If I go down after the Philistines, wilt thou deliver them into the hands of Israel? And he answered him not in that day.	καὶ ἐπηρώτησεν Σαουλ τὸν θεόν Εἰ καταβῶ ὀπίσω τῶν ἀλλοφύλων; εἰ παραδώσεις αὐτοὺς εἰς χεῖρας Ισραηλ; καὶ οὐκ ἀπεκρίθη αὐτῷ ἐν τῇ ἡµέρᾳ ἐκείνῃ.						
First Samuel	14	14	38	OT	1. OT	Historical Books	2. Historical Books	02. Historical Books	04. First Samuel		ⲡⲉϫⲉ ⲥⲁⲟⲩⲗ ⲛⲁⲩ ϫⲉ ⲁⲛⲓ̈ⲛⲉ ⲉⲡⲉⲓ̈ⲙⲁ ⲛ̅ⲛⲉⲧⲁⲅⲙⲁ ⲧⲏⲣⲟⲩ ⲙ̅ⲡⲓⲏ̅ⲗ̅. ⲛ̅ⲧⲉⲧⲛ̅ⲉⲓⲙⲉ ⲁⲩⲱ ⲛ̅ⲧⲉⲧⲛ̅ⲛⲁⲩ. ϫⲉ ⲛ̅ⲧⲁ ⲡⲉⲓ̈ⲛⲟⲃⲉ ϣⲱⲡⲉ ϩⲛ̅ ⲛⲓⲙ ⲙⲡⲟⲟⲩ.	And Saul said, Bring hither all the chiefs of Israel, and know and see by whom this sin has been committed this day.	καὶ εἶπεν Σαουλ Προσαγάγετε ἐνταῦθα πάσας τὰς γωνίας τοῦ Ισραηλ καὶ γνῶτε καὶ ἴδετε ἐν τίνι γέγονεν ἡ ἁµαρτία αὕτη σήµερον·						
First Samuel	14	14	39	OT	1. OT	Historical Books	2. Historical Books	02. Historical Books	04. First Samuel		ϫⲉ ⲡϫⲟⲉⲓⲥ ⲟⲛϩ̅ ⲡⲉⲛⲧⲁϥⲧⲟⲩϫⲉ ⲡⲓⲏ̅ⲗ̅. ϫⲉ ⲉϥϣⲁⲛⲧⲁⲙⲟⲛ ⲉⲧⲃⲉ ⲓ̈ⲱⲛⲁⲑⲁⲛ ⲡⲁϣⲏⲣⲉ. ϩⲛ̅ ⲟⲩⲙⲟⲩ. ϥⲛⲁⲙⲟⲩ ⲡⲉ. ⲁⲩⲱ ⲙ̅ⲡⲉ ⲗⲁⲁⲩ ϣⲁϫⲉ ϩⲙ̅ ⲡⲗⲁⲟⲥ ⲧⲏⲣϥ̅.	For as the Lord lives who has saved Israel, if answer should be against my son Jonathan, he shall surely die. And there was no one that answered out of all the people.	ὅτι ζῇ κύριος ὁ σώσας τὸν Ισραηλ, ὅτι ἐὰν ἀποκριθῇ κατὰ Ιωναθαν τοῦ υἱοῦ µου, θανάτῳ ἀποθανεῖται. καὶ οὐκ ἦν ὁ ἀποκρινόµενος ἐκ παντὸς τοῦ λαοῦ.						
First Samuel	14	14	40	OT	1. OT	Historical Books	2. Historical Books	02. Historical Books	04. First Samuel		ⲡⲉϫⲉ ⲥⲁⲟⲩⲗ ⲛ̅ⲛ̅ⲣⲱⲙⲉ ⲧⲏⲣⲟⲩ ⲙ̅ⲡⲓⲏ̅ⲗ̅ ϫⲉ ⲛ̅ⲧⲱⲧⲛ̅ ⲧⲉⲧⲛ̅ⲛⲁϣⲱⲡⲉ ϩⲛ̅ ⲟⲩⲙⲛ̅ⲧϩⲙ̅ϩⲁⲗ. ⲁⲛⲟⲕ ϩⲱⲱⲧ ⲟⲛ ⲙⲛ̅ ⲓ̈ⲱⲛⲁⲑⲁⲛ ⲡⲁϣⲏⲣⲉ ⲧⲉⲛⲛⲁϣⲱⲡⲉ ϩⲛ̅ ⲟⲩⲙⲛ̅ⲧϩⲙ̅ϩⲁⲗ. ⲡⲉϫⲉ ⲡⲗⲁⲟⲥ ⲛ̅ⲥⲁⲟⲩⲗ. ϫⲉ ⲡⲁⲅⲁⲑⲟⲛ ⲉⲧⲛⲁϩⲣⲁⲕ ⲁⲣⲓ̈ϥ.	And he said to all the men of Israel, Ye shall be under subjection, and I an Jonathan my son will be under subjection: and the people said to Saul, Do that which is good in thy sight.	καὶ εἶπεν παντὶ Ισραηλ Ὑµεῖς ἔσεσθε εἰς δουλείαν, καὶ ἐγὼ καὶ Ιωναθαν ὁ υἱός µου ἐσόµεθα εἰς δουλείαν. καὶ εἶπεν ὁ λαὸς πρὸς Σαουλ Τὸ ἀγαθὸν ἐνώπιόν σου ποίει.						
First Samuel	14	14	41	OT	1. OT	Historical Books	2. Historical Books	02. Historical Books	04. First Samuel		ⲡⲉϫⲉ ⲥⲁⲟⲩⲗ. ϫⲉ ⲡϫⲟⲉⲓⲥ ⲡⲛⲟⲩⲧⲉ ⲙ̅ⲡⲓⲏ̅ⲗ̅. ⲉⲧⲃⲉⲟⲩ ⲙ̅ⲡⲉⲕϣⲁϫⲉ ⲙ̅ⲡⲟⲟⲩ ⲙⲛ̅ ⲡⲉⲕϩⲙ̅ϩⲁⲗ. ⲉⲛⲉⲣⲉ ⲡⲛⲟⲃⲉ ⲉⲣⲟⲓ̈. ⲏ ⲓ̈ⲱⲛⲁⲑⲁⲛ ⲡⲁϣⲏⲣⲉ. ⲡϫⲟⲉⲓⲥ ⲡⲛⲟⲩⲧⲉ ⲙ̅ⲡⲓⲏ̅ⲗ̅ ϯⲙⲁⲉⲓⲛ ⲛⲁⲛ. ⲁⲩⲱ ⲉⲕϣⲁⲛϫⲟⲟⲥ ϩⲓ̈ⲛⲁⲓ̈. ⲧⲁⲓ̈ ⲧⲉ ⲑⲉ ⲉⲧⲛⲁϣⲱⲡⲉ. ϯⲙⲁⲉⲓⲛ ⲡϫⲟⲉⲓⲥ ⲉⲡⲉⲕⲗⲁⲟⲥ ⲡⲓⲏ̅ⲗ̅. ⲁⲩⲱ ⲡⲉⲕⲗⲏⲣⲟⲥ ⲁϥⲓ̈ ⲉϫⲛ̅ ⲓ̈ⲱⲛⲁⲑⲁⲛ ⲙⲛ̅ ⲥⲁⲟⲩⲗ. ⲡⲗⲁⲟⲥ ⲁϥⲉⲓ ⲉⲃⲟⲗ.	And Saul said, O Lord God of Israel, why hast thou not answered thy servant this day? is the iniquity in me, or in Jonathan my son? Lord God of Israel, give clear manifestations; and if the lot should declare this, give, I pray thee, to thy people of Israel, give, I pray, holiness. And Jonathan and Saul are taken, and the people escaped.	καὶ εἶπεν Σαουλ Κύριε ὁ θεὸς Ισραηλ, τί ὅτι οὐκ ἀπεκρίθης τῷ δούλῳ σου σήµερον; εἰ ἐν ἐµοὶ ἢ ἐν Ιωναθαν τῷ υἱῷ µου ἡ ἀδικία, κύριε ὁ θεὸς Ισραηλ, δὸς δήλους· καὶ ἐὰν τάδε εἴπῃς Ἐν τῷ λαῷ σου Ισραηλ, δὸς δὴ ὁσιότητα. καὶ κληροῦται Ιωναθαν καὶ Σαουλ, καὶ ὁ λαὸς ἐξῆλθεν.						
First Samuel	14	14	42	OT	1. OT	Historical Books	2. Historical Books	02. Historical Books	04. First Samuel		ⲡⲉϫⲉ ⲥⲁⲟⲩⲗ ϫⲉ ⲛⲉϫ ⲕⲗⲏⲣⲟⲥ ϩⲛ̅ ⲧⲁⲙⲏⲧⲉ. ⲁⲩⲱ ϩⲛ̅ ⲧⲙⲏⲧⲉ ⲛⲓ̈ⲱⲛⲁⲑⲁⲛ ⲡⲁϣⲏⲣⲉ. ⲁⲩⲱ ⲡⲉⲧⲉⲣⲉ ⲡϫⲟⲉⲓⲥ ⲛⲁⲉⲓⲛⲉ ⲙ̅ⲡⲉⲕⲗⲏⲣⲟⲥ ⲉϫⲱϥ. ⲉϥⲉⲙⲟⲩ ⲡⲉϫⲉ ⲡⲗⲁⲟⲥ ⲉϩⲟⲩⲛ ϩⲛ ⲥⲁⲟⲩⲗ. ϫⲉ ⲛ̅ⲛⲉ ⲡⲉⲓ̈ϣⲁϫⲉ ϣⲱⲡⲉ. ⲥⲁⲟⲩⲗ ⲇⲉ ⲁϥⲁⲛⲁⲅⲕⲁⲍⲉ ⲙ̅ⲡⲗⲁⲟⲥ ⲁⲩⲛⲉϫ ⲕⲗⲏⲣⲟⲥ ϩⲛ̅ ⲧⲉϥⲙⲏⲧⲉ. ⲁⲩⲱ ϩⲛ̅ ⲧⲙⲏⲧⲉ ⲛ̅ⲓ̈ⲱⲛⲁⲑⲁⲛ ⲡⲉϥϣⲏⲣⲉ. ⲁ ⲡⲉⲕⲗⲏⲣⲟⲥ ⲉⲓ ⲉϫⲛ̅ ⲓ̈ⲱⲛⲁⲑⲁⲛ.	And Saul said, Cast lots between me and my son Jonathan: whomsoever the Lord shall cause to be taken by lot, let him die: and the people said to Saul, This thing is not to be done: and Saul prevailed against the people, and they cast lots between him and Jonathan his son, and Jonathan is taken by lot.	καὶ εἶπεν Σαουλ Βάλετε ἀνὰ µέσον ἐµοῦ καὶ ἀνὰ µέσον Ιωναθαν τοῦ υἱοῦ µου· ὃν ἂν κατακληρώσηται κύριος, ἀποθανέτω. καὶ εἶπεν ὁ λαὸς πρὸς Σαουλ Οὐκ ἔστιν τὸ ῥῆµα τοῦτο. καὶ κατεκράτησεν Σαουλ τοῦ λαοῦ, καὶ βάλλουσιν ἀνὰ µέσον αὐτοῦ καὶ ἀνὰ µέσον Ιωναθαν τοῦ υἱοῦ αὐτοῦ, καὶ κατακληροῦται Ιωναθαν.						
First Samuel	14	14	43	OT	1. OT	Historical Books	2. Historical Books	02. Historical Books	04. First Samuel		ⲡⲉϫⲉ ⲥⲁⲟⲩⲗ ⲛ̅ⲓ̈ⲱⲛⲁⲑⲁⲛ. ϫⲉ ⲙⲁⲧⲁⲙⲟⲓ̈ ϫⲉ ⲟⲩ ⲡⲉ ⲛ̅ⲧⲁϥⲕⲁⲁϥ. ⲁⲩⲱ ⲓ̈ⲱⲛⲁⲑⲁⲛ ⲁϥⲧⲁⲙⲟϥ ⲉϥϫⲱ ⲙ̅ⲙⲟⲥ. ϫⲉ ⲛ̅ⲧⲁⲓ̈ⲥⲉⲡϩⲧⲏϥ̅ ⲙ̅ⲡⲁϭⲉⲣⲱⲃ ⲛ̅ⲟⲩⲕⲟⲩⲓ̈ ⲛ̅ⲉⲃⲓⲱ ⲁⲓ̈ⲧⲟⲡϥ̅. ⲁⲩⲱ ⲉⲓⲥ ϩⲏⲏⲧⲉ ⲁⲛⲟⲕ ⲉⲓ̈ⲛⲁⲙⲟⲩ ⲉⲧⲃⲉ ⲡⲁⲓ̈.	And Saul said to Jonathan, Tell me what thou hast done: and Jonathan told him, and said, I did indeed taste a little honey, with the end of my staff that was in my hand, and, lo! I am to die.	καὶ εἶπεν Σαουλ πρὸς Ιωναθαν Ἀπάγγειλόν µοι τί πεποίηκας. καὶ ἀπήγγειλεν αὐτῷ Ιωναθαν καὶ εἶπεν Γευσάµενος ἐγευσάµην ἐν ἄκρῳ τῷ σκήπτρῳ τῷ ἐν τῇ χειρί µου βραχὺ µέλι· ἰδοὺ ἐγὼ ἀποθνῄσκω.						
First Samuel	14	14	44	OT	1. OT	Historical Books	2. Historical Books	02. Historical Books	04. First Samuel		ⲡⲉϫⲉ ⲥⲁⲟⲩⲗ ⲛⲁϥ ϫⲉ ⲛⲁⲓ̈ ⲛⲉⲧⲉⲣⲉ ⲡⲛⲟⲩⲧⲉ ⲛⲁⲁⲁⲩ ⲛⲁⲓ̈. ⲁⲩⲱ ⲛⲉⲓ̈ⲕⲟⲟⲩⲉ ⲉϥⲉⲟⲩⲁϩⲟⲩ ⲉϫⲱⲓ̈. ϫⲉ ϩⲛ̅ ⲟⲩⲙⲟⲩ. ⲕⲛⲁⲙⲟⲩ. ⲙ̅ⲡⲟⲟⲩ ⲛ̅ϩⲟⲟⲩ.	And Saul said to him, God do so to me, and more also, thou shalt surely die to-day.	καὶ εἶπεν αὐτῷ Σαουλ Τάδε ποιήσαι µοι ὁ θεὸς καὶ τάδε προσθείη, ὅτι θανάτῳ ἀποθανῇ σήµερον.						
First Samuel	14	14	45	OT	1. OT	Historical Books	2. Historical Books	02. Historical Books	04. First Samuel		ⲁⲩⲱ ⲡⲗⲁⲟⲥ ⲡⲉϫⲁϥ ⲛ̅ⲥⲁⲟⲩⲗ. ϫⲉ ⲉⲛⲉ ⲡⲟⲟⲩ ϩⲏ. ϥⲛⲁⲙⲟⲩ ⲛ̅ϭⲓ ⲡⲉⲛⲧⲁϥⲉⲓⲣⲉ ⲙ̅ⲡⲉⲓ̈ⲛⲟϭ ⲛ̅ⲟⲩϫⲁⲓ̈ ϩⲙ̅ ⲡⲓⲏ̅ⲗ̅. ⲡϫⲟⲉⲓⲥ ⲟⲛϩ. ϫⲉ ⲉϣⲱⲡⲉ ⲟⲩⲛ ⲟⲩⲃⲱ ⲛ̅ⲟⲩⲱⲧ ⲛⲁϩⲉ ⲉⲃⲟⲗ ϩⲛ̅ ⲧⲉϥⲁⲡⲉ ⲉϩⲣⲁⲓ̈ ⲉϫⲙ̅ ⲡⲕⲁϩ. ϫⲉ ⲡⲗⲁⲟⲥ ⲙ̅ⲡⲛⲟⲩⲧⲉ ⲁϥⲉⲓⲣⲉ ⲙ̅ⲡⲉⲓ̈ⲛⲟϭ ⲛ̅ⲛⲟⲃⲉ. ⲁⲩⲱ ⲡⲗⲁⲟⲥ ⲁϥϣⲗⲏⲗ ⲉϩⲣⲁⲓ̈ ⲉⲡⲛⲟⲩⲧⲉ. ⲉϩⲣⲁⲓ̈ ⲉϫⲛ̅ ⲓ̈ⲱⲛⲁⲑⲁⲛ ⲙ̅ⲡⲉϩⲟⲟⲩ ⲉⲧⲙ̅ⲙⲁⲩ. ⲁⲩⲱ ⲙ̅ⲡⲉϥⲙⲟⲩ.	And the people said to Saul, Shall he that has wrought this great salvation in Israel be put to death this day? As the Lord lives, there shall not fall to the ground one of the hairs of his head; for the people of God have wrought successfully this day. And the people prayed for Jonathan in that day, and he died not.	καὶ εἶπεν ὁ λαὸς πρὸς Σαουλ Εἰ σήµερον θανατωθήσεται ὁ ποιήσας τὴν σωτηρίαν τὴν µεγάλην ταύτην ἐν Ισραηλ; ζῇ κύριος, εἰ πεσεῖται τῆς τριχὸς τῆς κεφαλῆς αὐτοῦ ἐπὶ τὴν γῆν· ὅτι ὁ λαὸς τοῦ θεοῦ ἐποίησεν τὴν ἡµέραν ταύτην. καὶ προσηύξατο ὁ λαὸς περὶ Ιωναθαν ἐν τῇ ἡµέρᾳ ἐκείνῃ, καὶ οὐκ ἀπέθανεν. —						
First Samuel	14	14	46	OT	1. OT	Historical Books	2. Historical Books	02. Historical Books	04. First Samuel		ⲥⲁⲟⲩⲗ ⲇⲉ ⲁϥⲃⲱⲕ ⲉⲣⲁⲧⲟⲩ ⲛ̅ⲛ̅ⲁⲗⲗⲟⲫⲩⲗⲟⲥ. ⲁⲩⲱ ⲛ̅ⲁⲗⲗⲟⲫⲩⲗⲟⲥ. ⲁⲩⲟⲗⲟⲩ ⲉϩⲣⲁⲓ̈ ⲉⲛⲉⲩⲙⲁ.	And Saul went up from following the Philistines; and the Philistines departed to their place.	καὶ ἀνέβη Σαουλ ἀπὸ ὄπισθεν τῶν ἀλλοφύλων, καὶ οἱ ἀλλόφυλοι ἀπῆλθον εἰς τὸν τόπον αὐτῶν.						
First Samuel	14	14	47	OT	1. OT	Historical Books	2. Historical Books	02. Historical Books	04. First Samuel		ⲁⲩⲱ ⲥⲁⲟⲩⲗ ⲁϥⲕⲗⲏⲣⲟⲩ ⲉⲧⲣⲉϥⲣ̅ⲣ̅ⲣⲟ. ⲁϥϣⲱⲡⲉ ⲛ̅ⲟⲩⲛⲟϭ ⲛ̅ϩⲱⲃ ⲉϫⲙ̅ ⲡⲓⲏ̅ⲗ̅. ⲁⲩⲱ ⲛⲉϥⲡⲟⲗⲩⲙⲉⲓ. ⲙⲛ̅ ⲛⲉϫⲁϫⲉ ⲧⲏⲣⲟⲩ ⲉⲧϩⲙ̅ ⲡⲉϥⲕⲱⲧⲉ. ⲙⲱⲁⲃ ⲙⲛ̅ ⲛⲉϣⲏⲣⲉ ⲛ̅ⲁⲙⲙⲱⲛ. ⲁⲩⲱ ⲛ̅ϣⲏⲣⲉ ⲛ̅ⲉⲇⲱⲙ. ⲁⲩⲱ ⲙⲛ̅ ⲛⲉⲑⲁⲓⲃⲱⲣ. ⲙⲛ̅ ⲡⲣ̅ⲣⲟ ⲛ̅ⲥⲟⲩⲃⲁ. ⲁⲩⲱ ⲙⲛ̅ ⲛ̅ⲁⲗⲗⲟⲫⲩⲗⲟⲥ. ⲡⲙⲁ ⲉϣⲁϥⲃⲱⲕ ⲉⲣⲟϥ ϣⲁϥⲟⲩϫⲁⲓ̈ ⲛ̅ϩⲏⲧϥ̅.	And Saul received the kingdom, by lot he inherits the office of ruling over Israel: and he fought against all his enemies round about, against Moab, and against the children of Ammon, and against the children of Edom, and against Baethaeor, and against the king of Suba, and against the Philistines: whithersoever he turned, he was victorious.	Καὶ Σαουλ κατακληροῦται ἔργον ἐπὶ Ισραηλ. καὶ ἐπολέµει κύκλῳ πάντας τοὺς ἐχθροὺς αὐτοῦ, εἰς τὸν Μωαβ καὶ εἰς τοὺς υἱοὺς Αµµων καὶ εἰς τοὺς υἱοὺς Εδωµ καὶ εἰς τὸν Βαιθεωρ καὶ εἰς βασιλέα Σουβα καὶ εἰς τοὺς ἀλλοφύλους· οὗ ἂν ἐστράφη, ἐσῴζετο.						
First Samuel	14	14	48	OT	1. OT	Historical Books	2. Historical Books	02. Historical Books	04. First Samuel		ⲁⲩⲱ ⲁϥⲉⲓⲣⲉ ⲛ̅ⲟⲩϭⲟⲙ ⲉⲥⲛⲁϣⲧ̅. ⲁϥⲡⲁⲧⲁⲥⲥⲉ ⲙ̅ⲡⲁⲙⲁⲗⲏⲕ. ⲁⲩⲱ ⲁϥⲛⲟⲩϩⲙ̅ ⲙ̅ⲡⲓⲏ̅ⲗ̅ ⲛ̅ⲧⲟⲟⲧⲟⲩ ⲛ̅ⲛⲉⲧⲑⲗⲓⲃⲉ ⲙ̅ⲙⲟⲟⲩ.	And he wrought valiantly, and smote Amalec, and rescued Israel out of the hand of them that trampled on him.	καὶ ἐποίησεν δύναµιν καὶ ἐπάταξεν τὸν Αµαληκ καὶ ἐξείλατο τὸν Ισραηλ ἐκ χειρὸς τῶν καταπατούντων αὐτόν. —						
