book	chapter	chapter-zfilled	verse	testament	testament-indexed	section	section-indexed	section-indexed-no-testament	book-indexed	Bohairic	Sahidic	English	Greek	Fayyumic	Akhmimic	OldBohairic	Mesokemic	DialectP	Lycopolitan
First Samuel	16	16	13	OT	1. OT	Historical Books	2. Historical Books	02. Historical Books	04. First Samuel	ⲟⲩⲟϩ ⲁ ⲥⲁⲙⲟⲩⲏⲗ ⲱⲗⲓ ⲙ̀ⲡⲓⲧⲁⲡ ⲛ̀ⲧⲉ ⲡⲓⲛⲉϩ ⲁϥⲑⲁϩⲥϥ ϧⲉⲛ ⲑⲙⲏϯ ⲛ̀ⲛⲉϥⲥⲛⲏⲟⲩ ⲟⲩⲟϩ ⲁ ⲡⲓⲡⲛ̅ⲁ̅ ⲛ̀ⲧⲉ ⲡϭ̅ⲥ̅ ϥⲟϫϥ ⲉ̀ϫⲉⲛ ⲇⲁⲩⲓⲇ ⲓⲥϫⲉⲛ ⲡⲓⲉϩⲟⲟⲩ ⲉⲧⲉⲙ̀ⲙⲁⲩ	ⲁⲩⲱ ⲥⲁⲙⲟⲩⲏⲗ ⲁϥϫⲓ̈ ⲙ̅ⲡⲧⲁⲡ ⲛⲛⲉϩ ⲁϥⲧⲱϩⲥ̅ ⲛ̅ⲇ̅ⲁ̅ⲇ̅ ϩⲛ̅ ⲧⲙⲏⲧⲉ ⲛ̅ⲛⲉϥⲥⲛⲏⲩ. ⲁⲩⲱ ⲡⲉⲡⲛ̅ⲁ̅ ⲙ̅ⲡϫⲟⲉⲓⲥ ⲁϥⲃⲱϭⲉ ⲉϫⲛ̅ ⲇⲁⲩⲉⲓⲇ. ⲛ̅ϫⲓ̈ⲛ ⲡⲉϩⲟⲟⲩ ⲉⲧⲙ̅ⲙⲁⲩ ϣⲁⲃⲟⲗ. ⲥⲁⲙⲟⲩⲏⲗ ⲇⲉ ⲁϥⲃⲱⲕ ⲉϩⲣⲁⲓ̈ ⲉⲁⲣⲙⲁⲑⲉⲓⲙ.	And Samuel took the horn of oil, and anointed him in the midst of his brethren: and the Spirit of the Lord came upon David from that day forward: and Samuel arose, and departed to Armathaim.	καὶ ἔλαβεν Σαµουηλ τὸ κέρας τοῦ ἐλαίου καὶ ἔχρισεν αὐτὸν ἐν µέσῳ τῶν ἀδελφῶν αὐτοῦ, καὶ ἐφήλατο πνεῦµα κυρίου ἐπὶ Δαυιδ ἀπὸ τῆς ἡµέρας ἐκείνης καὶ ἐπάνω. καὶ ἀνέστη Σαµουηλ καὶ ἀπῆλθεν εἰς Αρµαθαιµ.						
First Samuel	16	16	14	OT	1. OT	Historical Books	2. Historical Books	02. Historical Books	04. First Samuel		ⲁⲩⲱ ⲡⲉⲡⲛ̅ⲁ̅ ⲙ̅ⲡϫⲟⲉⲓⲥ ⲥⲁϩⲱⲱϥ ⲉⲃⲟⲗ ⲛ̅ⲥⲁⲟⲩⲗ. ⲁⲩⲱ ⲁⲩⲡⲛ̅ⲁ̅ ⲙ̅ⲡⲟⲛⲏⲣⲟⲛ. ⲱϫⲧ̅ ⲙ̅ⲙⲟϥ ⲛ̅ⲧⲟⲟⲧϥ̅ ⲙ̅ⲡϫⲟⲉⲓⲥ.	And the Spirit of the Lord departed from Saul, and an evil spirit from the Lord tormented him.	Καὶ πνεῦµα κυρίου ἀπέστη ἀπὸ Σαουλ, καὶ ἔπνιγεν αὐτὸν πνεῦµα πονηρὸν παρὰ κυρίου.						
First Samuel	16	16	15	OT	1. OT	Historical Books	2. Historical Books	02. Historical Books	04. First Samuel		ⲛ̅ϩⲙ̅ϩⲁⲗ ⲇⲉ ⲛ̅ⲥⲁⲟⲩⲗ ⲡⲉϫⲁⲩ ⲛⲁϥ. ϫⲉ ⲓ̈ⲥ ϩⲏⲏⲧⲉ ⲟⲩⲛ̅ ⲟⲩⲡⲛ̅ⲁ̅ ⲙ̅ⲡⲟⲛⲏⲣⲟⲛ ⲱϫⲧ̅ ⲙ̅ⲙⲟⲕ ⲛ̅ⲧⲟⲟⲧϥ̅ ⲙ̅ⲡϫⲟⲉⲓⲥ	And Saul’s servants said to him, Behold now, and evil spirit from the Lord torments thee.	καὶ εἶπαν οἱ παῖδες Σαουλ πρὸς αὐτόν Ἰδοὺ δὴ πνεῦµα κυρίου πονηρὸν πνίγει σε·						
First Samuel	16	16	16	OT	1. OT	Historical Books	2. Historical Books	02. Historical Books	04. First Samuel		ⲙⲁⲣⲉ ⲛⲉⲕϩⲙ̅ϩⲁⲗ ⲧⲁⲩⲉ ⲟⲩϣⲁϫⲉ ⲙ̅ⲡⲉⲕⲙⲧⲟ ⲉⲃⲟⲗ. ⲁⲩⲱ ⲛ̅ⲥⲉⲕⲱⲧⲉ ⲛ̅ⲥⲁ ⲟⲩⲣⲱⲙⲉ ⲉϥⲥⲟⲟⲩⲛ ⲙ̅ⲯⲁⲗⲗⲉⲓ ϩⲛ̅ ⲟⲩⲕⲓⲑⲁⲣⲁ. ⲛ̅ⲧⲉⲛⲉⲛ̅ⲧϥ̅ ⲉϩⲟⲩⲛ ⲙ̅ⲡⲉⲛϫⲟⲉⲓⲥ. ⲁⲩⲱ ⲉⲣϣⲁⲛ ⲡⲉⲡⲛ̅ⲁ̅ ⲙ̅ⲡⲟⲛⲏⲣⲟⲛ ⲉⲓ ⲉϫⲱⲕ. ⲉϥⲉⲯⲁⲗⲗⲉⲓ ϩⲛ ⲧⲉϥϭⲓⲛⲩⲣⲁ. ⲛϥ̅ϯⲉⲙⲧⲟⲛ ⲛⲁⲕ.	Let now thy servants speak before thee, and let them seek for our lord a man skilled to play on the harp; and it shall come to pass when an evil spirit comes upon thee and he shall play on his harp, that thou shalt be well, and he shall refresh thee.	εἰπάτωσαν δὴ οἱ δοῦλοί σου ἐνώπιόν σου καὶ ζητησάτωσαν τῷ κυρίῳ ἡµῶν ἄνδρα εἰδότα ψάλλειν ἐν κινύρᾳ, καὶ ἔσται ἐν τῷ εἶναι πνεῦµα πονηρὸν ἐπὶ σοὶ καὶ ψαλεῖ ἐν τῇ κινύρᾳ αὐτοῦ, καὶ ἀγαθόν σοι ἔσται, καὶ ἀναπαύσει σε.						
First Samuel	16	16	17	OT	1. OT	Historical Books	2. Historical Books	02. Historical Books	04. First Samuel		ⲡⲉϫⲉ ⲥⲁⲟⲩⲗ ϭⲉ ⲛ̅ⲛⲉϥϩⲙ̅ϩⲁⲗ. ϫⲉ ⲁⲛⲁⲩ ϭⲉ ⲛⲁⲓ̈ ⲙ̅ⲡⲣⲱⲙⲉ. ⲉϥⲥⲟⲟⲩⲛ ⲙ̅ⲯⲁⲗⲗⲉⲓ ⲕⲁⲗⲱⲥ. ⲛ̅ⲧⲉⲧⲛ̅ⲛ̅ⲧϥ̅ ⲉϩⲟⲩⲛ ⲛⲁⲓ̈	And Saul said to his servants, Look now out for me a skillful player, and bring him to me.	καὶ εἶπεν Σαουλ πρὸς τοὺς παῖδας αὐτοῦ Ἴδετε δή µοι ἄνδρα ὀρθῶς ψάλλοντα καὶ εἰσαγάγετε αὐτὸν πρὸς ἐµέ.						
First Samuel	16	16	18	OT	1. OT	Historical Books	2. Historical Books	02. Historical Books	04. First Samuel		ⲟⲩⲁ ⲇⲉ ⲛ̅ⲛⲉϥϩⲙ̅ϩⲁⲗ. ⲁϥⲟⲩⲱϣⲃ̅ ⲉϥϫⲱ ⲙ̅ⲙⲟⲥ ⲛⲁϥ. ϫⲉ ⲉⲓⲥ ϩⲏⲏⲧⲉ ⲁⲓ̈ⲛⲁⲩ ⲉⲩϣⲏⲣⲉ ⲛ̅ⲧⲉ ⲉⲓⲥⲥⲁⲓ̈. ⲡⲉ ⲉⲃⲟⲗ ϩⲛ̅ ⲃⲏⲑⲗⲉⲉⲙ. ⲛ̅ⲧⲟϥ ϥⲥⲟⲟⲩⲛ ⲙ̅ⲯⲁⲗⲗⲉⲓ. ⲡⲣⲱⲙⲉ ⲇⲉ ⲟⲩⲣⲉⲙⲛ̅ϩⲏⲧ ⲡⲉ. ⲁⲩⲱ ⲟⲩⲣⲱⲙⲉ ⲡⲉ ⲙ̅ⲡⲟⲗⲩⲙⲓⲥⲧⲏⲥ. ⲉⲩⲥⲱⲫⲟⲥ ⲡⲉ ϩⲙ̅ ⲡⲉϥϣⲁϫⲉ. ⲉⲩⲣⲱⲙⲉ ⲡⲉ ⲛ̅ⲁⲅⲁⲑⲟⲥ ϩⲙ̅ ⲡⲛⲁⲩ ⲉⲣⲟϥ. ⲁⲩⲱ ⲡϫⲟⲉⲓⲥ ⲛⲙ̅ⲙⲁϥ.	And one of his servants answered and said, Behold, I have seen a son of Jessae the Bethleemite, and he understands playing on the harp, and the man is prudent, and a warrior, and wise in speech, and the man is handsome, and the Lord is with him.	καὶ ἀπεκρίθη εἷς τῶν παιδαρίων αὐτοῦ καὶ εἶπεν Ἰδοὺ ἑόρακα υἱὸν τῷ Ιεσσαι Βηθλεεµίτην καὶ αὐτὸν εἰδότα ψαλµόν, καὶ ὁ ἀνὴρ συνετός, καὶ ὁ ἀνὴρ πολεµιστὴς καὶ σοφὸς λόγῳ καὶ ἀνὴρ ἀγαθὸς τῷ εἴδει, καὶ κύριος µετ’ αὐτοῦ.						
First Samuel	16	16	19	OT	1. OT	Historical Books	2. Historical Books	02. Historical Books	04. First Samuel		ⲥⲁⲟⲩⲗ ⲇⲉ ⲁϥϫⲟⲟⲩ ⲛ̅ϩⲉⲛⲃⲁⲓ̈ϣⲓ̈ⲛⲉ. ⲉⲣⲁⲧϥ̅ ⲛ̅ⲓ̈ⲉⲥⲥⲉ ⲉϥϫⲱ ⲙ̅ⲙⲟⲥ. ϫⲉ ⲧⲛ̅ⲛⲟⲟⲩ ⲛⲁⲓ̈. ⲙ̅ⲡⲉⲕϣⲏⲣⲉ ⲇⲁⲩⲉⲓⲇ. ⲉⲧϩⲛ̅ ⲛⲉⲕⲉⲥⲟⲟⲩ.	And Saul sent messengers to Jessae, saying, Send to me thy son David who is with thy flock.	καὶ ἀπέστειλεν Σαουλ ἀγγέλους πρὸς Ιεσσαι λέγων Ἀπόστειλον πρός µε τὸν υἱόν σου Δαυιδ τὸν ἐν τῷ ποιµνίῳ σου.						
First Samuel	16	16	20	OT	1. OT	Historical Books	2. Historical Books	02. Historical Books	04. First Samuel		ⲓ̈ⲉⲥⲥⲁⲓ̈ ⲇⲉ ⲁϥϫⲓ̈ ⲛ̅ⲟⲩϣⲓ̈ ⲛ̅ⲛⲟⲉⲓⲧ ⲙⲛ̅ ⲟⲩϩⲱⲧ ⲛ̅ⲏⲣⲡ ⲁⲩⲱ ⲟⲩⲙⲁⲥ ⲛ̅ⲃⲁⲁⲙⲡⲉ. ⲁϥϫⲟⲟⲩⲥⲟⲩ ⲛ̅ⲥⲁⲟⲩⲗ ⲉⲃⲟⲗ ϩⲓ̈ⲧⲟⲟⲧϥ ⲛ̅ⲇⲁⲩⲉⲓⲇ ⲡⲉϥϣⲏⲣⲉ.	And Jessae took a homer of bread, and a bottle of wine, and one kid of the goats, and sent them by the hand of his son David to Saul.	καὶ ἔλαβεν Ιεσσαι γοµορ ἄρτων καὶ ἀσκὸν οἴνου καὶ ἔριφον αἰγῶν ἕνα καὶ ἐξαπέστειλεν ἐν χειρὶ Δαυιδ τοῦ υἱοῦ αὐτοῦ πρὸς Σαουλ.						
First Samuel	16	16	21	OT	1. OT	Historical Books	2. Historical Books	02. Historical Books	04. First Samuel		ⲁⲩⲱ ⲇⲁⲩⲉⲓⲇ ⲁϥⲃⲱⲕ ⲉϩⲟⲩⲛ ϣⲁ ⲥⲁⲟⲩⲗ. ⲁϥⲁϩⲉⲣⲁⲧϥ̅ ⲙ̅ⲡⲉϥⲙ̅ⲧⲟ ⲉⲃⲟⲗ. ⲁϥⲙⲉⲣⲓ̈ⲧϥ ⲙ̅ⲙⲁⲧⲉ. ⲁϥϣⲱⲡⲉ ⲉϥϩⲁⲣⲁⲧϥ̅ ⲉϥϥⲉⲓ ⲛ̅ⲛⲉϥⲥⲕⲏⲩⲉ.	And David went in to Saul, and stood before him; and he loved him greatly; and he became his armour-bearer.	καὶ εἰσῆλθεν Δαυιδ πρὸς Σαουλ καὶ παρειστήκει ἐνώπιον αὐτοῦ· καὶ ἠγάπησεν αὐτὸν σφόδρα, καὶ ἐγενήθη αὐτῷ αἴρων τὰ σκεύη αὐτοῦ.						
First Samuel	16	16	22	OT	1. OT	Historical Books	2. Historical Books	02. Historical Books	04. First Samuel		ⲁⲩⲱ ⲥⲁⲟⲩⲗ ⲁϥϫⲟⲟⲩ ⲉⲣⲁⲧϥ̅ ⲛ̅ⲛⲓ̈ⲉⲥⲥⲁⲓ̈. ⲉϥϫⲱ ⲙ̅ⲙⲟⲥ ⲛⲁϥ. ϫⲉ ⲙⲁⲣⲉ ⲇⲁⲩⲉⲓⲇ ϭⲱ ϩⲁϩⲧⲏⲓ̈. ϫⲉ ⲁϥϭⲛ̅ ⲭⲁⲣⲓⲥ ⲛⲁϩⲣⲁⲓ̈.	And Saul sent to Jessae, saying, Let David, I pray thee, stand before me, for he has found grace in my eyes.	καὶ ἀπέστειλεν Σαουλ πρὸς Ιεσσαι λέγων Παριστάσθω δὴ Δαυιδ ἐνώπιον ἐµοῦ, ὅτι εὗρεν χάριν ἐν ὀφθαλµοῖς µου.						
First Samuel	16	16	23	OT	1. OT	Historical Books	2. Historical Books	02. Historical Books	04. First Samuel		ⲁⲩⲱ ⲉⲣϣⲁⲛ ⲡⲉⲡⲛ̅ⲁ̅ ⲙ̅ⲡⲟⲛⲏⲣⲟⲛ ⲉⲓ ⲉϩⲣⲁⲓ̈ ⲉϫⲛ̅ ⲥⲁⲟⲩⲗ. ⲇⲁⲩⲉⲓⲇ ϣⲁϥϫⲓ̈ ⲛ̅ⲧⲉϥϭⲓⲛⲏⲣⲁ ϩⲛ̅ ⲧⲉϥϭⲓϫ ⲉϥⲯⲁⲗⲗⲉⲓ. ⲁⲩⲱ ϣⲁⲣⲉ ⲥⲁⲟⲩⲗ ⲉⲙⲧⲟⲛ ⲛ̅ⲧⲉ ⲡⲁⲓ̈ ϣⲱⲡⲉ ⲛ̅ⲁⲅⲁⲑⲟⲛ ⲛ̅ⲧⲉ ⲡⲉⲡⲛ̅ⲁ̅ ⲙ̅ⲡⲟⲛⲏⲣⲟⲛ ⲥⲁϩⲱⲱϥ ⲉⲃⲟⲗ ⲙ̅ⲙⲟϥ.	And it came to pass when the evil spirit was upon Saul, that David took his harp, and played with his hand: and Saul was refreshed, and it was well with him, and the evil spirit departed from him.	καὶ ἐγενήθη ἐν τῷ εἶναι πνεῦµα πονηρὸν ἐπὶ Σαουλ καὶ ἐλάµβανεν Δαυιδ τὴν κινύραν καὶ ἔψαλλεν ἐν τῇ χειρὶ αὐτοῦ, καὶ ἀνέψυχεν Σαουλ, καὶ ἀγαθὸν αὐτῷ, καὶ ἀφίστατο ἀπ’ αὐτοῦ τὸ πνεῦµα τὸ πονηρόν.						
First Samuel	17	17	1	OT	1. OT	Historical Books	2. Historical Books	02. Historical Books	04. First Samuel		ⲛ̅ⲁⲗⲗⲟⲫⲩⲗⲟⲥ ⲇⲉ ⲁⲩⲥⲱⲟⲩϩ ⲉϩⲟⲩⲛ ⲉⲛⲉⲩⲡⲁⲣⲙⲃⲟⲗⲏ ⲏ ⲛⲉⲩⲉⲙⲡⲗⲁϩ (sic). ϩⲙ ⲡⲡⲟⲗⲩⲙⲟⲥ ⲁⲩⲱ ⲁⲩⲉⲓ ⲉϩⲣⲁⲓ̈ ⲉⲁⲥⲥⲟⲭⲟⲑ ⲛⲧⲉ ϯⲇⲟⲩⲙⲁⲓⲁ. ⲁⲩⲱ ϩⲛ̅ ⲧⲙⲏⲧⲉ ⲛ̅ⲁⲥⲥⲟⲭⲱⲑ. ⲁⲩⲱ ϩⲛ̅ ⲧⲙⲏⲧⲉ ⲛ̅ⲁⲍⲏⲅⲁ. ϩⲛ̅ ⲥⲉⲫⲁⲣⲙⲉⲙ.	And the Philistines gather their armies to battle, and gather themselves to Socchoth of Judaea, and encamp between Socchoth and Azeca Ephermen.	Καὶ συνάγουσιν ἀλλόφυλοι τὰς παρεµβολὰς αὐτῶν εἰς πόλεµον καὶ συνάγονται εἰς Σοκχωθ τῆς Ιουδαίας καὶ παρεµβάλλουσιν ἀνὰ µέσον Σοκχωθ καὶ ἀνὰ µέσον Αζηκα ἐν Εφερµεµ.						
First Samuel	17	17	2	OT	1. OT	Historical Books	2. Historical Books	02. Historical Books	04. First Samuel		ⲥⲁⲟⲩⲗ ⲇⲉ ⲙⲛ̅ ⲛ̅ⲣⲱⲙⲉ ⲙ̅ⲡⲓⲏ̅ⲗ̅. ⲁⲩⲥⲱⲟⲩϩ ⲉϩⲟⲩⲛ ⲉⲡⲓ̈ⲁ ⲛ̅ⲧⲟⲟⲩ. ⲁⲩⲁϩⲉⲣⲁⲧⲟⲩ ⲉⲡⲡⲟⲗⲩⲙⲟⲥ. ⲙ̅ⲡϩⲁⲁⲧⲉ ⲉⲃⲟⲗ ⲛ̅ⲛⲁⲗⲗⲟⲫⲩⲗⲟⲥ.	And Saul and the men of Israel gather together, and they encamp in the valley, and set the battle in array against the Philistines.	καὶ Σαουλ καὶ οἱ ἄνδρες Ισραηλ συνάγονται καὶ παρεµβάλλουσιν ἐν τῇ κοιλάδι· αὐτοὶ παρατάσσονται εἰς πόλεµον ἐξ ἐναντίας ἀλλοφύλων.						
First Samuel	17	17	3	OT	1. OT	Historical Books	2. Historical Books	02. Historical Books	04. First Samuel		ⲛ̅ⲁⲗⲗⲟⲫⲩⲗⲟⲥ ⲇⲉ ⲁⲩⲁϩⲉⲣⲁⲧⲟⲩ ϩⲓ̈ ⲡⲓ̈ⲥⲁ ⲙ̅ⲡⲧⲟⲟⲩ. ⲡⲓⲥⲣⲁⲏⲗ ⲇⲉ ⲁϥⲁϩⲉⲣⲁⲧϥ̅ ϩⲓ̈ ⲡⲓ̈ⲥⲁ ⲙ̅ⲡⲧⲟⲟⲩ. ⲁⲩⲱ ⲡⲁⲩⲗⲱⲛ ⲉⲧⲉ ⲡⲓ̈ⲁ ⲡⲉ. ⲛⲉϥϩⲛ̅ ⲧⲉⲩⲙⲏⲧⲉ.	And the Philistines stand on the mountain on one side, and Israel stands on the mountain on the other side, and the valley was between them.	καὶ ἀλλόφυλοι ἵστανται ἐπὶ τοῦ ὄρους ἐνταῦθα, καὶ Ισραηλ ἵσταται ἐπὶ τοῦ ὄρους ἐνταῦθα, καὶ ὁ αὐλὼν ἀνὰ µέσον αὐτῶν.						
First Samuel	17	17	4	OT	1. OT	Historical Books	2. Historical Books	02. Historical Books	04. First Samuel		ⲁϥⲓ̈ ⲇⲉ ⲛ̅ϭⲓ ⲟⲩⲣⲱⲙⲉ ⲛ̅ⲁⲙⲉⲥⲁⲓ̈ⲟⲥ. ⲉⲩϫⲱⲱⲣⲉ ⲡⲉ. ⲉⲃⲟⲗ ϩⲛ̅ ⲛⲉⲙⲗⲁϩ ⲛ̅ⲛ̅ⲁⲗⲗⲟⲫⲩⲗⲟⲥ. ⲉⲡⲉϥⲣⲁⲛ ⲡⲉ ⲅⲟⲗⲓⲁⲑ. ⲉⲩⲉ ⲉⲃⲟⲗ ⲡⲉ ϩⲛ̅ ⲅⲉⲑ. ⲉⲣⲉ ⲧⲉϥϣⲓ̈ⲏ. ⲛⲁⲉⲣϥⲧⲟⲟⲩ ⲙ̅ⲙⲁϩⲉ ⲙⲛ̅ ⲟⲩⲉⲣⲧⲱ.	And there went forth a mighty man out of the army of the Philistines, Goliath, by name, out of Geth, his height was four cubits and a span.	καὶ ἐξῆλθεν ἀνὴρ δυνατὸς ἐκ τῆς παρατάξεως τῶν ἀλλοφύλων, Γολιαθ ὄνοµα αὐτῷ ἐκ Γεθ, ὕψος αὐτοῦ τεσσάρων πήχεων καὶ σπιθαµῆς·						
First Samuel	17	17	5	OT	1. OT	Historical Books	2. Historical Books	02. Historical Books	04. First Samuel		ⲉⲣⲉ ⲟⲩⲡⲉⲣⲓⲕⲉⲫⲁⲗⲉⲁ ϩⲓ̈ϫⲛ̅ ⲧⲉϥⲁⲡⲉ. ⲉⲣⲉ ⲟⲩϩⲱⲕ ⲛ̅ⲣⲉ ⲛ̅ϭⲓ̈ⲛϭⲉ ⲧⲟ ⲉϩⲓ̈ⲱⲱϥ. ⲉⲣⲉ ⲡϣⲓ̈ ⲙ̅ⲡⲉϥϩⲱⲕ ⲛⲁⲉⲣ ⲟⲩϭⲓⲥ ⲧⲃⲁ ⲛ̅ⲥⲁⲧⲉⲉⲣⲉ. ⲛ̅ϩⲟⲙⲛⲧ. ϩⲓ̈ ⲡⲉⲛⲓ̈ⲡⲉ.	And he had a helmet upon his head, and he wore a breastplate of chain armour; and the weight of his breastplate was five thousand shekels of brass and iron.	καὶ περικεφαλαία ἐπὶ τῆς κεφαλῆς αὐτοῦ, καὶ θώρακα ἁλυσιδωτὸν αὐτὸς ἐνδεδυκώς, καὶ ὁ σταθµὸς τοῦ θώρακος αὐτοῦ πέντε χιλιάδες σίκλων χαλκοῦ καὶ σιδήρου·						
First Samuel	17	17	6	OT	1. OT	Historical Books	2. Historical Books	02. Historical Books	04. First Samuel		ⲁⲩⲱ ϩⲛ̅ⲥⲏϥⲉ ⲛ̅ϩⲟⲙⲛ̅ⲧ ⲛⲉⲩⲟⲧϩ ⲉⲣⲁⲧϥ̅. ⲉⲣⲉ ⲟⲩϩⲟⲡⲗⲟⲛ ⲛ̅ⲣⲛ̅ϩⲟϥ ⲕⲏ ⲉϩⲣⲁⲓ̈ ⲟⲩⲧⲉ ⲛⲉϥⲛⲁϩⲃⲉ.	And greaves of grass were upon his legs, and a brazen target was between his shoulders.	καὶ κνηµῖδες χαλκαῖ ἐπάνω τῶν σκελῶν αὐτοῦ, καὶ ἀσπὶς χαλκῆ ἀνὰ µέσον τῶν ὤµων αὐτοῦ·						
First Samuel	17	17	7	OT	1. OT	Historical Books	2. Historical Books	02. Historical Books	04. First Samuel		ⲧⲉϩⲧⲏ ⲇⲉ ⲙ̅ⲡⲉϥⲙⲉⲣⲉϩ. ⲛⲉⲥⲟ ⲛ̅ⲑⲉ ⲛ̅ⲟⲩϩⲟ ⲛ̅ⲥⲱϩⲉ. ⲁⲩⲱ ⲧⲉϥⲗⲟⲅⲭⲏ ⲛⲉⲥⲛⲁⲉⲣ ⲥⲟⲟⲩ ⲛ̅ϣⲉ ⲛ̅ⲥⲁⲧⲉⲉⲣⲉ ⲛ̅ϩⲣⲏϣⲉ ⲙ̅ⲡⲉⲛⲓ̈ⲡⲉ. ⲡⲉⲧϥⲓ̈ ⲇⲉ ⲛ̅ⲛⲉϥϩⲟⲡⲗⲟⲛ ⲛⲉϥⲙⲟⲟϣⲉ ϩⲓ̈ϩⲏ ⲙ̅ⲙⲟϥ.	And the staff of his spear was like a weaver’s beam, and the spear’s head was formed of six hundred shekels of iron; and his armour-bearer went before him.	καὶ ὁ κοντὸς τοῦ δόρατος αὐτοῦ ὡσεὶ µέσακλον ὑφαινόντων, καὶ ἡ λόγχη αὐτοῦ ἑξακοσίων σίκλων σιδήρου· καὶ ὁ αἴρων τὰ ὅπλα αὐτοῦ προεπορεύετο αὐτοῦ.						
First Samuel	17	17	8	OT	1. OT	Historical Books	2. Historical Books	02. Historical Books	04. First Samuel		ⲁⲩⲱ ⲕⲟⲗⲓⲁⲑ. ⲁϥⲁϩⲉⲣⲁⲧϥ̅. ⲁϥⲱϣ ⲉⲃⲟⲗ ⲉⲡⲙⲏⲏϣⲉ ⲙⲡⲓⲏ̅ⲗ̅. ⲉϥϫⲱ ⲙ̅ⲙⲟⲥ ⲛⲁⲩ. ϫⲉ ⲉⲧⲃⲉ ⲟⲩ ⲧⲉⲧⲛ̅ⲛⲏⲩ ⲉⲃⲟⲗ. ⲉⲁϩⲉⲣⲁⲧⲧⲏⲩⲧⲛ̅ ⲉⲡⲡⲟⲗⲩⲙⲟⲥ ⲉⲙⲓ̈ϣⲉ ⲛⲙ̅ⲙⲁⲛ. ⲙⲏ ⲁⲛⲟⲕ. ⲁⲛⲅ̅ ⲟⲩⲫⲩⲗⲉⲥⲧⲓⲁⲛⲟⲥ ⲁⲛ. ⲛ̅ⲧⲱⲧⲛ̅ ⲇⲉ ⲛ̅ⲧⲉⲧⲛ ⲛⲉϩⲉⲃⲣⲁⲓⲟⲥ. ⲛ̅ϩⲙ̅ϩⲁⲗ ⲛ̅ⲥⲁⲟⲩⲗ. ⲥⲱⲧⲡ̅ ϭⲉ ⲛ̅ⲟⲩⲣⲱⲙⲉ ⲉⲃⲟⲗ ⲛ̅ϩⲏⲧ ⲧⲏⲩⲧⲛ̅ ⲛϥ̅ⲉⲓ ⲉⲃⲟⲗ ⲛⲁⲓ̈	And he stood and cried to the army of Israel, and said to them, Why are ye come forth to set yourselves in battle array against us? Am not I a Philistine, and ye He brews of Saul? Choose for yourselves a man, and let him come down to me.	καὶ ἔστη καὶ ἀνεβόησεν εἰς τὴν παράταξιν Ισραηλ καὶ εἶπεν αὐτοῖς Τί ἐκπορεύεσθε παρατάξασθαι πολέµῳ ἐξ ἐναντίας ἡµῶν; οὐκ ἐγώ εἰµι ἀλλόφυλος καὶ ὑµεῖς Εβραῖοι τοῦ Σαουλ; ἐκλέξασθε ἑαυτοῖς ἄνδρα καὶ καταβήτω πρός µε,						
First Samuel	17	17	9	OT	1. OT	Historical Books	2. Historical Books	02. Historical Books	04. First Samuel		ⲁⲩⲱ ⲉϥϣⲁⲛϭⲙ̅ϭⲟⲙ ⲉⲙⲓ̈ϣⲉ ⲛⲙ̅ⲙⲁⲓ̈. ⲛϥ̅ⲡⲁⲧⲁⲥⲥⲉ ⲙ̅ⲙ<ⲟ>ⲓ̈. ⲧⲛ̅ⲛⲁϣⲱⲡⲉ ⲛⲏⲧⲛ̅ ⲛ̅ϩⲙ̅ϩⲁⲗ. ⲁⲛⲟⲕ ⲇⲉ ⲉⲓ̈ϣⲁⲛϭⲉⲙϭⲟⲙ ⲉⲣⲟϥ. ⲛ̅ⲧⲁⲡⲁⲧⲁⲥⲥⲉ ⲙ̅ⲙⲟϥ. ⲧⲉⲧⲛ̅ⲛⲁϣⲱⲡⲉ ⲛⲁⲛ ⲛ̅ϩⲙ̅ϩⲁⲗ.	And if he shall be able to fight against me, and shall smite me, then will we be your servants: but if I should prevail and smite him, ye shall be our servants, and serve us.	καὶ ἐὰν δυνηθῇ πρὸς ἐµὲ πολεµῆσαι καὶ ἐὰν πατάξῃ µε, καὶ ἐσόµεθα ὑµῖν εἰς δούλους, ἐὰν δὲ ἐγὼ δυνηθῶ καὶ πατάξω αὐτόν, ἔσεσθε ἡµῖν εἰς δούλους καὶ δουλεύσετε ἡµῖν.						
First Samuel	17	17	10	OT	1. OT	Historical Books	2. Historical Books	02. Historical Books	04. First Samuel		ⲁⲩⲱ ⲡⲁⲗⲗⲟⲫⲩⲗⲟⲥ ⲡⲉϫⲁϥ ⲛⲁⲩ ϫⲉ ⲉⲓⲥ ϩⲏⲏⲧⲉ. ⲡⲗⲁⲟⲥ ⲙ̅ⲡⲓⲏ̅ⲗ̅. ⲁⲓ̈ⲛⲉϭⲛⲟⲩϥ ⲙ̅ⲡⲟⲟⲩ ⲛ̅ϩⲟⲟⲩ. ϫⲉ ⲛⲉϩ ⲟⲩⲣⲱⲙⲉ ⲛⲁⲓ̈ ⲉⲃⲟⲗ. ⲛⲧⲉⲛⲙⲓ̈ϣⲉ ⲙ̅ⲡⲉⲥⲛⲁⲩ ϩⲓ̈ⲟⲩⲥⲟⲡ.	And the Philistine said, Behold, I have defied the armies of Israel this very day: give me a man, and we will both of us fight in single combat.	καὶ εἶπεν ὁ ἀλλόφυλος Ἰδοὺ ἐγὼ ὠνείδισα τὴν παράταξιν Ισραηλ σήµερον ἐν τῇ ἡµέρᾳ ταύτῃ· δότε µοι ἄνδρα, καὶ µονοµαχήσοµεν ἀµφότεροι.						
First Samuel	17	17	11	OT	1. OT	Historical Books	2. Historical Books	02. Historical Books	04. First Samuel		ⲁⲩⲱ ⲥⲁⲟⲩⲗ ⲙⲛ̅ ⲡⲓⲏ̅ⲗ̅ ⲧⲏⲣϥ. ⲁⲩⲥⲱⲧⲙ̅ ⲉⲛⲉⲓ̈ϣⲁϫⲉ ⲛ̅ⲧⲉ ⲡⲁⲗⲗⲟⲫⲩⲗⲟⲥ ⲁⲩϣⲧⲟⲣⲧⲣ̅. ⲁⲩⲣ̅ϩⲟⲧⲉ ⲉⲙⲁⲧⲉ.	And Saul and all Israel heard these words of the Philistine, and they were dismayed, and greatly terrified.	καὶ ἤκουσεν Σαουλ καὶ πᾶς Ισραηλ τὰ ῥήµατα τοῦ ἀλλοφύλου ταῦτα καὶ ἐξέστησαν καὶ ἐφοβήθησαν σφόδρα.						
First Samuel	17	17	12	OT	1. OT	Historical Books	2. Historical Books	02. Historical Books	04. First Samuel		ⲇⲁⲩⲉⲓⲇ ⲇⲉ ⲡϣⲏⲣⲉ ⲡⲉ ⲛ̅ⲟⲩⲣⲱⲙⲉ ⲛ̅ⲉⲫⲣⲁⲑⲁⲓⲟⲥ ⲛ̅ⲧⲉ ⲃⲏⲑⲗⲉⲉⲙ ⲛ̅ⲧⲉ ⲓ̈ⲟⲩⲇⲁ. ⲉⲡⲉϥⲣⲁⲛ ⲡⲉ ⲓ̈ⲥⲥⲁⲓ. ⲉⲟⲩⲛ̅ⲧⲁϥ ⲙ̅ⲙⲁⲩ ⲛ̅ϣⲙⲟⲩⲛ ⲛ̅ϣⲏⲣⲉ. ⲡⲣⲱⲙⲉ ⲇⲉ ⲉⲧⲙ̅ⲙⲁⲩ ϩⲛ̅ ⲛⲉϩⲟⲟⲩ ⲛ̅ⲥⲁⲟⲩⲗ. ⲛⲉⲩϩⲗ̅ⲗⲟ ⲡⲉ. ⲉϥϩⲉⲛ ⲛ̅ⲉⲣⲙ̅ϩⲣⲁⲩ								
First Samuel	17	17	13	OT	1. OT	Historical Books	2. Historical Books	02. Historical Books	04. First Samuel		ⲁⲩⲱ ϣⲟⲙⲛ̅ⲧ ⲛ̅ⲛⲟϭ ⲛ̅ϣⲏⲣⲉ ⲛ̅ⲧⲉ ⲉⲓⲥⲥⲁⲓ̈. ⲁⲩⲃⲱⲕ ⲁⲩⲟⲩⲁϩⲟⲩ ⲛ̅ⲥⲁ ⲥⲁⲟⲩⲗ ⲉⲡⲡⲟⲗⲩⲙⲟⲥ. ⲡⲣⲁⲛ ⲇⲉ ⲙ̅ⲡⲉϥϣⲟⲙⲉⲧ ⲛ̅ϣⲏⲣⲉ ⲛ̅ⲧⲁⲩⲃⲱⲕ ⲉⲃⲟⲗ ⲉⲡⲡⲟⲗⲩⲙⲟⲥ. ⲉⲗⲓⲁⲃ ⲡⲉ ⲡϣⲣⲡ̅ⲙⲓⲥⲉ. ⲁⲩⲱ ⲡⲙⲉϩⲥⲛⲁⲩ ⲡⲉ ⲁⲙⲓⲛⲁⲇⲁⲃ. ⲡⲙⲉϩϣⲟⲙⲛ̅ⲧ ⲡⲉ ⲥⲁⲙⲁⲁ.								
First Samuel	17	17	14	OT	1. OT	Historical Books	2. Historical Books	02. Historical Books	04. First Samuel		ⲇ̅ⲁ̅ⲇ̅ ⲇⲉ ⲡⲕⲟⲩⲓ̈ ⲉⲣⲟⲟⲩ. ⲡϣⲟⲙⲛⲧ̅ ⲇⲉ ⲛ̅ⲛⲟϭ ⲛ̅ⲥⲟⲛ. ⲁⲩⲃⲱⲕ ⲇⲉ ⲁⲩⲟⲩⲁϩⲟⲩ ⲛ̅ⲥⲁ ⲥⲁⲟⲩⲗ.								
