book	chapter	chapter-zfilled	verse	testament	testament-indexed	section	section-indexed	section-indexed-no-testament	book-indexed	Bohairic	Sahidic	English	Greek	Fayyumic	Akhmimic	OldBohairic	Mesokemic	DialectP	Lycopolitan
First Samuel	17	17	40	OT	1. OT	Historical Books	2. Historical Books	02. Historical Books	04. First Samuel	ⲟⲩⲟϩ ⲁϥⲱⲗⲓ ⲙ̀ⲡⲉϥϣⲃⲱⲧ ϧⲉⲛ ⲧⲉϥϫⲓϫ ⲟⲩⲟϩ ⲁϥⲥⲱⲧⲡ ⲛⲁϥ ⲛ̀ϯⲟⲩ ⲛ̀ⲱⲛⲓ ⲉⲩⲥⲗⲉϫⲗⲱϫ ⲉ̀ⲃⲟⲗ ϧⲉⲛ ⲡⲓⲙⲟⲩⲛⲥⲱⲣⲉⲙ ⲟⲩⲟϩ ⲁϥⲭⲁⲩ ⲛ̀ϧⲣⲏⲓ ϧⲉⲛ ⲡⲉϥⲕⲁⲧⲟⲥ ⲙ̀ⲙⲁⲛⲉⲥⲱⲟⲩ ⲫⲏ ⲉ̀ⲛⲁϥⲛ̀ⲧⲁϥ ⲙ̀ⲙⲁⲩ ⲉ̀ⲥⲱⲕⲓ ⲉ̀ⲣⲟϥ ⲟⲩⲟϩ ⲁϥⲭⲱ ⲛ̀ⲧⲉϥⲥⲫⲉⲛⲧⲟⲛⲏ ϧⲉⲛ ⲧⲉϥϫⲓϫ ⲟⲩⲟϩ ⲁϥⲓ̀ ϩⲁ ⲡⲓⲣⲱⲙⲓ ⲛ̀ⲁⲗⲗⲟⲫⲩⲗⲟⲥ	ⲁϥϫⲓ̈ ⲙ̅ⲡⲉϥϭⲉⲣⲱϥ ⲉϩⲣⲁⲓ̈ ⲉⲛⲉϥϭⲓϫ. ⲁⲩⲱ ⲁϥⲥⲱⲧⲡ̅ ⲛⲁϥ ⲛ̅ϯⲟⲩ ⲛ̅ⲱⲛⲉ ϩⲙ̅ ⲡⲓ̈ⲁ. ⲉⲩⲟⲩⲟϫ. ⲁϥⲕⲁⲁⲩ ⲉϩⲣⲁⲓ̈ ϩⲙ̅ ⲡⲉϥϫⲓ̈ⲗⲗⲏⲥ. ⲉϣⲁϥⲙⲟⲟⲛⲉ ⲛ̅ϩⲏⲧϥ̅ ⲉϥϣⲟⲟⲡ ⲛⲁϥ. ⲉⲣⲉ ⲧⲉϥⲥⲫⲉⲛⲧⲱⲛⲉ ϩⲛ̅ ⲧⲉϥϭⲓϫ. ⲁϥⲙⲟⲟϣⲉ ⲉⲃⲟⲗ ⲉⲡⲁⲗⲗⲟⲫⲩⲗⲟⲥ.	And he took his staff in his hand, and he chose for himself five smooth stones out of the brook, and put them in the shepherd’s scrip which he had for his store, and his sling was in his hand; and he approached the Philistine.	καὶ ἔλαβεν τὴν βακτηρίαν αὐτοῦ ἐν τῇ χειρὶ αὐτοῦ καὶ ἐξελέξατο ἑαυτῷ πέντε λίθους λείους ἐκ τοῦ χειµάρρου καὶ ἔθετο αὐτοὺς ἐν τῷ καδίῳ τῷ ποιµενικῷ τῷ ὄντι αὐτῷ εἰς συλλογὴν καὶ σφενδόνην αὐτοῦ ἐν τῇ χειρὶ αὐτοῦ καὶ προσῆλθεν πρὸς τὸν ἄνδρα τὸν ἀλλόφυλον.						
First Samuel	17	17	41	OT	1. OT	Historical Books	2. Historical Books	02. Historical Books	04. First Samuel		ⲡⲁⲗⲗⲟⲫⲩⲗⲟⲥ ϩⲱⲱϥ. ⲁϥⲙⲟⲟϣⲉ ⲉϩⲟⲩⲛ ⲉⲇⲁⲩⲉⲓⲇ. ⲉϥϣⲟⲩϣⲟⲩ ⲙ̅ⲙⲟϥ. ⲉⲣⲉ ⲡⲉⲧϥⲓ̈ ⲙ̅ⲡⲉϥⲑⲩⲣⲱⲛ ϩⲓ̈ϩⲏ ⲙ̅ⲙⲟϥ.								
First Samuel	17	17	42	OT	1. OT	Historical Books	2. Historical Books	02. Historical Books	04. First Samuel	ⲟⲩⲟϩ ⲁϥⲛⲁⲩ ⲛ̀ϫⲉ ⲅⲟⲗⲓⲁⲑ ⲉ̀ⲇⲁⲩⲓⲇ ⲟⲩⲟϩ ⲁϥϣⲟϣϥϥ ϫⲉ ⲛ̀ⲑⲟϥ ⲡⲉ ⲟⲩⲟϩ ⲛ̀ⲑⲟϥ ⲛⲁϥⲧⲟⲣϣ ⲡⲉ ⲛⲉⲙ ⲑⲙⲉⲧⲥⲁⲓⲉ ⲛ̀ⲧⲉ ⲛⲉϥⲃⲁⲗ	ⲡⲁⲗⲗⲟⲫⲩⲗⲟⲥ ⲇⲉ ⲁϥϭⲱϣⲧ̅. ⲁϥⲛⲁⲩ ⲉⲇⲁⲩⲉⲓⲇ. ⲁϥⲕⲱⲙϣ̅ ⲛ̅ⲥⲱϥ ϫⲉ ⲛⲉⲩϣⲏⲣⲉ ϣⲏⲙ ⲡⲉ. ⲉϥⲟ ⲙ̅ⲙⲣϣ̅. ⲛ̅ⲥⲁⲉⲓⲉⲃⲁⲗ ⲉⲣⲟϥ.	And Goliath saw David, and despised him; for he was a lad, and ruddy, with a fair countenance.	καὶ εἶδεν Γολιαδ τὸν Δαυιδ καὶ ἠτίµασεν αὐτόν, ὅτι αὐτὸς ἦν παιδάριον καὶ αὐτὸς πυρράκης µετὰ κάλλους ὀφθαλµῶν.						
First Samuel	17	17	43	OT	1. OT	Historical Books	2. Historical Books	02. Historical Books	04. First Samuel	ⲟⲩⲟϩ ⲡⲉϫⲉ ⲡⲓⲁⲗⲗⲟⲫⲩⲗⲟⲥ ⲟⲩⲃⲉ ⲇⲁⲩⲓⲇ ϫⲉ ⲙⲏ ⲁ̀ⲛⲟⲕ ⲙ̀ⲫⲣⲏϯ ⲛ̀ⲟⲩⲟⲩϩⲱⲣ ⲁ̀ⲛⲟⲕ ϫⲉ ⲛ̀ⲑⲟⲕ ⲭⲛⲏⲟⲩ ϩⲁⲣⲟⲓ ϧⲉⲛ ⲟⲩϣⲃⲱⲧ ⲛⲉⲙ ϩⲁⲛⲱⲛⲓ ⲟⲩⲟϩ ⲡⲉϫⲉ ⲇⲁⲩⲓⲇ ϫⲉ ⲙ̀ⲙⲟⲛ ⲁⲗⲗⲁ ⲕϩⲱⲟⲩ ⲉϩⲟⲧⲉ ⲟⲩϩⲱⲣ ⲟⲩⲟϩ ⲁϥⲥⲁϩⲟⲩⲓ ⲛ̀ϫⲉ ⲡⲓⲁⲗⲗⲟⲫⲩⲗⲟⲥ ⲉ̀ⲇⲁⲩⲓⲇ ⲛ̀ϧⲣⲏⲓ ϧⲉⲛ ⲛⲉϥⲛⲟⲩϯ	ⲁⲩⲱ ⲡⲁⲗⲗⲟⲫⲩⲗⲟⲥ ⲡⲉϫⲁϥ ⲉϩⲟⲩⲛ ϩⲛ̅ ⲇⲁⲩⲉⲓⲇ. ϫⲉ ⲉⲓ̈ⲟ ⲁⲛⲟⲕ ⲛ̅ⲑⲉ ⲛ̅ⲟⲩⲟⲩϩⲟⲣ. ϫⲉ ⲛ̅ⲧⲟⲕ ⲉⲕⲛⲏⲩ ⲉⲃⲟⲗ ⲉⲣⲟϥ. ϩⲛ̅ ⲟⲩϭⲉⲣⲱⲃ. ⲙⲛ̅ ϩⲉⲛⲱⲛⲉ ⲡⲉϫⲉ ⲇⲁⲩⲉⲓⲇ ⲛⲁϥ ϫⲉ ⲁⲣⲏⲩ ⲕϩⲟⲟⲩ ⲉⲡⲉⲩϩⲟⲣ. ⲁⲩⲱ ⲡⲁⲗⲗⲟⲫⲩⲗⲟⲥ ⲁϥⲥⲁϩⲟⲩ ⲛ̅ⲇⲁⲩⲉⲓⲇ ϩⲛ̅ ⲛⲉϥⲛⲟⲩⲧⲉ.	And the Philistine said to David, Am I as a dog, that thou comest against me with a staff and stones? [and David said, Nay, but worse than a dog.] And the Philistine cursed David by his gods.	καὶ εἶπεν ὁ ἀλλόφυλος πρὸς Δαυιδ Ὡσεὶ κύων ἐγώ εἰµι, ὅτι σὺ ἔρχῃ ἐπ’ ἐµὲ ἐν ῥάβδῳ καὶ λίθοις; καὶ εἶπεν Δαυιδ Οὐχί, ἀλλ’ ἢ χείρω κυνός. καὶ κατηράσατο ὁ ἀλλόφυλος τὸν Δαυιδ ἐν τοῖς θεοῖς αὐτοῦ.						
First Samuel	17	17	44	OT	1. OT	Historical Books	2. Historical Books	02. Historical Books	04. First Samuel	ⲟⲩⲟϩ ⲡⲉϫⲉ ⲡⲓⲁⲗⲗⲟⲫⲩⲗⲟⲥ ⲉ̀ⲇⲁⲩⲓⲇ ϫⲉ ⲁⲙⲟⲓ ϩⲁⲣⲟⲓ ⲛ̀ⲧⲁϯ ⲛ̀ⲛⲉⲕⲁϥⲟⲩⲓ ⲛ̀ⲛⲓϩⲁⲗⲁϯ ⲛ̀ⲧⲉ ⲧⲫⲉ ⲛⲉⲙ ⲛⲓⲑⲏⲣⲓⲟⲛ ⲛ̀ⲧⲉ ⲡⲕⲁϩⲓ	ⲉⲣⲉ ⲡⲁⲗⲗⲟⲫⲩⲗⲟⲥ ϫⲱ ⲙ̅ⲙⲟⲥ ⲉⲣⲟϥ. ϫⲉ ⲁⲙⲟⲩ ⲛⲁⲓ̈. ⲛ̅ⲧⲁϯ ⲛ̅ⲛⲉⲕⲁⲃⲟⲩⲓ̈ ⲛ̅ⲛⲉϩⲁⲗⲁⲧⲉ ⲛ̅ⲧⲡⲉ. ⲁⲩⲱ ⲛ̅ⲛⲉⲑⲩⲣⲓⲟⲛ ⲙ̅ⲡⲕⲁϩ	And the Philistine said to David, Come to me, and I will give thy flesh to the birds of the air, and to the beasts of the earth.	καὶ εἶπεν ὁ ἀλλόφυλος πρὸς Δαυιδ Δεῦρο πρός µε, καὶ δώσω τὰς σάρκας σου τοῖς πετεινοῖς τοῦ οὐρανοῦ καὶ τοῖς κτήνεσιν τῆς γῆς.						
First Samuel	17	17	45	OT	1. OT	Historical Books	2. Historical Books	02. Historical Books	04. First Samuel	ⲟⲩⲟϩ ⲡⲉϫⲉ ⲇⲁⲩⲓⲇ ⲟⲩⲃⲉ ⲡⲓⲁⲗⲗⲟⲫⲩⲗⲟⲥ ϫⲉ ⲛ̀ⲑⲟⲕ ⲭⲛⲏⲟⲩ ⲉ̀ϧⲟⲩⲛ ϩⲁⲣⲟⲓ ϧⲉⲛ ⲟⲩⲥⲏϥⲓ ⲛⲉⲙ ⲟⲩⲛⲁⲩⲓ ⲛⲉⲙ ⲟⲩϩⲟⲡⲗⲟⲛ ⲁ̀ⲛⲟⲕ ⲇⲉ ϯϧⲱⲛⲧ ϣⲁⲣⲟⲕ ϧⲉⲛ ⲫⲣⲁⲛ ⲙ̀ⲡϭ̅ⲥ̅ ⲥⲁⲃⲁⲱⲑ ⲫϯ ⲛ̀ⲧⲉ ϯⲑⲱⲟⲩⲧⲥ ⲛ̀ⲧⲉ ⲡⲓⲥ̅ⲗ̅ ⲑⲏ ⲉⲧ ⲁⲕϯϣⲱϣ ⲛⲁⲥ ⲙ̀ⲫⲟⲟⲩ	ⲇⲁⲩⲉⲓⲇ ⲇⲉ ⲡⲉϫⲁϥ ⲉϩⲟⲩⲛ ϩⲙ̅ ⲡⲁⲗⲗⲟⲫⲩⲗⲟⲥ. ϫⲉ ⲛ̅ⲧⲟⲕ ⲉⲕⲛⲁⲉⲓ ⲛⲁⲓ̈ ϩⲛ̅ ⲟⲩⲥⲏϥⲉ. ⲙⲛ̅ ⲟⲩⲙⲉⲣⲉϩ. ⲙⲛ̅ ⲟⲩϩⲟⲡⲗⲟⲛ. ⲁⲛⲟⲕ ⲇⲉ ⲉⲓ̈ⲛⲏⲩ ⲉϩⲟⲩⲛ ⲉⲣⲟⲕ ϩⲙ̅ ⲡⲣⲁⲛ ⲙ̅ⲡϫⲟⲉⲓⲥ ⲥⲁⲃⲃⲁⲱⲑ. ⲡⲛⲟⲩⲧⲉ ⲙ̅ⲡⲙⲏⲏϣⲉ ⲙ̅ⲡⲓⲏ̅ⲗ̅. ⲡⲁⲓ̈ ⲛ̅ⲧⲁⲕⲛⲉϭⲛⲟⲩϭϥ ⲙ̅ⲡⲟⲟⲩ.	And David said to the Philistine, Thou comest to me with sword, and with spear, and with shield; but I come to thee in the name of the Lord God of hosts of the army of Israel, which thou hast defied	καὶ εἶπεν Δαυιδ πρὸς τὸν ἀλλόφυλον Σὺ ἔρχῃ πρός µε ἐν ῥοµφαίᾳ καὶ ἐν δόρατι καὶ ἐν ἀσπίδι, κἀγὼ πορεύοµαι πρὸς σὲ ἐν ὀνόµατι κυρίου σαβαωθ θεοῦ παρατάξεως Ισραηλ, ἣν ὠνείδισας σήµερον·						
First Samuel	17	17	46	OT	1. OT	Historical Books	2. Historical Books	02. Historical Books	04. First Samuel	ⲟⲩⲟϩ ⲉⲣⲉ ⲫϯ ⲙⲁϣⲑⲁⲙ ⲛ̀ⲣⲱⲕ ⲙ̀ⲫⲟⲟⲩ ϧⲉⲛ ⲧⲁϫⲓϫ ⲟⲩⲟϩ ϯⲛⲁϧⲟⲑⲃⲉⲕ ⲛ̀ⲧⲁⲱⲗⲓ ⲛ̀ⲧⲉⲕⲛⲁϩⲃⲓ ⲉ̀ⲃⲟⲗ ⲙ̀ⲙⲟⲕ ⲟⲩⲟϩ ⲉⲓⲉ̀ϯ ⲛ̀ⲛⲉⲕⲕⲉⲗⲓ ⲛⲉⲙ ⲛⲉⲛⲕⲉⲗⲓ ⲛ̀ϯⲡⲁⲣⲉⲙⲃⲟⲗⲏ ⲛ̀ⲧⲉ ⲛⲓⲁⲗⲗⲟⲫⲩⲗⲟⲥ ⲛ̀ϧⲣⲏⲓ ϧⲉⲛ ⲡⲁⲓⲉϩⲟⲟⲩ ⲛ̀ⲛⲓϩⲁⲗⲁϯ ⲛ̀ⲧⲉ ⲧⲫⲉ ⲛⲉⲙ ⲛⲓⲑⲏⲣⲓⲟⲛ ⲧⲏⲣⲟⲩ ⲛ̀ⲧⲉ ⲡⲕⲁϩⲓ ⲟⲩⲟϩ ⲉϥⲉ̀ⲉⲙⲓ ⲛ̀ϫⲉ ⲡⲕⲁϩⲓ ⲧⲏⲣϥ ϫⲉ ⲫϯ ϣⲟⲡ ϧⲉⲛ ⲡⲓⲥ̅ⲗ̅	ⲁⲩⲱ ⲡϫⲟⲉⲓⲥ ⲛⲁⲧⲁⲁⲕ ⲙ̅ⲡⲟⲟⲩ ⲉϩⲣⲁⲓ̈ ⲉⲛⲁϭⲓϫ. ⲛϥ̅ⲧⲣⲁϩⲟⲧⲃⲉⲕ. ⲛ̅ⲧⲁϥⲓ̈ ⲙ̅ⲙⲁⲩ ⲛ̅ⲧⲉⲕⲁⲡⲉ. ⲛ̅ⲧⲁϯ ⲛ̅ⲛⲉⲕϣⲁⲩ. ⲁⲩⲱ ⲛ̅ϣⲁⲩ ⲛ̅ⲧⲡⲁⲣⲉⲙⲃⲟⲗⲏ ⲛ̅ⲛ̅ⲁⲗⲗⲟⲫⲩⲗⲟⲥ. ϩⲙ̅ ⲡⲟⲟⲩ ⲛ̅ϩⲟⲟⲩ ⲛ̅ⲛⲉϩⲁⲗⲁⲧⲉ ⲛ̅ⲧⲡⲉ. ⲙⲛ̅ ⲛⲉⲑⲩⲣⲓⲟⲛ ⲙ̅ⲡⲕⲁϩ ⲛ̅ⲧⲉ ⲡⲕⲁϩ ⲧⲏⲣϥ̅ ⲉⲓⲙⲉ ϫⲉ ⲡⲛⲟⲩⲧⲉ ϣⲟⲟⲡ ϩⲙ̅ ⲡⲓⲏ̅ⲗ̅	this day. And the Lord shall deliver thee this day into my hand; and I will slay thee, and take away thy head from off thee, and will give thy limbs and the limbs of the army of the Philistines this day to the birds of the sky, and to the wild beasts of the earth; and all the earth shall know that there is a God in Israel.	καὶ ἀποκλείσει σε κύριος σήµερον εἰς τὴν χεῖρά µου, καὶ ἀποκτενῶ σε καὶ ἀφελῶ τὴν κεφαλήν σου ἀπὸ σοῦ καὶ δώσω τὰ κῶλά σου καὶ τὰ κῶλα παρεµβολῆς ἀλλοφύλων ἐν ταύτῃ τῇ ἡµέρᾳ τοῖς πετεινοῖς τοῦ οὐρανοῦ καὶ τοῖς θηρίοις τῆς γῆς, καὶ γνώσεται πᾶσα ἡ γῆ ὅτι ἔστιν θεὸς ἐν Ισραηλ·						
First Samuel	17	17	47	OT	1. OT	Historical Books	2. Historical Books	02. Historical Books	04. First Samuel	ⲟⲩⲟϩ ⲥⲉⲉⲙⲓ ⲛ̀ϫⲉ ⲧⲁⲓⲑⲱⲟⲩⲧⲥ ⲧⲏⲣⲥ ϫⲉ ⲙ̀ⲡⲁⲣⲉ ⲡϭ̅ⲥ̅ ⲛⲟϩⲉⲙ ϧⲉⲛ ⲧⲥⲏϥⲓ ⲛⲉⲙ ⲟⲩⲛⲁⲩⲓ ϫⲉ ⲟⲩⲏⲓ ⲡⲡⲟⲗⲉⲙⲟⲥ ⲫⲁ ⲡϭ̅ⲥ̅ ⲡⲉ ⲟⲩⲟϩ ⲉϥⲉ̀ϯ ⲑⲏⲛⲟⲩ ⲉ̀ϧⲣⲏⲓ ⲉ̀ⲛⲉⲛϫⲓϫ	ⲁⲩⲱ ⲧⲉⲓ̈ⲥⲟⲟⲩϩⲥ ⲧⲏⲣⲥ̅ ⲛⲁⲉⲓⲙⲉ. ϫⲉ ⲛⲉⲣⲉ ⲡϫⲟⲉⲓⲥ ⲛⲁⲧⲟⲩϫⲉ ⲡⲣⲱⲙⲉ ⲁⲛ ϩⲛ̅ ⲟⲩⲥⲏϥⲉ. ⲟⲩⲇⲉ ϩⲛ̅ ⲟⲩⲙⲉⲣⲉϩ. ϫⲉ ⲡⲡⲟⲗⲩⲙⲟⲥ ⲣⲱ ⲡⲁⲡϫⲟⲉⲓⲥ ⲡⲉ. ⲁⲩⲱ ϥⲛⲁⲡⲁⲣⲁⲇⲓⲇⲟⲩ ⲙ̅ⲙⲱⲧⲛ̅ ⲉϩⲣⲁⲓ̈ ⲉⲧⲟⲟⲧⲛ̅.	And all this assembly shall know that the Lord delivers not by sword or spear, for the battle is the Lord’s, and the Lord will deliver you into our hands.	καὶ γνώσεται πᾶσα ἡ ἐκκλησία αὕτη ὅτι οὐκ ἐν ῥοµφαίᾳ καὶ δόρατι σῴζει κύριος, ὅτι τοῦ κυρίου ὁ πόλεµος, καὶ παραδώσει κύριος ὑµᾶς εἰς χεῖρας ἡµῶν.						
First Samuel	17	17	48	OT	1. OT	Historical Books	2. Historical Books	02. Historical Books	04. First Samuel	ⲟⲩⲟϩ ⲁϥⲧⲱⲛϥ ⲛ̀ϫⲉ ⲡⲓⲁⲗⲗⲟⲫⲩⲗⲟⲥ ⲁϥϣⲉ ⲛⲁϥ ⲉ̀ϩⲣⲉⲛ ⲇⲁⲩⲓⲇ	ⲡⲁⲗⲗⲟⲫⲩⲗⲟⲥ ⲇⲉ ⲁϥⲧⲱⲟⲩⲛ. ⲁϥⲙⲟⲟϣⲉ ⲉϩⲟⲩⲛ ⲉⲇⲁⲩⲉⲓⲇ. ⲁⲩⲱ ⲇⲁⲩⲉⲓⲇ ⲁϥⲁⲛⲅϥ̅ ⲉϩⲣⲁⲓ̈. ⲁϥⲓ̈ ⲉⲧⲙⲏⲧⲉ ⲙ̅ⲡⲉⲙⲗⲁϩ. ⲁϥⲙⲟⲟϣⲉ ⲉϩⲟⲩⲛ ⲉⲡⲁⲗⲗⲟⲫⲩⲗⲟⲥ.	And the Philistine arose and went to meet David.	καὶ ἀνέστη ὁ ἀλλόφυλος καὶ ἐπορεύθη εἰς συνάντησιν Δαυιδ.						
First Samuel	17	17	49	OT	1. OT	Historical Books	2. Historical Books	02. Historical Books	04. First Samuel	ⲟⲩⲟϩ ⲁ ⲇⲁⲩⲓⲇ ⲥⲟⲩⲧⲉⲛ ⲧⲉϥϫⲓϫ ⲉ̀ⲃⲟⲗ ⲛ̀ϧⲣⲏⲓ ϧⲉⲛ ⲡⲉϥⲕⲁⲧⲟⲥ ⲟⲩⲟϩ ⲁϥϭⲓ ⲉ̀ⲃⲟⲗ ⲙ̀ⲙⲁⲩ ⲛ̀ⲟⲩⲱⲛⲓ ⲛ̀ⲟⲩⲱⲧ ⲟⲩⲟϩ ⲁϥⲧⲉⲛⲑⲱⲛϥ ϧⲉⲛ ϯⲥⲫⲉⲛⲧⲟⲡⲏ ⲟⲩⲟϩ ⲁϥϣⲁⲣⲓ ⲉ̀ⲣⲟϥ ϧⲉⲛ ⲧⲉϥⲧⲉϩⲛⲓ ⲟⲩⲟϩ ⲁϥϩⲉⲓ ϩⲓϫⲉⲛ ⲡⲉϥϩⲟ ϩⲓϫⲉⲛ ⲡⲓⲕⲁϩⲓ	ⲇ̅ⲁ̅ⲇ̅ ⲇⲉ ⲁϥⲥⲟⲩⲧⲛ̅ ⲧⲟⲟⲧϥ̅ ⲉⲃⲟⲗ ⲉϩⲣⲁⲓ̈ ⲉⲡⲉϥϫⲓ̈ⲗⲗⲏⲥ ⲁϥϥⲓ̈ ⲛ̅ϩⲏⲧϥ̅ ⲛ̅ⲟⲩⲱⲛⲉ ⲛ̅ⲟⲩⲱⲧ. ⲁϥⲕⲁⲁϥ ϩⲛ̅ ⲧⲉϥⲥⲫⲉⲛⲇⲟⲛⲏ. ⲁϥϩⲣⲟⲩⲱⲣϥ̅ ⲉⲃⲟⲗ ⲉⲡⲁⲗⲗⲟⲫⲩⲗⲟⲥ. ⲁϥⲣⲁϩⲧϥ ⲉϩⲟⲩⲛ ⲉⲧⲉϥⲧⲉϩⲛⲉ. ⲡⲱⲛⲉ ⲇⲉ. ⲁϥϫⲉⲧ ⲧⲡⲉⲣⲓⲕⲉⲫⲁⲗⲉⲁ ⲉϩⲟⲩⲛ ϩⲛ̅ ⲧⲉϥⲧⲉϩⲛⲉ. ⲁϥϩⲉ ⲉⲡⲉⲥⲏⲧ ϩⲓ̈ϫⲙ̅ ⲡⲉϥϩⲟ.	And David stretched out his hand to his scrip, and took thence a stone, and slang it, and smote the Philistine on his forehead, and the stone penetrated through the helmet into his forehead, and he fell upon his face to the ground.	καὶ ἐξέτεινεν Δαυιδ τὴν χεῖρα αὐτοῦ εἰς τὸ κάδιον καὶ ἔλαβεν ἐκεῖθεν λίθον ἕνα καὶ ἐσφενδόνησεν καὶ ἐπάταξεν τὸν ἀλλόφυλον ἐπὶ τὸ µέτωπον αὐτοῦ, καὶ διέδυ ὁ λίθος διὰ τῆς περικεφαλαίας εἰς τὸ µέτωπον αὐτοῦ, καὶ ἔπεσεν ἐπὶ πρόσωπον αὐτοῦ ἐπὶ τὴν γῆν.						
First Samuel	17	17	50	OT	1. OT	Historical Books	2. Historical Books	02. Historical Books	04. First Samuel		ⲇⲁⲩⲉⲓⲇ ⲇⲉ ⲁϥϫⲣⲟ ⲉⲡⲁⲗⲗⲟⲫⲩⲗⲟⲥ ϩⲛ̅ ⲧⲉϥⲥⲫⲉⲛⲧⲱⲛⲓ. ⲁⲩⲱ ϩⲙ̅ ⲡⲉϥⲱⲛⲉ. ⲁϥⲉⲣ ⲡⲁⲗⲗⲟⲫⲩⲗⲟⲥ ⲛ̅ϭⲱⲃ ⲁϥⲙⲟⲟⲩⲧϥ̅. ⲛⲉⲙⲛ̅ ⲥⲏϥⲉ ⲇⲉ ⲛ̅ⲧⲟⲟⲧϥ̅ ⲛ̅ⲧⲁⲩⲉⲓⲇ.								
First Samuel	17	17	51	OT	1. OT	Historical Books	2. Historical Books	02. Historical Books	04. First Samuel	ⲟⲩⲟϩ ⲁϥϭⲟϫⲓ ⲛ̀ϫⲉ ⲇⲁⲩⲓⲇ ⲁϥⲟϩⲓ ⲉ̀ⲣⲁⲧϥ ϩⲓϫⲱϥ ⲟⲩⲟϩ ⲁϥⲱⲗⲓ ⲛ̀ⲧⲉϥⲥⲏϥⲓ ⲁϥϧⲟⲑⲃⲉϥ ⲁϥⲱⲗⲓ ⲛ̀ⲧⲉϥⲁⲫⲉ ⲉ̀ⲃⲟⲗ ⲙ̀ⲙⲟϥ ⲟⲩⲟϩ ⲉⲧⲁⲩⲛⲁⲩ ⲛ̀ϫⲉ ⲛⲓⲁⲗⲗⲟⲫⲩⲗⲟⲥ ϫⲉ ⲁϥⲙⲟⲩ ⲛ̀ϫⲉ ⲡⲟⲩⲣⲉⲙⲛ̀ϫⲟⲙ ⲁⲩⲫⲱⲧ	ⲁϥϯ ⲙ̅ⲡⲉϥⲟⲩⲟⲓ̈. ⲁϥⲁϩⲉⲣⲁⲧϥ̅ ⲉϫⲉⲙ ⲡⲁⲗⲗⲟⲫⲩⲗⲟⲥ. ⲁϥⲁⲙⲁϩⲧⲉ ⲛ̅ⲧⲉϥⲥⲏϥⲉ. ⲁϥⲧⲟⲕⲙⲉⲥ ⲉⲃⲟⲗ ϩⲙ̅ ⲡⲉⲥⲕⲟⲉⲓϩ ⲁϥⲙⲟⲟⲩⲧϥ̅. ⲁϥⲥⲉⲗⲉⲡ ⲧⲉϥⲁⲡⲉ ⲛ̅ϩⲏⲧⲥ̅. ⲛ̅ⲁⲗⲗⲟⲫⲩⲗⲟⲥ ⲇⲉ ⲛ̅ⲧⲉⲣⲟⲩⲛⲁⲩ. ϫⲉ ⲁ ⲡⲉⲩⲗⲉⲙⲏⲏϣⲉ ⲙⲟⲩ. ⲁⲩϯϩⲣⲟⲟⲩ ⲉⲃⲟⲗ ⲁⲩⲡⲱⲧ.	And David ran, and stood upon him, and took his sword, and slew him, and cut off his head: and the Philistines saw that their champion was dead, and they fled.	καὶ ἔδραµεν Δαυιδ καὶ ἐπέστη ἐπ’ αὐτὸν καὶ ἔλαβεν τὴν ῥοµφαίαν αὐτοῦ καὶ ἐθανάτωσεν αὐτὸν καὶ ἀφεῖλεν τὴν κεφαλὴν αὐτοῦ. καὶ εἶδον οἱ ἀλλόφυλοι ὅτι τέθνηκεν ὁ δυνατὸς αὐτῶν, καὶ ἔφυγον.						
First Samuel	17	17	52	OT	1. OT	Historical Books	2. Historical Books	02. Historical Books	04. First Samuel	ⲟⲩⲟϩ ⲁⲩⲧⲱⲟⲩⲛⲟⲩ ⲛ̀ϫⲉ ⲛⲓⲣⲱⲙⲓ ⲛ̀ⲧⲉ ⲡⲓⲥ̅ⲗ̅ ⲛⲉⲙ ⲓⲟⲩⲇⲁ ⲉⲩϣⲗⲏⲗⲟⲩⲓ ⲟⲩⲟϩ ⲁⲩϭⲟϫⲓ ⲛ̀ⲥⲱⲟⲩ ϣⲁ ⲉ̀ϩⲣⲏⲓ ⲉ̀ⲫⲓⲟⲙ ⲛⲉⲙ ⲡⲓⲙⲱⲓⲧ ⲉ̀ϧⲟⲩⲛ ⲛ̀ⲧⲉ ⲅⲉⲑ ϣⲁ ⲉ̀ϧⲟⲩⲛ ⲉ̀ϯⲡⲩⲗⲏ ⲛ̀ⲧⲉ ⲁⲥⲕⲁⲗⲱⲛ ⲟⲩⲟϩ ⲁⲩϩⲉⲓ ⲛ̀ϫⲉ ϩⲁⲛϧⲱⲧⲉⲃ ⲛ̀ⲧⲉ ⲛⲓⲁⲗⲗⲟⲫⲩⲗⲟⲥ ϧⲉⲛ ⲛⲓⲙⲱⲓⲧ ⲛ̀ⲧⲉ ⲛ̀ⲧⲉ ⲛⲓⲡⲩⲗⲏ ⲛⲉⲙ ϣⲁ ⲉ̀ϩⲣⲏⲓ ⲉ̀ⲅⲉⲑ ⲛⲉⲙ ϣⲁ ⲉ̀ϩⲣⲏⲓ ⲉ̀ⲁⲕⲕⲁⲣⲱⲛ	ⲛ̅ⲣⲱⲙⲉ ⲇⲉ ⲙ̅ⲡⲓⲏ̅ⲗ̅. ⲁⲩⲧⲱⲟⲩⲛ ⲙⲛ̅ ⲛ̅ⲣⲱⲙⲉ ⲛ̅ⲓ̈ⲟⲩⲇⲁ. ⲁⲩⲛⲉϫ ⲗⲟⲩⲗⲁⲓ ⲉⲃⲟⲗ ⲁⲩⲡⲱⲧ ⲛ̅ⲥⲁ ⲛ̅ⲁⲗⲗⲟⲫⲩⲗⲟⲥ. ϣⲁ ⲧⲉϩⲓ̈ⲏ ⲛ̅ⲃⲱⲕ ⲉϩⲟⲩⲛ ⲉⲅⲉⲑ. ⲉⲩⲛⲁⲧⲁⲁⲩ ⲉϩⲟⲩⲛ ⲉⲣⲟⲥ. ⲁⲩⲱ ϣⲁ ⲙ̅ⲡⲩⲗⲏ ⲛ̅ⲁⲥⲕⲁⲗⲱⲛ. ⲁⲩϩⲉ ⲛ̅ϭⲓ ⲛ̅ϩⲁⲧⲃⲉⲥ ⲛ̅ⲛ̅ⲁⲗⲗⲟⲫⲩⲗⲟⲥ ϩⲛ̅ ⲧⲉϩⲓ̈ⲏ ⲛ̅ⲛⲉⲡⲩⲗⲏ ϣⲁ ⲉϩⲣⲁⲓ̈ ⲉⲅⲉⲑ. ⲁⲩⲱ ϣⲁ ⲉϩⲣⲁⲓ̈ ⲉⲁⲕⲕⲁⲣⲱⲛ.	And the men of Israel and Juda arose, and shouted and pursued them as far as the entrance to Geth, and as far as the gate of Ascalon: and the slain men of the Philistines fell in the way of the gates, both to Geth, and to Accaron.	καὶ ἀνίστανται ἄνδρες Ισραηλ καὶ Ιουδα καὶ ἠλάλαξαν καὶ κατεδίωξαν ὀπίσω αὐτῶν ἕως εἰσόδου Γεθ καὶ ἕως τῆς πύλης Ἀσκαλῶνος, καὶ ἔπεσαν τραυµατίαι τῶν ἀλλοφύλων ἐν τῇ ὁδῷ τῶν πυλῶν καὶ ἕως Γεθ καὶ ἕως Ακκαρων.						
First Samuel	17	17	53	OT	1. OT	Historical Books	2. Historical Books	02. Historical Books	04. First Samuel	ⲟⲩⲟϩ ⲁⲩⲧⲁⲥⲟ ⲛ̀ϫⲉ ⲛⲓⲣⲱⲙⲓ ⲛ̀ⲧⲉ ⲡⲓⲥ̅ⲗ̅ ⲁⲩϭⲟϫⲓ ⲥⲁⲫⲁϩⲟⲩ ⲛ̀ⲛⲓⲁⲗⲗⲟⲫⲩⲗⲟⲥ ⲟⲩⲟϩ ⲛⲁⲩϩⲱⲙⲓ ⲉ̀ϩⲣⲏⲓ ⲉ̀ϫⲉⲛ ⲛⲟⲩⲡⲁⲣⲉⲙⲃⲟⲗⲏ	ⲛ̅ⲣⲱⲙⲉ ⲇⲉ ⲙ̅ⲡⲓⲏ̅ⲗ̅ ⲁⲩⲕⲧⲟⲟⲩ ⲉⲃⲟⲗ ϩⲛ̅ ⲛ̅ⲁⲗⲗⲟⲫⲩⲗⲟⲥ. ⲁⲩⲧⲁⲁⲩ ⲉϩⲣⲁⲓ̈ ⲉⲛⲉⲩⲡⲁⲣⲉⲙⲃⲟⲗⲏ ⲁⲩϣⲱⲗ ⲙ̅ⲙⲟⲟⲩ.	And the men of Israel returned from pursuing after the Philistines, and they destroyed their camp.	καὶ ἀνέστρεψαν ἄνδρες Ισραηλ ἐκκλίνοντες ὀπίσω τῶν ἀλλοφύλων καὶ κατεπάτουν τὰς παρεµβολὰς αὐτῶν.						
First Samuel	17	17	54	OT	1. OT	Historical Books	2. Historical Books	02. Historical Books	04. First Samuel	ⲟⲩⲟϩ ⲁ ⲇⲁⲩⲓⲇ ⲱⲗⲓ ⲛ̀ⲧⲁⲫⲉ ⲙ̀ⲡⲓⲁⲗⲗⲟⲫⲩⲗⲟⲥ ⲁϥⲉⲛⲥ ⲉ̀ϩⲣⲏⲓ ⲉ̀ⲓⲗ̅ⲏ̅ⲙ̅ ⲟⲩⲟϩ ⲛⲉϥⲥⲕⲉⲩⲟⲥ ⲁϥⲭⲁⲩ ϧⲁ ⲡⲉϥⲙⲁⲛ̀ϣⲱⲡⲓ	ⲁⲩⲱ ⲇⲁⲩⲉⲓⲇ. ⲁϥϫⲓ̈ ⲛ̅ⲧⲁⲡⲉ ⲙ̅ⲡⲁⲗⲗⲟⲫⲩⲗⲟⲥ. ⲁϥⲛ̅ⲧⲥ̅ ⲉϩⲣⲁⲓ̈ ⲉⲑⲓⲗ̅ⲏ̅ⲙ̅ ⲁⲩⲱ ⲛⲉϥⲥⲕⲏⲩⲉ. ⲁϥⲕⲁⲁⲩ ⲉϩⲣⲁⲓ̈ ϩⲛ̅ ⲧⲉⲥⲕⲩⲛⲏ.	And David took the head of the Philistine, and brought it to Jerusalem; but he put his armour in his tent.	καὶ ἔλαβεν Δαυιδ τὴν κεφαλὴν  τοῦ ἀλλοφύλου καὶ ἤνεγκεν αὐτὴν εἰς Ιερουσαληµ καὶ τὰ σκεύη αὐτοῦ ἔθηκεν ἐν τῷ σκηνώµατι αὐτοῦ.						
First Samuel	18	18	1	OT	1. OT	Historical Books	2. Historical Books	02. Historical Books	04. First Samuel										
First Samuel	18	18	2	OT	1. OT	Historical Books	2. Historical Books	02. Historical Books	04. First Samuel										
First Samuel	18	18	3	OT	1. OT	Historical Books	2. Historical Books	02. Historical Books	04. First Samuel										
First Samuel	18	18	4	OT	1. OT	Historical Books	2. Historical Books	02. Historical Books	04. First Samuel										
First Samuel	18	18	5	OT	1. OT	Historical Books	2. Historical Books	02. Historical Books	04. First Samuel										
First Samuel	18	18	6	OT	1. OT	Historical Books	2. Historical Books	02. Historical Books	04. First Samuel	ⲟⲩⲟϩ ⲁⲩⲓ̀ ⲉ̀ⲃⲟⲗ ⲛ̀ϫⲉ ⲛⲓϩⲓⲟⲙⲓ ⲉⲩϩⲱⲥ ⲉ̀ϧⲟⲩⲛ ⲉ̀ϩⲣⲉⲛ ⲇⲁⲩⲓⲇ ⲉ̀ⲃⲟⲗ ϧⲉⲛ ⲛⲓⲃⲁⲕⲓ ⲧⲏⲣⲟⲩ ⲛ̀ⲧⲉ ⲡⲓⲥ̅ⲗ̅ ⲛ̀ϧⲣⲏⲓ ϧⲉⲛ ϩⲁⲛⲕⲉⲙⲉⲕⲉⲙ ⲛⲉⲙ ⲟⲩⲣⲁϣⲓ ⲛⲉⲙ ϩⲁⲛⲕⲩⲙⲃⲁⲗⲟⲛ	ⲛⲉⲧⲭⲟⲣⲉⲩⲉ ⲇⲉ ⲁⲩⲉⲓ ⲉⲃⲟⲗ ϩⲏⲧϥ̅ ⲛ̅ⲇⲁⲩⲉⲓⲇ ⲉⲃⲟⲗ ϩⲛ̅ ⲛⲉⲡⲟⲗⲓⲥ ⲧⲏⲣⲟⲩ ⲙ̅ⲡⲓⲏ̅ⲗ̅ ⲙⲛ̅ ⲛⲉⲩⲕⲟⲩⲕⲙ̅. ⲁⲩⲱ ⲛⲉⲩⲕⲩⲙⲃⲁⲗⲟⲛ ϩⲛ̅ ⲟⲩⲣⲁϣⲉ.	And there came out women in dances to meet David out of all the cities of Israel, with timbrels, and with rejoicing, and with cymbals.	Καὶ ἐξῆλθον αἱ χορεύουσαι εἰς συνάντησιν Δαυιδ ἐκ πασῶν πόλεων Ισραηλ ἐν τυµπάνοις καὶ ἐν χαρµοσύνῃ καὶ ἐν κυµβάλοις,						
First Samuel	18	18	7	OT	1. OT	Historical Books	2. Historical Books	02. Historical Books	04. First Samuel	ⲟⲩⲟϩ ⲛⲁⲩϩⲱⲥ ⲛ̀ϫⲉ ⲛⲓϩⲓⲟⲙⲓ ⲁⲩϫⲱ ⲙ̀ⲙⲟⲥ ϫⲉ ⲥⲁⲟⲩⲗ ⲁϥϣⲁⲣⲓ ϧⲉⲛ ⲛⲉϥⲁⲛⲁⲛϣⲟ ⲟⲩⲟϩ ⲇⲁⲩⲓⲇ ⲁϥϣⲁⲣⲓ ϧⲉⲛ ⲛⲉϥⲁⲛⲁⲛⲑⲃⲁ	ⲁⲩⲱ ⲛⲉⲩϩⲓ̈ⲟⲙⲉ. ⲁⲩϩⲙⲟⲟⲥ ⲉⲩϩⲱⲥ ⲉⲩⲥⲱⲃⲉ. ⲉⲩϫⲱ ⲙ̅ⲙⲟⲥ. ϫⲉ ⲥⲁⲟⲩⲗ ⲁϥⲡⲁⲧⲁⲥⲥⲉ ϩⲛ̅ ⲛⲉϥϣⲟ. ⲇⲁⲩⲉⲓⲇ ϩⲱⲱϥ ϩⲛ̅ ⲛⲉϥⲧⲃⲁ	And the women began the strain, and said, Saul has smitten his thousands, and David his ten thousands.	καὶ ἐξῆρχον αἱ γυναῖκες καὶ ἔλεγον Ἐπάταξεν Σαουλ ἐν χιλιάσιν αὐτοῦ καὶ Δαυιδ ἐν µυριάσιν αὐτοῦ.						
First Samuel	18	18	8	OT	1. OT	Historical Books	2. Historical Books	02. Historical Books	04. First Samuel	ⲟⲩⲟϩ ⲁ ⲡⲓⲥⲁϫⲓ ϣⲱⲡⲓ ⲉϥϩⲱⲟⲩ ⲉ̀ⲙⲁϣⲱ ⲛⲁϩⲣⲉⲛ ⲛⲉⲛⲃⲁⲗ ⲛ̀ⲥⲁⲟⲩⲗ ⲉⲑⲃⲉ ⲡⲓⲥⲁϫⲓ ⲟⲩⲟϩ ⲡⲉϫⲁϥ ϫⲉ ⲁⲩϯ ⲛ̀ⲛⲓⲁⲛⲁⲛⲑⲃ ⲛ̀ⲇⲁⲩⲓⲇ ⲟⲩⲟϩ ⲁ̀ⲛⲟⲕ ϩⲱ ⲁⲩϯ ⲛ̀ⲛⲓⲁⲛⲁⲛϣⲟ ⲛⲏⲓ	ⲁⲩⲱ ⲡⲉⲓ̈ϣⲁϫⲉ ⲁϥϣⲱⲡⲉ ⲙ̅ⲡⲟⲛⲏⲣⲟⲛ ⲉⲙⲁⲧⲉ ⲛⲁϩⲣⲁϥ ⲛ̅ⲥⲁⲟⲩⲗ. ⲉⲧⲃⲉ ⲡⲉⲓ̈ϣⲁϫⲉ ⲛ̅ⲧⲁⲩϫⲟⲟϥ ⲉⲩϫⲱ ⲙ̅ⲙⲟⲥ ϫⲉ ⲛⲉⲧⲃⲁ ⲁⲩⲧⲁⲁⲩ ⲛ̅ⲇⲁⲩⲉⲓⲇ. ⲁⲛⲟⲕ ϩⲱ ⲁⲩϯ ⲛ̅ϣⲟ ⲛⲁⲓ̈.	And it seemed evil in the eyes of Saul concerning this matter, and he said, To David they have given ten thousands, and to me they have given thousands.	καὶ πονηρὸν ἐφάνη τὸ ῥῆµα ἐν ὀφθαλµοῖς Σαουλ περὶ τοῦ λόγου τούτου, καὶ εἶπεν Τῷ Δαυιδ ἔδωκαν τὰς µυριάδας καὶ ἐµοὶ ἔδωκαν τὰς χιλιάδας.						
First Samuel	18	18	9	OT	1. OT	Historical Books	2. Historical Books	02. Historical Books	04. First Samuel	ⲟⲩⲟϩ ⲁϥϣⲱⲡⲓ ⲛ̀ϫⲉ ⲥⲁⲟⲩⲗ ⲉϥϫⲟⲩϣⲧ ⲛ̀ⲥⲁ ⲇⲁⲩⲓⲇ ⲓⲥϫⲉⲛ ⲡⲓⲉϩⲟⲟⲩ ⲉⲧⲉⲙ̀ⲙⲁⲩ	ⲥⲁⲟⲩⲗ ⲇⲉ ⲛⲉⲣⲉ ⲡⲉϥϩⲏⲧ ⲕⲟⲗϫ ⲉⲣⲟϥ ⲉⲇⲁⲩⲉⲓⲇ. ⲛ̅ϫⲓⲛ ⲡⲉϩⲟⲟⲩ ⲉⲧⲙ̅ⲙⲁⲩ ϣⲁⲃⲟⲗ.		καὶ ἦν Σαουλ ὑποβλεπόµενος τὸν Δαυιδ ἀπὸ τῆς ἡµέρας ἐκείνης καὶ ἐπέκεινα.						
First Samuel	18	18	10	OT	1. OT	Historical Books	2. Historical Books	02. Historical Books	04. First Samuel		ⲁⲥϣⲱⲡⲉ ⲇⲉ ⲙⲛ̅ⲛ̅ⲥⲁ ⲡⲉϩⲟⲟⲩ ⲉⲧⲙ̅ⲙⲁⲩ ⲁⲩⲡⲛ̅ⲁ̅ ⲙ̅ⲡⲟⲛⲏⲣⲟⲛ ⲉⲓ ⲉϫⲛ̅ ⲥⲁⲟⲩⲗ. ⲁϥⲡⲣⲟⲫⲏⲧⲉⲩⲉ ϩⲛ̅ ⲧⲙⲏⲧⲉ ⲙ̅ⲡⲉϥⲏⲓ̈ ⲕⲁⲧⲁ ⲑⲉ ⲟⲛ ⲙ̅ⲙⲏⲛⲉ. ⲁⲩⲱ ⲧⲗⲟⲅⲭⲏ ⲛⲉⲥϩⲛ̅ ⲧϭⲓϫ ⲛ̅ⲥⲁⲟⲩⲗ.								
First Samuel	18	18	11	OT	1. OT	Historical Books	2. Historical Books	02. Historical Books	04. First Samuel		ⲥⲁⲟⲩⲗ ⲇⲉ ⲁϥⲛⲁⲩ ⲉⲧⲗⲟⲅⲭⲏ ⲡⲉϫⲁϥ ϫⲉ ϯⲛⲁⲣⲁϩⲧ̅ ⲇⲁⲩⲉⲓⲇ ϩⲛ̅ ⲧⲁⲓ̈. ⲛ̅ⲧⲉⲣⲉϥⲛⲟϫⲥ̅ ⲇⲉ ⲉⲇ̅ⲁ̅ⲇ̅. ⲁϥⲡⲟϣⲥϥ̅ ϩⲁ ⲡϩⲟ ⲛ̅ⲥⲁⲟⲩⲗ ⲁⲥⲧⲱⲝ ⲉⲧϫⲟ.								
First Samuel	18	18	12	OT	1. OT	Historical Books	2. Historical Books	02. Historical Books	04. First Samuel		ⲁⲩⲱ ⲥⲁⲟⲩⲗ ⲁϥⲣ̅ϩⲟⲧⲉ ϩⲁⲑⲏ ⲛ̅ⲇⲁⲩⲉⲓⲇ.	And Saul was alarmed on account of David.	καὶ ἐφοβήθη Σαουλ ἀπὸ προσώπου Δαυιδ						
