book	chapter	chapter-zfilled	verse	testament	testament-indexed	section	section-indexed	section-indexed-no-testament	book-indexed	Bohairic	Sahidic	English	Greek	Fayyumic	Akhmimic	OldBohairic	Mesokemic	DialectP	Lycopolitan
First Samuel	17	17	15	OT	1. OT	Historical Books	2. Historical Books	02. Historical Books	04. First Samuel		ⲇⲁⲩⲉⲓⲇ ⲇⲉ ⲁϥⲓ̈ ⲉⲃⲟⲗ ϩⲓ̈ⲧⲟⲟⲧϥ ⲛ̅ⲥⲁⲟⲩⲗ. ⲁϥⲃⲱⲕ ⲁϥⲙⲟⲟⲛⲉ ⲛ̅ⲛⲉⲥⲟⲟⲩ ⲙ̅ⲡⲉϥⲉⲓⲱⲧ ϩⲣⲁⲓ̈ ϩⲛ̅ ⲃⲏⲑⲗⲉⲉⲙ.								
First Samuel	17	17	16	OT	1. OT	Historical Books	2. Historical Books	02. Historical Books	04. First Samuel	ⲟⲩⲟϩ ⲁϥⲓ̀ ⲛ̀ϫⲉ ⲡⲓⲁⲗⲗⲟⲫⲩⲗⲟⲥ ⲉϥϧⲱⲛⲧ ⲙ̀ⲙⲟϥ ⲉ̀ϧⲟⲩⲛ ⲙ̀ⲫⲛⲁⲩ ⲛ̀ϣⲱⲣⲡ ⲛⲉⲙ ⲫⲛⲁⲩ ⲛ̀ⲣⲟⲩϩⲓ ⲟⲩⲟϩ ⲁϥⲟϩⲓ ⲉ̀ⲣⲁⲧϥ ⲛ̀ϩⲙⲉ ⲛ̀ⲉϩⲟⲟⲩ	ⲡⲁⲗⲗⲟⲫⲩⲗⲟⲥ ⲇⲉ ⲛⲉϥⲃⲏⲕ ⲉⲣⲱⲟⲩ ⲙ̅ⲙⲏⲛⲉ. ⲉϩⲧⲟⲟⲩⲉ. ⲁⲩⲱ ⲉⲣⲟⲩϩⲉ. ⲉⲁϥⲉⲣϩⲙⲉ ⲛ̅ϩⲟⲟⲩ ϩⲓ̈ⲣⲱⲟⲩ.								
First Samuel	17	17	17	OT	1. OT	Historical Books	2. Historical Books	02. Historical Books	04. First Samuel	ⲟⲩⲟϩ ⲡⲉϫⲉ ⲓⲉⲥⲥⲉ ⲛ̀ⲇⲁⲩⲓⲇ ⲡⲉϥϣⲏⲣⲓ ϫⲉ ϭⲓ ⲙ̀ⲫⲁⲓ ϣⲓ ⲛ̀ⲁⲗⲫⲓⲧⲟⲛ ⲛ̀ⲛⲉⲕⲥⲛⲏⲟⲩ ⲛⲉⲙ ⲡⲁⲓⲙⲏⲧ ⲛ̀ⲱⲓⲕ ⲛ̀ⲧⲉⲕⲟⲗⲟⲩ ϯⲡⲁⲣⲉⲙⲃⲟⲗⲏ ⲛ̀ⲧⲉⲕⲧⲏⲓⲧⲟⲩ ⲛ̀ⲛⲉⲕⲥⲛⲏⲟⲩ	ⲁⲩⲱ ⲡⲉϫⲉ ⲓ̈ⲉⲥⲥⲁⲓ̈ ⲛ̅ⲇⲁⲩⲉⲓⲇ ⲡⲉϥϣⲏⲣⲉ. ϫⲉ ϫⲓ̈ ⲙ̅ⲡⲉⲓ̈ϣⲓ̈ ⲛ̅ⲛⲟⲉⲓⲧ ⲛ̅ⲛⲉⲕⲥⲛⲏⲩ. ⲁⲩⲱ ⲡⲉⲓ̈ⲙⲏⲧ ⲛ̅ⲟⲉⲓⲕ ⲛⲅ̅ⲧⲱⲟⲩⲛ ⲛⲅ̅ⲡⲱⲧ ⲉϩⲣⲁⲓ̈. ⲉⲧⲡⲁⲣⲉⲙⲃⲟⲗⲏ. ⲉⲣⲁⲧⲟⲩ ⲛ̅ⲛⲉⲕⲥⲛⲏⲩ.								
First Samuel	17	17	18	OT	1. OT	Historical Books	2. Historical Books	02. Historical Books	04. First Samuel	ⲟⲩⲟϩ ⲡⲁⲓⲙⲏⲧ ⲛ̀ϭⲉⲗⲓ ⲛ̀ⲉⲣⲱϯ ⲉⲕⲉ̀ϭⲓⲧⲟⲩ ⲉ̀ϧⲟⲩⲛ ⲉ̀ⲡⲓⲭⲓⲗⲓⲁⲣⲭⲟⲥ ⲟⲩⲟϩ ⲛ̀ⲧⲉⲕϫⲉⲙⲡϣⲓⲛⲓ ⲛ̀ⲛⲉⲕⲥⲛⲏⲟⲩ ϧⲉⲛ ⲟⲩϩⲓⲣⲏⲛⲏ ⲟⲩⲟϩ ⲛ̀ⲧⲉⲕⲉⲙⲓ ϫⲉ ⲉⲩⲉⲣⲭⲣⲓⲁ ⲛ̀ⲟⲩ	ⲡⲉⲓ̈ⲙⲏⲧ ϩⲱⲱϥ ⲛ̅ⲟⲉⲓⲕ ⲛ̅ⲥⲁⲉⲓⲣ. ⲛⲅ̅ϫⲓ̈ⲧⲟⲩ ⲉϩⲟⲩⲛ ⲙ̅ⲡⲭⲓⲗⲓⲁⲣⲭⲟⲥ. ⲛⲅ̅ⲉⲛ ⲡⲟⲩⲱ ⲛ̅ⲛⲉⲕⲥⲛⲏⲩ ϩⲛ̅ ⲟⲩⲉⲓⲣⲏⲛⲏ. ⲛⲅ̅ⲛⲁⲩ ϫⲉ ⲉⲩϣⲁⲁⲧ ⲛ̅ⲟⲩ. ⲛⲅ̅ⲉⲛ ⲡⲉⲩⲟⲩⲱ ⲛⲁⲓ̈								
First Samuel	17	17	19	OT	1. OT	Historical Books	2. Historical Books	02. Historical Books	04. First Samuel	ⲟⲩⲟϩ ϩⲏⲡⲡⲉ ⲛ̀ⲑⲱⲟⲩ ⲛⲉⲙ ⲥⲁⲟⲩⲗ ⲛⲉⲙ ⲣⲱⲙⲓ ⲛⲓⲃⲉⲛ ⲛ̀ⲧⲉ ⲡⲓⲥ̅ⲗ̅ ⲥⲉⲭⲏ ϧⲉⲛ ϯϧⲉⲗⲗⲟⲧ ⲛ̀ⲧⲉ ⲛⲓϣϣⲏⲛ ⲉⲩϯ ⲛⲉⲙ ⲛⲓⲁⲗⲗⲟⲫⲩⲗⲟⲥ	ⲁⲩⲱ ⲥⲁⲟⲩⲗ ⲛⲙ̅ⲙⲁⲩ ⲙⲛ̅ ⲡⲓⲏ̅ⲗ̅ ⲧⲏⲣϥ̅ ⲛⲉⲩϩⲉⲛ ⲡⲓ̈ⲁ ⲙ̅ⲡϣⲏⲛ ⲉⲧϫⲟⲥⲉ. ⲉⲩⲙⲓ̈ϣⲉ. ⲙⲛ̅ ⲛ̅ⲁⲗⲗⲟⲫⲩⲗⲟⲥ.								
First Samuel	17	17	20	OT	1. OT	Historical Books	2. Historical Books	02. Historical Books	04. First Samuel	ⲁϥϣⲟⲣⲡϥ ⲛ̀ϫⲉ ⲇⲁⲩⲓⲇ ⲛ̀ϣⲱⲣⲡ ⲁϥⲭⲁ ⲛⲓⲉⲥⲱⲟⲩ ϧⲁⲧⲉⲛ ⲡⲓⲣⲉϥⲁⲣⲉϩ ⲟⲩⲟϩ ⲁϥϭⲓⲧⲟⲩ ⲁϥϣⲉ ⲛⲁϥ ⲙ̀ⲫⲣⲏϯ ⲉⲧⲁϥϩⲟⲛϩⲉⲛ ⲛⲁϥ ⲛ̀ϫⲉ ⲓⲉⲥⲥⲉ ⲡⲉϥⲓⲱⲧ ⲟⲩⲟϩ ⲁϥⲓ̀ ⲉ̀ϯⲥⲧⲣⲟⲅⲅⲩⲗⲱⲥⲓⲥ ⲛⲉⲙ ⲉ̀ϧⲟⲩⲛ ⲉ̀ϯϫⲟⲙ ⲉⲑⲙⲟϣⲓ ⲉ̀ⲃⲟⲗ ⲉ̀ⲡⲓⲃⲱⲧⲥ ⲟⲩⲟϩ ⲛⲁⲩⲉϣⲗⲏⲗⲟⲩⲓ ⲉ̀ⲃⲟⲗ ϧⲉⲛ ⲡⲓⲡⲟⲗⲉⲙⲟⲥ	ⲇ̅ⲁ̅ⲇ̅ ⲇⲉ ⲁϥϣⲟⲣⲡϥ̅ ⲉϩⲧⲟⲟⲩⲉ. ⲁϥⲕⲁ ⲛ̅ⲉⲥⲟⲟⲩ ⲛ̅ⲧⲟⲟⲧⲟⲩ ⲛ̅ⲛⲉⲣⲉϥⲣⲟⲉⲓⲥ. ⲁϥϫⲓ̈ ⲛ̅ⲛⲉⲛⲕⲁ ⲁϥⲃⲱⲕ. ⲕⲁⲧⲁ ⲑⲉ ⲛ̅ⲧⲁ ⲉⲓⲥⲥⲁⲓ̈ ϩⲱⲛ ⲉⲧⲟⲟⲧϥ̅. ⲁϥⲓ̈ ⲉϩⲣⲁⲓ̈ ⲉⲧⲉⲥⲧⲣⲟⲅⲉⲗⲟⲥⲓⲥ ⲉⲧⲉ ⲡⲙⲁ ⲡⲉ ⲉⲧⲟⲩⲉⲛϩⲏⲧϥ̅. ⲁⲩⲱ ⲉⲣⲁⲧϥ̅ ⲙ̅ⲡⲉⲙⲗⲁϩ. ⲛⲉⲧⲃⲏⲕ ⲉⲃⲟⲗ ϩⲙ̅ ⲡⲡⲟⲗⲩⲙⲟⲥ. ⲁⲩⲧⲉⲕ ⲗⲟⲩⲗⲁⲓ ⲉⲃⲟⲗ ϩⲙ̅ ⲡⲡⲟⲗⲩⲙⲟⲥ.								
First Samuel	17	17	21	OT	1. OT	Historical Books	2. Historical Books	02. Historical Books	04. First Samuel	ⲁⲩⲟϩⲓ ⲉ̀ⲣⲁⲧⲟⲩ ⲉ̀ⲡⲃⲱⲧⲥ ⲛ̀ϫⲉ ⲡⲓⲥ̅ⲗ̅ ⲛⲉⲙ ⲛⲓⲁⲗⲗⲟⲫⲩⲗⲟⲥ ⲙ̀ⲡⲉⲙ̀ⲑⲟ ⲛ̀ⲛⲟⲩⲉⲣⲏⲟⲩ	ⲡⲓⲏ̅ⲗ̅ ⲙⲛ ⲛⲁⲗⲗⲟⲫⲩⲗⲟⲥ. ⲁⲩⲁϩⲉⲣⲁⲧⲟⲩ ⲉⲙⲓϣⲉ ⲙⲛ ⲛⲉⲩⲉⲣⲏⲩ								
First Samuel	17	17	22	OT	1. OT	Historical Books	2. Historical Books	02. Historical Books	04. First Samuel	ⲟⲩⲟϩ ⲁ ⲇⲁⲩⲓⲇ ⲭⲁ ⲛⲓⲥⲕⲉⲩⲟⲥ ⲉ̀ϧⲣⲏⲓ ϧⲉⲛ ⲧϫⲓϫ ⲙ̀ⲡⲓⲣⲉϥⲉⲣⲁⲣⲉϩ ⲉ̀ⲛⲓⲥⲕⲉⲩⲟⲥ ⲟⲩⲟϩ ⲁϥϣⲉ ⲛⲁϥ ⲉ̀ϧⲟⲩⲛ ⲉ̀ϯⲑⲱⲟⲩⲧⲥ ⲟⲩⲟϩ ⲁϥϣⲉⲛ ⲛⲉϥⲥⲛⲏⲟⲩ ⲉⲩϩⲓⲣⲏⲛⲏ	ⲇ̅ⲁ̅ⲇ̅ ⲇⲉ ⲁϥⲕⲁ ⲛⲉϥⲥⲕⲉⲩⲏ ϩⲁⲧⲙ̅ ⲡⲉⲧϩⲁⲣⲉϩ ⲉⲛⲉⲥⲕⲉⲩⲏ. ⲁϥⲡⲱⲧ ⲉⲃⲟⲗ ⲉⲧⲡⲁⲣⲉⲙⲃⲟⲗⲏ. ⲁϥⲡⲱϩ ⲉⲛⲉϥⲥⲛⲏⲩ ⲁϥϫⲓ̈ⲛⲟⲩⲟⲩ ⲉⲡⲉⲩⲟⲩⲱ ϩⲛ̅ ⲟⲩⲉⲓⲣⲏⲛⲏ.								
First Samuel	17	17	23	OT	1. OT	Historical Books	2. Historical Books	02. Historical Books	04. First Samuel	ⲟⲩⲟϩ ϩⲱⲥ ⲟⲩⲛ ⲉϥⲥⲁϫⲓ ⲛⲉⲙⲱⲟⲩ ϩⲏⲡⲡⲉ ⲓⲥ ⲡⲓⲣⲱⲙⲓ ⲛⲁⲙⲉⲥⲥⲉⲟⲥ ⲁϥⲓ̀ ⲉ̀ⲡϣⲱⲓ ⲅⲟⲗⲓⲁⲑ ⲡⲉ ⲡⲉϥⲣⲁⲛ ⲡⲓⲫⲩⲗⲏⲥⲧⲓⲛⲟⲥ ⲉ̀ⲃⲟⲗ ϧⲉⲛ ⲅⲉⲑ ⲛ̀ⲧⲉⲛ ⲛⲓⲡⲣⲁⲧⲁⲝⲓⲥ ⲛ̀ⲧⲉ ⲛⲓⲁⲗⲗⲟⲫⲩⲗⲟⲥ ⲁϥⲥⲁϫⲓ ⲕⲁⲧⲁ ⲛⲁⲓⲥⲁϫⲓ ⲟⲩⲟϩ ⲁϥⲥⲱⲧⲉⲙ ⲛ̀ϫⲉ ⲥⲁⲟⲩⲗ	ⲛ̅ⲧⲟϥ ⲇⲉ ⲉϥϣⲁϫⲉ ⲛⲙ̅ⲙⲁⲩ ⲉⲓⲥ ⲡⲣⲱⲙⲉ ⲛ̅ⲁⲙⲉⲥⲥⲁⲓ̈ⲟⲥ ⲁϥⲓ̈ ⲉⲃⲟⲗ. ⲡⲉⲫⲩⲗⲓⲥⲧⲓⲁⲛⲟⲥ. ⲉⲡⲉϥⲣⲁⲛ ⲡⲉ ⲅⲟⲗⲓⲁⲑ. ⲉⲃⲟⲗ ϩⲛ̅ ⲅⲉⲑ. ⲉϥⲏⲡ ⲉⲛⲉⲙⲗⲁϩ ⲛ̅ⲛ̅ⲁⲗⲗⲟⲫⲩⲗⲟⲥ. ⲁϥϣⲁϫⲉ ⲉϩⲟⲩⲛ ⲉⲣⲟⲟⲩ ⲕⲁⲧⲁ ⲛⲉⲓ̈ϣⲁϫⲉ. ⲁⲩⲱ ⲁϥⲥⲱⲧⲙ̅ ⲛ̅ϭⲓ ⲥⲁⲟⲩⲗ.								
First Samuel	17	17	24	OT	1. OT	Historical Books	2. Historical Books	02. Historical Books	04. First Samuel	ⲛⲉⲙ ⲣⲱⲙⲓ ⲛⲓⲃⲉⲛ ⲛ̀ⲧⲉ ⲡⲓⲥ̅ⲗ̅ ⲟⲩⲟϩ ⲉⲧⲁⲩⲛⲁⲩ ⲉ̀ⲡⲓⲣⲱⲙⲓ ⲁⲩⲫⲱⲧ ⲉ̀ⲃⲟⲗ ϩⲁ ⲡⲉϥϩⲟ ⲟⲩⲟϩ ϩⲟϯ ⲉ̀ⲙⲁϣⲱ	ⲙⲛ̅ ⲛⲉⲣⲱⲙⲉ ⲧⲏⲣⲟⲩ ⲙ̅ⲡⲓⲏ̅ⲗ̅ ⲁⲩⲱ ⲛ̅ⲧⲉⲣⲟⲩⲛⲁⲩ ⲉⲡⲣⲱⲙⲉ. ⲁⲩⲡⲱⲧ ϩⲁ ⲡⲉϥϩⲟ. ⲁⲩⲣ̅ϩⲟⲧⲉ ⲉⲙⲁⲧⲉ.								
First Samuel	17	17	25	OT	1. OT	Historical Books	2. Historical Books	02. Historical Books	04. First Samuel	ⲟⲩⲟϩ ⲡⲉϫⲉ ⲛⲓⲣⲱⲙⲓ ⲛ̀ⲧⲉ ⲡⲓⲥ̅ⲗ̅ ϫⲉ ⲁⲛ ⲁⲣⲉⲧⲉⲛⲛⲁⲩ ⲉ̀ⲡⲁⲓⲣⲱⲙⲓ ⲉⲧⲁϥⲓ̀ ⲉ̀ⲡϣⲱⲓ ⲉⲧⲁϥⲓ̀ ⲉ̀ϯϣⲱϣ ⲙ̀ⲡⲓⲥ̅ⲗ̅ ⲡⲓⲣⲱⲙⲓ ⲉⲑⲛⲁϣⲁⲣⲓ ⲉ̀ⲣⲟϥ ⲡⲟⲩⲣⲟ ⲛⲁⲁⲓϥ ⲛ̀ⲣⲁⲙⲁⲟ ϧⲉⲛ ⲟⲩⲛⲓϣϯ ⲙ̀ⲙⲉⲧⲣⲁⲙⲁⲟ ⲟⲩⲟϩ ϥⲛⲁϯ ⲛⲁϥ ⲛ̀ⲧⲉϥϣⲉⲣⲓ ⲟⲩⲟϩ ⲡⲏⲓ ⲙ̀ⲡⲉϥⲓⲱⲧ ϥⲛⲁⲁⲓϥ ⲛ̀ⲣⲉⲙϩⲉ ϧⲉⲛ ⲡⲓⲥ̅ⲗ̅	ⲡⲉϫⲉ ⲛⲉⲣⲱⲙⲉ ⲙ̅ⲡⲓⲏ̅ⲗ̅ ⲛ̅ⲛⲉⲩⲉⲣⲏⲩ. ϫⲉ ⲉⲛⲉ ⲁⲧⲉⲧⲛ̅ⲛⲁⲩ ⲉⲡⲣⲱⲙⲉ. ⲡⲁⲓ̈ ⲛ̅ⲧⲁϥⲓ̈ ⲉϩⲣⲁⲓ̈ ⲉⲣⲱⲛ. ϫⲉ ⲛ̅ⲧⲁϥⲉⲓ ⲉϩⲣⲁⲓ̈ ⲉϫⲉⲙ ⲡⲓⲏ̅ⲗ̅. ⲡⲣⲱⲙⲉ ϭⲉ ⲉⲧⲛⲁⲃⲱⲗ ⲉⲃⲟⲗ ⲛϥ̅ⲡⲁⲧⲁⲥⲥⲉ ⲙ̅ⲙⲟϥ. ⲡⲣ̅ⲣⲟ ⲛⲁⲁⲁϥ ⲛ̅ⲣⲙ̅ⲙⲁⲟ. ϩⲛ̅ ⲟⲩⲛⲟϭ ⲙ̅ⲙⲉⲧⲣⲙ̅ⲙⲁⲟ. ⲁⲩⲱ ⲧⲉϥϣⲉⲉⲣⲉ ⲉϥⲛⲁⲧⲁⲁⲥ ⲛⲁϥ ⲛ̅ⲥϩⲓⲙⲉ. ⲁⲩⲱ ⲡⲏⲓ̈ ⲧⲏⲣϥ̅ ⲙ̅ⲡⲉϥⲉⲓⲱⲧ. ϥⲛⲁⲕⲁⲁϥ ⲉⲃⲟⲗ ⲛ̅ⲣⲉⲙϩⲉ ϩⲙ ⲡⲓⲏ̅ⲗ̅.								
First Samuel	17	17	26	OT	1. OT	Historical Books	2. Historical Books	02. Historical Books	04. First Samuel	ⲟⲩⲟϩ ⲡⲉϫⲉ ⲇⲁⲩⲓⲇ ⲛ̀ⲛⲓⲣⲱⲙⲓ ⲉⲧⲟϩⲓ ⲉ̀ⲣⲁⲧⲟⲩ ⲛⲉⲙⲁϥ ⲉϥϫⲱ ⲙ̀ⲙⲟⲥ ϫⲉ ⲟⲩ ⲡⲉ ⲉⲑⲛⲁϣⲱⲡⲓ ⲙ̀ⲡⲓⲣⲱⲙⲓ ⲉⲑⲛⲁϣⲁⲣⲓ ⲉ̀ⲡⲓⲁⲗⲗⲟⲫⲩⲗⲟⲥ ⲉⲧⲉⲙ̀ⲙⲁⲩ ⲟⲩⲟϩ ⲛ̀ⲧⲉϥⲱⲗⲓ ⲛ̀ⲟⲩϣⲱϣ ⲉ̀ⲃⲟⲗ ϧⲉⲛ ⲡⲓⲥ̅ⲗ̅ ϫⲉ ⲛⲓⲙ ⲡⲉ ⲡⲓⲁⲗⲗⲟⲫⲩⲗⲟⲥ ⲛ̀ⲁⲧⲥⲉⲃⲓ ϫⲉ ⲁϥϯϣⲱϣ ⲛ̀ϯⲑⲱⲟⲩⲧⲥ ⲙ̀ⲫϯ ⲉⲧⲟⲛϧ	ⲡⲉϫⲉ ⲇⲁⲩⲉⲓⲇ ⲛ̅ⲛ̅ⲣⲱⲙⲉ ⲉⲧⲁϩⲉⲣⲁⲧⲟⲩ ⲛⲙ̅ⲙⲁϥ ⲉϥϫⲱ ⲙ̅ⲙⲟⲥ ⲛⲁⲩ ϫⲉ ⲟⲩ ⲡⲉ ⲡϩⲱⲃ ⲉⲧⲟⲩⲛⲁⲁⲁϥ ⲙ̅ⲡⲣⲱⲙⲉ. ⲡⲉⲧⲛⲁⲡⲁⲧⲁⲥⲥⲉ ⲙ̅ⲡⲁⲗⲗⲟⲫⲩⲗⲟⲥ ⲉⲧⲙ̅ⲙⲁⲩ. ⲛϥ̅ϥⲓ̈ ⲙ̅ⲙⲁⲩ ⲛ̅ⲟⲩⲛⲟϭⲛⲉϭ ⲉⲃⲟⲗ ϩⲙ̅ ⲡⲓⲏ̅ⲗ̅. ϫⲉ ⲟⲩⲣⲱⲙⲉ ⲡⲉ ⲡⲓ̈ⲁⲗⲗⲟⲫⲩⲗⲟⲥ ⲛ̅ⲁⲧⲥⲃ̅ⲃⲉ. ⲡⲁⲓ̈ ⲛ̅ⲧⲁϥⲛⲟϭⲛⲉϭ ⲙ̅ⲡⲙⲏⲏϣⲉ ⲙ̅ⲡⲛⲟⲩⲧⲉ ⲉⲧⲟⲛϩ̅.								
First Samuel	17	17	27	OT	1. OT	Historical Books	2. Historical Books	02. Historical Books	04. First Samuel	ⲟⲩⲟϩ ⲡⲉϫⲉ ⲡⲓⲗⲁⲟⲥ ⲛⲁϥ ⲕⲁⲧⲁ ⲡⲁⲓⲥⲁϫⲓ ⲉϥϫⲱ ⲙ̀ⲙⲟⲥ ⲉϥϫⲱ ⲙ̀ⲙⲟⲥ ϫⲉ ⲡⲁⲓⲣⲏϯ ⲉⲑⲛⲁϣⲱⲡⲓ ⲙ̀ⲡⲓⲣⲱⲙⲓ ⲉⲑⲛⲁϣⲁⲣⲓ ⲉ̀ⲣⲟϥ	ⲁⲩⲱ ⲡⲗⲁⲟⲥ ⲁϥϣⲁϫⲉ ⲛⲙ̅ⲙⲁϥ. ⲕⲁⲧⲁ ⲡⲉⲓ̈ϣⲁϫⲉ ⲉϥϫⲱ ⲙ̅ⲙⲟⲥ. ϫⲉ ⲧⲁⲓ̈ ⲧⲉ ⲑⲉ ⲉⲧⲟⲩⲛⲁⲁⲁⲥ ⲙ̅ⲡⲣⲱⲙⲉ. ⲡⲉⲧⲛⲁⲡⲁⲧⲁⲥⲥⲉ ⲙ̅ⲡⲓ̈ⲁⲗⲗⲟⲫⲩⲗⲟⲥ.								
First Samuel	17	17	28	OT	1. OT	Historical Books	2. Historical Books	02. Historical Books	04. First Samuel	ⲟⲩⲟϩ ⲁϥⲥⲱⲧⲉⲙ ⲉ̀ⲣⲟϥ ⲛ̀ϫⲉ ⲉⲗⲓⲁⲃ ⲡⲉϥⲥⲟⲛ ⲛ̀ⲛⲓϣϯ ⲉϥⲥⲁϫⲓ ⲛⲉⲙ ⲛⲓⲣⲱⲙⲓ ⲟⲩⲟϩ ⲁϥϫⲱⲛⲧ ϧⲉⲛ ⲟⲩⲙⲃⲟⲛ ⲛ̀ϫⲉ ⲉⲗⲓⲁⲃ ⲉ̀ⲇⲁⲩⲓⲇ ⲟⲩⲟϩ ⲡⲉϫⲁϥ ⲛⲁϥ ϫⲉ ⲉⲑⲃⲉ ⲟⲩ ⲁⲕⲓ̀ ⲉ̀ϧⲣⲏⲓ ⲟⲩⲟϩ ⲉⲧⲁⲕⲭⲁ ⲛⲓⲕⲟⲩϫⲓ ⲛ̀ⲉⲥⲱⲟⲩ ϧⲁⲧⲉⲛ ⲛⲓⲙ ϩⲓ ⲡϣⲁϥⲉ ⲁ̀ⲛⲟⲕ ϯⲉⲙⲓ ⲛ̀ⲛⲉⲕⲙⲉⲧϭⲁⲥⲓϩⲏⲧ ϫⲉ ⲁⲕⲓ̀ ⲉ̀ϧⲣⲏⲓ ⲉ̀ⲛⲁⲩ ⲉ̀ⲡⲓⲡⲟⲗⲉⲙⲟⲥ	ⲁⲩⲱ ⲉⲗⲓⲁⲃ ⲡⲉϥⲛⲟϭ ⲛ̅ⲥⲟⲛ. ⲁϥⲥⲱⲧⲙ̅ ⲉⲣⲟϥ. ⲉϥϣⲁϫⲉ ⲙⲛ̅ ⲛⲉⲣⲱⲙⲉ. ⲉⲗⲓⲁⲃ ⲁϥⲛⲟⲩϭⲥ̅ ϩⲛ̅ ⲟⲩϭⲱⲛⲧ̅ ⲉⲇⲁⲩⲉⲓⲇ. ⲡⲉϫⲁϥ ⲉϩⲟⲩⲛ ⲉϩⲣⲁϥ. ϫⲉ ⲉⲧⲃⲉ ⲟⲩ. ⲁⲕⲉⲓ ⲉϩⲣⲁⲓ̈ ⲉⲡⲉⲓ̈ⲙⲁ. ⲁⲩⲱ ⲛ̅ⲧⲁⲕⲕⲁ ⲛ̅ⲉⲥⲟⲟⲩ ⲕⲟⲩⲓ̈. ⲛ̅ⲧⲉ ⲛⲓⲙ ϩⲛ̅ ⲧⲉⲣⲏⲙⲟⲥ. ⲁⲛⲟⲕ ϯⲥⲟⲟⲩⲛ ⲛ̅ⲧⲉⲕⲙⲛ̅ⲧϫⲁⲥⲓ̈ϩⲏⲧ. ⲁⲩⲱ ⲧⲕⲁⲕⲓⲁ ⲙ̅ⲡⲉⲕϩⲏⲧ. ϫⲉ ⲛ̅ⲧⲁⲕⲉⲓ ⲉⲡⲡⲟⲗⲩⲙⲟⲥ ⲉⲛⲁⲩ ⲉⲣⲟϥ.								
First Samuel	17	17	29	OT	1. OT	Historical Books	2. Historical Books	02. Historical Books	04. First Samuel	ⲟⲩⲟϩ ⲡⲉϫⲉ ⲇⲁⲩⲓⲇ ϫⲉ ⲟⲩ ⲡⲉ ⲉⲧⲁⲓⲁⲓϥ ϯⲛⲟⲩ ⲙⲏ ⲟⲩⲥⲁϫⲓ ⲁⲛ ⲡⲉ	ⲇ̅ⲁ̅ⲇ̅ ⲇⲉ ⲡⲉϫⲁϥ ⲛⲁϥ ϫⲉ ⲛ̅ⲧⲁⲓⲉⲣⲣ (sic) ⲟⲩ ⲛ̅ⲛⲟⲃⲉ. ⲙⲏ ⲛ̅ⲟⲩϣⲁϫⲉ ⲁⲛ ⲡⲉ ⲛ̅ⲧⲁⲓ̈ϫⲟⲟϥ.								
First Samuel	17	17	30	OT	1. OT	Historical Books	2. Historical Books	02. Historical Books	04. First Samuel	ⲟⲩⲟϩ ⲁϥⲧⲁⲥⲑⲟ ⲉ̀ⲃⲟⲗ ϩⲁⲣⲟϥ ⲁϥⲓ̀ ⲙ̀ⲡⲉⲙ̀ⲑⲟ ⲛ̀ⲕⲉⲟⲩⲁⲓ ⲟⲩⲟϩ ⲁϥⲥⲁϫⲓ ⲛⲉⲙⲁϥ ⲕⲁⲧⲁ ⲛⲁⲓⲥⲁϫⲓ ⲁϥⲉⲣⲟⲩⲱ ⲛⲁϥ ⲛ̀ϫⲉ ⲡⲓⲭⲉⲧ ⲕⲁⲧⲁ ⲡⲥⲁϫⲓ ⲙ̀ⲡⲓϩⲟⲩⲓⲧ	ⲁϥⲕⲧⲟϥ ⲇⲉ ⲉⲃⲟⲗ ⲙ̅ⲙⲟϥ. ⲁⲩⲱ ⲁϥⲉⲓ ⲉⲣⲁⲧϥ̅ ⲛ̅ⲕⲉⲣⲱⲙⲉ. ⲁϥϣⲁϫⲉ ⲕⲁⲧⲁ ⲡⲉⲓ̈ϣⲁϫⲉ. ⲁⲩⲱ ⲡⲗⲁⲟⲥ. ⲁϥⲣ̅ⲟⲩⲱ. ϩⲁⲣⲱϥ. ⲕⲁⲧⲁ ⲧⲙⲓ̈ⲛⲉ ⲙ̅ⲡϣⲟⲣⲡ̅ ⲛ̅ϣⲁϫⲉ.								
First Samuel	17	17	31	OT	1. OT	Historical Books	2. Historical Books	02. Historical Books	04. First Samuel	ⲟⲩⲟϩ ⲁⲩⲥⲱⲧⲉⲙ ⲉ̀ⲛⲓⲥⲁϫⲓ ⲉⲧⲁ ⲇⲁⲩⲓⲇ ⲥⲁϫⲓ ⲙ̀ⲙⲱⲟⲩ ⲟⲩⲟϩ ⲁⲩⲟⲗϥ ϩⲁ ⲥⲁⲟⲩⲗ	ⲛ̅ϣⲁϫⲉ ⲇⲉ ⲛ̅ⲧⲁ ⲇⲁⲩⲉⲓⲇ ϫⲟⲟⲩ. ⲁⲩϯⲥⲟⲉⲓⲧ. ⲁⲩⲱ ⲁⲩⲧⲁⲩⲟⲟⲩ ⲙ̅ⲡⲙⲧⲟ ⲉⲃⲟⲗ ⲛ̅ⲥⲁⲟⲩⲗ. ⲥⲁⲟⲩⲗ ⲇⲉ ⲁϥϫⲓ̈ⲧϥ ⲉϩⲟⲩⲛ ⲛⲁϥ.								
First Samuel	17	17	32	OT	1. OT	Historical Books	2. Historical Books	02. Historical Books	04. First Samuel	ⲟⲩⲟϩ ⲡⲉϫⲉ ⲇⲁⲩⲓⲇ ⲟⲩⲃⲉ ⲥⲁⲟⲩⲗ ϫⲉ ⲙ̀ⲡⲉⲛⲑⲣⲉϥⲱⲕⲉⲙ ⲉ̀ϫⲱϥ ⲛ̀ϫⲉ ⲡϩⲏⲧ ⲙ̀ⲡⲁϭ̅ⲥ̅ ⲡⲟⲩⲣⲟ ϥⲛⲁϣⲉ ⲛⲁϥ ⲛ̀ϫⲉ ⲡⲉⲕⲃⲱⲕ ⲟⲩⲟϩ ⲛ̀ⲧⲉϥⲃⲱⲧⲥ ⲛⲉⲙ ⲡⲓⲁⲗⲗⲟⲫⲩⲗⲟⲥ	ⲁⲩⲱ ⲇⲁⲩⲉⲓⲇ ⲡⲉϫⲁϥ ϩⲓ̈ⲑⲏ ⲛ̅ⲥⲁⲟⲩⲗ. ϫⲉ ⲙ̅ⲡⲉⲣⲧⲣⲉ ⲡϩⲏⲧ ⲙ̅ⲡⲁϫⲟⲉⲓⲥ ⲟⲩⲱⲗⲥ̅ ⲉⲣⲟϥ. ⲡⲉⲕϩⲙ̅ϩⲁⲗ ⲉⲧⲉ ⲁⲛⲟⲕ ⲡⲉ. ϥⲛⲁⲃⲱⲕ. ⲛϥ̅ⲡⲟⲗⲩⲙⲉⲓ ⲙⲛ̅ ⲡⲓ̈ⲁⲗⲗⲟⲫⲩⲗⲟⲥ.	And David said to Saul, Let not, I pray thee, the heart of my lord be dejected within him: thy servant will go, and fight with this Philistine.	Καὶ εἶπεν Δαυιδ πρὸς Σαουλ Μὴ δὴ συµπεσέτω ἡ καρδία τοῦ κυρίου µου ἐπ’ αὐτόν· ὁ δοῦλός σου πορεύσεται καὶ πολεµήσει µετὰ τοῦ ἀλλοφύλου τούτου.						
First Samuel	17	17	33	OT	1. OT	Historical Books	2. Historical Books	02. Historical Books	04. First Samuel	ⲟⲩⲟϩ ⲡⲉϫⲉ ⲥⲁⲟⲩⲗ ⲟⲩⲃⲉ ⲇⲁⲩⲓⲇ ⲇⲉ ⲭⲛⲁϣ̀ϫⲉⲙϫⲟⲙ ⲁⲛ ⲉ̀ϣⲉ ⲛⲁⲕ ϩⲁⲣⲟϥ ⲉϯ ⲛⲉⲙⲁϥ ϫⲉ ⲛ̀ⲑⲟⲕ ⲟⲩⲁⲗⲟⲩ ⲛ̀ⲑⲟⲕ ⲟⲩⲟϩ ⲡⲁⲓⲁⲗⲗⲟⲫⲩⲗⲟⲥ ⲛ̀ⲑⲟϥ ⲟⲩⲣⲱⲙⲓ ⲙ̀ⲃⲉⲧⲥ ⲓⲥϫⲉⲛ ⲧⲉϥⲙⲉⲧⲁⲗⲟⲩ	ⲡⲉϫⲉ ⲥⲁⲟⲩⲗ ⲉϩⲟⲩⲛ ϩⲛ̅ ⲇⲁⲩⲉⲓⲇ. ϫⲉ ⲛⲅ̅ⲛⲁⲉϣϭⲉⲙϭⲟⲙ ⲁⲛ ⲉⲃⲱⲕ. ⲉⲙⲓ̈ϣⲉ ⲙⲛ̅ ⲡⲓ̈ⲁⲗⲗⲟⲫⲩⲗⲟⲥ. ϫⲉ ⲛ̅ⲧⲕ̅ ⲟⲩϣⲏⲣⲉ ϣⲏⲙ ⲛ̅ⲧⲟⲕ. ⲡⲏ ⲇⲉ ⲟⲩⲣⲱⲙⲉ ⲡⲉ ⲛ̅ⲣⲉϥⲙⲓ̈ϣⲉ ⲛ̅ϫⲓ̈ⲛ ⲧⲉϥⲙⲛ̅ⲧⲕⲟⲩⲓ̈.	And Saul said to David, Thou wilt not in anywise be able to go against this Philistine to fight with him, for thou art a mere youth, and he a man of war from his youth.	καὶ εἶπεν Σαουλ πρὸς Δαυιδ Οὐ µὴ δυνήσῃ πορευθῆναι πρὸς τὸν ἀλλόφυλον τοῦ πολεµεῖν µετ’ αὐτοῦ, ὅτι παιδάριον εἶ σύ, καὶ αὐτὸς ἀνὴρ πολεµιστὴς ἐκ νεότητος αὐτοῦ.						
First Samuel	17	17	34	OT	1. OT	Historical Books	2. Historical Books	02. Historical Books	04. First Samuel	ⲟⲩⲟϩ ⲡⲉϫⲉ ⲇⲁⲩⲓⲇ ⲟⲩⲃⲉ ⲥⲁⲟⲩⲗ ϫⲉ ⲛⲁⲣⲉ ⲡⲉⲕⲃⲱⲕ ⲙⲟⲛⲓ ⲛ̀ⲛⲓⲉⲥⲱⲟⲩ ⲛ̀ⲧⲉ ⲡⲉϥⲓⲱⲧ ⲟⲩⲟϩ ϣⲁϥⲓ̀ ⲛ̀ϫⲉ ⲡⲓⲙⲟⲩⲓ ⲛⲉⲙ ϯⲗⲁⲃⲟⲓ ϣⲁⲩⲱⲗⲓ ⲛ̀ⲟⲩⲉⲥⲱⲟⲩ ϧⲉⲛ ⲡⲓⲓⲟϩⲓ	ⲇ̅ⲁ̅ⲇ̅ ⲇⲉ ⲡⲉϫⲁϥ ⲛ̅ⲥⲁⲟⲩⲗ. ϫⲉ ⲁⲛⲟⲕ ⲡⲉⲕϩⲙ̅ϩⲁⲗ. ⲛⲉⲓ̈ⲙⲟⲟⲛⲉ ⲛ̅ⲛ̅ⲉⲥⲟⲟⲩ ⲙ̅ⲡⲁⲉⲓⲱⲧ. ⲁⲩⲱ ⲉⲣϣⲁⲛ ⲡⲙⲟⲩⲓ̈ ⲙⲛ̅ ⲧⲁⲣⲝ̅ ⲉⲓ. ⲛ̅ⲧⲉⲣⲱϥ ϫⲓ̈ ⲟⲩⲉⲥⲟⲟⲩ ⲛ̅ϩⲏⲧⲟⲩ.	And David said to Saul, Thy servant was tending the flock for his father; and when a lion came and a she-bear, and took a sheep out of the flock,	καὶ εἶπεν Δαυιδ πρὸς Σαουλ Ποιµαίνων ἦν ὁ δοῦλός σου τῷ πατρὶ αὐτοῦ ἐν τῷ ποιµνίῳ, καὶ ὅταν ἤρχετο ὁ λέων καὶ ἡ ἄρκος καὶ ἐλάµβανεν πρόβατον ἐκ τῆς ἀγέλης,						
First Samuel	17	17	35	OT	1. OT	Historical Books	2. Historical Books	02. Historical Books	04. First Samuel	ⲟⲩⲟϩ ϣⲁⲓⲓ̀ ⲉ̀ⲃⲟⲗ ⲥⲁⲫⲁϩⲟⲩ ⲙ̀ⲙⲟϥ ⲟⲩⲟϩ ⲁⲓϣⲁⲣⲓ ⲉ̀ⲣⲟϥ ⲟⲩⲟϩ ϣⲁⲓⲑⲟⲕⲙⲉϥ ⲉ̀ⲃⲟⲗ ϧⲉⲛ ⲣⲱϥ ⲟⲩⲟϩ ⲁϥϣⲁⲛⲧⲱⲛϥ ⲉ̀ϩⲣⲏⲓ ⲉ̀ϫⲱⲓ ϣⲁⲓⲁⲙⲟⲛⲓ ⲙ̀ⲙⲟϥ ϧⲉⲛ ⲧⲉϥϣⲃⲱⲃⲓ ⲟⲩⲟϩ ⲛ̀ⲧⲁϩⲓⲟⲩⲓ ⲉ̀ⲣⲟϥ ⲛ̀ⲧⲁϧⲟⲑⲃⲉϥ	ϣⲁⲓ̈ⲁⲛⲅⲧ̅. ⲉⲃⲟⲗ ⲉⲡⲁϩⲟⲩ ⲙ̅ⲙⲟϥ. ⲛ̅ⲧⲁⲣⲁϩⲧ̅ ⲡⲙⲟⲩⲓ̈. ⲛ̅ⲧⲁϥⲓ̈ ⲉⲃⲟⲗ ϩⲛ̅ ⲧⲉϥⲧⲁⲡⲣⲟ. ⲙ̅ⲡⲉⲛⲧⲁ ⲡⲙⲟⲩⲓ̈ ⲧⲟⲣⲡϥ̅. ⲉϥϣⲁⲛⲕⲧⲟϥ ⲇⲉ ⲉⲣⲟⲓ̈. ϣⲁⲓ̈ⲙⲉϩⲧⲟⲟⲧ ϩⲛ̅ ⲧⲉϥϣⲟⲩⲱⲃⲉ. ⲛ̅ⲧⲁⲁⲁϥ ⲛ̅ϭⲱⲃ ⲛ̅ⲧⲁⲙⲟⲟⲩϥ.	then I went forth after him, and smote him, and drew the spoil out of his mouth: and as he rose up against me, then I caught hold of his throat, and smote him, and slew him.	καὶ ἐξεπορευόµην ὀπίσω αὐτοῦ καὶ ἐπάταξα αὐτὸν καὶ ἐξέσπασα ἐκ τοῦ στόµατος αὐτοῦ, καὶ εἰ ἐπανίστατο ἐπ’ ἐµέ, καὶ ἐκράτησα τοῦ φάρυγγος αὐτοῦ καὶ ἐπάταξα καὶ ἐθανάτωσα αὐτόν·						
First Samuel	17	17	36	OT	1. OT	Historical Books	2. Historical Books	02. Historical Books	04. First Samuel	ⲟⲩⲟϩ ⲡⲓⲙⲟⲩⲓ ⲛⲉⲙ ϯⲗⲁⲃⲟⲓ ϣⲁⲣⲉ ⲡⲉⲕⲃⲱⲕ ϩⲓⲟⲩⲓ ⲉ̀ⲣⲱⲟⲩ ⲟⲩⲟϩ ⲉϥⲉ̀ϣⲱⲡⲓ ⲛ̀ϫⲉ ⲡⲓⲁⲗⲗⲟⲫⲩⲗⲟⲥ ⲛ̀ⲁⲧⲥⲉⲃⲓ ⲙ̀ⲫⲣⲏϯ ⲛ̀ⲟⲩⲁⲓ ⲛ̀ⲛⲁⲓ ⲙⲏ ϯⲛⲁϣⲉ ⲛⲏⲓ ⲁⲛ ⲛ̀ⲧⲁϣⲁⲣⲓ ⲉⲣⲟϥ ⲟⲩⲟϩ ⲛ̀ⲧⲁⲱⲗⲓ ⲛ̀ⲟⲩϣⲱϣ ⲙ̀ⲫⲟⲟⲩ ⲉ̀ⲃⲟⲗ ϧⲉⲛ ⲡⲓⲥ̅ⲗ̅ ϫⲉ ⲛⲓⲙ ⲡⲉ ⲫⲁⲓ ⲡⲓⲁⲧⲥⲉⲃⲓ ⲫⲁⲓ ⲉⲧⲁϥϯϣⲱϣ ⲛ̀ϯⲑⲱⲟⲩⲧⲥ ⲛ̀ⲧⲉ ⲫϯ ⲉⲧⲟⲛϧ	ⲡⲙⲟⲩⲓ̈ ϭⲉ ⲙⲛ̅ ⲧⲁⲣⲝ. ⲡⲉⲕϩⲙ̅ϩⲁⲗ ⲁϥⲡⲁⲧⲁⲥⲥⲉ ⲙ̅ⲙⲟⲟⲩ. ⲡⲓ̈ⲁⲗⲗⲟⲫⲩⲗⲟⲥ ⲇⲉ ϩⲱⲱϥ ⲛ̅ⲁⲧⲥⲃⲃⲉ. ⲛⲁⲉⲣ ⲑⲉ ⲛ̅ⲟⲩⲁ ⲛ̅ⲛⲁⲓ̈. ϯⲛⲁⲃⲱⲕ ϭⲉ ⲟⲛ. ⲉⲃⲟⲗ ⲉⲣⲟϥ. ⲛ̅ⲧⲁⲡⲁⲧⲁⲥⲥⲉ ⲙ̅ⲙⲟϥ. ⲛ̅ⲧⲁϥⲓ̈ ⲛ̅ⲧⲉϥⲁⲡⲉ. ⲛ̅ⲧⲁϥⲓ̈ ⲙ̅ⲡⲟⲟⲩ ⲛ̅ⲟⲩⲛⲟϭⲛⲉϭ ⲉⲃⲟⲗ ϩⲙ̅ ⲡⲓⲏ̅ⲗ̅. ϫⲉ ⲟⲩ ϩⲱⲱϥ ⲡⲉ ⲡⲓ̈ⲁⲧⲥⲃⲃⲉ. ⲉⲁϥⲛⲟϭⲛⲉϭ ⲙ̅ⲡⲙⲏⲏϣⲉ ⲙ̅ⲡⲛⲟⲩⲧⲉ ⲉⲧⲟⲛϩ̅.	Thy servant smote both the lion and the bear, and the uncircumcised Philistine shall be as one of them: shall I not go and smite him, and remove this day a reproach from Israel? For who is this uncircumcised one, who has defied the army of the living God?	καὶ τὴν ἄρκον ἔτυπτεν ὁ δοῦλός σου καὶ τὸν λέοντα, καὶ ἔσται ὁ ἀλλόφυλος ὁ ἀπερίτµητος ὡς ἓν τούτων· οὐχὶ πορεύσοµαι καὶ πατάξω αὐτὸν καὶ ἀφελῶ σήµερον ὄνειδος ἐξ Ισραηλ; διότι τίς ὁ ἀπερίτµητος οὗτος, ὃς ὠνείδισεν παράταξιν θεοῦ ζῶντος;						
First Samuel	17	17	37	OT	1. OT	Historical Books	2. Historical Books	02. Historical Books	04. First Samuel	ⲡϭ̅ⲥ̅ ⲫⲏ ⲉⲧⲁϥⲛⲁϩⲙⲉⲧ ⲉ̀ⲃⲟⲗ ϧⲉⲛ ⲧϫⲓϫ ⲙ̀ⲡⲓⲙⲟⲩⲓ ⲛⲉⲙ ⲉ̀ⲃⲟⲗ ϧⲉⲛ ⲧϫⲓϫ ⲛ̀ϯⲗⲁⲃⲟⲓ ⲛ̀ⲑⲟϥ ⲉϥⲉ̀ⲛⲁϩⲙⲉⲧ ⲉ̀ⲃⲟⲗ ϧⲉⲛ ⲧϫⲓϫ ⲙ̀ⲡⲓⲁⲗⲗⲟⲫⲩⲗⲟⲥ ⲛ̀ⲁⲧⲥⲉⲃⲓ ⲟⲩⲟϩ ⲡⲉϫⲉ ⲥⲁⲟⲩⲗ ⲟⲩⲃⲉ ⲇⲁⲩⲓⲇ ϫⲉ ⲙⲁϣⲉ ⲛⲁⲕ ⲉϥⲉ̀ϣⲱⲡⲓ ⲛⲉⲙⲁⲕ ⲛ̀ϫⲉ ⲡϭ̅ⲥ̅	ⲁⲩⲱ ⲇⲁⲩⲉⲓⲇ ⲡⲉϫⲁϥ ϩⲓ̈ⲛⲁⲓ̈. ϫⲉ ⲡϫⲟⲉⲓⲥ ⲡⲉ ⲛ̅ⲧⲁϥⲛⲁϩⲙⲉⲧ ⲉⲧⲧⲁⲡⲣⲟ ⲙ̅ⲡⲙⲟⲩⲓ̈. ⲁⲩⲱ ⲛ̅ⲧⲟⲟⲧϥ̅ ⲛ̅ⲧⲁⲣⲝ. ⲛ̅ⲧⲟϥ ⲟⲛ ⲡⲉⲧⲛⲁⲛⲁϩⲙⲉⲧ ⲛ̅ⲧⲟⲟⲧϥ̅ ⲙ̅ⲡⲓ̈ⲁⲗⲗⲟⲫⲩⲗⲟⲥ ⲛ̅ⲁⲧⲥⲃ̅ⲃⲉ. ⲁⲩⲱ ⲥⲁⲟⲩⲗ ⲡⲉϫⲁϥ ⲛ̅ⲇⲁⲩⲉⲓⲇ. ϫⲉ ⲃⲱⲕ ⲉⲃⲟⲗ ⲉⲣⲟϥ. ⲁⲩⲱ ⲉⲣⲉ ⲡϫⲟⲉⲓⲥ ϣⲱⲡⲉ ⲛⲙ̅ⲙⲁⲕ.	The Lord who delivered me out of the paw of the lion and out the paw of the bear, he will deliver me out of the hand of this uncircumcised Philistine. And Saul said to David, Go, and the Lord shall be with thee.	κύριος, ὃς ἐξείλατό µε ἐκ χειρὸς τοῦ λέοντος καὶ ἐκ χειρὸς τῆς ἄρκου, αὐτὸς ἐξελεῖταί µε ἐκ χειρὸς τοῦ ἀλλοφύλου τοῦ ἀπεριτµήτου τούτου. καὶ εἶπεν Σαουλ πρὸς Δαυιδ Πορεύου, καὶ ἔσται κύριος µετὰ σοῦ.						
First Samuel	17	17	38	OT	1. OT	Historical Books	2. Historical Books	02. Historical Books	04. First Samuel	ⲟⲩⲟϩ ⲁ ⲥⲁⲟⲩⲗ ⲙⲟⲣ ⲛ̀ⲇⲁⲩⲓⲇ ϧⲉⲛ ⲡⲉϥⲙⲟⲩϫϧ ⲁϥϯ ⲛⲁϥ ⲛ̀ⲟⲩⲡⲉⲣⲓⲕⲉⲫⲁⲗⲉⲁ ϩⲓϫⲉⲛ ⲧⲉϥⲁⲫⲉ	ⲥⲁⲟⲩⲗ ⲇⲉ ⲁϥϯ ϩⲓ̈ⲱⲱϥ ⲛ̅ⲇ̅ⲁ̅ⲇ̅. ⲛ̅ⲟⲩϣⲧⲏⲛ ⲛ̅ⲣⲃⲧ̅. ⲁⲩⲱ ⲟⲩⲡⲉⲣⲓⲕⲉⲫⲁⲗⲁⲓⲁ ⲛ̅ϩⲟⲙⲛ̅ⲧ. ⲁϥⲧⲁⲁⲥ ⲉϫⲛ̅ ⲧⲉϥⲁⲡⲉ.	And Saul clothed David with a military coat, and put his brazen helmet on his head.	καὶ ἐνέδυσεν Σαουλ τὸν Δαυιδ µανδύαν καὶ περικεφαλαίαν χαλκῆν περὶ τὴν κεφαλὴν αὐτοῦ						
First Samuel	17	17	39	OT	1. OT	Historical Books	2. Historical Books	02. Historical Books	04. First Samuel	ⲟⲩⲟϩ ⲁϥϧⲟⲕϥ ⲛ̀ⲧⲉϥⲥⲏϥⲓ ⲥⲁⲡϣⲱⲓ ⲙ̀ⲡⲉϥⲙⲟϫϧ ⲟⲩⲟϩ ⲁϥϧⲟⲥⲓ ⲉϥⲙⲟϣⲓ ⲛ̀ⲟⲩⲥⲟⲡ ⲛⲉⲙ ⲥⲛⲁⲩ ⲉϥⲕⲉϩ ⲉ̀ⲣⲱⲟⲩ ⲁⲛ ⲟⲩⲟϩ ⲡⲉϫⲉ ⲇⲁⲩⲓⲇ ⲟⲩⲃⲉ ⲥⲁⲟⲩⲗ ϫⲉ ϯⲛⲁϣ̀ϫⲉⲙϫⲟⲙ ⲁⲛ ⲉ̀ⲙⲟϣⲓ ϧⲁ ⲛⲁⲓ ϫⲉ ϯⲕⲉϩ ⲉ̀ⲣⲱⲟⲩ ⲁⲛ ⲟⲩⲟϩ ⲁⲩⲟⲗⲟⲩ ⲉ̀ⲃⲟⲗ ϩⲓⲱⲧϥ	ⲁⲩⲱ ⲁϥϯ ϩⲓ̈ⲱⲱϥ ⲛ̅ⲟⲩϩⲱⲕ. ⲁⲩⲱ ⲧⲉϥⲥⲏϥⲉ. ⲁϥⲙⲟⲣⲥ̅ ⲉϫⲛ̅ ⲡϩⲱⲕ ⲛ̅ⲇⲁⲩⲉⲓⲇ. ⲁϥϫⲱⲣⲁϩ ⲇⲉ ⲛ̅ϭⲓ ⲇⲁⲩⲉⲓⲇ. ⲛ̅ⲧⲉⲣⲉϥϫⲱⲛⲧ ⲉⲙⲟⲟϣⲉ ⲛ̅ϩⲏⲧⲟⲩ. ϫⲉ ⲛⲉϥϫⲟⲛⲧ̅ ⲁⲛ ⲙ̅ⲙ̅ⲙⲟⲩ. ⲁⲩⲱ ⲛ̅ⲧⲉⲣⲉϥⲙⲟⲟϣⲉ ⲛ̅ϩⲏⲧⲟⲩ ⲛ̅ϩⲏⲧⲟⲩ ⲛ̅ⲟⲩⲥⲟⲡ ⲁⲩⲱ ⲥⲛⲁⲩ ⲁϥϩⲓ̈ⲥⲉ. ⲡⲉϫⲉ ⲇⲁⲩⲉⲓⲇ ⲛ̅ⲥⲁⲟⲩⲗ. ϫⲉ ⲛ̅ϯⲛⲁⲉϣ̅ⲙⲟⲟϣⲉ ⲁⲛ. ⲉⲣⲉ ⲛⲁⲓ̈ ϩⲓ̈ⲱⲱⲧ. ϫⲉ ⲛ̅ϯⲧⲏⲏⲡ ⲁⲛ ⲉⲣⲟⲟⲩ. ⲇⲁⲩⲉⲓⲇ ⲇⲉ ⲁϥⲕⲁⲁϥ ⲕⲁϩⲏⲩ ⲙ̅ⲙⲟⲟⲩ.	And he girt David with his sword over his coat: and he made trial walking with them once and again: and David said to Saul, I shall not be able to go with these, for I have not proved them: so they remove them from him.	καὶ ἔζωσεν τὸν Δαυιδ τὴν ῥοµφαίαν αὐτοῦ ἐπάνω τοῦ µανδύου αὐτοῦ. καὶ ἐκοπίασεν περιπατήσας ἅπαξ καὶ δίς· καὶ εἶπεν Δαυιδ πρὸς Σαουλ Οὐ µὴ δύνωµαι πορευθῆναι ἐν τούτοις, ὅτι οὐ πεπείραµαι. καὶ ἀφαιροῦσιν αὐτὰ ἀπ’ αὐτοῦ.						
