book	chapter	chapter-zfilled	verse	testament	testament-indexed	section	section-indexed	section-indexed-no-testament	book-indexed	Bohairic	Sahidic	English	Greek	Fayyumic	Akhmimic	OldBohairic	Mesokemic	DialectP	Lycopolitan
Second Samuel	16	16	9	OT	1. OT	Historical Books	2. Historical Books	02. Historical Books	05. Second Samuel		ⲁⲩⲱ ⲁⲃⲓⲥⲁ ⲡϣⲏⲣⲉ ⲛ̅ⲥⲁⲣⲟⲩⲉⲓⲁⲥ. ⲡⲉϫⲁϥ ⲉϩⲟⲩⲛ ⲡⲣ̅ⲣⲟ. ϫⲉ ⲟⲩ ⲡⲉ ⲡⲓⲟⲩϩⲟⲣ ⲉⲧⲙⲟⲟⲩⲧ. ϫⲉ ⲉϥⲉⲥⲁϩⲟⲩ ⲙ̅ⲡⲁϫⲟⲉⲓⲥ ⲡⲣ̅ⲣⲟ ϯⲛⲁⲃⲱⲕ ⲉⲣⲟϥ ⲛ̅ⲧⲁϥⲓ̈ ⲛ̅ⲧⲉϥⲁⲡⲉ.	And Abessa the son of Saruia said to the king, Why does this dead dog curse my lord the king? let me go over now and take off his head.	καὶ εἶπεν Αβεσσα υἱὸς Σαρουιας πρὸς τὸν βασιλέα Ἵνα τί καταρᾶται ὁ κύων ὁ τεθνηκὼς οὗτος τὸν κύριόν µου τὸν βασιλέα; διαβήσοµαι δὴ καὶ ἀφελῶ τὴν κεφαλὴν αὐτοῦ.						
Second Samuel	16	16	10	OT	1. OT	Historical Books	2. Historical Books	02. Historical Books	05. Second Samuel		ⲡⲉϫⲉ ⲡⲣ̅ⲣⲟ ⲛⲁϥ. ϫⲉ ⲁϩⲣⲱⲧⲛ̅ ⲛⲙ̅ⲙⲁⲓ̈ ⲛⲉϣⲏⲣⲉ ⲛ̅ⲥⲁⲣⲟⲩⲉⲓⲁⲥ. ⲁⲗⲱⲧⲛ̅ ϩⲁⲣⲟϥ. ⲉⲧⲣⲉϥⲥⲁϩⲟⲩ ϩⲓⲛⲁⲓ. ϫⲉ ⲡϫⲟⲉⲓⲥ ⲡⲉ ⲛ̅ⲧⲁϥϫⲟⲟⲥ ⲛⲁϥ ⲉⲧⲣⲉϥⲥⲁϩⲟⲩ ⲛ̅ⲇⲁⲩⲉⲓⲇ. ⲁⲩⲱ ⲛⲓⲙ ⲡⲉⲧⲛⲁϣ̅ϫⲟⲟⲥ ⲛⲁϥ ϫⲉ ⲉⲧⲃⲉ ⲟⲩ. ⲁⲕⲉⲓⲣⲉ. ⲛⲁⲓ.	And the king said, What have I to do with you, ye sons of Saruia? even let him alone, and so let him curse, for the Lord has told him to curse David: and who shall say, Why hast thou done thus?	καὶ εἶπεν ὁ βασιλεύς Τί ἐµοὶ καὶ ὑµῖν, υἱοὶ Σαρουιας; ἄφετε αὐτὸν καὶ οὕτως καταράσθω, ὅτι κύριος εἶπεν αὐτῷ καταρᾶσθαι τὸν Δαυιδ, καὶ τίς ἐρεῖ Ὡς τί ἐποίησας οὕτως;						
Second Samuel	16	16	11	OT	1. OT	Historical Books	2. Historical Books	02. Historical Books	05. Second Samuel		ⲁⲩⲱ ⲡⲉϫⲉ ⲇ̅ⲁ̅ⲇ̅ ⲉϩⲟⲩⲛ ϩⲛ̅ ⲁⲃⲓⲥⲁ. ⲁⲩⲱ ⲉϩⲟⲩⲛ ⲉⲛⲉϥϩⲙ̅ϩⲁⲗ ⲧⲏⲣⲟⲩ. ⲉϥϫⲱ ⲙ̅ⲙⲟⲥ ⲛⲁⲩ. ϫⲉ ⲉⲓⲥ ⲡⲁϣⲏⲣⲉ ⲣⲱ. ⲁⲩⲱ ⲡⲉⲛⲧⲁϥⲉⲓ ⲉⲃⲟⲗ ϩⲛ̅ ⲛⲁⲙⲉⲗⲟⲥ. ⲁⲩⲱ ϥⲕⲱⲧⲉ ⲛ̅ⲥⲁ ⲧⲁⲯⲩⲭⲏ ⲉϥⲓⲧⲥ̅. ⲉϫⲉⲙ ⲡⲁⲓ ⲇⲉ ϩⲱⲱϥ ⲧⲉⲛⲟⲩ. ⲡⲕⲉϣⲏⲣⲉ ⲛ̅ⲓ̈ⲉⲙⲉⲛⲉⲓ. ⲁⲗⲱⲧⲛ̅ ϩⲁⲣⲟϥ. ⲙⲁⲣⲉϥⲥⲁϩⲟⲩ. ϫⲉ ⲡϫⲟⲉⲓⲥ ⲡⲉ ⲛ̅ⲧⲁϥϫⲟⲟⲥ ⲛⲁϥ ⲉⲧⲣⲉϥⲉⲣ ⲡⲁⲓ.	And David said to Abessa and to all his servants, Behold, my son who came forth out of my bowels seeks my life; still more now may the son of Benjamin: let him curse, because the Lord has told him.	καὶ εἶπεν Δαυιδ πρὸς Αβεσσα καὶ πρὸς πάντας τοὺς παῖδας αὐτοῦ Ἰδοὺ ὁ υἱός µου ὁ ἐξελθὼν ἐκ τῆς κοιλίας µου ζητεῖ τὴν ψυχήν µου, καὶ προσέτι νῦν ὁ υἱὸς τοῦ Ιεµινι· ἄφετε αὐτὸν καταρᾶσθαι, ὅτι εἶπεν αὐτῷ κύριος·						
Second Samuel	16	16	12	OT	1. OT	Historical Books	2. Historical Books	02. Historical Books	05. Second Samuel		ⲙⲉϣⲁⲕ ⲛ̅ⲧⲉ ⲡϫⲟⲉⲓⲥ ϭⲱϣⲧ̅ ⲉϫⲙ̅ ⲡⲁⲑⲃ̅ⲃⲓⲟ. ⲛϥ̅ⲕⲧⲟ. ⲉϩⲣⲏⲓ ⲉϫⲱⲓ ⲛ̅ϩⲉⲛⲁⲅⲁⲑⲟⲛ. ⲉⲡⲙⲁ ⲙ̅ⲡⲉϥⲥⲁϩⲟⲩ ϩⲙ̅ ⲡⲟⲟⲩ ⲛ̅ϩⲟⲟⲩ.	If by any means the Lord may look on my affliction, thus shall he return me good for his cursing this day.	εἴ πως ἴδοι κύριος ἐν τῇ ταπεινώσει µου καὶ ἐπιστρέψει µοι ἀγαθὰ ἀντὶ τῆς κατάρας αὐτοῦ τῇ ἡµέρᾳ ταύτῃ.						
Second Samuel	16	16	13	OT	1. OT	Historical Books	2. Historical Books	02. Historical Books	05. Second Samuel		ⲁⲩⲱ ⲇ̅ⲁ̅ⲇ̅ ⲙⲛ̅ ⲛ̅ⲣⲱⲙⲉ ⲉⲧⲛ̅ⲙ̅ⲙⲁϥ. ⲁⲩⲙⲟⲟϣⲉ ϩⲛ̅ ⲧⲉϩⲓⲏ. ⲥⲉⲙⲉⲉⲓ ⲇⲉ ϩⲱⲱϥ. ⲛⲉϥⲙⲟⲟϣⲉ ⲛ̅ⲥⲁⲥⲡⲓⲣ ⲙ̅ⲡⲧⲟⲟⲩ. ⲉϥϩⲏⲛ ⲉⲣⲟϥ. ⲛⲉϥⲙⲟⲟϣⲉ ⲇⲉ ⲉϥⲥⲁϩⲟⲩ ⲁⲩⲱ ⲉϥⲛⲉϫ ⲱⲛⲉ. ϩⲉⲛ ϩⲉⲛⲱⲛⲉ ⲛ̅ⲥⲁⲥⲡⲓⲣ ⲙ̅ⲙⲟϥ. ⲁⲩⲱ ⲉϥⲛⲉϫ ⲉⲓⲧⲛ̅ ⲉϩⲟⲩⲛ ϩⲙ̅ ⲡⲉϥϩⲟ.	And David and all the men with him went on the way: and Semei went by the side of the hill next to him, cursing as he went, and casting stones at him, and sprinkling him with dirt.	καὶ ἐπορεύθη Δαυιδ καὶ οἱ ἄνδρες αὐτοῦ ἐν τῇ ὁδῷ, καὶ Σεµεϊ ἐπορεύετο ἐκ πλευρᾶς τοῦ ὄρους ἐχόµενα αὐτοῦ πορευόµενος καὶ καταρώµενος καὶ λιθάζων ἐν λίθοις ἐκ πλαγίων αὐτοῦ καὶ τῷ χοῒ πάσσων.						
Second Samuel	16	16	14	OT	1. OT	Historical Books	2. Historical Books	02. Historical Books	05. Second Samuel		ⲡⲣ̅ⲣⲟ ⲇⲉ ⲙⲛ̅ ⲡⲗⲁⲟⲥ ⲧⲏⲣϥ̅ ⲉⲧⲛ̅ⲙ̅ⲙⲁϥ. ⲁⲩⲉⲓ ⲉⲩϩⲟⲥⲉ. ⲁⲩⲱ ⲉⲩϣⲟⲥⲙ̅. ⲁⲩϭⲱ. ⲁⲩⲉⲙⲧⲟⲛ ⲙ̅ⲙⲟⲟⲩ ⲙ̅ⲡⲙⲁ ⲉⲧⲙ̅ⲙⲁⲩ.	And the king, and all the people with him, came away and refreshed themselves there.	καὶ ἦλθεν ὁ βασιλεὺς καὶ πᾶς ὁ λαὸς αὐτοῦ ἐκλελυµένοι καὶ ἀνέψυξαν ἐκεῖ.						
Second Samuel	16	16	15	OT	1. OT	Historical Books	2. Historical Books	02. Historical Books	05. Second Samuel		ⲁⲃⲏⲥⲁⲗⲱⲙ ⲇⲉ. ⲙⲛ̅ ⲛ̅ⲣⲱⲙⲉ ⲙ̅ⲡⲓ̈ⲏ̅ⲗ̅. ⲁⲩⲃⲱⲕ ⲛⲙ̅ⲙⲁϥ ⲉϩⲟⲩⲛ ⲉⲑⲓⲗ̅ⲏ̅ⲙ̅. ⲉⲣⲉ ⲁⲭⲓⲧⲟⲫⲉⲗ ⲛⲙ̅ⲙⲁϥ.	And Abessalom and all the men of Israel went into Jerusalem, and Achitophel with him.	Καὶ Αβεσσαλωµ καὶ πᾶς ἀνὴρ Ισραηλ εἰσῆλθον εἰς Ιερουσαληµ καὶ Αχιτοφελ µετ’ αὐτοῦ.						
Second Samuel	16	16	16	OT	1. OT	Historical Books	2. Historical Books	02. Historical Books	05. Second Samuel		ⲁⲥϣⲱⲡⲉ ⲇⲉ ⲛ̅ⲧⲉⲣⲉϥⲉⲓ ⲛ̅ϭⲓ ⲭⲟⲩⲥⲉⲓ. ⲡⲉϣⲃⲏⲣ ⲟⲛ ⲛⲇ̅ⲁ̅ⲇ̅ ⲉⲣⲁⲧϥ̅ ⲛ̅ⲁⲃⲏⲥⲁⲗⲱⲙ. ⲡⲉϫⲉ ⲭⲟⲩⲥⲉⲓ ⲛ̅ⲁⲃⲏⲥⲁⲗⲱⲙ. ϫⲉ ⲙⲁⲣⲉϥⲱⲛϩ̅ ⲛ̅ϭⲓ ⲡⲣ̅ⲣⲟ.	And it came to pass when Chusi the chief friend of David came to Abessalom, that Chusi said to Abessalom, Let the king live.	καὶ ἐγενήθη ἡνίκα ἦλθεν Χουσι ὁ Αρχι ἑταῖρος Δαυιδ πρὸς Αβεσσαλωµ, καὶ εἶπεν Χουσι πρὸς Αβεσσαλωµ Ζήτω ὁ βασιλεύς.						
Second Samuel	16	16	17	OT	1. OT	Historical Books	2. Historical Books	02. Historical Books	05. Second Samuel		ⲡⲉϫⲉ ⲁⲃⲏⲥⲁⲗⲱⲙ ⲉϩⲟⲩⲛ ϩⲛ̅ ⲭⲟⲩⲥⲉⲓ. ϫⲉ ⲡⲁⲓ ⲡⲉ ⲡⲉⲕⲛⲁ. ⲛ̅ⲧⲁⲕⲁⲁϥ. ⲙⲛ̅ ⲡⲉⲕϣⲃⲏⲣ. ⲉⲧⲃⲉⲟⲩ ⲙ̅ⲡⲉⲕⲃⲱⲕ ⲙⲛ̅ ⲡⲉⲕϣⲃⲏⲣ	And Abessalom said to Chusi, Is this thy kindness to thy friend? why wentest thou not forth with thy friend?	καὶ εἶπεν Αβεσσαλωµ πρὸς Χουσι Τοῦτο τὸ ἔλεός σου µετὰ τοῦ ἑταίρου σου; ἵνα τί οὐκ ἀπῆλθες µετὰ τοῦ ἑταίρου σου;						
Second Samuel	16	16	18	OT	1. OT	Historical Books	2. Historical Books	02. Historical Books	05. Second Samuel		ⲡⲉϫⲉ ⲭⲟⲩⲥⲉⲓ ⲉϩⲟⲩⲛ ϩⲛ̅ ⲁⲃⲏⲥⲁⲗⲱⲙ. ϫⲉ ⲛ̅ϯⲛⲁⲉⲣⲡⲁⲓ ⲁⲛ. ⲁⲗⲗⲁ ⲉⲓⲛⲁⲟⲩⲁϩⲧ̅ ⲛ̅ⲧⲟϥ ⲛ̅ⲥⲁ ⲡⲉⲛⲧⲁ ⲡϫⲟⲉⲓⲥ ⲥⲟⲧⲡϥ̅. ⲁⲩⲱ ⲡⲉⲛⲧⲁ ⲡⲉⲓⲗⲁⲟⲥ ⲙⲛ̅ ⲛⲉⲣⲱⲙⲉ ⲧⲏⲣⲟⲩ ⲙ̅ⲡⲓ̈ⲏ̅ⲗ̅ ⲥⲟⲧⲡϥ. ⲉⲓⲛⲁⲱⲡ ⲉⲣⲟϥ. ⲁⲩⲱ ⲉⲓⲛⲁϭⲱ ϩⲁⲧⲏϥ.	And Chusi said to Abessalom, Nay, but following whom the Lord, and this people, and all Israel have chosen, —his will I be, and with him I will dwell.	καὶ εἶπεν Χουσι πρὸς Αβεσσαλωµ Οὐχί, ἀλλὰ κατόπισθεν οὗ ἐξελέξατο κύριος καὶ ὁ λαὸς οὗτος καὶ πᾶς ἀνὴρ Ισραηλ, αὐτῷ ἔσοµαι καὶ µετ’ αὐτοῦ καθήσοµαι·						
Second Samuel	16	16	19	OT	1. OT	Historical Books	2. Historical Books	02. Historical Books	05. Second Samuel		ⲙⲛ̅ⲛ̅ⲥⲁ ⲡⲁⲓ ⲇⲉ ⲁⲛⲟⲕ. ⲉⲓⲛⲁⲣ̅ϩⲙ̅ϩⲁⲗ ⲛ̅ⲛⲓⲙ. ⲉⲓⲛⲁⲉⲓⲣⲉ ⲁⲛ ϩⲓⲑⲏ ⲙ̅ⲡⲉϥϣⲏⲣⲉ. ⲕⲁⲧⲁ ⲑⲉ ϭⲉ. ⲛ̅ⲧⲁⲓⲉⲣϩⲙ̅ϩⲁⲗ ⲛⲁϩⲣⲁϥ ⲙ̅ⲡⲉⲕⲉⲓⲱⲧ. ⲧⲁⲓ ⲧⲉ ⲑⲉ ⲉϯⲛⲁⲉⲓⲣⲉ ϩⲱⲱϥ ⲛⲁϩⲣⲟⲕ.	And again, whom shall I serve? should I not in the presence of his son? As I served in the sight of thy father, so will I be in thy presence.	καὶ τὸ δεύτερον τίνι ἐγὼ δουλεύσω; οὐχὶ ἐνώπιον τοῦ υἱοῦ αὐτοῦ; καθάπερ ἐδούλευσα ἐνώπιον τοῦ πατρός σου, οὕτως ἔσοµαι ἐνώπιόν σου.						
Second Samuel	16	16	20	OT	1. OT	Historical Books	2. Historical Books	02. Historical Books	05. Second Samuel		ⲡⲉϫⲉ ⲁⲃⲏⲥⲁⲗⲱⲙ ⲛ̅ⲁⲭⲓⲇⲟⲫⲉⲗ. ϫⲉ ⲛ̅ⲧⲱⲧⲛ̅. ⲁⲛⲓ̈ ⲟⲩⲅⲛⲱⲙⲏ ⲛⲁⲛ ⲉϩⲟⲩⲛ. ϫⲉ ⲟⲩ ⲡⲉⲧⲉⲛⲛⲁⲁⲁϥ.	And Abessalom said to Achitophel, Deliberate among yourselves concerning what we should do.	καὶ εἶπεν Αβεσσαλωµ πρὸς Αχιτοφελ Φέρετε ἑαυτοῖς βουλὴν τί ποιήσωµεν.						
Second Samuel	16	16	21	OT	1. OT	Historical Books	2. Historical Books	02. Historical Books	05. Second Samuel		ⲡⲉϫⲉ ⲁⲭⲓⲇⲟⲫⲉⲗ ⲛ̅ⲁⲃⲏⲥⲁⲗⲱⲙ ϫⲉ ⲃⲱⲕ ⲉϩⲟⲩⲛ ϣⲁ ⲙ̅ⲡⲁⲗⲗⲁⲕⲏ ⲙ̅ⲡⲉⲕⲉⲓⲱⲧ. ⲛⲁⲓ ⲛ̅ⲧⲁϥⲕⲁⲁⲩ ⲉⲡⲁϩⲟⲩ. ⲉⲧⲣⲉⲩϩⲁⲣⲉϩ ⲉⲡⲉϥⲏⲓ̈. ⲁⲩⲱ ⲥⲉⲛⲁⲥⲱⲧⲙ̅ ⲛ̅ϭⲓ ⲡⲓ̈ⲏ̅ⲗ̅ ⲧⲏⲣϥ̅. ϫⲉ ⲁⲕϯϣⲓⲡⲉ ⲙ̅ⲡⲉⲕⲉⲓⲱⲧ. ⲁⲩⲱ ⲥⲉⲛⲁⲧⲁϫⲣⲟ ⲛ̅ϭⲓ ⲛ̅ϭⲓϫ ⲛ̅ⲟⲩⲟⲛ ⲛⲓⲙ ⲉⲧⲛ̅ⲙ̅ⲙⲁⲕ.	And Achitophel said to Abessalom, Go in to thy father’s concubines, whom he left to keep his house; and all Israel shall hear that thou hast dishonoured thy father; and the hands of all that are with thee shall be strengthened.	καὶ εἶπεν Αχιτοφελ πρὸς Αβεσσαλωµ Εἴσελθε πρὸς τὰς παλλακὰς τοῦ πατρός σου, ἃς κατέλιπεν φυλάσσειν τὸν οἶκον αὐτοῦ, καὶ ἀκούσεται πᾶς Ισραηλ ὅτι κατῄσχυνας τὸν πατέρα σου, καὶ ἐνισχύσουσιν αἱ χεῖρες πάντων τῶν µετὰ σοῦ.						
Second Samuel	16	16	22	OT	1. OT	Historical Books	2. Historical Books	02. Historical Books	05. Second Samuel		ⲁⲩⲱ ⲁⲩⲧⲁϩⲟ ⲉⲣⲁⲧⲥ̅ ⲛ̅ⲧⲉⲥⲕⲩⲛⲏ ⲛ̅ⲁⲃⲏⲥⲁⲗⲱⲙ. ϩⲓ ⲧϫⲉⲛⲉⲡⲱⲣ. ⲁ ⲁⲃⲏⲥⲁⲗⲱⲙ ⲃⲱⲕ ⲉϩⲟⲩⲛ ϣⲁ ⲙ̅ⲡⲁⲗⲗⲁⲕⲏ ⲙ̅ⲡⲉϥⲉⲓⲱⲧ. ⲙ̅ⲡⲙ̅ⲧⲟ ⲉⲃⲟⲗ ⲙ̅ⲡⲓ̈ⲏ̅ⲗ̅. ⲧⲏⲣϥ̅.	And they pitched a tent for Abessalom on the roof, and Abessalom went in to his father’s concubines in the sight of all Israel.	καὶ ἔπηξαν τὴν σκηνὴν τῷ Αβεσσαλωµ ἐπὶ τὸ δῶµα, καὶ εἰσῆλθεν Αβεσσαλωµ πρὸς τὰς παλλακὰς τοῦ πατρὸς αὐτοῦ κατ’ ὀφθαλµοὺς παντὸς Ισραηλ.						
Second Samuel	16	16	23	OT	1. OT	Historical Books	2. Historical Books	02. Historical Books	05. Second Samuel		ⲁⲩⲱ ⲡϣⲟϫⲛⲉ. ⲛ̅ⲧⲁ ⲁⲭⲓⲧⲟⲫⲉⲗ. ϣⲟϫⲛⲉ ⲙ̅ⲙⲟϥ ϩⲛ̅ ⲛⲉϩⲟⲟⲩ ⲛ̅ϣⲟⲣⲡ̅. ⲛ̅ⲑⲉ ⲛ̅ⲟⲩⲁ ⲉϥⲛⲁϣⲓⲛⲉ. ϩⲙ̅ ⲡϣⲁϫⲉ ⲙ̅ⲡⲛⲟⲩⲧⲉ. ⲧⲁⲓ ⲧⲉ ⲑⲉ ⲙ̅ⲡϣⲟϫⲛⲉ ⲧⲏⲣϥ̅ ⲛ̅ⲁⲭⲓⲇⲟⲫⲉⲗ. ⲛⲁϩⲣⲁϥ ⲛ̅ⲇ̅ⲁ̅ⲇ̅ ⲁⲩⲱ ⲛⲁϩⲣⲁϥ ⲛ̅ⲁⲃⲏⲥⲁⲗⲱⲙ.	And the counsel of Achitophel, which he counselled in former days, was as if one should enquire of the word of God: so was all the counsel of Achitophel both to David and also to Abessalom.	καὶ ἡ βουλὴ Αχιτοφελ, ἣν ἐβουλεύσατο ἐν ταῖς ἡµέραις ταῖς πρώταις, ὃν τρόπον ἐπερωτήσῃ ἐν λόγῳ τοῦ θεοῦ, οὕτως πᾶσα ἡ βουλὴ τοῦ Αχιτοφελ καί γε τῷ Δαυιδ καί γε τῷ Αβεσσαλωµ. —						
Second Samuel	17	17	1	OT	1. OT	Historical Books	2. Historical Books	02. Historical Books	05. Second Samuel		ⲡⲉϫⲉ ⲁⲭⲓⲇⲟⲫⲉⲗ ⲛ̅ⲁⲃⲏⲥⲁⲗⲱⲙ. ϫⲉ ⲧⲁⲥⲱⲧⲡ̅ ⲛⲁⲓ. ⲛ̅ⲙⲛ̅ⲧⲥⲛⲟⲟⲩⲥ ⲛ̅ϣⲟ ⲛ̅ⲣⲱⲙⲉ. ⲛ̅ⲧⲁⲧⲱⲟⲩⲛ. ⲛ̅ⲧⲁⲡⲱⲧ ⲛ̅ⲥⲁ ⲇ̅ⲁ̅ⲇ̅ ⲛ̅ⲧⲉⲩϣⲏ.	And Achitophel said to Abessalom, Let me now choose out for myself twelve thousand men, and I will arise and follow after David this night:	καὶ εἶπεν Αχιτοφελ πρὸς Αβεσσαλωµ Ἐπιλέξω δὴ ἐµαυτῷ δώδεκα χιλιάδας ἀνδρῶν καὶ ἀναστήσοµαι καὶ καταδιώξω ὀπίσω Δαυιδ τὴν νύκτα·						
Second Samuel	17	17	2	OT	1. OT	Historical Books	2. Historical Books	02. Historical Books	05. Second Samuel		ⲛ̅ⲧⲁⲡⲱϩⲧ̅ ⲉϫⲱϥ ⲁⲩⲱ ⲛ̅ⲧⲟϥ ⲉⲓⲛⲁⲧⲁϩⲟϥ ⲉϥϩⲟⲥⲉ. ⲉⲛϥⲙⲏⲣ ⲁⲛ ϩⲛ̅ ⲛⲉϥϭⲓϫ. ⲛ̅ⲧⲁⲑⲉⲣϣⲁϥ ⲉⲙⲁⲧⲉ. ⲛϥ̅ⲧⲱⲟⲩⲛ. ⲛϥ̅ⲡⲱⲧ ⲛ̅ⲧⲟϥ. ⲁⲩⲱ ⲡⲙⲏⲏϣⲉ ⲧⲏⲣϥ̅ ⲉⲧⲛ̅ⲙ̅ⲙⲁϥ. ⲁⲩⲱ ⲛ̅ⲧⲁⲣⲁϩⲧ(sic) ⲡⲣ̅ⲣⲟ ⲙⲁⲩⲁⲁϥ.	and I will come upon him when he is weary and weak-handed, and I will strike him with terror; and all the people with him shall flee, and I will smite the king only of all.	καὶ ἐπελεύσοµαι ἐπ’ αὐτόν, καὶ αὐτὸς κοπιῶν καὶ ἐκλελυµένος χερσίν, καὶ ἐκστήσω αὐτόν, καὶ φεύξεται πᾶς ὁ λαὸς ὁ µετ’ αὐτοῦ, καὶ πατάξω τὸν βασιλέα µονώτατον·						
Second Samuel	17	17	3	OT	1. OT	Historical Books	2. Historical Books	02. Historical Books	05. Second Samuel		ⲛ̅ⲧⲁⲕⲧⲉ ⲡⲗⲁⲟⲥ ⲧⲏⲣϥ̅ ⲉⲣⲁⲧⲕ̅. ⲛ̅ⲑⲉ ⲛ̅ⲧϣⲉⲗⲉⲉⲧ. ⲉϣⲁⲥⲕⲧⲟⲥ ⲉⲣⲁⲧϥ̅ ⲙ̅ⲡⲉⲥϩⲁⲓ̈. ⲡⲗⲏⲛ ⲧⲉⲯⲩⲭⲏ ⲛ̅ⲟⲩⲣⲱⲙⲉ ⲛ̅ⲟⲩⲱⲧ. ⲧⲉⲧⲉⲕⲕⲱⲧⲉ ⲛ̅ⲥⲱⲥ ⲛ̅ⲧⲁⲕ(sic). ⲁⲩⲱ ⲡⲗⲁⲟⲥ ⲧⲏⲣϥ̅. ⲟⲩⲛ̅ ⲟⲩⲉⲓⲣⲏⲛⲏ ⲛⲁϣⲱⲡⲉ ⲛⲁϥ.	And I will bring back all the people to thee, as a bride returns to her husband: only thou seekest the life of one man, and all the people shall have peace.	καὶ ἐπιστρέψω πάντα τὸν λαὸν πρὸς σέ, ὃν τρόπον ἐπιστρέφει ἡ νύµφη πρὸς τὸν ἄνδρα αὐτῆς· πλὴν ψυχὴν ἑνὸς ἀνδρὸς σὺ ζητεῖς, καὶ παντὶ τῷ λαῷ ἔσται εἰρήνη.						
Second Samuel	17	17	4	OT	1. OT	Historical Books	2. Historical Books	02. Historical Books	05. Second Samuel		ⲡϣⲁϫⲉ ⲇⲉ ⲛⲉϥⲥⲟⲩⲧⲱⲛ ⲛⲁϩⲣⲁϥ ⲛ̅ⲁⲃⲏⲥⲁⲗⲱⲙ. ⲁⲩⲱ ⲛⲁϩⲣⲁⲩ ⲛ̅ⲛⲉⲡⲣⲉⲥⲃⲩⲧⲉⲣⲟⲥ ⲧⲏⲣⲟⲩ ⲙ̅ⲡⲓ̈ⲏ̅ⲗ̅.	And the saying was right in the eyes of Abessalom, and in the eyes of all the elders of Israel.	καὶ εὐθὴς ὁ λόγος ἐν ὀφθαλµοῖς Αβεσσαλωµ καὶ ἐν ὀφθαλµοῖς πάντων τῶν πρεσβυτέρων Ισραηλ.						
Second Samuel	17	17	5	OT	1. OT	Historical Books	2. Historical Books	02. Historical Books	05. Second Samuel		ⲡⲉϫⲉ ⲁⲃⲏⲥⲁⲗⲱⲙ ⲇⲉ ϫⲉ ⲙⲟⲩⲧⲉ ϩⲱⲱϥ ⲉⲭⲟⲩⲥⲉⲓ. ⲡϣⲏⲣⲉ ⲛ̅ⲁⲣⲁⲭⲓ ⲛ̅ⲧⲉⲛⲥⲱⲧⲙ̅. ⲉⲡϣⲁϫⲉ ϩⲱⲱϥ ⲉⲧϩⲉⲛ ⲧⲉϥⲧⲁⲡⲣⲟ.	And Abessalom said, Call now also Chusi the Arachite, and let us hear what is in his mouth, even in his also.	καὶ εἶπεν Αβεσσαλωµ Καλέσατε δὴ καί γε τὸν Χουσι τὸν Αραχι, καὶ ἀκούσωµεν τί ἐν τῷ στόµατι αὐτοῦ καί γε αὐτοῦ.						
Second Samuel	17	17	6	OT	1. OT	Historical Books	2. Historical Books	02. Historical Books	05. Second Samuel		ⲁⲩⲱ ⲭⲟⲩⲥⲉⲓ. ⲁϥⲃⲱⲕ ⲉϩⲟⲩⲛ ϣⲁ ⲁⲃⲏⲥⲁⲗⲱⲙ. ⲡⲉϫⲉ ⲁⲃⲏⲥⲁⲗⲱⲙ ⲛⲁϥ. ϫⲉ ⲉⲛⲉ ⲧⲁⲉⲓⲣⲉ. ⲕⲁⲧⲁ ⲡⲉⲓϣⲁϫⲉ ⲛ̅ⲧⲁ ⲁⲭⲓⲇⲟⲫⲉⲗ ϫⲟⲟϥ. ⲉϣⲱⲡⲉ ⲇⲉ ⲙ̅ⲙⲟⲛ. ⲉⲓⲉϣⲁϫⲉ ⲛ̅ⲧⲟⲕ.	And Chusi went in to Abessalom, and Abessalom spoke to him, saying, After this manner spoke Achitophel: shall we do according to his word? but if not, do thou speak.	καὶ εἰσῆλθεν Χουσι πρὸς Αβεσσαλωµ· καὶ εἶπεν Αβεσσαλωµ πρὸς αὐτὸν λέγων Κατὰ τὸ ῥῆµα τοῦτο ἐλάλησεν Αχιτοφελ· εἰ ποιήσοµεν κατὰ τὸν λόγον αὐτοῦ; εἰ δὲ µή, σὺ λάλησον.						
Second Samuel	17	17	7	OT	1. OT	Historical Books	2. Historical Books	02. Historical Books	05. Second Samuel		ⲡⲉϫⲉ ⲭⲟⲩⲥⲉⲓ ⲛ̅ⲁⲃⲏⲥⲁⲗⲱⲙ ϫⲉ ⲛⲁⲛⲟⲩ ⲡⲉⲓϣⲁϫⲛⲉ ⲁⲛ. ⲛ̅ⲧⲁ ⲁⲭⲓⲇⲟⲫⲉⲗ. ϣⲟϫⲛⲉ ⲙ̅ⲙⲟϥ ⲙ̅ⲡⲉⲓⲥⲟⲡ.	And Chusi said to Abessalom, This counsel which Achitophel has counselled this one time is not good.	καὶ εἶπεν Χουσι πρὸς Αβεσσαλωµ Οὐκ ἀγαθὴ αὕτη ἡ βουλή, ἣν ἐβουλεύσατο Αχιτοφελ τὸ ἅπαξ τοῦτο.						
Second Samuel	17	17	8	OT	1. OT	Historical Books	2. Historical Books	02. Historical Books	05. Second Samuel		ⲁϥⲟⲩⲱϩ ⲉⲧⲟⲟⲧϥ̅ ⲟⲛ ⲛ̅ϭⲓ ⲭⲟⲩⲥⲉⲓ ⲉϥϫⲱ ⲙ̅ⲙⲟⲥ ⲟⲛ. ϫⲉ ⲛ̅ⲧⲟⲕ ⲕⲥⲟⲟⲩⲛ ⲙ̅ⲡⲉⲕⲉⲓⲱⲧ. ⲙⲛ̅ ⲛⲉϥⲕⲉⲣⲱⲙⲉ. ϫⲉ ϩⲛ̅ϫⲱⲱⲣⲉ ⲛⲉ ⲉⲙⲁⲧⲉ. ⲁⲩⲱ ⲥⲉⲛⲁϣⲧ ϩⲛ̅ ⲧⲉⲩⲯⲩⲭⲏ. ⲛ̅ⲑⲉ ⲛ̅ⲟⲩⲁⲣⲝ̅. ⲉⲁⲩϥⲓ̈ ⲛ̅ⲛⲉⲥϣⲏⲣⲉ ϩⲛ̅ ⲧⲥⲱϣⲉ. ⲁⲩⲱ ⲛ̅ⲑⲉ ⲛ̅ⲟⲩⲣⲓⲣ ⲛ̅ϩⲟⲟⲩⲧ ⲉϥⲛⲁϣⲧ ϩⲛ̅ ⲟⲩⲙⲁ ⲛ̅ϣⲏⲛ. ⲁⲩⲱ ⲡⲉⲕⲉⲓⲱⲧ ⲟⲩⲣⲉϥⲙⲓϣⲉ ⲡⲉ ⲉϥⲛⲁϯϭⲟⲧⲡⲥ̅ ⲁⲛ ⲉⲡⲗⲁⲟⲥ.	And Chusi said, Thou knowest thy father and his men, that they are very mighty, and bitter in their spirit, as a bereaved bear in the field, [[and as a wild boar in the plain]]: and thy father is a man of war, and will not give the people rest.	καὶ εἶπεν Χουσι Σὺ οἶδας τὸν πατέρα σου καὶ τοὺς ἄνδρας αὐτοῦ ὅτι δυνατοί εἰσιν σφόδρα καὶ κατάπικροι τῇ ψυχῇ αὐτῶν ὡς ἄρκος ἠτεκνωµένη ἐν ἀγρῷ καὶ ὡς ὗς τραχεῖα ἐν τῷ πεδίῳ, καὶ ὁ πατήρ σου ἀνὴρ πολεµιστὴς καὶ οὐ µὴ καταλύσῃ τὸν λαόν·						
Second Samuel	17	17	9	OT	1. OT	Historical Books	2. Historical Books	02. Historical Books	05. Second Samuel		ⲉⲓⲥ ϩⲏⲏⲧⲉ ⲛ̅ⲧⲟϥ. ϥϩⲏⲡ ϩⲛ̅ ⲟⲩⲁ ⲛ̅ⲛ̅ⲉⲃⲟⲩⲛⲟⲥ. ⲏ ϩⲛ̅ ⲟⲩⲁ ⲛ̅ⲛⲉⲙⲁ ⲛ̅ⲗⲱϭⲉ. ⲁⲩⲱ ϩⲙ̅ ⲡⲧⲣⲉϥⲉⲓ ⲉϩⲣⲏⲓ ⲉϫⲱⲟⲩ ⲛ̅ϣⲟⲣⲡ. ϥⲛⲁⲡⲁⲧⲁⲥⲥⲉ ⲙ̅ⲙⲟⲟⲩ. ⲁⲩⲱ ⲛϥ̅ⲥⲱⲧⲙ̅ ⲛ̅ϭⲓ ⲡⲉⲧⲛⲁⲥⲱⲧⲙ̅ ⲛϥ̅ϫⲟⲟⲥ. ϫⲉ ⲁⲩⲣⲁϩⲧⲥ̅ ϣⲱⲡⲉ ⲛ̅ⲥⲁ ⲡⲗⲁⲟⲥ ⲉⲧⲟⲩⲏϩ ⲛ̅ⲥⲁ ⲁⲃⲏⲥⲁⲗⲱⲙ.	For, behold, he is now hidden in one of the hills or in some other place: and it shall come to pass when he falls upon them at the beginning, that some one will certainly hear, and say, There has been a slaughter among the people that follow after Abessalom.	ἰδοὺ γὰρ αὐτὸς νῦν κέκρυπται ἐν ἑνὶ τῶν βουνῶν ἢ ἐν ἑνὶ τῶν τόπων, καὶ ἔσται ἐν τῷ ἐπιπεσεῖν αὐτοῖς ἐν ἀρχῇ καὶ ἀκούσῃ ὁ ἀκούων καὶ εἴπῃ Ἐγενήθη θραῦσις ἐν τῷ λαῷ τῷ ὀπίσω Αβεσσαλωµ,						
Second Samuel	17	17	10	OT	1. OT	Historical Books	2. Historical Books	02. Historical Books	05. Second Samuel		ⲁⲩⲱ ⲛ̅ⲧⲟϥ ⲡⲉⲕⲉⲓⲱⲧ ⲟⲩⲣⲱⲙⲉ ⲡⲉ ⲛ̅ϫⲱⲱⲣⲉ. ⲉⲣⲉ ⲡⲉϥϩⲏⲧ. ⲟ ⲛ̅ⲑⲉ ⲙ̅ⲡϩⲏⲧ ⲙ̅ⲡⲙⲟⲩⲓ̈. ϩⲛ̅ ⲟⲩⲱⲛ ⲉϥϣⲁⲛⲟⲩⲱⲛ(sic). ⲁⲩⲱ ⲡⲓ̈ⲏ̅ⲗ̅ ⲧⲏⲣϥ̅ ⲥⲟⲟⲩⲛ. ϫⲉ ⲟⲩⲇⲩⲛⲁⲧⲟⲥ ⲡⲉ ⲡⲉⲕⲉⲓⲱⲧ. ⲁⲩⲱ ⲛ̅ⲕⲉⲣⲱⲙⲉ ⲉⲧⲛ̅ⲙ̅ⲙⲁϥ. ϩⲛ̅ⲣⲱⲙⲉ ⲛⲉ ⲛ̅ϫⲱⲱⲣⲉ.	Then even he that is strong, whose heart is as the heart of a lion, —it shall utterly melt: for all Israel knows that thy father is mighty, and they that are with him are mighty men.	καί γε αὐτὸς υἱὸς δυνάµεως, οὗ ἡ καρδία καθὼς ἡ καρδία τοῦ λέοντος, τηκοµένη τακήσεται, ὅτι οἶδεν πᾶς Ισραηλ ὅτι δυνατὸς ὁ πατήρ σου καὶ υἱοὶ δυνάµεως οἱ µετ’ αὐτοῦ.						
Second Samuel	17	17	11	OT	1. OT	Historical Books	2. Historical Books	02. Historical Books	05. Second Samuel		ⲡⲁϣⲟϫⲛⲉ ϭⲉ ⲁⲛⲟⲕ ⲉⲓϯ ⲙ̅ⲙⲟϥ ϩⲓⲛⲁⲓ. ⲁⲩⲱ ϩⲛ̅ ⲟⲩⲥⲱⲟⲩϩ. ϥⲛⲁⲥⲱⲟⲩϩ ⲉⲣⲁⲧⲕ̅ ⲛ̅ϭⲓ ⲡⲗⲁⲟⲥ ⲧⲏⲣϥ̅ ⲛ̅ϫⲓⲛ ⲇⲁⲛ ϣⲁ ⲃⲉⲣⲥⲁⲃⲉ. ⲉϥⲟϣ ⲛ̅ⲑⲉ ⲙ̅ⲡϣⲱ ⲉⲧⲡⲟⲣϣ̅ ⲉⲃⲟⲗ ⲉϫⲙ̅ ⲡⲉⲥⲡⲟⲧⲟⲩ ⲛ̅ⲑⲁⲗⲁⲥⲥⲁ ⲉⲩⲁϣⲏ. ⲁⲩⲱ ⲡⲉⲕϩⲟ. ϥⲛⲁϣⲱⲡⲉ ⲉϥϩⲁ ⲉⲟⲟⲩ ϩⲛ̅ ⲧⲉⲩⲙⲏⲧⲉ.	For thus I have surely given counsel, that all Israel be generally gathered to thee from Dan even to Bersabee, as the sand that is upon the sea-shore for multitude: and that thy presence go in the midst of them.	ὅτι οὕτως συµβουλεύων ἐγὼ συνεβούλευσα, καὶ συναγόµενος συναχθήσεται ἐπὶ σὲ πᾶς Ισραηλ ἀπὸ Δαν καὶ ἕως Βηρσαβεε ὡς ἡ ἄµµος ἡ ἐπὶ τῆς θαλάσσης εἰς πλῆθος, καὶ τὸ πρόσωπόν σου πορευόµενον ἐν µέσῳ αὐτῶν,						
Second Samuel	17	17	12	OT	1. OT	Historical Books	2. Historical Books	02. Historical Books	05. Second Samuel		ⲁⲩⲱ ⲧⲉⲛⲛⲁⲉⲓ ⲡⲉ ⲉϩⲣⲏⲓ ⲉϫⲱϥ ϩⲛ̅ ⲟⲩⲁ ⲛ̅ⲛⲉⲙⲁ ⲉⲧⲉⲛⲛⲁⲧⲁϩⲟϥ ⲛ̅ϩⲏⲧϥ̅. ⲁⲩⲱ ⲧⲉⲛⲛⲁϭⲱ ϩⲓⲣⲱϥ ⲛ̅ⲑⲉ ⲛ̅ϯⲱⲧⲉ ⲉϣⲁⲥⲉⲓ ⲉϫⲙ̅ ⲡⲕⲁϩ. ⲛ̅ⲧⲉⲧⲛ̅ⲧⲙ̅ⲕⲁ ⲟⲩⲁ ⲛ̅ϩⲏⲧⲟⲩ ⲉⲥⲉⲉⲡⲉ. ⲟⲩⲇⲉ ⲛ̅ⲧⲟϥ ⲟⲩⲇⲉ ⲛ̅ⲕⲉⲣⲱⲙⲉ ⲉⲧⲛ̅ⲙ̅ⲙⲁϥ.	And we will come upon him in one of the places where we shall find him, and we will encamp against him, as the dew falls upon the earth; and we will not leave of him and of his men so much as one.	καὶ ἥξοµεν πρὸς αὐτὸν εἰς ἕνα τῶν τόπων, οὗ ἐὰν εὕρωµεν αὐτὸν ἐκεῖ, καὶ παρεµβαλοῦµεν ἐπ’ αὐτόν, ὡς πίπτει ἡ δρόσος ἐπὶ τὴν γῆν, καὶ οὐχ ὑπολειψόµεθα ἐν αὐτῷ καὶ τοῖς ἀνδράσιν τοῖς µετ’ αὐτοῦ καί γε ἕνα·						
