book	chapter	chapter-zfilled	verse	testament	testament-indexed	section	section-indexed	section-indexed-no-testament	book-indexed	Bohairic	Sahidic	English	Greek	Fayyumic	Akhmimic	OldBohairic	Mesokemic	DialectP	Lycopolitan
Second Samuel	17	17	13	OT	1. OT	Historical Books	2. Historical Books	02. Historical Books	05. Second Samuel		ⲉϥϣⲁⲛⲡⲱⲧ ⲇⲉ ⲉϩⲟⲩⲛ ⲉⲩⲡⲟⲗⲓⲥ. ⲡⲓ̈ⲏ̅ⲗ̅ ⲧⲏⲣϥ̅ ⲛⲁⲥⲉⲣ ⲛⲟⲩϩ ⲉⲃⲟⲗ ⲉⲧⲡⲟⲗⲓⲥ ⲉⲧⲙ̅ⲙⲁⲩ. ⲛ̅ⲧⲉⲛⲥⲟⲕⲥ̅ ⲉⲃⲟⲗ ⲉⲡⲉⲭⲓⲙⲁⲣⲟⲥ. ⲛ̅ⲧⲉⲛⲧⲙ̅ⲕⲁ ⲟⲩⲱⲛⲉ ⲛ̅ⲟⲩⲱⲧ ⲛ̅ϩⲏⲧⲥ̅.	And if he shall have taken refuge with his army in a city, then shall all Israel take ropes to that city, and we will draw it even into the river, that there may not be left there even a stone.	καὶ ἐὰν εἰς πόλιν συναχθῇ, καὶ λήµψεται πᾶς Ισραηλ πρὸς τὴν πόλιν ἐκείνην σχοινία καὶ συροῦµεν αὐτὴν ἕως εἰς τὸν χειµάρρουν, ὅπως µὴ καταλειφθῇ ἐκεῖ µηδὲ λίθος.						
Second Samuel	17	17	14	OT	1. OT	Historical Books	2. Historical Books	02. Historical Books	05. Second Samuel		ⲡⲉϫⲉ ⲁⲃⲏⲥⲁⲗⲱⲙ ⲇⲉ ⲛ̅ⲛⲉⲣⲱⲙⲉ ⲧⲏⲣⲟⲩ ⲙ̅ⲡⲓ̈ⲏ̅ⲗ̅. ϫⲉ ⲛⲁⲛⲟⲩ ⲡϣⲁϫⲉ ⲛ̅ⲭⲟⲩⲥⲉⲓ. ⲡϣⲏⲣⲉ ⲛ̅ⲁⲣⲁⲭⲉⲓ. ⲉϩⲟⲩⲉ ⲉⲡϣⲟϫⲛⲉ ⲛ̅ⲁⲭⲓⲇⲟⲫⲉⲗ. ⲁⲩⲱ ⲡϫⲟⲉⲓⲥ ⲁϥⲟⲩⲉϩⲥⲁϩⲛⲉ. ⲉϫⲱⲱⲣⲉ ⲉⲃⲟⲗ ⲙ̅ⲡϣⲟϫⲛⲉ ⲉⲧⲛⲁⲛⲟⲩϥ ⲛ̅ⲁⲭⲓⲇⲟⲫⲉⲗ. ϫⲉⲕⲁⲥ ⲉⲣⲉ ⲡϫⲟⲉⲓⲥ ⲉⲓⲛⲉ ⲉϫⲛ̅ ⲁⲃⲏⲥⲁⲗⲱⲙ. ⲛ̅ⲛⲉⲡⲉⲑⲟⲟⲩ ⲧⲏⲣⲟⲩ.	And Abessalom, and all the men of Israel said, The counsel of Chusi the Arachite is better than the counsel of Achitophel. For the Lord ordained to disconcert the good counsel of Achitophel, that the Lord might bring all evil upon Abessalom.	καὶ εἶπεν Αβεσσαλωµ καὶ πᾶς ἀνὴρ Ισραηλ Ἀγαθὴ ἡ βουλὴ Χουσι τοῦ Αραχι ὑπὲρ τὴν βουλὴν Αχιτοφελ· καὶ κύριος ἐνετείλατο διασκεδάσαι τὴν βουλὴν Αχιτοφελ τὴν ἀγαθήν, ὅπως ἂν ἐπαγάγῃ κύριος ἐπὶ Αβεσσαλωµ τὰ κακὰ πάντα. —						
Second Samuel	17	17	15	OT	1. OT	Historical Books	2. Historical Books	02. Historical Books	05. Second Samuel		ⲭⲟⲩⲥⲉⲓ ⲇⲉ ⲡϣⲏⲣⲉ ⲛ̅ⲁⲣⲁⲭⲉⲓ. ⲡⲉϫⲁϥ ⲛ̅ⲥⲁⲇⲱⲕ ⲙⲛ̅ ⲁⲃⲓⲁⲑⲁⲣ ⲛⲉⲟⲩⲏⲏⲃ. ϫⲉ ⲉⲓⲥ ⲑⲏ. ⲙⲛ̅ ⲑⲏ. ⲛ̅ⲧⲁϥϯϣⲟϫⲛⲉ. ⲛ̅ϭⲓ ⲁⲭⲓⲇⲟⲫⲉⲗ ⲛ̅ⲁⲃⲏⲥⲁⲗⲱⲙ. ⲙⲛ̅ ⲛⲉⲡⲣⲉⲥⲃⲩⲧⲉⲣⲟⲥ ⲙ̅ⲡⲓ̈ⲏ̅ⲗ̅. ⲉⲓⲥ ⲧⲁϩⲉ ϩⲱ. ⲛⲧⲁⲓⲥⲩⲙⲃⲟⲩⲗⲉⲩⲉ.	And Chusi the Arachite said to Sadoc and Abiathar the priests, Thus and thus Achitophel counselled Abessalom and the elders of Israel; and thus and thus have I counselled.	καὶ εἶπεν Χουσι ὁ τοῦ Αραχι πρὸς Σαδωκ καὶ Αβιαθαρ τοὺς ἱερεῖς Οὕτως καὶ οὕτως συνεβούλευσεν Αχιτοφελ τῷ Αβεσσαλωµ καὶ τοῖς πρεσβυτέροις Ισραηλ, καὶ οὕτως καὶ οὕτως συνεβούλευσα ἐγώ·						
Second Samuel	17	17	16	OT	1. OT	Historical Books	2. Historical Books	02. Historical Books	05. Second Samuel		ⲧⲉⲛⲟⲩ ϭⲉ ϫⲟⲟⲩ ⲧⲁⲭⲏ. ⲛ̅ⲧⲉⲧⲛ̅ⲧⲁⲙⲉ ⲇ̅ⲁ̅ⲇ̅. ⲉⲧⲉⲧⲛ̅ϫⲱ ⲙ̅ⲙⲟⲥ ⲛⲁϥ ϫⲉ ⲙ̅ⲡⲉⲣϭⲱ ϩⲛ̅ ϯⲟⲩϣⲏ. ϩⲛ̅ ⲁⲣⲁⲃⲱⲑ. ⲛ̅ⲧⲉ ⲧⲉⲣⲏⲙⲟⲥ. ⲁⲗⲗⲁ ⲧⲱⲟⲩⲛ ⲛⲅ̅ⲡⲱⲱⲛⲉ ⲉⲃⲟⲗ ⲧⲁⲭⲏ. ⲙⲏⲡⲟⲧⲉ ⲛϥ̅ⲧⲱⲟⲩⲛ ⲉϫⲙ̅ ⲡⲣ̅ⲣⲟ. ⲁⲩⲱ ⲡⲕⲉⲗⲁⲟⲥ ⲉⲧⲛ̅ⲙ̅ⲙⲁϥ.	And now send quickly and report to David, saying, Lodge not this night in Araboth of the wilderness: even go and make haste, lest one swallow up the king, and all the people with him.	καὶ νῦν ἀποστείλατε ταχὺ καὶ ἀναγγείλατε τῷ Δαυιδ λέγοντες Μὴ αὐλισθῇς τὴν νύκτα ἐν Αραβωθ τῆς ἐρήµου καί γε διαβαίνων σπεῦσον, µήποτε καταπίῃ τὸν βασιλέα καὶ πάντα τὸν λαὸν τὸν µετ’ αὐτοῦ.						
Second Samuel	17	17	17	OT	1. OT	Historical Books	2. Historical Books	02. Historical Books	05. Second Samuel		ⲓ̈ⲱⲛⲁⲑⲁⲛ ⲇⲉ. ⲁⲩⲱ ⲁⲭⲓⲙⲁⲁⲥ ⲛⲉⲩⲁϩⲉⲣⲁⲧⲟⲩ ϩⲓϫⲛ̅ ⲧⲡⲩⲗⲏ ⲛ̅ϩⲣⲱⲅⲏⲗ. ⲑⲉⲙϩⲁⲗ ⲇⲉ ⲁⲥⲡⲱⲧ ⲁⲥⲧⲁⲙⲟⲟⲩ. ⲛ̅ⲧⲟⲟⲩ ϩⲱⲟⲩ ⲁⲩⲡⲱⲧ. ⲁⲩⲧⲁⲙⲉ ⲡⲣ̅ⲣⲟ ⲇ̅ⲁ̅ⲇ̅ ϫⲉ ⲙ̅ⲡⲟⲩⲉϣⲟⲩⲱⲛϩ ⲉⲃⲟⲗ. ⲉⲧⲣⲉⲩⲉⲣ ⲡϩⲟⲩⲛ ⲛ̅ⲧⲡⲩⲗⲏ.	And Jonathan and Achimaas stood by the well of Rogel, and a maid-servant went and reported to them, and they go and tell king David; for they might not be seen to enter into the city.	καὶ Ιωναθαν καὶ Αχιµαας εἱστήκεισαν ἐν τῇ πηγῇ Ρωγηλ, καὶ ἐπορεύθη ἡ παιδίσκη καὶ ἀνήγγειλεν αὐτοῖς, καὶ αὐτοὶ πορεύονται καὶ ἀναγγέλλουσιν τῷ βασιλεῖ Δαυιδ, ὅτι οὐκ ἐδύναντο ὀφθῆναι τοῦ εἰσελθεῖν εἰς τὴν πόλιν.						
Second Samuel	17	17	18	OT	1. OT	Historical Books	2. Historical Books	02. Historical Books	05. Second Samuel		ⲁϥⲛⲁⲩ ⲇⲉ ⲉⲣⲟⲟⲩ ⲛ̅ϭⲓ ⲟⲩϣⲏⲣⲉ ϣⲏⲙ. ⲁϥⲃⲱⲕ. ⲁϥⲧⲁⲙⲉ ⲁⲃⲏⲥⲁⲗⲱⲙ. ⲛ̅ⲧⲟⲟⲩ ⲇⲉ ⲙ̅ⲡⲉⲥⲛⲁⲩ. ⲁⲩⲡⲱⲧ ⲧⲁⲭⲏ. ⲁⲩⲃⲱⲕ ⲉϩⲟⲩⲛ ⲉⲡⲏⲓ̈ ⲛ̅ⲟⲩⲣⲱⲙⲉ. ϩⲛ̅ ⲃⲁⲟⲩⲣⲓⲙ. ⲛ̅ⲧⲟϥ ⲇⲉ ⲛⲉⲟⲩⲛ̅ⲧϥ̅ ⲟⲩϣⲏⲓ̈ ⲙ̅ⲙⲁⲩ ϩⲙ̅ ⲡⲉϥⲟϩⲉ. ⲁⲩⲃⲱⲕ ⲉⲡⲉⲥⲏⲧ ⲉⲣⲟϥ.	But a young man saw them and told Abessalom: and the two went quickly, and entered into the house of a man in Baurim; and he had a well in his court, and they went down into it.	καὶ εἶδεν αὐτοὺς παιδάριον καὶ ἀπήγγειλεν τῷ Αβεσσαλωµ, καὶ ἐπορεύθησαν οἱ δύο ταχέως καὶ εἰσῆλθαν εἰς οἰκίαν ἀνδρὸς ἐν Βαουριµ, καὶ αὐτῷ λάκκος ἐν τῇ αὐλῇ, καὶ κατέβησαν ἐκεῖ.						
Second Samuel	17	17	19	OT	1. OT	Historical Books	2. Historical Books	02. Historical Books	05. Second Samuel		ⲁⲩⲱ ⲑⲓ̈ⲙⲉ ⲙ̅ⲡⲣⲱⲙⲉ. ⲁⲥⲕⲱ ⲛ̅ⲟⲩϩⲟⲃⲥ̅ ⲉϫⲛ̅ ⲧⲧⲁⲡⲣⲟ ⲙ̅ⲡϣⲏⲓ̈. ⲁⲩⲱ ⲁⲥⲡⲱⲣϣ̅ ⲉⲃⲟⲗ. ⲉϫⲱϥ ⲛ̅ⲟⲩⲁⲣⲁⲫⲱⲑ. ⲉⲧⲉ ϩⲉⲛⲉⲛⲕⲁ ⲛ̅ⲟⲩⲱⲙ ⲛⲉ. ⲁⲩⲱ ⲙ̅ⲡⲉ ϩⲱⲃ ⲟⲩⲱⲛϩ̅ ⲉⲃⲟⲗ.	And a woman took a covering, and spread it over the mouth of the well, and spread out ground corn upon it to dry, and the thing was not known.	καὶ ἔλαβεν ἡ γυνὴ καὶ διεπέτασεν τὸ ἐπικάλυµµα ἐπὶ πρόσωπον τοῦ λάκκου καὶ ἔψυξεν ἐπ’ αὐτῷ αραφωθ, καὶ οὐκ ἐγνώσθη ῥῆµα.						
Second Samuel	17	17	20	OT	1. OT	Historical Books	2. Historical Books	02. Historical Books	05. Second Samuel		ⲛ̅ϩⲙ̅ϩⲁⲗ ⲇⲉ ⲛ̅ⲁⲃⲏⲥⲁⲗⲱⲙ ⲁⲩⲉⲓ ⲉⲣⲁⲧⲥ̅ ⲛ̅ⲧⲉⲥϩⲓⲙⲉ ⲉⲡⲉⲥⲏⲓ̈. ⲡⲉϫⲁⲩ ⲛⲁⲥ ϫⲉ ⲉϥⲧⲱⲛ ⲁⲭⲓⲙⲁⲁⲥ. ⲙⲛ̅ ⲓ̈ⲱⲛⲁⲑⲁⲛ. ⲧⲉⲥϩⲓⲙⲉ ⲇⲉ ⲡⲉϫⲁⲥ ⲛⲁⲩ. ϫⲉ ⲁⲩⲥⲓⲛⲉ ⲙ̅ⲡⲟⲟⲩ ϩⲁⲑⲏ ⲛ̅ⲟⲩⲕⲟⲩⲓ. ⲁⲩϯⲟⲩⲟⲓ ⲇⲉ ⲛ̅ⲥⲱⲟⲩ ⲙ̅ⲡⲟⲩϩⲉ ⲉⲣⲟⲟⲩ. ⲁⲩⲱ ⲁⲩⲕⲧⲟⲟⲩ ⲉϩⲣⲏⲓ ⲉⲑⲓⲗ̅ⲏ̅ⲙ̅.	And the servants of Abessalom came to the woman into the house, and said, Where are Achimaas and Jonathan? and the woman said to them, They are gone a little way beyond the water. And they sought and found them not, and returned to Jerusalem.	καὶ ἦλθαν οἱ παῖδες Αβεσσαλωµ πρὸς τὴν γυναῖκα εἰς τὴν οἰκίαν καὶ εἶπαν Ποῦ Αχιµαας καὶ Ιωναθαν; καὶ εἶπεν αὐτοῖς ἡ γυνή Παρῆλθαν µικρὸν τοῦ ὕδατος· καὶ ἐζήτησαν καὶ οὐχ εὗραν καὶ ἀνέστρεψαν εἰς Ιερουσαληµ.						
Second Samuel	17	17	21	OT	1. OT	Historical Books	2. Historical Books	02. Historical Books	05. Second Samuel		ⲁⲥϣⲱⲡⲉ ⲇⲉ ⲙⲛ̅ⲛ̅ⲥⲁ ⲉⲧⲣⲉ ⲛⲏ ⲃⲱⲕ. ⲛⲁⲓ ϩⲱⲟⲩ. ⲁⲩⲉⲓ ⲉϩⲣⲏⲓ ϩⲙ̅ ⲡϣⲏⲓ. ⲁⲩⲡⲱⲧ. ⲁⲩⲧⲁⲙⲉ ⲡⲣ̅ⲣⲟ ⲇ̅ⲁ̅ⲇ̅. ⲁⲩⲱ ⲡⲉϫⲁⲩ ⲉϩⲟⲩⲛ ϩⲛ̅ ⲇ̅ⲁ̅ⲇ̅. ϫⲉ ⲧⲟⲩⲛⲧⲏⲩⲧⲛ̅ ⲧⲉⲛⲟⲩ ⲛ̅ⲧⲉⲧⲛ̅ϫⲓⲟⲟⲣ ⲙ̅ⲡⲙⲟⲟⲩ. ϫⲉ ⲉⲓⲥ ⲑⲏ ⲧⲉ ⲧⲁⲓ. ⲛ̅ⲧⲁϥϯϣⲟϫⲛⲉ ⲉⲧⲃⲉⲧⲏⲩⲧⲛ̅ ⲛ̅ϭⲓ ⲁⲭⲓⲇⲟⲫⲉⲗ.	And it came to pass after they were gone, that they came up out of the pit, and went on their way; and reported to king David, and said to David, Arise ye and go quickly over the water, for thus has Achitophel counselled concerning you.	ἐγένετο δὲ µετὰ τὸ ἀπελθεῖν αὐτοὺς καὶ ἀνέβησαν ἐκ τοῦ λάκκου καὶ ἐπορεύθησαν καὶ ἀνήγγειλαν τῷ βασιλεῖ Δαυιδ καὶ εἶπαν πρὸς Δαυιδ Ἀνάστητε καὶ διάβητε ταχέως τὸ ὕδωρ, ὅτι οὕτως ἐβουλεύσατο περὶ ὑµῶν Αχιτοφελ.						
Second Samuel	17	17	22	OT	1. OT	Historical Books	2. Historical Books	02. Historical Books	05. Second Samuel		ⲁⲩⲱ ⲇⲁⲩⲉⲓⲇ ⲁϥⲧⲱⲟⲩⲛ ⲙⲛ̅ ⲡⲗⲁⲟⲥ ⲧⲏⲣϥ̅ ⲉⲧⲛ̅ⲙ̅ⲙⲁϥ. ⲁⲩϫⲓⲟⲟⲣ ⲙ̅ⲡⲓⲟⲣⲇⲁⲛⲏⲥ. ϣⲁ ⲡⲛⲁⲩ ⲛ̅ⲧⲉ ⲡⲟⲩⲟⲉⲓⲛ ⲉⲓ ⲉϩⲣⲏⲓ. ⲉⲙⲡⲉ ⲟⲩⲁ ⲛ̅ⲟⲩⲱⲧ ϭⲱ ⲉⲡⲁϩⲟⲩ ⲛ̅ϩⲏⲧⲟⲩ. ⲉⲙⲡⲉϥϫⲓⲟⲟⲣ ⲙ̅ⲡⲓⲟⲣⲇⲁⲛⲏⲥ.	And David rose up and all the people with him, and they passed over Jordan till the morning light; there was not one missing who did not pass over Jordan.	καὶ ἀνέστη Δαυιδ καὶ πᾶς ὁ λαὸς ὁ µετ’ αὐτοῦ καὶ διέβησαν τὸν Ιορδάνην ἕως τοῦ φωτὸς τοῦ πρωί, ἕως ἑνὸς οὐκ ἔλαθεν ὃς οὐ διῆλθεν τὸν Ιορδάνην.						
Second Samuel	17	17	23	OT	1. OT	Historical Books	2. Historical Books	02. Historical Books	05. Second Samuel		ⲁⲩⲱ ⲁⲭⲓⲧⲟⲫⲉⲗ ⲛ̅ⲧⲉⲣⲉϥⲛⲁⲩ. ϫⲉ ⲙ̅ⲡⲉ ⲡϣⲟϫⲛⲉ ⲛ̅ⲧⲁϥⲁⲁϥ ϣⲱⲡⲉ. ⲁϥϩⲉⲕ ⲧⲉϥⲉⲱ. ⲁϥⲧⲱⲟⲩⲛ. ⲁϥⲡⲱⲧ ⲉϩⲣⲏⲓ ⲉⲡⲉϥⲏⲓ̈ ⲉⲧⲉϥⲡⲟⲗⲓⲥ. ⲁⲩⲱ ⲛ̅ⲧⲉⲣⲉϥϩⲱⲛ ⲉⲧⲟⲟⲧⲟⲩ ⲛ̅ⲛⲁⲡⲉϥⲏⲓ̈ ϩⲛ̅ ⲛⲉⲛⲧⲁϥϫⲟⲟⲩ. ⲁϥⲟϫⲧϥ̅ ⲁϥⲙⲟⲩ. ⲁⲩⲱ ⲁⲩⲧⲟⲙⲥϥ̅ ϩⲙ̅ ⲡⲧⲁⲫⲟⲥ ⲙ̅ⲡⲉϥⲉⲓⲱⲧ.	And Achitophel saw that his counsel was not followed, and he saddled his ass, and rose and departed to his house into his city; and he gave orders to his household, and hanged himself, and died, and was buried in the sepulchre of his father.	καὶ Αχιτοφελ εἶδεν ὅτι οὐκ ἐγενήθη ἡ βουλὴ αὐτοῦ, καὶ ἐπέσαξεν τὴν ὄνον αὐτοῦ καὶ ἀνέστη καὶ ἀπῆλθεν εἰς τὸν οἶκον αὐτοῦ εἰς τὴν πόλιν αὐτοῦ· καὶ ἐνετείλατο τῷ οἴκῳ αὐτοῦ καὶ ἀπήγξατο καὶ ἀπέθανεν καὶ ἐτάφη ἐν τῷ τάφῳ τοῦ πατρὸς αὐτοῦ.						
Second Samuel	17	17	24	OT	1. OT	Historical Books	2. Historical Books	02. Historical Books	05. Second Samuel		ⲁⲩⲱ ⲇ̅ⲁ̅ⲇ̅ ⲁϥⲓ̈ ⲉϩⲣⲏⲓ ⲉⲙⲁⲛⲁⲉⲓⲛ. ⲁⲩⲱ ⲁⲃⲏⲥⲁⲗⲱⲙ ⲁϥϫⲓⲟⲟⲣ ⲙ̅ⲡⲓⲟⲣⲇⲁⲛⲏⲥ. ⲛ̅ⲧⲁϥ. ⲁⲩⲱ ⲡⲗⲁⲟⲥ ⲧⲏⲣϥ ⲁϥⲓ̈ ⲉϩⲣⲏⲓ ⲛⲙ̅ⲙⲁϥ.	And David passed over to Manaim: and Abessalom crossed over Jordan, he and all the men of Israel with him.	Καὶ Δαυιδ διῆλθεν εἰς Μαναϊµ, καὶ Αβεσσαλωµ διέβη τὸν Ιορδάνην αὐτὸς καὶ πᾶς ἀνὴρ Ισραηλ µετ’ αὐτοῦ.						
Second Samuel	17	17	25	OT	1. OT	Historical Books	2. Historical Books	02. Historical Books	05. Second Samuel		ⲁⲙⲉⲥⲥⲉⲉⲓ ⲇⲉ ⲁϥⲕⲁⲑⲓⲥⲧⲁ ⲙ̅ⲙⲟϥ. ⲛ̅ϭⲓ ⲁⲃⲉⲥⲁⲗⲱⲙ ⲉⲡⲙⲁ ⲛ̅ⲓ̈ⲱⲁⲃ. ⲉⲧⲣⲉϥϭⲱ ⲉϫⲙ̅ ⲡⲉϥⲙⲏⲏϣⲉ. ⲁⲙⲉⲥⲥⲉⲉⲓ ⲇⲉ. ⲡϣⲏⲣⲉ ⲡⲉ ⲛ̅ⲟⲩⲣⲱⲙⲉ. ⲉⲡⲉϥⲣⲁⲛ ⲡⲉ ⲓ̈ⲱⲑⲱⲣ ⲡⲓⲥⲙⲁⲏⲗⲓⲧⲏⲥ. ⲡⲁⲓ̈ ⲁϥⲃⲱⲕ ⲉϩⲟⲩⲛ ϣⲁ ⲁⲃⲓⲕⲓⲁ. ⲧϣⲉⲉⲣⲉ ⲛ̅ⲛⲁⲁⲥ. ⲡⲥⲟⲛ ⲛ̅ⲥⲁⲣⲟⲩⲉⲓⲁⲥ. ⲧⲙⲁⲁⲩ ⲛ̅ⲓ̈ⲱⲁⲃ.	And Abessalom appointed Amessai in the room of Joab over the host. And Amessai was the son of a man whose name was Jether of Jezrael: he went in to Abigaia the daughter of Naas, the sister of Saruia the mother of Joab.	καὶ τὸν Αµεσσαϊ κατέστησεν Αβεσσαλωµ ἀντὶ Ιωαβ ἐπὶ τῆς δυνάµεως· καὶ Αµεσσαϊ υἱὸς ἀνδρὸς καὶ ὄνοµα αὐτῷ Ιοθορ ὁ Ισραηλίτης, οὗτος εἰσῆλθεν πρὸς Αβιγαιαν θυγατέρα Ναας ἀδελφὴν Σαρουιας µητρὸς Ιωαβ.						
Second Samuel	17	17	26	OT	1. OT	Historical Books	2. Historical Books	02. Historical Books	05. Second Samuel		ⲁⲩⲱ ⲡⲓ̈ⲏ̅ⲗ̅ ⲧⲏⲣϥ. ⲙⲛ̅ ⲁⲃⲏⲥⲁⲗⲱⲙ ⲁⲩⲧⲁⲁⲩ ⲉϩⲣⲏⲓ ⲉⲡⲕⲁϩ ⲛ̅ⲅⲁⲗⲁⲁⲇ.	And all Israel and Abessalom encamped in the land of Galaad.	καὶ παρενέβαλεν πᾶς Ισραηλ καὶ Αβεσσαλωµ εἰς τὴν γῆν Γαλααδ.						
Second Samuel	17	17	27	OT	1. OT	Historical Books	2. Historical Books	02. Historical Books	05. Second Samuel		ⲁⲥϣⲱⲡⲉ ⲇⲉ ⲛ̅ⲧⲉⲣⲉ ⲇ̅ⲁ̅ⲇ̅ ⲉⲓ ⲉϩⲣⲏⲓ ⲉⲙⲁⲛⲁⲉⲓⲙ. ⲉⲡⲙⲁ ⲉⲧⲉⲣⲉ ⲉⲥⲃⲓⲛ. ⲛ̅ϩⲏⲧϥ̅. ⲡϣⲏⲣⲉ ⲙ̅ⲙⲁⲁⲥ. ⲉⲃⲟⲗ ϩⲛ̅ ϩⲣⲁⲃⲃⲁⲑ. ⲡⲕⲁϩ ⲛ̅ⲛⲉϣⲏⲣⲉ ⲛ̅ⲁⲙⲙⲱⲛ. ⲙⲁⲭⲓⲣ ⲡϣⲏⲣⲉ ⲛ̅ⲁⲙⲓⲏⲗ. ⲡⲉ ⲉⲃⲟⲗ ϩⲛ̅ ⲗⲁⲇⲁⲃⲁⲣ. ⲁⲩⲱ ⲃⲉⲣⲇⲉⲗⲗⲓ. ⲡⲅⲁⲗⲁⲧⲓⲧⲏⲥ. ⲡⲉ ⲉⲃⲟⲗ ϩⲛ̅ ϩⲣⲱⲅⲉⲗⲗⲓⲙ.	And it came to pass when David came to Manaim, that Uesbi the son of Naas of Rabbath of the sons of Ammon, and Machir son of Amiel of Lodabar, and Berzelli the Galaadite of Rogellim,	καὶ ἐγένετο ἡνίκα ἦλθεν Δαυιδ εἰς Μαναϊµ, Ουεσβι υἱὸς Ναας ἐκ Ραββαθ υἱῶν Αµµων καὶ Μαχιρ υἱὸς Αµιηλ ἐκ Λωδαβαρ καὶ Βερζελλι ὁ Γαλααδίτης ἐκ Ρωγελλιµ						
Second Samuel	17	17	28	OT	1. OT	Historical Books	2. Historical Books	02. Historical Books	05. Second Samuel		ⲁⲩⲉⲓⲛⲉ ⲙ̅ⲙⲏⲧⲉ ⲛ̅ⲕⲓⲧⲉ. ⲙⲛ̅ ϩⲛ̅ⲁⲙⲫⲓⲧⲁⲡⲟⲥ. ⲁⲩⲱ ⲙⲏⲧ ⲛ̅ⲭⲁⲗⲕⲓⲟⲛ. ⲙⲛ̅ ϩⲉⲛⲥⲕⲉⲩⲏ. ⲛ̅ϣⲁϣⲟⲩ ⲛ̅ⲏⲣⲡ̅. ⲁⲩⲱ ϩⲛ̅ⲥⲟⲩⲟ. ⲙⲛ̅ ⲟⲩⲉⲓⲱⲧ ⲙⲛ̅ ⲟⲩⲛⲟⲉⲓⲧ. ⲙⲛ̅ ⲟⲩϩⲛⲁⲁⲩ ⲛ̅ⲉⲗⲉⲗϣⲱⲟⲩⲉ. ⲙⲛ̅ ϩⲉⲛⲕⲉⲁⲙⲟⲥ ⲁⲩⲱ ⲟⲩⲁⲣϣⲓⲛ.	brought ten embroidered beds, (with double coverings,) and ten caldrons, and earthenware, and wheat, and barley, and flour, and meal, and beans, and pulse,	ἤνεγκαν δέκα κοίτας καὶ ἀµφιτάπους καὶ λέβητας δέκα καὶ σκεύη κεράµου καὶ πυροὺς καὶ κριθὰς καὶ ἄλευρον καὶ ἄλφιτον καὶ κύαµον καὶ φακὸν						
Second Samuel	17	17	29	OT	1. OT	Historical Books	2. Historical Books	02. Historical Books	05. Second Samuel		ⲙⲛ̅ ⲟⲩⲉⲃⲓⲱ. ⲁⲩⲱ ⲟⲩⲥⲟⲉⲓⲣⲉ. ⲙⲛ̅ ϩⲉⲛⲉⲥⲟⲟⲩ. ⲁⲩⲱ ⲥⲁⲡⲫⲟⲧ ⲛ̅ⲛⲉϩ(sic). ⲉⲧⲉ ϩⲉⲛⲙⲁⲥⲉ ⲛⲉ. ⲁⲩϫⲓⲧⲟⲩ ⲉϩⲟⲩⲛ ⲛ̅ⲇⲁⲩⲉⲓⲇ. ⲁⲩⲱ ⲙ̅ⲡⲗⲁⲟⲥ ⲉⲧⲛ̅ⲙ̅ⲙⲁⲩ ⲉⲧⲣⲉⲩⲟⲩⲱⲙ. ⲉⲃⲟⲗ ϫⲉ ⲁⲩϫⲟⲟⲥ ϫⲉ ⲉⲓⲥ ⲡⲗⲁⲟⲥ ϩⲕⲁⲉⲓⲧ ⲁⲩⲱ ϥⲟⲃⲉ. ⲉϥϣⲟⲥⲙ̅ ϩⲛ̅ ⲧⲉⲣⲏⲙⲟⲥ.	and honey, and butter, and sheep, and cheeses of kine: and they brought them to David and to his people with him to eat; for one said, The people is faint and hungry and thirsty in the wilderness.	καὶ µέλι καὶ βούτυρον καὶ πρόβατα καὶ σαφφωθ βοῶν καὶ προσήνεγκαν τῷ Δαυιδ καὶ τῷ λαῷ τῷ µετ’ αὐτοῦ φαγεῖν, ὅτι εἶπαν Ὁ λαὸς πεινῶν καὶ ἐκλελυµένος καὶ διψῶν ἐν τῇ ἐρήµῳ.						
Second Samuel	18	18	1	OT	1. OT	Historical Books	2. Historical Books	02. Historical Books	05. Second Samuel		ⲇ̅ⲁ̅ⲇ̅ ⲇⲉ ⲁϥⲉⲣⲁⲛⲛⲱⲙⲉⲓ ⲏ ⲁϥϭⲉⲙ ⲡϣⲓ̈ⲛⲉ ⲙ̅ⲡⲗⲁⲟⲥ ⲉⲧⲛ̅ⲙⲙⲁϥ. ⲁⲩⲱ ⲁϥⲕⲱ ⲉϩⲣⲏⲓ ⲉϫⲱⲟⲩ. ⲛ̅ϩⲛ̅ⲭⲓⲗⲓⲁⲣⲭⲟⲥ. ⲙⲛ̅ ϩⲉⲛϩⲩⲕⲁⲧⲟⲛⲧⲁⲣⲭⲟⲥ.	And David numbered the people with him, and set over them captains of thousands and captains of hundreds.	Καὶ ἐπεσκέψατο Δαυιδ τὸν λαὸν τὸν µετ’ αὐτοῦ καὶ κατέστησεν ἐπ’ αὐτῶν χιλιάρχους καὶ ἑκατοντάρχους,						
Second Samuel	18	18	2	OT	1. OT	Historical Books	2. Historical Books	02. Historical Books	05. Second Samuel		ⲁⲩⲱ ⲇ̅ⲁ̅ⲇ̅ ⲁϥⲥⲉⲣ ⲡⲗⲁⲟⲥ ⲉⲃⲟⲗ ϩⲓⲛⲁⲓ. ⲡⲟⲩⲉⲛ ⲉϣⲟⲙⲛ̅ⲧ ⲙⲉⲛ ⲛ̅ⲧⲟⲟⲧϥ̅ ⲛ̅ⲓ̈ⲱⲁⲃ. ⲁⲩⲱ ⲡⲟⲩⲉⲛ ⲉϣⲟⲙⲧ̅ ⲛ̅ⲧⲟⲟⲧϥ̅ ⲛ̅ⲁⲃⲓⲥⲁ ⲡϣⲏⲣⲉ ⲛ̅ⲥⲁⲣⲟⲩⲉⲓⲁⲥ ⲡⲥⲟⲛ ⲛ̅ⲓ̈ⲱⲁⲃ. ⲁⲩⲱ ⲡⲕⲉⲟⲩⲉⲛ ⲉϣⲟⲙⲧ̅ ⲛ̅ⲧⲟⲟⲧϥ̅ ⲛ̅ⲉⲑⲑⲓ ⲡⲕⲉⲑⲉⲟⲥ. ⲁⲩⲱ ⲡⲉϫⲉ ⲇ̅ⲁ̅ⲇ̅ ⲛⲁⲩ ϫⲉ ϩⲛ̅ ⲟⲩⲉⲓ. ⲁⲛⲟⲕ ϯⲛⲁⲉⲓ ⲉⲃⲟⲗ ⲛⲙ̅ⲙⲏⲧⲛ̅.	And David sent away the people, the third part under the hand of Joab, and the third part under the hand of Abessa the son of Saruia, the brother of Joab, and the third part under the hand of Ethi the Gittite. And David said to the people, I also will surely go out with you.	καὶ ἀπέστειλεν Δαυιδ τὸν λαόν, τὸ τρίτον ἐν χειρὶ Ιωαβ καὶ τὸ τρίτον ἐν χειρὶ Αβεσσα υἱοῦ Σαρουιας ἀδελφοῦ Ιωαβ καὶ τὸ τρίτον ἐν χειρὶ Εθθι τοῦ Γεθθαίου. καὶ εἶπεν Δαυιδ πρὸς τὸν λαόν Ἐξελθὼν ἐξελεύσοµαι καί γε ἐγὼ µεθ’ ὑµῶν.						
Second Samuel	18	18	3	OT	1. OT	Historical Books	2. Historical Books	02. Historical Books	05. Second Samuel		ⲡⲉϫⲁⲩ ⲛⲁϥ ϫⲉ ⲛⲧⲉⲛⲛⲁⲕⲁⲁⲕ ⲁⲛ ⲉⲉⲓ ⲉⲃⲟⲗ ⲛⲙ̅ⲙⲁⲛ. ϫⲉ ⲉⲛϣⲁⲛϭⲱⲧⲡ̅. ⲁⲛⲟⲛ ⲛ̅ⲧⲛ̅ⲡⲱⲧ ⲛ̅ⲥⲉⲛⲁϯϩⲧⲏⲩ ⲉⲣⲟⲛ ⲁⲛ. ⲁⲩⲱ ⲉⲣϣⲁⲛ ⲧⲉⲛⲡⲁϣⲉ ⲟⲛ ⲙⲟⲩ. ϩⲙ̅ ⲡⲉⲓⲕⲉ ⲟⲛ. ⲛ̅ⲥⲉⲛⲁϯϩⲧⲏⲩ ⲉⲣⲟⲛ ⲁⲛ ϫⲉ ⲁⲛⲟⲛ ⲛⲁ ⲡⲗⲁⲟⲥ. ⲉⲕⲛⲁⲉⲣ ⲑⲉ ⲛ̅ⲧⲟⲕ ⲛ̅ⲟⲩⲧⲃⲁ ⲛ̅ⲣⲱⲙⲉ ⲛ̅ϩⲏⲧⲛ̅. ⲧⲉⲛⲟⲩ ϭⲉ ⲟⲩⲁⲅⲁⲑⲟⲛ ⲛⲁⲛ ⲡⲉ. ⲉⲧⲣⲉⲕϭⲱ ⲉⲡⲁϩⲟⲩ ϩⲛ̅ ⲧⲡⲟⲗⲓⲥ. ϫⲉ ⲛ̅ⲧⲟⲕ ⲕⲛⲁϣⲱⲡⲉ ⲛⲁⲛ ⲛ̅ⲛⲁϣⲧⲉ. ⲉⲃⲟⲏⲑⲉⲓ ⲉⲣⲟⲛ.	And they said, Thou shalt not go out: for if we should indeed flee, they will not care for us; and if half of us should die, they will not mind us; for thou art as ten thousand of us: and now it is well that thou shalt be to us an aid to help us in the city.	καὶ εἶπαν Οὐκ ἐξελεύσῃ, ὅτι ἐὰν φυγῇ φύγωµεν, οὐ θήσουσιν ἐφ’ ἡµᾶς καρδίαν, καὶ ἐὰν ἀποθάνωµεν τὸ ἥµισυ ἡµῶν, οὐ θήσουσιν ἐφ’ ἡµᾶς καρδίαν, ὅτι σὺ ὡς ἡµεῖς δέκα χιλιάδες· καὶ νῦν ἀγαθὸν ὅτι ἔσῃ ἡµῖν ἐν τῇ πόλει βοήθεια τοῦ βοηθεῖν.						
Second Samuel	18	18	4	OT	1. OT	Historical Books	2. Historical Books	02. Historical Books	05. Second Samuel		ⲡⲉϫⲉ ⲡⲣ̅ⲣⲟ ⲇ̅ⲁ̅ⲇ̅ ⲛⲁⲩ. ϫⲉ ⲡϩⲱⲃ ⲉⲧⲉⲣⲁⲛⲏⲧⲛ̅. ϯⲛⲁⲁⲁϥ. ⲡⲣ̅ⲣⲟ ⲇⲉ ⲁϥϭⲱ ϩⲓϫⲛ̅ ⲧⲡⲩⲗⲏ. ⲁⲩⲱ ⲡⲗⲁⲟⲥ ⲧⲏⲣϥ̅ ⲁϥⲙⲟⲟϣⲉ ⲉⲃⲟⲗ. ⲉⲩⲛⲁⲉⲣϣⲉ. ϣⲉ. ⲁⲩⲱ ⲉⲩⲛⲁⲉⲣϣⲟ. ϣⲟ.	And the king said to them, Whatsoever shall seem good in your eyes I will do. And the king stood by the side of the gate, and all the people went out by hundreds and by thousands.	καὶ εἶπεν πρὸς αὐτοὺς ὁ βασιλεύς Ὃ ἐὰν ἀρέσῃ ἐν ὀφθαλµοῖς ὑµῶν, ποιήσω. καὶ ἔστη ὁ βασιλεὺς ἀνὰ χεῖρα τῆς πύλης, καὶ πᾶς ὁ λαὸς ἐξεπορεύετο εἰς ἑκατοντάδας καὶ εἰς χιλιάδας.						
Second Samuel	18	18	5	OT	1. OT	Historical Books	2. Historical Books	02. Historical Books	05. Second Samuel		ⲡⲣ̅ⲣⲟ ⲇⲉ ⲁϥϩⲱⲛ ⲉⲧⲟⲟⲧϥ̅ ⲛ̅ⲓ̈ⲱⲁⲃ. ⲙⲛ̅ ⲁⲃⲓⲥⲁ. ⲙⲛ̅ ⲉⲑⲑⲓ. ⲉϥϫⲱ ⲙ̅ⲙⲟⲥ ⲛⲁⲩ. ϫⲉ ϩⲁⲣⲉϩ ⲉⲡⲁϣⲏⲣⲉ ⲁⲃⲏⲥⲁⲗⲱⲙ. ⲁⲩⲱ ⲡⲗⲁⲟⲥ ⲧⲏⲣϥ̅. ⲁϥⲥⲱⲧⲙ̅ ⲉⲡⲣ̅ⲣⲟ ⲉϥϩⲱⲛ ⲉⲧⲟⲟⲧⲟⲩ ⲛ̅ⲛ̅ⲁⲣⲭⲱⲛ ⲧⲏⲣⲟⲩ ⲉⲧⲃⲉ ⲁⲃⲏⲥⲁⲗⲱⲙ.	And the king commanded Joab and Abessa and Ethi, saying, Spare for my sake the young man Abessalom. And all the people heard the king charging all the commanders concerning Abessalom.	καὶ ἐνετείλατο ὁ βασιλεὺς τῷ Ιωαβ καὶ τῷ Αβεσσα καὶ τῷ Εθθι λέγων Φείσασθέ µοι τοῦ παιδαρίου τοῦ Αβεσσαλωµ· καὶ πᾶς ὁ λαὸς ἤκουσεν ἐντελλοµένου τοῦ βασιλέως πᾶσιν τοῖς ἄρχουσιν ὑπὲρ Αβεσσαλωµ.						
Second Samuel	18	18	6	OT	1. OT	Historical Books	2. Historical Books	02. Historical Books	05. Second Samuel		ⲁⲩⲱ ⲡⲗⲁⲟⲥ ⲧⲏⲣϥ̅. ⲁϥⲓ ⲉⲃⲟⲗ ⲉⲡⲙⲁ ⲛ̅ϣⲏⲛ. ⲟⲩⲃⲉ ⲡⲓ̈ⲏ̅ⲗ̅. ⲡⲡⲟⲗⲩⲙⲟⲥ ⲁϥϣⲱⲡⲉ ϩⲙ̅ ⲡⲙⲁ ⲛ̅ϣⲏⲛ ϩⲙ̅ ⲡⲕⲁϩ ⲛ̅ⲉⲫⲣⲉⲙ	And all the people went out into the wood against Israel; and the battle was in the wood of Ephraim.	καὶ ἐξῆλθεν πᾶς ὁ λαὸς εἰς τὸν δρυµὸν ἐξ ἐναντίας Ισραηλ, καὶ ἐγένετο ὁ πόλεµος ἐν τῷ δρυµῷ Εφραιµ.						
Second Samuel	18	18	7	OT	1. OT	Historical Books	2. Historical Books	02. Historical Books	05. Second Samuel		ⲁⲩⲱ ⲡⲗⲁⲟⲥ ⲙ̅ⲡⲓ̈ⲏ̅ⲗ̅. ⲁϥϭⲱⲧⲡ̅ ⲙ̅ⲡⲙⲁ ⲉⲧⲙ̅ⲙⲁⲩ ϩⲁⲑⲏ ⲛ̅ⲛⲉϩⲙ̅ϩⲁⲗ ⲛ̅ⲇⲁⲩⲉⲓⲇ. ⲁⲩⲱ ⲧϭⲟⲡⲧⲥ̅. ⲁⲥϣⲱⲡⲉ ⲉⲩⲛⲟϭ ⲧⲉ ϩⲙ̅ ⲡⲉϩⲟⲟⲩ ⲉⲧⲙ̅ⲙⲁⲩ. ⲁⲩϭⲱⲧⲡ̅ ⲁⲩϩⲉ ⲛ̅ϭⲓ ⲧⲃⲁ ⲥⲛⲁⲩ ⲛ̅ⲣⲱⲙⲉ.	And the people of Israel fell down there before the servants of David, and there was a great slaughter in that day, even twenty thousand men.	καὶ ἔπταισεν ἐκεῖ ὁ λαὸς Ισραηλ ἐνώπιον τῶν παίδων Δαυιδ, καὶ ἐγένετο ἡ θραῦσις µεγάλη ἐν τῇ ἡµέρᾳ ἐκείνῃ, εἴκοσι χιλιάδες ἀνδρῶν.						
