book	chapter	chapter-zfilled	verse	testament	testament-indexed	section	section-indexed	section-indexed-no-testament	book-indexed	Bohairic	Sahidic	English	Greek	Fayyumic	Akhmimic	OldBohairic	Mesokemic	DialectP	Lycopolitan
Second Samuel	22	22	8	OT	1. OT	Historical Books	2. Historical Books	02. Historical Books	05. Second Samuel		ⲁϥϭⲱϣⲧ̅ ⲉϫⲙ̅ ⲡⲕⲁϩ. ⲁⲩⲱ ⲁϥⲛⲟⲉⲓⲛ. ⲁⲩⲱ ⲛ̅ⲥⲛ̅ⲧⲉ ⲛ̅ⲧⲡⲉ ⲁⲩϣⲧⲟⲣⲧⲣ̅. ⲁⲩϣⲧⲟⲣⲧⲣ̅ ϫⲉ ⲁ ⲡϫⲟⲉⲓⲥ ϭⲱⲛⲧ̅ ⲉⲣⲟⲟⲩ	And the earth was troubled and quaked, and the foundations of heaven were confounded and torn asunder, because the Lord was wroth with them.	καὶ ἐταράχθη καὶ ἐσείσθη ἡ γῆ, καὶ τὰ θεµέλια τοῦ οὐρανοῦ συνεταράχθησαν καὶ ἐσπαράχθησαν, ὅτι ἐθυµώθη κύριος αὐτοῖς.						
Second Samuel	22	22	9	OT	1. OT	Historical Books	2. Historical Books	02. Historical Books	05. Second Samuel		ⲟⲩⲕⲁⲡⲛⲟⲥ ⲁϥⲓ̈ ⲉϩⲣⲏⲓ ϩⲛ̅ ⲧⲉϥⲟⲣⲅⲏ. ⲁⲩⲱ ⲟⲩⲥⲁⲧⲉ ⲉⲃⲟⲗ ϩⲛ̅ ⲧⲉϥⲧⲁⲡⲣⲟ. ⲥⲛⲁⲟⲩⲱⲙ. ϩⲉⲛϫⲃ̅ⲃⲉⲥ ⲁⲩⲙⲟⲩϩ ⲉⲃⲟⲗ ϩⲓⲧⲟⲟⲧϥ̅.	There went up a smoke in his wrath, and fire out of his mouth devours: coals were kindled at it.	ἀνέβη καπνὸς ἐν τῇ ὀργῇ αὐτοῦ, καὶ πῦρ ἐκ στόµατος αὐτοῦ κατέδεται, ἄνθρακες ἐξεκαύθησαν ἀπ’ αὐτοῦ.						
Second Samuel	22	22	10	OT	1. OT	Historical Books	2. Historical Books	02. Historical Books	05. Second Samuel		ⲙ̅ⲡⲏⲩⲉ ⲁϥⲣⲁⲕⲧⲟⲩ ⲁϥⲓ̈ ⲉⲡⲉⲥⲏⲧ. ⲟⲩϭⲟⲥⲙ̅ ⲉϥϣⲟⲟⲡ ϩⲁ ⲛⲉϥⲟⲩⲉⲣⲏⲧⲉ.	And he bowed the heavens, and came down, and there was darkness under his feet.	καὶ ἔκλινεν οὐρανοὺς καὶ κατέβη, καὶ γνόφος ὑποκάτω τῶν ποδῶν αὐτοῦ.						
Second Samuel	22	22	11	OT	1. OT	Historical Books	2. Historical Books	02. Historical Books	05. Second Samuel		ⲁϥϩⲙⲟⲟⲥ ϩⲓϫⲛ̅ ⲛⲉⲭⲁⲓⲣⲟⲩⲃⲓⲛ. ⲁϥϩⲱⲗ ⲉⲃⲟⲗ. ⲁⲩⲱ ⲁϥⲟⲩⲱⲛϩ ⲉⲃⲟⲗ ϩⲓϫⲛ̅ ⲛⲉⲧⲛϩ̅ ⲙ̅ⲡⲧⲏⲩ	And he rode upon the cherubs and did fly, and was seen upon the wings of the wind.	καὶ ἐπεκάθισεν ἐπὶ Χερουβιν καὶ ἐπετάσθη καὶ ὤφθη ἐπὶ πτερύγων ἀνέµου.						
Second Samuel	22	22	12	OT	1. OT	Historical Books	2. Historical Books	02. Historical Books	05. Second Samuel		ⲁϥⲕⲱ ⲛ̅ⲟⲩⲕⲁⲕⲉ ϩⲓϩⲏ ⲙ̅ⲙⲟϥ. ⲧⲉϥⲥⲕⲩⲛⲏ ⲉⲥϣⲟⲟⲡ ϩⲙ̅ ⲡⲉϥⲕⲱⲧⲉ. ϩⲛ̅ⲙⲟⲟⲩ ⲛ̅ⲕⲁⲕⲉ ⲁⲩⲟⲩⲙⲟⲧ. ⲏ ⲁⲩⲁϣⲁⲓ ϩⲛ̅ ⲛⲉⲕⲗⲟⲟⲗⲉ ⲛ̅ⲁⲏⲣ.	And he made darkness his hiding-place; his tabernacle round about him was the darkness of waters, he condensed it with the clouds of the air.	καὶ ἔθετο σκότος ἀποκρυφὴν αὐτοῦ κύκλῳ αὐτοῦ, ἡ σκηνὴ αὐτοῦ σκότος ὑδάτων· ἐπάχυνεν ἐν νεφέλαις ἀέρος.						
Second Samuel	22	22	13	OT	1. OT	Historical Books	2. Historical Books	02. Historical Books	05. Second Samuel		ⲉⲃⲟⲗ ϩⲙ ⲡⲉϥⲟⲩⲟⲉⲓⲛ ⲛⲉⲕⲗⲟⲟⲗⲉ ⲁⲩⲙⲟⲟϣⲉ ϩⲓϩⲏ ⲙ̅ⲙⲟϥ. ϩⲛ̅ϫⲃ̅ⲃⲉⲥ ⲛ̅ⲥⲁⲧⲉ ⲁⲩⲙⲟⲩϩ	At the brightness before him coals of fire were kindled.	ἀπὸ τοῦ φέγγους ἐναντίον αὐτοῦ ἐξεκαύθησαν ἄνθρακες πυρός.						
Second Samuel	22	22	14	OT	1. OT	Historical Books	2. Historical Books	02. Historical Books	05. Second Samuel		ⲡϫⲟⲉⲓⲥ ⲁϥϯϩⲣⲟⲩⲃⲁⲓ ⲉⲃⲟⲗ ϩⲛ̅ ⲧⲡⲉ. ⲁⲩⲱ ⲡⲡⲉⲧϫⲟⲥⲉ ⲁϥϯ ⲙ̅ⲡⲉϥϩⲣⲟⲟⲩ.	The Lord thundered out of heaven, and the Most High uttered his voice.	ἐβρόντησεν ἐξ οὐρανοῦ κύριος, καὶ ὁ ὕψιστος ἔδωκεν φωνὴν αὐτοῦ						
Second Samuel	22	22	15	OT	1. OT	Historical Books	2. Historical Books	02. Historical Books	05. Second Samuel		ⲁϥϫⲟⲟⲩ ⲉⲃⲟⲗ ⲛ̅ⲛⲉϥⲥⲟⲧⲉ. ⲁⲩⲱ ⲁϥϫⲟⲟⲣⲟⲩ ⲉⲃⲟⲗ. ϩⲛ̅ⲉⲃⲣⲏ ϭⲉ ⲁϥⲧⲁϣⲟⲟⲩ. ⲁⲩⲱ ⲁϥϣⲧⲣⲧⲱⲣⲟⲩ.	And he sent forth arrows, and scattered them, and he flashed lightning, and dismayed them.	καὶ ἀπέστειλεν βέλη καὶ ἐσκόρπισεν αὐτούς, ἀστραπὴν καὶ ἐξέστησεν αὐτούς.						
Second Samuel	22	22	16	OT	1. OT	Historical Books	2. Historical Books	02. Historical Books	05. Second Samuel		ⲁⲩⲟⲩⲱⲛϩ ⲉⲃⲟⲗ ⲛ̅ϭⲓ ϩⲉⲛⲡⲩⲅⲏ ⲙ̅ⲙⲟⲟⲩ. ⲁⲩⲱ ⲁⲩϭⲱⲗⲡ̅ ⲉⲃⲟⲗ ⲛ̅ϭⲓ ⲛ̅ⲥⲛ̅ⲧⲉ ⲛ̅ⲧⲟⲓⲕⲟⲩⲙⲉⲛⲏ. ϩⲛ̅ ⲑⲟⲧⲉ ⲙ̅ⲡϫⲟⲉⲓⲥ. ⲉⲃⲟⲗ ϩⲙ̅ ⲡⲛⲓⲃⲉ ⲙ̅ⲡⲉⲡⲛ̅ⲁ̅ ⲛ̅ⲧⲉϥⲟⲣⲅⲏ.	And the channels of the sea were seen, and the foundations of the world were discovered, at the rebuke of the Lord, at the blast of the breath of his anger.	καὶ ὤφθησαν ἀφέσεις θαλάσσης, καὶ ἀπεκαλύφθη θεµέλια τῆς οἰκουµένης ἐν τῇ ἐπιτιµήσει κυρίου, ἀπὸ πνοῆς πνεύµατος θυµοῦ αὐτοῦ.						
Second Samuel	22	22	17	OT	1. OT	Historical Books	2. Historical Books	02. Historical Books	05. Second Samuel		ⲁϥⲧⲛ̅ⲛⲟⲟⲩ ⲉⲃⲟⲗ ϩⲙ̅ ⲡϫⲓⲥⲉ. ⲁϥϫⲓⲧ ⲁϥϣⲟⲡⲧ̅ ⲉⲣⲟϥ ⲉⲃⲟⲗ ϩⲛ̅ ϩⲉⲛⲙⲟⲟⲩ ⲉⲛⲁϣⲱⲟⲩ.	He sent from above and took me; he drew me out of many waters.	ἀπέστειλεν ἐξ ὕψους καὶ ἔλαβέν µε, εἵλκυσέν µε ἐξ ὑδάτων πολλῶν·						
Second Samuel	22	22	18	OT	1. OT	Historical Books	2. Historical Books	02. Historical Books	05. Second Samuel		ⲁϥⲛⲁϩⲙⲉⲧ ⲛ̅ⲧⲟⲟⲧⲟⲩ ⲛ̅ⲛⲁϫⲁϫⲉ ⲉⲧϭⲙ̅ϭⲟⲙ . ⲁⲩⲱ ⲛ̅ⲧⲟⲟⲧⲟⲩ ⲛ̅ⲛⲉⲧⲙⲟⲥⲧⲉ ⲙ̅ⲙⲟⲓ̈. ϫⲉ ⲁⲩⲧⲁϫⲣⲟ ⲉϩⲟⲩⲉ ⲉⲣⲟⲓ.	He delivered me from my strong enemies, from them that hated me, for they were stronger than I.	ἐρρύσατό µε ἐξ ἐχθρῶν µου ἰσχύος, ἐκ τῶν µισούντων µε, ὅτι ἐκραταιώθησαν ὑπὲρ ἐµέ.						
Second Samuel	22	22	19	OT	1. OT	Historical Books	2. Historical Books	02. Historical Books	05. Second Samuel		ⲁⲩⲱ ⲁⲩⲁϩⲉⲣⲁⲧⲟⲩ ⲉⲣⲟⲓ ⲛ̅ϭⲓ ⲛⲉϩⲟⲟⲩ ⲛ̅ⲧⲁⲑⲗⲓⲯⲓⲥ. ⲁⲩⲱ ⲡϫⲟⲉⲓⲥ ⲁϥϣⲱⲡⲉ ⲛⲁⲓ. ⲛ̅ⲧⲁϫⲣⲟ.	The days of my affliction prevented me; but the Lord was my stay.	προέφθασάν µε ἐν ἡµέρᾳ θλίψεώς µου, καὶ ἐγένετο κύριος ἐπιστήριγµά µου						
Second Samuel	22	22	20	OT	1. OT	Historical Books	2. Historical Books	02. Historical Books	05. Second Samuel		ⲁⲩⲱ ⲁϥⲟⲩⲱϣⲥ̅ ⲛⲁⲓ ⲉⲃⲟⲗ ⲁϥⲛⲁϩⲙⲉⲧ. ϫⲉ ⲁ ⲡⲉϥⲟⲩⲱϣ ϣⲱⲡⲉ ⲛ̅ϩⲏⲧ.	And he brought me into a wide place, and rescued me, because he delighted in me.	καὶ ἐξήγαγέν µε εἰς πλατυσµὸν καὶ ἐξείλατό µε, ὅτι εὐδόκησεν ἐν ἐµοί.						
Second Samuel	22	22	21	OT	1. OT	Historical Books	2. Historical Books	02. Historical Books	05. Second Samuel		ⲁⲩⲱ ⲡϫⲟⲉⲓⲥ ⲁϥⲧⲱⲱⲃⲉ ⲛⲁⲓ ⲕⲁⲧⲁ ⲧⲉϥⲇⲓⲕⲁⲓⲟⲥⲩⲛⲏ. ⲁⲩⲱ ⲕⲁⲧⲁ ⲡⲧⲃ̅ⲃⲟ ⲛⲛⲁϭⲓϫ. ⲁϥⲧⲱⲱⲃⲉ ⲛⲁⲓ.	And the Lord recompensed me according to my righteousness; even according to the purity of my hands did he recompense me.	καὶ ἀνταπέδωκέν µοι κύριος κατὰ τὴν δικαιοσύνην µου, κατὰ τὴν καθαριότητα τῶν χειρῶν µου ἀνταπέδωκέν µοι,						
Second Samuel	22	22	22	OT	1. OT	Historical Books	2. Historical Books	02. Historical Books	05. Second Samuel		ϫⲉ ⲁⲓϩⲁⲣⲉϩ ⲉⲛⲉϩⲓⲟⲟⲩⲉ ⲙ̅ⲡϫⲟⲉⲓⲥ. ⲁⲩⲱ ⲙ̅ⲡⲓⲉⲣϣⲁϥⲧⲉ ⲉⲡⲁⲛⲟⲩⲧⲉ.	Because, I kept the ways of the Lord, and did not wickedly depart from my God.	ὅτι ἐφύλαξα ὁδοὺς κυρίου καὶ οὐκ ἠσέβησα ἀπὸ τοῦ θεοῦ µου,						
Second Samuel	22	22	23	OT	1. OT	Historical Books	2. Historical Books	02. Historical Books	05. Second Samuel		ϫⲉ ⲛⲉϥϩⲁⲡ ⲧⲏⲣⲟⲩ ⲙ̅ⲡⲁⲙ̅ⲧⲟ ⲉⲃⲟⲗ. ⲁⲩⲱ ⲛⲉϥⲇⲓⲕⲁⲓⲱⲙⲁ. ⲙ̅ⲡⲓⲥⲁϩⲱⲟⲩ ⲉⲃⲟⲗ ⲙ̅ⲙⲟⲓ.	For all his judgments and his ordinances were before me: I departed not from them.	ὅτι πάντα τὰ κρίµατα αὐτοῦ κατεναντίον µου, καὶ τὰ δικαιώµατα αὐτοῦ, οὐκ ἀπέστην ἀπ’ αὐτῶν.						
Second Samuel	22	22	24	OT	1. OT	Historical Books	2. Historical Books	02. Historical Books	05. Second Samuel		ⲁⲩⲱ ϯⲛⲁϣⲱⲡⲉ ⲉⲓⲟⲩⲁⲁⲃ ⲛⲁϩⲣⲁϥ. ⲁⲩⲱ ϯⲛⲁϩⲟⲣⲧ̅ ⲉⲣⲟⲓ ⲉⲧⲁⲁⲛⲟⲙⲓⲁ. ⲁⲩⲱ	And I shall be blameless before him, and will keep myself from my iniquity.	καὶ ἔσοµαι ἄµωµος αὐτῷ καὶ προφυλάξοµαι ἀπὸ τῆς ἀνοµίας µου.						
Second Samuel	22	22	25	OT	1. OT	Historical Books	2. Historical Books	02. Historical Books	05. Second Samuel		ⲡϫⲟⲉⲓⲥ ⲛⲁⲧⲱⲱⲃⲉ ⲛⲁⲓ ⲕⲁⲧⲁ ⲧⲁⲇⲓⲕⲁⲓⲟⲥⲩⲛⲏ ⲁⲩⲱ ⲕⲁⲧⲁ ⲡⲧⲃ̅ⲃⲟ ⲛ̅ⲛⲁϭⲓϫ. ϥⲛⲁⲧⲱⲱⲃⲉ ⲛⲁⲓ ⲙ̅ⲡⲙ̅ⲧⲟ ⲉⲃⲟⲗ ⲛ̅ⲛⲉϥⲃⲁⲗ.	And the Lord will recompense me according to my righteousness, and according to the purity of my hands in his eye-sight.	καὶ ἀποδώσει µοι κύριος κατὰ τὴν δικαιοσύνην µου καὶ κατὰ τὴν καθαριότητα τῶν χειρῶν µου ἐνώπιον τῶν ὀφθαλµῶν αὐτοῦ.						
Second Samuel	22	22	26	OT	1. OT	Historical Books	2. Historical Books	02. Historical Books	05. Second Samuel		ⲉⲕϣⲁⲛϣⲱⲡⲉ ⲙⲛ̅ ⲟⲩⲁ. ⲉϥⲟⲩⲁⲁⲃ. ⲕⲛⲁϣⲱⲡⲉ ⲉⲕⲟⲩⲁⲁⲃ. ⲁⲩⲱ ⲉⲕϣⲁⲛϣⲱⲡⲉ ⲙⲛ̅ ⲟⲩⲧⲉⲗⲓⲟⲥ. ⲕⲛⲁϣⲱⲡⲉ ⲉⲕⲟ ⲛ̅ⲧⲉⲗⲓⲟⲥ.	With the holy thou wilt be holy, and with the perfect man thou will be perfect,	µετὰ ὁσίου ὁσιωθήσῃ καὶ µετὰ ἀνδρὸς τελείου τελειωθήσῃ						
Second Samuel	22	22	27	OT	1. OT	Historical Books	2. Historical Books	02. Historical Books	05. Second Samuel		ⲁⲩⲱ ⲉⲕϣⲁⲛϣⲱⲡⲉ ⲙⲛ̅ ⲟⲩⲥⲱⲧⲡ̅. ⲕⲛⲁϣⲱⲡⲉ ⲉⲕⲟ ⲛ̅ⲥⲱⲧⲡ̅. ⲁⲩⲱ ⲉⲕϣⲁⲛϣⲱⲡⲉ ⲙⲛ̅ ⲡⲉⲧϭⲟⲟⲙⲉ. ⲕⲛⲁϣⲱⲡⲉ ⲉⲕϭⲟⲟⲙⲉ.	and with the excellent thou wilt be excellent, and with the froward thou will be froward.	καὶ µετὰ ἐκλεκτοῦ ἐκλεκτὸς ἔσῃ καὶ µετὰ στρεβλοῦ στρεβλωθήσῃ.						
Second Samuel	22	22	28	OT	1. OT	Historical Books	2. Historical Books	02. Historical Books	05. Second Samuel		ⲁⲩⲱ ⲡⲗⲁⲟⲥ ⲛ̅ϩⲏⲕⲉ ⲉⲕⲛⲁⲛⲁϩⲙⲉϥ. ⲁⲩⲱ ⲛ̅ⲃⲁⲗ ⲛ̅ⲛⲉϫⲁⲥⲓϩⲏⲧ ⲕⲛⲁⲑⲃ̅ⲃⲓⲟⲟⲩ	And thou wilt save the poor people, and wilt bring down the eyes of the haughty.	καὶ τὸν λαὸν τὸν πτωχὸν σώσεις καὶ ὀφθαλµοὺς ἐπὶ µετεώρων ταπεινώσεις.						
Second Samuel	22	22	29	OT	1. OT	Historical Books	2. Historical Books	02. Historical Books	05. Second Samuel		ϫⲉ ⲛ̅ⲧⲟⲕ ⲡⲉ ⲡⲁϩⲏⲃⲥ̅ ⲡϫⲟⲉⲓⲥ. ⲁⲩⲱ ⲛ̅ⲧⲟⲕ ⲡⲉⲧⲛⲁⲧⲣⲉ. ⲡⲁⲕⲁⲕⲉ ⲉⲣⲟⲩⲟⲉⲓⲛ ⲛⲁϩⲣⲁⲓ.	For thou, Lord, art my lamp, and the Lord shall shine forth to me in my darkness.	ὅτι σὺ ὁ λύχνος µου, κύριε, καὶ κύριος ἐκλάµψει µοι τὸ σκότος µου.						
Second Samuel	22	22	30	OT	1. OT	Historical Books	2. Historical Books	02. Historical Books	05. Second Samuel		ϫⲉ ⲉⲓⲛⲁⲡⲱⲧ ϩⲣⲁⲓ ⲛ̅ϩⲏⲧⲕ̅ ⲉⲓⲧⲟⲩϫⲏⲩ. ⲁⲩⲱ ⲉⲓⲛⲁⲟⲩⲱⲧⲃ̅ ⲛ̅ⲟⲩⲥⲟⲃⲧ̅ ϩⲙ̅ ⲡⲁⲛⲟⲩⲧⲉ.	For by thee shall I run as a girded man, and by my God shall I leap over a wall.	ὅτι ἐν σοὶ δραµοῦµαι µονόζωνος καὶ ἐν τῷ θεῷ µου ὑπερβήσοµαι τεῖχος.						
Second Samuel	22	22	31	OT	1. OT	Historical Books	2. Historical Books	02. Historical Books	05. Second Samuel		ⲡⲁⲛⲟⲩⲧⲉ ⲉⲧⲧⲁϫⲣⲏⲟⲩⲧ. ⲧⲉϥϩⲓⲏ ⲟⲩⲁⲁⲃ. ⲡϣⲁϫⲉ ⲙ̅ⲡϫⲟⲉⲓⲥ ϫⲟⲟⲣ(sic) ⲉϥⲡⲟⲥⲉ. ⲧⲛⲁϣⲧⲉ ⲡⲉ ⲛ̅ⲟⲩⲟⲛ ⲛⲓⲙ ⲉⲧⲕⲱ ⲛ̅ϩⲧⲏⲩ ⲉⲣⲟϥ.	As for the Mighty One, his way is blameless: the word of the Lord is strong and tried in the fire: he is a protector to all that put their trust in him.	ὁ ἰσχυρός, ἄµωµος ἡ ὁδὸς αὐτοῦ, τὸ ῥῆµα κυρίου κραταιόν, πεπυρωµένον, ὑπερασπιστής ἐστιν πᾶσιν τοῖς πεποιθόσιν ἐπ’ αὐτῷ.						
Second Samuel	22	22	32	OT	1. OT	Historical Books	2. Historical Books	02. Historical Books	05. Second Samuel		ⲛⲓⲙ ⲡⲉ ⲡϫⲱⲱⲣⲉ ⲛ̅ⲥⲁ ⲡϫⲟⲉⲓⲥ. ⲁⲩⲱ ⲛⲓⲙ ⲡⲉⲧⲛⲁⲉⲣ ⲣⲉϥⲥⲱⲛⲧ̅ ⲛ̅ⲥⲁ ⲡⲉⲛⲛⲟⲩⲧⲉ.	Who is strong, but the Lord? and who will be a Creator except our God?	τίς ἰσχυρὸς πλὴν κυρίου; καὶ τίς κτίστης ἔσται πλὴν τοῦ θεοῦ ἡµῶν;						
