book	chapter	chapter-zfilled	verse	testament	testament-indexed	section	section-indexed	section-indexed-no-testament	book-indexed	Bohairic	Sahidic	English	Greek	Fayyumic	Akhmimic	OldBohairic	Mesokemic	DialectP	Lycopolitan
Proverbs	26	26	5	OT	1. OT	Poetic Books	3. Poetic Books	03. Poetic Books	03. Proverbs		ⲁⲗⲗⲁ ⲟⲩⲱϣⲃ̅ ⲛ̅ⲟⲩⲁⲑⲏⲧ ⲟⲩⲃⲉ ⲧⲉϥⲙⲛ̅ⲧⲁⲑⲏⲧ ϫⲉ ⲛ̅ⲛⲉϥⲟⲩⲱⲛϩ̅ ⲉⲃⲟⲗ ⲛ̅ⲥⲟⲫⲟⲥ ⲛ̅ⲛⲁϩⲣⲁϥ ⲙⲁⲩⲁⲁϥ.	Yet answer a fool according to his folly, lest he seem wise in his own conceit.	ἀλλὰ ἀποκρίνου ἄφρονι κατὰ τὴν ἀφροσύνην αὐτοῦ, ἵνα µὴ φαίνηται σοφὸς παρ’ ἑαυτῷ.		ⲁⲗⲗⲁ ⲟⲩⲱϣⲃⲉ ⲛ̅ⲟⲩⲁⲑⲏⲧ ⲟⲩⲃⲉ ⲧⲙⲛ̅ⲧⲁⲑⲏⲧ ϫⲉ ⲛⲉϥⲟⲩⲱⲛϩ̅ ⲁⲃⲁⲗ ⲛ̅ⲥⲟⲫⲟⲥ ⲛ̅ⲛⲁϩⲣⲉϥ ⲟⲩⲁⲉⲉⲧϥ				
Proverbs	26	26	6	OT	1. OT	Poetic Books	3. Poetic Books	03. Poetic Books	03. Proverbs		ⲁⲩⲱ ϣⲁϥϫⲡⲟ ⲛ̅ⲟⲩⲛⲟϭⲛⲉϭ ⲉⲃⲟⲗ ϩⲛ̅ ⲛⲉϥϣⲁϫⲉ ⲉⲕϣⲁⲛϫⲟⲟⲩ ⲛ̅ⲟⲩϣⲁϫⲉ ϩⲓⲧⲛ̅ ⲟⲩϥⲁⲓϣⲓⲛⲉ ⲛ̅ⲁⲑⲏⲧ.	He that sends a message by a foolish messenger procures for himself a reproach from his own ways.	ἐκ τῶν ἑαυτοῦ ποδῶν ὄνειδος πίεται ὁ ἀποστείλας δι’ ἀíέλου ἄφρονος λόγον.		ⲁⲟⲩ ⳉⲁⲣⲉϥⲧⳉⲡⲟ ⲛ̅ⲟⲩⲛⲁϭⲛⲉϭ ⲁⲃⲁⲗ ⳉⲛ̅ ⲛⲉϥϣⲉϫⲉ ⲡⲉⲧϫⲁⲩ ⲛ̅ⲟⲩϣⲉϫⲉ ϩⲓⲧⲛ̅ ⲟⲩϥⲁⲓ̈ϣⲓⲛⲉ ⲛ̅ⲁⲑⲏⲧ				
Proverbs	26	26	7	OT	1. OT	Poetic Books	3. Poetic Books	03. Poetic Books	03. Proverbs		ϥⲓ ⲙ̅ⲙⲁⲩ ⲛ̅ⲧⲉϩⲓⲏ ⲛ̅ⲛⲉϥⲟⲩⲉⲣⲏⲧⲉ ⲁⲩⲱ ⲟⲩⲡⲁⲣϩⲟⲓⲙⲓⲁ ⲉⲃⲟⲗ ϩⲛ̅ⲣⲱⲟⲩ ⲛ̅ⲛ̅ⲁⲑⲏⲧ.	As well take away the motion of the legs, as transgression from the mouth of fools.	ἀφελοῦ πορείαν σκελῶν καὶ παροιµίαν ἐκ στόµατος ἀφρόνων.		​ϥϥⲓ ⲙ̅ⲡⳉⲟ ⲛ̅ⲛⲉϥⲟⲩⲉⲣⲏⲧⲉ ⲁⲟⲩ ⲟⲩⲡⲁⲣϩⲟⲓⲙⲓⲁ ⲁⲃⲁⲗ ⳉⲛ̅ ⲣⲱⲟⲩ ⲛ̅ⲛ̅ⲁⲑⲏⲧ				
Proverbs	26	26	8	OT	1. OT	Poetic Books	3. Poetic Books	03. Poetic Books	03. Proverbs		ⲛ̅ⲑⲉ ⲙ̅ⲡⲉⲧⲛⲁⲙⲟⲩⲣ ⲛ̅ⲟⲩⲱⲛⲉ ϩⲛ̅ ⲟⲩⲥⲫⲉⲛⲇⲟⲛⲏ ⲧⲁⲓ̈ ⲧⲉ ⲑⲉ ⲙ̅ⲡⲉⲧϯⲉⲟⲟⲩ ⲛ̅ⲟⲩⲁⲑⲏⲧ.	He that binds up a stone in a sling, is like one that gives glory to a fool.	ὃς ἀποδεσµεύει λίθον ἐν σφενδόνῃ, ὅµοιός ἐστιν τῷ διδόντι ἄφρονι δόξαν.		ⲛ̅ⲧⳉⲉ ⲙ̅ⲡⲉⲧⲛⲁⲙⲟⲩⲣ ⲛ̅ⲟⲩⲱⲛⲉ ⳉⲛ̅ ⲟⲩⲥⲫⲉⲛⲇⲟⲛⲏ ⲧⲉⲓ̈ ⲧⲉ ⲧⳉⲉ ⲙ̅ⲡⲉⲧϯⲉⲁⲩ ⲛ̅ⲟⲩⲁⲑⲏⲧ				
Proverbs	26	26	9	OT	1. OT	Poetic Books	3. Poetic Books	03. Poetic Books	03. Proverbs		ϣⲁⲣⲉ ϩⲉⲛϣⲟⲛⲧⲉ ⲣⲱⲧ ϩⲛ̅ ⲛ̅ϭⲓϫ ⲙ̅ⲡⲣⲉϥϯϩⲉ ⲁⲩⲱ ⲟⲩⲙⲛ̅ⲧϩⲙ̅ϩⲁⲗ ϩⲛ̅ ⲛ̅ϭⲓϫ ⲛ̅ⲛ̅ⲁⲑⲏⲧ.	Thorns grow in the hand of a drunkard, and servitude in the hand of fools.	ἄκανθαι φύονται ἐν χειρὶ τοῦ µεθύσου, δουλεία δὲ ἐν χειρὶ τῶν ἀφρόνων.		ⳉⲁⲣⲉ ϩⲉⲛϣⲁⲛⲧⲉ ⲣⲱⲧ ⳉⲛ̅ ⲛ̅ϭⲓϫ ⲙ̅ⲡⲣⲉϥϯⳉⲉ ⲁⲟⲩ ⲟⲩⲙⲛ̅ⲧⳉⲙ̅ⳉⲉⲗ ⳉⲛ̅ ⲛ̅ϭⲓϫ ⲙ̅ⲡⲁⲑⲏⲧ				
Proverbs	26	26	10	OT	1. OT	Poetic Books	3. Poetic Books	03. Poetic Books	03. Proverbs		ϣⲁⲣⲉ ⲣⲱⲙⲉ ⲛⲓⲙ ⲥⲱⲃⲉ ⲛ̅ⲥⲁ ⲛ̅ⲁⲑⲏⲧ ⲁⲩⲱ ⲧⲉⲩϩⲓⲏ ⲅⲁⲣ ⲛⲁⲧⲁⲕⲟ.	All the flesh of fools endures much hardship; for their fury is brought to nought.	πολλὰ χειµάζεται πᾶσα σὰρξ ἀφρόνων· συντρίβεται γὰρ ἡ ἔκστασις αὐτῶν.		ⳉⲁⲣⲉ ⲣⲱⲙⲉ ⲛⲓⲙ ⲥⲱⲃⲉ ⲥⲉ ⲛⲁⲑⲏⲧ ⲡⲟⲩⳉⲉ ⲅⲁⲣ ⲛⲁⲧⲉⲕⲟ				
Proverbs	26	26	11	OT	1. OT	Poetic Books	3. Poetic Books	03. Poetic Books	03. Proverbs		ⲛ̅ⲑⲉ ⲛ̅ⲟⲩϩⲟⲟⲣ ⲉϣⲁϥⲕⲟⲧϥ̅ ⲉⲡⲉϥⲕⲁⲃⲟⲗ ⲛ̅ⲥⲉⲙⲉⲥⲧⲱϥ ⲧⲁⲓ̈ ⲧⲉ ⲑⲉ ⲙ̅ⲡⲁⲑⲏⲧ ϩⲛ̅ ⲧⲉϥⲕⲁⲕⲓⲁ ⲉϣⲁϥⲕⲟⲧϥ̅ ⲉⲡⲉϥⲛⲟⲃⲉ ⲟⲩⲛ̅ ⲟⲩϣⲓⲡⲉ ⲉϣⲁϥϫⲡⲉ ⲛⲟⲃⲉ ⲁⲩⲱ ⲟⲩⲛ̅ ⲟⲩϣⲓⲡⲉ ⲉⲩⲉⲟⲟⲩ ⲡⲉ ⲙⲛ̅ ⲟⲩⲭⲁⲣⲓⲥ.	As when a dog goes to his own vomit, and becomes abominable, so is fool who returns in his wickedness to his own sin. (11a) There is a shame that brings sin: and there is a shame that is glory and grace.	ὥσπερ κύων ὅταν ἐπέλθῃ ἐπὶ τὸν ἑαυτοῦ ἔµετον καὶ µισητὸς γένηται, οὕτως ἄφρων τῇ ἑαυτοῦ κακίᾳ ἀναστρέψας ἐπὶ τὴν ἑαυτοῦ ἁµαρτίαν. (11a) ἔστιν αἰσχύνη ἐπάγουσα ἁµαρτίαν, καὶ ἔστιν αἰσχύνη δόξα καὶ χάρις.		ⲛ̅ⲧⳉⲉ ⲛ̅ⲟⲩⲟⲩϩⲁⲣ ⲉⳉⲁⲣⲉϥⲕⲧⲁϥ ⲁⲡϥ̅ⲕⲁⲃⲁⲗ ⲥⲉⲙⲉⲥⲧⲱϥ ⲧⲉⲓ̈ ⲧⲉ ⲧⳉⲉ ⲙ̅ⲡⲁⲑⲏⲧ ⳉⲛ̅ ⲧϥ̅ⲕⲁⲕⲓⲁ ⲉⳉⲁⲣⲉϥⲕⲧⲁϥ ⲁⲛⲉϥⲛⲁⲃⲉ ⲟⲩⲛ̅ ⲟⲩϣⲓⲡⲉ ⲉⳉⲁⲣⲉϥⲧⳉⲡⲟ ⲡⲛⲁⲃⲉ ⲁⲟⲩ ⲟⲩⲛ̅ ⲟⲩϣⲓⲡⲉ ⲉⲩⲉⲁⲩ ⲡⲉ ⲙⲛ̅ ⲟⲩϩⲙⲁⲧ				
