book	chapter	chapter-zfilled	verse	testament	testament-indexed	section	section-indexed	section-indexed-no-testament	book-indexed	Bohairic	Sahidic	English	Greek	Fayyumic	Akhmimic	OldBohairic	Mesokemic	DialectP	Lycopolitan
Isaiah	54	54	14	OT	1. OT	Major Prophets	4. Major Prophets	04. Major Prophets	01. Isaiah	ⲟⲩⲟϩ ⲉⲩⲉ̀ⲕⲟⲧϯ ϧⲉⲛ ⲟⲩⲇⲓⲕⲉⲟⲥⲩⲛⲏ ⲛⲉⲙ ⲟⲩⲙⲉⲑⲙⲏⲓ ϩⲉⲛϯ ⲉ̀ⲃⲟⲗ ϩⲁ ⲛⲓⲣⲉϥϭⲓⲛ̀ϫⲟⲛⲥ ⲟⲩⲟϩ ⲛ̀ⲛⲉⲉⲣϩⲟϯ. ⲟⲩⲟϩ ⲟⲩⲥⲑⲉⲣⲧⲉⲣ ⲛ̀ⲛⲉϥϧⲱⲛⲧ ⲉ̀ⲣⲟ.		And thou shalt be built in righteousness: abstain from injustice, and thou shalt not fear; and trembling shall not come nigh thee.	καὶ ἐν δικαιοσύνῃ οἰκοδοµηθήσῃ· ἀπέχου ἀπὸ ἀδίκου καὶ οὐ φοβηθήσῃ, καὶ τρόµος οὐκ ἐγγιεῖ σοι.						
Isaiah	54	54	15	OT	1. OT	Major Prophets	4. Major Prophets	04. Major Prophets	01. Isaiah	ϩⲏⲡⲡⲉ ϩⲁⲛϣⲉⲙⲙⲱⲟⲩ. ⲉⲩⲉ̀ⲓ̀ ϩⲁⲣⲟ ⲉ̀ⲃⲟⲗ ϩⲓⲧⲟⲧ ⲟⲩⲟϩ ⲉⲩⲉ̀ⲫⲱⲧ ⲉ̀ⲣⲟ.		Behold, strangers shall come to thee by me, and shall sojourn with thee, and shall run to thee for refuge.	ἰδοὺ προσήλυτοι προσελεύσονταί σοι δι’ ἐµοῦ καὶ ἐπὶ σὲ καταφεύξονται.						
Isaiah	54	54	16	OT	1. OT	Major Prophets	4. Major Prophets	04. Major Prophets	01. Isaiah	ϩⲏⲡⲡⲉ ⲁ̀ⲛⲟⲕ ϯⲥⲱⲛⲧ ⲙ̀ⲙⲟ ⲙ̀ⲫⲣⲏϯ ⲛ̀ⲟⲩⲃⲉⲥⲛⲏⲧ ⲁⲛ ⲉϥⲛⲓϥⲓ ⲛ̀ⲥⲁ ϩⲁⲛϫⲉⲃⲥ ⲟⲩⲟϩ ⲉϥⲓⲛⲓ ⲛ̀ⲟⲩⲥⲕⲉⲩⲟⲥ ⲉ̀ⲃⲟⲗ ⲉⲩϩⲱⲃ. ⲁ̀ⲛⲟⲕ ⲁⲓⲥⲱⲛⲧ ⲙ̀ⲙⲟ ⲉⲩⲧⲁⲕⲟ ⲉ̀ⲧⲁⲕⲟ.		Behold, I have created thee, not as the coppersmith blowing coals, and bringing out a vessel fit for work; but I have created thee, not for ruin, that I should destroy thee.	ἰδοὺ ἐγὼ κτίζω σε, οὐχ ὡς χαλκεὺς φυσῶν ἄνθρακας καὶ ἐκφέρων σκεῦος εἰς ἔργον· ἐγὼ δὲ ἔκτισά σε οὐκ εἰς ἀπώλειαν φθεῖραι						
Isaiah	54	54	17	OT	1. OT	Major Prophets	4. Major Prophets	04. Major Prophets	01. Isaiah	ⲛ̀ⲥⲕⲉⲩⲟⲥ ⲛⲓⲃⲉⲛ ⲉⲑⲙⲉϩ ⲛ̀ϩⲓⲕ ⲛ̀ⲛⲁⲥⲟⲩⲧⲱⲛ ⲡⲟⲩⲙⲱⲓⲧ ⲇⲉ ⲉ̀ϩⲣⲏⲓ ⲉ̀ϫⲱ ⲉ̀ⲡϩⲁⲡ ⲉⲣⲉ̀ϭⲣⲟ ⲉ̀ⲣⲱⲟⲩ ⲧⲏⲣⲟⲩ ⲉ̀ⲛⲟⲭⲟⲥ ⲇⲉ ⲉⲩⲉ̀ϣⲱⲡⲓ ⲛ̀ϧⲏⲧⲥ. ⲟⲩⲟⲛ ⲟⲩⲕⲗⲏⲣⲟⲛⲟⲙⲓⲁ ϣⲟⲡ ⲛ̀ⲛⲏ ⲉⲧϣⲉⲙϣⲓ ⲙ̀ⲡϭ̅ⲥ̅. ⲟⲩⲟϩ ⲛ̀ⲑⲱⲧⲉⲛ ϣⲱⲡⲓ ⲉⲣⲉⲧⲉⲛⲟⲓ ⲛ̀ⲑⲙⲏⲓ ⲡⲉϫⲉ ⲡϭ̅ⲥ̅.		I will not suffer any weapon formed against thee to prosper; and every voice that shall rise up against thee for judgment, thou shalt vanquish them all; and thine adversaries shall be condemned thereby. There is an inheritance to them that serve the Lord, and ye shall be righteous before me, saith the Lord.	πᾶν σκεῦος φθαρτόν. ἐπὶ σὲ οὐκ εὐοδώσω, καὶ πᾶσα φωνὴ ἀναστήσεται ἐπὶ σὲ εἰς κρίσιν· πάντας αὐτοὺς ἡττήσεις, οἱ δὲ ἔνοχοί σου ἔσονται ἐν αὐτῇ. ἔστιν κληρονοµία τοῖς θεραπεύουσιν κύριον, καὶ ὑµεῖς ἔσεσθέ µοι δίκαιοι, λέγει κύριος.						
Isaiah	55	55	1	OT	1. OT	Major Prophets	4. Major Prophets	04. Major Prophets	01. Isaiah	ⲛⲏ ⲉⲧⲟⲃⲓ ⲙⲁϣⲉ ⲛⲱⲧⲉⲛ ⲛ̀ⲥⲁ ⲙⲱⲟⲩ ⲟⲩⲟϩ ⲛⲏ ⲉⲧⲉ ⲙ̀ⲙⲟⲛⲧⲟⲩ ϩⲁⲧ ⲙⲁϣⲉ ⲛⲱⲧⲉⲛ ϣⲱⲡ. ⲟⲩⲟϩ ⲥⲱ ⲛ̀ⲟⲩⲉϣⲉ ⲛϩⲁⲧ. ⲟⲩⲟϩ ⲟⲩⲥⲟⲩⲉⲛ ⲟⲩⲏⲣⲡ. ⲟⲩⲟϩ ⲟⲩⲱⲧ.		Ye that thirst, go to the water, and all that have no money, go and buy; and eat and drink wine and fat without money or price.	Οἱ διψῶντες, πορεύεσθε ἐφ’ ὕδωρ, καὶ ὅσοι µὴ ἔχετε ἀργύριον, βαδίσαντες ἀγοράσατε καὶ πίετε ἄνευ ἀργυρίου καὶ τιµῆς οἴνου καὶ στέαρ.						
Isaiah	55	55	2	OT	1. OT	Major Prophets	4. Major Prophets	04. Major Prophets	01. Isaiah	ⲉⲑⲃⲉ ⲟⲩ ⲧⲉⲧⲉⲛϣⲱⲡ ⲙ̀ⲙⲟϥ ϧⲁ ϩⲁⲧ. ⲟⲩⲟϩ ⲡⲉⲧⲉⲛϧⲓⲥⲓ ϥϣⲟⲡ ⲉⲩⲥⲓ. ⲥⲱⲧⲉⲙ ⲟⲩⲟϩ ⲉⲣⲉⲧⲉⲛⲟⲩⲱⲙ ⲛ̀ⲛⲓⲁⲅⲁⲑⲟⲛ. ⲟⲩⲟϩ ⲉⲥⲉ̀ⲟⲩⲛⲟϥ ⲛ̀ϫⲉ ⲧⲉⲛⲯⲩⲭⲏ ϧⲉⲛ ϩⲁⲛⲁⲅⲁⲑⲟⲛ		Wherefore do ye value at the price of money, and give your labour for that which will not satisfy? hearken to me, and ye shall eat that which is good, and your soul shall feast itself on good things.	ἵνα τί τιµᾶσθε ἀργυρίου, καὶ τὸν µόχθον ὑµῶν οὐκ εἰς πλησµονήν; ἀκούσατέ µου καὶ φάγεσθε ἀγαθά, καὶ ἐντρυφήσει ἐν ἀγαθοῖς ἡ ψυχὴ ὑµῶν.						
Isaiah	55	55	3	OT	1. OT	Major Prophets	4. Major Prophets	04. Major Prophets	01. Isaiah	ⲙⲁϩⲑⲏⲧⲉⲛ ϧⲉⲛ ⲛⲉⲧⲉⲛⲙⲁϣϫ. ⲟⲩⲟϩ ⲙⲟϣⲓ ⲛ̀ⲥⲁ ⲛⲁⲙⲱⲓⲧ. ⲥⲱⲧⲉⲙ ⲛ̀ⲥⲱⲓ ⲟⲩⲟϩ ⲉⲥⲉⲱⲛϧ ⲛ̀ϫⲉ ⲧⲉⲧⲉⲛⲯⲩⲭⲏ ϧⲉⲛ ϩⲁⲛⲁⲅⲁⲑⲟⲛ. ⲟⲩⲟϩ ⲉⲓⲉ̀ⲥⲉⲙⲛⲓ ⲛⲱⲧⲉⲛ ⲛ̀ⲟⲩⲇⲓⲁⲑⲏⲕⲏ ⲛ̀ⲉⲛⲉϩ. ⲉⲧⲉ ⲛⲉⲑⲟⲩⲁⲃ ⲛⲉ ⲛ̀ⲧⲉ ⲇⲁⲩⲓⲇ ⲉⲧⲉⲛϩⲟⲧ.		Give heed with your ears, and follow my ways: hearken to me, and your soul shall live in prosperity; and I will make with you an everlasting covenant, the sure mercies of David.	προσέχετε τοῖς ὠτίοις ὑµῶν καὶ ἐπακολουθήσατε ταῖς ὁδοῖς µου· ἐπακούσατέ µου, καὶ ζήσεται ἐν ἀγαθοῖς ἡ ψυχὴ ὑµῶν· καὶ διαθήσοµαι ὑµῖν διαθήκην αἰώνιον, τὰ ὅσια Δαυιδ τὰ πιστά.						
Isaiah	55	55	4	OT	1. OT	Major Prophets	4. Major Prophets	04. Major Prophets	01. Isaiah	ϩⲏⲡⲡⲉ ⲁⲓⲧⲏⲓϥ ⲛ̀ⲟⲩⲙⲉⲑⲣⲉ ϧⲉⲛ ⲛⲓⲉⲑⲛⲟⲥ. ⲟⲩⲟϩ ⲛ̀ⲁⲣⲭⲱⲛ ⲛ̀ⲣⲉϥⲟⲩⲁϩⲥⲁϩⲛⲓ ϧⲉⲛ ⲛⲓⲉⲑⲛⲟⲥ		Behold I have made him a testimony among the Gentiles, a prince and commander to the Gentiles.	ἰδοὺ µαρτύριον ἐν ἔθνεσιν δέδωκα αὐτόν, ἄρχοντα καὶ προστάσσοντα ἔθνεσιν.						
Isaiah	55	55	5	OT	1. OT	Major Prophets	4. Major Prophets	04. Major Prophets	01. Isaiah	ⲛⲓⲉⲑⲛⲟⲥ ⲉⲧⲉ ⲛ̀ⲥⲉⲥⲱⲟⲩⲛ ⲙ̀ⲙⲟⲕ ⲁⲛ ⲉⲩⲉ̀ⲫⲱⲧ ϩⲁⲣⲟⲕ. ⲟⲩⲟϩ ⲛⲓⲗⲁⲟⲥ ⲉⲧⲉ ⲛ̀ⲥⲉⲥⲱⲟⲩⲛ ⲙ̀ⲙⲟⲕ ⲁⲛ. ⲉⲩⲉ̀ⲧⲱⲃϩ ⲙ̀ⲙⲟⲕ ⲉⲑⲃⲉ ⲡⲉⲕⲛⲟⲩϯ ⲡⲉⲑⲟⲩⲁⲃ ⲛ̀ⲧⲉ ⲡⲓⲥ̅ⲗ̅ ϫⲉ ⲁϥϯⲱⲟⲩ ⲛⲁⲕ.		Nations which know thee not, shall call upon thee, and peoples which are not acquainted with thee, shall flee to thee for refuge, for the sake of the Lord thy God, the Holy One of Israel; for he has glorified thee.	ἔθνη, ἃ οὐκ ᾔδεισάν σε, ἐπικαλέσονταί σε, καὶ λαοί, οἳ οὐκ ἐπίστανταί σε, ἐπὶ σὲ καταφεύξονται ἕνεκεν τοῦ θεοῦ σου τοῦ ἁγίου Ισραηλ, ὅτι ἐδόξασέν σε.						
Isaiah	55	55	6	OT	1. OT	Major Prophets	4. Major Prophets	04. Major Prophets	01. Isaiah	ⲕⲱϯ ⲛ̀ⲥⲁ ⲡϭ̅ⲥ̅ ⲟⲩⲟϩ ϧⲉⲛ ⲡϫⲓⲛⲑⲣⲉⲧⲉⲛϫⲉⲙϥ ⲙⲁϯϩⲟ ⲉ̀ⲣⲟϥ. ⲉ̀ϣⲱⲡ ⲇⲉ ⲁϥϣⲁⲛϧⲱⲛⲧ ⲉ̀ⲣⲱⲧⲉⲛ		Seek ye the Lord, and when ye find him, call upon him; and when he shall draw nigh to you,	Ζητήσατε τὸν θεὸν καὶ ἐν τῷ εὑρίσκειν αὐτὸν ἐπικαλέσασθε· ἡνίκα δ’ ἂν ἐγγίζῃ ὑµῖν,						
Isaiah	55	55	7	OT	1. OT	Major Prophets	4. Major Prophets	04. Major Prophets	01. Isaiah	ⲙⲁⲣⲉ ⲡⲓⲁⲥⲉⲃⲏⲥ ⲭⲱ ⲛ̀ⲛⲉϥⲙⲱⲓⲧ ⲛ̀ⲥⲱϥ. ⲟⲩⲟϩ ⲡⲓⲣⲱⲙⲓ ⲛ̀ⲁⲛⲟⲙⲟⲥ ⲙⲁⲣⲉϥⲭⲱ ⲛ̀ⲛⲉϥⲥⲟϭⲛⲓ ⲛ̀ⲥⲱϥ ⲟⲩⲟϩ ⲙⲁⲣⲉϥⲕⲟⲧϥ ϩⲁ ⲡϭ̅ⲥ̅. ⲟⲩⲟϩ ⲉϥⲉ̀ⲛⲁϩⲙⲉϥ. ϫⲉ ϧⲉⲛ ⲟⲩϩⲟⲩⲟ ⲉϥⲉ̀ⲭⲱ ⲛ̀ⲛⲉⲧⲉⲛⲛⲟⲃⲓ ⲛⲱⲧⲉⲛ ⲉ̀ⲃⲟⲗ		let the ungodly leave his ways, and the transgressor his counsels: and let him return to the Lord, and he shall find mercy; for he shall abundantly pardon your sins.	ἀπολιπέτω ὁ ἀσεβὴς τὰς ὁδοὺς αὐτοῦ καὶ ἀνὴρ ἄνοµος τὰς βουλὰς αὐτοῦ καὶ ἐπιστραφήτω ἐπὶ κύριον, καὶ ἐλεηθήσεται, ὅτι ἐπὶ πολὺ ἀφήσει τὰς ἁµαρτίας ὑµῶν.						
Isaiah	55	55	8	OT	1. OT	Major Prophets	4. Major Prophets	04. Major Prophets	01. Isaiah	ⲥⲉⲟⲓ ⲅⲁⲣ ⲁⲛ ⲛ̀ϫⲉ ⲛⲁⲥⲟϭⲛⲓ. ⲙ̀ⲫⲣⲏϯ ⲛ̀ⲛⲉⲧⲉⲛⲥⲟϭⲛⲓ. ⲟⲩⲇⲉ ⲛⲁⲙⲱⲓⲧ ⲙ̀ⲫⲣⲏϯ ⲛ̀ⲛⲉⲧⲉⲛⲙⲱⲓⲧ ⲡⲉϫⲉ ⲡϭ̅ⲥ̅		For my counsels are not as your counsels, nor are my ways as your ways, saith the Lord.	οὐ γάρ εἰσιν αἱ βουλαί µου ὥσπερ αἱ βουλαὶ ὑµῶν οὐδὲ ὥσπερ αἱ ὁδοὶ ὑµῶν αἱ ὁδοί µου, λέγει κύριος·						
Isaiah	55	55	9	OT	1. OT	Major Prophets	4. Major Prophets	04. Major Prophets	01. Isaiah	ⲁⲗⲗⲁ ⲙ̀ⲫⲣⲏϯ ⲉⲧⲉ ⲧⲫⲉ ⲟⲩⲏⲟⲩ ⲉ̀ⲃⲟⲗ ϩⲁ ⲡⲕⲁϩⲓ. ⲡⲁⲓⲣⲏϯ ⲡⲁⲙⲱⲓⲧ ⲟⲩⲏⲟⲩ ⲙ̀ⲡⲉⲧⲉⲛⲙⲱⲓⲧ ⲟⲩⲟϩ ⲛⲉⲧⲉⲛⲙⲉⲩⲓ. ⲉ̀ⲃⲟⲗ ϩⲁ ⲡⲁⲙⲉⲩⲓ.		But as the heaven is distant from the earth, so is my way distant from your ways, and your thoughts from my mind.	ἀλλ’ ὡς ἀπέχει ὁ οὐρανὸς ἀπὸ τῆς γῆς, οὕτως ἀπέχει ἡ ὁδός µου ἀπὸ τῶν ὁδῶν ὑµῶν καὶ τὰ διανοήµατα ὑµῶν ἀπὸ τῆς διανοίας µου.						
Isaiah	55	55	10	OT	1. OT	Major Prophets	4. Major Prophets	04. Major Prophets	01. Isaiah	ⲙ̀ⲫⲣⲏϯ ⲅⲁⲣ ⲉⲧⲉ ⲁϥϣⲁⲛⲓ̀ ⲉ̀ⲡⲉⲥⲏⲧ ⲛ̀ϫⲉ ⲟⲩⲙⲟⲩⲛϩⲱⲟⲩ. ⲓⲉ ⲟⲩⲭⲓⲱⲛ ⲉ̀ⲃⲟⲗ ϧⲉⲛ ⲧⲫⲉ ⲙ̀ⲡⲁϥⲕⲟⲧϥ. ϣⲁⲧⲉϥⲑⲣⲉ ⲡⲓⲕⲁϩⲓ ⲑⲓϧⲓ ⲛ̀ⲧⲉϥⲙⲓⲥⲓ ⲟⲩⲟϩ ⲛ̀ⲧⲉϥⲫⲓⲣⲓ ⲉ̀ⲃⲟⲗ ⲟⲩⲟϩ ⲛ̀ⲧⲉϥϯ ⲛ̀ⲟⲩϫⲣⲟϫ ⲙ̀ⲫⲏ ⲉⲧⲥⲓϯ. ⲛⲉⲙ ⲟⲩⲱⲓⲕ ⲛ̀ϧⲣⲉ.		For as rain shall come down, or snow, from heaven, and shall not return until it have saturated the earth, and it bring forth, and bud, and give seed to the sower, and bread for food:	ὡς γὰρ ἐὰν καταβῇ ὑετὸς ἢ χιὼν ἐκ τοῦ οὐρανοῦ καὶ οὐ µὴ ἀποστραφῇ, ἕως ἂν µεθύσῃ τὴν γῆν, καὶ ἐκτέκῃ καὶ ἐκβλαστήσῃ καὶ δῷ σπέρµα τῷ σπείροντι καὶ ἄρτον εἰς βρῶσιν,						
Isaiah	55	55	11	OT	1. OT	Major Prophets	4. Major Prophets	04. Major Prophets	01. Isaiah	ⲉϥⲉ̀ϣⲱⲡⲓ ⲙ̀ⲡⲁⲓⲣⲏϯ ⲛ̀ϫⲉ ⲡⲓⲥⲁϫⲓ ⲉⲑⲛⲁⲓ ⲉ̀ⲃⲟⲗ ϧⲉⲛ ⲣⲱⲓ ⲛ̀ⲧⲉϥⲧⲟⲩϫⲟ. ϣⲁⲧⲟⲩϫⲱⲕ ⲉ̀ⲃⲟⲗ ⲛ̀ϫⲉ ϩⲱⲃ ⲛⲓⲃⲉⲛ ⲉⲧⲁⲩⲟⲩⲁϣⲟⲩ ⲟⲩⲟϩ ⲉⲓⲉ̀ⲥⲟⲩⲧⲱⲛ ⲛⲁⲙⲱⲓⲧ. ⲛⲉⲙ ⲛⲁϩⲟⲛϩⲉⲛ.		so shall my word be, whatever shall proceed out of my mouth, it shall by no means turn back, until all the things which I willed shall have been accomplished; and I will make thy ways prosperous, and will effect my commands.	οὕτως ἔσται τὸ ῥῆµά µου, ὃ ἐὰν ἐξέλθῃ ἐκ τοῦ στόµατός µου, οὐ µὴ ἀποστραφῇ, ἕως ἂν συντελεσθῇ ὅσα ἠθέλησα καὶ εὐοδώσω τὰς ὁδούς σου καὶ τὰ ἐντάλµατά µου.						
Isaiah	55	55	12	OT	1. OT	Major Prophets	4. Major Prophets	04. Major Prophets	01. Isaiah	ϧⲉⲛ ⲡⲟⲩⲛⲟϥ ⲅⲁⲣ ⲉⲣⲉⲧⲉⲛⲉ̀ϩⲉⲓ ⲉ̀ⲃⲟⲗ. ⲟⲩⲟϩ ⲉⲩⲉ̀ⲧⲁⲥⲑⲉ ⲑⲏⲛⲟⲩ ϧⲉⲛ ⲟⲩⲣⲁϣⲓ. ⲛⲓⲧⲱⲟⲩ ⲅⲁⲣ. ⲛⲉⲙ ⲛⲓⲕⲁⲗⲁⲙⲫⲟ ⲉⲩⲉ̀ϭⲓⲫⲉⲓ ⲉⲩϫⲟⲩϣⲧ ⲉ̀ⲃⲟⲗ ϧⲁϫⲱⲧⲉⲛ ϧⲉⲛ ⲟⲩⲣⲁϣⲓ. ⲟⲩⲟϩ ⲛⲓϣϣⲏⲛ ⲧⲏⲣⲟⲩ ⲛ̀ⲧⲉ ⲧⲕⲟⲓ ⲉⲩⲉ̀ϭⲁⲕ ⲛ̀ⲛⲟⲩϫⲁⲗ.		For ye shall go forth with joy, and shall be taught with gladness: for the mountains and the hills shall exult to welcome you with joy, and all the trees of the field shall applaud with their branches.	ἐν γὰρ εὐφροσύνῃ ἐξελεύσεσθε καὶ ἐν χαρᾷ διδαχθήσεσθε· τὰ γὰρ ὄρη καὶ οἱ βουνοὶ ἐξαλοῦνται προσδεχόµενοι ὑµᾶς ἐν χαρᾷ, καὶ πάντα τὰ ξύλα τοῦ ἀγροῦ ἐπικροτήσει τοῖς κλάδοις,						
Isaiah	55	55	13	OT	1. OT	Major Prophets	4. Major Prophets	04. Major Prophets	01. Isaiah	ⲟⲩⲟϩ ⲛ̀ⲧϣⲉⲃⲓⲱ ⲛ̀ϯⲥⲧⲏⲃⲏ ⲉϥⲉ̀ⲓ̀ ⲉ̀ⲡϣⲱⲓ ⲛ̀ϫⲉ ⲟⲩⲕⲩⲡⲁⲣⲓⲥⲟⲥ. ⲟⲩⲟϩ ⲛ̀ⲧϣⲉⲃⲓⲱ ⲛ̀ϯⲕⲟⲛⲓⲍⲁ ⲉⲥⲉ̀ⲓ̀ ⲉ̀ⲡϣⲱⲓ ⲛ̀ϫⲉ ⲟⲩⲙⲩⲣⲥⲩⲛⲏ. ⲟⲩⲟϩ ⲉⲣⲉ ⲡϭ̅ⲥ̅ ϣⲱⲡⲓ ⲉ̀ⲟⲩⲣⲁⲛ ⲛⲉⲙ ⲟⲩⲙⲏⲓⲛⲓ ⲛ̀ⲉⲛⲉϩ. ⲟⲩⲟϩ ⲛ̀ⲛⲉϥⲙⲟⲩⲛⲕ.		And instead of the bramble shall come up the cypress, and instead of the nettle shall come up the myrtle: and the Lord shall be for a name, and for an everlasting sign, and shall not fail.	καὶ ἀντὶ τῆς στοιβῆς ἀναβήσεται κυπάρισσος, ἀντὶ δὲ τῆς κονύζης ἀναβήσεται µυρσίνη· καὶ ἔσται κύριος εἰς ὄνοµα καὶ εἰς σηµεῖον αἰώνιον καὶ οὐκ ἐκλείψει.						
Isaiah	56	56	1	OT	1. OT	Major Prophets	4. Major Prophets	04. Major Prophets	01. Isaiah	ⲛⲁⲓ ⲛⲉ ⲛⲏ ⲉⲧⲉϥϫⲱ ⲙ̀ⲙⲱⲟⲩ ⲛ̀ϫⲉ ⲡϭ̅ⲥ̅. ⲁⲣⲉϩ ⲉ̀ⲡϩⲁⲡ ⲁⲣⲓⲟⲩⲓ ⲛ̀ⲟⲩⲙⲉⲑⲙⲏⲓ. ϫⲉ ϥϧⲉⲛⲧ ⲛ̀ϫⲉ ⲡⲁⲥⲱⲧⲏⲣ. ⲉ̀ⲑⲣⲉϥⲓ̀ ⲛⲉⲙ ⲡⲁⲛⲁⲓ ⲉ̀ϭⲱⲣⲡ ⲉ̀ⲃⲟⲗ		Thus saith the Lord, Keep ye judgment, and do justice: for my salvation is near to come, and my mercy to be revealed.	Τάδε λέγει κύριος Φυλάσσεσθε κρίσιν, ποιήσατε δικαιοσύνην· ἤγγισεν γὰρ τὸ σωτήριόν µου παραγίνεσθαι καὶ τὸ ἔλεός µου ἀποκαλυφθῆναι.						
Isaiah	56	56	2	OT	1. OT	Major Prophets	4. Major Prophets	04. Major Prophets	01. Isaiah	ⲱⲟⲩⲛⲓⲁⲧϥ ⲙ̀ⲡⲓⲣⲱⲙⲓ ⲉⲧⲓⲣⲓ ⲛ̀ⲛⲁⲓ ⲛⲉⲙ ⲡⲓⲣⲱⲙⲓ ⲉⲧⲁⲙⲟⲛⲓ ⲙ̀ⲙⲱⲟⲩ. ⲟⲩⲟϩ ⲉⲧⲁⲣⲉϩ ⲉ̀ⲛⲓⲥⲁⲃⲃⲁⲧⲟⲛ ⲉ̀ϣ̀ⲧⲉⲙⲥⲟϥⲟⲩ. ⲟⲩⲟϩ ⲉⲧⲁⲣⲉϩ ⲉ̀ⲛⲉϥϫⲓϫ ⲉ̀ϣ̀ⲧⲉⲙⲓⲣⲓ ⲛ̀ϩⲁⲛϭⲓⲛ̀ϫⲟⲛⲥ.		Blessed is the man that does these things, and the man that holds by them, and keeps the sabbaths from profaning them, and keeps his hands from doing unrighteousness.	µακάριος ἀνὴρ ὁ ποιῶν ταῦτα καὶ ἄνθρωπος ὁ ἀντεχόµενος αὐτῶν καὶ φυλάσσων τὰ σάββατα µὴ βεβηλοῦν καὶ διατηρῶν τὰς χεῖρας αὐτοῦ µὴ ποιεῖν ἀδίκηµα.						
Isaiah	56	56	3	OT	1. OT	Major Prophets	4. Major Prophets	04. Major Prophets	01. Isaiah	ⲙ̀ⲡⲉⲣⲑⲣⲉϥϫⲟⲥ ⲛ̀ϫⲉ ⲡⲓⲁⲗⲗⲟⲅⲉⲛⲏⲥ ⲉⲑⲟⲩⲉϩ ⲛ̀ⲥⲁ ⲡϭ̅ⲥ̅. ϫⲉ ϩⲁⲣⲁ ⲡϭ̅ⲥ̅ ⲛⲁⲫⲟⲣⲕⲧ ⲉ̀ⲃⲟⲗ ϩⲁ ⲡⲉϥⲗⲁⲟⲥ. ⲟⲩⲟϩ ⲙ̀ⲡⲉⲛⲑⲣⲉϥϫⲟⲥ ⲛ̀ϫⲉ ⲡⲓⲥⲓⲟⲩⲣ ϫⲉ ⲁ̀ⲛⲟⲕ ⲟⲩϣϣⲏⲛ ⲉϥϣⲟⲩⲱⲟⲩ		Let not the stranger who attaches himself to the Lord, say, Surely the Lord will separate me from his people: and let not the eunuch say, I am a dry tree.	µὴ λεγέτω ὁ ἀλλογενὴς ὁ προσκείµενος πρὸς κύριον Ἀφοριεῖ µε ἄρα κύριος ἀπὸ τοῦ λαοῦ αὐτοῦ· καὶ µὴ λεγέτω ὁ εὐνοῦχος ὅτι Ἐγώ εἰµι ξύλον ξηρόν.						
Isaiah	56	56	4	OT	1. OT	Major Prophets	4. Major Prophets	04. Major Prophets	01. Isaiah	ⲛⲁⲓ ⲛⲉ ⲛⲏ ⲉⲧⲉϥϫⲱ ⲙ̀ⲙⲱⲟⲩ ⲛ̀ϫⲉ ⲡϭ̅ⲥ̅ ⲛ̀ⲛⲓⲥⲓⲟⲩⲣ. ⲛⲏ ⲉⲑⲛⲁⲁⲣⲉϩ ⲉ̀ⲛⲓⲟⲩⲁϩⲥⲁϩⲛⲓ. ⲟⲩⲟϩ ⲉⲑⲛⲁⲥⲱⲧⲡ ⲛ̀ⲛⲏ ⲉ̀ϯⲟⲩⲁϣⲟⲩ ⲁ̀ⲛⲟⲕ. ⲟⲩⲟϩ ⲉⲑⲛⲁⲁⲙⲟⲛⲓ ⲛ̀ⲧⲁⲇⲓⲁⲑⲏⲕⲏ		Thus saith the Lord to the eunuchs, as many as shall keep my sabbaths, and choose the things which I take pleasure in, and take hold of my covenant;	τάδε λέγει κύριος Τοῖς εὐνούχοις, ὅσοι ἂν φυλάξωνται τὰ σάββατά µου καὶ ἐκλέξωνται ἃ ἐγὼ θέλω καὶ ἀντέχωνται τῆς διαθήκης µου,						
Isaiah	56	56	5	OT	1. OT	Major Prophets	4. Major Prophets	04. Major Prophets	01. Isaiah	ⲉⲓⲉ̀ⲟⲗⲟⲩ ⲉ̀ϧⲟⲩⲛ ⲉ̀ⲡⲁⲧⲱⲟⲩ ⲉⲑ̅ⲩ̅ ⲟⲩⲟϩ ⲉⲓⲉ̀ϯ ⲛⲱⲟⲩ ϧⲉⲛ ⲡⲁⲏⲓ ⲛⲉⲙ ϧⲉⲛ ⲡⲁⲥⲟⲃⲧ. ⲛ̀ⲟⲩⲛⲟⲛⲟⲙⲁⲥⲧⲟⲥ ⲉϥⲥⲟⲧⲡ ⲉ̀ϩⲁⲛϣⲏⲣⲓ ⲛⲉⲙ ϩⲁⲛϣⲉⲣⲓ ⲟⲩⲣⲁⲛ ⲛ̀ⲉⲛⲉϩ. ϯⲛⲁⲧⲏⲓϥ ⲛⲱⲟⲩ. ⲟⲩⲟϩ ⲛ̀ⲛⲉϥⲙⲟⲩⲛⲕ		I will give to them in my house and within my walls an honourable place, better than sons and daughters: I will give them an everlasting name, and it shall not fail.	δώσω αὐτοῖς ἐν τῷ οἴκῳ µου καὶ ἐν τῷ τείχει µου τόπον ὀνοµαστὸν κρείττω υἱῶν καὶ θυγατέρων, ὄνοµα αἰώνιον δώσω αὐτοῖς καὶ οὐκ ἐκλείψει.						
Isaiah	56	56	6	OT	1. OT	Major Prophets	4. Major Prophets	04. Major Prophets	01. Isaiah	ⲟⲩⲟϩ ⲛⲓⲁⲗⲗⲟⲅⲉⲛⲏⲥ ⲉⲑⲟⲩⲉϩ ⲉ̀ⲡϭ̅ⲥ̅ ⲉ̀ⲉⲣⲃⲱⲕ ⲛⲁϥ. ⲟⲩⲟϩ ⲉ̀ⲉⲣⲁⲅⲁⲡⲁⲛ ⲙ̀ⲫⲣⲁⲛ ⲙ̀ⲡϭ̅ⲥ̅ ⲉ̀ⲑⲣⲟⲩϣⲱⲡⲓ ⲛⲁϥ ⲛ̀ϩⲁⲛⲃⲱⲕ ⲛⲉⲙ ϩⲁⲛⲃⲱⲕⲓ. ⲛⲉⲙ ⲟⲩⲟⲛ ⲛⲓⲃⲉⲛ ⲉⲧⲁⲣⲉϩ ⲉ̀ⲛⲁⲥⲁⲃⲃⲁⲧⲟⲛ. ⲉ̀ϣ̀ⲧⲉⲙⲥⲟϥⲟⲩ. ⲟⲩⲟϩ ⲉⲧⲁⲙⲟⲛⲓ ⲛ̀ⲧⲁⲇⲓⲁⲑⲏⲕⲏ.		And I will give it to the strangers that attach themselves to the Lord, to serve him, and to love the name of the Lord, to be to him servants and handmaids; and as for all that keep my sabbaths from profaning them, and that take hold of my covenant;	καὶ τοῖς ἀλλογενέσι τοῖς προσκειµένοις κυρίῳ δουλεύειν αὐτῷ καὶ ἀγαπᾶν τὸ ὄνοµα κυρίου τοῦ εἶναι αὐτῷ εἰς δούλους καὶ δούλας καὶ πάντας τοὺς φυλασσοµένους τὰ σάββατά µου µὴ βεβηλοῦν καὶ ἀντεχοµένους τῆς διαθήκης µου,						
Isaiah	56	56	7	OT	1. OT	Major Prophets	4. Major Prophets	04. Major Prophets	01. Isaiah	ⲉⲓⲉ̀ⲟⲗⲟⲩ ⲉ̀ϧⲟⲩⲛ ⲉ̀ⲡⲁⲧⲱⲟⲩ ⲉⲑⲟⲩⲁⲃ. ⲟⲩⲟϩ ⲉⲓⲉ̀ⲑⲣⲟⲩⲟⲩⲛⲟϥ ϧⲉⲛ ⲡⲏⲓ ⲛ̀ⲧⲉ ⲧⲁⲡⲣⲟⲥⲉⲩⲭⲏ. ⲛ̀ⲟⲩϭⲗⲓⲗ ⲛⲉⲙ ⲛⲟⲩϣⲟⲩϣⲱⲟⲩϣⲓ. ⲉⲩⲉ̀ϣⲱⲡⲓ ⲉⲩϣⲏⲡ ⲉ̀ϫⲉⲛ ⲡⲁⲙⲁⲛ̀ⲉⲣϣⲱⲟⲩϣⲓ ⲡⲁⲏⲓ ⲅⲁⲣ ⲉⲩⲉ̀ⲙⲟⲩϯ ⲉ̀ⲣⲟϥ ϫⲉ ⲟⲩⲏⲓ ⲙ̀ⲡⲣⲟⲥⲉⲩⲭⲏ ⲛ̀ⲛⲓⲉⲑⲛⲟⲥ ⲧⲏⲣⲟⲩ		I will bring them to my holy mountain, and gladden them in my house of prayer: their whole-burnt-offerings and their sacrifices shall be acceptable upon mine altar; for my house shall be called a house of prayer for all nations,	εἰσάξω αὐτοὺς εἰς τὸ ὄρος τὸ ἅγιόν µου καὶ εὐφρανῶ αὐτοὺς ἐν τῷ οἴκῳ τῆς προσευχῆς µου· τὰ ὁλοκαυτώµατα αὐτῶν καὶ αἱ θυσίαι αὐτῶν ἔσονται δεκταὶ ἐπὶ τοῦ θυσιαστηρίου µου· ὁ γὰρ οἶκός µου οἶκος προσευχῆς κληθήσεται πᾶσιν τοῖς ἔθνεσιν,						
Isaiah	56	56	8	OT	1. OT	Major Prophets	4. Major Prophets	04. Major Prophets	01. Isaiah	ⲡⲉϫⲁϥ ⲛ̀ϫⲉ ⲡϭ̅ⲥ̅. ⲫⲏ ⲉⲧⲑⲱⲟⲩϯ ⲛ̀ⲛⲏ ⲉⲧⲁⲩϫⲱⲣ ⲉ̀ⲃⲟⲗ ⲛ̀ⲧⲉ ⲡⲓⲥ̅ⲗ̅. ϫⲉ ϯⲛⲁⲑⲱⲟⲩϯ ⲉ̀ϫⲱϥ ⲛ̀ⲟⲩⲥⲩⲛⲁⲅⲱⲅⲏ		saith the Lord that gathers the dispersed of Israel; for I will gather to him a congregation.	εἶπεν κύριος ὁ συνάγων τοὺς διεσπαρµένους Ισραηλ, ὅτι συνάξω ἐπ’ αὐτὸν συναγωγήν.						
Isaiah	56	56	9	OT	1. OT	Major Prophets	4. Major Prophets	04. Major Prophets	01. Isaiah	ⲛⲓⲑⲏⲣⲓⲟⲛ ⲧⲏⲣⲟⲩ ⲛ̀ⲁⲅⲣⲓⲟⲛ ⲁⲙⲱⲓⲛⲓ ⲟⲩⲱⲙ. ⲛⲓⲑⲏⲣⲓⲟⲛ ⲧⲏⲣⲟⲩ ⲛ̀ⲧⲉ ⲡⲓⲇⲣⲩⲙⲟⲥ.		All ye beasts of the field, come, devour, all ye beasts of the forest.	Πάντα τὰ θηρία τὰ ἄγρια, δεῦτε φάγετε, πάντα τὰ θηρία τοῦ δρυµοῦ.						
Isaiah	56	56	10	OT	1. OT	Major Prophets	4. Major Prophets	04. Major Prophets	01. Isaiah	ⲁⲛⲁⲩ ϫⲉ ⲁ ⲟⲩⲟⲛ ⲛⲓⲃⲉⲛ ⲉⲣⲃⲉⲗⲗⲉ. ⲙ̀ⲡⲟⲩⲉⲙⲓ ⲉ̀ⲕⲁϯ. ϩⲁⲛⲟⲩϩⲱⲣ ⲧⲏⲣⲟⲩ ⲛⲉ ⲟⲩⲟⲛϣ ⲙ̀ⲙⲟⲛ ϣ̀ϫⲟⲙ ⲙ̀ⲙⲱⲟⲩ ⲉ̀ⲟⲩⲁϩⲃⲉϥ ⲉⲩⲫⲉⲣ ⲣⲁⲥⲟⲩⲓ ϩⲓ ⲡⲓⲙⲁⲛⲉⲛ̀ⲕⲟⲧ. ⲉⲩⲙⲉⲓ ⲛ̀ϩⲓⲛⲓⲙ.		See how they are all blinded: they have not known; they are dumb dogs that will not bark; dreaming of rest, loving to slumber.	ἴδετε ὅτι πάντες ἐκτετύφλωνται, οὐκ ἔγνωσαν φρονῆσαι, πάντες κύνες ἐνεοί, οὐ δυνήσονται ὑλακτεῖν, ἐνυπνιαζόµενοι κοίτην, φιλοῦντες νυστάξαι.						
Isaiah	56	56	11	OT	1. OT	Major Prophets	4. Major Prophets	04. Major Prophets	01. Isaiah	ⲟⲩⲟϩ ⲛⲓⲟⲩϩⲱⲣ ϩⲁⲛⲁⲧϣⲓⲡⲓ ⲛⲉ ϧⲉⲛ ⲧⲟⲩⲯⲩⲭⲏ. ⲛ̀ⲥⲉⲥⲱⲟⲩⲛ ⲉ̀ⲓ̀ ⲁⲛ. ⲟⲩⲟϩ ⲥⲉϩⲱⲟⲩ ⲛ̀ⲥⲉⲥⲱⲟⲩⲛ ⲛ̀ⲕⲁϯ ⲁⲛ ⲁⲩⲙⲟϣⲓ ⲧⲏⲣⲟⲩ ⲛ̀ⲥⲁ ⲛⲟⲩⲙⲱⲟⲩⲧ. ⲡⲓⲟⲩⲁⲓ ⲡⲓⲟⲩⲁⲓ ⲕⲁⲧⲁ ⲡⲉϥⲥⲙⲟⲧ.		Yea, they are insatiable dogs, that know not what it is to be filled, and they are wicked, having no understanding: all have followed their own ways, each according to his will.	καὶ οἱ κύνες ἀναιδεῖς τῇ ψυχῇ, οὐκ εἰδότες πλησµονήν· καί εἰσιν πονηροὶ οὐκ εἰδότες σύνεσιν, πάντες ἐν ταῖς ὁδοῖς αὐτῶν ἐξηκολούθησαν, ἕκαστος κατὰ τὸ ἑαυτοῦ.						
Isaiah	57	57	1	OT	1. OT	Major Prophets	4. Major Prophets	04. Major Prophets	01. Isaiah	ⲁⲛⲁⲩ ⲙ̀ⲫⲣⲏϯ ⲉⲧⲁ ⲡⲓⲑⲙⲏⲓ ⲧⲁⲕⲟ. ⲟⲩⲟϩ ⲙ̀ⲙⲟⲛ ϩⲗⲓ ϯ ⲛ̀ϩⲑⲏϥ ϧⲉⲛ ⲡⲉϥϩⲏⲧ. ϩⲁⲛⲣⲱⲙⲓ ⲛ̀ⲑⲙⲏⲓ ⲛ̀ⲥⲉⲱⲗⲓ ⲙ̀ⲙⲱⲟⲩ ⲟⲩⲟϩ ⲙ̀ⲙⲟⲛ ϩⲗⲓ ϯⲛⲓⲁⲧϥ ⲉ̀ⲃⲟⲗ ⲅⲁⲣ ϩⲁ ⲡϩⲟ ⲛϯⲁⲇⲓⲕⲓⲁ. ⲁⲩⲱⲗⲓ ⲙ̀ⲡⲓⲑⲙⲏⲓ.		See how the just man has perished, and no one lays it to heart: and righteous men are taken away, and no one considers: for the righteous has been removed out of the way of injustice.	Ἴδετε ὡς ὁ δίκαιος ἀπώλετο, καὶ οὐδεὶς ἐκδέχεται τῇ καρδίᾳ, καὶ ἄνδρες δίκαιοι αἴρονται, καὶ οὐδεὶς κατανοεῖ. ἀπὸ γὰρ προσώπου ἀδικίας ἦρται ὁ δίκαιος·						
Isaiah	57	57	2	OT	1. OT	Major Prophets	4. Major Prophets	04. Major Prophets	01. Isaiah	ⲉⲥⲉ̀ϣⲱⲡⲓ ⲛ̀ϫⲉ ⲧⲉϥⲕⲁⲓⲥⲓ ϧⲉⲛ ⲟⲩϩⲓⲣⲏⲛⲏ ⲁⲩⲟⲗϥ ⲉ̀ⲃⲟⲗ ϧⲉⲛ ⲑⲙⲏϯ.		His burial shall be in peace: he has been removed out of the way.	ἔσται ἐν εἰρήνῃ ἡ ταφὴ αὐτοῦ, ἦρται ἐκ τοῦ µέσου.						
