book	chapter	chapter-zfilled	verse	testament	testament-indexed	section	section-indexed	section-indexed-no-testament	book-indexed	Bohairic	Sahidic	English	Greek	Fayyumic	Akhmimic	OldBohairic	Mesokemic	DialectP	Lycopolitan
Isaiah	57	57	3	OT	1. OT	Major Prophets	4. Major Prophets	04. Major Prophets	01. Isaiah	ⲛ̀ⲑⲱⲧⲉⲛ ⲇⲉ ϩⲉⲛ ⲑⲏⲛⲟⲩ ⲉⲙⲛⲁⲓ ⲛⲓϣⲏⲣⲓ ⲛⲁⲛⲟⲙⲟⲥ ⲡⲓϫⲣⲟϫ ⲛ̀ⲧⲉ ϩⲁⲛⲛⲱⲓⲕ ⲛⲉⲙ ⲟⲩⲡⲟⲣⲛⲏ		But draw ye near hither, ye lawless children, the seed of adulterers and the harlot.	ὑµεῖς δὲ προσαγάγετε ὧδε, υἱοὶ ἄνοµοι, σπέρµα µοιχῶν καὶ πόρνης·						
Isaiah	57	57	4	OT	1. OT	Major Prophets	4. Major Prophets	04. Major Prophets	01. Isaiah	ⲉⲧⲁⲣⲉⲧⲉⲛⲟⲩⲛⲟϥ ⲙ̀ⲙⲱⲧⲉⲛ ϧⲉⲛ ⲟⲩ. ⲟⲩⲟϩ ⲉⲧⲁⲣⲉⲧⲉⲛⲁⲟⲩⲱⲛ ⲛ̀ⲣⲱⲧⲉⲛ ⲉ̀ϫⲉⲛ ⲛⲓⲙ. ⲟⲩⲟϩ ⲉⲧⲁⲣⲉⲧⲉⲛⲧⲁⲟⲩⲟ ⲙ̀ⲡⲉⲧⲉⲛⲗⲁⲥ ⲉ̀ⲃⲟⲗ ⲉ̀ϫⲉⲛ ⲛⲓⲙ. ⲙⲏ ⲛ̀ⲑⲱⲧⲉⲛ ⲁⲛ. ⲛⲉ ⲛⲓϣⲏⲣⲓ ⲛ̀ⲧⲉ ⲡⲧⲁⲕⲟ. ⲡⲓϫⲣⲟϫ ⲛ̀ⲁⲛⲟⲙⲟⲥ		Wherein have ye been rioting? and against whom have ye opened your mouth, and against whom have ye loosed your tongue? are ye not children of perdition? a lawless seed?	ἐν τίνι ἐνετρυφήσατε; καὶ ἐπὶ τίνα ἠνοίξατε τὸ στόµα ὑµῶν; καὶ ἐπὶ τίνα ἐχαλάσατε τὴν γλῶσσαν ὑµῶν; οὐχ ὑµεῖς ἐστε τέκνα ἀπωλείας, σπέρµα ἄνοµον;						
Isaiah	57	57	5	OT	1. OT	Major Prophets	4. Major Prophets	04. Major Prophets	01. Isaiah	ⲛⲏ ⲉⲧϯϩⲟ ⲉ̀ⲛⲓⲓⲇⲱⲗⲟⲛ. ϧⲁⲣⲁⲧⲟⲩ ⲛ̀ϩⲁⲛϣϣⲏⲛ ⲉⲩⲟϣ ⲛ̀ϫⲁⲗ. ⲟⲩⲟϩ ⲉⲧϧⲟⲗϧⲉⲗ ⲛ̀ⲛⲟⲩϣⲏⲣⲓ ϧⲉⲛ ϯϧⲉⲗⲗⲟⲧ ⲟⲩⲇⲉ ⲑⲙⲏϯ ⲛ̀ϯⲡⲉⲧⲣⲁ.		who call upon idols under the leafy trees, slaying your children in the valleys among the rocks?	οἱ παρακαλοῦντες ἐπὶ τὰ εἴδωλα ὑπὸ δένδρα δασέα, σφάζοντες τὰ τέκνα αὐτῶν ἐν ταῖς φάραγξιν ἀνὰ µέσον τῶν πετρῶν.						
Isaiah	57	57	6	OT	1. OT	Major Prophets	4. Major Prophets	04. Major Prophets	01. Isaiah	ⲑⲏ ⲧⲉ ⲧⲉⲕⲧⲟⲓ ⲟⲩⲟϩ ⲫⲁⲓ ⲡⲉ ⲡⲉⲕⲕⲗⲏⲣⲟⲥ. ⲛⲏ ⲉⲧⲉⲙ̀ⲙⲁⲩ ⲁⲕⲟⲩⲱⲧⲉⲛ ⲛⲱⲟⲩ ⲉ̀ⲃⲟⲗ. ⲟⲩⲟϩ ⲛⲏ ⲁⲕⲓⲛⲓ ⲛⲱⲟⲩ ⲉ̀ϩⲣⲏⲓ ⲛ̀ϩⲁⲛϣⲟⲩϣⲱⲟⲩϣⲓ ⲉ̀ϩⲣⲏⲓ ⲉ̀ϫⲉⲛ ⲛⲁⲓ. ⲁⲛ ϯⲛⲁϫⲱⲛⲧ ⲁⲛ		That is thy portion, this is thy lot: and to them hast thou poured forth drink-offerings, and to these hast thou offered meat-offerings. Shall I not therefore be angry for these things?	ἐκείνη σου ἡ µερίς, οὗτός σου ὁ κλῆρος, κἀκείνοις ἐξέχεας σπονδὰς κἀκείνοις ἀνήνεγκας θυσίας· ἐπὶ τούτοις οὖν οὐκ ὀργισθήσοµαι;						
Isaiah	57	57	7	OT	1. OT	Major Prophets	4. Major Prophets	04. Major Prophets	01. Isaiah	ⲉ̀ϫⲉⲛ ⲟⲩⲧⲱⲟⲩ ⲉϥϭⲟⲥⲓ. ⲟⲩⲟϩ ⲉϥϭⲏⲟⲩ ⲁϥⲙ̀ⲙⲁⲩ ⲛ̀ϫⲉ ⲡⲁⲙⲁⲛⲉⲛⲕⲟⲧ. ⲟⲩⲟϩ ⲁⲣⲉⲧⲉⲛⲉⲛ ϣⲟⲩϣⲱⲟⲩϣⲓ ⲉ̀ϩⲣⲏⲓ ⲙ̀ⲙⲁⲩ.		On a lofty and high mountain, there is thy bed, and thither thou carriedst up thy meat-offerings:	ἐπ’ ὄρος ὑψηλὸν καὶ µετέωρον, ἐκεῖ σου ἡ κοίτη, κἀκεῖ ἀνεβίβασας θυσίας.						
Isaiah	57	57	8	OT	1. OT	Major Prophets	4. Major Prophets	04. Major Prophets	01. Isaiah	ⲟⲩⲟϩ ϩⲓⲫⲁϩⲟⲩ ⲛ̀ⲛⲓⲥⲧⲁⲧⲙⲟⲥ ⲛ̀ⲧⲉ ⲡⲉⲣⲟ. ⲁⲣⲉⲭⲱ ⲙ̀ⲡⲉⲉⲣⲫⲙⲉⲩⲓ ⲙ̀ⲙⲁⲩ. ⲁⲣⲉⲙⲉⲩⲓ ϫⲉ ⲁⲣⲉϣⲁⲛϣⲉ ⲛⲉ ⲉ̀ⲃⲟⲗ ϩⲁⲣⲟⲓ. ⲟⲩⲟⲛ ⲛⲁϣⲱⲡⲓ ⲛ̀ϩⲟⲩⲟ ⲁⲣⲉⲙⲉⲛⲣⲉ ⲛⲏ ⲉⲧⲉⲛⲕⲟⲧ ⲛⲉⲙⲉ.		and behind the posts of thy door thou didst place thy memorials. Didst thou think that if thou shouldest depart from me, thou wouldest gain? thou hast loved those that lay with thee;	καὶ ὀπίσω τῶν σταθµῶν τῆς θύρας σου ἔθηκας µνηµόσυνά σου· ᾤου ὅτι ἐὰν ἀπ’ ἐµοῦ ἀποστῇς, πλεῖόν τι ἕξεις· ἠγάπησας τοὺς κοιµωµένους µετὰ σοῦ						
Isaiah	57	57	9	OT	1. OT	Major Prophets	4. Major Prophets	04. Major Prophets	01. Isaiah	ⲟⲩⲟϩ ⲁⲣⲉⲧⲁⲛϣⲟ ⲛ̀ⲧⲉⲡⲟⲣⲛⲓⲁ ⲛⲉⲙⲱⲟⲩ. ⲁⲩⲟⲩⲉ̀ⲓ̀ ⲙ̀ⲙⲟⲛ ⲛ̀ϫⲉ ⲟⲩⲙⲏϣ ⲛⲏ ⲉⲑⲟⲩⲏⲟⲩ. ⲟⲩⲟϩ ⲁⲣⲉⲟⲩⲱⲣⲡ ⲛ̀ϩⲁⲛⲡⲣⲉⲥⲃⲩⲧⲏⲥ ⲥⲁⲙⲛⲏ ⲛ̀ⲛⲓϭⲓⲏ. ⲟⲩⲟϩ ⲁⲣⲉⲧⲁⲥⲑⲟ ⲉ̀ⲃⲟⲗ ⲁⲣⲉⲑⲉⲃⲓⲟ ϣⲁ ⲉ̀ϧⲣⲏⲓ ⲉ̀ⲁⲙⲉⲛϯ		and thou hast multiplied thy whoredom with them, and thou hast increased the number of them that are far from thee, and hast sent ambassadors beyond thy borders, and hast been debased even to hell.	καὶ ἐπλήθυνας τὴν πορνείαν σου µετ’ αὐτῶν καὶ πολλοὺς ἐποίησας τοὺς µακρὰν ἀπὸ σοῦ καὶ ἀπέστειλας πρέσβεις ὑπὲρ τὰ ὅριά σου καὶ ἀπέστρεψας καὶ ἐταπεινώθης ἕως ᾅδου.						
Isaiah	57	57	10	OT	1. OT	Major Prophets	4. Major Prophets	04. Major Prophets	01. Isaiah	ⲁⲣⲉϧⲓⲥⲓ ϧⲉⲛ ⲡⲁϣⲁⲓ ⲛ̀ⲛⲉⲙⲱⲓⲧ. ⲟⲩⲟϩ ⲙ̀ⲡⲉϫⲟⲥ ϫⲉ ϯⲛⲁⲕⲏⲛ ⲉⲓⲉ̀ϣ̀ϫⲉⲙϫⲟⲙ ϫⲉ ⲁⲣⲉⲉⲣⲛⲁⲓ. ⲉⲑⲃⲉ ⲫⲁⲓ ⲙ̀ⲡⲉϯϩⲟ ⲉ̀ⲣⲟⲓ.		Thou has wearied thyself with thy many ways; yet thou saidst not, I will cease to strengthen myself: for thou has done these things; therefore thou has not supplicated me.	ταῖς πολυοδίαις σου ἐκοπίασας καὶ οὐκ εἶπας Παύσοµαι ἐνισχύουσα ὅτι ἔπραξας ταῦτα, διὰ τοῦτο οὐ κατεδεήθης µου						
Isaiah	57	57	11	OT	1. OT	Major Prophets	4. Major Prophets	04. Major Prophets	01. Isaiah	ⲉⲧⲁⲣⲉϭⲱⲧⲡ ⲛ̀ⲑⲟ ϧⲁⲧϩⲏ ⲛ̀ⲛⲓⲙ. ⲉ̀ⲁⲣⲉⲉⲣϩⲟϯ. ⲟⲩⲟϩ ⲁⲣⲉϫⲉⲙⲉⲑⲛⲟⲩϫ ⲉ̀ⲣⲟⲓ. ⲟⲩⲟϩ ⲙ̀ⲡⲉⲣⲉⲣⲡⲁⲙⲉⲩⲓ. ⲟⲩⲇⲉ ⲙ̀ⲡⲉϭⲓⲧ ⲉ̀ϧⲣⲏⲓ ⲉ̀ⲡⲉⲙⲉⲩⲓ. ⲟⲩⲇⲉ ⲉ̀ϧⲣⲏⲓ ⲉ̀ⲡⲉϩⲏⲧ. ⲁ̀ⲛⲟⲕ ϩⲱ ⲉⲓⲉ̀ⲛⲁⲩ ⲉ̀ⲣⲟ ϯⲛⲁϩⲓⲡϩⲟ ⲙ̀ⲙⲟ. ⲟⲩⲟϩ ⲙ̀ⲡⲉⲣⲉⲣϩⲟϯ ϧⲁⲧⲁϩⲏ.		Through dread of whom hast thou feared, and lied against me, and has not remembered, nor considered me, nor regarded me, yea, though when I see thee I pass thee by, yet thou has not feared me.	σύ. τίνα εὐλαβηθεῖσα ἐφοβήθης καὶ ἐψεύσω µε καὶ οὐκ ἐµνήσθης µου οὐδὲ ἔλαβές µε εἰς τὴν διάνοιαν οὐδὲ εἰς τὴν καρδίαν σου; κἀγώ σε ἰδὼν παρορῶ, καὶ ἐµὲ οὐκ ἐφοβήθης.						
Isaiah	57	57	12	OT	1. OT	Major Prophets	4. Major Prophets	04. Major Prophets	01. Isaiah	ⲁ̀ⲛⲟⲕ ϩⲱ ϯⲛⲁϫⲱ ⲛ̀ⲧⲁⲙⲉⲑⲙⲏⲓ. ⲛⲉⲙ ⲛⲉⲡⲉⲧϩⲱⲟⲩ. ⲛⲏ ⲉⲧⲉ ⲛ̀ⲥⲉⲛⲁϯϩⲏⲟⲩ ⲛⲉ ⲁⲛ.		And I will declare thy righteousness, and thy sins, which shall not profit thee.	κἀγὼ ἀπαγγελῶ τὴν δικαιοσύνην µου καὶ τὰ κακά σου, ἃ οὐκ ὠφελήσουσίν σε.						
Isaiah	57	57	13	OT	1. OT	Major Prophets	4. Major Prophets	04. Major Prophets	01. Isaiah	ⲉ̀ϣⲱⲡ ⲁⲣⲉϣⲁⲛⲱϣ ⲉ̀ⲃⲟⲗ ⲙⲁⲣⲟⲩⲛⲁϩⲙⲓ ϧⲉⲛ ⲡⲉϩⲟϫϩⲉϫ. ⲛⲁⲓ ⲅⲁⲣ ⲧⲏⲣⲟⲩ ⲉϥⲉ̀ⲟⲗⲟⲩ ⲛ̀ϫⲉ ⲡⲑⲏⲟⲩ ⲟⲩⲟϩ ⲉⲥⲉ̀ϭⲓⲧⲟⲩ ⲛ̀ϫⲉ ⲟⲩⲥⲁⲣⲁⲑⲏⲟⲩ. ⲛⲏ ⲇⲉ ⲉⲑⲛⲁⲥⲱⲧⲉⲙ ⲛ̀ⲥⲱⲓ. ⲉⲩⲉ̀ϫⲫⲟ ⲛ̀ⲟⲩⲕⲁϩⲓ. ⲟⲩⲟϩ ⲉⲩⲉ̀ⲉⲣⲕⲗⲏⲣⲟⲛⲟⲙⲓⲛ ⲙ̀ⲡⲁⲧⲱⲟⲩ ⲉⲑⲟⲩⲁⲃ.		When thou criest out, let them deliver thee in thine affliction: for all these the wind shall take, and the tempest shall carry them away: but they that cleave to me shall possess the land, and shall inherit my holy mountain.	ὅταν ἀναβοήσῃς, ἐξελέσθωσάν σε ἐν τῇ θλίψει σου· τούτους γὰρ πάντας ἄνεµος λήµψεται καὶ ἀποίσει καταιγίς. οἱ δὲ ἀντεχόµενοί µου κτήσονται γῆν καὶ κληρονοµήσουσιν τὸ ὄρος τὸ ἅγιόν µου.						
Isaiah	57	57	14	OT	1. OT	Major Prophets	4. Major Prophets	04. Major Prophets	01. Isaiah	ⲟⲩⲟϩ ⲉⲩⲉ̀ϫⲟⲥ ϫⲉ ⲙⲁⲧⲟⲩⲃⲟ ⲛ̀ⲛⲁⲙⲱⲓⲧ ⲉ̀ⲃⲟⲗ ϩⲁ ⲡⲉϥϩⲟ. ⲟⲩⲟϩ ⲱⲗⲓ ⲛ̀ⲛⲓϭⲣⲟⲡ ⲉ̀ⲃⲟⲗ ϩⲁ ⲫⲙⲱⲓⲧ ⲙ̀ⲡⲁⲗⲁⲟⲥ.		And they shall say, Clear the ways before him, and take up the stumbling-blocks out of the way of my people.	καὶ ἐροῦσιν Καθαρίσατε ἀπὸ προσώπου αὐτοῦ ὁδοὺς καὶ ἄρατε σκῶλα ἀπὸ τῆς ὁδοῦ τοῦ λαοῦ µου.						
Isaiah	57	57	15	OT	1. OT	Major Prophets	4. Major Prophets	04. Major Prophets	01. Isaiah	ⲛⲁⲓ ⲛⲉ ⲛⲏ ⲉⲧⲉϥϫⲱ ⲙ̀ⲙⲱⲟⲩ ⲛ̀ϫⲉ ⲡⲉⲧϭⲟⲥⲓ ⲫⲏ ⲉⲧϣⲟⲡ ϧⲉⲛ ⲛⲏ ⲉⲧϭⲟⲥⲓ ϣⲁ ⲉⲛⲉϩ ⲫⲏ ⲉⲑⲟⲩⲁⲃ ⲉⲧϧⲉⲛ ⲛⲏ ⲉⲑⲟⲩⲁⲃ. ⲡϭ̅ⲥ̅ ⲉⲧϭⲟⲥⲓ ⲡⲉ ⲡⲉϥⲣⲁⲛ ⲫⲏ ⲉⲑⲙⲟⲧⲉⲛ ⲙ̀ⲙⲟϥ ϧⲉⲛ ⲛⲏ ⲉⲑⲟⲩⲁⲃ. ⲫⲏ ⲉⲧϯ ⲛ̀ⲟⲩⲙⲉⲧⲣⲉϥⲱⲟⲩ ⲛ̀ϩⲏⲧ ⲛ̀ⲛⲏ ⲉⲧⲟⲓ ⲛ̀ⲕⲟⲩϫⲓ ⲛ̀ϩⲏⲧ. ⲟⲩⲟϩ ⲉⲧϯ ⲛ̀ⲟⲩⲱⲛϧ ⲛ̀ⲛⲏ ⲉⲧⲧⲉⲛⲛⲏⲟⲩⲧ ϧⲉⲛ ⲡⲟⲩϩⲏⲧ.		Thus saith the Most High, who dwells on high for ever, Holy in the holies, is his name, the Most High resting in the holies, and giving patience to the faint-hearted, and giving life to the broken-hearted:	Τάδε λέγει κύριος ὁ ὕψιστος ὁ ἐν ὑψηλοῖς κατοικῶν τὸν αἰῶνα, ἅγιος ἐν ἁγίοις ὄνοµα αὐτῷ, κύριος ὕψιστος ἐν ἁγίοις ἀναπαυόµενος καὶ ὀλιγοψύχοις διδοὺς µακροθυµίαν καὶ διδοὺς ζωὴν τοῖς συντετριµµένοις τὴν καρδίαν						
Isaiah	57	57	16	OT	1. OT	Major Prophets	4. Major Prophets	04. Major Prophets	01. Isaiah	ϯⲛⲁϭⲓ ⲙ̀ⲡⲉⲧⲉⲛⲙ̀ⲡϣⲓϣ ⲁⲛ ϣⲁ ⲉⲛⲉϩ. ⲟⲩⲇⲉ ⲛ̀ϯⲛⲁϫⲱⲛⲧ ⲉ̀ⲣⲱⲧⲉⲛ ⲁⲛ ϣⲁ ⲉ̀ⲃⲟⲗ. ⲟⲩⲡⲛ̅ⲁ̅ ⲅⲁⲣ ⲉϥⲉ̀ⲓ̀ ⲉ̀ⲃⲟⲗ ϩⲓⲧⲟⲧ. ⲟⲩⲟϩ ⲛⲓϥⲓ ⲛⲓⲃⲉⲛ ⲁ̀ⲛⲟⲕ ⲁⲓⲑⲁⲙⲓⲱⲟⲩ.		I will not take vengeance on you for ever, neither will I be always angry with you: for my Spirit shall go forth from me, and I have created all breath.	Οὐκ εἰς τὸν αἰῶνα ἐκδικήσω ὑµᾶς οὐδὲ διὰ παντὸς ὀργισθήσοµαι ὑµῖν· πνεῦµα γὰρ παρ’ ἐµοῦ ἐξελεύσεται, καὶ πνοὴν πᾶσαν ἐγὼ ἐποίησα.						
Isaiah	57	57	17	OT	1. OT	Major Prophets	4. Major Prophets	04. Major Prophets	01. Isaiah	ⲉⲑⲃⲉ ⲟⲩⲛⲟⲃⲓ ⲁ̀ⲛⲟⲕ ⲁⲓϯⲙⲕⲁϩ ⲛ̀ϩⲏⲧ ⲛⲁϥ ⲛ̀ⲟⲩⲕⲟⲩϫⲓ. ⲟⲩⲟϩ ⲁⲓϯ ⲛ̀ⲟⲩⲉⲣϧⲟⲧ ⲛⲁϥ. ⲟⲩⲟϩ ⲁⲓⲧⲁⲥⲑⲟ ⲙ̀ⲡⲁϩⲟ ⲥⲁⲃⲟⲗ ⲙ̀ⲙⲟϥ. ⲟⲩⲟϩ ⲁϥⲉⲣⲙⲕⲁϩ ⲛ̀ϩⲏⲧ. ⲁϥⲙⲟϣⲓ ⲉϥⲟⲕⲉⲙ ϩⲓ ⲛⲉϥⲙⲱⲓⲧ		On account of sin for a little while I grieved him, and smote him, and turned away my face from him; and he was grieved, and he went on sorrowful in his ways.	δι’ ἁµαρτίαν βραχύ τι ἐλύπησα αὐτὸν καὶ ἐπάταξα αὐτὸν καὶ ἀπέστρεψα τὸ πρόσωπόν µου ἀπ’ αὐτοῦ, καὶ ἐλυπήθη καὶ ἐπορεύθη στυγνὸς ἐν ταῖς ὁδοῖς αὐτοῦ.						
Isaiah	57	57	18	OT	1. OT	Major Prophets	4. Major Prophets	04. Major Prophets	01. Isaiah	ⲁⲓⲛⲁⲩ ⲉ̀ⲛⲉϥⲙⲱⲓⲧ. ⲟⲩⲟϩ ⲁⲓⲧⲟⲩϫⲟϥ ⲁⲓϯⲛⲟⲙϯ ⲛⲁϥ. ⲟⲩⲟϩ ⲁⲓϯ ⲛⲁϥ ⲛ̀ⲟⲩⲑⲱⲧ ⲛ̀ϩⲏⲧ ⲛ̀ⲧⲁⲫⲙⲏⲓ.		I have seen his ways, and healed him, and comforted him, and given him true comfort;	τὰς ὁδοὺς αὐτοῦ ἑώρακα καὶ ἰασάµην αὐτὸν καὶ παρεκάλεσα αὐτὸν καὶ ἔδωκα αὐτῷ παράκλησιν ἀληθινήν,						
Isaiah	57	57	19	OT	1. OT	Major Prophets	4. Major Prophets	04. Major Prophets	01. Isaiah	ⲟⲩϩⲓⲣⲏⲛⲏ ⲉ̀ϫⲉⲛ ⲟⲩϩⲓⲣⲏⲛⲏ ⲛ̀ⲛⲏ ⲉⲑⲟⲩⲏⲟⲩ ⲛⲉⲙ ⲛⲏ ⲉⲧϧⲉⲛⲧ. ⲟⲩⲟϩ ⲡⲉϫⲉ ⲡϭ̅ⲥ̅ ϫⲉ ϯⲛⲁⲧⲟⲩϫⲱⲟⲩ.		peace upon peace to them that are far off, and to them that are nigh: and the Lord has said, I will heal them.	εἰρήνην ἐπ’ εἰρήνην τοῖς µακρὰν καὶ τοῖς ἐγγὺς οὖσιν· καὶ εἶπεν κύριος Ἰάσοµαι αὐτούς.						
Isaiah	57	57	20	OT	1. OT	Major Prophets	4. Major Prophets	04. Major Prophets	01. Isaiah	ⲛⲓⲁⲇⲓⲕⲟⲥ ⲇⲉ ⲉⲩⲉ̀ϣⲱⲡⲓ ⲙ̀ⲡⲁⲓⲣⲏϯ ϧⲉⲛ ⲡϩⲱⲓⲙⲓ. ⲟⲩⲟϩ ⲛ̀ⲛⲟⲩϣ̀ϫⲉⲙϫⲟⲙ ⲛ̀ⲉⲙⲧⲟⲛ		But the unrighteous shall be tossed as troubled waves, and shall not be able to rest.	οἱ δὲ ἄδικοι οὕτως κλυδωνισθήσονται καὶ ἀναπαύσασθαι οὐ δυνήσονται.						
Isaiah	57	57	21	OT	1. OT	Major Prophets	4. Major Prophets	04. Major Prophets	01. Isaiah	ⲛ̀ⲛⲉ ⲣⲁϣⲓ ϣⲱⲡⲓ ⲛ̀ⲛⲓⲁⲥⲉⲃⲏⲥ ⲡⲉϫⲉ ⲡϭ̅ⲥ̅ ⲫϯ.		There is no joy to the ungodly, said God.	οὐκ ἔστιν χαίρειν τοῖς ἀσεβέσιν, εἶπεν κύριος ὁ θεός.						
Isaiah	58	58	1	OT	1. OT	Major Prophets	4. Major Prophets	04. Major Prophets	01. Isaiah	ⲱϣ ⲉ̀ⲃⲟⲗ ϧⲉⲛ ⲟⲩϫⲟⲙ ⲟⲩⲟϩ ⲙ̀ⲡⲉⲣϯⲁⲥⲟ ϭⲓⲥⲓ ⲛ̀ⲧⲉⲕⲥⲙⲏ ⲙ̀ⲫⲣⲏϯ ⲛ̀ⲟⲩⲥⲁⲗⲡⲓⲅⲝ ⲟⲩⲟϩ ⲙⲁⲧⲁⲙⲉ ⲡⲁⲗⲁⲟⲥ ⲉ̀ⲛⲟⲩⲛⲟⲃⲓ ⲟⲩⲟϩ ⲡⲏⲓ ⲛⲓⲁⲕⲱⲃ ⲉ̀ⲛⲟⲩⲁⲛⲟⲙⲓⲁ.		Cry aloud, and spare not; lift up thy voice as with a trumpet, and declare to my people their sins, and to the house of Jacob their iniquities.	Ἀναβόησον ἐν ἰσχύι καὶ µὴ φείσῃ, ὡς σάλπιγγα ὕψωσον τὴν φωνήν σου καὶ ἀνάγγειλον τῷ λαῷ µου τὰ ἁµαρτήµατα αὐτῶν καὶ τῷ οἴκῳ Ιακωβ τὰς ἀνοµίας αὐτῶν.						
Isaiah	58	58	2	OT	1. OT	Major Prophets	4. Major Prophets	04. Major Prophets	01. Isaiah	ⲁ̀ⲛⲟⲕ ⲥⲉⲕⲱϯ ⲛ̀ⲥⲱⲓ ⲛ̀ⲟⲩⲉϩⲟⲟⲩ ϧⲁⲧϩⲏ ⲛ̀ⲟⲩⲉϩⲟⲟⲩ. ⲟⲩⲟϩ ⲥⲉⲉⲣⲉⲡⲓⲑⲩⲙⲓⲛ ⲉⲥⲟⲩⲱⲛ ⲛⲁⲙⲱⲓⲧ ⲙ̀ⲫⲣⲏϯ ⲛ̀ⲟⲩⲗⲁⲟⲥ. ⲉϥⲓⲣⲓ ⲛ̀ⲟⲩⲙⲉⲑⲙⲏⲓ. ⲟⲩⲟϩ ⲙ̀ⲡⲉϥⲭⲱ ⲛ̀ⲥⲱϥ ⲙ̀ⲡϩⲁⲡ ⲙ̀ⲡⲉϥⲛⲟⲩϯ. ⲥⲉⲉⲣⲉⲧⲓⲛ ⲙ̀ⲙⲟⲓ ϯⲛⲟⲩ ⲛ̀ⲟⲩϩⲁⲡ ⲙ̀ⲙⲏⲓ. ⲟⲩⲟϩ ⲥⲉⲉⲣⲉⲡⲓⲑⲩⲙⲓⲛ ⲉ̀ϧⲱⲛⲧ ⲉ̀ⲫϯ ⲉⲩϫⲱ ⲙ̀ⲙⲟⲥ.		They seek me day by day, and desire to know my ways, as a people that had done righteousness, and had not forsaken the judgment of their God: they now ask of me righteous judgment, and desire to draw nigh to God,	ἐµὲ ἡµέραν ἐξ ἡµέρας ζητοῦσιν καὶ γνῶναί µου τὰς ὁδοὺς ἐπιθυµοῦσιν· ὡς λαὸς δικαιοσύνην πεποιηκὼς καὶ κρίσιν θεοῦ αὐτοῦ µὴ ἐγκαταλελοιπὼς αἰτοῦσίν µε νῦν κρίσιν δικαίαν καὶ ἐγγίζειν θεῷ ἐπιθυµοῦσιν						
Isaiah	58	58	3	OT	1. OT	Major Prophets	4. Major Prophets	04. Major Prophets	01. Isaiah	ϫⲉ ⲉⲑⲃⲉⲟⲩ ⲁⲛⲉⲣⲛⲏⲥⲧⲉⲩⲓⲛ ⲟⲩⲟϩ ⲙⲡⲉⲕⲛⲁⲩ. ⲁⲛⲑⲉⲃⲓⲟ ⲛ̀ⲛⲉⲛⲯⲩⲭⲏ ⲟⲩⲟϩ ⲙ̀ⲡⲉⲕⲉⲙⲓ. ϧⲉⲛ ⲛⲓⲉϩⲟⲟⲩ ⲅⲁⲣ ⲛ̀ⲧⲉ ⲛⲉⲧⲉⲛⲛⲏⲥⲧⲓⲁ ⲧⲉⲧⲉⲛϫⲓⲙⲓ ⲛ̀ⲛⲉⲧⲉⲛⲟⲩⲱϣ ⲛ̀ϩⲏⲧ. ⲟⲩⲟϩ ⲧⲉⲧⲉⲛⲑⲟⲩⲕⲥ ⲛ̀ⲟⲩⲟⲛ ⲛⲓⲃⲉⲛ ⲉⲧⲭⲏ ϧⲁ ⲡⲉⲧⲉⲛⲉⲣϣⲓϣⲓ ⲉ̀ϩⲁⲛϩⲁⲡ ⲛⲉⲙ ϩⲁⲛϣⲟⲛⲧ.		saying, Why have we fasted, and thou regardest not? why have we afflicted our souls, and thou didst not know it?	λέγοντες Τί ὅτι ἐνηστεύσαµεν καὶ οὐκ εἶδες; ἐταπεινώσαµεν τὰς ψυχὰς ἡµῶν καὶ οὐκ ἔγνως; ἐν γὰρ ταῖς ἡµέραις τῶν νηστειῶν ὑµῶν εὑρίσκετε τὰ θελήµατα ὑµῶν καὶ πάντας τοὺς ὑποχειρίους ὑµῶν ὑπονύσσετε.						
Isaiah	58	58	4	OT	1. OT	Major Prophets	4. Major Prophets	04. Major Prophets	01. Isaiah	ⲧⲉⲧⲉⲛⲉⲣⲛⲏⲥⲧⲉⲩⲓⲛ. ⲟⲩⲟϩ ⲧⲉⲧⲉⲛⲙⲓϣⲓ ⲙ̀ⲫⲏ ⲉⲧⲑⲉⲃⲓⲏⲟⲩⲧ ⲛⲉⲙ ⲡⲉⲧⲉⲛϣⲫⲏⲣ ϧⲉⲛ ⲟⲩϭⲓⲛ̀ϫⲟⲛⲥ. ⲉⲑⲃⲉⲟⲩ ⲧⲉⲧⲉⲛⲉⲣⲛⲏⲥⲧⲉⲩⲓⲛ ⲛⲏⲓ ⲙ̀ⲫⲣⲏϯ ⲙ̀ⲫⲟⲟⲩ ⲉ̀ⲥⲱⲧⲉⲙ ⲉⲧⲉⲧⲉⲛⲥⲙⲏ ϧⲉⲛ ⲟⲩϧⲣⲱⲟⲩ.		If ye fast for quarrels and strifes, and smite the lowly with your fists, wherefore do ye fast to me as ye do this day, so that your voice may be heard in crying?	εἰ εἰς κρίσεις καὶ µάχας νηστεύετε καὶ τύπτετε πυγµαῖς ταπεινόν, ἵνα τί µοι νηστεύετε ὡς σήµερον ἀκουσθῆναι ἐν κραυγῇ τὴν φωνὴν ὑµῶν;						
Isaiah	58	58	5	OT	1. OT	Major Prophets	4. Major Prophets	04. Major Prophets	01. Isaiah	ⲑⲁⲓ ⲁⲛ ⲧⲉ ϯⲛⲏⲥⲧⲓⲁ ⲉⲧⲁⲓⲥⲟⲧⲡⲥ. ⲛⲉⲙ ϧⲉⲛ ⲟⲩⲉϩⲟⲟⲩ ⲛ̀ⲧⲉ ⲟⲩⲣⲱⲙⲓ ⲑⲉⲃⲓⲟ ⲛ̀ⲧⲉϥⲯⲩⲭⲏ. ⲟⲩⲇⲉ ⲉ̀ϣⲱⲡ ⲁⲕϣⲁⲛⲕⲱⲗϫ ⲛ̀ⲛⲉⲕⲙⲟϯ. ⲙ̀ⲫⲣⲏϯ ⲛ̀ⲟⲩⲕⲣⲓⲕⲟⲥ ⲟⲩⲟϩ ⲛ̀ⲧⲉⲕⲫⲱⲣϣ ϧⲁⲣⲟⲕ ⲛ̀ⲟⲩⲥⲟⲕ ⲛⲉⲙ ⲟⲩⲕⲉⲣⲙⲓ. ⲟⲩⲇⲉ ⲡⲁⲓⲣⲏϯ ⲛ̀ⲛⲉⲧⲉⲛⲙⲟⲩϯ ⲉ̀ⲣⲟⲥ ϫⲉ ⲛⲏⲥⲧⲓⲁ ⲉⲥϣⲏⲡ.		I have not chosen this fast, nor such a day for a man to afflict his soul; neither though thou shouldest bend down thy neck as a ring, and spread under thee sackcloth and ashes, neither thus shall ye call a fast acceptable.	οὐ ταύτην τὴν νηστείαν ἐξελεξάµην καὶ ἡµέραν ταπεινοῦν ἄνθρωπον τὴν ψυχὴν αὐτοῦ· οὐδ’ ἂν κάµψῃς ὡς κρίκον τὸν τράχηλόν σου καὶ σάκκον καὶ σποδὸν ὑποστρώσῃ, οὐδ’ οὕτως καλέσετε νηστείαν δεκτήν.						
Isaiah	58	58	6	OT	1. OT	Major Prophets	4. Major Prophets	04. Major Prophets	01. Isaiah	ⲑⲁⲓ ⲁⲛ ⲧⲉ ϯⲛⲏⲥⲧⲓⲁ ⲉⲧⲁⲓⲥⲟⲧⲡⲥ ⲁ̀ⲛⲟⲕ ⲡⲉϫⲉ ⲡϭ̅ⲥ̅. ⲁⲗⲗⲁ ⲃⲱⲗ ⲉ̀ⲃⲟⲗ ⲛⲥ̀ⲛⲁⲩϩ ⲛⲓⲃⲉⲛ ⲛ̀ⲧⲉ ϯⲙⲉⲧⲟϫⲓ. ⲙⲁϯⲟⲩⲱ ⲛ̀ⲛⲓⲕⲟⲧⲥ ⲛ̀ⲧⲉ ⲛⲓⲥϧⲁⲓ ⲛ̀ϫⲟⲛⲥ. ⲟⲩⲱⲣⲡ ⲛ̀ⲛⲏ ⲉⲧϧⲉⲙϧⲱⲙ ϧⲉⲛ ⲟⲩⲭⲱ ⲉ̀ⲃⲟⲗ. ⲟⲩⲟϩ ⲥϧⲁⲓ ⲛⲓⲃⲉⲛ ⲙ̀ⲙⲉⲧⲟϫⲓ ⲥⲟⲗⲡⲟⲩ.		I have not chosen such a fast, saith the Lord; but do thou loose every burden of iniquity, do thou untie the knots of hard bargains, set the bruised free, and cancel every unjust account.	οὐχὶ τοιαύτην νηστείαν ἐγὼ ἐξελεξάµην, λέγει κύριος, ἀλλὰ λῦε πάντα σύνδεσµον ἀδικίας, διάλυε στραγγαλιὰς βιαίων συναλλαγµάτων, ἀπόστελλε τεθραυσµένους ἐν ἀφέσει καὶ πᾶσαν συγγραφὴν ἄδικον διάσπα·						
Isaiah	58	58	7	OT	1. OT	Major Prophets	4. Major Prophets	04. Major Prophets	01. Isaiah	ⲙⲁ ⲡⲉⲕⲱⲓⲕ ⲛ̀ⲛⲏ ⲉⲧϩⲟⲕⲉⲣ. ⲟⲩⲟϩ ⲛⲓϩⲏⲕⲓ ⲛⲁⲧⲟⲩⲁϩⲥⲟⲓ. ⲁⲗⲓⲧⲟⲩ ⲉ̀ϧⲟⲩⲛ ⲉ̀ⲡⲉⲕⲏⲓ ⲁⲕϣⲁⲛⲛⲁⲩ ⲉ̀ⲟⲩⲁⲓ ⲉϥⲃⲏϣ ϩⲟⲃⲥϥ. ⲟⲩⲟϩ ⲉ̀ⲃⲟⲗ ϧⲉⲛ ⲛⲓⲣⲉⲙⲛ̀ⲏⲓ ⲛ̀ⲧⲉ ⲡⲉⲕϫⲣⲟϫ ⲙ̀ⲡⲉⲣϩⲓⲡϩⲟ ⲙ̀ⲙⲱⲟⲩ.		Break thy bread to the hungry, and lead the unsheltered poor to thy house: if thou seest one naked, clothe him, and thou shalt not disregard the relations of thine own seed.	διάθρυπτε πεινῶντι τὸν ἄρτον σου καὶ πτωχοὺς ἀστέγους εἴσαγε εἰς τὸν οἶκόν σου· ἐὰν ἴδῃς γυµνόν, περίβαλε, καὶ ἀπὸ τῶν οἰκείων τοῦ σπέρµατός σου οὐχ ὑπερόψῃ.						
Isaiah	58	58	8	OT	1. OT	Major Prophets	4. Major Prophets	04. Major Prophets	01. Isaiah	ⲧⲟⲧⲉ ⲉⲣⲉ ⲡⲉⲕⲟⲩⲱⲓⲛⲓ ϣⲁⲓ ⲛⲁⲕ ⲛ̀ϣⲟⲣⲡ. ⲟⲩⲟϩ ⲛⲉⲕⲧⲁⲗϭⲟ ⲉⲩⲉ̀ⲫⲓⲣⲓ ⲉ̀ⲃⲟⲗ ⲛ̀ⲭⲱⲗⲉⲙ. ⲟⲩⲟϩ ⲉⲥⲉ̀ⲙⲟϣⲓ ϧⲁϫⲱⲕ ⲛ̀ϫⲉ ⲧⲉⲕⲙⲉⲑⲙⲏⲓ. ⲟⲩⲟϩ ⲡⲱⲟⲩ ⲙ̀ⲫϯ ⲉϥⲉ̀ⲧⲁⲕⲧⲟ ⲉ̀ⲣⲟⲕ.		Then shall thy light break forth as the morning, and thy health shall speedily spring forth: and thy righteousness shall go before thee, and the glory of God shall compass thee.	τότε ῥαγήσεται πρόιµον τὸ φῶς σου, καὶ τὰ ἰάµατά σου ταχὺ ἀνατελεῖ, καὶ προπορεύσεται ἔµπροσθέν σου ἡ δικαιοσύνη σου, καὶ ἡ δόξα τοῦ θεοῦ περιστελεῖ σε·						
Isaiah	58	58	9	OT	1. OT	Major Prophets	4. Major Prophets	04. Major Prophets	01. Isaiah	ⲧⲟⲧⲉ ⲉⲕⲉ̀ⲱϣ ⲉ̀ⲃⲟⲗ ⲟⲩⲟϩ ⲉⲣⲉ ⲫϯ ⲥⲱⲧⲉⲙ ⲉ̀ⲣⲟⲕ ⲉⲧⲓ ⲉⲕⲥⲁϫⲓ. ⲉϥⲉ̀ϫⲟⲥ ϫⲉ ϯ ⲙ̀ⲡⲁⲓⲙⲁ. ⲉ̀ϣⲱⲡ ⲁⲕϣⲁⲛⲱⲗⲓ ⲉ̀ⲃⲟⲗ ϩⲁⲣⲟⲕ ⲛ̀ⲟⲩⲥⲛⲁⲩϩ ⲛⲉⲙ ⲟⲩⲭⲓⲣⲟⲇⲟⲛⲓⲁ. ⲛⲉⲙ ⲟⲩⲥⲁϫⲓ ⲛ̀ⲭⲣⲉⲙⲣⲉⲙ.		Then shalt thou cry, and God shall hearken to thee; while thou art yet speaking he will say, Behold, I am here. If thou remove from thee the band, and the stretching forth of the hands, and murmuring speech;	τότε βοήσῃ, καὶ ὁ θεὸς εἰσακούσεταί σου· ἔτι λαλοῦντός σου ἐρεῖ Ἰδοὺ πάρειµι. ἐὰν ἀφέλῃς ἀπὸ σοῦ σύνδεσµον καὶ χειροτονίαν καὶ ῥῆµα γογγυσµοῦ						
Isaiah	58	58	10	OT	1. OT	Major Prophets	4. Major Prophets	04. Major Prophets	01. Isaiah	ⲟⲩⲟϩ ⲛ̀ⲧⲉⲕϯ ⲙ̀ⲡⲉⲕⲱⲓⲕ ⲙ̀ⲡⲉⲧϩⲟⲕⲉⲣ ⲉ̀ⲃⲟⲗ. ϧⲉⲛ ⲧⲉⲕⲯⲩⲭⲏ ⲧⲏⲣⲥ. ⲟⲩⲟϩ ⲟⲩⲯⲩⲭⲏ ⲉⲥⲑⲉⲃⲓⲏⲟⲩⲧ ⲛ̀ⲧⲉⲕⲧⲥⲓⲟⲥ. ⲧⲟⲧⲉ ⲉϥⲉ̀ⲁϣⲁⲓ ⲛ̀ϫⲉ ⲡⲉⲕⲟⲩⲱⲓⲛⲓ ⲛ̀ϩⲣⲏⲓ ϧⲉⲛ ⲡⲭⲁⲕⲓ. ⲟⲩⲟϩ ⲡⲉⲕⲭⲁⲕⲓ ⲉϥⲉ̀ⲉⲣ ⲙ̀ⲫⲣⲏϯ ⲛ̀ⲟⲩⲁⲛⲁⲙⲉⲣⲓ.		and if thou give bread to the hungry from thy heart, and satisfy the afflicted soul; then shall thy light spring up in darkness, and thy darkness shall be as noon-day:	καὶ δῷς πεινῶντι τὸν ἄρτον ἐκ ψυχῆς σου καὶ ψυχὴν τεταπεινωµένην ἐµπλήσῃς, τότε ἀνατελεῖ ἐν τῷ σκότει τὸ φῶς σου, καὶ τὸ σκότος σου ὡς µεσηµβρία.						
