book	chapter	verse	Bohairic	Sahidic	English	Greek	Fayyumic	Akhmimic	OldBohairic	Mesokemic	DialectP	Lycopolitan
Deuteronomy	27	6	 ϩⲁⲛⲱⲛⲓ ⲉ̀ⲟⲩⲟϫ ⲉⲕⲉ̀ⲕⲟⲧⲟⲩ ⲛ̀ⲟⲩⲙⲁⲛ̀ⲉⲣϣⲱⲟⲩϣⲓ ⲙ̀ⲡϭ̅ⲥ̅ ⲡⲉⲕⲛⲟⲩϯ ⲟⲩⲟϩ ⲉⲕⲉ̀ⲓⲛⲓ ⲉ̀ϩⲣⲏⲓ ⲉ̀ϫⲱϥ ⲛ̀ϩⲁⲛϭⲗⲓⲗ ⲙ̀ⲡϭ̅ⲥ̅ ⲡⲉⲕⲛⲟⲩϯ		 Of whole stones shalt thou build an altar to the Lord thy God, and thou shalt offer upon it whole-burnt-offerings to the Lord thy God.	 λίθους ὁλοκλήρους οἰκοδοµήσεις θυσιαστήριον κυρίῳ τῷ θεῷ σου καὶ ἀνοίσεις ἐπ’ αὐτὸ ὁλοκαυτώµατα κυρίῳ τῷ θεῷ σου						
Deuteronomy	27	7	 ⲟⲩⲟϩ ⲉⲕⲉ̀ϣⲱⲧ ⲙ̀ⲙⲁⲩ ⲛ̀ⲟⲩϣⲟⲩϣⲱⲟⲩϣⲓ ⲛ̀ⲟⲩϫⲁⲓ ⲙ̀ⲡϭ̅ⲥ̅ ⲡⲉⲕⲛⲟⲩϯ ⲉⲕⲉ̀ⲟⲩⲱⲙ ⲙ̀ⲙⲁⲩ ⲟⲩⲟϩ ⲉⲕⲉ̀ⲥⲓ ⲉⲕⲉ̀ⲟⲩⲛⲟϥ ⲙ̀ⲡⲉⲙ̀ⲑⲟ ⲙ̀ⲡϭ̅ⲥ̅ ⲡⲉⲕⲛⲟⲩϯ		 And thou shalt there offer a peace-offering; and thou shalt eat and be filled, and rejoice before the Lord thy God.	 καὶ θύσεις ἐκεῖ θυσίαν σωτηρίου κυρίῳ τῷ θεῷ σου καὶ φάγῃ καὶ ἐµπλησθήσῃ καὶ εὐφρανθήσῃ ἐναντίον κυρίου τοῦ θεοῦ σου.						
Deuteronomy	27	8	 ⲟⲩⲟϩ ⲉⲕⲉ̀ⲥϧⲁⲓ ⲛ̀ϧⲣⲏⲓ ϩⲓ ⲛⲓⲱⲛⲓ ⲙ̀ⲡⲁⲓⲛⲟⲙⲟⲥ ⲧⲏⲣϥ ϧⲉⲛ ⲟⲩⲙⲉⲧⲥⲁⲃⲉ ⲉ̀ⲙⲁϣⲱ		 And thou shalt write upon the stones all this law very plainly.	 καὶ γράψεις ἐπὶ τῶν λίθων πάντα τὸν νόµον τοῦτον σαφῶς σφόδρα.						
Deuteronomy	27	9	 ⲟⲩⲟϩ ⲁϥⲥⲁϫⲓ ⲛ̀ϫⲉ ⲙⲱⲩ̀ⲥⲏⲥ ⲛⲉⲙ ⲛⲓⲟⲩⲏⲃ ⲛⲓⲗⲉⲩⲓⲧⲏⲥ ⲛⲉⲙ ⲡⲓⲥ̅ⲗ̅ ⲧⲏⲣϥ ⲉⲩϫⲱ ⲙ̀ⲙⲟⲥ ϫⲉ ⲭⲁⲣⲱⲕ ⲟⲩⲟϩ ⲥⲱⲧⲉⲙ ⲡⲓⲥ̅ⲗ̅ ⲛ̀ϩⲣⲏⲓ ϧⲉⲛ ⲡⲁⲓⲉϩⲟⲟⲩ ⲁⲕϣⲱⲡⲓ ⲛ̀ⲟⲩⲗⲁⲟⲥ ⲙ̀ⲡϭ̅ⲥ̅ ⲡⲉⲕⲛⲟⲩϯ		 And Moses and the priests the Levites spoke to all Israel, saying, Be silent and hear, O Israel; this day thou art become a people to the Lord thy God.	 Καὶ ἐλάλησεν Μωυσῆς καὶ οἱ ἱερεῖς οἱ Λευῖται παντὶ Ισραηλ λέγοντες Σιώπα καὶ ἄκουε, Ισραηλ· ἐν τῇ ἡµέρᾳ ταύτῃ γέγονας εἰς λαὸν κυρίῳ τῷ θεῷ σου·						
Deuteronomy	27	10	 ⲟⲩⲟϩ ⲉⲕⲉ̀ⲥⲱⲧⲉⲙ ⲛ̀ⲥⲁ ⲧⲥⲙⲏ ⲙ̀ⲡϭ̅ⲥ̅ ⲡⲉⲕⲛⲟⲩϯ ⲉⲕⲉ̀ⲓⲣⲓ ⲛ̀ⲛⲉϥ ⲧⲏⲣⲟⲩ ⲛⲉⲙ ⲛⲉϥⲙⲉⲑⲙⲏⲓ ⲛⲁⲓ ⲁ̀ⲛⲟⲕ ⲉ̀ϯϩⲟⲛϩⲉⲛ ⲙ̀ⲙⲟⲕ ⲉ̀ⲣⲱⲟⲩ ⲙ̀ⲫⲟⲟⲩ		 And thou shalt hearken to the voice of the Lord thy God, and shalt do all his commands, and his ordinances, as many as I command thee this day.	 καὶ εἰσακούσῃ τῆς φωνῆς κυρίου τοῦ θεοῦ σου καὶ ποιήσεις πάσας τὰς ἐντολὰς αὐτοῦ καὶ τὰ δικαιώµατα αὐτοῦ, ὅσα ἐγὼ ἐντέλλοµαί σοι σήµερον.						
Deuteronomy	27	11	 ⲟⲩⲟϩ ⲁϥϩⲟⲛϩⲉⲛ ⲛ̀ϫⲉ ⲙⲱⲩ̀ⲥⲏⲥ ⲉ̀ⲧⲟⲧϥ ⲙ̀ⲡⲓⲗⲁⲟⲥ ⲧⲏⲣϥ ϧⲉⲛ ⲡⲓⲉϩⲟⲟⲩ ⲉⲧⲉⲙ̀ⲙⲁⲩ ⲉϥϫⲱ ⲙ̀ⲙⲟⲥ		 And Moses charged the people on that day, saying,	 Καὶ ἐνετείλατο Μωυσῆς τῷ λαῷ ἐν τῇ ἡµέρᾳ ἐκείνῃ λέγων						
Deuteronomy	27	12	 ϫⲉ ⲛⲁⲓ ⲉⲩⲉ̀ⲟϩⲓ ⲉ̀ⲣⲁⲧⲟⲩ ϩⲓ ⲡⲧⲱⲟⲩ ⲛ̀ⲅⲁⲣⲓⲍⲓⲛ ⲉ̀ⲥⲙⲟⲩ ⲉ̀ⲡⲓⲗⲁⲟⲥ ⲁⲩϣⲁⲛⲥⲉⲛ ⲡⲓⲓⲟⲣⲇⲁⲛⲏⲥ ⲉⲙⲏⲣ ⲥⲩⲙⲉⲱⲛ ⲗⲉⲩⲓ ⲓⲟⲩⲇⲁⲥ ⲏⲥⲁⲭⲁⲣ ⲓⲱⲥⲏⲫ ⲛⲉⲙ ⲃⲉⲛⲓⲁⲙⲓⲛ		 These shall stand to bless the people on mount Garizin having gone over Jordan; Symeon, Levi, Judas, Issachar, Joseph, and Benjamin.	 Οὗτοι στήσονται εὐλογεῖν τὸν λαὸν ἐν ὄρει Γαριζιν διαβάντες τὸν Ιορδάνην· Συµεων, Λευι, Ιουδας, Ισσαχαρ, Ιωσηφ καὶ Βενιαµιν.						
Deuteronomy	27	13	 ⲛⲁⲓ ⲉⲩⲉ̀ⲟϩⲓ ⲉ̀ⲣⲁⲧⲟⲩ ϩⲓϫⲉⲛ ⲡⲓⲥⲁϩⲟⲩⲓ ⲛ̀ϩⲣⲏⲓ ϩⲓ ⲡⲧⲱⲟⲩ ⲛ̀ⲅⲁⲃⲁⲗ ⲣⲟⲩⲃⲏⲛ ⲅⲁⲇ ⲛⲉⲙ ⲁⲥⲥⲏⲣ ⲍⲁⲃⲟⲩⲗⲱⲛ ⲇⲁⲛ ⲛⲉⲫⲑⲁⲗⲓⲙ		 And these shall stand for cursing on mount Gaebal; Ruben, Gad, and Aser, Zabulon, Dan, and Nephthali.	 καὶ οὗτοι στήσονται ἐπὶ τῆς κατάρας ἐν ὄρει Γαιβαλ· Ρουβην, Γαδ καὶ Ασηρ, Ζαβουλων, Δαν καὶ Νεφθαλι.						
Deuteronomy	27	14	 ⲉⲩⲉ̀ⲉⲣⲟⲩⲱ ⲛ̀ϫⲉ ⲛⲓⲗⲉⲩⲓⲧⲏⲥ ⲟⲩⲟϩ ⲉⲩⲉ̀ϫⲟⲥ ⲙ̀ⲡⲓⲥ̅ⲗ̅ ⲧⲏⲣϥ ϧⲉⲛ ⲟⲩⲛⲓϣϯ ⲛ̀ϧⲣⲱⲟⲩ		 And the Levites shall answer and say to all Israel with a loud voice,	 καὶ ἀποκριθέντες οἱ Λευῖται ἐροῦσιν παντὶ Ισραηλ φωνῇ µεγάλῃ						
Deuteronomy	27	15	 ϫⲉ ϥⲥϩⲟⲩⲟⲣⲧ ⲛ̀ϫⲉ ⲡⲓⲣⲱⲙⲓ ⲫⲏ ⲉⲧⲛⲁⲑⲁⲙⲓⲟ ⲛ̀ⲟⲩⲙⲟⲛⲕ ⲙ̀ⲫⲱⲧϩ ⲓⲉ ⲟⲩⲙⲟⲛⲕ ⲛ̀ⲟⲩⲱⲧϩ ⲟⲩⲃⲟϯ ⲙ̀ⲡϭ̅ⲥ̅ ⲟⲩϩⲱⲃ ⲛ̀ⲧⲉ ϩⲁⲛϫⲓϫ ⲛ̀ⲧⲉⲭⲛⲓⲧⲏⲥ ⲛ̀ⲧⲉϥⲭⲁϥ ϧⲉⲛ ⲟⲩⲙⲁ ⲉϥϩⲏⲡ ⲟⲩⲟϩ ⲛ̀ⲧⲉϥⲉⲣⲟⲩⲱ ⲛ̀ϫⲉ ⲡⲓⲗⲁⲟⲥ ⲧⲏⲣϥ ϫⲉ ⲉⲥⲉ̀ϣⲱⲡⲓ		 Cursed is the man whosoever shall make a graven or molten image, an abomination to the Lord, the work of the hands of craftsmen, and shall put it in a secret place: and all the people shall answer and say, So be it.	 Ἐπικατάρατος ἄνθρωπος, ὅστις ποιήσει γλυπτὸν καὶ χωνευτόν, βδέλυγµα κυρίῳ, ἔργον χειρῶν τεχνίτου, καὶ θήσει αὐτὸ ἐν ἀποκρύφῳ· καὶ ἀποκριθεὶς πᾶς ὁ λαὸς ἐροῦσιν Γένοιτο.						
Deuteronomy	27	16	 ϥⲥϩⲟⲩⲟⲣⲧ ⲛ̀ϫⲉ ⲫⲏ ⲉⲧⲛⲁϣⲉϣ ⲡⲉϥⲓⲱⲧ ⲛⲉⲙ ⲧⲉϥⲙⲁⲩ ⲟⲩⲟϩ ⲉⲩⲉ̀ϫⲟⲥ ⲛ̀ϫⲉ ⲡⲓⲗⲁⲟⲥ ⲧⲏⲣϥ ϫⲉ ⲉⲥⲉ̀ϣⲱⲡⲓ		 Cursed is the man that dishonours his father or his mother: and all the people shall say, So be it.	 Ἐπικατάρατος ὁ ἀτιµάζων πατέρα αὐτοῦ ἢ µητέρα αὐτοῦ· καὶ ἐροῦσιν πᾶς ὁ λαός Γένοιτο.						
Deuteronomy	27	17	 ϥⲥϩⲟⲩⲟⲣⲧ ⲛ̀ϫⲉ ⲫⲏ ⲉⲧⲛⲁⲟⲩⲱⲧⲉⲃ ⲛ̀ⲛⲓⲑⲟϣ ⲛ̀ⲧⲉ ⲡⲉϥϣⲫⲏⲣ ⲉ̀ⲃⲟⲗ ⲟⲩⲟϩ ⲉⲩⲉ̀ϫⲟⲥ ⲛ̀ϫⲉ ⲡⲓⲗⲁⲟⲥ ⲧⲏⲣϥ ϫⲉ ⲉⲥⲉ̀ϣⲱⲡⲓ		 Cursed is he that removes his neighbour’s landmarks: and all the people shall say, So be it.	 Ἐπικατάρατος ὁ µετατιθεὶς ὅρια τοῦ πλησίον· καὶ ἐροῦσιν πᾶς ὁ λαός Γένοιτο.						
Deuteronomy	27	18	 ϥⲥϩⲟⲩⲟⲣⲧ ⲛ̀ϫⲉ ⲫⲏ ⲉⲧⲛⲁⲥⲱⲣⲉⲙ ⲛ̀ⲟⲩⲃⲉⲗⲗⲉ ϧⲉⲛ ⲟⲩⲙⲱⲓⲧ ⲟⲩⲟϩ ⲉⲩⲉ̀ϫⲟⲥ ⲛ̀ϫⲉ ⲡⲓⲗⲁⲟⲥ ⲧⲏⲣϥ ϫⲉ ⲉⲥⲉ̀ϣⲱⲡⲓ		 Cursed is he that makes the blind to wander in the way: and all the people shall say, So be it.	 Ἐπικατάρατος ὁ πλανῶν τυφλὸν ἐν ὁδῷ· καὶ ἐροῦσιν πᾶς ὁ λαός Γένοιτο.						
Deuteronomy	27	19	 ϥⲥϩⲟⲩⲟⲣⲧ ⲛ̀ϫⲉ ⲫⲏ ⲉⲧⲛⲁⲣⲓⲕⲓ ⲙ̀ⲡϩⲁⲡ ⲛ̀ⲟⲩϣⲉⲙⲙⲟ ⲛⲉⲙ ⲟⲩⲟⲣⲫⲁⲛⲟⲥ ⲛⲉⲙ ⲟⲩⲭⲏⲣⲁ ⲟⲩⲟϩ ⲉⲩⲉ̀ϫⲟⲥ ⲛ̀ϫⲉ ⲡⲓⲗⲁⲟⲥ ⲧⲏⲣϥ ϫⲉ ⲉⲥⲉ̀ϣⲱⲡⲓ		 Cursed is every one that shall pervert the judgment of the stranger, and orphan, and widow: and all the people shall say, So be it.	 Ἐπικατάρατος ὃς ἂν ἐκκλίνῃ κρίσιν προσηλύτου καὶ ὀρφανοῦ καὶ χήρας· καὶ ἐροῦσιν πᾶς ὁ λαός Γένοιτο.						
Deuteronomy	27	20	 ϥⲥϩⲟⲩⲟⲣⲧ ⲛ̀ϫⲉ ⲫⲏ ⲉⲧⲛⲁⲉⲛⲕⲟⲧ ⲛⲉⲙ ⲧⲥϩⲓⲙⲓ ⲙ̀ⲡⲉϥⲓⲱⲧ ϫⲉ ⲁϥⲃⲱϣ ⲙ̀ⲡϩⲱⲃⲥ ⲙ̀ⲡⲉϥⲓⲱⲧ ⲉ̀ⲃⲟⲗ ⲟⲩⲟϩ ⲉⲩⲉ̀ϫⲟⲥ ⲛ̀ϫⲉ ⲡⲓⲗⲁⲟⲥ ⲧⲏⲣϥ ϫⲉ ⲉⲥⲉ̀ϣⲱⲡⲓ		 Cursed is he that lies with his father’s wife, because he has uncovered his father’s skirt: and all the people shall say, So be it.	 Ἐπικατάρατος ὁ κοιµώµενος µετὰ γυναικὸς τοῦ πατρὸς αὐτοῦ, ὅτι ἀπεκάλυψεν συγκάλυµµα τοῦ πατρὸς αὐτοῦ· καὶ ἐροῦσιν πᾶς ὁ λαός Γένοιτο.						
Deuteronomy	27	21	 ϥⲥϩⲟⲩⲟⲣⲧ ⲛ̀ϫⲉ ⲫⲏ ⲉⲧⲛⲁⲉⲛⲕⲟⲧ ⲛⲉⲙ ⲧⲉⲃⲛⲏ ⲛⲓⲃⲉⲛ ⲟⲩⲟϩ ⲉϥⲉ̀ϫⲟⲥ ⲛ̀ϫⲉ ⲡⲓⲗⲁⲟⲥ ⲧⲏⲣϥ ϫⲉ ⲉⲥⲉ̀ϣⲱⲡⲓ ϥⲥϩⲟⲩⲟⲣⲧ ⲛ̀ϫⲉ ⲫⲏ ⲉⲧⲛⲁⲉⲛⲕⲟⲧ ⲛⲉⲙ ⲧⲥⲱⲛⲓ ⲙ̀ⲡⲉϥⲓⲱⲧ ⲓⲉ ⲧⲥⲱⲛⲓ ⲛ̀ⲧⲉϥⲙⲁⲩ ⲟⲩⲟϩ ⲉⲩⲉ̀ϫⲟⲥ ⲛ̀ϫⲉ ⲡⲓⲗⲁⲟⲥ ⲧⲏⲣϥ ϫⲉ ⲉⲥⲉ̀ϣⲱⲡⲓ		 Cursed is he that lies with any beast: and all the people shall say, So be it. (22) Cursed is he that lies with his sister by his father or his mother: and all the people shall say, So be it.	 Ἐπικατάρατος ὁ κοιµώµενος µετὰ παντὸς κτήνους· καὶ ἐροῦσιν πᾶς ὁ λαός Γένοιτο. (22) Ἐπικατάρατος ὁ κοιµώµενος µετὰ ἀδελφῆς ἐκ πατρὸς ἢ ἐκ µητρὸς αὐτοῦ· καὶ ἐροῦσιν πᾶς ὁ λαός Γένοιτο.						
Deuteronomy	27	23	 ϥⲥϩⲟⲩⲟⲣⲧ ⲛ̀ϫⲉ ⲫⲏ ⲉⲧⲛⲁⲉⲛⲕⲟⲧ ⲛⲉⲙ ⲧⲉϥⲥⲱⲛⲓ ⲛ̀ϣⲉⲛⲙⲁⲩ ⲓⲉ ⲧⲉϥⲥⲱⲛⲓ ⲛ̀ϣⲉⲛⲓⲱⲧ ⲟⲩⲟϩ ⲉⲩⲉ̀ϫⲟⲥ ⲛ̀ϫⲉ ⲡⲓⲥ̅ⲗ̅ ⲧⲏⲣϥ ϫⲉ ⲉⲥⲉ̀ϣⲱⲡⲓ		 Cursed is he that lies with his daughter-in-law: and all the people shall say, So be it.	 Ἐπικατάρατος ὁ κοιµώµενος µετὰ πενθερᾶς αὐτοῦ· καὶ ἐροῦσιν πᾶς ὁ λαός Γένοιτο.						
Deuteronomy	27		 ϥⲥϩⲟⲩⲟⲣⲧ ⲛ̀ϫⲉ ⲫⲏ ⲉⲧⲛⲁⲉⲛⲕⲟⲧ ⲛⲉⲙ ⲧⲉϥϣⲱⲙⲓ ⲉⲩⲉ̀ϫⲟⲥ ⲛ̀ϫⲉ ⲡⲓⲗⲁⲟⲥ ⲧⲏⲣϥ ϫⲉ ⲉⲥⲉ̀ϣⲱⲡⲓ		Cursed is he that lies with his wife’s sister: and all the people shall say, So be it.	Ἐπικατάρατος ὁ κοιµώµενος µετὰ ἀδελφῆς γυναικὸς αὐτοῦ· καὶ ἐροῦσιν πᾶς ὁ λαός Γένοιτο.						
Deuteronomy	27	24	 ϥⲥϩⲟⲩⲟⲣⲧ ⲛ̀ϫⲉ ⲫⲏ ⲉⲧⲛⲁϯ ⲛ̀ⲟⲩϣⲁϣ ⲙ̀ⲡⲉϥϣⲫⲏⲣ ϧⲉⲛ ⲟⲩⲭⲣⲟϥ ⲟⲩⲟϩ ⲉⲩⲉ̀ϫⲟⲥ ⲛ̀ϫⲉ ⲡⲓⲗⲁⲟⲥ ⲧⲏⲣϥ ϫⲉ ⲉⲥⲉ̀ϣⲱⲡⲓ		 Cursed is he that smites his neighbour secretly: and all the people shall say, So be it.	 Ἐπικατάρατος ὁ τύπτων τὸν πλησίον αὐτοῦ δόλῳ· καὶ ἐροῦσιν πᾶς ὁ λαός Γένοιτο.						
Deuteronomy	27	25	 ϥⲥϩⲟⲩⲟⲣⲧ ⲛ̀ϫⲉ ⲫⲏ ⲉⲧⲛⲁϭⲓ ⲛ̀ⲟⲩⲇⲱⲣⲟⲛ ⲉⲧⲁⲕⲟ ⲛ̀ⲟⲩⲥⲛⲟϥ ⲛ̀ⲁⲧⲛⲟⲃⲓ ⲟⲩⲟϩ ⲉⲩⲉ̀ϫⲟⲥ ⲛ̀ϫⲉ ⲡⲓⲗⲁⲟⲥ ⲧⲏⲣϥ ϫⲉ ⲉⲥⲉ̀ϣⲱⲡⲓ		 Cursed is he whosoever shall have taken a bribe to slay an innocent man: and all the people shall say, So be it.	 Ἐπικατάρατος ὃς ἂν λάβῃ δῶρα πατάξαι ψυχὴν αἵµατος ἀθῴου· καὶ ἐροῦσιν πᾶς ὁ λαός Γένοιτο.						
Deuteronomy	27	26	 ϥⲥϩⲟⲩⲟⲣⲧ ⲛ̀ϫⲉ ⲣⲱⲙⲓ ⲛⲓⲃⲉⲛ ⲉⲧⲉⲛ̀ϥⲛⲁⲟϩⲓ ⲁⲛ ⲉ̀ⲥⲁϫⲓ ⲛⲓⲃⲉⲛ ⲛ̀ⲧⲉ ⲡⲁⲓⲛⲟⲙⲟⲥ ⲉ̀ⲡⲁⲓⲧⲟⲩ ⲟⲩⲟϩ ⲉⲩⲉ̀ϫⲟⲥ ⲛ̀ϫⲉ ⲡⲓⲗⲁⲟⲥ ⲧⲏⲣϥ ϫⲉ ⲉⲥⲉ̀ϣⲱⲡⲓ		 Cursed is every man that continues not in all the words of this law to do them: and all the people shall say, So be it.	 Ἐπικατάρατος πᾶς ἄνθρωπος, ὃς οὐκ ἐµµενεῖ ἐν πᾶσιν τοῖς λόγοις τοῦ νόµου τούτου τοῦ ποιῆσαι αὐτούς· καὶ ἐροῦσιν πᾶς ὁ λαός Γένοιτο.						
Deuteronomy	28	1	 ⲟⲩⲟϩ ⲉⲥⲉ̀ϣⲱⲡⲓ ⲁⲣⲉⲧⲉⲛϣⲁⲛⲥⲓⲛⲓ ⲉ̀ⲙⲏⲣ ⲙ̀ⲡⲁⲓⲓⲟⲣⲇⲁⲛⲏⲥ ⲉ̀ⲡⲓⲕⲁϩⲓ ⲉⲧⲉ ⲡϭ̅ⲥ̅ ⲡⲉⲧⲉⲛⲛⲟⲩϯ ⲛⲁⲧⲏⲓϥ ⲛⲱⲧⲉⲛ ⲉ̀ϣⲱⲡ ϧⲉⲛ ⲟⲩⲥⲱⲧⲉⲙ ⲛ̀ⲧⲉⲧⲉⲛⲥⲱⲧⲉⲙ ⲛ̀ⲥⲁ ⲧⲥⲙⲏ ⲙ̀ⲡϭ̅ⲥ̅ ⲡⲉⲧⲉⲛⲛⲟⲩϯ ⲉ̀ⲁⲣⲉϩ ⲟⲩⲟϩ ⲉ̀ⲓⲣⲓ ⲛ̀ⲛⲉϥⲉⲛⲧⲟⲗⲏ ⲧⲏⲣⲟⲩ ⲛⲁⲓ ⲁ̀ⲛⲟⲕ ⲉ̀ϯϩⲟⲛϩⲉⲛ ⲙ̀ⲙⲟⲕ ⲉ̀ⲣⲱⲟⲩ ⲙ̀ⲫⲟⲟⲩ ⲟⲩⲟϩ ⲉϥⲉ̀ⲧⲏⲓⲕ ⲛ̀ϫⲉ ⲡϭ̅ⲥ̅ ⲡⲉⲕⲛⲟⲩϯ ⲥⲁⲡϣⲱⲓ ⲛ̀ⲛⲓⲉⲑⲛⲟⲥ ⲧⲏⲣⲟⲩ ⲛ̀ⲧⲉ ⲡⲕⲁϩⲓ		 And it shall come to pass, if thou wilt indeed hear the voice of the Lord thy God, to observe and do all these commands, which I charge thee this day, that the Lord thy God shall set thee on high above all the nations of the earth;	 Καὶ ἔσται ὡς ἂν διαβῆτε τὸν Ιορδάνην εἰς τὴν γῆν, ἣν κύριος ὁ θεὸς ὑµῶν δίδωσιν ὑµῖν, ἐὰν ἀκοῇ εἰσακούσητε τῆς φωνῆς κυρίου τοῦ θεοῦ ὑµῶν φυλάσσειν καὶ ποιεῖν πάσας τὰς ἐντολὰς αὐτοῦ, ἃς ἐγὼ ἐντέλλοµαί σοι σήµερον, καὶ δώσει σε κύριος ὁ θεός σου ὑπεράνω πάντων τῶν ἐθνῶν τῆς γῆς,						
Deuteronomy	28	2	 ⲉⲩⲉ̀ⲓ̀ ⲉ̀ϫⲱⲕ ⲛ̀ϫⲉ ⲛⲁⲓⲥⲙⲟⲩ ⲧⲏⲣⲟⲩ ⲟⲩⲟϩ ⲉⲩⲉ̀ϫⲉⲙⲕ ⲉ̀ϣⲱⲡ ϧⲉⲛ ⲟⲩⲥⲱⲧⲉⲙ ⲛ̀ⲧⲉⲕⲥⲱⲧⲉⲙ ⲛ̀ⲥⲁ ⲧⲥⲙⲏ ⲙ̀ⲡϭ̅ⲥ̅ ⲡⲉⲕⲛⲟⲩϯ		 and all these blessings shall come upon thee, and shall find thee. If thou wilt indeed hear the voice of the Lord thy God,	 καὶ ἥξουσιν ἐπὶ σὲ πᾶσαι αἱ εὐλογίαι αὗται καὶ εὑρήσουσίν σε, ἐὰν ἀκοῇ ἀκούσῃς τῆς φωνῆς κυρίου τοῦ θεοῦ σου.						
Deuteronomy	28	3	 ⲕⲥⲙⲁⲙⲁⲧ ⲛ̀ⲑⲟⲕ ϧⲉⲛ ⲛⲓⲃⲁⲕⲓ ⲟⲩⲟϩ ⲕⲥⲙⲁⲙⲁⲧ ⲛ̀ⲑⲟⲕ ϧⲉⲛ ⲧⲕⲟⲓ		 blessed shalt thou be in the city, and blessed shalt thou be in the field.	 εὐλογηµένος σὺ ἐν πόλει, καὶ εὐλογηµένος σὺ ἐν ἀγρῷ·						
Deuteronomy	28	4	 ⲥⲉⲥⲙⲁⲙⲁⲧ ⲛ̀ϫⲉ ⲛⲓⲙⲓⲥⲓ ⲛ̀ⲧⲉ ⲧⲉⲕⲛⲉϫⲓ ⲛⲉⲙ ⲛⲓⲟⲩⲧⲁϩ ⲛ̀ⲧⲉ ⲡⲉⲕⲕⲁϩⲓ ⲛⲉⲙ ⲛⲓⲟϩⲓ ⲛ̀ⲧⲉ ⲛⲉⲕⲉϩⲱⲟⲩ ⲛⲉⲙ ⲛⲓⲟϩⲓ ⲛ̀ⲧⲉ ⲛⲉⲕⲉⲥⲱⲟⲩ		 Blessed shall be the offspring of thy body, and the fruits of thy land, and the herds of thy oxen, and the flocks of thy sheep.	 εὐλογηµένα τὰ ἔκγονα τῆς κοιλίας σου καὶ τὰ γενήµατα τῆς γῆς σου, τὰ βουκόλια τῶν βοῶν σου καὶ τὰ ποίµνια τῶν προβάτων σου·						
Deuteronomy	28	5	 ⲥⲉⲥⲙⲁⲙⲁⲧ ⲛ̀ϫⲉ ⲛⲉⲕⲁⲡⲟⲑⲏⲕⲏ ⲛⲉⲙ ⲛⲏ ⲉⲧⲛⲁⲥⲱϫⲡ ⲛ̀ⲧⲁⲕ		 Blessed shall be thy barns, and thy stores.	 εὐλογηµέναι αἱ ἀποθῆκαί σου καὶ τὰ ἐγκαταλείµµατά σου·						
Deuteronomy	28	6	 ⲕⲥⲙⲁⲙⲁⲧ ⲛ̀ⲑⲟⲕ ϧⲉⲛ ⲡⲉⲕϫⲓⲛⲙⲟϣⲓ ⲉ̀ϧⲟⲩⲛ ⲟⲩⲟϩ ⲕⲥⲙⲁⲙⲁⲧ ⲛ̀ⲑⲟⲕ ϧⲉⲛ ⲡⲉⲕϫⲓⲛⲙⲟϣⲓ ⲉ̀ⲃⲟⲗ		 Blessed shalt thou be in thy coming in, and blessed shalt thou be in thy going out.	 εὐλογηµένος σὺ ἐν τῷ εἰσπορεύεσθαί σε, καὶ εὐλογηµένος σὺ ἐν τῷ ἐκπορεύεσθαί σε.						
Deuteronomy	28	7	 ⲉⲣⲉ ⲡϭ̅ⲥ̅ ⲡⲉⲕⲛⲟⲩϯ ϯ ⲛ̀ⲛⲉⲕϫⲁϫⲓ ⲉⲧϯ ⲟⲩⲃⲏⲕ ⲉⲩϧⲉⲙϧⲱⲙ ⲙ̀ⲡⲉⲙ̀ⲑⲟ ⲙ̀ⲡⲉⲕϩⲟ ⲉⲩⲉ̀ⲓ̀ ⲉ̀ⲃⲟⲗ ⲉ̀ϩⲣⲁⲕ ϧⲉⲛ ⲟⲩⲙⲱⲓⲧ ⲛ̀ⲟⲩⲱⲧ ⲟⲩⲟϩ ⲉⲩⲉ̀ⲫⲱⲧ ϧⲉⲛ ⲍ̅ ⲙ̀ⲙⲱⲓⲧ ⲉ̀ⲃⲟⲗ ϧⲁⲧϩⲏ ⲙ̀ⲡⲉⲕϩⲟ		 The Lord deliver thine enemies that withstand thee utterly broken before thy face: they shall come out against thee one way, and they shall flee seven ways from before thee.	 παραδῷ κύριος ὁ θεός σου τοὺς ἐχθρούς σου τοὺς ἀνθεστηκότας σοι συντετριµµένους πρὸ προσώπου σου· ὁδῷ µιᾷ ἐξελεύσονται πρὸς σὲ καὶ ἐν ἑπτὰ ὁδοῖς φεύξονται ἀπὸ προσώπου σου.						
Deuteronomy	28	8	 ⲉⲣⲉ ⲡϭ̅ⲥ̅ ⲟⲩⲱⲣⲡ ⲙ̀ⲡⲉϥⲥⲙⲟⲩ ⲉ̀ϫⲱⲕ ϧⲉⲛ ⲛⲉⲕⲧⲁⲙⲓⲟⲛ ϧⲉⲛ ⲉⲛⲭⲁⲓ ⲛⲓⲃⲉⲛ ⲉⲧⲉⲕⲛⲁϩⲓ ⲧⲟⲧⲕ ⲉ̀ⲣⲱⲟⲩ ϧⲉⲛ ⲡⲓⲕⲁϩⲓ ⲉⲧⲉ ⲡϭ̅ⲥ̅ ⲡⲉⲕⲛⲟⲩϯ ⲛⲁⲧⲏⲓϥ ⲛⲁⲕ		 The Lord send upon thee his blessing in thy barns, and on all on which thou shalt put thine hand, in the land which the Lord thy God gives thee.	 ἀποστείλαι κύριος ἐπὶ σὲ τὴν εὐλογίαν ἐν τοῖς ταµιείοις σου καὶ ἐν πᾶσιν, οὗ ἂν ἐπιβάλῃς τὴν χεῖρά σου, ἐπὶ τῆς γῆς, ἧς κύριος ὁ θεός σου δίδωσίν σοι.						
Deuteronomy	28	9	 ⲉϥⲉ̀ⲧⲟⲩⲛⲟⲥⲕ ⲛⲁϥ ⲛ̀ϫⲉ ⲡϭ̅ⲥ̅ ⲡⲉⲕⲛⲟⲩϯ ⲛ̀ⲟⲩⲗⲁⲟⲥ ⲉϥⲟⲩⲁⲃ ⲙ̀ⲫⲣⲏϯ ⲉⲧⲁϥⲱⲣⲕ ⲛ̀ⲛⲉⲕⲓⲟϯ ⲉ̀ϣⲱⲡ ⲁⲕϣⲁⲛⲥⲱⲧⲉⲙ ⲛ̀ⲥⲁ ⲧⲥⲙⲏ ⲙⲡϭ̅ⲥ̅ ⲡⲉⲕⲛⲟⲩϯ ⲛ̀ⲧⲉⲕⲙⲟϣⲓ ϩⲓ ⲛⲉϥⲙⲱⲓⲧ		 The Lord raise thee up for himself a holy people, as he sware to thy fathers; if thou wilt hear the voice of the Lord thy God, and walk in all his ways.	 ἀναστήσαι σε κύριος ὁ θεός σου ἑαυτῷ λαὸν ἅγιον, ὃν τρόπον ὤµοσεν τοῖς πατράσιν σου, ἐὰν εἰσακούσῃς τῆς φωνῆς κυρίου τοῦ θεοῦ σου καὶ πορευθῇς ἐν ταῖς ὁδοῖς αὐτοῦ·						
Deuteronomy	28	10	 ⲉⲩⲉ̀ⲛⲁⲩ ⲉ̀ⲣⲟⲕ ⲛ̀ϫⲉ ⲛⲓⲉⲑⲛⲟⲥ ⲧⲏⲣⲟⲩ ⲛ̀ⲧⲉ ⲡⲕⲁϩⲓ ϫⲉ ϥⲧⲟⲓ ⲉ̀ⲣⲟⲕ ⲛ̀ϫⲉ ⲫⲣⲁⲛ ⲙ̀ⲡϭ̅ⲥ̅ ⲡⲉⲕⲛⲟⲩϯ ⲟⲩⲟϩ ⲉⲩⲉ̀ⲉⲣϩⲟϯ ϧⲁⲧⲉⲕϩⲏ		 And all the nations of the earth shall see thee, that the name of the Lord is called upon thee, and they shall stand in awe of thee.	 καὶ ὄψονταί σε πάντα τὰ ἔθνη τῆς γῆς ὅτι τὸ ὄνοµα κυρίου ἐπικέκληταί σοι, καὶ φοβηθήσονταί σε.						
Deuteronomy	28	11	 ⲟⲩⲟϩ ⲉϥⲉⲑⲣⲉⲕⲁϣⲁⲓ ⲛ̀ϫⲉ ⲡϭ̅ⲥ̅ ⲡⲉⲕⲛⲟⲩϯ ⲉ̀ϩⲁⲛⲁⲅⲁⲑⲟⲛ ϩⲓ ⲛⲓⲙⲓⲥⲓ ⲛ̀ⲧⲉ ⲧⲉⲕⲛⲉϫⲓ ⲛⲉⲙ ⲛⲓⲟⲩⲧⲁϩ ⲛ̀ⲧⲉ ⲡⲉⲕⲕⲁϩⲓ ⲛⲉⲙ ϩⲓ ⲛⲓⲙⲁⲥ ⲛ̀ⲧⲉ ⲛⲉⲕⲧⲉⲃⲛⲱⲟⲩⲓ ⲛ̀ϧⲣⲏⲓ ϩⲓ ⲡⲓⲕⲁϩⲓ ⲉⲧⲁϥⲱⲣⲕ ⲙ̀ⲙⲟϥ ⲛ̀ϫⲉ ⲡϭ̅ⲥ̅ ⲛ̀ⲛⲉⲕⲓⲟϯ ⲉ̀ⲧⲏⲓϥ ⲛⲁⲕ		 And the Lord thy God shall multiply thee for good in the offspring of thy body, and in the offspring of thy cattle, and in the fruits of thy land, on thy land which the Lord sware to thy fathers to give to thee.	 καὶ πληθυνεῖ σε κύριος ὁ θεός σου εἰς ἀγαθὰ ἐπὶ τοῖς ἐκγόνοις τῆς κοιλίας σου καὶ ἐπὶ τοῖς γενήµασιν τῆς γῆς σου καὶ ἐπὶ τοῖς ἐκγόνοις τῶν κτηνῶν σου ἐπὶ τῆς γῆς, ἧς ὤµοσεν κύριος τοῖς πατράσιν σου δοῦναί σοι.						
Deuteronomy	28	12	 ⲉϥⲉ̀ⲁⲟⲩⲱⲛ ⲛ̀ϫⲉ ⲡϭ̅ⲥ̅ ⲙ̀ⲡⲉϥⲁϩⲟ ⲉⲧⲛⲁⲛⲉϥ ⲛ̀ⲧⲉ ⲧⲫⲉ ⲉϥⲉ̀ϯ ⲙ̀ⲡⲓⲙⲟⲩⲛϩⲱⲟⲩ ⲙ̀ⲡⲉⲕⲕⲁϩⲓ ϧⲉⲛ ⲡⲉϥⲥⲏⲟⲩ ⲉϥⲉ̀ⲥⲙⲟⲩ ⲉ̀ⲛⲓϩⲃⲏⲟⲩⲓ ⲧⲏⲣⲟⲩ ⲛ̀ⲧⲉ ⲛⲉⲕϫⲓϫ ⲟⲩⲟϩ ⲉⲕⲉ̀ϯ ⲉ̀ⲑⲙⲏⲥⲓ ⲛ̀ⲟⲩⲙⲏϣ ⲛ̀ⲉⲑⲛⲟⲥ ⲛ̀ⲑⲟⲕ ⲇⲉ ⲛ̀ⲛⲉⲕϭⲓ ⲉ̀ⲑⲙⲏⲥⲓ ⲉⲓⲉ̀ⲉⲣⲁⲣⲭⲱⲛ ⲛ̀ⲟⲩⲙⲏϣ ⲛ̀ⲉⲑⲛⲟⲥ ⲛ̀ⲑⲟⲕ ⲇⲉ ⲛ̀ⲛⲟⲩⲉⲣⲁⲣⲭⲱⲛ ⲉ̀ⲣⲟⲕ		 May the Lord open to thee his good treasure, the heaven, to give rain to thy land in season: may he bless all the works of thy hands: so shalt thou lend to many nations, but thou shalt not borrow; and thou shalt rule over many nations, but they shall not rule over thee.	 ἀνοίξαι σοι κύριος τὸν θησαυρὸν αὐτοῦ τὸν ἀγαθόν, τὸν οὐρανόν, δοῦναι τὸν ὑετὸν τῇ γῇ σου ἐπὶ καιροῦ αὐτοῦ εὐλογῆσαι πάντα τὰ ἔργα τῶν χειρῶν σου, καὶ δανιεῖς ἔθνεσιν πολλοῖς, σὺ δὲ οὐ δανιῇ, καὶ ἄρξεις σὺ ἐθνῶν πολλῶν, σοῦ δὲ οὐκ ἄρξουσιν.						
Deuteronomy	28	13	 ⲉϥⲉ̀ⲁⲓⲕ ⲛ̀ϫⲉ ⲡϭ̅ⲥ̅ ⲡⲉⲕⲛⲟⲩϯ ⲛ̀ⲟⲩⲁⲫⲉ ⲟⲩⲟϩ ⲛ̀ⲟⲩⲥⲁⲧ ⲁⲛ ⲧⲟⲧⲉ ⲉⲕⲉ̀ϣⲱⲡⲓ ⲥⲁⲡϣⲱⲓ ⲟⲩⲟϩ ⲥⲁⲡⲉⲥⲏⲧ ⲁⲛ ⲉ̀ϣⲱⲡ ϧⲉⲛ ⲟⲩⲥⲱⲧⲉⲙ ⲛ̀ⲧⲉⲕⲥⲱⲧⲉⲙ ⲛ̀ⲥⲁ ⲛⲓⲉⲛⲧⲟⲗⲏ ⲛ̀ⲧⲉ ⲡϭ̅ⲥ̅ ⲡⲉⲕⲛⲟⲩϯ ⲛⲏ ⲁ̀ⲛⲟⲕ ⲉ̀ϯϩⲟⲛϩⲉⲛ ⲙ̀ⲙⲟⲕ ⲉ̀ⲣⲱⲟⲩ ⲙ̀ⲫⲟⲟⲩ ⲉ̀ⲁⲣⲉϩ ⲉ̀ⲁⲓⲧⲟⲩ		 The Lord thy God make thee the head, and not the tail; and thou shalt then be above and thou shalt not be below, if thou wilt hearken to the voice of the Lord thy God, in all things that I charge thee this day to observe.	 καταστήσαι σε κύριος ὁ θεός σου εἰς κεφαλὴν καὶ µὴ εἰς οὐράν, καὶ ἔσῃ τότε ἐπάνω καὶ οὐκ ἔσῃ ὑποκάτω, ἐὰν ἀκούσῃς τῶν ἐντολῶν κυρίου τοῦ θεοῦ σου, ὅσα ἐγὼ ἐντέλλοµαί σοι σήµερον φυλάσσειν καὶ ποιεῖν·						
Deuteronomy	28	14	 ⲛ̀ⲛⲉⲕⲉⲣⲡⲁⲣⲁⲃⲉⲛⲓⲛ ⲛ̀ⲛⲁⲓⲥⲁϫⲓ ⲧⲏⲣⲟⲩ ⲉ̀ϯϩⲟⲛϩⲉⲛ ⲙ̀ⲙⲟⲕ ⲉ̀ⲣⲱⲟⲩ ⲙ̀ⲫⲟⲟⲩ ⲉ̀ⲟⲩⲓⲛⲁⲙ ⲟⲩⲇⲉ ⲉ̀ϫⲁϭⲏ ⲉ̀ⲙⲟϣⲓ ⲥⲁⲫⲁϩⲟⲩ ⲛ̀ϩⲁⲛⲕⲉⲛⲟⲩϯ ⲉ̀ϣⲉⲙϣⲓ ⲙ̀ⲙⲱⲟⲩ		 Thou shalt not turn aside from any of the commandments, which I charge thee this day, to the right hand or to the left, to go after other gods to serve them.	 οὐ παραβήσῃ ἀπὸ πάντων τῶν λόγων, ὧν ἐγὼ ἐντέλλοµαί σοι σήµερον, δεξιὰ οὐδὲ ἀριστερὰ πορεύεσθαι ὀπίσω θεῶν ἑτέρων λατρεύειν αὐτοῖς.						
Deuteronomy	28	15	 ⲟⲩⲟϩ ⲉⲥⲉ̀ϣⲱⲡⲓ ⲁⲣⲉⲧⲉⲛϣ̀ⲧⲉⲙⲥⲱⲧⲉⲙ ⲛ̀ⲥⲁ ⲧⲥⲙⲏ ⲙ̀ⲡϭ̅ⲥ̅ ⲡⲉⲧⲉⲛⲛⲟⲩϯ ⲉ̀ⲁⲣⲉϩ ⲉ̀ⲛⲉϥⲉⲛⲧⲟⲗⲏ ⲧⲏⲣⲟⲩ ⲛⲏ ⲁ̀ⲛⲟⲕ ⲉ̀ϯϩⲟⲛϩⲉⲛ ⲙ̀ⲙⲟⲕ ⲉ̀ⲣⲱⲟⲩ ⲙ̀ⲫⲟⲟⲩ ⲉⲩⲉ̀ⲓ̀ ⲉ̀ϫⲱⲕ ⲛ̀ϫⲉ ⲛⲁⲓⲥⲁϩⲟⲩⲓ ⲧⲏⲣⲟⲩ ⲟⲩⲟϩ ⲉⲩⲉ̀ⲧⲁϩⲟⲕ		 But it shall come to pass, if thou wilt not hearken to the voice of the Lord thy God, to observe all his commandments, as many as I charge thee this day, then all these curses shall come on thee, and overtake thee.	 Καὶ ἔσται ἐὰν µὴ εἰσακούσῃς τῆς φωνῆς κυρίου τοῦ θεοῦ σου φυλάσσειν καὶ ποιεῖν πάσας τὰς ἐντολὰς αὐτοῦ, ὅσας ἐγὼ ἐντέλλοµαί σοι σήµερον, καὶ ἐλεύσονται ἐπὶ σὲ πᾶσαι αἱ κατάραι αὗται καὶ καταλήµψονταί σε.						
