book	chapter	verse	Bohairic	Sahidic	English	Greek	Fayyumic	Akhmimic	OldBohairic	Mesokemic	DialectP	Lycopolitan
Deuteronomy	15	18	 ⲛ̀ⲛⲉϥϣⲱⲡⲓ ⲉϥⲛⲁϣⲧ ⲙ̀ⲡⲉⲕⲙ̀ⲑⲟ ⲁⲕϣⲁⲛⲟⲩⲟⲣⲡⲟⲩ ⲉⲩⲟⲓ ⲛ̀ⲣⲉⲙϩⲉ ⲉ̀ⲃⲟⲗ ϩⲁⲣⲟⲕ ϫⲉ ⲁⲩⲉⲣⲃⲱⲕ ⲛⲁⲕ ⲛ̀ⲟⲩⲃⲉⲭⲉ ⲛ̀ⲣⲟⲙⲡⲓ ⲛ̀ⲧⲉ ⲟⲩⲣⲉⲙⲃⲉⲭⲉ ⲛ̀ⲋ̅ ⲛ̀ⲣⲟⲙⲡⲓ ⲟⲩⲟϩ ⲉϥⲉ̀ⲥⲙⲟⲩ ⲉ̀ⲣⲟⲕ ⲛ̀ϫⲉ ⲡϭ̅ⲥ̅ ⲡⲉⲕⲛⲟⲩϯ ϧⲉⲛ ϩⲱⲃ ⲛⲓⲃⲉⲛ ⲉⲧⲉⲕⲛⲁⲁⲓⲧⲟⲩ		 It shall not seem hard to thee when they are sent out free from thee, because thy servant has served thee six years according to the annual hire of a hireling; so the Lord thy God shall bless thee in all things whatsoever thou mayest do.	 οὐ σκληρὸν ἔσται ἐναντίον σου ἐξαποστελλοµένων αὐτῶν ἐλευθέρων ἀπὸ σοῦ, ὅτι ἐφέτειον µισθὸν τοῦ µισθωτοῦ ἐδούλευσέν σοι ἓξ ἔτη· καὶ εὐλογήσει σε κύριος ὁ θεός σου ἐν πᾶσιν, οἷς ἐὰν ποιῇς.						
Deuteronomy	15	19	 ϣⲁⲙⲓⲥⲓ ⲛⲓⲃⲉⲛ ⲉⲧⲟⲩⲛⲁⲙⲁⲥⲟⲩ ⲛⲁⲕ ϧⲉⲛ ⲛⲉⲕⲉϩⲱⲟⲩ ⲛⲉⲙ ⲛⲉⲕⲉⲥⲱⲟⲩ ⲛⲓϩⲱⲟⲩⲧ ⲉⲕⲉ̀ⲧⲟⲩⲃⲱⲟⲩ ⲙ̀ⲡϭ̅ⲥ̅ ⲡⲉⲕⲛⲟⲩϯ ⲛ̀ⲛⲉⲕⲉⲣϩⲱⲃ ϧⲉⲛ ⲡⲉⲕϣⲁⲙⲓⲥⲓ ⲙ̀ⲙⲁⲥⲓ ⲟⲩⲟϩ ⲛ̀ⲛⲉⲕϧⲱⲕ ⲙ̀ⲡⲓϣⲁⲙⲓⲥⲓ ⲛ̀ⲧⲉ ⲛⲉⲕⲉⲥⲱⲟⲩ		 Every first-born that shall be born among thy kine and thy sheep, thou shalt sanctify the males to the Lord thy God; thou shalt not work with thy first-born calf, and thou shalt not shear the first-born of thy sheep.	 Πᾶν πρωτότοκον, ὃ ἐὰν τεχθῇ ἐν τοῖς βουσίν σου καὶ ἐν τοῖς προβάτοις σου, τὰ ἀρσενικά, ἁγιάσεις κυρίῳ τῷ θεῷ σου· οὐκ ἐργᾷ ἐν τῷ πρωτοτόκῳ µόσχῳ σου καὶ οὐ µὴ κείρῃς τὸ πρωτότοκον τῶν προβάτων σου·						
Deuteronomy	15	20	 ⲁⲗⲗⲁ ⲉⲕⲉ̀ⲟⲩⲟⲙϥ ⲙ̀ⲡⲉⲙ̀ⲑⲟ ⲙ̀ⲡϭ̅ⲥ̅ ⲡⲉⲕⲛⲟⲩϯ ⲛ̀ϯⲣⲟⲙⲡⲓ ϩⲁⲧϩⲏ ⲛ̀ϯⲣⲟⲙⲡⲓ ϧⲉⲛ ⲡⲓⲙⲁ ⲉⲧⲉ ⲡϭ̅ⲥ̅ ⲡⲉⲕⲛⲟⲩϯ ⲛⲁⲥⲟⲧⲡϥ ⲛ̀ⲑⲟⲕ ⲛⲉⲙ ⲡⲉⲕⲏⲓ ⲧⲏⲣϥ		 Thou shalt eat it before the Lord year by year in the place which the Lord thy God shall choose, thou and thy house.	 ἔναντι κυρίου φάγῃ αὐτὸ ἐνιαυτὸν ἐξ ἐνιαυτοῦ ἐν τῷ τόπῳ, ᾧ ἐὰν ἐκλέξηται κύριος ὁ θεός σου, σὺ καὶ ὁ οἶκός σου.						
Deuteronomy	15	21	 ⲉ̀ϣⲱⲡ ⲇⲉ ⲉ̀ⲟⲩⲟⲛ ⲁϭⲛⲓ ϩⲓⲱⲧϥ ⲓⲉ ⲟⲩϭⲁⲗⲉ ⲡⲉ ⲓⲉ ⲟⲩⲃⲉⲗⲗⲉ ⲡⲉ ⲓⲉ ⲁϭⲛⲓ ⲛⲓⲃⲉⲛ ⲉⲧϩⲱⲟⲩ ⲛ̀ⲛⲉⲕϣⲁⲧϥ ⲙ̀ⲡϭ̅ⲥ̅ ⲡⲉⲕⲛⲟⲩϯ		 And if there be in it a blemish, if it be lame or blind, an evil blemish, thou shalt not sacrifice it to the Lord thy God.	 ἐὰν δὲ ᾖ ἐν αὐτῷ µῶµος, χωλὸν ἢ τυφλὸν ἢ καὶ πᾶς µῶµος πονηρός, οὐ θύσεις αὐτὸ κυρίῳ τῷ θεῷ σου·						
Deuteronomy	15	22	 ⲉⲕⲉ̀ⲟⲩⲟⲙϥ ϧⲉⲛ ⲛⲉⲕⲃⲁⲕⲓ ⲫⲏ ⲉⲧϭⲁϧⲉⲙ ⲛ̀ϧⲏⲧⲕ ⲛⲉⲙ ⲫⲏ ⲉⲧⲧⲟⲩⲃⲏⲟⲩⲧ ⲉⲩⲉ̀ⲟⲩⲱⲙ ⲉⲩⲥⲟⲡ ⲙ̀ⲫⲣⲏϯ ⲛ̀ⲟⲩϭⲁϩⲥⲓ ⲓⲉ ⲟⲩⲉⲓⲟⲩⲗ		 Thou shalt eat it in thy cities; the unclean in thee and the clean shall eat it in like manner, as the doe or the stag.	 ἐν ταῖς πόλεσίν σου φάγῃ αὐτό, ὁ ἀκάθαρτος ἐν σοὶ καὶ ὁ καθαρὸς ὡσαύτως ἔδεται ὡς δορκάδα ἢ ἔλαφον·						
Deuteronomy	15	23	 ⲡⲗⲏⲛ ⲡⲥⲛⲟϥ ⲛ̀ⲛⲉⲧⲉⲛⲟⲩⲟⲙϥ ⲉⲣⲉⲧⲉⲛⲉ̀ⲫⲟⲛϥ ⲉ̀ⲃⲟⲗ ϩⲓϫⲉⲛ ⲡⲓⲕⲁϩⲓ ⲙ̀ⲫⲣⲏϯ ⲛ̀ⲟⲩⲙⲱⲟⲩ		 Only ye shall not eat the blood; thou shalt pour it out on the earth as water.	 πλὴν τὸ αἷµα οὐ φάγεσθε, ἐπὶ τὴν γῆν ἐκχεεῖς αὐτὸ ὡς ὕδωρ.						
Deuteronomy	16	1	 ⲁⲣⲉϩ ⲉ̀ⲡⲓⲁⲃⲟⲧ ⲛ̀ⲧⲉ ⲛⲓⲃⲉⲣⲓ ⲟⲩⲟϩ ⲉⲕⲉ̀ⲓⲣⲓ ⲙ̀ⲡⲓⲡⲁⲥⲭⲁ ⲛ̀ⲧⲉ ⲡϭ̅ⲥ̅ ⲡⲉⲕⲛⲟⲩϯ ϫⲉ ϧⲉⲛ ⲡⲓⲁⲃⲟⲧ ⲛ̀ⲧⲉ ⲛⲓⲃⲉⲣⲓ ⲁⲕⲓ̀ ⲉ̀ⲃⲟⲗ ϧⲉⲛ ⲡⲕⲁϩⲓ ⲛ̀ⲭⲏⲙⲓ ⲙ̀ⲡⲓⲉϫⲱⲣϩ		 Observe the month of new corn, and thou shalt sacrifice the passover to the Lord thy God; because in the month of new corn thou camest out of Egypt by night.	 Φύλαξαι τὸν µῆνα τῶν νέων καὶ ποιήσεις τὸ πασχα κυρίῳ τῷ θεῷ σου, ὅτι ἐν τῷ µηνὶ τῶν νέων ἐξῆλθες ἐξ Αἰγύπτου νυκτός.						
Deuteronomy	16	2	 ⲟⲩⲟϩ ⲉⲕⲉ̀ϣⲱⲧ ⲙ̀ⲡⲓⲡⲁⲥⲭⲁ ⲛ̀ⲧⲉ ⲡϭ̅ⲥ̅ ⲡⲉⲕⲛⲟⲩϯ ϩⲁⲛⲉⲥⲱⲟⲩ ⲛⲉⲙ ϩⲁⲛⲙⲁⲥⲓ ϧⲉⲛ ⲡⲓⲙⲁ ⲉⲧⲉϥⲛⲁⲥⲟⲧⲡϥ ⲛ̀ϫⲉ ⲡϭ̅ⲥ̅ ⲡⲉⲕⲛⲟⲩϯ ⲉ̀ⲣⲟϥ ⲉ̀ⲙⲟⲩϯ ⲉ̀ⲡⲉϥⲣⲁⲛ ⲙ̀ⲙⲁⲩ		 And thou shalt sacrifice the passover to the Lord thy God, sheep and oxen in the place which the Lord thy God shall choose to have his name called upon it.	 καὶ θύσεις τὸ πασχα κυρίῳ τῷ θεῷ σου πρόβατα καὶ βόας ἐν τῷ τόπῳ, ᾧ ἐὰν ἐκλέξηται κύριος ὁ θεός σου αὐτὸν ἐπικληθῆναι τὸ ὄνοµα αὐτοῦ ἐκεῖ.						
Deuteronomy	16	3	 ⲛ̀ⲛⲉⲕⲟⲩⲉⲙ ϣⲉⲙⲏⲣ ⲛ̀ϧⲏⲧϥ ⲉⲕⲉ̀ⲟⲩⲉⲙ ⲁⲧϣⲉⲙⲏⲣ ⲛ̀ϧⲏⲧϥ ⲛ̀ⲍ̅ ⲛ̀ⲉϩⲟⲟⲩ ⲟⲩⲱⲓⲕ ⲛ̀ⲧϩⲉⲙⲕⲟ ϫⲉ ϧⲉⲛ ⲟⲩⲓⲏⲥ ⲁⲣⲉⲧⲉⲛⲓ̀ ⲉ̀ⲃⲟⲗ ϧⲉⲛ ⲡⲕⲁϩⲓ ⲛ̀ⲭⲏⲙⲓ ϩⲓⲛⲁ ⲛ̀ⲧⲉⲧⲉⲛⲉⲣⲫⲙⲉⲩⲓ ⲙ̀ⲡⲓⲉϩⲟⲟⲩ ⲛ̀ⲧⲉ ⲡⲉⲧⲉⲛϫⲓⲛⲓ ⲉ̀ⲃⲟⲗ ϧⲉⲛ ⲡⲕⲁϩⲓ ⲛ̀ⲭⲏⲙⲓ ⲛ̀ⲛⲓⲉϩⲟⲟⲩ ⲧⲏⲣⲟⲩ ⲛ̀ⲧⲉ ⲡⲉⲧⲉⲛϫⲓⲛⲱⲛϧ		 Thou shalt not eat leaven with it; seven days shalt thou eat unleavened bread with it, bread of affliction, because ye came forth out of Egypt in haste; that ye may remember the day of your coming forth out of the land of Egypt all the days of your life.	 οὐ φάγῃ ἐπ’ αὐτοῦ ζύµην· ἑπτὰ ἡµέρας φάγῃ ἐπ’ αὐτοῦ ἄζυµα, ἄρτον κακώσεως, ὅτι ἐν σπουδῇ ἐξήλθετε ἐξ Αἰγύπτου· ἵνα µνησθῆτε τὴν ἡµέραν τῆς ἐξοδίας ὑµῶν ἐκ γῆς Αἰγύπτου πάσας τὰς ἡµέρας τῆς ζωῆς ὑµῶν.						
Deuteronomy	16	4	 ⲛ̀ⲛⲉ ϣⲉⲙⲏⲣ ⲟⲩⲟⲛϩϥ ϧⲉⲛ ⲛⲉⲕϭⲓⲏ ⲧⲏⲣⲟⲩ ⲛ̀ⲍ̅ ⲛ̀ⲉϩⲟⲟⲩ ⲟⲩⲟϩ ⲛ̀ⲛⲉ ⲁϥ ⲉⲛⲕⲟⲧ ⲉ̀ⲃⲟⲗ ϧⲉⲛ ⲛⲏ ⲉⲧⲉⲕⲛⲁϣⲁⲧⲟⲩ ⲛ̀ϩⲁⲛⲁⲣⲟⲩϩⲓ ⲙ̀ⲡⲓⲉϩⲟⲟⲩ ⲛ̀ϩⲟⲩⲓⲧ ⲉⲧⲟⲟⲩⲓ		 Leaven shall not be seen with thee in all thy borders for seven days, and there shall not be left of the flesh which thou shalt sacrifice at even on the first day until the morning.	 οὐκ ὀφθήσεταί σοι ζύµη ἐν πᾶσι τοῖς ὁρίοις σου ἑπτὰ ἡµέρας, καὶ οὐ κοιµηθήσεται ἀπὸ τῶν κρεῶν, ὧν ἐὰν θύσῃς τὸ ἑσπέρας τῇ ἡµέρᾳ τῇ πρώτῃ, εἰς τὸ πρωί.						
Deuteronomy	16	5	 ⲛ̀ⲛⲉⲕϣϫⲉⲙϫⲟⲙ ⲛ̀ϣⲁⲧ ⲡⲓⲡⲁⲥⲭⲁ ϧⲉⲛ ⲟⲩⲓ ⲛ̀ⲛⲉⲕⲃⲁⲕⲓ ⲉⲧⲉ ⲡϭ̅ⲥ̅ ⲡⲉⲕⲛⲟⲩϯ ⲛⲁⲧⲏⲓⲧⲟⲩ ⲛⲁⲕ		 thou shalt not have power to sacrifice the passover in any of the cities, which the Lord thy God gives thee.	 οὐ δυνήσῃ θῦσαι τὸ πασχα ἐν οὐδεµιᾷ τῶν πόλεών σου, ὧν κύριος ὁ θεός σου δίδωσίν σοι,						
Deuteronomy	16	6	 ⲁⲗⲗⲁ ϧⲉⲛ ⲡⲓⲙⲁ ⲉⲧⲉ ⲡϭ̅ⲥ̅ ⲡⲉⲕⲛⲟⲩϯ ⲛⲁⲥⲟⲧⲡϥ ⲉ̀ⲙⲟⲩϯ ⲉ̀ⲡⲉϥⲣⲁⲛ ⲙ̀ⲙⲁⲩ ⲉⲕⲉ̀ϣⲱⲧ ⲙ̀ⲡⲓⲡⲁⲥⲭⲁ ⲙ̀ⲙⲁⲩ ⲙ̀ⲫⲛⲁⲩ ⲛ̀ⲣⲟⲩϩⲓ ⲉⲣⲉ ⲫⲣⲏ ⲛⲁϩⲱⲧⲡ ⲕⲁⲧⲁ ⲡⲓⲥⲏⲟⲩ ⲉⲧⲁⲕⲓ̀ ⲉ̀ⲃⲟⲗ ϧⲉⲛ ⲡⲕⲁϩⲓ ⲛ̀ⲭⲏⲙⲓ		 But in the place which the Lord thy God shall choose, to have his name called there, thou shalt sacrifice the passover at even at the setting of the sun, at the time when thou camest out of Egypt.	 ἀλλ’ ἢ εἰς τὸν τόπον, ὃν ἐὰν ἐκλέξηται κύριος ὁ θεός σου ἐπικληθῆναι τὸ ὄνοµα αὐτοῦ ἐκεῖ, θύσεις τὸ πασχα ἑσπέρας πρὸς δυσµὰς ἡλίου ἐν τῷ καιρῷ, ᾧ ἐξῆλθες ἐξ Αἰγύπτου,						
Deuteronomy	16	7	 ⲉⲕⲉ̀ⲫⲓⲥⲓ ⲟⲩⲟϩ ⲉⲕⲉ̀ϫⲟϥϫⲉϥ ⲙ̀ⲡⲓⲁϥ ⲟⲩⲟϩ ⲉⲕⲉ̀ⲟⲩⲱⲙ ϧⲉⲛ ⲡⲓⲙⲁ ⲉⲧⲉϥⲛⲁⲥⲟⲧⲡϥ ⲛ̀ϫⲉ ⲡϭ̅ⲥ̅ ⲡⲉⲕⲛⲟⲩϯ ⲉⲕⲉ̀ⲕⲟⲧⲕ ⲉⲧⲟⲟⲩⲓ ⲉⲕⲉ̀ϣⲉ ⲛⲁⲕ ⲉ̀ⲛⲉⲕⲏⲟⲩ		 And thou shalt boil and roast and eat it in the place, which the Lord thy God shall choose; and thou shalt return in the morning, and go to thy house.	 καὶ ἑψήσεις καὶ ὀπτήσεις καὶ φάγῃ ἐν τῷ τόπῳ, ᾧ ἐὰν ἐκλέξηται κύριος ὁ θεός σου αὐτόν, καὶ ἀποστραφήσῃ τὸ πρωὶ καὶ ἀπελεύσῃ εἰς τοὺς οἴκους σου.						
Deuteronomy	16	8	 ⲋ̅ ⲛ̀ⲉϩⲟⲟⲩ ⲉⲕⲉ̀ⲟⲩⲉⲙ ⲁⲧϣⲉⲙⲏⲣ ⲟⲩⲟϩ ϧⲉⲛ ⲡⲓⲉϩⲟⲟⲩ ⲙ̀ⲙⲁϩⲍ̅ ⲟⲩϫⲓⲛⲓ̀ ⲉ̀ⲃⲟⲗ ⲡϣⲁⲓ ⲙ̀ⲡϭ̅ⲥ̅ ⲡⲉⲕⲛⲟⲩϯ ⲛ̀ⲛⲉⲕⲉⲣ ϩⲗⲓ ⲛ̀ϩⲱⲃ ⲛ̀ϧⲏⲧϥ ⲉ̀ⲃⲏⲗ ⲉ̀ⲛⲏ ⲉ̀ϣⲁⲩⲁⲓⲧⲟⲩ ⲛ̀ⲛⲟⲩⲯⲩⲭⲏ		 Six days shalt thou eat unleavened bread, and on the seventh day is a holiday, a feast to the Lord thy God: thou shalt not do in it any work, save what must be done by any one.	 ἓξ ἡµέρας φάγῃ ἄζυµα, καὶ τῇ ἡµέρᾳ τῇ ἑβδόµῃ ἐξόδιον, ἑορτὴ κυρίῳ τῷ θεῷ σου· οὐ ποιήσεις ἐν αὐτῇ πᾶν ἔργον πλὴν ὅσα ποιηθήσεται ψυχῇ. —						
Deuteronomy	16	9	 ⲍ̅ ⲛ̀ⲁⲛⲍ̅ ⲉⲩϫⲏⲕ ⲉⲕⲉ̀ⲟⲡⲟⲩ ⲛⲁⲕ ⲉ̀ⲁⲕⲉⲣϩⲏⲧⲥ ⲛ̀ϩⲓⲟⲥϧ ϧⲉⲛ ⲡⲱⲥϧ ⲉⲕⲉ̀ⲉⲣϩⲏⲧⲥ ⲛ̀ⲱⲡ ⲙ̀ⲡⲓⲍ̅ ⲛ̀ⲁⲛⲍ̅		 Seven weeks shalt thou number to thyself; when thou hast begun to put the sickle to the corn, thou shalt begin to number seven weeks.	 ἑπτὰ ἑβδοµάδας ὁλοκλήρους ἐξαριθµήσεις σεαυτῷ· ἀρξαµένου σου δρέπανον ἐπ’ ἀµητὸν ἄρξῃ ἐξαριθµῆσαι ἑπτὰ ἑβδοµάδας.						
Deuteronomy	16	10	 ⲟⲩⲟϩ ⲉⲕⲉ̀ⲓⲣⲓ ⲛ̀ⲟⲩϣⲁⲓ ⲛ̀ⲧⲉ ⲛⲓⲁⲛⲍ̅ ⲙ̀ⲡϭ̅ⲥ̅ ⲡⲉⲕⲛⲟⲩϯ ⲕⲁⲧⲁ ⲫⲣⲏϯ ⲉⲧⲉ ⲧⲉⲕϫⲓϫ ϫⲉⲙϫⲟⲙ ⲉ̀ⲣⲟϥ ⲛⲏ ⲉⲧⲉϥⲛⲁⲁⲓⲧⲟⲩ ⲛⲁⲕ ⲕⲁⲧⲁ ⲫⲣⲏϯ ⲉⲧⲁϥⲥⲙⲟⲩ ⲉ̀ⲣⲟⲕ ⲛ̀ϫⲉ ⲡϭ̅ⲥ̅ ⲡⲉⲕⲛⲟⲩϯ		 And thou shalt keep the feast of weeks to the Lord thy God, accordingly as thy hand has power in as many things as the Lord thy God shall give thee.	 καὶ ποιήσεις ἑορτὴν ἑβδοµάδων κυρίῳ τῷ θεῷ σου καθότι ἡ χείρ σου ἰσχύει, ὅσα ἂν δῷ σοι, καθότι ηὐλόγησέν σε κύριος ὁ θεός σου·						
Deuteronomy	16	11	 ⲉⲕⲉ̀ⲟⲩⲛⲟϥ ⲙ̀ⲡⲉⲙ̀ⲑⲟ ⲙ̀ⲡϭ̅ⲥ̅ ⲡⲉⲕⲛⲟⲩϯ ⲛ̀ⲑⲟⲕ ⲛⲉⲙ ⲡⲉⲕϣⲏⲣⲓ ⲛⲉⲙ ⲧⲉⲕϣⲉⲣⲓ ⲛⲉⲙ ⲡⲉⲕⲃⲱⲕ ⲛⲉⲙ ⲧⲉⲕⲃⲱⲕⲓ ⲛⲉⲙ ⲡⲓⲗⲉⲩⲓⲧⲏⲥ ⲉⲧϧⲉⲛ ⲛⲉⲕⲃⲁⲕⲓ ⲛⲉⲙ ⲡⲓϣⲉⲙⲙⲟ ⲛⲉⲙ ⲡⲓⲟⲣⲫⲁⲛⲟⲥ ⲛⲉⲙ ϯⲭⲏⲣⲁ ⲉⲧϧⲉⲛ ⲑⲏⲛⲟⲩ ϧⲉⲛ ⲡⲓⲙⲁ ⲉⲧⲉϥⲛⲁⲥⲟⲧⲡϥ ⲛⲁϥ ⲛ̀ϫⲉ ⲡϭ̅ⲥ̅ ⲡⲉⲕⲛⲟⲩϯ ⲉⲑⲣⲟⲩⲙⲟⲩϯ ⲉ̀ⲡⲉϥⲣⲁⲛ ⲙ̀ⲙⲁⲩ		 And thou shalt rejoice before the Lord thy God, thou and thy son, and thy daughter, thy man-servant and thy maid-servant, and the Levite, and the stranger, and the orphan, and the widow which dwells among you, in whatsoever place the Lord thy God shall choose, that his name should be called there.	 καὶ εὐφρανθήσῃ ἐναντίον κυρίου τοῦ θεοῦ σου, σὺ καὶ ὁ υἱός σου καὶ ἡ θυγάτηρ σου, ὁ παῖς σου καὶ ἡ παιδίσκη σου καὶ ὁ Λευίτης ὁ ἐν ταῖς πόλεσίν σου καὶ ὁ προσήλυτος καὶ ὁ ὀρφανὸς καὶ ἡ χήρα ἡ ἐν ὑµῖν, ἐν τῷ τόπῳ, ᾧ ἐὰν ἐκλέξηται κύριος ὁ θεός σου ἐπικληθῆναι τὸ ὄνοµα αὐτοῦ ἐκεῖ,						
Deuteronomy	16	12	 ⲟⲩⲟϩ ⲉⲕⲉ̀ⲉⲣⲫⲙⲉⲩⲓ ϫⲉ ⲛⲁⲕⲟⲓ ⲙ̀ⲃⲱⲕ ⲡⲉ ϧⲉⲛ ⲡⲕⲁϩⲓ ⲛ̀ⲭⲏⲙⲓ ⲟⲩⲟϩ ⲉⲕⲉ̀ⲁⲣⲉϩ ⲟⲩⲟϩ ⲉⲕⲉ̀ⲓⲣⲓ ⲛ̀ⲛⲁⲓⲉⲛⲧⲟⲗⲏ ⲧⲏⲣⲟⲩ		 And thou shalt remember that thou wast a servant in the land of Egypt, and thou shalt observe and do these commands.	 καὶ µνησθήσῃ ὅτι οἰκέτης ἦσθα ἐν γῇ Αἰγύπτῳ, καὶ φυλάξῃ καὶ ποιήσεις τὰς ἐντολὰς ταύτας. —						
Deuteronomy	16	13	 ⲟⲩϣⲁⲓ ⲛ̀ⲧⲉ ⲛⲓⲥⲕⲩⲛⲏ ⲉⲕⲉ̀ⲁⲓϥ ⲛ̀ⲍ̅ ⲛ̀ⲉϩⲟⲟⲩ ϧⲉⲛ ⲡϫⲓⲛⲑⲣⲉⲕⲑⲱⲟⲩϯ ⲉ̀ϧⲟⲩⲛ ⲉ̀ⲃⲟⲗ ϧⲉⲛ ⲛⲉⲕϭⲛⲱⲟⲩ ⲛⲉⲙ ⲉ̀ⲃⲟⲗ ϧⲉⲛ ⲧⲉⲕϩⲣⲱⲧ		 Thou shalt keep for thyself the feast of tabernacles seven days, when thou gatherest in thy produce from thy corn-floor and thy wine-press.	 ἑορτὴν σκηνῶν ποιήσεις σεαυτῷ ἑπτὰ ἡµέρας ἐν τῷ συναγαγεῖν σε ἐκ τοῦ ἅλωνός σου καὶ ἀπὸ τῆς ληνοῦ σου·						
Deuteronomy	16	14	 ⲉⲕⲉ̀ⲟⲩⲛⲟϥ ϧⲉⲛ ⲡⲉⲕϣⲁⲓ ⲛ̀ⲑⲟⲕ ⲛⲉⲙ ⲡⲉⲕϣⲏⲣⲓ ⲛⲉⲙ ⲧⲉⲕϣⲉⲣⲓ ⲡⲉⲕⲃⲱⲕ ⲛⲉⲙ ⲧⲉⲕⲃⲱⲕⲓ ⲛⲉⲙ ⲡⲓⲗⲉⲩⲓⲧⲏⲥ ⲛⲉⲙ ⲡⲓϣⲉⲙⲙⲟ ⲛⲉⲙ ⲡⲓⲟⲣⲫⲁⲛⲟⲥ ⲛⲉⲙ ϯⲭⲏⲣⲁ ⲛ̀ϧⲣⲏⲓ ϧⲉⲛ ⲛⲉⲕⲃⲁⲕⲓ		 And thou shalt rejoice in thy feast, thou, and thy son, and thy daughter, thy man-servant, and thy maid-servant, and the Levite, and the stranger, and the orphan, and the widow that is in thy cities.	 καὶ εὐφρανθήσῃ ἐν τῇ ἑορτῇ σου, σὺ καὶ ὁ υἱός σου καὶ ἡ θυγάτηρ σου, ὁ παῖς σου καὶ ἡ παιδίσκη σου καὶ ὁ Λευίτης καὶ ὁ προσήλυτος καὶ ὁ ὀρφανὸς καὶ ἡ χήρα ἡ οὖσα ἐν ταῖς πόλεσίν σου.						
Deuteronomy	16	15	 ⲍ̅ ⲛ̀ⲉϩⲟⲟⲩ ⲛ̀ϣⲁⲓ ⲉⲕⲉ̀ⲁⲓⲧⲟⲩ ⲙ̀ⲡϭ̅ⲥ̅ ⲡⲉⲕⲛⲟⲩϯ ϧⲉⲛ ⲡⲓⲙⲁ ⲉⲧⲉ ⲡϭ̅ⲥ̅ ⲡⲉⲕⲛⲟⲩϯ ⲛⲁⲥⲟⲧⲡϥ ⲛⲁⲕ ⲉ̀ϣⲱⲡ ⲇⲉ ⲁⲣⲉϣⲁⲛ ⲡϭ̅ⲥ̅ ⲡⲉⲕⲛⲟⲩϯ ⲥⲙⲟⲩ ⲉ̀ⲣⲟⲕ ϧⲉⲛ ⲛⲉⲕⲟⲩⲧⲁϩ ⲧⲏⲣⲟⲩ ⲛⲉⲙ ⲛ̀ϧⲣⲏⲓ ϧⲉⲛ ⲛⲓϩⲃⲏⲟⲩⲓ ⲧⲏⲣⲟⲩ ⲛ̀ⲧⲉ ⲛⲉⲕϫⲓϫ ⲟⲩⲟϩ ⲉⲕⲉ̀ϣⲱⲡⲓ ⲉⲕⲟⲩⲛⲟϥ		 Seven days shalt thou keep a feast to the Lord thy God in the place which the Lord thy God shall choose for himself; and if the Lord thy God shall bless thee in all thy fruits, and in every work of thy hands, then thou shalt rejoice.	 ἑπτὰ ἡµέρας ἑορτάσεις κυρίῳ τῷ θεῷ σου ἐν τῷ τόπῳ, ᾧ ἐὰν ἐκλέξηται κύριος ὁ θεός σου αὐτῷ· ἐὰν δὲ εὐλογήσῃ σε κύριος ὁ θεός σου ἐν πᾶσιν τοῖς γενήµασίν σου καὶ ἐν παντὶ ἔργῳ τῶν χειρῶν σου, καὶ ἔσῃ εὐφραινόµενος. —						
Deuteronomy	16	16	 ⲅ̅ ⲛ̀ⲥⲏⲟⲩ ⲛ̀ϯⲣⲟⲙⲡⲓ ⲉϥⲉ̀ⲟⲩⲟⲛϩϥ ⲛ̀ϫⲉ ϩⲱⲟⲩⲧ ⲛⲓⲃⲉⲛ ⲛ̀ⲧⲁⲕ ⲙ̀ⲡⲉⲙ̀ⲑⲟ ⲙ̀ⲡϭ̅ⲥ̅ ⲡⲉⲕⲛⲟⲩϯ ϧⲉⲛ ⲡⲓⲙⲁ ⲉⲧⲉϥⲛⲁⲥⲟⲧⲡϥ ⲛⲁϥ ⲛ̀ϫⲉ ⲡϭ̅ⲥ̅ ⲡⲉⲕⲛⲟⲩϯ ϧⲉⲛ ⲡϣⲁⲓ ⲛ̀ⲧⲉ ⲛⲓⲁⲧϣⲉⲙⲏⲣ ⲛⲉⲙ ϧⲉⲛ ⲡϣⲁⲓ ⲛ̀ⲧⲉ ⲛⲓⲁⲛⲍ̅ ⲛⲉⲙ ϧⲉⲛ ⲡϣⲁⲓ ⲛ̀ⲧⲉ ϯⲥⲕⲏⲛⲟⲡⲏⲕⲓⲁ ⲛ̀ⲛⲉⲕⲟⲩⲟⲛϩⲕ ⲙ̀ⲡⲉⲙ̀ⲑⲟ ⲙ̀ⲡϭ̅ⲥ̅ ⲡⲉⲕⲛⲟⲩϯ ⲉⲕϣⲟⲩⲓⲧ		 Three times in the year shall all thy males appear before the Lord thy God in the place which the Lord shall choose in the feast of unleavened bread, and in the feast of weeks, and in the feast of tabernacles: thou shalt not appear before the Lord thy God empty.	 τρεῖς καιροὺς τοῦ ἐνιαυτοῦ ὀφθήσεται πᾶν ἀρσενικόν σου ἐναντίον κυρίου τοῦ θεοῦ σου ἐν τῷ τόπῳ, ᾧ ἐὰν ἐκλέξηται αὐτὸν κύριος, ἐν τῇ ἑορτῇ τῶν ἀζύµων καὶ ἐν τῇ ἑορτῇ τῶν ἑβδοµάδων καὶ ἐν τῇ ἑορτῇ τῆς σκηνοπηγίας. οὐκ ὀφθήσῃ ἐνώπιον κυρίου τοῦ θεοῦ σου κενός·						
Deuteronomy	16	17	 ⲡⲓⲟⲩⲁⲓ ⲡⲓⲟⲩⲁⲓ ⲕⲁⲧⲁ ϯϫⲟⲙ ⲛ̀ⲧⲉ ⲛⲉⲧⲉⲛϫⲓϫ ⲕⲁⲧⲁ ⲡⲓⲥⲙⲟⲩ ⲛ̀ⲧⲉ ⲡϭ̅ⲥ̅ ⲡⲉⲕⲛⲟⲩϯ ⲉⲧⲁϥⲧⲏⲓϥ ⲛⲁⲕ		 Each one according to his ability, according to the blessing of the Lord thy God which he has given thee.	 ἕκαστος κατὰ δύναµιν τῶν χειρῶν ὑµῶν κατὰ τὴν εὐλογίαν κυρίου τοῦ θεοῦ σου, ἣν ἔδωκέν σοι.						
Deuteronomy	16	18	 ⲉⲕⲉ̀ⲭⲱ ⲛⲁⲕ ⲛ̀ϩⲁⲛⲣⲉϥϯϩⲁⲡ ⲛⲉⲙ ϩⲁⲛⲥⲁϧ ⲛⲉⲙ ⲛⲉⲕⲃⲁⲕⲓ ⲧⲏⲣⲟⲩ ⲛⲏ ⲉⲧⲉ ⲡϭ̅ⲥ̅ ⲡⲉⲕⲛⲟⲩϯ ⲛⲁⲧⲏⲓⲧⲟⲩ ⲛⲁⲕ ⲕⲁⲧⲁ ⲛⲓⲫⲩⲗⲏ ⲟⲩⲟϩ ⲉⲩⲉ̀ϯϩⲁⲡ ⲉ̀ⲡⲓⲗⲁⲟⲥ ϧⲉⲛ ⲟⲩϩⲁⲡ ⲙ̀ⲙⲏⲓ		 Thou shalt make for thyself judges and officers in thy cities, which the Lord thy God gives thee in thy tribes, and they shall judge the people with righteous judgment:	 Κριτὰς καὶ γραµµατοεισαγωγεῖς καταστήσεις σεαυτῷ ἐν πάσαις ταῖς πόλεσίν σου, αἷς κύριος ὁ θεός σου δίδωσίν σοι, κατὰ φυλάς, καὶ κρινοῦσιν τὸν λαὸν κρίσιν δικαίαν.						
Deuteronomy	16	19	 ⲛ̀ⲛⲟⲩⲣⲓⲕⲓ ⲉ̀ⲃⲟⲗ ⲛ̀ⲟⲩϩⲁⲡ ⲟⲩⲇⲉ ⲛ̀ⲛⲟⲩⲥⲟⲩⲉⲛ ⲟⲩϩⲟ ⲟⲩⲇⲉ ⲛ̀ⲛⲟⲩϭⲓ ⲇⲱⲣⲟⲛ ⲛⲓⲇⲱⲣⲟⲛ ⲅⲁⲣ ϣⲁⲩϣⲑⲁⲙ ⲛ̀ⲛⲓⲃⲁⲗ ⲛ̀ⲧⲉ ⲛⲓⲥⲁⲃⲉⲩ ⲟⲩⲟϩ ϣⲁⲩⲧⲁⲕⲟ ⲛ̀ⲛⲓⲥⲁϫⲓ ⲛ̀ⲑⲙⲏⲓ		 they shall not wrest judgment, nor favour persons, nor receive a gift; for gifts blind the eyes of the wise, and pervert the words of the righteous.	 οὐκ ἐκκλινοῦσιν κρίσιν, οὐκ ἐπιγνώσονται πρόσωπον οὐδὲ λήµψονται δῶρον· τὰ γὰρ δῶρα ἐκτυφλοῖ ὀφθαλµοὺς σοφῶν καὶ ἐξαίρει λόγους δικαίων.						
Deuteronomy	16	20	 ϧⲉⲛ ⲟⲩⲙⲉⲑⲙⲏⲓ ⲉⲕⲉ̀ϭⲟϫⲓ ⲛ̀ⲥⲁ ⲡⲓⲇⲓⲕⲉⲟⲛ ϩⲓⲛⲁ ⲛ̀ⲧⲉⲕⲱⲛϧ ⲟⲩⲟϩ ⲛ̀ⲧⲉⲧⲉⲛϣⲉ ⲛⲱⲧⲉⲛ ⲉ̀ϧⲟⲩⲛ ⲛ̀ⲧⲉⲧⲉⲛⲉⲣⲕⲗⲏⲣⲟⲛⲟⲙⲓⲛ ⲙ̀ⲡⲓⲕⲁϩⲓ ⲫⲏ ⲉⲧⲉ ⲡϭ̅ⲥ̅ ⲡⲉⲕⲛⲟⲩϯ ⲛⲁⲧⲏⲓϥ ⲛⲁⲕ		 Thou shalt justly pursue justice, that ye may live, and go in and inherit the land which the Lord thy God gives thee.	 δικαίως τὸ δίκαιον διώξῃ, ἵνα ζῆτε καὶ εἰσελθόντες κληρονοµήσητε τὴν γῆν, ἣν κύριος ὁ θεός σου δίδωσίν σοι.						
Deuteronomy	16	21	 ⲛ̀ⲛⲉⲕϭⲉ ϣϣⲏⲛ ⲛⲁⲕ ⲉ̀ⲃⲟⲗ ϧⲉⲛ ϣϣⲏⲛ ⲛⲓⲃⲉⲛ ϧⲁⲧⲉⲛ ⲡⲓⲙⲁⲛ̀ⲉⲣϣⲱⲟⲩϣⲓ ⲛ̀ⲧⲉ ⲡϭ̅ⲥ̅ ⲡⲉⲕⲛⲟⲩϯ		 Thou shalt not plant for thyself a grove; thou shalt not plant for thyself any tree near the altar of thy God.	 Οὐ φυτεύσεις σεαυτῷ ἄλσος, πᾶν ξύλον, παρὰ τὸ θυσιαστήριον κυρίου τοῦ θεοῦ σου, ὃ ποιήσεις σεαυτῷ.						
Deuteronomy	16	22	 ⲛ̀ⲛⲉⲕⲧⲁϩⲟ ⲛⲁⲕ ⲛ̀ⲟⲩⲥⲧⲩⲗⲏ ⲛⲏ ⲉⲧⲁϥⲙⲉⲥⲧⲱⲟⲩ ⲛ̀ϫⲉ ⲡϭ̅ⲥ̅ ⲡⲉⲕⲛⲟⲩϯ		 Thou shalt not set up for thyself a pillar, which the Lord thy God hates.	 οὐ στήσεις σεαυτῷ στήλην, ἃ ἐµίσησεν κύριος ὁ θεός σου.						
Deuteronomy	17	1	 ⲛ̀ⲛⲉⲕϣⲉⲧ ⲟⲩⲙⲁⲥⲓ ⲓⲉ ⲟⲩⲉⲥⲱⲟⲩ ⲙ̀ⲡⲉⲙ̀ⲑⲟ ⲙ̀ⲡϭ̅ⲥ̅ ⲡⲉⲕⲛⲟⲩϯ ⲉ̀ⲟⲩⲟⲛ ⲁϭⲛⲓ ϩⲓⲱⲧϥ ⲥⲁϫⲓ ⲛⲓⲃⲉⲛ ⲉⲧϩⲱⲟⲩ ⲟⲩⲱⲣⲉⲃ ⲡⲉ ⲙ̀ⲡⲉⲙ̀ⲑⲟ ⲙ̀ⲡϭ̅ⲥ̅ ⲡⲉⲕⲛⲟⲩϯ		 Thou shalt not sacrifice to the Lord thy God a calf or a sheep, in which there is a blemish, or any evil thing; for it is an abomination to the Lord thy God.	 Οὐ θύσεις κυρίῳ τῷ θεῷ σου µόσχον ἢ πρόβατον, ἐν ᾧ ἐστιν ἐν αὐτῷ µῶµος, πᾶν ῥῆµα πονηρόν, ὅτι βδέλυγµα κυρίῳ τῷ θεῷ σού ἐστιν.						
Deuteronomy	17	2	 ⲉ̀ϣⲱⲡ ⲇⲉ ⲁⲩϣⲁⲛϫⲓⲙⲓ ⲛ̀ϧⲏⲧⲕ ϧⲉⲛ ⲟⲩⲓ ⲛ̀ⲛⲉⲕⲃⲁⲕⲓ ⲛⲏ ⲉⲧⲉ ⲡϭ̅ⲥ̅ ⲡⲉⲕⲛⲟⲩϯ ⲛⲁⲧⲏⲓϥ ⲛⲁⲕ ⲛ̀ⲟⲩⲣⲱⲙⲓ ⲓⲉ ⲟⲩⲥϩⲓⲙⲓ ⲉϥⲓⲣⲓ ⲙ̀ⲡⲓⲡⲉⲧϩⲱⲟⲩ ⲙ̀ⲡⲉⲙ̀ⲑⲟ ⲙ̀ⲡϭ̅ⲥ̅ ⲡⲉⲕⲛⲟⲩϯ ⲛ̀ⲧⲟⲩⲉⲣⲥⲁⲃⲟⲗ ⲛ̀ⲧⲉϥⲇⲓⲁⲑⲏⲕⲏ		 And if there should be found in any one of thy cities, which the Lord thy God gives thee, a man or a woman who shall do that which is evil before the Lord thy God, so as to transgress his covenant,	 Ἐὰν δὲ εὑρεθῇ ἐν σοὶ ἐν µιᾷ τῶν πόλεών σου, ὧν κύριος ὁ θεός σου δίδωσίν σοι, ἀνὴρ ἢ γυνή, ὅστις ποιήσει τὸ πονηρὸν ἐναντίον κυρίου τοῦ θεοῦ σου παρελθεῖν τὴν διαθήκην αὐτοῦ,						
Deuteronomy	17	3	 ⲟⲩⲟϩ ⲛ̀ⲧⲟⲩϣⲉ ⲛⲱⲟⲩ ⲛ̀ⲧⲟⲩϣⲉⲙϣⲓ ⲛ̀ϩⲁⲛⲕⲉⲛⲟⲩϯ ⲛ̀ⲧⲟⲩⲟⲩⲱϣⲧ ⲙ̀ⲙⲱⲟⲩ ⲡⲓⲣⲏ ⲛⲉⲙ ⲡⲓⲓⲟϩ ⲓⲉ ϩⲱⲃ ⲛⲓⲃⲉⲛ ϧⲉⲛ ⲡⲓⲥⲟⲗⲥⲉⲗ ⲛ̀ⲧⲉ ⲧⲫⲉ ⲛⲁⲓ ⲉⲧⲉ ⲙ̀ⲡⲓⲟⲩⲁϩⲥⲁϩⲛⲓ ⲉ̀ⲁⲓⲧⲟⲩ		 and they should go and serve other gods, and worship them, the sun, or the moon, or any of the host of heaven, which he commanded thee not to do,	 καὶ ἐλθόντες λατρεύσωσιν θεοῖς ἑτέροις καὶ προσκυνήσωσιν αὐτοῖς, τῷ ἡλίῳ ἢ τῇ σελήνῃ ἢ παντὶ τῶν ἐκ τοῦ κόσµου τοῦ οὐρανοῦ, ἃ οὐ προσέταξεν,						
Deuteronomy	17	4	 ⲟⲩⲟϩ ⲛ̀ⲧⲟⲩⲧⲁⲙⲟⲕ ⲉⲕⲉ̀ⲕⲱϯ ⲉ̀ⲙⲁϣⲱ ⲟⲩⲟϩ ϩⲏⲡⲡⲉ ⲧⲁⲫⲙⲏⲓ ⲁϥϣⲱⲡⲓ ⲛ̀ϫⲉ ⲡⲁⲓⲥⲁϫⲓ ⲁϥϣⲱⲡⲓ ⲛ̀ϫⲉ ⲡⲁⲓⲥⲱϥ ϧⲉⲛ ⲡⲓⲥ̅ⲗ̅		 and it be told thee, and thou shalt have enquired diligently, and, behold, the thing really took place, this abomination has been done in Israel;	 καὶ ἀναγγελῇ σοι, καὶ ἐκζητήσεις σφόδρα, καὶ ἰδοὺ ἀληθῶς γέγονεν τὸ ῥῆµα, γεγένηται τὸ βδέλυγµα τοῦτο ἐν Ισραηλ,						
