book	chapter	verse	Bohairic	Sahidic	English	Greek	Fayyumic	Akhmimic	OldBohairic	Mesokemic	DialectP	Lycopolitan
Deuteronomy	1	1	 ⲛⲁⲓ ⲛⲉ ⲛⲓⲥⲁϫⲓ ⲉⲧⲁϥⲥⲁϫⲓ ⲙ̀ⲙⲱⲟⲩ ⲛ̀ϫⲉ ⲙⲱⲩ̀ⲥⲏⲥ ⲛⲉⲙ ⲡⲓⲥ̅ⲗ̅ ⲧⲏⲣϥ ϩⲓⲙⲏⲣ ⲙ̀ⲡⲓⲓⲟⲣⲇⲁⲛⲏⲥ ⲛ̀ϩⲣⲏⲓ ϩⲓ ⲡϣⲁϥⲉ ⲥⲁⲛⲓⲙⲁⲛ̀ϩⲱⲧⲡ ϧⲁⲑⲟⲩⲟϥ ⲙ̀ⲫⲓⲟⲙ ⲛ̀ϩⲁϩ ⲟⲩⲧⲱϥ ⲙ̀ⲫⲁⲣⲣⲁⲛ ⲧⲟⲫⲉⲗ ⲛⲉⲙ ⲗⲟⲃⲟⲛⲁ ⲛⲉⲙ ⲁⲩⲗⲱⲛ ⲛⲉⲙ ⲕⲁⲧⲁⲕⲣⲩⲥⲉⲁ		 These are the words which Moses spoke to all Israel on this side Jordan in the desert towards the west near the Red Sea, between Pharan Tophol, and Lobon, and Aulon, and the gold works.	 Οὗτοι οἱ λόγοι, οὓς ἐλάλησεν Μωυσῆς παντὶ Ισραηλ πέραν τοῦ Ιορδάνου ἐν τῇ ἐρήµῳ πρὸς δυσµαῖς πλησίον τῆς ἐρυθρᾶς ἀνὰ µέσον Φαραν, Τοφολ καὶ Λοβον καὶ Αυλων καὶ Καταχρύσεα·						
Deuteronomy	1	2	 ⲓ̅ⲁ̅ ⲛ̀ⲉϩⲟⲟⲩ ⲉ̀ⲃⲟⲗ ϧⲉⲛ ⲭⲱⲣⲏⲃ ⲡⲓⲙⲱⲓⲧ ⲉ̀ⲡⲧⲱⲟⲩ ⲛ̀ⲥⲏⲓⲣ ϣⲁ ⲕⲁⲇⲏⲥ ⲃⲁⲣⲛⲏ		 It is a journey of eleven days from Choreb to mount Seir as far as Cades Barne.	 ἕνδεκα ἡµερῶν ἐν Χωρηβ ὁδὸς ἐπ’ ὄρος Σηιρ ἕως Καδης Βαρνη.						
Deuteronomy	1	3	 ⲟⲩⲟϩ ⲁⲥϣⲱⲡⲓ ϧⲉⲛ ϯⲙⲁϩⲙ̅ ⲛ̀ⲣⲟⲙⲡⲓ ϧⲉⲛ ⲡⲓⲙⲁϩⲓ̅ⲁ̅ ⲛ̀ⲁⲃⲟⲧ ⲛ̀ⲥⲟⲩⲁⲓ ⲙ̀ⲡⲓⲁⲃⲟⲧ ⲁϥⲥⲁϫⲓ ⲛ̀ϫⲉ ⲙⲱⲩ̀ⲥⲏⲥ ⲛⲉⲙ ⲛⲉⲛϣⲏⲣⲓ ⲧⲏⲣⲟⲩ ⲙ̀ⲡⲓⲥ̅ⲗ̅ ⲕⲁⲧⲁ ϩⲱⲃ ⲛⲓⲃⲉⲛ ⲉⲧⲁϥϩⲉⲛϩⲱⲛϥ ⲉ̀ⲣⲱⲟⲩ ⲉ̀ϫⲟⲧⲟⲩ ⲛⲱⲟⲩ ⲡϭ̅ⲥ̅ ⲫϯ		 And it came to pass in the fortieth year, in the eleventh month, on the first day of the month, Moses spoke to all the children of Israel, according to all things which the Lord commanded him for them:	 καὶ ἐγενήθη ἐν τῷ τεσσαρακοστῷ ἔτει ἐν τῷ ἑνδεκάτῳ µηνὶ µιᾷ τοῦ µηνὸς ἐλάλησεν Μωυσῆς πρὸς πάντας υἱοὺς Ισραηλ κατὰ πάντα, ὅσα ἐνετείλατο κύριος αὐτῷ πρὸς αὐτούς.						
Deuteronomy	1	4	 ⲙⲉⲛⲉⲛⲥⲁ ⲑⲣⲉϥϣⲁⲣⲓ ⲉ̀ⲥⲏⲱⲛ ⲡⲟⲩⲣⲟ ⲛ̀ⲧⲉ ⲛⲓⲁⲙⲟⲣⲣⲉⲟⲥ ⲫⲏ ⲉⲧⲁϥϣⲱⲡⲓ ϧⲉⲛ ⲉⲥⲉⲃⲱⲛ ⲛⲉⲙ ⲱⲅ ⲡⲟⲩⲣⲟ ⲛ̀ⲑⲃⲁⲥⲁⲛ ⲫⲏ ⲉⲧⲁϥϣⲱⲡⲓ ϧⲉⲛ ⲁⲥⲧⲁⲣⲱⲑ ⲛⲉⲙ ϧⲉⲛ ⲁⲇⲣⲁⲓ		 after he had smitten Seon king of the Amorites who dwelt in Esebon, and Og the king of Basan who dwelt in Astaroth and in Edrain;	 µετὰ τὸ πατάξαι Σηων βασιλέα Αµορραίων τὸν κατοικήσαντα ἐν Εσεβων καὶ Ωγ βασιλέα τῆς Βασαν τὸν κατοικήσαντα ἐν Ασταρωθ καὶ ἐν Εδραϊν						
Deuteronomy	1	5	 ⲫⲏ ⲉⲧⲁϥϣⲱⲡⲓ ϩⲓⲙⲏⲣ ⲙ̀ⲡⲓⲓⲟⲣⲇⲁⲛⲏⲥ ϧⲉⲛ ⲡⲕⲁϩⲓ ⲙ̀ⲙⲱⲁⲃ ⲧⲟⲧⲉ ⲁϥⲉⲣϩⲏⲧⲥ ⲛ̀ϫⲉ ⲙⲱⲩ̀ⲥⲏⲥ ⲉ̀ⲥⲁϫⲓ ⲙ̀ⲡⲁⲓⲛⲟⲙⲟⲥ ⲫⲁⲓ ⲉϥϫⲱ ⲙ̀ⲙⲟⲥ		 beyond Jordan in the land of Moab, Moses began to declare this law, saying,	 ἐν τῷ πέραν τοῦ Ιορδάνου ἐν γῇ Μωαβ ἤρξατο Μωυσῆς διασαφῆσαι τὸν νόµον τοῦτον λέγων						
Deuteronomy	1	6	 ϫⲉ ⲡϭ̅ⲥ̅ ⲡⲉⲛⲛⲟⲩϯ ⲁϥⲥⲁϫⲓ ⲛⲉⲙⲁⲛ ϧⲉⲛ ⲭⲱⲣⲏⲃ ⲉϥϫⲱ ⲙ̀ⲙⲟⲥ ϫⲉ ⲕⲏⲛ ⲉ̀ⲣⲱⲧⲉⲛ ⲉ̀ϣⲱⲡⲓ ϩⲓ ⲡⲁⲓⲧⲱⲟⲩ		 The Lord your God spoke to us in Choreb, saying, Let it suffice you to have dwelt so long in this mountain.	 Κύριος ὁ θεὸς ἡµῶν ἐλάλησεν ἡµῖν ἐν Χωρηβ λέγων Ἱκανούσθω ὑµῖν κατοικεῖν ἐν τῷ ὄρει τούτῳ·						
Deuteronomy	1	7	 ⲕⲉⲧ ⲑⲏⲛⲟⲩ ⲟⲩⲟϩ ϥⲁⲓ ⲙ̀ⲙⲱⲧⲉⲛ ⲛ̀ⲑⲱⲧⲉⲛ ⲙⲁϣⲉ ⲛⲱⲧⲉⲛ ⲉ̀ϧⲟⲩⲛ ⲉ̀ⲡⲧⲱⲟⲩ ⲛ̀ⲧⲉ ⲛⲓⲁⲡⲟⲣⲣⲉⲟⲥ ⲛⲉⲙ ϩⲁ ⲛⲏ ⲧⲏⲣⲟⲩ ⲉⲧϣⲟⲡ ϧⲉⲛ ⲁⲣⲁⲃⲁ ⲥⲟⲩⲧⲱⲟⲩ ⲛⲉⲙ ⲁⲩⲙⲉϣϣⲱⲧ ⲛⲉⲙ ⲥⲁ ⲡⲉⲙⲉⲛⲧ ⲛⲉⲙ ϯⲡⲁⲣⲁⲗⲓⲁ ⲡⲕⲁϩⲓ ⲛ̀ⲧⲉ ⲛⲓⲭⲁⲛⲁⲛⲉⲟⲥ ⲛⲉⲙ ⲡⲓⲁⲛⲧⲓⲗⲓⲃⲁⲛⲟⲥ ϣⲁ ⲡⲓⲁⲣⲟ ⲡⲓⲛⲓϣϯ ⲡⲓⲉⲩⲫⲣⲁⲧⲏⲥ		 Turn ye and depart and enter into the mountain of the Amorites, and go to all that dwell near about Araba, to the mountain and the plain and to the south, and the land of the Chananites near the sea, and Antilibanus, as far as the great river, the river Euphrates.	 ἐπιστράφητε καὶ ἀπάρατε ὑµεῖς καὶ εἰσπορεύεσθε εἰς ὄρος Αµορραίων καὶ πρὸς πάντας τοὺς περιοίκους Αραβα εἰς ὄρος καὶ πεδίον καὶ πρὸς λίβα καὶ παραλίαν, γῆν Χαναναίων καὶ Ἀντιλίβανον ἕως τοῦ ποταµοῦ τοῦ µεγάλου Εὐφράτου.						
Deuteronomy	1	8	 ⲁⲛⲁⲩ ⲓⲥ ⲁⲓϯ ⲙ̀ⲡⲓⲕⲁϩⲓ ⲙ̀ⲡⲉⲧⲉⲛⲙ̀ⲑⲟ ⲙⲁϣⲉ ⲛⲱⲧⲉⲛ ⲉ̀ϧⲟⲩⲛ ⲁⲣⲓⲕⲗⲏⲣⲟⲛⲟⲙⲓⲛ ⲙ̀ⲡⲓⲕⲁϩⲓ ⲫⲏ ⲉⲧⲁⲓⲱⲣⲕ ⲙ̀ⲙⲟϥ ⲛ̀ⲛⲉⲧⲉⲛⲓⲟϯ ⲁⲃⲣⲁⲁⲙ ⲛⲉⲙ ⲓⲥⲁⲁⲕ ⲛⲉⲙ ⲓⲁⲕⲱⲃ ⲉ̀ⲧⲏⲓϥ ⲛⲱⲟⲩ ⲛⲉⲙ ⲡⲟⲩϫⲣⲟϫ ⲙⲉⲛⲉⲛⲥⲱⲟⲩ		 Behold, God has delivered the land before you; go in and inherit the land, which I sware to your fathers, Abraam, and Isaac, and Jacob, to give it to them and to their seed after them.	 ἴδετε παραδέδωκα ἐνώπιον ὑµῶν τὴν γῆν· εἰσπορευθέντες κληρονοµήσατε τὴν γῆν, ἣν ὤµοσα τοῖς πατράσιν ὑµῶν τῷ Αβρααµ καὶ Ισαακ καὶ Ιακωβ δοῦναι αὐτοῖς καὶ τῷ σπέρµατι αὐτῶν µετ’ αὐτούς.						
Deuteronomy	1	9	 ⲟⲩⲟϩ ⲁⲓϫⲟⲥ ⲛⲱⲧⲉⲛ ϧⲉⲛ ⲡⲓⲥⲏⲟⲩ ⲉⲧⲉⲙ̀ⲙⲁⲩ ⲉⲓϫⲱ ⲙ̀ⲙⲟⲥ ϫⲉ ϯⲛⲁϣϫⲉⲙϫⲟⲙ ⲙ̀ⲙⲁⲩⲁⲧ ⲁⲛ ⲉ̀ϥⲁⲓ ⲙ̀ⲙⲱⲧⲉⲛ		 And I spoke to you at that time, saying, I shall not be able by myself to bear you.	 καὶ εἶπα πρὸς ὑµᾶς ἐν τῷ καιρῷ ἐκείνῳ λέγων Οὐ δυνήσοµαι µόνος φέρειν ὑµᾶς·						
Deuteronomy	1	10	 ⲡϭ̅ⲥ̅ ⲡⲉⲧⲉⲛⲛⲟⲩϯ ⲁϥⲑⲣⲉⲧⲉⲛⲁϣⲁⲓ ϩⲏⲡⲡⲉ ⲧⲉⲧⲉⲛⲟⲓ ⲙ̀ⲫⲟⲟⲩ ⲙ̀ⲫⲣⲏϯ ⲛ̀ⲛⲓⲥⲓⲟⲩ ⲛ̀ⲧⲉ ⲧⲫⲉ ϧⲉⲛ ⲡⲉⲧⲉⲛⲁϣⲁⲓ		 The Lord your God has multiplied you, and, behold, ye are to-day as the stars of heaven for multitude.	 κύριος ὁ θεὸς ὑµῶν ἐπλήθυνεν ὑµᾶς, καὶ ἰδού ἐστε σήµερον ὡσεὶ τὰ ἄστρα τοῦ οὐρανοῦ τῷ πλήθει·						
Deuteronomy	1	11	 ⲡϭ̅ⲥ̅ ⲫϯ ⲛ̀ⲧⲉ ⲛⲉⲧⲉⲛⲓⲟϯ ⲉϥⲉ̀ⲟⲩⲟϩ ⲉ̀ⲣⲱⲧⲉⲛ ϩⲱⲥⲇⲉ ⲛ̀ⲧⲉⲧⲉⲛⲉⲣϣⲟ ⲛ̀ⲕⲱⲃ ⲟⲩⲟϩ ⲉϥⲉ̀ⲥⲙⲟⲩ ⲉ̀ⲣⲱⲧⲉⲛ ⲕⲁⲧⲁ ⲫⲣⲏϯ ⲉⲧⲁϥⲥⲁϫⲓ ⲛⲉⲙⲱⲧⲉⲛ		 The Lord God of your fathers add to you a thousand-fold more than you are, and bless you as he has spoken to you.	 κύριος ὁ θεὸς τῶν πατέρων ὑµῶν προσθείη ὑµῖν ὡς ἐστὲ χιλιοπλασίως καὶ εὐλογήσαι ὑµᾶς, καθότι ἐλάλησεν ὑµῖν.						
Deuteronomy	1	12	 ⲡⲱⲥ ϯⲛⲁϣϫⲉⲙϫⲟⲙ ⲙ̀ⲙⲁⲩⲁⲧ ⲉ̀ϥⲁⲓ ⲙ̀ⲡⲉⲧⲉⲛϧⲓⲥⲓ ⲛⲉⲙ ⲧⲉⲧⲉⲛⲏⲡⲓ ⲛⲉⲙ ⲛⲉⲧⲉⲛⲁⲛⲧⲓⲗⲟⲅⲓⲁ		 How shall I alone be able to bear your labour, and your burden, and your gainsayings?	 πῶς δυνήσοµαι µόνος φέρειν τὸν κόπον ὑµῶν καὶ τὴν ὑπόστασιν ὑµῶν καὶ τὰς ἀντιλογίας ὑµῶν;						
Deuteronomy	1	13	 ⲙⲁ ϩⲁⲛⲣⲱⲙⲓ ⲛⲏⲓ ⲉ̀ⲃⲟⲗ ϧⲉⲛ ⲑⲏⲛⲟⲩ ⲛ̀ⲥⲁⲃⲉ ⲉ̀ⲟⲩⲟⲛ ⲉ̀ⲡⲓⲥⲧⲏⲙⲏ ⲙ̀ⲙⲱⲟⲩ ⲟⲩⲟϩ ⲛ̀ⲕⲁⲧϩⲏⲧ ⲉ̀ⲛⲉⲧⲉⲛⲫⲩⲗⲏ ⲛ̀ⲧⲁⲭⲁⲩ ⲉ̀ϩⲣⲏⲓ ⲉ̀ϫⲉⲛ ⲑⲏⲛⲟⲩ ⲛ̀ϩⲁⲛⲏⲅⲟⲩⲙⲉⲛⲟⲥ ⲛⲱⲧⲉⲛ		 Take to yourselves wise and understanding and prudent men for your tribes, and I will set your leaders over you.	 δότε ἑαυτοῖς ἄνδρας σοφοὺς καὶ ἐπιστήµονας καὶ συνετοὺς εἰς τὰς φυλὰς ὑµῶν, καὶ καταστήσω ἐφ’ ὑµῶν ἡγουµένους ὑµῶν.						
Deuteronomy	1	14	 ⲁⲧⲉⲧⲉⲛⲉⲣⲟⲩⲱ ⲛⲏⲓ ⲡⲉϫⲱⲧⲉⲛ ϫⲉ ⲛⲁⲛⲉ ⲡⲓⲥⲁϫⲓ ⲫⲏ ⲉⲧⲁⲕⲥⲁϫⲓ ⲙ̀ⲙⲟϥ ⲉ̀ⲁⲓϥ		 And ye answered me and said, The thing which thou hast told us is good to do.	 καὶ ἀπεκρίθητέ µοι καὶ εἴπατε Καλὸν τὸ ῥῆµα, ὃ ἐλάλησας ποιῆσαι.						
Deuteronomy	1	15	 ⲟⲩⲟϩ ⲁⲓϭⲓ ⲉ̀ⲃⲟⲗ ϧⲉⲛ ⲑⲏⲛⲟⲩ ⲛ̀ϩⲁⲛⲣⲱⲙⲓ ⲛ̀ⲥⲁⲃⲉ ⲥⲟⲩⲟⲛ ⲉ̀ⲡⲓⲥⲧⲏⲙⲏ ⲙ̀ⲙⲱⲟⲩ ⲟⲩⲟϩ ⲛ̀ⲕⲁⲧϩⲏⲧ ⲁⲓⲭⲁⲩ ⲛ̀ϩⲏⲅⲟⲩⲙⲉⲛⲟⲥ ⲉ̀ϩⲣⲏⲓ ⲉ̀ϫⲉⲛ ⲑⲏⲛⲟⲩ ⲛ̀ϩⲁⲛϣⲟ ⲛⲉⲙ ϩⲁⲛⲁⲛϣⲉ ⲛⲉⲙ ϩⲁⲛⲁⲛⲛ ⲛⲉⲙ ϩⲁⲛⲁⲛⲓ ⲛⲉⲙ ϩⲁⲛⲥⲁϧ ⲛ̀ⲛⲉⲧⲉⲛⲣⲉϥϯϩⲁⲡ		 So I took of you wise and understanding and prudent men, and I set them to rule over you as rulers of thousands, and rulers of hundreds, and rulers of fifties, and rulers of tens, and officers to your judges.	 καὶ ἔλαβον ἐξ ὑµῶν ἄνδρας σοφοὺς καὶ ἐπιστήµονας καὶ συνετοὺς καὶ κατέστησα αὐτοὺς ἡγεῖσθαι ἐφ’ ὑµῶν χιλιάρχους καὶ ἑκατοντάρχους καὶ πεντηκοντάρχους καὶ δεκαδάρχους καὶ γραµµατοεισαγωγεῖς τοῖς κριταῖς ὑµῶν.						
Deuteronomy	1	16	 ⲟⲩⲟϩ ⲁⲓϩⲟⲛϩⲉⲛ ⲉ̀ⲧⲟⲧⲟⲩ ⲛ̀ⲛⲉⲧⲉⲛⲣⲉϥϯϩⲁⲡ ϧⲉⲛ ⲡⲓⲥⲏⲟⲩ ⲉⲧⲉⲙ̀ⲙⲁⲩ ⲉⲓϫⲱ ⲙ̀ⲙⲟⲥ ϫⲉ ⲥⲱⲧⲉⲙ ⲟⲩⲧⲱⲟⲩ ⲛ̀ⲛⲉⲧⲉⲛⲥⲛⲏⲟⲩ ⲟⲩⲟϩ ⲙⲁϩⲁⲡ ϧⲉⲛ ⲟⲩϩⲁⲡ ⲙ̀ⲙⲉⲑⲙⲏⲓ ⲟⲩⲧⲉ ⲣⲱⲙⲓ ⲛⲉⲙ ⲟⲩⲧⲉ ⲡⲉϥⲥⲟⲛ ⲛⲉⲙ ⲟⲩⲧⲉ ⲡⲉϥⲡⲣⲟⲥⲓⲗⲓⲧⲟⲥ		 And I charged your judges at that time, saying, Hear causes between your brethren, and judge rightly between a man and his brother, and the stranger that is with him.	 καὶ ἐνετειλάµην τοῖς κριταῖς ὑµῶν ἐν τῷ καιρῷ ἐκείνῳ λέγων Διακούετε ἀνὰ µέσον τῶν ἀδελφῶν ὑµῶν καὶ κρίνατε δικαίως ἀνὰ µέσον ἀνδρὸς καὶ ἀνὰ µέσον ἀδελφοῦ καὶ ἀνὰ µέσον προσηλύτου αὐτοῦ.						
Deuteronomy	1	17	 ⲛ̀ⲛⲉⲕⲥⲟⲩⲉⲛ ⲟⲩϩⲟ ϧⲉⲛ ⲡϩⲁⲡ ⲉⲕⲉ̀ϯϩⲁⲡ ⲕⲁⲧⲁ ⲡⲓⲕⲟⲩϫⲓ ⲛⲉⲙ ⲕⲁⲧⲁ ⲡⲓⲛⲓϣϯ ⲛ̀ⲛⲉⲕϩⲱⲡ ϧⲁⲧϩⲏ ⲙ̀ⲡϩⲟ ⲛ̀ⲟⲩⲣⲱⲙⲓ ϫⲉ ⲡⲓϩⲁⲡ ⲫⲁ ⲫϯ ⲡⲉ ⲟⲩⲟϩ ⲡⲓⲥⲁϫⲓ ⲉⲧⲛⲁϣⲧ ⲛ̀ⲧⲉⲛ ⲑⲏⲛⲟⲩ ⲉⲣⲉⲧⲉⲛⲉⲉⲛϥ ϩⲁⲣⲟⲓ ⲉⲓⲉ̀ⲥⲱⲧⲉⲙ ⲉ̀ⲣⲟϥ		 Thou shalt not have respect to persons in judgment, thou shalt judge small and great equally; thou shalt not shrink from before the person of a man, for the judgment is God’s; and whatsoever matter shall be too hard for you, ye shall bring it to me, and I will hear it.	 οὐκ ἐπιγνώσῃ πρόσωπον ἐν κρίσει, κατὰ τὸν µικρὸν καὶ κατὰ τὸν µέγαν κρινεῖς, οὐ µὴ ὑποστείλῃ πρόσωπον ἀνθρώπου, ὅτι ἡ κρίσις τοῦ θεοῦ ἐστιν· καὶ τὸ ῥῆµα, ὃ ἐὰν σκληρὸν ᾖ ἀφ’ ὑµῶν, ἀνοίσετε αὐτὸ ἐπ’ ἐµέ, καὶ ἀκούσοµαι αὐτό.						
Deuteronomy	1	18	 ⲟⲩⲟϩ ⲁⲓϩⲟⲛϩⲉⲛ ⲛ̀ⲧⲉⲛ ⲑⲏⲛⲟⲩ ϧⲉⲛ ⲡⲓⲥⲏⲟⲩ ⲉⲧⲉⲙ̀ⲙⲁⲩ ⲛ̀ⲛⲓⲥⲁϫⲓ ⲧⲏⲣⲟⲩ ⲉⲧⲉⲧⲉⲛⲛⲁⲁⲓⲧⲟⲩ		 And I charged upon you at that time all the commands which ye shall perform.	 καὶ ἐνετειλάµην ὑµῖν ἐν τῷ καιρῷ ἐκείνῳ πάντας τοὺς λόγους, οὓς ποιήσετε.						
Deuteronomy	1	19	 ⲟⲩⲟϩ ⲁⲛⲧⲱⲟⲩⲛ ϧⲉⲛ ⲭⲱⲣⲏⲃ ⲁⲛϣⲉ ⲛⲁⲛ ϩⲓ ⲡϣⲁϥⲉ ⲧⲏⲣϥ ⲉⲧⲉⲙ̀ⲙⲁⲩ ⲫⲏ ⲉⲧⲟⲓ ⲛ̀ϩⲟϯ ⲟⲩⲟϩ ⲉⲧⲛⲁⲁϥ ⲫⲏ ⲉⲧⲁⲣⲉⲧⲉⲛⲛⲁⲩ ⲉ̀ⲣⲟϥ ⲡⲓⲙⲱⲓⲧ ⲛ̀ⲧⲉ ⲡⲧⲱⲟⲩ ⲙ̀ⲡⲓⲁⲙⲟⲣⲣⲉⲟⲥ ⲕⲁⲧⲁ ⲫⲣⲏϯ ⲉⲧⲁ ⲡϭ̅ⲥ̅ ⲡⲉⲛⲛⲟⲩϯ ϩⲟⲛϩⲉⲛ ⲛⲁⲛ		 And we departed from Choreb, and went through all that great wilderness and terrible, which ye saw, by the way of the mountain of the Amorite, as the Lord our God charged us, and we came as far as Cades Barne.	 Καὶ ἀπάραντες ἐκ Χωρηβ ἐπορεύθηµεν πᾶσαν τὴν ἔρηµον τὴν µεγάλην καὶ τὴν φοβερὰν ἐκείνην, ἣν εἴδετε, ὁδὸν ὄρους τοῦ Αµορραίου, καθότι ἐνετείλατο κύριος ὁ θεὸς ἡµῶν ἡµῖν, καὶ ἤλθοµεν ἕως Καδης Βαρνη.						
Deuteronomy	1	20	 ⲟⲩⲟϩ ⲁⲓϫⲟⲥ ⲛⲱⲧⲉⲛ ϫⲉ ⲁⲧⲉⲧⲉⲛⲓ ϣⲁ ⲡⲧⲱⲟⲩ ⲙ̀ⲡⲓⲁⲙⲟⲣⲣⲉⲟⲥ ⲫⲏ ⲉⲧⲉ ⲡϭ̅ⲥ̅ ⲡⲉⲛⲛⲟⲩϯ ⲛⲁⲧⲏⲓϥ ⲛⲱⲧⲉⲛ		 And I said to you, Ye have come as far as the mountain of the Amorite, which the Lord our God gives to you:	 καὶ εἶπα πρὸς ὑµᾶς Ἤλθατε ἕως τοῦ ὄρους τοῦ Αµορραίου, ὃ ὁ κύριος ὁ θεὸς ἡµῶν δίδωσιν ὑµῖν.						
Deuteronomy	1	21	 ⲁⲛⲁⲩ ⲓⲥ ⲁ ⲡϭ̅ⲥ̅ ⲡⲉⲧⲉⲛⲛⲟⲩϯ ϯ ⲙ̀ⲡⲓⲕⲁϩⲓ ϧⲁⲧϩⲏ ⲙ̀ⲡⲉⲧⲉⲛϩⲟ ⲙⲁϣⲉ ⲛⲱⲧⲉⲛ ⲉ̀ϩⲣⲏⲓ ⲁⲣⲓⲕⲗⲏⲣⲟⲛⲟⲙⲓⲛ ⲙ̀ⲙⲟϥ ⲙ̀ⲫⲣⲏϯ ⲉⲧⲁ ⲡϭ̅ⲥ̅ ⲛ̀ⲧⲉ ⲛⲉⲧⲉⲛⲓⲟϯ ϫⲟⲥ ⲛⲱⲧⲉⲛ ⲙ̀ⲡⲉⲣⲉⲣϩⲟϯ ⲟⲩⲇⲉ ⲙ̀ⲡⲉⲣⲉⲣϣⲗⲁϩ ⲛ̀ϩⲏⲧ		 behold, the Lord your God has delivered to us the land before you: go up and inherit it as the Lord God of your fathers said to you; fear not, neither be afraid.	 ἴδετε παραδέδωκεν ὑµῖν κύριος ὁ θεὸς ὑµῶν πρὸ προσώπου ὑµῶν τὴν γῆν· ἀναβάντες κληρονοµήσατε, ὃν τρόπον εἶπεν κύριος ὁ θεὸς τῶν πατέρων ὑµῶν ὑµῖν· µὴ φοβεῖσθε µηδὲ δειλιάσητε.						
Deuteronomy	1	22	 ⲟⲩⲟϩ ⲁⲣⲉⲧⲉⲛ̀ⲓ ϩⲁⲣⲟⲓ ⲧⲏⲣⲟⲩ ⲟⲩⲟϩ ⲡⲉϫⲱⲧⲉⲛ ϫⲉ ⲙⲁⲣⲉⲛⲟⲩⲱⲣⲡ ⲛ̀ϩⲁⲛⲣⲱⲙⲓ ϧⲁϫⲱⲛ ⲙⲁⲣⲟⲩⲙⲉϣⲧ ⲡⲓⲕⲁϩⲓ ⲛⲁⲛ ⲟⲩⲟϩ ⲙⲁⲣⲟⲩⲧⲁⲙⲟⲛ ⲉ̀ⲟⲩⲥⲁϫⲓ ⲡⲓⲙⲱⲓⲧ ⲫⲏ ⲉⲧⲉⲛⲛⲁϣⲉ ⲛⲁⲛ ⲉ̀ϩⲣⲏⲓ ϩⲓⲱⲧϥ ⲛⲉⲙ ⲛⲓⲃⲁⲕⲓ ⲉⲧⲉⲛⲛⲁϣⲉ ⲉ̀ϧⲟⲩⲛ ⲉ̀ⲣⲱⲟⲩ		 And ye all came to me, and said, Let us send men before us, and let them go up to the land for us; and let them bring back to us a report of the way by which we shall go up, and of the cities into which we shall enter.	 καὶ προσήλθατέ µοι πάντες καὶ εἴπατε Ἀποστείλωµεν ἄνδρας προτέρους ἡµῶν, καὶ ἐφοδευσάτωσαν ἡµῖν τὴν γῆν καὶ ἀναγγειλάτωσαν ἡµῖν ἀπόκρισιν τὴν ὁδόν, δι’ ἧς ἀναβησόµεθα ἐν αὐτῇ, καὶ τὰς πόλεις, εἰς ἃς εἰσπορευσόµεθα εἰς αὐτάς.						
Deuteronomy	1	23	 ⲟⲩⲟϩ ⲁ ⲡⲓⲥⲁϫⲓ ⲣⲁⲛⲏⲓ ⲙ̀ⲡⲁⲙ̀ⲑⲟ ⲁⲓϭⲓ ⲉ̀ⲃⲟⲗ ϧⲉⲛ ⲑⲏⲛⲟⲩ ⲙ̀ⲡⲓⲓ̅ⲃ̅ ⲛ̀ⲣⲱⲙⲓ ⲕⲁⲧⲁ ⲫⲩⲗⲏ		 And the saying pleased me: and I took of you twelve men, one man of a tribe.	 καὶ ἤρεσεν ἐναντίον µου τὸ ῥῆµα, καὶ ἔλαβον ἐξ ὑµῶν δώδεκα ἄνδρας, ἄνδρα ἕνα κατὰ φυλήν.						
Deuteronomy	1	24	 ⲟⲩⲟϩ ⲉⲧⲁⲩⲕⲟⲧⲟⲩ ⲁⲩϣⲉ ⲛⲱⲟⲩ ⲉ̀ϩⲣⲏⲓ ⲉ̀ϫⲉⲛ ⲡⲓⲧⲱⲟⲩ ⲁⲩⲓ̀ ϣⲁ ϯϧⲉⲗⲗⲟⲧ ⲛ̀ⲧⲉ ⲡⲓⲥⲙⲁϩ ⲟⲩⲟϩ ⲉⲧⲁⲩⲙⲟϣⲧⲥ		 And they turned and went up to the mountain, and they came as far as the valley of the cluster, and surveyed it.	 καὶ ἐπιστραφέντες ἀνέβησαν εἰς τὸ ὄρος καὶ ἤλθοσαν ἕως Φάραγγος βότρυος καὶ κατεσκόπευσαν αὐτήν.						
Deuteronomy	1	25	 ⲁⲩϭⲓ ϧⲉⲛ ⲛⲟⲩϫⲓϫ ⲉ̀ⲃⲟⲗ ϧⲉⲛ ⲡⲟⲩⲧⲁϩ ⲛ̀ⲧⲉ ⲡⲕⲁϩⲓ ⲁⲩⲓⲛⲓ ⲉ̀ⲡⲉⲥⲏⲧ ϩⲁⲣⲟⲛ ⲟⲩⲟϩ ⲛⲁⲩϫⲱ ⲙ̀ⲙⲟⲥ ϫⲉ ⲛⲁⲛⲉ ⲡⲓⲕⲁϩⲓ ⲫⲏ ⲉⲧⲉ ⲡϭ̅ⲥ̅ ⲡⲉⲛⲛⲟⲩϯ ⲛⲁⲧⲏⲓϥ ⲛⲁⲛ		 And they took in their hands of the fruit of the land, and brought it to you, and said, The land is good which the Lord our God gives us.	 καὶ ἐλάβοσαν ἐν ταῖς χερσὶν αὐτῶν ἀπὸ τοῦ καρποῦ τῆς γῆς καὶ κατήνεγκαν πρὸς ἡµᾶς καὶ ἔλεγον Ἀγαθὴ ἡ γῆ, ἣν κύριος ὁ θεὸς ἡµῶν δίδωσιν ἡµῖν.						
Deuteronomy	1	26	 ⲟⲩⲟϩ ⲙ̀ⲡⲉⲧⲉⲛⲟⲩⲱϣ ⲉ̀ϣⲉ ⲉ̀ⲡϣⲱⲓ ⲁⲗⲗⲁ ⲁⲣⲉⲧⲉⲛⲉⲣⲁⲧⲥⲱⲧⲉⲙ ⲛ̀ⲥⲁ ⲡⲥⲁϫⲓ ⲙ̀ⲡϭ̅ⲥ̅ ⲡⲉⲧⲉⲛⲛⲟⲩϯ		 Yet ye would not go up, but rebelled against the words of the Lord our God.	 καὶ οὐκ ἠθελήσατε ἀναβῆναι καὶ ἠπειθήσατε τῷ ῥήµατι κυρίου τοῦ θεοῦ ὑµῶν						
Deuteronomy	1	27	 ⲟⲩⲟϩ ⲁⲣⲉⲧⲉⲛⲭⲣⲉⲙⲣⲉⲙ ϧⲉⲛ ⲛⲉⲧⲉⲛⲥⲕⲩⲛⲏ ⲟⲩⲟϩ ⲡⲉϫⲱⲧⲉⲛ ϫⲉ ⲉⲑⲃⲉⲟⲩ ϫⲉ ⲡϭ̅ⲥ̅ ⲙⲟⲥϯ ⲙ̀ⲙⲟⲛ ⲁϥⲉⲛⲧⲉⲛ ⲉ̀ⲃⲟⲗ ϧⲉⲛ ⲡⲕⲁϩⲓ ⲛ̀ⲭⲏⲙⲓ ⲉ̀ⲧⲏⲓⲧⲉⲛ ⲉ̀ϧⲣⲏⲓ ⲉ̀ⲛⲉⲛϫⲓϫ ⲛ̀ⲛⲓⲁⲙⲟⲣⲣⲉⲟⲥ ⲉϥⲟⲧⲧⲉⲛ ⲉ̀ⲃⲟⲗ		 And ye murmured in your tents, and said, Because the Lord hated us, he has brought us out of the land of Egypt to deliver us into the hands of the Amorites, to destroy us.	 καὶ διεγογγύζετε ἐν ταῖς σκηναῖς ὑµῶν καὶ εἴπατε Διὰ τὸ µισεῖν κύριον ἡµᾶς ἐξήγαγεν ἡµᾶς ἐκ γῆς Αἰγύπτου παραδοῦναι ἡµᾶς εἰς χεῖρας Αµορραίων ἐξολεθρεῦσαι ἡµᾶς.						
Deuteronomy	1	28	 ⲁⲛⲛⲁϣⲉ ⲛⲁⲛ ⲉ̀ⲡϣⲱⲓ ⲉ̀ⲑⲱⲛ ⲁ̀ⲛⲟⲛ ⲛⲉⲧⲉⲛⲥⲛⲏⲟⲩ ϫⲉ ⲁⲩⲫⲉⲛϩ ⲡⲉⲧⲉⲛϩⲏⲧ ⲉⲩϫⲱ ⲙ̀ⲙⲟⲥ ϫⲉ ⲟⲩⲛⲓϣϯ ⲛ̀ϣⲗⲟⲗ ⲉ̀ⲛⲁϣⲱϥ ⲟⲩⲟϩ ⲉϥϫⲟⲣ ⲉ̀ϩⲟⲧⲉⲣⲟⲛ ⲛⲉⲙ ϩⲁⲛⲛⲓϣϯ ⲙ̀ⲃⲁⲕⲓ ⲉⲩⲧⲁⲕⲧⲏⲟⲩⲧ ⲛ̀ⲥⲟⲃⲧ ϣⲁ ⲉ̀ϩⲣⲏⲓ ⲉ̀ⲧⲫⲉ ⲁⲗⲗⲁ ⲛⲉⲙ ϩⲁⲛⲕⲉϣⲏⲣⲓ ⲛⲁⲫⲱⲡ ⲁⲛⲛⲁⲩ ⲉ̀ⲣⲱⲟⲩ ⲙ̀ⲙⲁⲩ		 Whither do we go up? and your brethren drew away your heart, saying, It is a great nation and populous, and mightier than we; and there are cities great and walled up to heaven: moreover we saw there the sons of the giants.	 ποῦ ἡµεῖς ἀναβαίνοµεν; οἱ ἀδελφοὶ ὑµῶν ἀπέστησαν ὑµῶν τὴν καρδίαν λέγοντες Ἔθνος µέγα καὶ πολὺ καὶ δυνατώτερον ἡµῶν καὶ πόλεις µεγάλαι καὶ τετειχισµέναι ἕως τοῦ οὐρανοῦ, ἀλλὰ καὶ υἱοὺς γιγάντων ἑωράκαµεν ἐκεῖ.						
Deuteronomy	1	29	 ⲟⲩⲟϩ ⲁⲓϫⲟⲥ ⲛⲱⲧⲉⲛ ϫⲉ ⲙ̀ⲡⲉⲣⲉⲣϣⲗⲁϩ ⲛ̀ϩⲏⲧ ⲟⲩⲇⲉ ⲙ̀ⲡⲉⲣⲉⲣϩⲟϯ ϧⲁⲧⲟⲩϩⲏ		 And I said to you, Fear not, neither be ye afraid of them;	 καὶ εἶπα πρὸς ὑµᾶς Μὴ πτήξητε µηδὲ φοβηθῆτε ἀπ’ αὐτῶν·						
Deuteronomy	1	30	 ⲡϭ̅ⲥ̅ ⲅⲁⲣ ⲡⲉⲧⲉⲛⲛⲟⲩϯ ϥⲉⲣϣⲟⲣⲡ ⲙ̀ⲙⲟϣⲓ ϧⲁⲧϩⲏ ⲙ̀ⲡⲉⲧⲉⲛϩⲟ ⲛ̀ⲑⲟϥ ⲉⲧⲛⲁⲃⲱⲧⲥ ⲉ̀ⲣⲱⲟⲩ ⲛⲉⲙⲱⲧⲉⲛ ⲕⲁⲧⲁ ϩⲱⲃ ⲛⲓⲃⲉⲛ ⲉⲧⲁϥⲁⲓⲧⲟⲩ ⲛⲉⲙⲱⲧⲉⲛ ϧⲉⲛ ⲡⲕⲁϩⲓ ⲛ̀ⲭⲏⲙⲓ		 the Lord your God who goes before your face, he shall fight against them together with you effectually, according to all that he wrought for you in the land of Egypt;	 κύριος ὁ θεὸς ὑµῶν ὁ προπορευόµενος πρὸ προσώπου ὑµῶν αὐτὸς συνεκπολεµήσει αὐτοὺς µεθ’ ὑµῶν κατὰ πάντα, ὅσα ἐποίησεν ὑµῖν ἐν γῇ Αἰγύπτῳ						
Deuteronomy	1	31	 ⲛⲉⲙ ϧⲉⲛ ⲡⲁⲓϣⲁϥⲉ ⲉⲧⲁⲣⲉⲧⲉⲛⲛⲁⲩ ⲉ̀ⲣⲟϥ ⲙ̀ⲫⲣⲏϯ ⲉⲧⲁϥϣⲁⲛⲟⲩϣⲕ ⲛ̀ϫⲉ ⲡϭ̅ⲥ̅ ⲡⲉⲕⲛⲟⲩϯ ⲙ̀ⲫⲣⲏϯ ⲛ̀ⲟⲩⲓⲱⲧ ⲉϥϣⲁⲛϣ ⲛ̀ⲛⲉϥϣⲏⲣⲓ ⲕⲁⲧⲁ ⲡⲓⲙⲱⲓⲧ ⲧⲏⲣϥ ⲉⲧⲁⲣⲉⲧⲉⲛⲙⲟϣⲓ ϩⲓⲱⲧϥ ϣⲁⲧⲉⲧⲉⲛⲓ̀ ⲉ̀ⲡⲁⲓⲙⲁ		 and in this wilderness which ye saw, by the way of the mountain of the Amorite; how the Lord thy God will bear thee as a nursling, as if any man should nurse his child, through all the way which ye have gone until ye came to this place.	 καὶ ἐν τῇ ἐρήµῳ ταύτῃ, ἣν εἴδετε, ὡς ἐτροφοφόρησέν σε κύριος ὁ θεός σου, ὡς εἴ τις τροφοφορήσει ἄνθρωπος τὸν υἱὸν αὐτοῦ, κατὰ πᾶσαν τὴν ὁδόν, ἣν ἐπορεύθητε, ἕως ἤλθετε εἰς τὸν τόπον τοῦτον.						
Deuteronomy	1	32	 ⲟⲩⲟϩ ⲛ̀ϧⲣⲏⲓ ϧⲉⲛ ⲡⲁⲓⲥⲁϫⲓ ⲙ̀ⲡⲉⲧⲉⲛⲛⲁϩϯ ⲉ̀ⲡϭ̅ⲥ̅ ⲡⲉⲧⲉⲛⲛⲟⲩϯ		 And in this matter ye believed not the Lord our God,	 καὶ ἐν τῷ λόγῳ τούτῳ οὐκ ἐνεπιστεύσατε κυρίῳ τῷ θεῷ ὑµῶν,						
Deuteronomy	1	33	 ⲫⲏ ⲉⲧⲉⲣϣⲟⲣⲡ ⲙ̀ⲙⲟϣⲓ ϧⲁϫⲱⲧⲉⲛ ϩⲓ ⲡⲓⲙⲱⲓⲧ ⲉ̀ⲥⲱⲧⲡ ⲛⲱⲧⲉⲛ ⲛ̀ⲟⲩⲙⲁ ⲉϥϭⲓⲙⲱⲓⲧ ⲛⲱⲧⲉⲛ ϧⲉⲛ ⲟⲩⲭⲣⲱⲙ ⲙ̀ⲡⲓⲉϫⲱⲣϩ ⲉϥⲧⲁⲙⲟ ⲙ̀ⲙⲱⲧⲉⲛ ⲉ̀ⲡⲓⲙⲱⲓⲧ ⲉⲧⲉⲧⲉⲛⲛⲁⲙⲟϣⲓ ϩⲓⲱⲧϥ ⲛⲉⲙ ϧⲉⲛ ⲟⲩϭⲏⲡⲓ ⲙ̀ⲡⲓⲉϩⲟⲟⲩ		 who goes before you in the way to choose you a place, guiding you in fire by night, shewing you the way by which ye go, and a cloud by day.	 ὃς προπορεύεται πρότερος ὑµῶν ἐν τῇ ὁδῷ ἐκλέγεσθαι ὑµῖν τόπον ὁδηγῶν ὑµᾶς ἐν πυρὶ νυκτὸς δεικνύων ὑµῖν τὴν ὁδόν, καθ’ ἣν πορεύεσθε ἐπ’ αὐτῆς, καὶ ἐν νεφέλῃ ἡµέρας.						
Deuteronomy	1	34	 ⲟⲩⲟϩ ⲁ ⲡϭ̅ⲥ̅ ⲥⲱⲧⲉⲙ ⲉ̀ⲧⲥⲙⲏ ⲛ̀ⲧⲉ ⲛⲉⲧⲉⲛⲥⲁϫⲓ ⲟⲩⲟϩ ⲉⲧⲁϥϫⲱⲛⲧ ⲁϥⲱⲣⲕ ⲉϥϫⲱ ⲙ̀ⲙⲟⲥ		 And the Lord heard the voice of your words, and being greatly provoked he sware, saying,	 καὶ ἤκουσεν κύριος τὴν φωνὴν τῶν λόγων ὑµῶν καὶ παροξυνθεὶς ὤµοσεν λέγων						
