book	chapter	verse	Bohairic	Sahidic	English	Greek	Fayyumic	Akhmimic	OldBohairic	Mesokemic	DialectP	Lycopolitan
Malachi	1		ϯⲡⲣⲟⲫⲏⲧⲓⲁ ⲛ̀ⲧⲉ ⲙⲁⲗⲁⲭⲓⲁⲥ ⲡⲓⲡⲣⲟⲫⲏⲧⲏⲥ									
Malachi	1	1	 ⲫⲗⲩⲙⲙⲁ ⲙ̀ⲡⲥⲁϫⲓ ⲙ̀ⲡϭ̅ⲥ̅ ⲉ̀ϫⲉⲛ ⲡⲓⲥ̅ⲗ̅ ϧⲉⲛ ⲧϫⲓϫ ⲙ̀ⲡⲉϥⲁⲅⲅⲉⲗⲟⲥ ⲭⲁⲥ ϩⲓϫⲉⲛ ⲛⲉⲧⲉⲛϩⲏⲧ		 The burden of the word of the Lord to Israel by the hand of his messenger. Lay it, I pray you, to heart.	 Λῆµµα λόγου κυρίου ἐπὶ τὸν Ισραηλ ἐν χειρὶ ἀγγέλου αὐτοῦ· θέσθε δὴ ἐπὶ τὰς καρδίας ὑµῶν.						
Malachi	1	2	 ⲁⲓⲙⲉⲛⲣⲉ ⲑⲏⲛⲟⲩ ⲡⲉϫⲉ ⲡϭ̅ⲥ̅ ⲟⲩⲟϩ ⲡⲉϫⲱⲧⲉⲛ ϫⲉ ⲁⲕⲙⲉⲛⲣⲓⲧⲧⲉⲛ ϧⲉⲛ ⲟⲩ ⲙⲏ ⲛⲉ ⲡⲥⲟⲛ ⲛ̀ⲓⲁⲕⲱⲃ ⲁⲛ ⲡⲉ ⲏⲥⲁⲩ ⲡⲉϫⲉ ⲡϭ̅ⲥ̅ ⲟⲩⲟϩ ⲓⲁⲕⲱⲃ ⲙⲉⲛ ⲁⲓⲙⲉⲛⲣⲓⲧϥ		 I have loved you, saith the Lord. And ye said, Wherein hast thou loved us? Was not Esau Jacob’s brother? saith the Lord: yet I loved Jacob,	 Ἠγάπησα ὑµᾶς, λέγει κύριος. καὶ εἴπατε Ἐν τίνι ἠγάπησας ἡµᾶς; οὐκ ἀδελφὸς ἦν Ησαυ τοῦ Ιακωβ; λέγει κύριος· καὶ ἠγάπησα τὸν Ιακωβ,						
Malachi	1	3	 ⲏⲥⲁⲩ ⲇⲉ ⲁⲓⲙⲉⲥⲧⲱϥ ⲟⲩⲟϩ ⲁⲓⲑⲱϣ ⲛ̀ⲛⲉϥϭⲓⲏ ⲉ̀ⲟⲩⲧⲁⲕⲟ ⲟⲩⲟϩ ⲧⲉϥⲕⲗⲏⲣⲟⲛⲟⲙⲓⲁ ⲉ̀ϩⲁⲛⲧⲟⲓ ⲛ̀ⲧⲉ ⲡϣⲁϥⲉ		 and hated Esau and laid waste his borders, and made his heritage as dwellings of the wilderness?	 τὸν δὲ Ησαυ ἐµίσησα καὶ ἔταξα τὰ ὅρια αὐτοῦ εἰς ἀφανισµὸν καὶ τὴν κληρονοµίαν αὐτοῦ εἰς δόµατα ἐρήµου.						
Malachi	1	4	 ϫⲉ ⲟⲩⲏⲓ ⲉϥⲉ̀ϫⲟⲥ ϫⲉ ⲁⲥⲟⲩⲱϫⲡ ⲛ̀ϫⲉ ϯϩ{ⲁ}<ⲉ>ⲇⲟⲙⲉⲁ ⲙⲁⲣⲉⲛⲧⲁⲥⲑⲟ ⲟⲩⲟϩ ⲛ̀ⲧⲉⲛⲕⲱⲧ ⲛ̀ⲛⲉⲥϣⲁϥⲉⲩ ⲛⲁⲓ ⲛⲉ ⲛⲏ ⲉⲧⲉϥϫⲱ ⲙ̀ⲙⲱⲟⲩ ⲛ̀ϫⲉ ⲡϭ̅ⲥ̅ ⲡⲓⲡⲁⲛⲧⲟⲕⲣⲁⲧⲱⲣ ϫⲉ ⲛ̀ⲑⲱⲟⲩ ⲉⲩⲉ̀ⲕⲱⲧⲟⲩ ⲟⲩⲟϩ ⲁ̀ⲛⲟⲕ ϩⲱ ⲉⲓⲉⲟⲩⲱϫⲡ ⲟⲩⲟϩ ⲉⲩⲉ̀ⲙⲟⲩϯ ⲉ̀ⲣⲱⲟⲩ ϫⲉ ⲡⲓⲗⲁⲟⲥ ⲛ̀ⲧⲉ ϯⲁⲛⲟⲙⲓⲁ ⲟⲩⲟϩ ⲡⲓⲗⲁⲟⲥ ⲉⲧⲁϥϯⲟⲩⲃⲏϥ ⲛ̀ϫⲉ ⲡϭ̅ⲥ̅ ϣⲁ ⲉⲛⲉϩ		 Because one will say, Idumea has been overthrown, but let us return and rebuild the desolate places; thus saith the Lord Almighty, They shall build, but I will throw down; and they shall be called The borders of wickedness, and, The people against whom the Lord has set himself for ever.	 διότι ἐρεῖ ἡ Ιδουµαία Κατέστραπται, καὶ ἐπιστρέψωµεν καὶ ἀνοικοδοµήσωµεν τὰς ἐρήµους· τάδε λέγει κύριος παντοκράτωρ Αὐτοὶ οἰκοδοµήσουσιν, καὶ ἐγὼ καταστρέψω· καὶ ἐπικληθήσεται αὐτοῖς ὅρια ἀνοµίας καὶ λαὸς ἐφ’ ὃν παρατέτακται κύριος ἕως αἰῶνος.						
Malachi	1	5	 ⲟⲩⲟϩ ⲉⲩⲉ̀ⲛⲁⲩ ⲛ̀ϫⲉ ⲛⲉⲧⲉⲛⲃⲁⲗ ⲟⲩⲟϩ ⲛ̀ⲑⲱⲧⲉⲛ ⲉⲣⲉⲧⲉⲛⲛⲁϫⲟⲥ ϫⲉ ⲁϥⲉⲣⲛⲓϣϯ ⲛ̀ϫⲉ ⲡϭ̅ⲥ̅ ⲥⲁⲡϣⲱⲓ ⲛ̀ⲛⲓⲑⲟϣ ⲛ̀ⲧⲉ ⲡⲓⲥ̅ⲗ̅		 And your eyes shall see, and ye shall say, The Lord has been magnified upon the borders of Israel.	 καὶ οἱ ὀφθαλµοὶ ὑµῶν ὄψονται, καὶ ὑµεῖς ἐρεῖτε Ἐµεγαλύνθη κύριος ὑπεράνω τῶν ὁρίων τοῦ Ισραηλ.						
Malachi	1	6	 ⲟⲩϣⲏⲣⲓ ϣⲁϥϯⲱⲟⲩ ⲙ̀ⲡⲉϥⲓⲱⲧ ⲟⲩⲟϩ ⲟⲩⲃⲱⲕ ⲙ̀ⲡⲉϥϭ̅ⲥ̅ ⲟⲩⲟϩ ⲓⲥϫⲉ ⲁ̀ⲛⲟⲕ ⲟⲩⲓⲱⲧ ⲁϥⲑⲱⲛ ⲡⲁⲱⲟⲩ ⲟⲩⲟϩ ⲓⲥϫⲉ ⲁ̀ⲛⲟⲕ ⲟⲩ ⲡϭ̅ⲥ̅ ⲁⲥⲑⲱⲛ ⲧⲁϩⲟϯ ⲡⲉϫⲉ ⲡϭ̅ⲥ̅ ⲡⲓⲡⲁⲛⲧⲟⲕⲣⲁⲧⲱⲣ ⲛ̀ⲑⲱⲧⲉⲛ ⲛⲓⲟⲩⲏⲃ ⲛⲏ ⲉⲧϣⲱϣϥ ⲙ̀ⲡⲁⲣⲁⲛ ⲟⲩⲟϩ ⲡⲉϫⲱⲧⲉⲛ ϫⲉ ⲉⲧⲁⲛϣⲱϣϥ ⲙ̀ⲡⲉⲕⲣⲁⲛ ϧⲉⲛ ⲟⲩ		 A son honours his father, and a servant his master: if then I am a father, where is mine honour? and if I am a master, where is my fear? saith the Lord Almighty. Ye the priests are they that despise my name: yet ye said, Wherein have we despised thy name?	 Υἱὸς δοξάζει πατέρα καὶ δοῦλος τὸν κύριον αὐτοῦ. καὶ εἰ πατήρ εἰµι ἐγώ, ποῦ ἐστιν ἡ δόξα µου; καὶ εἰ κύριός εἰµι ἐγώ, ποῦ ἐστιν ὁ φόβος µου; λέγει κύριος παντοκράτωρ. ὑµεῖς οἱ ἱερεῖς οἱ φαυλίζοντες τὸ ὄνοµά µου· καὶ εἴπατε Ἐν τίνι ἐφαυλίσαµεν τὸ ὄνοµά σου;						
Malachi	1	7	 ⲉⲣⲉⲧⲉⲛⲓⲛⲓ ⲉ̀ϧⲟⲩⲛ ϩⲁ ⲡⲁⲙⲁⲛ̀ⲉⲣϣⲱⲟⲩϣⲓ ⲛ̀ϩⲁⲛⲱⲓⲕ ⲉⲩϭⲁϧⲉⲙ ⲟⲩⲟϩ ⲡⲉϫⲱⲧⲉⲛ ϫⲉ ⲉⲧⲁⲛϭⲁϧⲙⲟⲩ ϧⲉⲛ ⲟⲩ ϧⲉⲛ ⲡϫⲓⲛⲑⲣⲉⲧⲉⲛϫⲟⲥ ⲡⲉ ϫⲉ ⲉⲥϣⲟϣϥ ⲛ̀ϫⲉ ϯⲧⲣⲁⲡⲉⲍⲁ ⲛ̀ⲧⲉ ⲡϭ̅ⲥ̅ ⲟⲩⲟϩ ⲥⲉϣⲟϣϥ ⲛ̀ϫⲉ ⲛⲓϧⲣⲏⲟⲩⲓ ⲉⲧⲟⲩⲭⲱ ⲙ̀ⲙⲱⲟⲩ ϩⲓϫⲱⲥ		 In that ye bring to mine altar polluted bread; and ye said, Wherein have ye polluted it? In that ye say, The table of the Lord is polluted, and that which was set thereon ye have despised.	 προσάγοντες πρὸς τὸ θυσιαστήριόν µου ἄρτους ἠλισγηµένους. καὶ εἴπατε Ἐν τίνι ἠλισγήσαµεν αὐτούς; ἐν τῷ λέγειν ὑµᾶς Τράπεζα κυρίου ἐξουδενωµένη ἐστὶν καὶ τὰ ἐπιτιθέµενα βρώµατα ἐξουδενωµένα.						
Malachi	1	8	 ⲟⲩⲟϩ ⲉ̀ϣⲱⲡ ⲁⲣⲉⲧⲉⲛϣⲁⲛⲓⲛⲓ ⲉ̀ϧⲟⲩⲛ ⲛ̀ⲟⲩⲃⲉⲗⲗⲉ ⲉ̀ⲟⲩϣⲟⲩϣⲱⲟⲩϣⲓ ⲙⲏ ϥϩⲱⲟⲩ ⲁⲛ ⲟⲩⲟϩ ⲉ̀ϣⲱⲡ ⲁⲣⲉⲧⲉⲛϣⲁⲛⲓⲛⲓ ⲉ̀ϧⲟⲩⲛ ⲛ̀ⲟⲩϭⲁⲗⲉ ⲓⲉ ⲟⲩⲁⲓ ⲉϥϣⲱⲛⲓ ⲙⲏ ϥϩⲱⲟⲩ ⲁⲗⲓⲧϥ ⲇⲉ ⲉ̀ϧⲟⲩⲛ ⲙ̀ⲡⲉⲕϩⲩⲅⲟⲩⲙⲉⲛⲟⲥ ⲁⲛ ϥⲛⲁϭⲓⲧϥ ⲛ̀ⲧⲟⲧⲕ ⲁⲛ ϥⲛⲁϭⲓ ⲡⲉⲕϩⲟ ⲡⲉϫⲉ ⲡϭ̅ⲥ̅ ⲡⲓⲡⲁⲛⲧⲟⲕⲣⲁⲧⲱⲣ		 For if ye bring a blind victim for sacrifices, is it not evil? and if ye bring the lame or the sick, is it not evil? offer it now to thy ruler, and see if he will receive thee, if he will accept thy person, saith the Lord Almighty.	 διότι ἐὰν προσαγάγητε τυφλὸν εἰς θυσίαν, οὐ κακόν; καὶ ἐὰν προσαγάγητε χωλὸν ἢ ἄρρωστον, οὐ κακόν; προσάγαγε δὴ αὐτὸ τῷ ἡγουµένῳ σου, εἰ προσδέξεται αὐτό, εἰ λήµψεται πρόσωπόν σου, λέγει κύριος παντοκράτωρ.						
Malachi	1	9	 ⲟⲩⲟϩ ϯⲛⲟⲩ ⲧⲱⲃϩ ⲙ̀ⲡϩⲟ ⲙ̀ⲡϭ̅ⲥ̅ ⲡⲉⲧⲉⲛⲛⲟⲩϯ ⲟⲩⲟϩ ⲙⲁϯϩⲟ ⲉ̀ⲣⲟϥ ϩⲓⲛⲁ ⲛ̀ⲧⲉϥⲛⲁⲓ ⲛⲱⲧⲉⲛ ⲁⲩϣⲱⲡⲓ ⲛ̀ϫⲉ ⲛⲁⲓ ϧⲉⲛ ⲛⲉⲧⲉⲛϫⲓϫ ⲓⲉ ⲁⲛ ϯⲛⲁϭⲓ ⲉ̀ⲃⲟⲗ ϧⲉⲛ ⲑⲏⲛⲟⲩ ⲛ̀ⲛⲉⲧⲉⲛϩⲟ ⲡⲉϫⲉ ⲡϭ̅ⲥ̅ ⲡⲓⲡⲁⲛⲧⲟⲕⲣⲁⲧⲱⲣ		 And now intreat the face of your God, and make supplication to him. These things have been done by your hands; shall I accept you? saith the Lord Almighty.	 καὶ νῦν ἐξιλάσκεσθε τὸ πρόσωπον τοῦ θεοῦ ὑµῶν καὶ δεήθητε αὐτοῦ· ἐν χερσὶν ὑµῶν γέγονεν ταῦτα· εἰ λήµψοµαι ἐξ ὑµῶν πρόσωπα ὑµῶν; λέγει κύριος παντοκράτωρ.						
Malachi	1	10	 ϫⲉ ⲟⲩⲏⲓ ⲉⲩⲉ̀ϣⲱⲧⲉⲙ ⲛ̀ϩⲁⲛⲣⲱⲟⲩ ϧⲉⲛ ⲑⲏⲛⲟⲩ ϩⲱⲧⲉⲛ ⲟⲩⲟϩ ⲛ̀ⲛⲉⲧⲉⲛϭⲉⲣⲟ ⲙ̀ⲡⲓⲙⲁⲛ̀ⲉⲣϣⲱⲟⲩϣⲓ ⲛ̀ϫⲓⲛϫⲏ ⲡⲁⲟⲩⲱϣ ⲭⲏ ϧⲉⲛ ⲑⲏⲛⲟⲩ ⲁⲛ ⲡⲉϫⲉ ⲡϭ̅ⲥ̅ ⲡⲓⲡⲁⲛⲧⲟⲕⲣⲁⲧⲱⲣ ⲟⲩⲟϩ ϯⲛⲁϭⲓ ⲛ̀ⲟⲩϣⲟⲩϣⲱⲟⲩϣⲓ ⲁⲛ ⲉ̀ⲃⲟⲗ ϧⲉⲛ ⲛⲉⲧⲉⲛϫⲓϫ		 Because even among you the doors shall be shut, and one will not kindle the fire of mine altar for nothing, I have no pleasure in you, saith the Lord Almighty, and I will not accept a sacrifice at your hands.	 διότι καὶ ἐν ὑµῖν συγκλεισθήσονται θύραι, καὶ οὐκ ἀνάψετε τὸ θυσιαστήριόν µου δωρεάν· οὐκ ἔστιν µου θέληµα ἐν ὑµῖν, λέγει κύριος παντοκράτωρ, καὶ θυσίαν οὐ προσδέξοµαι ἐκ τῶν χειρῶν ὑµῶν.						
Malachi	1	11	 ϫⲉ ⲟⲩⲏⲓ ⲓⲥϫⲉⲛ ⲛⲓⲙⲁⲛ̀ϣⲁⲓ ⲛ̀ⲧⲉ ⲫⲣⲏ ϣⲁ ⲛⲉϥⲙⲁⲛ̀ϩⲱⲧⲡ ⲁϥϭⲓⲱⲟⲩ ⲛ̀ϫⲉ ⲡⲁⲣⲁⲛ ϧⲉⲛ ⲛⲓⲉⲑⲛⲟⲥ ⲟⲩⲟϩ ϧⲉⲛ ⲙⲁⲓ ⲛⲓⲃⲉⲛ ⲥⲉⲓⲛⲓ ⲛ̀ⲟⲩⲥⲑⲟⲓⲛⲟⲩϥⲓ ⲉ̀ϩⲣⲏⲓ ϧⲉⲛ ⲡⲁⲣⲁⲛ ⲛⲉⲙ ⲟⲩϣⲟⲩϣⲱⲟⲩϣⲓ ⲉϥⲟⲩⲁⲃ ϫⲉ ⲟⲩⲛⲓϣϯ ⲡⲉ ⲡⲁⲣⲁⲛ ϧⲉⲛ ⲛⲓⲉⲑⲛⲟⲥ ⲡⲉϫⲉ ⲡϭ̅ⲥ̅ ⲡⲓⲡⲁⲛⲧⲟⲕⲣⲁⲧⲱⲣ		 For from the rising of the sun even to the going down thereof my name has been glorified among the Gentiles; and in every place incense is offered to my name, and a pure offering: for my name is great among the Gentiles, saith the Lord Almighty.	 διότι ἀπ’ ἀνατολῶν ἡλίου ἕως δυσµῶν τὸ ὄνοµά µου δεδόξασται ἐν τοῖς ἔθνεσιν, καὶ ἐν παντὶ τόπῳ θυµίαµα προσάγεται τῷ ὀνόµατί µου καὶ θυσία καθαρά, διότι µέγα τὸ ὄνοµά µου ἐν τοῖς ἔθνεσιν, λέγει κύριος παντοκράτωρ.						
Malachi	1	12	 ⲛ̀ⲑⲱⲧⲉⲛ ⲇⲉ ⲧⲉ ⲧⲉⲛⲱⲣⲉⲃ ⲙ̀ⲙⲟϥ ϧⲉⲛ ⲡϫⲓⲛⲑⲣⲉⲧⲉⲧⲉⲛϫⲟⲥ ϫⲉ ⲥϭⲁϧⲉⲙ ⲛ̀ϫⲉ ϯⲧⲣⲁⲡⲉⲍⲁ ⲛ̀ⲧⲉ ⲡϭ̅ⲥ̅ ⲟⲩⲟϩ ⲥⲉϣⲟϣϥ ⲛ̀ϫⲉ ⲛⲓϧⲣⲏⲟⲩⲓ ⲉⲧⲭⲏ ϩⲓϫⲱⲥ		 But ye profane it, in that ye say, The table of the Lord is polluted, and his meats set thereon are despised.	 ὑµεῖς δὲ βεβηλοῦτε αὐτὸ ἐν τῷ λέγειν ὑµᾶς Τράπεζα κυρίου ἠλισγηµένη ἐστίν, καὶ τὰ ἐπιτιθέµενα ἐξουδένωνται βρώµατα αὐτοῦ.						
Malachi	1	13	 ⲟⲩⲟϩ ⲡⲉϫⲱⲧⲉⲛ ϫⲉ ϩⲁⲛⲉ̀ⲃⲟⲗ ϧⲉⲛ ϩⲁⲛϧⲓⲥⲓ ⲛⲉ ⲛⲁⲓ ⲟⲩⲟϩ ⲁⲓⲛⲓϥⲓ ⲛ̀ⲥⲱⲟⲩ ⲡⲉϫⲉ ⲡϭ̅ⲥ̅ ⲡⲓⲡⲁⲛⲧⲟⲕⲣⲁⲧⲱⲣ ⲟⲩⲟϩ ⲁⲣⲉⲧⲉⲛⲓⲛⲓ ⲉ̀ϧⲟⲩⲛ ⲛ̀ⲛⲓϩⲱⲗⲉⲙ ⲛⲉⲙ ⲛⲓⲃⲉⲗⲗⲉⲩ ⲛⲉⲙ ⲛⲏ ⲉⲧⲙⲟⲕϩ ⲟⲩⲟϩ ⲁⲣⲉⲧⲉⲛϣⲁⲛⲓⲛⲓ ⲛ̀ⲟⲩϣⲟⲩϣⲱⲟⲩϣⲓ ϯⲛⲁϣⲟⲡϥ ⲁⲛ ⲛ̀ⲧⲉⲛ ⲑⲏⲛⲟⲩ ⲡⲉϫⲉ ⲡϭ̅ⲥ̅ ⲡⲓⲡⲁⲛⲧⲟⲕⲣⲁⲧⲱⲣ		 And ye said, These services are troublesome: therefore I have utterly rejected them with scorn, saith the Lord Almighty: and ye brought in torn victims, and lame, and sick: if then ye should bring an offering, shall I accept them at your hands? saith the Lord Almighty.	 καὶ εἴπατε Ταῦτα ἐκ κακοπαθείας ἐστίν, καὶ ἐξεφύσησα αὐτὰ λέγει κύριος παντοκράτωρ· καὶ εἰσεφέρετε ἁρπάγµατα καὶ τὰ χωλὰ καὶ τὰ ἐνοχλούµενα· καὶ ἐὰν φέρητε τὴν θυσίαν, εἰ προσδέξοµαι αὐτὰ ἐκ τῶν χειρῶν ὑµῶν; λέγει κύριος παντοκράτωρ.						
Malachi	1	14	 ⲟⲩⲟϩ ϥⲥϩⲟⲩⲟⲣⲧ ⲛ̀ϫⲉ ⲟⲩⲣⲱⲙⲓ ⲛ̀ϫⲱⲣⲓ ⲫⲏ ⲉⲧⲉ ⲟⲩⲟⲛ ϣ̀ϫⲟⲙ ⲙ̀ⲙⲟϥ ⲟⲩⲟϩ ⲉⲧⲉ ⲟⲩⲟⲛ ϩⲱⲟⲩⲧ ϣⲟⲡ ϧⲉⲛ ⲡⲉϥⲟϩⲓ ⲟⲩⲟϩ ⲉⲣⲉ ⲧⲉϥⲯⲩⲭⲏ ϩⲓϫⲱϥ ⲟⲩⲟϩ ⲉϥϣⲱⲧ ⲛ̀ⲛⲏ ⲉⲧⲧⲁⲕⲏⲟⲩⲧ ⲙ̀ⲡϭ̅ⲥ̅ ϫⲉ ⲟⲩⲏⲓ ⲁ̀ⲛⲟⲕ ⲟⲩⲛⲓϣϯ ⲛ̀ⲟⲩⲣⲟ ⲁ̀ⲛⲟⲕ ⲡⲉϫⲉ ⲡϭ̅ⲥ̅ ⲡⲓⲡⲁⲛⲧⲟⲕⲣⲁⲧⲱⲣ ⲟⲩⲟϩ ⲡⲁⲣⲁⲛ ϥⲟⲩⲱⲛϩ ⲉ̀ⲃⲟⲗ ϧⲉⲛ ⲛⲓⲉⲑⲛⲟⲥ		 And cursed is the man who had the power, and possessed a male in his flock, and whose vow is upon him, and who sacrifices a corrupt thing to the Lord: for I am a great King, saith the Lord Almighty, and my name is glorious among the nations.	 καὶ ἐπικατάρατος ὃς ἦν δυνατὸς καὶ ὑπῆρχεν ἐν τῷ ποιµνίῳ αὐτοῦ ἄρσεν καὶ εὐχὴ αὐτοῦ ἐπ’ αὐτῷ καὶ θύει διεφθαρµένον τῷ κυρίῳ· διότι βασιλεὺς µέγας ἐγώ εἰµι, λέγει κύριος παντοκράτωρ, καὶ τὸ ὄνοµά µου ἐπιφανὲς ἐν τοῖς ἔθνεσιν.						
Malachi	2	1	 ⲟⲩⲟϩ ϯⲛⲟⲩ ⲁⲣⲉ ⲧⲁⲓⲉⲛⲧⲟⲗⲏ ϣⲟⲡ ϩⲁⲣⲱⲧⲉⲛ ⲛⲓⲟⲩⲏⲃ		 And now, O priests, this commandment is to you.	 Καὶ νῦν ἡ ἐντολὴ αὕτη πρὸς ὑµᾶς, οἱ ἱερεῖς·						
Malachi	2	2	 ⲉ̀ϣⲱⲡ ⲁⲣⲉⲧⲉⲛϣ̀ⲧⲉⲙⲥⲱⲧⲉⲙ ⲟⲩⲟϩ ⲉ̀ϣⲱⲡ ⲁⲣⲉⲧⲉⲛϣ̀ⲧⲉⲙⲭⲁⲥ ϧⲉⲛ ⲛⲉⲧⲉⲛϩⲏⲧ ⲉ̀ϯⲱⲟⲩ ⲙ̀ⲡⲁⲣⲁⲛ ⲡⲉϫⲉ ⲡϭ̅ⲥ̅ ⲡⲓⲡⲁⲛⲧⲟⲕⲣⲁⲧⲱⲣ ⲟⲩⲟϩ ⲉⲓⲉ̀ⲟⲩⲱⲣⲡ ⲉ̀ϩⲣⲏⲓ ⲉ̀ϫⲉⲛ ⲑⲏⲛⲟⲩ ⲙ̀ⲡⲓⲥⲁϩⲟⲩⲓ ⲟⲩⲟϩ ⲉⲓⲉ̀ⲥϩⲟⲩⲱⲣⲡ ⲡⲉⲧⲉⲛⲥⲙⲟⲩ ⲟⲩⲟϩ ⲉⲓⲉ̀ⲥⲁϩⲟⲩⲓ ⲉ̀ⲣⲟϥ ⲟⲩⲟϩ ⲉⲓⲉ̀ϫⲱⲣ ⲉ̀ⲃⲟⲗ ⲙ̀ⲡⲉⲧⲉⲛⲥⲙⲟⲩ ⲟⲩⲟϩ ⲛ̀ⲛⲉϥϣⲱⲡⲓ ϧⲉⲛ ⲑⲏⲛⲟⲩ ϫⲉ ⲛ̀ⲑⲱⲧⲉⲛ ⲧⲉⲧⲉⲛϫⲱ ⲙ̀ⲙⲟϥ ⲁⲛ ϧⲉⲛ ⲡⲉⲧⲉⲛϩⲏⲧ		 If ye will not hearken, and if ye will not lay it to heart, to give glory to my name, saith the Lord Almighty, then I will send forth the curse upon you, and I will bring a curse upon your blessing: yea, I will curse it, and I will scatter your blessing, and it shall not exist among you, because ye lay not this to heart.	 ἐὰν µὴ ἀκούσητε, καὶ ἐὰν µὴ θῆσθε εἰς τὴν καρδίαν ὑµῶν τοῦ δοῦναι δόξαν τῷ ὀνόµατί µου, λέγει κύριος παντοκράτωρ, καὶ ἐξαποστελῶ ἐφ’ ὑµᾶς τὴν κατάραν καὶ ἐπικαταράσοµαι τὴν εὐλογίαν ὑµῶν καὶ καταράσοµαι αὐτήν· καὶ διασκεδάσω τὴν εὐλογίαν ὑµῶν, καὶ οὐκ ἔσται ἐν ὑµῖν, ὅτι ὑµεῖς οὐ τίθεσθε εἰς τὴν καρδίαν ὑµῶν.						
Malachi	2	3	 ϩⲏⲡⲡⲉ ⲁ̀ⲛⲟⲕ ϯⲛⲁⲫⲱⲣϫ ⲛⲱⲧⲉⲛ ⲙ̀ⲡⲓϣⲱⲃϣ ⲟⲩⲟϩ ϯⲛⲁϫⲱⲣ ⲉ̀ⲃⲟⲗ ⲙ̀ⲡⲓⲙⲁϧⲧ ⲉ̀ϫⲉⲛ ⲛⲉⲧⲉⲛϩⲟ ⲡⲓⲙⲁϧⲧ ⲉ̀ϫⲉⲛ ⲛⲉⲧⲉⲛϣⲁⲓ ⲟⲩⲟϩ ⲉⲓⲉ̀ϭⲓ ⲑⲏⲛⲟⲩ ⲉⲩⲥⲟⲡ		 Behold, I turn my back upon you, and I will scatter dung upon your faces, the dung of your feasts, and I will carry you away at the same time.	 ἰδοὺ ἐγὼ ἀφορίζω ὑµῖν τὸν ὦµον καὶ σκορπιῶ ἤνυστρον ἐπὶ τὰ πρόσωπα ὑµῶν, ἤνυστρον ἑορτῶν ὑµῶν, καὶ λήµψοµαι ὑµᾶς εἰς τὸ αὐτό·						
Malachi	2	4	 ⲟⲩⲟϩ ⲉⲣⲉⲧⲉⲛⲉ̀ⲉⲙⲓ ϫⲉ ⲁ̀ⲛⲟⲕ ⲁⲓⲟⲩⲱⲣⲡ ϩⲁⲣⲱⲧⲉⲛ ⲛ̀ⲧⲁⲓⲉⲛⲧⲟⲗⲏ ⲉⲑⲣⲉ ⲧⲁⲇⲓⲁⲑⲏⲕⲏ ϣⲱⲡⲓ ⲛⲉⲙ ⲛⲓⲗⲉⲩⲓⲧⲏⲥ ⲡⲉϫⲉ ⲡϭ̅ⲥ̅ ⲡⲓⲡⲁⲛⲧⲟⲕⲣⲁⲧⲱⲣ		 And ye shall know that I have sent this commandment to you, that my covenant might be with the sons of Levi, saith the Lord Almighty.	 καὶ ἐπιγνώσεσθε διότι ἐγὼ ἐξαπέσταλκα πρὸς ὑµᾶς τὴν ἐντολὴν ταύτην τοῦ εἶναι τὴν διαθήκην µου πρὸς τοὺς Λευίτας, λέγει κύριος παντοκράτωρ.						
Malachi	2	5	 ⲧⲁⲇⲓⲁⲑⲏⲕⲏ ⲛⲁⲥ ⲛⲉⲙⲁϥ ϧⲉⲛ ⲡⲱⲛϧ ⲛⲉⲙ ϯϩⲓⲣⲏⲛⲏ ⲟⲩⲟϩ ⲁⲓϯ ⲛⲁϥ ⲉ̀ⲑⲣⲉϥⲉⲣϩⲟϯ ϧⲁⲧⲁϩⲏ ϧⲉⲛ ⲟⲩϩⲟϯ ⲟⲩⲟϩ ⲉ̀ⲑⲣⲉϥϩⲉⲛϥ ⲛⲁϥ ϧⲁϫⲉⲛ ⲡϩⲟ ⲙ̀ⲡⲁⲣⲁⲛ		 My covenant of life and peace was with him, and I gave it him that he might reverently fear me, and that he might be awe-struck at my name.	 ἡ διαθήκη µου ἦν µετ’ αὐτοῦ τῆς ζωῆς καὶ τῆς εἰρήνης, καὶ ἔδωκα αὐτῷ ἐν φόβῳ φοβεῖσθαί µε καὶ ἀπὸ προσώπου ὀνόµατός µου στέλλεσθαι αὐτόν.						
Malachi	2	6	 ⲟⲩⲛⲟⲙⲟⲥ ⲛ̀ⲧⲉ ϯⲙⲉⲑⲙⲏⲓ ⲉ̀ⲛⲁϥⲭⲏ ϧⲉⲛ ⲣⲱϥ ⲟⲩⲟϩ ⲙ̀ⲡⲟⲩϫⲓⲙⲓ ⲛ̀ⲟⲩϭⲓⲛ̀ϫⲟⲛⲥ ϧⲉⲛ ⲛⲉϥⲥⲫⲟⲧⲟⲩ ⲁϥⲙⲟϣⲓ ⲛⲉⲙⲏⲓ ⲉϥⲥⲟⲩⲧⲱⲛ ϧⲉⲛ ⲟⲩϩⲓⲣⲏⲛⲏ ⲟⲩⲟϩ ⲁϥⲧⲁⲥⲑⲟ ⲛ̀ⲟⲩⲙⲏϣ ⲉ̀ⲃⲟⲗ ϧⲉⲛ ⲡϭⲓⲛ̀ϫⲟⲛⲥ		 The law of truth was in his mouth, and iniquity was not found in his lips: he walked before me directing his way in peace, and he turned many from unrighteousness.	 νόµος ἀληθείας ἦν ἐν τῷ στόµατι αὐτοῦ, καὶ ἀδικία οὐχ εὑρέθη ἐν χείλεσιν αὐτοῦ· ἐν εἰρήνῃ κατευθύνων ἐπορεύθη µετ’ ἐµοῦ καὶ πολλοὺς ἐπέστρεψεν ἀπὸ ἀδικίας.						
Malachi	2	7	 ϫⲉ ⲛⲓⲥⲫⲟⲧⲟⲩ ⲛ̀ⲧⲉ ⲟⲩⲟⲩⲏⲃ ⲉⲩⲉ̀ⲁⲣⲉϩ ⲉ̀ⲟⲩⲅⲛⲱⲥⲓⲥ ⲟⲩⲟϩ ⲉⲩⲉ̀ⲕⲱϯ ⲛ̀ⲥⲁ ⲟⲩⲛⲟⲙⲟⲥ ⲉ̀ⲃⲟⲗ ϧⲉⲛ ⲣⲱϥ ϫⲉ ⲟⲩⲁⲅⲅⲉⲗⲟⲥ ⲡⲉ ⲛ̀ⲧⲉ ⲡϭ̅ⲥ̅ ⲡⲓⲡⲁⲛⲧⲟⲕⲣⲁⲧⲱⲣ		 For the priest’s lips should keep knowledge, and they should seek the law at his mouth: for he is the messenger of the Lord Almighty.	 ὅτι χείλη ἱερέως φυλάξεται γνῶσιν, καὶ νόµον ἐκζητήσουσιν ἐκ στόµατος αὐτοῦ, διότι ἄγγελος κυρίου παντοκράτορός ἐστιν.						
Malachi	2	8	 ⲛ̀ⲑⲱⲧⲉⲛ ⲇⲉ ⲁⲣⲉⲧⲉⲛⲣⲓⲕⲓ ⲉ̀ⲃⲟⲗ ϧⲉⲛ ⲡⲓⲙⲱⲓⲧ ⲟⲩⲟϩ ⲁⲣⲉⲧⲉⲛⲑⲣⲉ ⲟⲩⲙⲏϣ ϣⲱⲛⲓ ϧⲉⲛ ⲡⲓⲛⲟⲙⲟⲥ ⲁⲣⲉⲧⲉⲛⲧⲁⲕⲟ ⲛ̀ϯⲇⲓⲁⲑⲏⲕⲏ ⲛ̀ⲧⲉ ⲗⲉⲩⲓ ⲡⲉϫⲉ ⲡϭ̅ⲥ̅ ⲡⲓⲡⲁⲛⲧⲟⲕⲣⲁⲧⲱⲣ		 But ye have turned aside from the way, and caused many to fail in following the law: ye have corrupted the covenant of Levi, saith the Lord Almighty.	 ὑµεῖς δὲ ἐξεκλίνατε ἐκ τῆς ὁδοῦ καὶ πολλοὺς ἠσθενήσατε ἐν νόµῳ, διεφθείρατε τὴν διαθήκην τοῦ Λευι, λέγει κύριος παντοκράτωρ.						
Malachi	2	9	 ⲟⲩⲟϩ ⲁ̀ⲛⲟⲕ ⲁⲓϯ ⲑⲏⲛⲟⲩ ⲉⲣⲉⲧⲉⲛϩⲱⲟⲩⲓ ⲉ̀ⲃⲟⲗ ϧⲉⲛ ⲛⲓⲉⲑⲛⲟⲥ ⲧⲏⲣⲟⲩ ⲉ̀ⲫⲙⲁ ϫⲉ ⲛ̀ⲑⲱⲧⲉⲛ ⲙ̀ⲡⲉⲧⲉⲛⲁⲣⲉϩ ⲉ̀ⲛⲁⲙⲱⲓⲧ ⲁⲗⲗⲁ ⲁⲣⲉⲧⲉⲛϫⲟⲩϣⲧ ⲉ̀ϩⲟ ϧⲉⲛ ⲡⲓⲛⲟⲙⲟⲥ		 And I have made you despised and cast out among all the people, because ye have not kept my ways, but have been partial in the law.	 κἀγὼ δέδωκα ὑµᾶς ἐξουδενωµένους καὶ παρειµένους εἰς πάντα τὰ ἔθνη, ἀνθ’ ὧν ὑµεῖς οὐκ ἐφυλάξασθε τὰς ὁδούς µου, ἀλλὰ ἐλαµβάνετε πρόσωπα ἐν νόµῳ.						
Malachi	2	10	 ⲙⲏ ⲟⲩⲛⲟⲩϯ ⲛ̀ⲟⲩⲱⲧ ⲁⲛ ⲡⲉ ⲉⲧⲉⲛⲧⲱⲧⲉⲛ ⲧⲏⲣⲟⲩ ⲉⲑⲃⲉ ⲟⲩ ⲡⲓⲟⲩⲁⲓ ⲡⲓⲟⲩⲁⲓ ⲙ̀ⲙⲱⲧⲉⲛ ⲭⲱ ⲛ̀ⲥⲱϥ ⲙ̀ⲡⲉϥⲥⲟⲛ ⲉⲑⲣⲉ ⲧⲉⲧⲉⲛⲥⲱϥ ⲛ̀ϯⲇⲓⲁⲑⲏⲕⲏ ⲛ̀ⲧⲉ ⲛⲉⲧⲉⲛⲓⲟϯ		 Have ye not all one father? Did not one God create you? why have ye forsaken every man his brother, to profane the covenant of your fathers?	 Οὐχὶ θεὸς εἷς ἔκτισεν ὑµᾶς; οὐχὶ πατὴρ εἷς πάντων ὑµῶν; τί ὅτι ἐγκατελίπετε ἕκαστος τὸν ἀδελφὸν αὐτοῦ τοῦ βεβηλῶσαι τὴν διαθήκην τῶν πατέρων ὑµῶν;						
Malachi	2	11	 ⲁⲩⲥⲱϫⲡ ⲛ̀ⲓⲟⲩⲇⲁⲥ ⲟⲩⲟϩ ⲁϥϣⲱⲡⲓ ⲛ̀ϫⲉ ⲟⲩⲱⲣⲉⲃ ϧⲉⲛ ⲡⲓⲥ̅ⲗ̅ ⲛⲉⲙ ϧⲉⲛ ⲓⲗ̅ⲏ̅ⲙ̅ ϫⲉ ⲟⲩⲏⲓ ⲁϥⲥⲱϥ ⲛ̀ϫⲉ ⲓⲟⲩⲇⲁⲥ ⲛ̀ⲛⲏ ⲉⲑⲟⲩⲁⲃ ⲛ̀ⲧⲉ ⲡϭ̅ⲥ̅ ϧⲉⲛ ⲛⲏ ⲉⲧⲁϥⲙⲉⲛⲣⲓⲧⲟⲩ ⲟⲩⲟϩ ⲁϥϩⲓⲧⲟⲩ ⲉ̀ϩⲁⲛⲛⲟⲩϯ ⲛ̀ϣⲉⲙⲙⲟ		 Juda has been forsaken, and an abomination has been committed in Israel and in Jerusalem; for Juda has profaned the holy things of the Lord, which he delighted in, and has gone after other gods.	 ἐγκατελείφθη Ιουδας, καὶ βδέλυγµα ἐγένετο ἐν τῷ Ισραηλ καὶ ἐν Ιερουσαληµ, διότι ἐβεβήλωσεν Ιουδας τὰ ἅγια κυρίου, ἐν οἷς ἠγάπησεν, καὶ ἐπετήδευσεν εἰς θεοὺς ἀλλοτρίους.						
Malachi	2	12	 ⲉⲣⲉ ⲡϭ̅ⲥ̅ ϥⲱϯ ⲉ̀ⲃⲟⲗ ⲙ̀ⲡⲓⲣⲱⲙⲓ ⲉⲧⲓⲣⲓ ⲛ̀ⲛⲁⲓ ϣⲁⲧⲉϥⲑⲉⲃⲓⲟ ⲉ̀ⲃⲟⲗ ϧⲉⲛ ⲛⲓⲙⲁⲛ̀ϣⲱⲡⲓ ⲛ̀ⲧⲉ ⲓⲁⲕⲱⲃ ⲛⲉⲙ ⲉ̀ϧⲟⲗϧⲉⲗ ⲛ̀ⲛⲏ ⲉⲧⲓⲛⲓ ⲛ̀ⲟⲩϣⲟⲩϣⲱⲟⲩϣⲓ ⲉ̀ϧⲟⲩⲛ ⲙ̀ⲡϭ̅ⲥ̅ ⲡⲓⲡⲁⲛⲧⲟⲕⲣⲁⲧⲱⲣ		 The Lord will utterly destroy the man that does these things, until he be even cast down from out of the tabernacles of Jacob, and from among them that offer sacrifice to the Lord Almighty.	 ἐξολεθρεύσει κύριος τὸν ἄνθρωπον τὸν ποιοῦντα ταῦτα, ἕως καὶ ταπεινωθῇ ἐκ σκηνωµάτων Ιακωβ καὶ ἐκ προσαγόντων θυσίαν τῷ κυρίῳ παντοκράτορι.						
Malachi	2	13	 ⲟⲩⲟϩ ⲛⲁⲓ ⲉ̀ⲛⲁⲓⲙⲟⲥϯ ⲙ̀ⲙⲱⲟⲩ ⲛⲁⲣⲉⲧⲉⲛⲓⲣⲓ ⲙ̀ⲙⲱⲟⲩ ⲛⲁⲣⲉⲧⲉⲛϩⲱⲃⲥ ⲙ̀ⲡⲓⲙⲁⲛ̀ⲉⲣϣⲱⲟⲩϣⲓ ⲛ̀ⲧⲉ ⲡϭ̅ⲥ̅ ϧⲉⲛ ϩⲁⲛⲉⲣⲙⲱⲟⲩⲓ ⲛⲉⲙ ⲟⲩⲣⲓⲙⲓ ⲛⲉⲙ ⲟⲩϥⲓⲁϩⲟⲙ ⲉ̀ⲃⲟⲗ ϧⲉⲛ ϩⲁⲛϧⲓⲥⲓ ⲙⲏ ⲡⲉⲧⲥϣⲉ ⲉ̀ϫⲟⲩϣⲧ ⲉ̀ϫⲉⲛ ⲟⲩϣⲟⲩϣⲱⲟⲩϣⲓ ⲛ̀ⲧⲱⲧⲉⲛ ⲓⲉ ⲉ̀ϭⲓ ⲛ̀ⲟⲩⲧⲁⲓⲟ ⲉ̀ⲃⲟⲗ ϧⲉⲛ ⲛⲉⲧⲉⲛϫⲓϫ		 And these things which I hated, ye did: ye covered with tears the altar of the Lord, and with weeping and groaning because of troubles: is it meet for me to have respect to your sacrifice, or to receive anything from your hands as welcome?	 καὶ ταῦτα, ἃ ἐµίσουν, ἐποιεῖτε· ἐκαλύπτετε δάκρυσιν τὸ θυσιαστήριον κυρίου καὶ κλαυθµῷ καὶ στεναγµῷ ἐκ κόπων. ἔτι ἄξιον ἐπιβλέψαι εἰς θυσίαν ἢ λαβεῖν δεκτὸν ἐκ τῶν χειρῶν ὑµῶν;						
