book	chapter	verse	Bohairic	Sahidic	English	Greek	Fayyumic	Akhmimic	OldBohairic	Mesokemic	DialectP	Lycopolitan
Proverbs	7	12	 ϣⲁⲥⲉⲣⲟⲩⲥⲏⲟⲩ ⲅⲁⲣ ⲉⲥⲗⲉⲗⲉ ⲉ̀ⲃⲟⲗ ϣⲁⲥⲉⲣⲟⲩⲥⲏⲟⲩ ⲇⲉ ϧⲉⲛ ⲛⲓⲡⲗⲁⲧⲓⲁ ⲉⲥϫⲱⲣϫ ⲉⲥⲕⲉⲛ ⲉⲗⲕⲉ ⲛⲓⲃⲉⲛ	 ϣⲁⲥⲣ̅ⲟⲩⲟⲉⲓϣ ⲅⲁⲣ ⲉⲥⲕⲱⲧⲉ ϩⲓⲃⲟⲗ ⲟⲩⲟⲩⲟⲉⲓϣ ϫⲉ ⲉⲥϭⲟⲣϭ̅ ϩⲁⲧⲛ̅ ⲛ̅ⲕⲗϫⲉ ⲛⲓⲙ ϩⲛ̅ ⲛ̅ⲡⲗⲁⲧⲓⲁ.	 For at one time she wanders without, and at another time she lies in wait in the streets, at every corner.	 χρόνον γάρ τινα ἔξω ῥέµβεται, χρόνον δὲ ἐν πλατείαις παρὰ πᾶσαν γωνίαν ἐνεδρεύει.						
Proverbs	7	13	 ⲓⲧⲁ ϣⲁⲥⲁⲙⲟⲛⲓ ⲙ̀ⲙⲟϥ ϣⲁⲥϯⲫⲓ ⲉⲣⲟϥ ϧⲉⲛ ⲟⲩϩⲟ ⲇⲉ ⲛⲁⲧϣⲓⲡⲓ ϣⲁⲥϫⲟⲥ ⲛⲁϥ	 ⲙⲛ̅ⲛ̅ⲥⲱⲥ ϣⲁⲥⲁⲙⲁϩⲧⲉ ⲙ̅ⲙⲟϥ ⲛⲥ̅ϯⲡⲉ ⲉⲣⲱϥ ϩⲛ̅ ⲟⲩϩⲟ ⲇⲉ ⲛ̅ⲁⲧϣⲓⲡⲉ ϣⲁⲥϫⲟⲟⲥ ⲛⲁϥ	 Then she caught him, and kissed him, and with an impudent face said to him,	 εἶτα ἐπιλαβοµένη ἐφίλησεν αὐτόν, ἀναιδεῖ δὲ προσώπῳ προσεῖπεν αὐτῷ						
Proverbs	7	14	 ϫⲉ ⲟⲩϣⲟⲩϣⲱⲟⲩϣⲓ ⲛ̀ϩⲓⲣⲏⲛⲓⲕⲟⲛ ⲉⲧϣⲱⲡ ⲛⲏⲓ ϯⲛⲁϯ ⲛ̀ⲛⲁⲉⲩⲭⲏ ⲙ̀ⲫⲟⲟⲩ	 ϫⲉ ⲟⲩⲑⲩⲥⲓⲁ ⲛ̅ⲉⲓⲣⲏⲛⲓⲕⲏ ⲛⲁⲓ̈ ⲡⲉ ⲡⲟⲟⲩ ϯⲛⲁϯ ⲛ̅ⲛⲁⲉⲣⲁⲧⲉ.	 I have a peace-offering; today I pay my vows:	 Θυσία εἰρηνική µοί ἐστιν, σήµερον ἀποδίδωµι τὰς εὐχάς µου·						
Proverbs	7	15	 ⲉⲑⲃⲉⲫⲁⲓ ⲁⲓⲓ̀ ⲉ̀ⲃⲟⲗ ⲉ̀ϩⲣⲁⲕ ⲉⲓⲙⲉⲓ ⲉ̀ⲡⲉⲕϩⲟ ⲟⲩⲟϩ ⲁⲓϫⲉⲙⲕ	 ⲉⲧⲃⲉ ⲡⲁⲓ ⲁⲓ̈ⲉⲓ ⲉⲃⲟⲗ ⲉⲧⲱⲙⲛ̅ⲧ ⲉⲣⲟⲕ ⲉⲓ̈ⲟⲩⲉϣ ⲡⲉⲕϩⲟ ⲁⲓ̈ϩⲉ ⲉⲣⲟϥ.	 therefore I came forth to meet thee, desiring thy face; and I have found thee.	 ἕνεκα τούτου ἐξῆλθον εἰς συνάντησίν σοι, ποθοῦσα τὸ σὸν πρόσωπον εὕρηκά σε·						
Proverbs	7	16	 ⲁⲓϭⲱⲗⲕ ⲙ̀ⲡⲁϭⲁⲗⲁⲩϫ ϧⲉⲛ ϩⲁⲛⲥⲉⲃⲉⲛ ϧⲉⲛ ϩⲁⲛⲉⲛⲓⲧⲁⲡⲟⲥ ⲇⲉ ⲛ̀ⲧⲉ ⲭⲏⲙⲓ ⲁⲓⲫⲟⲣϣϥ	 ⲁⲓⲥⲱⲙⲛ̅ⲧ ⲙ̅ⲡⲁϭⲗⲟϭ ϩⲛ̅ ϩⲉⲛⲕⲉⲣⲉⲁ ⲁⲓ̈ⲡⲟⲣϣϥ̅ ⲇⲉ ⲛⲁⲙⲫⲓⲧⲁⲛⲟⲥ ⲛ̅ⲧⲉⲕⲏⲙⲉ.	 I have spread my bed with sheets, and I have covered it with double tapestry from Egypt.	 κειρίαις τέτακα τὴν κλίνην µου, ἀµφιτάποις δὲ ἔστρωκα τοῖς ἀπ’ Αἰγύπτου·						
Proverbs	7	17	 ⲁⲓⲛⲟⲩϫϧ ⲛ̀ⲧⲁϣⲁⲓⲣⲓ ϧⲉⲛ ⲟⲩⲕⲣⲟⲕⲟⲥ ⲡⲁⲏⲓ ⲇⲉ ϧⲉⲛ ⲟⲩⲕⲩⲛⲁⲙⲱⲛⲟⲛ	 ⲁⲓ̈ⲛⲟⲩϫϭ̅ ⲙ̅ⲡⲁϭⲗⲟϭ ϩⲛ̅ ⲟⲩⲕⲣⲟⲕⲕⲟⲥ ⲁⲩⲱ ⲡⲁⲏⲓ̈ ϩⲛ̅ ⲟⲩⲕⲓⲛⲁⲙⲱⲙⲟⲛ.	 I have sprinkled my couch with saffron, and my house with cinnamon.	 διέρραγκα τὴν κοίτην µου κρόκῳ, τὸν δὲ οἶκόν µου κινναµώµῳ·						
Proverbs	7	18	 ⲁⲙⲟⲩ ⲛ̀ⲧⲉⲛⲟⲩⲛⲟϥ ϧⲉⲛ ⲟⲩⲙⲉⲓ ϣⲁⲧⲟⲟⲩⲓ ⲁⲙⲟⲩ ⲛ̀ⲧⲉⲛⲥⲕⲉⲣⲕⲉⲣ ϧⲉⲛ ⲟⲩⲙⲉⲓ	 ⲁⲙⲟⲩ ⲛ̅ⲧⲛ̅ⲙ̅ⲧⲟⲛ ⲙ̅ⲙⲟⲛ ϩⲛ̅ ⲟⲩⲙⲛ̅ⲧϣⲃⲏⲣ ϣⲁϩⲧⲟⲟⲩⲉ ⲁⲙⲟⲩ ⲛ̅ⲧⲛ̅ϩⲱⲗϭ̅ ϩⲛ̅ ⲟⲩⲙⲉ.	 Come, and let us enjoy love until the morning; come, and let us embrace in love.	 ἐλθὲ καὶ ἀπολαύσωµεν φιλίας ἕως ὄρθρου, δεῦρο καὶ ἐγκυλισθῶµεν ἔρωτι·						
Proverbs	7	19	 ϥⲧⲁⲓ ⲅⲁⲣ ⲁⲛ ⲛ̀ϫⲉ ⲡⲁϩⲁⲓ ϧⲉⲛ ⲡⲁⲏⲓ ⲁϥϣⲉ ⲛⲁϥ ⲉ̀ⲟⲩⲙⲱⲓⲧ ⲉϥⲟⲩⲏⲟⲩ	 ⲙ̅ⲡⲁϩⲁⲓ ⲅⲁⲣ ϩⲙ̅ ⲡⲁⲏⲓ̈ ⲁⲛ ⲁϥⲃⲱⲕ ⲉⲩϩⲓⲏ ⲉⲥⲟⲩⲏⲩ	 For my husband is not at home, but is gone on a long journey,	 οὐ γὰρ πάρεστιν ὁ ἀνήρ µου ἐν οἴκῳ, πεπόρευται δὲ ὁδὸν µακρὰν						
Proverbs	7	20	 ⲉ̀ⲁϥⲱⲗⲓ ⲛ̀ⲟⲩⲥⲁⲟⲩⲓ ⲛ̀ϩⲟⲙⲧ ϧⲉⲛ ⲛⲉϥϫⲓϫ ϩⲓⲧⲉⲛ ⲟⲩⲙⲏϣ ⲛ̀ⲉϩⲟⲟⲩ ϥⲛⲁⲧⲁⲥⲑⲟ ⲉ̀ⲡⲉϥⲏⲓ	 ⲉⲣⲉ ⲟⲩⲧⲱⲱⲙⲉ ϩⲛ̅ ⲛⲉϥϭⲓϫ ϩⲓⲧⲛ̅ ⲟⲩⲙⲏⲏϣⲉ ⲛ̅ϩⲟⲟⲩ ⲉϥⲛⲁⲕⲟⲧϥ̅ ⲉⲡⲉϥⲏⲓ̈.	 having taken in his hand a bundle of money: after many days he will return to his house.	 ἔνδεσµον ἀργυρίου λαβὼν ἐν χειρὶ αὐτοῦ, δι’ ἡµερῶν πολλῶν ἐπανήξει εἰς τὸν οἶκον αὐτοῦ.						
Proverbs	7	21	 ϣⲁⲥⲥⲟⲣⲙⲉϥ ⲇⲉ ϧⲉⲛ ϩⲁⲛⲙⲏϣ ⲛ̀ⲥⲁϫⲓ ϧⲉⲛ ⲛⲓϩⲁϫⲓ ⲇⲉ ⲛ̀ⲧⲉ ⲛⲉⲥⲥⲫⲟⲧⲟⲩ ϣⲁⲥⲫⲟⲛϫϥ ⲉ̀ⲃⲟⲗ	 ⲁⲥⲡⲗⲁⲛⲁ ⲇⲉ ⲙ̅ⲙⲟϥ ϩⲛ̅ ⲟⲩⲛⲟϭ ⲛ̅ϩⲟⲙⲓⲗⲓⲁ ⲛ̅ϣⲁϫⲉ ⲁⲥⲙⲟⲣϥ̅ ⲇⲉ ϩⲛ̅ ⲛ̅ϩⲁϭⲉ ⲉⲃⲟⲗ ϩⲛ̅ ⲛⲉⲥⲡⲟⲧⲟⲩ ⲁⲥⲑⲓⲟϥ ⲉⲃⲟⲗ	 So with much converse she prevailed on him to go astray, and with the snares of her lips forced him from the right path.	 ἀπεπλάνησεν δὲ αὐτὸν πολλῇ ὁµιλίᾳ βρόχοις τε τοῖς ἀπὸ χειλέων ἐξώκειλεν αὐτόν.						
Proverbs	7	22	 ⲛ̀ⲑⲟϥ ⲇⲉ ϣⲁϥⲙⲟϣⲓ ⲛ̀ⲥⲱⲥ ⲉⲣⲉ ⲡⲉϥϩⲏⲧ ⲧⲟⲙⲧ ϣⲁⲥⲉⲛϥ ⲇⲉ ⲙ̀ⲫⲣⲏϯ ⲛ̀ⲟⲩⲟⲩϩⲟⲣ ⲉⲩⲛⲁⲉⲛϥ ⲉ̀ⲡⲥⲟⲛϩϥ ⲛⲉⲙ ⲙ̀ⲫⲣⲏϯ ⲛ̀ⲟⲩⲉⲓⲟⲩⲗ	 ⲛ̅ⲧⲟϥ ⲇⲉ ⲁϥⲟⲩⲁϩϥ̅ ⲛ̅ⲥⲱⲥ ϩⲛ̅ ⲟⲩⲛⲟϭ ⲙ̅ⲙⲛ̅ⲧⲁⲑⲏⲧ ⲉϥϣⲧⲣ̅ⲧⲱⲣ ⲛ̅ⲑⲉ ⲛ̅ⲟⲩⲙⲁⲥⲉ ⲉⲩⲛⲁⲛⲧϥ̅ ⲉⲡⲉϥⲙⲁⲛ̅ⲕⲟⲛⲥϥ̅ ⲁⲩⲱ ⲛ̅ⲑⲉ ⲛ̅ⲟⲩⲟⲩϩⲟⲣ ⲉϥϭⲉⲡⲏ ⲉⲧⲁⲁϥ ⲉⲡⲉⲕⲗⲁⲗ.	 And he followed her, being gently led on, and that as an ox is led to the slaughter, and as a dog to bonds, or as a hart shot in the liver with an arrow:	 ὁ δὲ ἐπηκολούθησεν αὐτῇ κεπφωθείς, ὥσπερ δὲ βοῦς ἐπὶ σφαγὴν ἄγεται καὶ ὥσπερ κύων ἐπὶ δεσµοὺς						
Proverbs	7	23	 ⲉϥⲙⲁϣⲓ ⲛ̀ⲟⲩϣⲉⲛⲥⲟⲑⲛⲉϥ ϧⲉⲛ ⲡⲉϥϩⲏⲡⲁⲣ ϥⲓⲏⲥ ⲇⲉ ⲙ̀ⲫⲣⲏϯ ⲛ̀ⲟⲩϩⲁⲗⲏⲧ ⲉ̀ⲟⲩⲫⲁϣ ⲛ̀ϥⲥⲱⲟⲩⲛ ⲁⲛ ϫⲉ ⲁϥϭⲟϫⲓ ⲉϯ ⲛ̀ⲧⲉϥⲯⲩⲭⲏ	 ⲏ ⲛ̅ⲑⲉ ⲛ̅ⲟⲩⲉⲓⲟⲩⲗ ⲉⲁⲩϣⲟⲟⲩⲉϥ ⲛ̅ⲟⲩⲥⲟⲧⲉ ⲉⲡⲉϥϩⲏⲡⲁⲣ ϥϭⲉⲡⲏ ⲇⲉ ⲛ̅ⲑⲉ ⲛ̅ⲟⲩϩⲁⲗⲏⲧ ⲉⲩⲡⲁϣ ⲉⲛϥ̅ⲥⲟⲟⲩⲛ ⲁⲛ ϫⲉ ⲡⲙⲁ ⲙ̅ⲡⲉϥⲧⲏⲩ ⲡⲉ.	 and he hastens as a bird into a snare, not knowing that he is running for his life.	 ἢ ὡς ἔλαφος τοξεύµατι πεπληγὼς εἰς τὸ ἧπαρ, σπεύδει δὲ ὥσπερ ὄρνεον εἰς παγίδα οὐκ εἰδὼς ὅτι περὶ ψυχῆς τρέχει.						
Proverbs	7	24	 ϯⲛⲟⲩ ⲟⲩⲛ ⲡⲁϣⲏⲣⲓ ⲥⲱⲧⲉⲙ ⲛ̀ⲥⲱⲓ ⲟⲩⲟϩ ⲙⲁϩⲑⲏⲕ ⲉ̀ⲛⲓⲥⲁϫⲓ ⲛ̀ⲧⲉⲣⲱⲓ	 ⲧⲉⲛⲟⲩ ϭⲉ ⲡⲁϣⲏⲣⲉ ⲥⲱⲧⲙ̅ ⲉⲣⲟⲓ̈ ⲛⲅ̅ϯϩⲧⲏⲕ ⲉⲛ̅ϣⲁϫⲉ ⲛ̅ⲣⲱⲓ̈.	 Now then, my son, hearken to me, and attend to the words of my mouth.	 νῦν οὖν, υἱέ, ἄκουέ µου καὶ πρόσεχε ῥήµασιν στόµατός µου·						
Proverbs	7	25	 ⲙ̀ⲡⲉⲛⲑⲣⲉ ⲡⲉⲕϩⲏⲧ ⲣⲓⲕⲓ ⲉ̀ⲛⲉⲥⲙⲱⲓⲧ ⲟⲩⲟϩ ⲙ̀ⲡⲉⲣⲥⲱⲣⲉⲙ ϧⲉⲛ ⲛⲉⲥⲙⲁⲛ̀ⲙⲟϣⲓ	 ⲙ̅ⲡⲣ̅ⲧⲣⲉ ⲡⲉⲕϩⲏⲧ ⲣⲓⲕⲉ ⲉⲛⲉⲥϩⲓⲟⲟⲩⲉ.	 Let not thine heart turn aside to her ways:	 µὴ ἐκκλινάτω εἰς τὰς ὁδοὺς αὐτῆς ἡ καρδία σου·						
Proverbs	7	26	 ⲟⲩⲙⲏϣ ⲅⲁⲣ ⲁⲥⲱϫϩ ⲙ̀ⲙⲱⲟⲩ ⲟⲩⲟϩ ⲁⲥⲣⲁϧⲧⲟⲩ ϩⲁⲛⲁⲧⲏⲡⲓ ⲇⲉ ⲛⲉ ⲛⲏ ⲉⲧⲁⲥϧⲟⲑⲃⲟⲩ	 ⲁⲥⲕⲛⲥ̅ ⲟⲩⲙⲏⲏϣⲉ ⲅⲁⲣ ⲁⲥⲧⲁⲩⲟⲟⲩ ⲉϩⲣⲁⲓ̈ ⲁⲩⲱ ϩⲉⲛⲁⲧⲏⲡⲉ ⲛⲉ ⲛ̅ⲧⲁⲥϩⲟⲧⲃⲟⲩ.	 for she has wounded and cast down many, and those whom she has slain are innumerable.	 πολλοὺς γὰρ τρώσασα καταβέβληκεν, καὶ ἀναρίθµητοί εἰσιν οὓς πεφόνευκεν·						
Proverbs	7	27	 ϩⲁⲛⲙⲱⲓⲧ ⲛ̀ⲧⲉ ⲁⲙⲉⲛϯ ⲛⲉ ⲡⲉⲥⲏⲓ ⲉⲩϭⲓ ⲉ̀ϧⲣⲏⲓ ⲉ̀ⲛⲓⲧⲁⲙⲓⲟⲛ ⲛ̀ⲧⲉ ⲫⲙⲟⲩ	 ⲉⲣⲉ ⲛⲉϩⲓⲟⲟⲩⲉ ⲃⲏⲕ ⲉⲛ̅ⲏⲓ̈ ⲛ̅ⲁⲙⲛ̅ⲧⲉ ⲉⲩⲃⲏⲕ ⲇⲉ ⲉⲡⲉⲥⲏⲧ ⲉⲛⲧⲁⲙⲓⲟⲛ ⲙ̅ⲡⲙⲟⲩ	 Her house is the way of hell, leading down to the chambers of death.	 ὁδοὶ ᾅδου ὁ οἶκος αὐτῆς κατάγουσαι εἰς τὰ ταµιεῖα τοῦ θανάτου.						
Proverbs	8	1	 ⲛ̀ⲑⲟⲕ ⲉⲕⲉ̀ϩⲓⲱⲓϣ ⲛ̀ϯⲥⲟⲫⲓⲁ ϩⲓⲛⲁ ⲛ̀ⲧⲉ ⲟⲩⲙⲉⲧⲥⲁⲃⲉ ⲥⲱⲧⲉⲙ ⲛ̀ⲥⲱⲕ	 ⲛ̅ⲧⲟⲕ ⲇⲉ ⲧⲁϣⲉⲟⲉⲓϣ ⲛ̅ⲧⲥⲟⲫⲓⲁ ϫⲉ ⲉⲣⲉⲧⲙⲛ̅ⲧⲣⲙⲛ̅ϩⲏⲧ ⲥⲱⲧⲙ̅ ⲛⲁⲕ.	 Thou shalt proclaim wisdom, that understanding may be obedient to thee.	 Σὺ τὴν σοφίαν κηρύξεις, ἵνα φρόνησίς σοι ὑπακούσῃ·						
Proverbs	8	2	 ⲁⲥϩⲓϫⲉⲛ ⲛⲓⲗⲁⲕϩ ⲅⲁⲣ ⲉⲩϭⲟⲥⲓ ⲁⲥⲟϩⲓ ⲉ̀ⲣⲁⲧⲥ ϧⲉⲛ ⲑⲙⲏϯ ⲛ̀ⲛⲓⲙⲱⲓⲧ	 ⲉⲥϩⲓϫⲛ̅ ⲛ̅ⲕⲟⲟϩ ⲅⲁⲣ ⲉⲧϫⲟⲥⲉ ⲥⲁϩⲉ ⲇⲉ ⲉⲣⲁⲧⲥ̅ ϩⲛ̅ ⲧⲙⲏⲧⲉ ⲛ̅ⲛⲉϩⲓⲟⲟⲩⲉ.	 For she is on lofty eminences, and stands in the midst of the ways.	 ἐπὶ γὰρ τῶν ὑψηλῶν ἄκρων ἐστίν, ἀνὰ µέσον δὲ τῶν τρίβων ἕστηκεν·						
Proverbs	8	3	 ⲥⲙⲏⲛ ⲅⲁⲣ ϧⲁⲧⲉⲛ ⲛⲓⲡⲩⲗⲏ ⲛ̀ⲧⲉ ⲛⲓϫⲱⲣⲓ ⲥⲉϩⲱⲥ ⲉ̀ⲣⲟⲥ ϩⲓ ⲛⲓⲙⲱⲓⲧ ⲉ̀ϧⲟⲩⲛ	 ⲥϭⲟⲣϭ̅ ϩⲁⲧⲛ̅ ⲙ̅ⲡⲩⲗⲏ ⲛ̅ⲛ̅ϫⲱⲱⲣⲉ ⲁⲩⲱ ⲥⲉⲥⲙⲟⲩ ⲉⲣⲟⲥ ϩⲛ̅ ⲙⲁⲛ̅ⲃⲱⲕ ⲉϩⲟⲩⲛ.	 For she sits by the gates of princes, and sings in the entrances, saying,	 παρὰ γὰρ πύλαις δυναστῶν παρεδρεύει, ἐν δὲ εἰσόδοις ὑµνεῖται						
Proverbs	8	4	 ⲛ̀ⲑⲱⲧⲉⲛ ⲱ ⲛⲓⲣⲱⲙⲓ ϯϯϩⲟ ⲉ̀ⲣⲱⲧⲉⲛ ⲟⲩⲟϩ ϯϯ ⲛ̀ⲧⲁⲥⲙⲏ ⲛ̀ⲛⲓϣⲏⲣⲓ ⲛ̀ⲧⲉ ⲛⲓⲣⲱⲙⲓ	 ϫⲉ ϯⲡⲁⲣⲁⲕⲁⲗⲓ ⲙ̅ⲙⲱⲧⲛ̅ ⲱ ⲛ̅ⲣⲱⲙⲉ ⲁⲩⲱ ϯϫⲱ ⲛⲏⲧⲛ̅ ⲛ̅ⲧⲁⲥⲃⲱ ⲛ̅ϣⲏⲣⲉ ⲛ̅ⲛ̅ⲣⲱⲙⲉ.	 You, O men, I exhort; and utter my voice to the sons of men.	 Ὑµᾶς, ὦ ἄνθρωποι, παρακαλῶ καὶ προί̈εµαι ἐµὴν φωνὴν υἱοῖς ἀνθρώπων·						
Proverbs	8	5	 ⲕⲁϯ ⲉ̀ⲟⲩⲙⲉⲧⲥⲁⲃⲉ ⲛⲓⲁⲧⲡⲉⲧϩⲱⲟⲩ ⲟⲩⲟϩ ⲛⲓⲁⲧⲥⲃⲱ ⲙⲁ ⲡⲉⲧⲉⲛϩⲏⲧ	 ⲛ̅ⲃⲁⲗϩⲏⲧ ⲛⲟⲓ̈ ⲛ̅ⲟⲩⲙⲛ̅ⲧⲥⲁⲃⲉ ⲛ̅ⲁⲑⲏⲧ ϯ ⲡⲉⲧⲛ̅ϩⲏⲧ.	 O ye simple, understand subtlety, and ye that are untaught, imbibe knowledge.	 νοήσατε, ἄκακοι, πανουργίαν, οἱ δὲ ἀπαίδευτοι, ἔνθεσθε καρδίαν.						
Proverbs	8	6	 ⲥⲱⲧⲉⲙ ⲛ̀ⲥⲱⲓ ϩⲁⲛⲥⲁϫⲓ ⲅⲁⲣ ⲛ̀ⲥⲉⲙⲛⲟⲛ ⲉ̀ϯⲛⲁϫⲟⲧⲟⲩ ⲟⲩⲟϩ ϯⲛⲁⲓⲛⲓ ⲛ̀ϩⲁⲛⲥⲁϫⲓ ⲉⲩⲥⲟⲩⲧⲱⲛ ⲉ̀ⲃⲟⲗ ϧⲉⲛ ⲛⲁⲥⲫⲟⲧⲟⲩ	 ⲥⲱⲧⲙ̅ ⲉⲣⲟⲓ̈ ϫⲉ ⲉⲓ̈ⲛⲁϫⲱ ⲅⲁⲣ ⲛ̅ϩⲉⲛⲥⲃⲱ ⲁⲩⲱ ⲉⲓ̈ⲛⲁⲟⲩⲱⲛ ⲛ̅ⲛⲉⲧⲥⲟⲩⲧⲱⲛ ⲉⲃⲟⲗ ϩⲛ̅ ⲛⲁⲥⲡⲟⲧⲟⲩ.	 Hearken to me; for I will speak solemn truths; and will produce right sayings from my lips.	 εἰσακούσατέ µου, σεµνὰ γὰρ ἐρῶ καὶ ἀνοίσω ἀπὸ χειλέων ὀρθά·						
Proverbs	8	7	 ϫⲉ ⲁⲣⲉ ⲧⲁϣⲃⲱⲃⲓ ⲛⲁⲉⲣⲙⲉⲗⲉⲧⲁⲛ ⲛ̀ϩⲁⲛⲙⲉⲑⲙⲏⲓ ⲥⲉⲥⲟϥ ⲇⲉ ⲙ̀ⲡⲁⲙ̀ⲑⲟ ⲛ̀ϫⲉ ⲛⲓⲥⲁϫⲓ ⲙ̀ⲙⲉⲑⲛⲟⲩϫ	 ⲉⲣⲉ ⲣⲱⲓ̈ ⲅⲁⲣ ⲙⲉⲗⲉⲧⲁ ⲛ̅ⲟⲩⲡⲓⲥⲧⲓⲥ ⲛⲉⲥⲡⲟⲧⲟⲩ ⲇⲉ ⲛ̅ϭⲟⲗ ϫⲁϩⲙ̅ ⲙ̅ⲡⲙ̅ⲧⲟ ⲉⲃⲟⲗ.	 For my throat shall meditate truth; and false lips are an abomination before me.	 ὅτι ἀλήθειαν µελετήσει ὁ φάρυγξ µου, ἐβδελυγµένα δὲ ἐναντίον ἐµοῦ χείλη ψευδῆ.						
Proverbs	8	8	 ⲛⲓⲥⲁϫⲓ ⲧⲏⲣⲟⲩ ⲛ̀ⲧⲉ ⲣⲱⲓ ⲁⲩϣⲱⲡ ϧⲉⲛ ⲟⲩⲙⲉⲑⲙⲏⲓ ⲙ̀ⲙⲟⲛ ϩⲗⲓ ⲛ̀ϧⲏⲧⲟⲩ ⲉϥϧⲟⲥⲓ ⲛ̀ϫⲉⲙϥ ⲟⲩⲇⲉ ⲉ̀ⲟⲩⲟⲛ ⲕⲟⲧⲥ ⲛ̀ϧⲏⲧϥ	 ⲉⲣⲉ ⲛ̅ϣⲁϫⲉ ⲧⲏⲣⲟⲩ ⲛ̅ⲣⲱⲓ̈ ϩⲛ̅ ⲟⲩⲇⲓⲕⲁⲓⲟⲥⲩⲛⲏ ⲙⲛ̅ ⲗⲁⲁⲩ ⲛ̅ϩⲏⲧⲟⲩ ⲉϥϭⲟⲟⲙⲉ ⲟⲩⲇⲉ ⲉϥϫⲏⲩ ⲛ̅ⲕⲟⲧⲥ̅.	 All the words of my mouth are in righteousness; there is nothing in them wrong or perverse.	 µετὰ δικαιοσύνης πάντα τὰ ῥήµατα τοῦ στόµατός µου, οὐδὲν ἐν αὐτοῖς σκολιὸν οὐδὲ στραγγαλῶδες·						
Proverbs	8	9	 ⲥⲉϫⲏ ⲧⲏⲣⲟⲩ ⲙ̀ⲡⲉⲙ̀ⲑⲟ ⲛ̀ⲛⲏ ⲉⲧⲕⲁϯ ⲟⲩⲟϩ ⲥⲉⲥⲟⲩⲧⲱⲛ ⲙ̀ⲡⲉⲙ̀ⲑⲟ ⲛ̀ⲛⲏ ⲉⲧϫⲓⲙⲓ ⲛ̀ϯⲅⲛⲱⲥⲓⲥ	 ⲥⲉⲙ̅ⲡⲉⲙ̅ⲧⲟ ⲉⲃⲟⲗ ⲧⲏⲣⲟⲩ ⲛ̅ⲛⲉⲧⲛ̅ⲟⲓ ⲥⲉⲥⲟⲩⲧⲱⲛ ⲇⲉ ⲛ̅ⲛⲉⲧⲟⲩⲱϣ ⲉϫⲓ ⲛ̅ⲟⲩⲁⲓⲥⲑⲏⲥⲓⲥ.	 They are all evident to those that understand, and right to those that find knowledge.	 πάντα ἐνώπια τοῖς συνιοῦσιν καὶ ὀρθὰ τοῖς εὑρίσκουσι γνῶσιν.						
Proverbs	8	10	 ϭⲓ ⲛ̀ⲟⲩⲥⲃⲱ ⲟⲩⲟϩ ⲛ̀ⲟⲩϩⲁⲧ ⲁⲛ ⲛⲉⲙ ⲟⲩⲅⲛⲱⲥⲓⲥ ⲉ̀ϩⲟⲧⲉ ⲟⲩⲛⲟⲩⲃ ⲉ̀ⲁⲩⲉⲣⲇⲟⲕⲓⲙⲁⲍⲓⲛ ⲙ̀ⲙⲟϥ ϯⲉⲥⲑⲉⲥⲓⲥ ⲇⲉ ⲥⲟⲧⲡⲥ ⲛⲱⲧⲉⲛ ⲉ̀ϩⲟⲧⲉ ⲟⲩⲛⲟⲩⲃ ⲉϥⲧⲟⲩⲃⲏⲟⲩⲧ	 ϯϩⲏⲩ ⲛ̅ⲟⲩⲥⲃⲱ ⲛ̅ⲟⲩϩⲁⲧ ⲁⲛ ⲁⲩⲱ ⲟⲩⲥⲟⲟⲩⲛ̅ ⲉϩⲟⲩⲉ ⲟⲩⲛⲟⲩⲃ ⲉϥⲥⲟⲧⲡ̅ ⲥⲉⲧⲡ̅ ⲧⲙⲛ̅ⲧⲣⲙ̅ⲛ̅ϩⲏⲧ ⲇⲉ ⲉϩⲟⲩⲉ ⲡⲛⲟⲩⲃ ⲉⲧⲧⲃ̅ⲃⲏⲩ.	 Receive instruction, and not silver; and knowledge rather than tried gold.	 λάβετε παιδείαν καὶ µὴ ἀργύριον καὶ γνῶσιν ὑπὲρ χρυσίον δεδοκιµασµένον, ἀνθαιρεῖσθε δὲ αἴσθησιν χρυσίου καθαροῦ·						
Proverbs	8	11	 ⲥⲥⲟⲧⲡ ⲅⲁⲣ ⲛ̀ϫⲉ ϯⲥⲟⲫⲓⲁ ⲉ̀ϩⲟⲧⲉ ϩⲁⲛⲱⲛⲓ ⲉ̀ⲛⲁϣⲉⲥⲟⲩⲉⲛⲟⲩ ϩⲱⲃ ⲛⲓⲃⲉⲛ ⲉⲧⲧⲁⲓⲏⲟⲩⲧ ⲥⲉⲙⲡϣⲁ ⲙ̀ⲙⲟⲥ ⲁⲛ	 ⲧⲥⲟⲫⲓⲁ ⲅⲁⲣ ⲥⲟⲧⲡ̅ ⲉϩⲟⲩⲉ ⲛⲉⲛⲉⲙⲙⲉ ⲛⲉⲧⲧⲁⲓ̈ⲏⲩ ⲇⲉ ⲧⲏⲣⲟⲩ ⲙ̅ⲡϣⲁ ⲙ̅ⲙⲟⲥ ⲁⲛ.	 For wisdom is better than precious stones; and no valuable substance is of equal worth with it.	 κρείσσων γὰρ σοφία λίθων πολυτελῶν, πᾶν δὲ τίµιον οὐκ ἄξιον αὐτῆς ἐστιν.						
Proverbs	8	12	 ⲁ̀ⲛⲟⲕ ϯⲥⲟⲫⲓⲁ ⲁⲓⲟⲩⲱⲛϩ ϧⲉⲛ ⲟⲩⲥⲟϭⲛⲓ ⲟⲩⲅⲛⲱⲥⲓⲥ ⲇⲉ ⲛⲉⲙ ⲟⲩⲕⲁϯ ⲁ̀ⲛⲟⲕ ⲁⲓⲕⲱϯ ⲛ̀ⲥⲱⲟⲩ	 ⲁⲛⲟⲕ ⲧⲥⲟⲫⲓⲁ ⲁⲓ̈ⲥⲱⲛⲧ̅ ⲙ̅ⲡϣⲟϫⲛⲉ ⲁⲛⲟⲕ ⲁⲓⲕⲱ ⲛⲁⲓ̈ ⲛ̅ⲧⲁⲓⲥⲑⲏⲥⲓⲥ ⲙⲛ̅ ⲡⲙⲉⲉⲩⲉ.	 I wisdom have dwelt with counsel and knowledge, and I have called upon understanding.	 ἐγὼ ἡ σοφία κατεσκήνωσα βουλήν, καὶ γνῶσιν καὶ ἔννοιαν ἐγὼ ἐπεκαλεσάµην.						
Proverbs	8	13	 ϯϩⲟϯ ⲛ̀ⲧⲉ ⲡϭ̅ⲥ̅ ⲙⲟⲥϯ ⲙ̀ⲡⲓϭⲓⲛ̀ϫⲟⲛⲥ ⲛⲉⲙ ⲡϣⲱϣ ⲛⲉⲙ ϯⲙⲉⲧϭⲁⲥⲓϩⲏⲧ ⲛⲉⲙ ⲛⲓⲙⲱⲓⲧ ⲛ̀ⲧⲉ ⲛⲓⲡⲟⲛⲏⲣⲟⲥ ⲁ̀ⲛⲟⲕ ⲁⲓⲙⲉⲥⲧⲉ ϩⲁⲛⲙⲱⲓⲧ ⲉⲩⲫⲟⲛϩ ⲛ̀ⲧⲉ ϩⲁⲛⲡⲉⲧϩⲱⲟⲩ	 ⲧⲙⲛ̅ⲧⲙⲁⲓⲛⲟⲩⲧⲉ ⲙⲟⲥⲧⲉ ⲛ̅ⲧⲕⲁⲕⲓⲁ ⲁⲩⲱ ⲥⲙⲟⲥⲧⲉ ⲛ̅ⲟⲩⲥⲱϣ ⲙⲛ̅ ⲟⲩⲙⲛ̅ⲧϫⲁⲥⲓϩⲏⲧ ⲙⲛ̅ ϩⲉⲛϩⲓⲟⲟⲩⲉ ⲉⲩϩⲟⲟⲩ ⲙⲛ̅ ⲟⲩⲧⲁⲡⲣⲟ ⲛ̅ϭⲟⲗ.	 The fear of the Lord hates unrighteousness, and insolence, and pride, and the ways of wicked men; and I hate the perverse ways of bad men.	 φόβος κυρίου µισεῖ ἀδικίαν, ὕβριν τε καὶ ὑπερηφανίαν καὶ ὁδοὺς πονηρῶν· µεµίσηκα δὲ ἐγὼ διεστραµµένας ὁδοὺς κακῶν.						
Proverbs	8	14	 ⲫⲱⲓ ⲡⲉ ⲡⲓⲥⲟϭⲛⲓ ⲛⲉⲙ ⲡⲓⲧⲁϫⲣⲟ ⲑⲱⲓ ⲧⲉ ϯⲙⲉⲧⲥⲁⲃⲉ ⲑⲱⲓ ⲧⲉ ϯϫⲟⲙ	 ⲡⲱⲓ̈ ⲡⲉ ⲡϣⲟϫⲛⲉ ⲙⲛ̅ ⲡⲱⲣϫ ⲧⲱⲓ̈ ⲧⲉ ⲧⲙⲛ̅ⲧⲣⲙ̅ⲛ̅ϩⲏⲧ ⲧⲱⲓ̈ ⲧⲉ ⲧϭⲟⲙ.	 Counsel and safety are mine; prudence is mine, and strength is mine.	 ἐµὴ βουλὴ καὶ ἀσφάλεια, ἐµὴ φρόνησις, ἐµὴ δὲ ἰσχύς·						
Proverbs	8	15	 ⲉ̀ⲃⲟⲗ ϩⲓⲧⲟⲧ ⲉⲣⲉ ⲛⲓⲣⲱⲟⲩ ⲟⲓ ⲛ̀ⲟⲩⲣⲟ ⲟⲩⲟϩ ⲉ̀ⲡⲉⲛⲓϫⲱⲣⲓ ⲥϧⲁⲓ ⲛ̀ϯⲙⲉⲑⲙⲏⲓ	 ⲉⲣⲉ ⲛⲉⲣ̅ⲣⲱⲟⲩ ⲟ ⲛ̅ⲣ̅ⲣⲟ ⲉⲃⲟⲗ ϩⲓⲧⲟⲟⲧ ⲁⲩⲱ ⲉⲣⲉ ⲛ̅ϫⲱⲱⲣⲉ ⲁⲙⲁϩⲧⲉ ⲙ̅ⲡⲕⲁϩ ⲉⲃⲟⲗ ϩⲓⲧⲟⲟⲧ.	 By me kings reign, and princes decree justice.	 δι’ ἐµοῦ βασιλεῖς βασιλεύουσιν, καὶ οἱ δυνάσται γράφουσιν δικαιοσύνην·						
Proverbs	8	16	 ⲉ̀ⲃⲟⲗ ϩⲓⲧⲟⲧ ⲛⲓⲉ̀ϩⲣⲏⲓ ⲥⲉⲟⲓ ⲛ̀ⲛⲓϣϯ ⲟⲩⲟϩ ⲛⲓⲧⲩⲣⲁⲛⲛⲟⲥ ⲁⲩⲁⲙⲟⲛⲓ ⲙ̀ⲡⲓⲕⲁϩⲓ ⲉ̀ⲃⲟⲗ ϩⲓⲧⲟⲧ	 ⲉⲣⲉ ⲛ̅ⲛⲟϭ ⲁⲓⲁⲓ ⲉⲃⲟⲗ ϩⲓⲧⲟⲟⲧ ⲁⲩⲱ ⲉⲣⲉ ⲛ̅ⲧⲩⲣⲁⲛⲛⲟⲥ ⲁⲙⲁϩⲧⲉ ⲙ̅ⲡⲕⲁϩ ⲉⲃⲟⲗ ϩⲓⲧⲟⲟⲧ.	 By me nobles become great, and monarchs by me rule over the earth.	 δι’ ἐµοῦ µεγιστᾶνες µεγαλύνονται, καὶ τύραννοι δι’ ἐµοῦ κρατοῦσι γῆς.						
Proverbs	8	17	 ⲁ̀ⲛⲟⲕ ϯⲉⲣⲁⲅⲁⲡⲁⲛ ⲛ̀ⲛⲏ ⲉⲧⲙⲉⲓ ⲙ̀ⲙⲟⲓ ⲛⲏ ⲉⲧⲕⲱϯ ⲛ̀ⲥⲱⲓ ⲉⲩⲉ̀ϫⲉⲙⲧ	 ⲁⲛⲟⲕ ⲉⲓⲙⲉ ⲛ̅ⲛⲉⲧⲙⲉ ⲙ̅ⲙⲟⲓ̈ ⲛⲉⲧϣⲓⲛⲉ ⲇⲉ ⲛ̅ⲥⲱⲓ̈ ⲥⲉⲛⲁϭⲛⲧ.	 I love those that love me; and they that seek me shall find me.	 ἐγὼ τοὺς ἐµὲ φιλοῦντας ἀγαπῶ, οἱ δὲ ἐµὲ ζητοῦντες εὑρήσουσιν.						
Proverbs	8	18	 ⲟⲩⲙⲉⲧⲣⲁⲙⲁⲟ ⲛⲉⲙ ⲟⲩⲱⲟⲩ ⲥⲉϣⲟⲡ ⲛⲏⲓ ⲛⲉⲙ ⲟⲩϫⲫⲟ ⲛⲉⲙ ⲟⲩⲙⲏϣ ⲛⲉⲙ ⲟⲩⲇⲓⲕⲉⲟⲥⲩⲛⲏ	 ⲟⲩⲛⲧⲁⲓ̈ ⲧⲙⲛ̅ⲧⲣⲙ̅ⲙⲁⲟ ⲅⲁⲣ ⲙⲛ̅ ⲡⲉⲟⲟⲩ ⲁⲩⲱ ⲟⲩϫⲡⲉ ϩⲁϩ ⲙⲛ̅ ⲟⲩⲇⲓⲕⲁⲓⲟⲥⲩⲛⲏ.	 Wealth and glory belong to me; yea, abundant possessions and righteousness.	 πλοῦτος καὶ δόξα ἐµοὶ ὑπάρχει καὶ κτῆσις πολλῶν καὶ δικαιοσύνη·						
Proverbs	8	19	 ⲛⲁⲛⲉⲥ ⲉⲩϫⲫⲟ ⲛⲱⲧⲉⲛ ⲉ̀ϩⲟⲧⲉ ⲟⲩⲛⲟⲩⲃ ⲛⲉⲙ ⲟⲩⲱⲛⲓ ⲉϥⲧⲁⲓⲏⲟⲩⲧ ⲛⲓⲟⲩⲧⲁϩ ⲇⲉ ⲥⲉⲥⲟⲧⲡ ⲉ̀ϩⲟⲧⲉ ⲟⲩⲱⲛⲓ ⲉϥⲥⲟⲧⲡ	 ⲛⲁⲛⲟⲩ ϫⲡⲟⲓ ⲛⲏⲧⲛ̅ ⲉϩⲟⲩⲉ ⲡⲛⲟⲩⲃ ⲙⲛ̅ ⲡⲉⲛⲉⲙⲙⲉ ⲁⲩⲱ ⲛⲁⲛⲟⲩ ⲛⲁⲅⲉⲛⲏⲙⲁ ⲉϩⲟⲩⲉ ⲡϩⲁⲧ ⲉⲧⲥⲟⲧⲡ̅.	 It is better to have my fruit than to have gold and precious stones; and my produce is better than choice silver.	 βέλτιον ἐµὲ καρπίζεσθαι ὑπὲρ χρυσίον καὶ λίθον τίµιον, τὰ δὲ ἐµὰ γενήµατα κρείσσω ἀργυρίου ἐκλεκτοῦ.						
Proverbs	8	20	 ⲁⲓⲙⲟϣⲓ ϧⲉⲛ ⲛⲓⲙⲱⲓⲧ ⲛ̀ⲧⲉ ϯⲇⲓⲕⲉⲟⲥⲩⲛⲏ ⲟⲩⲟϩ ⲁⲓⲉⲣⲁⲛⲁⲥⲧⲣⲉⲫⲉⲥⲑⲉ ϧⲉⲛ ⲑⲙⲏϯ ⲛ̀ⲛⲓⲙⲱⲓⲧ ⲛ̀ⲧⲉ ϯⲙⲉⲑⲙⲏⲓ	 ⲉⲓ̈ⲙⲟⲟϣⲉ ϩⲛ̅ ϩⲉⲛϩⲓⲟⲟⲩⲉ ⲙ̅ⲙⲛ̅ⲧⲙⲉ ⲁⲩⲱ ⲉⲓ̈ⲃⲏⲕ ϩⲛ̅ ⲛⲉϩⲓⲟⲟⲩⲉ ⲛ̅ⲧⲙⲉ.	 I walk in ways of righteousness, and am conversant with the paths of judgment;	 ἐν ὁδοῖς δικαιοσύνης περιπατῶ καὶ ἀνὰ µέσον τρίβων δικαιώµατος ἀναστρέφοµαι,						
Proverbs	8	21	 ϩⲓⲛⲁ ⲛ̀ⲧⲁⲫⲱⲣϣ ⲛ̀ⲛⲁϩⲏⲡⲁⲣⲭⲟⲛⲧⲁ ⲉ̀ϩⲣⲁⲩ ⲛ̀ⲛⲏ ⲉⲑⲙⲉⲓ ⲙ̀ⲙⲟⲓ ⲟⲩⲟϩ ⲛⲟⲩⲁϩⲱⲣ ⲛ̀ⲧⲁⲙⲁϩⲟⲩ ⲛ̀ⲁⲅⲁⲑⲟⲛ ⲉ̀ϣⲱⲡ ⲛ̀ⲧⲁⲥⲁϫⲓ ϧⲁⲧⲉⲛ ⲑⲏⲛⲟⲩ ⲛ̀ⲛⲏ ⲉⲧϣⲟⲡ ⲙ̀ⲙⲏⲛⲓ ⲉⲓⲉ̀ⲉⲣⲫⲙⲉⲩⲓ ⲉ̀ϭⲓⲏⲡⲓ ⲓⲥϫⲉⲛ ⲡⲉⲛⲉϩ	 ϫⲉⲕⲁⲥ ⲉⲓ̈ⲉⲡⲱϣ ⲉϫⲛ̅ ⲛⲉⲧⲙⲉ ⲙ̅ⲙⲟⲓ̈ ⲛ̅ⲟⲩⲙⲛ̅ⲧⲣⲙ̅ⲙⲁⲟ ⲁⲩⲱ ⲛ̅ⲧⲁⲙⲉϩ ⲛⲉⲩⲁϩⲱⲱⲣ ⲛ̅ⲁⲅⲁⲑⲟⲛ ⲉⲓ̈ϣⲁⲛϫⲱ ⲛⲏⲧⲛ̅ ⲛ̅ⲛⲉⲧϣⲟⲟⲡ ⲙ̅ⲙⲏⲛⲉ ϯⲛⲁⲣⲡⲙⲉⲉⲩⲉ ⲙ̅ⲡϩⲁⲡ ϫⲓⲛ ⲉⲛⲉϩ.	 that I may divide substance to them that love me, and may fill their treasures with good things. (21a) If I declare to you the things that daily happen, I will remember also to recount the things of old.	 ἵνα µερίσω τοῖς ἐµὲ ἀγαπῶσιν ὕπαρξιν καὶ τοὺς θησαυροὺς αὐτῶν ἐµπλήσω ἀγαθῶν. ἐὰν ἀναγγείλω ὑµῖν τὰ καθ’ ἡµέραν γινόµενα, µνηµονεύσω τὰ ἐξ αἰῶνος ἀριθµῆσαι.						
Proverbs	8	22	 ⲡϭ̅ⲥ̅ ⲁϥⲥⲱⲧⲡ ⲙ̀ⲙⲟⲓ ⲛ̀ⲁⲣⲭⲏ ⲛ̀ⲛⲉϥϩⲃⲏⲟⲩⲓ ⲙ̀ⲡⲁⲧⲟⲩⲑⲁⲙⲓⲉ ϩⲗⲓ	 ⲁ ⲡⲛⲟⲩⲧⲉ ⲥⲟⲛⲧ̅ ϩⲛ̅ ⲧⲁⲣⲭⲏ ⲛ̅ⲛⲉϥϩⲓⲟⲟⲩⲉ ⲉⲛⲉϥϩⲃⲏⲩⲉ ⲉⲙⲡⲁⲧϥ̅ⲧⲁⲙⲓⲉ ⲗⲁⲁⲩ	 The Lord made me the beginning of his ways for his works.	 κύριος ἔκτισέν µε ἀρχὴν ὁδῶν αὐτοῦ εἰς ἔργα αὐτοῦ,						
Proverbs	8	23	 ϧⲁϫⲱϥ ⲙ̀ⲡⲉⲛⲉϩ ⲁϥϩⲓⲥⲉⲛϯ ⲙ̀ⲙⲟⲓ ϧⲉⲛ ⲧⲁⲣⲭⲏ ⲙ̀ⲡⲁⲧⲟⲩⲑⲁⲙⲓⲉ ⲡⲕⲁϩⲓ	 ⲁⲩⲱ ⲁϥⲥⲙⲛ̅ⲥⲛ̅ⲧⲉ ⲙ̅ⲙⲟⲓ̈ ϩⲁⲑⲏ ⲛ̅ⲛ̅ⲉⲛⲉϩ ϩⲛ̅ ⲧⲁⲣⲭⲏ	 He established me before time was in the beginning, before he made the earth:	 πρὸ τοῦ αἰῶνος ἐθεµελίωσέν µε ἐν ἀρχῇ,						
Proverbs	8	24	 ⲙ̀ⲡⲁⲧⲟⲩⲑⲁⲙⲓⲟ ⲛ̀ⲛⲓⲛⲟⲩⲛ ⲙ̀ⲡⲁⲧⲟⲩⲓ ⲉ̀ⲃⲟⲗ ⲛ̀ϫⲉ ⲛⲓⲙⲟⲩⲛϩⲱⲟⲩ	 ⲉⲙⲡⲁⲧϥ̅ⲧⲁⲙⲓⲉ ⲡⲕⲁϩ ⲁϥϫⲡⲟⲓ ⲇⲉ ϩⲁⲑⲏ ⲙ̅ⲡⲛⲟⲩⲛ ⲉⲙⲡⲁⲧⲉ ⲙ̅ⲡⲏⲅⲏ ⲙ̅ⲙⲟⲟⲩ ⲉⲓ ⲉⲃⲟⲗ	 even before he made the depths; before the fountains of water came forth:	 πρὸ τοῦ τὴν γῆν ποιῆσαι καὶ πρὸ τοῦ τὰς ἀβύσσους ποιῆσαι, πρὸ τοῦ προελθεῖν τὰς πηγὰς τῶν ὑδάτων,						
Proverbs	8	25	 ⲙ̀ⲡⲁⲧⲟⲩⲥⲉⲙⲛⲓ ⲛ̀ϫⲉ ⲛⲓⲧⲱⲟⲩ ϧⲁϫⲱⲟⲩ ⲇⲉ ⲛ̀ⲛⲓⲕⲁⲗⲁⲙⲫⲟ ⲧⲏⲣⲟⲩ ⲁⲩⲙⲁⲥⲧ	 ⲉⲙⲡⲁⲧϥ̅ⲧⲁϫⲣⲉ ⲛ̅ⲧⲟⲟⲩ ⲁⲩⲱ ⲛϥ̅ⲡⲗⲁⲥⲥⲉ ⲙ̅ⲡⲕⲁϩ ⲙⲛ̅ ⲧⲟⲓⲕⲟⲩⲙⲉⲛⲏ ⲁϥϫⲡⲟⲓ ⲇⲉ ϩⲁⲑⲏ ⲛ̅ⲥⲓⲃⲧ ⲛⲓⲙ.	 before the mountains were settled, and before all hills, he begets me.	 πρὸ τοῦ ὄρη ἑδρασθῆναι, πρὸ δὲ πάντων βουνῶν γεννᾷ µε.						
