book	chapter	verse	Bohairic	Sahidic	English	Greek	Fayyumic	Akhmimic	OldBohairic	Mesokemic	DialectP	Lycopolitan
Proverbs	22	10	 	 ⲛⲟⲩϫⲉ ⲉⲃⲟⲗ ⲛ̅ⲟⲩⲁ ⲉϥϩⲟⲟⲩ ϩⲛ̅ ⲟⲩⲙⲏⲏϣⲉ ⲧⲁⲣⲉ ⲡϯⲧⲱⲛ ⲃⲱⲕ ⲉⲃⲟⲗ ⲛⲙ̅ⲙⲁϥ ⲉϥϣⲁⲛϩⲙⲟⲟⲥ ⲅⲁⲣ ϩⲙ̅ ⲡⲙⲏⲏϣⲉ ϣⲁϥⲥⲟϣⲟⲩ ⲧⲏⲣⲟⲩ.	 Cast out a pestilent person from the council, and strife shall go out with him; for when he sits in the council he dishonours all.	 ἔκβαλε ἐκ συνεδρίου λοιµόν, καὶ συνεξελεύσεται αὐτῷ νεῖκος· ὅταν γὰρ καθίσῃ ἐν συνεδρίῳ, πάντας ἀτιµάζει.						
Proverbs	22	11	 	 ⲉⲣⲉ ⲡⲛⲟⲩⲧⲉ ⲙⲉ ⲛ̅ⲛ̅ϩⲏⲧ ⲉⲧⲟⲩⲁⲁⲃ ⲟⲩⲟⲛ ⲇⲉ ⲛⲓⲙ ⲉⲧⲟⲩⲁⲁⲃ ⲥⲟⲧⲡ̅ ⲛⲁϥ ⲉⲣⲉ ⲡⲥⲱϣ ⲙⲟⲟⲛⲉ ϩⲓ ⲛⲉϥⲥⲡⲟⲧⲟⲩ ⲉⲣⲉ ⲡⲣ̅ⲣⲟ ⲇⲉ ϩⲙ̅ ⲡⲉϥⲁⲙⲁϩⲧⲉ.	 The Lord loves holy hearts, and all blameless persons are acceptable with him: a king rules with his lips.	 ἀγαπᾷ κύριος ὁσίας καρδίας, δεκτοὶ δὲ αὐτῷ πάντες ἄµωµοι· χείλεσιν ποιµαίνει βασιλεύς.						
Proverbs	22	12	 	 ⲛ̅ⲃⲁⲗ ⲙ̅ⲡⲛⲟⲩⲧⲉ ϩⲁⲣⲉϩ ⲉⲛ̅ⲣⲉϥⲁⲓⲥⲑⲁⲛⲉ ϣⲁⲣⲉ ⲡⲡⲁⲣⲁⲛⲟⲙⲟⲥ ⲇⲉ ⲥⲱϣϥ̅ ⲛ̅ϩⲉⲛϣⲁϫⲉ.	 But the eyes of the Lord preserve discretion; but the transgressor despises wise words.	 οἱ δὲ ὀφθαλµοὶ κυρίου διατηροῦσιν αἴσθησιν, φαυλίζει δὲ λόγους παράνοµος.						
Proverbs	22	13	 	 ϣⲁⲣⲉ ⲡⲣⲉϥϫⲛⲁⲁⲩ ϭⲛ̅ ⲗⲟⲓϭⲉ ⲛϥ̅ϫⲓⲟⲩⲱ ϫⲉ ⲡⲙⲟⲩⲓ ϩⲛ̅ ⲛⲉϩⲓⲟⲟⲩⲉ ⲁⲩⲱ ⲥⲉϩⲱⲧⲃ̅ ϩⲛ̅ ⲛⲉⲡⲗⲁⲧⲓⲁ.	 The sluggard makes excuses, and says, There is a lion in the ways, and murderers in the streets.	 προφασίζεται καὶ λέγει ὀκνηρός Λέων ἐν ταῖς ὁδοῖς, ἐν δὲ ταῖς πλατείαις φονευταί.						
Proverbs	22	14	 	 ⲟⲩϩⲓⲉⲓⲧ ⲉϥϫⲏⲕ ⲧⲉ ⲧⲧⲁⲡⲣⲟ ⲙ̅ⲡⲁⲣⲁⲛⲟⲙⲟⲥ ⲡⲉⲛⲧⲁⲩⲙⲉⲥⲧⲱϥ ⲇⲉ ϩⲓⲧⲙ̅ ⲡⲛⲟⲩⲧⲉ ϥⲛⲁϩⲉ ⲉϩⲣⲁⲓ̈ ⲉⲣⲟϥ ⲟⲩⲛ̅ ϩⲉⲛϩⲓⲟⲟⲩⲉ ⲉⲩϩⲟⲟⲩ ⲙ̅ⲡⲉⲙ̅ⲧⲟ ⲉⲃⲟⲗ ⲙ̅ⲡⲣⲱⲙⲉ ⲁⲩⲱ ⲛϥ̅ⲙⲉ ⲁⲛ ⲕⲧⲟϥ ⲉⲃⲟⲗ ⲙ̅ⲙⲟⲟⲩ ϣ̅ϣⲉ ⲇⲉ ⲉⲕⲧⲟⲕ ⲉⲃⲟⲗ ϩⲛ̅ ϩⲓⲏ ⲛⲓⲙ ⲉⲧϭⲟⲟⲩϭ ⲁⲩⲱ ⲉⲑⲟⲟⲩ.	 The mouth of a transgressor is a deep pit; and he that is hated of the Lord shall fall into it. (14a) Evil ways are before a man, and he does not like to turn away from them; but it is needful to turn aside from a perverse and bad way.	 βόθρος βαθὺς στόµα παρανόµου, ὁ δὲ µισηθεὶς ὑπὸ κυρίου ἐµπεσεῖται εἰς αὐτόν. (14a) εἰσὶν ὁδοὶ κακαὶ ἐνώπιον ἀνδρός, καὶ οὐκ ἀγαπᾷ τοῦ ἀποστρέψαι ἀπ’ αὐτῶν· ἀποστρέφειν δὲ δεῖ ἀπὸ ὁδοῦ σκολιᾶς καὶ κακῆς.						
Proverbs	22	15	 	 ⲁ ⲡϩⲏⲧ ⲙ̅ⲡⲣⲱⲙⲉ ϣⲏⲙ ϫⲓϥⲟϭⲥ̅ ϩⲛ̅ ⲧⲙⲛ̅ⲧⲁⲑⲏⲧ ⲡϭⲉⲣⲱⲃ ⲅⲁⲣ ⲙⲛ̅ⲧⲉⲥⲃⲱ ⲟⲩⲏⲩ ⲙ̅ⲙⲟϥ.	 Folly is attached to the heart of a child, but the rod and instruction are then far from him.	 ἄνοια ἐξῆπται καρδίας νέου, ῥάβδος δὲ καὶ παιδεία µακρὰν ἀπ’ αὐτοῦ.						
Proverbs	22	16	 	 ⲡⲉⲧϩⲓⲗⲁ ⲉⲩϩⲏⲕⲉ ⲉϥⲧⲁϣⲟ ⲛ̅ⲛⲉϥⲡⲉⲑⲟⲟⲩ ϥⲛⲁϯ ⲇⲉ ⲙ̅ⲡⲣⲙ̅ⲙⲁⲟ ⲉϫⲙ̅ ⲡⲉⲧⲣ̅ϭⲣⲱϩ.	 He that oppresses the poor, increases his own substance, yet gives to the rich so as to make it less.	 ὁ συκοφαντῶν πένητα πολλὰ ποιεῖ τὰ ἑαυτοῦ· δίδωσιν δὲ πλουσίῳ ἐπ’ ἐλάσσονι.						
Proverbs	22	17	 	 ⲣⲓⲕⲉ ⲙ̅ⲡⲉⲕⲙⲁⲁϫⲉ ⲉⲡϣⲁϫⲉ ⲛ̅ⲛ̅ⲥⲟⲫⲟⲥ ⲁⲩⲱ ⲛⲅ̅ⲥⲱⲧⲙ̅ ⲉⲛⲁϣⲁϫⲉ ⲛⲅ̅ⲥⲙⲓⲛⲉ ⲇⲉ ⲙ̅ⲡⲉⲕϩⲏⲧ ϫⲉ ⲉⲕⲉⲉⲓⲙⲉ ⲉⲣⲟⲟⲩ ϫⲉ ⲛⲁⲛⲟⲩⲟⲩ.	 Incline thine ear to the words of wise men: hear also my word, and apply thine heart,	 Λόγοις σοφῶν παράβαλλε σὸν οὖς καὶ ἄκουε ἐµὸν λόγον, τὴν δὲ σὴν καρδίαν ἐπίστησον, ἵνα γνῷς ὅτι καλοί εἰσιν·						
Proverbs	22	18	 	 ⲁⲩⲱ ⲉⲕϣⲁⲛⲕⲁⲁⲩ ϩⲙ̅ ⲡⲉⲕϩⲏⲧ ⲕⲛⲁϯϩⲏⲩ ⲥⲟⲩⲧⲱⲛⲟⲩ ⲇⲉ ϩⲓⲟⲩⲥⲟⲡ ⲉϫⲛ̅ ⲛⲉⲕⲥⲡⲟⲧⲟⲩ.	 that thou mayest know that they are good: and if thou lay them to heart, they shall also gladden thee on thy lips.	 καὶ ἐὰν ἐµβάλῃς αὐτοὺς εἰς τὴν καρδίαν σου, εὐφρανοῦσίν σε ἅµα ἐπὶ σοῖς χείλεσιν,						
Proverbs	22	19	 	 ϫⲉⲕⲁⲥ ⲉⲣⲉ ⲟⲩⲧⲱⲕ ⲛ̅ϩⲏⲧ ϣⲱⲡⲉ ⲛⲁⲕ ⲉϫⲙ̅ ⲡⲛⲟⲩⲧⲉ ⲁⲩⲱ ⲛϥ̅ⲧⲁⲙⲟⲕ ⲉⲧⲉϥϩⲓⲏ.	 That thy hope may be in the Lord, and he may make thy way known to thee.	 ἵνα σου γένηται ἐπὶ κύριον ἡ ἐλπὶς καὶ γνωρίσῃ σοι τὴν ὁδὸν αὐτοῦ.						
Proverbs	22	20	 	 ⲛ̅ⲧⲟⲕ ⲇⲉ ϩⲱⲕ ⲥϩⲁⲓ̈ⲥⲟⲩ ⲛⲁⲕ ⲛ̅ϣⲙ̅ⲧⲥⲱⲡ ⲉⲩϣⲟϫⲛⲉ ⲙⲛ̅ ⲟⲩⲥⲟⲟⲩⲛ.	 And do thou too repeatedly record them for thyself on the table of thine heart, for counsel and knowledge.	 καὶ σὺ δὲ ἀπόγραψαι αὐτὰ σεαυτῷ τρισσῶς εἰς βουλὴν καὶ γνῶσιν ἐπὶ τὸ πλάτος τῆς καρδίας σου.						
Proverbs	22	21	 	 ϯⲧⲥⲁⲃⲉ ⲇⲟ ⲙ̅ⲙⲟⲕ ⲉⲥⲟⲟⲩⲛ ⲧⲙⲉ ⲁⲩⲱ ⲉϫⲱ ⲛ̅ⲛ̅ϣⲁϫⲉ ⲛ̅ⲧⲙⲉ ⲛ̅ⲛⲉⲧⲛⲁϫⲛⲟⲩⲕ ⲡϣⲟϫⲛⲉ ⲛⲁϣⲧ̅ ⲉⲡⲟⲩⲟⲓ ⲛ̅ⲟⲩⲙⲟⲟⲩ ⲥⲱⲧⲙ̅ ⲉϫⲓ ⲛ̅ⲟⲩⲱ ⲛ̅ⲛⲉⲧⲛⲁϫⲛⲟⲩⲕ.	 I therefore teach thee truth, and knowledge good to hear; that thou mayest answer words of truth to them that question thee.	 διδάσκω οὖν σε ἀληθῆ λόγον καὶ γνῶσιν ἀγαθὴν ὑπακούειν τοῦ ἀποκρίνεσθαι λόγους ἀληθείας τοῖς προβαλλοµένοις σοι.						
Proverbs	22	22	 	 ⲙ̅ⲡⲣ̅ϫⲓ ⲟⲩϩⲏⲕⲉ ⲛ̅ϭⲟⲛⲥ̅ ϫⲉ ϥⲣ̅ϭⲣⲱϩ ⲅⲁⲣ ⲁⲩⲱ ⲙ̅ⲡⲣ̅ⲥⲉϣϥ̅ ⲟⲩⲁⲥⲑⲉⲛⲏⲥ ϩⲛ̅ ϩⲉⲛⲗⲩⲡⲏ.	 Do no violence to the poor, for he is needy: neither dishonour the helpless man in the gates.	 Μὴ ἀποβιάζου πένητα, πτωχὸς γάρ ἐστιν, καὶ µὴ ἀτιµάσῃς ἀσθενῆ ἐν πύλαις·						
Proverbs	22	23	 	 ⲡϫⲟⲉⲓⲥ ⲅⲁⲣ ⲛⲁⲕⲣⲓⲛⲉ ⲙ̅ⲡⲉϥϩⲁⲡ ⲁⲩⲱ ⲕⲛⲁⲧⲟⲩϫⲟ ⲛ̅ⲧⲉⲕⲯⲩⲭⲏ ⲛ̅ⲁⲧⲁⲣⲓⲕⲉ.	 For the Lord will plead his cause, and thou shalt deliver thy soul in safety.	 ὁ γὰρ κύριος κρινεῖ αὐτοῦ τὴν κρίσιν, καὶ ῥύσῃ σὴν ἄσυλον ψυχήν.						
Proverbs	22	24	 	 ⲙ̅ⲡⲣ̅ⲣ̅ϣⲃⲏⲣ ⲉⲩⲣⲱⲙⲉ ⲛ̅ⲣⲉϥϭⲱⲛⲧ̅ ⲙ̅ⲡⲣ̅ϣⲱⲡⲉ ⲇⲉ ⲙⲛ̅ ⲟⲩϣⲃⲏⲣ ⲛ̅ⲣⲉϥⲛⲟⲩϭⲥ̅.	 Be not companion to a furious man; neither lodge with a passionate man:	 µὴ ἴσθι ἑταῖρος ἀνδρὶ θυµώδει, φίλῳ δὲ ὀργίλῳ µὴ συναυλίζου,						
Proverbs	22	25	 	 ⲙⲏⲡⲟⲧⲉ ⲛⲅ̅ϫⲓⲥⲃⲱ ⲉⲛⲉϥϩⲓⲟⲟⲩⲉ ⲛⲅ̅ϫⲓ ⲛ̅ⲟⲩϩⲁϭⲉ ⲉⲧⲉⲕⲯⲩⲭⲏ.	 lest thou learn of his ways, and get snares to thy soul.	 µήποτε µάθῃς τῶν ὁδῶν αὐτοῦ καὶ λάβῃς βρόχους τῇ σῇ ψυχῇ.						
Proverbs	22	26	 	 ⲙ̅ⲡⲣ̅ⲧⲁⲁⲕ ⲛ̅ϣⲡ̅ⲧⲱⲣⲉ ⲉⲁⲕϣⲓⲛⲉ ϩⲏⲧϥ̅ ⲛ̅ⲟⲩϩⲟ.	 Become not surety from respect of a man’s person.	 µὴ δίδου σεαυτὸν εἰς ἐíύην αἰσχυνόµενος πρόσωπον·						
Proverbs	22	27	 	 ⲉϣⲱⲡⲉ ⲅⲁⲣ ⲉⲙⲛ̅ⲧⲁⲕ ⲉⲧⲁⲁⲩ ⲥⲉⲛⲁϥⲓ ⲙ̅ⲡⲉ ⲡⲣⲏϣ ⲉⲧϩⲁ ⲛⲉⲕⲥⲡⲓⲣⲟⲟⲩⲉ.	 For if those have not whence to give compensation, they will take the bed that is under thee.	 ἐὰν γὰρ µὴ ἔχῃς πόθεν ἀποτείσῃς, λήµψονται τὸ στρῶµα τὸ ὑπὸ τὰς πλευράς σου.						
Proverbs	22	28	 	 ⲙ̅ⲡⲣ̅ⲡⲉⲉⲛⲉ ⲛ̅ⲧⲟϣ ⲉⲃⲟⲗ ϣⲁ ⲉⲛⲉϩ ⲛ̅ⲧⲁ ⲛⲉⲕⲉⲓⲟⲧⲉ ⲥⲙⲛ̅ⲧⲟⲩ.	 Remove not the old landmarks, which thy fathers placed.	 µὴ µέταιρε ὅρια αἰώνια, ἃ ἔθεντο οἱ πατέρες σου.						
Proverbs	22	29	 	 ⲟⲩⲣⲱⲙⲉ ⲛ̅ⲣⲉϥϯϩⲧⲏϥ ⲛ̅ⲣⲉϥϭⲉⲡⲏ ϩⲛ̅ ⲛⲉϥϩⲃⲏⲩⲉ ϩⲁⲡⲥ̅ ⲉⲣⲟϥ ⲉⲧⲣⲉϥⲁϩⲉⲣⲁⲧϥ̅ ⲉϩⲉⲛⲉⲣⲱⲟⲩ ⲛϥ̅ⲧⲙ̅ⲁϩⲉⲣⲁⲧϥ̅ ⲉϩⲉⲛⲣⲱⲙⲉ ⲛ̅ϭⲱⲃ.	 It is fit that an observant man and one diligent in his business should attend on kings, and not attend on slothful men.	 ὁρατικὸν ἄνδρα καὶ ὀξὺν ἐν τοῖς ἔργοις αὐτοῦ βασιλεῦσι δεῖ παρεστάναι καὶ µὴ παρεστάναι ἀνδράσι νωθροῖς.						
Proverbs	23	1	 	 ⲉⲕϣⲁⲛϩⲙⲟⲟⲥ ⲉⲟⲩⲱⲙ ϩⲓ ⲧⲉⲧⲣⲁⲡⲉⲍⲁ ⲛ̅ⲟⲩϫⲱⲱⲣⲉ ϩⲛ̅ ⲟⲩⲛⲟⲓ ⲛⲟⲓ ⲛ̅ⲛⲉⲧⲟⲩⲕⲱ ⲙ̅ⲙⲟⲟⲩ ϩⲁⲣⲱⲕ.	 If thou sit to sup at the table of a prince, consider attentively the things set before thee:	 ἐὰν καθίσῃς δειπνεῖν ἐπὶ τραπέζης δυναστῶν, νοητῶς νόει τὰ παρατιθέµενά σοι						
Proverbs	23	2	 	 ⲛⲅ̅ϩⲓⲧⲟⲟⲩⲧⲕ̅ ⲉⲣⲟⲟⲩ ⲉⲕⲥⲟⲟⲩⲛ ϫⲉ ⲕⲛⲁϫⲡⲓ ⲥⲟⲃⲧⲉ ⲛ̅ⲧⲉⲓ̈ϩⲉ.	 and apply thine hand, knowing that it behoves thee to prepare such meats: but if thou art very insatiable,	 καὶ ἐπίβαλλε τὴν χεῖρά σου εἰδὼς ὅτι τοιαῦτά σε δεῖ παρασκευάσαι·						
Proverbs	23	3	 	 ⲉϣⲱⲡⲉ ⲇⲉ ⲛ̅ⲧⲕ̅ⲟⲩⲁⲧⲥⲉⲓ ⲙ̅ⲡⲣ̅ⲉⲡⲓⲑⲩⲙⲓ ⲉⲛⲉϥϭⲓⲛ̅ⲟⲩⲱⲙ ⲛⲁⲓ̈ ⲅⲁⲣ ϩⲏⲛ ⲉϩⲟⲩⲛ ⲉⲩⲱⲛϩ̅ ⲛ̅ⲛⲟⲩϫ.	 desire not his provisions; for these belong to a false life.	 εἰ δὲ ἀπληστότερος εἶ, µὴ ἐπιθύµει τῶν ἐδεσµάτων αὐτοῦ, ταῦτα γὰρ ἔχεται ζωῆς ψευδοῦς.						
Proverbs	23	4	 	 ⲙ̅ⲡⲣ̅ⲥⲟⲩⲧⲛ ⲧⲟⲟⲧⲕ̅ ⲉⲃⲟⲗ ⲙⲛ̅ ⲟⲩⲣⲙ̅ⲙⲁⲟ ⲛ̅ⲧⲕ̅ ⲟⲩϩⲏⲕⲉ ⲥⲁϩⲱⲱⲕ ⲇⲉ ⲉⲃⲟⲗ ⲙ̅ⲙⲟϥ ϩⲙ̅ ⲡⲉⲕϩⲏⲧ.	 If thou art poor, measure not thyself with a rich man; but refrain thyself in thy wisdom.	 µὴ παρεκτείνου πένης ὢν πλουσίῳ, τῇ δὲ σῇ ἐννοίᾳ ἀπόσχου·						
Proverbs	23	5	 	 ⲉϣⲱⲡⲉ ⲇⲉ ⲉⲕϣⲁⲛⲥⲙ̅ⲛⲉⲓⲁⲧⲕ̅ ⲉϫⲱϥ ⲛ̅ⲛⲉϥⲟⲩⲱⲛϩ ⲉⲃⲟⲗ ϩⲛ̅ ⲗⲁⲁⲩ ⲙ̅ⲙⲁ ⲁϥⲥⲟⲃⲧⲉ ⲅⲁⲣ ⲛⲁϥ ⲛ̅ϩⲉⲛⲧⲛ̅ϩ ⲛ̅ⲑⲉ ⲛ̅ⲟⲩⲁϩⲱⲙ ⲉⲃⲱⲗ ⲉⲃⲟⲗ ⲉⲡⲁⲏⲣ ⲁⲩⲱ ϥⲛⲁⲕⲧⲟϥ ⲉⲡⲏⲓ̈ ⲙ̅ⲡⲉⲧϩⲓϫⲱϥ ⲡⲱⲛ ⲉϩⲣⲟϣ ⲁⲩⲱ ⲡϣⲱ ⲙⲟⲕϩ̅ ⲛ̅ϥⲓ ϩⲁⲣⲟϥ ⲧⲟⲣⲅⲏ ⲇⲉ ⲙ̅ⲡⲁⲑⲏⲧ ϩⲟⲣϣ̅ ⲉϩⲟⲩⲟ ⲉⲣⲟⲟⲩ ⲙ̅ⲡⲉⲥⲛⲁⲩ.	 If thou shouldest fix thine eye upon him, he will disappear; for wings like an eagle’s are prepared for him, and he returns to the house of his master.	 ἐὰν ἐπιστήσῃς τὸ σὸν ὄµµα πρὸς αὐτόν, οὐδαµοῦ φανεῖται, κατεσκεύασται γὰρ αὐτῷ πτέρυγες ὥσπερ ἀετοῦ, καὶ ὑποστρέφει εἰς τὸν οἶκον τοῦ προεστηκότος αὐτοῦ.						
Proverbs	23	6	 	 ⲙ̅ⲡⲣ̅ⲟⲩⲱⲙ ⲙⲛ̅ ⲟⲩⲣⲱⲙⲉ ⲛⲉⲓⲉⲣⲃⲟⲟⲛⲉ ⲁⲩⲱ ⲙ̅ⲡⲣ̅ⲉⲡⲓⲑⲩⲙⲓ ⲉⲛⲉϥϭⲓⲛ̅ⲟⲩⲱⲙ ⲛⲁⲓ̈ ⲅⲁⲣ ϩⲏⲛ ⲉϩⲟⲩⲛ ⲉⲩⲱⲛϩ ⲛ̅ⲛⲟⲩϫ	 Sup not with an envious man, neither desire thou his meats:	 µὴ συνδείπνει ἀνδρὶ βασκάνῳ µηδὲ ἐπιθύµει τῶν βρωµάτων αὐτοῦ·						
Proverbs	23	7b	 	 ⲙ̅ⲡⲣ̅ϫⲓⲧϥ ⲉϩⲟⲩⲛ ⲉⲡⲉⲕⲏⲓ̈ ϫⲉ ⲛ̅ⲛⲉⲕⲟⲩⲱⲙ ⲛ̅ⲛⲉⲕⲟⲉⲓⲕ ⲛⲙ̅ⲙⲁϥ.	 and do not bring him in to thyself, nor eat thy morsel with him:	 µηδὲ πρὸς σὲ εἰσαγάγῃς αὐτὸν καὶ φάγῃς τὸν ψωµόν σου µετ’ αὐτοῦ·						
Proverbs	23	7a	 	 ⲛ̅ⲑⲉ ⲅⲁⲣ ⲛ̅ⲟⲩⲁ ⲉϥⲛⲁⲉⲙⲕⲟⲩϥⲱ ⲧⲁⲓ̈ ⲧⲉ ⲑⲉ ⲉⲧϥ̅ⲛⲁⲟⲩⲱⲙ ⲁⲩⲱ ⲛϥ̅ⲥⲱ	 so he eats and drinks as if any one should swallow a hair,	 ὃν τρόπον γὰρ εἴ τις καταπίοι τρίχα, οὕτως ἐσθίει καὶ πίνει.						
Proverbs	23	8	 	 ϥⲛⲁⲕⲁⲃⲟⲗ ⲅⲁⲣ ⲙ̅ⲙⲟⲟⲩ ⲛϥ̅ⲧⲁⲕⲉ ⲛⲉⲕϣⲁϫⲉ ⲉⲧⲛⲁⲛⲟⲩⲟⲩ.	 for he will vomit it up, and spoil thy fair words.	 ἐξεµέσει γὰρ αὐτὸν καὶ λυµανεῖται τοὺς λόγους σου τοὺς καλούς.						
Proverbs	23	9	 	 ⲙ̅ⲡⲣ̅ϫⲉ ⲗⲁⲁⲩ ⲉⲙⲙⲁⲁϫⲉ ⲙ̅ⲡⲁⲑⲏⲧ ⲙⲏⲡⲟⲧⲉ ⲛϥ̅ⲕⲙ̅ϣ ⲛⲉϥϣⲁϫⲉ.	 Say nothing in the ears of a fool, lest at any time he sneer at thy wise words.	 εἰς ὦτα ἄφρονος µηδὲν λέγε, µήποτε µυκτηρίσῃ τοὺς συνετοὺς λόγους σου.						
Proverbs	23	10	 	 ⲙ̅ⲡⲣ̅ⲃⲱⲕ ⲉϩⲟⲩⲛ ⲉϭⲱⲙ ⲛ̅ⲟⲣⲫⲁⲛⲟⲥ.	 Remove not the ancient landmarks; and enter not upon the possession of the fatherless:	 µὴ µεταθῇς ὅρια αἰώνια, εἰς δὲ κτῆµα ὀρφανῶν µὴ εἰσέλθῃς·						
Proverbs	23	11	 	 ⲡⲛⲟⲩⲧⲉ ⲅⲁⲣ ⲉⲧϫⲟⲟⲣ ⲡⲉⲧⲥⲱⲧⲉ ⲙ̅ⲙⲟⲟⲩ ⲁⲩⲱ ϥⲛⲁϫⲓϩⲁⲡ ⲛⲙ̅ⲙⲁⲕ ϩⲁⲣⲟⲟⲩ.	 for the Lord is their redeemer; he is mighty, and will plead their cause with thee.	 ὁ γὰρ λυτρούµενος αὐτοὺς κύριος κραταιός ἐστιν καὶ κρινεῖ τὴν κρίσιν αὐτῶν µετὰ σοῦ.						
Proverbs	23	12	 	 ϯ ⲡⲉⲕϩⲏⲧ ⲉⲧⲉⲥⲃⲱ ⲛⲅ̅ⲥⲃ̅ⲧⲉ ⲛⲉⲕⲙⲁⲁϫⲉ ⲉⲛϣⲁϫⲉ ⲛ̅ⲧⲁⲓⲥⲑⲏⲥⲓⲥ.	 Apply thine heart to instruction, and prepare thine ears for words of discretion.	 δὸς εἰς παιδείαν τὴν καρδίαν σου, τὰ δὲ ὦτά σου ἑτοίµασον λόγοις αἰσθήσεως.						
Proverbs	23	13	 	 ⲙ̅ⲡⲣ̅ⲗⲟ ⲉⲕϯⲥⲃⲱ ⲛ̅ⲟⲩⲕⲟⲩⲓ̈ ϫⲉ ⲉⲕϣⲁⲛⲣⲁϩⲧϥ̅ ⲛ̅ⲟⲩϭⲉⲣⲱⲃ ⲛ̅ⲛⲉϥⲛⲁⲙⲟⲩ ⲁⲛ.	 Refrain not from chastening a child; for if thou beat him with the rod, he shall not die.	 µὴ ἀπόσχῃ νήπιον παιδεύειν, ὅτι ἐὰν πατάξῃς αὐτὸν ῥάβδῳ, οὐ µὴ ἀποθάνῃ·						
Proverbs	23	14	 	 ⲛ̅ⲧⲟⲕ ⲙⲉⲛ ⲅⲁⲣ ⲉⲕⲛⲁⲣⲉϩⲧ ⲡⲉⲕϣⲏⲣⲉ ϩⲛ̅ ⲟⲩϭⲉⲣⲱⲃ ⲕⲛⲁⲧⲟⲩϫⲟ ⲇⲉ ⲛ̅ⲧⲉϥⲯⲩⲭⲏ ⲉⲃⲟⲗ ϩⲙ̅ ⲡⲙⲟⲩ.	 For thou shalt beat him with the rod, and shalt deliver his soul from death.	 σὺ µὲν γὰρ πατάξεις αὐτὸν ῥάβδῳ, τὴν δὲ ψυχὴν αὐτοῦ ἐκ θανάτου ῥύσῃ.						
Proverbs	23	15	 	 ⲡⲁϣⲏⲣⲉ ⲉⲣϣⲁⲛ ⲡⲉⲕϩⲏⲧ ⲣ̅ⲥⲟⲫⲟⲥ ⲕⲛⲁⲉⲩⲫⲣⲁⲛⲧⲉ ⲙ̅ⲡⲱⲓ ϩⲱ.	 Son, if thy heart be wise, thou shalt also gladden my heart;	 υἱέ, ἐὰν σοφὴ γένηταί σου ἡ καρδία, εὐφρανεῖς καὶ τὴν ἐµὴν καρδίαν,						
Proverbs	23	16	 	 ⲁⲩⲱ ⲛ̅ⲧⲉⲛⲁⲥⲡⲟⲟⲧⲟⲩ ϣⲁϫⲉ ⲙⲛ̅ ⲛⲉⲕⲥⲡⲟⲧⲟⲩ ⲉϣⲱⲡⲉ ⲉⲩⲥⲟⲩⲧⲱⲛ.	 and thy lips shall converse with my lips, if they be right.	 καὶ ἐνδιατρίψει λόγοις τὰ σὰ χείλη πρὸς τὰ ἐµὰ χείλη, ἐὰν ὀρθὰ ὦσιν.						
Proverbs	23	17	 	 ⲙ̅ⲡⲣ̅ⲧⲣⲉ ⲡⲉⲕϩⲏⲧ ⲕⲱϩ ⲉⲛ̅ⲣⲉϥⲣ̅ⲛⲟⲃⲉ ⲁⲗⲗⲁ ⲙⲁⲧⲁϣⲟⲕ ⲉⲩⲙⲛ̅ⲧⲙⲁⲓⲛⲟⲩⲧⲉ ⲁⲩⲱ ⲛⲅ̅ϣⲱⲡⲉ ϩⲛ̅ ⲑⲟⲧⲉ ⲙ̅ⲡϫⲟⲉⲓⲥ ⲙ̅ⲡⲉϩⲟⲟⲩ ⲧⲏⲣϥ̅.	 Let not thine heart envy sinners: but be thou in the fear of the Lord all the day.	 µὴ ζηλούτω ἡ καρδία σου ἁµαρτωλούς, ἀλλὰ ἐν φόβῳ κυρίου ἴσθι ὅλην τὴν ἡµέραν·						
Proverbs	23	18	 	 ⲉⲕϣⲁⲛϩⲁⲣⲉϩ ⲅⲁⲣ ⲉⲛⲁⲓ̈ ⲟⲩⲛ̅ ϩⲉⲛϫⲡⲟ ⲛⲁϣⲱⲡⲉ ⲛⲁⲕ ⲁⲩⲱ ⲛ̅ⲧⲉⲕϩⲉⲗⲡⲓⲥ ⲛⲁⲱϫⲛ̅ ⲁⲛ.	 For if thou shouldest keep these things, thou shalt have posterity; and thine hope shall not be removed.	 ἐὰν γὰρ τηρήσῃς αὐτά, ἔσται σοι ἔκγονα, ἡ δὲ ἐλπίς σου οὐκ ἀποστήσεται.						
Proverbs	23	19	 	 ⲥⲱⲧⲙ̅ ⲡⲁϣⲏⲣⲉ ⲁⲩⲱ ⲛⲅ̅ⲣ̅ⲥⲟⲫⲟⲥ ⲁⲩⲱ ⲛⲅ̅ⲣ̅ϩⲉⲛⲙⲉⲉⲩⲉ ⲉⲩⲥⲟⲩⲧⲱⲛ ⲙ̅ⲡⲉⲕϩⲏⲧ.	 Hear, my son, and be wise, and rightly direct the thoughts of thine heart.	 ἄκουε, υἱέ, καὶ σοφὸς γίνου καὶ κατεύθυνε ἐννοίας σῆς καρδίας·						
Proverbs	23	20	 	 ⲙ̅ⲡⲣ̅ⲣ̅ⲣⲉϥϯϩⲉ ⲁⲩⲱ ⲙ̅ⲡⲣ̅ⲥⲟⲩⲧⲛ̅ ⲧⲟⲟⲧⲕ̅ ⲉⲃⲟⲗ ⲉϩⲉⲛⲥⲩⲙⲃⲟⲗⲏ ⲉϣⲉⲡⲁϥ.	 Be not a wine-bibber, neither continue long at feasts, and purchases of flesh:	 µὴ ἴσθι οἰνοπότης µηδὲ ἐκτείνου συµβολαῖς κρεῶν τε ἀγορασµοῖς·						
Proverbs	23	21	 	 ⲣⲉϥϯϩⲉ ⲅⲁⲣ ⲛⲓⲙ ϩⲓ ⲡⲟⲣⲛⲟⲕⲟⲡⲟⲥ ⲛⲁⲣ̅ϩⲏⲕⲉ ⲁⲩⲱ ⲥⲁⲩⲏⲣⲡ ⲛⲓⲙ ⲛⲁϯϩⲓⲱⲱϥ ⲛ̅ϩⲉⲛⲧⲟⲉⲓⲥ.	 for every drunkard and whoremonger shall be poor; and every sluggard shall clothe himself with tatters and ragged garments.	 πᾶς γὰρ µέθυσος καὶ πορνοκόπος πτωχεύσει, καὶ ἐνδύσεται διερρηγµένα καὶ ῥακώδη πᾶς ὑπνώδης.						
Proverbs	23	22	 	 ⲥⲱⲧⲙ̅ ⲡⲁϣⲏⲣⲉ ⲛ̅ⲥⲁ ⲡⲉⲕⲉⲓⲱⲧ ⲛ̅ⲧⲁϥϫⲡⲟⲕ ⲁⲩⲱ ⲙ̅ⲡⲣ̅ⲕⲁⲧⲁⲫⲣⲟⲛⲓ ϫⲉ ⲁ ⲧⲉⲕⲙⲁⲁⲩ ⲣ̅ϩⲗ̅ⲗⲱ.	 Hearken, my son, to thy father which begot thee, and despise not thy mother because she is grown old.	 ἄκουε, υἱέ, πατρὸς τοῦ γεννήσαντός σε καὶ µὴ καταφρόνει ὅτι γεγήρακέν σου ἡ µήτηρ.						
Proverbs	23	23	 	 	 	 						
Proverbs	23	24	 	 ϣⲁⲣⲉ ⲟⲩⲉⲓⲱⲧ ⲛ̅ⲇⲓⲕⲁⲓⲟⲥ ⲥⲁⲁⲛϣ̅ ⲕⲁⲗⲱⲥ ϣⲁⲣⲉ ⲡⲉϥϩⲏⲧ ⲇⲉ ⲉⲩⲫⲣⲁⲛⲉ ⲉϫⲛ̅ ⲟⲩϣⲏⲣⲉ ⲛ̅ⲥⲁⲃⲉ.	 A righteous father brings up his children well; and his soul rejoices over a wise son.	 καλῶς ἐκτρέφει πατὴρ δίκαιος, ἐπὶ δὲ υἱῷ σοφῷ εὐφραίνεται ἡ ψυχὴ αὐτοῦ·						
Proverbs	23	25	 	 ⲙⲁⲣⲉ ⲡⲉⲕⲉⲓⲱⲧ ⲙⲛ̅ ⲧⲉⲕⲙⲁⲁⲩ ⲉⲩⲫⲣⲁⲛⲉ ⲉϫⲱⲕ ⲛ̅ⲧⲉⲧⲉⲛ̅ⲧⲁⲥϫⲡⲟⲕ ⲣⲁϣⲉ.	 Let thy father and thy mother rejoice over thee, and let her that bore thee be glad.	 εὐφραινέσθω ὁ πατὴρ καὶ ἡ µήτηρ ἐπὶ σοί, καὶ χαιρέτω ἡ τεκοῦσά σε.						
Proverbs	23	26	 	 ⲡⲁϣⲏⲣⲉ ⲙⲁ ⲛⲁⲓ̈ ⲙ̅ⲡⲉⲕϩⲏⲧ ⲙⲁⲣⲉ ⲛⲉⲕⲃⲁⲗ ⲇⲉ ϩⲁⲣⲉϩ ⲉⲛⲁϩⲓⲟⲟⲩⲉ.	 My son, give me thine heart, and let thine eyes observe my ways.	 δός µοι, υἱέ, σὴν καρδίαν, οἱ δὲ σοὶ ὀφθαλµοὶ ἐµὰς ὁδοὺς τηρείτωσαν·						
Proverbs	23	27	 	 ⲟⲩⲡⲓⲑⲟⲥ ⲅⲁⲣ ⲉϥϭⲟⲧϩ̅ ⲡⲉ ⲟⲩⲏⲓ̈ ⲉⲙⲡⲱⲕ ⲁⲛ ⲡⲉ ⲁⲩⲱ ⲟⲩϣⲱⲧⲉ ⲧⲉ ⲉⲥϭⲏⲩ ⲉⲥⲙⲟⲕϩ̅ ⲛⲉⲓ ⲉϩⲣⲁⲓ̈.	 For a strange house is a vessel full of holes; and a strange well is narrow.	 πίθος γὰρ τετρηµένος ἐστὶν ἀλλότριος οἶκος, καὶ φρέαρ στενὸν ἀλλότριον·						
Proverbs	23	28	 	 ⲏⲇⲏ ⲅⲁⲣ ϥⲛⲁⲧⲁⲕⲟ ⲛ̅ⲧⲉⲩⲛⲟⲩ ⲁⲩⲱ ⲡⲁⲣⲁⲛⲟⲙⲟⲥ ⲛⲓⲙ ⲛⲁⲱϫⲛ̅.	 For such a one shall perish suddenly; and every transgressor shall be cut off.	 οὗτος γὰρ συντόµως ἀπολεῖται, καὶ πᾶς παράνοµος ἀναλωθήσεται.						
Proverbs	23	29	 	 ⲉⲣⲉ ⲡⲟⲩⲟⲓ ⲛⲁϣⲱⲡⲉ ⲛ̅ⲛⲓⲙ ⲁⲩⲱ ⲡⲉϣⲧⲟⲣⲧⲣ̅ ⲛ̅ⲛⲓⲙ ⲙⲛ̅ ϫⲓϩⲁⲡ ⲛⲓⲙ ⲙⲛ̅ ⲛ̅ⲗⲉⲥⲭⲏ ⲉⲑⲟⲟⲩ ⲛ̅ⲛⲓⲙ ⲉⲣⲉ ⲛⲟⲩⲱϣϥ̅ ⲉⲡϫⲓⲛϫⲏ ϣⲟⲟⲡ ⲛ̅ⲛⲓⲙ ⲏ ⲛⲓⲙ ⲡⲉⲧⲉⲣⲉ ⲛⲉϥⲃⲁⲗ ⲟⲛ ⲉⲗⲉⲗⲕⲏⲙⲉ.	 Who has woe? who trouble? who has quarrels? and who vexations and disputes? who has bruises without a cause? whose eyes are livid?	 τίνι οὐαί; τίνι θόρυβος; τίνι κρίσις; τίνι ἀηδίαι καὶ λέσχαι; τίνι συντρίµµατα διὰ κενῆς; τίνος πέλιοι οἱ ὀφθαλµοί;						
Proverbs	23	30	 	 ⲛ̅ⲛⲉⲧⲱⲥⲕ̅ ⲁⲛ ⲛⲉ ϩⲛ̅ ⲛ̅ⲏⲣⲡ̅ ⲛ̅ⲛⲉⲧϣⲓⲛⲉ ⲁⲛ ⲛⲉ ϫⲉ ⲉⲣⲉ ⲙ̅ⲙⲁⲛ̅ⲥⲱ ⲛⲁϣⲱⲡⲉ ⲧⲱⲛ.	 Are not those of them that stay long at wine? are not those of them that haunt the places where banquets are?	 οὐ τῶν ἐγχρονιζόντων ἐν οἴνοις; οὐ τῶν ἰχνευόντων ποῦ πότοι γίνονται;						
Proverbs	23		 	 ⲙ̅ⲡⲣ̅ϯϩⲉ ⲛ̅ⲛ̅ⲏⲣⲡ̅ ⲁⲗⲗⲁ ϣⲁϫⲉ ⲙⲛ̅ ⲛ̅ⲣⲱⲙⲉ ⲛ̅ⲇⲓⲕⲁⲓⲟⲥ ⲁⲩⲱ ⲛ̅ⲧⲉⲧⲛ̅ϣⲁϫⲉ ⲙⲛ̅ ⲛⲉⲧⲙⲟⲟϣⲉ ⲉⲕϣⲁⲛϯ ⲛⲉⲕⲃⲁⲗ ⲅⲁⲣ ⲉⲛⲉⲫⲓⲁⲗⲏ ⲙⲛ̅ ⲛ̅ϫⲱ ⲙⲛ̅ⲛ̅ⲥⲱⲥ ⲕⲛⲁⲙⲟⲟϣⲉ ⲉⲕⲕⲏⲕⲁϩⲏⲩ ⲉϩⲟⲩⲉ ⲟⲩⲥⲁϩⲙⲉⲥ ⲛ̅ⲑⲁⲏ ⲇⲉ.	Be not drunk with wine; but converse with just men, and converse with them openly. (31) For if thou shouldest set thine eyes on bowls and cups, thou shalt afterwards go more naked than a pestle.	 µὴ µεθύσκεσθε οἴνῳ, ἀλλὰ ὁµιλεῖτε ἀνθρώποις δικαίοις καὶ ὁµιλεῖτε ἐν περιπάτοις· ἐὰν γὰρ εἰς τὰς φιάλας καὶ τὰ ποτήρια δῷς τοὺς ὀφθαλµούς σου, ὕστερον περιπατήσεις γυµνότερος ὑπέρου,						
Proverbs	23	32	 	 ⲕⲛⲁⲣ̅ⲑⲉ ⲙ̅ⲡⲉⲛⲧⲁϥⲙⲟⲩ ⲉⲁⲩϣⲟⲟϭⲉϥ ϩⲓⲧⲛ̅ ⲟⲩϩⲟϥ ⲉⲡϩⲁⲏ. ⲁⲩⲱ ⲛ̅ⲑⲉ ⲙ̅ⲡⲉⲛⲧⲁ ⲟⲩⲕⲉⲣⲁⲥⲧⲏⲥ ⲗⲟⲕⲥϥ̅ ⲉⲁⲧⲙⲁⲧⲟⲩ ϣⲱⲗ ⲉⲣⲟϥ.	 But at last such a one stretches himself out as one smitten by a serpent, and venom is diffused through him as by a horned serpent.	 τὸ δὲ ἔσχατον ὥσπερ ὑπὸ ὄφεως πεπληγὼς ἐκτείνεται καὶ ὥσπερ ὑπὸ κεράστου διαχεῖται αὐτῷ ὁ ἰός.						
Proverbs	23	33	 	 ⲉⲣϣⲁⲛ ⲛⲉⲕⲃⲁⲗ ⲛⲁⲩ ⲉⲛⲉⲧⲉⲛⲛⲟⲩⲕ ⲁⲛ ⲛⲉ ⲧⲉⲕⲧⲁⲡⲣⲟ ⲛⲁϫⲱ ⲛ̅ⲛⲉⲧϭⲟⲟⲙⲉ.	 Whenever thine eyes shall behold a strange woman, then thy mouth shall speak perverse things.	 οἱ ὀφθαλµοί σου ὅταν ἴδωσιν ἀλλοτρίαν, τὸ στόµα σου τότε λαλήσει σκολιά,						
Proverbs	23	34	 	 ⲕⲛⲁⲛⲟϫⲕ ⲛ̅ⲑⲉ ⲙ̅ⲡⲉⲧϩⲙ̅ ⲡϩⲏⲧ ⲛ̅ⲑⲁⲗⲁⲥⲥⲁ ⲁⲩⲱ ⲛ̅ⲑⲉ ⲛ̅ⲟⲩⲛⲉⲉⲃ ⲉϥϩⲛ̅ ⲟⲩⲛⲟϭ ⲛ̅ϩⲟⲉⲓⲙ.	 And thou shalt lie as in the midst of the sea, and as a pilot in a great storm.	 καὶ κατακείσῃ ὥσπερ ἐν καρδίᾳ θαλάσσης καὶ ὥσπερ κυβερνήτης ἐν πολλῷ κλύδωνι·						
