book	chapter	verse	Bohairic	Sahidic	English	Greek	Fayyumic	Akhmimic	OldBohairic	Mesokemic	DialectP	Lycopolitan
Song of Songs	1	1		 [ⲡϫⲱ ⲛ̅ⲧⲉ] ⲛⲓϫⲱ [ⲉⲧⲉ ⲡⲁ ⲥⲟⲗⲟ]ⲙⲱⲛ ⲡⲉ [ⲉϥϫⲱ ⲙ̅ⲙ]ⲟⲥ	 The Song of songs, which is Solomon’s.	 ᾎσµα ᾀσµάτων, ὅ ἐστιν τῷ Σαλωµων.	 [ⲁⲥⲙⲁ ⲁⲥⲙⲁⲧⲱⲛ]					
Song of Songs	1	2		 ϫⲉ ⲙⲁ[ⲣⲉϥϯ ⲡⲉⲓ ⲉ]ⲣⲱⲓ ⲉⲃⲟⲗ [ϩⲛ̅ ⲙ̅ⲡⲉⲓ] ⲛ̅ⲧⲉ ⲧⲉϥⲧⲁ[ⲡⲣⲟ ϫⲉ] ⲛⲁⲛⲟⲩ ⲛⲉⲕ[ⲉⲕⲓⲃ]ⲉ ⲛ̅ϩⲟⲩⲉ ⲡⲏⲣⲡ̅	 Let him kiss me with the kisses of his mouth: for thy breasts are better than wine.	 Φιλησάτω µε ἀπὸ φιληµάτων στόµατος αὐτοῦ, ὅτι ἀγαθοὶ µαστοί σου ὑπὲρ οἶνον,	 ⲙⲁⲗⲉϥϯ ⲡⲓ ⲉⲗⲱⲉⲓ. ⲉⲃⲁⲗ [ϩⲓⲛ ⲙ̈ⲡⲓ ⲛ̈ⲧⲉ ⲡⲉϥⲗⲁ÷ ϫ]ⲉ ⲛⲁⲛⲟⲩ ⲛⲉⲕⲓⲕⲉⲓⲃⲉⲓ ⲉϩⲟⲩⲁⲥⲧ ⲉⲟⲩⲏⲗⲡ÷					
Song of Songs	1	3		 [ⲁⲩ]ⲱ ⲡⲉⲥⲧⲟⲓ ⲛ̅ⲛⲉⲕ[ⲥⲟϭ]ⲛ̅ ⲉϥϣⲱϣ ⲛ̅ϩⲟⲩ[ⲉ ⲛ̅ϩ]ⲏⲛⲉ ⲧⲏⲣⲟⲩ.  [ⲡⲉ]ⲕⲣⲁⲛ ⲟⲩⲥⲟϭⲛ̅ ⲡⲉ ⲉⲁⲩⲥⲙⲟⲩ ⲉⲣⲟϥ ⲁⲩⲱ ϥⲡⲏⲛ ⲉⲃⲟⲗ. ⲉⲧⲃⲉ ⲡⲁⲓ ⲁ ⲛ̅ϣⲉⲉⲣⲉ ϣⲏⲙ ⲙⲉⲣⲓⲧⲕ̅.	 And the smell of thine ointments is better than all spices: thy name is ointment poured forth; therefore do the young maidens love thee.	 καὶ ὀσµὴ µύρων σου ὑπὲρ πάντα τὰ ἀρώµατα, µύρον ἐκκενωθὲν ὄνοµά σου. διὰ τοῦτο νεάνιδες ἠγάπησάν σε,	 ⲁϩⲁ [ⲡⲉⲥⲧⲁⲉⲓ ⲛ̈ⲛⲉⲕⲥⲁ]ϫⲓⲛ ⲛⲁⲛⲟⲩ[ϥ] ⲉϩⲟⲩⲁⲥⲧ ⲉⲥⲁϫⲓⲛ ⲛⲓⲙⲉⲓ÷ ⲟⲩⲥⲁ[ϫⲓⲛ ⲉϥⲡⲏⲛ ⲉⲃⲁⲗ] ⲡⲉ ⲡⲉⲕⲗⲉ[ⲛ÷] ⲉⲗⲃⲉ ⲡⲉⲓ ϩⲉⲛⲁⲗⲁⲩⲓ̈ ⲛϩⲓⲁⲙⲓ ⲁⲩ[ⲙⲏⲓ̈ ⲙ̈ⲙⲁⲕ÷]					
Song of Songs	1	4		 ⲁⲩⲥⲟⲕⲕ̅ ⲛⲁⲩ ⲉⲡⲁϩⲟⲩ ⲉⲛⲛⲁⲡⲱⲧ ⲉⲟⲩⲁϩⲛ̅ ⲛ̅ⲥⲁ ⲡⲉⲥⲧⲟⲓ ⲛ̅ⲛⲉⲕⲥⲟϭⲛ̅ ⲁ ⲡⲣ̅ⲣⲟ ϫⲓ [ⲙ̅ⲙⲟⲓ] ⲉϩⲟⲩⲛ [ⲉⲡⲉϥⲧⲁⲙⲓ]ⲟⲛ ⲧⲛ̅[ⲛⲁⲧⲉⲗⲏⲗ] ϭⲉ ⲛ̅ⲧⲛ̅[ⲉⲩⲫⲣⲁⲛⲉ] ⲛ̅ϩⲏⲧⲉ. [ⲧⲛ̅ⲛⲁ]ⲙⲉⲣⲉ ⲛⲟⲩ[ⲉⲕⲓⲃⲉ] ⲉϩⲟⲩⲉ ⲡⲏⲣ[ⲡ̅ ϫⲉ ⲁ] ⲡⲉⲧⲥⲟⲩⲧⲱ[ⲛ ⲙⲉ]ⲣⲓⲧⲉ.	 They have drawn thee: we will run after thee, for the smell of thine ointments: the king has brought me into closet: let us rejoice and be glad in thee; we will love thy breasts more than wine: righteousness loves thee.	 εἵλκυσάν σε, ὀπίσω σου εἰς ὀσµὴν µύρων σου δραµοῦµεν. Εἰσήνεγκέν µε ὁ βασιλεὺς εἰς τὸ ταµιεῖον αὐτοῦ. Ἀγαλλιασώµεθα καὶ εὐφρανθῶµεν ἐν σοί, ἀγαπήσοµεν µαστούς σου ὑπὲρ οἶνον· εὐθύτης ἠγάπησέν σε.	 [ⲁⲩ]ⲥⲁⲕ ⲛ̈ⲥⲁ ⲡⲉϩⲟⲩ ⲛ̈ⲛⲉⲕⲥⲁϫⲓⲛ÷ ⲁϩⲁ ⲡⲣⲣⲁ ⲁϥⲛ̈ⲧϯ ⲉϩ[ⲟⲩⲛ ⲉⲡⲉϥⲧ]ⲁⲙⲓⲟⲛ÷ ⲉⲛⲉⲧⲉⲗⲏⲗ ⲛ̈ⲧⲉⲛⲟⲩⲛⲁϥ ϩⲗⲏⲓ̈ ⲛ̈ϩⲏⲧⲕ[÷ ⲧⲉⲛⲉⲙⲉ(ⲗ)ⲗ]ⲉ ⲛⲉⲕⲕⲓⲃⲓ ⲉϩⲟⲩⲁⲥⲧ ⲉⲟⲩⲏⲗⲡ÷ ⲡⲥⲁⲩⲧⲉⲛ ⲡⲉⲛⲧⲁϥⲙⲉⲗ[ⲗⲓϯ÷]					
Song of Songs	1	5		 ⲁⲛⲟⲕ ⲁⲛ[ⲅ̅ ⲟⲩ]ⲕⲁⲙⲏ ⲁⲗⲗⲁ ⲛ[ⲉⲥⲱ]ⲉⲓ ⲉⲛ̅ϣⲉⲉⲣⲉ ⲙ̅[ⲡⲓⲏ̅]ⲗ̅. ⲛ̅ⲑⲉ ⲛ̅ⲛⲉⲥⲕⲏⲛⲏ ⲛ̅ⲕⲏⲇⲁⲣ ⲛ̅ⲑⲉ ⲇⲉ ⲛ̅ⲛ̅ⲇⲉⲣⲣⲓⲥ ⲛ̅ⲥⲟⲗⲟⲙⲱⲛ.	 I am black, but beautiful, ye daughters of Jerusalem, as the tents of Kedar, as the curtains of Solomon.	 Μέλαινά εἰµι καὶ καλή, θυγατέρες Ιερουσαληµ, ὡς σκηνώµατα Κηδαρ, ὡς δέρρεις Σαλωµων.	 [ⲁⲛⲁ]ⲕ ⲟⲩⲕⲁⲙⲏ ⲁϩⲁ ⲛⲁⲛⲟⲩⲥ ⲛ̈ⲛⲓⲛϣⲏⲗⲓ ⲛ̈ⲥϩⲓⲙⲉⲓ ⲛ̈ⲧⲉ ⲡⲓⲥ̅[ⲗ̅÷ ⲛ̈ⲑⲏ ⲛ̈]ⲛⲓⲙⲁ ⲛ̈ϣⲱⲡⲓ ⲛ̈ⲕⲏⲇⲁⲣ÷ ⲛ̈ⲑⲏ ⲙ̈ⲡⲁϥⲟⲩⲓ̈ ⲛ̈ⲥⲁⲗⲟⲙⲱ[ⲛ÷]					
Song of Songs	1	6		 ⲙ̅ⲡⲣ̅ϭⲱϣⲧ̅ ⲉⲣⲟⲓ ϫⲉ ⲁⲛⲅ̅ ⲟⲩⲕⲁⲙⲏ. ⲁⲛⲟⲕ ⲡⲣⲏ ⲡⲉⲛⲧⲁϥⲕⲁⲁⲧ ⲛ̅[ⲥⲱϥ. ⲛ̅ϣ]ⲏⲣⲉ ⲛ̅ⲧⲁⲙ[ⲁⲁⲩ ⲁⲩⲙⲓ]ϣⲉ ⲛⲙ̅[ⲙⲁⲓ. ⲁⲩⲕⲁⲁ]ⲧ ⲉⲣⲟⲓ̈ⲥ [ⲉϩⲉⲛⲙⲁ] ⲛ̅ⲉⲗⲟⲟⲗⲉ. [ⲡⲁⲙⲁ ⲛ̅]ⲉⲗⲟⲟⲗⲉ [ⲁⲛⲟⲕ ⲙ̅]ⲡⲓⲣⲟⲉⲓⲥ [ⲉⲣⲟϥ].	 Look not upon me, because I am dark, because the sun has looked unfavourably upon me: my mother’s sons strove with me; they made me keeper in the vineyards; I have not kept my own vineyard.	 µὴ βλέψητέ µε, ὅτι ἐγώ εἰµι µεµελανωµένη, ὅτι παρέβλεψέν µε ὁ ἥλιος· υἱοὶ µητρός µου ἐµαχέσαντο ἐν ἐµοί, ἔθεντό µε φυλάκισσαν ἐν ἀµπελῶσιν· ἀµπελῶνα ἐµὸν οὐκ ἐφύλαξα.	 [ⲙ̈ⲡⲉⲗ]ⲥⲁⲙⲉⲥ ⲉⲗⲁⲓ̈ ϫⲉ ⲁⲛⲁⲕ ⲟⲩⲕⲁⲙⲏ÷ ⲡⲣⲉ ⲡⲉ. ⲛ̈ⲧⲁϥϩⲓ ϩⲧ[ⲉⲓ̈ ⲙ̈ⲙⲁⲓ̈÷ (ⲛⲓ)]ⲛϣⲏⲗⲓ ⲛ̈ⲧⲁⲙⲉⲩ ⲛⲉⲧⲁⲩϣⲱϫⲓ ⲛ̈ϩⲏⲧ÷ ⲁⲩⲕⲉⲧ ⲛ̈ⲛⲟⲩ[ⲁⲗⲉϩ ⲉⲙ̈ⲙⲁ] ⲛ̈ⲛⲁⲗⲁⲗⲉⲓ÷ ⲡⲁⲙⲉ ⲛⲁⲗⲁⲗⲉⲓ ⲁⲛⲁⲕ ⲙ̈ⲡⲉⲓⲁⲗⲉϩ ⲉⲗ[ⲁϥ÷]					
Song of Songs	1	7		 ⲙⲁⲧⲁⲙⲟⲓ ϭⲉ [ⲡⲉⲛ]ⲧⲁ ⲧⲁⲯⲩⲭⲏ ⲙⲉ[ⲣⲓⲧϥ̅]. ϫⲉ ⲉⲕⲙⲟⲟⲛⲉ [ⲧⲱⲛ] ⲁⲩⲱ ⲉⲕⲣ̅ϣⲁⲓ[ⲣⲉ ⲧ]ⲱⲛ ⲙ̅ⲡⲛⲁⲩ ⲙ̅[ⲙ]ⲉⲉⲣⲉ. ⲙ̅ⲡⲣ̅ⲧⲣⲁϭⲟⲟⲗⲉⲧ ⲧⲁⲉⲓ ⲉϫⲛ̅ ⲛ̅ⲁⲅⲉⲗⲏ ⲛ̅ⲛⲉⲕϣ̅ⲃⲉⲉⲣ.	 Tell me, thou whom my soul loves, where thou tendest thy flock, where thou causest them to rest at noon, lest I become as one that is veiled by the flocks of thy companions.	 Ἀπάγγειλόν µοι, ὃν ἠγάπησεν ἡ ψυχή µου, ποῦ ποιµαίνεις, ποῦ κοιτάζεις ἐν µεσηµβρίᾳ, µήποτε γένωµαι ὡς περιβαλλοµένη ἐπ’ ἀγέλαις ἑταίρων σου.	 [ⲙⲁⲧⲁ]ⲙⲁⲉⲓ ⲉⲡⲏ ⲉⲧⲉ[[ⲙ]] ⲁ ⲧⲁⲯⲩⲭⲏ ⲙⲉⲗⲗⲓⲧϥ÷ ⲁⲕⲙⲁⲛⲉⲓ ⲧⲟⲛ[÷ ⲁⲕⲓ̈ⲗ ϣⲉⲓ̈]ⲗⲓ ⲧⲟⲛ ⲙ̈ⲡⲛⲉⲩ ⲙ̈ⲙⲏⲗⲓ÷ ⲙⲉⲛⲧⲟⲩϫⲁⲡⲧ ⲉϩⲗⲏⲓ̈ ⲉϩⲉ[ⲛⲁϩⲓ ⲛ̈ⲧⲉ ⲛ]ⲓϣⲉⲙⲙⲁ					
Song of Songs	1	8		 ⲉϣⲱⲡⲉ ⲉⲣⲉⲧⲙ̅ⲥⲟⲩⲱⲛⲧ̅ ⲧⲉⲧⲛⲉⲥⲱⲥ ϩⲛ̅ ⲛⲉϩⲓⲟⲙⲉ ⲉⲓⲥ ⲁⲙⲏ ⲉⲃⲟⲗ ⲛ̅ⲧⲉ ⲉⲑⲁⲏ ⲛ̅ⲛⲟ[ϩ]ⲉ. ⲛ̅ⲧⲉⲙⲟⲟⲛⲉ [ⲛ̅ⲛ̅ⲟⲩⲃⲁⲁⲙ]ⲡⲉ ϩⲛ̅ ⲛ̅[ⲥⲕⲏⲛⲏ] ⲛ̅ⲛ̅ϣⲱⲱⲥ	 If thou know not thyself, thou fair one among women, go thou forth by the footsteps of the flocks, and feed thy kids by the shepherd’s tents.	 Ἐὰν µὴ γνῷς σεαυτήν, ἡ καλὴ ἐν γυναιξίν, ἔξελθε σὺ ἐν πτέρναις τῶν ποιµνίων καὶ ποίµαινε τὰς ἐρίφους σου ἐπὶ σκηνώµασιν τῶν ποιµένων.	 ⲉϣⲱⲡⲓ ⲉⲗⲉ[ⲧⲓⲙⲥⲟ]ⲩⲱⲛ[ⲓ ⲧⲉⲧ]ⲛⲁⲛⲟⲩ[ⲥ ⲛ̈ⲛⲉ]ϩ[ⲓⲁⲙ]ⲓ ⲁⲙⲏ ⲉⲃⲁⲗ ϩⲁⲗⲉⲧⲟⲩ [ⲛ̈ⲛⲓⲛⲁϩⲓ ⲛ̈ⲧⲉⲙⲁⲛⲓ ⲛ̈ⲛⲉ]ⲃⲁⲙⲡⲓ÷ ϩⲗⲏⲓ̈ ⲛ̈ⲛⲓⲙⲁ ⲛϣⲱⲡⲉ ⲛ̈ⲧ[ⲉ ⲛⲓⲛⲙⲁⲛⲓ÷]					
Song of Songs	1	9		 [ⲧⲉⲧ]ϩⲓⲧⲟⲩⲱⲓ [ⲁⲓⲧⲛ̅ⲧⲱ]ⲛⲉ ⲉⲧⲁϩⲧ[ⲱⲣⲉ ϩⲛ̅]  ⲛ̅ϩⲁⲣⲙⲁ ⲙ̅ⲫ[ⲁⲣⲁⲱ]	 I have likened thee, my companion, to my horses in the chariots of Pharao.	 Τῇ ἵππῳ µου ἐν ἅρµασιν Φαραω ὡµοίωσά σε, ἡ πλησίον µου.	 [ⲁⲉⲓⲓ̈ⲛⲓ ⲛ̈]ⲧⲁϩⲧⲁⲣⲓ ϩⲗⲏⲓ̈ ϩⲓⲛ ⲛⲓⲛⲁⲣⲙⲁ ⲙ̈[ⲫⲁⲣⲁⲱ ⲧⲁⲁⲗⲏⲟⲩ÷]					
Song of Songs	1	10		 ⲛ̅ⲟⲩⲟϭⲉ ⲁⲩⲥ[ⲁ ⲛ̅ⲑⲉ]ⲛ̅ϩⲉⲛϭⲣⲙ̅ⲡϣ[ⲁⲛ]. ⲡⲟⲩⲙⲁⲕϩ̅ ⲁϥ[ⲥⲁ ⲛ̅]ⲑⲉ ⲛ̅ϩⲉⲛϩⲟⲣ[ⲙⲓ]ⲥⲕⲟⲥ.	 How are thy cheeks beautiful as those of a dove, thy neck as chains!	 τί ὡραιώθησαν σιαγόνες σου ὡς τρυγόνες, τράχηλός σου ὡς ὁρµίσκοι;	 [ⲁϩⲁ] ⲛⲉⲩⲁϫⲓ ⲛⲁⲥⲱⲟⲩ ⲛ̈ⲑⲏ ⲛ̈ϩⲉⲛ[ϫⲣⲉⲙⲡϣⲁⲗ÷ ⲡⲉⲙⲁϯ. ⲛ̈ⲑⲏ ⲛ̈ⲟ]ⲩϩⲟⲣⲙⲓⲥⲕⲟⲥ÷					
Song of Songs	1	11		 ⲡⲉⲓⲛⲉ ⲙ̅ⲡⲛⲟⲩ[ⲃ] ⲧⲛ̅ⲛⲁⲧⲁⲙⲓⲟϥ ⲛⲉ. ⲙⲛ̅ ⲙ̅ⲙⲁⲉⲓⲛ ⲙ̅ⲫⲁⲧ	 We will make thee figures of gold with studs of silver.	 ὁµοιώµατα χρυσίου ποιήσοµέν σοι µετὰ στιγµάτων τοῦ ἀργυρίου.	 ⲙ̈ⲡⲓⲛⲓ ⲛ̈ⲛⲓⲛ[ⲛⲟⲩⲃ÷ ⲧⲉⲛⲛⲉⲧⲁⲙⲓⲁ ⲛⲉ ⲛ̈ϣ]ⲱⲗⲉϩ ⲛ̈ϩⲉⲛⲧ÷					
Song of Songs	1	12		 ϣⲁⲛⲧⲉ ⲡⲣ̅ⲣⲟ ⲛⲟϫϥ̅ ϩⲙ̅ ⲡⲉϥⲙⲁ. ⲧⲁⲛⲁⲣⲇⲟⲥ ⲁⲥϣⲱϣ ⲉⲃⲟⲗ ⲙ̅ⲡⲉⲥⲥⲧⲟⲓ.	 So long as the king was at table, my spikenard gave forth its smell.	 Ἕως οὗ ὁ βασιλεὺς ἐν ἀνακλίσει αὐτοῦ, νάρδος µου ἔδωκεν ὀσµὴν αὐτοῦ.	 ϣⲁⲛⲧⲉ [ⲡⲣⲣⲁ ⲛⲁϫϥ ϩⲓⲙ ⲡⲉϥϫⲗⲁϫ÷ ⲡⲁ]ⲛⲁⲣⲇⲟⲥ ⲁϥϯ. ⲙ̈ⲡⲉⲙⲥⲧⲓ ⲛⲟ[ⲩϥⲓ÷]					
Song of Songs	1	13		 ⲟⲩⲙⲁⲓⲣⲉ ⲛ̅ⲧⲉ ⲧⲉⲥⲧⲁⲕⲧⲏ [ⲡⲉ] ⲡⲁⲥⲟⲛ ⲛⲁⲓ. ⲉ[ϥⲛⲁ]ϣⲱⲡⲉ ϩⲛ̅ ⲧ[ⲙⲏⲧ]ⲉ ⲛ̅ⲛⲁⲉⲕⲓⲃⲉ	 My kinsman is to me a bundle of myrrh; he shall lie between my breasts.	 ἀπόδεσµος τῆς στακτῆς ἀδελφιδός µου ἐµοί, ἀνὰ µέσον τῶν µαστῶν µου αὐλισθήσεται·	 [ⲟⲩϣⲁⲗ ⲛ̈(ⲧⲉ)ⲥⲧⲁⲕⲧⲏ ⲡⲉ ⲡⲁⲥⲁⲛ]÷ ⲉϥⲉⲛ̈ⲕⲁⲧ ⲛ̈ⲙⲏϯ [ⲛ̈ⲛⲁⲕⲓⲃⲓ÷]					
Song of Songs	1	14		 ⲟⲩⲥⲙⲁϩ ⲛ̅ⲕⲟⲩⲡⲣ̅ ⲡⲉ ⲡⲁⲥⲟⲛ. ⲉϥϩⲛ̅ ⲙ̅ⲙⲁ ⲛ̅ⲉⲗⲟⲟⲗⲉ ⲉⲧϩⲛ̅ ⲅⲁⲇⲇ[ⲉ]ⲓ	 My kinsman is to me a cluster of camphor in the vineyards of Engaddi.	 βότρυς τῆς κύπρου ἀδελφιδός µου ἐµοὶ ἐν ἀµπελῶσιν Εγγαδδι.	 [ⲟⲩⲥⲙⲉϩ ⲛ̈ⲕⲟⲩⲡⲓⲗ ⲡⲉ] ⲡⲁⲥⲁⲛ ⲛⲏⲓ̈÷ ϩⲓⲛ ⲛⲓⲙⲉ ⲛ[ⲁⲗⲁⲗⲓ ⲛⲉⲅⲅⲁⲇⲇⲓ÷]					
Song of Songs	1	15		 ⲉⲓⲥ ϩⲏⲏⲧⲉ ⲛⲉⲥⲱ ⲧⲁϣⲃⲉⲉⲣⲉ. ⲉⲓⲥ ϩⲏⲏⲧⲉ ⲛⲉⲥⲱ ⲛ̅ⲟⲩⲃⲁⲗ ϩⲉⲛⲃⲁⲗ ⲛ̅ϭⲣⲟⲟⲙⲡⲉ ⲛⲉ.	 Behold, thou art fair, my companion; behold, thou art fair; thine eyes are doves.	 Ἰδοὺ εἶ καλή, ἡ πλησίον µου, ἰδοὺ εἶ καλή, ὀφθαλµοί σου περιστεραί.	 [ϩⲏⲧⲉ] ⲛⲁⲛⲟⲩϯ[.] ⲧⲁⲁⲗⲏⲟⲩ ϩⲏⲧⲉ ⲛⲁⲛⲟⲩ[ϯ ⲧⲁⲥⲱⲛⲓ÷ ⲛⲉⲃⲉ]ⲗ ϩⲉⲛϫⲣⲁⲙⲡⲓ÷					
Song of Songs	1	16		 ⲉⲓⲥ ϩⲏⲏⲧⲉ ⲛⲁ ⲛⲟⲩⲕ ⲡⲁⲥⲟⲛ ⲁⲩⲱ ⲛⲉⲥⲱⲕ ⲉϭⲱϣⲧ̅ ⲛ̅ⲥⲱⲕ. ⲉⲕⲟ ⲛ̅ϩⲁⲓⲃⲉⲥ ⲉⲃⲟⲗ ⲉϫⲙ̅ ⲡⲉⲛⲙⲁ ⲛ̅ⲛ̅ⲕⲟⲧⲕ̅.	 Behold, thou art fair, my kinsman, yea, beautiful, overshadowing our bed.	 Ἰδοὺ εἶ καλός, ὁ ἀδελφιδός µου, καί γε ὡραῖος· πρὸς κλίνη ἡµῶν σύσκιος,	 ϩⲏⲧⲉ ⲛⲁⲥⲱⲕ ⲡ[ⲁⲥⲁⲛ ⲁϩⲁ ⲛⲁⲛⲟⲩⲕ÷ ϩⲓⲙ] ⲡⲉⲛⲁⲕ ⲕⲓⲗ ϩⲏⲃⲓ ⲉⲗⲁⲛ=					
Song of Songs	1	17		 ⲛ̅ⲥⲟⲓ ⲙ̅ⲡⲉⲛⲏⲓ ϩⲉⲛⲉⲃⲟⲗ ⲛⲉ ϩⲛ̅ [ⲛ̅ϣ]ⲉ ⲙ̅ⲡⲗⲓⲃⲁⲛⲟⲥ [ⲛⲉⲛ]ⲟⲩⲉϩⲥⲟⲓ ϩⲉ[ⲛⲕⲩ]ⲡⲁⲣⲓⲥⲥⲟⲥ ⲛⲉ.	 The beams of our house are cedars, our ceilings are of cypress.	 δοκοὶ οἴκων ἡµῶν κέδροι, φατνώµατα ἡµῶν κυπάρισσοι.	 ⲛ̈ⲛⲟⲩϩⲉⲥⲁⲓ ⲙ̈[ⲡⲉⲛⲏⲓ̈ ϩⲉⲛⲕⲉⲇⲣⲟⲥ ⲛ]ⲉ÷ ⲧⲉⲧⲟⲩⲉϩ ⲉⲗⲁⲛ ϩⲉⲛⲛⲓ̈ⲃ. ⲃⲣⲉⲧ ⲛⲉ÷					
Song of Songs	2	1		 [ⲁⲛⲟⲕ] ⲡⲉ ⲡⲉϩⲣⲏⲣⲉ ⲛ̅[ⲧⲥ]ⲱϣⲉ. ⲁⲩⲱ ⲡⲉⲕⲣⲓⲛⲟⲛ ⲛ̅ⲛ̅ⲉⲓⲁ.	 I am a flower of the plain, a lily of the valleys.	 Ἐγὼ ἄνθος τοῦ πεδίου, κρίνον τῶν κοιλάδων.	 [ⲁⲛⲁⲕ ⲧⲉ ⲧⲉϩⲗⲏⲗⲓ] ⲛϫⲱϣⲓ÷ ⲧⲉϩⲗⲏⲓ̈ ⲛ̈ⲧⲉ ⲛⲉⲛϫⲁⲛⲓ					
Song of Songs	2	2		 ⲛ̅ⲑⲉ ⲙ̅ⲡⲉⲕⲣⲓⲛⲟⲛ ⲉϥϩⲛ̅ ⲧⲙ[ⲏ]ⲧⲉ ⲛ̅ⲛ̅ϣⲟⲛⲧⲉ ⲧⲁⲓ ⲧⲉ ⲑⲉ ⲛ̅ⲧⲁϣⲃⲉⲉⲣⲉ ⲉⲥϩⲛ̅ ⲧⲙⲏⲧⲉ ⲛ̅ⲛ̅ϣⲃⲉⲉⲣⲉ.	 As a lily among thorns, so is my companion among the daughters.	 Ὡς κρίνον ἐν µέσῳ ἀκανθῶν, οὕτως ἡ πλησίον µου ἀνὰ µέσον τῶν θυγατέρων.	 [ⲛ̈ⲑⲏ ⲛ̈ⲟⲩϩⲗⲏⲗⲓ ⲛ̈(ⲧ)ⲙⲏ]ϯ ⲛⲛϣⲁⲛϯ= ⲧⲉⲓϩⲏ ⲧⲁⲁⲗ[ⲏⲟⲩ ⲛ̈ⲧⲙⲏϯ. ⲛ̈(ⲛ)ϣ]ⲏⲗⲉ ⲛ̈ⲥϩⲓⲙⲓ÷					
Song of Songs	2	3		 ⲛ̅ⲑⲉ ⲛ̅ⲟⲩϫⲙ̅ⲡⲉϩ ⲉϥϩⲛ̅ ⲛ̅ϣⲏⲛ ⲙ̅ⲡⲙⲁ ⲛ̅ϣⲏⲛ. ⲧⲁⲓ ⲧⲉ ⲑⲉ ⲙ̅ⲡⲁⲥⲟⲛ ⲉϥϩⲛ̅ ⲧⲙⲏⲧⲉ ⲛ̅ⲛ̅ϣⲏⲣⲉ. ⲁⲓⲉⲡⲓⲑⲩⲙⲓ ⲉⲧⲟⲩϩⲁⲓⲃⲉⲥ ⲁⲓϩⲙⲟⲟⲥ ϩⲁⲣ[ⲁⲧⲥ]. ⲁⲩⲱ ⲡⲉϥⲕⲁⲣⲡⲟ[ⲥ ϩⲟⲗϭ̅] ϩⲛ̅ ⲧⲁϣⲟⲩⲱⲃⲉ	 As the apple among the trees of the wood, so is my kinsman among the sons. I desired his shadow, and sat down, and his fruit was sweet in my throat.	 Ὡς µῆλον ἐν τοῖς ξύλοις τοῦ δρυµοῦ, οὕτως ἀδελφιδός µου ἀνὰ µέσον τῶν υἱῶν· ἐν τῇ σκιᾷ αὐτοῦ ἐπεθύµησα καὶ ἐκάθισα, καὶ καρπὸς αὐτοῦ γλυκὺς ἐν λάρυγγί µου.	 ⲛ̈ⲑⲏ ϩⲉⲛϫⲓ[ⲙ̈]ⲡⲉϩ ⲛ̈ⲧⲙⲏϯ [ⲛ̈ⲛⲓⲛϣⲏⲛ ⲙ̈ⲡⲓϣ]ⲧⲁ÷ ⲧⲉⲓϩⲏ ⲡⲁⲥⲁⲛ ⲛ̈ⲧⲙ[ⲏϯ.] ⲛ̈ⲛⲉⲛϣⲏⲗⲓ[÷ ϩⲗⲏⲓ̈ ϩⲓⲛ ⲧⲉϥϩⲏⲓ̈]ⲃⲓ ⲁⲓ̈ϩⲙⲁⲥ ϩⲁⲗⲁⲥ÷ ⲡⲉϥⲟⲩⲧⲉϩ ⲇⲉ ϥϩⲁⲗϫ [ϩⲗⲏⲓ̈ ϩⲓⲛ ⲧⲁϣⲟⲩ]ⲱⲃⲓ÷					
Song of Songs	2	4		 ϫⲓⲧ ⲉϩⲟⲩⲛ ⲉⲡ[ⲏⲓ] ⲙ̅ⲡⲏⲣⲡ. ⲥⲙⲓⲛⲉ ⲛⲁⲓ ⲛ̅ⲟⲩⲁⲅⲁⲡⲏ	 Bring me into the wine house; set love before me.	 Εἰσαγάγετέ µε εἰς οἶκον τοῦ οἴνου, τάξατε ἐπ’ ἐµὲ ἀγάπην.	 ϥⲓⲧ ⲉϩⲟⲩⲛ ⲉⲡⲏⲓ̈ ⲙ̈ⲡⲏⲗ[ⲡ]ⲧⲁϣ ⲟⲩⲁⲁⲅⲁⲡ[ⲏ ⲛⲏⲓ̈÷]					
Song of Songs	2	5		 ⲛ̅ⲧⲉⲧⲛ̅ⲧⲁϫⲣⲟⲓ ϩⲛ̅ ϩⲉⲛⲥⲟϭⲛ̅. ⲛ̅ⲧⲉⲧⲛ̅ⲕⲧⲟ ⲉⲣⲟⲓ ⲛ̅ϩⲉⲛϫⲙ̅ⲡⲉϩ ϫⲉ ⲁ ⲧⲉϥⲁⲅⲁⲡⲏ ⲁⲛⲟⲕ ϫⲓ ⲙ̅ⲙⲟⲓ	 Strengthen me with perfumes, stay me with apples: for I am wounded with love.	 στηρίσατέ µε ἐν ἀµόραις, στοιβάσατέ µε ἐν µήλοις, ὅτι τετρωµένη ἀγάπης ἐγώ.	 [ⲧⲁϫⲣⲁⲓ̈ ϩⲗ]ⲏⲓ̈ ϩⲓⲙ ⲡⲥⲁϫⲓⲛ÷ ϩⲁⲗϫ ϩⲗⲏⲓ̈ ⲛ̈ϩⲉⲛϫⲓⲙⲡⲉ[ϩ÷ ϫⲉ ϯⲗⲁϫⲗⲉϫ] ⲛ̈ⲧⲉⲕⲁⲅⲁⲡⲏ÷					
Song of Songs	2	6		 ⲧⲉϥϭⲓϫ ⲛ̅ϩⲃⲟⲩⲣ ϩⲁ ⲧⲁⲁⲡⲉ. ⲁⲩⲱ ⲧⲉϥⲟⲩⲛⲁⲙ ⲛⲁϩⲱⲗϭ̅ ⲉⲣⲟⲓ.	 His left hand shall be under my head, and his right hand shall embrace me.	 εὐώνυµος αὐτοῦ ὑπὸ τὴν κεφαλήν µου, καὶ ἡ δεξιὰ αὐτοῦ περιλήµψεταί µε.	 ⲧⲉϥϫⲁϫⲉ ⲁⲥϩⲁϫⲱⲓ̈÷ ⲧⲉ[ϥⲟⲩⲓ̈ⲛⲉⲙ ⲛⲉⲓ̈ⲗ ϩ]ⲁⲙⲏⲗ ⲙ̈ⲙⲁⲓ					
Song of Songs	2	7		 ⲁⲓⲧⲁⲣⲕⲉ ⲧⲏⲩⲧⲛ̅ ⲛ̅ϣⲉⲉⲣⲉ ⲛ̅ⲑⲓⲗ̅ⲏ̅ⲙ̅. ϩⲛ̅ ⲛ̅ϭⲟⲙ ⲁⲩⲱ ϩⲛ̅ ⲛ̅ⲛⲟⲙⲧⲉ ⲛ̅ⲧⲥⲱϣⲉ. ⲉⲧⲣⲉⲧⲛ̅ⲛⲉϩⲥⲉ ⲛ̅ⲧⲁⲅⲁⲡⲏ ⲁⲩⲱ ⲛ̅ⲧⲉⲧⲛ̅ⲧⲟⲩⲛⲟⲥⲥ̅ ϣⲁⲛⲧⲥ̅ⲣ̅ ϩⲛⲁⲥ.	 I have charged you, ye daughters of Jerusalem, by the powers and by the virtues of the field, that ye do not rouse or wake my love, until he please.	 ὥρκισα ὑµᾶς, θυγατέρες Ιερουσαληµ, ἐν ταῖς δυνάµεσιν καὶ ἐν ταῖς ἰσχύσεσιν τοῦ ἀγροῦ, ἐὰν ἐγείρητε καὶ ἐξεγείρητε τὴν ἀγάπην, ἕως οὗ θελήσῃ.	 ⲁⲓ̈ϯⲓⲗⲕⲁ ⲧⲏⲛⲟⲩ ⲛⲓⲛϣⲏⲗⲓ ⲛ̈ⲓ̅ⲉ̅ⲙ̅ [ϩⲗⲏⲓ̈ ϩⲓⲛ ⲛⲉⲛϫⲁⲙ ⲁ]ϩⲁ ϩⲗⲏⲓ̈ ϩⲓⲙ ⲡⲧⲁϫⲣⲁ ⲛ̈ⲧⲉ ϣⲱϣⲓ÷ [ⲙ̈ⲡⲓⲗⲧⲟⲩⲛⲁⲥ ⲧⲁⲅⲁ]ⲡⲏ ⲟⲩⲇⲉ ⲙ̈ⲡⲓⲗⲡⲓⲁⲥ ϣⲁⲛⲧⲉⲥⲟⲩϩ [ⲧⲱⲛⲥ÷]					
Song of Songs	2	8		 ⲡ[ⲉϩ]ⲣⲟⲟⲩ ⲙ̅ⲡⲁⲥⲟⲛ ⲁϥ[ⲧⲁ]ϩⲟⲓ. ⲉⲓⲥ ϩⲏⲏⲧⲉ ⲛ̅[ⲧⲟ]ϥ ⲁϥⲉⲓ ⲉϥⲡⲏⲧ ϩⲓϫⲛ̅ ⲛ̅ⲧⲟⲩⲉⲓⲏ. ⲁⲩⲱ ⲉϥϫⲓ ϥⲟϭⲥ̅ ϩⲓϫⲛ̅ ⲛ̅ⲃⲟⲩⲛⲟⲥ.	 The voice of my kinsman! behold, he comes leaping over the mountains, bounding over the hills.	 Φωνὴ ἀδελφιδοῦ µου· ἰδοὺ οὗτος ἥκει πηδῶν ἐπὶ τὰ ὄρη διαλλόµενος ἐπὶ τοὺς βουνούς.	 [ϩⲉⲓ̈ ⲧⲉⲥⲙⲏ ⲙ̈]ⲡⲁⲥⲁⲛ÷ ϩⲉⲓ̈ⲡⲉ ⲁϥϥⲓ ⲉϥϥⲓ ⲡⲏⲓ̈ ⲉϫ[ⲱⲛ ⲛⲓⲛⲧⲁⲩ ⲉϥϥⲱϫⲓ ⲉ]ⲗⲁϥ ⲉϩⲗⲏⲓ̈ ⲉϫⲱⲛ ⲛⲉⲛⲥⲓⲃⲧ÷					
Song of Songs	2	9		 ⲉⲣⲉ ⲡⲁⲥⲟⲛ ⲧⲛ̅ⲧⲱⲛ ⲉⲩϭⲁϩⲥⲉ. ⲁⲩⲱ ⲉⲩⲙⲁⲥ ⲛ̅ⲉⲓⲟⲩⲗ ϩⲓϫⲛ̅ ⲛ̅ⲧⲟⲟⲩ ⲛ̅ⲃⲁⲓⲑⲏⲗ. ⲉⲓⲥ ϩⲏⲏⲧⲉ ⲛ̅ⲧⲟϥ ϥϭⲱϣⲧ̅ ϩⲓⲡⲁϩⲟⲩ ⲛ̅ⲧⲛ̅ϫⲟ. ϥϭⲱϣⲧ̅ ⲉⲃⲟⲗ ϩⲛ̅ ⲛ̅ϣⲟⲩϣⲧ̅.	 My kinsman is like a roe or a young hart on the mountains of Baethel: behold, he is behind our wall, looking through the windows, peeping through the lattices.	 ὅµοιός ἐστιν ἀδελφιδός µου τῇ δορκάδι ἢ νεβρῷ ἐλάφων ἐπὶ τὰ ὄρη Βαιθηλ. ἰδοὺ οὗτος ἕστηκεν ὀπίσω τοῦ τοίχου ἡµῶν παρακύπτων διὰ τῶν θυρίδων ἐκκύπτων διὰ τῶν δικτύων.	 ⲁⲗⲉ ⲡ[ⲁⲥⲁⲛ ⲓ̈ⲛⲓ ⲛ̈ⲛⲟⲩⲇⲟⲣⲕⲁⲥ] ⲓ̈ [ⲟ]ⲩⲕⲟⲩⲓ̈ ⲛ̈ⲛⲉⲓⲟⲩⲗ ϩⲗⲏⲓ̈ ⲉϫⲱⲛ ⲛ̈[ⲧⲁⲩ ⲛ̈ⲃⲉⲑⲏⲗ÷ ϩⲉⲓ̈ ϥϩⲓ ⲡ]ⲉϩⲟⲩ ⲛ̈ⲧⲉϥϫⲁⲓ̈ ϥϫⲱⲛⲧ ⲉⲃⲁⲗ ⲛ̈ⲛⲉⲛϣ[ⲟⲩϣⲧ ϥϫⲱϥⲧ ⲉⲃⲁⲗ ⲛ̈ⲛ]ⲉⲛϣⲛⲏ÷					
Song of Songs	2	10		 ⲁⲩⲱ ⲡⲁⲥⲟⲛ ⲁϥϣⲁϫⲉ ⲛⲙ̅ⲙⲁⲓ ⲉⲃⲟⲗ ϩⲛ̅ ⲛⲉϣⲛⲏⲩ ⲉϥϫⲱ ⲙ̅ⲙⲟⲥ. ϫⲉ ⲧⲱ[ⲟ]ⲩⲛ ⲁⲙⲏ ⲧⲁϣⲃⲉⲉ[ⲣⲉ] ⲧⲁϭⲣⲟⲟⲙⲡⲉ ⲉ[ⲧⲛ]ⲉⲥⲱⲥ.	 My kinsman answers, and says to me, Rise up, come, my companion, my fair one, my dove.	 ἀποκρίνεται ἀδελφιδός µου καὶ λέγει µοι Ἀνάστα ἐλθέ, ἡ πλησίον µου, καλή µου, περιστερά µου,	 ⲁ ⲡⲁⲥⲁⲛ ⲁϥϯ. ϩⲉⲗ ⲟⲩⲱ ⲡ[ⲉϫⲉϥ] ⲛⲏ[ⲓ̈ (ϫⲉ) ⲧⲱ]ⲛⲓ ⲁⲙ[ⲏ ⲧⲁⲁⲗ]ⲏⲟⲩ ⲧⲉⲧⲛⲁⲛⲟⲩⲥ ⲧⲁϫⲣⲁⲙⲡⲓ÷					
Song of Songs	2	11		 ϫⲉ ⲉⲓⲥ ⲧⲉ[ⲡ]ⲣⲱ ⲁⲥⲟⲩⲉⲓⲛⲉ. ⲡ[ϩ]ⲟⲩ ⲙ̅ⲡⲉ ⲁϥⲙⲟⲟϣⲉ ⲁϥⲃⲱⲕ ⲉⲡⲉϥⲙⲁ	 For, behold, the winter is past, the rain is gone, it has departed.	 ὅτι ἰδοὺ ὁ χειµὼν παρῆλθεν, ὁ ὑετὸς ἀπῆλθεν, ἐπορεύθη ἑαυτῷ,	 ⲁ ⲧⲉ[ⲡ]ⲗⲱ ⲥⲉⲛⲧⲓⲛ ⲉ[ⲃⲁⲗ÷ ⲁ] ⲡⲙⲟⲩ ⲛ̈ϩⲱⲟⲩ ⲁϥϩⲉϯ. ⲛⲉϥ ⲛⲁⲟⲩⲉϥ÷					
Song of Songs	2	12		 ⲛ̅ϯⲟⲩⲱ ⲁⲩⲟⲩⲱⲛϩ̅ ⲉⲃⲟⲗ ϩⲓϫⲙ̅ ⲡⲕⲁϩ. ⲡⲉⲟⲩⲟⲉⲓϣ ⲙ̅ⲡϫⲱⲗϩ̅ ⲁϥⲉⲓ. ⲡⲉϩⲣⲟⲟⲩ ⲙ̅ⲡⲉϭⲣⲙ̅ⲡϣⲁⲛ ⲁⲩⲥⲱⲧⲙ̅ ⲉⲣⲟϥ ϩⲙ̅ ⲡⲉⲛⲕⲁϩ.	 The flowers are seen in the land; the time of pruning has arrived; the voice of the turtle-dove has been heard in our land.	 τὰ ἄνθη ὤφθη ἐν τῇ γῇ, καιρὸς τῆς τοµῆς ἔφθακεν, φωνὴ τοῦ τρυγόνος ἠκούσθη ἐν τῇ γῇ ἡµῶν,	 ⲛⲉ[ⲛ]ϩⲗⲏ[ⲗⲓ ⲟⲩⲱⲛϩ] ⲉⲃⲁⲗ ϩ[ⲓⲙ ⲡⲕⲉ]ϩⲓ ⲡⲟⲩⲁⲓϣ ⲛ̈ϣⲁⲧϫⲏ ⲡⲉⲛⲧⲁϥϩⲱⲛ÷ ⲧⲉⲥ[ⲙⲏ ⲛ̈ⲧⲉϫⲣⲁⲙⲡⲓ ⲁⲩⲥⲁⲧⲙ]ⲉⲥ ϩⲗⲏⲓ̈ ϩⲓⲙ ⲡⲕⲉϩⲓ÷					
Song of Songs	2	13		 ⲧⲃⲱ ⲛ̅ⲕⲛ̅ⲧⲉ ⲁⲥⲧⲁⲩⲟ ⲉⲃⲟⲗ ⲛ̅ⲛⲉⲥⲃⲉⲉϣ. ⲛ̅ⲃⲱ ⲛ̅ⲉⲗⲟⲟⲗⲉ ⲉⲩⲛⲉϫ ⲕⲟⲩⲡⲣ̅ ⲁⲩϯ ⲙ̅ⲡⲉⲩⲥⲧⲟⲓ. ⲧⲱⲟⲩⲛⲉ ⲁⲙ[ⲏ]ⲧⲉⲧϩⲓ ⲧⲟⲩⲱⲓ ⲧⲁ[ϭⲣⲟⲟⲙ]ⲡⲉ ⲉⲧⲛⲁⲛⲟ[ⲩⲥ]	 The fig-tree has put forth its young figs, the vines put forth the tender grape, they yield a smell: arise, come, my companion, my fair one, my dove; yea, come.	 ἡ συκῆ ἐξήνεγκεν ὀλύνθους αὐτῆς, αἱ ἄµπελοι κυπρίζουσιν, ἔδωκαν ὀσµήν. ἀνάστα ἐλθέ, ἡ πλησίον µου, καλή µου, περιστερά µου,	 ⲧⲃⲱ ⲛ̈ⲕⲏⲛⲧⲏ [ⲁⲥϯ. ⲟⲩⲱ ⲉⲃⲁⲗ ⲛ̈ⲛⲉⲥⲃⲏϣ÷] ⲁ ⲙⲓⲙⲃⲱ ⲛ̈ⲛⲁⲗⲁⲗⲓ ⲁⲩⲧⲁⲟⲩⲁ ⲕⲟⲩⲡ[ⲓⲗ ⲉⲃⲁⲗ ⲁⲩϯ. ⲥⲧⲓⲛⲟⲩϥⲓ ⲉ]ⲃⲁⲗ÷ ⲧⲱⲛⲓ ⲁⲙⲏ ⲧⲁⲁⲗⲏⲟⲩ ⲧⲉⲧⲛ[ⲁⲛⲟⲩⲥ ⲧⲁϫⲣⲁⲙⲡⲓ÷]					
Song of Songs	2	14		 [ⲛ̅]ⲧⲉⲉⲓ ⲛⲧⲟ ⲧⲁϭⲣ[ⲟ]ⲟⲙⲡⲉ ϩⲙ̅ ⲡⲟⲩⲱ[ϣ ⲛ̅]ⲧⲉ ⲧⲡⲉⲧⲣⲁ. ϩⲓⲧⲟⲩⲱϥ ⲙ̅ⲡⲥⲟⲃⲧ [ⲉⲧϩⲓ]ⲃⲟⲗ. ⲛ̅ⲧⲉⲧⲥⲁⲃⲟ[ⲓ ⲙ̅]ⲡⲟⲩϩⲟ. ⲁⲩⲱ [ⲛ̅ⲧⲉ]ⲧⲣⲁⲥⲱⲧⲙ̅ ⲉⲡⲟⲩ[ϩⲣⲟ]ⲟⲩ. ϫⲉ ⲡⲟⲩϩⲣⲟⲟⲩ ⲟⲩϩⲣⲟⲟⲩ ⲡⲉ ⲉϥⲛⲟⲧⲙ̅ ⲁⲩⲱ ⲡⲟⲩϩⲟ ⲛⲉⲥⲱϥ ⲛⲁⲓ.	 Thou art my dove, in the shelter of the rock, near the wall: shew me thy face, and cause me to hear thy voice; for thy voice is sweet, and thy countenance is beautiful.	 καὶ ἐλθὲ σύ, περιστερά µου ἐν σκέπῃ τῆς πέτρας ἐχόµενα τοῦ προτειχίσµατος, δεῖξόν µοι τὴν ὄψιν σου καὶ ἀκούτισόν µε τὴν φωνήν σου, ὅτι ἡ φωνή σου ἡδεῖα, καὶ ἡ ὄψις σου ὡραία.	 [ⲁⲙⲏ ⲧⲁϫⲣⲁ]ⲙⲡⲓ ϩⲗⲏⲓ̈ ⲛ̈ⲧⲛⲉϣϯ ⲛ̈ⲧⲡ[ⲉⲧⲣⲁ÷ ϩⲁϩⲧ]ⲏ ⲕⲟ[ⲩⲓ̈ ⲛ̈ⲥⲁⲃⲉⲧ÷ ⲙⲁⲧⲁⲟ]ⲩⲁⲓ̈ ⲉⲡⲉϩⲁ÷ ⲙⲁⲗⲗⲓⲥ[ⲱⲧⲟⲙ ⲉⲧⲉ]ⲥⲙⲏ÷ ϫ[ⲉ] ⲛ[ⲁ]ⲛⲟⲩ[ⲩⲥ ⲁϩⲁ] ⲡⲉϩⲁ ⲛⲁⲥⲱϥ÷					
Song of Songs	2	15		 ϭⲱⲡⲉ ⲛⲁⲓ ⲛ̅ϩⲉⲛⲃⲁϣⲟⲣ ϩⲉⲛⲃⲁϣⲟⲣ ⲕⲟⲩⲓ. ⲉⲩⲧⲁⲕⲟ ⲙ̅ⲙⲁ ⲛ̅ⲉⲗⲟⲟⲗⲉ. ⲁⲩⲱ [ⲛⲉⲛⲃⲱ] ⲛ̅ⲉⲗⲟⲟⲗⲉ [ⲥⲉⲛⲁϯ] ⲕⲟⲩⲡⲣ̅.	 Take us the little foxes that spoil the vines: for our vines put forth tender grapes.	 Πιάσατε ἡµῖν ἀλώπεκας µικροὺς ἀφανίζοντας ἀµπελῶνας, καὶ αἱ ἄµπελοι ἡµῶν κυπρίζουσιν.	 ϫⲱⲡ[ⲓ ⲛⲉⲛ (ⲛ̈)ⲛⲓⲛ]ⲕⲟⲩⲓ̈ ⲙ̈ⲃ[ⲁϣⲁⲣ ⲉⲧⲉϣⲁⲩ]ⲧⲁⲕⲁ ⲛ̈ϩⲉⲛⲙⲉ ⲛ̈ⲛⲁⲗ[ⲁⲗⲓ÷ ⲁϩⲁ] ⲙⲙⲉ ⲛ̈ⲁ[ⲗⲁⲗⲓ ⲥⲉⲛⲉϯ ⲕⲟⲩ]ⲡⲓⲗ ⲉⲃⲁⲗ÷					
Song of Songs	2	16		 ⲡⲁ[ⲥⲟⲛ ⲉϥ]ϣⲟⲟⲡ ⲛⲁⲓ [ⲁⲩⲱ ⲁⲛ]ⲟⲕ ϩⲱ ⲉⲓ[ϣⲟⲟ]ⲡ ⲛⲁϥ. ⲡⲉⲧ[ⲙⲟⲟ]ⲛⲉ ϩⲛ̅ ⲛⲉⲕⲣⲓⲛⲟⲛ	 My kinsman is mine, and I am his: he feeds his flock among the lilies.	 Ἀδελφιδός µου ἐµοί, κἀγὼ αὐτῷ, ὁ ποιµαίνων ἐν τοῖς κρίνοις,	 ⲡⲁⲥⲁⲛ [ⲛⲏⲓ̈ ⲁϩⲁ ⲁⲛⲁⲕ] ϩⲱ ⲛⲉϥ÷ ⲡ[ⲉ]ⲧⲙ[ⲁⲛⲓ ϩⲗⲏⲓ̈] ϩⲓⲛ ⲛⲉϩⲣⲏⲗⲓ					
