book	chapter	verse	Bohairic	Sahidic	English	Greek	Fayyumic	Akhmimic	OldBohairic	Mesokemic	DialectP	Lycopolitan
Wisdom of Solomon	11	24	 	 ⲕⲙⲉ ⲅⲁⲣ ⲛ̅ⲛⲉⲧϣⲟⲟⲡ ⲧⲏⲣⲟⲩ ⲁⲩⲱ ⲛⲅ̅ϥⲱⲧⲉ ⲁⲛ ⲛ̅ⲗⲁⲁⲩ ⲛ̅ⲛⲉⲛⲧⲁⲕⲧⲁⲙⲓⲟⲟⲩ: ⲛ̅ⲛⲉⲕⲛⲁⲥⲛ̅ⲧ ⲛ̅ⲕⲁ ⲅⲁⲣ ⲁⲛ ⲉⲕⲙⲟⲥⲧⲉ ⲙ̅ⲙⲟϥ.	 For thou lovest all the things that are, and abhorrest nothing which thou hast made: for never wouldest thou have made any thing, if thou hadst hated it.	 ἀγαπᾷς γὰρ τὰ ὄντα πάντα καὶ οὐδὲν βδελύσσῃ ὧν ἐποίησας· οὐδὲ γὰρ ἂν µισῶν τι κατεσκεύασας.						
Wisdom of Solomon	11	25	 	 ⲛ̅ⲁϣ ⲇⲉ ⲛ̅ϩⲉ ⲉⲣⲉ ⲟⲩϩⲱⲃ ⲛⲁⲙⲟⲩⲛ ⲉⲃⲟⲗ ⲉⲙⲡⲉⲕⲟⲩⲁϣϥ̅; ⲏ ⲉϥⲛⲁϭⲱ ϣⲁ ⲡⲧⲏⲣϥ̅ ⲛⲓⲙ ⲡⲉⲧⲉ ⲙ̅ⲡⲕ̅ϯⲣⲁⲛ ⲉⲣⲟϥ;	 And how could any thing have endured, if it had not been thy will? or been preserved, if not called by thee?	 πῶς δὲ διέµεινεν ἄν τι, εἰ µὴ σὺ ἠθέλησας, ἢ τὸ µὴ κληθὲν ὑπὸ σοῦ διετηρήθη;						
Wisdom of Solomon	11	26	 	 ⲕϯⲥⲟ ⲇⲉ ⲉⲣⲟⲟⲩ ⲧⲏⲣⲟⲩ ϫⲉ ⲡⲉⲧⲉⲛⲱⲕ ⲛⲉ ⲡϫⲟⲉⲓⲥ ⲙ̅ⲙⲁⲉⲓ̈ ⲯⲩⲭⲏ.	 But thou sparest all: for they are thine, O Lord, thou lover of souls.	 φείδῃ δὲ πάντων, ὅτι σά ἐστιν, δέσποτα φιλόψυχε·						
Wisdom of Solomon	12	1	 	 ⲡⲉⲡⲛⲉⲩⲙⲁ ⲅⲁⲣ ⲛ̅ⲁⲧⲧⲁⲕⲟ ⲛ̅ϩⲏⲧⲟⲩ ⲧⲏⲣⲟⲩ:	 For thine incorruptible Spirit is in all things.	 τὸ γὰρ ἄφθαρτόν σου πνεῦµά ἐστιν ἐν πᾶσιν.						
Wisdom of Solomon	12	2	 	 ⲉⲧⲃⲉ ⲡⲁⲓ̈ ⲛⲉⲧⲛⲁϩⲉ ⲉⲩϫⲡⲓⲟ ⲙ̅ⲙⲟⲟⲩ ϣⲏⲙϣⲏⲙ ⲁⲩⲱ ϩⲛ̅ ⲛⲉⲧⲟⲩⲣ̅ⲛⲟⲃⲉ ⲛ̅ϩⲏⲧⲟⲩ ⲉⲕϯⲥⲃⲱ ⲛⲁⲩ ⲉⲧⲣⲉⲩⲣ̅ⲡⲙⲉⲉⲩⲉ ϫⲉⲕⲁⲁⲥ ⲉⲩⲉⲗⲟ ϩⲛ̅ ⲧⲕⲁⲕⲓⲁ ⲛ̅ⲥⲉⲡⲓⲥⲧⲉⲩⲉ ⲉⲣⲟⲕ ⲡϫⲟⲉⲓⲥ.	 Therefore chastenest thou them by little and little that offend, and warnest them by putting them in remembrance wherein they have offended, that leaving their wickedness they may believe on thee, O Lord.	 Διὸ τοὺς παραπίπτοντας κατ’ ὀλίγον ἐλέγχεις  καὶ ἐν οἷς ἁµαρτάνουσιν ὑποµιµνῄσκων νουθετεῖς, ἵνα ἀπαλλαγέντες τῆς κακίας πιστεύσωσιν ἐπὶ σέ, κύριε.						
Wisdom of Solomon	12	3	 	 ⲕⲁⲓ ⲅⲁⲣ ⲛ̅ϣⲟⲣⲡ̅ ⲉⲧⲟⲩⲏϩ ϩⲙ̅ ⲡⲉⲕⲕⲁϩ ⲉⲧⲟⲩⲁⲁⲃ ⲁⲕⲙⲉⲥⲧⲱⲟⲩ	 For it was thy will to destroy by the hands of our fathers both those old inhabitants of thy holy land,	 καὶ γὰρ τοὺς πάλαι οἰκήτορας τῆς ἁγίας σου γῆς						
Wisdom of Solomon	12	4	 	 ⲉⲧⲃⲉ ⲛ̅ⲃⲟⲧⲉ ⲉⲧⲟⲩⲉⲓⲣⲉ ⲙ̅ⲙⲟⲟⲩ ϩⲛ̅ϩⲃⲏⲩⲉ ⲙ̅ⲙⲛ̅ⲧⲣⲉϥⲣ̅ⲡⲁϩⲣⲉ ⲙⲛ̅ ϩⲉⲛϣⲙ̅ϣⲉ ⲉⲩϫⲁϩⲙ̅	 Whom thou hatedst for doing most odious works of witchcrafts, and wicked sacrifices;	 µισήσας ἐπὶ τῷ ἔχθιστα πράσσειν, ἔργα φαρµακειῶν καὶ τελετὰς ἀνοσίους						
Wisdom of Solomon	12	5	 	 ⲉⲩϩⲱⲧⲃ̅ ⲛ̅ⲛⲉⲩϣⲏⲣⲉ ϩⲛ̅ ⲟⲩⲙⲛ̅ⲧⲟⲩⲁϩⲓⲏⲧ ⲉⲩⲟⲩⲱⲙ ⲛ̅ⲛⲉⲥⲡⲗⲁⲅⲭⲛⲟⲛ ⲛ̅ⲥⲁⲣⲝ ϩⲓ ⲥⲛⲟϥ ⲣ̅ⲣⲱⲙⲉ ⲉⲩⲟ ⲛ̅ⲧⲙⲏⲧⲉ ⲛ̅ⲛⲉⲧⲟⲩϣⲙ̅ϣⲉ ⲛⲁⲩ.	 And also those merciless murderers of children, and devourers of man’s flesh, and the feasts of blood,	 τέκνων τε φονὰς ἀνελεήµονας καὶ σπλαγχνοφάγον ἀνθρωπίνων σαρκῶν θοῖναν καὶ αἵµατος, ἐκ µέσου µύστας θιάσου						
Wisdom of Solomon	12	6	 	 ϩⲉⲛⲉⲓⲟⲧⲉ ⲉⲙⲡⲟⲩⲛⲁ ϩⲁ ⲛⲉⲯⲩⲭⲏ ⲛ̅ⲛⲉⲩϣⲏⲣⲉ ⲛⲁⲓ̈ ⲁⲕⲟⲩⲱϣ ⲉⲧⲁⲕⲟⲟⲩ ϩⲓⲧⲛ̅ ⲛ̅ϭⲓϫ ⲛ̅ⲛⲉⲛⲉⲓⲟⲧⲉ	 With their priests out of the midst of their idolatrous crew, and the parents, that killed with their own hands souls destitute of help:	 καὶ αὐθέντας γονεῖς ψυχῶν ἀβοηθήτων, ἐβουλήθης ἀπολέσαι διὰ χειρῶν πατέρων ἡµῶν,						
Wisdom of Solomon	12	7	 	 ϫⲉⲕⲁⲥ ⲉϥⲉⲙ̅ⲡϣⲁ ⲉⲧⲣⲉ ⲛ̅ϣⲏⲣⲉ ⲙ̅ⲡⲛⲟⲩⲧⲉ ⲟⲩⲱϩ ⲛ̅ϩⲏⲧϥ ⲛ̅ϭⲓ ⲡⲕⲁϩ ⲉⲧⲧⲁⲉⲓⲏⲩ ⲛ̅ⲧⲟⲟⲧⲕ̅ ⲉϩⲟⲩⲉ ⲕⲁϩ ⲛⲓⲙ.	 That the land, which thou esteemedst above all other, might receive a worthy colony of God’s children.	 ἵνα ἀξίαν ἀποικίαν δέξηται θεοῦ παίδων ἡ παρὰ σοὶ πασῶν τιµιωτάτη γῆ.						
Wisdom of Solomon	12	8	 	 ⲁⲗⲗⲁ ⲛⲉⲓ̈ ⲕⲟⲟⲩⲉ ⲟⲛ ϩⲱⲥ ⲣⲱⲙⲉ ⲁⲕϯⲥⲟ ⲉⲁⲕⲧⲛ̅ⲛⲟⲟⲩ ⲛⲁⲩ ⲛ̅ϩⲉⲛⲁⲙⲏⲙ ⲡⲣⲟⲇⲣⲟⲙⲟⲥ .... ⲙ̅ⲡⲉⲕⲥⲧⲣⲁⲧⲉⲩⲙⲁ ϫⲉⲕⲁⲥ ⲉⲩⲉⲙⲟⲟⲩⲧⲟⲩ ϣⲏⲙϣⲏⲙ	 Nevertheless even those thou sparedst as men, and didst send wasps, forerunners of thine host, to destroy them by little and little.	 ἀλλὰ καὶ τούτων ὡς ἀνθρώπων ἐφείσω ἀπέστειλάς τε προδρόµους τοῦ στρατοπέδου σου σφῆκας, ἵνα αὐτοὺς κατὰ βραχὺ ἐξολεθρεύσωσιν.						
Wisdom of Solomon	12	9	 	 ⲉⲕⲟ ⲛ̅ⲁⲧϭⲟⲙ ⲁⲛ ⲉϯ ⲛ̅ⲛ̅ⲁⲥⲉⲃⲏⲥ ⲉϩⲣⲁⲓ̈ ⲉⲛ̅ϭⲓϫ ⲛ̅ⲛ̅ⲇⲓⲕⲁⲓⲟⲥ ϩⲛ̅ ⲡⲡⲟⲗⲉⲙⲟⲥ ⲏ ⲛ̅ϩⲛ̅ⲑⲏⲣⲓⲟⲛ ⲉⲩⲛⲁϣⲧ̅ ⲏ ϩⲛ̅ ⲟⲩϣⲁϫⲉ ⲛ̅ⲟⲩⲱⲧ ⲉⲟⲩⲟϣϥⲟⲩ ϩⲛ̅ ⲟⲩϣⲥ̅ⲛⲉ	 Not that thou wast unable to bring the ungodly under the hand of the righteous in battle, or to destroy them at once with cruel beasts, or with one rough word:	 οὐκ ἀδυνατῶν ἐν παρατάξει ἀσεβεῖς δικαίοις ὑποχειρίους δοῦναι ἢ θηρίοις δεινοῖς ἢ λόγῳ ἀποτόµῳ ὑφ’ ἓν ἐκτρῖψαι,						
Wisdom of Solomon	12	10	 	 ⲉⲕⲕⲣⲓⲛⲉ ⲇⲉ ⲙ̅ⲙⲟⲟⲩ ϣⲏⲙϣⲏⲙ ⲉⲕϯⲙⲁ ⲛⲁⲩ ⲙ̅ⲙⲉⲧⲁⲛⲟⲓⲁ ⲉⲕⲥⲟⲟⲩⲛ ϫⲉ ⲟⲩⲡⲟⲛⲏⲣⲟⲛ ⲡⲉ ⲡⲉⲩϫⲡⲟ ⲁⲩⲱ ⲁ ⲧⲉⲩⲕⲁⲕⲓⲁ ϫⲉ ⲛⲟⲩⲛⲉ ⲉⲃⲟⲗ ϫⲉ ⲙ̅ⲡⲉⲩϩⲏⲧ ⲛⲁϣⲓⲃⲉ ⲁⲛ ⲉⲛⲉϩ.	 But executing thy judgments upon them by little and little, thou gavest them place of repentance, not being ignorant that they were a naughty generation, and that their malice was bred in them, and that their cogitation would never be changed.	 κρίνων δὲ κατὰ βραχὺ ἐδίδους τόπον µετανοίας οὐκ ἀγνοῶν ὅτι πονηρὰ ἡ γένεσις αὐτῶν καὶ ἔµφυτος ἡ κακία αὐτῶν καὶ ὅτι οὐ µὴ ἀλλαγῇ ὁ λογισµὸς αὐτῶν εἰς τὸν αἰῶνα.						
Wisdom of Solomon	12	11	 	 ⲟⲩⲥⲡⲉⲣⲙⲁ ⲅⲁⲣ ⲡⲉ ⲉϥⲥϩⲟⲩⲟⲣⲧ̅ ϫⲓⲛ ⲛ̅ϣⲟⲣⲡ̅. ⲟⲩⲇⲉ ⲛ̅ⲛⲉⲕⲥⲛⲁⲧ ⲁⲛ ϩⲏⲧϥ̅ ⲛ̅ⲟⲩⲁ ⲉⲕϩⲟⲣϣ̅ ⲛ̅ϩⲏⲧ ⲉϩⲣⲁⲓ̈ ⲉϫⲱⲟⲩ ⲉⲩⲣ̅ⲛⲟⲃⲉ.	 For it was a cursed seed from the beginning; neither didst thou for fear of any man give them pardon for those things wherein they sinned.	 σπέρµα γὰρ ἦν κατηραµένον ἀπ’ ἀρχῆς, οὐδὲ εὐλαβούµενός τινα ἐφ’ οἷς ἡµάρτανον ἄδειαν ἐδίδους.						
Wisdom of Solomon	12	12	 	 ⲛⲓⲙ ⲅⲁⲣ ⲡⲉⲧⲛⲁϫⲟⲟⲥ ⲛⲁⲕ ϫⲉ ⲟⲩ ⲡⲉⲛⲧⲁⲕⲁⲁϥ; ⲏ ⲛⲓⲙ ⲡⲉⲧⲛⲁⲁϩⲉ ⲣⲁⲧϥ̅ ⲟⲩⲃⲉ ⲡⲉⲕϩⲁⲡ; ⲏ ⲛⲓⲙ ⲡⲉⲧⲛⲁⲉⲅⲕⲁⲗⲓ ⲛⲁⲕ ⲉⲧⲃⲉ ⲡⲧⲁⲕⲟ ⲛ̅ⲛ̅ϩⲉⲑⲛⲟⲥ ⲉⲛⲧⲟⲕ ⲁⲕⲧⲁⲙⲓⲟⲟⲩ; ⲏ ⲛⲓⲙ ⲡⲉⲧⲛⲁϫⲓϩⲁⲡ ⲛⲙ̅ⲙⲁⲕ ⲉⲕϫⲓ ⲙ̅ⲡⲉⲕⲃⲁ ⲛ̅ϩⲛ̅ⲣⲱⲙⲉ ⲛ̅ⲣⲉϥϫⲓⲛ̅ϭⲟⲛⲥ̅;	 For who shall say, What hast thou done? or who shall withstand thy judgment? or who shall accuse thee for the nations that perish, whom thou made? or who shall come to stand against thee, to be revenged for the unrighteous men?	 τίς γὰρ ἐρεῖ Τί ἐποίησας; ἢ τίς ἀντιστήσεται τῷ κρίµατί σου; τίς δὲ ἐγκαλέσει σοι κατὰ ἐθνῶν ἀπολωλότων ἃ σὺ ἐποίησας; ἢ τίς εἰς κατάστασίν σοι ἐλεύσεται ἔκδικος κατὰ ἀδίκων ἀνθρώπων;						
Wisdom of Solomon	12	13	 	 ⲙ̅ⲙⲛ̅ⲕⲉ ⲛⲟⲩⲧⲉ ⲅⲁⲣ ⲛ̅ⲃⲗ̅ⲗⲁⲕ ⲉϥϥⲓⲣⲟⲟⲩϣ ϩⲁ ⲡⲧⲏⲣϥ̅ ϫⲉⲕⲁⲥ ⲉⲕⲉⲧⲥⲁⲃⲟⲟⲩ ϫⲉ ⲛ̅ⲧⲁⲕⲕⲣⲓⲛⲉ ⲙ̅ⲙⲟⲟⲩ ⲁⲛ ⲁⲇⲓⲕⲱⲥ:	 For neither is there any God but thou that careth for all, to whom thou mightest shew that thy judgment is not unright.	 οὔτε γὰρ θεός ἐστιν πλὴν σοῦ, ᾧ µέλει περὶ πάντων, ἵνα δείξῃς ὅτι οὐκ ἀδίκως ἔκρινας,						
Wisdom of Solomon	12	14	 	 ⲟⲩⲇⲉ ⲙⲛ̅ ⲟⲩⲣ̅ⲣⲟ ⲏ ⲟⲩⲇⲉ ⲧⲩⲣⲁⲛⲛⲟⲥ ⲁϩⲉⲣⲁⲧϥ̅ ⲉⲣⲟⲕ ϩⲁ ⲛⲉⲧⲁⲕⲕⲟⲗⲁⲍⲉ ⲙ̅ⲙⲟⲟⲩ.	 Neither shall king or tyrant be able to set his face against thee for any whom thou hast punished.	 οὔτε βασιλεὺς ἢ τύραννος ἀντοφθαλµῆσαι δυνήσεταί σοι περὶ ὧν ἐκόλασας.						
Wisdom of Solomon	12	15	 	 ⲛ̅ⲧⲕ̅ ⲟⲩⲇⲓⲕⲁⲓⲟⲥ ⲇⲉ ⲕⲣ̅ϩⲙ̅ⲙⲉ ⲙ̅ⲙⲟⲟⲩ ⲧⲏⲣⲟⲩ ⲇⲓⲕⲁⲓⲱⲥ ⲉⲕⲱⲡ ⲙ̅ⲡⲁⲓ̈ ϫⲉ ⲟⲩϣⲙ̅ⲙⲟ ⲡⲉ ⲉⲧⲉⲕϭⲟⲙ ⲉⲕⲟⲗⲁⲍⲉ ⲛ̅ⲟⲩⲁ ⲉⲛϥ̅ⲙ̅ⲡϣⲁ ⲁⲛ ⲛ̅ⲧⲁϭⲁⲓ̈ⲟϥ.	 Forsomuch then as thou art righteous thyself, thou orderest all things righteously: thinking it not agreeable with thy power to condemn him that hath not deserved to be punished.	 δίκαιος δὲ ὢν δικαίως τὰ πάντα διέπεις αὐτὸν τὸν µὴ ὀφείλοντα κολασθῆναι καταδικάσαι ἀλλότριον ἡγούµενος τῆς σῆς δυνάµεως.						
Wisdom of Solomon	12	16	 	 ⲧⲉⲕϭⲟⲙ ⲅⲁⲣ ⲧⲉ ⲧⲉϩⲟⲩⲉⲓⲧⲉ ⲛ̅ⲧⲇⲓⲕⲁⲓⲟⲥⲩⲛⲏ ⲁⲩⲱ ⲧⲉⲕⲙⲛ̅ⲧϫⲟⲉⲓⲥ ⲉⲧϩⲓϫⲙ̅ ⲡⲧⲏⲣϥ̅ ⲉⲧⲣⲉⲕϯⲥⲟ ⲉⲣⲟⲟⲩ ⲧⲏⲣⲟⲩ.	 For thy power is the beginning of righteousness, and because thou art the Lord of all, it maketh thee to be gracious unto all.	 ἡ γὰρ ἰσχύς σου δικαιοσύνης ἀρχή, καὶ τὸ πάντων σε δεσπόζειν πάντων φείδεσθαί σε ποιεῖ.						
Wisdom of Solomon	12	17	 	 ⲕⲟⲩⲱⲛϩ̅ ⲅⲁⲣ ⲉⲃⲟⲗ ⲛ̅ⲧⲉⲕϭⲟⲙ ⲉⲧⲉ ⲛ̅ⲥⲉⲛⲁϩⲧⲉ ⲉⲣⲟⲥ ⲁⲛ ϩⲣⲁⲓ̈ ϩⲛ̅ ⲧⲙⲛ̅ⲧⲧⲉⲗⲉⲓⲟⲥ ⲛ̅ⲧⲉⲕⲛⲟⲙⲧⲉ ⲉⲕⲧⲁⲙⲟ ⲙ̅ⲙⲟⲟⲩ ⲉⲡⲉⲕⲁⲙⲁϩⲧⲉ ϩⲛ̅ ⲛⲉⲧⲥⲟⲟⲩⲛ ⲙ̅ⲙⲟⲕ.	 For when men will not believe that thou art of a full power, thou shewest thy strength, and among them that know it thou makest their boldness manifest.	 ἰσχὺν γὰρ ἐνδείκνυσαι ἀπιστούµενος ἐπὶ δυνάµεως τελειότητι καὶ ἐν τοῖς εἰδόσι τὸ θράσος ἐξελέγχεις·						
Wisdom of Solomon	12	18	 	 ⲛ̅ⲧⲟⲕ ⲡϫⲟⲉⲓⲥ ⲛ̅ⲛ̅ϭⲟⲙ ⲉⲕⲕⲣⲓⲛⲉ ⲛ̅ⲟⲩϩⲁⲕ ⲁⲩⲱ ⲉⲕⲣ̅ϩⲙ̅ⲙⲉ ⲙ̅ⲙⲟⲛ ϩⲛ̅ ⲟⲩⲛⲟϭ ⲛ̅ϯⲥⲟ: ⲧⲉⲩⲛⲟⲩ ⲉⲧⲉϩⲛⲁⲕ ⲟⲩⲛ̅ϭⲟⲙ ⲙ̅ⲙⲟⲕ ⲉⲣ̅ⲡⲉⲧⲉⲕⲟⲩⲁϣϥ̅.	 But thou, mastering thy power, judgest with equity, and orderest us with great favour: for thou mayest use power when thou wilt.	 σὺ δὲ δεσπόζων ἰσχύος ἐν ἐπιεικείᾳ κρίνεις καὶ µετὰ πολλῆς φειδοῦς διοικεῖς ἡµᾶς· πάρεστιν γάρ σοι, ὅταν θέλῃς, τὸ δύνασθαι.						
Wisdom of Solomon	12	19	 	 ⲁⲕⲧⲥⲁⲃⲟ ⲙ̅ⲡⲉⲕⲗⲁⲟⲥ ⲉⲃⲟⲗ ϩⲓⲧⲛ̅ ⲛⲉⲓ̈ϩⲃⲏⲩⲉ ϫⲉ ϣϣⲉ ⲉⲡⲇⲓⲕⲁⲓⲟⲥ ⲉⲣ̅ⲙⲁⲉⲓⲣⲱⲙⲉ ⲁⲩⲱ ⲁⲕϯ ⲧⲱⲕ ⲛ̅ϩⲏⲧ ⲛ̅ⲛⲉⲕϣⲏⲣⲉ ϫⲉ ⲁⲕϯ ⲙⲉⲧⲁⲛⲟⲓⲁ ⲛ̅ⲛⲉⲛⲧⲁⲩⲣ̅ⲛⲟⲃⲉ.	 But by such works hast thou taught thy people that the just man should be merciful, and hast made thy children to be of a good hope that thou givest repentance for sins.	 Ἐδίδαξας δέ σου τὸν λαὸν διὰ τῶν τοιούτων ἔργων ὅτι δεῖ τὸν δίκαιον εἶναι φιλάνθρωπον, καὶ εὐέλπιδας ἐποίησας τοὺς υἱούς σου ὅτι διδοῖς ἐπὶ ἁµαρτήµασιν µετάνοιαν.						
Wisdom of Solomon	12	20	 	 ⲉϣϫⲉ ⲛ̅ϫⲓϫⲉⲉⲩ ⲅⲁⲣ ⲛ̅ⲛⲉⲕϣⲏⲣⲉ ⲛⲁⲓ̈ ⲉⲧⲙ̅ⲡϣⲁ ⲙ̅ⲡⲙⲟⲩ ⲛ̅ⲧⲁⲕⲧⲓⲙⲱⲣⲉⲓ ⲙ̅ⲙⲟⲟⲩ ϩⲛ̅ ⲟⲩϯⲥⲟ ⲙⲛ̅ ⲟⲩⲙⲛ̅ⲧ​ϩⲁⲣϣ̅ϩⲏⲧ ⲉⲛⲁϣⲱⲥ ⲉⲕϯ ⲙⲁ ⲛⲁⲩ ϩⲓ ⲟⲩⲟⲉⲓϣ ⲉⲧⲣⲉⲩⲗⲟ ϩⲛ̅ ⲧⲉⲩⲕⲁⲕⲓⲁ	 For if thou didst punish the enemies of thy children, and the condemned to death, with such deliberation, giving them time and place, whereby they might be delivered from their malice:	 εἰ γὰρ ἐχθροὺς παίδων σου καὶ ὀφειλοµένους θανάτῳ µετὰ τοσαύτης ἐτιµωρήσω προσοχῆς καὶ διέσεως δοὺς χρόνους καὶ τόπον, δι’ ὧν ἀπαλλαγῶσι τῆς κακίας,						
Wisdom of Solomon	12	21	 	 ⲉⲉⲓⲉ ϩⲛ̅ ⲟⲩ[ⲏⲣ ⲙ]ⲙⲛ̅ⲧϩⲁⲣϣ̅ϩⲏⲧ ⲉⲕⲕⲣⲓⲛⲉ ⲛ̅ⲛⲉ[ⲕϣ]ⲏⲣⲉ ⲛⲁⲓ̈ ⲉⲛⲧⲁⲕⲥⲙⲓⲛⲉ ⲙⲛ̅ ⲛⲉⲩⲉⲓⲟⲧⲉ ⲛ̅ϩⲉⲛⲁⲛⲁⲩϣ ⲙⲛ̅ ϩⲉⲛⲇⲓⲁⲑⲏⲕⲏ ⲙⲛ̅ ϩⲉⲛⲉⲣⲏⲧ ⲉⲛⲁⲛⲟⲩⲟⲩ;	 With how great circumspection didst thou judge thine own sons, unto whose fathers thou hast sworn, and made covenants of good promises?	 µετὰ πόσης ἀκριβείας ἔκρινας τοὺς υἱούς σου, ὧν τοῖς πατράσιν ὅρκους καὶ συνθήκας ἔδωκας ἀγαθῶν ὑποσχέσεων;						
Wisdom of Solomon	12	22	 	 ⲉⲕϯⲥⲃⲱ ϭⲉ ⲛⲁⲛ ⲉⲕⲙⲁⲥⲧⲓⲅⲟⲩ ⲛ̅ⲛⲉⲛϫⲁϫⲉ ⲛ̅ⲟⲩⲧⲃⲁ ⲛ̅ⲕⲱⲃ ϫⲉⲕⲁⲁⲥ ⲉⲛⲉⲣ̅ⲡⲙⲉⲉⲩⲉ ⲛ̅ⲧⲉⲕⲙⲛ̅ⲧⲁⲅⲁⲑⲟⲥ ⲉⲛϯϩⲁⲡ ⲉⲕⲕⲣⲓⲛⲉ ⲇⲉ ⲙ̅ⲙⲟⲛ ⲧⲛ̅ⲛⲁϭⲱϣⲧ̅ ⲉⲃⲟⲗ ϩⲏⲧϥ̅ ⲛ̅ⲟⲩⲛⲁ.	 Therefore, whereas thou dost chasten us, thou scourgest our enemies a thousand times more, to the intent that, when we judge, we should carefully think of thy goodness, and when we ourselves are judged, we should look for mercy.	 Ἡµᾶς οὖν παιδεύων τοὺς ἐχθροὺς ἡµῶν ἐν µυριότητι µαστιγοῖς, ἵνα σου τὴν ἀγαθότητα µεριµνῶµεν κρίνοντες, κρινόµενοι δὲ προσδοκῶµεν ἔλεος.						
Wisdom of Solomon	12	23	 	 ⲉⲧⲃⲉ ⲡⲁⲓ̈ ⲟⲛ ⲛⲉⲛⲧⲁⲩϣⲱⲡⲉ ϩⲛ̅ ⲟⲩϭⲓⲛⲱⲛϩ̅ ⲛ̅ⲛ̅ⲁⲑⲏⲧ ⲙⲛ̅ ⲟⲩϫⲓⲛ̅ϭⲟⲛⲥ̅ ⲛ̅ⲧⲁⲕⲃⲁⲥⲁⲛⲓⲍⲉ ⲙ̅ⲙⲟⲟⲩ ϩⲓⲧⲛ̅ ⲛⲉⲩⲃⲟⲧⲉ ⲙⲙⲓⲛ ⲙ̅ⲙⲟⲟⲩ.	 Wherefore, whereas men have lived dissolutely and unrighteously, thou hast tormented them with their own abominations.	 ὅθεν καὶ τοὺς ἐν ἀφροσύνῃ ζωῆς βιώσαντας ἀδίκως διὰ τῶν ἰδίων ἐβασάνισας βδελυγµάτων·						
Wisdom of Solomon	12	24	 	 ⲕⲁⲓ ⲅⲁⲣ ⲁⲩⲥⲱⲣⲙ̅ ⲙ̅ⲡⲟⲩⲉⲓ ⲉϩⲣⲁⲓ̈ ϩⲛ̅ ⲛⲉϩⲓⲟⲟⲩⲉ ⲛ̅ⲧⲉⲡⲗⲁⲛⲏ ⲉⲩⲙⲉⲉⲩⲉ ϫⲉ ϩⲛ̅ⲛⲟⲩⲧⲉ ⲛⲉ ⲛⲁⲓ̈ ⲉⲧⲥⲏϣ ⲛ̅ⲛ̅ⲍⲱⲟⲛ ⲛ̅ⲛ̅ⲕⲉϩⲉⲑⲛⲟⲥ ⲉⲁⲩⲣ̅ϩⲁⲗ ⲙ̅ⲙⲟⲟⲩ ⲛ̅ⲑⲉ ⲛ̅ϩⲉⲛϣⲏⲣⲉ ⲕⲟⲩⲓ̈ ⲛ̅ⲛ̅ⲁⲑⲏⲧ.	 For they went astray very far in the ways of error, and held them for gods, which even among the beasts of their enemies were despised, being deceived, as children of no understanding.	 καὶ γὰρ τῶν πλάνης ὁδῶν µακρότερον ἐπλανήθησαν θεοὺς ὑπολαµβάνοντες τὰ καὶ ἐν ζῴοις τῶν αἰσχρῶν ἄτιµα νηπίων δίκην ἀφρόνων ψευσθέντες.						
Wisdom of Solomon	12	25	 	 ⲉⲧⲃⲉ ⲡⲁⲓ̈ ⲟⲛ ⲁⲕⲧⲛ̅ⲛⲟⲟⲩ ⲛⲁⲩ ⲛ̅ⲟⲩϩⲁⲡ ⲛ̅ⲥⲱⲃⲉ ⲛ̅ⲥⲱⲟⲩ ⲛ̅ⲑⲉ ⲛ̅ϩⲉⲛϣⲏⲣⲉ ϣⲏⲙ ⲛ̅ⲁⲧⲛⲟⲓ̈.	 Therefore unto them, as to children without the use of reason, thou didst send a judgment to mock them.	 διὰ τοῦτο ὡς παισὶν ἀλογίστοις τὴν κρίσιν εἰς ἐµπαιγµὸν ἔπεµψας.						
Wisdom of Solomon	12	26	 	 ⲛ̅ⲧⲟⲟⲩ ⲇⲉ ⲙ̅ⲡⲟⲩϫⲓⲥⲃⲱ ϩⲓⲧⲛ̅ ⲧⲉⲡⲓⲧⲓⲙⲓⲁ ⲙⲛ̅ ⲥⲱⲃⲉ ⲛ̅ⲥⲱⲟⲩ ⲥⲉⲛⲁⲙ̅ⲡϣⲁ ⲛ̅ϫⲓ ⲡⲓⲣⲁ ⲛ̅ⲧⲉⲕⲣⲓⲥⲓⲥ ⲙ̅ⲡⲛⲟⲩⲧⲉ.	 But they that would not be reformed by that correction, wherein he dallied with them, shall feel a judgment worthy of God.	 οἱ δὲ παιγνίοις ἐπιτιµήσεως µὴ νουθετηθέντες ἀξίαν θεοῦ κρίσιν πειράσουσιν.						
Wisdom of Solomon	12	27	 	 ϩⲛ̅ ⲛⲉⲛⲧⲁⲩϭⲱⲛⲧ̅ ⲅⲁⲣ ⲛ̅ϩⲏⲧⲟⲩ ⲉⲩⲑⲙ̅ⲕⲟ ⲙ̅ⲙⲟⲟⲩ ⲛ̅ⲧⲁⲩⲕⲟⲗⲁⲍⲉ ⲙ̅ⲙⲟⲟⲩ: ϩⲛ̅ ⲛⲉⲛ​ⲧⲟⲩⲙⲉⲉⲩⲉ ⲉⲣⲟⲟⲩ ϫⲉ ϩⲛ̅ⲛⲟⲩⲧⲉ ⲛⲉ. ⲧⲟⲧⲉ ⲁⲩⲥⲟⲩⲛ̅ ⲡⲛⲟⲩⲧⲉ ⲙ̅ⲙⲉ ⲡⲉⲧⲉ ⲛⲉⲩⲁⲣⲛⲁ ⲙ̅ⲙⲟϥ ⲛ̅ϣⲟⲣⲡ̅ ϫⲉ ⲛ̅ⲧⲛ̅ⲥⲟⲟⲩⲛ ⲙ̅ⲙⲟϥ ⲁⲛ.	 For, look, for what things they grudged, when they were punished, that is, for them whom they thought to be gods; now being punished in them, when they saw it, they acknowledged him to be the true God, whom before they denied to know:	 ἐφ’ οἷς γὰρ αὐτοὶ πάσχοντες ἠγανάκτουν, ἐπὶ τούτοις, οὓς ἐδόκουν θεούς, ἐν αὐτοῖς κολαζόµενοι ἰδόντες, ὃν πάλαι ἠρνοῦντο εἰδέναι, θεὸν ἐπέγνωσαν ἀληθῆ·						
Wisdom of Solomon	12		 	 ⲉⲧⲃⲉ ⲡⲁⲓ̈ ⲁ ⲑⲁⲏ ⲙ̅ⲡⲧⲁⲕⲟ ⲉⲓ ⲉϩⲣⲁⲓ̈ ⲉϫⲱⲟⲩ.	and therefore came extreme damnation upon them.	διὸ καὶ τὸ τέρµα τῆς καταδίκης ἐπ’ αὐτοὺς ἐπῆλθεν.						
Wisdom of Solomon	13	1	 	 ϩⲛ̅ ⲡⲉⲧϣⲟⲩⲉⲓⲧ ⲅⲁⲣ ⲛⲉ ⲣⲱⲙⲉ ⲛⲓⲙ ⲉⲧⲟ ⲛ̅ⲁⲧⲥⲟⲟⲩⲛ̅ ⲙ̅ⲡⲛⲟⲩⲧⲉ: ⲙ̅ⲡⲟⲩⲉϣⲥⲟⲩⲛ̅ ⲡⲉⲧϣⲟⲟⲡ ⲅⲁⲣ ϩⲓⲧⲛ̅ ⲛ̅ⲁⲅⲁⲑⲟⲛ ⲉⲧⲟⲩⲛⲁⲩ ⲉⲣⲟⲟⲩ ⲟⲩⲇⲉ ⲙ̅ⲡⲟⲩϯ ϩⲧⲏⲩ ⲉⲛⲉϩⲃⲏⲩⲉ ⲛ̅ⲥⲉⲥⲟⲩⲛ̅ ⲡⲣⲉϥⲥⲱⲛⲧ̅:	 Surely vain are all men by nature, who are ignorant of God, and could not out of the good things that are seen know him that is: neither by considering the works did they acknowledge the workmaster;	 Μάταιοι µὲν γὰρ πάντες ἄνθρωποι φύσει, οἷς παρῆν θεοῦ ἀγνωσία καὶ ἐκ τῶν ὁρωµένων ἀγαθῶν οὐκ ἴσχυσαν εἰδέναι τὸν ὄντα οὔτε τοῖς ἔργοις προσέχοντες ἐπέγνωσαν τὸν τεχνίτην,						
Wisdom of Solomon	13	2	 	 ⲁⲗⲗⲁ ⲛ̅ⲧⲁⲩⲙⲉⲉⲩⲉ ⲉⲩⲕⲱϩⲧ̅ ⲏ ⲟⲩⲡⲛⲉⲩⲙⲁ ⲏ ⲙ̅ⲡⲁⲏⲣ ⲉⲧⲁⲥⲱⲟⲩ ⲏ ⲛ̅ⲥⲓⲟⲩ ⲉⲧⲕⲱⲧⲉ ⲏ ⲙ̅ⲡⲙⲟⲟⲩ ⲉⲧⲥⲱⲕ ⲏ ⲛⲉⲫⲱⲥⲧⲏⲣ ⲛ̅ⲧⲡⲉ ⲉⲧⲣ̅ⲟⲩⲟⲉⲓⲛ ⲉⲡⲕⲟⲥⲙⲟⲥ ϫⲉ ⲛⲁⲓ̈ ⲛⲉ ⲛ̅ⲛⲟⲩⲧⲉ.	 But deemed either fire, or wind, or the swift air, or the circle of the stars, or the violent water, or the lights of heaven, to be the gods which govern the world.	 ἀλλ’ ἢ πῦρ ἢ πνεῦµα ἢ ταχινὸν ἀέρα ἢ κύκλον ἄστρων ἢ βίαιον ὕδωρ ἢ φωστῆρας οὐρανοῦ πρυτάνεις κόσµου θεοὺς ἐνόµισαν.						
Wisdom of Solomon	13	3	 	 ⲉϣϫⲉ ⲛ̅ⲧⲁⲩⲣ̅ϣⲡⲏⲣⲉ ⲙ̅ⲡⲉⲩⲥⲁ ⲁⲩⲙⲉⲉⲩⲉ ⲉⲣⲟⲟⲩ ϫⲉ ϩⲉⲛⲛⲟⲩⲧⲉ ⲛⲉ ⲙⲁⲣⲟⲩⲉⲓⲙⲉ ϫⲉ ⲡϫⲟⲉⲓⲥ ⲛ̅ⲛⲁⲓ̈ ⲉⲉⲓⲉ ⲛⲉⲥⲱϥ ⲉⲣⲟⲟⲩ ⲛ̅ⲛⲁⲟⲩⲏⲣ ⲛ̅ϩⲟⲩⲟ: ⲡⲁⲣⲭⲱⲛ ⲅⲁⲣ ⲙ̅ⲡⲧⲁⲙⲓⲟ ⲙ̅ⲡⲉⲩⲥⲁ ⲡⲉⲛⲧⲁϥⲥⲟⲛⲧⲟⲩ ⲧⲏⲣⲟⲩ.	 With whose beauty if they being delighted took them to be gods; let them know how much better the Lord of them is: for the first author of beauty hath created them.	 ὧν εἰ µὲν τῇ καλλονῇ τερπόµενοι ταῦτα θεοὺς ὑπελάµβανον, γνώτωσαν πόσῳ τούτων ὁ δεσπότης ἐστὶ βελτίων, ὁ γὰρ τοῦ κάλλους γενεσιάρχης ἔκτισεν αὐτά·						
Wisdom of Solomon	13	4	 	 ⲉϣϫⲉ ⲛ̅ⲧⲁⲩⲡⲱϣⲥ̅ ⲉϩⲣⲁⲓ̈ ⲉϫⲛ̅ ⲧⲉⲩϭⲟⲙ ⲙⲛ̅ ⲧⲉⲩⲉⲛⲉⲣⲅⲉⲓⲁ ⲙⲁⲣⲟⲩⲛⲟⲓ̈ ϭⲉ ⲉⲃⲟⲗ ⲛ̅ϩⲏⲧⲟⲩ ϫⲉ ⲡⲉⲛⲧⲁϥⲥⲃ̅ⲧⲱⲧⲟⲩ ⲉⲉⲓⲉϥϭⲙ̅ϭⲟⲙ ⲉⲣⲟⲟⲩ ⲛ̅ⲟⲩⲏⲣ ⲛ̅ϩⲟⲩⲟ.	 But if they were astonished at their power and virtue, let them understand by them, how much mightier he is that made them.	 εἰ δὲ δύναµιν καὶ ἐνέργειαν ἐκπλαγέντες, νοησάτωσαν ἀπ’ αὐτῶν πόσῳ ὁ κατασκευάσας αὐτὰ δυνατώτερός ἐστιν·						
Wisdom of Solomon	13	5	 	 ⲉⲩⲧⲟⲛⲧⲛ̅ ⲅⲁⲣ ⲉⲡⲁⲛⲁⲓ̈ ⲙⲛ̅ ⲧⲛⲟϭ ⲙ̅ⲡⲣⲉϥⲥⲱⲛⲧ̅ ⲉⲩⲛⲁⲩ ⲉⲃⲟⲗ ⲙ̅ⲙⲟⲟⲩ ⲉⲡⲣⲉϥⲣ̅ϩⲱⲃ ⲙ̅ⲡⲉⲩϫⲡⲟ.	 For by the greatness and beauty of the creatures proportionably the maker of them is seen.	 ἐκ γὰρ µεγέθους καὶ καλλονῆς κτισµάτων ἀναλόγως ὁ γενεσιουργὸς αὐτῶν θεωρεῖται.						
Wisdom of Solomon	13	6	 	 ⲁⲗⲗⲁ ⲛⲉⲓ̈ⲕⲟⲟⲩⲉ ⲟⲛ ⲟⲩⲛ̅ ⲁⲣⲓⲕⲉ ⲉⲣⲟⲟⲩ: ⲕⲁⲓ ⲅⲁⲣ ⲛ̅ⲧⲟⲟⲩ ϩⲱⲟⲩ ⲟⲛ ⲥⲉⲡⲗⲁⲛⲁ. ⲉⲩϣⲓⲛⲉ ⲛ̅ⲥⲁ ⲡⲛⲟⲩⲧⲉ ⲉⲩⲟⲩⲉϣ ϩⲉ ⲉⲣⲟϥ.	 But yet for this they are the less to be blamed: for they peradventure err, seeking God, and desirous to find him.	 ἀλλ’ ὅµως ἐπὶ τούτοις µέµψις ἐστὶν ὀλίγη, καὶ γὰρ αὐτοὶ τάχα πλανῶνται θεὸν ζητοῦντες καὶ θέλοντες εὑρεῖν·						
Wisdom of Solomon	13	7	 	 ⲉⲩϣⲟⲟⲡ ⲅⲁⲣ ϩⲛ̅ ⲛⲉϥϩⲃⲏⲩⲉ ⲁⲩⲱ ⲉⲩϩⲟⲧϩⲧ̅: ⲥⲉⲡⲓⲑⲉ ⲅⲁⲣ ⲉϫⲛ̅ ⲛⲉⲧⲟⲩⲛⲁⲩ ⲉⲣⲟⲟⲩ ϫⲉ ⲛⲉⲥⲱⲟⲩ.	 For being conversant in his works they search him diligently, and believe their sight: because the things are beautiful that are seen.	 ἐν γὰρ τοῖς ἔργοις αὐτοῦ ἀναστρεφόµενοι διερευνῶσιν καὶ πείθονται τῇ ὄψει, ὅτι καλὰ τὰ βλεπόµενα.						
Wisdom of Solomon	13	8	 	 ⲛⲉⲓ̈ⲕⲟⲟⲩⲉ ⲟⲛ ⲛ̅ⲥⲉⲧⲙⲁⲓ̈ⲏⲩ ⲁⲛ.	 Howbeit neither are they to be pardoned.	 πάλιν δ’ οὐδ’ αὐτοὶ συíνωστοί·						
