book	chapter	verse	Bohairic	Sahidic	English	Greek	Fayyumic	Akhmimic	OldBohairic	Mesokemic	DialectP	Lycopolitan
Wisdom of Solomon	1			ⲧⲥⲟⲫⲓⲁ ⲛ̅ⲥⲟⲗⲟⲙⲱⲛ								
Wisdom of Solomon	1	1	 ⲙⲉⲛⲣⲉ ϯⲙⲉⲑⲙⲏⲓ ⲛⲏ ⲉⲧϯϩⲁⲡ ⲉ̀ⲡⲕⲁϩⲓ ⲁⲣⲓⲫⲙⲉⲩⲓ ⲡϭ̅ⲥ̅ ϧⲉⲛ ⲟⲩⲙⲉⲧⲁⲅⲁⲑⲟⲥ ⲉⲣⲉⲧⲉⲛⲕⲱϯ ⲛ̀ⲥⲱϥ ϧⲉⲛ ϯⲙⲉⲧⲁⲡⲗⲟⲩⲥ ⲛ̀ⲧⲉ ⲡⲉⲧⲉⲛϩⲏⲧ	 ⲙⲉⲣⲉ ⲧⲇⲓⲕⲁⲓⲟⲥⲩⲛⲏ ⲛⲉⲧⲕⲣⲓⲛⲉ ⲙ̅ⲡⲕⲁϩ ⲁⲣⲓⲡⲙⲉⲉⲩⲉ ⲙ̅ⲡϫⲟⲉⲓⲥ ϩⲛ̅ ⲟⲩⲙⲛ̅ⲧⲁⲅⲁⲑⲟⲥ ⲛ̅ⲧⲉⲧⲛ̅ϣⲓⲛⲉ ⲛ̅ⲥⲱϥ ϩⲛ̅ ⲟⲩⲙⲛ̅ⲧϩⲁⲡⲗⲟⲩⲥ ⲛ̅ⲧⲉ ⲡⲉⲧⲛ̅ϩⲏⲧ.	 Love righteousness, ye that be judges of the earth: think of the Lord with a good (heart,) and in simplicity of heart seek him.	 Ἀγαπήσατε δικαιοσύνην, οἱ κρίνοντες τὴν γῆν, φρονήσατε περὶ τοῦ κυρίου ἐν ἀγαθότητι καὶ ἐν ἁπλότητι καρδίας ζητήσατε αὐτόν.						
Wisdom of Solomon	1	2	 ϫⲉ ϣⲁⲩϫⲓⲙⲓ ⲙ̀ⲙⲟϥ ⲛ̀ϫⲉ ⲛⲏ ⲉⲧⲉ ⲛ̀ⲥⲉⲉⲣⲡⲓⲣⲁⲍⲓⲛ ⲙ̀ⲙⲟϥ ⲁⲛ ϣⲁϥⲟⲩⲱⲛϩ ⲉ̀ⲃⲟⲗ ⲛ̀ⲛⲏ ⲉⲧⲉ ⲛ̀ⲥⲉⲟⲓ ⲛ̀ⲁⲑⲛⲁϩϯ ⲉ̀ⲣⲟϥ ⲁⲛ	 ϫⲉ ϣⲁⲩϩⲉ ⲉⲣⲟϥ ⲛ̅ϭⲓ ⲛⲉⲧⲉ ⲛ̅ⲥⲉⲡⲉⲓⲣⲁⲍⲉ ⲙ̅ⲙⲟϥ ⲁⲛ ϣⲁϥⲟⲩⲱⲛϩ̅ ⲇⲉ ⲉⲃⲟⲗ ⲛ̅ⲛⲉⲧⲉ ⲛ̅ⲥⲉⲟ ⲛ̅ⲁⲧⲛⲁϩⲧⲉ ⲉⲣⲟϥ ⲁⲛ.	 For he will be found of them that tempt him not; and sheweth himself unto such as do not distrust him.	 ὅτι εὑρίσκεται τοῖς µὴ πειράζουσιν αὐτόν, ἐµφανίζεται δὲ τοῖς µὴ ἀπιστοῦσιν αὐτῷ.						
Wisdom of Solomon	1	3	 ϣⲁⲣⲉ ⲡⲓⲙⲉⲩⲓ ⲅⲁⲣ ⲉⲧϩⲱⲟⲩ ⲫⲟⲣϫⲟⲩ ⲉ̀ⲃⲟⲗ ϩⲁ ⲫϯ ⲟⲩⲟϩ ⲧⲉϥϫⲟⲙ ⲉⲑⲟⲩⲱⲛϩ ⲉ̀ⲃⲟⲗ ϣⲁⲥⲥⲟϩⲓ ⲛ̀ⲛⲓⲁⲧϩⲏⲧ	 ϣⲁⲣⲉ ⲡⲙⲉⲉⲩⲉ ⲅⲁⲣ ⲉⲑⲟⲟⲩ ⲡⲟⲣϫⲟⲩ ⲉⲡⲛⲟⲩⲧⲉ. ⲁⲩⲱ ⲧⲉϥϭⲟⲙ ⲉⲧⲟⲩⲟⲛϩ̅ ⲉⲃⲟⲗ ϣⲁⲥϫⲡⲉⲓⲉ ⲛ̅ⲁⲑⲏⲧ:	 For froward thoughts separate from God: and his power, when it is tried, reproveth the unwise.	 σκολιοὶ γὰρ λογισµοὶ χωρίζουσιν ἀπὸ θεοῦ, δοκιµαζοµένη τε ἡ δύναµις ἐλέγχει τοὺς ἄφρονας.						
Wisdom of Solomon	1	4	 ϫⲉ ⲙ̀ⲡⲁⲣⲉ ϯⲥⲟⲫⲓⲁ ϣⲉ ⲉ̀ϧⲟⲩⲛ ⲉ̀ⲟⲩⲯⲩⲭⲏ ⲉ̀ⲥϩⲱⲟⲩ ⲟⲩⲇⲉ ⲙ̀ⲡⲁⲥⲟⲩⲱⲛϩ ϧⲉⲛ ⲟⲩⲥⲱⲙⲁ ⲛ̀ⲣⲉϥⲉⲣⲛⲟⲃⲓ	 ϫⲉ ⲙⲉⲣⲉ ⲧⲥⲟⲫⲓⲁ ⲅⲁⲣ ⲃⲱⲕ ⲉϩⲟⲩⲛ ⲉⲩⲯⲩⲭⲏ ⲉⲥϩⲟⲟⲩ ⲟⲩⲇⲉ ⲙⲉⲥⲟⲩⲱϩ ϩⲛ̅ ⲥⲱⲙⲁ ⲣ̅ⲣⲉϥⲣ̅ⲛⲟⲃⲉ.	 For into a malicious soul wisdom shall not enter; nor dwell in the body that is subject unto sin.	 ὅτι εἰς κακότεχνον ψυχὴν οὐκ εἰσελεύσεται σοφία οὐδὲ κατοικήσει ἐν σώµατι κατάχρεῳ ἁµαρτίας.						
Wisdom of Solomon	1	5	 ⲡⲓⲡⲛⲁ ⲅⲁⲣ ⲉⲑⲟⲩⲁⲃ ⲛ̀ⲧⲉ ϯⲥⲟⲫⲓⲁ ϣⲁϥⲫⲱⲧ ⲉ̀ⲃⲟⲗ ⲛ̀ⲭⲣⲟϥ ⲛⲓⲃⲉⲛ ⲟⲩⲟϩ ϣⲁϥⲟⲩⲉⲓ ⲉ̀ⲃⲟⲗ ⲛ̀ⲛⲓⲙⲟⲕⲙⲉⲕ ⲛ̀ⲧⲉ ⲛⲓⲁⲧϩⲏⲧ ⲟⲩⲟϩ ϣⲁϥⲥⲟϩⲓ ⲙ̀ⲡⲓϭⲓⲛϫⲟⲛⲥ ⲁϥϣⲁⲛⲓ̀	 ⲡⲉⲡⲛⲉⲩⲙⲁ ⲅⲁⲣ ⲉⲧⲟⲩⲁⲁⲃ ⲛ̅ⲧⲥⲟⲫⲓⲁ ϣⲁϥⲡⲱⲧ ⲉⲃⲟⲗ ⲛ̅ⲕⲣⲟϥ ⲁⲩⲱ ϣⲁϥⲟⲩⲉ ⲛ̅ⲙ̅ⲙⲟⲕⲙⲉⲕ ⲛ̅ⲛ̅ⲁⲑⲏⲧ ⲁⲩⲱ ϣⲁϥϫⲡⲓⲉ ⲡϫⲓⲛ̅ϭⲟⲛⲥ̅ ⲉϥϣⲁⲛⲉⲓ	 For the holy spirit of discipline will flee deceit, and remove from thoughts that are without understanding, and will not abide when unrighteousness cometh in.	 ἅγιον γὰρ πνεῦµα παιδείας φεύξεται δόλον καὶ ἀπαναστήσεται ἀπὸ λογισµῶν ἀσυνέτων καὶ ἐλεγχθήσεται ἐπελθούσης ἀδικίας.						
Wisdom of Solomon	1	6	 ⲟⲩⲙⲁⲓⲣⲱⲙⲓ ⲅⲁⲣ ⲡⲉ ⲡⲓⲡⲛ̅ⲁ̅ ⲛ̀ⲧⲉ ϯⲥⲟⲫⲓⲁ ⲟⲩⲟϩ ϥⲉⲣⲑⲙⲁⲓⲟ ⲁⲛ ⲙ̀ⲫⲏ ⲉⲧϫⲉⲟⲩⲁ ϧⲉⲛ ⲛⲉϥⲥⲫⲟⲧⲟⲩ ϫⲉ ⲫϯ ⲡⲉ ⲡⲓⲙⲉⲑⲣⲉ ⲛ̀ⲛⲉϥϭⲗⲱⲧ ⲟⲩⲟϩ ⲡⲉⲧϧⲟⲧϧⲉⲧ ⲙ̀ⲙⲏⲓ ⲛⲧⲉ ⲡⲉϥϩⲏⲧ ⲟⲩⲟϩ ⲉⲧⲥⲱⲧⲉⲙ ⲉ̀ⲡⲉϥⲗⲁⲥ	 ⲟⲩⲙⲁⲉⲓ ⲣⲱⲙⲉ ⲅⲁⲣ ⲡⲉ ⲡⲉⲡⲛⲉⲩⲙⲁ ⲛ̅ⲧⲥⲟⲫⲓⲁ ⲁⲩⲱ ⲛϥ̅ⲛⲁⲧⲙⲁⲓ̈ⲉ ⲡϫⲓⲟⲩⲁ ⲁⲛ ϩⲛ̅ ⲛⲉϥⲥⲡⲟⲧⲟⲩ: ϫⲉ ⲡⲛⲟⲩⲧⲉ ⲡⲉ ⲡⲙⲛ̅ⲧⲣⲉ ⲛ̅ⲛⲉϥϭⲗⲟⲧⲉ ⲁⲩⲱ ⲡⲉⲧⲙⲟⲩϣⲧ̅ ⲛⲁⲙⲉ ⲙ̅ⲡⲉϥϩⲏⲧ ⲁⲩⲱ ⲡⲉⲧⲥⲱⲧⲙ̅ ⲉⲡⲉϥⲗⲁⲥ.	 For wisdom is a loving spirit; and will not acquit a blasphemer of his words: for God is witness of his reins, and a true beholder of his heart, and a hearer of his tongue.	 φιλάνθρωπον γὰρ πνεῦµα σοφία καὶ οὐκ ἀθῳώσει βλάσφηµον ἀπὸ χειλέων αὐτοῦ· ὅτι τῶν νεφρῶν αὐτοῦ µάρτυς ὁ θεὸς καὶ τῆς καρδίας αὐτοῦ ἐπίσκοπος ἀληθὴς καὶ τῆς γλώσσης ἀκουστής.						
Wisdom of Solomon	1	7	 ϫⲉ ⲡⲓⲡⲛ̅ⲁ̅ ⲛ̀ⲧⲉ ⲡϭ̅ⲥ̅ ⲁϥⲙⲟϩ ⲛ̀ϯⲟⲓⲕⲟⲩⲙⲉⲛⲏ ⲟⲩⲟϩ ⲫⲏ ⲉⲧⲥⲱϫⲡ ⲙ̀ⲡⲧⲏⲣϥ ϥⲥⲱⲟⲩⲛ ⲉ̀ⲡⲟⲩϧⲣⲱⲟⲩ	 ϫⲉ ⲡⲉⲡⲛⲉⲩⲙⲁ ⲙ̅ⲡϫⲟⲉⲓⲥ ⲁϥⲙⲉϩ ⲧⲟⲓⲕⲟⲩⲙⲉⲛⲏ ⲁⲩⲱ ⲡⲉⲧϣⲱⲡ ⲙ̅ⲡⲧⲏⲣϥ̅ ⲉϥⲥⲟⲟⲩⲛ ⲙ̅ⲡⲉⲩϩⲣⲟⲟⲩ.	 For the Spirit of the Lord filleth the world: and that which containeth all things hath knowledge of the voice.	 ὅτι πνεῦµα κυρίου πεπλήρωκεν τὴν οἰκουµένην, καὶ τὸ συνέχον τὰ πάντα γνῶσιν ἔχει φωνῆς.						
Wisdom of Solomon	1	8	 ⲉⲑⲃⲉ ⲫⲁⲓ ⲙ̀ⲙⲟⲛ ϩⲗⲓ ⲛⲁϣϩⲱⲡ ⲉⲡⲉϥⲥⲁϫⲓ ϧⲉⲛ ⲟⲩϭⲓⲛ̀ϫⲟⲛⲥ ⲟⲩⲇⲉ ⲛ̀ⲛⲉϥⲉⲣⲉⲃⲟⲗ ⲉ̀ϯⲕⲣⲏⲥⲓⲥ ⲉⲑⲛⲏⲟⲩ	 ⲉⲧⲃⲉ ⲡⲁⲓ̈ ⲙⲛ̅ ⲗⲁⲁⲩ ⲛⲁϩⲱⲡ ⲉϥϣⲁϫⲉ ϩⲛ̅ ⲟⲩϫⲓⲛ̅ϭⲟⲛⲥ̅ ⲟⲩⲇⲉ ⲛϥ̅ⲛⲁⲣ̅ⲃⲟⲗ ⲁⲛ ⲉⲧⲉⲕⲣⲓⲥⲓⲥ ⲉⲧⲛ̅ⲛⲏⲩ	 Therefore he that speaketh unrighteous things cannot be hid: neither shall vengeance, when it punisheth, pass by him.	 διὰ τοῦτο φθεγγόµενος ἄδικα οὐδεὶς µὴ λάθῃ, οὐδὲ µὴ παροδεύσῃ αὐτὸν ἐλέγχουσα ἡ δίκη.						
Wisdom of Solomon	1	9	 ⲉⲩⲉ̀ϫⲉⲙⲡϣⲓⲛⲓ ⲅⲁⲣ ⲙ̀ⲡⲓⲁⲥⲉⲃⲏⲥ ϧⲉⲛ ⲡⲉϥⲥⲟϭⲛⲓ ⲟⲩⲟϩ ⲡϭ̅ⲥ̅ ⲛⲁⲥⲱⲧⲉⲙ ⲁⲛ ⲉ̀ⲛⲉϥⲥⲁϫⲓ ⲉ̀ⲫⲟⲩⲱⲛϩ ⲉ̀ⲃⲟⲗ ⲛ̀ⲛⲉϥⲁⲛⲟⲙⲓⲁ	 ⲥⲉⲛⲁϭⲙ̅ⲡϣⲓⲛⲉ ⲅⲁⲣ ⲙ̅ⲡϣⲟϫⲛⲉ ⲙ̅ⲡⲁⲥⲉⲃⲏⲥ ⲁⲩⲱ ⲡϫⲟⲉⲓⲥ ⲛⲁⲥⲱⲧⲙ̅ ⲉⲛⲉϥϣⲁϫⲉ ⲉⲡⲟⲩⲱⲛϩ̅ ⲉⲃⲟⲗ ⲛ̅ⲛⲉϥⲁⲛⲟⲙⲓⲁ.	 For inquisition shall be made into the counsels of the ungodly: and the sound of his words shall come unto the Lord for the manifestation of his wicked deeds.	 ἐν γὰρ διαβουλίοις ἀσεβοῦς ἐξέτασις ἔσται, λόγων δὲ αὐτοῦ ἀκοὴ πρὸς κύριον ἥξει εἰς ἔλεγχον ἀνοµηµάτων αὐτοῦ·						
Wisdom of Solomon	1	10		 ϫⲉ ⲡⲙⲁⲁϫⲉ ⲙⲡⲉϥⲕⲱϩ ϣⲁϥⲥⲱⲧⲙ̅ ⲉϩⲱⲃ ⲛⲓⲙ. ⲁⲩⲱ ⲡⲉϩⲣⲟⲟⲩ ⲛ̅ⲛⲉⲕⲣⲙ̅ⲣⲙ̅ ⲛⲁϩⲱⲡ ⲁⲛ.	 For the ear of jealousy heareth all things: and the noise of murmurings is not hid.	 ὅτι οὖς ζηλώσεως ἀκροᾶται τὰ πάντα, καὶ θροῦς γογγυσµῶν οὐκ ἀποκρύπτεται.						
Wisdom of Solomon	1	11		 ϩⲁⲣⲉϩ ϭⲉ ⲉⲣⲱⲧⲛ̅ ⲉⲡⲉⲕⲣⲙ̅ⲣⲙ̅ ⲉⲧϣⲟⲩⲉⲓⲧ ⲁⲩⲱ ϯⲥⲟ ⲉⲡⲉⲧⲛ̅ⲗⲁⲥ ⲉⲃⲟⲗ ϩⲛ̅ ⲧⲕⲁⲧⲁⲗⲁⲗⲓⲁ ϫⲉ ⲙⲛ̅ ⲟⲩϣⲁϫⲉ ⲉϥϣⲟⲩⲉⲓⲧ ⲛⲁϩⲱⲡ ⲟⲩⲧⲁⲡⲣⲟ ⲉⲥϫⲓϭⲟⲗ ϣⲁⲥⲧⲁⲕⲉ ⲧⲉⲯⲩⲭⲏ.	 Therefore beware of murmuring, which is unprofitable; and refrain your tongue from backbiting: for there is no word so secret, that shall go for nought: and the mouth that belieth slayeth the soul.	 Φυλάξασθε τοίνυν γογγυσµὸν ἀνωφελῆ καὶ ἀπὸ καταλαλιᾶς φείσασθε γλώσσης· ὅτι φθέγµα λαθραῖον κενὸν οὐ πορεύσεται, στόµα δὲ καταψευδόµενον ἀναιρεῖ ψυχήν.						
Wisdom of Solomon	1	12		 ⲙ̅ⲡⲣ̅ⲕⲱϩ ϭⲉ ⲉⲡⲙⲟⲩ ϩⲛ̅ ⲧⲉⲡⲗⲁⲛⲏ ⲙ̅ⲡⲉⲧⲛ̅ⲱⲛϩ̅ ⲟⲩⲇⲉ ⲙ̅ⲡⲣ̅ⲥⲱⲕ ⲛⲏⲧⲛ̅ ⲙ̅ⲡⲧⲁⲕⲟ ϩⲛ̅ ⲛⲉϩⲃⲏⲩⲉ ⲛ̅ⲛⲉⲧⲛ̅ϭⲓϫ	 Seek not death in the error of your life: and pull not upon yourselves destruction with the works of your hands.	 µὴ ζηλοῦτε θάνατον ἐν πλάνῃ ζωῆς ὑµῶν µηδὲ ἐπισπᾶσθε ὄλεθρον ἐν ἔργοις χειρῶν ὑµῶν·						
Wisdom of Solomon	1	13		 ϫⲉ ⲙ̅ⲡⲉ ⲡⲛⲟⲩⲧⲉ ⲧⲁⲙⲓⲉ ⲡⲙⲟⲩ ⲟⲩⲇⲉ ⲛϥ̅ⲣⲁϣⲉ ⲁⲛ ⲉϫⲙ̅ ⲡⲧⲁⲕⲟ ⲛ̅ⲛⲉⲧⲟⲛϩ.	 For God made not death: neither hath he pleasure in the destruction of the living.	 ὅτι ὁ θεὸς θάνατον οὐκ ἐποίησεν οὐδὲ τέρπεται ἐπ’ ἀπωλείᾳ ζώντων.						
Wisdom of Solomon	1	14		 ⲛ̅ⲧⲁϥⲥⲟⲛⲧⲟⲩ ⲅⲁⲣ ⲧⲏⲣⲟⲩ ⲉⲧⲣⲉⲩϭⲱ ϣⲁⲃⲟⲗ ⲁⲩⲱ ⲉⲧⲣⲉⲩⲟⲩϫⲁⲓ̈ ⲛ̅ϭⲓ ⲛ̅ⲥⲱⲛⲧ ⲙ̅ⲡⲕⲟⲥⲙⲟⲥ: ⲙ̅ⲙⲛ̅ ⲡⲁϩⲣⲉ ⲙ̅ⲙⲟⲩ ϩⲣⲁⲓ̈ ⲛ̅ϩⲏⲧⲟⲩ ⲟⲩⲇⲉ ⲙ̅​ⲛⲧ​ⲉⲣⲟ ⲛ̅ⲁⲙⲛ̅ⲧⲉ ϩⲓϫⲙ̅ ⲡⲕⲁϩ.	 For he created all things, that they might have their being: and the generations of the world were healthful; and there is no poison of destruction in them, nor the kingdom of death upon the earth:	 ἔκτισεν γὰρ εἰς τὸ εἶναι τὰ πάντα, καὶ σωτήριοι αἱ γενέσεις τοῦ κόσµου, καὶ οὐκ ἔστιν ἐν αὐταῖς φάρµακον ὀλέθρου οὔτε ᾅδου βασίλειον ἐπὶ γῆς.						
Wisdom of Solomon	1	15		 ⲧⲇⲓⲕⲁⲓⲟⲥⲩⲛⲏ ⲅⲁⲣ ⲟⲩⲁⲧⲙⲟⲩ ⲧⲉ	 (For righteousness is immortal:)	 δικαιοσύνη γὰρ ἀθάνατός ἐστιν.						
Wisdom of Solomon	1	16		 ⲛ̅ⲁⲥⲉⲃⲏⲥ ⲇⲉ ϩⲛ̅ ⲛⲉⲩϭⲓϫ ⲙⲛ̅ ⲛⲉⲩϣⲁϫⲉ ⲁⲩⲥⲟⲧⲡϥ̅ ⲛⲁⲩ: ⲁⲩⲧⲁⲁϥ ⲛⲁⲩ ⲛ̅ϣⲃⲏⲣ ⲁⲩⲃⲱⲗ ⲉⲃⲟⲗ ⲁⲩⲥⲙⲓⲛⲉ ⲛ̅ⲟⲩⲇⲓⲁⲑⲏⲕⲏ ⲛⲉⲙⲁϥ ϫⲉ ⲥⲉⲙ̅ⲡϣⲁ ⲛ̅ⲧⲙⲉⲣⲓⲥ ⲙ̅ⲡⲉⲧⲙ̅ⲙⲁⲩ.	 But ungodly men with their works and words called it to them: for when they thought to have it their friend, they consumed to nought, and made a covenant with it, because they are worthy to take part with it.	 Ἀσεβεῖς δὲ ταῖς χερσὶν καὶ τοῖς λόγοις προσεκαλέσαντο αὐτόν, φίλον ἡγησάµενοι αὐτὸν ἐτάκησαν καὶ συνθήκην ἔθεντο πρὸς αὐτόν, ὅτι ἄξιοί εἰσιν τῆς ἐκείνου µερίδος εἶναι.						
Wisdom of Solomon	2	1		 ⲁⲩϫⲟⲟⲥ ⲅⲁⲣ ⲉⲁⲩⲙⲉⲉⲩⲉ ϩⲣⲁⲓ̈ ⲛ̅ϩⲏⲧⲟⲩ ϩⲛ̅ ⲟⲩⲥⲟⲟⲩⲧⲛ̅ ⲁⲛ ϫⲉ ⲟⲩⲕⲟⲩⲓ̈ ⲡⲉ ⲡⲉⲛⲁϩⲉ ⲉϥⲙⲉϩ ⲗ̅ⲗⲩⲡⲏ ⲁⲩⲱ ⲙ̅ⲙⲛ̅ ⲙ̅ⲧⲟⲛ ϣⲟⲟⲡ ϩⲙ̅ ⲡⲙⲟⲩ ⲙ̅ⲡⲣⲱⲙⲉ ⲟⲩⲇⲉ ⲙ̅ⲡⲛ̅ⲥⲟⲩⲛ̅ ⲟⲩⲁ ⲉⲁϥⲉⲓ ⲉϩⲣⲁⲓ̈ ϩⲛ̅ ⲁⲙⲛ̅ⲧⲉ	 For the ungodly said, reasoning with themselves, but not aright, Our life is short and tedious, and in the death of a man there is no remedy: neither was there any man known to have returned from the grave.	 εἶπον γὰρ ἐν ἑαυτοῖς λογισάµενοι οὐκ ὀρθῶς Ὀλίγος ἐστὶν καὶ λυπηρὸς ὁ βίος ἡµῶν, καὶ οὐκ ἔστιν ἴασις ἐν τελευτῇ ἀνθρώπου, καὶ οὐκ ἐγνώσθη ὁ ἀναλύσας ἐξ ᾅδου.						
Wisdom of Solomon	2	2		 ϫⲉ ⲛ̅ⲧⲁⲛϣⲱⲡⲉ ⲉⲡⲡⲉⲧϣⲟⲩⲉⲓⲧ ⲙⲛ̅ⲛ̅ⲥⲱⲥ ⲉⲛⲛⲁⲣ̅ ⲑⲉ ⲛ̅ⲛⲉⲧⲉ ⲙ̅ⲡⲟⲩϣⲱⲡⲉ: ϫⲉ ⲟⲩⲕⲁⲡⲛⲟⲥ ⲡⲉ ⲡⲛⲓϥⲉ ⲉⲧϩⲛ̅ ϣⲁⲛⲧⲛ̅ ⲁⲩⲱ ⲟⲩϯⲕ̅ ⲡⲉ ⲡϣⲁϫⲉ ⲉⲧⲕⲓⲙ ϩⲙ̅ ⲡⲉⲛϩⲏⲧ:	 For we are born at all adventure: and we shall be hereafter as though we had never been: for the breath in our nostrils is as smoke, and a little spark in the moving of our heart:	 ὅτι αὐτοσχεδίως ἐγενήθηµεν καὶ µετὰ τοῦτο ἐσόµεθα ὡς οὐχ ὑπάρξαντες· ὅτι καπνὸς ἡ πνοὴ ἐν ῥισὶν ἡµῶν, καὶ ὁ λόγος σπινθὴρ ἐν κινήσει καρδίας ἡµῶν,						
Wisdom of Solomon	2	3		 ⲡⲁⲓ̈ ⲉϥϣⲁⲛⲱϣⲙ̅ ⲉⲣⲉ ⲡⲥⲱⲙⲁ ⲧⲏⲣϥ̅ ⲛⲁⲣ̅ ⲑⲉ ⲛ̅ⲟⲩϫⲃ̅ⲃⲉⲥ ⲁⲩⲱ ⲡⲉⲛⲡⲛⲉⲩⲙⲁ ⲛⲁⲃⲱⲗ ⲉⲃⲟⲗ ⲛ̅ⲑⲉ ⲙ̅ⲡⲁⲏⲣ ⲉⲧϫⲟⲟⲣⲉ ⲉⲃⲟⲗ.	 Which being extinguished, our body shall be turned into ashes, and our spirit shall vanish as the soft air,	 οὗ σβεσθέντος τέφρα ἀποβήσεται τὸ σῶµα καὶ τὸ πνεῦµα διαχυθήσεται ὡς χαῦνος ἀήρ.						
Wisdom of Solomon	2	4		 ⲛ̅ⲥⲉⲣ̅ⲡⲱⲃϣ ⲙ̅ⲡⲉⲛⲣⲁⲛ ϩⲙ̅ ⲡⲉⲛⲟⲩⲟⲉⲓϣ ⲛ̅ⲧⲉⲧⲙ̅ ⲗⲁⲁⲩ ⲉⲣ ⲡⲙⲉⲉⲩⲉ ⲛ̅ⲛⲉⲛϩⲃⲏⲩⲉ ⲁⲩⲱ ⲡⲉⲛⲁϩⲉ ⲛⲁⲟⲩⲉⲓⲛⲉ ⲛ̅ⲑⲉ ⲛ̅ⲟⲩⲕⲗⲟⲟⲗⲉ ​ⲁⲩⲱ ϥⲛⲁϫⲱⲱⲣⲉ ⲉⲃⲟⲗ ⲛ̅ⲑⲉ ⲛ̅ⲟⲩⲛⲓϥⲉ ⲉⲁϥⲃⲱⲗ ⲉⲃⲟⲗ ϩⲓⲧⲛ̅ ⲡⲁⲕⲧⲓⲛ ⲙ̅ⲡⲣⲏ ⲁⲩⲱ ⲉⲁ ⲧⲉϥϩⲙ̅ⲙⲉ ϩⲣⲟϣ ⲉϫⲱϥ.	 And our name shall be forgotten in time, and no man shall have our works in remembrance, and our life shall pass away as the trace of a cloud, and shall be dispersed as a mist, that is driven away with the beams of the sun, and overcome with the heat thereof.	 καὶ τὸ ὄνοµα ἡµῶν ἐπιλησθήσεται ἐν χρόνῳ, καὶ οὐθεὶς µνηµονεύσει τῶν ἔργων ἡµῶν· καὶ παρελεύσεται ὁ βίος ἡµῶν ὡς ἴχνη νεφέλης καὶ ὡς ὁµίχλη διασκεδασθήσεται διωχθεῖσα ὑπὸ ἀκτίνων ἡλίου καὶ ὑπὸ θερµότητος αὐτοῦ βαρυνθεῖσα.						
Wisdom of Solomon	2	5		 ⲟⲩϩⲁⲉⲓⲃⲉⲥ ⲉⲁⲥⲟⲩⲉⲓⲛⲉ ⲡⲉ ⲡⲉⲛⲟⲩⲟⲉⲓϣ ⲁⲩⲱ ⲙ̅ⲙⲛ̅ ⲕⲧⲟ ϣⲟⲟⲡ ⲙ̅ⲡⲉⲛⲙⲟⲩ: ϫⲉ ⲁⲩⲧⲱⲱⲃⲉ ⲉⲣⲱⲟⲩ ⲁⲩⲱ ⲛ̅ⲛⲉ ⲗⲁⲁⲩ ⲕⲟⲧϥ̅	 For our time is a very shadow that passeth away; and after our end there is no returning: for it is fast sealed, so that no man cometh again.	 σκιᾶς γὰρ πάροδος ὁ καιρὸς ἡµῶν, καὶ οὐκ ἔστιν ἀναποδισµὸς τῆς τελευτῆς ἡµῶν, ὅτι κατεσφραγίσθη καὶ οὐδεὶς ἀναστρέφει.						
Wisdom of Solomon	2	6		 ⲁⲙⲏⲉⲓⲧⲛ̅ ϭⲉ ⲛ̅ⲧⲛ̅ⲧⲥⲓⲟⲛ ⲛ̅ⲛ̅ⲁⲅⲁⲑⲟⲛ ⲉⲧϣⲟⲟⲡ ⲛ̅ⲧⲛ̅ⲭⲣⲱ ⲛ̅ⲧⲉⲕⲧⲓⲥⲓⲥ ϩⲛ̅ ⲟⲩϭⲉⲡⲏ ⲛ̅ⲑⲉ ⲛ̅ⲟⲩⲙⲛ̅ⲧⲃⲣ̅ⲣⲉ.	 Come on therefore, let us enjoy the good things that are present: and let us speedily use the creatures like as in youth.	 δεῦτε οὖν καὶ ἀπολαύσωµεν τῶν ὄντων ἀγαθῶν καὶ χρησώµεθα τῇ κτίσει ὡς ἐν νεότητι σπουδαίως·						
Wisdom of Solomon	2	7		 ⲙⲁⲣⲛ̅ⲧⲥⲓⲟⲛ ⲛ̅ⲏⲣⲡ ⲉⲛⲁⲛⲟⲩϥ ϩⲓ ⲥⲧⲓ ⲛⲟⲩϥⲉ ⲁⲩⲱ ⲙ̅ⲡⲣ̅ⲧⲣⲉⲩ ⲥⲁⲁⲧⲛ̅ ⲛ̅ϭⲓ ⲛ̅ⲕⲁⲣⲡⲟⲥ ⲙ̅ⲡⲁⲏⲣ	 Let us fill ourselves with costly wine and ointments: and let no flower of the spring pass by us:	 οἴνου πολυτελοῦς καὶ µύρων πλησθῶµεν, καὶ µὴ παροδευσάτω ἡµᾶς ἄνθος ἔαρος·						
Wisdom of Solomon	2	8		 ⲙⲁⲣⲛ̅ϯ ⲉϫⲱⲛ ⲛ̅ϩⲛ̅ⲕⲗⲟⲙ ⲛ̅ⲟⲩⲣⲧ̅ ⲉⲙⲡⲁⲧⲟⲩϩⲱϭⲃ̅:	 Let us crown ourselves with rosebuds, before they be withered:	 στεψώµεθα ῥόδων κάλυξιν πρὶν ἢ µαρανθῆναι·						
Wisdom of Solomon	2	9		 ⲙ̅ⲡⲣ̅ ⲧⲣⲉ ⲗⲁⲁⲩ ⲙ̅ⲙⲟⲛ ϣⲱⲡⲉ ⲙ̅ⲡⲃⲟⲗ ⲛ̅ⲛⲉⲛⲙⲛ̅ⲧϣⲛⲁ: ⲙⲁⲣⲛ̅ⲕⲁ ⲥⲩⲙⲃⲟⲩⲗⲏ ⲛ̅ⲟⲩⲛⲟϥ ϩⲙ̅ ⲙⲁ ⲛⲓⲙ: ϫⲉ ⲧⲁⲓ̈ ⲧⲉ ⲧⲉⲛ̅ⲙⲉⲣⲓⲥ ⲁⲩⲱ ⲡⲉⲛⲕⲗⲏⲣⲟⲥ.	 Let none of us go without his part of our voluptuousness: let us leave tokens of our joyfulness in every place: for this is our portion, and our lot is this.	 µηδεὶς ἡµῶν ἄµοιρος ἔστω τῆς ἡµετέρας ἀγερωχίας, πανταχῇ καταλίπωµεν σύµβολα τῆς εὐφροσύνης, ὅτι αὕτη ἡ µερὶς ἡµῶν καὶ ὁ κλῆρος οὗτος.						
Wisdom of Solomon	2	10		 ⲟⲩϩⲏⲕⲉ ⲛ̅ⲇⲓⲕⲁⲓⲟⲥ ⲙⲁⲣⲛ̅ϫⲓⲧϥ̅ ⲛ̅ϭⲟⲛⲥ̅: ⲙ̅ⲡⲣ̅ⲧⲣⲉⲛϯⲥⲟ ⲉⲧⲉⲭⲏⲣⲁ ⲟⲩⲇⲉ ⲙ̅ⲡⲣ̅ⲧⲣⲉⲛϣⲓⲡⲉ ϩⲏⲧⲟⲩ ⲛ̅ⲛⲉⲥⲕⲓⲙ ⲛ̅ⲟⲩϩⲗⲗⲟ ⲛ̅ⲛⲟϭ ⲛ̅ⲁϩⲉ.	 Let us oppress the poor righteous man, let us not spare the widow, nor reverence the ancient gray hairs of the aged.	 καταδυναστεύσωµεν πένητα δίκαιον, µὴ φεισώµεθα χήρας µηδὲ πρεσβύτου ἐντραπῶµεν πολιὰς πολυχρονίους·						
Wisdom of Solomon	2	11		 ⲙⲁⲣⲉ ⲧⲉⲛϭⲟⲙ ϣⲱⲡⲉ ⲛⲁⲛ ⲛ̅ⲛⲟⲙⲟⲥ ⲛ̅ⲇⲓⲕⲁⲓⲟⲥⲩⲛⲏ: ⲧⲙⲛ̅ⲧϭⲱⲃ ⲅⲁⲣ ⲉϣⲁⲩϫⲡⲓⲟⲥ ϩⲱⲥ ⲁⲧϣⲁⲩ.	 Let our strength be the law of justice: for that which is feeble is found to be nothing worth.	 ἔστω δὲ ἡµῶν ἡ ἰσχὺς νόµος τῆς δικαιοσύνης, τὸ γὰρ ἀσθενὲς ἄχρηστον ἐλέγχεται.						
Wisdom of Solomon	2	12	 ⲉϥⲉ̀ϫⲟⲣϫϥ ⲛ̀ⲟⲩⲭⲣⲱⲙ ⲉⲑⲃⲉϫⲉ ⲙ̀ⲡⲉϥϯϩⲟⲗϫ ⲙ̀ⲡⲉⲛϩⲏⲧ ⲟⲩⲟϩ ⲉ̀ϯ ⲉ̀ϩⲣⲉⲛ ⲛⲉⲛϩⲃⲏⲟⲩⲓ ⲟⲩⲟϩ ⲉ̀ϯϣⲱϣ ⲛⲁⲛ ⲉ̀ϫⲉⲛ ⲛⲉⲛϣⲱϥⲧ ⲉ̀ϫⲉⲛ ⲡⲓⲛⲟⲙⲟⲥ ⲉϥⲉ̀ⲟⲩⲱⲛϩ ⲉ̀ϩⲣⲏⲓ ⲉ̀ϫⲱⲛ ⲉ̀ϫⲉⲛ ⲛⲓⲛⲟⲃⲓ ⲛ̀ⲧⲉ ϯⲙⲉⲧⲁⲧⲑⲱⲧ ⲛ̀ϩⲏⲧ	 ⲙⲁⲣⲛ̅ϭⲱⲣϭ̅ ⲉⲡⲇⲓⲕⲁⲓⲟⲥ ϫⲉ ϥⲙⲟⲕϩ̅ ⲉⲣ̅ⲭⲣⲏⲥⲧⲟⲥ ⲛⲁⲛ ⲁⲩⲱ ϥϯ ⲟⲩⲃⲉ ⲛⲉⲛϩⲃⲏⲩⲉ: ϥⲛⲟϭⲛⲉϭ ⲙ̅ⲙⲟⲛ ⲛ̅ⲛⲉⲛⲛⲟⲃⲉ ϩⲓⲧⲙ̅ ⲡⲛⲟⲙⲟⲥ ⲁⲩⲱ ϥⲟⲩⲱⲛϩ̅ ⲉⲃⲟⲗ ⲛ̅ⲛⲉⲛⲛⲟⲃⲉ ϩⲓⲧⲛ̅ ⲧⲉⲥⲃⲱ.	 Therefore let us lie in wait for the righteous; because he is not for our turn, and he is clean contrary to our doings: he upbraideth us with our offending the law, and objecteth to our infamy the transgressings of our education.	 ἐνεδρεύσωµεν τὸν δίκαιον, ὅτι δύσχρηστος ἡµῖν ἐστιν καὶ ἐναντιοῦται τοῖς ἔργοις ἡµῶν καὶ ὀνειδίζει ἡµῖν ἁµαρτήµατα νόµου καὶ ἐπιφηµίζει ἡµῖν ἁµαρτήµατα παιδείας ἡµῶν·						
Wisdom of Solomon	2	13	 ⲟⲩⲟϩ ⲉ̀ⲟⲩⲟⲛ ⲉⲙⲓ ⲛⲉⲙⲁϥ ⲉ̀ⲃⲟⲗ ϩⲓⲧⲉⲛ ⲫϯ ⲉⲩⲉ̀ⲙⲟⲩϯ ⲉ̀ⲣⲟϥ ϫⲉ ⲡϣⲏⲣⲓ ⲙ̀ⲫϯ	 ϥϫⲱ ⲙ̅ⲙⲟⲥ ϫⲉ ϯⲥⲟⲟⲩⲛ ⲙ̅ⲡⲛⲟⲩⲧⲉ ⲁⲩⲱ ϥⲉⲓⲣⲉ ⲙ̅ⲙⲟϥ ⲛ̅ϣⲏⲣⲉ ⲙ̅ⲡⲉⲛϫⲟⲉⲓⲥ.	 He professeth to have the knowledge of God: and he calleth himself the child of the Lord.	 ἐπαγγέλλεται γνῶσιν ἔχειν θεοῦ καὶ παῖδα κυρίου ἑαυτὸν ὀνοµάζει·						
Wisdom of Solomon	2	14	 ⲉϥⲉ̀ϣⲱⲡⲓ ⲛⲁⲛ ⲛ̀ⲟⲩⲣⲉϥⲥⲟϩⲓ ⲉ̀ϫⲉⲛ ⲛⲉⲛⲟⲩⲱϣ ⲉϥⲉ̀ⲟⲩⲱⲛϩ ⲉ̀ϩⲣⲏⲓ ⲉ̀ϫⲱⲛ ⲉ̀ⲡϫⲓⲛⲛⲁⲩ ⲉ̀ⲣⲟϥ	 ϣⲁϥϣⲱⲡⲉ ⲛⲁⲛ ⲉⲩϫⲡⲓⲟ ⲛ̅ⲛⲉⲛⲙⲉⲉⲩⲉ: ϥϩⲟⲣϣ̅ ⲛⲁⲛ ⲉⲛⲁⲩ ⲉⲣⲟϥ.	 He was made to reprove our thoughts.	 ἐγένετο ἡµῖν εἰς ἔλεγχον ἐννοιῶν ἡµῶν, βαρύς ἐστιν ἡµῖν καὶ βλεπόµενος,						
Wisdom of Solomon	2	15	 ⲉⲑⲃⲉϫⲉ ⲡⲉϥⲗⲁⲟⲥ ⲟⲛⲓ ⲛ̀ⲕⲉⲟⲩⲁⲓ ⲁⲛ ⲟⲩⲟϩ ⲛⲉϥⲙⲱⲓⲧ ⲥⲉⲫⲱⲛϩ ⲛ̀ⲧⲟⲧⲉⲛ	 ϫⲉ ⲙ̅ⲡⲉϥⲃⲓⲟⲥ ⲉⲓⲛⲉ ⲁⲛ ⲙ̅ⲡⲁ ⲟⲩⲟⲛ ⲛⲓⲙ ⲁⲩⲱ ⲛⲉϥϩⲓⲟⲟⲩⲉ ⲥⲉϣⲟⲃⲉ.	 He is grievous unto us even to behold: for his life is not like other men’s, his ways are of another fashion.	 ὅτι ἀνόµοιος τοῖς ἄMοις ὁ βίος αὐτοῦ, καὶ ἐξηλλαγµέναι αἱ τρίβοι αὐτοῦ·						
Wisdom of Solomon	2	16	 ⲟⲩⲟϩ ⲛⲏⲡ ⲛ̀ⲧⲟⲧϥ ϫⲉ ϧⲁⲉ̀ ⲉϥⲉ̀ⲟⲩⲉⲓ ⲛ̀ⲛⲉⲛⲙⲱⲓⲧ ⲙ̀ⲫⲣⲏϯ ⲉⲧⲉϥⲟⲩⲉⲓ ⲙ̀ⲙⲟϥ ⲛ̀ⲛⲓⲑⲏⲣⲓⲟⲛ ⲉϥⲉ̀ⲙⲃⲟⲛ ⲉ̀ϫⲉⲛ ϩⲁⲛⲟⲩⲟⲛ ⲛ̀ⲧⲉ ⲛⲓⲉⲗⲉⲩⲑⲉⲣⲟⲥ ⲟⲩⲟϩ ⲉϥⲉ̀ϣⲟⲩϣⲟⲩ ⲙ̀ⲙⲟϥ ϫⲉ ⲫϯ ⲡⲉ ⲡⲉϥⲓⲱⲧ	 ⲉⲛⲏⲡ ⲛ̅ⲧⲟⲟⲧϥ̅ ⲉϩⲉⲛϫⲟⲟⲩⲧ ⲁⲩⲱ ϥⲥⲁϩⲏⲩ ⲉⲃⲟⲗ ⲛ̅ⲛⲉⲛϩⲓⲟⲟⲩⲉ ⲛ̅ⲑⲉ ⲛ̅ⲛⲓⲁⲕⲁⲑⲁⲣⲥⲓⲁ: ϥ̅ⲙⲁⲕⲁⲣⲓⲍⲉ ⲛ̅ⲑⲁⲏ ⲛ̅ⲛ̅ⲇⲓⲕⲁⲓⲟⲥ ⲁⲩⲱ ϥϣⲟⲩϣⲟⲩ ⲙ̅ⲙⲟϥ ϫⲉ ⲡⲁⲓ̈ⲱⲧ ⲡⲉ ⲡⲛⲟⲩⲧⲉ.	 We are esteemed of him as counterfeits: he abstaineth from our ways as from filthiness: he pronounceth the end of the just to be blessed, and maketh his boast that God is his father.	 εἰς κίβδηλον ἐλογίσθηµεν αὐτῷ, καὶ ἀπέχεται τῶν ὁδῶν ἡµῶν ὡς ἀπὸ ἀκαθαρσιῶν· µακαρίζει ἔσχατα δικαίων καὶ ἀλαζονεύεται πατέρα θεόν.						
Wisdom of Solomon	2	17	 ⲧⲉⲛϫⲟⲩϣⲧ ϫⲉ ⲁⲣⲏⲟⲩ ⲁϥⲥⲁϫⲓ ϩⲁⲛⲙⲏⲓⲛⲉ ⲉⲩⲉⲣⲇⲟⲕⲓⲙⲁⲍⲓⲛ ⲙ̀ⲫⲏ ⲉⲑⲛⲁϣⲱⲡⲓ ⲙⲉⲛⲉⲛⲥⲁ ⲡⲉϥϫⲱⲕ ⲉ̀ⲃⲟⲗ	 ⲙⲁⲣⲛ̅ⲛⲁⲩ ϫⲉ ϩⲙ̅ⲙⲉ ⲛⲉ ⲛⲉϥϣⲁϫⲉ ⲁⲩⲱ ⲛ̅ⲧⲛ̅ⲡⲉⲓⲣⲁⲍⲉ ⲛ̅ⲧⲉϥϩⲁⲏ.	 Let us see if his words be true: and let us prove what shall happen in the end of him.	 ἴδωµεν εἰ οἱ λόγοι αὐτοῦ ἀληθεῖς, καὶ πειράσωµεν τὰ ἐν ἐκβάσει αὐτοῦ·						
Wisdom of Solomon	2	18	 ϫⲉ ⲛⲉ ⲟⲩϣⲏⲣⲓ ⲡⲉ ⲫϯ ϧⲉⲛ ⲟⲩⲙⲉⲑⲙⲏⲓ ⲉϥⲉ̀ⲛⲟϩⲉⲙ ⲛ̀ⲧⲉϥⲯⲩⲭⲏ ⲉϥⲉ̀ⲥⲟⲧⲥ ϧⲉⲛ ⲛⲉⲛϫⲓϫ ⲛ̀ⲛⲓⲁⲛⲧⲓⲕⲓⲙⲉⲛⲟⲥ	 ⲉϣϫⲉ ⲡⲇⲓⲕⲁⲓⲟⲥ ⲅⲁⲣ ⲡⲉ ⲡϣⲏⲣⲉ ⲙ̅ⲡⲛⲟⲩⲧⲉ ϥⲛⲁϣⲟⲡϥ̅ ⲉⲣⲟϥ ⲛϥ̅ⲛⲁϩⲙⲉϥ ⲛ̅ⲧⲟⲟⲧⲟⲩ ⲛ̅ⲛⲉⲧϯ ⲟⲩⲃⲏϥ.	 For if the just man be the son of God, he will help him, and deliver him from the hand of his enemies.	 εἰ γάρ ἐστιν ὁ δίκαιος υἱὸς θεοῦ, ἀντιλήµψεται αὐτοῦ καὶ ῥύσεται αὐτὸν ἐκ χειρὸς ἀνθεστηκότων.						
