book	chapter	verse	Bohairic	Sahidic	English	Greek	Fayyumic	Akhmimic	OldBohairic	Mesokemic	DialectP	Lycopolitan
Wisdom of Solomon	14	28	 	 ⲏ ⲅⲁⲣ ⲥⲉⲗⲟⲃⲉ ϩⲁ ⲡϯϩⲉ ⲏ ⲥⲉⲡⲣⲟⲫⲏⲧⲉⲩⲉ ⲛ̅ⲛⲟⲩϫ ⲥⲟⲛϩ ϩⲛ̅ ⲟⲩϫⲓⲛ̅ϭⲟⲛⲥ̅ ⲏ ⲥⲉϭⲉⲡⲏ ⲉⲱⲣⲕ̅ ⲛ̅ⲛⲟⲩϫ.	 For either they are mad when they be merry, or prophesy lies, or live unjustly, or else lightly forswear themselves.	 ἢ γὰρ εὐφραινόµενοι µεµήνασιν ἢ προφητεύουσιν ψευδῆ ἢ ζῶσιν ἀδίκως ἢ ἐπιορκοῦσιν ταχέως·						
Wisdom of Solomon	14	29	 	 ⲉⲩⲕⲱ ⲅⲁⲣ ⲛ̅ϩⲧⲏⲩ ⲉϩⲛ̅ⲉⲓⲇⲱⲗⲟⲛ ⲉⲩⲙⲟⲟⲩⲧ ⲥⲉⲱⲣⲕ̅ ⲕⲁⲕⲱⲥ ⲛ̅ⲥⲉⲣ̅ϩⲟⲧⲉ ⲁⲛ ϫⲉ ⲛ̅ⲛⲉ ⲡⲉⲑⲟⲟⲩ ⲧⲁϩⲟⲟⲩ.	 For insomuch as their trust is in idols, which have no life; though they swear falsely, yet they look not to be hurt.	 ἀψύχοις γὰρ πεποιθότες εἰδώλοις κακῶς ὀµόσαντες ἀδικηθῆναι οὐ προσδέχονται.						
Wisdom of Solomon	14	30	 	 ⲫⲁⲡ ⲛⲁⲧⲁϩⲟⲟⲩ ⲙ̅ⲡⲉⲙ̅ϣⲁ ⲙ̅ⲫⲱⲃ ⲥⲛⲁⲩ ϫⲉ ⲁⲩⲙⲉⲉⲩⲉ ⲕⲁⲕⲱⲥ ⲉϩⲟⲩⲛ ⲉⲡⲛⲟⲩⲧⲉ ⲉⲩⲕⲱ ⲛ̅ϩⲧⲏⲩ ⲉϩⲛ̅ⲉⲓⲇⲱⲗⲟⲛ ⲁⲩⲱ ⲉⲩⲱⲣⲕ̅ ⲕⲁⲕⲱⲥ ϩⲛ̅ ⲟⲩϫⲓⲛ̅ϭⲟⲛⲥ̅ ⲙⲛ̅ ⲟⲩⲕⲣⲟϥ ⲉⲁⲩⲕⲁⲧⲁⲫⲣⲟⲛⲉⲓ ⲛ̅ⲧⲉⲕⲣⲓⲥⲓⲥ.	 Howbeit for both causes shall they be justly punished: both because they thought not well of God, giving heed unto idols, and also unjustly swore in deceit, despising holiness.	 ἀµφότερα δὲ αὐτοὺς µετελεύσεται τὰ δίκαια, ὅτι κακῶς ἐφρόνησαν περὶ θεοῦ προσέχοντες εἰδώλοις καὶ ἀδίκως ὤµοσαν ἐν δόλῳ καταφρονήσαντες ὁσιότητος·						
Wisdom of Solomon	14	31	 	 ............. ⲙ̅ⲙⲟⲟⲩ ⲁⲗⲗⲁ ⲫⲁⲡ ⲛ̅ⲛⲉⲧⲣ̅ⲛⲟⲃⲉ ... ϣⲁϥⲉⲓ ⲛ̅ⲥⲟⲡ ⲛⲓⲙ ⲉϫⲛ̅ ⲧⲡⲁⲣⲁⲃⲁⲥⲓⲥ ⲛ̅ⲣ̅ⲣⲉϥϫⲓⲛ̅ϭⲟⲛⲥ̅.	 For it is not the power of them by whom they swear: but it is the just vengeance of sinners, that punisheth always the offence of the ungodly.	 οὐ γὰρ ἡ τῶν ὀµνυµένων δύναµις, ἀλλ’ ἡ τῶν ἁµαρτανόντων δίκη ἐπεξέρχεται ἀεὶ τὴν τῶν ἀδίκων παράβασιν.						
Wisdom of Solomon	15	1	 	 ⲛ̅ⲧⲟⲕ ⲇⲉ ⲡⲛⲟⲩⲧⲉ ⲛ̅ⲧⲕ̅ ⲟⲩⲭⲣⲏⲥⲧⲟⲥ ⲁⲩⲱ ⲛ̅ⲧⲕ̅ ⲟⲩⲙⲉ ⲛ̅ⲧⲕ̅ ⲟⲩϩⲁⲣϣ̅ ϩⲏⲧ ⲉⲕⲥⲙⲓⲛⲉ ⲙ̅ⲡⲧⲏⲣϥ̅ ϩⲛ̅ ⲧⲱϣ ϩⲓ ⲛⲁ.	 But thou, O God, art gracious and true, longsuffering, and in mercy ordering all things,	 Σὺ δέ, ὁ θεὸς ἡµῶν, χρηστὸς καὶ ἀληθής, µακρόθυµος καὶ ἐλέει διοικῶν τὰ πάντα.						
Wisdom of Solomon	15	2	 	 ⲕⲁⲛ ⲉⲛϣⲁⲛⲣ̅ⲛⲟⲃⲉ ⲁⲛⲟⲛ ⲡⲉⲧⲉⲛⲱⲕ ⲛⲉ ⲉⲛⲥⲟⲟⲩⲛ̅ ⲛ̅ⲧⲉⲕⲁⲙⲁϩⲧⲉ: ⲛ̅ⲧⲛ̅ⲛⲁⲣ̅ⲛⲟⲃⲉ ⲁⲛ ⲉⲛⲥⲟⲟⲩⲛ̅ ϫⲉ ⲉⲛⲏⲡ ⲉⲣⲟⲕ.	 For if we sin, we are thine, knowing thy power: but we will not sin, knowing that we are counted thine.	 καὶ γὰρ ἐὰν ἁµάρτωµεν, σοί ἐσµεν, εἰδότες σου τὸ κράτος· οὐχ ἁµαρτησόµεθα δέ, εἰδότες ὅτι σοὶ λελογίσµεθα.						
Wisdom of Solomon	15	3	 	 ⲟⲩⲇⲓⲕⲁⲓⲟⲥⲩⲛⲏ ⲅⲁⲣ ⲉⲥϫⲏⲕ ⲉⲃⲟⲗ ⲡⲉ ⲡⲥⲟⲩⲱⲛⲅ̅ ⲁⲩⲱ ⲧⲛⲟⲩⲛⲉ ⲙ̅ⲡⲱⲛϩ̅ ⲡⲉ ⲡⲥⲟⲟⲩⲛ̅ ⲙ̅ⲡⲉⲕⲁⲙⲁϩⲧⲉ.	 For to know thee is perfect righteousness: yea, to know thy power is the root of immortality.	 τὸ γὰρ ἐπίστασθαί σε ὁλόκληρος δικαιοσύνη, καὶ εἰδέναι σου τὸ κράτος ῥίζα ἀθανασίας.						
Wisdom of Solomon	15	4	 	 ⲟⲩⲧⲉ ⲅⲁⲣ ⲙ̅ⲡⲥⲡ̅ⲗⲁⲛⲁ ⲙ̅ⲙⲟⲛ ⲛ̅ϭⲓ ⲧⲉϩⲓⲏ ⲉⲑⲟⲟⲩ ⲙⲛ̅ ⲡⲙⲉⲉⲩⲉ ⲛ̅ⲣ̅ⲣⲱⲙⲉ ⲟⲩⲧⲉ ⲡϩⲓⲥⲉ ⲛ̅ⲁⲧⲕⲁⲣⲡⲟⲥ ⲛ̅ⲣ̅ⲣⲉϥⲥⲉϩ ϩⲁⲉⲓⲃⲉⲥ ⲙⲛ̅ ⲛⲉⲥⲙⲟⲧ ⲉⲧϫⲏϩ ϩⲉⲛⲁⲩⲁⲛ ⲉⲩϣⲟⲃⲉ.	 For neither did the mischievous invention of men deceive us, nor an image spotted with divers colours, the painter’s fruitless labour;	 οὔτε γὰρ ἐπλάνησεν ἡµᾶς ἀνθρώπων κακότεχνος ἐπίνοια οὐδὲ σκιαγράφων πόνος ἄκαρπος, εἶδος σπιλωθὲν χρώµασιν διηλλαγµένοις,						
Wisdom of Solomon	15	5	 	 ⲛⲁⲓ̈ ⲉⲧⲉ ϣⲁⲣⲉ ⲛ̅ⲁⲑⲏⲧ ⲉⲡⲓⲑⲩⲙⲓ ⲉⲣⲟⲟⲩ. ⲉⲩⲙⲉ ⲙ̅ⲡⲓⲛⲉ ⲛ̅ⲑⲓⲕⲱⲛ ⲉⲧⲙⲟⲟⲩⲧ ⲉⲧⲉ ⲙⲛ̅ ⲡⲛⲉⲩⲙⲁ ⲛ̅ϩⲏⲧⲥ̅	 The sight whereof enticeth fools to lust after it, and so they desire the form of a dead image, that hath no breath.	 ὧν ὄψις ἄφροσιν εἰς ὄρεξιν ἔρχεται, ποθεῖ τε νεκρᾶς εἰκόνος εἶδος ἄπνουν.						
Wisdom of Solomon	15	6	 	 ⲉⲩⲟ ⲙ̅ⲙⲁⲓ̈ ⲛ̅ⲉⲑⲟⲟⲩ. ⲉⲩⲙ̅ⲡϣⲁ ⲛ̅ⲛ̅ϩⲉⲗⲡⲓⲥ ⲛ̅ⲧⲉⲓ̈ⲙⲓⲛⲉ ⲛ̅ϭⲓ ⲛⲉⲧⲧⲁⲙⲓⲟ ⲙ̅ⲙⲟⲟⲩ ⲙⲛ̅ ⲛⲉⲧϣⲙ̅ϣⲉ ⲛⲁⲩ.	 Both they that make them, they that desire them, and they that worship them, are lovers of evil things, and are worthy to have such things to trust upon.	 κακῶν ἐρασταὶ ἄξιοί τε τοιούτων ἐλπίδων καὶ οἱ δρῶντες καὶ οἱ ποθοῦντες καὶ οἱ σεβόµενοι.						
Wisdom of Solomon	15	7	 	 ⲕⲁⲓ ⲅⲁⲣ ⲟⲩⲕⲉⲣⲁⲙⲉⲩⲥ ⲉϥϩⲓⲥⲉ ⲙ̅ⲙⲟϥ ⲉϥⲟⲩⲱϣⲙ̅ ⲙ̅ⲡⲟⲙⲉ ϥ̅ⲡⲗⲁⲥⲥⲉ ⲙ̅ⲡⲟⲩⲁ ⲡⲟⲩⲁ ⲛ̅ⲛⲉϩⲛⲁⲁⲩ ⲙ̅ⲡⲉⲛϣⲙ̅ϣⲉ: ϩⲟⲉⲓⲛⲉ ⲙⲉⲛ ⲉⲛ ...... ϩⲟⲉⲓⲛⲉ ⲇⲉ ⲉ​ⲛⲉⲧⲥⲏϣ ⲉⲃⲟⲗ ϩⲙ̅ ⲡⲓⲟⲙⲉ ⲛ̅ⲟⲩⲱⲧ: ⲡⲉⲧⲣ̅ϩⲱⲃ ⲇⲉ ⲙ̅ⲙⲟⲟⲩ ⲡⲉⲧⲥⲟⲟⲩⲛ̅ ϫⲉ ⲟⲩ ⲧⲉ ⲧⲉⲭⲣⲓⲁ ⲙ̅ⲡⲟⲩⲁ ⲡⲟⲩⲁ.	 For the potter, tempering soft earth, fashioneth every vessel with much labour for our service: yea, of the same clay he maketh both the vessels that serve for clean uses, and likewise also all such as serve to the contrary: but what is the use of either sort, the potter himself is the judge.	 Καὶ γὰρ κεραµεὺς ἁπαλὴν γῆν θλίβων ἐπίµοχθον πλάσσει πρὸς ὑπηρεσίαν ἡµῶν ἓν ἕκαστον· ἀλλ’ ἐκ τοῦ αὐτοῦ πηλοῦ ἀνεπλάσατο τά τε τῶν καθαρῶν ἔργων δοῦλα σκεύη τά τε ἐναντία, πάντα ὁµοίως· τούτων δὲ ἑτέρου τίς ἑκάστου ἐστὶν ἡ χρῆσις, κριτὴς ὁ πηλουργός.						
Wisdom of Solomon	15	8	 	 ⲁⲩⲱ ⲡⲣⲉϥϩⲁⲥⲧϥ̅ ⲉⲡⲡⲉⲑⲟⲟⲩ ⲉⲃⲟⲗ ϩⲙ̅ ⲡⲓⲟⲙⲉ ⲛ̅ⲟⲩⲱⲧ ⲁϥⲡⲗⲁⲥⲥⲉ ⲛ̅ⲟⲩⲛⲟⲩⲧⲉ ⲡⲁⲓ̈ ⲉⲛⲧⲁⲩⲧⲁⲙⲓⲟϥ ⲉⲃⲟⲗ ϩⲙ̅ ⲡⲕⲁϩ ϩⲁⲑⲏ ⲛ̅ⲟⲩⲕⲟⲩⲓ̈ ⲙⲛ̅ⲛ̅ⲥⲁ ⲕⲉⲕⲟⲩⲓ̈ ⲉϥⲛⲁⲃⲱⲕ ⲉⲡⲙⲁ ⲛ̅ⲧⲁϥⲉⲓ ⲉⲃⲟⲗ ⲛ̅ϩⲏⲧϥ̅ ⲉⲁⲩϥⲓ ⲧⲉϥⲯⲩⲭⲏ ⲛ̅ⲧⲟⲟⲧϥ̅.	 And employing his labours lewdly, he maketh a vain god of the same clay, even he which a little before was made of earth himself, and within a little while after returneth to the same, out when his life which was lent him shall be demanded.	 καὶ κακόµοχθος θεὸν µάταιον ἐκ τοῦ αὐτοῦ πλάσσει πηλοῦ ὃς πρὸ µικροῦ ἐκ γῆς γενηθεὶς µετ’ ὀλίγον πορεύεται ἐξ ἧς ἐλήµφθη, τὸ τῆς ψυχῆς ἀπαιτηθεὶς χρέος.						
Wisdom of Solomon	15	9	 	 ⲁⲗⲗⲁ ⲛⲉϥϥⲓⲣⲟⲟⲩϣ ⲁⲛ ϫⲉ ⲉϥⲛⲁⲙⲟⲩ ⲏ ϫⲉ ⲟⲩⲕⲟⲩⲓ̈ ⲡⲉ ⲡⲉϥⲁϩⲉ ⲁⲗⲗⲁ ⲉϥϯⲧⲱⲛ ⲙⲛ̅ ⲛ̅ϩⲁⲩⲛⲟⲩⲃ ⲙⲛ̅ ⲛ̅ⲣⲉϥⲣ̅ϩⲁⲧ ⲙⲛ̅ ⲛ̅ⲥⲁ ⲛ̅ϩⲟⲙⲛ̅ⲧ ⲉϥϣⲟⲩϣⲟⲩ ⲙ̅ⲙⲟϥ ϫⲉ ⲉϥⲧⲁⲙⲓⲉ ⲥⲙⲟⲧ ⲃ̅ⲃⲗ̅ϫⲉ.	 Notwithstanding his care is, not that he shall have much labour, nor that his life is short: but striveth to excel goldsmiths and silversmiths, and endeavoureth to do like the workers in brass, and counteth it his glory to make counterfeit things.	 ἀλλ’ ἔστιν αὐτῷ φροντὶς οὐχ ὅτι µέλλει κάµνειν οὐδ’ ὅτι βραχυτελῆ βίον ἔχει, ἀλλ’ ἀντερείδεται µὲν χρυσουργοῖς καὶ ἀργυροχόοις χαλκοπλάστας τε µιµεῖται καὶ δόξαν ἡγεῖται ὅτι κίβδηλα πλάσσει.						
Wisdom of Solomon	15	10	 	 ⲉⲩⲕⲣ̅ⲙⲉⲥ ⲡⲉ ⲡⲉϥϩⲏⲧ ⲁⲩⲱ ⲧⲉϥϩⲉⲗⲡⲓⲥ ⲥⲟϣϥ̅ ⲉⲩⲕⲁϩ ⲁⲩⲱ ⲡⲉϥⲱⲛϩ̅ ⲥⲏϣ ⲉⲩⲟⲙⲉ	 His heart is ashes, his hope is more vile than earth, and his life of less value than clay:	 σποδὸς ἡ καρδία αὐτοῦ, καὶ γῆς εὐτελεστέρα ἡ ἐλπὶς αὐτοῦ, πηλοῦ τε ἀτιµότερος ὁ βίος αὐτοῦ,						
Wisdom of Solomon	15	11	 	 ⲉⲃⲟⲗ ϫⲉ ⲙ̅ⲡϥ̅ⲥⲟⲩⲛ ⲡⲉⲛⲧⲁϥⲡⲗⲁⲥⲥⲉ ⲙ̅ⲙⲟϥ ⲡⲉⲛⲧⲁϥⲛⲓϥⲉ ⲉϩⲟⲩⲛ ⲉϩⲣⲁϥ ⲛ̅ⲟⲩⲯⲩⲭⲏ ⲉⲥⲉⲛⲉⲣⲅⲉⲓ ⲁⲩⲱ ⲡⲉⲛⲧⲁϥϯ ⲛⲁϥ ⲛ̅ⲟⲩⲡⲛⲉⲩⲙⲁ ⲛ̅ⲱⲛϩ̅:	 Forasmuch as he knew not his Maker, and him that inspired into him an active soul, and breathed in a living spirit.	 ὅτι ἠγνόησεν τὸν πλάσαντα αὐτὸν καὶ τὸν ἐµπνεύσαντα αὐτῷ ψυχὴν ἐνεργοῦσαν καὶ ἐµφυσήσαντα πνεῦµα ζωτικόν,						
Wisdom of Solomon	15	12	 	 ⲁⲗⲗⲁ ⲛ̅ⲧⲁϥⲙⲉⲉⲩⲉ ϫⲉ ⲟⲩϣⲟⲩⲥⲱⲃⲉ ⲙ̅ⲙⲟϥ ⲡⲉ ⲡⲉⲛⲱⲛϩ̅ ⲁⲩⲱ ⲡⲉⲛⲁϩⲉ ⲛ̅ⲑⲉ ⲛ̅ⲟⲩϣⲁ ⲛ̅ϯϩⲏⲩ: ...............ϩⲏⲩ ⲛ̅ϩⲱⲃ ⲛⲓⲙ ....... ⲡⲉⲑⲟⲟⲩ.	 But they counted our life a pastime, and our time here a market for gain: for, say they, we must be getting every way, though it be by evil means.	 ἀλλ’ ἐλογίσαντο παίγνιον εἶναι τὴν ζωὴν ἡµῶν καὶ τὸν βίον πανηγυρισµὸν ἐπικερδῆ, δεῖν γάρ φησιν ὅθεν δή, κἂν ἐκ κακοῦ, πορίζειν.						
Wisdom of Solomon	15	13	 	 ⲡⲁⲓ̈ ⲅⲁⲣ ⲥⲟⲟⲩⲛ̅ ⲉϩⲟⲩ[ⲟ ⲛ̅ⲟⲩⲟⲛ ⲛⲓⲙ ϫⲉ ϥⲣ̅ⲛⲟⲃⲉ ⲉϥⲧⲁⲙⲓⲟ ⲛ̅ϩⲛ̅ⲙⲟⲩⲛⲅ̅ ... ⲉⲩⲛⲁⲟⲩⲱϭⲡ̅ ⲉⲃⲟⲗ ϩⲛ̅ ⲑⲩⲗⲏ ⲙ̅ⲡⲕⲁϩ.	 For this man, that of earthly matter maketh brittle vessels and graven images, knoweth himself to offend above all others.	 οὗτος γὰρ παρὰ πάντας οἶδεν ὅτι ἁµαρτάνει ὕλης γεώδους εὔθραυστα σκεύη καὶ γλυπτὰ δηµιουργῶν.						
Wisdom of Solomon	15	14	 	 ϩⲛ̅ⲉⲃⲓⲏⲛ ⲛⲉ ⲁⲩⲱ ⲛ̅ⲁⲑⲏⲧ ⲛⲉ ⲉϩⲟⲩⲉ ⲟⲩⲯⲩⲭⲏ ⲛ̅ϣⲏⲣⲉ ϣⲏⲙ ⲛ̅ϫⲓϫⲉⲉⲩ ⲙ̅ⲡⲉⲕⲗⲁⲟⲥ ⲉⲧϫⲓ ⲙ̅ⲙⲟϥ ⲛ̅ϭⲟⲛⲥ̅.	 And all the enemies of thy people, that hold them in subjection, are most foolish, and are more miserable than very babes.	 πάντες δὲ ἀφρονέστατοι καὶ τάλανες ὑπὲρ ψυχὴν νηπίου οἱ ἐχθροὶ τοῦ λαοῦ σου καταδυναστεύσαντες αὐτόν,						
Wisdom of Solomon	15	15	 	 ϫⲉ ⲛ̅ⲉⲓⲇⲱⲗⲟⲛ ⲧⲏⲣⲟⲩ ⲛ̅ⲛⲉⲉⲑⲛⲟⲥ ⲉⲩⲙⲉⲉⲩⲉ ϫⲉ ϩⲛ̅ ⲛⲟⲩⲧⲉ ⲛⲉ ⲛⲁⲓ̈ ⲉⲧⲉ ⲛ̅ⲥⲉⲛⲁⲩ ⲉⲃⲟⲗ ⲁⲛ ϩⲛ̅ ⲛⲉⲩⲃⲁⲗ ⲟⲩⲧⲉ ⲛ̅ⲥⲉϣⲱⲗⲙ̅ ⲁⲛ ϩⲛ̅ ϣⲁⲁⲛⲧⲟⲩ ⲟⲩⲧⲉ ⲛ̅ⲥⲉⲥⲱⲧⲙ̅ ⲁⲛ ϩⲛ̅ ⲛⲉⲩⲙⲁⲁϫⲉ ⲟⲩⲧⲉ ⲛ̅ⲥⲉϭⲟⲙϭⲙ̅ ⲁⲛ ϩⲛ̅ ⲛ̅ⲧⲏⲏⲃⲉ ⲛ̅ⲛⲉⲩϭⲓϫ: ⲛⲉⲩⲕⲉⲟⲩⲉⲣⲏⲧⲉ ϩⲉⲛⲁⲣⲅⲟⲛ ⲛⲉ ⲉⲙⲉⲩⲙⲟⲟϣⲉ.	 For they counted all the idols of the heathen to be gods: which neither have the use of eyes to see, nor noses to draw breath, nor ears to hear, nor fingers of hands to handle; and as for their feet, they are slow to go.	 ὅτι καὶ πάντα τὰ εἴδωλα τῶν ἐθνῶν ἐλογίσαντο θεούς, οἷς οὔτε ὀµµάτων χρῆσις εἰς ὅρασιν οὔτε ῥῖνες εἰς συνολκὴν ἀέρος οὔτε ὦτα ἀκούειν οὔτε δάκτυλοι χειρῶν εἰς ψηλάφησιν καὶ οἱ πόδες αὐτῶν ἀργοὶ πρὸς ἐπίβασιν.						
Wisdom of Solomon	15	16	 	 ⲟⲩⲣⲱⲙⲉ ⲅⲁⲣ ⲉⲣⲉ ⲡⲉϥⲡⲛⲉⲩⲙⲁ ⲉⲣⲟϥ ⲡⲉⲛⲧⲁϥⲧⲁⲙⲓⲟⲟⲩ ⲙⲛ̅ ϣϭⲟⲙ ⲇⲉ ⲗ̅ⲗⲁⲁⲩ ⲛ̅ⲣⲱⲙⲉ ⲉⲡⲗⲁⲥⲥⲉ ⲛ̅ⲟⲩⲛⲟⲩⲧⲉ ⲉϥⲉⲓⲛⲉ ⲙ̅ⲙⲟϥ.	 For man made them, and he that borrowed his own spirit fashioned them: but no man can make a god like unto himself.	 ἄνθρωπος γὰρ ἐποίησεν αὐτούς, καὶ τὸ πνεῦµα δεδανεισµένος ἔπλασεν αὐτούς· οὐδεὶς γὰρ αὐτῷ ὅµοιον ἄνθρωπος ἰσχύει πλάσαι θεόν·						
Wisdom of Solomon	15	17	 	 ⲟⲩⲣⲉϥⲙⲟⲩⲧⲉ ⲇⲉ ϥⲣ̅ϩⲱⲃ ⲟⲛ ⲉⲡⲉⲧⲙⲟⲟⲩⲧ ϩⲛ̅ ⲛⲉϥϭⲓϫ ⲛ̅ⲁⲛⲟⲙⲟⲛ: ⲛ̅ⲧⲟϥ ⲅⲁⲣ ϥⲥⲟⲧⲡ̅ ⲉⲛⲉⲧϥ̅ϣⲙ̅ϣⲉ ⲙ̅ⲙⲟⲟⲩ ϫⲉ ⲛ̅ⲧⲟϥ ⲙⲉⲛ ϥⲟⲛϩ̅ ⲛⲏ ⲇⲉ ⲙ̅ⲡⲟⲩⲱⲛϩ̅ ⲉⲛⲉϩ.	 For being mortal, he worketh a dead thing with wicked hands: for he himself is better than the things which he worshippeth: whereas he lived once, but they never.	 θνητὸς δὲ ὢν νεκρὸν ἐργάζεται χερσὶν ἀνόµοις· κρείττων γάρ ἐστιν τῶν σεβασµάτων αὐτοῦ, ὧν αὐτὸς µὲν ἔζησεν, ἐκεῖνα δὲ οὐδέποτε. —						
Wisdom of Solomon	15	18	 	 ⲛ̅ⲕⲉⲧⲃ̅ⲛⲟⲟⲩⲉ ⲉⲧⲥⲏϣ ⲥⲉⲟⲩⲱϣⲧ̅ ⲙ̅ⲙⲟⲟⲩ ϩⲛ̅ ⲉ...: ⲉⲩⲧⲟⲛⲧⲛ̅ ⲅⲁⲣ ⲙ̅ⲙⲟⲟⲩ ⲥⲉϩⲟⲟⲩ ⲉⲡⲕⲉ....	 Yea, they worshipped those beasts also that are most hateful: for being compared together, some are worse than others.	 καὶ τὰ ζῷα δὲ τὰ ἔχθιστα σέβονται· ἀνοίᾳ γὰρ συγκρινόµενα τῶν ἄMων ἐστὶ χείρονα·						
Wisdom of Solomon	15	19	 	 ⲟⲩⲇⲉ ⲛ̅ⲛⲉ..... ⲁⲛ ϩⲙ̅ ⲡⲉⲩϩⲟ ⲉⲧⲣⲉⲩⲟⲩⲁϣⲟⲩ ϩⲛ̅ ⲛ̅ⲍⲱⲟⲛ ⲥⲉⲟ ⲇⲉ ⲛ̅ϣⲙ̅ⲙⲟ ⲉⲡⲧⲁⲓ̈ⲟ ⲙ̅ⲡⲛⲟⲩⲧⲉ ⲙⲛ̅ ⲡⲉⲥⲙⲟⲩ.	 Neither are they beautiful, so much as to be desired in respect of beasts: but they went without the praise of God and his blessing.	 οὐδ’ ὅσον ἐπιποθῆσαι ὡς ἐν ζῴων ὄψει καλὰ τυγχάνει, ἐκπέφευγεν δὲ καὶ τὸν τοῦ θεοῦ ἔπαινον καὶ τὴν εὐλογίαν αὐτοῦ.						
Wisdom of Solomon	16	1	 	 ⲉⲧⲃⲉ ⲡⲁⲓ̈ ⲉⲁⲩⲕⲟⲗⲁⲍⲉ ⲙ̅ⲙⲟⲟⲩ ϩⲛ̅ ⲟⲩⲙ̅ⲡϣⲁ .. ϩⲟⲉⲓⲛⲉ ⲛ̅ⲧⲉⲉⲓⲙⲓⲛⲉ ⲁⲩⲱ ⲉⲩⲃⲁⲥⲁⲛⲓⲍⲉ ⲙ̅ⲙⲟⲟⲩ ϩⲓⲧⲛ̅ ⲟⲩⲁϣⲏ ⲛ̅ⲍⲱⲟⲛ.	 Therefore by the like were they punished worthily, and by the multitude of beasts tormented.	 Διὰ τοῦτο δι’ ὁµοίων ἐκολάσθησαν ἀξίως καὶ διὰ πλήθους κνωδάλων ἐβασανίσθησαν.						
Wisdom of Solomon	16	2	 	 ⲉⲡⲙⲁ ⲛ̅ⲧⲉⲓ̈ⲕⲟⲗⲁⲥⲓⲥ ⲁⲕⲣ̅ⲡⲉⲧⲛⲁⲛⲟⲩϥ ⲙ̅ⲡⲉⲕⲗⲁⲟⲥ: ⲁⲕⲥⲟⲃⲧⲉ ⲛⲁⲩ ⲛ̅ⲟⲩϩⲏ ⲙ̅ⲡⲏⲣⲁ ⲛ̅ϩⲣⲉ ϩⲛ̅ ⲟⲩϯⲡⲉ ⲃ̅ⲃⲣ̅ⲣⲉ ⲉⲥϫⲱⲕ ⲉⲃⲟⲗ ⲛ̅ⲧⲉⲩⲉⲡⲓⲑⲩⲙⲓⲁ	 Instead of which punishment, dealing graciously with thine own people, thou preparedst for them meat of a strange taste, even quails to stir up their appetite:	 ἀνθ’ ἧς κολάσεως εὐεργετήσας τὸν λαόν σου εἰς ἐπιθυµίαν ὀρέξεως ξένην γεῦσιν τροφὴν ἡτοίµασας ὀρτυγοµήτραν,						
Wisdom of Solomon	16	3	 	 ϫⲉⲕⲁⲁⲥ ⲛⲏ ⲙⲉⲛ ⲉⲩⲉⲡⲓⲑⲩⲙⲓ ⲉⲟⲩⲱⲙ ⲛ̅ⲥⲉⲧⲙ̅ϭⲙ̅ϭⲟⲙ ⲉϫⲓ ⲛ̅ⲧⲉⲩϩⲣⲉ ⲉⲧⲃⲉ ⲛⲉⲛⲧⲁⲩⲧⲛ̅ⲛⲟⲟⲩⲥⲟⲩ ⲉϫⲱⲟⲩ ⲛⲁⲓ̈ ⲇⲉ ⲛ̅ⲧⲟⲟⲩ ⲁⲩϣⲡ̅ϩⲓⲥⲉ ⲛ̅ⲟⲩϣⲏⲙ ⲁⲩϫⲓ ϯⲡⲉ ⲛ̅ⲟⲩϩⲣⲉ ⲃ̅ⲃⲣ̅ⲣⲉ.	 To the end that they, desiring food, might for the ugly sight of the beasts sent among them lothe even that, which they must needs desire; but these, suffering penury for a short space, might be made partakers of a strange taste.	 ἵνα ἐκεῖνοι µὲν ἐπιθυµοῦντες τροφὴν διὰ τὴν εἰδέχθειαν τῶν ἐπαπεσταλµένων καὶ τὴν ἀναγκαίαν ὄρεξιν ἀποστρέφωνται, αὐτοὶ δὲ ἐπ’ ὀλίγον ἐνδεεῖς γενόµενοι καὶ ξένης µετάσχωσι γεύσεως.						
Wisdom of Solomon	16	4	 	 ϣ̅ϣⲉ ⲅⲁⲣ ⲉⲧⲣⲉ ⲟⲩϩⲕⲟ ⲉϥⲛⲁϣⲧ̅ ⲉⲓ ⲉϩⲣⲁⲓ̈ ⲉϫⲛ̅ ⲛⲏ ⲉⲧⲟ ⲣ̅ⲣⲉϥϫⲓϫⲛⲁϩ ⲛⲁⲓ̈ ⲇⲉ ⲉⲧⲁⲙⲟⲟⲩ ⲙ̅ⲙⲁⲧⲉ ⲉⲑⲉ ⲉⲛⲧⲁⲩⲃⲁⲥⲁⲛⲓⲍⲉ ⲛ̅ⲛⲉⲩϫⲁϫⲉ.	 For it was requisite, that upon them exercising tyranny should come penury, which they could not avoid: but to these it should only be shewed how their enemies were tormented.	 ἔδει γὰρ ἐκείνοις µὲν ἀπαραίτητον ἔνδειαν ἐπελθεῖν τυραννοῦσιν, τούτοις δὲ µόνον δειχθῆναι πῶς οἱ ἐχθροὶ αὐτῶν ἐβασανίζοντο.						
Wisdom of Solomon	16	5	 	 ⲕⲁⲓ ⲅⲁⲣ ⲛ̅ⲧⲉⲣⲉϥⲉⲓ ⲟⲛ ⲉϩⲣⲁⲓ̈ ⲉϫⲱⲟⲩ ⲛ̅ϭⲓ ⲡϭⲱⲛⲧ̅ ⲛ̅ⲛⲉⲑⲏⲣⲓⲟⲛ ⲁⲩⲗⲱⲕⲥ̅ ⲙ̅ⲙⲟⲟⲩ ϩⲓⲧⲛ̅ ϩⲛ̅ϩⲟϥ ⲉⲩⲛⲁϣⲧ̅ ⲙ̅ⲡⲉ ⲧⲉⲕⲟⲣⲅⲏ ⲙⲟⲩⲛ ⲉⲃⲟⲗ ϣⲁ ⲡⲧⲏⲣϥ̅.	 For when the horrible fierceness of beasts came upon these, and they perished with the stings of crooked serpents, thy wrath endured not for ever:	 Καὶ γὰρ ὅτε αὐτοῖς δεινὸς ἐπῆλθεν θηρίων θυµὸς δήγµασίν τε σκολιῶν διεφθείροντο ὄφεων, οὐ µέχρι τέλους ἔµεινεν ἡ ὀργή σου·						
Wisdom of Solomon	16	6	 	 ..... ⲡⲣⲟⲥ ⲟⲩⲕⲟⲩⲓ̈ .... ⲱ ⲛⲁⲩ ⲉⲁⲩϫⲓ ⲛ̅ⲟⲩⲙⲁⲉⲓⲛ ⲛ̅ⲟⲩϫⲁⲓ̈ ϩⲙ̅ ⲡⲣ̅ⲡⲙⲉⲉⲩⲉ ⲛ̅ⲉⲛⲧⲟⲗⲏ ⲙ̅ⲡⲉⲕⲛⲟⲙⲟⲥ.	 But they were troubled for a small season, that they might be admonished, having a sign of salvation, to put them in remembrance of the commandment of thy law.	 εἰς νουθεσίαν δὲ πρὸς ὀλίγον ἐταράχθησαν σύµβολον ἔχοντες σωτηρίας εἰς ἀνάµνησιν ἐντολῆς νόµου σου·						
Wisdom of Solomon	16	7	 	 ⲡⲉⲛⲧⲁⲕⲧⲟϣϥ̅ ⲅⲁⲣ ⲉϣⲁϥⲛⲟⲩϩⲙ̅ ⲁⲛ ⲉⲧⲃⲉ ⲡⲉⲧϥ̅ⲛⲁⲩ ⲙ̅ⲙⲟϥ ⲁⲗⲗⲁ ⲉⲧⲃⲏⲧⲕ̅ ⲡⲥⲱ​ⲧⲏⲣ ⲛ̅ⲟⲩⲟⲛ ⲛⲓⲙ.	 For he that turned himself toward it was not saved by the thing that he saw, but by thee, that art the Saviour of all.	 ὁ γὰρ ἐπιστραφεὶς οὐ διὰ τὸ θεωρούµενον ἐσῴζετο, ἀλλὰ διὰ σὲ τὸν πάντων σωτῆρα.						
Wisdom of Solomon	16	8	 	 ϩⲙ̅ ⲡⲁⲓ̈ ⲇⲉ ⲁⲕⲧⲁⲙⲉ ⲛⲉⲛϫⲁϫⲉ ϫⲉ ⲛ̅ⲧⲟⲕ ⲡⲉϣⲁⲕⲧⲟⲩϫⲟ ⲉⲃⲟⲗ ϩⲙ̅ ⲡⲉⲑⲟⲟⲩ ⲛⲓⲙ.	 And in this thou madest thine enemies confess, that it is thou who deliverest from all evil:	 καὶ ἐν τούτῳ δὲ ἔπεισας τοὺς ἐχθροὺς ἡµῶν ὅτι σὺ εἶ ὁ ῥυόµενος ἐκ παντὸς κακοῦ·						
Wisdom of Solomon	16	9	 	 ⲛⲏ ⲙⲉⲛ ⲁ ϩⲉⲛϣϫⲉ ⲙⲛ̅ ϩⲉⲛⲁϥ ⲛ̅ⲟⲩϩⲟⲣ ⲙⲟⲟⲩⲧⲟⲩ ⲉⲩⲗⲱⲕⲥ̅ ⲙ̅ⲙⲟⲟⲩ ⲁⲩⲱ ⲙ̅ⲡⲟⲩϩⲉ ⲉⲧⲁⲗϭⲟ ⲛ̅ⲛⲉⲩⲯⲩⲭⲏ ϫⲉ ⲛⲉⲩⲙ̅ⲡϣⲁ ⲛ̅ⲕⲟⲗⲁⲍⲉ ⲙ̅ⲙⲟⲟⲩ ϩⲓⲧⲛ̅ ϩⲛ̅ ⲧⲉⲉⲓⲙⲓⲛⲉ:	 For them the bitings of grasshoppers and flies killed, neither was there found any remedy for their life: for they were worthy to be punished by such.	 οὓς µὲν γὰρ ἀκρίδων καὶ µυιῶν ἀπέκτεινεν δήγµατα, καὶ οὐχ εὑρέθη ἴαµα τῇ ψυχῇ αὐτῶν, ὅτι ἄξιοι ἦσαν ὑπὸ τοιούτων κολασθῆναι·						
Wisdom of Solomon	16	10	 	 ⲛⲉⲕϣⲏⲣⲉ ⲇⲉ ⲛ̅ⲧⲟⲟⲩ ⲙ̅ⲡⲟⲩϫⲣⲟ ⲉⲣⲟⲟⲩ ⲛ̅ϭⲓ ⲛ̅ⲟⲃϩⲉ ⲛ̅ⲛ̅ϩⲟϥ ⲛ̅ⲃⲁⲕⲙⲁⲧⲟⲩ: ⲡⲉⲕⲛⲁ ⲅⲁⲣ ⲁϥⲉⲓ ⲉϫⲱⲟⲩ ⲁϥⲧⲁⲗϭⲟⲟⲩ.	 But thy sons not the very teeth of venomous dragons overcame: for thy mercy was ever by them, and healed them.	 τοὺς δὲ υἱούς σου οὐδὲ ἰοβόλων δρακόντων ἐνίκησαν ὀδόντες, τὸ ἔλεος γάρ σου ἀντιπαρῆλθεν καὶ ἰάσατο αὐτούς.						
Wisdom of Solomon	16	11	 	 ⲛ̅ⲧⲁⲩⲧⲟⲃⲥⲟⲩ ⲅⲁⲣ ⲉⲧⲣⲉⲩⲣ̅ⲡⲙⲉⲉⲩⲉ ⲛ̅ⲛⲉⲕϣⲁϫⲉ ⲁⲩⲱ ⲛ̅ⲧⲉⲩⲛⲟⲩ ⲁⲩⲟⲩϫⲁⲓ̈ ϫⲉ ⲛ̅ⲛⲉ ⲟⲩⲛⲟϭ ⲛ̅ⲱⲃϣ̅ ⲧⲁϩⲟⲟⲩ ⲛ̅ⲥⲉⲣ̅ⲡⲱⲃϣ ⲛ̅ⲛⲉⲕⲡⲉⲧⲛⲁⲛⲟⲩⲟⲩ.	 For they were pricked, that they should remember thy words; and were quickly saved, that not falling into deep forgetfulness, they might be continually mindful of thy goodness.	 εἰς γὰρ ὑπόµνησιν τῶν λογίων σου ἐνεκεντρίζοντο καὶ ὀξέως διεσῴζοντο, ἵνα µὴ εἰς βαθεῖαν ἐµπεσόντες λήθην ἀπερίσπαστοι γένωνται τῆς σῆς εὐεργεσίας.						
Wisdom of Solomon	16	12	 	 ⲟⲩⲧⲉ ⲅⲁⲣ ⲛ̅ⲟⲩⲛ̅ⲧⲏϭ ⲁⲛ ⲟⲩⲧⲉ ⲛ̅ⲟⲩⲡⲁϩⲣⲉ ⲁⲛ ⲧⲉⲛⲧⲁⲥⲧⲁⲗϭⲟⲟⲩ ⲁⲗⲗⲁ ⲡⲉⲕϣⲁϫⲉ ⲡⲉ ⲡϫⲟⲉⲓⲥ ⲉⲧⲧⲟⲩϫⲟ ⲛ̅ⲟⲩⲟⲛ ⲛⲓⲙ.	 For it was neither herb, nor mollifying plaister, that restored them to health: but thy word, O Lord, which healeth all things.	 καὶ γὰρ οὔτε βοτάνη οὔτε µάλαγµα ἐθεράπευσεν αὐτούς, ἀλλὰ ὁ σός, κύριε, λόγος ὁ πάντας ἰώµενος.						
Wisdom of Solomon	16	13	 	 ⲧⲱⲕ ⲅⲁⲣ ⲧⲉ ⲧⲉⲝⲟⲩⲥⲓⲁ ⲙ̅ⲡⲱⲛϩ̅ ⲙⲛ̅ ⲡⲙⲟⲩ: ⲉⲕϫⲓ ⲉϩⲣⲁⲓ̈ ⲉⲙ​ⲡⲩⲗⲏ ...........ⲉⲓⲛⲉ ⲉϩⲣⲁⲓ̈ ...	 For thou hast power of life and death: thou leadest to the gates of hell, and bringest up again.	 σὺ γὰρ ζωῆς καὶ θανάτου ἐξουσίαν ἔχεις καὶ κατάγεις εἰς πύλας ᾅδου καὶ ἀνάγεις·						
Wisdom of Solomon	16	14	 	 ⲡⲣⲱⲙⲉ ⲇⲉ ϣⲁϥⲙⲟⲩⲟⲩⲧ ϩⲛ̅ ⲧⲉϥⲕⲁⲕⲓⲁ ⲉⲣⲉϣⲁⲛ ⲡⲉⲡⲛⲉⲩⲙⲁ ⲉⲓ ⲉⲃⲟⲗ ⲁⲩⲱ ⲧⲉϥⲯⲩⲭⲏ ⲙⲉⲥⲕⲟⲧⲥ̅ ⲉⲣⲟϥ.	 A man indeed killeth through his malice: and the spirit, when it is gone forth, returneth not; neither the soul received up cometh again.	 ἄνθρωπος δὲ ἀποκτέννει µὲν τῇ κακίᾳ αὐτοῦ, ἐξελθὸν δὲ πνεῦµα οὐκ ἀναστρέφει οὐδὲ ἀναλύει ψυχὴν παραληµφθεῖσαν.						
Wisdom of Solomon	16	15	 	 ⲙⲛ̅ ⲗⲁⲁⲩ ⲛⲁϣϭⲙ̅ϭⲟⲙ ⲉⲡⲱⲧ ⲉⲛⲉⲕϭⲓϫ.	 But it is not possible to escape thine hand.	 Τὴν δὲ σὴν χεῖρα φυγεῖν ἀδύνατόν ἐστιν·						
