book	chapter	verse	Bohairic	Sahidic	English	Greek	Fayyumic	Akhmimic	OldBohairic	Mesokemic	DialectP	Lycopolitan
Wisdom of Solomon	6	13	 	 ϣⲁⲥⲣ̅ϣⲟⲣⲡ̅ ⲉⲟⲩⲱⲛϩ̅ ⲛ̅ⲛⲉⲧⲉⲡⲓⲑⲩⲙⲓ ⲉⲣⲟⲥ.	 She preventeth them that desire her, in making herself first known unto them.	 φθάνει τοὺς ἐπιθυµοῦντας προγνωσθῆναι.						
Wisdom of Solomon	6	14	 	 ⲡⲉⲧⲛⲁϣⲟⲣⲡϥ̅ ⲉⲣⲟⲥ ⲛϥ̅ⲛⲁϩⲓⲥⲉ ⲁⲛ: ϥⲛⲁϩⲉ ⲅⲁⲣ ⲉⲣⲟⲥ​ ⲉⲥⲁϩⲉ ⲣⲁⲧⲥ̅ ϩⲓⲣⲛ̅ ⲛⲉϥⲣⲟ:	 Whoso seeketh her early shall have no great travail: for he shall find her sitting at his doors.	 ὁ ὀρθρίσας πρὸς αὐτὴν οὐ κοπιάσει· πάρεδρον γὰρ εὑρήσει τῶν πυλῶν αὐτοῦ.						
Wisdom of Solomon	6	15	 	 ⲡⲣ̅ⲡⲙⲉⲉⲩⲉ ⲅⲁⲣ ⲉⲣⲟⲥ ⲟⲩⲙⲛ̅ⲧⲣⲙ̅ⲛ̅ϩⲏⲧ ⲧⲉ ⲉⲥϫⲏⲕ ⲉⲃⲟⲗ. ⲁⲩⲱ ⲡⲉⲛⲧⲁϥⲣ̅ ⲟⲩϣⲏ ⲛ̅ⲣⲟⲉⲓⲥ ⲉⲧⲃⲏⲧⲥ̅ ⲛⲁⲣ̅ⲁⲧⲣⲟⲟⲩϣ ϩⲛ̅ ⲟⲩϭⲉⲡⲏ.	 To think therefore upon her is perfection of wisdom: and whoso watcheth for her shall quickly be without care.	 τὸ γὰρ ἐνθυµηθῆναι περὶ αὐτῆς φρονήσεως τελειότης, καὶ ὁ ἀγρυπνήσας δι’ αὐτὴν ταχέως ἀµέριµνος ἔσται·						
Wisdom of Solomon	6	16	 	 ϫⲉ ⲛ̅ⲧⲟⲥ ϣⲁⲥⲙⲟⲟϣⲉ ⲉⲥϣⲓⲛⲉ ⲛ̅ⲥⲁ ⲛⲉⲧⲙ̅ⲡϣⲁ ⲙ̅ⲙⲟⲥ ⲛ̅ⲥⲟⲩⲱⲛϩ̅ ⲉⲣⲟⲟⲩ ϩⲓ ⲛⲉϩⲓⲟⲟⲩ ⲉⲥⲛⲟⲧⲙ̅ ⲛⲥ̅ⲧⲱⲙⲛ̅ⲧ ⲉⲣⲟⲟⲩ ϩⲛ̅ ⲟⲩϣⲟϫⲛⲉ ⲛⲓⲙ.	 For she goeth about seeking such as are worthy of her, sheweth herself favourably unto them in the ways, and meeteth them in every thought.	 ὅτι τοὺς ἀξίους αὐτῆς αὐτὴ περιέρχεται ζητοῦσα καὶ ἐν ταῖς τρίβοις φαντάζεται αὐτοῖς εὐµενῶς καὶ ἐν πάσῃ ἐπινοίᾳ ὑπαντᾷ αὐτοῖς.						
Wisdom of Solomon	6	17	 	 ⲧⲉⲥϩⲟⲩⲉⲓⲧⲉ ⲅⲁⲣ ⲧⲉ ⲧⲉⲡⲓⲑⲩⲙⲓⲁ ⲛ̅ⲧⲉⲫⲃⲱ ⲙ̅ⲙⲉ	 For the very true beginning of her is the desire of discipline; and the care of discipline is love;	 ἀρχὴ γὰρ αὐτῆς ἡ ἀληθεστάτη παιδείας ἐπιθυµία, φροντὶς δὲ παιδείας ἀγάπη,						
Wisdom of Solomon	6	18	 	 ⲡⲣⲟⲟⲩϣ ⲇⲉ ⲛ̅ⲧⲉⲥⲃⲱ ⲡⲉ ⲧⲁⲅⲁⲡⲏ ⲧⲁⲅⲁⲡⲏ ⲇⲉ ⲡⲉ ⲡϩⲁⲣⲉϩ ⲉⲡⲉⲥⲛⲟⲙⲟⲥ ⲡϯϩⲧⲏⲕ ⲇⲉ ⲉⲡⲛⲟⲙⲟⲥ ⲡⲉ ⲡ̅ⲧⲁϫⲣⲟ ⲛ̅ⲧⲙⲛ̅ⲧⲁⲧⲧⲁⲕⲟ	 And love is the keeping of her laws; and the giving heed unto her laws is the assurance of incorruption;	 ἀγάπη δὲ τήρησις νόµων αὐτῆς, προσοχὴ δὲ νόµων βεβαίωσις ἀφθαρσίας,						
Wisdom of Solomon	6	19	 	 ⲧⲙⲛ̅ⲧⲁⲧⲧⲁⲕⲟ ⲇⲉ ϣⲁⲥⲧⲣⲉⲩϩⲱⲛ ⲉϩⲟⲩⲛ ⲉⲡⲛⲟⲩⲧⲉ.	 And incorruption maketh us near unto God:	 ἀφθαρσία δὲ ἐíὺς εἶναι ποιεῖ θεοῦ·						
Wisdom of Solomon	6	20	 	 ⲧⲉⲡⲓⲑⲩⲙⲓⲁ ϭⲉ ⲛ̅ⲧⲥⲟⲫⲓⲁ ⲛⲁϫⲓⲧⲟⲩ ⲉϩⲟⲩⲛ ⲉⲡⲱⲛϩ̅ ⲉϩⲟⲩⲛ ⲉⲧⲙⲛ̅ⲧⲉⲣⲟ	 Therefore the desire of wisdom bringeth to a kingdom.	 ἐπιθυµία ἄρα σοφίας ἀνάγει ἐπὶ βασιλείαν.						
Wisdom of Solomon	6	21	 	 ⲉϣϫⲉ ⲧⲉⲧⲛ̅ⲙⲉ ϭⲉ ⲛ̅ⲛⲉⲑⲣⲟⲛⲟⲥ ⲙⲛ̅ ⲛⲉϭⲣⲏⲡⲉ ⲛ̅ⲧⲩⲣⲁⲛⲛⲟⲥ ⲛ̅ⲗ̅ⲗⲁⲟⲥ	 If your delight be then in thrones and sceptres, O ye kings of the people,	 εἰ οὖν ἥδεσθε ἐπὶ θρόνοις καὶ σκήπτροις, τύραννοι λαῶν,						
Wisdom of Solomon	6		 	 ⲙⲁⲧⲁⲓ̈ⲉ ⲧⲥⲟⲫⲓⲁ ϫⲉ ⲉⲧⲉⲧⲛ̅ⲉⲣ̅ⲣ̅ⲣⲟ ϣⲁ ⲉⲛⲉϩ.	honour wisdom, that ye may reign for evermore.	τιµήσατε σοφίαν, ἵνα εἰς τὸν αἰῶνα βασιλεύσητε.						
Wisdom of Solomon	6	22	 	 ⲟⲩ ⲇⲉ ⲡⲉ ⲧⲥⲟⲫⲓⲁ ⲁⲩⲱ ⲛ̅ⲧⲁⲥϣⲱⲡⲉ ⲛ̅ⲁϣ ⲛ̅ϩⲉ ϯⲛⲁϫⲟⲟⲥ ⲁⲩⲱ ⲛ̅ϯⲛⲁϩⲱⲡ ⲁⲛ ⲉⲣⲱⲧⲛ̅ ⲙ̅ⲡⲉⲓ̈ⲙⲩⲥⲧⲏⲣⲓⲟⲛ ⲁⲗⲗⲁ ϯⲛⲁϩⲉⲧϩⲱⲧⲥ̅ ϫⲓⲛ ⲧⲉϩⲟⲩⲉⲓⲧⲉ ⲙ̅ⲡⲉⲥⲧⲁⲙⲓⲟ ⲛ̅ⲧⲁⲟⲩⲱⲛϩ̅ ⲉⲃⲟⲗ ⲙ̅ⲡⲉⲥⲥⲟⲟⲩⲛ: ⲛ̅ϯⲛⲁⲣ̅ ⲡⲃⲟⲗ ⲁⲛ ⲛ̅ⲧⲙⲉ	 As for wisdom, what she is, and how she came up, I will tell you, and will not hide mysteries from you: but will seek her out from the beginning of her nativity, and bring the knowledge of her into light, and will not pass over the truth.	 τί δέ ἐστιν σοφία καὶ πῶς ἐγένετο, ἀπαíελῶ καὶ οὐκ ἀποκρύψω ὑµῖν µυστήρια, ἀλλὰ ἀπ’ ἀρχῆς γενέσεως ἐξιχνιάσω καὶ θήσω εἰς τὸ ἐµφανὲς τὴν γνῶσιν αὐτῆς καὶ οὐ µὴ παροδεύσω τὴν ἀλήθειαν.						
Wisdom of Solomon	6	23	 	 ⲟⲩⲇⲉ ⲛ̅ⲛⲁⲃⲱⲕ ⲙⲛ̅ ⲡⲉⲕⲣⲟϥ ⲉϫⲟⲟⲩ ϫⲉ ⲙ̅ⲡⲁⲓ̈ⲕⲟⲓⲛⲱⲛⲓ ⲁⲛ ⲙⲛ̅ ⲧⲥⲟⲫⲓⲁ.	 Neither will I go with consuming envy; for such a man shall have no fellowship with wisdom.	 οὔτε µὴν φθόνῳ τετηκότι συνοδεύσω, ὅτι οὗτος οὐ κοινωνήσει σοφίᾳ.						
Wisdom of Solomon	6	24	 	 ⲟⲩⲟⲩϫⲁⲓ̈ ⲙ̅ⲡⲕⲟⲥⲙⲟⲥ ⲡⲉ ⲡⲁϣⲏ ⲛ̅ⲛ̅ⲥⲟⲫⲟⲥ ⲁⲩⲱ ⲟⲩⲣ̅ⲣⲟ ⲛ̅ⲥⲁⲃⲉ ⲡⲉ ⲡⲉⲥⲙⲓⲛⲉ ⲙ̅ⲡⲉⲙⲏⲏϣⲉ	 But the multitude of the wise is the welfare of the world: and a wise king is the upholding of the people.	 πλῆθος δὲ σοφῶν σωτηρία κόσµου, καὶ βασιλεὺς φρόνιµος εὐστάθεια δήµου.						
Wisdom of Solomon	6	25	 	 ϫⲓⲥⲃⲱ ϭⲉ ⲉⲛⲁϣⲁϫⲉ ⲧⲁⲣⲉⲧⲛ̅ϯϩⲏⲟⲩ	 Receive therefore instruction through my words, and it shall do you good.	 ὥστε παιδεύεσθε τοῖς ῥήµασίν µου, καὶ ὠφεληθήσεσθε.						
Wisdom of Solomon	7	1		 ⲁⲛⲅ̅ ⲟⲩⲣⲱⲙⲉ [ⲡⲉ] ϩⲱⲱⲧ ⲛ̅ⲑⲉ ⲛ̅ⲟⲩⲟⲛ ⲛⲓⲙ ⲟⲩϫⲡⲟ ⲉⲃⲟⲗ ϩⲛ̅ ⲡⲣⲙ̅ⲛ̅ⲕⲁϩ ⲉⲛⲧⲁⲩⲡⲗⲁⲥⲥⲉ ⲙ̅ⲙⲟϥ ⲛ̅ϣⲟⲣⲡ̅ ⲉⲁⲩⲙⲟⲛⲅ̅ⲧ ⲛ̅ⲥⲁⲣⲝ̅ ⲛ̅ϩⲏⲧⲥ̅ ⲛ̅ⲧⲁⲙⲁⲁⲩ.	 I myself also am a mortal man, like to all, and the offspring of him that was first made of the earth,	 Εἰµὶ µὲν κἀγὼ θνητὸς ἄνθρωπος ἴσος ἅπασιν καὶ γηγενοῦς ἀπόγονος πρωτοπλάστου· καὶ ἐν κοιλίᾳ µητρὸς ἐγλύφην σὰρξ						
Wisdom of Solomon	7	2		 ⲁⲓ̈ⲧⲱⲕ ϩⲛ̅ ⲟⲩⲥⲛⲟϥ ⲙ̅ⲙⲏⲧ ⲛ̅ⲉⲃⲟⲧ ⲉⲃⲟⲗ ϩⲛ̅ ⲟⲩⲥⲡⲉⲣⲙⲁ ⲣ̅ⲣⲱⲙⲉ ⲉⲁⲥⲉⲓ ⲉϩⲟⲩⲛ ⲉⲣⲟϥ ϩⲙ̅ ⲡⲉⲛ̅ⲕⲟⲧⲕ̅ ϩⲛ̅ ⲟⲩϩⲏⲇⲟⲛⲏ.	 And in my mother’s womb was fashioned to be flesh in the time of ten months, being compacted in blood, of the seed of man, and the pleasure that came with sleep.	 δεκαµηνιαίῳ χρόνῳ παγεὶς ἐν αἵµατι ἐκ σπέρµατος ἀνδρὸς καὶ ἡδονῆς ὕπνῳ συνελθούσης.						
Wisdom of Solomon	7	3		 ⲛ̅ⲧⲉⲣⲓϣⲱⲡⲉ ⲇⲉ ⲁⲓ̈ϩⲱⲛ ⲉⲃⲟⲗ ⲉⲡⲁⲏⲣ ⲁⲓ̈ϩⲉ ⲉϩⲣⲁⲓ̈ ⲉϫⲙ̅ ⲡⲉⲓ̈ⲕⲁϩ ⲟⲩⲱⲧ ⲁⲓ̈ϯ ⲛ̅ⲧϣⲟⲣⲡ̅ ⲛ̅ⲥⲙⲏ ⲉⲓ̈ⲣⲓⲙⲉ ⲛ̅ⲑⲉ ⲛ̅ⲟⲩⲟⲛ ⲛⲓⲙ.	 And when I was born, I drew in the common air, and fell upon the earth, which is of like nature, and the first voice which I uttered was crying, as all others do.	 καὶ ἐγὼ δὲ γενόµενος ἔσπασα τὸν κοινὸν ἀέρα καὶ ἐπὶ τὴν ὁµοιοπαθῆ κατέπεσον γῆν πρώτην φωνὴν τὴν ὁµοίαν πᾶσιν ἴσα κλαίων·						
Wisdom of Solomon	7	4		 ⲁⲩⲥⲁⲛⲟⲩϣⲧ̅ ϩⲛ̅ ϩⲉⲛⲧⲟⲉⲓⲥ ⲙⲛ̅ ϩⲉⲛⲣⲟⲟⲩϣ.	 I was nursed in swaddling clothes, and that with cares.	 ἐν σπαργάνοις ἀνετράφην καὶ φροντίσιν.						
Wisdom of Solomon	7	5		 ⲙⲛ ⲗⲁⲁⲩ ⲅⲁⲣ ⲛⲣⲣⲟ ⲉⲩⲛⲧϥ ⲕⲉ ϩⲟⲩⲉⲓⲧⲉ ⲛ̅ϫⲡⲟ.	 For there is no king that had any other beginning of birth.	 οὐδεὶς γὰρ βασιλέων ἑτέραν ἔσχεν γενέσεως ἀρχήν,						
Wisdom of Solomon	7	6		 ⲟⲩϭⲓⲛⲉⲓ ⲛ̅ⲟⲩⲱⲧ ⲧⲉ ⲛ̅ⲟⲩⲟⲛ ⲛⲓⲙ ⲉϩⲟⲩⲛ ⲉⲡⲕⲟⲥⲙⲟⲥ ⲁⲩⲱ ⲟⲩϭⲓⲛⲃⲱⲕ ⲉⲃⲟⲗ.	 For all men have one entrance into life, and the like going out.	 µία δὲ πάντων εἴσοδος εἰς τὸν βίον ἔξοδός τε ἴση.						
Wisdom of Solomon	7	7		 ⲉⲧⲃⲉ ⲡⲁⲓ̈ ⲁⲓ̈ϣⲗⲏⲗ ⲁⲩϯ ⲛⲁⲓ̈ ⲛ̅ⲟⲩⲙⲛ̅ⲧⲣⲙ̅ⲛ̅ϩⲏⲧ: ⲁⲓ̈ⲉⲡⲓⲕⲁⲗⲉⲓ ⲁϥⲉⲓ ⲛⲁⲓ̈ ⲛ̅ϭⲓ ⲟⲩⲡⲛⲉⲩⲙⲁ ⲛ̅ⲥⲟⲫⲓⲁ.	 Wherefore I prayed, and understanding was given me: I called upon God, and the spirit of wisdom came to me.	 διὰ τοῦτο εὐξάµην, καὶ φρόνησις ἐδόθη µοι· ἐπεκαλεσάµην, καὶ ἦλθέν µοι πνεῦµα σοφίας.						
Wisdom of Solomon	7	8		 ⲁⲓ̈ⲥⲟⲧⲡⲥ̅ ⲉⲛⲉϭⲣⲏⲡⲉ ⲙⲛ̅ ⲛⲉⲑⲣⲟⲛⲟⲥ: ⲙ̅ⲡⲓⲉⲛ ⲧⲙⲛ̅ⲧⲣⲙ̅ⲙⲁⲟ ⲛⲙ̅ⲙⲁⲥ ⲛ̅ⲑⲉ ⲛ̅ⲟⲩⲗⲁⲁⲩ	 I preferred her before sceptres and thrones, and esteemed riches nothing in comparison of her.	 προέκρινα αὐτὴν σκήπτρων καὶ θρόνων καὶ πλοῦτον οὐδὲν ἡγησάµην ἐν συγκρίσει αὐτῆς·						
Wisdom of Solomon	7	9		 ⲟⲩⲇⲉ ⲡⲱⲛⲉ ⲙ̅ⲙⲉ ⲙ̅ⲡⲓⲧⲛ̅ⲧⲱⲛϥ̅ ⲉⲣⲟⲥ. ϫⲉ ⲡⲛⲟⲩⲃ ⲧⲏⲣϥ̅ ⲛ̅ⲛⲁϩⲣⲁⲥ ⲉϥⲟ ⲛ̅ⲑⲉ ⲛ̅ⲟⲩϣⲏⲙ ⲛ̅ϣⲱ ⲁⲩⲱ ⲉⲣⲉ ⲫⲁⲧ ⲙ̅ⲡⲉⲙ̅ⲧⲟ ⲉⲃⲟⲗ ⲛ̅ⲑⲉ ⲛ̅ⲟⲩⲟⲙⲉ.	 Neither compared I unto her any precious stone, because all gold in respect of her is as a little sand, and silver shall be counted as clay before her.	 οὐδὲ ὡµοίωσα αὐτῇ λίθον ἀτίµητον, ὅτι ὁ πᾶς χρυσὸς ἐν ὄψει αὐτῆς ψάµµος ὀλίγη, καὶ ὡς πηλὸς λογισθήσεται ἄργυρος ἐναντίον αὐτῆς·						
Wisdom of Solomon	7	10		 ⲁⲓ̈ⲙⲉⲣⲓⲧⲥ̅ ⲉϩⲟⲩⲉ ⲟⲩϫⲣⲟ ⲙⲛ̅ ⲟⲩⲥⲁ ⲁⲓ̈ⲥⲟⲧⲡⲥ̅ ⲉⲕⲁⲁⲥ ⲛⲁⲓ̈ ⲉⲡⲙⲁ ⲙ̅ⲡⲟⲩⲟⲉⲓⲛ ϫⲉ ⲡⲉⲥⲟⲩⲟⲉⲓⲛ ⲛ̅ⲧⲟⲥ ⲙⲉϥⲛ̅ⲕⲟⲧⲕ̅.	 I loved her above health and beauty, and chose to have her instead of light: for the light that cometh from her never goeth out.	 ὑπὲρ ὑγίειαν καὶ εὐµορφίαν ἠγάπησα αὐτὴν καὶ προειλόµην αὐτὴν ἀντὶ φωτὸς ἔχειν, ὅτι ἀκοίµητον τὸ ἐκ ταύτης φέγγος.						
Wisdom of Solomon	7	11		 ⲁⲩⲉⲓ ⲇⲉ ⲛⲁⲓ̈ ⲛⲙ̅ⲙⲁⲥ ⲛ̅ϭⲓ ⲛ̅ⲁⲅⲁⲑⲟⲛ ⲧⲏⲣⲟⲩ ϩⲓ ⲟⲩⲥⲟⲡ ⲁⲩⲱ ⲟⲩⲙⲛ̅ⲧⲣⲙ̅ⲙⲁⲟ ⲉⲛⲁϣⲱⲥ ϩⲛ̅ ⲛⲉⲥϭⲓϫ.	 All good things together came to me with her, and innumerable riches in her hands.	 ἦλθεν δέ µοι τὰ ἀγαθὰ ὁµοῦ πάντα µετ’ αὐτῆς καὶ ἀναρίθµητος πλοῦτος ἐν χερσὶν αὐτῆς·						
Wisdom of Solomon	7	12		 ⲁⲓ̈ⲣⲁϣⲉ ⲇⲉ ⲉϫⲱⲟⲩ ⲧⲏⲣⲟⲩ ϫⲉ ⲧⲥⲟⲫⲓⲁ ⲧⲉⲧϫⲓⲙⲟⲉⲓⲧ ϩⲏⲧⲟⲩ ⲛⲉⲓ̈ⲥⲟⲟⲩⲛ ⲇⲉ ⲁⲛ ⲡⲉ ϫⲉ ⲛ̅ⲧⲟⲥ ⲁⲥϫⲡⲟⲟⲩ ⲧⲏⲣⲟⲩ.	 And I rejoiced in them all, because wisdom goeth before them: and I knew not that she was the mother of them.	 εὐφράνθην δὲ ἐπὶ πᾶσιν, ὅτι αὐτῶν ἡγεῖται σοφία, ἠγνόουν δὲ αὐτὴν γενέτιν εἶναι τούτων.						
Wisdom of Solomon	7	13		 ⲁⲓ̈ⲥⲃⲟ ⲁϫⲛ̅ ⲕⲣⲟϥ ϯⲛⲁϯ ⲁϫⲛ̅ ⲫⲑⲟⲛⲟⲥ ⲛ̅ϯⲛⲁϩⲱⲡ ⲁⲛ ⲛ̅ⲧⲉⲥⲙⲛ̅ⲧⲣⲙ̅ⲙⲁⲟ:	 I learned diligently, and do communicate her liberally: I do not hide her riches.	 ἀδόλως τε ἔµαθον ἀφθόνως τε µεταδίδωµι, τὸν πλοῦτον αὐτῆς οὐκ ἀποκρύπτοµαι·						
Wisdom of Solomon	7	14		 ⲟⲩⲁϩⲟ ⲅⲁⲣ ⲛ̅ⲣ̅ⲣⲱⲙⲉ ⲡⲉ ⲉⲙⲉϥⲱϫⲛ̅: ⲛⲉⲛⲧⲁⲩⲭⲣⲱ ⲙ̅ⲙⲟⲥ ⲁⲩⲣ̅ϣⲃⲏⲣ ⲉⲡⲛⲟⲩⲧⲉ ⲁⲩⲥⲩⲛϩⲓⲥⲧⲁ ⲙ̅ⲙⲟⲟⲩ ⲉⲧⲃⲉ ⲛ̅ⲇⲱⲣⲟⲛ ⲛ̅ⲧⲉⲥⲃⲱ.	 For she is a treasure unto men that never faileth: which they that use become the friends of God, being commended for the gifts that come from learning.	 ἀνεκλιπὴς γὰρ θησαυρός ἐστιν ἀνθρώποις, ὃν οἱ κτησάµενοι πρὸς θεὸν ἐστείλαντο φιλίαν διὰ τὰς ἐκ παιδείας δωρεὰς συσταθέντες.						
Wisdom of Solomon	7	15		 ⲉⲣⲉ ⲡⲛⲟⲩⲧⲉ ⲇⲉ ϯ ⲛⲁⲓ̈ ⲉϫⲟⲟⲩ ⲕⲁⲧⲁ ⲧⲁⲅⲛⲱⲙⲏ ⲁⲩⲱ ⲉⲙⲉⲉⲩⲉ ⲕⲁⲧⲁ ⲡⲉⲙⲡϣⲁ ⲛ̅ⲛⲉⲧϥ̅ⲛⲁⲧⲁⲁⲩ ϫⲉ ⲛ̅ⲧⲟϥ ⲡⲉⲧϫⲓⲙⲟⲉⲓⲧ ϩⲏⲧⲥ̅ ⲛ̅ⲧⲥⲟⲫⲓⲁ ⲁⲩⲱ ⲡⲉⲧϯⲥⲃⲱ ⲛ̅ⲛ̅ⲥⲟⲫⲟⲥ.	 God hath granted me to speak as I would, and to conceive as is meet for the things that are given me: because it is he that leadeth unto wisdom, and directeth the wise.	 Ἐµοὶ δὲ δῴη ὁ θεὸς εἰπεῖν κατὰ γνώµην καὶ ἐνθυµηθῆναι ἀξίως τῶν δεδοµένων, ὅτι αὐτὸς καὶ τῆς σοφίας ὁδηγός ἐστιν καὶ τῶν σοφῶν διορθωτής.						
Wisdom of Solomon	7	16		 ⲉⲛϣⲟⲟⲡ ⲅⲁⲣ ϩⲛ̅ ⲧⲉϥϭⲓϫ ⲁⲛⲟⲛ ⲙⲛ̅ ⲛⲉⲛⲕⲉϣⲁϫⲉ. ⲁⲩⲱ ⲙⲛ̅ⲧⲣⲙ̅ⲛ̅ϩⲏⲧ ⲛⲓⲙ ⲛⲙ̅ ⲧⲉⲥⲃⲱ ⲛ̅​ⲛⲉϩⲃⲏⲩⲉ.	 For in his hand are both we and our words; all wisdom also, and knowledge of workmanship.	 ἐν γὰρ χειρὶ αὐτοῦ καὶ ἡµεῖς καὶ οἱ λόγοι ἡµῶν πᾶσά τε φρόνησις καὶ ἐργατειῶν ἐπιστήµη.						
Wisdom of Solomon	7	17		 ⲛ̅ⲧⲟϥ ⲅⲁⲣ ⲁϥϯ ⲛⲁⲓ̈ ⲙ̅ⲡⲥⲟⲟⲩⲛ ⲙ̅ⲙⲉ ⲛ̅ⲛⲉⲧϣⲟⲟⲡ ⲉⲥⲟⲩⲛ̅ ⲡⲧⲱϣ ⲙ̅ⲡⲕⲟⲥⲙⲟⲥ ⲙⲛ̅ ⲧⲉⲛⲉⲣⲅⲉⲓⲁ ⲛ̅ⲛⲉⲥⲧⲟⲓⲭⲓⲟⲛ	 For he hath given me certain knowledge of the things that are, namely, to know how the world was made, and the operation of the elements:	 αὐτὸς γάρ µοι ἔδωκεν τῶν ὄντων γνῶσιν ἀψευδῆ εἰδέναι σύστασιν κόσµου καὶ ἐνέργειαν στοιχείων,						
Wisdom of Solomon	7	18		 ⲧⲉϩⲟⲩⲉⲓⲧⲉ ⲙⲛ̅ ⲑⲁⲏ ⲙⲛ̅ ⲧⲙⲏⲧⲉ ⲛ̅ⲛ̅ⲥⲏⲟⲩ ⲛ̅ϣⲓⲃⲉ ⲛ̅ⲛⲁⲏⲣ ⲙⲛ̅ ⲙ̅ⲙⲉⲧⲁⲃⲟⲗⲏ ⲛ̅ⲛⲉⲩⲟⲉⲓϣ:	 The beginning, ending, and midst of the times: the alterations of the turning of the sun, and the change of seasons:	 ἀρχὴν καὶ τέλος καὶ µεσότητα χρόνων, τροπῶν ἀλλαγὰς καὶ µεταβολὰς καιρῶν,						
Wisdom of Solomon	7	19		 ⲛ̅ⲕⲩⲕⲗⲟⲥ ⲛ̅ⲧⲉⲣⲟⲙⲡⲉ ⲙⲛ̅ ⲛⲉⲥⲙⲓⲛⲉ ⲛ̅ⲛ̅ⲥⲓⲟⲩ	 The circuits of years, and the positions of stars:	 ἐνιαυτοῦ κύκλους καὶ ἄστρων θέσεις,						
Wisdom of Solomon	7	20		 ⲛⲉⲫⲩⲥⲓⲥ ⲛ̅ⲛ̅ⲍⲱⲟⲛ ⲙⲛ̅ ⲡϭⲱⲛⲧ̅ ⲛ̅ⲛⲉⲑⲏⲣⲓⲟⲛ ⲡⲉⲛϣⲟⲧ ⲛ̅ⲛ̅ⲧⲏⲩ ⲙⲛ̅ ⲙ̅ⲙⲟⲕⲙⲉⲕ ⲛ̅ⲛ̅ⲣⲱⲙⲉ ⲛ̅ϣⲓⲃⲉ ⲛ̅ⲛ̅ϣⲏⲛ ⲙⲛ̅ ⲧϭⲟⲙ ⲛ̅ⲛⲉⲛⲧⲏϭ.	 The natures of living creatures, and the furies of wild beasts: the violence of winds, and the reasonings of men: the diversities of plants and the virtues of roots:	 φύσεις ζῴων καὶ θυµοὺς θηρίων, πνευµάτων βίας καὶ διαλογισµοὺς ἀνθρώπων, διαφορὰς φυτῶν καὶ δυνάµεις ῥιζῶν,						
Wisdom of Solomon	7	21		 ⲛⲉⲧϩⲏⲡ ⲙⲛ̅ ⲛⲉⲧⲟⲩⲟⲛϩ̅ ⲉⲃⲟⲗ ⲁⲓ̈ⲥⲟⲩⲱⲛⲟⲩ: ⲧⲥⲟⲫⲓⲁ ⲅⲁⲣ ⲉⲛⲧⲁⲥⲧⲁⲙⲓⲟⲟⲩ ⲧⲏⲣⲟⲩ ⲁⲥⲧⲥⲁⲃⲟⲓ̈ ⲉⲣⲟⲟⲩ.	 And all such things as are either secret or manifest, them I know.	 ὅσα τέ ἐστιν κρυπτὰ καὶ ἐµφανῆ ἔγνων· ἡ γὰρ πάντων τεχνῖτις ἐδίδαξέν µε σοφία.						
Wisdom of Solomon	7	22		 ⲟⲩⲛ̅ ⲟⲩⲡⲛⲉⲩⲙⲁ ⲅⲁⲣ ⲛ̅ϩⲏⲧⲥ̅ ⲉϥⲟⲩⲁⲁⲃ. ⲛ̅ⲣⲉϥⲛⲟⲓ̈ ⲛ̅ⲟⲩⲥⲙⲟⲧ ⲛ̅ⲟⲩⲱⲧ ⲛ̅ⲁⲧⲉⲥⲙⲟⲧ ⲉϥⲁⲥⲱⲟⲩ ⲣ̅ⲣⲉϥⲣ̅ϩⲱⲃ ⲉϥϭⲙ̅ϭⲟⲙ ⲉϥⲟ ⲛ̅ⲁⲧⲧⲱⲗⲙ̅ ⲛ̅ⲥⲁⲃⲉ ⲛ̅ⲁⲧⲛⲟⲃⲉ ⲙ̅ⲙⲁⲓ̈ⲁⲅⲁⲑⲟⲛ ⲉϥⲧⲟⲣϩ̅ ⲉⲙⲉⲩϣⲁⲙ​ⲁϩⲧⲉ ⲙ̅ⲙⲟϥ ⲣ̅ⲣⲉϥⲣ̅ⲡⲉⲧⲛⲁⲛⲟⲩϥ​	 For wisdom, which is the worker of all things, taught me: for in her is an understanding spirit holy, one only, manifold, subtil, lively, clear, undefiled, plain, not subject to hurt, loving the thing that is good quick, which cannot be letted, ready to do good,	 Ἔστιν γὰρ ἐν αὐτῇ πνεῦµα νοερόν, ἅγιον, µονογενές, πολυµερές, λεπτόν, εὐκίνητον, τρανόν, ἀµόλυντον, σαφές, ἀπήµαντον, φιλάγαθον, ὀξύ,						
Wisdom of Solomon	7	23		 ⲙ̅ⲙⲁⲓ̈ⲣⲱⲙⲉ ⲉϥⲧⲁϫⲣⲏⲩ ⲉϥⲟⲣϫ ⲉϥⲟ ⲛ̅ⲁⲧⲣⲟⲟⲩϣ ⲉϥϭⲙ̅ϭⲟⲙ ⲉϩⲱⲃ ⲛⲓⲙ ⲉϥϭⲱϣⲧ̅ ⲉϫⲙ̅ ⲡⲧⲏⲣϥ̅ ⲉϥϫⲱⲧⲉ ϩⲓⲧⲛ̅ ⲛⲉⲡⲛⲉⲩⲙⲁ ⲧⲏⲣⲟⲩ ⲉⲧⲟⲩⲁⲁⲃ ⲣ̅ⲣⲉϥⲛⲟⲓ̈ ⲉⲧϣⲟⲟⲙⲉ.	 Kind to man, steadfast, sure, free from care, having all power, overseeing all things, and going through all understanding, pure, and most subtil, spirits.	 ἀκώλυτον, εὐεργετικόν, φιλάνθρωπον, βέβαιον, ἀσφαλές, ἀµέριµνον, παντοδύναµον, πανεπίσκοπον καὶ διὰ πάντων χωροῦν πνευµάτων νοερῶν καθαρῶν λεπτοτάτων.						
Wisdom of Solomon	7	24	 ϯⲥⲟⲫⲓⲁ ⲅⲁⲣ ⲥⲕⲓⲙ ⲉ̀ϧⲟⲩⲛ ⲉ̀ⲛⲏ ⲉⲧⲕⲓⲙ ⲧⲏⲣⲟⲩ ⲥⲫⲟϩ ⲟⲩⲟϩ ⲉⲥⲛⲏⲟⲩ ⲉ̀ⲃⲟⲗ ϩⲓⲧⲉⲛ ⲡⲧⲏⲣϥ ⲉⲑⲃⲉ ⲡⲉⲥⲧⲟⲩⲃⲟ	 ⲧⲥⲟⲫⲓⲁ ⲅⲁⲣ ⲕⲓⲙ ⲉϩⲟⲩⲉ ⲛⲉⲧⲕⲓⲙ ⲧⲏⲣⲟⲩ ⲥϫⲱⲧⲉ ⲁⲩⲱ ⲥⲛⲏⲩ ⲉⲃⲟⲗ ϩⲓⲧⲙ̅ ⲡⲧⲏⲣϥ̅ ⲉⲧⲃⲉ ⲡⲉⲥⲧⲃ̅ⲃⲟ:	 For wisdom is more moving than any motion: she passeth and goeth through all things by reason of her pureness.	 πάσης γὰρ κινήσεως κινητικώτερον σοφία, διήκει δὲ καὶ χωρεῖ διὰ πάντων διὰ τὴν καθαρότητα·						
Wisdom of Solomon	7	25	 ⲟⲩϣⲁϩ ⲅⲁⲣ ⲇⲉ ⲛ̀ⲧⲉ ⲧϫⲟⲙ ⲙ̀ⲫϯ ⲟⲩⲟϩ ⲟⲩϧⲁϯ ⲉⲃⲟⲗ ϧⲉⲛ ⲡⲓⲱⲟⲩ ⲉⲑⲟⲩⲁⲃ ⲛ̀ⲧⲉ ⲡⲓⲡⲁⲛⲧⲟⲕⲣⲁⲧⲱⲣ ⲉⲑⲃⲉ ⲫⲁⲓ ⲙ̀ⲙⲟⲛ ϩⲗⲓ ⲉϥϭⲁϧⲉⲙ ϧⲱⲛⲧ ⲉ̀ⲣⲟⲥ	 ⲉⲥⲛⲏⲩ ⲅⲁⲣ ⲉⲃⲟⲗ ϩⲓⲧⲛ̅ ⲧϭⲟⲙ ⲙ̅ⲡⲛⲟⲩⲧⲉ ⲁⲩⲱ ⲉⲃⲟⲗ ϩⲙ̅ ⲡⲉⲟⲟⲩ ⲉⲧⲟⲩⲁⲁⲃ ⲛ̅ⲧⲉ ⲡⲡⲁⲛⲧⲟⲕⲣⲁⲧⲱⲣ ⲉⲧⲃⲉ ⲡⲁⲓ̈ ⲙⲉⲣⲉ ⲗⲁⲁⲩ ⲉϥϫⲁϩⲙ̅ ⲧⲱⲙⲛ̅ⲧ ⲉⲣⲟⲥ.	 For she is the breath of the power of God, and a pure influence flowing from the glory of the Almighty: therefore can no defiled thing fall into her.	 ἀτµὶς γάρ ἐστιν τῆς τοῦ θεοῦ δυνάµεως καὶ ἀπόρροια τῆς τοῦ παντοκράτορος δόξης εἰλικρινής· διὰ τοῦτο οὐδὲν µεµιαµµένον εἰς αὐτὴν παρεµπίπτει.						
Wisdom of Solomon	7	26	 ⲟⲩⲟⲩⲱⲓⲛⲓ ⲅⲁⲣ ⲧⲉ ⲛ̀ⲧⲉ ⲡⲓⲟⲩⲱⲓⲛⲓ ⲛⲉⲛⲉϩ ⲟⲩⲟϩ ⲟⲩⲓⲁⲗ ⲉⲥⲟⲩⲁⲃ ⲧⲉ ⲛ̀ⲧⲉ ⲛⲓϩⲃⲏⲟⲩⲓ ⲛ̀ⲧⲉ ⲫϯ ⲟⲩⲟϩ ⲧϩⲓⲕⲱⲛ ⲛ̀ⲧⲉ ⲧⲉϥⲙⲉⲧⲁⲅⲁⲑⲟⲥ ⲧⲉ	 ⲟⲩⲉⲓⲛⲉ ⲅⲁⲣ ⲧⲉ ⲛ̅ⲧⲉ ⲡⲟⲩⲟⲉⲓⲛ ⲛ̅ϣⲁ ⲉⲛⲉϩ ⲁⲩⲱ ⲟⲩⲉⲓⲁⲗ ⲉⲥⲟⲩⲁⲁⲃ ⲛ̅ⲧⲉ ⲧⲉⲛⲉⲣⲅⲓⲁ ⲙ̅ⲡⲛⲟⲩⲧⲉ ⲁⲩⲱ ⲑⲓⲕⲱⲛ ⲛ̅ⲧⲉϥⲙⲛ̅ⲧⲁⲅⲁⲑⲟⲥ.	 For she is the brightness of the everlasting light, the unspotted mirror of the power of God, and the image of his goodness.	 ἀπαύγασµα γάρ ἐστιν φωτὸς ἀϊδίου καὶ ἔσοπτρον ἀκηλίδωτον τῆς τοῦ θεοῦ ἐνεργείας καὶ εἰκὼν τῆς ἀγαθότητος αὐτοῦ.						
Wisdom of Solomon	7	27	 ⲟⲩ ⲓⲧⲉ ⲉⲥϫⲉⲙϫⲟⲙ ⲉ̀ϩⲱⲃ ⲛⲓⲃⲉⲛ ⲟⲩⲟϩ ⲥⲭⲏ ϧⲁⲣⲓϧⲁⲣⲟⲥ ⲉⲥⲓⲣⲓ ⲙⲡⲧⲏⲣϥ ⲙ̀ⲃⲉⲣⲓ ⲟⲩⲟϩ ⲕⲁⲧⲁ ⲅⲉⲛⲉⲁ ⲉⲥϣⲉ ⲉ̀ϧⲟⲩⲛ ⲉ̀ϩⲁⲛⲯⲩⲭⲏ ⲉⲩⲟⲩⲁⲃ ⲉⲥⲓⲣⲓ ⲙ̀ⲙⲱⲟⲩ ⲛ̀ϣⲫⲏⲣ ⲙ̀ⲫϯ ⲟⲩⲟϩ ⲙ̀ⲡⲣⲟⲫⲏⲧⲏⲥ	 ⲉⲟⲩⲉⲓ ⲇⲉ ⲧⲉ ⲉⲥϭⲙ̅ϭⲟⲙ ⲉϩⲱⲃ ⲛⲓⲙ ⲁⲩⲱ ⲉⲥϭⲉⲉⲧ ϩⲁⲣⲓ ϩⲁⲣⲟⲥ ⲉⲥⲉⲓⲣⲉ ⲙ̅ⲡⲧⲏⲣϥ̅ ⲙ̅ⲃⲣ̅ⲣⲉ ⲁⲩⲱ ⲕⲁⲧⲁ ⲅⲉⲛⲉⲁ ⲥⲃⲏⲕ ⲉϩⲟⲩⲛ ⲉⲛⲉⲯⲩⲭⲏ ⲛ̅ⲛⲉⲧⲟⲩⲁⲁⲃ ⲥⲉⲓⲣⲉ ⲙ̅ⲙⲟⲟⲩ ⲛ̅ϣⲃⲏⲣ ⲉⲡⲛⲟⲩⲧⲉ ⲁⲩⲱ ⲙ̅ⲡⲣⲟⲫⲏⲧⲏⲥ.	 And being but one, she can do all things: and remaining in herself, she maketh all things new: and in all ages entering into holy souls, she maketh them friends of God, and prophets.	 µία δὲ οὖσα πάντα δύναται καὶ µένουσα ἐν αὑτῇ τὰ πάντα καινίζει καὶ κατὰ γενεὰς εἰς ψυχὰς ὁσίας µεταβαίνουσα φίλους θεοῦ καὶ προφήτας κατασκευάζει·						
Wisdom of Solomon	7	28	 ⲫϯ ⲅⲁⲣ ⲙⲉⲓ ⲛ̀ϩⲗⲓ ⲁⲛ ⲉ̀ⲃⲏⲗ ⲉ̀ⲫⲏ ⲉⲧϣⲟⲡ ϧⲉⲛ ϯⲥⲟⲫⲓⲁ	 ⲙ̅ⲡⲛⲟⲩⲧⲉ ⲅⲁⲣ ⲙⲉ ⲗⲗⲁⲁⲩ ⲁⲛ ⲉⲓⲙⲏⲧⲓ ⲡⲉⲧⲟⲩⲏϩ ϩⲛ̅ ⲧⲥⲟⲫⲓⲁ:	 For God loveth none but him that dwelleth with wisdom.	 οὐθὲν γὰρ ἀγαπᾷ ὁ θεὸς εἰ µὴ τὸν σοφίᾳ συνοικοῦντα.						
Wisdom of Solomon	7	29	 ⲑⲁⲓ ⲅⲁⲣ ⲟⲩⲥⲁⲓⲉ ⲧⲉ ⲉϩⲟⲧⲉ ⲡⲓⲣⲏ ⲛⲉⲙ ⲉϩⲟⲧⲉ ⲡⲥⲉⲙⲛⲓ ⲛ̀ⲛⲓⲥⲓⲟⲩ ⲧⲏⲣⲟⲩ ⲁⲩϣⲁⲛⲧⲉⲛⲑⲱⲛⲥ ⲉ̀ⲫⲟⲩⲱⲓⲛⲓ ⲥⲛⲁⲉⲣϣⲟⲣⲡ ⲉ̀ⲣⲟϥ	 ⲧⲁⲓ̈ ⲅⲁⲣ ⲛⲉⲥⲱⲥ ⲉϩⲟⲩⲉ ⲡⲣⲏ ⲁⲩⲱ ⲉϩⲟⲩⲉ ⲡⲉⲥⲙⲓⲛⲉ ⲛ̅ⲛ̅ⲥⲓⲟⲩ ⲧⲏⲣⲟⲩ: ⲉⲩϣⲁⲛⲧⲛ̅ⲧⲱⲛⲥ̅ ⲉⲡⲟⲩⲟⲉⲓⲛ ⲥⲛⲁⲣ̅ϣⲟⲣⲡ̅ ⲉⲣⲟϥ.	 For she is more beautiful than the sun, and above all the order of stars: being compared with the light, she is found before it.	 ἔστιν γὰρ αὕτη εὐπρεπεστέρα ἡλίου καὶ ὑπὲρ πᾶσαν ἄστρων θέσιν. φωτὶ συγκρινοµένη εὑρίσκεται προτέρα·						
Wisdom of Solomon	7	30	 ⲫⲁⲓ ⲅⲁⲣ ⲉ̀ϣⲁⲣⲉ ⲡⲓⲉϫⲱⲣϩ ⲓ ⲉ̀ⲡⲉϥⲙⲁ ϯⲥⲟⲫⲓⲁ ⲇⲉ ⲙ̀ⲡⲁⲣⲉ ⲭⲁⲕⲓ ϣ̀ϫⲉⲙϫⲟⲙ ⲉ̀ⲣⲟⲥ	 ⲡⲁⲓ̈ ⲙⲉⲛ ⲅⲁⲣ ϣⲁⲣⲉ ⲧⲉⲩϣⲏ ⲉⲓ ⲉⲡⲉϥⲙⲁ ⲧⲥⲟⲫⲓⲁ ⲇⲉ ⲙⲉⲣⲉ ⲧⲕⲁⲕⲓⲁ ϭⲙ̅ϭⲟⲙ ⲉⲣⲟⲥ.	 For after this cometh night: but vice shall not prevail against wisdom.	 τοῦτο µὲν γὰρ διαδέχεται νύξ, σοφίας δὲ οὐ κατισχύει κακία.						
