book	chapter	verse	Bohairic	Sahidic	English	Greek	Fayyumic	Akhmimic	OldBohairic	Mesokemic	DialectP	Lycopolitan
Zechariah	1		ϯⲡⲣⲟⲫⲏⲧⲓⲁ ⲛ̀ⲧⲉ ⲍⲁⲭⲁⲣⲓⲁⲥ ⲡⲓⲡⲣⲟⲫⲏⲧⲏⲥ									
Zechariah	1	1	 ⲛ̀ϩⲣⲏⲓ ϧⲉⲛ ⲡⲓⲁⲃⲟⲧ ⲙ̀ⲙⲁϩⲏ̅ ⲛ̀ⲧⲉ ϯⲣⲟⲙⲡⲓ ⲙ̀ⲙⲁϩⲃ̅ϯ ϩⲓ ⲇⲁⲣⲓⲟⲥ ⲁ ⲟⲩⲥⲁϫⲓ ⲛ̀ⲧⲉ ⲡϭ̅ⲥ̅ ϣⲱⲡⲓ ϩⲁ ⲍⲁⲭⲁⲣⲓⲁⲥ ⲡϣⲏⲣⲓ ⲛ̀ⲃⲁⲣⲁⲭⲓⲁⲥ ⲡϣⲏⲣⲓ ⲛ̀ⲁⲇⲇⲱ ⲡⲓⲡⲣⲟⲫⲏⲧⲏⲥ ⲉϥϫⲱ ⲙ̀ⲙⲟⲥ		 In the eighth month, in the second year of the reign of Darius, the word of the Lord came to Zacharias, the son of Barachias, the son of Addo, the prophet, saying,	 Ἐν τῷ ὀγδόῳ µηνὶ ἔτους δευτέρου ἐπὶ Δαρείου ἐγένετο λόγος κυρίου πρὸς Ζαχαριαν τὸν τοῦ Βαραχιου υἱὸν Αδδω τὸν προφήτην λέγων						
Zechariah	1	2	 ϫⲉ ⲁϥϫⲱⲛⲧ ⲛ̀ϫⲉ ⲡϭ̅ⲥ̅ ⲉ̀ϫⲉⲛ ⲛⲉⲧⲉⲛⲓⲟϯ ϧⲉⲛ ⲟⲩⲛⲓϣϯ ⲛ̀ϫⲱⲛⲧ		 The Lord has been very angry with your fathers.	 Ὠργίσθη κύριος ἐπὶ τοὺς πατέρας ὑµῶν ὀργὴν µεγάλην.						
Zechariah	1	3	 ⲟⲩⲟϩ ⲉⲕⲉ̀ϫⲟⲥ ⲛⲱⲟⲩ ϫⲉ ⲛⲁⲓ ⲛⲉ ⲛⲏ ⲉⲧⲉϥϫⲱ ⲙ̀ⲙⲱⲟⲩ ⲛ̀ϫⲉ ⲡϭ̅ⲥ̅ ϫⲉ ⲕⲉⲧ ⲑⲏⲛⲟⲩ ϩⲁⲣⲟⲓ ⲟⲩⲟϩ ϯⲛⲁⲕⲟⲧⲧ ϩⲁⲣⲱⲧⲉⲛ ϩⲱ ⲡⲉϫⲉ ⲡϭ̅ⲥ̅ ⲡⲓⲡⲁⲛⲧⲟⲕⲣⲁⲧⲱⲣ		 And thou shalt say to them, Thus saith the Lord Almighty: Turn to me, saith the Lord of hosts, and I will turn to you, saith the Lord of hosts.	 καὶ ἐρεῖς πρὸς αὐτούς Τάδε λέγει κύριος παντοκράτωρ Ἐπιστρέψατε πρός µε, καὶ ἐπιστραφήσοµαι πρὸς ὑµᾶς, λέγει κύριος.						
Zechariah	1	4	 ⲟⲩⲟϩ ⲙ̀ⲡⲉⲣϣⲱⲡⲓ ⲙ̀ⲫⲣⲏϯ ⲛ̀ⲛⲉⲧⲉⲛⲓⲟϯ ⲉⲧⲁⲩⲉⲣⲉⲛⲕⲁⲗⲓⲛ ⲛⲱⲟⲩ ⲛ̀ϫⲉ ⲛⲓⲡⲣⲟⲫⲏⲧⲏⲥ ⲓⲥϫⲉⲛ ϣⲟⲣⲡ ⲉⲩϫⲱ ⲙ̀ⲙⲟⲥ ϫⲉ ⲛⲁⲓ ⲛⲉ ⲛⲏ ⲉⲧⲉϥϫⲱ ⲙ̀ⲙⲱⲟⲩ ⲛ̀ϫⲉ ⲡϭ̅ⲥ̅ ⲡⲓⲡⲁⲛⲧⲟⲕⲣⲁⲧⲱⲣ ϫⲉ ⲙⲁⲧⲁⲥⲑⲉ ⲑⲏⲛⲟⲩ ⲉ̀ⲃⲟⲗ ϩⲁ ⲛⲉⲧⲉⲛⲙⲱⲓⲧ ⲉⲧϩⲱⲟⲩ ⲛⲉⲙ ⲉ̀ⲃⲟⲗ ϩⲁ ⲛⲉⲧⲉⲛϩⲃⲏⲟⲩⲓ ⲉⲧϩⲱⲟⲩ ⲟⲩⲟϩ ⲙ̀ⲡⲟⲩϯϩⲑⲏⲟⲩ ⲉ̀ⲥⲱⲧⲉⲙ ⲛ̀ⲥⲱⲓ ⲡⲉϫⲉ ⲡϭ̅ⲥ̅		 And be ye not as your fathers, whom the prophets before charged, saying, Thus saith the Lord Almighty: Turn ye from your evil ways, and from your evil practices: but they hearkened not, and attended not to hearken to me, saith the Lord.	 καὶ µὴ γίνεσθε καθὼς οἱ πατέρες ὑµῶν, οἷς ἐνεκάλεσαν αὐτοῖς οἱ προφῆται οἱ ἔµπροσθεν λέγοντες Τάδε λέγει κύριος παντοκράτωρ Ἀποστρέψατε ἀπὸ τῶν ὁδῶν ὑµῶν τῶν πονηρῶν καὶ ἀπὸ τῶν ἐπιτηδευµάτων ὑµῶν τῶν πονηρῶν, καὶ οὐ προσέσχον τοῦ εἰσακοῦσαί µου, λέγει κύριος.						
Zechariah	1	5	 ⲁⲩⲑⲱⲛ ⲛⲉⲧⲉⲛⲓⲟϯ ⲛⲉⲙ ⲛⲓⲡⲣⲟⲫⲏⲧⲏⲥ ⲙⲏ ⲁⲩⲛⲁⲱⲛϧ ϣⲁ ⲉⲛⲉϩ		 Where are your fathers, and the prophets? Will they live for ever?	 οἱ πατέρες ὑµῶν ποῦ εἰσιν; καὶ οἱ προφῆται µὴ τὸν αἰῶνα ζήσονται;						
Zechariah	1	6	 ⲡⲗⲏⲛ ⲛⲁⲥⲁϫⲓ ⲛⲉⲙ ⲛⲁⲛⲟⲙⲟⲥ ϣⲟⲡⲟⲩ ⲉ̀ⲣⲱⲧⲉⲛ ⲛⲏ ⲁ̀ⲛⲟⲕ ⲉ̀ϯϩⲟⲛϩⲉⲛ ⲙ̀ⲙⲱⲟⲩ ϧⲉⲛ ⲟⲩⲡⲛ̅ⲁ̅ ⲛ̀ⲧⲉ ⲛⲁⲉⲃⲓⲁⲓⲕ ⲛⲓⲡⲣⲟⲫⲏⲧⲏⲥ ⲛⲏ ⲉⲧⲁⲩⲧⲁϩⲉ ⲛⲉⲧⲉⲛⲓⲟϯ ⲟⲩⲟϩ ⲁⲩⲉⲣⲟⲩⲱ ⲡⲉϫⲱⲟⲩ ⲕⲁⲧⲁ ⲫⲣⲏϯ ⲉⲧⲁϥⲟⲩⲁϩⲥⲁϩⲛⲓ ⲛ̀ϫⲉ ⲡϭ̅ⲥ̅ ⲡⲓⲡⲁⲛⲧⲟⲕⲣⲁⲧⲱⲣ ⲉ̀ⲓⲣⲓ ⲕⲁⲧⲁ ⲛⲉⲧⲉⲛⲙⲱⲓⲧ ⲛⲉⲙ ⲕⲁⲧⲁ ⲛⲉⲧⲉⲛϩⲃⲏⲟⲩⲓ ⲡⲁⲓⲣⲏϯ ⲁϥⲓⲣⲓ ⲛⲱⲧⲉⲛ		 But do ye receive my words and mine ordinances, all that I command by my Spirit to my servants the prophets, who lived in the days of your fathers; and they answered and said, As the Lord Almighty determined to do to us, according to our ways, and according to our practices, so has he done to us.	 πλὴν τοὺς λόγους µου καὶ τὰ νόµιµά µου δέχεσθε, ὅσα ἐγὼ ἐντέλλοµαι ἐν πνεύµατί µου τοῖς δούλοις µου τοῖς προφήταις, οἳ κατελάβοσαν τοὺς πατέρας ὑµῶν. καὶ ἀπεκρίθησαν καὶ εἶπαν Καθὼς παρατέτακται κύριος παντοκράτωρ τοῦ ποιῆσαι κατὰ τὰς ὁδοὺς ὑµῶν καὶ κατὰ τὰ ἐπιτηδεύµατα ὑµῶν, οὕτως ἐποίησεν ὑµῖν.						
Zechariah	1	7	 ⲛ̀ϩⲣⲏⲓ ϧⲉⲛ ⲥⲟⲩⲕ̅ⲇ̅ ⲙ̀ⲡⲓⲁⲃⲟⲧ ⲙ̀ⲙⲁϩⲓⲁ ⲫⲁⲓ ⲡⲉ ⲡⲓⲁⲃⲟⲧ ⲥⲁⲃⲁⲧ ϧⲉⲛ ϯⲣⲟⲙⲡⲓ ⲙ̀ⲙⲁϩⲃ̅ϯ ϩⲓ ⲇⲁⲣⲓⲟⲥ ⲁ ⲟⲩⲥⲁϫⲓ ⲛ̀ⲧⲉ ⲡϭ̅ⲥ̅ ϣⲱⲡⲓ ϩⲁ ⲍⲁⲭⲁⲣⲓⲁⲥ ⲡϣⲏⲣⲓ ⲙ̀ⲃⲁⲣⲁⲭⲓⲁⲥ ⲡϣⲏⲣⲓ ⲛ̀ⲁⲇⲇⲱ ⲡⲓⲡⲣⲟⲫⲏⲧⲏⲥ ⲉϥϫⲱ ⲙ̀ⲙⲟⲥ		 On the twenty-fourth day in the eleventh month, this is the month Sabat, in the second year of the reign of Darius, the word of the Lord came to Zacharias, the son of Barachias, the son of Addo, the prophet, saying,	 Τῇ τετράδι καὶ εἰκάδι τῷ ἑνδεκάτῳ µηνί — οὗτός ἐστιν ὁ µὴν Σαβατ — ἐν τῷ δευτέρῳ ἔτει ἐπὶ Δαρείου ἐγένετο λόγος κυρίου πρὸς Ζαχαριαν τὸν τοῦ Βαραχιου υἱὸν Αδδω τὸν προφήτην λέγων						
Zechariah	1	8	 ⲁⲓⲛⲁⲩ ϧⲉⲛ ⲡⲓⲉϫⲱⲣϩ ⲟⲩⲟϩ ϩⲏⲡⲡⲉ ⲓⲥ ⲟⲩⲣⲱⲙⲓ ⲉϥⲧⲁⲗⲏⲟⲩⲧ ⲉ̀ϫⲉⲛ ⲟⲩϩⲑⲟ ⲛ̀ⲁⲟⲩⲁⲛ ⲛ̀ⲭⲣⲱⲙ ⲟⲩⲟϩ ⲫⲁⲓ ⲛⲁϥⲟϩⲓ ⲉ̀ⲣⲁⲧϥ ϧⲉⲛ ⲑⲙⲏϯ ⲙ̀ⲡⲓⲧⲱⲟⲩ ⲃ̅ ⲉⲧⲟⲓ ⲛ̀ϧⲏⲓⲃⲓ ⲟⲩⲟϩ ϩⲓⲫⲁϩⲟⲩ ⲙ̀ⲙⲟϥ ϩⲁⲛϩⲑⲱⲣ ⲛ̀ⲁⲟⲩⲁⲛ ⲛ̀ⲭⲣⲱⲙ ⲛⲉⲙ ϩⲁⲛⲁⲟⲩⲁⲛ ⲙ̀ⲫⲓⲛ ⲛⲉⲙ ϩⲁⲛⲁⲟⲩⲓ ⲁⲟⲩⲁⲛ ⲛⲉⲙ ϩⲁⲛⲁⲟⲩⲁⲛ ⲛ̀ⲟⲩⲱⲃϣ		 I saw by night, and behold a man mounted on a red horse, and he stood between the shady mountains; and behind him were red horses, and grey, and piebald, and white.	 Ἑώρακα τὴν νύκτα καὶ ἰδοὺ ἀνὴρ ἐπιβεβηκὼς ἐπὶ ἵππον πυρρόν, καὶ οὗτος εἱστήκει ἀνὰ µέσον τῶν δύο ὀρέων τῶν κατασκίων, καὶ ὀπίσω αὐτοῦ ἵπποι πυρροὶ καὶ ψαροὶ καὶ ποικίλοι καὶ λευκοί.						
Zechariah	1	9	 ⲟⲩⲟϩ ⲡⲉϫⲏⲓ ϫⲉ ⲟⲩ ⲛⲉ ⲛⲁⲓ ⲡϭ̅ⲥ̅ ⲟⲩⲟϩ ⲡⲉϫⲁϥ ⲛⲏⲓ ⲛ̀ϫⲉ ⲡⲓⲁⲅⲅⲉⲗⲟⲥ ⲉⲧⲥⲁϫⲓ ⲛ̀ϧⲣⲏⲓ ⲛ̀ϧⲏⲧ ϫⲉ ⲁ̀ⲛⲟⲕ ϯⲛⲁⲧⲁⲙⲟⲕ ϫⲉ ⲟⲩ ⲛⲉ ⲛⲁⲓ		 And I said, What are these, my lord? And the angel spoke with me said to me, I will shew thee what these things are.	 καὶ εἶπα Τί οὗτοι, κύριε; καὶ εἶπεν πρός µε ὁ ἄγγελος ὁ λαλῶν ἐν ἐµοί Ἐγὼ δείξω σοι τί ἐστιν ταῦτα.						
Zechariah	1	10	 ⲟⲩⲟϩ ⲁϥⲉⲣⲟⲩⲱ ⲛ̀ϫⲉ ⲡⲓⲣⲱⲙⲓ ⲫⲏ ⲉⲧⲟϩⲓ ⲉ̀ⲣⲁⲧϥ ϧⲉⲛ ⲑⲙⲏϯ ⲛ̀ⲛⲓⲧⲱⲟⲩ ⲟⲩⲟϩ ⲡⲉϫⲁϥ ⲛⲏⲓ ϫⲉ ⲛⲁⲓ ⲛⲉ ⲛⲏ ⲉⲧⲁϥⲟⲩⲟⲣⲡⲟⲩ ⲉ̀ⲃⲟⲗ ⲛ̀ϫⲉ ⲡϭ̅ⲥ̅ ⲉ̀ⲙⲉϣⲧ ⲡⲓⲕⲁϩⲓ		 And the man that stood between the mountains answered, and said to me, These are they whom the Lord has sent forth to go round the earth.	 καὶ ἀπεκρίθη ὁ ἀνὴρ ὁ ἐφεστηκὼς ἀνὰ µέσον τῶν ὀρέων καὶ εἶπεν πρός µε Οὗτοί εἰσιν οὓς ἐξαπέσταλκεν κύριος τοῦ περιοδεῦσαι τὴν γῆν.						
Zechariah	1	11	 ⲟⲩⲟϩ ⲁⲩⲉⲣⲟⲩⲱ ⲙ̀ⲡⲓⲁⲅⲅⲉⲗⲟⲥ ⲛ̀ⲧⲉ ⲡϭ̅ⲥ̅ ⲫⲏ ⲉⲧⲟϩⲓ ⲉ̀ⲣⲁⲧϥ ϧⲉⲛ ⲑⲙⲏϯ ⲛ̀ⲛⲓⲧⲱⲟⲩ ⲡⲉϫⲱⲟⲩ ϫⲉ ⲁⲛⲙⲉϣⲧ ⲡⲓⲕⲁϩⲓ ⲟⲩⲟϩ ⲓⲥ ⲡⲓⲕⲁϩⲓ ⲧⲏⲣϥ ⲥⲉϣⲟⲡ ⲛ̀ϧⲏⲧϥ ⲟⲩⲟϩ ϥϩⲟⲩⲣⲱⲟⲩ		 And they answered the angel of the Lord that stood between the mountains, and said, We have gone round all the earth, and, behold, all the earth is inhabited, and is at rest.	 καὶ ἀπεκρίθησαν τῷ ἀγγέλῳ κυρίου τῷ ἐφεστῶτι ἀνὰ µέσον τῶν ὀρέων καὶ εἶπον Περιωδεύκαµεν πᾶσαν τὴν γῆν, καὶ ἰδοὺ πᾶσα ἡ γῆ κατοικεῖται καὶ ἡσυχάζει.						
Zechariah	1	12	 ⲟⲩⲟϩ ⲁϥⲉⲣⲟⲩⲱ ⲛ̀ϫⲉ ⲡⲓⲁⲅⲅⲉⲗⲟⲥ ⲛ̀ⲧⲉ ⲡϭ̅ⲥ̅ ⲡⲉϫⲁϥ ϫⲉ ⲡϭ̅ⲥ̅ ⲡⲓⲡⲁⲛⲧⲟⲕⲣⲁⲧⲱⲣ ϣⲁ ⲑⲛⲁⲩ ⲭⲛⲁⲛⲁⲓ ⲁⲛ ⲉ̀ⲓⲗ̅ⲏ̅ⲙ̅ ⲛⲉⲙ ⲛⲓⲃⲁⲕⲓ ⲛ̀ⲧⲉ ⲓⲟⲩⲇⲁ ⲛⲏ ⲉⲧⲁⲕϩⲓⲡϩⲟ ⲙ̀ⲙⲱⲟⲩ ⲟⲩⲟϩ ⲑⲁⲓ ⲑⲙⲁϩⲟ ⲛ̀ⲣⲟⲙⲡⲓ ⲧⲉ		 Then the angel of the Lord answered and said, O Lord Almighty, how long wilt thou have no mercy on Jerusalem, and the cities of Juda, which thou has disregarded these seventy years?	 καὶ ἀπεκρίθη ὁ ἄγγελος κυρίου καὶ εἶπεν Κύριε παντοκράτωρ, ἕως τίνος οὐ µὴ ἐλεήσῃς τὴν Ιερουσαληµ καὶ τὰς πόλεις Ιουδα, ἃς ὑπερεῖδες τοῦτο ἑβδοµηκοστὸν ἔτος;						
Zechariah	1	13	 ⲟⲩⲟϩ ⲁϥⲉⲣⲟⲩⲱ ⲛ̀ϫⲉ ⲡϭ̅ⲥ̅ ⲡⲓⲡⲁⲛⲧⲟⲕⲣⲁⲧⲱⲣ ⲙ̀ⲡⲓⲁⲅⲅⲉⲗⲟⲥ ⲉⲧⲥⲁϫⲓ ⲛ̀ϧⲣⲏⲓ ⲛ̀ϧⲏⲧ ⲛ̀ϩⲁⲛⲥⲁϫⲓ ⲉ̀ⲛⲁⲛⲉⲩ ⲛⲉⲙ ϩⲁⲛⲥⲁϫⲓ ⲛ̀ⲛⲟⲙϯ		 And the Lord Almighty answered the angel that spoke with me good words and consolatory sayings.	 καὶ ἀπεκρίθη κύριος παντοκράτωρ τῷ ἀγγέλῳ τῷ λαλοῦντι ἐν ἐµοὶ ῥήµατα καλὰ καὶ λόγους παρακλητικούς.						
Zechariah	1	14	 ⲟⲩⲟϩ ⲡⲉϫⲁϥ ⲛⲏⲓ ⲛ̀ϫⲉ ⲡⲓⲁⲅⲅⲉⲗⲟⲥ ⲉⲧⲥⲁϫⲓ ⲛ̀ϧⲣⲏⲓ ⲛ̀ϧⲏⲧ ϫⲉ ⲱϣ ⲉ̀ⲃⲟⲗ ⲉⲕϫⲱ ⲙ̀ⲙⲟⲥ ϫⲉ ⲛⲁⲓ ⲛⲉ ⲛⲏ ⲉⲧⲉϥϫⲱ ⲙ̀ⲙⲱⲟⲩ ⲛ̀ϫⲉ ⲡϭ̅ⲥ̅ ⲡⲓⲡⲁⲛⲧⲟⲕⲣⲁⲧⲱⲣ ϫⲉ ⲁⲓⲭⲟϩ ⲉ̀ⲓⲗ̅ⲏ̅ⲙ̅ ⲛⲉⲙ ⲥⲓⲱⲛ ϧⲉⲛ ⲟⲩⲛⲓϣϯ ⲛ̀ⲭⲟϩ		 And the angel that spoke with me said to me, Cry out and say, Thus saith the Lord Almighty; I have been jealous for Jerusalem and Sion with great jealousy.	 καὶ εἶπεν πρός µε ὁ ἄγγελος ὁ λαλῶν ἐν ἐµοί Ἀνάκραγε λέγων Τάδε λέγει κύριος παντοκράτωρ Ἐζήλωκα τὴν Ιερουσαληµ καὶ τὴν Σιων ζῆλον µέγαν						
Zechariah	1	15	 ⲟⲩⲟϩ ⲁ̀ⲛⲟⲕ ϯⲛⲁϫⲱⲛⲧ ϧⲉⲛ ⲟⲩⲛⲓϣϯ ⲛ̀ϫⲱⲛⲧ ⲉ̀ϫⲉⲛ ⲛⲓⲉⲑⲛⲟⲥ ⲛⲏ ⲉⲧⲁⲩⲧⲱⲟⲩⲛⲟⲩ ⲉ̀ϫⲉⲛ ⲑⲏⲛⲟⲩ ⲉ̀ⲫⲙⲁ ϫⲉ ⲁ̀ⲛⲟⲕ ⲙⲉⲛ ⲁⲓϫⲱⲛⲧ ⲛ̀ⲟⲩⲕⲟⲩϫⲓ ⲛ̀ⲑⲱⲟⲩ ⲇⲉ ⲁⲩⲧⲱⲟⲩⲛⲟⲩ ⲉ̀ϫⲉⲛ ⲑⲏⲛⲟⲩ ⲉ̀ϩⲁⲛⲡⲉⲧϩⲱⲟⲩ		 And I am very angry with the heathen that combine to attack her: forasmuch as I indeed was a little angry, but they combined to attack her for evil.	 καὶ ὀργὴν µεγάλην ἐγὼ ὀργίζοµαι ἐπὶ τὰ ἔθνη τὰ συνεπιτιθέµενα ἀνθ’ ὧν ἐγὼ µὲν ὠργίσθην ὀλίγα, αὐτοὶ δὲ συνεπέθεντο εἰς κακά.						
Zechariah	1	16	 ⲉⲑⲃⲉ ⲫⲁⲓ ⲛⲁⲓ ⲛⲉ ⲛⲏ ⲉⲧⲉϥϫⲱ ⲙ̀ⲙⲱⲟⲩ ⲛ̀ϫⲉ ⲡϭ̅ⲥ̅ ϫⲉ ϯⲛⲁⲧⲁⲥⲑⲟ ⲉ̀ϫⲉⲛ ⲓⲗ̅ⲏ̅ⲙ̅ ϧⲉⲛ ⲟⲩⲙⲉⲧϣⲉⲛϩⲏⲧ ⲟⲩⲟϩ ⲡⲁⲏⲓ ⲉⲩⲉ̀ⲕⲟⲧϥ ⲛ̀ϧⲏⲧⲥ ⲛ̀ⲕⲉⲥⲟⲡ ⲡⲉϫⲉ ⲡϭ̅ⲥ̅ ⲡⲓⲡⲁⲛⲧⲟⲕⲣⲁⲧⲱⲣ ⲟⲩⲟϩ ⲟⲩϣⲓ ⲉⲩⲉ̀ⲫⲱⲣϣ ⲉⲧⲓ ⲉ̀ϫⲉⲛ ⲓⲗ̅ⲏ̅ⲙ̅		 Therefore thus saith the Lord: I will return to Jerusalem with compassion; and my house shall be rebuilt in her, saith the Lord Almighty, and a measuring line shall yet be stretched out over Jerusalem.	 διὰ τοῦτο τάδε λέγει κύριος Ἐπιστρέψω ἐπὶ Ιερουσαληµ ἐν οἰκτιρµῷ, καὶ ὁ οἶκός µου ἀνοικοδοµηθήσεται ἐν αὐτῇ, λέγει κύριος παντοκράτωρ, καὶ µέτρον ἐκταθήσεται ἐπὶ Ιερουσαληµ ἔτι.						
Zechariah	1	17	 ⲟⲩⲟϩ ⲡⲉϫⲁϥ ⲛⲏⲓ ⲛ̀ϫⲉ ⲡⲓⲁⲅⲅⲉⲗⲟⲥ ⲉⲧⲥⲁϫⲓ ⲛ̀ϧⲣⲏⲓ ⲛ̀ϧⲏⲧ ϫⲉ ⲱϣ ⲉ̀ⲃⲟⲗ ⲉⲕϫⲱ ⲙ̀ⲙⲟⲥ ϫⲉ ⲛⲁⲓ ⲛⲉ ⲛⲏ ⲉⲧⲉϥϫⲱ ⲙ̀ⲙⲱⲟⲩ ⲛ̀ϫⲉ ⲡϭ̅ⲥ̅ ⲡⲓⲡⲁⲛⲧⲟⲕⲣⲁⲧⲱⲣ ϫⲉ ⲉⲧⲓ ⲉⲩⲉ̀ⲫⲱⲛ ⲉ̀ⲃⲟⲗ ⲛ̀ϫⲉ ⲛⲓⲃⲁⲕⲓ ϧⲉⲛ ϩⲁⲛⲁⲅⲁⲑⲟⲛ ⲟⲩⲟϩ ⲉⲧⲓ ⲉϥⲉ̀ⲛⲁⲓ ⲛ̀ⲥⲓⲱⲛ ϫⲉ ⲡϭ̅ⲥ̅ ⲟⲩⲟϩ ⲉϥⲉ̀ⲥⲱⲧⲡ ⲉⲧⲓ ⲛ̀ⲓⲗ̅ⲏ̅ⲙ̅		 And the angel that spoke with me said to me, Cry yet, and say, Thus saith the Lord Almighty; Yet shall cities be spread abroad through prosperity; and the Lord shall yet have mercy upon Sion, and shall choose Jerusalem.	 καὶ εἶπεν πρός µε ὁ ἄγγελος ὁ λαλῶν ἐν ἐµοί Ἀνάκραγε λέγων Τάδε λέγει κύριος παντοκράτωρ Ἔτι διαχυθήσονται πόλεις ἐν ἀγαθοῖς, καὶ ἐλεήσει κύριος ἔτι τὴν Σιων καὶ αἱρετιεῖ ἔτι τὴν Ιερουσαληµ.						
Zechariah	1	18	 ⲟⲩⲟϩ ⲁⲓϥⲁⲓ ⲛ̀ⲛⲁⲃⲁⲗ ⲉ̀ⲡϣⲱⲓ ⲁⲓⲛⲁⲩ ⲟⲩⲟϩ ϩⲏⲡⲡⲉ ⲓⲥ ⲇ̅ ⲛ̀ⲧⲁⲡ		 And I lifted up mine eyes and looked, and behold four horns.	 Καὶ ἦρα τοὺς ὀφθαλµούς µου καὶ εἶδον καὶ ἰδοὺ τέσσαρα κέρατα.						
Zechariah	1	19	 ⲟⲩⲟϩ ⲡⲉϫⲏⲓ ⲙ̀ⲡⲓⲁⲅⲅⲉⲗⲟⲥ ⲉⲧⲥⲁϫⲓ ⲛ̀ϧⲣⲏⲓ ⲛ̀ϧⲏⲧ ϫⲉ ⲟⲩ ⲛⲉ ⲛⲁⲓ ⲡϭ̅ⲥ̅ ⲟⲩⲟϩ ⲡⲉϫⲁϥ ⲛⲏⲓ ϫⲉ ⲛⲁⲓ ⲛⲉ ⲛⲓⲧⲁⲡ ⲉⲧⲁⲩϫⲉⲣ ⲓⲟⲩⲇⲁ ⲉ̀ⲃⲟⲗ ⲛⲉⲙ ⲡⲓⲥ̅ⲗ̅		 And I said to the angel that spoke with me, What are these things, my lord? And he said to me, These are the horns that have scattered Juda, and Israel, and Jerusalem.	 καὶ εἶπα πρὸς τὸν ἄγγελον τὸν λαλοῦντα ἐν ἐµοί Τί ἐστιν ταῦτα, κύριε; καὶ εἶπεν πρός µε Ταῦτα τὰ κέρατα τὰ διασκορπίσαντα τὸν Ιουδαν καὶ τὸν Ισραηλ.						
Zechariah	1	20	 ⲟⲩⲟϩ ⲁϥⲧⲁⲙⲟⲓ ⲛ̀ϫⲉ ⲡϭ̅ⲥ̅ ⲉ̀ⲇ̅ ⲛ̀ⲁⲙϣⲉ		 And the Lord shewed me four artificers.	 καὶ ἔδειξέν µοι κύριος τέσσαρας τέκτονας.						
Zechariah	1	21	 ⲟⲩⲟϩ ⲡⲉϫⲏⲓ ϫⲉ ⲉⲣⲉ ⲛⲁⲓ ⲛⲏⲟⲩ ⲉ̀ⲉⲣ ⲟⲩ ⲟⲩⲟϩ ⲡⲉϫⲁϥ ⲛⲏⲓ ϫⲉ ⲛⲁⲓ ⲛⲉ ⲛⲓⲧⲁⲡ ⲉⲧⲁⲩϫⲉⲣ ⲓⲟⲩⲇⲁ ⲉ̀ⲃⲟⲗ ⲛⲉⲙ ⲡⲓⲥ̅ⲗ̅ ⲟⲩⲟϩ ⲁⲩⲉⲣⲕⲟⲣϫⲟⲩ ⲟⲩⲟϩ ⲙ̀ⲡⲉ ϩⲗⲓ ⲙ̀ⲙⲱⲟⲩ ϥⲁⲓ ⲛ̀ⲧⲉϥⲁⲫⲉ ⲉ̀ⲡϣⲱⲓ ⲟⲩⲟϩ ⲁⲩⲓ̀ ⲉ̀ϧⲟⲩⲛ ⲛ̀ϫⲉ ⲛⲁⲓ ⲉ̀ϣⲉⲡϣⲱⲡⲟⲩ ϧⲉⲛ ⲛⲟⲩϫⲓϫ ⲡⲁⲓ ⲇ̅ ⲛ̀ⲧⲁⲡ ⲛⲓⲉⲑⲛⲟⲥ ⲛⲉ ⲉⲧϭⲓⲥⲓ ⲙ̀ⲙⲱⲟⲩ ⲉ̀ϫⲉⲛ ⲡⲓⲕⲁϩⲓ ⲛ̀ⲧⲉ ⲡϭ̅ⲥ̅ ⲉ̀ϫⲟⲣϥ ⲉ̀ⲃⲟⲗ		 And I said, What are these coming to do? And he said, These are the horns that scattered Juda, and they broke Israel in pieces, and none of them lifted up his head: and these are come forth to sharpen them for their hands, even the four horns, the nations that lifted up the horn against the land of the Lord to scatter it.	 καὶ εἶπα Τί οὗτοι ἔρχονται ποιῆσαι; καὶ εἶπεν πρός µε Ταῦτα τὰ κέρατα τὰ διασκορπίσαντα τὸν Ιουδαν καὶ τὸν Ισραηλ κατέαξαν, καὶ οὐδεὶς αὐτῶν ἦρεν κεφαλήν· καὶ εἰσῆλθον οὗτοι τοῦ ὀξῦναι αὐτὰ εἰς χεῖρας αὐτῶν τὰ τέσσαρα κέρατα τὰ ἔθνη τὰ ἐπαιρόµενα κέρας ἐπὶ τὴν γῆν κυρίου τοῦ διασκορπίσαι αὐτήν.						
Zechariah	2	1	 ⲟⲩⲟϩ ⲁⲓϥⲁⲓ ⲛ̀ⲛⲁⲃⲁⲗ ⲉ̀ⲡϣⲱⲓ ⲁⲓⲛⲁⲩ ⲟⲩⲟϩ ϩⲏⲡⲡⲉ ⲓⲥ ⲟⲩⲣⲱⲙⲓ ⲟⲩⲟϩ ⲛⲉ ⲟⲩⲟⲛ ⲟⲩⲛⲟϩ ⲛ̀ⲣⲱϣ ϧⲉⲛ ⲧⲉϥϫⲓϫ		 And I lifted up mine eyes, and looked, and behold a man, and in his hand a measuring line.	 Καὶ ἦρα τοὺς ὀφθαλµούς µου καὶ εἶδον καὶ ἰδοὺ ἀνὴρ καὶ ἐν τῇ χειρὶ αὐτοῦ σχοινίον γεωµετρικόν.						
Zechariah	2	2	 ⲟⲩⲟϩ ⲡⲉϫⲏⲓ ⲛⲁϥ ϫⲉ ⲁⲕⲙⲟϣⲓ ⲉ̀ⲑⲱⲛ ⲛ̀ⲑⲟⲕ ⲟⲩⲟϩ ⲡⲉϫⲁϥ ⲛⲏⲓ ϫⲉ ⲉⲓϣⲓ ⲛ̀ⲓⲗ̅ⲏ̅ⲙ̅ ⲟⲩⲟϩ ⲉ̀ⲛⲁⲩ ϫⲉ ⲟⲩ ⲁϣ ⲙⲁⲓⲏ ⲡⲉ ⲡⲉⲥⲟⲩⲟⲥⲑⲉⲛ ⲟⲩⲟϩ ⲟⲩ ⲁϣ ⲙⲁⲓⲏ ⲧⲉ ⲧⲉⲥϣⲓⲏ		 And I said to him, Whither goest thou? And he said to me, To measure Jerusalem, to see what is the breadth of it, and what is the length of it.	 καὶ εἶπα πρὸς αὐτόν Ποῦ σὺ πορεύῃ; καὶ εἶπεν πρός µε Διαµετρῆσαι τὴν Ιερουσαληµ τοῦ ἰδεῖν πηλίκον τὸ πλάτος αὐτῆς ἐστιν καὶ πηλίκον τὸ µῆκος.						
Zechariah	2	3	 ⲟⲩⲟϩ ϩⲏⲡⲡⲉ ⲓⲥ ⲡⲓⲁⲅⲅⲉⲗⲟⲥ ⲉⲧⲥⲁϫⲓ ⲛ̀ϧⲣⲏⲓ ⲛ̀ϧⲏⲧ ⲛⲁϥⲟϩⲓ ⲉ̀ⲣⲁⲧϥ ⲡⲉ ⲟⲩⲟϩ ⲛⲁϥⲛⲏⲟⲩ ⲉ̀ⲃⲟⲗ ⲡⲉ ⲛ̀ϫⲉ ⲕⲉⲁⲅⲅⲉⲗⲟⲥ ⲉ̀ⲑⲣⲉϥⲉⲣⲁⲡⲁⲛⲧⲁⲛ ⲉ̀ⲣⲟϥ		 And, behold, the angel that spoke with me stood by, and another angel went forth to meet him,	 καὶ ἰδοὺ ὁ ἄγγελος ὁ λαλῶν ἐν ἐµοὶ εἱστήκει, καὶ ἄγγελος ἕτερος ἐξεπορεύετο εἰς συνάντησιν αὐτῷ						
Zechariah	2	4	 ⲟⲩⲟϩ ⲡⲉϫⲁϥ ⲛⲁϥ ⲉϥϫⲱ ⲙ̀ⲙⲟⲥ ϫⲉ ϭⲟϫⲓ ⲥⲁϫⲓ ⲛⲉⲙ ⲛⲓϧⲉⲗϣⲓⲣⲓ ⲉⲧⲧⲏ ⲉⲕϫⲱ ⲙ̀ⲙⲟⲥ ϫⲉ ⲉⲥⲉ̀ϣⲱⲡⲓ ⲛ̀ϫⲉ ⲓⲗ̅ⲏ̅ⲙ̅ ⲉ̀ⲥⲟⲧⲡ ⲛ̀ⲟⲩⲧⲁϩ ⲛ̀ⲧⲉⲛ ⲡⲁϣⲁⲓ ⲛ̀ⲛⲓⲣⲱⲙⲓ ⲛⲉⲙ ⲛⲓⲧⲉⲃⲛⲱⲟⲩⲓ ⲉⲧϧⲉⲛ ⲧⲉⲥⲙⲏϯ		 and spoke to him, saying, Run and speak to that young man, saying, Jerusalem shall be fully inhabited by reason of the abundance of men and cattle in the midst of her.	 καὶ εἶπεν πρὸς αὐτὸν λέγων Δράµε καὶ λάλησον πρὸς τὸν νεανίαν ἐκεῖνον λέγων Κατακάρπως κατοικηθήσεται Ιερουσαληµ ἀπὸ πλήθους ἀνθρώπων καὶ κτηνῶν ἐν µέσῳ αὐτῆς·						
Zechariah	2	5	 ⲟⲩⲟϩ ⲁ̀ⲛⲟⲕ ⲉⲓⲉ̀ϣⲱⲡⲓ ⲛⲁⲥ ⲡⲉϫⲉ ⲡϭ̅ⲥ̅ ⲛ̀ⲟⲩⲥⲟⲃⲧ ⲛ̀ⲭⲣⲱⲙ ⲉϥⲕⲱϯ ⲟⲩⲟϩ ⲉⲓⲉ̀ϣⲱⲡⲓ ⲉⲩⲱⲟⲩ ϧⲉⲛ ⲧⲉⲥⲙⲏϯ		 And I will be to her, saith the Lord, a wall of fire round about, and I will be for a glory in the midst of her.	 καὶ ἐγὼ ἔσοµαι αὐτῇ, λέγει κύριος, τεῖχος πυρὸς κυκλόθεν καὶ εἰς δόξαν ἔσοµαι ἐν µέσῳ αὐτῆς.						
Zechariah	2	6	 ⲱ ⲱ ⲫⲱⲧ ⲉ̀ⲃⲟⲗ ϩⲁ ⲡⲕⲁϩⲓ ⲙ̀ⲡⲉⲙϩⲓⲧ ⲡⲉϫⲉ ⲡϭ̅ⲥ̅ ϫⲉ ⲉ̀ⲃⲟⲗ ϧⲉⲛ ⲡⲓϥⲧⲟⲩ ⲑⲏⲟⲩ ⲛ̀ⲧⲉ ⲧⲫⲉ ⲉⲓⲉ̀ⲑⲟⲩⲉⲧ ⲑⲏⲛⲟⲩ ⲡⲉϫⲉ ⲡϭ̅ⲥ̅		 Ho, ho, flee from the land of the north, saith the Lord: for I will gather you from the four winds of heaven, saith the Lord,	 ὦ ὦ φεύγετε ἀπὸ γῆς βορρᾶ, λέγει κύριος, διότι ἐκ τῶν τεσσάρων ἀνέµων τοῦ οὐρανοῦ συνάξω ὑµᾶς, λέγει κύριος·						
Zechariah	2	7	 ⲛⲁϩⲉⲙ ⲑⲏⲛⲟⲩ ⲉ̀ϧⲟⲩⲛ ⲉ̀ⲥⲓⲱⲛ ⲛⲏ ⲉⲧϣⲟⲡ ϧⲉⲛ ⲧϣⲉⲣⲓ ⲙ̀ⲃⲁⲃⲩⲗⲱⲛ		 even to Sion: deliver yourselves, ye that dwell with the daughter of Babylon.	 εἰς Σιων ἀνασῴζεσθε, οἱ κατοικοῦντες θυγατέρα Βαβυλῶνος.						
Zechariah	2	8	 ϫⲉ ⲟⲩⲏⲓ ⲛⲁⲓ ⲛⲉ ⲛⲏ ⲉⲧⲉϥϫⲱ ⲙ̀ⲙⲱⲟⲩ ⲛ̀ϫⲉ ⲡϭ̅ⲥ̅ ⲡⲓⲡⲁⲛⲧⲟⲕⲣⲁⲧⲱⲣ ⲁϥⲟⲩⲟⲣⲡⲧ ⲛⲱⲟⲩ ϩⲓⲫⲁϩⲟⲩ ⲛ̀ⲛⲓⲉⲑⲛⲟⲥ ⲉⲧⲁⲩϣⲉⲗ ⲑⲏⲛⲟⲩ ϫⲉ ⲟⲩⲏⲓ ⲫⲏ ⲉⲧϭⲓⲛⲉⲙⲱⲧⲉⲛ ⲁϥ ⲙ̀ⲫⲣⲏϯ ⲙ̀ⲫⲏ ⲉⲧϭⲓⲛⲉⲙ ⲧⲁⲗⲗⲟⲩ ⲛ̀ⲛⲉϥⲃⲁⲗ		 For thus saith the Lord Almighty; After the glory has he sent me to the nations that spoiled you: for he that touches you is as one that touches the apple of his eye.	 διότι τάδε λέγει κύριος παντοκράτωρ Ὀπίσω δόξης ἀπέσταλκέν µε ἐπὶ τὰ ἔθνη τὰ σκυλεύσαντα ὑµᾶς, διότι ὁ ἁπτόµενος ὑµῶν ὡς ἁπτόµενος τῆς κόρης τοῦ ὀφθαλµοῦ αὐτοῦ·						
Zechariah	2	9	 ϫⲉ ⲟⲩⲏⲓ ϩⲏⲡⲡⲉ ⲁ̀ⲛⲟⲕ ϯⲛⲁⲓⲛⲓ ⲛ̀ⲧⲁϫⲓϫ ⲟⲩⲟϩ ⲉⲩⲉ̀ϣⲱⲡⲓ ⲉ̀ⲡϣⲱⲗ ⲛ̀ⲛⲏ ⲉⲧⲁⲩϣⲟⲗⲟⲩ ⲟⲩⲟϩ ⲉⲣⲉⲧⲉⲛⲉ̀ⲉⲙⲓ ϫⲉ ⲡϭ̅ⲥ̅ ⲡⲓⲡⲁⲛⲧⲟⲕⲣⲁⲧⲱⲣ ⲡⲉⲧⲁϥⲟⲩⲟⲣⲡⲧ		 For, behold, I bring my hand upon them, and they shall be a spoil to them that serve them: and ye shall know that the Lord Almighty has sent me.	 διότι ἰδοὺ ἐγὼ ἐπιφέρω τὴν χεῖρά µου ἐπ’ αὐτούς, καὶ ἔσονται σκῦλα τοῖς δουλεύουσιν αὐτοῖς, καὶ γνώσεσθε διότι κύριος παντοκράτωρ ἀπέσταλκέν µε.						
Zechariah	2	10	 ⲟⲩⲣⲟⲧ ⲟⲩⲟϩ ⲟⲩⲛⲟϥ ⲧϣⲉⲣⲓ ⲛ̀ⲥⲓⲱⲛ ϫⲉ ϩⲏⲡⲡⲉ ⲁ̀ⲛⲟⲕ ϯⲛⲏⲟⲩ ⲟⲩⲟϩ ⲛ̀ⲧⲁϣⲱⲡⲓ ϧⲉⲛ ⲧⲉⲙⲏϯ ⲡⲉϫⲉ ⲡϭ̅ⲥ̅		 Rejoice and be glad, O daughter of Sion: for, behold, I come, and will dwell in the midst of thee, saith the Lord.	 τέρπου καὶ εὐφραίνου, θύγατερ Σιων, διότι ἰδοὺ ἐγὼ ἔρχοµαι καὶ κατασκηνώσω ἐν µέσῳ σου, λέγει κύριος.						
Zechariah	2	11	 ⲟⲩⲟϩ ϩⲁⲛⲙⲏϣ ⲛ̀ⲉⲑⲛⲟⲥ ⲉⲩⲉ̀ⲫⲱⲧ ⲉ̀ⲣⲁⲧϥ ⲙ̀ⲡϭ̅ⲥ̅ ϧⲉⲛ ⲡⲓⲉϩⲟⲟⲩ ⲉⲧⲉⲙ̀ⲙⲁⲩ ⲟⲩⲟϩ ⲉⲩⲉ̀ϣⲱⲡⲓ ⲛⲁϥ ⲉ̀ⲟⲩⲗⲁⲟⲥ ⲟⲩⲟϩ ⲉⲩⲉ̀ϣⲱⲡⲓ ϧⲉⲛ ⲧⲉⲙⲏϯ ⲟⲩⲟϩ ⲉⲣⲉ̀ⲉⲙⲓ ϫⲉ ⲡϭ̅ⲥ̅ ⲡⲓⲡⲁⲛⲧⲟⲕⲣⲁⲧⲱⲣ ⲡⲉⲧⲁϥⲟⲩⲟⲣⲡⲧ ϩⲁⲣⲟ		 And many nations shall flee for refuge to the Lord in that day, and they shall be for a people to him, and they shall dwell in the midst of thee: and thou shalt know that the Lord Almighty has sent me to thee.	 καὶ καταφεύξονται ἔθνη πολλὰ ἐπὶ τὸν κύριον ἐν τῇ ἡµέρᾳ ἐκείνῃ καὶ ἔσονται αὐτῷ εἰς λαὸν καὶ κατασκηνώσουσιν ἐν µέσῳ σου, καὶ ἐπιγνώσῃ ὅτι κύριος παντοκράτωρ ἐξαπέσταλκέν µε πρὸς σέ.						
