book	chapter	verse	Bohairic	Sahidic	English	Greek	Fayyumic	Akhmimic	OldBohairic	Mesokemic	DialectP	Lycopolitan
Zechariah	8	5	 ⲟⲩⲟϩ ⲛⲓⲡⲗⲁⲧⲓⲁ ⲛ̀ⲧⲉ ϯⲃⲁⲕⲓ ⲉⲩⲉ̀ⲙⲟϩ ⲛ̀ϩⲁⲛⲕⲟⲩϫⲓ ⲛ̀ⲁⲗⲱⲟⲩⲓ ⲛ̀ϩⲱⲟⲩⲧ ⲛⲉⲙ ⲕⲟⲩϫⲓ ⲛ̀ⲁⲗⲱⲟⲩⲓ ⲛ̀ⲥϩⲓⲙⲓ ⲉⲩⲥⲱⲃⲓ ϧⲉⲛ ⲛⲉⲥⲡⲗⲁⲧⲓⲁ		 And the broad places of the city shall be filled with boys and girls playing in the streets thereof.	 καὶ αἱ πλατεῖαι τῆς πόλεως πλησθήσονται παιδαρίων καὶ κορασίων παιζόντων ἐν ταῖς πλατείαις αὐτῆς.						
Zechariah	8	6	 ⲛⲁⲓ ⲛⲉ ⲛⲏ ⲉⲧⲉϥϫⲱ ⲙ̀ⲙⲱⲟⲩ ⲛ̀ϫⲉ ⲡϭ̅ⲥ̅ ⲡⲓⲡⲁⲛⲧⲟⲕⲣⲁⲧⲱⲣ ⲓⲥϫⲉ ⲟⲩⲟⲛ ⲟⲩⲙⲉⲧⲁⲧϫⲟⲙ ⲛⲁϣⲱⲡⲓ ⲙ̀ⲡⲉⲙ̀ⲑⲟ ⲙ̀ⲡⲥⲱϫⲡ ⲙ̀ⲡⲁⲓⲗⲁⲟⲥ ϧⲉⲛ ⲛⲓⲉϩⲟⲟⲩ ⲉⲧⲉⲙ̀ⲙⲁⲩ ⲙⲏ ⲟⲩⲟⲛ ⲟⲩⲙⲉⲧⲁⲧϫⲟⲙ ⲛⲁϣⲱⲡⲓ ⲙ̀ⲡⲁⲙ̀ⲑⲟ ϩⲱ ⲡⲉϫⲉ ⲡϭ̅ⲥ̅ ⲡⲓⲡⲁⲛⲧⲟⲕⲣⲁⲧⲱⲣ		 Thus saith the Lord Almighty; If it shall be impossible in the sight of the remnant of this people in those days, shall it also be impossible in my sight? saith the Lord Almighty.	 τάδε λέγει κύριος παντοκράτωρ Διότι εἰ ἀδυνατήσει ἐνώπιον τῶν καταλοίπων τοῦ λαοῦ τούτου ἐν ταῖς ἡµέραις ἐκείναις, µὴ καὶ ἐνώπιον ἐµοῦ ἀδυνατήσει; λέγει κύριος παντοκράτωρ.						
Zechariah	8	7	 ⲛⲁⲓ ⲛⲉ ⲛⲏ ⲉⲧⲉϥϫⲱ ⲙ̀ⲙⲱⲟⲩ ⲛ̀ϫⲉ ⲡϭ̅ⲥ̅ ⲡⲓⲡⲁⲛⲧⲟⲕⲣⲁⲧⲱⲣ ϫⲉ ϩⲏⲡⲡⲉ ⲁ̀ⲛⲟⲕ ϯⲛⲁⲛⲟϩⲉⲙ ⲙ̀ⲡⲁⲗⲁⲟⲥ ⲉ̀ⲃⲟⲗ ϧⲉⲛ ⲡⲕⲁϩⲓ ⲛ̀ⲧⲉ ⲛⲓⲙⲁⲛ̀ϣⲁⲓ ⲛⲉⲙ ⲉ̀ⲃⲟⲗ ϧⲉⲛ ⲡⲕⲁϩⲓ ⲛ̀ⲧⲉ ⲛⲓⲙⲁⲛ̀ϩⲱⲧⲡ		 Thus saith the Lord Almighty; Behold, I will save my people from the east country, and the west country;	 τάδε λέγει κύριος παντοκράτωρ Ἰδοὺ ἐγὼ ἀνασῴζω τὸν λαόν µου ἀπὸ γῆς ἀνατολῶν καὶ ἀπὸ γῆς δυσµῶν						
Zechariah	8	8	 ⲟⲩⲟϩ ⲉⲓⲉ̀ⲟⲗⲟⲩ ⲉ̀ϧⲟⲩⲛ ⲟⲩⲟϩ ⲉⲓⲉ̀ⲑⲣⲟⲩϣⲱⲡⲓ ϧⲉⲛ ⲑⲙⲏϯ ⲛ̀ⲓⲗ̅ⲏ̅ⲙ̅ ⲟⲩⲟϩ ⲉⲩⲉ̀ϣⲱⲡⲓ ⲛⲏⲓ ⲉⲩⲗⲁⲟⲥ ⲟⲩⲟϩ ⲁ̀ⲛⲟⲕ ϩⲱ ⲉⲓⲉ̀ϣⲱⲡⲓ ⲛⲱⲟⲩ ⲉⲩⲛⲟⲩϯ ϧⲉⲛ ⲟⲩⲙⲉⲑⲙⲏⲓ ⲛⲉⲙ ⲟⲩⲇⲓⲕⲉⲟⲥⲩⲛⲏ		 and I will bring them in, and cause them to dwell in the midst of Jerusalem: and they shall be to me a people, and I will be to them a God, in truth and in righteousness.	 καὶ εἰσάξω αὐτοὺς καὶ κατασκηνώσω ἐν µέσῳ Ιερουσαληµ, καὶ ἔσονταί µοι εἰς λαόν, καὶ ἐγὼ ἔσοµαι αὐτοῖς εἰς θεὸν ἐν ἀληθείᾳ καὶ ἐν δικαιοσύνῃ.						
Zechariah	8	9	 ⲛⲁⲓ ⲛⲉ ⲛⲏ ⲉⲧⲉϥϫⲱ ⲙ̀ⲙⲱⲟⲩ ⲛ̀ϫⲉ ⲡϭ̅ⲥ̅ ⲡⲓⲡⲁⲛⲧⲟⲕⲣⲁⲧⲱⲣ ϫⲉ ⲙⲁⲣⲟⲩϫⲉⲙⲛⲟⲙϯ ⲛ̀ϫⲉ ⲛⲉⲧⲉⲛϫⲓϫ ⲛⲏ ⲉⲧⲥⲱⲧⲉⲙ ϧⲉⲛ ⲛⲁⲓⲉϩⲟⲟⲩ ⲉ̀ⲛⲁⲓⲥⲁϫⲓ ⲉ̀ⲃⲟⲗ ϧⲉⲛ ⲣⲱⲟⲩ ⲛ̀ⲛⲓⲡⲣⲟⲫⲏⲧⲏⲥ ⲓⲥϫⲉⲛ ⲡⲓⲉϩⲟⲟⲩ ⲉⲧⲁⲩϩⲓⲥⲉⲛϯ ⲙ̀ⲡⲏⲓ ⲙ̀ⲡϭ̅ⲥ̅ ⲡⲓⲡⲁⲛⲧⲟⲕⲣⲁⲧⲱⲣ ⲛⲉⲙ ⲓⲥϫⲉⲛ ⲉⲧⲁⲩⲕⲱⲧ ⲉ̀ⲡⲓⲉⲣⲫⲉⲓ		 Thus saith the Lord Almighty; Let your hands be strong, ye that hear in these days these words out of the mouth of the prophets, from the day that the house of the Lord Almighty was founded, and from the time that the temple was built.	 τάδε λέγει κύριος παντοκράτωρ Κατισχυέτωσαν αἱ χεῖρες ὑµῶν τῶν ἀκουόντων ἐν ταῖς ἡµέραις ταύταις τοὺς λόγους τούτους ἐκ στόµατος τῶν προφητῶν, ἀφ’ ἧς ἡµέρας τεθεµελίωται ὁ οἶκος κυρίου παντοκράτορος, καὶ ὁ ναὸς ἀφ’ οὗ ᾠκοδόµηται.						
Zechariah	8	10	 ϫⲉ ⲟⲩⲏⲓ ϧⲁϫⲱⲟⲩ ⲛ̀ⲛⲓⲉϩⲟⲟⲩ ⲉⲧⲉⲙ̀ⲙⲁⲩ ⲫⲃⲉⲭⲉ ⲛ̀ⲛⲓⲣⲱⲙⲓ ⲛⲁϣⲱⲡⲓ ⲛⲱⲟⲩ ⲁⲛ ⲉⲩⲥⲓ ⲟⲩⲟϩ ⲫⲃⲉⲭⲉ ⲛ̀ⲛⲓⲧⲉⲃⲛⲱⲟⲩⲓ ⲛ̀ⲛⲉϥϣⲱⲡⲓ ⲟⲩⲟϩ ⲫⲏ ⲉⲑⲛⲏⲟⲩ ⲉ̀ⲃⲟⲗ ⲛⲉⲙ ⲫⲏ ⲉⲑⲛⲏⲟⲩ ⲉ̀ϧⲟⲩⲛ ⲛ̀ⲛⲉ ϩⲓⲣⲏⲛⲏ ϣⲱⲡⲓ ⲛⲁϥ ⲉ̀ⲃⲟⲗ ϧⲉⲛ ⲡⲓϩⲟϫϩⲉϫ ⲟⲩⲟϩ ϯⲛⲁⲟⲩⲱⲣⲡ ⲛ̀ⲛⲓⲣⲱⲙⲓ ⲧⲏⲣⲟⲩ ⲡⲓⲟⲩⲁⲓ ⲡⲓⲟⲩⲁⲓ ⲉ̀ϫⲉⲛ ⲡⲉϥϣⲫⲏⲣ		 For before those days the wages of men could not be profitable, and there could be no hire of cattle, and there could be no peace by reason of the affliction to him that went out or to him that came in: for I would have let loose all men, every one against his neighbour.	 διότι πρὸ τῶν ἡµερῶν ἐκείνων ὁ µισθὸς τῶν ἀνθρώπων οὐκ ἔσται εἰς ὄνησιν, καὶ ὁ µισθὸς τῶν κτηνῶν οὐχ ὑπάρξει, καὶ τῷ ἐκπορευοµένῳ καὶ τῷ εἰσπορευοµένῳ οὐκ ἔσται εἰρήνη ἀπὸ τῆς θλίψεως· καὶ ἐξαποστελῶ πάντας τοὺς ἀνθρώπους ἕκαστον ἐπὶ τὸν πλησίον αὐτοῦ.						
Zechariah	8	11	 ⲟⲩⲟϩ ϯⲛⲁⲓⲣⲓ ⲁⲛ ⲕⲁⲧⲁ ⲛⲓⲉϩⲟⲟⲩ ⲛ̀ⲧⲉ ϣⲟⲣⲡ ⲛ̀ⲛⲓⲥⲱϫⲡ ⲛ̀ⲧⲉ ⲡⲁⲗⲁⲟⲥ ⲡⲉϫⲉ ⲡϭ̅ⲥ̅ ⲡⲓⲡⲁⲛⲧⲟⲕⲣⲁⲧⲱⲣ		 But now I will not do to the remnant of this people according to the former days, saith the Lord Almighty.	 καὶ νῦν οὐ κατὰ τὰς ἡµέρας τὰς ἔµπροσθεν ἐγὼ ποιῶ τοῖς καταλοίποις τοῦ λαοῦ τούτου, λέγει κύριος παντοκράτωρ,						
Zechariah	8	12	 ⲁⲗⲗⲁ ϯⲛⲁⲟⲩⲱⲛϩ ⲛ̀ⲟⲩϩⲓⲣⲏⲛⲏ ⲉ̀ⲃⲟⲗ ϯⲃⲱ ⲛ̀ⲁⲗⲟⲗⲓ ⲛⲁϯ ⲙ̀ⲡⲉⲥⲟⲩⲧⲁϩ ⲟⲩⲟϩ ⲡⲕⲁϩⲓ ⲉϥⲉ̀ϯ ⲛ̀ⲛⲉϥⲟⲩⲧⲁϩ ⲟⲩⲟϩ ⲧⲫⲉ ⲉⲥⲉ̀ϯ ⲛ̀ⲧⲉϥⲥⲓⲱϯ ⲟⲩⲟϩ ϯⲛⲁⲑⲣⲉ ⲛⲓⲥⲱϫⲡ ⲛ̀ⲧⲉ ⲡⲁⲗⲁⲟⲥ ⲉⲣⲕⲗⲏⲣⲟⲛⲟⲙⲓⲛ ⲛⲁⲓ ⲧⲏⲣⲟⲩ		 But I will shew peace: the vine shall yield her fruit, and the land shall yield her produce, and the heaven shall give its dew: and I will give as an inheritance all these things to the remnant of my people.	 ἀλλ’ ἢ δείξω εἰρήνην· ἡ ἄµπελος δώσει τὸν καρπὸν αὐτῆς, καὶ ἡ γῆ δώσει τὰ γενήµατα αὐτῆς, καὶ ὁ οὐρανὸς δώσει τὴν δρόσον αὐτοῦ, καὶ κατακληρονοµήσω τοῖς καταλοίποις τοῦ λαοῦ µου πάντα ταῦτα.						
Zechariah	8	13	 ⲟⲩⲟϩ ⲉⲥⲉ̀ϣⲱⲡⲓ ⲙ̀ⲫⲣⲏϯ ⲉ̀ⲛⲁⲣⲉⲧⲉⲛϣⲟⲡ ϧⲉⲛ ⲟⲩⲥⲁϩⲟⲩⲓ ϧⲉⲛ ⲛⲓⲉⲑⲛⲟⲥ ⲡⲏⲓ ⲛ̀ⲓⲟⲩⲇⲁ ⲛⲉⲙ ⲡⲏⲓ ⲙ̀ⲡⲓⲥ̅ⲗ̅ ⲡⲁⲓⲣⲏϯ ϯⲛⲁⲛⲁϩⲉⲙ ⲑⲏⲛⲟⲩ ⲟⲩⲟϩ ⲉⲣⲉⲧⲉⲛⲉ̀ϣⲱⲡⲓ ϧⲉⲛ ⲟⲩⲥⲙⲟⲩ ϫⲉⲙϫⲟⲙ ⲟⲩⲟϩ ϫⲉⲙⲛⲟⲙϯ ϧⲉⲛ ⲛⲉⲧⲉⲛϫⲓϫ		 And it shall come to pass, as ye were a curse among the nations, O house of Juda, and house of Israel; so will I save you, and ye shall be a blessing: be of good courage, and strengthen your hands.	 καὶ ἔσται ὃν τρόπον ἦτε ἐν κατάρᾳ ἐν τοῖς ἔθνεσιν, οἶκος Ιουδα καὶ οἶκος Ισραηλ, οὕτως διασώσω ὑµᾶς καὶ ἔσεσθε ἐν εὐλογίᾳ· θαρσεῖτε καὶ κατισχύετε ἐν ταῖς χερσὶν ὑµῶν.						
Zechariah	8	14	 ϫⲉ ⲟⲩⲏⲓ ⲛⲁⲓ ⲛⲉ ⲛⲏ ⲉⲧⲉϥϫⲱ ⲙ̀ⲙⲱⲟⲩ ⲛ̀ϫⲉ ⲡϭ̅ⲥ̅ ⲡⲓⲡⲁⲛⲧⲟⲕⲣⲁⲧⲱⲣ ϫⲉ ⲙ̀ⲫⲣⲏϯ ⲉⲧⲁⲓⲙⲉⲩⲓ ⲉⲧϩⲉⲙⲕⲉ ⲑⲏⲛⲟⲩ ϧⲉⲛ ⲡϫⲓⲛⲑⲣⲉ ⲛⲉⲧⲉⲛⲓⲟϯ ϯϫⲱⲛⲧ ⲛⲏⲓ ⲡⲉϫⲉ ⲡϭ̅ⲥ̅ ⲡⲓⲡⲁⲛⲧⲟⲕⲣⲁⲧⲱⲣ		 For thus saith the Lord Almighty; As I took counsel to afflict you when your fathers provoked me, saith the Lord Almighty,	 διότι τάδε λέγει κύριος παντοκράτωρ Ὃν τρόπον διενοήθην τοῦ κακῶσαι ὑµᾶς ἐν τῷ παροργίσαι µε τοὺς πατέρας ὑµῶν, λέγει κύριος παντοκράτωρ,						
Zechariah	8		 ⲟⲩⲟϩ ⲙ̀ⲡⲓⲟⲩⲉⲙϩⲑⲏⲓ ⲡⲁⲓⲣⲏϯ ⲁⲓⲧⲁⲥⲑⲟ ⲟⲩⲟϩ ⲁⲓⲙⲉⲩⲓ ⲛ̀ϩⲣⲏⲓ ϧⲉⲛ ⲛⲁⲓⲉϩⲟⲟⲩ ⲉ̀ⲉⲣⲡⲉⲑⲛⲁⲛⲉϥ ⲛⲉⲙ ⲓⲗ̅ⲏ̅ⲙ̅ ⲛⲉⲙ ⲡⲏⲓ ⲛ̀ⲓⲟⲩⲇⲁ ϫⲉⲙⲛⲟⲙϯ		and I repented not: (15) so have I prepared and taken counsel in these days to do good to Jerusalem and to the house of Juda: be ye of good courage.	καὶ οὐ µετενόησα, (15) οὕτως παρατέταγµαι καὶ διανενόηµαι ἐν ταῖς ἡµέραις ταύταις τοῦ καλῶς ποιῆσαι τὴν Ιερουσαληµ καὶ τὸν οἶκον Ιουδα· θαρσεῖτε.						
Zechariah	8	16	 ⲟⲩⲟϩ ⲛⲁⲓ ⲛⲉ ⲛⲓⲥⲁϫⲓ ⲉⲧⲉⲧⲉⲛⲛⲁⲁⲓⲧⲟⲩ ⲥⲁϫⲓ ⲛ̀ⲑⲙⲏⲓ ⲡⲓⲟⲩⲁⲓ ⲡⲓⲟⲩⲁⲓ ⲛⲉⲙ ⲡⲉϥϣⲫⲏⲣ ⲟⲩⲟϩ ⲟⲩϩⲁⲡ ⲛ̀ϩⲓⲣⲏⲛⲓⲕⲟⲛ ⲙⲁϩⲁⲡ ⲙ̀ⲙⲟϥ ϧⲉⲛ ⲛⲉⲧⲉⲛⲡⲩⲗⲏ		 These are the things which ye shall do; speak truth every one with his neighbour; judge truth and peaceable judgment in your gates:	 οὗτοι οἱ λόγοι, οὓς ποιήσετε· λαλεῖτε ἀλήθειαν ἕκαστος πρὸς τὸν πλησίον αὐτοῦ καὶ κρίµα εἰρηνικὸν κρίνατε ἐν ταῖς πύλαις ὑµῶν						
Zechariah	8	17	 ⲟⲩⲟϩ ⲫⲟⲩⲁⲓ ⲫⲟⲩⲁⲓ ⲙ̀ⲙⲱⲧⲉⲛ ⲙ̀ⲡⲉⲛⲑⲣⲉϥⲙⲉⲩⲓ ⲉ̀ⲟⲩⲕⲁⲕⲓⲁ ϧⲉⲛ ⲛⲉⲧⲉⲛϩⲏⲧ ⲉ̀ϧⲟⲩⲛ ⲉ̀ⲛⲉⲧⲉⲛⲉⲣⲏⲟⲩ ⲟⲩⲟϩ ⲙ̀ⲡⲉⲣⲙⲉⲛⲣⲉ ⲟⲩⲁⲛⲁϣ ⲛ̀ⲛⲟⲩϫ ⲡⲉϫⲉ ⲡϭ̅ⲥ̅ ⲡⲓⲡⲁⲛⲧⲟⲕⲣⲁⲧⲱⲣ		 and let none of you devise evil in his heart against his neighbour; and love not a false oath: for all these things I hate, saith the Lord Almighty.	 καὶ ἕκαστος τὴν κακίαν τοῦ πλησίον αὐτοῦ µὴ λογίζεσθε ἐν ταῖς καρδίαις ὑµῶν καὶ ὅρκον ψευδῆ µὴ ἀγαπᾶτε, διότι ταῦτα πάντα ἐµίσησα, λέγει κύριος παντοκράτωρ.						
Zechariah	8	18	 ⲟⲩⲟϩ ⲁ ⲟⲩⲥⲁϫⲓ ⲛ̀ⲧⲉ ⲡϭ̅ⲥ̅ ⲡⲓⲡⲁⲛⲧⲟⲕⲣⲁⲧⲱⲣ ϣⲱⲡⲓ ϩⲁⲣⲟⲓ ⲉϥϫⲱ ⲙ̀ⲙⲟⲥ		 And the word of the Lord Almighty came to me, saying,	 Καὶ ἐγένετο λόγος κυρίου παντοκράτορος πρός µε λέγων						
Zechariah	8	19	 ϫⲉ ⲛⲁⲓ ⲛⲉ ⲛⲏ ⲉⲧⲉϥϫⲱ ⲙ̀ⲙⲱⲟⲩ ⲛ̀ϫⲉ ⲡϭ̅ⲥ̅ ⲡⲓⲡⲁⲛⲧⲟⲕⲣⲁⲧⲱⲣ ϫⲉ ϯⲛⲏⲥⲧⲓⲁ ⲛ̀ⲧⲉ ⲡⲓⲇ̅ ⲛⲉⲙ ϯⲛⲏⲥⲧⲓⲁ ⲛ̀ⲧⲉ ⲡⲓⲉ̅ ⲛⲉⲙ ϯⲛⲏⲥⲧⲓⲁ ⲛ̀ⲧⲉ ⲡⲓⲍ̅ ⲛⲉⲙ ϯⲛⲏⲥⲧⲓⲁ ⲛ̀ⲧⲉ ⲡⲓⲓ̅ ⲙ̀ⲡⲓⲁⲃⲟⲧ ⲉⲩⲉ̀ϣⲱⲡⲓ ⲙ̀ⲡⲏⲓ ⲛ̀ⲓⲟⲩⲇⲁ ⲉⲩⲣⲁϣⲓ ⲛⲉⲙ ⲟⲩⲟⲩⲛⲟϥ ⲛⲉⲙ ϩⲁⲛⲉϩⲟⲟⲩ ⲛ̀ϣⲁⲓ ⲉ̀ⲛⲁⲛⲉⲩ ⲟⲩⲟϩ ⲉⲣⲉⲧⲉⲛⲉ̀ⲟⲩⲛⲟϥ ⲟⲩⲟϩ ⲉⲣⲉⲧⲉⲛⲉ̀ⲙⲉⲛⲣⲉ ϯⲙⲉⲑⲙⲏⲓ ⲛⲉⲙ ϯϩⲓⲣⲏⲛⲏ		 Thus saith the Lord Almighty, The fourth fast, and the fifth fast, and the seventh fast, and the tenth fast, shall be to the house of Juda for joy and gladness, and for good feasts; and ye shall rejoice; and love ye the truth and peace.	 Τάδε λέγει κύριος παντοκράτωρ Νηστεία ἡ τετρὰς καὶ νηστεία ἡ πέµπτη καὶ νηστεία ἡ ἑβδόµη καὶ νηστεία ἡ δεκάτη ἔσονται τῷ οἴκῳ Ιουδα εἰς χαρὰν καὶ εἰς εὐφροσύνην καὶ εἰς ἑορτὰς ἀγαθὰς καὶ εὐφρανθήσεσθε, καὶ τὴν ἀλήθειαν καὶ τὴν εἰρήνην ἀγαπήσατε.						
Zechariah	8	20	 ⲛⲁⲓ ⲛⲉ ⲛⲏ ⲉⲧⲉϥϫⲱ ⲙ̀ⲙⲱⲟⲩ ⲛ̀ϫⲉ ⲡϭ̅ⲥ̅ ⲡⲓⲡⲁⲛⲧⲟⲕⲣⲁⲧⲱⲣ ϫⲉ ⲉⲧⲓ ⲉⲩⲉ̀ⲓ̀ ⲛ̀ϫⲉ ϩⲁⲛⲗⲁⲟⲥ ⲉⲩⲟϣ		 Thus saith the Lord Almighty; Yet shall many peoples come, and the inhabitants of many cities;	 τάδε λέγει κύριος παντοκράτωρ Ἔτι ἥξουσιν λαοὶ πολλοὶ καὶ κατοικοῦντες πόλεις πολλάς·						
Zechariah	8	21	 ⲟⲩⲟϩ ⲉⲩⲉ̀ⲑⲱⲟⲩϯ ⲛ̀ϫⲉ ⲛⲏ ⲉⲧϣⲟⲡ ϧⲉⲛ ⲉ̅ ⲙ̀ⲃⲁⲕⲓ ⲟⲩⲟϩ ⲉⲩⲉ̀ⲓ̀ ⲉ̀ⲟⲩⲃⲁⲕⲓ ⲛ̀ⲟⲩⲱⲧ ⲉⲩϫⲱ ⲙ̀ⲙⲟⲥ ϫⲉ ⲙⲁⲣⲉⲛϣⲉ ⲛⲁⲛ ⲛ̀ⲧⲉⲛⲧⲱⲃϩ ⲙ̀ⲡϭ̅ⲥ̅ ⲟⲩⲟϩ ⲛ̀ⲧⲉⲛⲕⲱϯ ⲛ̀ⲥⲁ ⲡϩⲟ ⲙ̀ⲡϭ̅ⲥ̅ ⲡⲓⲡⲁⲛⲧⲟⲕⲣⲁⲧⲱⲣ ϯⲛⲁⲙⲟϣⲓ ϩⲱ		 and the inhabitants of five cities shall come together to one city, saying, Let us go to make supplication to the Lord, and to seek the face of the Lord Almighty; I will go also.	 καὶ συνελεύσονται κατοικοῦντες πέντε πόλεις εἰς µίαν πόλιν λέγοντες Πορευθῶµεν δεηθῆναι τοῦ προσώπου κυρίου καὶ ἐκζητῆσαι τὸ πρόσωπον κυρίου παντοκράτορος· πορεύσοµαι κἀγώ.						
Zechariah	8	22	 ⲟⲩⲟϩ ⲉⲩⲉ̀ⲓ̀ ⲛ̀ϫⲉ ϩⲁⲛⲗⲁⲟⲥ ⲉⲩⲟϣ ⲛⲉⲙ ϩⲁⲛⲙⲏϣ ⲛ̀ⲉⲑⲛⲟⲥ ⲉⲩⲉ̀ⲕⲱϯ ⲛ̀ⲥⲁ ⲡϩⲟ ⲙ̀ⲡϭ̅ⲥ̅ ⲡⲓⲡⲁⲛⲧⲟⲕⲣⲁⲧⲱⲣ ϧⲉⲛ ⲓⲗ̅ⲏ̅ⲙ̅ ⲛⲉⲙ ⲉ̀ⲧⲱⲃϩ ⲙ̀ⲡϩⲟ ⲙ̀ⲡϭ̅ⲥ̅		 And many peoples and many nations shall come to seek earnestly the face of the Lord Almighty in Jerusalem, and to obtain favour of the Lord.	 καὶ ἥξουσιν λαοὶ πολλοὶ καὶ ἔθνη πολλὰ ἐκζητῆσαι τὸ πρόσωπον κυρίου παντοκράτορος ἐν Ιερουσαληµ καὶ τοῦ ἐξιλάσκεσθαι τὸ πρόσωπον κυρίου.						
Zechariah	8	23	 ⲛⲁⲓ ⲛⲉ ⲛⲏ ⲉⲧⲉϥϫⲱ ⲙ̀ⲙⲱⲟⲩ ⲛ̀ϫⲉ ⲡϭ̅ⲥ̅ ⲡⲓⲡⲁⲛⲧⲟⲕⲣⲁⲧⲱⲣ ϫⲉ ⲛ̀ϧⲣⲏⲓ ϧⲉⲛ ⲛⲓⲉϩⲟⲟⲩ ⲉⲧⲉⲙ̀ⲙⲁⲩ ⲉ̀ϣⲱⲡ ⲁⲩϣⲁⲛⲁⲙⲟⲛⲓ ⲛ̀ϫⲉ ⲓ̅ ⲛ̀ⲣⲱⲙⲓ ⲉ̀ⲃⲟⲗ ϧⲉⲛ ⲛⲓⲗⲁⲟⲥ ⲧⲏⲣⲟⲩ ⲛ̀ⲧⲉ ⲛⲓⲉⲑⲛⲟⲥ ⲉⲩⲉ̀ⲁⲙⲟⲛⲓ ⲙ̀ⲡⲓϣⲧⲁϯ ⲛⲟⲩϩⲃⲱⲥ ⲛⲟⲩⲣⲱⲙⲓ ⲛ̀ⲓⲟⲩⲇⲁⲓ ⲉⲩϫⲱ ⲙ̀ⲙⲟⲥ ϫⲉ ⲧⲉⲛⲛⲁⲙⲟϣⲓ ⲛⲉⲙⲁⲕ ϫⲉ ⲁⲛⲥⲱⲧⲉⲙ ϫⲉ ⲫϯ ⲭⲏ ⲛⲉⲙⲱⲧⲉⲛ		 Thus saith the Lord Almighty; In those days my word shall be fulfilled if ten men of all the languages of the nations should take hold—even take hold of the hem of a Jew, saying, We will go with thee; for we have heard that God is with you.	 τάδε λέγει κύριος παντοκράτωρ Ἐν ταῖς ἡµέραις ἐκείναις ἐὰν ἐπιλάβωνται δέκα ἄνδρες ἐκ πασῶν τῶν γλωσσῶν τῶν ἐθνῶν καὶ ἐπιλάβωνται τοῦ κρασπέδου ἀνδρὸς Ιουδαίου λέγοντες Πορευσόµεθα µετὰ σοῦ, διότι ἀκηκόαµεν ὅτι ὁ θεὸς µεθ’ ὑµῶν ἐστιν.						
Zechariah	9	1	 ⲫⲗⲏⲙⲙⲁ ⲙ̀ⲡⲥⲁϫⲓ ⲙ̀ⲡϭ̅ⲥ̅ ϧⲉⲛ ⲡⲕⲁϩⲓ ⲛ̀ⲥⲉⲇⲣⲁⲕ ⲛⲉⲙ ⲇⲁⲙⲁⲥⲕⲟⲥ ⲡⲉϥϣⲟⲩϣⲱⲟⲩϣⲓ ϫⲉ ⲟⲩⲏⲓ ϥϫⲟⲩϣⲧ ⲛ̀ϫⲉ ⲡϭ̅ⲥ̅ ⲉ̀ϫⲉⲛ ⲛⲓⲣⲱⲙⲓ ⲛⲉⲙ ⲛⲓⲡⲩⲗⲏ ⲧⲏⲣⲟⲩ ⲛ̀ⲧⲉ ⲓⲗ̅ⲏ̅ⲙ̅		 The burden of the word of the Lord, in the land of Sedrach, and his sacrifice shall be in Damascus; for the Lord looks upon men, and upon all the tribes of Israel.	 Λῆµµα λόγου κυρίου· ἐν γῇ Σεδραχ καὶ Δαµασκοῦ θυσία αὐτοῦ, διότι κύριος ἐφορᾷ ἀνθρώπους καὶ πάσας φυλὰς τοῦ Ισραηλ.						
Zechariah	9	2	 ⲛⲉⲙ ⲏⲙⲁⲑ ϧⲉⲛ ⲛⲉⲥⲑⲟϣ ⲧⲩⲣⲟⲥ ⲛⲉⲙ ⲧⲥⲩⲇⲱⲛ ⲉⲑⲃⲉ ϫⲉ ⲁⲩⲙⲉⲩⲓ ⲉ̀ϩⲁⲛϧⲉⲣⲟⲩⲱ ⲉ̀ⲙⲁϣⲱ		 And in Emath, even in her coasts, are Tyre and Sidon, because they were very wise.	 καὶ Εµαθ ἐν τοῖς ὁρίοις αὐτῆς, Τύρος καὶ Σιδών, διότι ἐφρόνησαν σφόδρα.						
Zechariah	9	3	 ⲟⲩⲟϩ ⲁⲥⲕⲱⲧ ⲛⲁⲥ ⲛ̀ϫⲉ ⲧⲩⲣⲟⲥ ⲛ̀ⲟⲩⲙⲁ ⲉϥϫⲟⲣ ⲟⲩⲟϩ ⲁⲥϩⲓⲟⲩⲓ ⲉ̀ϧⲟⲩⲛ ⲛ̀ⲟⲩϩⲁⲧ ⲙ̀ⲫⲣⲏϯ ⲛ̀ⲟⲩⲕⲁϩⲓ ⲟⲩⲟϩ ⲁⲥⲑⲟⲩⲏⲧ ⲛⲟⲩⲃ ⲙ̀ⲫⲣⲏϯ ⲛ̀ⲟⲩⲟⲙⲓ ⲛ̀ⲧⲉ ϩⲁⲛⲙⲱⲓⲧ		 And Tyrus built strong-holds for herself, and heaped up silver as dust, and gathered gold as the mire of the ways.	 καὶ ᾠκοδόµησεν Τύρος ὀχυρώµατα ἑαυτῇ καὶ ἐθησαύρισεν ἀργύριον ὡς χοῦν καὶ συνήγαγεν χρυσίον ὡς πηλὸν ὁδῶν.						
Zechariah	9	4	 ⲉⲑⲃⲉ ⲫⲁⲓ ⲉϥⲉ̀ⲉⲣⲕⲗⲏⲣⲟⲛⲟⲙⲓⲛ ⲙ̀ⲙⲟⲥ ⲟⲩⲟϩ ⲉϥⲉ̀ⲓⲛⲓ ⲛ̀ⲧⲉⲥϫⲟⲙ ⲉ̀ϧⲣⲏⲓ ⲉ̀ⲫⲓⲟⲙ ⲟⲩⲟϩ ⲛ̀ⲑⲟⲥ ⲉⲥⲉ̀ⲙⲟⲩⲛⲕ ϧⲉⲛ ⲟⲩⲭⲣⲱⲙ		 And therefore the Lord will take them for a possession, and will smite her power in the sea; and she shall be consumed with fire.	 διὰ τοῦτο κύριος κληρονοµήσει αὐτὴν καὶ πατάξει εἰς θάλασσαν δύναµιν αὐτῆς, καὶ αὕτη ἐν πυρὶ καταναλωθήσεται.						
Zechariah	9	5	 ⲉⲥⲉ̀ⲛⲁⲩ ⲛ̀ϫⲉ ⲁⲥⲕⲁⲗⲱⲛ ⲟⲩⲟϩ ⲉⲥⲉ̀ⲉⲣϩⲟϯ ⲟⲩⲟϩ ⲅⲁⲍⲁ ⲉⲥⲉ̀ⲉⲣⲙⲕⲁϩ ⲛ̀ϩⲏⲧ ⲉ̀ⲙⲁϣⲱ ⲟⲩⲟϩ ⲁⲕⲕⲁⲣⲱⲛ ϫⲉ ⲁⲥϭⲓϣⲓⲡⲓ ⲟⲩⲟϩ ⲉⲥⲉ̀ⲭⲁϩⲑⲏⲥ ϧⲉⲛ ⲡⲉⲥϩⲉⲓ ⲉ̀ⲃⲟⲗ ϩⲁ ⲧⲉⲥϩⲉⲗⲡⲓⲥ ⲟⲩⲟϩ ⲉϥⲉ̀ⲧⲁⲕⲟ ⲛ̀ϫⲉ ⲟⲩⲟⲩⲣⲟ ⲉ̀ⲃⲟⲗ ϧⲉⲛ ⲅⲁⲍⲁ ⲟⲩⲟϩ ⲁⲥⲕⲁⲗⲱⲛ ⲛ̀ⲛⲉⲥϫⲱⲣϫ		 Ascalon shall see, and fear; Gaza also, and shall be greatly pained, and Accaron; for she is ashamed at her trespass; and the king shall perish from Gaza, and Ascalon shall not be inhabited.	 ὄψεται Ἀσκαλὼν καὶ φοβηθήσεται, καὶ Γάζα καὶ ὀδυνηθήσεται σφόδρα, καὶ Ακκαρων, ὅτι ᾐσχύνθη ἐπὶ τῷ παραπτώµατι αὐτῆς· καὶ ἀπολεῖται βασιλεὺς ἐκ Γάζης, καὶ Ἀσκαλὼν οὐ µὴ κατοικηθῇ.						
Zechariah	9	6	 ⲟⲩⲟϩ ⲉⲩⲉ̀ϣⲱⲡⲓ ϧⲉⲛ ⲁⲍⲱⲧⲟⲥ ⲛ̀ϫⲉ ϩⲁⲛⲁⲗⲗⲟⲅⲉⲛⲏⲥ ⲟⲩⲟϩ ϯⲛⲁⲑⲉⲃⲓⲟ ⲙ̀ⲡϣⲱϣ ⲛ̀ⲧⲉ ⲛⲓⲁⲗⲗⲟⲫⲩⲗⲟⲥ		 And aliens shall dwell in Azotus, and I will bring down the pride of the Philistines.	 καὶ κατοικήσουσιν ἀλλογενεῖς ἐν Ἀζώτῳ, καὶ καθελῶ ὕβριν ἀλλοφύλων.						
Zechariah	9	7	 ϯⲛⲁⲱⲗⲓ ⲙ̀ⲡⲟⲩⲥⲛⲟϥ ⲉ̀ⲃⲟⲗ ϧⲉⲛ ⲣⲱⲟⲩ ⲛⲉⲙ ⲛⲟⲩⲱⲣⲉⲃ ⲉ̀ⲃⲟⲗ ϧⲉⲛ ⲑⲙⲏϯ ⲛ̀ⲛⲟⲩⲛⲁϫϩⲓ ⲟⲩⲟϩ ⲉⲩⲉ̀ⲥⲱϫⲡ ⲙ̀ⲡⲟⲩⲛⲟⲩϯ ⲛ̀ϫⲉ ⲛⲁⲓⲕⲉⲭⲱⲟⲩⲛⲓ ⲟⲩⲟϩ ⲉⲩⲉ̀ϣⲱⲡⲓ ⲙ̀ⲫⲣⲏϯ ⲛ̀ⲟⲩⲭⲓⲗⲓⲁⲣⲭⲟⲥ ϧⲉⲛ ⲓⲟⲩⲇⲁ ⲟⲩⲟϩ ⲁⲕⲕⲁⲣⲱⲛ ⲉⲥⲉ̀ⲉⲣ ⲙ̀ⲫⲣⲏϯ ⲙ̀ⲡⲓⲉⲃⲟⲩⲥⲉⲟⲥ		 And I will take their blood out of their mouth, and their abominations from between their teeth; and these also shall be left to our God, and they shall be as a captain of a thousand in Juda, and Accaron as a Jebusite.	 καὶ ἐξαρῶ τὸ αἷµα αὐτῶν ἐκ στόµατος αὐτῶν καὶ τὰ βδελύγµατα αὐτῶν ἐκ µέσου ὀδόντων αὐτῶν, καὶ ὑπολειφθήσεται καὶ οὗτος τῷ θεῷ ἡµῶν, καὶ ἔσονται ὡς χιλίαρχος ἐν Ιουδα καὶ Ακκαρων ὡς ὁ Ιεβουσαῖος.						
Zechariah	9	8	 ⲟⲩⲟϩ ϯⲛⲁⲥⲉⲙⲛⲓ ⲛ̀ⲟⲩⲧⲁϩⲟ ⲉ̀ⲣⲁⲧϥ ⲙ̀ⲡⲁⲏⲓ ⲉ̀ϣ̀ⲧⲉⲙⲑⲣⲉ ϩⲗⲓ ⲥⲓⲛⲓ ⲉ̀ⲃⲟⲗ ϩⲓⲧⲟⲧϥ ⲟⲩⲇⲉ ⲉ̀ϣ̀ⲧⲉⲙⲑⲣⲉ ϩⲗⲓ ⲧⲁⲥⲑⲟ ⲟⲩⲟϩ ⲛ̀ⲧⲉϥⲓ̀ ⲉ̀ϩⲣⲏⲓ ⲉ̀ϫⲱⲟⲩ ⲛ̀ϫⲉ ⲫⲏ ⲉⲧϭⲱⲣⲉⲙ ϫⲉ ⲟⲩⲏⲓ ⲁⲓⲛⲁⲩ ϯⲛⲟⲩ ϧⲉⲛ ⲛⲁⲃⲁⲗ		 And I will set up a defence for my house, that they may not pass through, nor turn back, neither shall there any more come upon them one to drive them away: for now have I seen with mine eyes.	 καὶ ὑποστήσοµαι τῷ οἴκῳ µου ἀνάστηµα τοῦ µὴ διαπορεύεσθαι µηδὲ ἀνακάµπτειν, καὶ οὐ µὴ ἐπέλθῃ ἐπ’ αὐτοὺς οὐκέτι ἐξελαύνων, διότι νῦν ἑώρακα ἐν τοῖς ὀφθαλµοῖς µου.						
Zechariah	9	9	 ⲣⲁϣⲓ ⲉ̀ⲙⲁϣⲱ ⲧϣⲉⲣⲓ ⲛ̀ⲥⲓⲱⲛ ϩⲓⲱⲓϣ ⲧϣⲉⲣⲓ ⲛ̀ⲓⲗ̅ⲏ̅ⲙ̅ ϩⲏⲡⲡⲉ ⲓⲥ ⲡⲉⲟⲩⲣⲟ ⲉϥⲛⲏⲟⲩ ⲛⲉ ⲉ̀ⲟⲩⲑⲙⲏⲓ ⲡⲉ ⲟⲩⲟϩ ⲟⲩⲣⲉϥⲛⲟϩⲉⲙ ⲡⲉ ⲛ̀ⲑⲟϥ ⲟⲩⲣⲉⲙⲣⲁⲩϣ ⲡⲉ ⲟⲩⲟϩ ⲉϥⲧⲁⲗⲏⲟⲩⲧ ⲉ̀ϫⲉⲛ ⲟⲩⲓⲱ ⲛⲉⲙ ⲟⲩⲥⲏϫ ⲙ̀ⲃⲉⲣⲓ		 Rejoice greatly, O daughter of Sion; proclaim it aloud, O daughter of Jerusalem; behold, the King is coming to thee, just, and a Saviour; he is meek and riding on an ass, and a young foal.	 Χαῖρε σφόδρα, θύγατερ Σιων· κήρυσσε, θύγατερ Ιερουσαληµ· ἰδοὺ ὁ βασιλεύς σου ἔρχεταί σοι, δίκαιος καὶ σῴζων αὐτός, πραῢς καὶ ἐπιβεβηκὼς ἐπὶ ὑποζύγιον καὶ πῶλον νέον.						
Zechariah	9	10	 ⲟⲩⲟϩ ⲉϥⲉ̀ϥⲱϯ ⲛ̀ϩⲁⲛϩⲁⲣⲙⲁ ⲉ̀ⲃⲟⲗ ϧⲉⲛ ⲉ̀ⲫⲣⲉⲙ ⲛⲉⲙ ⲟⲩϩⲑⲟ ⲉ̀ⲃⲟⲗ ϧⲉⲛ ⲓⲗ̅ⲏ̅ⲙ̅ ⲟⲩⲟϩ ⲉⲥⲉ̀ϥⲱϯ ⲉ̀ⲃⲟⲗ ⲛ̀ϫⲉ ⲟⲩⲫⲓϯ ⲙ̀ⲡⲟⲗⲉⲙⲓⲕⲟⲛ ⲛⲉⲙ ⲟⲩⲙⲏϣ ⲛⲉⲙ ⲟⲩϩⲓⲣⲏⲛⲏ ⲉ̀ⲃⲟⲗ ϧⲉⲛ ϩⲁⲛⲉⲑⲛⲟⲥ ⲟⲩⲟϩ ⲉϥⲉ̀ⲉⲣⲁⲣⲭⲱⲛ ⲉ̀ϫⲉⲛ ϩⲁⲛⲙⲱⲟⲩ ϣⲁ ⲫⲓⲟⲙ ⲛⲉⲙ ⲉ̀ϫⲉⲛ ϩⲁⲛⲓⲁⲣⲱⲟⲩ ϩⲁⲛⲙⲱⲓⲧ ⲉ̀ⲃⲟⲗ ⲛ̀ⲧⲉ ⲟⲩⲕⲁϩⲓ		 And he shall destroy the chariots out of Ephraim, and the horse out of Jerusalem, and the bow of war shall be utterly destroyed; and there shall be abundance and peace out of the nations; and he shall rule over the waters as far as the sea, and the rivers to the ends of the earth.	 καὶ ἐξολεθρεύσει ἅρµατα ἐξ Εφραιµ καὶ ἵππον ἐξ Ιερουσαληµ, καὶ ἐξολεθρευθήσεται τόξον πολεµικόν, καὶ πλῆθος καὶ εἰρήνη ἐξ ἐθνῶν· καὶ κατάρξει ὑδάτων ἕως θαλάσσης καὶ ποταµῶν διεκβολὰς γῆς.						
Zechariah	9	11	 ⲟⲩⲟϩ ⲛ̀ⲑⲟⲕ ϧⲉⲛ ⲡⲥⲛⲟϥ ⲛ̀ⲟⲩⲇⲓⲁⲑⲏⲕⲏ ⲁⲕⲟⲩⲟⲣⲡ ⲉ̀ⲃⲟⲗ ϧⲉⲛ ⲛⲏ ⲉⲧⲥⲟⲛϩ ⲛ̀ⲧⲁⲕ ⲉ̀ⲃⲟⲗ ϧⲉⲛ ⲟⲩⲗⲁⲕⲕⲟⲥ ⲙ̀ⲙⲟⲛ ⲙⲱⲟⲩ ⲛ̀ϧⲏⲧϥ		 And thou by the blood of thy covenant has sent forth thy prisoners out of the pit that has no water.	 καὶ σὺ ἐν αἵµατι διαθήκης ἐξαπέστειλας δεσµίους σου ἐκ λάκκου οὐκ ἔχοντος ὕδωρ.						
