book	chapter	verse	Bohairic	Akhmimic	Fayyumic	OldBohairic	Mesokemic	DialectP	Lycopolitan	Greek	English	Sahidic
Ecclesiastes	3	11	 		 [     ] ⲁϩⲁ [ⲡⲁⲓ]ⲱⲛ ⲙⲉⲛ ⲁϥϯ [ⲙ̈ⲙⲁϥ ⲁⲛ ⲉϩⲗⲏⲉⲓ ϩⲓⲙ ⲡⲉⲩϩⲏⲧ⳾ ϫⲉ]ⲕⲉⲥ ⲛ̈ⲛⲉ ⲡⲗⲱⲙⲓ ϫⲓⲛⲓ [ⲙ̈ⲡⲧⲁⲙⲓⲁ ⲛ̈ⲧⲁ ⲫϯ ⲧⲁⲙⲓⲁϥ ⲛ̈ϫⲓⲛ ⲧⲉϩⲟⲩⲉⲓϯ] ⲁϩⲁ ⲛ̈ϣⲁ ⲉⲛⲉϩ⳾					 σὺν τὰ πάντα ἐποίησεν καλὰ ἐν καιρῷ αὐτοῦ καί γε σὺν τὸν αἰῶνα ἔδωκεν ἐν καρδίᾳ αὐτῶν, ὅπως µὴ εὕρῃ ὁ ἄνθρωπος τὸ ποίηµα, ὃ ἐποίησεν ὁ θεός, ἀπ’ ἀρχῆς καὶ µέχρι τέλους.	 All the things which he has made are beautiful in his time: he has also set the whole world in their heart, that man might not find out the work which God has wrought from the beginning even to the end.	 ⲛ̅ⲕⲁ ⲛⲓ̈ⲙ ⲛ̅ⲧⲁϥⲧⲁⲙⲓ̈ⲟⲟⲩ ⲛⲁⲛⲟⲩⲟⲩ ϩⲙ̅ ⲡⲉⲩⲟⲩⲟⲉⲓϣ ⲁⲩⲱ ⲡⲁⲓ̈ⲱⲛ ⲧⲏⲣϥ̅ ⲁϥⲧⲁⲁϥ ⲉϩⲣⲁⲓ̈ ⲉⲡⲉϥϩⲏⲧ ϫⲉⲕⲁⲥ ⲛ̅ⲛⲉ ⲡⲣⲱⲙⲉ ϩⲉ ⲉⲡⲧⲁⲙⲓ̈ⲟ ⲛ̅ⲧⲁ ⲡⲛⲟⲩⲧⲉ ⲧⲁⲙⲓ̈ⲟϥ ϫⲓ̈ⲛ ⲧⲉϩⲟⲩⲉⲓⲧⲉ ϣⲁ ⲑⲁⲏ
Ecclesiastes	3	12	 		 ⲁⲓⲉⲓⲙ[(ⲉ)ⲓ ⲁⲛⲁⲕ ϫⲉ ⲙⲁⲛ ⲟⲩⲡⲉⲧⲛⲁⲛⲟⲩϥ ϣⲁⲡ] ⲛ̈ϩⲏⲧⲟⲩ⳾ ⲉⲙⲉϣⲏⲓ̈ ⲛ̈[ⲕⲟⲩⲛⲁϥ ⲛ̈ⲕⲓ̈ⲗⲓ ⲛ̈(ⲛ)ⲟⲩⲡⲉⲧⲛⲁⲛⲟⲩϥ ϩⲓⲙ] ⲡⲉⲕⲱⲛⲉϩ⳾					 ἔγνων ὅτι οὐκ ἔστιν ἀγαθὸν ἐν αὐτοῖς εἰ µὴ τοῦ εὐφρανθῆναι καὶ τοῦ ποιεῖν ἀγαθὸν ἐν ζωῇ αὐτοῦ·	 I know that there is no good in them, except for a man to rejoice, and to do good in his life.	 ⲁⲓ̈ⲉⲓⲙⲉ ϫⲉ ⲙⲛ̅ ⲁⲅⲁⲑⲟⲛ ϣⲟⲟⲡ ⲛⲁⲩ ⲛ̅ϩⲏⲧⲟⲩ ⲛ̅ⲥⲁ ⲉⲩⲫⲣⲁⲛⲉ ⲁⲩⲱ ⲉⲉⲓⲣⲉ ⲛ̅ⲟⲩⲁⲅⲁⲑⲟⲛ ϩⲙ̅ ⲡⲉϥⲱⲛϩ̅
Ecclesiastes	3	13	 		 ⲗⲱⲙⲓ ⲛⲓⲙ[ⲓ ⲉϥⲛⲉⲟⲩⲱⲙ ⲁϩⲁ ⲛ̈ϥⲥⲱ ⲁϩⲁ ⲛ̈ϥⲛⲉⲩ] ⲉⲟⲩⲡⲉⲧⲛⲁⲛⲟⲩϩ ⲛ̈ⲛⲉϥϩⲓⲥⲓ ⲧⲏⲗⲟⲩ⳾ ⲟⲩϯ ⲛⲉϥ ⲡⲉ [ⲉⲃⲁⲗ ϩⲓⲙ ⲫϯ⳾]					 καί γε πᾶς ὁ ἄνθρωπος, ὃς φάγεται καὶ πίεται καὶ ἴδῃ ἀγαθὸν ἐν παντὶ µόχθῳ αὐτοῦ, δόµα θεοῦ ἐστιν.	 Also in the case of every man who shall eat and drink, and see good in all his labour, this is a gift of God.	 ϫⲉ ⲣⲱⲙⲉ ⲛⲓ̈ⲙ ⲉϥⲛⲁⲟⲩⲱⲙ ⲛϥ̅ⲥⲱ ⲛϥ̅ⲛⲁⲩ ⲉⲩⲁⲅⲁⲑⲟⲛ ϩⲙ̅ ⲡⲉϥϩⲓ̈ⲥⲉ ⲧⲏⲣϥ̅ ⲟⲩϯ ⲛⲁϥ ⲡⲉ ⲛ̅ⲧⲙ̅ ⲡⲛⲟⲩⲧⲉ
Ecclesiastes	3	14	 		 ⲁⲓ̈ⲙⲓ ⲉⲛⲉⲧⲁ ⲫϯ ⲧ[ⲁ]ⲙⲙⲓⲁⲩ ⲧⲏ[ⲗⲟⲩ⳾ ⲥⲉⲛⲉϣⲱⲡⲓ ϣⲁ ⲉⲛⲉϩ⳾ ⲛⲉⲕϣ ⲟⲩ]ⲱϩ ⲉⲗⲁⲩ ⲟⲩⲇⲉ ⲛⲉⲕϣ ϥⲓ ⲉⲃ[ⲁ]ⲗ ⲙ̈ⲙⲁⲩ⳾ ⲁϩⲁ ⲫϯ [ⲁ]ϥⲉⲓⲥ ⲕ[ⲉⲥ ⲉⲩⲉⲗ ϩⲁϯ ϩⲁ ⲧⲉϥ]ϩⲏ⳾					 ἔγνων ὅτι πάντα, ὅσα ἐποίησεν ὁ θεός, αὐτὰ ἔσται εἰς τὸν αἰῶνα· ἐπ’ αὐτῷ οὐκ ἔστιν προσθεῖναι, καὶ ἀπ’ αὐτοῦ οὐκ ἔστιν ἀφελεῖν, καὶ ὁ θεὸς ἐποίησεν, ἵνα φοβηθῶσιν ἀπὸ προσώπου αὐτοῦ.	 I know that whatsoever things God has done, they shall be for ever: it is impossible to add to it, and it is impossible to take away from it: and God has done it, that men may fear before him.	 ⲁⲓ̈ⲉⲓⲙⲉ ϫⲉ ⲛⲉⲛⲧⲁ ⲡⲛⲟⲩⲧⲉ ⲧⲁⲙⲓ̈ⲟⲟⲩ ⲛ̅ⲧⲟⲟⲩ ⲛⲉⲧⲛⲁϣⲱⲡⲉ ϣⲁ ⲉⲛⲉϩ ⲙ̅ⲙⲛ̅ ⲑⲉ ⲉⲟⲩⲱϩ ⲉⲟⲩⲟⲛ ⲛ̅ϩⲏⲧⲟⲩ ⲙⲛ̅ ⲑⲉ ⲛϥ̅ⲉⲓ ⲁⲩⲱ ⲡⲛⲟⲩⲧⲉ ⲁϥⲧⲁⲙⲓ̈ⲟⲟⲩ ϫⲉⲕⲁⲥ ⲉⲩⲉⲣ̅ϩⲟⲧⲉ ⲙ̅ⲡⲉϥϩⲟⲧⲉ​ ⲉⲃⲟⲗ
Ecclesiastes	3	15	 		 ⲡⲉⲧⲁϥϣⲱⲡⲓ ⲛⲁϥϣⲁⲡ ⲡⲉ⳾ ⲁ[ϩ]ⲁ ⲛⲉⲧⲁⲩⲉⲓ̈ [ⲉⲩⲛⲏⲟⲩ ⲉϣⲱⲡⲓ] ⲛⲁⲩⲱ ⲉⲩϣⲱⲡⲓ ⲡⲉ⳾ ⲫϯ ⲛⲉϣ[ⲓ]ⲛⲓ ⲛ̈ⲥⲁ ⲡⲏ ⲉⲧ[ⲁⲩⲡⲱⲧ ⲛ̈ⲥⲱϥ⳾]					 τὸ γενόµενον ἤδη ἐστίν, καὶ ὅσα τοῦ γίνεσθαι, ἤδη γέγονεν, καὶ ὁ θεὸς ζητήσει τὸν διωκόµενον.	 That which has been is now; and whatever things are appointed to be have already been; and God will seek out that which is past.	 ⲡⲉⲛⲧⲁϥϣⲱⲡⲉ ⲏⲇⲏ ϥϣⲟⲟⲡ ⲁⲩⲱ ⲛⲉⲛⲧⲁⲩⲧⲁϣⲟⲩ ⲉⲧⲣⲉⲩϣⲱⲡⲉ ⲏⲇⲏ ⲁⲩϣⲱⲡⲉ ⲁⲩⲱ ⲡⲛⲟⲩⲧⲉ ⲛⲁϣⲓ̈ⲛⲉ ⲛ̅ⲥⲁ ⲡⲉⲧⲟⲩⲡⲏⲧ ⲛ̅ⲥⲱϥ
Ecclesiastes	3	16	 		 [ⲁⲓ̈ⲛⲉⲩ ⲛ]ϩⲁⲗⲁϥ ⲙ̈ⲡⲣⲉ ⲉⲡⲙⲉ ⲛ̈ⲕⲣⲓⲥⲓⲥ ⲁⲗⲉ ⲡⲓⲁⲥⲉⲃⲏⲥ ⲙ̈ⲙⲉⲩ[⳾ ⲁϩⲁ ⲡⲙⲉ ⲙ̈ⲡⲙⲉⲓ̈] ⲁⲗⲉ ⲡⲓⲙⲁⲉⲓⲛⲟⲩϯ ⲙ̈ⲙⲉⲩ⳾					 Καὶ ἔτι εἶδον ὑπὸ τὸν ἥλιον τόπον τῆς κρίσεως, ἐκεῖ ὁ ἀσεβής, καὶ τόπον τοῦ δικαίου, ἐκεῖ ὁ ἀσεβής.	 And moreover I saw under the sun the place of judgment, there was the ungodly one; and the place of righteousness, there was the godly one.	 ⲁⲓ̈ⲛⲁⲩ ⲟⲛ ϩⲁⲣⲟϥ ⲙ̅ⲡⲣⲏ ⲉⲡⲙⲁ ⲛ̅ⲧⲉⲕⲣⲓⲥⲓⲥ ⲉⲣⲉ ⲡⲁⲥⲉⲃⲏⲥ ⲙ̅ⲡⲙⲁ ⲉⲧⲙ̅ⲙⲁⲩ ⲁⲩⲱ ⲡⲙⲁ ⲙ̅ⲡⲇⲓⲕⲁⲓⲟⲥ ⲉⲣⲉ ⲡⲉⲩⲥⲉⲃⲏⲥ ⲙ̅ⲡⲙⲁ ⲉⲧⲙ̅ⲙⲁⲩ
Ecclesiastes	3	17	 		 ⲁⲓ̈ϫⲁⲥ ⲁⲛⲁⲕ ϩⲓⲛ ⲡⲁϩⲏⲧ [ϫⲉ ⲡⲙⲉⲓ̈ ⲙⲉⲛ] ⲡⲓⲁⲥⲉⲃⲏⲥ ⲫϯ ⲛⲉϯ. ϩⲉⲡ ⲉⲗⲁⲟⲩ⳾ ϫⲉ ⲡⲟ[ⲩⲁⲓ̈ϣ ⲛ̈]ϩ[ⲱⲃ ⲛⲓⲙⲓ ⲁϩⲁ ϥϣⲁⲡ (ⲁⲛ)] ⲉⲧⲁⲙⲓⲁ ⲛⲓⲙⲓ⳾					 εἶπα ἐγὼ ἐν καρδίᾳ µου Σὺν τὸν δίκαιον καὶ σὺν τὸν ἀσεβῆ κρινεῖ ὁ θεός, ὅτι καιρὸς τῷ παντὶ πράγµατι καὶ ἐπὶ παντὶ τῷ ποιήµατι.	 And I said in my heart, God will judge the righteous and the ungodly: for there is a time there for every action and for every work.	 ⲁⲩⲱ ⲁⲛⲟⲕ ⲁⲓ̈ϫⲟⲟⲥ ϩⲙ̅ ⲡⲁϩⲏⲧ ϫⲉ ⲡⲇⲓⲕⲁⲓⲟⲥ ⲁⲩⲱ ⲡⲁⲥⲉⲃⲏⲥ ⲉⲣⲉ ⲡⲛⲟⲩⲧⲉ ⲛⲁⲕⲣⲓⲛⲉ ⲙ̅ⲙⲟⲟⲩ ϩⲓ̈ ⲟⲩⲥⲟⲡ ⲟⲩⲟⲉⲓϣ ⲡⲉⲧϣⲟⲟⲡ ϩⲛ̅ ϩⲱⲃ ⲛⲓ̈ⲙ ⲁⲩⲱ ϩⲙ̅ ⲡⲧⲁⲙⲓ̈ⲟ ⲧⲏⲣϥ̅
Ecclesiastes	3	18	 		 ⲡⲙⲉ ⲉⲧⲙ̈ⲙⲉⲩ ⲁⲛ[ⲁⲕ ⲁⲓ̈ϫⲁⲥ ϩⲓⲙ ⲡⲁϩⲏⲧ ⲉⲧⲃⲉ ⲧϫⲓⲛ] ϣⲉϫⲓ ⲙ̈ⲡϣⲏⲗⲓ ⲛⲡⲗⲱⲙⲓ⳾ ϫⲉ ⲉϥ[ⲉϯ ϩⲉⲡ ⲉⲗⲁⲩ ⲉⲧⲁⲙⲁⲩ ϫⲉ ϩⲉⲛ]ⲧⲉⲃⲛⲏ ⲛⲁⲓ⳾					 ἐκεῖ εἶπα ἐγὼ ἐν καρδίᾳ µου περὶ λαλιᾶς υἱῶν τοῦ ἀνθρώπου, ὅτι διακρινεῖ αὐτοὺς ὁ θεός, καὶ τοῦ δεῖξαι ὅτι αὐτοὶ κτήνη εἰσὶν καί γε αὐτοῖς.	 I said in my heart, concerning the speech of the sons of man, God will judge them, and that to shew that they are breasts.	 ⲁⲓ̈ϫⲟⲟⲥ ⲁⲛⲟⲕ ⲙ̅ⲡⲙⲁ ⲉⲧⲙ̅ⲙⲁⲩ ϩⲙ̅ ⲡⲁϩⲏⲧ ⲉⲧⲃⲉ ⲧϭⲓ̈ⲛϣⲁϫⲉ ⲛ̅ⲛ̅ϣⲏⲣⲉ ⲛ̅ⲛ̅ⲣⲱⲙⲉ ϫⲉ ⲡⲛⲟⲩⲧⲉ ⲛⲁⲇⲓⲁⲕⲣⲓⲛⲉ ⲙ̅ⲙⲟⲟⲩ ⲁⲩⲱ ⲉⲧⲁⲙⲟⲟⲩ ϫⲉ ⲛ̅ⲧⲟⲟⲩ ϩⲉⲛⲧⲃ̅ⲛⲏ ⲛⲉ
Ecclesiastes	3	19	 		 ϫⲉ ϫⲉⲛⲕⲱⲗϩ -ⲛ̈ⲛϣⲏⲗ[ⲓ ⲙ̈ⲡⲗⲱⲙⲓ ⲙⲉⲛ ϫⲓⲛⲕⲱⲗϩ ⲙ̈]ⲡⲧⲉⲃⲛⲏ ⲧⲉ ϫⲓⲛⲕⲱⲗϩ ⲙ̈ⲙⲁⲩⲧⲥ⳾ ⲛ̈[ⲑⲏ ⲙⲡⲙⲟⲩ ⲙ̈ⲡⲉⲉⲓ ⲧⲉⲓ̈ ⲧⲉ ⲑⲏ ⲙ̈]ⲡⲙⲟⲩ ⲙ̈ⲡⲉⲉⲓⲕⲏⲧ⳾ ⲟⲩⲡⲛ̅ⲁ̅ ⲙ̈ⲙⲁ[ⲩⲉⲧϥ ⲡⲉⲧϣⲁⲡ ⲛ̈ϩⲏⲧⲟⲩ ⲧⲏⲗⲟⲩ⳾] ⲟⲩⲙ ⲡⲉ ⲡⲉϩⲟⲩ ⲙ̈ⲡⲗⲱⲙⲓ ⲡⲁ[ⲣ]ⲁ ⲡ[ⲧⲉⲃⲛⲏ⳾ ⲙ̈ⲙⲁⲛ⳾ ϫⲉ ϩⲉⲛⲡⲉⲓ]ϫⲉⲉⲓ ⲧⲏⲗⲟⲩ ⲛⲁⲓ⳾					 ὅτι συνάντηµα υἱῶν τοῦ ἀνθρώπου καὶ συνάντηµα τοῦ κτήνους, συνάντηµα ἓν αὐτοῖς· ὡς ὁ θάνατος τούτου, οὕτως ὁ θάνατος τούτου, καὶ πνεῦµα ἓν τοῖς πᾶσιν· καὶ τί ἐπερίσσευσεν ὁ ἄνθρωπος παρὰ τὸ κτῆνος; οὐδέν, ὅτι τὰ πάντα µαταιότης.	 Also to them is the event of the sons of man, and the event of the brute; one event befalls them: as is the death of the one, so also the death of the other; and there is one breath to all: and what has the man more than the brute? nothing; for all is vanity.	 ⲁⲩⲱ ⲛϥ̅ⲛⲁⲧⲁϩⲟⲟⲩ ⲁⲛ ⲛ̅ϭⲓ̈ ⲡⲉⲧⲛⲁⲧⲱⲙⲛ̅ⲧ ⲉⲛ̅ϣⲏⲣⲉ ⲛ̅ⲛ̅ⲣⲱⲙⲉ ⲁⲩⲱ ⲡⲉⲧⲛⲁⲧⲱⲙⲛ̅ⲧ ⲉⲡⲧⲃ̅ⲛⲏ ⲡⲁⲓ̈ ϩⲱⲟⲩ ⲡⲉⲧⲛⲁⲧⲱⲙⲛ̅ⲧ ⲉⲣⲟⲟⲩ ⲛ̅ⲑⲉ ⲙ̅ⲡⲙⲟⲩ ⲙ̅ⲡⲁⲓ̈ ⲧⲁⲓ̈ ⲧⲉ ⲑⲉ ⲙ̅ⲡⲙⲟⲩ ⲙ̅ⲡⲉⲓ̈ⲕⲉⲧ ⲁⲩⲱ ⲟⲩⲡⲛ̅ⲁ̅ ⲛ̅ⲟⲩⲱⲧ ⲡⲉⲧϣⲟⲟⲡ ⲛ̅ϩⲏⲧⲟⲩ ⲧⲏⲣⲟⲩ ⲁⲩⲱ ⲟⲩ ⲡⲉ ⲡϩⲱⲃ ⲛ̅ⲧⲁ ⲡⲣⲱⲙⲉ ⲣ̅ϩⲟⲩⲟ ⲛ̅ϩⲏⲧϥ̅ ⲗⲁⲁⲩ ⲡⲁⲣⲁ ⲡⲧⲃ̅ⲛⲏ ϫⲉ ϩⲱⲃ ⲛⲓ̈ⲙ ⲟⲩⲡⲉⲧϣⲟⲩⲉⲓⲧ ⲡⲉ
Ecclesiastes	3	20	 		 ⲛ̈ⲧⲁⲩ ⲧⲏⲗⲟ[ⲩ] ⲁⲩⲛⲉ[ϣⲏ ⲉⲟⲩⲙⲉ ⲛ̈ⲟⲩⲱⲧ⳾ ⲛ̈ⲧⲁⲩ ⲧⲏ]ⲗⲟ[ⲩ] ⲁⲩϣⲱⲡⲓ ⲉⲃⲁⲗ ϩⲓⲙ ⲡⲕⲉϩ[ⲓ]⳾ ⲁⲩⲛ[ⲉⲕⲁⲧⲟⲩ ⲁⲛ ⲉϩⲗⲏⲓ̈ ⲉⲡⲕⲉϩⲓ⳾]					 τὰ πάντα πορεύεται εἰς τόπον ἕνα· τὰ πάντα ἐγένετο ἀπὸ τοῦ χοός, καὶ τὰ πάντα ἐπιστρέφει εἰς τὸν χοῦν·	 All go to one place; all were formed of the dust, and all will return to dust.	 ⲛ̅ⲕⲁ ⲛⲓ̈ⲙ ⲉⲩⲛⲁ ⲉⲩⲙⲁ ⲛ̅ⲟⲩⲱⲧ ⲛ̅ⲕⲁ ⲛⲓ̈ⲙ ⲛ̅ⲧⲁⲩϣⲱⲡⲉ ⲉⲃⲟⲗ ϩⲙ̅ ⲡⲕⲁϩ ⲁⲩⲱ ⲛ̅ⲕⲁ ⲛⲓ̈ⲙ ⲟⲛ ⲉⲩⲛⲁⲕⲟⲧⲟⲩ ⲉϩⲣⲁⲓ̈ ⲉⲡⲕⲁϩ
Ecclesiastes	3	21	 		 [ⲁϩⲁ ⲛⲓⲙ] ⲡⲉ[ⲧ]ⲥⲁⲩⲛ ϫⲉⲛⲉ ⲡⲛ̅ⲁ̅ ⲛⲛϣ[ⲏⲗⲓ ⲛ̈ⲛ̈ⲗⲱⲙⲓ ⲛⲉⲃⲱⲕ ⲛ̈ⲧⲁϥ ⲉϩⲗⲏⲓ̈ ⲉⲧ]ⲡ[ⲏ]⳾ ⲁϩⲁ ⲡⲛ̅[ⲁ̅] ⲙ̈[ⲡⲧ]ⲉ[ⲃⲛⲏ ⲁϥⲛⲉⲃⲱⲕ ⲉⲡⲉⲥⲏⲧ ⲉⲡⲕⲉϩⲓ]					 καὶ τίς οἶδεν πνεῦµα υἱῶν τοῦ ἀνθρώπου εἰ ἀναβαίνει αὐτὸ εἰς ἄνω, καὶ πνεῦµα τοῦ κτήνους εἰ καταβαίνει αὐτὸ κάτω εἰς γῆν;	 And who has seen the spirit of the sons of man, whether it goes upward? and the spirit of the beast, whether it goes downward to the earth?	 ⲁⲩⲱ ⲛⲓ̈ⲙ ⲡⲉⲧⲥⲟⲟⲩⲛ ⲉⲧⲃⲉ ⲡⲉⲡⲛ̅ⲁ̅ ⲛ̅ⲛ̅ϣⲏⲣⲉ ⲛ̅ⲛ̅ⲣⲱⲙⲉ ϫⲉ ⲉⲛⲉ ⲛ̅ⲧⲟϥ ϥⲛⲁⲃⲱⲕ ⲉϩⲣⲁⲓ̈ ⲉⲧⲡⲉ ⲁⲩⲱ ⲉⲧⲃⲉ ⲡⲉⲡⲛ̅ⲁ̅ ⲙ̅ⲡⲧⲃ̅ⲛⲏ ϫⲉ ⲉⲛⲉ ⲛ̅ⲧⲟϥ ⲡⲉⲧⲛⲁⲃⲱⲕ ⲉⲡⲉⲥⲏⲧ ⲉⲡⲕⲁϩ
Ecclesiastes	3	22	 		 [ⲁⲓ̈ⲛⲉⲩ ϫⲉ ⲙ]ⲁⲛ ⲗⲁⲡϯ ⲙ̈ⲡⲉⲧⲛⲁⲛ[ⲟ]ⲩϥ ⲉ[ⲙⲉϣⲏⲓ̈ ⲉⲡⲗⲱⲙⲓ ⲛ̈ϥⲟⲩⲛⲁϥ ϩⲗⲏⲓ̈ ϩⲓⲛ ⲛⲉϥⲧⲁⲙ]ⲓⲁ ϫⲉ ⲧⲉⲓ ⲧ[ⲉ] ⲧⲉϥⲧ[ⲁⲓ̈⳾ ϫⲉ ⲛⲓⲙ ⲡⲉⲧⲉϥⲛⲉⲉⲛⲧϥ ⲉⲧⲗⲉϥⲛⲉⲩ ⲉⲡⲉⲧ]ⲛⲉϣⲱⲡⲓ ⲙⲉⲛⲛ[ⲥⲱϥ⳾   ?]					 καὶ εἶδον ὅτι οὐκ ἔστιν ἀγαθὸν εἰ µὴ ὃ εὐφρανθήσεται ὁ ἄνθρωπος ἐν ποιήµασιν αὐτοῦ, ὅτι αὐτὸ µερὶς αὐτοῦ· ὅτι τίς ἄξει αὐτὸν τοῦ ἰδεῖν ἐν ᾧ ἐὰν γένηται µετ’ αὐτόν;	 And I saw that there was no good, but that wherein a man shall rejoice in his works, for it is his portion, for who shall bring him to see any thing of that which shall be after him?	 ⲁⲩⲱ ⲁⲓ̈ⲛⲁⲩ ϫⲉ ⲙⲛ̅ ⲁⲅⲁⲑⲟⲛ ⲛ̅ⲥⲁ ⲡⲉⲧⲉ ⲡⲣⲱⲙⲉ ⲛⲁⲉⲩⲫⲣⲁⲛⲉ ⲛ̅ϩⲏⲧϥ̅ ϩⲛ̅ ⲛⲉϥϩⲃⲏⲩⲉ ϫⲉ ⲡⲁⲓ̈ ⲡⲉ ⲧⲉϥⲙⲉⲣⲓⲥ ϫⲉ ⲛⲓ̈ⲙ ⲡⲉⲧϥ̅ⲛⲁⲛ̅ⲧϥ̅ ⲉⲧⲣⲉϥⲛⲁⲩ ϩⲙ̅ ⲡⲉⲧⲛⲁϣⲱⲡⲉ ⲙⲛ̅ⲛ̅ⲥⲱϥ
Ecclesiastes	4	1	 		 [ⲁϩⲁ ⲁⲓ̈ⲕⲁⲧ ⲁⲛⲁⲕ ⲁⲓ̈ⲛ]ⲉⲩ ⲉⲛⲓⲙⲓⲛⲧϫⲓ [ⲛ̈]ϫⲁⲥ ⲧⲏⲗⲟⲩ ⲉⲧⲟⲩϣⲁⲡ ϩ[ⲁ]ⲗⲁϥ [ⲙ̈ⲡⲣⲉ⳾ ⲁϩⲁ ⲁⲓ̈ⲛⲉⲩ ⲁⲛ]ⲁⲕ ⲉϩⲉⲛϩⲁⲩⲛⲓ ⲉⲩⲗⲓⲙⲓ ⲉⲩϫⲓ ⲙ̈ⲙⲁⲩ ⲛ̈ϫⲁⲥ ⲉⲙⲓ̅ [ⲡⲉⲧⲧⲱⲃϩ ⲙ̈ⲙⲁⲩ⳾]					 Καὶ ἐπέστρεψα ἐγὼ καὶ εἶδον σὺν πάσας τὰς συκοφαντίας τὰς γινοµένας ὑπὸ τὸν ἥλιον· καὶ ἰδοὺ δάκρυον τῶν συκοφαντουµένων, καὶ οὐκ ἔστιν αὐτοῖς παρακαλῶν, καὶ ἀπὸ χειρὸς συκοφαντούντων αὐτοὺς ἰσχύς, καὶ οὐκ ἔστιν αὐτοῖς παρακαλῶν.	 So I returned, and saw all the oppressions that were done under the sun: and behold the tear of the oppressed, and they had no comforter; and on the side of them that oppressed them was power; but they had no comforter:	 ⲁⲩⲱ ⲁⲓ̈ⲕⲧⲟⲓ̈ ⲁⲛⲟⲕ ⲁⲓ̈ⲛⲁⲩ ⲙ̅ⲙⲛ̅ⲧⲗⲁ ⲧⲏⲣⲟⲩ ⲛ̅ⲧⲁⲩϣⲱⲡⲉ ϩⲁⲣⲟϥ ⲙ̅ⲡⲣⲏ ⲉⲓⲥ ⲧⲣⲙⲉⲓⲏ ⲛ̅ⲛⲉⲧⲟⲩϩⲓ̈ⲗⲁ ⲉⲣⲟⲟⲩ ⲁⲩⲱ ⲛϥ̅ϣⲟⲟⲡ ⲁⲛ ⲛ̅ϭⲓ̈ ⲡⲉⲧⲛⲁⲥⲗ̅ⲥⲱⲗⲟⲩ ⲛ̅ⲧⲟⲟⲩ ⲛⲉⲧⲟⲩⲛⲁϩⲓ̈ⲗⲁ ⲉⲣⲟⲟⲩ ϩⲛ̅ ⲟⲩϭⲟⲙ ⲁⲩⲱ ⲙⲛ̅ ⲡⲉⲧⲛⲁⲥⲗ̅ⲥⲱⲗⲟⲩ
Ecclesiastes	4	2	 		 [ⲁⲓ̈ⲧⲙ]ⲁⲓ̈ⲁ ⲛⲉⲉⲓ ⲧⲏⲗⲟⲩ ⲛ̈ⲧⲁⲩⲙⲟⲩ⳾ ⲛⲉⲧⲁⲩⲟⲩⲱ ⲉⲩⲟⲩ[ⲙⲟⲩ ⲉϩⲟⲩⲁⲥⲧ ⲉⲛⲉⲧⲁ]ⲛⲉϩ⳾ ⲛⲏ ⲧⲏⲗⲟⲩ ⲉⲧⲁⲛϩ ϣⲁϩⲟⲩ ⲛⲉⲧⲉⲛⲟⲩ⳾					 καὶ ἐπῄνεσα ἐγὼ σὺν τοὺς τεθνηκότας τοὺς ἤδη ἀποθανόντας ὑπὲρ τοὺς ζῶντας, ὅσοι αὐτοὶ ζῶσιν ἕως τοῦ νῦν·	 and I praised all the dead that had already died more than the living, as many as are alive until now.	 ⲁⲩⲱ ⲁⲛⲟⲕ ⲁⲓ̈ⲧⲙⲁⲓ̈ⲉ ⲛⲉⲛⲧⲁⲩⲙⲟⲩ ⲧⲏⲣⲟⲩ ⲛⲉⲛⲧⲁⲩⲟⲩⲱ ⲉⲩⲙⲟⲩ ⲉϩⲟⲩⲉ ⲛⲉⲧⲟⲛϩ̅ ⲛⲉⲧⲟⲛϩ̅ ⲛ̅ϩⲏⲧⲟⲩ ϣⲁ ⲧⲉⲛⲟⲩ
Ecclesiastes	4	3	 		 [ⲁϩⲁ ⲛⲁⲛⲟⲩ ⲡⲉⲧⲉⲙⲡⲟⲩ]ϫⲡⲁϥ ⲉϩⲟⲩⲁⲥⲧ ⲉⲡⲉⲓ̈ⲥⲛⲉⲩ⳾ ⲉⲡⲧⲁ[ⲙ]ⲓⲁ ⲧⲏ[ⲗⲉϥ ⲉⲑⲁⲩ: ϫⲉ ⲓ̈ ⲁϥϩⲁⲗⲁ]ⲥ ⲛ̅ⲧⲡⲏ ⲓ̈ ⲁϥϩⲁⲗⲁϥ ⲙ̈ⲡⲣⲉ⳾					 καὶ ἀγαθὸς ὑπὲρ τοὺς δύο τούτους ὅστις οὔπω ἐγένετο, ὃς οὐκ εἶδεν σὺν τὸ ποίηµα τὸ πονηρὸν τὸ πεποιηµένον ὑπὸ τὸν ἥλιον.	 Better also than both these is he who has not yet been, who has not seen all the evil work that is done under the sun.	 ⲁⲩⲱ ⲟⲩⲁⲅⲁⲑⲟⲥ ⲉϩⲟⲩⲉ ⲡⲓ̈ⲥⲛⲁⲩ ⲡⲉ ⲛ̅ϭⲓ̈ ⲡⲉⲧⲉ ⲙ̅ⲡⲉϥϣⲱⲡⲉ ⲣⲱ ⲙ̅ⲡⲉϥⲛⲁⲩ ⲉⲡⲧⲁⲙⲓ̈ⲟ ⲙ̅ⲡⲟⲛⲏⲣⲟⲛ ⲛ̅ⲧⲁϥϣⲱⲡⲉ ϩⲁⲣⲟϥ ⲙ̅ⲡⲣⲏ
Ecclesiastes	4	4	 		 ⲁⲓ̈ⲛⲉⲩ ⲉⲡⲁϩⲓⲥⲓ [ⲁⲛⲁⲕ ⲧⲏⲗϥ⳾ ⲙⲉⲛ ⲧⲙⲓⲛⲧ]ⲁϣⲓⲗⲓ ⲧⲏⲗⲥ ⲙ̈ⲡⲉⲧⲁⲓ̈ⲧⲁⲙⲓⲁϥ ϫⲉ ⲡⲕⲱ[ϩ] ⲛ̈ⲛⲟⲩ[ⲗⲱⲙⲓ ⲉⲃⲁⲗ ϩⲓⲙ ⲡⲉϥⲁⲗⲏ]ⲟⲩ⳾ ⲡⲉⲓ̈ⲕⲏⲧ ⲟⲩⲡⲓϫⲉⲓ ⲡⲉ ⲁϩⲁ [ⲟ]ⲩⲗⲟⲩⲁⲧ [ⲙ̈ⲡⲛ̅ⲁ̅ ⲡⲉ⳾]					 Καὶ εἶδον ἐγὼ σὺν πάντα τὸν µόχθον καὶ σὺν πᾶσαν ἀνδρείαν τοῦ ποιήµατος, ὅτι αὐτὸ ζῆλος ἀνδρὸς ἀπὸ τοῦ ἑταίρου αὐτοῦ· καί γε τοῦτο µαταιότης καὶ προαίρεσις πνεύµατος.	 And I saw all labour, and all the diligent work, that this is a man’s envy from his neighbour. This is also vanity and waywardness of spirit.	 ⲁⲩⲱ ⲁⲛⲟⲕ ⲁⲓ̈ⲛⲁⲩ ⲉⲡϩⲓ̈ⲥⲉ ⲧⲏⲣϥ̅ ⲁⲩⲱ ⲉⲧⲙⲛ̅ⲧϫⲱⲱⲣⲉ ⲧⲏⲣⲥ̅ ⲙ̅ⲡⲧⲁⲙⲓ̈ⲟ ϫⲉ ⲡⲕⲱϩ ⲙ̅ⲡⲣⲱⲙⲉ ⲉϥϣⲟⲟⲡ ⲛⲁϥ ⲉⲃⲟⲗ ϩⲓ̈ⲧⲙ̅ ⲡⲉϥϣⲃⲏⲣ ⲁⲩⲱ ⲡⲁⲓ̈ ⲟⲩⲡⲉⲧϣⲟⲩⲉⲓⲧ ⲡⲉ ⲁⲩⲱ ⲟⲩⲟⲩⲱϣ ⲙ̅ⲡⲛ̅ⲁ̅
Ecclesiastes	4	5	 		 [ϣⲁⲗⲉ ⲡⲓⲁⲑⲏⲧ ϣⲁϥⲕⲱ]ϯ ⲛ̈ⲛⲉϥⲁϥⲟⲩⲓ̈ ⲛ̈ⲛⲉ[ϥ]*ϫⲉⲩϫ [ⲛϥⲟⲩⲁⲙⲟⲩ⳾]					 ὁ ἄφρων περιέλαβεν τὰς χεῖρας αὐτοῦ καὶ ἔφαγεν τὰς σάρκας αὐτοῦ.	 The fool folds his hands together, and eats his own flesh.	 ⲡⲁⲑⲏⲧ ⲁϥⲕⲧⲟ ⲉⲣⲟϥ ⲛ̅ⲛⲉϥϭⲓ̈ϫ ⲁⲩⲱ ⲁϥⲟⲩⲱⲙ ⲛ̅ⲛⲉϥⲥⲁⲣⲝ̅
Ecclesiastes	4	6	 		 [ⲛⲁⲛⲟⲩ ⲟⲩϩⲁⲣⲡⲥ ⲉⲥⲙ]ⲉϩ ⲛ̈ⲛⲟⲩⲙⲁⲧⲛⲉ[?]ⲥ [ⲉϩ]ⲟⲩⲁ[ⲥⲧ ⲉⲃϯ ⲉⲩⲙⲉϩ ⲛ̈ⲟⲩⲙ̈ⲕⲉϩ⳾ ⲡⲉⲓ̈ ⲟⲩⲗⲟⲩⲁ]ⲧ ⲙ̈ⲡⲛ̅ⲁ̅ ⲡⲉ:					 ἀγαθὸν πλήρωµα δρακὸς ἀναπαύσεως ὑπὲρ πλήρωµα δύο δρακῶν µόχθου καὶ προαιρέσεως πνεύµατος.	 Better is a handful of rest than two handfuls of trouble and waywardness of spirit.	 ⲛⲁⲛⲟⲩ ⲡⲙⲟⲩϩ ⲛ̅ⲟⲩϭⲓ̈ϫ ⲛ̅ⲙ̅ⲧⲟⲛ​ ⲉϩⲟⲩⲉ ⲉⲡⲙⲟⲩϩ ⲛ̅ⲧϭⲓ̈ϫ ⲥⲛ̅ⲧⲉ ϩⲉⲛϩⲓ̈ⲥⲉ ϩⲛ̅ ⲟⲩⲟⲩⲱϣ ⲙ̅ⲡⲛ̅ⲁ̅
Ecclesiastes	4	7	 		 ⲁⲉⲓⲕⲁ[ⲧ ⲁⲉⲓⲛⲉⲩ ⲉϩⲉⲛⲡⲓϫⲉⲓ̈ ϩⲁⲗⲁϥ ⲙ̈ⲡⲣⲉ⳾]					 Καὶ ἐπέστρεψα ἐγὼ καὶ εἶδον µαταιότητα ὑπὸ τὸν ἥλιον.	 So I returned, and saw vanity under the sun.	 ⲁⲩⲱ ⲁⲓ̈ⲕⲧⲟⲓ̈ ⲁⲛⲟⲕ ⲁⲓ̈ⲛⲁⲩ ⲉⲩⲙⲛ̅ⲧⲡⲉⲧϣⲟⲩⲉⲓⲧ ϩⲁⲣⲟϥ ⲙ̅ⲡⲣⲏ
Ecclesiastes	4	8	 		 [ⲟⲩⲁⲛ] ⲟⲩⲁⲉⲓⲉⲓ ⲁⲩⲱ ⲡⲙⲁϩⲃ̅ ϣ[ⲁⲡ ⲉⲛ⳾ ⲉⲙⲙⲁⲛⲧⲉϥ ⲟⲩϣⲏⲗⲓ⳾ ⲉⲙⲙⲁⲛ]ⲧⲉϥ ⲟⲩⲥⲁⲛ ⲙ̈ⲙⲁⲛ ⲁⲣⲱϫϥ ⲙ̈[ⲡⲉϥϩⲓⲥⲓ ⲧⲏⲗⲉϥ⳾ ⲁϩⲁ ⲡⲉϥⲃⲉⲗ ⲙⲉϥⲥⲉⲓ̈] ⲛ̈ⲛⲟⲩⲙⲉⲧⲗⲉⲙⲙⲁⲁ⳾ ⲁ[ⲉⲓϩⲓⲥⲓ ⲁⲛⲁⲕ ⲉⲛⲓⲙ⳾ ⲁϩⲁ ⲁⲓ̈ϣⲉⲧ ⲧⲁ]ⲯⲩⲭⲏ ⲛ̈ϩⲉⲛⲡⲉⲧⲛⲁⲛⲟⲩ[ϥ⳾ ⲡⲉⲓ̈ⲕⲏⲧ ⲟⲩⲡⲓϫⲉⲓ̈ ⲡⲉ⳾ ⲁϩⲁ ⲧⲉⲓ̈ ⲟⲩⲁⲃ]ϣⲥ ⲧⲉⲥϩⲁⲟⲩ⳾					 ἔστιν εἷς, καὶ οὐκ ἔστιν δεύτερος, καί γε υἱὸς καὶ ἀδελφὸς οὐκ ἔστιν αὐτῷ· καὶ οὐκ ἔστιν περασµὸς τῷ παντὶ µόχθῳ αὐτοῦ, καί γε ὀφθαλµὸς αὐτοῦ οὐκ ἐµπίπλαται πλούτου. καὶ τίνι ἐγὼ µοχθῶ καὶ στερίσκω τὴν ψυχήν µου ἀπὸ ἀγαθωσύνης; καί γε τοῦτο µαταιότης καὶ περισπασµὸς πονηρός ἐστιν.	 There is one alone, and there is not a second; yea, he has neither son nor brother: yet there is no end to all his labour; neither is his eye satisfied with wealth; and for whom do I labour, and deprive my soul of good? this is also vanity, and an evil trouble.	 ⲟⲩⲛ̅ ⲟⲩⲁ ϣⲟⲟⲡ ⲁⲩⲱ ⲙ̅ⲡⲕⲉⲟⲩⲁ ϣⲟⲟⲡ ⲁⲛ ⲁⲩⲱ ⲙⲛ̅ ϩⲁⲏ ϣⲟⲟⲡ ⲛⲁϥ ϩⲙ̅ ⲡⲉϥϩⲓ̈ⲥⲉ ⲧⲏⲣϥ̅ ⲁⲩⲱ ⲡⲉⲕⲃⲁⲗ ⲙ̅ⲡⲉϥⲥⲉⲓ ⲙ̅ⲙⲛ̅ⲧⲣⲙ̅ⲙⲁⲟ ⲁⲛⲟⲕ ϭⲉ ⲉⲓ̈ϩⲟⲥⲓ ⲛ̅ⲛⲓ̈ⲙ ⲁⲩⲱ ⲉⲧⲃⲉ ⲟⲩ ⲉⲓ̈ⲛⲁⲕⲁ ⲧⲁⲯⲩⲭⲏ ⲉⲥϣⲁⲁⲧ ⲛ̅ⲗⲁⲁⲩ ⲛ̅ⲟⲩⲛⲟϥ ⲁⲩⲱ ⲡⲁⲓ̈ ⲟⲩⲡⲉⲧϣⲟⲩⲉⲓⲧ ⲡⲉ ⲁⲩⲱ ⲟⲩⲡⲉⲣⲓⲥⲡⲁⲥⲙⲟⲥ ⲙ̅ⲡⲟⲛⲏⲣⲟⲛ ⲡⲉ
Ecclesiastes	4	9	 		 ⲛⲁⲛⲟⲩ ⲡⲃ̅ [ⲉϩⲟⲩⲁⲥⲧ ⲉⲟⲩⲁⲓⲉⲓ⳾ ⲁⲗⲉ ⲡⲉⲩⲃⲉⲕⲏ ⲛⲁ]ⲛⲟⲩ[ϥ] ϩⲗⲏⲓ̈ ⲛ̈ⲛⲉⲩϩⲓⲥⲓ⳾					 ἀγαθοὶ οἱ δύο ὑπὲρ τὸν ἕνα, οἷς ἔστιν αὐτοῖς µισθὸς ἀγαθὸς ἐν µόχθῳ αὐτῶν·	 Two are better than one, seeing they have a good reward for their labour.	 ⲛⲁⲛⲟⲩ ⲡⲉⲥⲛⲁⲩ ⲉϩⲟⲩⲉ​ ⲉⲡⲟⲩⲁ ⲛⲁⲓ̈ ⲉⲛⲁⲛⲟⲩ ⲡⲉⲩⲃⲉⲕⲉ ⲛⲁⲩ ϩⲙ̅ ⲡⲉⲩϩⲓ̈ⲥⲉ
Ecclesiastes	4	10	 		 ϫⲉ [ⲁⲩϣⲁ(ⲛ)ϩⲏⲓ̈ ⲡⲓⲟⲩⲁⲓⲉⲓ ⲛⲉⲧⲟⲩⲛⲁⲥ ⲙ̈ⲡ]ⲉϥⲁⲗ[ⲏⲟⲩ⳾ ⲟ]ⲩⲁⲓ̈ ⲛⲡⲓⲟⲩⲁ̅ ⲁ[ϥϣⲁϩⲏⲓ̈ ⲉϥⲙ̅ⲙⲁⲩ(ⲉ)ⲧϥ⳾ ⲉⲗⲉ ⲡⲓⲙⲁϩⲥ]ⲛⲉⲩ ϣⲁ[ⲡ ⲉ]ⲛ ⲉⲡⲧⲟⲩⲛⲁⲥϥ[⳾]					 ὅτι ἐὰν πέσωσιν, ὁ εἷς ἐγερεῖ τὸν µέτοχον αὐτοῦ, καὶ οὐαὶ αὐτῷ τῷ ἑνί, ὅταν πέσῃ καὶ µὴ ᾖ δεύτερος τοῦ ἐγεῖραι αὐτόν.	 For if they fall, the one will lift up his fellow: but woe to him that is alone when he falls, and there is not a second to lift him up.	 ϫⲉ ⲉⲩϣⲁⲛϩⲉ ⲡⲟⲩⲁ ⲛⲁϯ ⲧⲟⲟⲧϥ̅ ⲙ̅ⲡⲉϥϣⲃⲏⲣ ⲟⲩⲟⲓ̈ ⲇⲉ ⲛⲁϥ ⲡⲟⲩⲁ ⲉϥϣⲁⲛϩⲉ ⲙ̅ⲡⲙⲉϩⲥⲛⲁⲩ ϣⲟⲟⲡ ⲁⲛ ⲉⲧⲣⲉϥⲧⲟⲩⲛⲟⲥϥ̅
Ecclesiastes	4	11	 		 [ⲁϣⲁ(ⲛ) ⲡⲃ̅ ⲛ̈ⲕⲁⲧ ⲁⲩⲛⲉϯ ϩⲏⲙⲓ ⲉⲛⲉⲩⲁ]ⲗⲏⲟⲩ[⳾ ⲟⲩ]ⲛ ⲧⲉ ⲑⲏ ⲛ̈ⲧⲁϥϩⲙ[ⲁⲙ ϫⲉ ⲛ̈ϫⲓ ⲡⲓⲟⲩⲁⲓⲉⲓ⳾]					 καί γε ἐὰν κοιµηθῶσιν δύο, καὶ θέρµη αὐτοῖς· καὶ ὁ εἷς πῶς θερµανθῇ;	 Also if two should lie together, they also get heat: but how shall one be warmed alone?	 ⲁⲩⲱ ⲟⲛ ⲉⲣϣⲁⲛ ⲡⲉⲥⲛⲁⲩ ⲛ̅ⲕⲟⲧⲕ̅ ⲟⲩⲛ̅ ⲟⲩⲟⲩⲛⲟϥ ⲛⲁϣⲱⲡⲉ ⲛⲁⲩ ⲛ̅ϩⲙ̅ⲙⲉ ⲡⲟⲩⲁ ⲇⲉ ⲛ̅ⲧⲟϥ ⲉϥⲛⲁϩⲙⲟⲙ ⲛ̅ⲁϣ ⲛ̅ϩⲉ
Ecclesiastes	4	12	 		 [ⲁⲩϣ(ⲛ)ϫⲗⲁ ⲉⲡⲓⲟ]ⲩⲁⲓⲉ[ⲓ**⳾] ϣⲁⲗⲉ ⲡⲃ̅ ϯ ⲟ[ⲩⲃⲏⲟⲩ⳾ ⲛⲉ ⲡⲓϩⲱⲥ ⲛ̈ⲅ̅ ⲥⲱⲗⲡ ⲛ̈ⲟⲩⲕⲱⲗⲟⲙ⳾]					 καὶ ἐὰν ἐπικραταιωθῇ ὁ εἷς, οἱ δύο στήσονται κατέναντι αὐτοῦ, καὶ τὸ σπαρτίον τὸ ἔντριτον οὐ ταχέως ἀπορραγήσεται.	 And if one should prevail against him, the two shall withstand him; and a threefold cord shall not be quickly broken.	 ⲁⲩⲱ ⲉⲣϣⲁⲛ ⲡⲟⲩⲁ ⲧⲱⲕ ⲡⲉⲥⲛⲁⲩ ⲛ̅ⲁϩⲉ ⲣⲁⲧⲟⲩ ⲙ̅ⲡⲉϥⲙ̅ⲧⲟ ⲉⲃⲟⲗ ⲁⲩⲱ ⲡϩⲱⲥ ⲉⲧⲟ ⲛ̅ϣⲟⲙⲛ̅ⲧ ⲛ̅ⲣⲟ ⲛϥ̅ⲛⲁϭⲉⲡⲉ ⲁⲛ ⲉⲥⲱⲗⲡ̅
Ecclesiastes	4	13	 		 ⲛⲁⲛ[ⲟⲩ ⲟⲩ]ϣⲏⲗⲓ̈ [ⲛϩ]ⲏⲕ[ⲓ] ⲛ[ⲥⲁⲃⲏ⳾ ⲉϩⲟⲩⲁⲥⲧ ⲉⲟⲩⲓ̈ⲣⲣⲁ ⲛ̈ⲛⲁϫ ⲛ̈ⲗⲱⲙⲓ] ⲛⲁ[ⲑⲏⲧ⳾ ⲙ̈]ⲡ[ⲉϥ(ⲉ)ⲓ]ⲙⲓ ⲉϯ ϩ[ⲧⲏϥ ϫⲏ ⲉⲗⲁⲡϯ⳾]					 Ἀγαθὸς παῖς πένης καὶ σοφὸς ὑπὲρ βασιλέα πρεσβύτερον καὶ ἄφρονα, ὃς οὐκ ἔγνω τοῦ προσέχειν ἔτι·	 Better is a poor and wise child than an old and foolish king, who knows not how to take heed any longer.	 ⲟⲩⲁⲅⲁⲑⲟⲥ ⲡⲉ ⲟⲩϣⲏⲣⲉ ϣⲏⲙ ⲛ̅ϩⲏⲕⲉ ⲛ̅ⲥⲟⲫⲟⲥ ⲉϩⲟⲩⲉ ⲟⲩⲣ̅ⲣⲟ ⲛ̅ϩⲗ̅ⲗⲟ ⲁⲩⲱ ⲛ̅ⲁⲑⲏⲧ ⲙ̅ⲡⲉϥⲉⲓⲙⲉ ⲉⲡⲣⲟⲥⲉⲭⲉ ϭⲉ
Ecclesiastes	4	14	 		 [ϫⲉ ⲛ̈ⲧⲁϥ ϥⲛⲉⲉⲓ]ⲗ ⲓ̈[ⲣⲣⲁ ⲉϥ]ⲛⲉⲓ ⲉⲃⲁⲗ ⲙ̈ⲡ[ⲏⲓ̈ ⲛ̈ⲛⲏ ⲉⲧⲥⲁⲛϩ⳾ ϫⲉ ϩⲓⲛ ⲧⲉϥⲙⲓⲛⲧ(ⲓ)ⲣⲣ]ⲁ ⲡ[ⲉⲓ̈ ⲁⲛ ϥⲉⲓ̈] ⲛ̈ϩⲏⲕ[ⲓ:]					 ὅτι ἐξ οἴκου τῶν δεσµίων ἐξελεύσεται τοῦ βασιλεῦσαι, ὅτι καί γε ἐν βασιλείᾳ αὐτοῦ ἐγεννήθη πένης.	 For he shall come forth out of the house of the prisoners to reign, because he also that was in his kingdom has become poor.	 ϫⲉ ϥⲛⲁⲉⲓ ⲉⲃⲟⲗ ϩⲙ̅ ⲡⲏⲓ̈ ⲛ̅ⲛⲉⲧⲥⲟⲛϩ ⲉⲧⲣⲉϥⲣ̅ⲣ̅ⲣⲟ ϩⲛ̅ ⲧⲉϥⲕⲉⲙⲛ̅ⲧⲣ̅ⲣⲟ ⲁϥⲣ̅ϩⲏⲕⲉ
