book	chapter	verse	Bohairic	Akhmimic	Fayyumic	OldBohairic	Mesokemic	DialectP	Lycopolitan	Greek	English	Sahidic
Ecclesiastes	6	3	 		 ⲁϣⲁϫⲡⲁ ⲣ̅ ⲛ̈ⲛⲟⲩⲗⲱⲙⲓ ⲛ̈ϥⲱⲛϩ ⲛ̈ⲛⲟⲩⲁⲧⲁ ⲛ̈ⲗⲁⲙⲡⲓ ⲛ̈ϥⲥⲱⲕ ⲉⲃⲁⲗ⳾ ϫⲉ ⲛⲉϩⲁⲟⲩ ⲛ̈ⲧⲉ ⲡⲉϥⲱⲛϩ ⲁⲩⲛⲉϣⲱⲧ ⲛⲉⲧⲉϥⲯⲩ[ⲭ]ⲩ ⲛⲉⲥⲓ ⲉⲛ ϩⲁⲃⲁⲗ ⲙ̈ⲡⲉϥⲡⲉⲧⲛⲁⲛⲟⲩϥ⳾ ⲁϩⲁ ⲙ̈ⲡⲟ[ⲩ]ⲕⲁⲥϥ⳾ ⲁⲉⲓϫⲁⲥ ϫⲉ ⲛⲁⲛⲟⲩ ⲡⲓϩⲟⲩϩⲏ. ⲉϩⲟⲩⲁⲥⲧ ⲉⲗⲁϥ⳾					 ἐὰν γεννήσῃ ἀνὴρ ἑκατὸν καὶ ἔτη πολλὰ ζήσεται, καὶ πλῆθος ὅ τι ἔσονται ἡµέραι ἐτῶν αὐτοῦ, καὶ ψυχὴ αὐτοῦ οὐκ ἐµπλησθήσεται ἀπὸ τῆς ἀγαθωσύνης, καί γε ταφὴ οὐκ ἐγένετο αὐτῷ, εἶπα Ἀγαθὸν ὑπὲρ αὐτὸν τὸ ἔκτρωµα,	 If a man beget a hundred children, and live many years, yea, however abundant the days of his years shall be, yet if his soul shall not be satisfied with good, and also he have no burial; I said, An untimely birth is better than he.	 ⲉⲣϣⲁⲛ ⲡⲣⲱⲙⲉ ϫⲡⲉ ϣⲏ ⲛ̅ϣⲏⲣⲉ ⲁⲩⲱ ⲛϥ̅ⲱⲛϩ̅ ⲛ̅ⲟⲩⲁϣⲏ ⲛ̅ⲣⲟⲙⲡⲉ ⲛ̅ⲧⲉ ⲛⲉϩⲟⲟⲩ ⲛ̅ⲛⲉϥⲣⲙ̅ⲡⲟⲟⲩⲉ ⲁϣⲁⲓ̈ ⲁⲩⲱ ⲧⲉϥⲯⲩⲭⲏ ⲛⲥ̅ⲛⲁⲥⲉⲓ ⲁⲛ ⲉⲃⲟⲗ ϩⲙ̅ ⲡⲟⲩⲛⲟϥ ⲁⲩⲱ ⲟⲛ ⲙ̅ⲡⲉ ⲕⲁⲓ̈ⲥⲉ ϣⲱⲡⲉ ⲛⲁϥ ⲁⲓ̈ϫⲟⲟⲥ ϫⲉ ⲛⲁⲛⲟⲩ ⲛ̅ϩⲟⲩϩⲉ ⲉⲣⲟϥ
Ecclesiastes	6	4	 		 ϫⲉ ⲁϥⲉⲓ ⲛ̈ⲛⲟⲩⲡⲓϫⲉⲉⲓ ⲁϥⲛⲉⲙⲁϣⲓ ϩⲓⲛ ⲕⲙⲓⲧⲥ⳾ ⲧⲕⲙⲓⲧⲥ ⲛⲉϣⲱⲃⲥ. ϩⲗⲏⲉⲓ ⲉϫⲓⲛ ⲡⲉϥ[ⲗⲉⲛ]⳾					 ὅτι ἐν µαταιότητι ἦλθεν καὶ ἐν σκότει πορεύεται, καὶ ἐν σκότει ὄνοµα αὐτοῦ καλυφθήσεται,	 For he came in vanity, and departs in darkness, and his name shall be covered in darkness.	 ϫⲉ ⲛ̅ⲧⲁϥⲉⲓ ϩⲛ̅ ⲟⲩⲡⲉⲧϣⲟⲩⲉⲓⲧ ⲉϥⲛⲁⲃⲱⲕ ⲟⲛ ϩⲛ̅ ⲟⲩⲕⲁⲕⲉ ⲁⲩⲱ ⲉⲣⲉ ⲡⲉϥⲣⲁⲛ ⲛⲁϩⲱⲃⲥ̅ ϩⲙ̅ ⲡⲕⲁϩ
Ecclesiastes	6	5	 		 ⲙ̈ⲡⲉϥⲛⲉⲩ ⲉⲡⲣⲉ ⲙ̈ⲡⲉϥⲉⲓⲙⲓ ⲉⲟⲩⲙⲁⲧⲛⲉⲥ⳾ ⲡⲉⲓ̈ ⲛⲁⲉϥ ⲉⲡⲉⲓ⳾					 καί γε ἥλιον οὐκ εἶδεν καὶ οὐκ ἔγνω, ἀνάπαυσις τούτῳ ὑπὲρ τοῦτον.	 Moreover he has not seen the sun, nor known rest: there is no more rest to this one than another.	 ⲁⲩⲱ ⲙ̅ⲡⲉϥⲛⲁⲩ ⲉⲡⲣⲏ ⲙ̅ⲡⲉϥⲉⲓⲙⲉ ⲟⲛ ⲉⲙⲟⲧⲛⲉⲥ ⲡⲁⲓ̈ ϭⲉ ⲥⲟⲧⲡ̅ ⲉⲡⲁⲓ̈
Ecclesiastes	6	6	 		 ⲁϥⲱⲛϩ ⲛ̈ϣⲁ ⲛ̈ⲕⲁⲧⲥ ⲛ̈ⲗⲁⲙⲡⲓ⳾ ⲙ̈ⲡⲉϥⲛⲉⲟⲩ ⲉⲩⲡⲉⲧⲛⲁⲛⲟⲩϥ⳾ ⲛ̈ⲛⲁⲩⲛⲉⲙⲁϣⲓ ⲉⲛ ⲛ̈ⲛⲟⲩⲙⲉ ⲛ̈ⲟⲩⲱⲧ⳾					 καὶ εἰ ἔζησεν χιλίων ἐτῶν καθόδους καὶ ἀγαθωσύνην οὐκ εἶδεν, µὴ οὐκ εἰς τόπον ἕνα τὰ πάντα πορεύεται;	 Though he has lived to the return of a thousand years, yet he has seen no good: do not all go to one place?	 ⲕⲁⲛ ⲉϣⲱⲡⲉ ⲁϥⲱⲛϩ̅ ⲛ̅ϣⲟ ⲛ̅ⲣⲟⲙⲡⲉ ϩⲛ̅ ⲛⲉϩⲓ̈ⲟⲟⲩⲉ ⲁⲩⲱ ⲙ̅ⲡⲉϥⲛⲁⲩ ⲉⲟⲩⲛⲟϥ ⲙⲏ ⲉⲣⲉ ⲛ̅ⲕⲁ ϭⲉ ⲛⲓ̈ⲙ ⲛⲁⲃⲱⲕ ⲉϩⲣⲁⲓ̈ ⲉⲩⲙⲁ ⲛ̅ⲟⲩⲱⲧ
Ecclesiastes	6	7	 		 ⲛ̈ϩⲓⲥⲓ ⲧⲏⲗⲟⲩ ⲛ̈ⲧⲉ ⲡⲗⲱⲙⲓ ⲁⲩϩⲗⲏⲓ̈ ϩⲓⲙ ⲡⲉϥⲗⲁ⳾ ⲧⲉϥⲯⲩⲭⲏ ⲛⲉⲥⲓ ⲉⲛ⳾					 Πᾶς µόχθος τοῦ ἀνθρώπου εἰς στόµα αὐτοῦ, καί γε ἡ ψυχὴ οὐ πληρωθήσεται.	 All the labour of a man is for his mouth, and yet the appetite shall not be satisfied.	 ⲡϩⲓ̈ⲥⲉ ⲧⲏⲣϥ̅ ⲙ̅ⲡⲣⲱⲙⲉ ⲉϥⲃⲏⲕ ⲉϩⲟⲩⲛ ⲉⲧⲉϥⲧⲁⲡⲣⲟ ⲁⲩⲱ ⲧⲉϥⲯⲩⲭⲏ ⲛⲁⲙⲟⲩϩ ⲁⲛ
Ecclesiastes	6	8	 		 ϫⲉ ⲟⲩⲁⲛ ⲟⲩϩⲁ ϣⲁⲡ ⲙ̈ⲡⲓⲥϥⲁ⳾ ⲉϩⲟⲩⲁⲥⲧ ⲉⲡⲓⲁⲑⲏⲧ⳾ ϫⲉ ⲡⲓϩⲏⲕⲓ ϥⲥⲁⲟⲩⲛ ⲙ̈ⲙⲁϣⲓ ⲙ̈ⲡⲉⲙⲧⲁ ⲙ̈ⲡⲉϥϩⲱⲛϩ ⲉⲃⲁⲗ⳾					 ὅτι τίς περισσεία τῷ σοφῷ ὑπὲρ τὸν ἄφρονα; διότι ὁ πένης οἶδεν πορευθῆναι κατέναντι τῆς ζωῆς.	 For what advantage has the wise man over the fool, since even the poor knows how to walk in the direction of life?	 ϫⲉ ⲟⲩⲛ̅ ⲟⲩϩⲟⲩⲟ ϣⲟⲟⲡ ⲙ̅ⲡⲥⲟⲫⲟⲥ ⲉϩⲟⲩⲉ ⲡⲁⲑⲏⲧ ϫⲉ ⲡϩⲏⲕⲉ ⲥⲟⲟⲩⲛ ⲉⲧⲣⲉϥⲙⲟⲟϣⲉ ⲙ̅ⲡⲙ̅ⲧⲟ ⲉⲃⲟⲗ ⲙ̅ⲡⲱⲛϩ̅
Ecclesiastes	6	9	 		 ⲛⲁⲛⲟⲩ ⲡⲓⲱⲣϩ ⲛ̈ⲛⲟⲩⲃⲉⲗ ⲉϩⲟⲩⲁⲥⲧ ⲉⲡⲏ ⲉⲧⲙⲁϣⲓ ⲙⲉⲛ ⲧⲉϥⲯⲩⲭⲏ⳾ ⲡⲉⲓ̈ⲕⲏⲧ ⲁⲛ ⲟⲩⲡⲓϫⲉⲓ̈ ⲡⲉ⳾ ⲁϩⲁ ⲟⲩⲗⲟⲩⲁⲧ ⲙ̈ⲡⲛⲉⲩⲙⲁ ⲡⲉ⳾					 ἀγαθὸν ὅραµα ὀφθαλµῶν ὑπὲρ πορευόµενον ψυχῇ. καί γε τοῦτο µαταιότης καὶ προαίρεσις πνεύµατος.	 The sight of the eyes is better than that which wanders in soul: this is also vanity, and waywardness of spirit.	 ⲟⲩⲁⲅⲁⲑⲟⲥ ⲡⲉ ⲡⲛⲁⲩ ⲛ̅ⲛ̅ⲃⲁⲗ ⲉϩⲟⲩⲉ ⲡⲉⲧⲙⲟⲟϣⲉ ⲙⲛ̅ ⲧⲉϥⲯⲩⲭⲏ ⲡⲁⲓ̈ ⲟⲩⲡⲉⲧϣⲟⲩⲉⲓⲧ ⲡⲉ ⲁⲩⲱ ⲟⲩⲟⲩⲱϣ ⲡⲉ ⲙ̅ⲡⲛ̅ⲁ̅
Ecclesiastes	6	10	 		 ⲡⲉⲧⲁϥϣⲱⲡⲓ ⲁⲩⲧⲓ ⲗⲉⲛ ⲉⲗⲁϥ⳾ ⲡⲗⲱⲙⲓ ⲉⲧϥ-ⲛ̈ϩⲏⲧϥ ⲉⲓⲙⲓ ⲉⲗⲁϥ⳾ ⲙ̈ⲙⲁⲛ ϣϫⲁⲙ ⲙⲁϥ ⲉϫⲓ ϩⲉⲡ ⲟⲩⲃⲉ ⲡϫⲱⲣⲓ ⲉⲗⲁϥ⳾					 Εἴ τι ἐγένετο, ἤδη κέκληται ὄνοµα αὐτοῦ, καὶ ἐγνώσθη ὅ ἐστιν ἄνθρωπος, καὶ οὐ δυνήσεται τοῦ κριθῆναι µετὰ τοῦ ἰσχυροῦ ὑπὲρ αὐτόν·	 If anything has been, its name has already been called: and it is known what man is; neither can he contend with him who is stronger than he.	 ⲡⲉⲛⲧⲁϥϣⲱⲡⲉ ⲏⲇⲏ ⲁⲩϯⲣⲁⲛ ⲉⲣⲟϥ ⲁⲩⲱ ⲁⲩⲉⲓⲙⲉ ⲉⲣⲟϥ ϫⲉ ⲟⲩⲣⲱⲙⲉ ⲡⲉ ⲁⲩⲱ ⲛϥ̅ⲛⲁϫⲓ̈ϩⲁⲡ ⲁⲛ ⲙⲛ̅ ⲡϫⲱⲱⲣⲉ ⲉⲣⲟϥ
Ecclesiastes	6	11	 		 ϫⲉ ⲟ[ⲩ]ⲁⲛ ϩⲉⲛϣⲉϫⲓ ϣⲁⲩⲧⲗⲉ ϩⲉⲛ ⲡⲓϫⲉⲉⲓ ⲁϣⲉⲓ̈⳾ ⲉϣ ⲡⲉϩⲟⲩⲁ ⲙ̈ⲡⲗⲱⲙⲓ⳾					 ὅτι εἰσὶν λόγοι πολλοὶ πληθύνοντες µαταιότητα. τί περισσὸν τῷ ἀνθρώπῳ;	 For there are many things which increase vanity.	 ϫⲉ ⲟⲩⲛ̅ ϩⲉⲛϣⲁϫⲉ ⲉⲩⲧⲁϣⲟ ⲛ̅ϩⲉⲛⲡⲉⲧϣⲟⲩⲉⲓⲧ
Ecclesiastes	7	1	 		 ⲛⲓⲙ ⲡⲉⲧ[[ⲉⲓ]]ⲥⲁⲟⲩⲛ ⲙ̈ⲡⲉⲧⲛⲁⲛⲟⲩϥ ⲙ̈ⲡⲗⲱⲙⲓ ϩⲗⲏⲓ̈ ϩⲓⲙ ⲡⲉϥⲱⲛϩ⳾ ⲧⲏⲡⲓ ⲛ̈ⲛⲉϩⲁⲟⲩ ⲙ̈ⲡⲉϥⲱⲛϩ: ϩⲉⲛⲡⲓϫⲉⲓ ⲛⲉ⳾ ⲁϥⲉⲓ[ⲧ]ⲟⲩ ϩⲗⲏⲓ̈ ⲛ̈ⲛⲟⲩϩⲏⲃⲓ[⳾] ϫⲉ ⲛⲓⲙ ⲡⲉⲧⲛⲉⲧⲁⲙⲁ ⲡⲗⲱⲙⲓ ⲉⲧϩⲁⲗⲁϥ ⲙ̈ⲡⲣⲉ ϫⲉ ⲟⲩⲛ ⲡⲉⲧⲛⲉϣ[ⲱⲡⲓ] ϩⲁⲗⲉⲧϥ⳾					 ὅτι τίς οἶδεν τί ἀγαθὸν τῷ ἀνθρώπῳ ἐν τῇ ζωῇ ἀριθµὸν ἡµερῶν ζωῆς µαταιότητος αὐτοῦ; καὶ ἐποίησεν αὐτὰς ἐν σκιᾷ· ὅτι τίς ἀπαíελεῖ τῷ ἀνθρώπῳ τί ἔσται ὀπίσω αὐτοῦ ὑπὸ τὸν ἥλιον;	 What advantage has a man? for who knows what is good for a man in his life, during the number of the life of the days of his vanity? and he has spent them as a shadow; for who shall tell a man what shall be after him under the sun?	 ⲟⲩ ⲡⲉ ⲡⲉϩⲟⲩⲟ ⲙ̅ⲡⲣⲱⲙⲉ ⲁⲩⲱ ⲛⲓ̈ⲙ ⲡⲉⲧⲥⲟⲟⲩⲛ ϫⲉ ⲟⲩ ⲡⲉ ⲡⲁⲅⲁⲑⲟⲛ ⲙ̅ⲡⲣⲱⲙⲉ ϩⲙ̅ ⲡⲉϥⲱⲛϩ̅ ⲏ ⲧⲏⲡⲉ ⲛ̅ⲛⲉϩⲟⲟⲩ ⲙ̅ⲡⲱⲛϩ̅ ⲛ̅ⲧⲉϥⲙⲛ̅ⲧⲡⲉⲧϣⲟⲩⲉⲓⲧ ⲁⲩⲱ ⲁϥⲁⲁⲩ ϩⲛ̅ ⲟⲩϩⲁⲓ̈ⲃⲉⲥ ϫⲉ ⲛⲓ̈ⲙ ⲡⲉⲧⲛⲁⲧⲁⲙⲉ ⲡⲣⲱⲙⲉ ϫⲉ ⲟⲩ ⲡⲉⲧⲛⲁϣⲱⲡⲉ ⲙⲛ̅ⲛ̅ⲥⲱϥ ϩⲁⲣⲟϥ ⲙ̅ⲡⲣⲏ
Ecclesiastes	7	2	 		 ⲛⲁⲛⲟⲩ ⲟⲩⲗⲉⲛ ⲉϩⲟⲩⲁⲥⲧ ⲉⲟⲩⲛⲉϩ ⲉⲧⲛⲁⲛⲟⲩϥ⳾ ⲛⲁⲛⲟⲩ ⲡⲉϩⲁⲟⲩ ⲙ̈ⲡⲉϥⲙⲟⲩ⳾ ⲉϩⲟⲩⲁⲥⲧ ⲉⲡⲉϩⲁⲟⲩ ⲛ̈ⲧⲁⲩϫⲡⲁϥ⳾					 Ἀγαθὸν ὄνοµα ὑπὲρ ἔλαιον ἀγαθὸν καὶ ἡµέρα τοῦ θανάτου ὑπὲρ ἡµέραν γενέσεως αὐτοῦ.	 A good name is better than good oil; and the day of death than the day of birth.	 ⲟⲩⲁⲅⲁⲑⲟⲛ ⲡⲉ ⲟⲩⲣⲁⲛ ⲉϩⲟⲩⲉ ⲟⲩⲛⲉϩ ⲏ ⲟⲩⲛⲁ ⲛ̅ⲁⲅⲁⲑⲟⲛ ⲁⲩⲱ ⲟⲩⲁⲅⲁⲑⲟⲛ ⲡⲉ ⲡⲉϩⲟⲟⲩ ⲙ̅ⲡⲙⲟⲩ ⲉϩⲟⲩⲉ ⲡⲉϩⲟⲟⲩ ⲙ̅ⲡⲙⲓ̈ⲥⲉ
Ecclesiastes	7	3	 		 ⲛⲁⲛⲟⲩⲥ ⲛ̈ϣⲏ ⲉϩⲟⲩⲛ ⲉⲩⲏⲓ̈ ⲉⲩⲉⲓⲗ ϩⲏⲃⲓ ⲛ̈ϩⲏⲧϥ⳾ ⲉϩⲟⲩⲁⲥⲧ ⲉⲛ̈ⲕϣⲏ ⲉϩⲟⲩⲛ ⲉⲩⲏⲓ̈ ⲉⲩⲥⲱ [ⲛ̈]ϩ[ⲏ]ⲧ[ϥ⳾] ϫⲉ ⲧⲉⲓ̈ ⲧⲉ ⲑⲁⲏ ⲛ̈ⲗⲱⲙⲓ ⲛⲓⲙ[ⲓ] ⲡⲉⲧⲁⲛⲉϩ ⲉϥⲉϯ⳾ ⲛ̈ⲛ[ⲟⲩ]ⲡ[ⲉⲧ]ⲛ[ⲁⲛⲟⲩϥ] ⲉϩⲗⲏⲉⲓ [ⲉ]ⲡⲉϥϩⲏⲧ⳾					 ἀγαθὸν πορευθῆναι εἰς οἶκον πένθους ἢ ὅτι πορευθῆναι εἰς οἶκον πότου, καθότι τοῦτο τέλος παντὸς τοῦ ἀνθρώπου, καὶ ὁ ζῶν δώσει εἰς καρδίαν αὐτοῦ.	 It is better to go to the house of mourning, than to go to the banquet house: since this is the end of every man; and the living man will apply good warning to his heart.	 ⲟⲩⲁⲅⲁⲑⲟⲛ ⲡⲉ ⲃⲱⲕ ⲉϩⲟⲩⲛ ⲉⲡⲏⲓ̈ ⲙ̅ⲡϩⲏⲃⲉ ⲉϩⲟⲩⲉ ⲃⲱⲕ ⲉϩⲟⲩⲛ ⲉⲡⲏⲓ̈ ⲙ̅ⲡⲥⲱ ⲉⲃⲟⲗ ϫⲉ ⲧⲁⲓ̈ ⲧⲉ ⲑⲁⲏ ⲛ̅ⲣⲱⲙⲉ ⲛⲓ̈ⲙ ⲁⲩⲱ ⲡⲉⲧⲟⲛϩ̅ ϥⲛⲁϯ ⲛ̅ⲟⲩⲁⲅⲁⲑⲟⲛ ⲉϩⲣⲁⲓ̈ ⲉⲡⲉϥϩⲏⲧ
Ecclesiastes	7	4	 		 ⲛⲁⲛⲟⲩ ⲟⲩⲃⲱⲣⲕ: ⲉϩⲟ[ⲩⲁⲥⲧ ⲉⲟⲩⲥⲱⲃⲓ⳾] ϫⲉ [ϩⲓⲛⲛ ⲟ]ⲩⲕⲁⲕⲓⲁ ϣⲁⲗⲉ ⲡⲉϥϩⲁ ϣⲁϥⲉ[ⲓⲗ] ⲡ[ⲉⲧ]ⲛⲁ[ⲛⲟⲩϥ⳾]					 ἀγαθὸν θυµὸς ὑπὲρ γέλωτα, ὅτι ἐν κακίᾳ προσώπου ἀγαθυνθήσεται καρδία.	 Sorrow is better than laughter: for by the sadness of the countenance the heart will be made better.	 ⲟⲩⲁⲅⲁⲑⲟⲛ ⲡⲉ ⲡϭⲱⲛⲧ̅ ⲉϩⲟⲩⲉ ⲡⲥⲱⲃⲉ ϫⲉ ϥⲛⲁϯ ⲟⲩⲛⲁϥ ϩⲙ̅ ⲡϩⲏⲧ ⲙ̅ⲡⲉϥϩⲟ
Ecclesiastes	7	5	 		 [ⲡϩⲏⲧ ⲛ̈ⲛⲓⲥ]ⲃⲁ ϩ[ⲓⲙ ⲡⲏ]ⲓ̈ ⲛ̈ⲛⲉⲧⲉⲓⲗ ϩⲏⲃⲓ ⲁϩⲁ ⲡϩⲏ[ⲧ ⲛ̈ⲛⲓⲁⲑⲉϯ. ϩⲓⲙ ⲡ]ⲏⲓ̈ ⲛ̈ⲛⲉ[ⲧⲟⲩⲛⲁϥ⳾]					 καρδία σοφῶν ἐν οἴκῳ πένθους, καὶ καρδία ἀφρόνων ἐν οἴκῳ εὐφροσύνης.	 The heart of the wise is in the house of mourning; but the heart of fools is in the house of mirth.	 ⲡϩⲏⲧ ⲛ̅ⲛ̅ⲥⲁⲃⲉⲉⲩ ⲉϥϩⲙ̅ ⲡⲏⲓ̈ ⲙ̅ⲡϩⲏⲃⲉ ⲡϩⲏⲧ ϩⲱⲱϥ ⲛ̅ⲛ̅ⲁⲑⲏⲧ ⲉϥϩⲙ̅ ⲡⲏⲓ̈ ⲙ̅ⲡⲟⲩⲛⲟϥ
Ecclesiastes	7	6	 		 ⲛⲁⲛⲟⲩⲥ ⲛ̈ϥⲥⲱⲧⲟⲙ ⲉⲡⲛⲟⲩϣⲥ⳾ ⲛ̈ⲛⲟⲩⲥⲃⲁ: ⲉϩⲟⲩⲁⲥⲧ ⲉⲟⲩⲗⲱⲙⲓ ⲉϥⲥⲱⲧⲟ[ⲙ] ⲉⲡϫⲱ: ⲛⲓⲁⲑⲏⲧ:					 ἀγαθὸν τὸ ἀκοῦσαι ἐπιτίµησιν σοφοῦ ὑπὲρ ἄνδρα ἀκούοντα ᾆσµα ἀφρόνων·	 It is better to hear a reproof of a wise man, than for a man to hear the song of fools.	 ⲟⲩⲁⲅⲁⲑⲟⲛ ⲡⲉ ⲡⲥⲱⲧⲙ̅ ⲉⲡⲉϫⲡⲓ̈ⲟ ⲙ̅ⲡⲥⲁⲃⲉ ⲉϩⲟⲩⲉ ⲟⲩⲣⲱⲙⲉ ⲉϥⲥⲱⲧⲙ̅ ⲉⲡϫⲱ ⲛ̅ⲛ̅ⲁⲑⲏⲧ
Ecclesiastes	7	7	 		 ⲛ̈ⲑⲏ ⲛ̈ⲧⲥⲙⲏ⳾ ⲛ̈ϩⲉⲛϣⲁⲛϯ⳾ ⲉⲩⲧⲱⲕ[⳾] ϩⲁⲗⲁⲩⲟⲩ⳾ ϩⲁⲗⲁⲥ ⲛ̈ⲛⲟⲩⲗⲁϩϯ. ⲧⲉⲓ ⲧⲉ ⲑⲏ ⲙ̈ⲡⲥⲱⲃⲓ ⲛ̈ⲛⲓⲁⲑⲏⲧ: ⲡⲉⲓ̈ⲕⲏⲧ ⲁⲛ ⲟⲩⲡⲓϫⲉⲓ ⲡⲉ[⳾]					 ὅτι ὡς φωνὴ τῶν ἀκανθῶν ὑπὸ τὸν λέβητα, οὕτως γέλως τῶν ἀφρόνων· καί γε τοῦτο µαταιότης.	 As the sound of thorns under a caldron, so is the laughter of fools: this is also vanity.	 ⲛ̅ⲑⲉ ⲙ̅ⲡⲉϩⲣⲟⲟⲩ ⲛ̅ϩⲉⲛϣⲟⲛⲧⲉ ⲉⲩⲙⲟⲩϩ ϩⲁ ⲡⲉⲭⲁⲗⲕⲓⲟⲛ ⲧⲁⲓ̈ ⲧⲉ ⲑⲉ ⲙ̅ⲡⲥⲱⲃⲉ ⲛ̅ⲛ̅ⲁⲑⲏⲧ ⲡⲉⲓ̈ⲕⲉ ⲟⲛ ⲟⲩⲡⲉⲧϣⲟⲩⲉⲓⲧ ⲡⲉ
Ecclesiastes	7	8	 		 ϫⲉ ⲧⲙⲓⲛⲧⲛⲟⲩϫ⳾ ϣⲁⲥⲕⲓⲙ ⲉⲡⲓⲥⲃⲁ⳾ ϣⲁϥⲧⲁⲕⲁ ⲙ̈ⲡⲉϥϩⲏⲧ. ⲉⲧⲧⲁⲓ̈ⲏⲟⲩⲧ⳾					 ὅτι ἡ συκοφαντία περιφέρει σοφὸν καὶ ἀπόλλυσι τὴν καρδίαν εὐτονίας αὐτοῦ.	 for oppression makes a wise man mad, and destroys his noble heart.	 ϫⲉ ⲧⲙⲛ̅ⲧⲗⲁ ⲥⲛⲁⲕⲱⲧⲉ ⲙⲛ̅ ⲡⲥⲁⲃⲉ ⲁⲩⲱ ϥⲛⲁⲧⲁⲕⲟ ⲙ̅ⲡϩⲏⲧ ⲛ̅ⲧⲉϥⲙⲛ̅ⲧⲉⲩⲅⲉⲛⲏⲥ
Ecclesiastes	7	9	 		 ⲛⲁⲛ[ⲟ]ⲩ ⲑⲁⲏ ⲛⲉϥϣⲉϫⲓ⳾ ⲉϩⲟⲩⲁⲥⲧ ⲉⲧⲉϥϩⲟⲩⲉⲓϯ⳾ ⲛⲁⲛⲟⲩ ⲟⲩ ⲟⲩⲛⲁϫ⳾ ⲛ̈ϩⲏⲧ⳾ ⲉϩⲟⲩⲁⲥⲧ ⲉⲟⲩⲡⲛⲉⲩⲙⲁ ⲛ̈ϫⲁⲥⲓϩⲏⲧ⳾					 ἀγαθὴ ἐσχάτη λόγων ὑπὲρ ἀρχὴν αὐτοῦ, ἀγαθὸν µακρόθυµος ὑπὲρ ὑψηλὸν πνεύµατι.	 The end of a matter is better than the beginning thereof: the patient is better than the high-minded.	 ⲛⲁⲛⲟⲩ ⲑⲁⲏ ⲛ̅ⲛ̅ϣⲁϫⲉ ⲉϩⲟⲩⲉ ⲧⲉⲩⲁⲣⲭⲏ ⲟⲩⲁⲅⲁⲑⲟⲛ ⲡⲉ ⲟⲩϩⲁⲣϣ̅ϩⲏⲧ ⲉϩⲟⲩⲉ ⲟⲩⲡⲛ̅ⲁ̅ ⲉϥϫⲟⲥⲉ
Ecclesiastes	7	10	 		 ⲙ̈ⲃⲉⲗⲕⲱⲗⲟⲙ- ⲛⲕϫⲉⲛ⳾ ϩⲗⲏⲓ̈ ϩⲓⲙ ⲡⲉⲕⲡⲛⲁ⳾ ϫⲉ ⲡⲃⲱ ⲗⲉⲕ. ϣⲁϥⲙ̈ⲧⲁⲛ ⲙ̈ⲁϥ ⲛ̈[ⲛⲓ]ⲁⲑⲉϯ⳾					 µὴ σπεύσῃς ἐν πνεύµατί σου τοῦ θυµοῦσθαι, ὅτι θυµὸς ἐν κόλπῳ ἀφρόνων ἀναπαύσεται.	 Be not hasty in thy spirit to be angry: for anger will rest in the bosom of fools.	 ⲙ̅ⲡⲣ̅ϭⲉⲡⲏ ⲉϭⲱⲛⲧ̅ ϩⲙ̅ ⲡⲉⲕⲡⲛ̅ⲁ̅ ϫⲉ ⲡϭⲱⲛⲧ̅ ⲛⲁⲙ̅ⲧⲟⲛ ⲙ̅ⲙⲟϥ ϩⲛ̅ ⲕⲟⲩⲛⲟⲩ ⲛ̅ⲛ̅ⲁⲑⲏⲧ
Ecclesiastes	7	11	 		 ⲙ̈ⲡⲉⲗϫⲁⲥ ϫⲉ ⲟⲩⲙ ⲡⲉⲛⲧⲁϥϣⲱⲡⲓ: ϫⲉ ⲛⲉϩⲁⲟⲩ ⲛ̈ϣⲁⲣⲡ ⲛⲁⲟⲩ. ⲉϩⲟⲩⲁⲥⲧ ⲉⲛⲁ ⲧⲉⲛⲟⲩ⳾ ⲛⲁⲕϣⲓⲛⲓ ⲉⲛ. ⲉⲧⲃⲉ ⲡⲉⲓ̈ ϩⲓⲛⲛ ⲟⲩⲥⲟⲫⲓ̈ⲁ⳾					 µὴ εἴπῃς Τί ἐγένετο ὅτι αἱ ἡµέραι αἱ πρότεραι ἦσαν ἀγαθαὶ ὑπὲρ ταύτας; ὅτι οὐκ ἐν σοφίᾳ ἐπηρώτησας περὶ τούτου.	 Say not, What has happened, that the former days were better than these? for thou dost not enquire in wisdom concerning this.	 ⲙ̅ⲡⲣ̅ϫⲟⲟⲥ ϫⲉ ⲉⲧⲃⲉ ⲟⲩ ⲁⲓ̈ϣⲱⲡⲉ ϫⲉ ⲛⲉϩⲟⲟⲩ ⲛ̅ϣⲟⲣⲡ̅ ⲛⲁⲛⲟⲩⲟⲩ ⲉϩⲟⲩⲉ ⲉⲛⲁⲓ̈ ϫⲉ ⲛ̅ⲧⲁⲕϣⲓ̈ⲛⲉ ⲁⲛ ⲉⲧⲃⲉ ⲡⲁⲓ̈ ϩⲛ̅ ⲟⲩⲥⲟⲫⲓⲁ
Ecclesiastes	7	12	 		 ⲛⲁⲛⲟⲩ⳾ ⲧⲥⲟⲫⲓⲁ. ⲙⲉⲛⲛ ⲟⲩⲕⲗⲏⲣⲟⲛⲟⲙⲓⲁ⳾ ⲁϩⲁ ⲟⲩϩⲟⲩⲁ ⲡⲉ ⲛⲏ ⲉⲧⲛⲉⲟⲩ ⲉⲡⲣⲉ:					 ἀγαθὴ σοφία µετὰ κληροδοσίας καὶ περισσεία τοῖς θεωροῦσιν τὸν ἥλιον·	 Wisdom is good with an inheritance: and there is an advantage by it to them that see the sun.	 ⲁⲩⲱ ⲟⲩⲛ̅ ⲟⲩϩⲟⲩⲟ ϣⲟⲟⲡ ⲛ̅ⲛⲉⲧⲛⲁⲩ ⲉⲡⲣⲏ
Ecclesiastes	7	13	 		 ϫⲉ ϩⲗⲏⲓ̈⳾ ϩⲓⲛ ⲧⲉⲥϩⲏⲓ̈ⲃⲓ⳾ ⲁⲗⲉ ⲧⲥⲟⲫⲓⲁ ϣⲁⲡ ⲛ̈ⲑⲏ ⲃⲓ ⲙ̈ⲫⲉⲧ[⳾] ⲟⲩϩⲟⲩⲁ: ⲡⲉ ⲡⲥⲁⲟⲩⲛ ⲛⲇⲉ⳾ ⲧⲥⲟⲫⲓⲁ⳾ ϣⲁⲥⲧⲁⲛϩⲁ ⲡⲉⲧϩⲁⲧⲁⲥ⳾					 ὅτι ἐν σκιᾷ αὐτῆς ἡ σοφία ὡς σκιὰ τοῦ ἀργυρίου, καὶ περισσεία γνώσεως τῆς σοφίας ζωοποιήσει τὸν παρ’ αὐτῆς.	 For wisdom in its shadow is as the shadow of silver: and the excellence of the knowledge of wisdom will give life to him that has it.	 ϫⲉ ⲧⲥⲟⲫⲓⲁ ⲉⲥϣⲟⲟⲡ ϩⲛ̅ ⲧⲉⲥϩⲁⲓ̈ⲃⲉⲥ ⲉⲥⲟ ⲛ̅ⲑⲉ ⲛ̅ⲟⲩϩⲁⲓ̈ⲃⲉⲥ ⲛϩⲁⲧ ⲁⲩⲱ ⲟⲩⲛ̅ ϩⲟⲩⲟ ϣⲟⲟⲡ ⲛ̅ⲧⲉⲅⲛⲱⲥⲓⲥ ⲛ̅ⲧⲥⲟⲫⲓⲁ ⲉⲥⲛⲁⲧⲁⲛϩⲟ ⲙ̅ⲡⲉⲧⲏⲡ ⲉⲣⲟⲥ
Ecclesiastes	7	14	 		 ⲁⲛⲉⲩ ⲉⲛⲧⲁⲙⲓⲁ ⲛ̈ⲧⲉ ⲫϯ ϫⲉ ⲙⲁⲛ ϣϫⲁⲙ ⲛ̈ⲧⲉ ⲗⲁⲡϯ ⲥⲕ ϥⲱⲟⲩ ⲡⲉⲧⲉⲗⲉ ⲫϯ ⲛⲉⲕⲁⲧϥ⳾					 ἰδὲ τὰ ποιήµατα τοῦ θεοῦ· ὅτι τίς δυνήσεται τοῦ κοσµῆσαι ὃν ἂν ὁ θεὸς διαστρέψῃ αὐτόν;	 Behold the works of God: for who shall be able to straighten him whom God has made crooked?	 ⲁⲓ̈ⲛⲁⲩ ⲉⲛ̅ⲧⲁⲙⲓ̈ⲟ ⲙ̅ⲡⲛⲟⲩⲧⲉ ϫⲉ ⲛⲓ̈ⲙ ⲡⲉⲧⲛⲁϣϭⲙ̅ϭⲟⲙ ⲉⲕⲟⲥⲙⲉⲓ ⲙ̅ⲡⲉⲧⲉⲣⲉ ⲡⲛⲟⲩⲧⲉ ⲛⲁⲡⲟⲟⲛⲉϥ
Ecclesiastes	7	15	 		 ⲉⲃⲁⲗ ⲛ̈ⲛⲉϩⲁⲟⲩ ⲛ̈ⲛⲉϥⲡⲉⲧⲛⲁⲛⲟⲩϥ⳾ ⲱⲛϩ ⲉϩⲟⲩⲛ ⲉⲡⲉϩⲁⲟⲩ ⲛ̈ⲛⲟⲩⲡⲉⲧⲛⲁⲛⲟⲩϥ⳾ ⲁⲛⲉⲩ ⲉⲡⲉϩⲁⲟⲩ ⲛ̈ⲧⲕⲁⲕ[ⲓⲁ⳾] ⲁⲛⲉⲩ ⲉⲡⲉⲓⲕⲏⲧ ϫⲉ ⲧⲙⲉⲓ ⲧⲉ⳾ ⲡⲉⲓ̈ ⲁ ⲫϯ ⲁϥⲉⲓ̈ϥ ϫⲉ ⲉⲩⲉϣⲉϫ[ⲓ] ⲉⲧⲃⲏⲧϥ ϫⲉ ⲛⲉ ⲡⲗⲱⲙⲓ ⲛⲉϥ ϫⲓⲛ ⲗⲁⲡⲧ ϩⲁⲗⲉ[[ϥ]]ⲧⲉϥ⳾					 ἐν ἡµέρᾳ ἀγαθωσύνης ζῆθι ἐν ἀγαθῷ καὶ ἐν ἡµέρᾳ κακίας ἰδέ· καί γε σὺν τοῦτο σύµφωνον τούτῳ ἐποίησεν ὁ θεὸς περὶ λαλιᾶς, ἵνα µὴ εὕρῃ ὁ ἄνθρωπος ὀπίσω αὐτοῦ µηδέν.	 In the day of prosperity live joyfully, and consider in the day of adversity: consider, I say, God also has caused the one to agree with the other for this reason, that man should find nothing after him.	 ϩⲙ̅ ⲡⲉϩⲟⲟⲩ ⲙ̅ⲡⲟⲩⲛⲟϥ ϣⲓ̈ⲛⲉ ϩⲛ̅ ⲟⲩⲁⲅⲁⲑⲟⲛ ⲁⲩⲱ ⲛⲅ̅ⲛⲁⲩ ϩⲙ̅ ⲡⲉϩⲟⲟⲩ ⲛ̅ⲧⲕⲁⲕⲓⲁ ⲁⲩⲱ ⲛⲅ̅ϯ ϩⲧⲏⲕ ⲉⲡⲁⲓ̈ ϩⲛ̅ ⲟⲩϣⲱⲛϥ̅ ⲡⲁⲓ̈ ⲁ ⲡⲛⲟⲩⲧⲉ ⲧⲁⲙⲓ̈ⲟϥ ⲉⲧⲃⲉ ⲟⲩϭⲓ̈ⲛϣⲁϫⲉ ϫⲉⲕⲁⲥ ⲛ̅ⲛⲉ ⲡⲣⲱⲙⲉ ϩⲉ ⲗⲁⲁⲩ ⲙⲛ̅ⲛ̅ⲥⲱϥ
Ecclesiastes	7	16	 		 ⲁⲓ̈ⲛⲉⲩ ⲉⲗⲁⲩ ⲧⲏⲗⲟⲩ ⲙ̈ⲡⲉϩⲁⲟⲩ ⲛ̈ⲧⲁⲙⲓⲛⲧⲡⲉⲓϫⲉⲓ⳾ ⲟⲩⲁⲛ ⲟⲩⲙⲉⲓ̈ ⲛⲉ ⲛⲕⲁⲧ ϩⲓⲛ ⲧⲉϥⲙⲓⲛⲧⲙⲉⲓ̈⳾ ⲁϩⲁ ⲟⲩⲁⲛ ⲟⲩⲁⲥⲉⲃⲏⲥ ϥⲛⲉϫⲱ ϩⲗⲏⲓ̈ ϩⲓⲛ ⲧⲉϥⲕⲁⲕⲓⲁ⳾					 Σὺν τὰ πάντα εἶδον ἐν ἡµέραις µαταιότητός µου· ἔστιν δίκαιος ἀπολλύµενος ἐν δικαίῳ αὐτοῦ, καὶ ἔστιν ἀσεβὴς µένων ἐν κακίᾳ αὐτοῦ.	 I have seen all things in the days of my vanity: there is a just man perishing in his justice, and there is an ungodly man remaining in his wickedness.	 ϩⲱⲃ ⲛⲓ̈ⲙ ⲁⲓ̈ⲛⲁⲩ ⲉⲣⲟⲟⲩ ⲛ̅ⲛⲉϩⲟⲟⲩ ⲛ̅ⲧⲁⲙⲛ̅ⲧⲡⲉⲧϣⲟⲩⲉⲓⲧ ⲟⲩⲛ̅ ⲇⲓⲕⲁⲓⲟⲥ ⲉϣⲁϥⲙⲟⲩ ϩⲛ̅ ⲧⲉϥⲙⲛ̅ⲧⲙⲉ ⲁⲩⲱ ⲟⲩⲛ̅ ⲁⲥⲉⲃⲏⲥ ⲉϥⲙⲏⲛ ⲉⲃⲟⲗ ϩⲛ̅ ⲧⲉϥⲕⲁⲕⲓⲁ
Ecclesiastes	7	17	 							 µὴ γίνου δίκαιος πολὺ καὶ µὴ σοφίζου περισσά, µήποτε ἐκπλαγῇς.	 Be not very just; neither be very wise: lest thou be confounded.	 ⲙ̅ⲡⲣ̅ϣⲱⲡⲉ ⲛ̅ⲇⲓⲕⲁⲓⲟⲥ ⲉⲡⲉϩⲟⲩⲟ ⲁⲩⲱ ⲙ̅ⲡⲣ̅ⲁⲁⲕ ⲛ̅ⲣⲙ̅ⲛ̅ⲥⲃⲱ ⲉⲡⲉϩⲟⲩⲟ ⲙⲏⲡⲱⲥ ⲛⲅ̅ⲡⲱϣⲥ̅ ⲉⲃⲟⲗ
Ecclesiastes	7	18	 		 [[ⲙ̈]]ⲡⲓⲗ ϣⲱⲡⲓ ⲉⲕⲛⲉϣⲧ ϫⲉ ⲛⲉⲕⲙⲟⲩ ⲉⲛⲡⲉⲕⲉϩⲓ ⲉⲛ ⲡⲉ⳾					 µὴ ἀσεβήσῃς πολὺ καὶ µὴ γίνου σκληρός, ἵνα µὴ ἀποθάνῃς ἐν οὐ καιρῷ σου.	 Be not very wicked; and be not stubborn: lest thou shouldest die before thy time.	 ⲙ̅ⲡⲣ̅ⲣ̅ⲁⲥⲉⲃⲏⲥ ⲟⲛ ⲉⲡⲉϩⲟⲩⲟ ⲁⲩⲱ ⲙ̅ⲡⲣ̅ϣⲱⲡⲉ ⲉⲕⲛⲁϣⲧ̅ ϫⲉ ⲛ̅ⲛⲉⲕⲙⲟⲩ ⲡⲃⲟⲗ ⲙ̅ⲡⲉⲕⲟⲩⲟⲉⲓϣ
Ecclesiastes	7	19	 		 ⲛⲁⲛⲟⲩⲥ ⲛⲕⲙⲁϣⲓ ϩⲁⲗⲉⲧ ⲁϩⲁ ⲙ̈ⲡⲓⲗⲱⲣⲉⲃ. ⲛ̈ⲥⲁ ⲧⲉⲕϫⲓϫ⳾ ϫⲉ ⲡⲉⲧⲓⲗ ϩⲁϯ ⲁⲑⲏ ⲙ̈ⲫϯ ϣⲁϥⲉⲓⲗ ⲃⲁⲗ ⲉⲗⲁⲩ ⲧⲏⲗⲟⲩ⳾					 ἀγαθὸν τὸ ἀντέχεσθαί σε ἐν τούτῳ, καί γε ἀπὸ τούτου µὴ ἀνῇς τὴν χεῖρά σου, ὅτι φοβούµενος τὸν θεὸν ἐξελεύσεται τὰ πάντα.	 It is well for thee to hold fast by this; also by this defile not thine hand: for to them that fear God all things shall come forth well.	 ⲟⲩⲁⲅⲁⲑⲟⲛ ⲡⲉ ⲉⲧⲣⲉⲕϭⲟⲗϫⲕ̅ ϩⲙ̅ ⲡⲁⲓ̈ ⲁⲩⲱ ⲙ̅ⲡⲣ̅ϫⲱϩⲙ̅ ⲛ̅ⲧⲉⲕϭⲓ̈ϫ ⲉⲃⲟⲗ ϩⲙ̅ ⲡⲁⲓ̈ ϫⲉ ⲛⲉⲧⲣ̅ϩⲟⲧⲉ ϩⲏⲧϥ̅ ⲙ̅ⲡⲛⲟⲩⲧⲉ ⲟⲩⲛ̅ ϩⲱⲃ ⲛⲓ̈ⲙ ⲛ̅ⲁⲅⲁⲑⲟⲛ ⲛⲁϣⲱⲡⲉ ⲛⲁⲩ
Ecclesiastes	7	20	 		 ⲧⲥⲟⲫⲓⲁ ϣⲁⲥⲉⲗ ⲧⲁⲓ̈ⲙ[[ⲉ]] ⲉⲡⲓⲥⲃⲁ ⲉϩⲟⲩⲁⲥⲧ ⲉⲙⲏⲧ⳾ ⲉⲟⲩⲁⲉⲓ ⲛⲟ̅ⲥ̅ ⲉⲟⲩⲡⲟⲗⲓⲥ⳾					 Ἡ σοφία βοηθήσει τῷ σοφῷ ὑπὲρ δέκα ἐξουσιάζοντας τοὺς ὄντας ἐν τῇ πόλει·	 Wisdom will help the wise man more than ten mighty men which are in the city.	 ⲧⲥⲟⲫⲓⲁ ⲛⲁⲃⲟⲏⲑⲉⲓ ⲉⲡⲥⲟⲫⲟⲥ ⲉϩⲟⲩⲉ ⲙⲏⲧ ⲉⲩⲟ ⲛ̅ⲉⲝⲟⲩⲥⲓⲁ ⲉⲩϣⲟⲟⲡ ϩⲛ̅ ⲟⲩⲡⲟⲗⲓⲥ
Ecclesiastes	7	21	 		 ϫⲉ ⲙ̈ⲙⲁⲛ ⲟⲩⲗⲱⲙⲓ ⲙ̈ⲙⲉⲓ̈ ϩⲗⲏⲓ̈ ⲉϫⲱⲛ ⲡⲕⲉϩⲓ: ⲉⲧϥⲉⲛⲉⲓ̈ⲗⲓ ⲛ̈ⲛⲟⲩ ⲡⲉⲧⲛⲁⲛⲟⲩϥ ⲁⲩⲱ ⲛⲉϥⲓⲗ ⲛⲁⲃⲓ⳾					 ὅτι ἄνθρωπος οὐκ ἔστιν δίκαιος ἐν τῇ γῇ, ὃς ποιήσει ἀγαθὸν καὶ οὐχ ἁµαρτήσεται.	 For there is not a righteous man in the earth, who will do good, and not sin	 ϫⲉ ⲙⲛ̅ ⲣⲱⲙⲉ ⲛ̅ⲇⲓⲕⲁⲓⲟⲥ ϩⲓ̈ϫⲙ̅ ⲡⲕⲁϩ ⲉϥⲛⲁⲉⲓⲣⲉ ⲛ̅ⲟⲩⲁⲅⲁⲑⲟⲛ ⲛϥ̅ⲧⲙ̅ⲣ̅ⲛⲟⲃⲉ
Ecclesiastes	7	22	 		 ⲛ̈ϣⲉϫⲓ ⲧⲏⲗⲟⲩ ⲉⲧⲉ ⲛⲁⲥⲉⲃⲏⲥ⳾ ⲛⲉϫⲁⲩ ⲙ̈ⲃⲉⲗⲕⲁ ⲡⲉⲕϩⲏⲧ ⲉⲥⲁⲧⲙⲟⲩ: ϫⲉ ⲛⲉⲕⲥⲱⲧⲟⲙ⳾ ⲉⲡⲉⲕϩⲉⲗ⳾ ⲉϥϩⲁⲟⲩϣ ⲉⲗⲁⲕ⳾					 καί γε εἰς πάντας τοὺς λόγους, οὓς λαλήσουσιν, µὴ θῇς καρδίαν σου, ὅπως µὴ ἀκούσῃς τοῦ δούλου σου καταρωµένου σε,	 Also take no heed to all the words which ungodly men shall speak; lest thou hear thy servant cursing thee.	 ⲁⲩⲱ ⲛ̅ϣⲁϫⲉ ⲧⲏⲣⲟⲩ ⲉⲧⲉⲣⲉ ⲛ̅ⲁⲥⲉⲃⲏⲥ ⲛⲁϫⲟⲟⲩ ⲙ̅ⲡⲣ̅ϯ ⲙ̅ⲡⲉⲕϩⲏⲧ ⲉⲣⲟⲟⲩ ϫⲉⲕⲁⲁⲥ ⲛ̅ⲛⲉⲕⲥⲱⲧⲙ̅ ⲉⲡⲉⲕϩⲙ̅ϩⲁⲗ ⲉϥⲥⲁϩⲟⲩ ⲙ̅ⲙⲟⲕ
Ecclesiastes	7	23	 		 ⲟⲩⲁⲧⲁ ⲛ̈ⲥⲁⲡ ϣⲁϥⲙⲏⲟⲩⲓ̈ ⲉⲡⲉⲕⲡⲉⲑⲁⲩ⳾ ⲛ̈ⲑⲏ ⲛ̈ⲧⲁⲕ ϩⲱⲕ ϣⲁⲕϩⲁⲩϣ ⲉϩⲉⲛⲕⲁⲓⲕⲁⲩⲛⲓ⳾					 ὅτι πλειστάκις πονηρεύσεταί σε καὶ καθόδους πολλὰς κακώσει καρδίαν σου, ὅπως καί γε σὺ κατηράσω ἑτέρους.	 For many times he shall trespass against thee, and repeatedly shall he afflict thine heart; for thus also hast thou cursed others.	 ϫⲉ ϥⲛⲁⲡⲟⲛⲏⲣⲉⲩⲉ ⲉⲣⲟⲕ ⲛ̅ϩⲁϩ ⲛ̅ⲥⲟⲡ ⲁⲩⲱ ⲡⲉⲕϩⲏⲧ ⲛⲁⲙⲟⲕϩⲕ̅ ⲛ̅ϩⲁϩ ⲛ̅ⲥⲟⲡ ϩⲛ̅ ⲛⲉⲕϩⲓ̈ⲟⲟⲩⲉ ϫⲉ ⲛ̅ⲧⲟⲕ ϩⲱⲱⲕ ⲟⲛ ⲁⲕⲥⲁϩⲟⲩ ⲛ̅ϩⲉⲛⲕⲟⲟⲩⲉ
