book	chapter	verse	Bohairic	Akhmimic	Fayyumic	OldBohairic	Mesokemic	DialectP	Lycopolitan	Greek	English	Sahidic
Ecclesiastes	1				ⲉⲕⲕⲗⲏⲥ[ⲓⲁⲥⲧⲏ]ⲥ							ⲡⲉⲕⲗⲏⲥⲓⲁⲥⲧⲏⲥ ⲩ̅ⲩ̅ ⲛ̅ⲇ̅ⲁ̅ⲇ̅
Ecclesiastes	1	1	 		 ⲛ̈[[ⲛⲓⲛ]]ϣⲉϫⲓ ⲙ̈ⲡⲉⲕ[ⲕⲗⲏⲥⲓ]ⲁⲥⲧⲏⲥ ⲡϣⲏⲗⲉ ⲛ⳰ⲇ̅ⲇ̅ ⲡⲣⲣⲁ ⲙ⳰ⲡⲓ̅ⲥ̅ⲗ̅ ⲛ⳰ⲓ̈ϩ̅ⲉ̅ⲙ̅:					 Ῥήµατα Ἐκκλησιαστοῦ υἱοῦ Δαυιδ βασιλέως Ισραηλ ἐν Ιερουσαληµ.	 The words of the Preacher, the son of David, king of Israel in Jerusalem.	 ⲛⲁⲓ̈ ⲛⲉ ⲛ̅ϣⲁϫⲉ ⲙ̅ⲡⲉⲕⲕⲗⲏⲥⲓⲁⲥⲧⲏⲥ ⲡϣⲏⲣⲉ ⲛ̅ⲇⲁⲩⲉⲓⲇ ⲉⲁϥⲣ̅ⲣ̅ⲣⲟ ⲉϫⲙ̅ ⲡⲓⲏⲗ ϩⲛ̅ ⲑⲓⲉⲗ̅ⲏ̅ⲙ̅
Ecclesiastes	1	2	 		 ⲉⲛⲡⲓϫⲉⲉⲓ ⲙ̈ⲡⲓϫⲉ[ⲉⲓ ⲡⲉϫ]ⲉ ⲡⲉⲕⲕⲗⲏⲥⲓⲁⲥⲧⲏⲥ⳾ ⲉⲛⲡⲓϫⲉⲓ ⲉⲛⲡⲓϫⲉⲓ ⲧⲏⲗⲟⲩ ⲛⲉ ⲡⲉϫⲉ ⲡ[ⲉⲕⲕⲗ]ⲏⲥⲓⲁⲥⲧⲏⲥ					 Ματαιότης µαταιοτήτων, εἶπεν ὁ Ἐκκλησιαστής, µαταιότης µαταιοτήτων, τὰ πάντα µαταιότης.	 Vanity of vanities, said the Preacher, vanity of vanities; all is vanity.	 ⲟⲩⲡⲉⲧϣⲟⲩⲉⲓⲧ ⲛ̅ⲙ̅ⲡⲉⲧϣⲟⲩⲉⲓⲧ ⲡⲉⲧϣⲟⲟⲡ ⲡⲉϫⲉ ⲡⲉⲕⲕⲗⲏⲥⲓⲁⲥⲧⲏⲥ ⲟⲩⲡⲉⲧϣⲟⲩⲉⲓⲧ ⲛ̅ⲙ̅ⲡⲉⲧϣⲟⲩⲉⲓⲧ ⲡⲉ ϩⲱⲃ ⲛⲓ̈ⲙ ⲉⲡⲉⲧϣⲟⲩⲉⲓⲧ ⲡⲉⲧⲛ̅ϩⲏⲧⲟⲩ
Ecclesiastes	1	3	 		 ⲟⲩⲙ ⲡⲉ ⲡⲉϩⲟⲩⲁ ⲙ⳰ⲡⲗⲱⲙⲓ ⲛ̈ϩⲓⲥⲓ ⲛⲓⲙⲓ ⲉⲧⲉϥ[ϩ]ⲁ[ⲥⲧϥ ⲉ]ⲗⲁϥ⳾ ⲛ̈ⲁⲗⲁϥ ⲙ̈ⲡⲣⲉ:					 τίς περισσεία τῷ ἀνθρώπῳ ἐν παντὶ µόχθῳ αὐτοῦ, ᾧ µοχθεῖ ὑπὸ τὸν ἥλιον;	 What advantage is there to a man in all his labour that he takes under the sun?	 ⲟⲩ ⲡⲉ ⲡⲉϩⲟⲩⲟ ⲙ̅ⲡⲣⲱⲙⲉ ⲉⲧϣⲟⲟⲡ ⲛⲁϥ ϩⲙ̅ ⲡⲉϥϩⲓ̈ⲥⲉ ⲧⲏⲣϥ̅ ⲡⲁⲓ̈ ⲉⲧϥϩⲁⲥⲉ ⲛ̅ϩⲏⲧϥ̅ ϩⲁⲣⲟϥ ⲙ̅ⲡⲣⲏ
Ecclesiastes	1	4	 		 ⲟⲩⲁⲛ ⲟⲩϫⲱⲙ ϣⲁϥϣⲏ ⲟⲩⲁⲛ ⲟⲩϫⲱⲙ ϣ[ⲁϥⲉⲓ⳾] ⲡⲕⲉϩⲓ ⲟϩⲓ ⲉⲗⲉⲧϥ ϣⲁ ⲉⲛⲉϩ⳾					 γενεὰ πορεύεται καὶ γενεὰ ἔρχεται, καὶ ἡ γῆ εἰς τὸν αἰῶνα ἕστηκεν.	 A generation goes, and a generation comes: but the earth stands for ever.	 ϫⲉ ⲟⲩⲅⲉⲛⲉⲁ ϣⲁⲥⲃⲱⲕ ⲛ̅ⲧⲉ ⲕⲉⲟⲩⲉⲓ ⲉⲓ ⲉⲡⲉⲥⲙⲁ ⲡⲕⲁϩ ⲇⲉ ϣⲟⲟⲡ ϣⲁ ⲉⲛⲉϩ
Ecclesiastes	1	5	 		 ϣⲁⲗⲉ ⲡⲣⲉ ϣⲉⲉⲓ⳾ ϣⲁⲗⲉ ⲡⲣⲉ ⲱ[ⲧⲡ ⲛ̈ϥⲥⲱⲕ] ⲉϩⲏⲉⲓ ⲉⲡⲉϥⲙⲉ:					 καὶ ἀνατέλλει ὁ ἥλιος καὶ δύνει ὁ ἥλιος καὶ εἰς τὸν τόπον αὐτοῦ ἕλκει·	 And the sun arises, and the sun goes down and draws toward its place;	 ⲁⲩⲱ ⲡⲣⲏ ϣⲁϥϣⲁ ⲛϥ̅ϩⲱⲧⲡ ̅ⲛϥ̅ⲥⲱⲕ ⲟⲛ ⲉϩⲣⲁⲓ̈ ⲉⲡⲉϥⲙⲁ
Ecclesiastes	1	6	 		 ⲉϣⲁϥϣⲉⲉⲓ ϣⲁϥϣⲏ ϩⲗⲏⲉⲓ ⲉⲡⲣⲏⲥ⳾ [ϣⲁϥⲕⲁ]ⲧϥ ϩⲗⲏⲉⲓ ⲉⲡⲉⲙⲓ̈ϩⲧ⳾ ⲛ̈ⲛⲟⲩⲕⲱⲧⲓ ϣⲁϥⲕⲁⲧϥ ϣⲁϥⲙⲁϣⲓ ϩ[ⲓⲛ] ⲟⲩⲕⲱϯ⳾ ⲁϩⲁ ϩⲗⲏⲉⲓ ⲛ̈ⲛⲉϥⲕⲁⲧⲥ ϣⲁⲗⲉ ⲡⲛ̅ⲁ̅ ⲕⲱϯ⳾					 ἀνατέλλων αὐτὸς ἐκεῖ πορεύεται πρὸς νότον καὶ κυκλοῖ πρὸς βορρᾶν· κυκλοῖ κυκλῶν, πορεύεται τὸ πνεῦµα, καὶ ἐπὶ κύκλους αὐτοῦ ἐπιστρέφει τὸ πνεῦµα.	 arising there it proceeds southward, and goes round toward the north. The wind goes round and round, and the wind returns to its circuits.	 ⲛ̅ⲧⲟϥ ⲉϥⲛⲁϣⲁ ϣⲁϥⲙⲟⲟϣⲉ ⲉⲡⲥⲁ ⲙ̅ⲡⲣⲏⲥ ⲁⲩⲱ ⲛϥ̅ⲕⲟⲧϥ̅ ⲉϣⲁϥⲕⲧⲟϥ ⲉⲡⲥⲁ ⲙ̅ⲡⲉⲙϩⲓ̈ⲧ ⲡⲉⲡⲛ̅ⲁ̅ ⲉϥⲙⲟⲟϣⲉ ⲉϥⲕⲱⲧⲉ ⲁⲩⲱ ϣⲁϥⲕⲧⲟϥ ⲉϩⲣⲁⲓ̈ ⲉⲛⲉϥⲕⲟⲧⲥ̅
Ecclesiastes	1	7	 		 ⲛ̈ⲙⲟⲩⲓ̈ⲉ ⲥⲱⲣⲟⲙ ⲧⲏⲗⲟⲩ ϣⲁⲩϣⲏ ϩⲗⲏⲉⲓ ⲉⲑⲁⲗⲁⲥⲥⲁ⳾ ⲑⲁⲗⲁⲥⲥⲁ ⲇⲉ ⲙ̈ⲃⲉⲥⲙⲟⲩϩ ⲁⲗⲁⲩ⳾ ⲡⲙⲉ ⲉⲧⲉϣⲁⲗⲉ ⲙ̈ⲙⲟⲩⲉⲓⲁⲓ ⲥⲱⲣⲟⲙ ϣⲏ ⲉⲙⲉⲟⲩ⳾ ϣⲁⲩⲕⲁⲧⲟⲩ ⲉⲙⲉⲟⲩ ⲉⲙ[ⲁ]ϣⲓ:					 πάντες οἱ χείµαρροι, πορεύονται εἰς τὴν θάλασσαν, καὶ ἡ θάλασσα οὐκ ἔσται ἐµπιµπλαµένη· εἰς τόπον, οὗ οἱ χείµαρροι πορεύονται, ἐκεῖ αὐτοὶ ἐπιστρέφουσιν τοῦ πορευθῆναι.	 All the rivers run into the sea; and yet the sea is not filled: to the place whence the rivers come, thither they return again.	 ⲙ̅ⲙⲟⲩⲛⲥⲱⲣⲙ̅ ⲧⲏⲣⲟⲩ ⲉⲩⲙⲟⲟϣⲉ ⲉϩⲣⲁⲓ̈ ⲉⲑⲁⲗⲁⲥⲥⲁ ⲁⲩⲱ ⲧⲉⲑⲁⲗⲁⲥⲥⲁ ⲙⲉⲥⲙⲟⲩϩ ϩⲁⲣⲟⲟⲩ ⲙ̅ⲙⲟⲩⲛⲥⲱⲣⲙ̅ ⲧⲏⲣⲟⲩ ϣⲁⲩⲙⲟⲟϣⲉ ⲉϩⲣⲁⲓ̈ ⲉⲛⲉⲩⲙⲁ ⲉϣⲁⲩⲙⲟⲟϣⲉ ⲛ̅ⲧⲟⲟⲩ ⲉⲧⲣⲉⲩⲃⲱⲕ ⲉⲡⲙⲁ ⲉⲧⲙ̅ⲙⲁⲩ
Ecclesiastes	1	8	 		 ⲛ̈ϣⲉϫⲓ ⲧⲏⲗⲟⲩ ⲥⲉϩⲁ[[ⲥⲓ]]ⲥⲓ: ⲙ̈ⲙⲁⲛ ϣϫⲁⲙ ⲛⲟⲩⲗⲱⲙⲓ ⲛ̈ϥϣⲉϫⲓ⳾ ⲙ̈[ⲙ]ⲁⲛ ⲟⲩⲃⲉⲗ ⲛ̈ⲛⲉⲥⲓ ⲙ̈ⲡⲓⲱⲣϩϩ ⲙ̈ⲙⲁⲛ ⲟⲩⲙⲉϫⲁ ⲛ̈ⲛⲉⲥⲓ ⲙ⳰ⲡⲥⲱⲧ[ⲟⲙ⳾]					 πάντες οἱ λόγοι ἔγκοποι· οὐ δυνήσεται ἀνὴρ τοῦ λαλεῖν, καὶ οὐκ ἐµπλησθήσεται ὀφθαλµὸς τοῦ ὁρᾶν, καὶ οὐ πληρωθήσεται οὖς ἀπὸ ἀκροάσεως.	 All things are full of labour; a man will not be able to speak of them: neither shall the eye be satisfied with seeing, neither shall the ear be filled with hearing.	 ⲛ̅ϣⲁϫⲉ ⲧⲏⲣⲟⲩ ⲥⲉϣⲁⲁⲧ ⲛ̅ⲛⲉϣ ⲡⲣⲱⲙⲉ ϣⲁϫⲉ ⲛ̅ϩⲏⲧⲟⲩ ⲁⲩⲱ ⲛ̅ⲛⲉϣ ⲡⲃⲁⲗ ⲥⲉⲓ ϩⲁ ⲡⲛⲁⲩ ⲁⲩⲱ ⲛ̅ⲛⲉϣ ⲡⲙⲁⲁϫⲉ ⲥⲉⲓ ϩⲁ ⲡⲥⲱⲧⲙ̅
Ecclesiastes	1	9	 		 [ⲟⲩⲙ ⲡⲉ] ⲛⲧⲁϥϣⲱⲡⲓ ⲛ̈ⲧⲁϥ ⲁⲛ ⲡⲉ⳾ ⲡⲉⲧⲛⲉϣⲱⲡⲓ⳾ ⲁ[ϩⲁ] ⲟⲩⲙ ⲡⲉ[ⲧⲁⲩⲧⲁⲙ(ⲙ)ⲓⲁϥ] ⲛ⳰ⲧⲁϥ ⲁⲛ ⲡⲉⲧⲟⲩⲛⲉ ⲧⲁⲙⲙⲓⲁϥ⳾ ⲁϩⲁ ⲙⲁ[ⲛ ⲗⲁⲡ]ⲥ ⲙ̈[ⲙⲟⲩⲓ̈ ϣⲁⲡ ⲛ̈ⲁⲗⲁⲥ] ⲛ̈ⲧⲧⲡⲡⲏ⳾					 τί τὸ γεγονός, αὐτὸ τὸ γενησόµενον· καὶ τί τὸ πεποιηµένον, αὐτὸ τὸ ποιηθησόµενον· καὶ οὐκ ἔστιν πᾶν πρόσφατον ὑπὸ τὸν ἥλιον.	 What is that which has been? the very thing which shall be: and what is that which has been done? the very thing which shall be done: and there is no new thing under the sun.	 ⲟⲩ ⲡⲉⲛⲧⲁϥϣⲱⲡⲉ ⲛ̅ⲧⲟϥ ⲟⲛ ⲡⲉⲧⲛⲁϣⲱⲡⲉ ⲟⲩ ⲡⲉⲛⲧⲁⲩⲧⲁⲙⲓ̈ⲟϥ ⲛ̅ⲧⲟϥ ⲟⲛ ⲡⲉⲧⲟⲩⲛⲁⲧⲁⲙⲓ̈ⲟϥ ⲁⲩⲱ ⲙⲛ̅ ⲗⲁⲁⲩ ⲛ̅ϩⲱⲃ ⲛ̅ⲃⲣ̅ⲣⲉ ϩⲁⲣⲱϥ ⲙ̅ⲡⲣⲏ
Ecclesiastes	1	10	 		 [ⲡⲉⲧ(ⲛⲉ)ϣⲉ]ϫⲓ ⲛ̈ϫⲁϥ⳾ ϫⲉ ⲡⲉⲉⲓ ⲟⲩⲙ[ⲟⲩⲓ̈ (ⲡⲉ) ⳾ ⲁϥⲟⲩⲱ ⲉϥϣ]ⲱⲡⲓ ⲛⲛⲓⲁⲓⲱⲛ [ⲛ̈ⲧⲁⲩ]ϣⲱⲡⲓ ϩⲁ ⲧⲉⲛϩⲏ:					 ὃς λαλήσει καὶ ἐρεῖ Ἰδὲ τοῦτο καινόν ἐστιν, ἤδη γέγονεν ἐν τοῖς αἰῶσιν τοῖς γενοµένοις ἀπὸ ἔµπροσθεν ἡµῶν.	 Who is he that shall speak and say, Behold, this is new? it has already been in the ages that have passed before us.	 ⲉⲣⲉ ⲡⲣⲱⲙⲉ ⲛⲁϣⲁϫⲉ ⲉⲣⲟⲟⲩ ⲛϥ̅ϫⲟⲟⲥ ϫⲉ ⲉⲓⲥ ⲡⲁⲓ̈ ⲟⲩⲃⲣ̅ⲣⲉ ⲡⲉ ⲏⲇⲏ ⲁⲩⲟⲩⲱ ⲉⲩϣⲱⲡⲉ ϩⲛ̅ ⲛⲁⲓ̈ⲱⲛ ⲛ̅ⲧⲁⲩϣⲱⲡⲉ ϩⲁ ⲧⲛ̅ϩⲓ̈ⲏ
Ecclesiastes	1	11	 		 ⲙ̈ⲙⲁⲛ ⲟ[ⲩⲙⲏⲟⲩⲓ̈ ϣⲁⲡ ⲛ̈ⲛ]ⲉϩⲟⲩϯ⳾ ⲁϩⲁ [(ⲛ̈)ⲛⲉⲧⲁⲩ]ϣⲱⲡⲓ ⲛ̈ⲥⲁ ϩⲁⲏ⳰ ⲁ ⲧⲉⲛϩⲏ[⳾ ⲙ̈ⲙⲁⲛ ⲟⲩⲙⲏ]ⲟ[ⲩⲓ̈] ϣⲁⲡ ⲛ̈ⲛⲉⲉⲓ⳾ [ⲛⲉⲧⲛⲉϣ]ⲱⲡⲓ ⲛ⳰ⲥⲁ ϩⲁⲏ⳾					 οὐκ ἔστιν µνήµη τοῖς πρώτοις, καί γε τοῖς ἐσχάτοις γενοµένοις οὐκ ἔσται αὐτοῖς µνήµη µετὰ τῶν γενησοµένων εἰς τὴν ἐσχάτην.	 There is no memorial to the first things; neither to the things that have been last shall their memorial be with them that shall at the last time.	 ⲙ̅ⲙⲛ̅ ⲣ̅ⲡⲙⲉⲉⲩⲉ ϣⲟⲟⲡ ⲛ̅ⲛ̅ϣⲟⲣⲡ̅ ⲁⲩⲱ ⲛ̅ⲕⲉϩⲁⲉⲉⲩⲉ ⲛ̅ⲧⲁⲩϣⲱⲡⲉ ϩⲁ ⲧⲛ̅ϩⲓ̈ⲏ ⲙ̅ⲙⲛ̅ ⲣ̅ⲡⲙⲉⲉⲩⲉ ϣⲟⲟⲡ ⲁⲩⲱ ⲛⲉⲧⲛⲁϣⲱⲡⲉ ⲉⲑⲁⲏ
Ecclesiastes	1	12	 		 ⲁⲛ[ⲁ]ⲕ [ⲡⲉⲕⲕ]ⲗⲏⲥ[ⲓ]ⲁⲥⲧⲏⲥ ⲁⲓ̈ⲗ ⲣⲣⲁ [ⲙ̈ⲡⲓ̅ⲥ̅ⲗ̅ ⲛ̈ⲓ̈ⲉⲣ]ⲟⲩⲥⲁⲗⲏⲙ⳾					 Ἐγὼ Ἐκκλησιαστὴς ἐγενόµην βασιλεὺς ἐπὶ Ισραηλ ἐν Ιερουσαληµ·	 I the Preacher was king over Israel in Jerusalem.	 ⲁⲛⲟⲕ ⲡⲉⲕⲕⲗⲏⲥⲓⲁⲥⲧⲏⲥ ⲁⲓ̈ⲣ̅ⲣ̅ⲣⲟ ⲉϫⲙ̅ ⲡⲓⲏ̅ⲗ̅ ϩⲛ̅ ⲑⲓⲉⲗ̅ⲏ̅ⲙ̅
Ecclesiastes	1	13	 		 ⲁⲉⲓϯ ⲙ̈ⲡⲁϩ[ⲏⲧ] ⲉⲕⲱϯ ⲁϩⲁ ⲛ̈ⲧⲁϫⲓⲛⲓ ⲙ̈[ⲡⲉⲥϣⲓⲛⲓ] ⲛ̈ⲧⲁⲥⲟⲫⲓⲁ⳾ ⲉⲧⲃⲉ ⲛⲉⲧ[ⲁⲩ]ϣⲱⲡⲓ ⲧⲏⲗⲟⲩ⳾ ⲛ̈ⲁⲗⲁⲥ ⲛ̈ⲧⲡⲏ⳾ [ϫⲉ ⲟⲩⲱ]ⲃⲉϣ ⲁ ⲫϯ ⲧⲉⲉⲓⲥ ⲛ̈[[ⲛⲟ]]ⲓⲛϣ[ⲏ]ⲗⲓ ⲛ̈[[ⲛⲓ]]ⲗⲱⲙⲓ ϫⲉ ⲉⲩⲁⲓⲱⲃϣ [ⲛ]ϩ[ⲏ]ⲧ[ϥ] ⳾					 καὶ ἔδωκα τὴν καρδίαν µου τοῦ ἐκζητῆσαι καὶ τοῦ κατασκέψασθαι ἐν τῇ σοφίᾳ περὶ πάντων τῶν γινοµένων ὑπὸ τὸν οὐρανόν· ὅτι περισπασµὸν πονηρὸν ἔδωκεν ὁ θεὸς τοῖς υἱοῖς τοῦ ἀνθρώπου τοῦ περισπᾶσθαι ἐν αὐτῷ.	 And I applied my heart to seek out and examine by wisdom concerning all things that are done under heaven, for God has given to the sons of men an evil trouble to be troubled therewith.	 ⲁⲩⲱ ⲁⲓ̈ϯ ⲙ̅ⲡⲁϩⲏⲧ ⲉϣⲓ̈ⲛⲉ ⲁⲩⲱ ⲉϯ ⲟⲩⲟⲓ̈ ϩⲛ̅ ⲧⲥⲟⲫⲓⲁ ⲉⲧⲃⲉ ⲛⲉⲛⲧⲁⲩϣⲱⲡⲉ ⲧⲏⲣⲟⲩ ϩⲁⲣⲟⲥ ⲛ̅ⲧⲡⲉ ϫⲉ ⲟⲩⲡⲉⲣⲓⲥⲡⲁⲥⲙⲟⲥ ⲙ̅ⲡⲟⲛⲏⲣⲟⲛ ⲁ ⲡⲛⲟⲩⲧⲉ ⲧⲁⲁϥ ⲛ̅ⲛ̅ϣⲏⲣⲉ ⲛ̅ⲛ̅ⲣⲱⲙⲉ ⲉⲧⲣⲉⲩϫⲓ̈ϩⲣⲁⲩ ⲛ̅ϩⲏⲧϥ̅ ϩⲛ̅ ⲟⲩϩⲏⲇⲟⲛⲏ
Ecclesiastes	1	14	 		 [ⲁⲉⲓⲛⲉ]ⲩ ⲉⲛⲓⲧⲁⲙⲓⲁ ⲧⲏⲗⲟⲩ ⲛ⳰ⲧⲁⲩⲧⲁⲙⲓⲁⲁⲩ ⲛ̈ϩⲁⲗⲁϥ ⲙ̈ⲡⲣⲉ⳾ ⲛ̈ⲧⲁⲩ [ⲧⲏⲗⲟⲩ ϩⲉⲛ]ⲡⲓϫⲉⲉⲓ ⲛⲁⲓ ⲁϩⲁ ⲟⲩⲉⲓⲗⲟⲩⲁⲧ ⲙ̈ⲡⲛ̅ⲁ̅⳾					 εἶδον σὺν πάντα τὰ ποιήµατα τὰ πεποιηµένα ὑπὸ τὸν ἥλιον, καὶ ἰδοὺ τὰ πάντα µαταιότης καὶ προαίρεσις πνεύµατος.	 I beheld all the works that were wrought under the sun; and, beheld, all were vanity and waywardness of spirit.	 ⲁⲓ̈ⲛⲁⲩ ⲛ̅ⲧⲁⲙⲓ̈ⲟ ⲧⲏⲣⲟⲩ ⲛ̅ⲧⲁⲩⲧⲁⲙⲓ̈ⲟⲟⲩ ⲧⲏⲣⲟⲩ ϩⲁⲣⲟϥ ⲙ̅ⲡⲣⲏ ⲁⲩⲱ ⲉⲓⲥ ϩⲏⲏⲛⲉ ⲧⲏⲣⲟⲩ ⲟⲩⲡⲉⲧϣⲟⲩⲉⲓⲧ ⲡⲉⲧⲛ̅ϩⲏⲧⲟⲩ ⲙⲛ̅ ⲟⲩⲟⲩⲱϣ ⲙ̅ⲡⲛ̅ⲁ̅
Ecclesiastes	1	15	 		 ⲡⲉⲧϫⲁⲙⲁⲓ ⲙ̈ⲙⲁⲛ [ϣϫⲁⲙ ⲛ̈]ⲥⲉⲥⲕ ϥⲟⲩⲱϥ⳾ ⲁϩⲁ ⲡⲉⲧϫⲁⲗϩ ⲙ̈ⲙⲁⲛ ϣϫⲁⲙ ⲛ⳰ⲥⲉϫⲓ ⲏ⳰ⲡⲓ [ⲙ̈ⲙⲁϥ⳾]					 διεστραµµένον οὐ δυνήσεται τοῦ ἐπικοσµηθῆναι, καὶ ὑστέρηµα οὐ δυνήσεται τοῦ ἀριθµηθῆναι.	 That which is crooked cannot be made straight: and deficiency cannot be numbered.	 ⲡⲉⲧϭⲟⲟⲙⲉ ⲛ̅ⲥⲉⲛⲁϣⲕⲟⲥⲙⲉⲓ ⲁⲛ ⲙ̅ⲙⲟϥ ⲁⲩⲱ ⲡⲉⲧϣⲁⲁⲧ ⲛ̅ⲥⲉⲛⲁϣⲛ̅ⲧϥ̅ ⲁⲛ ⲉⲩⲏⲡⲉ
Ecclesiastes	1	16	 		 ⲁⲉⲓϣⲉϫⲓ ⲁⲛⲁⲕ ϩⲓ[ⲙ] ⲡⲁϩⲏⲧ⳾ ϫⲉ ⲁⲉⲓⲉϫⲁⲥ ϫⲉ ϩⲏⲧⲉ ⲁⲉⲓ[ϫⲓⲥⲓ ⲁϩⲁ ⲁⲓ̈]ϯ̈ ⲟⲩⲥⲟⲫⲓⲁ ⲛ̈ⲁⲗⲁⲉⲓ ⲉϩⲟⲩⲁⲥⲧ ⲉⲛⲏ ⲛ̈ⲧⲁⲩϣⲱⲡⲓ [ϩⲁ ⲧⲁϩⲏ ⲛ̈ⲓ̈]ⲉⲣ̅ⲟ̅ⲙ̅ⲗ̅ ⲡⲁϩⲏⲧ ⲁϥⲛⲉⲟⲩ [[ⲁϥ]]ⲉⲉⲟⲩⲁⲧⲁ⳾ ⲟ[ⲩ]ⲥⲟⲫⲓⲁ ⲙ̈ⲙⲁⲛⲛ ⲟⲩ[ⲥⲁⲟⲩⲛ⳾]					 ἐλάλησα ἐγὼ ἐν καρδίᾳ µου τῷ λέγειν Ἐγὼ ἰδοὺ ἐµεγαλύνθην καὶ προσέθηκα σοφίαν ἐπὶ πᾶσιν, οἳ ἐγένοντο ἔµπροσθέν µου ἐν Ιερουσαληµ, καὶ καρδία µου εἶδεν πολλά, σοφίαν καὶ γνῶσιν.	 I spoke in my heart, saying, Behold, I am increased, and have acquired wisdom beyond all who were before me in Jerusalem: also I applied my heart to know wisdom and knowledge.	 ⲁⲛⲟⲕ ⲁⲓ̈ϣⲁϫⲉ ϩⲙ̅ ⲡⲁϩⲏⲧ ϩⲙ̅ ⲡⲧⲣⲁϫⲟⲟⲥ ϫⲉ ⲉⲓⲥ ϩⲏⲏⲧⲉ ⲁⲛⲟⲕ ⲁⲓ̈ϫⲓ̈ⲥⲉ ⲡⲁⲣⲁ ⲛⲉⲛⲧⲁⲩϣⲱⲡⲉ ϩⲁ ⲧⲁϩⲓ̈ⲏ ϩⲛ̅ ⲑⲓⲉⲗ̅ⲏ̅ⲙ̅ ⲁⲩⲱ ⲁⲓ̈ⲟⲩⲱϩ ⲉⲧⲟⲟⲧ ⲛ̅ⲟⲩⲥⲟⲫⲓⲁ ⲉϩⲟⲩⲛ ⲉⲟⲩⲟⲛ ⲛⲓ̈ⲙ ⲡⲁⲣⲁ ⲛⲉⲛⲧⲁⲩϣⲱⲡⲉ ϩⲁ ⲧⲁϩⲓ̈ⲏ ϩⲛ̅ ⲑⲓⲉⲗ̅ⲏ̅ⲙ̅ ⲁⲩⲱ ⲁ ⲡⲁϩⲏⲧ ⲛⲁⲩ ⲉϩⲁϩ ⲛ̅ϩⲱⲃ ⲟⲩⲥⲟⲫⲓⲁ ⲙⲛ̅ ⲟⲩⲥⲟⲟⲩⲛ
Ecclesiastes	1	17	 		 [ⲁⲉⲓ]ϯ̈ ⲡⲁϩⲏⲧ ϫⲉ ⲁⲓⲓⲉⲓⲙⲓ ⲉⲟⲩⲥⲟⲫⲓⲁ ⲙ[ⲙ]ⲉⲛ ⲟⲩⲥⲁⲟⲩⲛ ⲟⲩⲡⲁⲣⲁⲃⲟⲗⲏ ⲙⲙⲉⲛ ⲟⲩⲥⲃⲱ⳾ ⲁⲛⲁⲕ ⲁⲉⲓⲙⲓ ⲉ[ⲗⲁⲩ ϫⲉ ⲡ]ⲉⲓⲕⲏⲧ ⲁⲛ ⲟⲩⲗⲟⲩⲁⲧ ⲙ⳰ⲡⲛ̅[ⲁ̅]					 καὶ ἔδωκα καρδίαν µου τοῦ γνῶναι σοφίαν καὶ γνῶσιν, παραβολὰς καὶ ἐπιστήµην ἔγνων, ὅτι καί γε τοῦτ’ ἔστιν προαίρεσις πνεύµατος·	 And my heart knew much—wisdom, and knowledge, parables and understanding: I perceived that this also is waywardness of spirit.	 ⲁⲩⲱ ⲟⲩⲡⲁⲣⲁⲃⲟⲗⲏ ⲙⲛ̅ ⲟⲩⲥⲃⲱ ⲁⲛⲟⲕ ⲁⲓ̈ⲉⲓⲙⲉ ⲉⲣⲟⲟⲩ ϫⲉ ⲉⲓⲥ ⲡⲉⲓ̈ⲕⲉ ⲟⲛ ⲟⲩⲟⲩⲱϣ ⲡⲉ ⲙ̅ⲡⲛ̅ⲁ̅
Ecclesiastes	1	18	 		 ϫⲉ ϩⲓⲙ ⲡⲁϣⲉⲉⲓ ⲛⲧⲉ ⲧⲥⲟⲫⲓⲁ ⲡⲁϣⲉⲉⲓ [ⲛⲧⲉ ⲡⲥⲁ]ⲟⲩⲛ̈ ⲡⲉ⳾ ⲡⲉⲧⲁϥⲉⲓⲙⲓ ⲉⲡⲥⲁⲟⲩⲛ ⲛⲉⲟⲩϩⲉ ⲟⲩⲙⲕⲉϩ⳾					 ὅτι ἐν πλήθει σοφίας πλῆθος γνώσεως, καὶ ὁ προστιθεὶς γνῶσιν προσθήσει ἄλγηµα.	 For in the abundance of wisdom is abundance of knowledge; and he that increases knowledge will increase sorrow.	 ϫⲉ ⲉⲣⲉ ⲟⲩⲛⲟϭ ⲛ̅ⲥⲟⲟⲩⲛ ϣⲟⲟⲡ ϩⲙ̅ ⲡⲁϣⲁⲓ̈ ⲛ̅ⲧⲥⲟⲫⲓⲁ ⲁⲩⲱ ⲡⲉⲧⲛⲁⲟⲩⲱϩ ⲉⲧⲟⲟⲧϥ̅ ⲉϫⲙ̅ ⲡⲥⲟⲟⲩⲛ ⲉϥⲛⲁⲟⲩⲉϩ ⲟⲩⲙⲟⲕϩⲥ̅
Ecclesiastes	2	1	 		 ⲁⲉⲓϫⲁⲥ ⲁⲛⲁⲕ ⲙ[ⲡⲁϩⲏ]ⲧ ϫⲉ ⲁⲙⲟⲩ ⲛ̈ⲧⲁϫⲁⲛⲧⲕ ϩⲓⲛⲛ ⲟⲩⲛⲁϥ ⲛ̈ⲕⲛⲉⲩ ⲉⲛⲡⲉⲧⲛⲁⲛⲟⲩϥ⳾ ⲡ[ⲉⲉⲓⲕⲏ]ⲧ ⲁⲛ ⲟⲩⲡⲓϫⲉⲉⲓ ⲡⲉ⳾					 Εἶπον ἐγὼ ἐν καρδίᾳ µου Δεῦρο δὴ πειράσω σε ἐν εὐφροσύνῃ, καὶ ἰδὲ ἐν ἀγαθῷ· καὶ ἰδοὺ καί γε τοῦτο µαταιότης.	 I said in my heart, Come now, I will prove thee with mirth, and behold thou good: and, behold, this is also vanity.	 ⲁⲓ̈ϫⲟⲟⲥ ⲁⲛⲟⲕ ϩⲙ̅ ⲡⲁϩⲏⲧ ϫⲉ ⲁⲙⲟⲩ ⲧⲁϫⲟⲛⲧⲕ̅ ϩⲛ̅ ⲟⲩⲟⲩⲛⲟϥ ⲛⲅ̅ⲛⲁⲩ ϩⲛ̅ ⲟⲩⲁⲅⲁⲑⲟⲛ ⲁⲩⲱ ⲉⲓⲥ ⲡⲉⲓ̈ⲕⲉⲧ ⲟⲩⲡⲉⲧϣⲟⲩⲉⲓⲧ ⲡⲉ
Ecclesiastes	2	2	 		 ⲁⲉⲓϫⲁⲥ ⲉⲡⲥⲱⲃⲓ ϫⲉ ⲛ̈ϥⲥⲙⲁⲧ ⲉⲛ⳾ ⲁϩⲁ [ⲡⲟⲩⲛⲁϥ] ϫⲉ ⲁϩⲁⲕ ⲕⲓⲗⲉⲓ ⲙ̈ⲡⲉⲓ⳾					 τῷ γέλωτι εἶπα περιφορὰν καὶ τῇ εὐφροσύνῃ Τί τοῦτο ποιεῖς;	 I said to laughter, Madness: and to mirth, Why doest thou this:	 ⲡⲥⲱⲃⲉ ⲁⲓ̈ⲧⲁⲩⲟ ⲉⲣⲟϥ ⲙ̅ⲡϣⲉⲉⲓ ⲁⲩⲱ ⲡⲟⲩⲛⲟϥ ⲁⲓ̈ϫⲟⲟⲥ ⲛⲁϥ ϫⲉ ⲟⲩ ⲡⲉ ⲡⲁⲓ̈ ⲉⲧⲕ̅ⲉⲓⲣⲉ ⲙ̅ⲙⲟϥ
Ecclesiastes	2	3	 		 ⲁⲉⲓϫⲱϣⲧ ⲉⲡⲁⲏ⳰ⲧ⳾ ϫⲉ ⲁⲉⲓⲛⲁⲓⲥⲉⲧ ⲡⲁⲁ[ϥⲟⲩⲓ̈] ⲛⲑⲏ ⲛ̈ⲟⲩⲏⲗⲡ⳾ ⲡⲁϩⲏⲧ ⲇⲉ ⲁϥϫⲓⲙⲁⲉⲓⲧ ⲛⲏⲉⲓ ⲛ̈ⲥⲟⲫⲓⲁ⳾ [ⲁϩⲁ ⲉ]ⲁⲙⲉϩϯ ⲛ̈ⲡⲟⲩⲛⲁϥ⳾ ϣⲁⲛϯⲛⲉⲩ ϫⲉ ⲉϣ ⲡⲉⲧⲛⲁⲛⲟⲩ[ϥ ϣ]ⲁ[ⲡ ⲛ̈ⲛ̈ϣ]ⲏⲗⲓ ⲛ̈ⲛⲓⲗⲱⲙⲓ⳾ ⲧⲏⲡⲓ ⲛⲛⲉϩⲁⲟⲩ ⲛ̈ⲧⲉ ⲡⲉⲩⲱⲛϩ⳾					 κατεσκεψάµην ἐν καρδίᾳ µου τοῦ ἑλκύσαι εἰς οἶνον τὴν σάρκα µου — καὶ καρδία µου ὡδήγησεν ἐν σοφίᾳ — καὶ τοῦ κρατῆσαι ἐπ’ ἀφροσύνῃ, ἕως οὗ ἴδω ποῖον τὸ ἀγαθὸν τοῖς υἱοῖς τοῦ ἀνθρώπου, ὃ ποιήσουσιν ὑπὸ τὸν ἥλιον ἀριθµὸν ἡµερῶν ζωῆς αὐτῶν.	 And I examined whether my heart would excite my flesh as with wine, (though my heart guided me in wisdom,) and I desired to lay hold of mirth, until I should see of what kind is the good to the sons of men, which they should do under the sun all the days of their life.	 ⲁⲓ̈ϯ ϩⲧⲏⲓ̈ ϫⲉ ⲛⲉ ⲡⲁϩⲏⲧ ⲛⲁϣⲥⲉⲕ ⲧⲁⲥⲁⲣⲝ ⲛ̅ⲑⲉ ⲛ̅ⲟⲩⲏⲣⲡ ⲁⲩⲱ ⲡⲁϩⲏⲧ ⲁϥϫⲓ̈ ⲙⲟⲉⲓⲧ ϩⲏⲧ ϩⲛ̅ ⲟⲩⲥⲟⲫⲓⲁ ⲁⲩⲱ ⲉⲧⲣⲁⲁⲙⲁϩⲧⲉ ⲉϫⲙ̅ ⲡⲟⲩⲛⲟϥ ϣⲁⲛϯⲛⲁⲩ ϫⲉ ⲁϣ ⲡⲉ ⲡⲁⲅⲁⲑⲟⲛ ⲉⲧϣⲟⲟⲡ ⲛ̅ⲛ̅ϣⲏⲣⲉ ⲛ̅ⲛ̅ⲣⲱⲙⲉ ⲉⲧⲟⲩⲛⲁⲁϥ ϩⲁⲣⲟϥ ⲙ̅ⲡⲣⲏ ⲛ̅ⲧⲏⲡⲉ ⲛ̅ⲛⲉϩⲟⲟⲩ ⲙ̅ⲡⲉⲩⲱⲛϩ̅
Ecclesiastes	2	4	 		 ⲁⲉⲓⲧⲗ[ⲉ ⲡⲧⲁⲙ]ⲓⲁ ⲁϣⲉⲓ⳾ ⲁⲉⲓⲕⲁⲧ ⲉⲛⲏ⳰ⲉⲓ ⲛⲏⲉⲓ⳾ ⲁⲉⲓⲧⲁϫ ⲉⲛⲙⲁ ⲛ̈ⲁⲗ[ⲁⲗⲉⲓ ⲛⲏ]ⲉⲓ⳾					 ἐµεγάλυνα ποίηµά µου, ᾠκοδόµησά µοι οἴκους, ἐφύτευσά µοι ἀµπελῶνας,	 I enlarged my work; I built me houses; I planted me vineyards.	 ⲁⲓ̈ϫⲓ̈ⲥⲉ ⲙ̅ⲡⲉⲛⲧⲁⲓ̈ⲧⲁⲙⲓ̈ⲟϥ ⲛⲁⲓ̈ ⲁⲓ̈ⲕⲱⲧ ⲛⲁⲓ̈ ⲛ̅ϩⲉⲛⲏⲓ̈ ⲁⲓ̈ⲧⲱϭⲉ ⲛⲁⲓ̈ ⲛ̅ϩⲉⲛⲙⲁ ⲛ̅ⲉⲗⲟⲟⲗⲉ
Ecclesiastes	2	5	 		 ⲁⲉⲓⲧⲁⲙⲓⲁ ⲛⲏⲓ̈ ⲛ̈ⲛⲉⲛϣⲛⲏ⳾ ⲙ̈ⲙⲉⲛ ⲉⲛⲡⲁⲣⲁⲇⲓⲥⲟⲥ[⳾ ⲁ]ⲉⲓⲧⲁϫ ϣϣⲉⲛ ⲛⲓⲙⲉⲓ ⲉ[ⲧ] ⲛ̈ϩⲏⲧⲟⲩ ⲛ̈ϥⲁⲉⲓ ⲟⲩⲧⲉϩ⳾					 ἐποίησά µοι κήπους καὶ παραδείσους καὶ ἐφύτευσα ἐν αὐτοῖς ξύλον πᾶν καρποῦ·	 I made me gardens and orchards, and planted in them every kind of fruit-tree.	 ⲁⲓ̈ⲧⲁⲙⲓ̈ⲟ ⲛⲁⲓ̈ ⲛ̅ϩⲉⲛⲕⲏⲡⲟⲥ ⲙⲛ̅ ϩⲉⲛⲡⲁⲣⲁⲇⲓⲥⲟⲥ ⲁⲩⲱ ⲁⲓ̈ⲧⲱϭⲉ ⲛⲁⲓ̈ ⲛ̅ϩⲏⲧⲟⲩ ⲛ̅ϣⲏⲛ ⲛⲓ̈ⲙ ⲛ̅ⲣⲉϥϯⲕⲁⲣⲡⲟⲥ
Ecclesiastes	2	6	 		 ⲁⲉⲓⲗⲓ ⲛ̈ⲛⲉⲛⲥⲁⲙⲓⲧ ⲙ̈ⲙⲁⲟⲩ ⲛⲏⲉⲓ⳾ ϫⲉ ⲁⲓⲉⲓ ⲛⲁⲓⲧⲥⲁ ⲛ̈ⲧⲁϣⲱϣⲓ ⲉⲧⲟⲩⲗⲏⲧ ⲛ̈ϩⲏⲧⲥ⳾					 ἐποίησά µοι κολυµβήθρας ὑδάτων τοῦ ποτίσαι ἀπ’ αὐτῶν δρυµὸν βλαστῶντα ξύλα·	 I made me pools of water, to water from them the timber-bearing wood.	 ⲁⲓ̈ⲧⲁⲙⲓ̈ⲟ ⲛⲁⲓ̈ ⲛ̅ϩⲉⲛⲕⲟⲗⲩⲙⲃⲏⲑⲣⲁ ⲙ̅ⲙⲟⲟⲩ ⲉⲧⲥⲟ ⲉⲃⲟⲗ ⲙ̅ⲡⲁⲙⲁ ⲛ̅ϣⲏⲛ ⲉⲧϯⲟⲩⲱ
Ecclesiastes	2	7	 		 ⲁⲉⲓⲕⲱ ⲛ̈ⲛ̈ϩⲉⲛϩⲉⲗ ⲛ̈ϩⲁ[ⲩⲧ] ⲛⲏⲓ̈⳾ ⲁⲉⲓⲕⲱ ⲛ̈ϩⲉⲛϩⲉⲗ⳾ ⲛ̈ⲥϩⲓⲙⲓ ⲉⲛⲙⲁⲥ [[ϩ]]ⲛ̈ⲛⲏⲓ̈ ⲁⲩϣⲱⲡⲓ ⲛⲏⲉⲓ⳾ ⲁⲉⲓⲕⲱ ⲛⲏⲉⲓ ⲛ̈ϩⲉⲛⲁϩ[ⲁ]ⲟⲩ ⲉⲛⲁϩⲱⲟⲩ ⲙⲉⲛ ϩⲉⲛⲉⲥⲁⲟⲩ ⲉⲛⲁϣⲱⲟⲩ[⳾] ⲉϩⲟⲩⲁⲥⲧ ⲉⲛⲁⲓⲧⲁⲩϩⲱⲡ[ⲓ] ϩⲁ ⲧⲁϩⲏ ⲛ̈ϩ̅ⲓ̅ⲙ̅					 ἐκτησάµην δούλους καὶ παιδίσκας, καὶ οἰκογενεῖς ἐγένοντό µοι, καί γε κτῆσις βουκολίου καὶ ποιµνίου πολλὴ ἐγένετό µοι ὑπὲρ πάντας τοὺς γενοµένους ἔµπροσθέν µου ἐν Ιερουσαληµ·	 I got servants and maidens, and servants were born to me in the house: also I had abundant possession of flocks and herds, beyond all who were before me in Jerusalem.	 ⲁⲓ̈ⲕⲱ ⲛⲁⲓ̈ ⲛ̅ϩⲉⲛϩⲙ̅ϩⲁⲗ ⲛ̅ϩⲟⲟⲩⲧ ⲙⲛ̅ ϩⲉⲛϩⲙ̅ϩⲁⲗ ⲛ̅ⲥϩⲓ̈ⲙⲉ ⲁⲩⲱ ϩⲉⲛⲕⲉⲙⲉⲥ ϩⲛ̅ ⲏⲓ̈ ⲁⲩϣⲱⲡⲉ ⲛⲁⲓ̈ ⲁⲩⲱ ⲟⲩⲛⲟϭ ⲛⲁϣⲏ ⲛ̅ⲉϩⲉ ϩⲓ ⲉⲥⲟⲟⲩ ⲁⲥϣⲱⲡⲉ ⲛⲁⲓ̈ ⲉϩⲟⲩⲉ ⲛⲉⲛⲧⲁⲩϣⲱⲡⲉ ⲧⲏⲣⲟⲩ ϩⲁ ⲧⲁϩⲓ̈ⲏ ϩⲛ̅ ⲑⲓⲉⲗ̅ⲏ̅ⲙ̅
Ecclesiastes	2	8	 		 ⲁⲉⲓⲧⲁⲩϯ ⲛⲏⲉⲓ ⲛ̈ⲛⲉⲛϩⲉⲧ ⲙ̈ⲙⲉⲛ ϩⲉⲛⲛⲟⲩⲃ⳾ ⲁϩ ⲟ[ⲩⲙⲉⲧⲗⲓⲙ]ⲙⲁⲁ⳾ ⲛ̈ⲧⲉ ϩⲉⲛⲓ̈ⲣⲣⲱⲟⲩ ⲙ̈ⲙⲉⲛ ϩⲉⲛⲭⲱⲣⲁ⳾ ⲁⲉⲓⲧⲁⲙⲓⲁ ⲛ̈[ⲛⲉⲧⲛⲉϫⲱ] ⲉⲗⲁⲉⲓ⳾ ⲛ̈ϩⲁⲟⲩⲧ ⲁϩⲁ ⲛ̈ϩⲓⲁⲙⲓ⳾ ⲛ̈ⲛⲟⲩⲧⲣⲩⲫⲩ ⲙ̈ⲙⲉ[ⲛ ⲛ̈ϣⲏⲗⲓ ⲛ̈]ⲛ̈ⲗⲱⲙⲓ[⳾ ϩ]ⲉⲛⲗⲉϥⲟⲩⲱϩⲑ ⲛ̈ϩⲁⲟⲩⲧ [ⲙⲉⲛ] ϩⲉⲛⲗⲉϥⲟ[ⲩⲱϩⲑ (..)...] ⲛ̈ϩⲓⲁⲙ[ⲓ⳾]					 συνήγαγόν µοι καί γε ἀργύριον καὶ χρυσίον καὶ περιουσιασµοὺς βασιλέων καὶ τῶν χωρῶν· ἐποίησά µοι ᾄδοντας καὶ ᾀδούσας καὶ ἐντρυφήµατα υἱῶν τοῦ ἀνθρώπου οἰνοχόον καὶ οἰνοχόας·	 Moreover I collected for myself both silver and gold also, and the peculiar treasures of kings and provinces: I procured me singing men and singing women, and delights of the sons of men, a butler and female cupbearers.	 ⲁⲓ̈ⲥⲱⲟⲩϩ ⲛⲁⲓ̈ ⲉϩⲟⲩⲛ ⲛ̅ⲟⲩϩⲁⲧ ⲙⲛ̅ ⲟⲩⲛⲟⲩⲃ ⲁⲩⲱ ⲛ̅ϣⲟⲩϣⲟⲩ ⲛ̅ⲛⲉⲣⲱⲟⲩ ⲙⲛ̅ ⲛⲉⲭⲱⲣⲁ ⲁⲓ̈ⲕⲱ ⲛⲁⲓ̈ ⲛ̅ϩⲉⲛϩⲟⲟⲩⲧ ⲙⲛ̅ ϩⲉⲛϩⲓ̈ⲟⲟⲙⲉ ⲉⲩⲛⲁϫⲱ ⲉⲣⲟⲓ̈ ϩⲛ̅ ⲟⲩⲧⲣⲩⲫⲏ ⲙⲛ̅ ⲛ̅ϣⲏⲣⲉ ⲛ̅ⲛ̅ⲣⲱⲙⲉ ⲁⲩⲱ ϩⲉⲛⲣⲉϥⲟⲩⲱⲧϩ̅ ⲛ̅ϩⲟⲟⲩⲧ ⲙⲛ̅ ϩⲉⲛⲣⲉϥⲟⲩⲱⲧϩ̅ ⲛ̅ⲥϩⲓ̈ⲙⲉ
Ecclesiastes	2	9	 		 ⲁϩ ⲁⲉⲓⲟ[ⲩ]ⲱϩ ⲉⲧⲁⲧ ⲁⲉ[ⲓ ⲧⲉⲥ]ⲁϣⲉⲓ ⲉϩⲟⲩⲁⲥ[ⲧ ⲉⲛⲉⲧⲁⲩϣⲱⲡⲓ] ⲧⲏⲗⲟⲩ ϩⲁ ⲧⲁϩⲏ ⲛ̈ϩ̅ⲓ̅ⲉ̅ⲙ̅[⳾ ⲁ ⲧⲁ]ⲥⲟⲫⲓⲁ ⲁⲥϫⲱ ⲛ[ⲏⲉⲓ⳾]					 καὶ ἐµεγαλύνθην καὶ προσέθηκα παρὰ πάντας τοὺς γενοµένους ἔµπροσθέν µου ἐν Ιερουσαληµ· καί γε σοφία µου ἐστάθη µοι.	 So I became great, and advanced beyond all that were before in Jerusalem: also my wisdom was established to me.	 ⲁⲩⲱ ⲁⲓ̈ϫⲓ̈ⲥⲉ ⲁⲓ̈ⲟⲩⲱϩ ⲉⲧⲟⲟⲧ ⲡⲁⲣⲁ ⲛⲉⲛⲧⲁⲩϣⲱⲡⲉ ϩⲁ ⲧⲁϩⲓ̈ⲏ ⲧⲏⲣⲟⲩ ϩⲛ̅ ⲑⲓⲉⲗ̅ⲏ̅ⲙ̅ ⲁⲩⲱ ⲁ ⲧⲁⲥⲟⲫⲓⲁ ⲁϩⲉⲣⲁⲧⲥ̅ ⲛⲁⲓ̈
