book	chapter	verse	Bohairic	Akhmimic	Fayyumic	OldBohairic	Mesokemic	DialectP	Lycopolitan	Greek	English	Sahidic
Genesis	27	32	 ⲟⲩⲟϩ ⲡⲉϫⲉ ⲓⲥⲁⲁⲕ ⲡⲉϥⲓⲱⲧ ⲛⲁϥ ϫⲉ ⲛ̀ⲑⲟⲕ ⲛⲓⲙ ⲛ̀ⲑⲟⲕ ⲛ̀ⲑⲟϥ ⲇⲉ ⲡⲉϫⲁϥ ϫⲉ ⲁ̀ⲛⲟⲕ ⲡⲉ ⲡⲉⲕϣⲏⲣⲓ ⲡⲉⲕϣⲟⲣⲡ ⲙ̀ⲙⲓⲥⲓ ⲏⲥⲁⲩ							 καὶ εἶπεν αὐτῷ Ισαακ ὁ πατὴρ αὐτοῦ Τίς εἶ σύ; ὁ δὲ εἶπεν ᾿Εγώ εἰμι ὁ υἱός σου ὁ πρωτότοκος Ησαυ.	 And Isaac his father said to him, Who art thou? And he said, I am thy first-born son Esau.	
Genesis	27	33	 ⲁϥⲧⲱⲙⲧ ⲇⲉ ⲛ̀ϫⲉ ⲓⲥⲁⲁⲕ ϧⲉⲛ ⲟⲩⲛⲓϣϯ ⲛ̀ⲧⲱⲙⲧ ⲉ̀ⲙⲁϣⲱ ⲟⲩⲟϩ ⲡⲉϫⲁϥ ϫⲉ ⲛⲓⲙ ⲟⲩⲛ ⲁϥϫⲉⲣϫ ⲟⲩϫⲟⲣϫⲥ ⲛⲏⲓ ⲟⲩⲟϩ ⲁϥⲉⲛⲥ ⲛⲏⲓ ⲉ̀ϧⲟⲩⲛ ⲟⲩⲟϩ ⲁⲓⲟⲩⲱⲙ ⲉ̀ⲃⲟⲗ ⲛ̀ϧⲏⲧⲟⲩ ⲧⲏⲣⲟⲩ ⲙ̀ⲡⲁⲧⲉⲕⲓ̀ ⲟⲩⲟϩ ⲁⲓⲥⲙⲟⲩ ⲉ̀ⲣⲟϥ ⲟⲩⲟϩ ⲉϥⲉ̀ϣⲱⲡⲓ ⲉϥⲥⲙⲁⲙⲁⲧ							 ἐξέστη δὲ Ισαακ ἔκστασιν μεγάλην σφόδρα καὶ εἶπεν Τίς οὖν ὁ θηρεύσας μοι θήραν καὶ εἰσενέγκας μοι; καὶ ἔφαγον ἀπὸ πάντων πρὸ τοῦ σε ἐλθεῖν καὶ ηὐλόγησα αὐτόν, καὶ εὐλογημένος ἔστω.	 And Isaac was amazed with very great amazement, and said, Who then is it that has procured venison for me and brought it to me? and I have eaten of all before thou camest, and I have blessed him; and he shall be blessed.	
Genesis	27	34	 ⲁⲥϣⲱⲡⲓ ⲇⲉ ⲉⲧⲁϥⲥⲱⲧⲉⲙ ⲛ̀ϫⲉ ⲏⲥⲁⲩ ⲉ̀ⲛⲓⲥⲁϫⲓ ⲛ̀ⲧⲉ ⲓⲥⲁⲁⲕ ⲡⲉϥⲓⲱⲧ ⲁϥⲱϣ ⲉ̀ⲃⲟⲗ ϧⲉⲛ ⲟⲩⲛⲓϣϯ ⲛ̀ⲥⲙⲏ ⲟⲩⲟϩ ⲉⲥⲛ̀ϣⲁϣⲓ ⲉ̀ⲙⲁϣⲱ ⲟⲩⲟϩ ⲡⲉϫⲁϥ ⲙ̀ⲡⲉϥⲓⲱⲧ ϫⲉ ⲥⲙⲟⲩ ⲉ̀ⲣⲟⲓ ϩⲱ ⲡⲁⲓⲱⲧ							 ἐγένετο δὲ ἡνίκα ἤκουσεν Ησαυ τὰ ῥήματα Ισαακ τοῦ πατρὸς αὐτοῦ, ἀνεβόησεν φωνὴν μεγάλην καὶ πικρὰν σφόδρα καὶ εἶπεν Εὐλόγησον δὴ κἀμέ, πάτερ.	 And it came to pass when Esau heard the words of his father Isaac, he cried out with a great and very bitter cry, and said, Bless, I pray thee, me also, father.	
Genesis	27	35	 ⲡⲉϫⲁϥ ⲇⲉ ⲛⲁϥ ϫⲉ ⲁϥⲓ̀ ⲛ̀ϫⲉ ⲡⲉⲕⲥⲟⲛ ϧⲉⲛ ⲟⲩⲭⲣⲟϥ ⲁϥⲱⲗⲓ ⲙ̀ⲡⲉⲕⲥⲙⲟⲩ							 εἶπεν δὲ αὐτῷ ᾿Ελθὼν ὁ ἀδελφός σου μετὰ δόλου ἔλαβεν τὴν εὐλογίαν σου.	 And he said to him, Thy brother has come with subtlety, and taken thy blessing.	
Genesis	27	36	 ⲟⲩⲟϩ ⲡⲉϫⲉ ⲏⲥⲁⲩ ϫⲉ ϧⲉⲛ ⲟⲩⲙⲉⲑⲙⲏⲓ ⲁⲩϯⲣⲉⲛϥ ϫⲉ ⲓⲁⲕⲱⲃ ⲁϥϭⲓⲑⲓⲃⲥ ⲅⲁⲣ ⲙ̀ⲙⲟⲓ ⲫⲁⲓ ⲫⲙⲁϩⲥⲟⲡⲃ̅ ⲡⲉ ⲛⲁⲙⲉⲧϣⲟⲣⲡ ⲙ̀ⲙⲓⲥⲓ ⲁϥⲟⲗⲟⲩ ⲟⲩⲟϩ ϯⲛⲟⲩ ⲓⲥ ⲡⲁⲕⲉⲥⲙⲟⲩ ⲁϥϭⲓⲧϥ ⲡⲉϫⲉ ⲏⲥⲁⲩ ⲇⲉ ⲙ̀ⲡⲉϥⲓⲱⲧ ϫⲉ ⲙ̀ⲡⲉⲕⲥⲉϫⲡ ⲟⲩⲥⲙⲟⲩ ⲛⲏⲓ ⲣⲱ ⲁ̀ⲛⲟⲕ ⲡⲁⲓⲱⲧ							 καὶ εἶπεν Δικαίως ἐκλήθη τὸ ὄνομα αὐτοῦ Ιακωβ· ἐπτέρνικεν γάρ με ἤδη δεύτερον τοῦτο· τά τε πρωτοτόκιά μου εἴληφεν καὶ νῦν εἴληφεν τὴν εὐλογίαν μου. καὶ εἶπεν Ησαυ τῷ πατρὶ αὐτοῦ Οὐχ ὑπελίπω μοι εὐλογίαν, πάτερ;	 And he said, Rightly was his name called Jacob, for lo! this second time has he supplanted me; he has both taken my birthright, and now he has taken my blessing; and Esau said to his father, Hast thou not left a blessing for me, father?	
Genesis	27	37	 ⲁϥⲉⲣⲟⲩⲱ ⲇⲉ ⲛ̀ϫⲉ ⲓⲥⲁⲁⲕ ⲡⲉϫⲁϥ ⲛ̀ⲏⲥⲁⲩ ϫⲉ ⲓⲥ ϫⲉ ⲁⲓⲁⲓϥ ⲛ̀ϭ̅ⲥ̅ ⲉ̀ⲣⲟⲕ ⲟⲩⲟϩ ⲛⲉϥⲥⲛⲏⲟⲩ ⲧⲏⲣⲟⲩ ⲁⲓⲁⲓⲧⲟⲩ ⲙ̀ⲃⲱⲕ ⲛⲁϥ ⲁⲓⲧⲁϫⲣⲟϥ ϧⲉⲛ ⲡⲥⲟⲩⲟ ⲛⲉⲙ ⲡⲏⲣⲡ ⲛ̀ⲑⲟⲕ ⲇⲉ ⲟⲩ ⲡⲉ ⲉ̀ϯⲛⲁⲁⲓϥ ⲛⲁⲕ ⲡⲁϣⲏⲣⲓ							 ἀποκριθεὶς δὲ Ισαακ εἶπεν τῷ Ησαυ Εἰ κύριον αὐτὸν ἐποίησά σου καὶ πάντας τοὺς ἀδελφοὺς αὐτοῦ ἐποίησα αὐτοῦ οἰκέτας, σίτῳ καὶ οἴνῳ ἐστήρισα αὐτόν, σοὶ δὲ τί ποιήσω, τέκνον;	 And Isaac answered and said to Esau, If I have made him thy lord, and have made all his brethren his servants, and have strengthened him with corn and wine, what then shall I do for thee, Son?	
Genesis	27	38	 ⲡⲉϫⲉ ⲏⲥⲁⲩ ⲇⲉ ⲙ̀ⲡⲉϥⲓⲱⲧ ϫⲉ ⲟⲩⲥⲙⲟⲩ ⲙ̀ⲙⲁⲩⲁⲧϥ ⲉⲧⲉ̀ⲛ̀ⲧⲁⲕ ⲡⲁⲓⲱⲧ ⲥⲙⲟⲩ ⲉ̀ⲣⲟⲓ ϩⲱ ⲡⲁⲓⲱⲧ ⲟⲩⲟϩ ⲉⲧⲁϥⲉⲣⲙⲕⲁϩ ⲛ̀ϩⲏⲧ ⲛ̀ϫⲉ ⲓⲥⲁⲁⲕ ⲟⲩⲟϩ ⲁϥⲱϣ ⲉ̀ⲃⲟⲗ ϧⲉⲛ ⲟⲩⲛⲓϣϯ ⲛ̀ⲥⲙⲏ ⲛ̀ϫⲉ ⲏⲥⲁⲩ ⲟⲩⲟϩ ⲁϥⲣⲓⲙⲓ							 εἶπεν δὲ Ησαυ πρὸς τὸν πατέρα αὐτοῦ Μὴ εὐλογία μία σοί ἐστιν, πάτερ; εὐλόγησον δὴ κἀμέ, πάτερ. κατανυχθέντος δὲ Ισαακ ἀνεβόησεν φωνὴν Ησαυ καὶ ἔκλαυσεν.	 And Esau said to his father, Hast thou only one blessing, father? Bless, I pray thee, me also, father. And Isaac being troubled, Esau cried aloud and wept.	
Genesis	27	39	 ⲁϥⲉⲣⲟⲩⲱ ⲇⲉ ⲛ̀ϫⲉ ⲓⲥⲁⲁⲕ ⲡⲉϫⲁϥ ⲛⲁϥ ϫⲉ ϩⲏⲡⲡⲉ ⲉ̀ⲃⲟⲗ ϧⲉⲛ ⲡⲓⲕⲉⲛⲓ ⲛ̀ⲧⲉ ⲡⲕⲁϩⲓ ⲉϥⲉ̀ϣⲱⲡⲓ ⲛ̀ϫⲉ ⲡⲉⲕⲙⲁⲛ̀ϣⲱⲡⲓ ⲛⲉⲙ ⲉ̀ⲃⲟⲗ ϧⲉⲛ ϯⲓⲱϯ ⲛ̀ⲧⲉ ⲧⲫⲉ ⲙ̀ⲡϣⲱⲓ							 ἀποκριθεὶς δὲ Ισαακ ὁ πατὴρ αὐτοῦ εἶπεν αὐτῷ ᾿Ιδοὺ ἀπὸ τῆς πιότητος τῆς γῆς ἔσται ἡ κατοίκησίς σου καὶ ἀπὸ τῆς δρόσου τοῦ οὐρανοῦ ἄνωθεν·	 And Isaac his father answered and said to him, Behold, thy dwelling shall be of the fatness of the earth, and of the dew of heaven from above.	
Genesis	27	40	 ⲟⲩⲟϩ ⲉⲕⲉ̀ⲱⲛϧ ⲉ̀ⲧⲉⲕⲥⲏϥⲓ ⲟⲩⲟϩ ⲉⲕⲉ̀ⲉⲣⲃⲱⲕ ⲙ̀ⲡⲉⲕⲥⲟⲛ ⲉⲥⲉ̀ϣⲱⲡⲓ ⲇⲉ ϩⲟⲧⲁⲛ ⲁⲕϣⲁⲛⲟⲩⲟϩ ⲛⲁⲕ ⲉⲕⲉ̀ⲃⲉⲗ ⲡⲉϥⲛⲁϩⲃⲉϥ ⲉ̀ⲃⲟⲗ ϩⲓ ⲛⲉⲕⲙⲟϯ							 καὶ ἐπὶ τῇ μαχαίρῃ σου ζήσῃ καὶ τῷ ἀδελφῷ σου δουλεύσεις· ἔσται δὲ ἡνίκα ἐὰν καθέλῃς, καὶ ἐκλύσεις τὸν ζυγὸν αὐτοῦ ἀπὸ τοῦ τραχήλου σου.	 And thou shalt live by thy sword, and shalt serve thy brother; and there shall be a time when thou shalt break and loosen his yoke from off thy neck.	
Genesis	27	41	 ⲟⲩⲟϩ ⲛⲁⲣⲉ ⲏⲥⲁⲩ ⲙ̀ⲃⲟⲛ ⲉ̀ⲓⲁⲕⲱⲃ ⲉⲑⲃⲉ ⲡⲓⲥⲙⲟⲩ ⲉⲧⲁ ⲡⲉϥⲓⲱⲧ ⲥⲙⲟⲩ ⲉ̀ⲣⲟϥ ⲙ̀ⲙⲟϥ ⲡⲉϫⲉ ⲏⲥⲁⲩ ⲇⲉ ϧⲉⲛ ⲡⲉϥϩⲏⲧ ϫⲉ ⲙⲁⲣⲟⲩϧⲱⲛⲧ ⲛ̀ϫⲉ ⲛⲓⲉϩⲟⲟⲩ ⲛ̀ⲧⲉ ⲫⲙⲟⲩ ⲙ̀ⲡⲁⲓⲱⲧ ϩⲓⲛⲁ ⲛ̀ⲧⲁϧⲱⲧⲉⲃ ⲛ̀ⲓⲁⲕⲱⲃ ⲡⲁⲥⲟⲛ							 Καὶ ἐνεκότει Ησαυ τῷ Ιακωβ περὶ τῆς εὐλογίας, ἧς εὐλόγησεν αὐτὸν ὁ πατὴρ αὐτοῦ· εἶπεν δὲ Ησαυ ἐν τῇ διανοίᾳ ᾿Εγγισάτωσαν αἱ ἡμέραι τοῦ πένθους τοῦ πατρός μου, ἵνα ἀποκτείνω Ιακωβ τὸν ἀδελφόν μου.	 And Esau was angry with Jacob because of the blessing, with which his father blessed him; and Esau said in his mind, Let the days of my father’s mourning draw nigh, that I may slay my brother Jacob.	
Genesis	27	42	 ⲁⲩⲧⲁⲙⲉ ⲣⲉⲃⲉⲕⲕⲁ ⲇⲉ ⲉ̀ⲛⲓⲥⲁϫⲓ ⲛ̀ⲧⲉ ⲏⲥⲁⲩ ⲡⲉⲥⲛⲓϣϯ ⲛ̀ϣⲏⲣⲓ ⲟⲩⲟϩ ⲁⲥⲟⲩⲱⲣⲡ ⲁⲥⲙⲟⲩϯ ⲉ̀ⲓⲁⲕⲱⲃ ⲡⲉⲥⲕⲟⲩϫⲓ ⲛϣⲏⲣⲓ ⲟⲩⲟϩ ⲡⲉϫⲁⲥ ⲛⲁϥ ϫⲉ ϩⲏⲡⲡⲉ ⲓⲥ ⲏⲥⲁⲩ ⲡⲉⲕⲥⲟⲛ ϥⲉⲙⲃⲟⲛ ⲉ̀ⲣⲟⲕ ⲉ̀ϧⲟⲑⲃⲉⲕ							 ἀπηγγέλη δὲ Ρεβεκκα τὰ ῥήματα Ησαυ τοῦ υἱοῦ αὐτῆς τοῦ πρεσβυτέρου, καὶ πέμψασα ἐκάλεσεν Ιακωβ τὸν υἱὸν αὐτῆς τὸν νεώτερον καὶ εἶπεν αὐτῷ ᾿Ιδοὺ Ησαυ ὁ ἀδελφός σου ἀπειλεῖ σοι τοῦ ἀποκτεῖναί σε·	 And the words of Esau her elder son were reported to Rebecca, and she sent and called Jacob her younger son, and said to him, Behold, Esau thy brother threatens thee to kill thee.	
Genesis	27	43	 ϯⲛⲟⲩ ⲟⲩⲛ ⲡⲁϣⲏⲣⲓ ⲥⲱⲧⲉⲙ ⲛ̀ⲥⲁ ⲧⲁⲥⲙⲏ ⲧⲱⲛⲕ ⲙⲁϣⲉ ⲛⲁⲕ ⲉ̀ϯⲙⲉⲥⲟⲡⲟⲧⲁⲙⲓⲁ ϩⲁ ⲗⲁⲃⲁⲛ ⲡⲁⲥⲟⲛ ⲉ̀ⲭⲁⲣⲣⲁⲛ							 νῦν οὖν, τέκνον, ἄκουσόν μου τῆς φωνῆς καὶ ἀναστὰς ἀπόδραθι εἰς τὴν Μεσοποταμίαν πρὸς Λαβαν τὸν ἀδελφόν μου εἰς Χαρραν	 Now then, my son, hear my voice, and rise and depart quickly into Mesopotamia to Laban my brother into Charran.	
Genesis	27	44	 ⲟⲩⲟϩ ϣⲱⲡⲓ ⲛⲉⲙⲁϥ ⲛ̀ϩⲁⲛⲉϩⲟⲟⲩ							 καὶ οἴκησον μετ᾽ αὐτοῦ ἡμέρας τινὰς ἕως τοῦ ἀποστρέψαι τὸν θυμὸν	 And dwell with him certain days,	
Genesis	27		 ϣⲁⲧⲉ ⲡⲉⲙⲃⲟⲛ ⲛⲉⲙ ⲡϫⲱⲛⲧ ⲙ̀ⲡⲉⲕⲥⲟⲛ ⲕⲟⲧϥ ⲉ̀ⲃⲟⲗ ϩⲁⲣⲟⲕ ⲟⲩⲟϩ ⲛ̀ⲧⲉϥⲉⲣⲡⲱⲃϣ ⲛ̀ⲛⲏ ⲉⲧⲁⲕⲁⲓⲧⲟⲩ ⲛⲁϥ ⲟⲩⲟϩ ⲉⲓⲉ̀ⲧⲁⲟⲩⲟ ⲛ̀ⲥⲱⲕ ⲉ̀ⲃⲟⲗ ⲙ̀ⲙⲁⲩ ⲙⲏⲡⲟⲧⲉ ⲛ̀ⲧⲁⲉⲣⲁⲧϣⲏⲣⲓ ⲉ̀ⲃⲟⲗ ⲙ̀ⲙⲱⲧⲉⲛ ⲙ̀ⲡⲓⲃ̅ ϧⲉⲛ ⲟⲩⲉϩⲟⲟⲩ ⲛ̀ⲟⲩⲱⲧ							 καὶ τὴν ὀργὴν τοῦ ἀδελφοῦ σου ἀπὸ σοῦ καὶ ἐπιλάθηται ἃ πεποίηκας αὐτῷ, καὶ ἀποστείλασα μεταπέμψομαί σε ἐκεῖθεν, μήποτε ἀτεκνωθῶ ἀπὸ τῶν δύο ὑμῶν ἐν ἡμέρᾳ μιᾷ.	until thy brother’s anger (45) and rage depart from thee, and he forget what thou hast done to him; and I will send and fetch thee thence, lest at any time I should be bereaved of you both in one day.	
Genesis	27	46	 ⲡⲉϫⲉ ⲣⲉⲃⲉⲕⲕⲁ ⲇⲉ ⲛ̀ⲓⲥⲁⲁⲕ ϫⲉ ⲁ ⲡⲁϩⲏⲧ ϩⲣⲟϣ ⲉ̀ⲡⲁⲱⲛϧ ⲉⲑⲃⲉ ⲛⲓϣⲉⲣⲓ ⲛ̀ⲧⲉ ⲛⲉⲛϧⲣⲟϯ ⲛ̀ⲭⲉⲧ ⲓⲥϫⲉ ⲁⲣⲉ ⲓⲁⲕⲱⲃ ⲛⲁϭⲓⲥϩⲓⲙⲓ ⲛⲁϥ ⲉ̀ⲃⲟⲗ ϧⲉⲛ ⲛⲓϣⲉⲣⲓ ⲛ̀ⲧⲉ ⲡⲁⲓⲕⲁϩⲓ ⲉⲣⲟⲩ ⲛⲏⲓ ⲙ̀ⲡⲁⲱⲛϧ							 Εἶπεν δὲ Ρεβεκκα πρὸς Ισαακ Προσώχθικα τῇ ζωῇ μου διὰ τὰς θυγατέρας τῶν υἱῶν Χετ· εἰ λήμψεται Ιακωβ γυναῖκα ἀπὸ τῶν θυγατέρων τῆς γῆς ταύτης, ἵνα τί μοι ζῆν;	 And Rebecca said to Isaac, I am weary of my life, because of the daughters of the sons of Chet; if Jacob shall take a wife of the daughters of this land, wherefore should I live?	
Genesis	28	1	 ⲁϥⲙⲟⲩϯ ⲇⲉ ⲛ̀ϫⲉ ⲓⲥⲁⲁⲕ ⲉⲓⲁⲕⲱⲃ ⲁϥⲥⲙⲟⲩ ⲉ̀ⲣⲟϥ ⲟⲩⲟϩ ⲁϥϩⲟⲛϩⲉⲛ ⲛⲁϥ ⲉϥϫⲱ ⲙ̀ⲙⲟⲥ ϫⲉ ⲛ̀ⲛⲉⲕϭⲓⲥϩⲓⲙⲓ ⲛⲁⲕ ⲉ̀ⲃⲟⲗ ϧⲉⲛ ⲛⲓϣⲉⲣⲓ ⲛ̀ⲧⲉ ⲛⲓⲭⲁⲛⲁⲛⲉⲟⲥ							 προσκαλεσάμενος δὲ Ισαακ τὸν Ιακωβ εὐλόγησεν αὐτὸν καὶ ἐνετείλατο αὐτῷ λέγων Οὐ λήμψῃ γυναῖκα ἐκ τῶν θυγατέρων Χανααν·	 And Isaac having called for Jacob, blessed him, and charged him, saying, Thou shalt not take a wife of the daughters of the Chananites.	
Genesis	28	2	 ⲧⲱⲛⲕ ⲙⲁϣⲉ ⲛⲁⲕ ⲉ̀ϧⲣⲏⲓ ⲉ̀ϯⲙⲉⲥⲟⲡⲟⲧⲁⲙⲓⲁ ⲉ̀ϧⲟⲩⲛ ⲉⲡⲏⲓ ⲙ̀ⲃⲁⲑⲟⲩⲏⲗ ⲫⲓⲱⲧ ⲛ̀ⲧⲉⲕⲙⲁⲩ ⲟⲩⲟϩ ⲉⲕⲉ̀ϭⲓ ⲛ̀ⲟⲩⲥϩⲓⲙⲓ ⲛⲁⲕ ⲉ̀ⲃⲟⲗ ⲙ̀ⲙⲁⲩ ⲉ̀ⲃⲟⲗ ϧⲉⲛ ⲛⲓϣⲉⲣⲓ ⲛ̀ⲧⲉ ⲗⲁⲃⲁⲛ ⲡⲥⲟⲛ ⲛ̀ⲧⲉⲕⲙⲁⲩ							 ἀναστὰς ἀπόδραθι εἰς τὴν Μεσοποταμίαν εἰς τὸν οἶκον Βαθουηλ τοῦ πατρὸς τῆς μητρός σου καὶ λαβὲ σεαυτῷ ἐκεῖθεν γυναῖκα ἐκ τῶν θυγατέρων Λαβαν τοῦ ἀδελφοῦ τῆς μητρός σου.	 Rise and depart quickly into Mesopotamia, to the house of Bathuel the father of thy mother, and take to thyself thence a wife of the daughters of Laban thy mother’s brother.	
Genesis	28	3	 ⲡⲁⲛⲟⲩϯ ⲇⲉ ⲉϥⲉ̀ⲥⲙⲟⲩ ⲉ̀ⲣⲟⲕ ⲟⲩⲟϩ ⲉϥⲉ̀ⲑⲣⲉⲕⲁϣⲁⲓ ⲟⲩⲟϩ ⲉⲕⲉ̀ϣⲱⲡⲓ ⲉ̀ϩⲁⲛⲑⲱⲟⲩⲧⲥ ⲛ̀ⲉⲑⲛⲟⲥ							 ὁ δὲ θεός μου εὐλογήσαι σε καὶ αὐξήσαι σε καὶ πληθύναι σε, καὶ ἔσῃ εἰς συναγωγὰς ἐθνῶν·	 And may my God bless thee, and increase thee, and multiply thee, and thou shalt become gatherings of nations.	
Genesis	28	4	 ⲟⲩⲟϩ ⲉϥⲉ̀ϯ ⲛⲁⲕ ⲙ̀ⲡⲥⲙⲟⲩ ⲛ̀ⲁⲃⲣⲁⲁⲙ ⲡⲁⲓⲱⲧ ⲛⲉⲙ ⲡⲉⲕϫⲣⲟϫ ⲙⲉⲛⲉⲛⲥⲱⲕ ⲉ̀ⲉⲣⲕⲗⲏⲣⲟⲛⲟⲙⲓⲛ ⲙ̀ⲡⲓⲕⲁϩⲓ ⲛ̀ⲧⲉ ⲡⲉⲕⲙⲁⲛ̀ϫⲱⲓⲗⲓ ⲫⲏ ⲉⲧⲁ ⲫϯ ⲧⲏⲓϥ ⲛ̀ⲁⲃⲣⲁⲁⲙ							 καὶ δῴη σοι τὴν εὐλογίαν Αβρααμ τοῦ πατρός μου, σοὶ καὶ τῷ σπέρματί σου μετὰ σέ, κληρονομῆσαι τὴν γῆν τῆς παροικήσεώς σου, ἣν ἔδωκεν ὁ θεὸς τῷ Αβρααμ.	 And may he give thee the blessing of my father Abraam, even to thee and to thy seed after thee, to inherit the land of thy sojourning, which God gave to Abraam.	
Genesis	28	5	 ⲟⲩⲟϩ ⲁ ⲓⲥⲁⲁⲕ ⲟⲩⲱⲣⲡ ⲛ̀ⲓⲁⲕⲱⲃ ⲟⲩⲟϩ ⲁϥϣⲉ ⲛⲁϥ ⲉ̀ϯⲙⲉⲥⲟⲡⲟⲧⲁⲙⲓⲁ ⲛ̀ⲧⲉ ϯⲥⲩⲣⲓⲁ ϩⲁ ⲗⲁⲃⲁⲛ ⲡϣⲏⲣⲓ ⲙ̀ⲃⲁⲑⲟⲩⲏⲗ ⲡⲓⲥⲩⲣⲟⲥ ⲡⲥⲟⲛ ⲇⲉ ⲛ̀ⲣⲉⲃⲉⲕⲕⲁ ⲑⲙⲁⲩ ⲛ̀ⲓⲁⲕⲱⲃ ⲛⲉⲙ ⲏⲥⲁⲩ							 καὶ ἀπέστειλεν Ισαακ τὸν Ιακωβ, καὶ ἐπορεύθη εἰς τὴν Μεσοποταμίαν πρὸς Λαβαν τὸν υἱὸν Βαθουηλ τοῦ Σύρου ἀδελφὸν δὲ Ρεβεκκας τῆς μητρὸς Ιακωβ καὶ Ησαυ.	 So Isaac sent away Jacob, and he went into Mesopotamia to Laban the son of Bethuel the Syrian, the brother of Rebecca the mother of Jacob and Esau.	
Genesis	28	6	 ⲉⲧⲁϥⲛⲁⲩ ⲇⲉ ⲛ̀ϫⲉ ⲏⲥⲁⲩ ϫⲉ ⲁ ⲓⲥⲁⲁⲕ ⲥⲙⲟⲩ ⲉ̀ⲓⲁⲕⲱⲃ ⲟⲩⲟϩ ϫⲉ ⲁϥϣⲉ ⲛⲁϥ ⲉ̀ϯⲙⲉⲥⲟⲡⲟⲧⲁⲙⲓⲁ ⲛ̀ⲧⲉ ϯⲥⲩⲣⲓⲁ ⲉ̀ϭⲓ ⲟⲩⲥϩⲓⲙⲓ ⲛⲁϥ ⲉ̀ⲃⲟⲗ ⲙ̀ⲙⲁⲩ ϧⲉⲛ ⲡϫⲓⲛⲑⲣⲉϥⲥⲙⲟⲩ ⲉ̀ⲣⲟϥ ⲟⲩⲟϩ ⲁϥϩⲟⲛϩⲉⲛ ⲛⲁϥ ⲉϥϫⲱ ⲙ̀ⲙⲟⲥ ϫⲉ ⲛ̀ⲛⲉⲕϭⲓⲥϩⲓⲙⲓ ⲛⲁⲕ ⲉ̀ⲃⲟⲗ ϧⲉⲛ ⲛⲓϣⲉⲣⲓ ⲛ̀ⲧⲉ ⲭⲁⲛⲁⲁⲛ							 Εἶδεν δὲ Ησαυ ὅτι εὐλόγησεν Ισαακ τὸν Ιακωβ καὶ ἀπῴχετο εἰς τὴν Μεσοποταμίαν Συρίας λαβεῖν ἑαυτῷ ἐκεῖθεν γυναῖκα ἐν τῷ εὐλογεῖν αὐτὸν καὶ ἐνετείλατο αὐτῷ λέγων Οὐ λήμψῃ γυναῖκα ἀπὸ τῶν θυγατέρων Χανααν,	 And Esau saw that Isaac blessed Jacob, and sent him away to Mesopotamia of Syria as he blessed him, to take to himself a wife thence, and that he charged him, saying, Thou shalt not take a wife of the daughters of the Chananites;	
Genesis	28	7	 ⲟⲩⲟϩ ⲁϥⲥⲱⲧⲉⲙ ⲛ̀ϫⲉ ⲓⲁⲕⲱⲃ ⲛ̀ⲥⲁ ⲡⲉϥⲓⲱⲧ ⲛⲉⲙ ⲧⲉϥⲙⲁⲩ ⲟⲩⲟϩ ⲁϥϣⲉ ⲛⲁϥ ⲉ̀ϯⲙⲉⲥⲟⲡⲟⲧⲁⲙⲓⲁ							 καὶ ἤκουσεν Ιακωβ τοῦ πατρὸς καὶ τῆς μητρὸς αὐτοῦ καὶ ἐπορεύθη εἰς τὴν Μεσοποταμίαν Συρίας,	 and that Jacob hearkened to his father and his mother, and went to Mesopotamia of Syria.	
Genesis	28	8	 ⲟⲩⲟϩ ⲁϥⲛⲁⲩ ⲛ̀ϫⲉ ⲏⲥⲁⲩ ϫⲉ ⲥⲉϩⲱⲟⲩ ⲛ̀ϫⲉ ⲛⲓϣⲉⲣⲓ ⲛ̀ⲧⲉ ⲭⲁⲛⲁⲁⲛ ⲙ̀ⲡⲉⲙⲑⲟ ⲛ̀ⲓⲥⲁⲁⲕ ⲡⲉϥⲓⲱⲧ							 καὶ εἶδεν Ησαυ ὅτι πονηραί εἰσιν αἱ θυγατέρες Χανααν ἐναντίον Ισαακ τοῦ πατρὸς αὐτοῦ,	 And Esau also having seen that the daughters of Chanaan were evil before his father Isaac,	
Genesis	28	9	 ⲁϥϣⲉ ⲛⲁϥ ⲛ̀ϫⲉ ⲏⲥⲁⲩ ϩⲁ ⲓⲥⲙⲁⲏⲗ ⲟⲩⲟϩ ⲁϥϭⲓ ⲙ̀ⲙⲁⲉⲗⲉⲑ ⲧϣⲉⲣⲓ ⲛ̀ⲓⲥⲙⲁⲏⲗ ⲡϣⲏⲣⲓ ⲛ̀ⲁⲃⲣⲁⲁⲙ ⲧⲥⲱⲛⲓ ⲛ̀ⲛⲁⲃⲉⲱⲑ ϩⲁ ⲛⲉϥϩⲓⲟⲙⲓ ⲉⲩⲥϩⲓⲙⲓ ⲛⲁϥ							 καὶ ἐπορεύθη Ησαυ πρὸς Ισμαηλ καὶ ἔλαβεν τὴν Μαελεθ θυγατέρα Ισμαηλ τοῦ υἱοῦ Αβρααμ ἀδελφὴν Ναβαιωθ πρὸς ταῖς γυναιξὶν αὐτοῦ γυναῖκα.	 Esau went to Ismael, and took Maeleth the daughter of Ismael, the son of Abraam, the sister of Nabeoth, a wife in addition to his other wives.	
Genesis	28	10	 ⲁϥⲓ̀ ⲇⲉ ⲉ̀ⲃⲟⲗ ⲛ̀ϫⲉ ⲓⲁⲕⲱⲃ ⲉ̀ϫⲉⲛ ⲧϣⲱϯ ⲙ̀ⲡⲁⲛⲁϣ ⲟⲩⲟϩ ⲁϥϣⲉ ⲛⲁϥ ⲉ̀ϩⲣⲏⲓ ⲉ̀ⲭⲁⲣⲣⲁⲛ							 Καὶ ἐξῆλθεν Ιακωβ ἀπὸ τοῦ φρέατος τοῦ ὅρκου καὶ ἐπορεύθη εἰς Χαρραν.	 And Jacob went forth from the well of the oath, and departed into Charrhan.	
Genesis	28	11	 ⲟⲩⲟϩ ⲁϥⲓ̀ ⲉ̀ⲃⲟⲗ ⲉ̀ϩⲣⲉⲛ ⲟⲩⲙⲁ ⲟⲩⲟϩ ⲁϥⲛ̀ⲕⲟⲧ ⲙ̀ⲙⲁⲩ ⲛⲉ ⲁ ⲫⲣⲏ ⲅⲁⲣ ϩⲱⲧⲡ ⲡⲉ ⲟⲩⲟϩ ⲁϥϭⲓ ⲛ̀ⲟⲩⲱⲛⲓ ⲉ̀ⲃⲟⲗ ϧⲉⲛ ⲛⲓⲱⲛⲓ ⲛ̀ⲧⲉ ⲡⲓⲙⲁ ⲉⲧⲉⲙ̀ⲙⲁⲩ ⲟⲩⲟϩ ⲁϥⲭⲁϥ ϧⲁ ⲧⲉϥⲁⲫⲉ ⲟⲩⲟϩ ⲁϥⲉⲛⲕⲟⲧ ϧⲉⲛ ⲡⲓⲙⲁ ⲉⲧⲉⲙ̀ⲙⲁⲩ							 καὶ ἀπήντησεν τόπῳ καὶ ἐκοιμήθη ἐκεῖ· ἔδυ γὰρ ὁ ἥλιος· καὶ ἔλαβεν ἀπὸ τῶν λίθων τοῦ τόπου καὶ ἔθηκεν πρὸς κεφαλῆς αὐτοῦ καὶ ἐκοιμήθη ἐν τῷ τόπῳ ἐκείνῳ.	 And came to a certain place and slept there, for the sun had gone down; and he took one of the stones of the place, and put it at his head, and lay down to sleep in that place,	
Genesis	28	12	 ⲟⲩⲟϩ ⲁϥⲛⲁⲩ ⲉ̀ⲟⲩⲣⲁⲥⲟⲩⲓ ⲟⲩⲟϩ ϩⲏⲡⲡⲉ ⲓⲥ ⲟⲩⲙⲟⲩⲕⲓ ⲉⲥⲧⲁϫⲣⲏⲟⲩⲧ ϩⲓϫⲉⲛ ⲡⲓⲕⲁϩⲓ ⲉⲣⲉ ϫⲱⲥ ϭⲓ ϣⲁ ⲉϩⲣⲏⲓ ⲉ̀ⲧⲫⲉ ⲟⲩⲟϩ ⲛⲁⲣⲉ ⲛⲓⲁⲅⲅⲉⲗⲟⲥ ⲛ̀ⲧⲉ ⲫϯ ⲛⲁⲩⲛⲁ ⲉ̀ⲡϣⲱⲓ ⲟⲩⲟϩ ⲛⲁⲩⲛⲏⲟⲩ ⲉ̀ⲡⲉⲥⲏⲧ ϩⲓⲱⲧⲥ ⲡⲉ							 καὶ ἐνυπνιάσθη, καὶ ἰδοὺ κλίμαξ ἐστηριγμένη ἐν τῇ γῇ, ἧς ἡ κεφαλὴ ἀφικνεῖτο εἰς τὸν οὐρανόν, καὶ οἱ ἄγγελοι τοῦ θεοῦ ἀνέβαινον καὶ κατέβαινον ἐπ᾽ αὐτῆς.	 and dreamed, and behold a ladder fixed on the earth, whose top reached to heaven, and the angels of God ascended and descended on it.	
Genesis	28	13	 ⲡϭ̅ⲥ̅ ⲇⲉ ⲛⲁϥⲧⲁϫⲣⲏⲟⲩⲧ ϩⲓϫⲱⲥ ⲡⲉ ⲟⲩⲟϩ ⲡⲉϫⲁϥ ϫⲉ ⲁ̀ⲛⲟⲕ ⲡⲉ ⲫϯ ⲛ̀ⲁⲃⲣⲁⲁⲙ ⲡⲉⲕⲓⲱⲧ ⲛⲉⲙ ⲫϯ ⲛ̀ⲓⲥⲁⲁⲕ ⲙ̀ⲡⲉⲣⲉⲣϩⲟϯ ⲡⲓⲕⲁϩⲓ ⲉⲧⲉⲕⲉⲛⲕⲟⲧ ⲛ̀ⲑⲟⲕ ϩⲓⲱⲧϥ ⲉⲓⲉ̀ⲧⲏⲓϥ ⲛⲁⲕ ⲛⲉⲙ ⲡⲉⲕϫⲣⲟϫ ⲙⲉⲛⲉⲛⲥⲱⲕ							 ὁ δὲ κύριος ἐπεστήρικτο ἐπ᾽ αὐτῆς καὶ εἶπεν ᾿Εγὼ κύριος ὁ θεὸς Αβρααμ τοῦ πατρός σου καὶ ὁ θεὸς Ισαακ· μὴ φοβοῦ· ἡ γῆ, ἐφ᾽ ἧς σὺ καθεύδεις ἐπ᾽ αὐτῆς, σοὶ δώσω αὐτὴν καὶ τῷ σπέρματί σου.	 And the Lord stood upon it, and said, I am the God of thy father Abraam, and the God of Isaac; fear not, the land on which thou liest, to thee will I give it, and to thy seed.	
Genesis	28	14	 ⲟⲩⲟϩ ⲉⲣⲉ ⲡⲉⲕϫⲣⲟϫ ⲉⲣ ⲙ̀ⲫⲣⲏϯ ⲙ̀ⲡⲓϣⲱ ⲛ̀ⲧⲉ ⲡⲕⲁϩⲓ ⲟⲩⲟϩ ⲉϥⲉ̀ⲟⲩⲱϣⲥ ⲉ̀ⲡⲥⲁ ⲙ̀ⲫⲓⲟⲙ ⲛⲉⲙ ⲡⲉⲙⲉⲛⲧ ⲛⲉⲙ ⲡⲉⲙϩⲓⲧ ⲛⲉⲙ ⲡⲉⲓⲉⲃⲧ ⲟⲩⲟϩ ⲉⲩⲉ̀ϭⲓⲥⲙⲟⲩ ⲛ̀ϧⲣⲏⲓ ⲛ̀ϧⲏⲧⲕ ⲛ̀ⲧⲉ ⲛⲓⲫⲩⲗⲏ ⲧⲏⲣⲟⲩ ⲛ̀ⲧⲉ ⲡⲕⲁϩⲓ ⲛⲉⲙ ⲛ̀ϧⲣⲏⲓ ϧⲉⲛ ⲡⲉⲕϫⲣⲟϫ							 καὶ ἔσται τὸ σπέρμα σου ὡς ἡ ἄμμος τῆς γῆς καὶ πλατυνθήσεται ἐπὶ θάλασσαν καὶ ἐπὶ λίβα καὶ ἐπὶ βορρᾶν καὶ ἐπ᾽ ἀνατολάς, καὶ ἐνευλογηθήσονται ἐν σοὶ πᾶσαι αἱ φυλαὶ τῆς γῆς καὶ ἐν τῷ σπέρματί σου.	 And thy seed shall be as the sand of the earth; and it shall spread abroad to the sea, and the south, and the north, and to the east; and in thee and in thy seed shall all the tribes of the earth be blessed.	
Genesis	28	15	 ⲟⲩⲟϩ ϩⲏⲡⲡⲉ ⲁ̀ⲛⲟⲕ ϯⲭⲏ ⲛⲉⲙⲁⲕ ⲟⲩⲟϩ ⲉⲓⲉ̀ⲁⲣⲉϩ ⲉ̀ⲣⲟⲕ ⲛ̀ϩⲣⲏⲓ ϩⲓ ⲡⲓⲙⲱⲓⲧ ⲧⲏⲣϥ ⲉⲧⲉⲕⲛⲁⲙⲟϣⲓ ϩⲓⲱⲧϥ ⲟⲩⲟϩ ⲉⲓⲉ̀ⲧⲁⲥⲑⲟⲕ ⲉ̀ⲡⲁⲓⲕⲁϩⲓ ϫⲉ ⲛ̀ⲛⲁⲭⲁⲕ ⲛ̀ⲥⲱⲓ ϣⲁϯⲓⲣⲓ ⲛ̀ϩⲱⲃ ⲛⲓⲃⲉⲛ ⲉⲧⲁⲓⲥⲁϫⲓ ⲙ̀ⲙⲱⲟⲩ ⲛⲉⲙⲁⲕ							 καὶ ἰδοὺ ἐγὼ μετὰ σοῦ διαφυλάσσων σε ἐν τῇ ὁδῷ πάσῃ, οὗ ἐὰν πορευθῇς, καὶ ἀποστρέψω σε εἰς τὴν γῆν ταύτην, ὅτι οὐ μή σε ἐγκαταλίπω ἕως τοῦ ποιῆσαί με πάντα, ὅσα ἐλάλησά σοι.	 And behold I am with thee to preserve thee continually in all the way wherein thou shalt go; and I will bring thee back to this land; for I will not desert thee, until I have done all that I have said to thee.	
Genesis	28	16	 ⲁϥⲧⲱⲛϥ ⲇⲉ ⲛ̀ϫⲉ ⲓⲁⲕⲱⲃ ⲉ̀ⲃⲟⲗ ϧⲉⲛ ⲡⲓⲉⲛⲕⲟⲧ ⲟⲩⲟϩ ⲡⲉϫⲁϥ ϫⲉ ⲡϭ̅ⲥ̅ ⲭⲏ ⲙ̀ⲡⲁⲓⲙⲁ ⲁ̀ⲛⲟⲕ ⲇⲉ ⲛⲁⲓⲉⲙⲓ ⲁⲛ ⲡⲉ							 καὶ ἐξηγέρθη Ιακωβ ἀπὸ τοῦ ὕπνου αὐτοῦ καὶ εἶπεν ὅτι ῎Εστιν κύριος ἐν τῷ τόπῳ τούτῳ, ἐγὼ δὲ οὐκ ᾔδειν.	 And Jacob awaked out of his sleep, and said, The Lord is in this place, and I knew it not.	
Genesis	28	17	 ⲟⲩⲟϩ ⲁϥⲉⲣϩⲟϯ ⲟⲩⲟϩ ⲡⲉϫⲁϥ ϫⲉ ⲓⲥϫⲉⲕ ⲡⲁⲓⲙⲁ ⲟⲩϩⲟϯ ⲡⲉ ⲫⲁⲓ ⲇⲉ ⲁⲛ ⲡⲉ ⲁⲗⲗⲁ ⲡⲏⲓ ⲙ̀ⲫϯ ⲡⲉ ⲟⲩⲟϩ ⲑⲁⲓ ⲧⲉ ϯⲡⲩⲗⲏ ⲛ̀ⲧⲉ ⲧⲫⲉ							 καὶ ἐφοβήθη καὶ εἶπεν ῾Ως φοβερὸς ὁ τόπος οὗτος· οὐκ ἔστιν τοῦτο ἀλλ᾽ ἢ οἶκος θεοῦ, καὶ αὕτη ἡ πύλη τοῦ οὐρανοῦ.	 And he was afraid, and said, How fearful is this place! this is none other than the house of God, and this is the gate of heaven.	
