book	chapter	verse	Bohairic	Akhmimic	Fayyumic	OldBohairic	Mesokemic	DialectP	Lycopolitan	Greek	English	Sahidic
Genesis	39	12	 ⲟⲩⲟϩ ⲁⲥⲙⲟⲗϫⲥ ⲉ̀ⲛⲉϥϩⲃⲱⲥ ⲁⲥⲃⲁϣϥ ⲙ̀ⲙⲱⲟⲩ ⲉⲥϫⲱ ⲙ̀ⲙⲟⲥ ϫⲉ ⲛ̀ⲕⲟⲧ ⲛⲉⲙⲏⲓ ⲟⲩⲟϩ ⲁϥⲥⲱϫⲡ ⲛ̀ⲛⲉϥϩⲃⲱⲥ ϧⲉⲛ ⲛⲉⲥϫⲓϫ ⲁϥⲫⲱⲧ ⲟⲩⲟϩ ⲁϥⲓ̀ ⲉ̀ⲃⲟⲗ							 καὶ ἐπεσπάσατο αὐτὸν τῶν ἱματίων λέγουσα Κοιμήθητι μετ᾽ ἐμοῦ. καὶ καταλιπὼν τὰ ἱμάτια αὐτοῦ ἐν ταῖς χερσὶν αὐτῆς ἔφυγεν καὶ ἐξῆλθεν ἔξω.	 And she caught hold of him by his clothes, and said, Lie with me; and having left his clothes in her hands, he fled, and went forth.	
Genesis	39	13	 ⲟⲩⲟϩ ⲁⲥϣⲱⲡⲓ ⲉⲧⲁⲥⲛⲁⲩ ϫⲉ ⲁϥⲥⲱϫⲡ ⲛ̀ⲛⲉϥϩⲃⲱⲥ ϧⲉⲛ ⲛⲉⲥϫⲓϫ ⲟⲩⲟϩ ⲁϥⲫⲱⲧ ⲁϥⲓ̀ ⲉ̀ⲃⲟⲗ							 καὶ ἐγένετο ὡς εἶδεν ὅτι κατέλιπεν τὰ ἱμάτια αὐτοῦ ἐν ταῖς χερσὶν αὐτῆς καὶ ἔφυγεν καὶ ἐξῆλθεν ἔξω,	 And it came to pass, when she saw that he had left his clothes in her hands, and fled, and gone forth,	
Genesis	39	14	 ⲁⲥⲙⲟⲩϯ ⲉ̀ⲛⲏ ⲉⲧϧⲉⲛ ⲡⲓⲏⲓ ⲟⲩⲟϩ ⲡⲉϫⲁⲥ ⲛⲱⲟⲩ ϫⲉ ⲁⲛⲁⲩ ⲁϥⲉⲛ ⲟⲩⲁⲗⲟⲩ ⲛ̀ϩⲉⲃⲣⲉⲟⲥ ⲉ̀ϧⲟⲩⲛ ϩⲁⲣⲟⲛ ⲉ̀ⲥⲱⲃⲓ ⲙ̀ⲙⲟⲛ ⲁϥⲓ̀ ⲉ̀ϧⲟⲩⲛ ϩⲁⲣⲟⲓ ⲉϥϫⲱ ⲙ̀ⲙⲟⲥ ϫⲉ ⲛ̀ⲕⲟⲧ ⲛⲉⲙⲏⲓ ⲟⲩⲟϩ ⲁⲓⲱϣ ⲉ̀ⲃⲟⲗ ϧⲉⲛ ⲟⲩⲛⲓϣϯ ⲛ̀ⲥⲙⲏ							 καὶ ἐκάλεσεν τοὺς ὄντας ἐν τῇ οἰκίᾳ καὶ εἶπεν αὐτοῖς λέγουσα ῎Ιδετε, εἰσήγαγεν ἡμῖν παῖδα Εβραῖον ἐμπαίζειν ἡμῖν· εἰσῆλθεν πρός με λέγων Κοιμήθητι μετ᾽ ἐμοῦ, καὶ ἐβόησα φωνῇ μεγάλῃ·	 that she called those that were in the house, and spoke to them, saying, See, he has brought in to us a Hebrew servant to mock us—he came in to me, saying, Lie with me, and I cried with a loud voice.	
Genesis	39	15	 ϧⲉⲛ ⲡϫⲓⲛⲑⲣⲉϥⲥⲱⲧⲉⲙ ⲇⲉ ϫⲉ ⲁⲓϭⲓⲥⲓ ⲛ̀ⲧⲁⲥⲙⲏ ⲟⲩⲟϩ ⲁⲓⲱϣ ⲉ̀ⲃⲟⲗ ⲁϥⲥⲱϫⲡ ⲛ̀ⲛⲉϥϩⲃⲱⲥ ⲛ̀ⲧⲟⲧ ⲁϥⲫⲱⲧ ⲟⲩⲟϩ ⲁϥϣⲉ ⲛⲁϥ ⲉ̀ⲃⲟⲗ							 ἐν δὲ τῷ ἀκοῦσαι αὐτὸν ὅτι ὕψωσα τὴν φωνήν μου καὶ ἐβόησα, καταλιπὼν τὰ ἱμάτια αὐτοῦ παρ᾽ ἐμοὶ ἔφυγεν καὶ ἐξῆλθεν ἔξω.	 And when he heard that I lifted up my voice and cried, having left his clothes with me, he fled, and went forth out.	
Genesis	39	16	 ⲟⲩⲟϩ ⲁⲥⲭⲁ ⲛⲓϩⲃⲱⲥ ⲛ̀ⲧⲟⲧⲥ ϣⲁⲧⲉ ⲡⲉϥϭⲟⲓⲥ ⲓ ⲉ̀ϧⲟⲩⲛ ⲉ̀ⲡⲉϥⲏⲓ							 καὶ καταλιμπάνει τὰ ἱμάτια παρ᾽ ἑαυτῇ, ἕως ἦλθεν ὁ κύριος εἰς τὸν οἶκον αὐτοῦ.	 So she leaves the clothes by her, until the master came to his house.	
Genesis	39	17	 ⲟⲩⲟϩ ⲁⲥⲥⲁϫⲓ ⲛⲉⲙⲁϥ ⲕⲁⲧⲁ ⲛⲁⲓⲥⲁϫⲓ ⲉⲥϫⲱ ⲙ̀ⲙⲟⲥ ϫⲉ ⲁϥⲓ̀ ϩⲁⲣⲟⲓ ⲛ̀ϫⲉ ⲡⲉⲕⲁⲗⲟⲩ ⲛ̀ϩⲉⲃⲣⲉⲟⲥ ⲫⲁⲓ ⲉⲧⲁⲕⲉⲛϥ ⲉ̀ϧⲟⲩⲛ ϩⲁⲣⲟⲛ ⲉ̀ⲥⲱⲃⲓ ⲙ̀ⲙⲟⲓ ⲟⲩⲟϩ ⲡⲉϫⲁϥ ⲛⲏⲓ ϫⲉ ⲛ̀ⲕⲟⲧ ⲛⲉⲙⲏⲓ							 καὶ ἐλάλησεν αὐτῷ κατὰ τὰ ῥήματα ταῦτα λέγουσα Εἰσῆλθεν πρός με ὁ παῖς ὁ Εβραῖος, ὃν εἰσήγαγες πρὸς ἡμᾶς, ἐμπαῖξαί μοι καὶ εἶπέν μοι Κοιμηθήσομαι μετὰ σοῦ·	 And she spoke to him according to these words, saying, The Hebrew servant, whom thou broughtest in to us, came in to me to mock me, and said to me, I will lie with thee.	
Genesis	39	18	 ⲉⲧⲁϥⲥⲱⲧⲉⲙ ⲇⲉ ϫⲉ ⲁⲓϭⲓⲥⲓ ⲛ̀ⲧⲁⲥⲙⲏ ⲟⲩⲟϩ ⲁⲓⲱϣ ⲉ̀ⲃⲟⲗ ⲁϥⲥⲱϫⲡ ⲛ̀ⲛⲉϥϩⲃⲱⲥ ⲛ̀ⲧⲟⲧ ⲁϥⲫⲱⲧ ⲟⲩⲟϩ ⲁϥϣⲉ ⲛⲁϥ ⲉ̀ⲃⲟⲗ							 ὡς δὲ ἤκουσεν ὅτι ὕψωσα τὴν φωνήν μου καὶ ἐβόησα, κατέλιπεν τὰ ἱμάτια αὐτοῦ παρ᾽ ἐμοὶ καὶ ἔφυγεν καὶ ἐξῆλθεν ἔξω.	 And when he heard that I lifted up my voice and cried, having left his clothes with me, he fled and departed forth.	
Genesis	39	19	 ⲁⲥϣⲱⲡⲓ ⲇⲉ ⲉⲧⲁϥⲥⲱⲧⲉⲙ ⲛ̀ϫⲉ ⲡⲉϥϭⲟⲓⲥ ⲉ̀ⲛⲓⲥⲁϫⲓ ⲛ̀ⲧⲉ ⲧⲉϥⲥϩⲓⲙⲓ ⲛⲏ ⲉⲧⲁⲥⲥⲁϫⲓ ⲙ̀ⲙⲱⲟⲩ ⲛⲉⲙⲁϥ ⲉⲥϫⲱ ⲙ̀ⲙⲟⲥ ϫⲉ ⲡⲁⲓⲣⲏϯ ⲡⲉⲧⲁϥⲁⲓϥ ⲛⲏⲓ ⲛ̀ϫⲉ ⲡⲉⲕⲁⲗⲟⲩ ⲟⲩⲟϩ ⲁϥϫⲱⲛⲧ ϧⲉⲛ ⲟⲩⲙ̀ⲃⲟⲛ							 ἐγένετο δὲ ὡς ἤκουσεν ὁ κύριος αὐτοῦ τὰ ῥήματα τῆς γυναικὸς αὐτοῦ, ὅσα ἐλάλησεν πρὸς αὐτὸν λέγουσα Οὕτως ἐποίησέν μοι ὁ παῖς σου, καὶ ἐθυμώθη ὀργῇ.	 And it came to pass, when his master heard all the words of his wife, that she spoke to him, saying, Thus did thy servant to me, that he was very angry.	
Genesis	39	20	 ⲟⲩⲟϩ ⲁ ⲡϭⲟⲓⲥ ⲛ̀ⲓⲱⲥⲏⲫ ⲟⲗϥ ⲁϥϩⲓⲧϥ ⲉ̀ⲡⲓϣⲧⲉⲕⲟ ⲉ̀ⲡⲓⲙⲁ ⲉ̀ⲛⲁⲣⲉ ⲛⲏ ⲉⲧⲥⲟⲛϩ ⲛ̀ⲧⲉ ⲡⲟⲩⲣⲟ ⲭⲏ ⲙ̀ⲙⲟϥ ϧⲉⲛ ⲡⲓϣⲧⲉⲕⲟ							 καὶ λαβὼν ὁ κύριος Ιωσηφ ἐνέβαλεν αὐτὸν εἰς τὸ ὀχύρωμα, εἰς τὸν τόπον, ἐν ᾧ οἱ δεσμῶται τοῦ βασιλέως κατέχονται ἐκεῖ ἐν τῷ ὀχυρώματι.	 And his master took Joseph, and cast him into the prison, into the place where the king’s prisoners are kept, there in the prison;	
Genesis	39	21	 ⲟⲩⲟϩ ⲛⲁⲣⲉ ⲡϭ̅ⲥ̅ ⲭⲏ ⲛⲉⲙ ⲓⲱⲥⲏⲫ ⲡⲉ ⲟⲩⲟϩ ⲛⲁϥϫⲉϣ ⲛⲁⲓ ⲉ̀ϩⲣⲏⲓ ⲉ̀ϫⲱϥ ⲟⲩⲟϩ ⲁϥϯ ⲛ̀ⲟⲩϩⲙⲟⲧ ⲛⲁϥ ⲙ̀ⲡⲉⲙ̀ⲑⲟ ⲙ̀ⲡⲓⲙ̀ⲛⲟⲩⲧ ⲛ̀ⲧⲉ ⲡⲓϣ̀ⲧⲉⲕⲟ							 Καὶ ἦν κύριος μετὰ Ιωσηφ καὶ κατέχεεν αὐτοῦ ἔλεος καὶ ἔδωκεν αὐτῷ χάριν ἐναντίον τοῦ ἀρχιδεσμοφύλακος,	 And the Lord was with Joseph, and poured down mercy upon him, and he gave him favour in the sight of the chief keeper of the prison.	
Genesis	39	22	 ⲟⲩⲟϩ ⲁ ⲡⲓⲙ̀ⲛⲟⲩⲧ ⲛ̀ⲧⲉ ⲡⲓϣ̀ⲧⲉⲕⲟ ϯ ⲙ̀ⲡⲓⲙⲁⲛ̀ⲥⲱⲛϩ ⲉ̀ⲧϫⲓϫ ⲛ̀ⲓⲱⲥⲏⲫ ⲛⲉⲙ ⲟⲩⲟⲛ ⲛⲓⲃⲉⲛ ⲉⲧϩⲱⲟⲩⲓ ⲉ̀ϧⲟⲩⲛ ⲛⲏ ⲉⲧⲭⲏ ϧⲉⲛ ⲡⲓⲙⲁⲛ̀ⲥⲱⲛϩ ⲟⲩⲟϩ ϩⲱⲃ ⲛⲓⲃⲉⲛ ⲉⲧⲟⲩⲣⲁ ⲙ̀ⲙⲱⲟⲩ ⲙ̀ⲙⲁⲩ							 καὶ ἔδωκεν ὁ ἀρχιδεσμοφύλαξ τὸ δεσμωτήριον διὰ χειρὸς Ιωσηφ καὶ πάντας τοὺς ἀπηγμένους, ὅσοι ἐν τῷ δεσμωτηρίῳ, καὶ πάντα, ὅσα ποιοῦσιν ἐκεῖ.	 And the chief keeper of the prison gave the prison into the hand of Joseph, and all the prisonersas many as were in the prison; and all things whatsoever they do there, he did them.	
Genesis	39	23	 ⲛⲁϥⲉⲙⲓ ⲉ̀ⲣⲱⲟⲩ ⲁⲛ ⲡⲉ ⲛ̀ϫⲉ ⲡⲓⲙ̀ⲛⲟⲩⲧ ⲛ̀ⲧⲉ ⲡⲓϣ̀ⲧⲉⲕⲟ ⲉⲑⲃⲏⲧϥ ϩⲱⲃ ⲅⲁⲣ ⲛⲓⲃⲉⲛ ⲛⲁⲩ ϧⲉⲛ ⲧϫⲓϫ ⲛ̀ⲓⲱⲥⲏⲫ ϫⲉ ⲛⲁⲣⲉ ⲡϭ̅ⲥ̅ ⲭⲏ ⲛⲉⲙⲁϥ ⲡⲉ ϩⲱⲃ ⲛⲓⲃⲉⲛ ⲉ̀ϣⲁϥⲁⲓⲧⲟⲩ ϣⲁⲣⲉ ⲡϭ̅ⲥ̅ ⲥⲟⲩⲧⲉⲛ ⲡⲉϥⲙⲱⲓⲧ ϧⲉⲛ ⲛⲉϥϫⲓϫ							 οὐκ ἦν ὁ ἀρχιδεσμοφύλαξ τοῦ δεσμωτηρίου γινώσκων δι᾽ αὐτὸν οὐθέν· πάντα γὰρ ἦν διὰ χειρὸς Ιωσηφ διὰ τὸ τὸν κύριον μετ᾽ αὐτοῦ εἶναι, καὶ ὅσα αὐτὸς ἐποίει, κύριος εὐώδου ἐν ταῖς χερσὶν αὐτοῦ.	 Because of him the chief keeper of the prison knew nothing, for all things were in the hand of Joseph, because the Lord was with him; and whatever things he did, the Lord made them to prosper in his hands.	
Genesis	40	1	 ⲁⲥϣⲱⲡⲓ ⲇⲉ ⲙⲉⲛⲉⲛⲥⲁ ⲛⲁⲓⲥⲁϫⲓ ⲁϥⲉⲣⲛⲟⲃⲓ ⲛ̀ϫⲉ ⲡⲓⲣⲉϥⲟⲩⲱⲧϩ ⲛ̀ⲧⲉ ⲡⲟⲩⲣⲟ ⲛ̀ⲭⲏⲙⲓ ⲛⲉⲙ ⲡⲓⲁⲙⲣⲉ ⲉ̀ⲡⲟⲩϭⲟⲓⲥ ⲡⲟⲩⲣⲟ ⲛ̀ⲭⲏⲙⲓ							 ᾿Εγένετο δὲ μετὰ τὰ ῥήματα ταῦτα ἥμαρτεν ὁ ἀρχιοινοχόος τοῦ βασιλέως Αἰγύπτου καὶ ὁ ἀρχισιτοποιὸς τῷ κυρίῳ αὐτῶν βασιλεῖ Αἰγύπτου.	 And it came to pass after these things, that the chief cupbearer of the king of Egypt and the chief baker trespassed against their lord the king of Egypt.	
Genesis	40	2	 ⲟⲩⲟϩ ⲁϥϫⲱⲛⲧ ⲛ̀ϫⲉ ⲫⲁⲣⲁⲱ ⲉ̀ⲡⲓⲥⲓⲟⲩⲣ ⲃ̅ ⲡⲓⲣⲉϥⲟⲩⲱⲧϩ ⲛⲉⲙ ⲡⲓⲁⲙⲣⲉ							 καὶ ὠργίσθη Φαραω ἐπὶ τοῖς δυσὶν εὐνούχοις αὐτοῦ, ἐπὶ τῷ ἀρχιοινοχόῳ καὶ ἐπὶ τῷ ἀρχισιτοποιῷ,	 And Pharao was wroth with his two eunuchs, with his chief cupbearer, and with his chief baker.	
Genesis	40	3	 ⲟⲩⲟϩ ⲁϥⲭⲁⲩ ϧⲉⲛ ⲡⲓϣ̀ⲧⲉⲕⲟ ϧⲁⲧⲉⲛ ⲡⲓⲁⲣⲭⲓⲙⲁⲅⲓⲣⲟⲥ ϧⲉⲛ ⲡⲓⲙⲁⲛ̀ⲥⲱⲛϩ ⲡⲓⲙⲁ ⲉⲧⲁⲩⲉⲗ ⲓⲱⲥⲏⲫ ⲉ̀ⲣⲟϥ							 καὶ ἔθετο αὐτοὺς ἐν φυλακῇ παρὰ τῷ δεσμοφύλακι εἰς τὸ δεσμωτήριον, εἰς τὸν τόπον, οὗ Ιωσηφ ἀπῆκτο ἐκεῖ.	 And he put them in ward, into the prison, into the place whereinto Joseph had been led.	
Genesis	40	4	 ⲟⲩⲟϩ ⲁ ⲡⲓⲙ̀ⲛⲟⲩⲧ ⲧⲁϩⲱⲟⲩ ⲛⲉⲙ ⲓⲱⲥⲏⲫ ⲟⲩⲟϩ ⲁϥⲧⲏⲓⲧⲟⲩ ⲉ̀ⲧⲟⲧϥ ⲛⲁⲩⲭⲏ ⲇⲉ ⲡⲉ ϧⲉⲛ ⲡⲓϣ̀ⲧⲉⲕⲟ ⲛ̀ϩⲁⲛⲉϩⲟⲟⲩ							 καὶ συνέστησεν ὁ ἀρχιδεσμώτης τῷ Ιωσηφ αὐτούς, καὶ παρέστη αὐτοῖς· ἦσαν δὲ ἡμέρας ἐν τῇ φυλακῇ.—	 And the chief keeper of the prison committed them to Joseph, and he stood by them; and they were some days in the prison.	
Genesis	40	5	 ⲟⲩⲟϩ ⲁⲩⲛⲁⲩ ⲙ̀ⲡⲃ̅ ⲉ̀ⲟⲩⲣⲁⲥⲟⲩⲓ ⲫⲟⲩⲁⲓ ⲫⲟⲩⲁⲓ ⲁϥⲛⲁⲩ ⲉ̀ⲧⲉϥⲣⲁⲥⲟⲩⲓ ϧⲉⲛ ⲟⲩⲉ̀ϫⲱⲣϩ ⲛ̀ⲟⲩⲱⲧ ϯϩⲟⲣⲁⲥⲓⲥ ⲛ̀ⲧⲉ ⲧⲉϥⲣⲁⲥⲟⲩⲓ ⲡⲓⲣⲉϥⲟⲩⲱⲧϩ ⲛⲉⲙ ⲡⲓⲁⲙⲣⲉ ⲛ̀ⲧⲉ ⲡⲟⲩⲣⲟ ⲛ̀ⲭⲏⲙⲓ ⲛⲏ ⲉ̀ⲛⲁⲩⲭⲏ ϧⲉⲛ ⲡⲓⲙⲁⲛ̀ⲥⲱⲛϩ							 καὶ εἶδον ἀμφότεροι ἐνύπνιον, ἑκάτερος ἐνύπνιον, ἐν μιᾷ νυκτὶ ὅρασις τοῦ ἐνυπνίου αὐτοῦ, ὁ ἀρχιοινοχόος καὶ ὁ ἀρχισιτοποιός, οἳ ἦσαν τῷ βασιλεῖ Αἰγύπτου, οἱ ὄντες ἐν τῷ δεσμωτηρίῳ.	 And they both had a dream in one night; and the vision of the dream of the chief cupbearer and chief baker, who belonged to the king of Egypt, who were in the prison, was this.	
Genesis	40	6	 ⲁϥⲓ̀ ⲇⲉ ⲛ̀ϫⲉ ⲓⲱⲥⲏⲫ ⲉ̀ϧⲟⲩⲛ ϩⲁⲣⲱⲟⲩ ⲛ̀ⲧⲟⲟⲩⲓ ⲁϥⲛⲁⲩ ⲉ̀ⲣⲱⲟⲩ ⲉⲩϣⲑⲉⲣⲑⲱⲣ							 εἰσῆλθεν δὲ πρὸς αὐτοὺς Ιωσηφ τὸ πρωὶ καὶ εἶδεν αὐτούς, καὶ ἦσαν τεταραγμένοι.	 Joseph went in to them in the morning, and saw them, and they had been troubled.	
Genesis	40	7	 ⲟⲩⲟϩ ⲛⲁϥϣⲓⲛⲓ ⲛ̀ⲛⲓⲥⲓⲟⲩⲣ ⲛ̀ⲧⲉ ⲫⲁⲣⲁⲱ ⲛⲏ ⲉ̀ⲛⲁⲩ ⲛⲉⲙⲁϥ ϧⲉⲛ ⲡⲓϣ̀ⲧⲉⲕⲟ ⲉ̀ⲃⲟⲗ ϩⲓⲧⲉⲛ ⲡⲉϥϭⲟⲓⲥ ⲉϥϫⲱ ⲙ̀ⲙⲟⲥ ϫⲉ ⲉⲑⲃⲉⲟⲩ ⲡⲉⲧⲉⲛϩⲟ ⲟⲕⲉⲙ ⲙ̀ⲫⲟⲟⲩ							 καὶ ἠρώτα τοὺς εὐνούχους Φαραω, οἳ ἦσαν μετ᾽ αὐτοῦ ἐν τῇ φυλακῇ παρὰ τῷ κυρίῳ αὐτοῦ, λέγων Τί ὅτι τὰ πρόσωπα ὑμῶν σκυθρωπὰ σήμερον;	 And he asked the eunuchs of Pharao who were with him in the prison with his master, saying, Why is it that your countenances are sad to-day?	
Genesis	40	8	 ⲛ̀ⲑⲱⲟⲩ ⲇⲉ ⲡⲉϫⲱⲟⲩ ⲛⲁϥ ϫⲉ ⲟⲩⲣⲁⲥⲟⲩⲓ ⲁⲛⲛⲁⲩ ⲉⲣⲟⲥ ⲟⲩⲟϩ ϥϣⲟⲡ ⲁⲛ ⲛ̀ϫⲉ ⲫⲏ ⲉⲧⲛⲁⲃⲟⲗⲥ ⲡⲉϫⲉ ⲓⲱⲥⲏⲫ ⲇⲉ ⲛⲱⲟⲩ ϫⲉ ⲙⲏ ⲁⲣⲉ ⲡⲟⲩⲃⲱⲗ ϣⲟⲡ ⲁⲛ ⲉ̀ⲃⲟⲗ ϩⲓⲧⲉⲛ ⲫϯ ⲥⲁϫⲓ ⲟⲩⲛ ϧⲁⲧⲟⲧ							 οἱ δὲ εἶπαν αὐτῷ ᾿Ενύπνιον εἴδομεν, καὶ ὁ συγκρίνων οὐκ ἔστιν αὐτό. εἶπεν δὲ αὐτοῖς Ιωσηφ Οὐχὶ διὰ τοῦ θεοῦ ἡ διασάφησις αὐτῶν ἐστιν; διηγήσασθε οὖν μοι.—	 And they said to him, We have seen a dream, and there is no interpreter of it. And Joseph said to them, Is not the interpretation of them through God? tell them then to me.	
Genesis	40	9	 ⲟⲩⲟϩ ⲁ ⲡⲓⲣⲉϥⲟⲩⲱⲧϩ ϫⲉ ⲧⲉϥⲣⲁⲥⲟⲩⲓ ⲛ̀ⲓⲱⲥⲏⲫ ⲟⲩⲟϩ ⲡⲉϫⲁϥ ϫⲉ ⲛ̀ϩⲣⲏⲓ ϧⲉⲛ ⲧⲁⲣⲁⲥⲟⲩⲓ ⲛⲉ ⲟⲩⲟⲛ ⲟⲩⲃⲱ ⲛ̀ⲁⲗⲟⲗⲓ ⲭⲏ ⲙ̀ⲡⲁⲙ̀ⲑⲟ ⲡⲉ							 καὶ διηγήσατο ὁ ἀρχιοινοχόος τὸ ἐνύπνιον αὐτοῦ τῷ Ιωσηφ καὶ εἶπεν ᾿Εν τῷ ὕπνῳ μου ἦν ἄμπελος ἐναντίον μου·	 And the chief cupbearer related his dream to Joseph, and said, In my dream a vine was before me.	
Genesis	40	10	 ⲛ̀ϩⲣⲏⲓ ϧⲉⲛ ϯⲃⲱ ⲛ̀ⲁⲗⲟⲗⲓ ⲛⲁⲣⲉ ⲟⲩⲟⲛ ⲅ̅ ⲛ̅ⲭⲁϥ ⲡⲉ ⲟⲩⲟϩ ⲑⲁⲓ ⲛⲁⲥⲫⲟⲣⲓ ⲉ̀ⲃⲟⲗ ⲡⲉ ⲁⲥⲉⲛ ϩⲁⲛⲥⲙⲁϩ ⲉ̀ⲃⲟⲗ ⲉⲩⲫⲉϩ ⲛ̀ϫⲉ ⲛⲓⲥⲙⲁϩ ⲛ̀ⲁⲗⲟⲗⲓ							 ἐν δὲ τῇ ἀμπέλῳ τρεῖς πυθμένες, καὶ αὐτὴ θάλλουσα ἀνενηνοχυῖα βλαστούς· πέπειροι οἱ βότρυες σταφυλῆς.	 And in the vine were three stems; and it budding shot forth blossoms; the clusters of grapes were ripe.	
Genesis	40	11	 ⲟⲩⲟϩ ⲛⲁⲣⲉ ⲡⲓⲁⲫⲟⲧ ⲛ̀ⲧⲉ ⲫⲁⲣⲁⲱ ϧⲉⲛ ⲧⲁϫⲓϫ ⲟⲩⲟϩ ⲁⲓϭⲓ ⲛ̀ⲛⲓⲁⲗⲟⲗⲓ ⲁⲓⲟϥⲟⲩ ⲉ̀ϧⲣⲏⲓ ⲉ̀ⲡⲓⲁⲫⲟⲧ ϧⲉⲛ ⲛⲉⲛϫⲓϫ ⲙ̀ⲫⲁⲣⲁⲱ							 καὶ τὸ ποτήριον Φαραω ἐν τῇ χειρί μου· καὶ ἔλαβον τὴν σταφυλὴν καὶ ἐξέθλιψα αὐτὴν εἰς τὸ ποτήριον καὶ ἔδωκα τὸ ποτήριον εἰς τὰς χεῖρας Φαραω.	 And the cup of Pharao was in my hand; and I took the bunch of grapes, and squeezed it into the cup, and gave the cup into Pharao’s hand.	
Genesis	40	12	 ⲟⲩⲟϩ ⲡⲉϫⲉ ⲓⲱⲥⲏⲫ ⲛⲁϥ ϫⲉ ⲫⲁⲓ ⲡⲉ ⲡⲉⲥⲃⲱⲗ ⲡⲓⲅ̅ ⲛ̀ⲭⲁϥ ⲅ̅ ⲛ̀ⲉϩⲟⲟⲩ ⲛⲉ							 καὶ εἶπεν αὐτῷ Ιωσηφ Τοῦτο ἡ σύγκρισις αὐτοῦ· οἱ τρεῖς πυθμένες τρεῖς ἡμέραι εἰσίν·	 And Joseph said to him, This is the interpretation of it. The three stems are three days.	
Genesis	40	13	 ⲉⲧⲓ ⲕⲉⲅ̅ ⲛ̀ⲉϩⲟⲟⲩ ϥⲛⲁⲉⲣⲫⲙⲉⲩⲓ ⲛ̀ϫⲉ ⲫⲁⲣⲁⲱ ⲛ̀ⲧⲉⲕⲁⲣⲭⲏ ⲟⲩⲟϩ ϥⲛⲁⲭⲁⲕ ⲉ̀ϩⲣⲏⲓ ⲉ̀ϫⲉⲛ ⲧⲉⲕⲙⲉⲧⲣⲉϥⲟⲩⲱⲧϩ ⲟⲩⲟϩ ⲉⲕⲉ̀ϯ ⲙ̀ⲡⲓⲁⲫⲟⲧ ⲛ̀ⲧⲉ ⲫⲁⲣⲁⲱ ⲉ̀ϧⲣⲏⲓ ⲉ̀ⲛⲉϥϫⲓϫ ⲕⲁⲧⲁ ⲧⲉⲕⲁⲣⲭⲏ ⲛ̀ⲧⲉ ϣⲟⲣⲡ ⲙ̀ⲡⲓⲣⲏϯ ⲉ̀ⲛⲁⲕⲟⲓ ⲛ̀ⲣⲉϥⲟⲩⲱⲧϩ							 ἔτι τρεῖς ἡμέραι καὶ μνησθήσεται Φαραω τῆς ἀρχῆς σου καὶ ἀποκαταστήσει σε ἐπὶ τὴν ἀρχιοινοχοΐαν σου, καὶ δώσεις τὸ ποτήριον Φαραω εἰς τὴν χεῖρα αὐτοῦ κατὰ τὴν ἀρχήν σου τὴν προτέραν, ὡς ἦσθα οἰνοχοῶν.	 Yet three days and Pharao shall remember thy office, and he shall restore thee to thy place of chief cupbearer, and thou shalt give the cup of Pharao into his hand, according to thy former high place, as thou wast wont to be cupbearer.	
Genesis	40	14	 ⲁⲗⲗⲁ ⲁⲣⲓ ⲡⲁⲙⲉⲩⲓ ⲉ̀ⲃⲟⲗ ϩⲓⲧⲟⲧⲕ ⲉ̀ϣⲱⲡ ⲁⲣⲉϣⲁⲛ ⲡⲓⲡⲉⲑⲛⲁⲛⲉϥ ϫⲉⲙⲕ ⲟⲩⲟϩ ⲉⲕⲉ̀ⲓⲣⲓ ⲛ̀ϧⲏⲧ ⲛ̀ⲟⲩⲛⲁⲓ ⲟⲩⲟϩ ⲉⲕⲉ̀ⲉⲣⲫⲙⲉⲩⲓ ⲉⲑⲃⲏⲧ ⲛⲁϩⲣⲉⲛ ⲫⲁⲣⲁⲱ ⲟⲩⲟϩ ⲉⲕⲉ̀ⲉⲛⲧ ⲉ̀ⲃⲟⲗ ϧⲉⲛ ⲡⲁⲓϣⲧⲉⲕⲟ							 ἀλλὰ μνήσθητί μου διὰ σεαυτοῦ, ὅταν εὖ σοι γένηται, καὶ ποιήσεις ἐν ἐμοὶ ἔλεος καὶ μνησθήσῃ περὶ ἐμοῦ Φαραω καὶ ἐξάξεις με ἐκ τοῦ ὀχυρώματος τούτου·	 But remember me of thyself, when it shall be well with thee, and thou shalt deal mercifully with me, and thou shalt make mention of me to Pharao, and thou shalt bring me forth out of this dungeon.	
Genesis	40	15	 ϫⲉ ϧⲉⲛ ⲟⲩϭⲓⲟⲩⲓ ⲁⲩⲟⲗⲧ ⲛ̀ϭⲓⲟⲩⲓ ⲉ̀ⲃⲟⲗ ϧⲉⲛ ⲡⲕⲁϩⲓ ⲛ̀ⲧⲉ ⲛⲓϩⲉⲃⲣⲉⲟⲥ ⲟⲩⲟϩ ϧⲉⲛ ⲡⲁⲓⲙⲁ ⲟⲛ ⲙ̀ⲡⲓⲉⲣ ϩⲗⲓ ⲛ̀ⲛⲟⲃⲓ ⲁⲗⲗⲁ ⲁⲩϩⲓⲧ ⲉ̀ϩⲣⲏⲓ ⲉ̀ⲡⲁⲓⲗⲁⲕⲕⲟⲥ							 ὅτι κλοπῇ ἐκλάπην ἐκ γῆς Εβραίων καὶ ὧδε οὐκ ἐποίησα οὐδέν, ἀλλ᾽ ἐνέβαλόν με εἰς τὸν λάκκον τοῦτον.—	 For surely I was stolen away out of the land of the Hebrews, and here I have done nothing, but they have cast me into this pit.	
Genesis	40	16	 ⲟⲩⲟϩ ⲉⲧⲁϥⲛⲁⲩ ⲛ̀ϫⲉ ⲡⲓⲁⲙⲣⲉ ϫⲉ ⲁϥⲃⲱⲗ ϧⲉⲛ ⲟⲩⲥⲱⲟⲩⲧⲉⲛ ⲡⲉϫⲁϥ ⲛ̀ⲓⲱⲥⲏⲫ ϫⲉ ⲁⲛⲟⲕ ϩⲱ ⲁⲓⲛⲁⲩ ⲉ̀ⲟⲩⲣⲁⲥⲟⲩⲓ ⲁⲓⲛⲁⲩ ⲓⲥϫⲉⲕ ⲛⲁⲓϥⲁⲓ ⲛ̀ⲅ̅ ⲛ̀ⲕⲁⲛⲟⲩⲛ ⲛ̀ⲭⲟⲛⲇⲣⲓⲧⲏⲥ ϩⲓϫⲉⲛ ⲧⲁⲁⲫⲉ							 καὶ εἶδεν ὁ ἀρχισιτοποιὸς ὅτι ὀρθῶς συνέκρινεν, καὶ εἶπεν τῷ Ιωσηφ Κἀγὼ εἶδον ἐνύπνιον καὶ ᾤμην τρία κανᾶ χονδριτῶν αἴρειν ἐπὶ τῆς κεφαλῆς μου·	 And the chief baker saw that he interpreted aright; and he said to Joseph, I also saw a dream, and methought I took up on my head three baskets of mealy food.	
Genesis	40	17	 ⲛ̀ϩⲣⲏⲓ ⲇⲉ ϧⲉⲛ ⲡⲓⲕⲁⲛⲟⲩⲛ ⲉⲧⲥⲁⲡϣⲱⲓ ⲛⲉ ⲟⲩⲟⲛ ⲛ̀ϧⲏⲧϥ ⲡⲉ ⲉ̀ⲃⲟⲗ ϧⲉⲛ ⲛⲏ ⲧⲏⲣⲟⲩ ⲉ̀ϣⲁⲣⲉ ⲡⲟⲩⲣⲟ ⲫⲁⲣⲁⲱ ⲟⲩⲟⲙⲟⲩ ⲛ̀ϩⲱⲃ ⲛⲁⲙⲣⲉ ⲟⲩⲟϩ ⲛⲁⲣⲉ ⲛⲓϩⲁⲗⲁϯ ⲟⲩⲱⲙ ⲙ̀ⲙⲱⲟⲩ ⲡⲉ ⲉ̀ⲃⲟⲗ ϧⲉⲛ ⲡⲓⲕⲁⲛⲟⲩⲛ ⲉⲧⲭⲏ ϩⲓϫⲉⲛ ⲧⲁⲁⲫⲉ							 ἐν δὲ τῷ κανῷ τῷ ἐπάνω ἀπὸ πάντων τῶν γενῶν, ὧν ὁ βασιλεὺς Φαραω ἐσθίει, ἔργον σιτοποιοῦ, καὶ τὰ πετεινὰ τοῦ οὐρανοῦ κατήσθιεν αὐτὰ ἀπὸ τοῦ κανοῦ τοῦ ἐπάνω τῆς κεφαλῆς μου.	 And in the upper basket there was the work of the baker of every kind which Pharao eats; and the fowls of the air ate them out of the basket that was on my head.	
Genesis	40	18	 ⲁϥⲉⲣⲟⲩⲱ ⲛ̀ϫⲉ ⲓⲱⲥⲏⲫ ⲡⲉϫⲁϥ ⲛⲁϥ ϫⲉ ⲫⲁⲓ ⲡⲉ ⲡⲉⲥⲃⲱⲗ ⲡⲓⲅ̅ ⲛ̀ⲕⲁⲛⲟⲩⲛ ⲅ̅ ⲛ̀ⲉϩⲟⲟⲩ ⲛⲉ							 ἀποκριθεὶς δὲ Ιωσηφ εἶπεν αὐτῷ Αὕτη ἡ σύγκρισις αὐτοῦ· τὰ τρία κανᾶ τρεῖς ἡμέραι εἰσίν·	 And Joseph answered and said to him, This is the interpretation of it; The three baskets are three days.	
Genesis	40	19	 ⲉⲧⲓ ⲕⲉⲅ̅ ⲛ̀ⲉϩⲟⲟⲩ ⲉⲣⲉ ⲫⲁⲣⲁⲱ ⲱⲗⲓ ⲛ̀ⲧⲉⲕⲁⲫⲉ ⲉ̀ⲃⲟⲗ ⲙ̀ⲙⲟⲕ ⲟⲩⲟϩ ⲉϥⲉ̀ⲁϣⲕ ⲉ̀ϫⲉⲛ ⲟⲩϣⲉ ⲟⲩⲟϩ ⲉⲩⲉ̀ⲟⲩⲱⲙ ⲛ̀ϫⲉ ⲛⲓϩⲁⲗⲁϯ ⲛ̀ⲧⲉ ⲧⲫⲉ ⲛ̀ⲛⲉⲕⲁϥⲟⲩⲓ ⲉ̀ⲃⲟⲗ ⲙ̀ⲙⲟⲕ							 ἔτι τριῶν ἡμερῶν ἀφελεῖ Φαραω τὴν κεφαλήν σου ἀπὸ σοῦ καὶ κρεμάσει σε ἐπὶ ξύλου, καὶ φάγεται τὰ ὄρνεα τοῦ οὐρανοῦ τὰς σάρκας σου ἀπὸ σοῦ.—	 Yet three days, and Pharao shall take away thy head from off thee, and shall hang thee on a tree, and the birds of the sky shall eat thy flesh from off thee.	
Genesis	40	20	 ⲁⲥϣⲱⲡⲓ ⲇⲉ ϧⲉⲛ ⲡⲓⲉϩⲟⲟⲩ ⲙ̀ⲙⲁϩⲅ̅ ⲛⲉ ⲡⲉϩⲟⲟⲩ ⲙ̀ⲙⲓⲥⲓ ⲙ̀ⲫⲁⲣⲁⲱ ⲡⲉ ⲟⲩⲟϩ ⲁϥⲓⲣⲓ ⲛ̀ⲟⲩⲥⲱ ⲉ̀ⲛⲉϥⲁⲗⲱⲟⲩⲓ ⲧⲏⲣⲟⲩ ⲟⲩⲟϩ ⲁϥⲉⲣⲫⲙⲉⲩⲓ ⲛ̀ϯⲁⲣⲭⲏ ⲛ̀ⲧⲉ ⲡⲓⲣⲉϥⲟⲩⲱⲧϩ ⲛⲉⲙ ϯⲁⲣⲭⲏ ⲛ̀ⲧⲉ ⲡⲓⲁⲙⲣⲉ ϧⲉⲛ ⲑⲙⲏϯ ⲛ̀ⲛⲉϥⲁⲗⲱⲟⲩⲓ							 ἐγένετο δὲ ἐν τῇ ἡμέρᾳ τῇ τρίτῃ ἡμέρα γενέσεως ἦν Φαραω, καὶ ἐποίει πότον πᾶσι τοῖς παισὶν αὐτοῦ. καὶ ἐμνήσθη τῆς ἀρχῆς τοῦ ἀρχιοινοχόου καὶ τῆς ἀρχῆς τοῦ ἀρχισιτοποιοῦ ἐν μέσῳ τῶν παίδων αὐτοῦ	 And it came to pass on the third day that it was Pharao’s birth-day, and he made a banquet for all his servants, and he remembered the office of the cupbearer and the office of the baker in the midst of his servants.	
Genesis	40	21	 ⲟⲩⲟϩ ⲁϥⲧⲁϩⲉ ⲙ̀ⲡⲓⲣⲉϥⲟⲩⲱⲧϩ ⲉ̀ϫⲉⲛ ⲧⲉϥⲁⲣⲭⲏ ⲟⲩⲟϩ ⲁϥϯ ⲙ̀ⲡⲓⲁⲫⲟⲧ ⲉ̀ⲧϫⲓϫ ⲙ̀ⲫⲁⲣⲁⲱ							 καὶ ἀπεκατέστησεν τὸν ἀρχιοινοχόον ἐπὶ τὴν ἀρχὴν αὐτοῦ, καὶ ἔδωκεν τὸ ποτήριον εἰς τὴν χεῖρα Φαραω,	 And he restored the chief cupbearer to his office, and he gave the cup into Pharao’s hand.	
Genesis	40	22	 ⲡⲓⲁⲙⲣⲉ ⲇⲉ ⲁϥⲁϣϥ ⲕⲁⲧⲁ ⲫⲣⲏϯ ⲉⲧⲁϥⲃⲱⲗ ⲛ̀ϫⲉ ⲓⲱⲥⲏⲫ							 τὸν δὲ ἀρχισιτοποιὸν ἐκρέμασεν, καθὰ συνέκρινεν αὐτοῖς Ιωσηφ.	 And he hanged the chief baker, as Joseph interpreted to them.	
Genesis	40	23	 ⲙ̀ⲡⲉϥⲉⲣⲫⲙⲉⲩⲓ ⲇⲉ ⲛ̀ⲓⲱⲥⲏⲫ ⲛ̀ϫⲉ ⲡⲓⲣⲉϥⲟⲩⲱⲧϩ ⲁⲗⲗⲁ ⲁϥⲉⲣⲡⲱⲃϣ							 οὐκ ἐμνήσθη δὲ ὁ ἀρχιοινοχόος τοῦ Ιωσηφ, ἀλλὰ ἐπελάθετο αὐτοῦ.	 Yet did not the chief cupbearer remember Joseph, but forgot him.	
Genesis	41	1	 ⲁⲥϣⲱⲡⲓ ⲇⲉ ⲙⲉⲛⲉⲛⲥⲁ ⲣⲟⲙⲡⲓ ⲃ̅ϯ ⲛ̀ⲉϩⲟⲟⲩ ⲫⲁⲣⲁⲱ ⲁϥⲛⲁⲩ ⲉ̀ⲟⲩⲣⲁⲥⲟⲩⲓ ⲓⲥϫⲉⲕ ⲛⲁϥⲟϩⲓ ⲉ̀ⲣⲁⲧϥ ⲡⲉ ϩⲓϫⲉⲛ ⲫⲓⲁⲣⲟ							 ᾿Εγένετο δὲ μετὰ δύο ἔτη ἡμερῶν Φαραω εἶδεν ἐνύπνιον. ᾤετο ἑστάναι ἐπὶ τοῦ ποταμοῦ,	 And it came to pass after two full years that Pharao had a dream. He thought he stood upon the bank of the river.	
