book	chapter	verse	Bohairic	Akhmimic	Fayyumic	OldBohairic	Mesokemic	DialectP	Lycopolitan	Greek	English	Sahidic
Genesis	16	10	 ⲟⲩⲟϩ ⲡⲉϫⲉ ⲡⲓⲁⲅⲅⲉⲗⲟⲥ ⲛ̀ⲧⲉ ⲡϭ̅ⲥ̅ ⲛⲁⲥ ϫⲉ ϧⲉⲛ ⲟⲩⲁ̀ϣⲁⲓ ⲉⲓⲉ̀ⲑⲣⲉ ⲡⲉⲕϫⲣⲟϫ ⲁϣⲁⲓ ⲟⲩⲟϩ ⲛ̀ⲛⲟⲩϭⲓⲏⲡⲓ ⲙ̀ⲙⲟϥ ⲉ̀ⲃⲟⲗ ϧⲉⲛ ⲡⲉϥⲁ̀ϣⲁⲓ							 καὶ εἶπεν αὐτῇ ὁ ἄγγελος κυρίου Πληθύνων πληθυνῶ τὸ σπέρμα σου, καὶ οὐκ ἀριθμηθήσεται ἀπὸ τοῦ πλήθους.	 And the angel of the Lord said to her, I will surely multiply thy seed, and it shall not be numbered for multitude.	
Genesis	16	11	 ⲟⲩⲟϩ ⲡⲉϫⲁϥ ⲛⲁⲥ ⲛ̀ϫⲉ ⲡⲓⲁⲅⲅⲉⲗⲟⲥ ⲛ̀ⲧⲉ ⲡϭ̅ⲥ̅ ϫⲉ ϩⲏⲡⲡⲉ ⲛ̀ⲑⲟ ⲧⲉⲙⲃⲟⲕⲓ ⲟⲩⲟϩ ⲉⲣⲉ̀ⲙⲓⲥⲓ ⲛ̀ⲟⲩϣⲏⲣⲓ ⲟⲩⲟϩ ⲉⲣⲉ̀ⲙⲟⲩϯ ⲉ̀ⲡⲉϥⲣⲁⲛ ϫⲉ ⲓⲥⲙⲁⲏⲗ ϫⲉ ⲁϥⲥⲱⲧⲉⲙ ⲛ̀ϫⲉ ⲡϭ̅ⲥ̅ ⲉ̀ⲡⲉⲑⲉⲃⲓⲟ							 καὶ εἶπεν αὐτῇ ὁ ἄγγελος κυρίου ᾿Ιδοὺ σὺ ἐν γαστρὶ ἔχεις καὶ τέξῃ υἱὸν καὶ καλέσεις τὸ ὄνομα αὐτοῦ Ισμαηλ, ὅτι ἐπήκουσεν κύριος τῇ ταπεινώσει σου.	 And the angel of the Lord said to her, Behold, thou art with child, and shalt bear a son, and shalt call his name Ismael, for the Lord hath hearkened to thy humiliation.	
Genesis	16	12	 ⲫⲁⲓ ⲉϥⲉ̀ⲉⲣ ⲟⲩⲣⲱⲙⲓ ⲛ̀ⲣⲉⲙⲛ̀ⲕⲟⲓ ⲛⲉϥϫⲓϫ ⲉⲩⲉ̀ϣⲱⲡⲓ ϩⲓϫⲉⲛ ⲟⲩⲟⲛ ⲛⲓⲃⲉⲛ ⲟⲩⲟϩ ⲛⲉⲛϫⲓϫ ⲛ̀ⲟⲩⲟⲛ ⲛⲓⲃⲉⲛ ⲉⲩⲉ̀ϣⲱⲡⲓ ϩⲓϫⲱϥ ⲟⲩⲟϩ ⲉϥⲉ̀ϣⲱⲡⲓ ⲙ̀ⲡⲉⲙ̀ⲑⲟ ⲛ̀ⲛⲉϥⲥⲛⲏⲟⲩ ⲧⲏⲣⲟⲩ							 οὗτος ἔσται ἄγροικος ἄνθρωπος· αἱ χεῖρες αὐτοῦ ἐπὶ πάντας, καὶ αἱ χεῖρες πάντων ἐπ᾽ αὐτόν, καὶ κατὰ πρόσωπον πάντων τῶν ἀδελφῶν αὐτοῦ κατοικήσει.	 He shall be a wild man, his hands against all, and the hands of all against him, and he shall dwell in the presence of all his brethren.	
Genesis	16	13	 ⲟⲩⲟϩ ⲁⲥⲙⲟⲩϯ ⲛ̀ϫⲉ ⲁⲅⲁⲣ ⲉ̀ⲫⲣⲁⲛ ⲙ̀ⲡϭ̅ⲥ̅ ⲫⲏ ⲉⲧⲁϥⲥⲁϫⲓ ⲛⲉⲙⲁⲥ ϫⲉ ⲛ̀ⲑⲟⲕ ⲡⲉ ⲫϯ ⲉⲧⲁϥⲥⲟⲙⲥ ⲉ̀ⲣⲟⲓ ϫⲉ ⲁⲓϫⲟⲥ ⲕⲉⲅⲁⲣ ⲁⲓⲛⲁⲩ ⲉ̀ⲣⲟϥ ⲉ̀ⲁϥⲟⲩⲟⲛϩϥ ⲉ̀ⲣⲟⲓ ⲙⲡⲁⲙ̀ⲑⲟ							 καὶ ἐκάλεσεν Αγαρ τὸ ὄνομα κυρίου τοῦ λαλοῦντος πρὸς αὐτήν Σὺ ὁ θεὸς ὁ ἐπιδών με· ὅτι εἶπεν Καὶ γὰρ ἐνώπιον εἶδον ὀφθέντα μοι.	 And she called the name of the Lord God who spoke to her, Thou art God who seest me; for she said, For I have openly seen him that appeared to me.	
Genesis	16	14	 ⲉⲑⲃⲉⲫⲁⲓ ⲁⲥϯⲣⲉⲛ ⲫⲣⲁⲛ ⲛ̀ϯϣⲱϯ ϫⲉ ⲧϣⲱϯ ⲉⲧⲁⲓⲛⲁⲩ ⲙ̀ⲡⲁⲙ̀ⲑⲟ ⲟⲩⲧⲉ ⲕⲁⲇⲏⲥ ⲛⲉⲙ ⲟⲩⲧⲉ ⲃⲁⲣⲁⲕ							 ἕνεκεν τούτου ἐκάλεσεν τὸ φρέαρ Φρέαρ οὗ ἐνώπιον εἶδον· ἰδοὺ ἀνὰ μέσον Καδης καὶ ἀνὰ μέσον Βαραδ.	 Therefore she called the well, The well of him whom I have openly seen; behold it is between Cades and Barad.	
Genesis	16	15	 ⲟⲩⲟϩ ⲁⲥⲙⲓⲥⲓ ⲛ̀ϫⲉ ⲁⲅⲁⲣ ⲛ̀ⲟⲩϣⲏⲣⲓ ⲛ̀ⲁⲃⲣⲁⲙ ⲟⲩⲟϩ ⲁ ⲁⲃⲣⲁⲙ ϯⲣⲉⲛ ⲫⲣⲁⲛ ⲙ̀ⲡⲓϣⲏⲣⲓ ⲫⲏ ⲉⲧⲁ ⲁⲅⲁⲣ ⲙⲁⲥϥ ⲛⲁϥ ϫⲉ ⲓⲥⲙⲁⲏⲗ							 Καὶ ἔτεκεν Αγαρ τῷ Αβραμ υἱόν, καὶ ἐκάλεσεν Αβραμ τὸ ὄνομα τοῦ υἱοῦ αὐτοῦ, ὃν ἔτεκεν αὐτῷ Αγαρ, Ισμαηλ.	 And Agar bore a son to Abram; and Abram called the name of his son which Agar bore to him, Ismael.	
Genesis	16	16	 ⲁⲃⲣⲁⲙ ⲇⲉ ⲛⲁϥⲭⲏ ϧⲉⲛ ⲡⲋ̅ ⲛ̀ⲣⲟⲙⲡⲓ ⲉⲧⲁⲥⲙⲓⲥⲓ ⲛⲁϥ ⲛ̀ϫⲉ ⲁⲅⲁⲣ ⲛ̀ⲓⲥⲙⲁⲏⲗ							 Αβραμ δὲ ἦν ὀγδοήκοντα ἓξ ἐτῶν, ἡνίκα ἔτεκεν Αγαρ τὸν Ισμαηλ τῷ Αβραμ.	 And Abram was eighty-six years old, when Agar bore Ismael to Abram.	
Genesis	17	1	 ⲁϥϣⲱⲡⲓ ⲇⲉ ⲛ̀ϫⲉ ⲁⲃⲣⲁⲙ ϧⲉⲛ ϥ̅ⲑ̅ ⲛ̀ⲣⲟⲙⲡⲓ ⲟⲩⲟϩ ⲁ ⲡϭ̅ⲥ̅ ⲟⲩⲟⲛϩϥ ⲉ̀ⲁⲃⲣⲁⲙ ⲡⲉϫⲁϥ ⲛⲁϥ ϫⲉ ⲁ̀ⲛⲟⲕ ⲡⲉ ⲫϯ ϣⲱⲡⲓ ⲉⲕⲣⲁⲛⲏⲓ ⲙ̀ⲡⲁⲙ̀ⲑⲟ ⲟⲩⲟϩ ϣⲱⲡⲓ ⲙ̀ⲙⲟⲛ ⲁⲣⲓⲕⲓ ϭⲓ ⲉⲣⲟⲕ							 ᾿Εγένετο δὲ Αβραμ ἐτῶν ἐνενήκοντα ἐννέα, καὶ ὤφθη κύριος τῷ Αβραμ καὶ εἶπεν αὐτῷ ᾿Εγώ εἰμι ὁ θεός σου· εὐαρέστει ἐναντίον ἐμοῦ καὶ γίνου ἄμεμπτος,	 And Abram was ninety-nine years old, and the Lord appeared to Abram and said to him, I am thy God, be well-pleasing before me, and be blameless.	
Genesis	17	2	 ⲟⲩⲟϩ ⲉⲓⲉ̀ⲭⲱ ⲛ̀ⲧⲁⲇⲓⲁⲑⲏⲕⲏ ⲟⲩⲧⲱⲓ ⲛⲉⲙ ⲟⲩⲧⲱⲕ ⲟⲩⲟϩ ⲉⲓⲉ̀ⲑⲣⲉⲕⲁ̀ϣⲁⲓ ⲉ̀ⲙⲁϣⲱ							 καὶ θήσομαι τὴν διαθήκην μου ἀνὰ μέσον ἐμοῦ καὶ ἀνὰ μέσον σοῦ καὶ πληθυνῶ σε σφόδρα.	 And I will establish my covenant between me and thee, and I will multiply thee exceedingly.	
Genesis	17	3	 ⲟⲩⲟϩ ⲁϥϩⲉⲓ ⲛ̀ϫⲉ ⲁⲃⲣⲁⲙ ⲉ̀ϫⲉⲛ ⲡⲉϥϩⲟ ⲟⲩⲟϩ ⲁϥⲥⲁϫⲓ ⲛⲉⲙⲁϥ ⲛ̀ϫⲉ ⲫϯ ⲉϥϫⲱ ⲙ̀ⲙⲟⲥ							 καὶ ἔπεσεν Αβραμ ἐπὶ πρόσωπον αὐτοῦ, καὶ ἐλάλησεν αὐτῷ ὁ θεὸς λέγων	 And Abram fell upon his face, and God spoke to him, saying,	
Genesis	17	4	 ϫⲉ ⲁ̀ⲛⲟⲕ ϩⲏⲡⲡⲉ ⲓⲥ ⲧⲁⲇⲓⲁⲑⲏⲕⲏ ⲥⲭⲏ ⲛⲉⲙⲁⲕ ⲟⲩⲟϩ ⲉⲕⲉ̀ϣⲱⲡⲓ ⲛ̀ⲓⲱⲧ ⲛ̀ⲟⲩⲙⲏϣ ⲛ̀ϣⲗⲟⲗ							 Καὶ ἐγὼ ἰδοὺ ἡ διαθήκη μου μετὰ σοῦ, καὶ ἔσῃ πατὴρ πλήθους ἐθνῶν.	 And I, behold! my covenant is with thee, and thou shalt be a father of a multitude of nations.	
Genesis	17	5	 ⲟⲩⲟϩ ⲛ̀ⲛⲟⲩⲙⲟⲩϯ ⲉ̀ⲡⲉⲕⲣⲁⲛ ϫⲉ ⲁⲃⲣⲁⲙ ⲁⲗⲗⲁ ⲉⲣⲉ ⲡⲉⲕⲣⲁⲛ ϣⲱⲡⲓ ϫⲉ ⲁⲃⲣⲁⲁⲙ ϫⲉ ⲁⲓⲭⲁⲕ ⲛ̀ⲓⲱⲧ ⲛ̀ⲟⲩⲙⲏϣ ⲛ̀ⲉⲑⲛⲟⲥ							 καὶ οὐ κληθήσεται ἔτι τὸ ὄνομά σου Αβραμ, ἀλλ᾽ ἔσται τὸ ὄνομά σου Αβρααμ, ὅτι πατέρα πολλῶν ἐθνῶν τέθεικά σε.	 And thy name shall no more be called Abram, but thy name shall be Abraam, for I have made thee a father of many nations.	
Genesis	17	6	 ⲟⲩⲟϩ ⲉⲓⲉ̀ⲑⲣⲉⲕⲁϣⲁⲓ ⲉ̀ⲙⲁϣⲱ ⲉ̀ⲙⲁϣⲱ ⲟⲩⲟϩ ⲉⲓⲉ̀ⲭⲁⲕ ⲉ̀ϩⲁⲛϣⲗⲱⲗ ⲟⲩⲟϩ ϩⲁⲛⲟⲩⲣⲱⲟⲩ ⲉⲩⲉ̀ⲓ̀ ⲉ̀ⲃⲟⲗ ⲙ̀ⲙⲟⲕ							 καὶ αὐξανῶ σε σφόδρα σφόδρα καὶ θήσω σε εἰς ἔθνη, καὶ βασιλεῖς ἐκ σοῦ ἐξελεύσονται.	 And I will increase thee very exceedingly, and I will make nations of thee, and kings shall come out of thee.	
Genesis	17	7	 ⲟⲩⲟϩ ⲉⲓⲉ̀ⲥⲉⲙⲛⲓ ⲛ̀ⲧⲁⲇⲓⲁⲑⲏⲕⲏ ⲟⲩⲧⲱⲓ ⲛⲉⲙ ⲟⲩⲧⲱⲕ ⲛⲉⲙ ⲟⲩⲧⲉ ⲡⲉⲕϫⲣⲟϫ ⲙⲉⲛⲉⲛⲥⲱⲕ ϣⲁ ⲛⲟⲩⲅⲉⲛⲉⲁ ⲉⲩⲇⲓⲁⲑⲏⲕⲏ ⲛ̀ⲉⲛⲉϩ ⲉⲑⲣⲓϣⲱⲡⲓ ⲛⲁⲕ ⲛ̀ⲛⲟⲩϯ ⲛⲉⲙ ⲡⲉⲕϫⲣⲟϫ ⲙⲉⲛⲉⲛⲥⲱⲕ							 καὶ στήσω τὴν διαθήκην μου ἀνὰ μέσον ἐμοῦ καὶ ἀνὰ μέσον σοῦ καὶ ἀνὰ μέσον τοῦ σπέρματός σου μετὰ σὲ εἰς γενεὰς αὐτῶν εἰς διαθήκην αἰώνιον εἶναί σου θεὸς καὶ τοῦ σπέρματός σου μετὰ σέ.	 And I will establish my covenant between thee and thy seed after thee, to their generations, for an everlasting covenant, to be thy God, and the God of thy seed after thee.	
Genesis	17	8	 ⲟⲩⲟϩ ⲉⲓⲉ̀ϯ ⲛⲁⲕ ⲛⲉⲙ ⲡⲉⲕϫⲣⲟϫ ⲙⲉⲛⲉⲛⲥⲱⲕ ⲙ̀ⲡⲓⲕⲁϩⲓ ⲉⲧⲉⲕⲟⲓ ⲛ̀ⲣⲉⲙⲛ̀ϫⲱⲓⲗⲓ ⲛ̀ϧⲏⲧϥ ⲡⲕⲁϩⲓ ⲧⲏⲣϥ ⲛ̀ⲭⲁⲛⲁⲁⲛ ⲉⲩⲁⲙⲁϩⲓ ⲛ̀ⲉⲛⲉϩ ⲟⲩⲟϩ ⲉⲓⲉ̀ϣⲱⲡⲓ ⲛⲱⲟⲩ ⲛ̀ⲛⲟⲩϯ							 καὶ δώσω σοι καὶ τῷ σπέρματί σου μετὰ σὲ τὴν γῆν, ἣν παροικεῖς, πᾶσαν τὴν γῆν Χανααν, εἰς κατάσχεσιν αἰώνιον καὶ ἔσομαι αὐτοῖς θεός.—	 And I will give to thee and to thy seed after thee the land wherein thou sojournest, even all the land of Chanaan for an everlasting possession, and I will be to them a God.	
Genesis	17	9	 ⲟⲩⲟϩ ⲡⲉϫⲉ ⲫϯ ⲟⲩⲃⲉ ⲁⲃⲣⲁⲁⲙ ϫⲉ ⲛ̀ⲑⲟⲕ ⲇⲉ ⲧⲁⲇⲓⲁⲑⲏⲕⲏ ⲉⲕⲉ̀ⲁⲣⲉϩ ⲉ̀ⲣⲟⲥ ⲛ̀ⲑⲟⲕ ⲛⲉⲙ ⲡⲉⲕϫⲣⲟϫ ⲙⲉⲛⲉⲛⲥⲱⲕ ϣⲁ ⲛⲟⲩϫⲱⲟⲩ							 καὶ εἶπεν ὁ θεὸς πρὸς Αβρααμ Σὺ δὲ τὴν διαθήκην μου διατηρήσεις, σὺ καὶ τὸ σπέρμα σου μετὰ σὲ εἰς τὰς γενεὰς αὐτῶν.	 And God said to Abraam, Thou also shalt fully keep my covenant, thou and thy seed after thee for their generations.	
Genesis	17	10	 ⲟⲩⲟϩ ⲑⲁⲓ ⲧⲉ ⲧⲁⲇⲓⲁⲑⲏⲕⲏ ⲉⲧⲉⲕⲛⲁⲁⲣⲉϩ ⲉ̀ⲣⲟⲥ ⲟⲩⲧⲱⲓ ⲛⲉⲙⲱⲧⲉⲛ ⲛⲉⲙ ⲟⲩⲧⲉ ⲡⲉⲕϫⲣⲟϫ ⲙⲉⲛⲉⲛⲥⲱⲕ ϣⲁ ⲛⲟⲩϫⲱⲟⲩ							 καὶ αὕτη ἡ διαθήκη, ἣν διατηρήσεις, ἀνὰ μέσον ἐμοῦ καὶ ὑμῶν καὶ ἀνὰ μέσον τοῦ σπέρματός σου μετὰ σὲ εἰς τὰς γενεὰς αὐτῶν·	 And this is the covenant which thou shalt fully keep between me and you, and between thy seed after thee for their generations;	
Genesis	17		 ϩⲱⲟⲩⲧ ⲛⲓⲃⲉⲛ ⲛ̀ⲧⲱⲧⲉⲛ ⲉϥⲉ̀ⲥⲟⲩⲃⲏⲧϥ ⲟⲩⲟϩ ⲉⲣⲉⲧⲉⲛⲉ̀ⲥⲟⲩⲃⲉ ⲧⲥⲁⲣⲝ ⲛ̀ⲧⲉⲧⲉⲛⲙⲉⲧⲁⲧⲥⲉⲃⲓ ⲟⲩⲟϩ ⲉϥⲉ̀ϣⲱⲡⲓ ϧⲉⲛ ⲟⲩⲙⲏⲓⲛⲓ ⲛ̀ⲧⲉ ⲟⲩⲇⲓⲁⲑⲏⲕⲏ ⲟⲩⲧⲱⲓ ⲛⲉⲙⲱⲧⲉⲛ							περιτμηθήσεται ὑμῶν πᾶν ἀρσενικόν, (11) καὶ περιτμηθήσεσθε τὴν σάρκα τῆς ἀκροβυστίας ὑμῶν, καὶ ἔσται ἐν σημείῳ διαθήκης ἀνὰ μέσον ἐμοῦ καὶ ὑμῶν.	every male of you shall be circumcised. (11) And ye shall be circumcised in the flesh of your foreskin, and it shall be for a sign of a covenant between me and you.	
Genesis	17	12	 ⲟⲩⲟϩ ⲟⲩⲁⲗⲟⲩ ϧⲉⲛ ⲏ̅ ⲛ̀ⲉϩⲟⲟⲩ ⲉⲩⲉ̀ⲥⲟⲩⲃⲏⲧϥ ⲛⲱⲧⲉⲛ ⲛⲉⲧⲉⲛϩⲱⲟⲩⲧ ⲧⲏⲣⲟⲩ ϣⲁ ⲛⲉⲧⲉⲛϫⲱⲟⲩ ⲡⲓⲙⲉⲥ ϧⲉⲛ ⲏⲓ ⲛⲉⲙ ⲡⲓϣⲱⲡ ϧⲁ ϩⲁⲧ ⲉ̀ⲃⲟⲗ ϧⲉⲛ ϣⲏⲣⲓ ⲛⲓⲃⲉⲛ ⲛ̀ϣⲉⲙⲙⲱⲟⲩ ⲉⲧⲉ ⲉ̀ⲃⲟⲗ ϧⲉⲛ ⲡⲉⲕϫⲣⲟϫ ⲁⲛ ⲛⲉ ϧⲉⲛ ⲟⲩⲥⲉⲃⲓ ⲉⲕⲉ̀ⲥⲟⲩⲃⲏⲧⲟⲩ ⲡⲓⲙⲉⲥ ϧⲉⲛ ⲏⲓ ⲛ̀ⲧⲉ ⲡⲉⲕⲏⲓ ⲛⲉⲙ ⲡⲓϣⲱⲡ ϧⲁ ϩⲁⲧ							 καὶ παιδίον ὀκτὼ ἡμερῶν περιτμηθήσεται ὑμῖν πᾶν ἀρσενικὸν εἰς τὰς γενεὰς ὑμῶν, ὁ οἰκογενὴς τῆς οἰκίας σου καὶ ὁ ἀργυρώνητος ἀπὸ παντὸς υἱοῦ ἀλλοτρίου, ὃς οὐκ ἔστιν ἐκ τοῦ σπέρματός σου. (13) περιτομῇ περιτμηθήσεται ὁ οἰκογενὴς τῆς οἰκίας σου καὶ ὁ ἀργυρώνητος,	 And the child of eight days old shall be circumcised by you, every male throughout your generations, and the servant born in the house and he that is bought with money, of every son of a stranger, who is not of thy seed. (13) He that is born in thy house, and he that is bought with money shall be surely circumcised,	
Genesis	17		 ⲟⲩⲟϩ ⲉⲥⲉ̀ϣⲱⲡⲓ ⲛ̀ϫⲉ ⲧⲁⲇⲓⲁⲑⲏⲕⲏ ϩⲓ ⲧⲉⲧⲉⲛⲥⲁⲣⲝ ⲉⲩⲇⲓⲁⲑⲏⲕⲏ ⲛ̀ⲉⲛⲉϩ							καὶ ἔσται ἡ διαθήκη μου ἐπὶ τῆς σαρκὸς ὑμῶν εἰς διαθήκην αἰώνιον.	and my covenant shall be on your flesh for an everlasting covenant.	
Genesis	17	14	 ⲟⲩⲟϩ ⲡⲓϩⲱⲟⲩⲧ ⲉⲧⲟⲓ ⲛ̀ⲁⲧⲥⲉⲃⲓ ⲫⲏ ⲉⲧⲟⲩⲛⲁⲥⲟⲩⲃⲉ ⲧⲥⲁⲣⲝ ⲁⲛ ⲛ̀ⲧⲉ ⲧⲉϥⲙⲉⲧⲁⲧⲥⲉⲃⲓ ϧⲉⲛ ⲡⲓⲙⲁϩⲏ ⲛ̀ⲉϩⲟⲟⲩ ⲉⲩⲉ̀ϥⲱϯ ⲛ̀ϯⲯⲩⲭⲏ ⲉⲧⲉⲙ̀ⲙⲁⲩ ⲉ̀ⲃⲟⲗ ϧⲉⲛ ⲡⲉⲥⲅⲉⲛⲟⲥ ϫⲉ ⲧⲁⲇⲓⲁⲑⲏⲕⲏ ⲁϥϫⲟⲣⲥ ⲉ̀ⲃⲟⲗ							 καὶ ἀπερίτμητος ἄρσην, ὃς οὐ περιτμηθήσεται τὴν σάρκα τῆς ἀκροβυστίας αὐτοῦ τῇ ἡμέρᾳ τῇ ὀγδόῃ, ἐξολεθρευθήσεται ἡ ψυχὴ ἐκείνη ἐκ τοῦ γένους αὐτῆς, ὅτι τὴν διαθήκην μου διεσκέδασεν.	 And the uncircumcised male, who shall not be circumcised in the flesh of his foreskin on the eighth day, that soul shall be utterly destroyed from its family, for he has broken my covenant.	
Genesis	17	15	 ⲟⲩⲟϩ ⲡⲉϫⲉ ⲫϯ ⲛ̀ⲁⲃⲣⲁⲁⲙ ϫⲉ ⲥⲁⲣⲁ ⲧⲉⲕⲥϩⲓⲙⲓ ⲛ̀ⲛⲟⲩⲙⲟⲩϯ ϫⲉ ⲡⲉⲥⲣⲁⲛ ϫⲉ ⲥⲁⲣⲁ ⲁⲗⲗⲁ ⲉⲣⲉ ⲡⲉⲥⲣⲁⲛ ϣⲱⲡⲓ ϫⲉ ⲥⲁⲣⲣⲁ							 Εἶπεν δὲ ὁ θεὸς τῷ Αβρααμ Σαρα ἡ γυνή σου, οὐ κληθήσεται τὸ ὄνομα αὐτῆς Σαρα, ἀλλὰ Σαρρα ἔσται τὸ ὄνομα αὐτῆς.	 And God said to Abraam, Sara thy wife—her name shall not be called Sara, Sarrha shall be her name.	
Genesis	17	16	 ⲉⲓⲉ̀ⲥⲙⲟⲩ ⲇⲉ ⲉ̀ⲣⲟⲥ ⲟⲩⲟϩ ⲉⲓⲉ̀ϯ ⲛⲁⲕ ⲛ̀ⲟⲩϣⲏⲣⲓ ⲉ̀ⲃⲟⲗ ⲙ̀ⲙⲟⲥ ⲉⲓⲉⲥ̀ⲙⲟⲩ ⲉ̀ⲣⲟϥ ⲟⲩⲟϩ ⲉϥⲉ̀ϣⲱⲡⲓ ⲉ̀ϩⲁⲛϣⲗⲟⲗ ⲟⲩⲟϩ ϩⲁⲛⲟⲩⲣⲱⲟⲩ ⲛ̀ⲧⲉ ϩⲁⲛϣⲗⲟⲗ ⲉⲩⲉ̀ⲓ̀ ⲉ̀ⲃⲟⲗ ⲙ̀ⲙⲟϥ							 εὐλογήσω δὲ αὐτὴν καὶ δώσω σοι ἐξ αὐτῆς τέκνον· καὶ εὐλογήσω αὐτόν, καὶ ἔσται εἰς ἔθνη, καὶ βασιλεῖς ἐθνῶν ἐξ αὐτοῦ ἔσονται.	 And I will bless her, and give thee a son of her, and I will bless him, and he shall become nations, and kings of nations shall be of him.	
Genesis	17	17	 ⲟⲩⲟϩ ⲁϥϩⲓⲧϥ ⲛ̀ϫⲉ ⲁⲃⲣⲁⲁⲙ ⲉ̀ϫⲉⲛ ⲡⲉϥϩⲟ ⲟⲩⲟϩ ⲁϥⲥⲱⲃⲓ ⲟⲩⲟϩ ⲡⲉϫⲁϥ ϧⲉⲛ ⲡⲉϥϩⲏⲧ ⲉϥϫⲱ ⲙ̀ⲙⲟⲥ ϫⲉ ⲁⲛ ⲉⲥⲉ̀ϣⲱⲡⲓ ⲙ̀ⲫⲏ ⲉⲧⲁϥⲉⲣ ⲣ̅ ⲛ̀ⲣⲟⲙⲡⲓ ⲟⲩⲟϩ ⲥⲁⲣⲣⲁ ⲁⲥⲉⲣ ϥ̅ ⲛ̀ⲣⲟⲙⲡⲓ ⲁⲛ ⲉⲥⲉ̀ⲙⲓⲥⲓ							 καὶ ἔπεσεν Αβρααμ ἐπὶ πρόσωπον καὶ ἐγέλασεν καὶ εἶπεν ἐν τῇ διανοίᾳ αὐτοῦ λέγων Εἰ τῷ ἑκατονταετεῖ γενήσεται, καὶ εἰ Σαρρα ἐνενήκοντα ἐτῶν οὖσα τέξεται;	 And Abraam fell upon his face, and laughed; and spoke in his heart, saying, Shall there be a child to one who is a hundred years old, and shall Sarrha who is ninety years old, bear?	
Genesis	17	18	 ⲡⲉϫⲉ ⲁⲃⲣⲁⲁⲙ ⲇⲉ ⲟⲩⲃⲉ ⲫϯ ϫⲉ ⲓⲥⲙⲁⲏⲗ ⲫⲁⲓ ⲙⲁⲣⲉϥⲱⲛϧ ⲙ̀ⲡⲉⲕⲙ̀ⲑⲟ							 εἶπεν δὲ Αβρααμ πρὸς τὸν θεόν Ισμαηλ οὗτος ζήτω ἐναντίον σου.	 And Abraam said to God, Let this Ismael live before thee.	
Genesis	17	19	 ⲡⲉϫⲉ ⲫϯ ⲇⲉ ⲛ̀ⲁⲃⲣⲁⲁⲙ ϫⲉ ⲁⲣⲁ ϩⲏⲡⲡⲉ ⲓⲥ ⲥⲁⲣⲣⲁ ⲧⲉⲕⲥϩⲓⲙⲓ ⲉⲥⲉ̀ⲙⲓⲥⲓ ⲛⲁⲕ ⲛ̀ⲟⲩϣⲏⲣⲓ ⲟⲩⲟϩ ⲉⲕⲉ̀ⲙⲟⲩϯ ⲉ̀ⲡⲉϥⲣⲁⲛ ϫⲉ ⲓⲥⲁⲁⲕ ⲟⲩⲟϩ ⲉⲓⲉ̀ⲥⲉⲙⲛⲓ ⲛ̀ⲧⲁⲇⲓⲁⲑⲏⲕⲏ ⲛⲉⲙⲁϥ ⲉⲩⲇⲓⲁⲑⲏⲕⲏ ⲛ̀ⲉⲛⲉϩ ⲉⲑⲣⲓϣⲱⲡⲓ ⲛⲁϥ ⲛ̀ⲛⲟⲩϯ ⲛⲉⲙ ⲡⲉⲕϫⲣⲟϫ ⲙⲉⲛⲉⲛⲥⲱϥ							 εἶπεν δὲ ὁ θεὸς τῷ Αβρααμ Ναί· ἰδοὺ Σαρρα ἡ γυνή σου τέξεταί σοι υἱόν, καὶ καλέσεις τὸ ὄνομα αὐτοῦ Ισαακ, καὶ στήσω τὴν διαθήκην μου πρὸς αὐτὸν εἰς διαθήκην αἰώνιον καὶ τῷ σπέρματι αὐτοῦ μετ᾽ αὐτόν.	 And God said to Abraam, Yea, behold, Sarrha thy wife shall bear thee a son, and thou shalt call his name Isaac; and I will establish my covenant with him, for an everlasting covenant, to be a God to him and to his seed after him.	
Genesis	17	20	 ⲉⲑⲃⲉ ⲓⲥⲙⲁⲏⲗ ⲇⲉ ϩⲏⲡⲡⲉ ⲁⲓⲥⲱⲧⲉⲙ ⲉⲣⲟⲕ ϩⲏⲡⲡⲉ ⲁⲓⲥⲙⲟⲩ ⲉ̀ⲣⲟϥ ⲟⲩⲟϩ ⲉⲓⲉ̀ⲑⲣⲉϥⲁⲓⲁⲓ ⲟⲩⲟϩ ⲉⲓⲉ̀ⲑⲣⲉϥⲁ̀ϣⲁⲓ ⲉ̀ⲙⲁϣⲱ ⲓ̅ⲃ̅ ⲛ̀ϣⲗⲟⲗ ⲉϥⲉ̀ϫⲫⲱⲟⲩ ⲟⲩⲟϩ ⲉⲓⲉ̀ⲧⲏⲓϥ ⲉ̀ⲟⲩⲛⲓϣϯ ⲛ̀ϣⲗⲟⲗ							 περὶ δὲ Ισμαηλ ἰδοὺ ἐπήκουσά σου· ἰδοὺ εὐλόγησα αὐτὸν καὶ αὐξανῶ αὐτὸν καὶ πληθυνῶ αὐτὸν σφόδρα· δώδεκα ἔθνη γεννήσει, καὶ δώσω αὐτὸν εἰς ἔθνος μέγα.	 And concerning Ismael, behold, I have heard thee, and, behold, I have blessed him, and will increase him and multiply him exceedingly; twelve nations shall he beget, and I will make him a great nation.	
Genesis	17	21	 ⲧⲁⲇⲓⲁⲑⲏⲕⲏ ⲇⲉ ⲉⲓⲉ̀ⲥⲉⲙⲛⲏⲧⲥ ⲛⲉⲙ ⲓⲥⲁⲁⲕ ⲫⲏ ⲉⲧⲉ ⲥⲁⲣⲣⲁ ⲛⲁⲙⲁⲥϥ ⲛⲁⲕ ⲙ̀ⲡⲁⲓⲥⲏⲟⲩ ϧⲉⲛ ϯⲕⲉⲣⲟⲙⲡⲓ							 τὴν δὲ διαθήκην μου στήσω πρὸς Ισαακ, ὃν τέξεταί σοι Σαρρα εἰς τὸν καιρὸν τοῦτον ἐν τῷ ἐνιαυτῷ τῷ ἑτέρῳ.	 But I will establish my covenant with Isaac, whom Sarrha shall bear to thee at this time, in the next year.	
Genesis	17	22	 ⲁϥⲕⲏⲛ ⲇⲉ ⲉϥⲥⲁϫⲓ ⲛⲉⲙⲁϥ ⲟⲩⲟϩ ⲁϥϣⲉ ⲛⲁϥ ⲉ̀ⲡϣⲱⲓ ⲛ̀ϫⲉ ⲫϯ ⲉ̀ⲃⲟⲗ ϩⲁ ⲁⲃⲣⲁⲁⲙ							 συνετέλεσεν δὲ λαλῶν πρὸς αὐτὸν καὶ ἀνέβη ὁ θεὸς ἀπὸ Αβρααμ.	 And he left off speaking with him, and God went up from Abraam.	
Genesis	17	23	 ⲟⲩⲟϩ ⲁϥϭⲓ ⲛ̀ϫⲉ ⲁⲃⲣⲁⲁⲙ ⲛ̀ⲓⲥⲙⲁⲏⲗ ⲡⲉϥϣⲏⲣⲓ ⲛⲉⲙ ⲛⲉϥⲙⲉⲥ ϧⲉⲛ ⲏⲓ ⲧⲏⲣⲟⲩ ⲛⲉⲙ ⲛⲉϥϣⲱⲡ ϧⲁ ϩⲁⲧ ⲧⲏⲣⲟⲩ ⲛⲉⲙ ϩⲱⲟⲩⲧ ⲛⲓⲃⲉⲛ ⲛ̀ⲧⲉ ⲛⲓⲣⲱⲙⲓ ⲛⲏ ⲉⲧϧⲉⲛ ⲡⲏⲓ ⲛⲁⲃⲣⲁⲁⲙ ⲟⲩⲟϩ ⲁϥⲥⲟⲩⲃⲉ ⲧⲟⲩⲙⲉⲧⲁⲧⲥⲉⲃⲓ ϧⲉⲛ ⲡⲓⲥⲏⲟⲩ ⲛ̀ⲧⲉ ⲡⲓⲉϩⲟⲟⲩ ⲉⲧⲉⲙ̀ⲙⲁⲩ ⲕⲁⲧⲁ ⲫⲣⲏϯ ⲉⲧⲁ ⲫϯ ⲥⲁϫⲓ ⲛⲉⲙⲁϥ							 Καὶ ἔλαβεν Αβρααμ Ισμαηλ τὸν υἱὸν αὐτοῦ καὶ πάντας τοὺς οἰκογενεῖς αὐτοῦ καὶ πάντας τοὺς ἀργυρωνήτους καὶ πᾶν ἄρσεν τῶν ἀνδρῶν τῶν ἐν τῷ οἴκῳ Αβρααμ καὶ περιέτεμεν τὰς ἀκροβυστίας αὐτῶν ἐν τῷ καιρῷ τῆς ἡμέρας ἐκείνης, καθὰ ἐλάλησεν αὐτῷ ὁ θεός.	 And Abraam took Ismael his son, and all his home-born servants, and all those bought with money, and every male of the men in the house of Abraam, and he circumcised their foreskins in the time of that day, according as God spoke to him.	
Genesis	17	24	 ⲁⲃⲣⲁⲁⲙ ⲇⲉ ⲛⲁϥⲭⲏ ϧⲉⲛ ϥ̅ⲑ̅ ⲛ̀ⲣⲟⲙⲡⲓ ⲡⲉ ⲉⲧⲁϥⲥⲟⲩⲃⲉ ⲧⲥⲁⲣⲝ ⲛ̀ⲧⲉ ⲧⲉϥⲙⲉⲧⲁⲧⲥⲉⲃⲓ							 Αβρααμ δὲ ἦν ἐνενήκοντα ἐννέα ἐτῶν, ἡνίκα περιέτεμεν τὴν σάρκα τῆς ἀκροβυστίας αὐτοῦ·	 And Abraam was ninety-nine years old, when he was circumcised in the flesh of his foreskin.	
Genesis	17	25	 ⲓⲥⲙⲁⲏⲗ ⲇⲉ ⲡⲉϥϣⲏⲣⲓ ⲛⲁϥⲭⲏ ϧⲉⲛ ⲓ̅ⲅ̅ ⲛ̀ⲣⲟⲙⲡⲓ ⲡⲉ ⲉⲧⲁⲩⲥⲟⲩⲃⲉ ⲧⲥⲁⲣⲝ ⲛ̀ⲧⲉ ⲧⲉϥⲙⲉⲧⲁⲧⲥⲉⲃⲓ							 Ισμαηλ δὲ ὁ υἱὸς αὐτοῦ ἐτῶν δέκα τριῶν ἦν, ἡνίκα περιετμήθη τὴν σάρκα τῆς ἀκροβυστίας αὐτοῦ.	 And Ismael his son was thirteen years old when he was circumcised in the flesh of his foreskin.	
Genesis	17	26	 ⲛ̀ϩⲣⲏⲓ ⲇⲉ ϧⲉⲛ ⲡⲓⲥⲏⲟⲩ ⲛ̀ⲧⲉ ⲡⲓⲉϩⲟⲟⲩ ⲉⲧⲉⲙ̀ⲙⲁⲩ ⲉϥⲥⲟⲩⲃⲏⲧϥ ⲛ̀ϫⲉ ⲁⲃⲣⲁⲁⲙ ⲛⲉⲙ ⲓⲥⲙⲁⲏⲗ ⲡⲉϥϣⲏⲣⲓ							 ἐν τῷ καιρῷ τῆς ἡμέρας ἐκείνης περιετμήθη Αβρααμ καὶ Ισμαηλ ὁ υἱὸς αὐτοῦ·	 And at the period of that day, Abraam was circumcised, and Ismael his son,	
Genesis	17	27	 ⲛⲉⲙ ⲛⲓⲣⲱⲙⲓ ⲧⲏⲣⲟⲩ ⲛ̀ⲧⲉ ⲡⲉϥⲏⲓ ⲛⲉⲙ ⲛⲓⲙⲉⲥ ϧⲉⲛ ⲏⲓ ⲛⲉⲙ ⲛⲓϣⲱⲡ ϧⲁ ϩⲁⲧ ⲛⲓⲉ̀ⲃⲟⲗ ϧⲉⲛ ϩⲁⲛⲅⲉⲛⲟⲥ ⲛ̀ϣⲗⲟⲗ ⲁϥⲥⲟⲩⲃⲏⲧⲟⲩ							 καὶ πάντες οἱ ἄνδρες τοῦ οἴκου αὐτοῦ καὶ οἱ οἰκογενεῖς καὶ οἱ ἀργυρώνητοι ἐξ ἀλλογενῶν ἐθνῶν, περιέτεμεν αὐτούς.	 and all the men of his house, both those born in the house, and those bought with money of foreign nations.	
Genesis	18	1	 ⲁ ⲫϯ ⲇⲉ ⲟⲩⲟⲛϩϥ ⲉ̀ⲣⲟϥ ϧⲁⲧⲉⲛ ⲡⲓϣϣⲏⲛ ⲛ̀ⲧⲉ ⲙⲁⲙⲃⲣⲏ ⲉϥϩⲉⲙⲥⲓ ϩⲓⲣⲉⲛ ⲫⲣⲟ ⲛ̀ⲧⲉ ⲧⲉϥⲥⲕⲩⲛⲏ ⲙ̀ⲫⲛⲁⲩ ⲙ̀ⲙⲉⲣⲓ							 ῎Ωφθη δὲ αὐτῷ ὁ θεὸς πρὸς τῇ δρυὶ τῇ Μαμβρη καθημένου αὐτοῦ ἐπὶ τῆς θύρας τῆς σκηνῆς αὐτοῦ μεσημβρίας.	 And God appeared to him by the oak of Mambre, as he sat by the door of his tent at noon.	
Genesis	18	2	 ⲁϥϫⲟⲩϣⲧ ⲇⲉ ⲛ̀ⲛⲉϥⲃⲁⲗ ⲁϥⲛⲁⲩ ϩⲏⲡⲡⲉ ⲓⲥ ⲅ̅ ⲛ̀ⲣⲱⲙⲓ ⲛⲁⲩⲟϩⲓ ⲉ̀ⲣⲁⲧⲟⲩ ⲥⲁⲡϣⲱⲓ ⲙ̀ⲙⲟϥ ⲟⲩⲟϩ ⲉⲧⲁϥⲛⲁⲩ ⲁϥϭⲟϫⲓ ⲉ̀ⲃⲟⲗ ⲉ̀ϩⲣⲁⲩ ⲉ̀ⲃⲟⲗ ϩⲁ ⲫⲣⲟ ⲛ̀ⲧⲉ ⲧⲉϥⲥⲕⲩⲛⲏ ⲟⲩⲟϩ ⲁϥⲟⲩⲱϣⲧ ϩⲓϫⲉⲛ ⲡⲓⲕⲁϩⲓ							 ἀναβλέψας δὲ τοῖς ὀφθαλμοῖς αὐτοῦ εἶδεν, καὶ ἰδοὺ τρεῖς ἄνδρες εἱστήκεισαν ἐπάνω αὐτοῦ· καὶ ἰδὼν προσέδραμεν εἰς συνάντησιν αὐτοῖς ἀπὸ τῆς θύρας τῆς σκηνῆς αὐτοῦ καὶ προσεκύνησεν ἐπὶ τὴν γῆν	 And he lifted up his eyes and beheld, and lo! three men stood before him; and having seen them he ran to meet them from the door of his tent, and did obeisance to the ground.	
Genesis	18	3	 ⲟⲩⲟϩ ⲡⲉϫⲁϥ ϫⲉ ⲡⲁϭ̅ⲥ̅ ⲓⲥϫⲉ ⲁⲓϫⲉⲙ ⲟⲩϩⲙⲟⲧ ⲙ̀ⲡⲉⲕⲙ̀ⲑⲟ ⲙ̀ⲡⲉⲣⲥⲉⲛ ⲡⲉⲕⲁⲗⲟⲩ							 καὶ εἶπεν Κύριε, εἰ ἄρα εὗρον χάριν ἐναντίον σου, μὴ παρέλθῃς τὸν παῖδά σου·	 And he said, Lord, if indeed I have found grace in thy sight, pass not by thy servant.	
Genesis	18	4	 ⲙⲁⲣⲟⲩϭⲓ ⲇⲉ ⲛ̀ⲟⲩⲙⲱⲟⲩ ⲟⲩⲟϩ ⲙⲁⲣⲟⲩⲓⲁ ⲛⲉⲧⲉⲛϭⲁⲗⲁⲩϫ ⲉ̀ⲃⲟⲗ ⲟⲩⲟϩ ⲭⲃⲟⲃ ⲙ̀ⲙⲱⲧⲉⲛ ϧⲁⲧⲉⲛ ⲡⲓϣϣⲏⲛ							 λημφθήτω δὴ ὕδωρ, καὶ νιψάτωσαν τοὺς πόδας ὑμῶν, καὶ καταψύξατε ὑπὸ τὸ δένδρον·	 Let water now be brought, and let them wash your feet, and do ye refresh yourselves under the tree.	
