book	chapter	verse	Bohairic	Akhmimic	Fayyumic	OldBohairic	Mesokemic	DialectP	Lycopolitan	Greek	English	Sahidic
Genesis	1		ⲅⲉⲛⲉⲥⲓⲥ									
Genesis	1	1	 ϧⲉⲛ ⲟⲩⲁⲣⲭⲏ ⲁ ⲫϯ ⲑⲁⲙⲓⲟ ⲛ̀ⲧⲫⲉ ⲛⲉⲙ ⲡⲕⲁϩⲓ							 ᾿Εν ἀρχῇ ἐποίησεν ὁ θεὸς τὸν οὐρανὸν καὶ τὴν γῆν.	 IN the beginning God made the heaven and the earth.	
Genesis	1	2	 ⲡⲕⲁϩⲓ ⲇⲉ ⲛⲁϥϣⲟⲡ ⲛ̀ⲁⲧⲛⲁⲩ ⲉ̀ⲣⲟϥ ⲡⲉ ⲟⲩⲟϩ ⲛ̀ⲁⲧⲥⲟⲃϯ ⲟⲩⲟϩ ⲟⲩⲭⲁⲕⲓ ⲛⲁϥⲭⲏ ϩⲓϫⲉⲛ ⲫⲛⲟⲩⲛ ⲟⲩⲟϩ ⲟⲩⲡⲛ̅ⲁ̅ ⲛ̀ⲧⲉ ⲫϯ ⲛⲁϥⲛⲏⲟⲩ ϩⲓϫⲉⲛ ⲛⲓⲙⲱⲟⲩ							 ἡ δὲ γῆ ἦν ἀόρατος καὶ ἀκατασκεύαστος, καὶ σκότος ἐπάνω τῆς ἀβύσσου, καὶ πνεῦμα θεοῦ ἐπεφέρετο ἐπάνω τοῦ ὕδατος.	 But the earth was unsightly and unfurnished, and darkness was over the deep, and the Spirit of God moved over the water.	
Genesis	1	3	 ⲟⲩⲟϩ ⲡⲉϫⲉ ⲫϯ ϫⲉ ⲙⲁⲣⲉⲩⲱⲓⲛⲓ <ϣⲱⲡⲓ> ⲟⲩⲟϩ ⲁϥϣⲱⲡⲓ ⲛ̀ϫⲉ ⲡⲓⲟⲩⲱⲓⲛⲓ							 καὶ εἶπεν ὁ θεός Γενηθήτω φῶς. καὶ ἐγένετο φῶς.	 And God said, Let there be light, and there was light.	
Genesis	1	4	 ⲟⲩⲟϩ ⲁϥⲛⲁⲩ ⲛ̀ϫⲉ ⲫϯ ⲉ̀ⲡⲓⲟⲩⲱⲓⲛⲓ ϫⲉ ⲛⲁⲛⲉϥ ⲟⲩⲟϩ ⲁϥⲫⲱⲣϫ ⲉ̀ⲃⲟⲗ ⲛ̀ϫⲉ ⲫϯ ⲟⲩⲧⲉ ⲡⲓⲟⲩⲱⲓⲛⲓ ⲛⲉⲙ ⲟⲩⲧⲉ ⲡⲓⲭⲁⲕⲓ							 καὶ εἶδεν ὁ θεὸς τὸ φῶς ὅτι καλόν. καὶ διεχώρισεν ὁ θεὸς ἀνὰ μέσον τοῦ φωτὸς καὶ ἀνὰ μέσον τοῦ σκότους.	 And God saw the light that it was good, and God divided between the light and the darkness.	
Genesis	1	5	 ⲟⲩⲟϩ ⲁϥⲙⲟⲩϯ ⲛ̀ϫⲉ ⲫϯ ⲉ̀ⲡⲓⲟⲩⲱⲓⲛⲓ ϫⲉ ⲡⲓⲉ̀ϩⲟⲟⲩ ⲟⲩⲟϩ ⲡⲓⲭⲁⲕⲓ ⲁϥⲙⲟⲩϯ ⲉ̀ⲣⲟϥ ϫⲉ ⲡⲓⲉ̀ϫⲱⲣϩ ⲟⲩⲟϩ ⲁ ⲣⲟⲩϩⲓ ϣⲱⲡⲓ ⲁ ⲧⲟⲟⲩⲓ̀ ϣⲱⲡⲓ ⲙ̀ⲡⲓⲉ̀ϩⲟⲟⲩ ⲛ̀ϩⲟⲩⲓⲧ							 καὶ ἐκάλεσεν ὁ θεὸς τὸ φῶς ἡμέραν καὶ τὸ σκότος ἐκάλεσεν νύκτα. καὶ ἐγένετο ἑσπέρα καὶ ἐγένετο πρωί, ἡμέρα μία.	 And God called the light Day, and the darkness he called Night, and there was evening and there was morning, the first day.	
Genesis	1	6	 ⲟⲩⲟϩ ⲡⲉϫⲉ ⲫϯ ϫⲉ ⲙⲁⲣⲉⲩⲧⲁϫⲣⲟ ϣⲱⲡⲓ ϧⲉⲛ ⲑⲙⲏϯ ⲛ̀ⲧⲉ ⲛⲓⲙⲱⲟⲩ ⲟⲩⲟϩ ⲙⲁⲣⲉϥϣⲱⲡⲓ ⲉϥⲫⲱⲣϫ ⲟⲩⲧⲉ ⲙⲱⲟⲩ ⲛⲉⲙ ⲙⲱⲟⲩ ⲟⲩⲟϩ ⲁⲥϣⲱⲡⲓ ⲙ̀ⲡⲁⲓⲣⲏϯ							 Καὶ εἶπεν ὁ θεός Γενηθήτω στερέωμα ἐν μέσῳ τοῦ ὕδατος καὶ ἔστω διαχωρίζον ἀνὰ μέσον ὕδατος καὶ ὕδατος. καὶ ἐγένετο οὕτως.	 And God said, Let there be a firmament in the midst of the water, and let it be a division between water and water, and it was so.	
Genesis	1	7	 ⲟⲩⲟϩ ⲁϥⲑⲁⲙⲓⲟ ⲛ̀ϫⲉ ⲫϯ ⲙ̀ⲡⲓⲧⲁϫⲣⲟ ⲟⲩⲟϩ ⲁϥⲫⲱⲣϫ ⲛ̀ϫⲉ ⲫϯ ⲟⲩⲧⲉ ⲡⲓⲙⲱⲟⲩ ⲉⲧⲥⲁϧⲣⲏⲓ ⲙ̀ⲡⲓⲧⲁϫⲣⲟ ⲛⲉⲙ ⲟⲩⲧⲉ ⲡⲓⲙⲱⲟⲩ ⲉⲧⲥⲁⲡϣⲱⲓ ⲙ̀ⲡⲓⲧⲁϫⲣⲟ							 καὶ ἐποίησεν ὁ θεὸς τὸ στερέωμα, καὶ διεχώρισεν ὁ θεὸς ἀνὰ μέσον τοῦ ὕδατος, ὃ ἦν ὑποκάτω τοῦ στερεώματος, καὶ ἀνὰ μέσον τοῦ ὕδατος τοῦ ἐπάνω τοῦ στερεώματος.	 And God made the firmament, and God divided between the water which was under the firmament and the water which was above the firmament.	
Genesis	1	8	 ⲟⲩⲟϩ ⲁ ⲫϯ ⲙⲟⲩϯ ⲉ̀ⲡⲓⲧⲁϫⲣⲟ ϫⲉ ⲧⲫⲉ ⲁϥⲛⲁⲩ ⲛ̀ϫⲉ ⲫϯ ϫⲉ ⲛⲁⲛⲉϥ ⲟⲩⲟϩ ⲁ ⲣⲟⲩϩⲓ ϣⲱⲡⲓ ⲁ ⲧⲟⲟⲩⲓ̀ ϣⲱⲡⲓ ⲙ̀ⲡⲓⲉϩⲟⲟⲩ ⲙ̀ⲙⲁϩⲃ̅							 καὶ ἐκάλεσεν ὁ θεὸς τὸ στερέωμα οὐρανόν. καὶ εἶδεν ὁ θεὸς ὅτι καλόν. καὶ ἐγένετο ἑσπέρα καὶ ἐγένετο πρωί, ἡμέρα δευτέρα.	 And God called the firmament Heaven, and God saw that it was good, and there was evening and there was morning, the second day.	
Genesis	1	9	 ⲟⲩⲟϩ ⲡⲉϫⲉ ⲫϯ ϫⲉ ⲙⲁⲣⲉϥⲑⲱⲟⲩϯ ⲛ̀ϫⲉ ⲡⲓⲙⲱⲟⲩ ⲉⲧⲥⲁϧⲣⲏⲓ ⲛ̀ⲧⲫⲉ ⲉ̀ⲛⲉϥⲥⲩⲛⲁⲅⲱⲅⲏ ⲟⲩⲟϩ ⲙⲁⲣⲉϥⲟⲩⲱⲛϩ ⲉ̀ⲃⲟⲗ ⲛ̀ϫⲉ ⲡⲓϣⲟⲩⲓⲉ ⲟⲩⲟϩ ⲁⲥϣⲱⲡⲓ ⲙ̀ⲡⲁⲓⲣⲏϯ ⲟⲩⲟϩ ⲁⲩⲑⲱⲟⲩϯ ⲛ̀ϫⲉ ⲛⲓⲙⲱⲟⲩ ⲉⲧⲥⲁϧⲣⲏⲓ ⲛ̀ⲧⲫⲉ ⲉ̀ⲛⲟⲩⲥⲩⲛⲁⲅⲱⲅⲏ ⲟⲩⲟϩ ⲁϥⲟⲩⲱⲛϩ ⲉ̀ⲃⲟⲗ ⲛ̀ϫⲉ ⲡⲓϣⲟⲩⲓⲉ							 Καὶ εἶπεν ὁ θεός Συναχθήτω τὸ ὕδωρ τὸ ὑποκάτω τοῦ οὐρανοῦ εἰς συναγωγὴν μίαν, καὶ ὀφθήτω ἡ ξηρά. καὶ ἐγένετο οὕτως. καὶ συνήχθη τὸ ὕδωρ τὸ ὑποκάτω τοῦ οὐρανοῦ εἰς τὰς συναγωγὰς αὐτῶν, καὶ ὤφθη ἡ ξηρά.	 And God said, Let the water which is under the heaven be collected into one place, and let the dry land appear, and it was so. And the water which was under the heaven was collected into its places, and the dry land appeared.	
Genesis	1	10	 ⲟⲩⲟϩ ⲁϥⲙⲟⲩϯ ⲛ̀ϫⲉ ⲫϯ ⲉ̀ⲡⲓϣⲟⲩⲓⲉ ϫⲉ ⲡⲕⲁϩⲓ ⲟⲩⲟϩ ⲛⲓⲙⲁⲛ̀ⲑⲱⲟⲩϯ ⲛ̀ⲧⲉ ⲛⲓⲙⲱⲟⲩ ⲁϥⲙⲟⲩϯ ⲉ̀ⲣⲱⲟⲩ ϫⲉ ⲛⲓⲁⲙⲁⲓⲟⲩ ⲟⲩⲟϩ ⲁϥⲛⲁⲩ ⲛ̀ϫⲉ ⲫϯ ϫⲉ ⲛⲁⲛⲉϥ							 καὶ ἐκάλεσεν ὁ θεὸς τὴν ξηρὰν γῆν καὶ τὰ συστήματα τῶν ὑδάτων ἐκάλεσεν θαλάσσας. καὶ εἶδεν ὁ θεὸς ὅτι καλόν.—	 And God called the dry land Earth, and the gatherings of the waters he called Seas, and God saw that it was good.	
Genesis	1	11	 ⲟⲩⲟϩ ⲡⲉϫⲉ ⲫϯ ϫⲉ ⲙⲁⲣⲉ ⲡⲕⲁϩⲓ ⲓⲛⲓ ⲉ̀ⲃⲟⲗ ⲛ̀ϩⲁⲛⲥⲙⲉϩ ⲛ̀ⲥⲓⲙ ⲛ̀ⲥⲓϯ ⲛ̀ϫⲣⲟϫ ⲕⲁⲧⲁ ⲅⲉⲛⲟⲥ ⲛⲉⲙ ⲕⲁⲧⲁ ⲓⲛⲓ ⲛⲉⲙ ⲟⲩϣϣⲏⲛ ⲙ̀ⲙⲁⲥⲟⲩⲧⲁϩ ⲉϥⲓⲣⲓ ⲛ̀ⲟⲩⲧⲁϩ ⲉⲣⲉ ⲡⲉϥϫⲣⲟϫ ⲛ̀ϧⲏⲧϥ ⲕⲁⲧⲁ ⲅⲉⲛⲟⲥ ϩⲓϫⲉⲛ ⲡⲕⲁϩⲓ ⲟⲩⲟϩ ⲁⲥϣⲱⲡⲓ ⲙ̀ⲡⲁⲓⲣⲏϯ							 καὶ εἶπεν ὁ θεός Βλαστησάτω ἡ γῆ βοτάνην χόρτου, σπεῖρον σπέρμα κατὰ γένος καὶ καθ᾽ ὁμοιότητα, καὶ ξύλον κάρπιμον ποιοῦν καρπόν, οὗ τὸ σπέρμα αὐτοῦ ἐν αὐτῷ κατὰ γένος ἐπὶ τῆς γῆς. καὶ ἐγένετο οὕτως.	 And God said, Let the earth bring forth the herb of grass bearing seed according to its kind and according to its likeness, and the fruit-tree bearing fruit whose seed is in it, according to its kind on the earth, and it was so.	
Genesis	1	12	 ⲟⲩⲟϩ ⲁ ⲡⲕⲁϩⲓ ⲓⲛⲓ ⲉ̀ⲃⲟⲗ ⲛ̀ϩⲁⲛⲥⲙⲉϩ ⲛ̀ⲥⲓⲙ ⲛ̀ⲥⲓϯ ⲛ̀ϫⲣⲟϫ ⲕⲁⲧⲁ ⲅⲉⲛⲟⲥ ⲛⲉⲙ ⲕⲁⲧⲁ ⲓⲛⲓ ⲛⲉⲙ ⲟⲩϣϣⲏⲛ ⲙ̀ⲙⲁⲥⲟⲩⲧⲁϩ ⲉϥⲓⲣⲓ ⲛ̀ⲟⲩⲧⲁϩ ⲉⲣⲉ ⲡⲉϥϫⲣⲟϫ ⲛ̀ϧⲏⲧϥ ⲕⲁⲧⲁ ⲅⲉⲛⲟⲥ ϩⲓϫⲉⲛ ⲡⲓⲕⲁϩⲓ ⲟⲩⲟϩ ⲁϥⲛⲁⲩ ⲛ̀ϫⲉ ⲫϯ ϫⲉ ⲛⲁⲛⲉⲩ							 καὶ ἐξήνεγκεν ἡ γῆ βοτάνην χόρτου, σπεῖρον σπέρμα κατὰ γένος καὶ καθ᾽ ὁμοιότητα, καὶ ξύλον κάρπιμον ποιοῦν καρπόν, οὗ τὸ σπέρμα αὐτοῦ ἐν αὐτῷ κατὰ γένος ἐπὶ τῆς γῆς. καὶ εἶδεν ὁ θεὸς ὅτι καλόν.	 And the earth brought forth the herb of grass bearing seed according to its kind and according to its likeness, and the fruit tree bearing fruit whose seed is in it, according to its kind on the earth, and God saw that it was good.	
Genesis	1	13	 ⲟⲩⲟϩ ⲁ ⲣⲟⲩϩⲓ ϣⲱⲡⲓ ⲁ ⲧⲟⲟⲩⲓ̀ ϣⲱⲡⲓ ⲙ̀ⲡⲓⲉϩⲟⲟⲩ ⲙ̀ⲙⲁϩⲅ̅							 καὶ ἐγένετο ἑσπέρα καὶ ἐγένετο πρωί, ἡμέρα τρίτη.	 And there was evening and there was morning, the third day.	
Genesis	1	14	 ⲟⲩⲟϩ ⲡⲉϫⲉ ⲫϯ ϫⲉ ⲙⲁⲣⲟⲩϣⲱⲡⲓ ⲛ̀ϫⲉ ϩⲁⲛⲫⲱⲥⲧⲏⲣ ϧⲉⲛ ⲡⲓⲧⲁϫⲣⲟ ⲛ̀ⲧⲉ ⲧⲫⲉ ⲉⲑⲣⲟⲩⲉⲣⲟⲩⲱⲓⲛⲓ ⲉ̀ⲡⲓⲕⲁϩⲓ ⲉ̀ⲟⲩⲱϯ ⲟⲩⲧⲉ ⲡⲓⲉϩⲟⲟⲩ ⲛⲉⲙ ⲡⲓⲉϫⲱⲣϩ							 Καὶ εἶπεν ὁ θεός Γενηθήτωσαν φωστῆρες ἐν τῷ στερεώματι τοῦ οὐρανοῦ εἰς φαῦσιν τῆς γῆς τοῦ διαχωρίζειν ἀνὰ μέσον τῆς ἡμέρας καὶ ἀνὰ μέσον τῆς νυκτὸς	 And God said, Let there be lights in the firmament of the heaven to give light upon the earth, to divide between day and night,	
Genesis	1		 ⲟⲩⲟϩ ⲙⲁⲣⲟⲩϣⲱⲡⲓ ⲉ̀ϩⲁⲛⲙⲏⲓⲛⲓ ⲛⲉⲙ ϩⲁⲛⲥⲏⲟⲩ ⲛⲉⲙ ϩⲁⲛⲉ̀ϩⲟⲟⲩ ⲛⲉⲙ ϩⲁⲛⲣⲟⲙⲡⲓ ⲟⲩⲟϩ ⲙⲁⲣⲟⲩϣⲱⲡⲓ ⲉⲩⲉⲣⲟⲩⲱⲓⲛⲓ ϧⲉⲛ ⲡⲓⲧⲁϫⲣⲟ ⲛ̀ⲧⲉ ⲧⲫⲉ ϩⲱⲥⲇⲉ ⲛ̀ⲧⲟⲩⲉⲣⲟⲩⲱⲓⲛⲓ ϩⲓϫⲉⲛ ⲡⲓⲕⲁϩⲓ ⲟⲩⲟϩ ⲁⲥϣⲱⲡⲓ ⲙ̀ⲡⲁⲓⲣⲏϯ							 καὶ ἔστωσαν εἰς σημεῖα καὶ εἰς καιροὺς καὶ εἰς ἡμέρας καὶ εἰς ἐνιαυτοὺς (15) καὶ ἔστωσαν εἰς φαῦσιν ἐν τῷ στερεώματι τοῦ οὐρανοῦ ὥστε φαίνειν ἐπὶ τῆς γῆς. καὶ ἐγένετο οὕτως.	and let them be for signs and for seasons and for days and for years. (15) And let them be for light in the firmament of the heaven, so as to shine upon the earth, and it was so.	
Genesis	1	16	 ⲟⲩⲟϩ ⲁϥⲑⲁⲙⲓⲟ ⲛ̀ϫⲉ ⲫϯ ⲙ̀ⲡⲓⲛⲓϣϯ ⲃ̅ ⲛ̀ⲣⲉϥⲉⲣⲟⲩⲱⲓⲛⲓ ⲡⲓⲛⲓϣϯ ⲛ̀ⲣⲉϥⲉⲣⲟⲩⲱⲓⲛⲓ ⲉ̀ⲟⲩⲁ̀ⲣⲭⲏ ⲛ̀ⲧⲉ ⲡⲓⲉ̀ϩⲟⲟⲩ ⲟⲩⲟϩ ⲡⲓⲕⲟⲩϫⲓ ⲛ̀ⲣⲉϥⲉⲣⲟⲩⲱⲓⲛⲓ ⲉ̀ⲟⲩⲁ̀ⲣⲭⲏ ⲛ̀ⲧⲉ ⲡⲓⲉ̀ϫⲱⲣϩ ⲛⲉⲙ ⲛⲓⲥⲓⲟⲩ							 καὶ ἐποίησεν ὁ θεὸς τοὺς δύο φωστῆρας τοὺς μεγάλους, τὸν φωστῆρα τὸν μέγαν εἰς ἀρχὰς τῆς ἡμέρας καὶ τὸν φωστῆρα τὸν ἐλάσσω εἰς ἀρχὰς τῆς νυκτός, καὶ τοὺς ἀστέρας.	 And God made the two great lights, the greater light for regulating the day and the lesser light for regulating the night, the stars also.	
Genesis	1	17	 ⲟⲩⲟϩ ⲁϥⲭⲁⲩ ⲛ̀ϫⲉ ⲫϯ ϧⲉⲛ ⲡⲓⲧⲁϫⲣⲟ ⲛ̀ⲧⲉ ⲧⲫⲉ ϩⲱⲥⲧⲉ ⲛ̀ⲧⲟⲩⲉⲣⲟⲩⲱⲓⲛⲓ ϩⲓϫⲉⲛ ⲡⲓⲕⲁϩⲓ							 καὶ ἔθετο αὐτοὺς ὁ θεὸς ἐν τῷ στερεώματι τοῦ οὐρανοῦ ὥστε φαίνειν ἐπὶ τῆς γῆς	 And God placed them in the firmament of the heaven, so as to shine upon the earth,	
Genesis	1	18	 ⲟⲩⲟϩ ⲛ̀ⲧⲟⲩⲉⲣⲁⲣⲭⲱⲛ ⲉ̀ⲡⲓⲉϩⲟⲟⲩ ⲛⲉⲙ ⲡⲓⲉϫⲱⲣϩ ⲟⲩⲟϩ ⲛ̀ⲧⲟⲩⲫⲱⲣϫ ⲉ̀ⲃⲟⲗ ⲟⲩⲧⲉ ⲡⲓⲟⲩⲱⲓⲛⲓ ⲛⲉⲙ ⲡⲓⲭⲁⲕⲓ							 καὶ ἄρχειν τῆς ἡμέρας καὶ τῆς νυκτὸς καὶ διαχωρίζειν ἀνὰ μέσον τοῦ φωτὸς καὶ ἀνὰ μέσον τοῦ σκότους. καὶ εἶδεν ὁ θεὸς ὅτι καλόν.	 and to regulate day and night, and to divide between the light and the darkness. And God saw that it was good.	
Genesis	1	19	 ⲟⲩⲟϩ ⲁϥⲛⲁⲩ ⲛ̀ϫⲉ ⲫϯ ϫⲉ ⲛⲁⲛⲉϥ ⲟⲩⲟϩ ⲁ ⲣⲟⲩϩⲓ ϣⲱⲡⲓ ⲁ ⲧⲟⲟⲩⲓ̀ ϣⲱⲡⲓ ⲙ̀ⲡⲓⲉϩⲟⲟⲩ ⲙ̀ⲙⲁϩⲇ̅							 καὶ ἐγένετο ἑσπέρα καὶ ἐγένετο πρωί, ἡμέρα τετάρτη.	 And there was evening and there was morning, the fourth day.	
Genesis	1	20	 ⲟⲩⲟϩ ⲡⲉϫⲉ ⲫϯ ϫⲉ ⲙⲁⲣⲉ ⲛⲓⲙⲱⲟⲩ ⲓⲛⲓ ⲉ̀ⲃⲟⲗ ⲛ̀ϩⲁⲛϭⲁⲧϥⲓ ⲙ̀ⲯⲩⲭⲏ ⲉⲩⲟⲛϧ ⲛⲉⲙ ϩⲁⲛϩⲁⲗⲁϯ ⲉⲩϩⲏⲗ ϩⲓϫⲉⲛ ⲡⲓⲕⲁϩⲓ ⲕⲁⲧⲁ ⲡⲓⲧⲁϫⲣⲟ ⲛ̀ⲧⲉ ⲧⲫⲉ ⲟⲩⲟϩ ⲁⲥϣⲱⲡⲓ ⲙ̀ⲡⲁⲓⲣⲏϯ							 Καὶ εἶπεν ὁ θεός ᾿Εξαγαγέτω τὰ ὕδατα ἑρπετὰ ψυχῶν ζωσῶν καὶ πετεινὰ πετόμενα ἐπὶ τῆς γῆς κατὰ τὸ στερέωμα τοῦ οὐρανοῦ. καὶ ἐγένετο οὕτως.	 And God said, Let the waters bring forth reptiles having life, and winged creatures flying above the earth in the firmament of heaven, and it was so.	
Genesis	1	21	 ⲟⲩⲟϩ ⲁϥⲑⲁⲙⲓⲟ̀ ⲛ̀ϫⲉ ⲫϯ ⲛ̀ⲛⲓⲛⲓϣϯ ⲛ̀ⲕⲏⲧⲟⲥ ⲛⲉⲙ ⲯⲩⲭⲏ ⲛⲓⲃⲉⲛ ⲉⲧⲟⲛϧ ⲉⲧⲁ ⲛⲓϭⲁⲧϥⲓ ⲛ̀ⲧⲉ ⲛⲓⲙⲱⲟⲩ ⲉⲛⲟⲩ ⲉ̀ⲃⲟⲗ ⲕⲁⲧⲁ ⲅⲉⲛⲟⲥ ⲛⲉⲙ ϩⲁⲗⲏⲧ ⲛⲓⲃⲉⲛ ⲉⲧϩⲏⲗ ⲕⲁⲧⲁ ⲅⲉⲛⲟⲥ ⲟⲩⲟϩ ⲁϥⲛⲁⲩ ⲛ̀ϫⲉ ⲫϯ ϫⲉ ⲛⲁⲛⲉⲩ							 καὶ ἐποίησεν ὁ θεὸς τὰ κήτη τὰ μεγάλα καὶ πᾶσαν ψυχὴν ζῴων ἑρπετῶν, ἃ ἐξήγαγεν τὰ ὕδατα κατὰ γένη αὐτῶν, καὶ πᾶν πετεινὸν πτερωτὸν κατὰ γένος. καὶ εἶδεν ὁ θεὸς ὅτι καλά.	 And God made great whales, and every living reptile, which the waters brought forth according to their kinds, and every creature that flies with wings according to its kind, and God saw that they were good.	
Genesis	1	22	 ⲟⲩⲟϩ ⲁϥⲥⲙⲟⲩ ⲉ̀ⲣⲱⲟⲩ ⲛ̀ϫⲉ ⲫϯ ⲉϥϫⲱ ⲙ̀ⲙⲟⲥ ϫⲉ ⲁⲓⲁⲓ ⲟⲩⲟϩ ⲁϣⲁⲓ ⲟⲩⲟϩ ⲙⲁϩ ⲛⲓⲙⲱⲟⲩ ⲉⲧϧⲉⲛ ⲛⲓⲁⲙⲁⲓⲟⲩ ⲟⲩⲟϩ ⲛⲓϩⲁⲗⲁϯ ⲙⲁⲣⲟⲩⲁϣⲁⲓ ϩⲓϫⲉⲛ ⲡⲕⲁϩⲓ							 καὶ ηὐλόγησεν αὐτὰ ὁ θεὸς λέγων Αὐξάνεσθε καὶ πληθύνεσθε καὶ πληρώσατε τὰ ὕδατα ἐν ταῖς θαλάσσαις, καὶ τὰ πετεινὰ πληθυνέσθωσαν ἐπὶ τῆς γῆς.	 And God blessed them, saying, Increase and multiply and fill the waters in the seas, and let the creatures that fly be multiplied on the earth.	
Genesis	1	23	 ⲟⲩⲟϩ ⲁ ⲣⲟⲩϩⲓ ϣⲱⲡⲓ ⲁ ⲧⲟⲟⲩⲓ̀ ϣⲱⲡⲓ ⲙ̀ⲡⲓⲉϩⲟⲟⲩ ⲙ̀ⲙⲁϩⲉ̅							 καὶ ἐγένετο ἑσπέρα καὶ ἐγένετο πρωί, ἡμέρα πέμπτη.	 And there was evening and there was morning, the fifth day.	
Genesis	1	24	 ⲟⲩⲟϩ ⲡⲉϫⲉ ⲡϭ̅ⲥ̅ ⲫϯ ϫⲉ ⲙⲁⲣⲉ ⲡⲕⲁϩⲓ ⲓⲛⲓ ⲉ̀ⲃⲟⲗ ⲙ̀ⲯⲩⲭⲏ ⲉⲩⲟⲛϧ ⲕⲁⲧⲁ ⲅⲉⲛⲟⲥ ϩⲁⲛϥⲧⲉⲫⲁⲧ ⲛⲉⲙ ϩⲁⲛϭⲁⲧϥⲓ ϩⲁⲛⲑⲏⲣⲓⲟⲛ ⲛ̀ⲧⲉ ⲡⲕⲁϩⲓ ⲕⲁⲧⲁ ⲅⲉⲛⲟⲥ ⲟⲩⲟϩ ⲁⲥϣⲱⲡⲓ ⲙ̀ⲡⲁⲓⲣⲏϯ							 Καὶ εἶπεν ὁ θεός ᾿Εξαγαγέτω ἡ γῆ ψυχὴν ζῶσαν κατὰ γένος, τετράποδα καὶ ἑρπετὰ καὶ θηρία τῆς γῆς κατὰ γένος. καὶ ἐγένετο οὕτως.	 And God said, Let the earth bring forth the living creature according to its kind, quadrupeds and reptiles and wild beasts of the earth according to their kind, and it was so.	
Genesis	1	25	 ⲟⲩⲟϩ ⲁϥⲑⲁⲙⲓⲟ ⲛ̀ϫⲉ ⲫϯ ⲛ̀ⲛⲓⲑⲏⲣⲓⲟⲛ ⲛ̀ⲧⲉ ⲡⲕⲁϩⲓ ⲕⲁⲧⲁ ⲅⲉⲛⲟⲥ ⲛⲉⲙ ⲛⲓⲧⲉⲃⲛⲱⲟⲩⲓ ⲕⲁⲧⲁ ⲅⲉⲛⲟⲥ ⲛⲉⲙ ⲛⲓϭⲁⲧϥⲓ ⲧⲏⲣⲟⲩ ⲛ̀ⲧⲉ ⲡⲕⲁϩⲓ ⲕⲁⲧⲁ ⲅⲉⲛⲟⲥ ⲟⲩⲟϩ ⲁϥⲛⲁⲩ ⲛ̀ϫⲉ ⲫϯ ϫⲉ ⲛⲁⲛⲉⲩ							 καὶ ἐποίησεν ὁ θεὸς τὰ θηρία τῆς γῆς κατὰ γένος καὶ τὰ κτήνη κατὰ γένος καὶ πάντα τὰ ἑρπετὰ τῆς γῆς κατὰ γένος αὐτῶν. καὶ εἶδεν ὁ θεὸς ὅτι καλά.—	 And God made the wild beasts of the earth according to their kind, and cattle according to their kind, and all the reptiles of the earth according to their kind, and God saw that they were good.	
Genesis	1	26	 ⲟⲩⲟϩ ⲡⲉϫⲉ ⲫϯ ϫⲉ ⲙⲁⲣⲉⲛⲑⲁⲙⲓⲟ ⲛ̀ⲟⲩⲣⲱⲙⲓ ⲕⲁⲧⲁ ⲧⲉⲛϩⲓⲕⲱⲛ ⲛⲉⲙ ⲕⲁⲧⲁ ⲡⲉⲛⲓⲛⲓ ⲟⲩⲟϩ ⲙⲁⲣⲟⲩⲉⲣⲁⲣⲭⲱⲛ ⲉ̀ⲛⲓⲧⲉⲃⲧ ⲛ̀ⲧⲉ ⲫⲓⲟⲙ ⲛⲉⲙ ⲛⲓϩⲁⲗⲁϯ ⲛ̀ⲧⲉ ⲧⲫⲉ ⲛⲉⲙ ⲛⲓⲧⲉⲃⲛⲱⲟⲩⲓ ⲛⲉⲙ ⲡⲕⲁϩⲓ ⲧⲏⲣϥ ⲛⲉⲙ ϭⲁⲧϥⲓ ⲛⲓⲃⲉⲛ ⲉⲧⲕⲓⲙ ϩⲓϫⲉⲛ ⲡⲕⲁϩⲓ							 καὶ εἶπεν ὁ θεός Ποιήσωμεν ἄνθρωπον κατ᾽ εἰκόνα ἡμετέραν καὶ καθ᾽ ὁμοίωσιν, καὶ ἀρχέτωσαν τῶν ἰχθύων τῆς θαλάσσης καὶ τῶν πετεινῶν τοῦ οὐρανοῦ καὶ τῶν κτηνῶν καὶ πάσης τῆς γῆς καὶ πάντων τῶν ἑρπετῶν τῶν ἑρπόντων ἐπὶ τῆς γῆς.	 And God said, Let us make man according to our image and likeness, and let them have dominion over the fish of the sea, and over the flying creatures of heaven, and over the cattle and all the earth, and over all the reptiles that creep on the earth.	
Genesis	1	27	 ⲟⲩⲟϩ ⲁϥⲑⲁⲙⲓⲟ ⲛ̀ϫⲉ ⲫϯ ⲙ̀ⲡⲓⲣⲱⲙⲓ ⲕⲁⲧⲁ ϯϩⲓⲕⲱⲛ ⲛ̀ⲧⲉ ⲫϯ ⲁϥⲑⲁⲙⲓⲟϥ ⲛ̀ϩⲱⲟⲩⲧ ⲛⲉⲙ ⲥϩⲓⲙⲓ ⲁϥⲑⲁⲙⲓⲱⲟⲩ							 καὶ ἐποίησεν ὁ θεὸς τὸν ἄνθρωπον, κατ᾽ εἰκόνα θεοῦ ἐποίησεν αὐτόν, ἄρσεν καὶ θῆλυ ἐποίησεν αὐτούς.	 And God made man, according to the image of God he made him, male and female he made them.	
Genesis	1	28	 ⲟⲩⲟϩ ⲁϥⲥⲙⲟⲩ ⲉ̀ⲣⲱⲟⲩ ⲛ̀ϫⲉ ⲫϯ ⲉϥϫⲱ ⲙ̀ⲙⲟⲥ ϫⲉ ⲁⲓⲁⲓ ⲟⲩⲟϩ ⲁϣⲁⲓ ⲟⲩⲟϩ ⲙⲁϩ ⲡⲓⲕⲁϩⲓ ⲟⲩⲟϩ ⲁⲣⲓϭ̅ⲥ̅ ⲉ̀ϫⲱϥ ⲟⲩⲟϩ ⲁⲣⲓⲁⲣⲭⲱⲛ ⲉ̀ⲛⲓⲧⲉⲃⲧ ⲛ̀ⲧⲉ ⲫⲓⲟⲙ ⲛⲉⲙ ⲛⲓϩⲁⲗⲁϯ ⲛ̀ⲧⲉ ⲧⲫⲉ ⲛⲉⲙ ⲛⲓⲧⲉⲃⲛⲱⲟⲩⲓ ⲧⲏⲣⲟⲩ ⲛⲉⲙ ⲡⲕⲁϩⲓ ⲧⲏⲣϥ ⲛⲉⲙ ϭⲁⲧϥⲓ ⲛⲓⲃⲉⲛ ⲉⲧⲕⲓⲙ ϩⲓϫⲉⲛ ⲡⲓⲕⲁϩⲓ							 καὶ ηὐλόγησεν αὐτοὺς ὁ θεὸς λέγων Αὐξάνεσθε καὶ πληθύνεσθε καὶ πληρώσατε τὴν γῆν καὶ κατακυριεύσατε αὐτῆς καὶ ἄρχετε τῶν ἰχθύων τῆς θαλάσσης καὶ τῶν πετεινῶν τοῦ οὐρανοῦ καὶ πάντων τῶν κτηνῶν καὶ πάσης τῆς γῆς καὶ πάντων τῶν ἑρπετῶν τῶν ἑρπόντων ἐπὶ τῆς γῆς.	 And God blessed them, saying, Increase and multiply, and fill the earth and subdue it, and have dominion over the fish of the seas and flying creatures of heaven, and all the cattle and all the earth, and all the reptiles that creep on the earth.	
Genesis	1	29	 ⲟⲩⲟϩ ⲡⲉϫⲉ ⲫϯ ϫⲉ ϩⲏⲡⲡⲉ ⲁⲓϯ ⲛⲱⲧⲉⲛ ⲛ̀ⲥⲓⲙ ⲛⲓⲃⲉⲛ ⲛ̀ⲥⲓϯ ⲉ̀ⲡⲥⲓϯ ⲛ̀ⲛⲓϫⲣⲟϫ ⲫⲏ ⲉⲧⲭⲏ ϩⲓϫⲉⲛ ⲡⲓⲕⲁϩⲓ ⲧⲏⲣϥ ⲛⲉⲙ ϣϣⲏⲛ ⲛⲓⲃⲉⲛ ⲉⲧⲉ ⲡⲉϥⲟⲩⲧⲁϩ ⲛ̀ϧⲏⲧϥ ⲛ̀ϫⲣⲟϫ ⲛ̀ⲥⲓϯ ⲉϥⲉ̀ϣⲱⲡⲓ ⲛⲱⲧⲉⲛ ⲉⲩϧⲣⲉ							 καὶ εἶπεν ὁ θεός ᾿Ιδοὺ δέδωκα ὑμῖν πᾶν χόρτον σπόριμον σπεῖρον σπέρμα, ὅ ἐστιν ἐπάνω πάσης τῆς γῆς, καὶ πᾶν ξύλον, ὃ ἔχει ἐν ἑαυτῷ καρπὸν σπέρματος σπορίμου— ὑμῖν ἔσται εἰς βρῶσιν—	 And God said, Behold I have given to you every seed-bearing herb sowing seed which is upon all the earth, and every tree which has in itself the fruit of seed that is sown, to you it shall be for food.	
Genesis	1	30	 ⲛⲉⲙ ⲛⲓⲑⲏⲣⲓⲟⲛ ⲧⲏⲣⲟⲩ ⲛ̀ⲧⲉ ⲡⲕⲁϩⲓ ⲛⲉⲙ ⲛⲓϩⲁⲗⲁϯ ⲧⲏⲣⲟⲩ ⲛ̀ⲧⲉ ⲧⲫⲉ ⲛⲉⲙ ϭⲁⲧϥⲓ ⲛⲓⲃⲉⲛ ⲉⲧⲕⲓⲙ ϩⲓϫⲉⲛ ⲡⲓⲕⲁϩⲓ ⲉⲧⲉ ⲟⲩⲟⲛ ⲯⲩⲭⲏ ⲛ̀ⲱⲛϧ ⲛ̀ϧⲏⲧϥ ⲛⲉⲙ ⲥⲓⲙ ⲛⲓⲃⲉⲛ ⲉⲑⲟⲩⲉⲧⲟⲩⲱⲧ ⲉⲩϧⲣⲉ ⲟⲩⲟϩ ⲁⲥϣⲱⲡⲓ ⲙ̀ⲡⲁⲓⲣⲏϯ							 καὶ πᾶσι τοῖς θηρίοις τῆς γῆς καὶ πᾶσι τοῖς πετεινοῖς τοῦ οὐρανοῦ καὶ παντὶ ἑρπετῷ τῷ ἕρποντι ἐπὶ τῆς γῆς, ὃ ἔχει ἐν ἑαυτῷ ψυχὴν ζωῆς, πάντα χόρτον χλωρὸν εἰς βρῶσιν. καὶ ἐγένετο οὕτως.	 And to all the wild beasts of the earth, and to all the flying creatures of heaven, and to every reptile creeping on the earth, which has in itself the breath of life, even every green plant for food; and it was so.	
Genesis	1	31	 ⲟⲩⲟϩ ⲁϥⲛⲁⲩ ⲛ̀ϫⲉ ⲫϯ ⲉ̀ϩⲱⲃ ⲛⲓⲃⲉⲛ ⲉⲧⲁϥⲑⲁⲙⲓⲱⲟⲩ ⲟⲩⲟϩ ϩⲏⲡⲡⲉ ⲛⲁⲛⲉⲩ ⲉ̀ⲙⲁϣⲱ ⲟⲩⲟϩ ⲁ ⲣⲟⲩϩⲓ ϣⲱⲡⲓ ⲟⲩⲟϩ ⲁ ⲧⲟⲟⲩⲓ̀ ϣⲱⲡⲓ ⲙ̀ⲡⲓⲉϩⲟⲟⲩ ⲙ̀ⲙⲁϩⲋ̅							 καὶ εἶδεν ὁ θεὸς τὰ πάντα, ὅσα ἐποίησεν, καὶ ἰδοὺ καλὰ λίαν. καὶ ἐγένετο ἑσπέρα καὶ ἐγένετο πρωί, ἡμέρα ἕκτη.	 And God saw all the things that he had made, and, behold, they were very good. And there was evening and there was morning, the sixth day.	
Genesis	2	1	 ⲟⲩⲟϩ ⲁϥϫⲱⲕ ⲉ̀ⲃⲟⲗ ⲛ̀ϫⲉ ⲧⲫⲉ ⲛⲉⲙ ⲡⲕⲁϩⲓ ⲛⲉⲙ ⲡⲟⲩⲥⲟⲗⲥⲉⲗ ⲧⲏⲣϥ							 Καὶ συνετελέσθησαν ὁ οὐρανὸς καὶ ἡ γῆ καὶ πᾶς ὁ κόσμος αὐτῶν.	 And the heavens and the earth were finished, and the whole world of them.	
Genesis	2	2	 ⲟⲩⲟϩ ⲁ ⲫϯ ϫⲱⲕ ⲛ̀ⲛⲉϥϩⲃⲏⲟⲩⲓ ⲉ̀ⲃⲟⲗ ⲛⲏ ⲉⲧⲁϥⲑⲁⲙⲓⲱⲟⲩ ϧⲉⲛ ⲡⲓⲉϩⲟⲟⲩ ⲙ̀ⲙⲁϩⲋ̅ ⲟⲩⲟϩ ⲁϥⲉⲙⲧⲟⲛ ⲙ̀ⲙⲟϥ ϧⲉⲛ ⲡⲓⲉϩⲟⲟⲩ ⲙ̀ⲙⲁϩⲍ̅ ⲉ̀ⲃⲟⲗ ϩⲁ ⲛⲉϥϩⲃⲏⲟⲩⲓ ⲧⲏⲣⲟⲩ ⲛⲏ ⲉⲧⲁϥⲑⲁⲙⲓⲱⲟⲩ							 καὶ συνετέλεσεν ὁ θεὸς ἐν τῇ ἡμέρᾳ τῇ ἕκτῃ τὰ ἔργα αὐτοῦ, ἃ ἐποίησεν, καὶ κατέπαυσεν τῇ ἡμέρᾳ τῇ ἑβδόμῃ ἀπὸ πάντων τῶν ἔργων αὐτοῦ, ὧν ἐποίησεν.	 And God finished on the sixth day his works which he made, and he ceased on the seventh day from all his works which he made.	
Genesis	2	3	 ⲟⲩⲟϩ ⲁ ⲫϯ ⲥⲙⲟⲩ ⲉ̀ⲡⲓⲉϩⲟⲟⲩ ⲙ̀ⲙⲁϩⲍ̅ ⲟⲩⲟϩ ⲁϥⲧⲟⲩⲃⲟϥ ϫⲉ ⲛ̀ϧⲣⲏⲓ ⲛ̀ϧⲏⲧϥ ⲁϥⲉⲙⲧⲟⲛ ⲙ̀ⲙⲟϥ ⲉ̀ⲃⲟⲗ ϩⲁ ⲛⲉϥϩⲃⲏⲟⲩⲓ ⲧⲏⲣⲟⲩ ⲛⲏ ⲉⲧⲁϥⲉⲣϩⲏⲧⲥ ⲛ̀ⲑⲁⲙⲓⲱⲟⲩ ⲛ̀ϫⲉ ⲫϯ							 καὶ ηὐλόγησεν ὁ θεὸς τὴν ἡμέραν τὴν ἑβδόμην καὶ ἡγίασεν αὐτήν, ὅτι ἐν αὐτῇ κατέπαυσεν ἀπὸ πάντων τῶν ἔργων αὐτοῦ, ὧν ἤρξατο ὁ θεὸς ποιῆσαι.	 And God blessed the seventh day and sanctified it, because in it he ceased from all his works which God began to do.	
