book	chapter	verse	Bohairic	Akhmimic	Fayyumic	OldBohairic	Mesokemic	DialectP	Lycopolitan	Greek	English	Sahidic
Joel	1		ϯⲡⲣⲟⲫⲏⲧⲓⲁ ⲛ̀ⲧⲉ ⲓⲟⲩⲏⲗ ⲡⲓⲡⲣⲟⲫⲏⲧⲏⲥ									
Joel	1	1	 ⲡⲥⲁϫⲓ ⲙ̀ⲡϭ̅ⲥ̅ ⲉⲧⲁϥϣⲱⲡⲓ ϩⲁ ⲓⲱⲏⲗ ⲡϣⲏⲣⲓ ⲛ̀ⲃⲁⲑⲟⲩⲏⲗ							 Λόγος κυρίου, ὃς ἐγενήθη πρὸς Ιωηλ τὸν τοῦ Βαθουηλ.	 The word of the Lord which came to Joel the son of Bathuel.	
Joel	1	2	 ⲥⲱⲧⲉⲙ ⲉ̀ⲛⲁⲓ ⲛⲓⲡⲣⲉⲥⲃⲩⲧⲉⲣⲟⲥ ⲟⲩⲟϩ ϭⲓⲥⲙⲏ ⲟⲩⲟⲛ ⲛⲓⲃⲉⲛ ⲉⲧϣⲟⲡ ϩⲓϫⲉⲛ ⲡⲕⲁϩⲓ ϫⲉ ⲁ ⲛⲁ ϩⲁⲛϩⲃⲏⲟⲩⲓ ϣⲱⲡⲓ ⲙ̀ⲡⲁⲓⲣⲏϯ ϧⲉⲛ ⲛⲉⲧⲉⲛⲉϩⲟⲟⲩ ⲛⲉⲙ ϧⲉⲛ ⲛⲓⲉϩⲟⲟⲩ ⲛ̀ⲧⲉ ⲛⲉⲧⲉⲛⲓⲟϯ							 Ἀκούσατε δὴ ταῦτα, οἱ πρεσβύτεροι, καὶ ἐνωτίσασθε, πάντες οἱ κατοικοῦντες τὴν γῆν. εἰ γέγονεν τοιαῦτα ἐν ταῖς ἡµέραις ὑµῶν ἢ ἐν ταῖς ἡµέραις τῶν πατέρων ὑµῶν;	 Hear these words, ye elders, and hearken all ye that inhabit the land. Have such things happen in your days, or in the days of your fathers?	
Joel	1	3	 ⲥⲁϫⲓ ⲉⲑⲃⲉ ϧⲁⲧⲟⲧⲟⲩ ⲛ̀ⲛⲉⲧⲉⲛϣⲏⲣⲓ ⲟⲩⲟϩ ⲛⲉⲧⲉⲛϣⲏⲣⲓ ϧⲁⲧⲟⲧⲟⲩ ⲛ̀ⲛⲟⲩϣⲏⲣⲓ ⲟⲩⲟϩ ⲛⲟⲩϣⲏⲣⲓ ⲛ̀ⲕⲉⲅⲉⲛⲉⲁ							 ὑπὲρ αὐτῶν τοῖς τέκνοις ὑµῶν διηγήσασθε, καὶ τὰ τέκνα ὑµῶν τοῖς τέκνοις αὐτῶν, καὶ τὰ τέκνα αὐτῶν εἰς γενεὰν ἑτέραν.	 Tell your children concerning them, and let your children tell their children, and their children another generation.	
Joel	1	4	 ⲛⲓⲥⲉⲡⲓ ⲛ̀ⲧⲉ ⲡⲓϥⲉⲛⲧ ⲁϥⲟⲩⲟⲙⲟⲩ ⲛ̀ϫⲉ ⲡⲓϣϫⲉ ⲟⲩⲟϩ ⲛⲓⲥⲉⲡⲓ ⲛ̀ⲧⲉ ⲡⲓϣϫⲉ ⲁϥⲟⲩⲟⲙⲟⲩ ⲛ̀ϫⲉ ⲡⲓϥⲣⲟⲩⲭⲟⲥ ⲟⲩⲟϩ ⲛⲓⲥⲉⲡⲓ ⲛ̀ⲧⲉ ⲡⲓϥⲣⲟⲩⲭⲟⲥ ⲁⲥⲟⲩⲟⲙⲟⲩ ⲛ̀ϫⲉ ϯⲉⲧⲏϣⲓ							 τὰ κατάλοιπα τῆς κάµπης κατέφαγεν ἡ ἀκρίς, καὶ τὰ κατάλοιπα τῆς ἀκρίδος κατέφαγεν ὁ βροῦχος, καὶ τὰ κατάλοιπα τοῦ βρούχου κατέφαγεν ἡ ἐρυσίβη.	 The leavings of the caterpillar has the locust eaten, and the leavings of the locust has the palmerworm eaten, and the leavings of the palmerworm has the cankerworm eaten.	
Joel	1	5	 ⲁⲣⲓⲛⲏⲫⲓⲛ ⲛⲏ ⲉⲧⲑⲁϧⲓ ⲉ̀ⲃⲟⲗ ϧⲉⲛ ⲡⲟⲩⲏⲣⲡ ⲟⲩⲟϩ ⲣⲓⲙⲓ ⲟⲩⲟϩ ⲁⲣⲓϩⲏⲃⲓ ⲧⲏⲣⲟⲩ ⲛⲏ ⲉⲧⲥⲱ ⲙ̀ⲡⲓⲏⲣⲡ ⲉⲩⲑⲁϧⲓ ϫⲉ ⲁⲩⲱⲗⲓ ⲉ̀ⲃⲟⲗ ϧⲉⲛ ⲣⲱⲧⲉⲛ ⲙ̀ⲡⲟⲩⲛⲟϥ ⲛⲉⲙ ⲫⲣⲁϣⲓ							 ἐκνήψατε, οἱ µεθύοντες, ἐξ οἴνου αὐτῶν καὶ κλαύσατε· θρηνήσατε, πάντες οἱ πίνοντες οἶνον, εἰς µέθην, ὅτι ἐξῆρται ἐκ στόµατος ὑµῶν εὐφροσύνη καὶ χαρά.	 Awake, ye drunkards, from your wine, and weep: mourn, all ye that drink wine to drunkenness: for joy and gladness and removed are from your mouth.	
Joel	1	6	 ϫⲉ ⲁϥⲓ̀ ⲛ̀ϫⲉ ⲟⲩⲉⲑⲛⲟⲥ ⲉ̀ϫⲉⲛ ⲡⲕⲁϩⲓ ⲉϥϫⲟⲣ ⲟⲩⲟϩ ⲙⲙⲟⲛⲧⲉϥ ⲏⲡⲓ ⲛⲉϥϣⲟⲗ ϩⲁⲛϣⲟⲗ ⲙ̀ⲙⲟⲩⲓ ⲛⲉ ⲟⲩⲟϩ ⲛⲉϥⲛⲁϫϩⲓ ϩⲁⲛⲙⲁⲥ ⲙ̀ⲙⲟⲩⲓ ⲛⲉ							 ὅτι ἔθνος ἀνέβη ἐπὶ τὴν γῆν µου ἰσχυρὸν καὶ ἀναρίθµητον, οἱ ὀδόντες αὐτοῦ ὀδόντες λέοντος, καὶ αἱ µύλαι αὐτοῦ σκύµνου·	 For a strong and innumerable nation is come up against my land, their teeth are lion’s teeth, and their back teeth those of a lion’s whelp.	
Joel	1	7	 ⲁϥⲭⲱ ⲛ̀ⲧⲁⲃⲱ ⲛ̀ⲁⲗⲟⲗⲓ ⲉ̀ⲡⲧⲁⲕⲟ ⲟⲩⲟϩ ⲧⲁⲃⲱ ⲛ̀ⲕⲉⲛⲧⲉ ⲉⲩⲕⲱϣ ϧⲉⲛ ⲟⲩϧⲟⲧϧⲉⲧ ⲁϥϧⲉⲧϧⲱⲧⲥ ⲟⲩⲟϩ ⲁϥⲃⲉⲣⲃⲱⲣⲥ ⲉ̀ⲃⲟⲗ ⲁϥⲑⲣⲟⲩ ⲟⲩⲃⲁϣ ⲛ̀ϫⲉ ⲛⲉⲥⲕⲗⲏⲙⲁ							 ἔθετο τὴν ἄµπελόν µου εἰς ἀφανισµὸν καὶ τὰς συκᾶς µου εἰς συγκλασµόν· ἐρευνῶν ἐξηρεύνησεν αὐτὴν καὶ ἔρριψεν, ἐλεύκανεν κλήµατα αὐτῆς.	 He has ruined my vine, and utterly broken my fig-trees: he has utterly searched my vine, and cast it down; he has peeled its branches.	
Joel	1	8	 ⲁⲣⲓϩⲏⲃⲓ ⲉ̀ⲡϣⲱⲓ ϩⲁⲣⲟⲓ ⲉ̀ϩⲟⲧⲉ ⲟⲩϣⲉⲗⲉⲧ ⲉⲥⲙⲏⲣ ⲛ̀ⲟⲩⲥⲟⲕ ⲉ̀ϫⲉⲛ ⲡϩⲁⲓ ⲛ̀ⲧⲉ ⲧⲉⲥⲙⲉⲧⲡⲁⲣⲑⲉⲛⲟⲥ							 θρήνησον πρός µε ὑπὲρ νύµφην περιεζωσµένην σάκκον ἐπὶ τὸν ἄνδρα αὐτῆς τὸν παρθενικόν.	 Lament to me more than a virgin girded with sackcloth for the husband of her youth.	
Joel	1	9	 ϫⲉ ⲁⲩⲱⲗⲓ ⲉ̀ⲃⲟⲗ ϧⲉⲛ ⲡⲏⲓ ⲙ̀ⲡϭ̅ⲥ̅ ⲛ̀ⲟⲩϣⲟⲩϣⲱⲟⲩϣⲓ ⲛⲉⲙ ⲟⲩⲱⲧⲉⲛ ⲉ̀ⲃⲟⲗ ⲁⲣⲓϩⲏⲃⲓ ⲛⲓⲟⲩⲏⲃ ⲛⲏ ⲉⲧϣⲉⲙϣⲓ ⲙ̀ⲡⲓⲙⲁⲛ̀ⲉⲣϣⲱⲟⲩϣⲓ							 ἐξῆρται θυσία καὶ σπονδὴ ἐξ οἴκου κυρίου. πενθεῖτε, οἱ ἱερεῖς οἱ λειτουργοῦντες θυσιαστηρίῳ,	 The meat-offering and drink-offering are removed from the house of the Lord: mourn, ye priests that serve at the altar of the Lord.	
Joel	1	10	 ϫⲉ ⲁⲩⲉⲣⲧⲁⲗⲉⲡⲱⲣⲓⲛ ⲛ̀ϫⲉ ⲛⲓⲙⲉϣϣⲱⲧ ⲙⲁⲣⲉϥⲉⲣϩⲏⲃⲓ ⲛ̀ϫⲉ ⲡⲕⲁϩⲓ ϫⲉ ⲁϥⲉⲣⲧⲁⲗⲉⲡⲱⲣⲓⲛ ⲛ̀ϫⲉ ⲡⲓⲥⲟⲩⲟ							 ὅτι τεταλαιπώρηκεν τὰ πεδία· πενθείτω ἡ γῆ, ὅτι τεταλαιπώρηκεν σῖτος, ἐξηράνθη οἶνος, ὠλιγώθη ἔλαιον.	 For the plains languish: let the land mourn, for the corn languishes; the wine is dried up, the oil becomes scarce;	
Joel	1	11	 ⲛⲉⲙ ⲡⲓⲓⲱⲧ ϫⲉ ⲁϥⲧⲁⲕⲟ ⲛ̀ϫⲉ ⲡⲓϭⲱⲗ ϧⲉⲛ ⲧⲕⲟⲓ							 ἐξηράνθησαν οἱ γεωργοί· θρηνεῖτε, κτήµατα, ὑπὲρ πυροῦ καὶ κριθῆς, ὅτι ἀπόλωλεν τρυγητὸς ἐξ ἀγροῦ·	 the husbandmen are consumed: mourn your property on account of the wheat and barley; for the harvest has perished from off the field.	
Joel	1	12	 ⲁⲥϣⲱⲟⲩⲓ ⲛ̀ϫⲉ ϯⲃⲱ ⲛ̀ⲁⲗⲟⲗⲓ ⲟⲩⲟϩ ⲁⲩⲉⲣⲕⲟⲩϫⲓ ⲛ̀ϫⲉ ⲛⲓⲃⲱ ⲛ̀ⲕⲉⲛ̀ⲧⲉ ϯⲃⲱ ⲛⲉⲣⲙⲁⲛ ⲛⲉⲙ ϯⲃⲉⲛⲓ ⲛⲉⲙ ϯⲃⲱ ⲛ̀ϫⲉⲙⲫⲉϩ ⲛⲉⲙ ⲛⲓϣϣⲏⲛ ⲧⲏⲣⲟⲩ ⲛ̀ⲧⲉ ⲧⲕⲟⲓ ⲁⲩϣⲱⲟⲩⲓ ϫⲉ ⲁⲩϯϣⲓⲡⲓ ⲙ̀ⲫⲣⲁϣⲓ ⲛ̀ϫⲉ ⲛⲓϣⲏⲣⲓ ⲛ̀ⲧⲉ ⲛⲓⲣⲱⲙⲓ							 ἡ ἄµπελος ἐξηράνθη, καὶ αἱ συκαῖ ὠλιγώθησαν· ῥόα καὶ φοῖνιξ καὶ µῆλον καὶ πάντα τὰ ξύλα τοῦ ἀγροῦ ἐξηράνθησαν, ὅτι ᾔσχυναν χαρὰν οἱ υἱοὶ τῶν ἀνθρώπων.	 The vine is dried up, and the fig-trees are become few; the pomegranate, and palm-tree, and apple, and all trees of the field are dried up: for the sons of men have have abolished joy.	
Joel	1	13	 ⲙⲏⲣ ⲑⲏⲛⲟⲩ ⲟⲩⲟϩ ⲛⲉϩⲡⲓ ⲛⲓⲟⲩⲏⲃ ⲁⲣⲓϩⲏⲃⲓ ⲛⲏ ⲉⲧϣⲉⲙϣⲓ ⲙ̀ⲡⲓⲙⲁⲛ̀ⲉⲣϣⲱⲟⲩϣⲓ ⲙⲁϣⲉ ⲛⲱⲧⲉⲛ ⲉ̀ϧⲟⲩⲛ ⲉⲛⲕⲟⲧ ϧⲉⲛ ϩⲁⲛⲥⲟⲕ ⲛⲏ ⲉⲧϣⲉⲙϣⲓ ⲙ̀ⲫϯ ϫⲉ ⲁϥⲕⲏⲛ ⲉ̀ⲃⲟⲗ ϧⲉⲛ ⲡⲏⲓ ⲙ̀ⲡϭ̅ⲥ̅ ⲡⲉⲧⲉⲛⲛⲟⲩϯ ⲛ̀ϫⲉ ⲟⲩϣⲟⲩϣⲱⲟⲩϣⲓ ⲛⲉⲙ ⲟⲩⲱⲧⲉⲛ ⲉ̀ⲃⲟⲗ							 περιζώσασθε καὶ κόπτεσθε, οἱ ἱερεῖς, θρηνεῖτε, οἱ λειτουργοῦντες θυσιαστηρίῳ· εἰσέλθατε ὑπνώσατε ἐν σάκκοις λειτουργοῦντες θεῷ, ὅτι ἀπέσχηκεν ἐξ οἴκου θεοῦ ὑµῶν θυσία καὶ σπονδή.	 Gird yourselves with sackcloth, and lament, ye priests: mourn, ye that serve at the altar: go in, sleep in sackcloths, ye that minister to God: for the meat-offering and drink-offering are withheld from the house of your God.	
Joel	1	14	 ⲙⲁⲧⲟⲩⲃⲟ ⲛ̀ⲟⲩⲛⲏⲥⲧⲓⲁ ϩⲓⲱⲓϣ ⲛ̀ⲟⲩϣⲉⲙϣⲓ ⲑⲱⲟⲩϯ ⲛ̀ⲛⲓⲡⲣⲉⲥⲃⲩⲧⲉⲣⲟⲥ ⲧⲏⲣⲟⲩ ⲉⲧϣⲟⲡ ϩⲓϫⲉⲛ ⲡⲕⲁϩⲓ ⲉ̀ϧⲟⲩⲛ ⲉ̀ⲡⲏⲓ ⲙ̀ⲡϭ̅ⲥ̅ ⲡⲉⲧⲉⲛⲛⲟⲩϯ ⲟⲩⲟϩ ⲱϣ ⲉ̀ϩⲣⲏⲓ ϩⲁ ⲡϭ̅ⲥ̅ ⲉ̀ⲙⲁϣⲱ							 ἁγιάσατε νηστείαν, κηρύξατε θεραπείαν, συναγάγετε πρεσβυτέρους πάντας κατοικοῦντας γῆν εἰς οἶκον θεοῦ ὑµῶν καὶ κεκράξατε πρὸς κύριον ἐκτενῶς	 Sanctify a fast, proclaim a solemn service, gather the elders and all the inhabitants of the land into the house of your God, and cry earnestly to the Lord,	
Joel	1	15	 ϫⲉ ⲟⲩⲟⲓ ⲛⲏⲓ ⲟⲩⲟⲓ ⲛⲏⲓ ⲙ̀ⲡⲓⲉϩⲟⲟⲩ ϫⲉ ϥϧⲉⲛⲧ ⲛ̀ϫⲉ ⲡⲓⲉϩⲟⲟⲩ ⲛ̀ⲧⲉ ⲡϭ̅ⲥ̅ ⲟⲩⲟϩ ϥⲛⲏⲟⲩ ⲙ̀ⲫⲣⲏϯ ⲛ̀ⲟⲩⲧⲁⲗⲉⲡⲱⲣⲓⲁ ⲉ̀ⲃⲟⲗ ϧⲉⲛ ⲟⲩⲧⲁⲗⲉⲡⲱⲣⲓⲁ							 Οἴµµοι οἴµµοι οἴµµοι εἰς ἡµέραν, ὅτι ἐγγὺς ἡµέρα κυρίου καὶ ὡς ταλαιπωρία ἐκ ταλαιπωρίας ἥξει.	 Alas, Alas, Alas for the day! for the day of the Lord is nigh, and it will come as trouble upon trouble.	
Joel	1	16	 ⲁⲩϥⲱϯ ⲛ̀ⲛⲓϧⲣⲏⲟⲩⲓ ⲉ̀ⲃⲟⲗ ⲙ̀ⲡⲉⲙ̀ⲑⲟ ⲛ̀ⲛⲉⲧⲉⲛⲃⲁⲗ ϧⲉⲛ ⲡⲏⲓ ⲙ̀ⲡⲉⲧⲉⲛⲛⲟⲩϯ ⲟⲩⲟⲩⲛⲟϥ ⲛⲉⲙ ⲟⲩⲣⲁϣⲓ							 κατέναντι τῶν ὀφθαλµῶν ὑµῶν βρώµατα ἐξωλεθρεύθη, ἐξ οἴκου θεοῦ ὑµῶν εὐφροσύνη καὶ χαρά.	 Your meat has been destroyed before your eyes, joy and gladness from out of the house of your God.	
Joel	1	17	 ⲁⲩϭⲓⲫⲉⲓ ⲛ̀ϫⲉ ⲛⲓⲃⲁϩⲥⲓ ⲉ̀ϫⲉⲛ ⲟⲩⲟⲛϩϥ ⲟⲩⲟϩ ⲁⲩⲧⲁⲕⲟ ⲛ̀ϫⲉ ⲛⲓⲁϩⲱⲣ ⲁⲩⲟⲩⲱϫⲡ ⲛ̀ϫⲉ ⲛⲓϩⲣⲱⲧ ϫⲉ ⲁϥϣⲱⲟⲩⲓ ⲛ̀ϫⲉ ⲡⲓⲥⲟⲩⲟ ⲟⲩ ⲡⲉ ⲉⲧⲉⲛⲛⲁϩⲓⲧϥ ⲛⲁⲛ ⲉ̀ϧⲟⲩⲛ							 ἐσκίρτησαν δαµάλεις ἐπὶ ταῖς φάτναις αὐτῶν, ἠφανίσθησαν θησαυροί, κατεσκάφησαν ληνοί, ὅτι ἐξηράνθη σῖτος.	 The heifers have started at their mangers, the treasures are abolished, the wine-presses are broken down; for the corn is withered.	
Joel	1	18	 ⲁⲩⲣⲓⲙⲓ ⲛ̀ϫⲉ ⲛⲓⲓⲟϩⲓ ⲛ̀ⲉⲥⲱⲟⲩ ϫⲉ ⲙ̀ⲙⲟⲛ ⲙⲁⲛ̀ⲙⲟⲛⲓ ϣⲟⲡ ⲛⲱⲟⲩ ⲟⲩⲟϩ ⲛⲓⲓⲟϩⲓ ⲛ̀ⲧⲉ ⲛⲓⲉⲥⲱⲟⲩ ⲁⲩⲧⲁⲕⲟ							 τί ἀποθήσοµεν ἑαυτοῖς; ἔκλαυσαν βουκόλια βοῶν, ὅτι οὐχ ὑπῆρχεν νοµὴ αὐτοῖς, καὶ τὰ ποίµνια τῶν προβάτων ἠφανίσθησαν.	 What shall we store up for ourselves? the herds of cattle have mourned, because they had no pasture; and the flocks of sheep have been utterly destroyed.	
Joel	1	19	 ϯⲛⲁⲱϣ ⲉ̀ⲡϣⲱⲓ ϩⲁⲣⲟⲕ ⲡϭ̅ⲥ̅ ⲡⲁⲛⲟⲩϯ ϫⲉ ⲟⲩⲭⲣⲱⲙ ⲛⲁϥⲟⲩⲱⲙ ⲛ̀ⲛⲏ ⲉⲑⲛⲉⲥⲱⲟⲩ ⲛ̀ⲧⲉ ⲡϣⲁϥⲉ ⲟⲩⲟϩ ⲟⲩϣⲁϩ ⲁϥϭⲉⲣⲟ ⲛ̀ⲛⲓϣϣⲏⲛ ⲧⲏⲣⲟⲩ ⲛ̀ⲧⲉ ⲧⲕⲟⲓ							 πρὸς σέ, κύριε, βοήσοµαι, ὅτι πῦρ ἀνήλωσεν τὰ ὡραῖα τῆς ἐρήµου, καὶ φλὸξ ἀνῆψεν πάντα τὰ ξύλα τοῦ ἀγροῦ·	 To thee, O Lord, will I cry: for fire has devoured the fair places of the wilderness, and a flame has burnt up all the trees of the field.	
Joel	1	20	 ⲟⲩⲟϩ ⲛⲓⲧⲉⲃⲛⲱⲟⲩⲓ ⲛ̀ⲧⲉ ⲛⲓⲙⲉϣϣⲱⲧ ⲁⲩϫⲟⲩϣⲧ ⲉ̀ⲡϣⲱⲓ ϩⲁⲣⲟⲕ ϫⲉ ⲁⲩϣⲱⲟⲩⲓ ⲛ̀ϫⲉ ⲛⲓⲙⲁⲛ̀ϯⲙⲱⲟⲩ ⲟⲩⲟϩ ⲟⲩⲭⲣⲱⲙ ⲁϥⲟⲩⲱⲙ ⲛ̀ⲛⲏ ⲉⲑⲛⲉⲥⲱⲟⲩ ⲛ̀ⲧⲉ ⲡϣⲁϥⲉ							 καὶ τὰ κτήνη τοῦ πεδίου ἀνέβλεψαν πρὸς σέ, ὅτι ἐξηράνθησαν ἀφέσεις ὑδάτων καὶ πῦρ κατέφαγεν τὰ ὡραῖα τῆς ἐρήµου.	 And the cattle of the field have looked up to thee: for the fountains of waters have been dried up, and fire has devoured the fair places of the wilderness.	
Joel	2	1	 ⲁⲣⲓⲥⲁⲗⲡⲓⲍⲓⲛ ϧⲉⲛ ⲟⲩⲥⲁⲗⲡⲓⲅⲝ ϧⲉⲛ ⲥⲓⲱⲛ ϩⲓⲱⲓϣ ϧⲉⲛ ⲡⲁⲧⲱⲟⲩ ⲉⲑⲩ ⲟⲩⲟϩ ⲙⲁⲣⲟⲩϣⲑⲟⲣⲧⲉⲣ ⲛ̀ϫⲉ ⲟⲩⲟⲛ ⲛⲓⲃⲉⲛ ⲉⲧϣⲟⲡ ϩⲓϫⲉⲛ ⲡⲕⲁϩⲓ ϫⲉ ⲁϥⲓ̀ ⲛ̀ϫⲉ ⲡⲓⲉϩⲟⲟⲩ ⲛ̀ⲧⲉ ⲡϭ̅ⲥ̅							 Σαλπίσατε σάλπιγγι ἐν Σιων, κηρύξατε ἐν ὄρει ἁγίῳ µου, καὶ συγχυθήτωσαν πάντες οἱ κατοικοῦντες τὴν γῆν, διότι πάρεστιν ἡµέρα κυρίου, ὅτι ἐγγύς,	 Sound the trumpet in Sion, make a proclamation in my holy mountain, and let all the inhabitants of the land be confounded: for the day of the Lord is near;	
Joel	2	2	 ⲟⲩⲟϩ ϥϧⲉⲛⲧ ⲛ̀ϫⲉ ⲡⲓⲉϩⲟⲟⲩ ⲛ̀ⲭⲁⲕⲓ ⲛⲉⲙ ⲅⲛⲟⲫⲟⲥ ⲡⲓⲉϩⲟⲟⲩ ⲛ̀ϭⲏⲡⲓ ⲛⲉⲙ ⲛⲓϥⲓ ⲟⲩⲗⲁⲟⲥ ⲉϥⲟϣ ⲟⲩⲟϩ ⲉϥϫⲟⲣ ⲉϥⲉ̀ⲫⲱⲣϣ ϩⲓϫⲉⲛ ⲛⲓⲧⲱⲟⲩ ⲙ̀ⲫⲣⲏϯ ⲛ̀ⲟⲩⲁⲛⲁⲧⲟⲟⲩⲓ ⲙ̀ⲡⲉ ⲟⲩⲟⲛ ϣⲱⲡⲓ ⲉϥⲟⲛⲓ ⲙ̀ⲙⲟϥ ⲓⲥϫⲉⲛ ⲡⲉⲛⲉϩ ⲟⲩⲟϩ ⲙⲉⲛⲉⲛⲥⲱϥ ⲛ̀ⲛⲉ ⲟⲩⲟⲛ ⲟⲩⲁϩ ⲧⲟⲧϥ ⲉ̀ϣⲱⲡⲓ ⲉ̀ϩⲁⲛϫⲱⲟⲩ ⲛ̀ϫⲱⲟⲩ							 ἡµέρα σκότους καὶ γνόφου, ἡµέρα νεφέλης καὶ ὁµίχλης. ὡς ὄρθρος χυθήσεται ἐπὶ τὰ ὄρη λαὸς πολὺς καὶ ἰσχυρός· ὅµοιος αὐτῷ οὐ γέγονεν ἀπὸ τοῦ αἰῶνος καὶ µετ’ αὐτὸν οὐ προστεθήσεται ἕως ἐτῶν εἰς γενεὰς γενεῶν.	 for a day of darkness and gloominess is near, a day of cloud and mist: a numerous and strong people shall be spread upon the mountains as the morning; there has not been from the beginning one like it, and after it there shall not be again even to the years of many generations.	
Joel	2	3	 ϩⲓⲧϩⲏ ⲙ̀ⲙⲟϥ ⲟⲩⲭⲣⲱⲙ ⲉϥⲙⲟⲩⲛⲕ ⲡⲉ ⲟⲩⲟϩ ϩⲓⲫⲁϩⲟⲩ ⲙ̀ⲙⲟϥ ⲟⲩϣⲁϩ ⲉϥⲙⲟϩ ⲡⲉ ⲙ̀ⲫⲣⲏϯ ⲙ̀ⲡⲓⲡⲁⲣⲁⲇⲓⲥⲟⲥ ⲛ̀ⲧⲉ ⲡⲟⲩⲛⲟϥ ⲡⲉ ⲡⲓⲕⲁϩⲓ ⲙ̀ⲡⲉⲙⲑⲟ ⲙ̀ⲡⲉϥϩⲟ ⲟⲩⲟϩ ϩⲓⲫⲁϩⲟⲩ ⲙ̀ⲙⲟϥ ⲟⲩⲙⲉϣϣⲱⲧ ⲛ̀ⲧⲉ ⲡⲧⲁⲕⲟ ⲡⲉ							 τὰ ἔµπροσθεν αὐτοῦ πῦρ ἀναλίσκον, καὶ τὰ ὀπίσω αὐτοῦ ἀναπτοµένη φλόξ· ὡς παράδεισος τρυφῆς ἡ γῆ πρὸ προσώπου αὐτοῦ, καὶ τὰ ὄπισθεν αὐτοῦ πεδίον ἀφανισµοῦ, καὶ ἀνασῳζόµενος οὐκ ἔσται αὐτῷ.	 Before them is a consuming fire, and behind them is a flame kindled: the land before them is as a paradise of delight, and behind them a desolate plain: and there shall none of them escape.	
Joel	2	4	 ⲡⲟⲩϩⲟ ⲁϥⲙ̀ⲫⲣⲏϯ ⲛ̀ⲟⲩϩⲟⲣⲁⲥⲓⲥ ⲛ̀ⲧⲉ ϩⲁⲛϩⲑⲱⲣ ⲟⲩⲟϩ ⲙ̀ⲫⲣⲏϯ ⲛ̀ϩⲁⲛϭⲁⲥⲓϩⲑⲟ ⲡⲁⲓⲣⲏϯ ⲉⲩⲉ̀ⲫⲱⲧ							 ὡς ὅρασις ἵππων ἡ ὄψις αὐτῶν, καὶ ὡς ἱππεῖς οὕτως καταδιώξονται·	 Their appearance is as the appearance of horses; and as horsemen, so shall they pursue.	
Joel	2	5	 ⲥⲉⲛⲁϣⲓϯ ⲙ̀ⲫⲣⲏϯ ⲛ̀ⲧⲥⲙⲏ ⲛ̀ⲧⲉ ϩⲁⲛϩⲁⲣⲙⲁ ϩⲓϫⲉⲛ ⲛⲓϭⲓⲥⲓ ⲛ̀ⲧⲉ ⲛⲓⲧⲱⲟⲩ ⲛⲉⲙ ⲙ̀ⲫⲣⲏϯ ⲛ̀ⲟⲩϣⲁϩ ⲛ̀ⲭⲣⲱⲙ ⲉϥⲟⲩⲱⲙ ⲛ̀ⲟⲩⲁⲣⲱⲟⲩⲓ ⲛⲉⲙ ⲙ̀ⲫⲣⲏϯ ⲛ̀ⲟⲩⲗⲁⲟⲥ ⲉϥⲟϣ ⲟⲩⲟϩ ⲉϥϫⲟⲣ ⲉϥⲛⲁⲑⲱⲟⲩϯ ⲉ̀ⲡⲡⲟⲗⲉⲙⲟⲥ							 ὡς φωνὴ ἁρµάτων ἐπὶ τὰς κορυφὰς τῶν ὀρέων ἐξαλοῦνται καὶ ὡς φωνὴ φλογὸς πυρὸς κατεσθιούσης καλάµην καὶ ὡς λαὸς πολὺς καὶ ἰσχυρὸς παρατασσόµενος εἰς πόλεµον.	 As the sound of chariots on the tops of mountains shall they leap, and as the sound of a flame of fire devouring stubble, and as a numerous and strong people setting themselves in array for battle.	
Joel	2	6	 ⲥⲉⲛⲁϧⲟⲙϧⲉⲙ ⲛ̀ϫⲉ ϩⲁⲛⲗⲁⲟⲥ ⲉ̀ⲃⲟⲗ ϧⲁⲧϩⲏ ⲙ̀ⲡⲉϥϩⲟ ϩⲟ ⲛⲓⲃⲉⲛ ⲛⲁⲉⲣ ⲙ̀ⲫⲣⲏϯ ⲛ̀ⲟⲩϩⲉⲗϩⲱⲡ ⲛ̀ⲧⲉ ⲟⲩϣⲓⲱ							 ἀπὸ προσώπου αὐτοῦ συντριβήσονται λαοί, πᾶν πρόσωπον ὡς πρόσκαυµα χύτρας.	 Before them shall the people be crushed: every face shall be as the blackness of a caldron.	
Joel	2	7	 ⲟⲩⲟϩ ⲉⲩⲉ̀ϣⲉ ⲛⲱⲟⲩ ⲉ̀ϫⲉⲛ ⲛⲓⲥⲟⲃⲧ ⲙ̀ⲫⲣⲏϯ ⲛ̀ϩⲁⲛⲣⲱⲙⲓ ⲛ̀ⲣⲉϥⲟⲩⲃⲱⲧⲥ ⲟⲩⲟϩ ⲫⲟⲩⲁⲓ ⲫⲟⲩⲁⲓ ⲉϥⲉ̀ⲙⲟϣⲓ ϧⲉⲛ ⲡⲉϥⲙⲱⲓⲧ ⲟⲩⲟϩ ⲛ̀ⲛⲟⲩⲣⲓⲕⲓ ⲉ̀ⲃⲟⲗ ⲛ̀ⲛⲟⲩⲙⲁⲛ̀ϣⲱⲡⲓ							 ὡς µαχηταὶ δραµοῦνται καὶ ὡς ἄνδρες πολεµισταὶ ἀναβήσονται ἐπὶ τὰ τείχη, καὶ ἕκαστος ἐν τῇ ὁδῷ αὐτοῦ πορεύσεται, καὶ οὐ µὴ ἐκκλίνωσιν τὰς τρίβους αὐτῶν,	 As warriors shall they run, and as men of war shall they mount on the walls; and each shall move in his right path, and they shall not turn aside from their tracks:	
Joel	2	8	 ⲟⲩⲟϩ ⲫⲟⲩⲁⲓ ⲫⲟⲩⲁⲓ ⲛ̀ⲛⲉϥϩⲉⲛϥ ⲉ̀ⲃⲟⲗ ϩⲁ ⲡⲉϥⲥⲟⲛ ⲥⲉⲛⲁⲙⲟϣⲓ ⲉⲩϩⲟⲣϣ ϧⲉⲛ ⲛⲟⲩϩⲟⲡⲗⲟⲛ ⲟⲩⲟϩ ⲥⲉⲛⲁϩⲉⲓ ϧⲉⲛ ⲛⲟⲩⲥⲟⲑⲛⲉϥ ⲟⲩⲟϩ ⲛ̀ⲛⲟⲩⲙⲟⲛⲕⲟⲩ							 καὶ ἕκαστος ἀπὸ τοῦ ἀδελφοῦ αὐτοῦ οὐκ ἀφέξεται· καταβαρυνόµενοι ἐν τοῖς ὅπλοις αὐτῶν πορεύσονται καὶ ἐν τοῖς βέλεσιν αὐτῶν πεσοῦνται καὶ οὐ µὴ συντελεσθῶσιν.	 and not one shall stand aloof from his brother: they shall go on weighed down with their arms, and they fall upon their weapons, yet shall they in no wise be destroyed.	
Joel	2	9	 ⲉⲩⲉϭⲓ ⲛ̀ϯⲃⲁⲕⲓ ⲟⲩⲟϩ ⲉⲩⲉ̀ϭⲟϫⲓ ⲛ̀ϫⲉ ⲛⲓⲥⲟⲃⲧ ⲟⲩⲟϩ ⲉⲩⲉ̀ϣⲉ ⲛⲱⲟⲩ ⲉ̀ⲡϣⲱⲓ ⲉ̀ϫⲉⲛ ⲛⲓⲏⲓ ⲟⲩⲟϩ ⲉⲩⲉ̀ϣⲉ ⲛⲱⲟⲩ ⲉ̀ϧⲟⲩⲛ ϩⲓⲧⲉⲛ ϩⲁⲛϣⲟⲩϣⲧ ⲙ̀ⲫⲣⲏϯ ⲛ̀ϩⲁⲛⲣⲉϥϭⲓⲟⲩⲓ							 τῆς πόλεως ἐπιλήµψονται καὶ ἐπὶ τῶν τειχέων δραµοῦνται καὶ ἐπὶ τὰς οἰκίας ἀναβήσονται καὶ διὰ θυρίδων εἰσελεύσονται ὡς κλέπται.	 They shall seize upon the city, and run upon the walls, and go up upon the houses, and enter in through the windows as thieves.	
Joel	2	10	 ⲉϥⲉ̀ϣⲑⲟⲣⲧⲉⲣ ⲛ̀ϫⲉ ⲡⲕⲁϩⲓ ϧⲁⲧϩⲏ ⲙ̀ⲡⲟⲩϩⲟ ⲟⲩⲟϩ ⲉⲥⲉ̀ⲙⲟⲛⲙⲉⲛ ⲛ̀ϫⲉ ⲧⲫⲉ ⲫⲣⲏ ⲛⲉⲙ ⲡⲓⲓⲟϩ ⲉⲩⲉ̀ⲉⲣⲭⲁⲕⲓ ⲟⲩⲟϩ ⲛⲓⲥⲓⲟⲩ ⲉⲩⲉ̀ϩⲱⲧⲡ ⲙ̀ⲡⲟⲩⲟⲩⲱⲓⲛⲓ							 πρὸ προσώπου αὐτῶν συγχυθήσεται ἡ γῆ καὶ σεισθήσεται ὁ οὐρανός, ὁ ἥλιος καὶ ἡ σελήνη συσκοτάσουσιν, καὶ τὰ ἄστρα δύσουσιν τὸ φέγγος αὐτῶν.	 Before them the earth shall be confounded, and the sky shall be shaken: the sun and the moon shall be darkened, and the stars shall withdraw their light.	
Joel	2	11	 ⲡϭ̅ⲥ̅ ⲇⲉ ⲉϥⲉ̀ϯ ⲛ̀ⲧⲉϥⲥⲙⲏ ⲙ̀ⲡⲉⲙ̀ⲑⲟ ⲛ̀ⲧⲉϥϫⲟⲙ ϫⲉ ⲥⲟϣ ⲉ̀ⲙⲁϣⲱ ⲛ̀ϫⲉ ⲧⲉϥⲡⲁⲣⲉⲙⲃⲟⲗⲏ ϫⲉ ⲥⲉϫⲟⲣ ⲛ̀ϫⲉ ⲛⲓϩⲃⲏⲟⲩⲓ ⲛ̀ⲧⲉ ⲛⲉϥⲥⲁϫⲓ ϫⲉ ⲟⲩⲛⲓϣϯ ⲡⲉ ⲡⲓⲉϩⲟⲟⲩ ⲛ̀ⲧⲉ ⲡϭ̅ⲥ̅ ⲟⲩⲛⲓϣϯ ⲡⲉ ⲟⲩⲟϩ ϥⲟⲩⲟⲛϩ ⲉ̀ⲃⲟⲗ ⲉ̀ⲙⲁϣⲱ ⲟⲩⲟϩ ⲛⲓⲙ ⲉⲑⲛⲁϣ̀ϫⲉⲙϫⲟⲙ ⲛ̀ϧⲏⲧϥ							 καὶ κύριος δώσει φωνὴν αὐτοῦ πρὸ προσώπου δυνάµεως αὐτοῦ, ὅτι πολλή ἐστιν σφόδρα ἡ παρεµβολὴ αὐτοῦ, ὅτι ἰσχυρὰ ἔργα λόγων αὐτοῦ· διότι µεγάλη ἡ ἡµέρα τοῦ κυρίου, µεγάλη καὶ ἐπιφανὴς σφόδρα, καὶ τίς ἔσται ἱκανὸς αὐτῇ;	 And the Lord shall utter his voice before his host: for his camp is very great: for the execution of his words is mighty: for the day of the Lord is great, very glorious, and who shall be able to resist it?	
Joel	2	12	 ⲟⲩⲟϩ ϯⲛⲟⲩ ϥϫⲱ ⲙ̀ⲙⲟⲥ ⲛ̀ϫⲉ ⲡϭ̅ⲥ̅ ⲡⲉⲧⲉⲛⲛⲟⲩϯ ϫⲉ ⲕⲉⲧ ⲑⲏⲛⲟⲩ ϩⲁⲣⲟⲓ ⲉ̀ⲃⲟⲗ ϧⲉⲛ ⲡⲉⲧⲉⲛϩⲏⲧ ⲧⲏⲣϥ ϧⲉⲛ ⲟⲩⲛⲏⲥⲧⲓⲁ ⲛⲉⲙ ⲟⲩⲣⲓⲙⲓ ⲛⲉⲙ ϧⲉⲛ ⲟⲩⲛⲉϩⲡⲓ							 καὶ νῦν λέγει κύριος ὁ θεὸς ὑµῶν Ἐπιστράφητε πρός µε ἐξ ὅλης τῆς καρδίας ὑµῶν καὶ ἐν νηστείᾳ καὶ ἐν κλαυθµῷ καὶ ἐν κοπετῷ·	 Now therefore, saith the Lord your God, turn to me with all your heart, and with fasting, and with weeping, and with lamentation:	
Joel	2	13	 ⲟⲩⲟϩ ⲫⲱϧ ⲛ̀ⲛⲉⲧⲉⲛϩⲏⲧ ⲛⲉⲧⲉⲛϩⲃⲱⲥ ⲁⲛ ⲟⲩⲟϩ ⲕⲉⲧ ⲑⲏⲛⲟⲩ ϩⲁ ⲡϭ̅ⲥ̅ ⲡⲉⲧⲉⲛⲛⲟⲩϯ ϫⲉ ⲟⲩⲛⲁⲏⲧ ⲡⲉ ⲟⲩⲟϩ ⲟⲩⲣⲉϥⲱⲟⲩ ⲛ̀ϩⲏⲧ ⲡⲉ ⲉ̀ⲛⲁϣⲉ ⲡⲉϥⲛⲁⲓ ⲟⲩⲟϩ ϥⲟⲩⲱⲙ ⲛ̀ϩⲑⲏϥ ⲉ̀ϫⲉⲛ ⲛⲓⲕⲁⲕⲓⲁ							 καὶ διαρρήξατε τὰς καρδίας ὑµῶν καὶ µὴ τὰ ἱµάτια ὑµῶν καὶ ἐπιστράφητε πρὸς κύριον τὸν θεὸν ὑµῶν, ὅτι ἐλεήµων καὶ οἰκτίρµων ἐστίν, µακρόθυµος καὶ πολυέλεος καὶ µετανοῶν ἐπὶ ταῖς κακίαις.	 and rend your hearts, and not your garments, and turn to the Lord your God: for he is merciful and compassionate, long-suffering, and plenteous in mercy, and repents of evils.	
Joel	2	14	 ⲛⲓⲙ ⲉⲧⲉⲙⲓ ϫⲉ ⲁⲛ ϥⲛⲁⲧⲁⲥⲑⲟ ⲟⲩⲟϩ ⲛ̀ⲧⲉϥⲟⲩⲱⲙ ⲛ̀ϩⲑⲏϥ ⲟⲩⲟϩ ⲛ̀ⲧⲉϥⲥⲱϫⲡ ⲛ̀ⲟⲩⲥⲙⲟⲩ ⲛ̀ⲟⲩϩⲓⲫⲁϩⲟⲩ ⲙ̀ⲙⲟϥ ⲟⲩϣⲟⲩϣⲱⲟⲩϣⲓ ⲛⲉⲙ ⲟⲩⲱⲧⲉⲛ ⲉ̀ⲃⲟⲗ ⲙ̀ⲡϭ̅ⲥ̅ ⲡⲉⲧⲉⲛⲛⲟⲩϯ							 τίς οἶδεν εἰ ἐπιστρέψει καὶ µετανοήσει καὶ ὑπολείψεται ὀπίσω αὐτοῦ εὐλογίαν, θυσίαν καὶ σπονδὴν κυρίῳ τῷ θεῷ ἡµῶν;	 Who knows if he will return, and repent, and leave a blessing behind him, even a meat-offering and a drink-offering to the Lord your God?	
Joel	2	15	 ⲁⲣⲓⲥⲁⲗⲡⲓⲍⲓⲛ ⲛ̀ⲟⲩⲥⲁⲗⲡⲓⲅⲝ ϧⲉⲛ ⲥⲓⲱⲛ ⲙⲁⲧⲟⲩⲃⲟ ⲛ̀ⲟⲩⲛⲏⲥⲧⲓⲁ ϩⲓⲱⲓϣ ⲛ̀ⲟⲩϣⲉⲙϣⲓ							 σαλπίσατε σάλπιγγι ἐν Σιων, ἁγιάσατε νηστείαν, κηρύξατε θεραπείαν,	 Sound the trumpet in Sion, sanctify a fast, proclaim a solemn service:	
