book	chapter	verse	Bohairic	Akhmimic	Fayyumic	OldBohairic	Mesokemic	DialectP	Lycopolitan	Greek	English	Sahidic
Joel	3	16	 ⲡϭ̅ⲥ̅ ⲇⲉ ⲉϥⲉ̀ⲱϣ ⲉ̀ⲃⲟⲗ ϧⲉⲛ ⲥⲓⲱⲛ ⲟⲩⲟϩ ⲉϥⲉ̀ϯ ⲛ̀ⲧⲉϥⲥⲙⲏ ⲉ̀ⲃⲟⲗ ϧⲉⲛ ⲓⲗ̅ⲏ̅ⲙ̅ ⲟⲩⲟϩ ⲉⲥⲉ̀ⲙⲟⲛⲙⲉⲛ ⲛ̀ϫⲉ ⲧⲫⲉ ⲛⲉⲙ ⲡⲕⲁϩⲓ ⲡϭ̅ⲥ̅ ⲇⲉ ⲉϥⲉ̀ϯⲁⲥⲟ ⲉ̀ⲡⲉϥⲗⲁⲟⲥ ⲟⲩⲟϩ ⲡϭ̅ⲥ̅ ⲉϥⲉ̀ϯϫⲟⲙ ⲛ̀ⲛⲉⲛϣⲏⲣⲓ ⲙ̀ⲡⲓⲥ̅ⲗ̅							 ὁ δὲ κύριος ἐκ Σιων ἀνακεκράξεται καὶ ἐξ Ιερουσαληµ δώσει φωνὴν αὐτοῦ, καὶ σεισθήσεται ὁ οὐρανὸς καὶ ἡ γῆ· ὁ δὲ κύριος φείσεται τοῦ λαοῦ αὐτοῦ, καὶ ἐνισχύσει κύριος τοὺς υἱοὺς Ισραηλ.	 And the Lord shall cry out of Sion, and shall utter his voice from Jerusalem; and the heaven and the earth shall be shaken, but the Lord shall spare his people, and shall strengthen the children of Israel.	
Joel	3	17	 ⲟⲩⲟϩ ⲉⲣⲉⲧⲉⲛⲉ̀ⲉⲙⲓ ϫⲉ ⲁ̀ⲛⲟⲕ ⲡⲉ ⲡϭ̅ⲥ̅ ⲡⲉⲧⲉⲛⲛⲟⲩϯ ⲫⲏ ⲉⲧϣⲟⲡ ϧⲉⲛ ⲥⲓⲱⲛ ⲡⲁⲧⲱⲟⲩ ⲉⲑⲟⲩⲁⲃ ⲟⲩⲟϩ ⲉⲥⲉ̀ϣⲱⲡⲓ ⲉⲥⲟⲩⲁⲃ ⲛ̀ϫⲉ ⲓⲗ̅ⲏ̅ⲙ̅ ⲟⲩⲟϩ ⲛ̀ⲛⲉ ⲁⲗⲗⲟⲅⲉⲛⲏⲥ ϫⲉ ⲥⲓⲛⲓ ⲉ̀ⲃⲟⲗ ϩⲓⲧⲟⲧⲥ							 καὶ ἐπιγνώσεσθε διότι ἐγὼ κύριος ὁ θεὸς ὑµῶν ὁ κατασκηνῶν ἐν Σιων ἐν ὄρει ἁγίῳ µου· καὶ ἔσται Ιερουσαληµ πόλις ἁγία, καὶ ἀλλογενεῖς οὐ διελεύσονται δι’ αὐτῆς οὐκέτι.	 And ye shall know that I am the Lord your God, who dwell in Sion my holy mountain: and Jerusalem shall be holy, and strangers shall not pass through her anymore.	
Joel	3	18	 ⲟⲩⲟϩ ⲉⲣⲉ̀ϣⲱⲡⲓ ϧⲉⲛ ⲛⲓⲉϩⲟⲟⲩ ⲉⲧⲉⲙ̀ⲙⲁⲩ ⲉⲣⲉ ⲛⲓⲧⲱⲟⲩ ⲧⲉⲗⲧⲉⲗ ⲛ̀ⲟⲩϩⲗⲟϫ ⲟⲩⲟϩ ⲛⲓⲕⲁⲗⲁⲙⲫⲟ ⲉⲩⲉ̀ϧⲁϯ ⲛ̀ⲉⲣⲱϯ ⲟⲩⲟϩ ⲛⲓⲙⲁⲛϯⲙⲱⲟⲩ ⲧⲏⲣⲟⲩ ⲛ̀ⲧⲉ ⲓⲟⲩⲇⲁ ⲉⲩⲉ̀ϧⲁϯ ⲛ̀ϩⲁⲛⲙⲱⲟⲩ ⲟⲩⲟϩ ⲟⲩⲙⲟⲩⲙⲓ ⲉⲥⲉ̀ⲓ̀ ⲉ̀ⲃⲟⲗ ϧⲉⲛ ⲡⲏⲓ ⲙ̀ⲡϭ̅ⲥ̅ ⲟⲩⲟϩ ⲉⲥⲉ̀ⲧⲥⲟ ⲙ̀ⲡⲓⲭⲓⲙⲁⲣⲟⲥ ⲛ̀ⲧⲉ ⲛⲓϣⲉⲛⲥⲓϥⲓ							 καὶ ἔσται ἐν τῇ ἡµέρᾳ ἐκείνῃ ἀποσταλάξει τὰ ὄρη γλυκασµόν, καὶ οἱ βουνοὶ ῥυήσονται γάλα, καὶ πᾶσαι αἱ ἀφέσεις Ιουδα ῥυήσονται ὕδατα, καὶ πηγὴ ἐξ οἴκου κυρίου ἐξελεύσεται καὶ ποτιεῖ τὸν χειµάρρουν τῶν σχοίνων.	 And it shall come to pass in that day that the mountains shall drop sweet wine, and the hills shall flow with milk, and all the fountains of Juda shall flow with water, and a fountain shall go forth of the house of the Lord, and water the valley of flags.	
Joel	3	19	 ⲭⲏⲙⲓ ⲉϥⲉ̀ϣⲱⲡⲓ ⲉ̀ⲡⲧⲁⲕⲟ ⲟⲩⲟϩ ϯϩⲩⲇⲟⲙⲉⲁ ⲉⲥⲉ̀ϣⲱⲡⲓ ⲉⲩⲙⲉϣϣⲱϯ ⲛ̀ⲧⲉ ⲡⲧⲁⲕⲟ ⲉ̀ⲃⲟⲗ ϧⲉⲛ ⲛⲓϭⲓⲛϫⲟⲛⲥ ⲛ̀ⲧⲉ ⲛⲉⲛϣⲏⲣⲓ ⲛⲓⲟⲩⲇⲁ ⲉⲫⲙⲁ ϫⲉ ⲁⲩⲫⲱⲛ ⲛ̀ⲟⲩⲥⲛⲟϥ ⲛ̀ⲑⲙⲏⲓ ⲉ̀ⲃⲟⲗ ϧⲉⲛ ⲡⲟⲩⲕⲁϩⲓ							 Αἴγυπτος εἰς ἀφανισµὸν ἔσται, καὶ ἡ Ιδουµαία εἰς πεδίον ἀφανισµοῦ ἔσται ἐξ ἀδικιῶν υἱῶν Ιουδα, ἀνθ’ ὧν ἐξέχεαν αἷµα δίκαιον ἐν τῇ γῇ αὐτῶν.	 Egypt shall be a desolation, and Idumea shall be a desolate plain, because of the wrongs of the children of Juda, because they have shed righteous blood in their land.	
Joel	3	20	 ϯⲓⲟⲩⲇⲉⲁ ⲛⲁϫⲱⲣϫ ϣⲁ ⲉⲛⲉϩ ⲟⲩⲟϩ ⲓⲗ̅ⲏ̅ⲙ̅ ⲉ̀ϩⲁⲛϫⲱⲟⲩ ⲛ̀ϫⲱⲟⲩ							 ἡ δὲ Ιουδαία εἰς τὸν αἰῶνα κατοικηθήσεται καὶ Ιερουσαληµ εἰς γενεὰς γενεῶν.	 But Judea shall be inhabited for ever, and Jerusalem to all generations.	
Joel	3	21	 ⲟⲩⲟϩ ⲉⲓⲉ̀ϭⲓⲙ̀ⲡⲉⲙⲡϣⲓϣ ⲙ̀ⲡⲟⲩⲥⲛⲟϥ ⲟⲩⲟϩ ϯⲛⲁⲧⲟⲩⲃⲱⲟⲩ ⲟⲩⲟϩ ⲡϭ̅ⲥ̅ ⲛⲁϣⲱⲡⲓ ϧⲉⲛ ⲥⲓⲱⲛ							 καὶ ἐκδικήσω τὸ αἷµα αὐτῶν καὶ οὐ µὴ ἀθῳώσω. καὶ κύριος κατασκηνώσει ἐν Σιων.	 And I will make inquisition for their blood, and will by no means leave it unavenged: and the Lord shall dwell in Sion.	
