book	chapter	verse	Bohairic	Akhmimic	Fayyumic	OldBohairic	Mesokemic	DialectP	Lycopolitan	Greek	English	Sahidic
Proverbs	22	10	 							 ἔκβαλε ἐκ συνεδρίου λοιµόν, καὶ συνεξελεύσεται αὐτῷ νεῖκος· ὅταν γὰρ καθίσῃ ἐν συνεδρίῳ, πάντας ἀτιµάζει.	 Cast out a pestilent person from the council, and strife shall go out with him; for when he sits in the council he dishonours all.	 ⲛⲟⲩϫⲉ ⲉⲃⲟⲗ ⲛ̅ⲟⲩⲁ ⲉϥϩⲟⲟⲩ ϩⲛ̅ ⲟⲩⲙⲏⲏϣⲉ ⲧⲁⲣⲉ ⲡϯⲧⲱⲛ ⲃⲱⲕ ⲉⲃⲟⲗ ⲛⲙ̅ⲙⲁϥ ⲉϥϣⲁⲛϩⲙⲟⲟⲥ ⲅⲁⲣ ϩⲙ̅ ⲡⲙⲏⲏϣⲉ ϣⲁϥⲥⲟϣⲟⲩ ⲧⲏⲣⲟⲩ.
Proverbs	22	11	 							 ἀγαπᾷ κύριος ὁσίας καρδίας, δεκτοὶ δὲ αὐτῷ πάντες ἄµωµοι· χείλεσιν ποιµαίνει βασιλεύς.	 The Lord loves holy hearts, and all blameless persons are acceptable with him: a king rules with his lips.	 ⲉⲣⲉ ⲡⲛⲟⲩⲧⲉ ⲙⲉ ⲛ̅ⲛ̅ϩⲏⲧ ⲉⲧⲟⲩⲁⲁⲃ ⲟⲩⲟⲛ ⲇⲉ ⲛⲓⲙ ⲉⲧⲟⲩⲁⲁⲃ ⲥⲟⲧⲡ̅ ⲛⲁϥ ⲉⲣⲉ ⲡⲥⲱϣ ⲙⲟⲟⲛⲉ ϩⲓ ⲛⲉϥⲥⲡⲟⲧⲟⲩ ⲉⲣⲉ ⲡⲣ̅ⲣⲟ ⲇⲉ ϩⲙ̅ ⲡⲉϥⲁⲙⲁϩⲧⲉ.
Proverbs	22	12	 							 οἱ δὲ ὀφθαλµοὶ κυρίου διατηροῦσιν αἴσθησιν, φαυλίζει δὲ λόγους παράνοµος.	 But the eyes of the Lord preserve discretion; but the transgressor despises wise words.	 ⲛ̅ⲃⲁⲗ ⲙ̅ⲡⲛⲟⲩⲧⲉ ϩⲁⲣⲉϩ ⲉⲛ̅ⲣⲉϥⲁⲓⲥⲑⲁⲛⲉ ϣⲁⲣⲉ ⲡⲡⲁⲣⲁⲛⲟⲙⲟⲥ ⲇⲉ ⲥⲱϣϥ̅ ⲛ̅ϩⲉⲛϣⲁϫⲉ.
Proverbs	22	13	 							 προφασίζεται καὶ λέγει ὀκνηρός Λέων ἐν ταῖς ὁδοῖς, ἐν δὲ ταῖς πλατείαις φονευταί.	 The sluggard makes excuses, and says, There is a lion in the ways, and murderers in the streets.	 ϣⲁⲣⲉ ⲡⲣⲉϥϫⲛⲁⲁⲩ ϭⲛ̅ ⲗⲟⲓϭⲉ ⲛϥ̅ϫⲓⲟⲩⲱ ϫⲉ ⲡⲙⲟⲩⲓ ϩⲛ̅ ⲛⲉϩⲓⲟⲟⲩⲉ ⲁⲩⲱ ⲥⲉϩⲱⲧⲃ̅ ϩⲛ̅ ⲛⲉⲡⲗⲁⲧⲓⲁ.
Proverbs	22	14	 							 βόθρος βαθὺς στόµα παρανόµου, ὁ δὲ µισηθεὶς ὑπὸ κυρίου ἐµπεσεῖται εἰς αὐτόν. (14a) εἰσὶν ὁδοὶ κακαὶ ἐνώπιον ἀνδρός, καὶ οὐκ ἀγαπᾷ τοῦ ἀποστρέψαι ἀπ’ αὐτῶν· ἀποστρέφειν δὲ δεῖ ἀπὸ ὁδοῦ σκολιᾶς καὶ κακῆς.	 The mouth of a transgressor is a deep pit; and he that is hated of the Lord shall fall into it. (14a) Evil ways are before a man, and he does not like to turn away from them; but it is needful to turn aside from a perverse and bad way.	 ⲟⲩϩⲓⲉⲓⲧ ⲉϥϫⲏⲕ ⲧⲉ ⲧⲧⲁⲡⲣⲟ ⲙ̅ⲡⲁⲣⲁⲛⲟⲙⲟⲥ ⲡⲉⲛⲧⲁⲩⲙⲉⲥⲧⲱϥ ⲇⲉ ϩⲓⲧⲙ̅ ⲡⲛⲟⲩⲧⲉ ϥⲛⲁϩⲉ ⲉϩⲣⲁⲓ̈ ⲉⲣⲟϥ ⲟⲩⲛ̅ ϩⲉⲛϩⲓⲟⲟⲩⲉ ⲉⲩϩⲟⲟⲩ ⲙ̅ⲡⲉⲙ̅ⲧⲟ ⲉⲃⲟⲗ ⲙ̅ⲡⲣⲱⲙⲉ ⲁⲩⲱ ⲛϥ̅ⲙⲉ ⲁⲛ ⲕⲧⲟϥ ⲉⲃⲟⲗ ⲙ̅ⲙⲟⲟⲩ ϣ̅ϣⲉ ⲇⲉ ⲉⲕⲧⲟⲕ ⲉⲃⲟⲗ ϩⲛ̅ ϩⲓⲏ ⲛⲓⲙ ⲉⲧϭⲟⲟⲩϭ ⲁⲩⲱ ⲉⲑⲟⲟⲩ.
Proverbs	22	15	 							 ἄνοια ἐξῆπται καρδίας νέου, ῥάβδος δὲ καὶ παιδεία µακρὰν ἀπ’ αὐτοῦ.	 Folly is attached to the heart of a child, but the rod and instruction are then far from him.	 ⲁ ⲡϩⲏⲧ ⲙ̅ⲡⲣⲱⲙⲉ ϣⲏⲙ ϫⲓϥⲟϭⲥ̅ ϩⲛ̅ ⲧⲙⲛ̅ⲧⲁⲑⲏⲧ ⲡϭⲉⲣⲱⲃ ⲅⲁⲣ ⲙⲛ̅ⲧⲉⲥⲃⲱ ⲟⲩⲏⲩ ⲙ̅ⲙⲟϥ.
Proverbs	22	16	 							 ὁ συκοφαντῶν πένητα πολλὰ ποιεῖ τὰ ἑαυτοῦ· δίδωσιν δὲ πλουσίῳ ἐπ’ ἐλάσσονι.	 He that oppresses the poor, increases his own substance, yet gives to the rich so as to make it less.	 ⲡⲉⲧϩⲓⲗⲁ ⲉⲩϩⲏⲕⲉ ⲉϥⲧⲁϣⲟ ⲛ̅ⲛⲉϥⲡⲉⲑⲟⲟⲩ ϥⲛⲁϯ ⲇⲉ ⲙ̅ⲡⲣⲙ̅ⲙⲁⲟ ⲉϫⲙ̅ ⲡⲉⲧⲣ̅ϭⲣⲱϩ.
Proverbs	22	17	 							 Λόγοις σοφῶν παράβαλλε σὸν οὖς καὶ ἄκουε ἐµὸν λόγον, τὴν δὲ σὴν καρδίαν ἐπίστησον, ἵνα γνῷς ὅτι καλοί εἰσιν·	 Incline thine ear to the words of wise men: hear also my word, and apply thine heart,	 ⲣⲓⲕⲉ ⲙ̅ⲡⲉⲕⲙⲁⲁϫⲉ ⲉⲡϣⲁϫⲉ ⲛ̅ⲛ̅ⲥⲟⲫⲟⲥ ⲁⲩⲱ ⲛⲅ̅ⲥⲱⲧⲙ̅ ⲉⲛⲁϣⲁϫⲉ ⲛⲅ̅ⲥⲙⲓⲛⲉ ⲇⲉ ⲙ̅ⲡⲉⲕϩⲏⲧ ϫⲉ ⲉⲕⲉⲉⲓⲙⲉ ⲉⲣⲟⲟⲩ ϫⲉ ⲛⲁⲛⲟⲩⲟⲩ.
Proverbs	22	18	 							 καὶ ἐὰν ἐµβάλῃς αὐτοὺς εἰς τὴν καρδίαν σου, εὐφρανοῦσίν σε ἅµα ἐπὶ σοῖς χείλεσιν,	 that thou mayest know that they are good: and if thou lay them to heart, they shall also gladden thee on thy lips.	 ⲁⲩⲱ ⲉⲕϣⲁⲛⲕⲁⲁⲩ ϩⲙ̅ ⲡⲉⲕϩⲏⲧ ⲕⲛⲁϯϩⲏⲩ ⲥⲟⲩⲧⲱⲛⲟⲩ ⲇⲉ ϩⲓⲟⲩⲥⲟⲡ ⲉϫⲛ̅ ⲛⲉⲕⲥⲡⲟⲧⲟⲩ.
Proverbs	22	19	 							 ἵνα σου γένηται ἐπὶ κύριον ἡ ἐλπὶς καὶ γνωρίσῃ σοι τὴν ὁδὸν αὐτοῦ.	 That thy hope may be in the Lord, and he may make thy way known to thee.	 ϫⲉⲕⲁⲥ ⲉⲣⲉ ⲟⲩⲧⲱⲕ ⲛ̅ϩⲏⲧ ϣⲱⲡⲉ ⲛⲁⲕ ⲉϫⲙ̅ ⲡⲛⲟⲩⲧⲉ ⲁⲩⲱ ⲛϥ̅ⲧⲁⲙⲟⲕ ⲉⲧⲉϥϩⲓⲏ.
Proverbs	22	20	 							 καὶ σὺ δὲ ἀπόγραψαι αὐτὰ σεαυτῷ τρισσῶς εἰς βουλὴν καὶ γνῶσιν ἐπὶ τὸ πλάτος τῆς καρδίας σου.	 And do thou too repeatedly record them for thyself on the table of thine heart, for counsel and knowledge.	 ⲛ̅ⲧⲟⲕ ⲇⲉ ϩⲱⲕ ⲥϩⲁⲓ̈ⲥⲟⲩ ⲛⲁⲕ ⲛ̅ϣⲙ̅ⲧⲥⲱⲡ ⲉⲩϣⲟϫⲛⲉ ⲙⲛ̅ ⲟⲩⲥⲟⲟⲩⲛ.
Proverbs	22	21	 							 διδάσκω οὖν σε ἀληθῆ λόγον καὶ γνῶσιν ἀγαθὴν ὑπακούειν τοῦ ἀποκρίνεσθαι λόγους ἀληθείας τοῖς προβαλλοµένοις σοι.	 I therefore teach thee truth, and knowledge good to hear; that thou mayest answer words of truth to them that question thee.	 ϯⲧⲥⲁⲃⲉ ⲇⲟ ⲙ̅ⲙⲟⲕ ⲉⲥⲟⲟⲩⲛ ⲧⲙⲉ ⲁⲩⲱ ⲉϫⲱ ⲛ̅ⲛ̅ϣⲁϫⲉ ⲛ̅ⲧⲙⲉ ⲛ̅ⲛⲉⲧⲛⲁϫⲛⲟⲩⲕ ⲡϣⲟϫⲛⲉ ⲛⲁϣⲧ̅ ⲉⲡⲟⲩⲟⲓ ⲛ̅ⲟⲩⲙⲟⲟⲩ ⲥⲱⲧⲙ̅ ⲉϫⲓ ⲛ̅ⲟⲩⲱ ⲛ̅ⲛⲉⲧⲛⲁϫⲛⲟⲩⲕ.
Proverbs	22	22	 							 Μὴ ἀποβιάζου πένητα, πτωχὸς γάρ ἐστιν, καὶ µὴ ἀτιµάσῃς ἀσθενῆ ἐν πύλαις·	 Do no violence to the poor, for he is needy: neither dishonour the helpless man in the gates.	 ⲙ̅ⲡⲣ̅ϫⲓ ⲟⲩϩⲏⲕⲉ ⲛ̅ϭⲟⲛⲥ̅ ϫⲉ ϥⲣ̅ϭⲣⲱϩ ⲅⲁⲣ ⲁⲩⲱ ⲙ̅ⲡⲣ̅ⲥⲉϣϥ̅ ⲟⲩⲁⲥⲑⲉⲛⲏⲥ ϩⲛ̅ ϩⲉⲛⲗⲩⲡⲏ.
Proverbs	22	23	 							 ὁ γὰρ κύριος κρινεῖ αὐτοῦ τὴν κρίσιν, καὶ ῥύσῃ σὴν ἄσυλον ψυχήν.	 For the Lord will plead his cause, and thou shalt deliver thy soul in safety.	 ⲡϫⲟⲉⲓⲥ ⲅⲁⲣ ⲛⲁⲕⲣⲓⲛⲉ ⲙ̅ⲡⲉϥϩⲁⲡ ⲁⲩⲱ ⲕⲛⲁⲧⲟⲩϫⲟ ⲛ̅ⲧⲉⲕⲯⲩⲭⲏ ⲛ̅ⲁⲧⲁⲣⲓⲕⲉ.
Proverbs	22	24	 							 µὴ ἴσθι ἑταῖρος ἀνδρὶ θυµώδει, φίλῳ δὲ ὀργίλῳ µὴ συναυλίζου,	 Be not companion to a furious man; neither lodge with a passionate man:	 ⲙ̅ⲡⲣ̅ⲣ̅ϣⲃⲏⲣ ⲉⲩⲣⲱⲙⲉ ⲛ̅ⲣⲉϥϭⲱⲛⲧ̅ ⲙ̅ⲡⲣ̅ϣⲱⲡⲉ ⲇⲉ ⲙⲛ̅ ⲟⲩϣⲃⲏⲣ ⲛ̅ⲣⲉϥⲛⲟⲩϭⲥ̅.
Proverbs	22	25	 							 µήποτε µάθῃς τῶν ὁδῶν αὐτοῦ καὶ λάβῃς βρόχους τῇ σῇ ψυχῇ.	 lest thou learn of his ways, and get snares to thy soul.	 ⲙⲏⲡⲟⲧⲉ ⲛⲅ̅ϫⲓⲥⲃⲱ ⲉⲛⲉϥϩⲓⲟⲟⲩⲉ ⲛⲅ̅ϫⲓ ⲛ̅ⲟⲩϩⲁϭⲉ ⲉⲧⲉⲕⲯⲩⲭⲏ.
Proverbs	22	26	 							 µὴ δίδου σεαυτὸν εἰς ἐíύην αἰσχυνόµενος πρόσωπον·	 Become not surety from respect of a man’s person.	 ⲙ̅ⲡⲣ̅ⲧⲁⲁⲕ ⲛ̅ϣⲡ̅ⲧⲱⲣⲉ ⲉⲁⲕϣⲓⲛⲉ ϩⲏⲧϥ̅ ⲛ̅ⲟⲩϩⲟ.
Proverbs	22	27	 							 ἐὰν γὰρ µὴ ἔχῃς πόθεν ἀποτείσῃς, λήµψονται τὸ στρῶµα τὸ ὑπὸ τὰς πλευράς σου.	 For if those have not whence to give compensation, they will take the bed that is under thee.	 ⲉϣⲱⲡⲉ ⲅⲁⲣ ⲉⲙⲛ̅ⲧⲁⲕ ⲉⲧⲁⲁⲩ ⲥⲉⲛⲁϥⲓ ⲙ̅ⲡⲉ ⲡⲣⲏϣ ⲉⲧϩⲁ ⲛⲉⲕⲥⲡⲓⲣⲟⲟⲩⲉ.
Proverbs	22	28	 							 µὴ µέταιρε ὅρια αἰώνια, ἃ ἔθεντο οἱ πατέρες σου.	 Remove not the old landmarks, which thy fathers placed.	 ⲙ̅ⲡⲣ̅ⲡⲉⲉⲛⲉ ⲛ̅ⲧⲟϣ ⲉⲃⲟⲗ ϣⲁ ⲉⲛⲉϩ ⲛ̅ⲧⲁ ⲛⲉⲕⲉⲓⲟⲧⲉ ⲥⲙⲛ̅ⲧⲟⲩ.
Proverbs	22	29	 							 ὁρατικὸν ἄνδρα καὶ ὀξὺν ἐν τοῖς ἔργοις αὐτοῦ βασιλεῦσι δεῖ παρεστάναι καὶ µὴ παρεστάναι ἀνδράσι νωθροῖς.	 It is fit that an observant man and one diligent in his business should attend on kings, and not attend on slothful men.	 ⲟⲩⲣⲱⲙⲉ ⲛ̅ⲣⲉϥϯϩⲧⲏϥ ⲛ̅ⲣⲉϥϭⲉⲡⲏ ϩⲛ̅ ⲛⲉϥϩⲃⲏⲩⲉ ϩⲁⲡⲥ̅ ⲉⲣⲟϥ ⲉⲧⲣⲉϥⲁϩⲉⲣⲁⲧϥ̅ ⲉϩⲉⲛⲉⲣⲱⲟⲩ ⲛϥ̅ⲧⲙ̅ⲁϩⲉⲣⲁⲧϥ̅ ⲉϩⲉⲛⲣⲱⲙⲉ ⲛ̅ϭⲱⲃ.
Proverbs	23	1	 							 ἐὰν καθίσῃς δειπνεῖν ἐπὶ τραπέζης δυναστῶν, νοητῶς νόει τὰ παρατιθέµενά σοι	 If thou sit to sup at the table of a prince, consider attentively the things set before thee:	 ⲉⲕϣⲁⲛϩⲙⲟⲟⲥ ⲉⲟⲩⲱⲙ ϩⲓ ⲧⲉⲧⲣⲁⲡⲉⲍⲁ ⲛ̅ⲟⲩϫⲱⲱⲣⲉ ϩⲛ̅ ⲟⲩⲛⲟⲓ ⲛⲟⲓ ⲛ̅ⲛⲉⲧⲟⲩⲕⲱ ⲙ̅ⲙⲟⲟⲩ ϩⲁⲣⲱⲕ.
Proverbs	23	2	 							 καὶ ἐπίβαλλε τὴν χεῖρά σου εἰδὼς ὅτι τοιαῦτά σε δεῖ παρασκευάσαι·	 and apply thine hand, knowing that it behoves thee to prepare such meats: but if thou art very insatiable,	 ⲛⲅ̅ϩⲓⲧⲟⲟⲩⲧⲕ̅ ⲉⲣⲟⲟⲩ ⲉⲕⲥⲟⲟⲩⲛ ϫⲉ ⲕⲛⲁϫⲡⲓ ⲥⲟⲃⲧⲉ ⲛ̅ⲧⲉⲓ̈ϩⲉ.
Proverbs	23	3	 							 εἰ δὲ ἀπληστότερος εἶ, µὴ ἐπιθύµει τῶν ἐδεσµάτων αὐτοῦ, ταῦτα γὰρ ἔχεται ζωῆς ψευδοῦς.	 desire not his provisions; for these belong to a false life.	 ⲉϣⲱⲡⲉ ⲇⲉ ⲛ̅ⲧⲕ̅ⲟⲩⲁⲧⲥⲉⲓ ⲙ̅ⲡⲣ̅ⲉⲡⲓⲑⲩⲙⲓ ⲉⲛⲉϥϭⲓⲛ̅ⲟⲩⲱⲙ ⲛⲁⲓ̈ ⲅⲁⲣ ϩⲏⲛ ⲉϩⲟⲩⲛ ⲉⲩⲱⲛϩ̅ ⲛ̅ⲛⲟⲩϫ.
Proverbs	23	4	 							 µὴ παρεκτείνου πένης ὢν πλουσίῳ, τῇ δὲ σῇ ἐννοίᾳ ἀπόσχου·	 If thou art poor, measure not thyself with a rich man; but refrain thyself in thy wisdom.	 ⲙ̅ⲡⲣ̅ⲥⲟⲩⲧⲛ ⲧⲟⲟⲧⲕ̅ ⲉⲃⲟⲗ ⲙⲛ̅ ⲟⲩⲣⲙ̅ⲙⲁⲟ ⲛ̅ⲧⲕ̅ ⲟⲩϩⲏⲕⲉ ⲥⲁϩⲱⲱⲕ ⲇⲉ ⲉⲃⲟⲗ ⲙ̅ⲙⲟϥ ϩⲙ̅ ⲡⲉⲕϩⲏⲧ.
Proverbs	23	5	 							 ἐὰν ἐπιστήσῃς τὸ σὸν ὄµµα πρὸς αὐτόν, οὐδαµοῦ φανεῖται, κατεσκεύασται γὰρ αὐτῷ πτέρυγες ὥσπερ ἀετοῦ, καὶ ὑποστρέφει εἰς τὸν οἶκον τοῦ προεστηκότος αὐτοῦ.	 If thou shouldest fix thine eye upon him, he will disappear; for wings like an eagle’s are prepared for him, and he returns to the house of his master.	 ⲉϣⲱⲡⲉ ⲇⲉ ⲉⲕϣⲁⲛⲥⲙ̅ⲛⲉⲓⲁⲧⲕ̅ ⲉϫⲱϥ ⲛ̅ⲛⲉϥⲟⲩⲱⲛϩ ⲉⲃⲟⲗ ϩⲛ̅ ⲗⲁⲁⲩ ⲙ̅ⲙⲁ ⲁϥⲥⲟⲃⲧⲉ ⲅⲁⲣ ⲛⲁϥ ⲛ̅ϩⲉⲛⲧⲛ̅ϩ ⲛ̅ⲑⲉ ⲛ̅ⲟⲩⲁϩⲱⲙ ⲉⲃⲱⲗ ⲉⲃⲟⲗ ⲉⲡⲁⲏⲣ ⲁⲩⲱ ϥⲛⲁⲕⲧⲟϥ ⲉⲡⲏⲓ̈ ⲙ̅ⲡⲉⲧϩⲓϫⲱϥ ⲡⲱⲛ ⲉϩⲣⲟϣ ⲁⲩⲱ ⲡϣⲱ ⲙⲟⲕϩ̅ ⲛ̅ϥⲓ ϩⲁⲣⲟϥ ⲧⲟⲣⲅⲏ ⲇⲉ ⲙ̅ⲡⲁⲑⲏⲧ ϩⲟⲣϣ̅ ⲉϩⲟⲩⲟ ⲉⲣⲟⲟⲩ ⲙ̅ⲡⲉⲥⲛⲁⲩ.
Proverbs	23	6	 							 µὴ συνδείπνει ἀνδρὶ βασκάνῳ µηδὲ ἐπιθύµει τῶν βρωµάτων αὐτοῦ·	 Sup not with an envious man, neither desire thou his meats:	 ⲙ̅ⲡⲣ̅ⲟⲩⲱⲙ ⲙⲛ̅ ⲟⲩⲣⲱⲙⲉ ⲛⲉⲓⲉⲣⲃⲟⲟⲛⲉ ⲁⲩⲱ ⲙ̅ⲡⲣ̅ⲉⲡⲓⲑⲩⲙⲓ ⲉⲛⲉϥϭⲓⲛ̅ⲟⲩⲱⲙ ⲛⲁⲓ̈ ⲅⲁⲣ ϩⲏⲛ ⲉϩⲟⲩⲛ ⲉⲩⲱⲛϩ ⲛ̅ⲛⲟⲩϫ
Proverbs	23	7b	 							 µηδὲ πρὸς σὲ εἰσαγάγῃς αὐτὸν καὶ φάγῃς τὸν ψωµόν σου µετ’ αὐτοῦ·	 and do not bring him in to thyself, nor eat thy morsel with him:	 ⲙ̅ⲡⲣ̅ϫⲓⲧϥ ⲉϩⲟⲩⲛ ⲉⲡⲉⲕⲏⲓ̈ ϫⲉ ⲛ̅ⲛⲉⲕⲟⲩⲱⲙ ⲛ̅ⲛⲉⲕⲟⲉⲓⲕ ⲛⲙ̅ⲙⲁϥ.
Proverbs	23	7a	 							 ὃν τρόπον γὰρ εἴ τις καταπίοι τρίχα, οὕτως ἐσθίει καὶ πίνει.	 so he eats and drinks as if any one should swallow a hair,	 ⲛ̅ⲑⲉ ⲅⲁⲣ ⲛ̅ⲟⲩⲁ ⲉϥⲛⲁⲉⲙⲕⲟⲩϥⲱ ⲧⲁⲓ̈ ⲧⲉ ⲑⲉ ⲉⲧϥ̅ⲛⲁⲟⲩⲱⲙ ⲁⲩⲱ ⲛϥ̅ⲥⲱ
Proverbs	23	8	 							 ἐξεµέσει γὰρ αὐτὸν καὶ λυµανεῖται τοὺς λόγους σου τοὺς καλούς.	 for he will vomit it up, and spoil thy fair words.	 ϥⲛⲁⲕⲁⲃⲟⲗ ⲅⲁⲣ ⲙ̅ⲙⲟⲟⲩ ⲛϥ̅ⲧⲁⲕⲉ ⲛⲉⲕϣⲁϫⲉ ⲉⲧⲛⲁⲛⲟⲩⲟⲩ.
Proverbs	23	9	 							 εἰς ὦτα ἄφρονος µηδὲν λέγε, µήποτε µυκτηρίσῃ τοὺς συνετοὺς λόγους σου.	 Say nothing in the ears of a fool, lest at any time he sneer at thy wise words.	 ⲙ̅ⲡⲣ̅ϫⲉ ⲗⲁⲁⲩ ⲉⲙⲙⲁⲁϫⲉ ⲙ̅ⲡⲁⲑⲏⲧ ⲙⲏⲡⲟⲧⲉ ⲛϥ̅ⲕⲙ̅ϣ ⲛⲉϥϣⲁϫⲉ.
Proverbs	23	10	 							 µὴ µεταθῇς ὅρια αἰώνια, εἰς δὲ κτῆµα ὀρφανῶν µὴ εἰσέλθῃς·	 Remove not the ancient landmarks; and enter not upon the possession of the fatherless:	 ⲙ̅ⲡⲣ̅ⲃⲱⲕ ⲉϩⲟⲩⲛ ⲉϭⲱⲙ ⲛ̅ⲟⲣⲫⲁⲛⲟⲥ.
Proverbs	23	11	 							 ὁ γὰρ λυτρούµενος αὐτοὺς κύριος κραταιός ἐστιν καὶ κρινεῖ τὴν κρίσιν αὐτῶν µετὰ σοῦ.	 for the Lord is their redeemer; he is mighty, and will plead their cause with thee.	 ⲡⲛⲟⲩⲧⲉ ⲅⲁⲣ ⲉⲧϫⲟⲟⲣ ⲡⲉⲧⲥⲱⲧⲉ ⲙ̅ⲙⲟⲟⲩ ⲁⲩⲱ ϥⲛⲁϫⲓϩⲁⲡ ⲛⲙ̅ⲙⲁⲕ ϩⲁⲣⲟⲟⲩ.
Proverbs	23	12	 							 δὸς εἰς παιδείαν τὴν καρδίαν σου, τὰ δὲ ὦτά σου ἑτοίµασον λόγοις αἰσθήσεως.	 Apply thine heart to instruction, and prepare thine ears for words of discretion.	 ϯ ⲡⲉⲕϩⲏⲧ ⲉⲧⲉⲥⲃⲱ ⲛⲅ̅ⲥⲃ̅ⲧⲉ ⲛⲉⲕⲙⲁⲁϫⲉ ⲉⲛϣⲁϫⲉ ⲛ̅ⲧⲁⲓⲥⲑⲏⲥⲓⲥ.
Proverbs	23	13	 							 µὴ ἀπόσχῃ νήπιον παιδεύειν, ὅτι ἐὰν πατάξῃς αὐτὸν ῥάβδῳ, οὐ µὴ ἀποθάνῃ·	 Refrain not from chastening a child; for if thou beat him with the rod, he shall not die.	 ⲙ̅ⲡⲣ̅ⲗⲟ ⲉⲕϯⲥⲃⲱ ⲛ̅ⲟⲩⲕⲟⲩⲓ̈ ϫⲉ ⲉⲕϣⲁⲛⲣⲁϩⲧϥ̅ ⲛ̅ⲟⲩϭⲉⲣⲱⲃ ⲛ̅ⲛⲉϥⲛⲁⲙⲟⲩ ⲁⲛ.
Proverbs	23	14	 							 σὺ µὲν γὰρ πατάξεις αὐτὸν ῥάβδῳ, τὴν δὲ ψυχὴν αὐτοῦ ἐκ θανάτου ῥύσῃ.	 For thou shalt beat him with the rod, and shalt deliver his soul from death.	 ⲛ̅ⲧⲟⲕ ⲙⲉⲛ ⲅⲁⲣ ⲉⲕⲛⲁⲣⲉϩⲧ ⲡⲉⲕϣⲏⲣⲉ ϩⲛ̅ ⲟⲩϭⲉⲣⲱⲃ ⲕⲛⲁⲧⲟⲩϫⲟ ⲇⲉ ⲛ̅ⲧⲉϥⲯⲩⲭⲏ ⲉⲃⲟⲗ ϩⲙ̅ ⲡⲙⲟⲩ.
Proverbs	23	15	 							 υἱέ, ἐὰν σοφὴ γένηταί σου ἡ καρδία, εὐφρανεῖς καὶ τὴν ἐµὴν καρδίαν,	 Son, if thy heart be wise, thou shalt also gladden my heart;	 ⲡⲁϣⲏⲣⲉ ⲉⲣϣⲁⲛ ⲡⲉⲕϩⲏⲧ ⲣ̅ⲥⲟⲫⲟⲥ ⲕⲛⲁⲉⲩⲫⲣⲁⲛⲧⲉ ⲙ̅ⲡⲱⲓ ϩⲱ.
Proverbs	23	16	 							 καὶ ἐνδιατρίψει λόγοις τὰ σὰ χείλη πρὸς τὰ ἐµὰ χείλη, ἐὰν ὀρθὰ ὦσιν.	 and thy lips shall converse with my lips, if they be right.	 ⲁⲩⲱ ⲛ̅ⲧⲉⲛⲁⲥⲡⲟⲟⲧⲟⲩ ϣⲁϫⲉ ⲙⲛ̅ ⲛⲉⲕⲥⲡⲟⲧⲟⲩ ⲉϣⲱⲡⲉ ⲉⲩⲥⲟⲩⲧⲱⲛ.
Proverbs	23	17	 							 µὴ ζηλούτω ἡ καρδία σου ἁµαρτωλούς, ἀλλὰ ἐν φόβῳ κυρίου ἴσθι ὅλην τὴν ἡµέραν·	 Let not thine heart envy sinners: but be thou in the fear of the Lord all the day.	 ⲙ̅ⲡⲣ̅ⲧⲣⲉ ⲡⲉⲕϩⲏⲧ ⲕⲱϩ ⲉⲛ̅ⲣⲉϥⲣ̅ⲛⲟⲃⲉ ⲁⲗⲗⲁ ⲙⲁⲧⲁϣⲟⲕ ⲉⲩⲙⲛ̅ⲧⲙⲁⲓⲛⲟⲩⲧⲉ ⲁⲩⲱ ⲛⲅ̅ϣⲱⲡⲉ ϩⲛ̅ ⲑⲟⲧⲉ ⲙ̅ⲡϫⲟⲉⲓⲥ ⲙ̅ⲡⲉϩⲟⲟⲩ ⲧⲏⲣϥ̅.
Proverbs	23	18	 							 ἐὰν γὰρ τηρήσῃς αὐτά, ἔσται σοι ἔκγονα, ἡ δὲ ἐλπίς σου οὐκ ἀποστήσεται.	 For if thou shouldest keep these things, thou shalt have posterity; and thine hope shall not be removed.	 ⲉⲕϣⲁⲛϩⲁⲣⲉϩ ⲅⲁⲣ ⲉⲛⲁⲓ̈ ⲟⲩⲛ̅ ϩⲉⲛϫⲡⲟ ⲛⲁϣⲱⲡⲉ ⲛⲁⲕ ⲁⲩⲱ ⲛ̅ⲧⲉⲕϩⲉⲗⲡⲓⲥ ⲛⲁⲱϫⲛ̅ ⲁⲛ.
Proverbs	23	19	 							 ἄκουε, υἱέ, καὶ σοφὸς γίνου καὶ κατεύθυνε ἐννοίας σῆς καρδίας·	 Hear, my son, and be wise, and rightly direct the thoughts of thine heart.	 ⲥⲱⲧⲙ̅ ⲡⲁϣⲏⲣⲉ ⲁⲩⲱ ⲛⲅ̅ⲣ̅ⲥⲟⲫⲟⲥ ⲁⲩⲱ ⲛⲅ̅ⲣ̅ϩⲉⲛⲙⲉⲉⲩⲉ ⲉⲩⲥⲟⲩⲧⲱⲛ ⲙ̅ⲡⲉⲕϩⲏⲧ.
Proverbs	23	20	 							 µὴ ἴσθι οἰνοπότης µηδὲ ἐκτείνου συµβολαῖς κρεῶν τε ἀγορασµοῖς·	 Be not a wine-bibber, neither continue long at feasts, and purchases of flesh:	 ⲙ̅ⲡⲣ̅ⲣ̅ⲣⲉϥϯϩⲉ ⲁⲩⲱ ⲙ̅ⲡⲣ̅ⲥⲟⲩⲧⲛ̅ ⲧⲟⲟⲧⲕ̅ ⲉⲃⲟⲗ ⲉϩⲉⲛⲥⲩⲙⲃⲟⲗⲏ ⲉϣⲉⲡⲁϥ.
Proverbs	23	21	 							 πᾶς γὰρ µέθυσος καὶ πορνοκόπος πτωχεύσει, καὶ ἐνδύσεται διερρηγµένα καὶ ῥακώδη πᾶς ὑπνώδης.	 for every drunkard and whoremonger shall be poor; and every sluggard shall clothe himself with tatters and ragged garments.	 ⲣⲉϥϯϩⲉ ⲅⲁⲣ ⲛⲓⲙ ϩⲓ ⲡⲟⲣⲛⲟⲕⲟⲡⲟⲥ ⲛⲁⲣ̅ϩⲏⲕⲉ ⲁⲩⲱ ⲥⲁⲩⲏⲣⲡ ⲛⲓⲙ ⲛⲁϯϩⲓⲱⲱϥ ⲛ̅ϩⲉⲛⲧⲟⲉⲓⲥ.
Proverbs	23	22	 							 ἄκουε, υἱέ, πατρὸς τοῦ γεννήσαντός σε καὶ µὴ καταφρόνει ὅτι γεγήρακέν σου ἡ µήτηρ.	 Hearken, my son, to thy father which begot thee, and despise not thy mother because she is grown old.	 ⲥⲱⲧⲙ̅ ⲡⲁϣⲏⲣⲉ ⲛ̅ⲥⲁ ⲡⲉⲕⲉⲓⲱⲧ ⲛ̅ⲧⲁϥϫⲡⲟⲕ ⲁⲩⲱ ⲙ̅ⲡⲣ̅ⲕⲁⲧⲁⲫⲣⲟⲛⲓ ϫⲉ ⲁ ⲧⲉⲕⲙⲁⲁⲩ ⲣ̅ϩⲗ̅ⲗⲱ.
Proverbs	23	23	 							 	 	 
Proverbs	23	24	 							 καλῶς ἐκτρέφει πατὴρ δίκαιος, ἐπὶ δὲ υἱῷ σοφῷ εὐφραίνεται ἡ ψυχὴ αὐτοῦ·	 A righteous father brings up his children well; and his soul rejoices over a wise son.	 ϣⲁⲣⲉ ⲟⲩⲉⲓⲱⲧ ⲛ̅ⲇⲓⲕⲁⲓⲟⲥ ⲥⲁⲁⲛϣ̅ ⲕⲁⲗⲱⲥ ϣⲁⲣⲉ ⲡⲉϥϩⲏⲧ ⲇⲉ ⲉⲩⲫⲣⲁⲛⲉ ⲉϫⲛ̅ ⲟⲩϣⲏⲣⲉ ⲛ̅ⲥⲁⲃⲉ.
Proverbs	23	25	 							 εὐφραινέσθω ὁ πατὴρ καὶ ἡ µήτηρ ἐπὶ σοί, καὶ χαιρέτω ἡ τεκοῦσά σε.	 Let thy father and thy mother rejoice over thee, and let her that bore thee be glad.	 ⲙⲁⲣⲉ ⲡⲉⲕⲉⲓⲱⲧ ⲙⲛ̅ ⲧⲉⲕⲙⲁⲁⲩ ⲉⲩⲫⲣⲁⲛⲉ ⲉϫⲱⲕ ⲛ̅ⲧⲉⲧⲉⲛ̅ⲧⲁⲥϫⲡⲟⲕ ⲣⲁϣⲉ.
Proverbs	23	26	 							 δός µοι, υἱέ, σὴν καρδίαν, οἱ δὲ σοὶ ὀφθαλµοὶ ἐµὰς ὁδοὺς τηρείτωσαν·	 My son, give me thine heart, and let thine eyes observe my ways.	 ⲡⲁϣⲏⲣⲉ ⲙⲁ ⲛⲁⲓ̈ ⲙ̅ⲡⲉⲕϩⲏⲧ ⲙⲁⲣⲉ ⲛⲉⲕⲃⲁⲗ ⲇⲉ ϩⲁⲣⲉϩ ⲉⲛⲁϩⲓⲟⲟⲩⲉ.
Proverbs	23	27	 							 πίθος γὰρ τετρηµένος ἐστὶν ἀλλότριος οἶκος, καὶ φρέαρ στενὸν ἀλλότριον·	 For a strange house is a vessel full of holes; and a strange well is narrow.	 ⲟⲩⲡⲓⲑⲟⲥ ⲅⲁⲣ ⲉϥϭⲟⲧϩ̅ ⲡⲉ ⲟⲩⲏⲓ̈ ⲉⲙⲡⲱⲕ ⲁⲛ ⲡⲉ ⲁⲩⲱ ⲟⲩϣⲱⲧⲉ ⲧⲉ ⲉⲥϭⲏⲩ ⲉⲥⲙⲟⲕϩ̅ ⲛⲉⲓ ⲉϩⲣⲁⲓ̈.
Proverbs	23	28	 							 οὗτος γὰρ συντόµως ἀπολεῖται, καὶ πᾶς παράνοµος ἀναλωθήσεται.	 For such a one shall perish suddenly; and every transgressor shall be cut off.	 ⲏⲇⲏ ⲅⲁⲣ ϥⲛⲁⲧⲁⲕⲟ ⲛ̅ⲧⲉⲩⲛⲟⲩ ⲁⲩⲱ ⲡⲁⲣⲁⲛⲟⲙⲟⲥ ⲛⲓⲙ ⲛⲁⲱϫⲛ̅.
Proverbs	23	29	 							 τίνι οὐαί; τίνι θόρυβος; τίνι κρίσις; τίνι ἀηδίαι καὶ λέσχαι; τίνι συντρίµµατα διὰ κενῆς; τίνος πέλιοι οἱ ὀφθαλµοί;	 Who has woe? who trouble? who has quarrels? and who vexations and disputes? who has bruises without a cause? whose eyes are livid?	 ⲉⲣⲉ ⲡⲟⲩⲟⲓ ⲛⲁϣⲱⲡⲉ ⲛ̅ⲛⲓⲙ ⲁⲩⲱ ⲡⲉϣⲧⲟⲣⲧⲣ̅ ⲛ̅ⲛⲓⲙ ⲙⲛ̅ ϫⲓϩⲁⲡ ⲛⲓⲙ ⲙⲛ̅ ⲛ̅ⲗⲉⲥⲭⲏ ⲉⲑⲟⲟⲩ ⲛ̅ⲛⲓⲙ ⲉⲣⲉ ⲛⲟⲩⲱϣϥ̅ ⲉⲡϫⲓⲛϫⲏ ϣⲟⲟⲡ ⲛ̅ⲛⲓⲙ ⲏ ⲛⲓⲙ ⲡⲉⲧⲉⲣⲉ ⲛⲉϥⲃⲁⲗ ⲟⲛ ⲉⲗⲉⲗⲕⲏⲙⲉ.
Proverbs	23	30	 							 οὐ τῶν ἐγχρονιζόντων ἐν οἴνοις; οὐ τῶν ἰχνευόντων ποῦ πότοι γίνονται;	 Are not those of them that stay long at wine? are not those of them that haunt the places where banquets are?	 ⲛ̅ⲛⲉⲧⲱⲥⲕ̅ ⲁⲛ ⲛⲉ ϩⲛ̅ ⲛ̅ⲏⲣⲡ̅ ⲛ̅ⲛⲉⲧϣⲓⲛⲉ ⲁⲛ ⲛⲉ ϫⲉ ⲉⲣⲉ ⲙ̅ⲙⲁⲛ̅ⲥⲱ ⲛⲁϣⲱⲡⲉ ⲧⲱⲛ.
Proverbs	23		 							 µὴ µεθύσκεσθε οἴνῳ, ἀλλὰ ὁµιλεῖτε ἀνθρώποις δικαίοις καὶ ὁµιλεῖτε ἐν περιπάτοις· ἐὰν γὰρ εἰς τὰς φιάλας καὶ τὰ ποτήρια δῷς τοὺς ὀφθαλµούς σου, ὕστερον περιπατήσεις γυµνότερος ὑπέρου,	Be not drunk with wine; but converse with just men, and converse with them openly. (31) For if thou shouldest set thine eyes on bowls and cups, thou shalt afterwards go more naked than a pestle.	 ⲙ̅ⲡⲣ̅ϯϩⲉ ⲛ̅ⲛ̅ⲏⲣⲡ̅ ⲁⲗⲗⲁ ϣⲁϫⲉ ⲙⲛ̅ ⲛ̅ⲣⲱⲙⲉ ⲛ̅ⲇⲓⲕⲁⲓⲟⲥ ⲁⲩⲱ ⲛ̅ⲧⲉⲧⲛ̅ϣⲁϫⲉ ⲙⲛ̅ ⲛⲉⲧⲙⲟⲟϣⲉ ⲉⲕϣⲁⲛϯ ⲛⲉⲕⲃⲁⲗ ⲅⲁⲣ ⲉⲛⲉⲫⲓⲁⲗⲏ ⲙⲛ̅ ⲛ̅ϫⲱ ⲙⲛ̅ⲛ̅ⲥⲱⲥ ⲕⲛⲁⲙⲟⲟϣⲉ ⲉⲕⲕⲏⲕⲁϩⲏⲩ ⲉϩⲟⲩⲉ ⲟⲩⲥⲁϩⲙⲉⲥ ⲛ̅ⲑⲁⲏ ⲇⲉ.
Proverbs	23	32	 							 τὸ δὲ ἔσχατον ὥσπερ ὑπὸ ὄφεως πεπληγὼς ἐκτείνεται καὶ ὥσπερ ὑπὸ κεράστου διαχεῖται αὐτῷ ὁ ἰός.	 But at last such a one stretches himself out as one smitten by a serpent, and venom is diffused through him as by a horned serpent.	 ⲕⲛⲁⲣ̅ⲑⲉ ⲙ̅ⲡⲉⲛⲧⲁϥⲙⲟⲩ ⲉⲁⲩϣⲟⲟϭⲉϥ ϩⲓⲧⲛ̅ ⲟⲩϩⲟϥ ⲉⲡϩⲁⲏ. ⲁⲩⲱ ⲛ̅ⲑⲉ ⲙ̅ⲡⲉⲛⲧⲁ ⲟⲩⲕⲉⲣⲁⲥⲧⲏⲥ ⲗⲟⲕⲥϥ̅ ⲉⲁⲧⲙⲁⲧⲟⲩ ϣⲱⲗ ⲉⲣⲟϥ.
Proverbs	23	33	 							 οἱ ὀφθαλµοί σου ὅταν ἴδωσιν ἀλλοτρίαν, τὸ στόµα σου τότε λαλήσει σκολιά,	 Whenever thine eyes shall behold a strange woman, then thy mouth shall speak perverse things.	 ⲉⲣϣⲁⲛ ⲛⲉⲕⲃⲁⲗ ⲛⲁⲩ ⲉⲛⲉⲧⲉⲛⲛⲟⲩⲕ ⲁⲛ ⲛⲉ ⲧⲉⲕⲧⲁⲡⲣⲟ ⲛⲁϫⲱ ⲛ̅ⲛⲉⲧϭⲟⲟⲙⲉ.
Proverbs	23	34	 							 καὶ κατακείσῃ ὥσπερ ἐν καρδίᾳ θαλάσσης καὶ ὥσπερ κυβερνήτης ἐν πολλῷ κλύδωνι·	 And thou shalt lie as in the midst of the sea, and as a pilot in a great storm.	 ⲕⲛⲁⲛⲟϫⲕ ⲛ̅ⲑⲉ ⲙ̅ⲡⲉⲧϩⲙ̅ ⲡϩⲏⲧ ⲛ̅ⲑⲁⲗⲁⲥⲥⲁ ⲁⲩⲱ ⲛ̅ⲑⲉ ⲛ̅ⲟⲩⲛⲉⲉⲃ ⲉϥϩⲛ̅ ⲟⲩⲛⲟϭ ⲛ̅ϩⲟⲉⲓⲙ.
