book	chapter	verse	Bohairic	Akhmimic	Fayyumic	OldBohairic	Mesokemic	DialectP	Lycopolitan	Greek	English	Sahidic
Proverbs	13	19	 ⲛⲓⲉⲡⲓⲑⲩⲙⲓⲁ ⲛ̀ⲧⲉ ⲛⲓⲉⲩⲥⲉⲃⲏⲥ ϣⲁⲩⲑⲣⲉ ⲟⲩⲯⲩⲭⲏ ⲟⲩⲛⲟϥ ⲛⲓϩⲃⲏⲟⲩⲓ ⲇⲉ ⲛ̀ⲧⲉ ⲛⲓⲁⲥⲉⲃⲏⲥ ⲥⲉⲟⲩⲏⲟⲩ ⲙ̀ⲡⲉⲙⲓ							 ἐπιθυµίαι εὐσεβῶν ἡδύνουσιν ψυχήν, ἔργα δὲ ἀσεβῶν µακρὰν ἀπὸ γνώσεως.	 The desires of the godly gladden the soul, but the works of the ungodly are far from knowledge.	 ϣⲁⲣⲉ ⲛ̅ⲉⲡⲓⲑⲩⲙⲓⲁ ⲛ̅ⲛ̅ⲣ̅ⲙⲛ̅ⲛⲟⲩⲧⲉ ϯⲟⲩⲛⲟϥ ⲛ̅ⲛⲉⲩⲯⲩⲭⲏ ⲛ̅ⲉⲡⲓⲑⲩⲙⲓⲁ ⲇⲉ ⲛ̅ⲛ̅ⲁⲥⲉⲃⲏⲥ ⲟⲩⲏⲩ ⲉⲃⲟⲗ ⲙ̅ⲡⲥⲟⲟⲩⲛ ⲛ̅ϫⲱϩⲙ̅ ⲛ̅ⲛ̅ⲁⲥⲉⲃⲏⲥ ⲟⲩⲏⲩ ⲉⲃⲟⲗ ⲛ̅ⲧⲁⲓⲥⲑⲏⲥⲓⲥ ⲛ̅ⲁⲥⲉⲃⲏⲥ ⲇⲉ ⲛⲁⲥⲁϩⲱⲟⲩ ⲉⲃⲟⲗ ⲛ̅ⲣⲙ̅ⲛ̅ⲟⲩⲧⲉ
Proverbs	13	20	 ⲫⲏ ⲉⲧⲙⲟϣⲓ ⲛⲉⲙ ϩⲁⲛⲥⲁⲃⲉⲩ ϣⲁϥϣⲱⲡⲓ ⲉϥⲟⲓ ⲛ̀ⲥⲁⲃⲉ ⲫⲏ ⲇⲉ ⲉⲧⲙⲟϣⲓ ⲛⲉⲙ ϩⲁⲛⲁⲧϩⲏⲧ ⲉϥⲉ̀ⲟⲩⲱⲛϩ ⲉ̀ⲃⲟⲗ							 ὁ συµπορευόµενος σοφοῖς σοφὸς ἔσται, ὁ δὲ συµπορευόµενος ἄφροσι γνωσθήσεται.	 If thou walkest with wise men thou shalt be wise: but he that walks with fools shall be known.	 ⲉⲕϣⲁⲛⲙⲟⲟϣⲉ ⲙⲛ̅ ϩⲉⲛⲥⲟⲫⲟⲥ ⲕⲛⲁⲣ̅ⲥⲟⲫⲟⲥ ⲡⲉⲧⲙⲟⲟϣⲉ ⲇⲉ ⲙⲛ̅ ϩⲉⲛⲁⲑⲏⲧ ϥⲛⲁⲟⲩⲱⲛϩ̅ ⲉⲃⲟⲗ ⲛ̅ⲇⲓⲕⲁⲓⲟⲥ ⲛⲁϣⲱⲡⲉ ϩⲛ̅ ⲟⲩⲉⲓⲣⲏⲛⲏ.
Proverbs	13	21	 ⲛⲏ ⲉⲧⲉⲣⲛⲟⲃⲓ ⲥⲉⲛⲁⲧⲁϩⲱⲟⲩ ⲛ̀ϫⲉ ϩⲁⲛⲡⲉⲧϩⲱⲟⲩ ⲛⲓⲑⲙⲏⲓ ⲇⲉ ⲥⲉⲛⲁⲧⲁϩⲱⲟⲩ ⲛ̀ϫⲉ ϩⲁⲛⲁⲅⲁⲑⲟⲛ							 ἁµαρτάνοντας καταδιώξεται κακά, τοὺς δὲ δικαίους καταλήµψεται ἀγαθά.	 Evil shall pursue sinners; but good shall overtake the righteous.	 ⲙ̅ⲡⲉⲑⲟⲟⲩ ⲛⲁⲡⲱⲧ ⲛ̅ⲥⲁ ⲛ̅ⲣⲉϥⲣ̅ⲛⲟⲃⲉ ⲛ̅ⲁⲅⲁⲑⲟⲛ ⲇⲉ ⲛⲁⲧⲁϩⲉ ⲛ̅ⲇⲓⲕⲁⲓⲟⲥ.
Proverbs	13	22	 ⲟⲩⲁⲅⲁⲑⲟⲥ ⲛ̀ⲣⲱⲙⲓ ϣⲁϥⲉⲣⲕⲗⲏⲣⲟⲛⲟⲙⲓⲛ ⲛ̀ⲛⲓϣⲏⲣⲓ ⲛ̀ⲧⲉ ⲛⲉϥϣⲏⲣⲓ ϯⲙⲉⲧⲣⲁⲙⲁⲟ ⲛ̀ⲧⲉ ⲛⲓⲁⲥⲉⲃⲏⲥ ⲥⲉϩⲓⲟⲩⲓ ⲙ̀ⲙⲟⲥ ⲉ̀ϧⲟⲩⲛ ⲛ̀ⲛⲓⲑⲙⲏⲓ							 ἀγαθὸς ἀνὴρ κληρονοµήσει υἱοὺς υἱῶν, θησαυρίζεται δὲ δικαίοις πλοῦτος ἀσεβὼν.	 A good man shall inherit children’s children; and the wealth of ungodly men is laid up for the just.	 ⲡⲣⲱⲙⲉ ⲛ̅ⲇⲓⲕⲁⲓⲟⲥ ⲛⲁⲡⲱϣ ⲉϫⲛ̅ ⲛ̅ϣⲏⲣⲉ ⲛ̅ⲛ̅ⲉϥϣⲏⲣⲉ ⲉⲩⲥⲱⲟⲩϩ ⲇⲉ ⲉϩⲟⲩⲛ ⲛ̅ⲧⲙⲛ̅ⲧⲣⲙ̅ⲙⲁⲟ ⲛ̅ⲛ̅ⲁⲥⲉⲃⲏⲥ ⲛ̅ⲛ̅ⲇⲓⲕⲁⲓⲟⲥ.
Proverbs	13	23	 ϩⲁⲛⲑⲙⲏⲓ ⲉⲩⲉ̀ⲉⲣⲟⲩⲙⲏϣ ⲛ̀ⲣⲟⲙⲡⲓ ϧⲉⲛ ⲟⲩⲙⲉⲧⲣⲁⲙⲁⲟ ⲛⲓⲣⲉϥϭⲓⲛ̀ϫⲟⲛⲥ ⲇⲉ ⲉⲩⲉ̀ⲧⲁⲕⲟ ϧⲉⲛ ⲟⲩⲱϣⲧ ⲉ̀ⲃⲟⲗ							 δίκαιοι ποιήσουσιν ἐν πλούτῳ ἔτη πολλά, ἄδικοι δὲ ἀπολοῦνται συντόµως.	 The righteous shall spend many years in wealth: but the unrighteous shall perish suddenly.	 ⲛ̅ϫⲱⲱⲣⲉ ⲛⲁⲙ̅ⲧⲟⲛ ⲙ̅ⲙⲟⲟⲩ ⲛ̅ϩⲁϩ ⲛ̅ⲣⲟⲙⲡⲉ ϩⲛ̅ ⲟⲩⲙⲛ̅ⲧⲣⲙ̅ⲙⲁⲟ ⲁ ϩⲟⲓⲛⲉ ⲇⲉ ⲧⲁⲕⲟ ⲛ̅ⲧⲉⲩⲛⲟⲩ.
Proverbs	13	24	 ⲫⲏ ⲉⲧϯⲁⲥⲟ ⲉ̀ⲡⲉϥϣⲃⲱⲧ ⲁϥⲙⲟⲥϯ ⲙ̀ⲡⲉϥϣⲏⲣⲓ ⲫⲏ ⲉⲧⲙⲉⲓ ⲙ̀ⲡⲉϥϣⲏⲣⲓ ϣⲁϥϯⲥⲃⲱ ⲛⲁϥ ϧⲉⲛ ⲟⲩⲭⲣⲟϥ ⲛ̀ϩⲏⲧ							 ὃς φείδεται τῆς βακτηρίας, µισεῖ τὸν υἱὸν αὐτοῦ· ὁ δὲ ἀγαπῶν ἐπιµελῶς παιδεύει.	 He that spares the rod hates his son: but he that loves, carefully chastens him.	 ⲡⲉⲧϯⲥⲟ ⲉⲡⲉϥϭⲉⲣⲱⲃ ⲉϥⲙⲟⲥⲧⲉ ⲙ̅ⲡⲉϥϣⲏⲣⲉ ⲡⲉⲧⲙⲉ ⲇⲉ ⲙ̅ⲡⲱϥ ϥⲛⲁϯⲥⲃⲱ ⲛⲁϥ ⲉⲙⲁⲧⲉ.
Proverbs	13	25	 ⲟⲩⲑⲙⲏⲓ ⲉϥⲟⲩⲱⲙ ϣⲁϥⲧⲥⲱ ⲛ̀ⲧⲉϥⲯⲩⲭⲏ ⲛⲓⲯⲩⲭⲏ ⲇⲉ ⲛ̀ⲧⲉ ⲛⲓⲁⲥⲉⲃⲏⲥ ϣⲁⲩⲉⲣϧⲁⲉ							 δίκαιος ἔσθων ἐµπιπλᾷ τὴν ψυχὴν αὐτοῦ, ψυχαὶ δὲ ἀσεβῶν ἐνδεεῖς.	 A just man eats and satisfies his soul: but the souls of the ungodly are in want.	 ⲉⲣⲉ ⲡⲇⲓⲕⲁⲓⲟⲥ ⲟⲩⲱⲙ ϣⲁϥⲧⲥⲓⲟ ⲛ̅ⲧⲉϥⲯⲩⲭⲏ ⲛⲉⲯⲩⲭⲏ ⲇⲉ ⲛ̅ⲛ̅ⲁⲥⲉⲃⲏⲥ ⲛⲁⲣ̅ϭⲣⲱϩ.
Proverbs	14	1	 ϩⲁⲛⲥⲁⲃⲏ ⲛ̀ϩⲓⲟⲙⲓ ϣⲁⲩⲕⲱⲧ ⲛ̀ϩⲁⲛⲏⲓ ϯⲁⲧϩⲏⲧ ⲇⲉ ⲁⲥⲟⲩⲟϫⲡⲟⲩ ϧⲉⲛ ⲡⲉⲥϫⲓϫ							 σοφαὶ γυναῖκες ᾠκοδόµησαν οἴκους, ἡ δὲ ἄφρων κατέσκαψεν ταῖς χερσὶν αὐτῆς.	 Wise women build houses: but a foolish one digs hers down with her hands.	 ϣⲁⲣⲉ ⲛ̅ⲥⲁⲃⲉ ⲛ̅ⲥϩⲓⲙⲉ ⲕⲉⲧ ϩⲉⲛⲏⲓ̈ ⲧⲉⲧⲛⲁⲣ̅ⲁⲑⲏⲧ ⲇⲉ ⲛⲁϣⲣ̅ϣⲱⲣϥ̅ ϩⲛ̅ ⲛⲉⲥϭⲓϫ.
Proverbs	14	2	 ⲫⲏ ⲉⲧⲙⲟϣⲓ ϧⲉⲛ ⲟⲩⲥⲱⲟⲩⲧⲉⲛ ⲁϥⲉⲣϩⲟϯ ϧⲁⲧϩⲏ ⲙ̀ⲡϭ̅ⲥ̅ ⲫⲏ ⲇⲉ ⲉⲧⲕⲟⲗϫ ϩⲓ ⲛⲉϥⲙⲱⲓⲧ ⲉϥⲉ̀ϭⲓϣⲱϣ							 ὁ πορευόµενος ὀρθῶς φοβεῖται τὸν κύριον, ὁ δὲ σκολιάζων ταῖς ὁδοῖς αὐτοῦ ἀτιµασθήσεται.	 He that walks uprightly fears the Lord; but he that is perverse in his ways shall be dishonoured.	 ⲡⲉⲧⲙⲟⲟϣⲉ ϩⲛ̅ ⲟⲩⲥⲟⲟⲩⲧⲛ̅ ⲣ̅ϩⲟⲧⲉ ϩⲏⲧϥ̅ ⲙ̅ⲡⲛⲟⲩⲧⲉ ⲡⲉⲧϭⲱⲟⲩϭ ⲇⲉ ⲛ̅ⲛⲉϥϩⲓⲟⲟⲩⲉ ⲛⲁϫⲓⲥⲱϣ.
Proverbs	14	3	 ⲟⲩϣⲃⲱⲧ ⲛ̀ⲧⲉ ⲡϣⲱϣ ⲉⲧⲛⲏⲟⲩ ⲉ̀ⲃⲟⲗ ϧⲉⲛ ⲣⲱⲟⲩ ⲛ̀ⲛⲓⲁⲧϩⲏⲧ ⲛⲓⲥⲫⲟⲧⲟⲩ ⲛ̀ⲧⲉ ⲛⲓⲥⲁⲃⲉⲩ ⲉⲩⲁⲣⲉϩ ⲉ̀ⲣⲱⲟⲩ							 ἐκ στόµατος ἀφρόνων βακτηρία ὕβρεως, χείλη δὲ σοφῶν φυλάσσει αὐτούς.	 Out of the mouth of fools comes a rod of pride; but the lips of the wise preserve them.	 ⲟⲩϭⲉⲣⲱⲃ ⲛ̅ⲥⲱϣ ⲡⲉⲧϩⲛ̅ ⲧⲧⲁⲡⲣⲟ ⲛ̅ⲛ̅ⲁⲑⲏⲧ ⲛⲉⲥⲡⲟⲧⲟⲩ ⲇⲉ ⲛ̅ⲛ̅ⲥⲟⲫⲟⲥ ⲛⲁϩⲁⲣⲉϩ ⲉⲣⲟⲟⲩ.
Proverbs	14	4	 ⲫⲙⲁ ⲉⲧⲉⲙ̀ⲙⲟⲛ ⲉϩⲉ ⲙ̀ⲙⲟϥ ⲛⲓⲟⲩⲟⲛϩϥ ⲥⲉⲧⲟⲩⲃⲏⲟⲩⲧ ⲫⲙⲁ ⲇⲉ ⲉⲧⲉ ⲟⲩⲟⲛ ⲟⲩⲙⲏϣ ⲛ̀ⲟⲩⲧⲁϩ ⲙ̀ⲙⲟϥ ⲥⲉⲟⲩⲟⲛϩ ⲉ̀ⲃⲟⲗ ⲛ̀ϫⲉ ⲧϫⲟⲙ ⲛ̀ϯⲉϩⲉⲥ							 οὗ µή εἰσιν βόες, φάτναι καθαραί· οὗ δὲ πολλὰ γενήµατα, φανερὰ βοὸς ἰσχύς.	 Where no oxen are, the cribs are clean; but where there is abundant produce, the strength of the ox is apparent.	 ⲛⲟⲩⲟⲙϥ ϣⲟⲩⲉⲓⲧ ϩⲙ̅ ⲡⲙⲁ ⲉⲧⲉⲙⲛ̅ⲉϩⲉ ⲛ̅ϩⲏⲧϥ ⲧϭⲟⲙ ⲛ̅ⲧⲉϩⲉ ⲟⲩⲟⲛϩ̅ ⲉⲃⲟⲗ ϩⲙ̅ ⲡⲙⲁ ⲉⲧⲉ ⲟⲩⲛ̅ ϩⲁϩ ⲛ̅ϩⲏⲧϥ̅ ⲛ̅ⲅⲉⲛⲏⲙⲁ.
Proverbs	14	5	 ⲟⲩⲙⲉⲑⲣⲉ ⲉϥⲉⲛϩⲟⲧ ⲙ̀ⲡⲁϥϫⲉⲙⲉⲑⲛⲟⲩϫ ϣⲁϥϩⲓⲥⲁϩϯ ϫⲉ ϧⲉⲛ ⲟⲩⲙⲉⲑⲛⲟⲩϫ ⲛ̀ϫⲉ ⲟⲩⲙⲉⲑⲣⲉ ⲛ̀ⲟϫⲓ							 µάρτυς πιστὸς οὐ ψεύδεται, ἐκκαίει δὲ ψεύδη µάρτυς ἄδικος.	 A faithful witness does not lie; but an unjust witness kindles falsehoods.	 ⲙⲛ̅ ⲟⲩⲙⲛ̅ⲧⲣⲉ ⲙ̅ⲡⲓⲥⲧⲟⲥ ⲛⲁϫⲓϭⲟⲗ ϣⲁⲣⲉ ⲟⲩⲙⲛ̅ⲧⲣⲉ ⲇⲉ ⲛ̅ϫⲓⲛ̅ϭⲟⲛⲥ̅ ⲧⲙ̅ϩⲉ ϩⲉⲛϭⲟⲗ.
Proverbs	14	6	 ⲉⲕⲉ̀ⲕⲱϯ ⲛ̀ⲥⲁ ϯⲥⲟⲫⲓⲁ ⲛ̀ⲧⲟⲧⲟⲩ ⲛ̀ⲛⲓⲥⲁⲙⲡⲉⲧϩⲱⲟⲩ ⲟⲩⲟϩ ⲛ̀ⲛⲉⲕϫⲉⲙⲥ ϯⲉⲥⲑⲉⲥⲓⲥ ⲇⲉ ⲉⲥⲙⲟⲧⲉⲛ ⲛ̀ⲛⲓⲥⲁⲃⲉⲩ							 ζητήσεις σοφίαν παρὰ κακοῖς καὶ οὐχ εὑρήσεις, αἴσθησις δὲ παρὰ φρονίµοις εὐχερής.	 Thou shalt seek wisdom with bad men, and shalt not find it; but discretion is easily available with the prudent.	 ⲕⲛⲁϣⲓⲛⲉ ⲛ̅ⲥⲁ ⲧⲥⲟⲫⲓⲁ ⲛ̅ⲧⲛ̅ ⲛⲉⲧⲑⲟⲟⲩ ⲛⲅ̅ⲧⲙ̅ϭⲛ̅ⲧⲥ ⲧⲁⲓⲥⲑⲏⲥⲓⲥ ⲇⲉ ⲥⲃ̅ⲧⲱⲧ ⲛ̅ⲧⲟⲟⲧⲟⲩ ⲛ̅ⲛ̅ⲥⲁⲃⲉ.
Proverbs	14	7	 ϩⲱⲃ ⲇⲉ ⲛⲓⲃⲉⲛ ϩⲁⲛϫⲁϫⲓ ⲛⲉⲙ ⲟⲩⲣⲱⲙⲓ ⲛ̀ⲁⲧϩⲏⲧ ϩⲁⲛϩⲟⲡⲗⲟⲛ ⲇⲉ ⲛ̀ⲧⲉ ⲡⲕⲁϯ ⲛⲉⲙ ⲛⲓⲥⲫⲟⲧⲟⲩ ⲛ̀ⲧⲉ ⲛⲓⲥⲁⲃⲉ							 πάντα ἐναντία ἀνδρὶ ἄφρονι, ὅπλα δὲ αἰσθήσεως χείλη σοφά.	 All things are adverse to a foolish man; but wise lips are the weapons of discretion.	 ϩⲱⲃ ⲛⲓⲙ ϯⲟⲩⲃⲉ ⲡⲣⲱⲙⲉ ⲛ̅ⲁⲑⲏⲧ ϩⲉⲛϩⲟⲡⲗⲟⲛ ⲇⲉ ⲛⲁⲓⲥⲑⲏⲥⲓⲥ ⲛⲉ ⲛⲉⲥⲡⲟⲧⲟⲩ ⲛ̅ⲛ̅ⲥⲁⲃⲉ.
Proverbs	14	8	 ⲧⲉⲥⲃⲱ ⲛ̀ⲧⲉ ⲛⲓⲥⲁⲃⲉⲩ ϣⲁⲥⲥⲟⲩⲧⲱⲛ ⲛ̀ⲟⲩⲙⲱⲓⲧ ϯⲙⲉⲧⲁⲧⲕⲁϯ ⲇⲉ ⲛ̀ⲧⲉ ⲛⲓⲁⲧϩⲏⲧ ⲁⲥϧⲉⲛ ⲟⲩⲡⲗⲁⲛⲏ							 σοφία πανούργων ἐπιγνώσεται τὰς ὁδοὺς αὐτῶν, ἄνοια δὲ ἀφρόνων ἐν πλάνῃ.	 The wisdom of the prudent will understand their ways; but the folly of fools leads astray.	 ⲧⲥⲟⲫⲓⲁ ⲛ̅ⲛ̅ⲣⲙ̅ⲛ̅ϩⲏⲧ ⲛⲁⲉⲓⲙⲉ ⲉⲛⲉⲩϩⲓⲟⲟⲩⲉ ⲧⲙⲛ̅ⲧⲁⲑⲏⲧ ⲇⲉ ⲛ̅ⲛ̅ⲁⲧⲥⲃⲱ ϩⲛ̅ ⲟⲩⲡⲗⲁⲧⲓⲁ.
Proverbs	14	9	 ⲛⲓⲏⲓ ⲛ̀ⲧⲉ ⲛⲓⲡⲁⲣⲁⲛⲟⲙⲟⲥ ⲉϥⲉ̀ϣⲱⲡⲓ ⲉ̀ⲣⲱⲟⲩ ⲛ̀ϫⲉ ⲡⲓⲧⲟⲩⲃⲟ ⲛⲓⲏⲓ ⲛ̀ⲧⲉ ⲛⲓⲑⲙⲏⲓ ⲥⲉϣⲏⲡ							 οἰκίαι παρανόµων ὀφειλήσουσιν καθαρισµόν, οἰκίαι δὲ δικαίων δεκταί.	 The houses of transgressors will need purification; but the houses of the just are acceptable.	 ⲛ̅ⲏⲓ̈ ⲛ̅ⲙ̅ⲡⲁⲣⲁⲛⲟⲙⲟⲥ ⲙ̅ⲡϣⲁ ⲛ̅ⲟⲩⲧⲃ̅ⲃⲟ ⲛⲏⲓ̈ ⲇⲉ ⲛ̅ⲛ̅ⲇⲓⲕⲁⲓⲟⲥ ⲥⲟⲧⲡ̅.
Proverbs	14	10	 ⲟⲩϩⲏⲧ ⲛ̀ⲣⲉϥⲕⲁϯ ⲛ̀ⲧⲉ ⲟⲩⲣⲱⲙⲓ ⲧⲉϥⲯⲩⲭⲏ ϧⲉⲛ ⲡⲉⲙⲕⲁϩ ⲛ̀ϩⲏⲧ ⲉ̀ϣⲱⲡ ⲇⲉ ⲉϥⲟⲩⲛⲟϥ ⲙ̀ⲡⲁϥⲙⲟⲩϫⲧ ⲛⲉⲙ ⲡϣⲱϣ							 καρδία ἀνδρὸς αἰσθητική, λυπηρὰ ψυχὴ αὐτοῦ· ὅταν δὲ εὐφραίνηται, οὐκ ἐπιµείγνυται ὕβρει.	 If a man’s mind is intelligent, his soul is sorrowful; and when he rejoices, he has no fellowship with pride.	 ⲡϩⲏⲧ ⲛ̅ⲟⲩⲣⲱⲙⲉ ⲛ̅ⲣⲉϥⲁⲓⲥⲑⲁⲛⲉ ⲟⲩⲗⲩⲡⲏ ⲡⲉ ⲛ̅ⲧⲉϥⲯⲩⲭⲏ ϩⲟⲧⲁⲛ ⲇⲉ ⲉϥϣⲁⲛⲉⲩⲫⲣⲁⲛⲉ ⲙⲉⲣⲉ ⲧⲗⲩⲡⲏ ⲧⲱϩ ⲛⲙ̅ⲙⲁϥ.
Proverbs	14	11	 ⲛⲓⲏⲓ ⲛ̀ⲧⲉ ⲛⲓⲁⲥⲉⲃⲏⲥ ⲥⲉⲛⲁⲧⲁⲕⲟ ⲛⲓⲥⲕⲩⲛⲏ ⲇⲉ ⲛ̀ⲧⲉ ⲛⲏ ⲉⲧⲥⲟⲩⲧⲱⲛ ⲥⲉⲛⲁⲥⲉⲙⲛⲓ							 οἰκίαι ἀσεβῶν ἀφανισθήσονται, σκηναὶ δὲ κατορθούντων στήσονται.	 The houses of ungodly men shall be utterly destroyed; but the tabernacles of them that walk uprightly shall stand.	 ⲛ̅ⲏⲓ̈ ⲛ̅ⲛ̅ⲁⲥⲉⲃⲏⲥ ⲛⲁⲧⲁⲕⲟ ⲛⲉⲥⲕⲏⲡⲏ ⲇⲉ ⲛ̅ⲛ̅ⲇⲓⲕⲁⲓⲟⲥ ⲛⲁⲁϩⲉⲣⲁⲧⲟⲩ.
Proverbs	14	12	 ⲟⲩⲟⲛ ⲟⲩⲙⲱⲓⲧ ⲉⲣⲉ ⲛⲓⲣⲱⲙⲓ ⲙⲉⲩⲓ ⲉ̀ⲣⲟϥ ϫⲉ ϥⲥⲟⲩⲧⲱⲛ ⲧⲉϥϧⲁⲉ̀ ⲇⲉ ⲉⲥϩⲛⲏⲟⲩ ⲉ̀ϩⲣⲏⲓ ⲉ̀ⲧϧⲁⲏ̀ ⲛ̀ⲁⲙⲉⲛϯ							 ἔστιν ὁδὸς ἣ δοκεῖ ὀρθὴ εἶναι παρὰ ἀνθρώποις, τὰ δὲ τελευταῖα αὐτῆς ἔρχεται εἰς πυθµένα ᾅδου.	 There is a way which seems to be right with men, but the ends of it reach to the depths of hell.	 ⲟⲩⲛ ⲟⲩϩⲓⲏ ⲉⲣⲉ ⲡⲣⲱⲙⲉ ⲙⲉⲉⲩⲉ ⲉⲣⲟⲥ ϫⲉ ⲉⲥⲥⲟⲩⲧⲱⲛ ⲉⲣⲉ ⲧⲉⲥϩⲁⲏ ⲇⲉ ⲡⲏϩ ⲉⲡϣⲓⲕ ⲛ̅ⲁⲙⲛ̅ⲧⲉ.
Proverbs	14	13	 ϧⲉⲛ ⲛⲓⲟⲩⲛⲟϥ ⲙ̀ⲡⲁϥⲙⲟⲩϫⲧ ⲛ̀ϫⲉ ⲡⲓⲕⲁϯ ⲛ̀ϩⲏⲧ ⲡⲓⲣⲁϣⲓ ⲇⲉ ⲛ̀ϧⲁⲉ̀ ϣⲁϥⲓ̀ ⲉ̀ⲡϧⲏⲓⲃⲓ							 ἐν εὐφροσύναις οὐ προσµείγνυται λύπη, τελευταία δὲ χαρὰ εἰς πένθος ἔρχεται.	 Grief mingles not with mirth; and joy in the end comes to grief.	 ⲙⲉⲣⲉ ⲧⲗⲩⲡⲏ ⲧⲱϩ ⲙⲛ̅ ⲡⲟⲩⲛⲟϥ ϣⲁⲣⲉ ⲑⲁⲏ ⲇⲉ ⲙ̅ⲡⲣ̅ⲁϣⲉ ⲉⲓ ⲉⲡϩⲏⲃⲉ.
Proverbs	14	14	 ϥⲛⲁⲙⲁϩⲏⲧϥ ⲛ̀ⲛⲉϥⲙⲱⲓⲧ ⲛ̀ϫⲉ ⲡⲓⲛⲁϣⲧ ϩⲏⲧ ⲟⲩⲣⲱⲙⲓ ⲇⲉ ⲉ̀ⲛⲁⲅⲁⲑⲟⲥ ϥⲛⲁⲟⲓ ⲛ̀ⲛⲉϥⲙⲉⲩⲓ							 τῶν ἑαυτοῦ ὁδῶν πλησθήσεται θρασυκάρδιος, ἀπὸ δὲ τῶν διανοηµάτων αὐτοῦ ἀνὴρ ἀγαθός.	 A stout-hearted man shall be filled with his own ways; and a good man with his own thoughts.	 ⲡⲛⲁϣⲧ̅ ϩⲏⲧ ⲛⲁⲥⲉⲓ ⲛ̅ⲛⲉϥϩⲓⲟⲟⲩⲉ ⲙⲁⲩⲁⲁϥ. ⲡⲣⲱⲙⲉ ⲇⲉ ⲉⲧⲟⲩⲁⲁⲃ ⲉⲃⲟⲗ ϩⲛ̅ ⲛⲉϥⲙⲉⲉⲩⲉ.
Proverbs	14	15	 ⲡⲓⲁⲧⲡⲉⲧϩⲱⲟⲩ ϣⲁϥⲧⲉⲛϩⲉⲧ ⲥⲁϫⲓ ⲛⲓⲃⲉⲛ ⲡⲓⲡⲁⲛⲟⲩⲣⲅⲟⲥ ⲇⲉ ϣⲁϥⲓ̀ ⲉ̀ⲟⲩⲱⲙ ⲛϩⲏⲧ							 ἄκακος πιστεύει παντὶ λόγῳ, πανοῦργος δὲ ἔρχεται εἰς µετάνοιαν.	 The simple believes every word: but the prudent man betakes himself to after-thought.	 ϣⲁⲣⲉ ⲡⲃⲁⲗϩⲏⲧ ⲧⲁⲛϩⲉ ⲧϣⲁϫⲉ ⲛⲓⲙ ϣⲁⲣⲉ ⲛ̅ⲥⲁⲃⲉ ⲇⲉ ⲣ̅ϩⲧⲏϥ.
Proverbs	14	16	 ⲡⲓⲥⲁⲃⲉ ⲇⲉ ⲉⲧⲁϥⲉⲣϩⲟϯ ⲁϥⲣⲓⲕⲓ ⲥⲁⲃⲟⲗ ⲙ̀ⲡⲓⲡⲉⲧϩⲱⲟⲩ ⲡⲓⲁⲧϩⲏⲧ ⲇⲉ ⲉⲣⲉ̀ϩⲑⲏϥ ⲭⲏ ⲉ̀ⲣⲟϥ ⲙ̀ⲙⲁⲩⲁⲧϥ ϣⲁϥⲙⲟⲩϫⲧ ⲛⲉⲙ ⲛⲓⲁⲛⲟⲙⲟⲥ							 σοφὸς φοβηθεὶς ἐξέκλινεν ἀπὸ κακοῦ, ὁ δὲ ἄφρων ἑαυτῷ πεποιθὼς µείγνυται ἀνόµῳ.	 A wise man fears, and departs from evil; but the fool trusts in himself, and joins himself with the transgressor.	 ⲉⲣϣⲁⲛ ⲡⲥⲟⲫⲟⲥ ⲣ̅ϩⲟⲧⲉ ϣⲁϥⲣⲁⲕⲧϥ̅ ⲉⲃⲟⲗ ⲙ̅ⲡⲉⲑⲟⲟⲩ ϣⲁⲣⲉ ⲡⲁⲑⲏⲧ ⲇⲉ ⲧⲱϩ ⲛⲙ̅ⲙⲁϥ ϩⲛ̅ ⲟⲩⲧⲁϫⲣⲟ.
Proverbs	14	17	 ⲡⲓⲣⲉϥϫⲱⲛⲧ ⲛ̀ⲭⲱⲗⲉⲙ ⲁϥⲉⲣϩⲱⲃ ϧⲉⲛ ⲟⲩⲙⲉⲧⲁⲧⲥⲟϭⲛⲓ ⲟⲩⲣⲱⲙⲓ ⲇⲉ ⲛ̀ⲥⲁⲃⲉ ϣⲁϥϥⲁⲓ ϧⲁ ⲟⲩⲙⲏϣ ⲛ̀ϩⲱⲃ							 ὀξύθυµος πράσσει µετὰ ἀβουλίας, ἀνὴρ δὲ φρόνιµος πολλὰ ὑποφέρει.	 A passionate man acts inconsiderately; but a sensible man bears up under many things.	 ϣⲁⲣⲉ ⲡⲉⲧϭⲉⲡⲏ ⲉϭⲱⲛⲧ̅ ⲉⲓⲣⲉ ⲛ̅ⲟⲩⲙⲛ̅ⲧⲁⲧϣⲟϫⲛⲉ ϣⲁⲣⲉ ⲟⲩⲣⲱⲙⲉ ⲇⲉ ⲛ̅ⲥⲟⲫⲟⲥ ϥⲓ ⲉⲣⲟϥ ⲉⲙⲁⲧⲉ.
Proverbs	14	18	 ⲉⲩⲉ̀ⲫⲱϣ ⲛ̀ϯⲕⲁⲕⲓⲁ ⲉ̀ϩⲣⲁⲩ ⲛ̀ϫⲉ ⲛⲓⲁⲧϩⲏⲧ ⲛⲓⲥⲁⲃⲉⲩ ⲇⲉ ⲉⲩⲉ̀ⲁⲙⲟⲛⲓ ⲙ̀ⲡⲓⲕⲁϯ							 µεριοῦνται ἄφρονες κακίαν, οἱ δὲ πανοῦργοι κρατήσουσιν αἰσθήσεως.	 Fools shall have mischief for their portion; but the prudent shall take fast hold of understanding.	 ⲛ̅ⲁⲑⲏⲧ ⲛⲁⲡⲱϣ ⲉϫⲱⲟⲩ ⲛ̅ⲧⲕⲁⲕⲓⲁ ϣⲁⲣⲉ ⲛ̅ⲥⲁⲃⲉ ⲇⲉ ⲁⲙⲁϩⲧⲉ ⲛ̅ⲟⲩⲁⲓⲥⲑⲏⲥⲓⲥ.
Proverbs	14	19	 ⲉⲩⲉ̀ⲥⲗⲁϯ ⲛ̀ϫⲉ ⲛⲓⲥⲁⲙⲡⲉⲧϩⲱⲟⲩ ⲙ̀ⲡⲉⲙ̀ⲑⲟ ⲛ̀ⲛⲓⲁⲅⲁⲑⲟⲥ ⲟⲩⲟϩ ⲛⲓⲁⲥⲉⲃⲏⲥ ⲉⲩⲉ̀ϣⲉⲙϣⲓ ⲛⲁϩⲣⲉⲛ ⲫⲣⲟ ⲛ̀ⲛⲓⲑⲙⲏⲓ							 ὀλισθήσουσιν κακοὶ ἔναντι ἀγαθῶν, καὶ ἀσεβεῖς θεραπεύσουσιν θύρας δικαίων.	 Evil men shall fall before the good; and the ungodly shall attend at the gates of the righteous.	 ⲛⲉⲑⲟⲟⲩ ⲛⲁϩⲉ ⲙ̅ⲡⲉⲙ̅ⲧⲟ ⲉⲃⲟⲗ ⲛ̅ⲛⲉⲧⲛⲁⲛⲟⲩⲟⲩ ⲁⲩⲱ ⲛ̅ⲁⲥⲉⲃⲏⲥ ⲛⲁϣⲙ̅ϣⲉ ϩⲓⲣⲛ̅ ⲛ̅ⲣⲟ ⲛ̅ⲛ̅ⲇⲓⲕⲁⲓⲟⲥ
Proverbs	14	20	 ϩⲁⲛϣⲫⲏⲣ ⲉⲩⲉ̀ⲙⲉⲥⲧⲉ ϩⲁⲛϣⲫⲏⲣ ⲛ̀ϩⲏⲕⲓ ⲥⲉⲟϣ ⲇⲉ ⲛ̀ϫⲉ ⲛⲓϣⲫⲏⲣ ⲛ̀ⲧⲉ ⲛⲓⲣⲁⲙⲁⲟ							 φίλοι µισήσουσιν φίλους πτωχούς, φίλοι δὲ πλουσίων πολλοί.	 Friends will hate poor friends; but the friends of the rich are many.	 ϣⲁⲣⲉ ϩⲉⲛϣⲃⲏⲣ ⲙⲉⲥⲧⲉ ⲛⲉⲩϣⲃⲏⲣ ⲛ̅ϩⲏⲕⲉ ⲛⲁϣⲉ ⲛⲉϣⲃⲉⲉⲣ ⲇⲉ ⲛ̅ⲛ̅ⲣⲙ̅ⲙⲁⲟ ϣⲁⲣⲉ ⲡⲣⲉϥⲣ̅ⲛⲟⲃⲉ ⲕⲙ̅ϣ ⲛⲉϥϣⲃⲉⲉⲣ.
Proverbs	14	21	 ⲫⲏ ⲉⲧϣⲱϣ ⲛ̀ϩⲁⲛϩⲏⲕⲓ ϥⲉⲣⲛⲟⲃⲓ ⲫⲏ ⲉⲧⲛⲁⲓ ⲛ̀ϩⲁⲛϩⲏⲕⲓ ⲱⲟⲩⲛⲓⲁⲧϥ							 ὁ ἀτιµάζων πένητας ἁµαρτάνει, ἐλεῶν δὲ πτωχοὺς µακαριστός.	 He that dishonours the needy sins: but he that has pity on the poor is most blessed.	 ⲡⲉⲧⲥⲱϣ ⲛ̅ⲛ̅ϩⲏⲕⲉ ⲣ̅ⲛⲟⲃⲉ ⲟⲩⲙⲁⲕⲁⲣⲓⲟⲥ ⲇⲉ ⲡⲉ ⲡⲉⲧⲛⲁ ⲛ̅ⲛ̅ϩⲏⲕⲉ.
Proverbs	14	22	 ⲛⲏ ⲇⲉ ⲉⲧⲥⲟⲣⲉⲙ ⲥⲉⲓⲣⲓ ⲛ̀ϩⲁⲛⲡⲉⲧϩⲱⲟⲩ ⲟⲩⲛⲁⲓ ⲛⲉⲙ ⲟⲩⲙⲉⲑⲙⲏⲓ ϣⲁⲩⲁⲓⲧⲟⲩ ⲛ̀ϫⲉ ⲛⲓⲁⲅⲁⲑⲟⲥ ⲥⲉⲥⲱⲟⲩⲛ ⲙ̀ⲫⲛⲁⲓ ⲁⲛ ⲛⲉⲙ ⲫⲛⲁϩϯ ⲛ̀ϫⲉ ⲛⲏ ⲉⲧⲉⲣϩⲱⲃ ⲉ̀ⲡⲓⲡⲉⲧϩⲱⲟⲩ ⲛⲓⲙⲉⲧⲛⲁⲏⲧ ⲇⲉ ⲛⲉⲙ ⲫⲛⲁϩϯ ⲥⲉϧⲉⲛ ⲛⲏ ⲉⲧⲓⲣⲓ ⲛ̀ⲛⲓⲁⲅⲁⲑⲟⲛ							 πλανώµενοι τεκταίνουσι κακά, ἔλεον δὲ καὶ ἀλήθειαν τεκταίνουσιν ἀγαθοί. οὐκ ἐπίστανται ἔλεον καὶ πίστιν τέκτονες κακῶν, ἐλεηµοσύναι δὲ καὶ πίστεις παρὰ τέκτοσιν ἀγαθοῖς.	 They that go astray devise evils: but the good devise mercy and truth. The framers of evil do not understand mercy and truth: but compassion and faithfulness are with the framers of good.	 ⲛⲉⲧⲥⲟⲣⲙ̅ ⲣ̅ϩⲱⲃ ⲉϩⲉⲛⲡⲉⲑⲟⲟⲩ ϩⲉⲛⲣⲉϥϫⲓϣⲟϫⲛⲉ ⲛⲙ̅ ⲡⲉⲧⲛⲁⲛⲟⲩⲟⲩ ⲛⲉ ⲛ̅ⲛⲁⲏⲧ ⲛ̅ⲣⲉϥϫⲓϣⲟϫⲛⲉ ⲇⲉ ⲛ̅ϫⲓⲛ̅ϭⲟⲛⲥ̅ ⲥⲉⲡⲗⲁⲛⲁ ϩⲙ̅ ⲡⲉⲩϣⲟϫⲛⲉ ⲉⲣⲉ ⲡⲛⲁ ⲇⲉ ⲙⲛ̅ ⲧⲙⲉ ⲛ̅ⲧⲉⲛⲣⲉϥⲣ̅ⲡⲉⲧⲛⲁⲛⲟⲩϥ ⲛ̅ⲣⲉϥⲣⲡⲉⲑⲟⲟⲩ ⲥⲟⲟⲩⲛ ⲁⲛ ⲙ̅ⲡⲛⲁ ⲙⲛ̅ ⲧⲡⲓⲥⲧⲓⲥ ⲉⲣⲉ ⲙ̅ⲙⲛ̅ⲧⲛⲁ ⲇⲉ ⲙⲛ̅ ⲧⲡⲓⲥⲧⲓⲥ ⲛ̅ⲧⲟⲟⲧⲟⲩ ⲛ̅ⲛ̅ⲣⲉϥⲣ̅ⲡⲉⲧⲛⲁⲛⲟⲩϥ
Proverbs	14	23	 ⲟⲩⲟⲛ ⲛⲓⲃⲉⲛ ⲉⲧϥⲓⲣⲱⲟⲩϣ ⲟⲩⲟⲛ ⲟⲩϩⲟⲩⲟ ϣⲟⲡ ⲛ̀ϧⲏⲧϥ ⲫⲏ ⲇⲉ ⲉⲧⲉⲣϩⲏⲇⲩⲛⲉⲥⲑⲉ ⲟⲩⲟϩ ⲉⲧϯⲙⲕⲁϩ ⲛ̀ϩⲏⲧ ⲛⲁϥ ⲁⲛ ⲉϥⲉ̀ϣⲱⲡⲓ ⲉϥⲉⲣϧⲁⲉ̀							 ἐν παντὶ µεριµνῶντι ἔνεστιν περισσόν, ὁ δὲ ἡδὺς καὶ ἀνάλγητος ἐν ἐνδείᾳ ἔσται.	 With every one who is careful there is abundance: but the pleasure-taking and indolent shall be in want.	 ⲟⲩⲛ ⲥⲟⲫⲓⲁ ϩⲛ̅ ⲟⲩⲟⲛ ⲛⲓⲙ ⲉⲧϥⲓⲣⲟⲟⲩϣ ⲡⲉⲧⲙⲟⲧⲛ̅ ⲇⲉ ⲙⲛ̅ ⲡⲉⲧⲉϥⲙⲉϥⲙⲟⲕϩϥ̅ ⲛⲁⲣ̅ϭⲣⲱϩ ⲛ̅ⲧⲙⲛ̅ⲧⲥⲁⲃⲉ.
Proverbs	14	24	 ⲟⲩⲭⲗⲟⲙ ⲛ̀ⲧⲉ ⲛⲓⲥⲁⲃⲉⲩ ⲡⲉ ⲡⲓⲥⲉⲃ ⲡⲓϫⲓⲛⲙⲟϣⲓ ⲇⲉ ⲛ̀ⲧⲉ ⲛⲓⲁⲧϩⲏⲧ ⲛⲉⲙ ⲛⲟⲩⲉⲣⲏⲟⲩ ϥϩⲱⲟⲩ							 στέφανος σοφῶν πανοῦργος, ἡ δὲ διατριβὴ ἀφρόνων κακή.	 A prudent man is the crown of the wise: but the occupation of fools is evil.	 ⲧⲙⲛ̅ⲧⲣⲙ̅ⲙⲁⲟ ⲡⲉⲕⲗⲟⲙ ⲛ̅ⲛ̅ⲥⲟⲫⲟⲥ ⲡⲙⲁⲛ̅ϣⲱⲡⲉ ⲇⲉ ⲛ̅ⲁⲑⲏⲧ ϩⲟⲟⲩ.
Proverbs	14	25	 ϥⲛⲁⲛⲟϩⲉⲙ ⲛ̀ϩⲁⲛⲯⲩⲭⲏ ⲉ̀ⲃⲟⲗ ϧⲉⲛ ϩⲁⲛⲡⲉⲧϩⲱⲟⲩ ⲛ̀ϫⲉ ⲟⲩⲙⲉⲑⲣⲉ ⲉϥⲉⲛϧⲟⲧ ϣⲁϥϩⲓⲥⲁϩϯ ⲇⲉ ϧⲉⲛ ⲟⲩⲙⲉⲑⲛⲟⲩϫ ⲛ̀ϫⲉ ⲟⲩⲣⲉϥⲉⲣⲭⲣⲟϥ							 ῥύσεται ἐκ κακῶν ψυχὴν µάρτυς πιστός, ἐκκαίει δὲ ψεύδη δόλιος.	 A faithful witness shall deliver a soul from evil: but a deceitful man kindles falsehoods.	 ϣⲁⲣⲉ ⲟⲩⲙⲛ̅ⲧⲣⲉ ⲉϥⲛ̅ϩⲟⲧ ⲧⲟⲩϫⲉ ϩⲉⲛⲯⲩⲭⲏ ⲉϩⲉⲛⲡⲉⲑⲟⲟⲩ ϣⲁⲣⲉ ⲡⲉⲕⲣⲟϥ ⲇⲉ ⲧⲙ̅ϩⲉ ϩⲉⲛϭⲟⲗ.
Proverbs	14	26	 ϧⲉⲛ ⲧϩⲟϯ ⲙ̀ⲡϭ̅ⲥ̅ ⲥϣⲟⲡ ⲛ̀ϫⲉ ⲟⲩϩⲉⲗⲡⲓⲥ ⲛ̀ⲧⲉ ⲟⲩϫⲟⲙ							 ἐν φόβῳ κυρίου ἐλπὶς ἰσχύος, τοῖς δὲ τέκνοις αὐτοῦ καταλείπει ἔρεισµα.	 In the fear of the Lord is strong confidence: and he leaves his children a support.	 ⲉⲣⲉ ⲑⲉⲗⲡⲓⲥ ⲛ̅ⲧϭⲟⲙ ϩⲛ̅ ⲑⲟⲧⲉ ⲙ̅ⲡϫⲟⲉⲓⲥ ⲟⲩⲁⲙⲁϩⲧⲉ ⲉϥⲧⲁϫⲣⲏⲩ ⲧⲉ ⲧⲙⲛ̅ⲧⲙⲁⲓⲛⲟⲩⲧⲉ ϥⲛⲁⲕⲱ ⲇⲉ ⲛ̅ⲟⲩⲧⲁϫⲣⲟ ⲛ̅ⲱⲛϩ̅ ⲛ̅ⲛⲉϥϣⲏⲣⲉ.
Proverbs	14	27								 πρόσταγµα κυρίου πηγὴ ζωῆς, ποιεῖ δὲ ἐκκλίνειν ἐκ παγίδος θανάτου.	 The commandment of the Lord is a fountain of life; and it causes men to turn aside from the snare of death.	 ⲟⲩⲡⲏⲅⲏ ⲛ̅ⲱⲛϩ̅ ⲡⲉ ⲡⲉⲡⲣⲟⲥⲧⲁⲅⲙⲁ ⲙ̅ⲡϫⲟⲉⲓⲥ ϣⲁϥⲣⲁⲕⲧⲟⲩ ⲇⲉ ⲉⲃⲟⲗ ϩⲙ̅ ⲡⲡⲁϣ ⲙ̅ⲡⲙⲟⲩ.
Proverbs	14	28								 ἐν πολλῷ ἔθνει δόξα βασιλέως, ἐν δὲ ἐκλείψει λαοῦ συντριβὴ δυνάστου.	 In a populous nation is the glory of a king: but in the failure of people is the ruin of a prince.	 ⲉⲣⲉ ⲡⲉⲟⲟⲩ ⲛ̅ⲟⲩⲣ̅ⲣⲟ ϩⲛ̅ ⲟⲩⲛⲟϭ ⲙ̅ⲙⲏⲏϣⲉ ⲉⲣⲉ ⲡⲟⲩⲱϣϥ̅ ⲇⲉ ⲛ̅ⲟⲩⲇⲩⲛⲁⲥⲧⲏⲥ ϩⲙ̅ ⲡⲱϫⲛ̅ ⲛ̅ⲛ̅ⲗⲁⲟⲥ.
Proverbs	14	29								 µακρόθυµος ἀνὴρ πολὺς ἐν φρονήσει, ὁ δὲ ὀλιγόψυχος ἰσχυρῶς ἄφρων.	 A man slow to wrath abounds in wisdom: but a man of impatient spirit is very foolish.	 ⲡϩⲁⲣϣ̅ϩⲏⲧ ⲛ̅ⲣⲱⲙⲉ ⲟϣ ⲙ̅ⲙⲛ̅ⲧⲥⲁⲃⲉ ⲟⲩⲁⲑⲏⲧ ⲇⲉ ⲉⲙⲁⲧⲉ ⲡⲉ ⲡϩⲏⲧ ϣⲏⲙ.
Proverbs	14	30								 πραύ̈θυµος ἀνὴρ καρδίας ἰατρός, σὴς δὲ ὀστέων καρδία αἰσθητική.	 A meek-spirited man is a healer of the heart: but a sensitive heart is a corruption of the bones.	 ⲟⲩⲥⲁⲉⲓⲛ ϩⲙ̅ ⲡⲉϥϩⲏⲧ ⲡⲉ ⲟⲩⲣⲱⲙⲉ ⲉⲙϥ̅ϭⲱⲛⲧ ⲟⲩϫⲟⲟⲗⲉⲥ ⲇⲉ ⲛ̅ⲛ̅ⲕⲉⲉⲥ ⲡⲉ ⲟⲩϩⲏⲧ ⲛ̅ⲣⲉϥⲁⲓⲥⲑⲁⲛⲉ.
Proverbs	14	31								 ὁ συκοφαντῶν πένητα παροξύνει τὸν ποιήσαντα αὐτόν, ὁ δὲ τιµῶν αὐτὸν ἐλεᾷ πτωχόν.	 He that oppresses the needy provokes his Maker: but he that honours him has pity upon the poor.	 ⲉⲣⲉ ⲡⲉⲧϩⲓⲗⲁ ⲉⲩϩⲏⲕⲉ ϯⲛⲟⲩϭⲥ̅ ⲙ̅ⲡⲉⲛⲧⲁϥⲧⲁⲙⲓⲟϥ ϣⲁⲣⲉ ⲡⲉⲧⲧⲁⲓⲟ ⲇⲉ ⲙ̅ⲙⲟϥ ⲛⲁ ⲛ̅ⲟⲩϩⲏⲕⲉ.
Proverbs	14	32								 ἐν κακίᾳ αὐτοῦ ἀπωσθήσεται ἀσεβής, ὁ δὲ πεποιθὼς τῇ ἑαυτοῦ ὁσιότητι δίκαιος.	 The ungodly shall be driven away in his wickedness: but he who is secure in his own holiness is just.	 ⲡⲁⲥⲑⲉⲛⲏⲥ ⲛⲁⲑⲃ̅ⲃⲓⲟ ϩⲛ̅ ⲧⲉϥⲕⲁⲕⲓⲁ ⲟⲩⲇⲓⲕⲁⲓⲟⲥ ⲇⲉ ⲡⲉ ⲡⲉⲧⲛⲁϩⲧⲉ ⲉⲡⲉϥⲟⲩⲟⲡ.
