book	chapter	verse	Bohairic	Akhmimic	Fayyumic	OldBohairic	Mesokemic	DialectP	Lycopolitan	Greek	English	Sahidic
Proverbs	7	12	 ϣⲁⲥⲉⲣⲟⲩⲥⲏⲟⲩ ⲅⲁⲣ ⲉⲥⲗⲉⲗⲉ ⲉ̀ⲃⲟⲗ ϣⲁⲥⲉⲣⲟⲩⲥⲏⲟⲩ ⲇⲉ ϧⲉⲛ ⲛⲓⲡⲗⲁⲧⲓⲁ ⲉⲥϫⲱⲣϫ ⲉⲥⲕⲉⲛ ⲉⲗⲕⲉ ⲛⲓⲃⲉⲛ							 χρόνον γάρ τινα ἔξω ῥέµβεται, χρόνον δὲ ἐν πλατείαις παρὰ πᾶσαν γωνίαν ἐνεδρεύει.	 For at one time she wanders without, and at another time she lies in wait in the streets, at every corner.	 ϣⲁⲥⲣ̅ⲟⲩⲟⲉⲓϣ ⲅⲁⲣ ⲉⲥⲕⲱⲧⲉ ϩⲓⲃⲟⲗ ⲟⲩⲟⲩⲟⲉⲓϣ ϫⲉ ⲉⲥϭⲟⲣϭ̅ ϩⲁⲧⲛ̅ ⲛ̅ⲕⲗϫⲉ ⲛⲓⲙ ϩⲛ̅ ⲛ̅ⲡⲗⲁⲧⲓⲁ.
Proverbs	7	13	 ⲓⲧⲁ ϣⲁⲥⲁⲙⲟⲛⲓ ⲙ̀ⲙⲟϥ ϣⲁⲥϯⲫⲓ ⲉⲣⲟϥ ϧⲉⲛ ⲟⲩϩⲟ ⲇⲉ ⲛⲁⲧϣⲓⲡⲓ ϣⲁⲥϫⲟⲥ ⲛⲁϥ							 εἶτα ἐπιλαβοµένη ἐφίλησεν αὐτόν, ἀναιδεῖ δὲ προσώπῳ προσεῖπεν αὐτῷ	 Then she caught him, and kissed him, and with an impudent face said to him,	 ⲙⲛ̅ⲛ̅ⲥⲱⲥ ϣⲁⲥⲁⲙⲁϩⲧⲉ ⲙ̅ⲙⲟϥ ⲛⲥ̅ϯⲡⲉ ⲉⲣⲱϥ ϩⲛ̅ ⲟⲩϩⲟ ⲇⲉ ⲛ̅ⲁⲧϣⲓⲡⲉ ϣⲁⲥϫⲟⲟⲥ ⲛⲁϥ
Proverbs	7	14	 ϫⲉ ⲟⲩϣⲟⲩϣⲱⲟⲩϣⲓ ⲛ̀ϩⲓⲣⲏⲛⲓⲕⲟⲛ ⲉⲧϣⲱⲡ ⲛⲏⲓ ϯⲛⲁϯ ⲛ̀ⲛⲁⲉⲩⲭⲏ ⲙ̀ⲫⲟⲟⲩ							 Θυσία εἰρηνική µοί ἐστιν, σήµερον ἀποδίδωµι τὰς εὐχάς µου·	 I have a peace-offering; today I pay my vows:	 ϫⲉ ⲟⲩⲑⲩⲥⲓⲁ ⲛ̅ⲉⲓⲣⲏⲛⲓⲕⲏ ⲛⲁⲓ̈ ⲡⲉ ⲡⲟⲟⲩ ϯⲛⲁϯ ⲛ̅ⲛⲁⲉⲣⲁⲧⲉ.
Proverbs	7	15	 ⲉⲑⲃⲉⲫⲁⲓ ⲁⲓⲓ̀ ⲉ̀ⲃⲟⲗ ⲉ̀ϩⲣⲁⲕ ⲉⲓⲙⲉⲓ ⲉ̀ⲡⲉⲕϩⲟ ⲟⲩⲟϩ ⲁⲓϫⲉⲙⲕ							 ἕνεκα τούτου ἐξῆλθον εἰς συνάντησίν σοι, ποθοῦσα τὸ σὸν πρόσωπον εὕρηκά σε·	 therefore I came forth to meet thee, desiring thy face; and I have found thee.	 ⲉⲧⲃⲉ ⲡⲁⲓ ⲁⲓ̈ⲉⲓ ⲉⲃⲟⲗ ⲉⲧⲱⲙⲛ̅ⲧ ⲉⲣⲟⲕ ⲉⲓ̈ⲟⲩⲉϣ ⲡⲉⲕϩⲟ ⲁⲓ̈ϩⲉ ⲉⲣⲟϥ.
Proverbs	7	16	 ⲁⲓϭⲱⲗⲕ ⲙ̀ⲡⲁϭⲁⲗⲁⲩϫ ϧⲉⲛ ϩⲁⲛⲥⲉⲃⲉⲛ ϧⲉⲛ ϩⲁⲛⲉⲛⲓⲧⲁⲡⲟⲥ ⲇⲉ ⲛ̀ⲧⲉ ⲭⲏⲙⲓ ⲁⲓⲫⲟⲣϣϥ							 κειρίαις τέτακα τὴν κλίνην µου, ἀµφιτάποις δὲ ἔστρωκα τοῖς ἀπ’ Αἰγύπτου·	 I have spread my bed with sheets, and I have covered it with double tapestry from Egypt.	 ⲁⲓⲥⲱⲙⲛ̅ⲧ ⲙ̅ⲡⲁϭⲗⲟϭ ϩⲛ̅ ϩⲉⲛⲕⲉⲣⲉⲁ ⲁⲓ̈ⲡⲟⲣϣϥ̅ ⲇⲉ ⲛⲁⲙⲫⲓⲧⲁⲛⲟⲥ ⲛ̅ⲧⲉⲕⲏⲙⲉ.
Proverbs	7	17	 ⲁⲓⲛⲟⲩϫϧ ⲛ̀ⲧⲁϣⲁⲓⲣⲓ ϧⲉⲛ ⲟⲩⲕⲣⲟⲕⲟⲥ ⲡⲁⲏⲓ ⲇⲉ ϧⲉⲛ ⲟⲩⲕⲩⲛⲁⲙⲱⲛⲟⲛ							 διέρραγκα τὴν κοίτην µου κρόκῳ, τὸν δὲ οἶκόν µου κινναµώµῳ·	 I have sprinkled my couch with saffron, and my house with cinnamon.	 ⲁⲓ̈ⲛⲟⲩϫϭ̅ ⲙ̅ⲡⲁϭⲗⲟϭ ϩⲛ̅ ⲟⲩⲕⲣⲟⲕⲕⲟⲥ ⲁⲩⲱ ⲡⲁⲏⲓ̈ ϩⲛ̅ ⲟⲩⲕⲓⲛⲁⲙⲱⲙⲟⲛ.
Proverbs	7	18	 ⲁⲙⲟⲩ ⲛ̀ⲧⲉⲛⲟⲩⲛⲟϥ ϧⲉⲛ ⲟⲩⲙⲉⲓ ϣⲁⲧⲟⲟⲩⲓ ⲁⲙⲟⲩ ⲛ̀ⲧⲉⲛⲥⲕⲉⲣⲕⲉⲣ ϧⲉⲛ ⲟⲩⲙⲉⲓ							 ἐλθὲ καὶ ἀπολαύσωµεν φιλίας ἕως ὄρθρου, δεῦρο καὶ ἐγκυλισθῶµεν ἔρωτι·	 Come, and let us enjoy love until the morning; come, and let us embrace in love.	 ⲁⲙⲟⲩ ⲛ̅ⲧⲛ̅ⲙ̅ⲧⲟⲛ ⲙ̅ⲙⲟⲛ ϩⲛ̅ ⲟⲩⲙⲛ̅ⲧϣⲃⲏⲣ ϣⲁϩⲧⲟⲟⲩⲉ ⲁⲙⲟⲩ ⲛ̅ⲧⲛ̅ϩⲱⲗϭ̅ ϩⲛ̅ ⲟⲩⲙⲉ.
Proverbs	7	19	 ϥⲧⲁⲓ ⲅⲁⲣ ⲁⲛ ⲛ̀ϫⲉ ⲡⲁϩⲁⲓ ϧⲉⲛ ⲡⲁⲏⲓ ⲁϥϣⲉ ⲛⲁϥ ⲉ̀ⲟⲩⲙⲱⲓⲧ ⲉϥⲟⲩⲏⲟⲩ							 οὐ γὰρ πάρεστιν ὁ ἀνήρ µου ἐν οἴκῳ, πεπόρευται δὲ ὁδὸν µακρὰν	 For my husband is not at home, but is gone on a long journey,	 ⲙ̅ⲡⲁϩⲁⲓ ⲅⲁⲣ ϩⲙ̅ ⲡⲁⲏⲓ̈ ⲁⲛ ⲁϥⲃⲱⲕ ⲉⲩϩⲓⲏ ⲉⲥⲟⲩⲏⲩ
Proverbs	7	20	 ⲉ̀ⲁϥⲱⲗⲓ ⲛ̀ⲟⲩⲥⲁⲟⲩⲓ ⲛ̀ϩⲟⲙⲧ ϧⲉⲛ ⲛⲉϥϫⲓϫ ϩⲓⲧⲉⲛ ⲟⲩⲙⲏϣ ⲛ̀ⲉϩⲟⲟⲩ ϥⲛⲁⲧⲁⲥⲑⲟ ⲉ̀ⲡⲉϥⲏⲓ							 ἔνδεσµον ἀργυρίου λαβὼν ἐν χειρὶ αὐτοῦ, δι’ ἡµερῶν πολλῶν ἐπανήξει εἰς τὸν οἶκον αὐτοῦ.	 having taken in his hand a bundle of money: after many days he will return to his house.	 ⲉⲣⲉ ⲟⲩⲧⲱⲱⲙⲉ ϩⲛ̅ ⲛⲉϥϭⲓϫ ϩⲓⲧⲛ̅ ⲟⲩⲙⲏⲏϣⲉ ⲛ̅ϩⲟⲟⲩ ⲉϥⲛⲁⲕⲟⲧϥ̅ ⲉⲡⲉϥⲏⲓ̈.
Proverbs	7	21	 ϣⲁⲥⲥⲟⲣⲙⲉϥ ⲇⲉ ϧⲉⲛ ϩⲁⲛⲙⲏϣ ⲛ̀ⲥⲁϫⲓ ϧⲉⲛ ⲛⲓϩⲁϫⲓ ⲇⲉ ⲛ̀ⲧⲉ ⲛⲉⲥⲥⲫⲟⲧⲟⲩ ϣⲁⲥⲫⲟⲛϫϥ ⲉ̀ⲃⲟⲗ							 ἀπεπλάνησεν δὲ αὐτὸν πολλῇ ὁµιλίᾳ βρόχοις τε τοῖς ἀπὸ χειλέων ἐξώκειλεν αὐτόν.	 So with much converse she prevailed on him to go astray, and with the snares of her lips forced him from the right path.	 ⲁⲥⲡⲗⲁⲛⲁ ⲇⲉ ⲙ̅ⲙⲟϥ ϩⲛ̅ ⲟⲩⲛⲟϭ ⲛ̅ϩⲟⲙⲓⲗⲓⲁ ⲛ̅ϣⲁϫⲉ ⲁⲥⲙⲟⲣϥ̅ ⲇⲉ ϩⲛ̅ ⲛ̅ϩⲁϭⲉ ⲉⲃⲟⲗ ϩⲛ̅ ⲛⲉⲥⲡⲟⲧⲟⲩ ⲁⲥⲑⲓⲟϥ ⲉⲃⲟⲗ
Proverbs	7	22	 ⲛ̀ⲑⲟϥ ⲇⲉ ϣⲁϥⲙⲟϣⲓ ⲛ̀ⲥⲱⲥ ⲉⲣⲉ ⲡⲉϥϩⲏⲧ ⲧⲟⲙⲧ ϣⲁⲥⲉⲛϥ ⲇⲉ ⲙ̀ⲫⲣⲏϯ ⲛ̀ⲟⲩⲟⲩϩⲟⲣ ⲉⲩⲛⲁⲉⲛϥ ⲉ̀ⲡⲥⲟⲛϩϥ ⲛⲉⲙ ⲙ̀ⲫⲣⲏϯ ⲛ̀ⲟⲩⲉⲓⲟⲩⲗ							 ὁ δὲ ἐπηκολούθησεν αὐτῇ κεπφωθείς, ὥσπερ δὲ βοῦς ἐπὶ σφαγὴν ἄγεται καὶ ὥσπερ κύων ἐπὶ δεσµοὺς	 And he followed her, being gently led on, and that as an ox is led to the slaughter, and as a dog to bonds, or as a hart shot in the liver with an arrow:	 ⲛ̅ⲧⲟϥ ⲇⲉ ⲁϥⲟⲩⲁϩϥ̅ ⲛ̅ⲥⲱⲥ ϩⲛ̅ ⲟⲩⲛⲟϭ ⲙ̅ⲙⲛ̅ⲧⲁⲑⲏⲧ ⲉϥϣⲧⲣ̅ⲧⲱⲣ ⲛ̅ⲑⲉ ⲛ̅ⲟⲩⲙⲁⲥⲉ ⲉⲩⲛⲁⲛⲧϥ̅ ⲉⲡⲉϥⲙⲁⲛ̅ⲕⲟⲛⲥϥ̅ ⲁⲩⲱ ⲛ̅ⲑⲉ ⲛ̅ⲟⲩⲟⲩϩⲟⲣ ⲉϥϭⲉⲡⲏ ⲉⲧⲁⲁϥ ⲉⲡⲉⲕⲗⲁⲗ.
Proverbs	7	23	 ⲉϥⲙⲁϣⲓ ⲛ̀ⲟⲩϣⲉⲛⲥⲟⲑⲛⲉϥ ϧⲉⲛ ⲡⲉϥϩⲏⲡⲁⲣ ϥⲓⲏⲥ ⲇⲉ ⲙ̀ⲫⲣⲏϯ ⲛ̀ⲟⲩϩⲁⲗⲏⲧ ⲉ̀ⲟⲩⲫⲁϣ ⲛ̀ϥⲥⲱⲟⲩⲛ ⲁⲛ ϫⲉ ⲁϥϭⲟϫⲓ ⲉϯ ⲛ̀ⲧⲉϥⲯⲩⲭⲏ							 ἢ ὡς ἔλαφος τοξεύµατι πεπληγὼς εἰς τὸ ἧπαρ, σπεύδει δὲ ὥσπερ ὄρνεον εἰς παγίδα οὐκ εἰδὼς ὅτι περὶ ψυχῆς τρέχει.	 and he hastens as a bird into a snare, not knowing that he is running for his life.	 ⲏ ⲛ̅ⲑⲉ ⲛ̅ⲟⲩⲉⲓⲟⲩⲗ ⲉⲁⲩϣⲟⲟⲩⲉϥ ⲛ̅ⲟⲩⲥⲟⲧⲉ ⲉⲡⲉϥϩⲏⲡⲁⲣ ϥϭⲉⲡⲏ ⲇⲉ ⲛ̅ⲑⲉ ⲛ̅ⲟⲩϩⲁⲗⲏⲧ ⲉⲩⲡⲁϣ ⲉⲛϥ̅ⲥⲟⲟⲩⲛ ⲁⲛ ϫⲉ ⲡⲙⲁ ⲙ̅ⲡⲉϥⲧⲏⲩ ⲡⲉ.
Proverbs	7	24	 ϯⲛⲟⲩ ⲟⲩⲛ ⲡⲁϣⲏⲣⲓ ⲥⲱⲧⲉⲙ ⲛ̀ⲥⲱⲓ ⲟⲩⲟϩ ⲙⲁϩⲑⲏⲕ ⲉ̀ⲛⲓⲥⲁϫⲓ ⲛ̀ⲧⲉⲣⲱⲓ							 νῦν οὖν, υἱέ, ἄκουέ µου καὶ πρόσεχε ῥήµασιν στόµατός µου·	 Now then, my son, hearken to me, and attend to the words of my mouth.	 ⲧⲉⲛⲟⲩ ϭⲉ ⲡⲁϣⲏⲣⲉ ⲥⲱⲧⲙ̅ ⲉⲣⲟⲓ̈ ⲛⲅ̅ϯϩⲧⲏⲕ ⲉⲛ̅ϣⲁϫⲉ ⲛ̅ⲣⲱⲓ̈.
Proverbs	7	25	 ⲙ̀ⲡⲉⲛⲑⲣⲉ ⲡⲉⲕϩⲏⲧ ⲣⲓⲕⲓ ⲉ̀ⲛⲉⲥⲙⲱⲓⲧ ⲟⲩⲟϩ ⲙ̀ⲡⲉⲣⲥⲱⲣⲉⲙ ϧⲉⲛ ⲛⲉⲥⲙⲁⲛ̀ⲙⲟϣⲓ							 µὴ ἐκκλινάτω εἰς τὰς ὁδοὺς αὐτῆς ἡ καρδία σου·	 Let not thine heart turn aside to her ways:	 ⲙ̅ⲡⲣ̅ⲧⲣⲉ ⲡⲉⲕϩⲏⲧ ⲣⲓⲕⲉ ⲉⲛⲉⲥϩⲓⲟⲟⲩⲉ.
Proverbs	7	26	 ⲟⲩⲙⲏϣ ⲅⲁⲣ ⲁⲥⲱϫϩ ⲙ̀ⲙⲱⲟⲩ ⲟⲩⲟϩ ⲁⲥⲣⲁϧⲧⲟⲩ ϩⲁⲛⲁⲧⲏⲡⲓ ⲇⲉ ⲛⲉ ⲛⲏ ⲉⲧⲁⲥϧⲟⲑⲃⲟⲩ							 πολλοὺς γὰρ τρώσασα καταβέβληκεν, καὶ ἀναρίθµητοί εἰσιν οὓς πεφόνευκεν·	 for she has wounded and cast down many, and those whom she has slain are innumerable.	 ⲁⲥⲕⲛⲥ̅ ⲟⲩⲙⲏⲏϣⲉ ⲅⲁⲣ ⲁⲥⲧⲁⲩⲟⲟⲩ ⲉϩⲣⲁⲓ̈ ⲁⲩⲱ ϩⲉⲛⲁⲧⲏⲡⲉ ⲛⲉ ⲛ̅ⲧⲁⲥϩⲟⲧⲃⲟⲩ.
Proverbs	7	27	 ϩⲁⲛⲙⲱⲓⲧ ⲛ̀ⲧⲉ ⲁⲙⲉⲛϯ ⲛⲉ ⲡⲉⲥⲏⲓ ⲉⲩϭⲓ ⲉ̀ϧⲣⲏⲓ ⲉ̀ⲛⲓⲧⲁⲙⲓⲟⲛ ⲛ̀ⲧⲉ ⲫⲙⲟⲩ							 ὁδοὶ ᾅδου ὁ οἶκος αὐτῆς κατάγουσαι εἰς τὰ ταµιεῖα τοῦ θανάτου.	 Her house is the way of hell, leading down to the chambers of death.	 ⲉⲣⲉ ⲛⲉϩⲓⲟⲟⲩⲉ ⲃⲏⲕ ⲉⲛ̅ⲏⲓ̈ ⲛ̅ⲁⲙⲛ̅ⲧⲉ ⲉⲩⲃⲏⲕ ⲇⲉ ⲉⲡⲉⲥⲏⲧ ⲉⲛⲧⲁⲙⲓⲟⲛ ⲙ̅ⲡⲙⲟⲩ
Proverbs	8	1	 ⲛ̀ⲑⲟⲕ ⲉⲕⲉ̀ϩⲓⲱⲓϣ ⲛ̀ϯⲥⲟⲫⲓⲁ ϩⲓⲛⲁ ⲛ̀ⲧⲉ ⲟⲩⲙⲉⲧⲥⲁⲃⲉ ⲥⲱⲧⲉⲙ ⲛ̀ⲥⲱⲕ							 Σὺ τὴν σοφίαν κηρύξεις, ἵνα φρόνησίς σοι ὑπακούσῃ·	 Thou shalt proclaim wisdom, that understanding may be obedient to thee.	 ⲛ̅ⲧⲟⲕ ⲇⲉ ⲧⲁϣⲉⲟⲉⲓϣ ⲛ̅ⲧⲥⲟⲫⲓⲁ ϫⲉ ⲉⲣⲉⲧⲙⲛ̅ⲧⲣⲙⲛ̅ϩⲏⲧ ⲥⲱⲧⲙ̅ ⲛⲁⲕ.
Proverbs	8	2	 ⲁⲥϩⲓϫⲉⲛ ⲛⲓⲗⲁⲕϩ ⲅⲁⲣ ⲉⲩϭⲟⲥⲓ ⲁⲥⲟϩⲓ ⲉ̀ⲣⲁⲧⲥ ϧⲉⲛ ⲑⲙⲏϯ ⲛ̀ⲛⲓⲙⲱⲓⲧ							 ἐπὶ γὰρ τῶν ὑψηλῶν ἄκρων ἐστίν, ἀνὰ µέσον δὲ τῶν τρίβων ἕστηκεν·	 For she is on lofty eminences, and stands in the midst of the ways.	 ⲉⲥϩⲓϫⲛ̅ ⲛ̅ⲕⲟⲟϩ ⲅⲁⲣ ⲉⲧϫⲟⲥⲉ ⲥⲁϩⲉ ⲇⲉ ⲉⲣⲁⲧⲥ̅ ϩⲛ̅ ⲧⲙⲏⲧⲉ ⲛ̅ⲛⲉϩⲓⲟⲟⲩⲉ.
Proverbs	8	3	 ⲥⲙⲏⲛ ⲅⲁⲣ ϧⲁⲧⲉⲛ ⲛⲓⲡⲩⲗⲏ ⲛ̀ⲧⲉ ⲛⲓϫⲱⲣⲓ ⲥⲉϩⲱⲥ ⲉ̀ⲣⲟⲥ ϩⲓ ⲛⲓⲙⲱⲓⲧ ⲉ̀ϧⲟⲩⲛ							 παρὰ γὰρ πύλαις δυναστῶν παρεδρεύει, ἐν δὲ εἰσόδοις ὑµνεῖται	 For she sits by the gates of princes, and sings in the entrances, saying,	 ⲥϭⲟⲣϭ̅ ϩⲁⲧⲛ̅ ⲙ̅ⲡⲩⲗⲏ ⲛ̅ⲛ̅ϫⲱⲱⲣⲉ ⲁⲩⲱ ⲥⲉⲥⲙⲟⲩ ⲉⲣⲟⲥ ϩⲛ̅ ⲙⲁⲛ̅ⲃⲱⲕ ⲉϩⲟⲩⲛ.
Proverbs	8	4	 ⲛ̀ⲑⲱⲧⲉⲛ ⲱ ⲛⲓⲣⲱⲙⲓ ϯϯϩⲟ ⲉ̀ⲣⲱⲧⲉⲛ ⲟⲩⲟϩ ϯϯ ⲛ̀ⲧⲁⲥⲙⲏ ⲛ̀ⲛⲓϣⲏⲣⲓ ⲛ̀ⲧⲉ ⲛⲓⲣⲱⲙⲓ							 Ὑµᾶς, ὦ ἄνθρωποι, παρακαλῶ καὶ προί̈εµαι ἐµὴν φωνὴν υἱοῖς ἀνθρώπων·	 You, O men, I exhort; and utter my voice to the sons of men.	 ϫⲉ ϯⲡⲁⲣⲁⲕⲁⲗⲓ ⲙ̅ⲙⲱⲧⲛ̅ ⲱ ⲛ̅ⲣⲱⲙⲉ ⲁⲩⲱ ϯϫⲱ ⲛⲏⲧⲛ̅ ⲛ̅ⲧⲁⲥⲃⲱ ⲛ̅ϣⲏⲣⲉ ⲛ̅ⲛ̅ⲣⲱⲙⲉ.
Proverbs	8	5	 ⲕⲁϯ ⲉ̀ⲟⲩⲙⲉⲧⲥⲁⲃⲉ ⲛⲓⲁⲧⲡⲉⲧϩⲱⲟⲩ ⲟⲩⲟϩ ⲛⲓⲁⲧⲥⲃⲱ ⲙⲁ ⲡⲉⲧⲉⲛϩⲏⲧ							 νοήσατε, ἄκακοι, πανουργίαν, οἱ δὲ ἀπαίδευτοι, ἔνθεσθε καρδίαν.	 O ye simple, understand subtlety, and ye that are untaught, imbibe knowledge.	 ⲛ̅ⲃⲁⲗϩⲏⲧ ⲛⲟⲓ̈ ⲛ̅ⲟⲩⲙⲛ̅ⲧⲥⲁⲃⲉ ⲛ̅ⲁⲑⲏⲧ ϯ ⲡⲉⲧⲛ̅ϩⲏⲧ.
Proverbs	8	6	 ⲥⲱⲧⲉⲙ ⲛ̀ⲥⲱⲓ ϩⲁⲛⲥⲁϫⲓ ⲅⲁⲣ ⲛ̀ⲥⲉⲙⲛⲟⲛ ⲉ̀ϯⲛⲁϫⲟⲧⲟⲩ ⲟⲩⲟϩ ϯⲛⲁⲓⲛⲓ ⲛ̀ϩⲁⲛⲥⲁϫⲓ ⲉⲩⲥⲟⲩⲧⲱⲛ ⲉ̀ⲃⲟⲗ ϧⲉⲛ ⲛⲁⲥⲫⲟⲧⲟⲩ							 εἰσακούσατέ µου, σεµνὰ γὰρ ἐρῶ καὶ ἀνοίσω ἀπὸ χειλέων ὀρθά·	 Hearken to me; for I will speak solemn truths; and will produce right sayings from my lips.	 ⲥⲱⲧⲙ̅ ⲉⲣⲟⲓ̈ ϫⲉ ⲉⲓ̈ⲛⲁϫⲱ ⲅⲁⲣ ⲛ̅ϩⲉⲛⲥⲃⲱ ⲁⲩⲱ ⲉⲓ̈ⲛⲁⲟⲩⲱⲛ ⲛ̅ⲛⲉⲧⲥⲟⲩⲧⲱⲛ ⲉⲃⲟⲗ ϩⲛ̅ ⲛⲁⲥⲡⲟⲧⲟⲩ.
Proverbs	8	7	 ϫⲉ ⲁⲣⲉ ⲧⲁϣⲃⲱⲃⲓ ⲛⲁⲉⲣⲙⲉⲗⲉⲧⲁⲛ ⲛ̀ϩⲁⲛⲙⲉⲑⲙⲏⲓ ⲥⲉⲥⲟϥ ⲇⲉ ⲙ̀ⲡⲁⲙ̀ⲑⲟ ⲛ̀ϫⲉ ⲛⲓⲥⲁϫⲓ ⲙ̀ⲙⲉⲑⲛⲟⲩϫ							 ὅτι ἀλήθειαν µελετήσει ὁ φάρυγξ µου, ἐβδελυγµένα δὲ ἐναντίον ἐµοῦ χείλη ψευδῆ.	 For my throat shall meditate truth; and false lips are an abomination before me.	 ⲉⲣⲉ ⲣⲱⲓ̈ ⲅⲁⲣ ⲙⲉⲗⲉⲧⲁ ⲛ̅ⲟⲩⲡⲓⲥⲧⲓⲥ ⲛⲉⲥⲡⲟⲧⲟⲩ ⲇⲉ ⲛ̅ϭⲟⲗ ϫⲁϩⲙ̅ ⲙ̅ⲡⲙ̅ⲧⲟ ⲉⲃⲟⲗ.
Proverbs	8	8	 ⲛⲓⲥⲁϫⲓ ⲧⲏⲣⲟⲩ ⲛ̀ⲧⲉ ⲣⲱⲓ ⲁⲩϣⲱⲡ ϧⲉⲛ ⲟⲩⲙⲉⲑⲙⲏⲓ ⲙ̀ⲙⲟⲛ ϩⲗⲓ ⲛ̀ϧⲏⲧⲟⲩ ⲉϥϧⲟⲥⲓ ⲛ̀ϫⲉⲙϥ ⲟⲩⲇⲉ ⲉ̀ⲟⲩⲟⲛ ⲕⲟⲧⲥ ⲛ̀ϧⲏⲧϥ							 µετὰ δικαιοσύνης πάντα τὰ ῥήµατα τοῦ στόµατός µου, οὐδὲν ἐν αὐτοῖς σκολιὸν οὐδὲ στραγγαλῶδες·	 All the words of my mouth are in righteousness; there is nothing in them wrong or perverse.	 ⲉⲣⲉ ⲛ̅ϣⲁϫⲉ ⲧⲏⲣⲟⲩ ⲛ̅ⲣⲱⲓ̈ ϩⲛ̅ ⲟⲩⲇⲓⲕⲁⲓⲟⲥⲩⲛⲏ ⲙⲛ̅ ⲗⲁⲁⲩ ⲛ̅ϩⲏⲧⲟⲩ ⲉϥϭⲟⲟⲙⲉ ⲟⲩⲇⲉ ⲉϥϫⲏⲩ ⲛ̅ⲕⲟⲧⲥ̅.
Proverbs	8	9	 ⲥⲉϫⲏ ⲧⲏⲣⲟⲩ ⲙ̀ⲡⲉⲙ̀ⲑⲟ ⲛ̀ⲛⲏ ⲉⲧⲕⲁϯ ⲟⲩⲟϩ ⲥⲉⲥⲟⲩⲧⲱⲛ ⲙ̀ⲡⲉⲙ̀ⲑⲟ ⲛ̀ⲛⲏ ⲉⲧϫⲓⲙⲓ ⲛ̀ϯⲅⲛⲱⲥⲓⲥ							 πάντα ἐνώπια τοῖς συνιοῦσιν καὶ ὀρθὰ τοῖς εὑρίσκουσι γνῶσιν.	 They are all evident to those that understand, and right to those that find knowledge.	 ⲥⲉⲙ̅ⲡⲉⲙ̅ⲧⲟ ⲉⲃⲟⲗ ⲧⲏⲣⲟⲩ ⲛ̅ⲛⲉⲧⲛ̅ⲟⲓ ⲥⲉⲥⲟⲩⲧⲱⲛ ⲇⲉ ⲛ̅ⲛⲉⲧⲟⲩⲱϣ ⲉϫⲓ ⲛ̅ⲟⲩⲁⲓⲥⲑⲏⲥⲓⲥ.
Proverbs	8	10	 ϭⲓ ⲛ̀ⲟⲩⲥⲃⲱ ⲟⲩⲟϩ ⲛ̀ⲟⲩϩⲁⲧ ⲁⲛ ⲛⲉⲙ ⲟⲩⲅⲛⲱⲥⲓⲥ ⲉ̀ϩⲟⲧⲉ ⲟⲩⲛⲟⲩⲃ ⲉ̀ⲁⲩⲉⲣⲇⲟⲕⲓⲙⲁⲍⲓⲛ ⲙ̀ⲙⲟϥ ϯⲉⲥⲑⲉⲥⲓⲥ ⲇⲉ ⲥⲟⲧⲡⲥ ⲛⲱⲧⲉⲛ ⲉ̀ϩⲟⲧⲉ ⲟⲩⲛⲟⲩⲃ ⲉϥⲧⲟⲩⲃⲏⲟⲩⲧ							 λάβετε παιδείαν καὶ µὴ ἀργύριον καὶ γνῶσιν ὑπὲρ χρυσίον δεδοκιµασµένον, ἀνθαιρεῖσθε δὲ αἴσθησιν χρυσίου καθαροῦ·	 Receive instruction, and not silver; and knowledge rather than tried gold.	 ϯϩⲏⲩ ⲛ̅ⲟⲩⲥⲃⲱ ⲛ̅ⲟⲩϩⲁⲧ ⲁⲛ ⲁⲩⲱ ⲟⲩⲥⲟⲟⲩⲛ̅ ⲉϩⲟⲩⲉ ⲟⲩⲛⲟⲩⲃ ⲉϥⲥⲟⲧⲡ̅ ⲥⲉⲧⲡ̅ ⲧⲙⲛ̅ⲧⲣⲙ̅ⲛ̅ϩⲏⲧ ⲇⲉ ⲉϩⲟⲩⲉ ⲡⲛⲟⲩⲃ ⲉⲧⲧⲃ̅ⲃⲏⲩ.
Proverbs	8	11	 ⲥⲥⲟⲧⲡ ⲅⲁⲣ ⲛ̀ϫⲉ ϯⲥⲟⲫⲓⲁ ⲉ̀ϩⲟⲧⲉ ϩⲁⲛⲱⲛⲓ ⲉ̀ⲛⲁϣⲉⲥⲟⲩⲉⲛⲟⲩ ϩⲱⲃ ⲛⲓⲃⲉⲛ ⲉⲧⲧⲁⲓⲏⲟⲩⲧ ⲥⲉⲙⲡϣⲁ ⲙ̀ⲙⲟⲥ ⲁⲛ							 κρείσσων γὰρ σοφία λίθων πολυτελῶν, πᾶν δὲ τίµιον οὐκ ἄξιον αὐτῆς ἐστιν.	 For wisdom is better than precious stones; and no valuable substance is of equal worth with it.	 ⲧⲥⲟⲫⲓⲁ ⲅⲁⲣ ⲥⲟⲧⲡ̅ ⲉϩⲟⲩⲉ ⲛⲉⲛⲉⲙⲙⲉ ⲛⲉⲧⲧⲁⲓ̈ⲏⲩ ⲇⲉ ⲧⲏⲣⲟⲩ ⲙ̅ⲡϣⲁ ⲙ̅ⲙⲟⲥ ⲁⲛ.
Proverbs	8	12	 ⲁ̀ⲛⲟⲕ ϯⲥⲟⲫⲓⲁ ⲁⲓⲟⲩⲱⲛϩ ϧⲉⲛ ⲟⲩⲥⲟϭⲛⲓ ⲟⲩⲅⲛⲱⲥⲓⲥ ⲇⲉ ⲛⲉⲙ ⲟⲩⲕⲁϯ ⲁ̀ⲛⲟⲕ ⲁⲓⲕⲱϯ ⲛ̀ⲥⲱⲟⲩ							 ἐγὼ ἡ σοφία κατεσκήνωσα βουλήν, καὶ γνῶσιν καὶ ἔννοιαν ἐγὼ ἐπεκαλεσάµην.	 I wisdom have dwelt with counsel and knowledge, and I have called upon understanding.	 ⲁⲛⲟⲕ ⲧⲥⲟⲫⲓⲁ ⲁⲓ̈ⲥⲱⲛⲧ̅ ⲙ̅ⲡϣⲟϫⲛⲉ ⲁⲛⲟⲕ ⲁⲓⲕⲱ ⲛⲁⲓ̈ ⲛ̅ⲧⲁⲓⲥⲑⲏⲥⲓⲥ ⲙⲛ̅ ⲡⲙⲉⲉⲩⲉ.
Proverbs	8	13	 ϯϩⲟϯ ⲛ̀ⲧⲉ ⲡϭ̅ⲥ̅ ⲙⲟⲥϯ ⲙ̀ⲡⲓϭⲓⲛ̀ϫⲟⲛⲥ ⲛⲉⲙ ⲡϣⲱϣ ⲛⲉⲙ ϯⲙⲉⲧϭⲁⲥⲓϩⲏⲧ ⲛⲉⲙ ⲛⲓⲙⲱⲓⲧ ⲛ̀ⲧⲉ ⲛⲓⲡⲟⲛⲏⲣⲟⲥ ⲁ̀ⲛⲟⲕ ⲁⲓⲙⲉⲥⲧⲉ ϩⲁⲛⲙⲱⲓⲧ ⲉⲩⲫⲟⲛϩ ⲛ̀ⲧⲉ ϩⲁⲛⲡⲉⲧϩⲱⲟⲩ							 φόβος κυρίου µισεῖ ἀδικίαν, ὕβριν τε καὶ ὑπερηφανίαν καὶ ὁδοὺς πονηρῶν· µεµίσηκα δὲ ἐγὼ διεστραµµένας ὁδοὺς κακῶν.	 The fear of the Lord hates unrighteousness, and insolence, and pride, and the ways of wicked men; and I hate the perverse ways of bad men.	 ⲧⲙⲛ̅ⲧⲙⲁⲓⲛⲟⲩⲧⲉ ⲙⲟⲥⲧⲉ ⲛ̅ⲧⲕⲁⲕⲓⲁ ⲁⲩⲱ ⲥⲙⲟⲥⲧⲉ ⲛ̅ⲟⲩⲥⲱϣ ⲙⲛ̅ ⲟⲩⲙⲛ̅ⲧϫⲁⲥⲓϩⲏⲧ ⲙⲛ̅ ϩⲉⲛϩⲓⲟⲟⲩⲉ ⲉⲩϩⲟⲟⲩ ⲙⲛ̅ ⲟⲩⲧⲁⲡⲣⲟ ⲛ̅ϭⲟⲗ.
Proverbs	8	14	 ⲫⲱⲓ ⲡⲉ ⲡⲓⲥⲟϭⲛⲓ ⲛⲉⲙ ⲡⲓⲧⲁϫⲣⲟ ⲑⲱⲓ ⲧⲉ ϯⲙⲉⲧⲥⲁⲃⲉ ⲑⲱⲓ ⲧⲉ ϯϫⲟⲙ							 ἐµὴ βουλὴ καὶ ἀσφάλεια, ἐµὴ φρόνησις, ἐµὴ δὲ ἰσχύς·	 Counsel and safety are mine; prudence is mine, and strength is mine.	 ⲡⲱⲓ̈ ⲡⲉ ⲡϣⲟϫⲛⲉ ⲙⲛ̅ ⲡⲱⲣϫ ⲧⲱⲓ̈ ⲧⲉ ⲧⲙⲛ̅ⲧⲣⲙ̅ⲛ̅ϩⲏⲧ ⲧⲱⲓ̈ ⲧⲉ ⲧϭⲟⲙ.
Proverbs	8	15	 ⲉ̀ⲃⲟⲗ ϩⲓⲧⲟⲧ ⲉⲣⲉ ⲛⲓⲣⲱⲟⲩ ⲟⲓ ⲛ̀ⲟⲩⲣⲟ ⲟⲩⲟϩ ⲉ̀ⲡⲉⲛⲓϫⲱⲣⲓ ⲥϧⲁⲓ ⲛ̀ϯⲙⲉⲑⲙⲏⲓ							 δι’ ἐµοῦ βασιλεῖς βασιλεύουσιν, καὶ οἱ δυνάσται γράφουσιν δικαιοσύνην·	 By me kings reign, and princes decree justice.	 ⲉⲣⲉ ⲛⲉⲣ̅ⲣⲱⲟⲩ ⲟ ⲛ̅ⲣ̅ⲣⲟ ⲉⲃⲟⲗ ϩⲓⲧⲟⲟⲧ ⲁⲩⲱ ⲉⲣⲉ ⲛ̅ϫⲱⲱⲣⲉ ⲁⲙⲁϩⲧⲉ ⲙ̅ⲡⲕⲁϩ ⲉⲃⲟⲗ ϩⲓⲧⲟⲟⲧ.
Proverbs	8	16	 ⲉ̀ⲃⲟⲗ ϩⲓⲧⲟⲧ ⲛⲓⲉ̀ϩⲣⲏⲓ ⲥⲉⲟⲓ ⲛ̀ⲛⲓϣϯ ⲟⲩⲟϩ ⲛⲓⲧⲩⲣⲁⲛⲛⲟⲥ ⲁⲩⲁⲙⲟⲛⲓ ⲙ̀ⲡⲓⲕⲁϩⲓ ⲉ̀ⲃⲟⲗ ϩⲓⲧⲟⲧ							 δι’ ἐµοῦ µεγιστᾶνες µεγαλύνονται, καὶ τύραννοι δι’ ἐµοῦ κρατοῦσι γῆς.	 By me nobles become great, and monarchs by me rule over the earth.	 ⲉⲣⲉ ⲛ̅ⲛⲟϭ ⲁⲓⲁⲓ ⲉⲃⲟⲗ ϩⲓⲧⲟⲟⲧ ⲁⲩⲱ ⲉⲣⲉ ⲛ̅ⲧⲩⲣⲁⲛⲛⲟⲥ ⲁⲙⲁϩⲧⲉ ⲙ̅ⲡⲕⲁϩ ⲉⲃⲟⲗ ϩⲓⲧⲟⲟⲧ.
Proverbs	8	17	 ⲁ̀ⲛⲟⲕ ϯⲉⲣⲁⲅⲁⲡⲁⲛ ⲛ̀ⲛⲏ ⲉⲧⲙⲉⲓ ⲙ̀ⲙⲟⲓ ⲛⲏ ⲉⲧⲕⲱϯ ⲛ̀ⲥⲱⲓ ⲉⲩⲉ̀ϫⲉⲙⲧ							 ἐγὼ τοὺς ἐµὲ φιλοῦντας ἀγαπῶ, οἱ δὲ ἐµὲ ζητοῦντες εὑρήσουσιν.	 I love those that love me; and they that seek me shall find me.	 ⲁⲛⲟⲕ ⲉⲓⲙⲉ ⲛ̅ⲛⲉⲧⲙⲉ ⲙ̅ⲙⲟⲓ̈ ⲛⲉⲧϣⲓⲛⲉ ⲇⲉ ⲛ̅ⲥⲱⲓ̈ ⲥⲉⲛⲁϭⲛⲧ.
Proverbs	8	18	 ⲟⲩⲙⲉⲧⲣⲁⲙⲁⲟ ⲛⲉⲙ ⲟⲩⲱⲟⲩ ⲥⲉϣⲟⲡ ⲛⲏⲓ ⲛⲉⲙ ⲟⲩϫⲫⲟ ⲛⲉⲙ ⲟⲩⲙⲏϣ ⲛⲉⲙ ⲟⲩⲇⲓⲕⲉⲟⲥⲩⲛⲏ							 πλοῦτος καὶ δόξα ἐµοὶ ὑπάρχει καὶ κτῆσις πολλῶν καὶ δικαιοσύνη·	 Wealth and glory belong to me; yea, abundant possessions and righteousness.	 ⲟⲩⲛⲧⲁⲓ̈ ⲧⲙⲛ̅ⲧⲣⲙ̅ⲙⲁⲟ ⲅⲁⲣ ⲙⲛ̅ ⲡⲉⲟⲟⲩ ⲁⲩⲱ ⲟⲩϫⲡⲉ ϩⲁϩ ⲙⲛ̅ ⲟⲩⲇⲓⲕⲁⲓⲟⲥⲩⲛⲏ.
Proverbs	8	19	 ⲛⲁⲛⲉⲥ ⲉⲩϫⲫⲟ ⲛⲱⲧⲉⲛ ⲉ̀ϩⲟⲧⲉ ⲟⲩⲛⲟⲩⲃ ⲛⲉⲙ ⲟⲩⲱⲛⲓ ⲉϥⲧⲁⲓⲏⲟⲩⲧ ⲛⲓⲟⲩⲧⲁϩ ⲇⲉ ⲥⲉⲥⲟⲧⲡ ⲉ̀ϩⲟⲧⲉ ⲟⲩⲱⲛⲓ ⲉϥⲥⲟⲧⲡ							 βέλτιον ἐµὲ καρπίζεσθαι ὑπὲρ χρυσίον καὶ λίθον τίµιον, τὰ δὲ ἐµὰ γενήµατα κρείσσω ἀργυρίου ἐκλεκτοῦ.	 It is better to have my fruit than to have gold and precious stones; and my produce is better than choice silver.	 ⲛⲁⲛⲟⲩ ϫⲡⲟⲓ ⲛⲏⲧⲛ̅ ⲉϩⲟⲩⲉ ⲡⲛⲟⲩⲃ ⲙⲛ̅ ⲡⲉⲛⲉⲙⲙⲉ ⲁⲩⲱ ⲛⲁⲛⲟⲩ ⲛⲁⲅⲉⲛⲏⲙⲁ ⲉϩⲟⲩⲉ ⲡϩⲁⲧ ⲉⲧⲥⲟⲧⲡ̅.
Proverbs	8	20	 ⲁⲓⲙⲟϣⲓ ϧⲉⲛ ⲛⲓⲙⲱⲓⲧ ⲛ̀ⲧⲉ ϯⲇⲓⲕⲉⲟⲥⲩⲛⲏ ⲟⲩⲟϩ ⲁⲓⲉⲣⲁⲛⲁⲥⲧⲣⲉⲫⲉⲥⲑⲉ ϧⲉⲛ ⲑⲙⲏϯ ⲛ̀ⲛⲓⲙⲱⲓⲧ ⲛ̀ⲧⲉ ϯⲙⲉⲑⲙⲏⲓ							 ἐν ὁδοῖς δικαιοσύνης περιπατῶ καὶ ἀνὰ µέσον τρίβων δικαιώµατος ἀναστρέφοµαι,	 I walk in ways of righteousness, and am conversant with the paths of judgment;	 ⲉⲓ̈ⲙⲟⲟϣⲉ ϩⲛ̅ ϩⲉⲛϩⲓⲟⲟⲩⲉ ⲙ̅ⲙⲛ̅ⲧⲙⲉ ⲁⲩⲱ ⲉⲓ̈ⲃⲏⲕ ϩⲛ̅ ⲛⲉϩⲓⲟⲟⲩⲉ ⲛ̅ⲧⲙⲉ.
Proverbs	8	21	 ϩⲓⲛⲁ ⲛ̀ⲧⲁⲫⲱⲣϣ ⲛ̀ⲛⲁϩⲏⲡⲁⲣⲭⲟⲛⲧⲁ ⲉ̀ϩⲣⲁⲩ ⲛ̀ⲛⲏ ⲉⲑⲙⲉⲓ ⲙ̀ⲙⲟⲓ ⲟⲩⲟϩ ⲛⲟⲩⲁϩⲱⲣ ⲛ̀ⲧⲁⲙⲁϩⲟⲩ ⲛ̀ⲁⲅⲁⲑⲟⲛ ⲉ̀ϣⲱⲡ ⲛ̀ⲧⲁⲥⲁϫⲓ ϧⲁⲧⲉⲛ ⲑⲏⲛⲟⲩ ⲛ̀ⲛⲏ ⲉⲧϣⲟⲡ ⲙ̀ⲙⲏⲛⲓ ⲉⲓⲉ̀ⲉⲣⲫⲙⲉⲩⲓ ⲉ̀ϭⲓⲏⲡⲓ ⲓⲥϫⲉⲛ ⲡⲉⲛⲉϩ							 ἵνα µερίσω τοῖς ἐµὲ ἀγαπῶσιν ὕπαρξιν καὶ τοὺς θησαυροὺς αὐτῶν ἐµπλήσω ἀγαθῶν. ἐὰν ἀναγγείλω ὑµῖν τὰ καθ’ ἡµέραν γινόµενα, µνηµονεύσω τὰ ἐξ αἰῶνος ἀριθµῆσαι.	 that I may divide substance to them that love me, and may fill their treasures with good things. (21a) If I declare to you the things that daily happen, I will remember also to recount the things of old.	 ϫⲉⲕⲁⲥ ⲉⲓ̈ⲉⲡⲱϣ ⲉϫⲛ̅ ⲛⲉⲧⲙⲉ ⲙ̅ⲙⲟⲓ̈ ⲛ̅ⲟⲩⲙⲛ̅ⲧⲣⲙ̅ⲙⲁⲟ ⲁⲩⲱ ⲛ̅ⲧⲁⲙⲉϩ ⲛⲉⲩⲁϩⲱⲱⲣ ⲛ̅ⲁⲅⲁⲑⲟⲛ ⲉⲓ̈ϣⲁⲛϫⲱ ⲛⲏⲧⲛ̅ ⲛ̅ⲛⲉⲧϣⲟⲟⲡ ⲙ̅ⲙⲏⲛⲉ ϯⲛⲁⲣⲡⲙⲉⲉⲩⲉ ⲙ̅ⲡϩⲁⲡ ϫⲓⲛ ⲉⲛⲉϩ.
Proverbs	8	22	 ⲡϭ̅ⲥ̅ ⲁϥⲥⲱⲧⲡ ⲙ̀ⲙⲟⲓ ⲛ̀ⲁⲣⲭⲏ ⲛ̀ⲛⲉϥϩⲃⲏⲟⲩⲓ ⲙ̀ⲡⲁⲧⲟⲩⲑⲁⲙⲓⲉ ϩⲗⲓ							 κύριος ἔκτισέν µε ἀρχὴν ὁδῶν αὐτοῦ εἰς ἔργα αὐτοῦ,	 The Lord made me the beginning of his ways for his works.	 ⲁ ⲡⲛⲟⲩⲧⲉ ⲥⲟⲛⲧ̅ ϩⲛ̅ ⲧⲁⲣⲭⲏ ⲛ̅ⲛⲉϥϩⲓⲟⲟⲩⲉ ⲉⲛⲉϥϩⲃⲏⲩⲉ ⲉⲙⲡⲁⲧϥ̅ⲧⲁⲙⲓⲉ ⲗⲁⲁⲩ
Proverbs	8	23	 ϧⲁϫⲱϥ ⲙ̀ⲡⲉⲛⲉϩ ⲁϥϩⲓⲥⲉⲛϯ ⲙ̀ⲙⲟⲓ ϧⲉⲛ ⲧⲁⲣⲭⲏ ⲙ̀ⲡⲁⲧⲟⲩⲑⲁⲙⲓⲉ ⲡⲕⲁϩⲓ							 πρὸ τοῦ αἰῶνος ἐθεµελίωσέν µε ἐν ἀρχῇ,	 He established me before time was in the beginning, before he made the earth:	 ⲁⲩⲱ ⲁϥⲥⲙⲛ̅ⲥⲛ̅ⲧⲉ ⲙ̅ⲙⲟⲓ̈ ϩⲁⲑⲏ ⲛ̅ⲛ̅ⲉⲛⲉϩ ϩⲛ̅ ⲧⲁⲣⲭⲏ
Proverbs	8	24	 ⲙ̀ⲡⲁⲧⲟⲩⲑⲁⲙⲓⲟ ⲛ̀ⲛⲓⲛⲟⲩⲛ ⲙ̀ⲡⲁⲧⲟⲩⲓ ⲉ̀ⲃⲟⲗ ⲛ̀ϫⲉ ⲛⲓⲙⲟⲩⲛϩⲱⲟⲩ							 πρὸ τοῦ τὴν γῆν ποιῆσαι καὶ πρὸ τοῦ τὰς ἀβύσσους ποιῆσαι, πρὸ τοῦ προελθεῖν τὰς πηγὰς τῶν ὑδάτων,	 even before he made the depths; before the fountains of water came forth:	 ⲉⲙⲡⲁⲧϥ̅ⲧⲁⲙⲓⲉ ⲡⲕⲁϩ ⲁϥϫⲡⲟⲓ ⲇⲉ ϩⲁⲑⲏ ⲙ̅ⲡⲛⲟⲩⲛ ⲉⲙⲡⲁⲧⲉ ⲙ̅ⲡⲏⲅⲏ ⲙ̅ⲙⲟⲟⲩ ⲉⲓ ⲉⲃⲟⲗ
Proverbs	8	25	 ⲙ̀ⲡⲁⲧⲟⲩⲥⲉⲙⲛⲓ ⲛ̀ϫⲉ ⲛⲓⲧⲱⲟⲩ ϧⲁϫⲱⲟⲩ ⲇⲉ ⲛ̀ⲛⲓⲕⲁⲗⲁⲙⲫⲟ ⲧⲏⲣⲟⲩ ⲁⲩⲙⲁⲥⲧ							 πρὸ τοῦ ὄρη ἑδρασθῆναι, πρὸ δὲ πάντων βουνῶν γεννᾷ µε.	 before the mountains were settled, and before all hills, he begets me.	 ⲉⲙⲡⲁⲧϥ̅ⲧⲁϫⲣⲉ ⲛ̅ⲧⲟⲟⲩ ⲁⲩⲱ ⲛϥ̅ⲡⲗⲁⲥⲥⲉ ⲙ̅ⲡⲕⲁϩ ⲙⲛ̅ ⲧⲟⲓⲕⲟⲩⲙⲉⲛⲏ ⲁϥϫⲡⲟⲓ ⲇⲉ ϩⲁⲑⲏ ⲛ̅ⲥⲓⲃⲧ ⲛⲓⲙ.
