book	chapter	verse	Bohairic	Akhmimic	Fayyumic	OldBohairic	Mesokemic	DialectP	Lycopolitan	Greek	English	Sahidic
Proverbs	1	1	 ⲛⲓⲡⲁⲣⲟⲓⲙⲓⲁ ⲛ̀ⲧⲉ ⲥⲟⲗⲟⲙⲱⲛ ⲡϣⲏⲣⲓ ⲙ̀ⲡⲟⲩⲣⲟ ⲇⲁⲩⲓⲇ ⲫⲏ ⲉⲧⲁϥⲉⲣⲟⲩⲣⲟ ϧⲉⲛ ⲡⲓⲥ̅ⲗ̅							 Παροιµίαι Σαλωµῶντος υἱοῦ Δαυιδ, ὃς ἐβασίλευσεν ἐν Ισραηλ,	 The Proverbs of Solomon son of David, who reigned in Israel;	 ⲙ̅ⲡⲁⲣϩⲟⲓⲙⲓⲁ ⲛ̅ⲥⲟⲗⲟⲙⲱⲛ ⲡϣⲏⲣⲉ ⲛ̅ⲇⲁⲩⲉⲓⲇ ⲡⲉⲛⲧⲁϥⲣ̅ⲣⲟ ϩⲙ̅ ⲡⲓⲏ̅ⲗ̅.
Proverbs	1	2	 ⲉ̀ⲉⲙⲓ ⲉ̀ⲟⲩⲥⲟⲫⲓⲁ ⲛⲉⲙ ⲟⲩⲥⲃⲱ ⲉ̀ⲉⲣⲛⲟⲓⲛ ⲛ̀ϩⲁⲛⲥⲁϫⲓ ⲛ̀ⲧⲉ ⲟⲩⲙⲉⲧⲥⲁⲃⲉ							 γνῶναι σοφίαν καὶ παιδείαν νοῆσαί τε λόγους φρονήσεως	 to know wisdom and instruction, and to perceive words of understanding;	 ⲉⲉⲓⲙⲉ ⲉⲧⲥⲟⲫⲓⲁ ⲙⲛ̅ ⲧⲉⲥⲃⲱ ⲉⲛⲟⲓ ⲛ̅ⲛ̅ϣⲁϫⲉ ⲛ̅ⲧⲙⲛ̅ⲧⲣⲙ̅ⲛ̅ϩⲏⲧ.
Proverbs	1	3	 ⲉ̀ϣⲱⲡ ⲉ̀ⲣⲱⲧⲉⲛ ⲛ̀ϩⲁⲛⲫⲱⲛϩ ⲛ̀ⲧⲉ ϩⲁⲛⲥⲁϫⲓ ⲉ̀ⲥⲁⲃⲉ ⲉ̀ⲟⲩⲇⲓⲕⲉⲟⲥⲩⲛⲏ ⲛ̀ⲧⲁⲫⲙⲏⲓ ⲛⲉⲙ ⲟⲩϩⲁⲡ ⲉϥⲥⲟⲩⲧⲱⲛ							 δέξασθαί τε στροφὰς λόγων νοῆσαί τε δικαιοσύνην ἀληθῆ καὶ κρίµα κατευθύνειν,	 to receive also hard saying, and to understand true justice, and how to direct judgment;	 ⲉϫⲓ ⲙ̅ⲡⲉⲕⲧⲟ ⲛ̅ϩⲉⲛϣⲁϫⲉ ⲙⲛ̅ ⲛ̅ⲃⲱⲗ ⲛ̅ϩⲉⲛⲁⲓⲛⲓⲅⲙⲁ ⲉⲛⲟⲓ ⲛ̅ⲧⲟⲩⲇⲓⲕⲁⲓⲟⲥⲩⲛⲏ ⲙⲙⲉ ⲁⲩⲱ ⲉⲥⲟⲩⲧⲛ̅ ⲟⲩϩⲁⲡ.
Proverbs	1	4	 ϩⲓⲛⲁ ⲛ̀ⲧⲉⲥϯ ⲛ̀ⲟⲩⲙⲉⲧⲥⲁⲃⲉ ⲛ̀ⲛⲓⲁⲧⲡⲉⲧϩⲱⲟⲩ ⲟⲩⲟϩ ⲟⲩⲉⲥⲑⲉⲥⲓⲥ ⲛⲉⲙ ⲟⲩⲕⲁϯ ⲛ̀ⲟⲩⲁⲗⲟⲩ ⲙ̀ⲃⲉⲣⲓ							 ἵνα δῷ ἀκάκοις πανουργίαν, παιδὶ δὲ νέῳ αἴσθησίν τε καὶ ἔννοιαν·	 that he might give subtlety to the simple, and to the young man discernment and understanding.	 ϫⲉ ⲉⲓⲉϯ ⲛⲟⲩⲙⲛ̅ⲧⲣⲙ̅ⲛ̅ϩⲏⲧ ⲛ̅ⲛ̅ⲃⲁⲗϩⲏⲧ ⲁⲩⲱ ⲟⲩⲁⲓⲥⲑⲏⲥⲓⲥ ⲙⲛ̅ ⲟⲩⲙⲉⲉⲩⲉ ⲛ̅ⲟⲩϣⲏⲣⲉ ϣⲏⲙ.
Proverbs	1	5	 ⲡⲓⲥⲁⲃⲉ ⲇⲉ ⲁϥϣⲁⲛⲥⲱⲧⲉⲙ ⲉ̀ⲛⲁⲓ ϥⲛⲁⲉⲣⲥⲁⲃⲉ ⲛ̀ϩⲟⲩⲟ ⲡⲓⲛⲉⲃϩⲏⲧ ⲇⲉ ⲉϥⲉ̀ϫⲫⲟ ⲛ̀ⲟⲩⲙⲉⲧⲣⲉϥⲉⲣϩⲉⲙⲓ							 τῶνδε γὰρ ἀκούσας σοφὸς σοφώτερος ἔσται, ὁ δὲ νοήµων κυβέρνησιν κτήσεται	 For by the hearing of these a wise man will be wiser, and man of understanding will gain direction;	 ⲡⲥⲟⲫⲟⲥ ⲅⲁⲣ ⲉⲧⲛⲁⲥⲱⲧⲙ̅ ⲉⲛⲁⲓ̈ ϥⲛⲁⲣ̅ϩⲟⲩⲉⲥⲟⲫⲟⲥ ⲡⲣⲙ̅ⲛ̅ϩⲏⲧ ⲇⲉ ⲛⲁϫⲡⲟ ⲛⲁϥ ⲛ̅ⲟⲩⲣ̅ϩⲙ̅ⲙⲉ.
Proverbs	1	6	 ⲉϥⲉ̀ⲕⲁϯ ⲇⲉ ⲉ̀ⲟⲩⲡⲁⲣⲁⲃⲟⲗⲏ ⲛⲉⲙ ⲟⲩⲥⲁϫⲓ ⲛ̀ⲭⲁⲕⲓ ⲛⲉⲙ ϩⲁⲛⲥⲁϫⲓ ⲛ̀ⲧⲉ ϩⲁⲛⲥⲁⲃⲉⲩ ⲛⲉⲙ ϩⲁⲛⲥⲁϫⲓ ⲉⲩϩⲏⲡ							 νοήσει τε παραβολὴν καὶ σκοτεινὸν λόγον ῥήσεις τε σοφῶν καὶ αἰνίγµατα.	 and will understand a parable, and a dark speech; the saying of the wise also, and riddles.	 ϥⲛⲁⲛⲟⲓ ⲛ̅ⲟⲩⲡⲁⲣⲁⲃⲟⲗⲏ ⲙⲛ̅ ⲟⲩϣⲁϫⲉ ⲉϥϩⲏⲡ ⲛ̅ϣⲁϫⲉ ⲛ̅ⲛ̅ⲥⲟⲫⲟⲥ ⲙⲛ̅ ⲛⲉⲩⲁⲓⲛⲓⲅⲙⲁ.
Proverbs	1	7	 ⲧⲁⲣⲭⲏ ⲛ̀ϯⲥⲟⲫⲓⲁ ϯϩⲟϯ ⲛ̀ⲧⲉ ⲡϭ̅ⲥ̅ ⲧⲉ ⲡⲓⲕⲁϯ ⲇⲉ ⲛⲁⲛⲉϥ ⲛ̀ⲟⲩⲟⲛ ⲛⲓⲃⲉⲛ ⲉⲧⲓⲣⲓ ⲙ̀ⲙⲟϥ ϯⲙⲉⲧⲉⲩⲥⲉⲃⲏⲥ ⲇⲉ ⲑⲁ ⲫϯ ⲧⲁⲣⲭⲏ ⲙ̀ⲡⲓⲕⲁϯ ⲡⲉ ϯⲥⲟⲫⲓⲁ ⲛⲉⲙ ϯⲥⲃⲱ ⲛⲓⲁⲥⲉⲃⲏⲥ ⲉⲩⲉ̀ϣⲱϣϥⲟⲩ							 Ἀρχὴ σοφίας φόβος θεοῦ, σύνεσις δὲ ἀγαθὴ πᾶσι τοῖς ποιοῦσιν αὐτήν· εὐσέβεια δὲ εἰς θεὸν ἀρχὴ αἰσθήσεως, σοφίαν δὲ καὶ παιδείαν ἀσεβεῖς ἐξουθενήσουσιν.	 The fear of the Lord is the beginning of wisdom; and there is good understanding to all that practise it: and piety toward God is the beginning of discernment; but the ungodly will set at nought wisdom and instruction.	 ⲧⲁⲣⲭⲏ ⲛ̅ⲧⲥⲟⲫⲓⲁ ⲧⲉ ⲑⲟⲧⲉ ⲙ̅ⲡⲛⲟⲩⲧⲉ ⲛⲁⲛⲟⲩ ⲧⲙⲛ̅ⲣⲙⲛ̅ϩⲏⲧ ⲇⲉ ⲛ̅ⲟⲩⲟⲛ ⲛⲓⲙ ⲉⲧⲛⲁⲁⲥ ⲧⲁⲣⲭⲏ ⲛ̅ⲧⲁⲓⲥⲑⲏⲥⲓⲥ ⲧⲉ ⲧⲙⲛ̅ⲧⲙⲁⲓⲛⲟⲩⲧⲉ ⲛ̅ⲁⲥⲉⲃⲏⲥ ⲇⲉ ⲛⲁⲥⲱⲱϥ ⲛ̅ⲧⲥⲟⲫⲓⲁ ⲙⲛ̅ⲧⲉⲥⲃⲱ.
Proverbs	1	8	 ⲥⲱⲧⲉⲙ ⲡⲁϣⲏⲣⲓ ⲉ̀ϯⲥⲃⲱ ⲛ̀ⲧⲉ ⲡⲉⲕⲓⲱⲧ ⲟⲩⲟϩ ⲙ̀ⲡⲉⲣϩⲓⲡϩⲟ ⲛ̀ⲛⲓⲥⲟϭⲛⲓ ⲛ̀ⲧⲉ ⲧⲉⲕⲙⲁⲩ							 ἄκουε, υἱέ, παιδείαν πατρός σου καὶ µὴ ἀπώσῃ θεσµοὺς µητρός σου·	 Hear, my son, the instruction of thy father, and reject not the rules of thy mother.	 ⲥⲱⲧⲙ̅ ⲡⲁϣⲏⲣⲉ ⲉⲧⲉⲥⲃⲱ ⲙ̅ⲡⲉⲕⲉⲓⲱⲧ ⲁⲩⲱ ⲙ̅ⲡⲣ̅ⲕⲱ ⲛ̅ⲥⲱⲕ ⲛ̅ⲛⲁⲛⲥⲙ̅ⲙⲉ ⲛ̅ⲧⲉⲕⲙⲁⲁⲩ.
Proverbs	1	9	 ⲟⲩⲭⲗⲟⲙ ⲅⲁⲣ ⲛ̀ⲧⲉ ϩⲁⲛϩⲙⲟⲧ ⲉⲩⲉ̀ⲧⲏⲓϥ ϩⲓϫⲱⲕ ⲛⲉⲙ ⲟⲩⲭⲗⲁⲗ ⲛ̀ⲛⲟⲩⲃ ⲉ̀ⲡⲉⲕⲙⲟϯ							 στέφανον γὰρ χαρίτων δέξῃ σῇ κορυφῇ καὶ κλοιὸν χρύσεον περὶ σῷ τραχήλῳ.	 For thou shalt receive for thine head a crown of graces, and a chain of gold round thy neck.	 ⲕⲛⲁϫⲓ ⲅⲁⲣ ⲛ̅ⲟⲩⲕⲗⲟⲙ ⲛ̅ϩⲙⲟⲧ ⲉϫⲛ̅ ⲧⲉⲕⲁⲡⲉ ⲁⲩⲱ ⲟⲩⲕⲗⲁⲗ ⲛ̅ⲛⲟⲩⲃ ⲉⲡⲉⲕⲙⲁⲕϩ̅.
Proverbs	1	10	 ⲡⲁϣⲏⲣⲓ ⲙ̀ⲡⲉⲛⲑⲣⲟⲩⲥⲟⲣⲙⲉⲕ ⲛ̀ϫⲉ ϩⲁⲛⲣⲱⲙⲓ ⲛ̀ⲁⲥⲉⲃⲏⲥ ⲟⲩⲇⲉ ⲙ̀ⲡⲉⲣⲟⲩⲱϣ ⲉ̀ϣⲱⲡ ⲁⲩϣⲁⲛϯϩⲟ ⲉ̀ⲣⲟⲕ ⲉⲩϫⲱ ⲙ̀ⲙⲟⲥ							 υἱέ, µή σε πλανήσωσιν ἄνδρες ἀσεβεῖς, µηδὲ βουληθῇς, ἐὰν παρακαλέσωσί σε λέγοντες	 My son, let not ungodly men lead thee astray, neither consent thou to them.	 ⲡⲁϣⲏⲣⲉ ⲙ̅ⲡⲣ̅ⲧⲣⲉ ϩⲉⲛⲣⲱⲙⲉ ⲛ̅ⲣⲉϥⲣⲛⲟⲃⲉ ⲡⲗⲁⲛⲁ ⲙ̅ⲙⲟⲕ ⲟⲩⲇⲉ ⲙ̅ⲡⲣ̅ⲟⲩⲱϣ ⲉⲩϣⲁⲛⲥⲉⲡⲥⲱⲡⲕ̅ ⲉⲩϫⲱ ⲙ̅ⲙⲟⲥ.
Proverbs	1	11	 ϫⲉ ⲁⲙⲟⲩ ⲁⲣⲓϣⲫⲏⲣ ⲛⲉⲙⲁⲛ ⲉⲩⲥⲛⲟϥ ⲟⲩⲟϩ ⲛ̀ⲧⲉⲛⲭⲱⲡ ϧⲉⲛ ⲡⲕⲁϩⲓ ⲛ̀ⲟⲩⲣⲱⲙⲓ ⲛ̀ⲑⲙⲏⲓ ϧⲉⲛ ⲟⲩⲙⲉⲧⲟϫⲓ							 Ἐλθὲ µεθ’ ἡµῶν, κοινώνησον αἵµατος, κρύψωµεν δὲ εἰς γῆν ἄνδρα δίκαιον ἀδίκως,	 If they should exhort thee, saying, Come with us, partake in blood, and let us unjustly hide the just man in the earth:	 ϫⲉ ⲁⲙⲟⲩ ⲛⲙ̅ⲙⲁⲛ ⲛⲅ̅ⲕⲟⲓⲛⲱⲛⲓ ⲉⲡⲉⲓϩⲱⲧⲃ̅ ⲛ̅ⲧⲛ̅ϩⲱⲡ ⲇⲉ ⲉⲡⲕⲁϩ ⲛ̅ⲟⲩⲣⲱⲙⲉ ⲛ̅ⲇⲓⲕⲁⲓⲟⲥ ϩⲛ̅ ⲟⲩϫⲓ ⲛ̅ϭⲟⲛⲥ̅.
Proverbs	1	12	 ⲙⲁⲣⲉⲛⲟⲙⲕϥ ⲇⲉ ⲉϥⲟⲛϧ ⲙ̀ⲫⲣⲏϯ ⲛ̀ⲁⲙⲉⲛϯ ⲟⲩⲟϩ ⲛ̀ⲧⲉⲛⲱⲗⲓ ⲙ̀ⲡⲉϥⲙⲉⲩⲓ ⲉ̀ⲃⲟⲗ ϩⲓϫⲉⲛ ⲡⲕⲁϩⲓ							 καταπίωµεν δὲ αὐτὸν ὥσπερ ᾅδης ζῶντα καὶ ἄρωµεν αὐτοῦ τὴν µνήµην ἐκ γῆς·	 and let us swallow him alive, as Hades would, and remove the memorial of him from the earth:	 ⲛ̅ⲧⲛ̅ⲟⲙⲕϥ ⲇⲉ ⲛ̅ⲑⲉ ⲛ̅ⲁⲙⲛ̅ⲧⲉ ⲉϥⲟⲛϩ̅ ⲁⲩⲱ ⲛ̅ⲧⲛ̅ϥⲓ ⲙ̅ⲡⲉϥⲣ̅ⲡⲙⲉⲉⲩⲉ ⲉⲃⲟⲗ ϩⲓϫⲙ̅ ⲡⲕⲁϩ.
Proverbs	1	13	 ⲧⲉϥⲕⲧⲏⲥⲓⲥ ⲉⲑⲛⲁϣⲉⲛⲥ ⲙⲁⲣⲉⲛⲧⲁϩⲟⲥ ⲙⲁⲣⲉⲛⲙⲁϩ ⲛⲉⲛⲏⲓ ⲇⲉ ⲛ̀ϣⲱⲗ							 τὴν κτῆσιν αὐτοῦ τὴν πολυτελῆ καταλαβώµεθα, πλήσωµεν δὲ οἴκους ἡµετέρους σκύλων·	 let us seize on his valuable property, and let us fill our houses with spoils:	 ⲛ̅ⲧⲛ̅ϫⲡⲟ ⲛⲁⲛ ⲛ̅ⲛⲉϥⲛ̅ⲕⲁ ⲉⲧⲛⲁϣⲱⲟⲩ ⲛ̅ⲧⲛ̅ⲙⲉϩ ⲛⲉⲛⲏⲓ̈ ⲛ̅ϣⲱⲗ.
Proverbs	1	14	 ⲡⲉⲕⲕⲗⲏⲣⲟⲥ ϩⲓⲧϥ ⲛ̀ϧⲏⲧⲕ ⲟⲩⲁⲥⲟⲩⲓ ⲇⲉ ⲙⲁⲣⲉⲛϫⲫⲟⲥ ⲛⲁⲛ ⲧⲏⲣⲟⲩ ⲉⲩⲥⲟⲡ ⲟⲩⲟϩ ⲟⲩⲁⲥⲟⲩⲓ ⲛ̀ⲟⲩⲱⲧ ⲙⲁⲣⲉⲥϣⲱⲡⲓ ⲛⲁⲛ							 τὸν δὲ σὸν κλῆρον βάλε ἐν ἡµῖν, κοινὸν δὲ βαλλάντιον κτησώµεθα πάντες, καὶ µαρσίππιον ἓν γενηθήτω ἡµῖν.	 but do thou cast in thy lot with us, and let us all provide a common purse, and let us have one pouch:	 ⲛⲅ̅ⲛⲟⲩϫⲉ ⲙ̅ⲡⲉⲕⲕⲗⲏⲣⲟⲥ ⲛⲙ̅ⲙⲁⲛ ⲛ̅ⲧⲉ ⲟⲩⲧⲱⲱⲙⲉ ⲛ̅ⲟⲩⲱⲧ ϣⲱⲡⲉ ⲛⲁⲛ.
Proverbs	1	15	 ⲙ̀ⲡⲉⲣⲙⲟϣⲓ ϩⲓ ⲫⲙⲱⲓⲧ ⲛⲉⲙⲱⲟⲩ ⲣⲓⲕⲓ ⲇⲉ ⲛ̀ⲧⲉⲕϭⲁⲗⲟϫ ⲉ̀ⲃⲟⲗ ϩⲓ ⲛⲟⲩⲙⲱⲓⲧ							 µὴ πορευθῇς ἐν ὁδῷ µετ’ αὐτῶν, ἔκκλινον δὲ τὸν πόδα σου ἐκ τῶν τρίβων αὐτῶν·	 go not in the way with them, but turn aside thy foot from their paths:	 ⲡⲁϣⲏⲣⲉ ⲙ̅ⲡⲣ̅ⲃⲱⲕ ϩⲓ ⲧⲉϩⲓⲏ ⲛⲙ̅ⲙⲁⲩ ⲣⲉⲕⲧ̅ ⲧⲉⲕⲟⲩⲉⲣⲏⲧⲉ ⲇⲉ ⲉⲃⲟⲗ ϩⲛ̅ ⲛⲉⲩϩⲓⲟⲟⲩⲉ.
Proverbs	1	16								 οἱ γὰρ πόδες αὐτῶν εἰς κακίαν τρέχουσιν καὶ ταχινοὶ τοῦ ἐκχέαι αἷµα·		 ⲉⲣⲉ ⲛⲉⲩⲟⲩⲉⲣⲏⲧⲉ ⲅⲁⲣ ⲡⲏⲧ ⲉⲧⲕⲁⲕⲓⲁ ⲁⲩⲱ ⲥⲉϭⲉⲡⲏ ⲉⲡⲛ̅ⲥⲛⲟϥ ⲉⲃⲟⲗ.
Proverbs	1	17	 ⲁⲩⲫⲱⲣϣ ⲅⲁⲣ ⲛ̀ⲛⲟⲩϣⲛⲏⲟⲩ ⲉ̀ⲃⲟⲗ ⲉ̀ϫⲉⲛ ⲛⲓϩⲁⲗⲁϯ ϧⲉⲛ ⲟⲩⲙⲉⲧⲟϫⲓ							 οὐ γὰρ ἀδίκως ἐκτείνεται δίκτυα πτερωτοῖς.	 for nets are not without cause spread for birds.	 ⲛ̅ⲛⲉⲩⲡⲣϣ̅ ϣⲛⲉ ⲅⲁⲣ ⲁⲛ ⲉⲃⲟⲗ ⲉⲛϩⲁⲗⲁⲧⲉ ⲉⲡⲣⲁ.
Proverbs	1	18	 ⲛ̀ⲑⲱⲟⲩ ⲅⲁⲣ ⲛⲏ ⲉⲧⲟⲓ ⲛ̀ϣⲫⲏⲣ ⲉ̀ϩⲁⲛϧⲱⲧⲉⲃ ⲥⲉϩⲓⲟⲩⲓ ⲛⲱⲟⲩ ⲉ̀ϧⲟⲩⲛ ⲛ̀ϩⲁⲛⲡⲉⲧϩⲱⲟⲩ ⲫⲟⲩⲱϫⲡ ⲇⲉ ⲛ̀ⲧⲉ ⲛⲓⲣⲱⲙⲓ ⲙ̀ⲡⲁⲣⲁⲛⲟⲙⲟⲥ ϥϩⲱⲟⲩ							 αὐτοὶ γὰρ οἱ φόνου µετέχοντες θησαυρίζουσιν ἑαυτοῖς κακά, ἡ δὲ καταστροφὴ ἀνδρῶν παρανόµων κακή.	 For they that are concerned in murder store up evils for themselves; and the overthrow of transgressors is evil.	 ⲛ̅ⲧⲟⲟⲩ ⲅⲁⲣ ⲉⲩⲙⲉⲧⲉⲭⲉ ⲉϩⲉⲛⲥⲛⲟϥ ⲉⲩⲥⲉⲩϩ ⲡⲉⲑⲟⲟⲩ ⲛⲁⲩ ⲉϩⲟⲩⲛ.
Proverbs	1	19	 ⲛⲁⲓ ⲛⲉ ⲛⲓⲙⲱⲓⲧ ⲛ̀ⲧⲉ ⲟⲩⲟⲛ ⲛⲓⲃⲉⲛ ⲉⲧϫⲱⲕ ⲛ̀ⲛⲓⲁⲛⲟⲙⲓⲁ ⲉ̀ⲃⲟⲗ ⲛ̀ϧⲣⲏⲓ ⲅⲁⲣ ϧⲉⲛ ⲟⲩⲙⲉⲧⲁⲥⲉⲃⲏⲥ ⲥⲉⲱⲗⲓ ⲛ̀ⲛⲟⲩⲯⲩⲭⲏ ⲙ̀ⲙⲓⲛ ⲙ̀ⲙⲱⲟⲩ							 αὗται αἱ ὁδοί εἰσιν πάντων τῶν συντελούντων τὰ ἄνοµα· τῇ γὰρ ἀσεβείᾳ τὴν ἑαυτῶν ψυχὴν ἀφαιροῦνται.	 These are the ways of all that perform lawless deeds; for by ungodliness they destroy their own life.	 ⲛⲁⲓ̈ ⲛⲉ ⲛⲉϩⲓⲟⲟⲩⲉ ⲛ̅ⲟⲩⲟⲛ ⲛⲓⲙ ⲉⲧϫⲱⲕ ⲉⲃⲟⲗ ⲛ̅ⲛ̅ⲛⲟⲃⲉ ⲡϣⲟⲣϣⲣ̅ ⲇⲉ ⲛ̅ⲛ̅ⲣⲱⲙⲉ ⲙ̅ⲡⲁⲣⲁⲛⲟⲙⲟⲥ ϩⲟⲟⲩ  ⲉⲩⲛⲁⲧⲁⲕⲟ ⲅⲁⲣ ⲛ̅ⲧⲉⲩⲯⲩⲭⲏ ϩⲛ̅ ⲧⲉⲩⲙⲛ̅ⲧϣⲁϥⲧ.
Proverbs	1	20	 ϯⲥⲟⲫⲓⲁ ⲇⲉ ⲥⲉϩⲱⲥ ⲉ̀ⲣⲟⲥ ϩⲓ ⲛⲓⲙⲱⲓⲧ ⲉ̀ⲃⲟⲗ ⲟⲩⲟϩ ϧⲉⲛ ⲛⲓⲡⲗⲁⲧⲓⲁ ⲥϣⲱⲡ ϧⲉⲛ ⲟⲩⲡⲁⲣⲣⲏⲥⲓⲁ							 Σοφία ἐν ἐξόδοις ὑµνεῖται, ἐν δὲ πλατείαις παρρησίαν ἄγει,	 Wisdom sings aloud in passages, and in the broad places speaks boldly.	 ⲥⲉⲥⲙⲟⲩ ⲉⲧⲥⲟⲫⲓⲁ ϩⲛ̅ ⲛ̅ϩⲓⲣ ⲁⲩⲱ ⲟⲩⲛ̅ⲧⲥ̅ ⲡⲁⲣⲣⲏⲥⲓⲁ ϩⲛ̅ ⲛⲉⲡⲗⲁⲧⲓⲁ.
Proverbs	1	21	 ⲛ̀ϧⲣⲏⲓ ⲇⲉ ϧⲉⲛ ⲛⲓⲗⲁⲕϩ ⲛ̀ⲧⲉ ⲛⲓⲥⲃⲑⲁⲓⲟⲩ ⲥⲉϩⲓⲱⲓϣ ⲙ̀ⲙⲟⲥ ⲥⲙⲏⲛ ⲇⲉ ϧⲉⲛ ⲛⲓⲡⲩⲗⲏ ⲛ̀ⲧⲉ ⲛⲓϫⲱⲣⲓ ϧⲉⲛ ⲛⲓⲡⲩⲗⲏ ⲛ̀ⲧⲉ ⲛⲓⲃⲁⲕⲓ ⲥϫⲱ ⲙ̀ⲙⲟⲥ ⲉⲣⲉ ⲡⲉⲥϩⲏⲧ ϫⲟⲣ							 ἐπ’ ἄκρων δὲ τειχέων κηρύσσεται, ἐπὶ δὲ πύλαις δυναστῶν παρεδρεύει, ἐπὶ δὲ πύλαις πόλεως θαρροῦσα λέγει	 And she makes proclamation on the top of the walls, and sits by the gates of princes; and at the gates of the city boldly says,	 ⲥⲉⲧⲁϣⲉⲟⲉⲓϣ ⲇⲉ ⲙ̅ⲙⲟⲥ ϩⲓϫⲛ̅ ⲛ̅ⲕⲟⲟϩ ⲛ̅ⲛ̅ⲥⲟⲃⲧ̅ ϣⲁⲥϫⲟⲟⲥ ⲇⲉ ⲉⲥⲧⲏⲕ ⲛ̅ϩⲏⲧ ϩⲓϫⲛ̅ ⲙ̅ⲡⲩⲗⲏ ⲛ̅ⲙ̅ⲡⲟⲗⲓⲥ.
Proverbs	1	22	 ϫⲉ ⲛ̀ⲥⲛⲏⲟⲩ ⲛⲓⲃⲉⲛ ⲉⲣⲉ ⲛⲓⲁⲧⲡⲉⲧϩⲱⲟⲩ ⲛⲁⲁⲙⲟⲛⲓ ⲛ̀ϯⲙⲉⲑⲙⲏⲓ ⲛ̀ⲛⲟⲩϭⲓϣⲓⲡⲓ ⲛⲓⲁⲧϩⲏⲧ ⲉⲩⲟⲓ ⲛ̀ⲣⲉϥⲉⲣⲉⲡⲓⲑⲩⲙⲓⲛ ⲉ̀ⲡϣⲱϣ ⲉⲧⲁⲩⲉⲣⲁⲥⲉⲃⲏⲥ ⲁⲩⲙⲉⲥⲧⲉ ⲡⲓⲕⲁϯ							 Ὅσον ἂν χρόνον ἄκακοι ἔχωνται τῆς δικαιοσύνης, οὐκ αἰσχυνθήσονται· οἱ δὲ ἄφρονες, τῆς ὕβρεως ὄντες ἐπιθυµηταί, ἀσεβεῖς γενόµενοι ἐµίσησαν αἴσθησιν	 So long as the simple cleave to justice, they shall not be ashamed: but the foolish being lovers of haughtiness, having become ungodly have hated knowledge, and are become subject to reproofs.	 ϫⲉ ⲛ̅ⲟⲩⲟⲉⲓϣ ⲛⲓⲙ ⲉⲣⲉ ⲛ̅ⲃⲁⲗϩⲏⲧ ϭⲟⲗϫ̅ ⲛ̅ⲧⲇⲓⲕⲁⲓⲟⲥⲩⲛⲏ ⲥⲉⲛⲁϫⲓϣⲓⲡⲉ ⲁⲛ ⲛ̅ⲁⲑⲏⲧ ⲇⲉ ⲉⲩⲟ ⲛ̅ⲣⲉϥⲉⲡⲓⲑⲩⲙⲓ ⲉⲡⲥⲱϣ ⲛ̅ⲧⲉⲣⲟⲩⲣ̅ⲁⲥⲉⲃⲏⲥ ⲁⲩⲙⲉⲥⲧⲉ ⲧⲁⲓⲥⲑⲏⲥⲓⲥ.
Proverbs	1	23	 ⲟⲩⲟϩ ⲁⲩϣⲱⲡⲓ ⲉⲩⲣⲁⲟⲩⲏⲟⲩⲧ ϧⲉⲛ ϩⲁⲛⲥⲟϩⲓ ϩⲏⲡⲡⲉ ϯⲛⲁⲭⲱ ϧⲁⲧⲉⲛ ⲑⲏⲛⲟⲩ ⲛ̀ⲟⲩⲥⲁϫⲓ ⲛ̀ⲧⲉ ⲡⲁⲛⲓϥⲓ ϯⲛⲁⲥⲁⲃⲱⲧⲉⲛ ⲇⲉ ⲉ̀ⲡⲁⲥⲁϫⲓ							 καὶ ὑπεύθυνοι ἐγένοντο ἐλέγχοις. ἰδοὺ προήσοµαι ὑµῖν ἐµῆς πνοῆς ῥῆσιν, διδάξω δὲ ὑµᾶς τὸν ἐµὸν λόγον.	 Behold, I will bring forth to you the utterance of my breath, and I will instruct you in my speech.	 ⲁⲩⲱ ⲁⲩϣⲱⲡⲉ ⲉⲩϭⲏⲡ ⲉϩⲉⲛϫⲡⲓⲟ ⲉⲓⲥ ϩⲏⲏⲧⲉ ϯⲛⲁϫⲱ ⲛⲏⲧⲛ̅ ⲙ̅ⲡϣⲁϫⲉ ⲛ̅ⲧⲁⲡⲛⲟⲏ ϯⲛⲁⲧⲥⲁⲃⲱⲧⲛ̅ ⲇⲉ ⲉⲡⲁϣⲁϫⲉ.
Proverbs	1	24	 ⲉ̀ⲡⲓⲇⲏ ⲁⲓⲙⲟⲩϯ ⲟⲩⲟϩ ⲙ̀ⲡⲉⲧⲉⲛⲥⲱⲧⲉⲙ ⲟⲩⲟϩ ⲛⲁⲓⲫⲱⲣϣ ⲛ̀ⲛⲁϫⲓϫ ⲉ̀ⲃⲟⲗ ⲛⲁⲣⲉⲧⲉⲛϯ ⲛ̀ϩⲑⲏⲧⲉⲛ ⲁⲛ ⲡⲉ							 ἐπειδὴ ἐκάλουν καὶ οὐχ ὑπηκούσατε καὶ ἐξέτεινον λόγους καὶ οὐ προσείχετε,	 Since I called, and ye did not hearken; and I spoke at length, and ye gave no heed;	 ⲉⲡⲉⲓⲇⲏ ⲁⲓ̈ⲙⲟⲩⲧⲉ ⲉⲣⲱⲧⲛ̅ ⲙ̅ⲡⲉⲧⲛ̅ⲥⲱⲧⲙ̅ ⲉⲣⲟⲓ̈ ⲁⲩⲱ ⲁⲓ̈ⲡⲣϣ̅ ⲛⲁϣⲁϫⲉ ⲉⲃⲟⲗ ⲙ̅ⲡⲉⲧⲛ̅ϯϩⲧⲏⲧⲛ̅.
Proverbs	1	25	 ⲁⲗⲗⲁ ⲁⲣⲉⲧⲉⲛⲓⲣⲓ ⲛ̀ⲛⲁⲥⲟϭⲛⲓ ϩⲱⲥ ⲛ̀ⲥⲉⲧⲧⲁϫⲣⲏⲟⲩⲧ ⲁⲛ ⲛⲁⲥⲟϩⲓ ⲇⲉ ⲛⲁⲣⲉⲧⲉⲛϯ ⲛ̀ϩⲑⲏⲧⲉⲛ ⲉ̀ⲣⲱⲟⲩ ⲁⲛ ⲡⲉ							 ἀλλὰ ἀκύρους ἐποιεῖτε ἐµὰς βουλάς, τοῖς δὲ ἐµοῖς ἐλέγχοις ἠπειθήσατε,	 but ye set at nought my counsels, and disregarded my reproofs;	 ⲁⲗⲗⲁ ⲁⲧⲉⲧⲛ̅ⲧⲥ̅ⲧⲟ ⲉⲃⲟⲗ ⲛ̅ⲛⲁϣⲟϫⲛⲉ ⲁⲩⲱ ⲁⲧⲉⲧⲛ̅ⲣ̅ⲁⲧⲥⲱⲧⲙ̅ ⲛ̅ⲥⲁ ⲛⲁϫⲡⲓⲟ.
Proverbs	1	26	 ⲉⲑⲃⲉⲫⲁⲓ ⲁ̀ⲛⲟⲕ ϩⲱ ϯⲛⲁⲥⲱⲃⲓ ⲉ̀ϩⲣⲏⲓ ⲉ̀ϫⲉⲛ ⲧⲉⲧⲉⲛⲁⲕⲱ ϯⲛⲁⲣⲁϣⲓ ⲇⲉ ⲉ̀ϣⲱⲡ ⲁϥϣⲁⲛⲓ̀ ⲉ̀ϫⲉⲛ ⲑⲏⲛⲟⲩ ⲛ̀ϫⲉ ⲟⲩϥⲱϯ ⲉ̀ⲃⲟⲗ							 τοιγαροῦν κἀγὼ τῇ ὑµετέρᾳ ἀπωλείᾳ ἐπιγελάσοµαι, καταχαροῦµαι δέ, ἡνίκα ἂν ἔρχηται ὑµῖν ὄλεθρος,	 therefore I also will laugh at your destruction; and I will rejoice against you when ruin comes upon you:	 ⲉⲧⲃⲉ ⲡⲁⲓ ϩⲱ ϯⲛⲁⲥⲱⲃⲉ ⲛ̅ⲥⲁ ⲡⲉⲧⲛ̅ⲧⲁⲕⲟ ϯⲛⲁⲣⲁϣⲉ ⲇⲉ ⲙ̅ⲙⲱⲧⲛ̅ ⲉⲣϣⲁⲛ ⲡⲧⲁⲕⲟ ⲉⲓ ⲉϫⲱⲧⲛ̅.
Proverbs	1	27	 ⲉ̀ϣⲱⲡ ⲁϥϣⲁⲛⲓ̀ ⲉ̀ϫⲉⲛ ⲑⲏⲛⲟⲩ ⲛ̀ϫⲉ ⲟⲩϣⲑⲟⲣⲧⲉⲣ ⲛ̀ⲟⲩϩⲟϯ ϧⲉⲛ ⲟⲩϩⲟϯ ⲟⲩⲟϩ ⲛ̀ⲧⲉϥⲓ̀ ⲛ̀ϫⲉ ⲡⲓⲱϫⲡ ⲙ̀ⲫⲣⲏϯ ⲛ̀ⲟⲩⲥⲁⲣⲁⲑⲏⲟⲩ ⲟⲩⲟϩ ⲁϥϣⲁⲛⲓ̀ ⲉ̀ϫⲱⲧⲉⲛ ⲛ̀ϫⲉ ⲟⲩϩⲟϫϩⲉϫ ⲛⲉⲙ ⲟⲩⲧⲁⲕⲟ							 καὶ ὡς ἂν ἀφίκηται ὑµῖν ἄφνω θόρυβος, ἡ δὲ καταστροφὴ ὁµοίως καταιγίδι παρῇ, καὶ ὅταν ἔρχηται ὑµῖν θλῖψις καὶ πολιορκία, ἢ ὅταν ἔρχηται ὑµῖν ὄλεθρος.	 yea when dismay suddenly comes upon you, and your overthrow shall arrive like a tempest; and when tribulation and distress shall come upon you, or when ruin shall come upon you.	 ⲁⲩⲱ ⲉⲣϣⲁⲛ ⲡⲉϣⲧⲟⲣⲧⲣ̅ ⲧⲁϩⲉ ⲧⲏⲩⲧⲛ̅ ϩⲛ̅ ⲟⲩϣⲥ̅ⲛⲉ ⲛ̅ⲧⲉ ⲡϣⲟⲣϣⲣ̅ ⲉⲓ ⲉϫⲱⲧⲛ̅ ⲛ̅ⲑⲉ ⲛ̅ⲟⲩϩⲁⲧⲏⲩ ⲏ ⲉⲣϣⲁⲛ ⲡⲧⲁⲕⲟ ⲉⲓ ⲉϫⲱⲧⲛ̅ ⲁⲩⲱ ⲉⲣϣⲁⲛ ⲟⲩⲑⲗⲓⲯⲓⲥ ⲉⲓ ⲛⲏⲧⲛ̅ ⲙⲛ̅ ⲟⲩⲕⲧⲟ ⲉⲣⲱⲧⲛ̅.
Proverbs	1	28	 ⲉⲥⲉ̀ϣⲱⲡⲓ ⲅⲁⲣ ⲁⲣⲉⲧⲉⲛϣⲁⲛϯϩⲟ ⲉⲣⲟⲓ ⲁ̀ⲛⲟⲕ ⲇⲉ ⲛ̀ⲛⲁⲥⲱⲧⲉⲙ ⲉ̀ⲣⲱⲧⲉⲛ ⲉⲩⲉ̀ⲕⲱϯ ⲛ̀ⲥⲱⲓ ⲛ̀ϫⲉ ϩⲁⲛⲥⲁⲙⲡⲉⲧϩⲱⲟⲩ ⲟⲩⲟϩ ⲛ̀ⲛⲟⲩϫⲉⲙⲧ							 ἔσται γὰρ ὅταν ἐπικαλέσησθέ µε, ἐγὼ δὲ οὐκ εἰσακούσοµαι ὑµῶν· ζητήσουσίν µε κακοὶ καὶ οὐχ εὑρήσουσιν.	 For it shall be that when ye call upon me, I will not hearken to you: wicked men shall seek me, but shall not find me.	 ⲥⲛⲁϣⲱⲡⲉ ⲅⲁⲣ ⲛ̅ⲧⲉⲧⲛ̅ⲙⲟⲩⲧⲉ ⲉϩⲣⲁⲓ̈ ⲟⲩⲃⲏⲓ ⲁⲛⲟⲕ ⲇⲉ ⲛ̅ⲧⲁⲧⲙ̅ⲥⲱⲧⲙ̅ ⲉⲣⲱⲧⲛ̅ ⲛⲉⲑⲟⲟⲩ ⲛⲁϣⲓⲛⲉ ⲛ̅ⲥⲱⲓ̈ ⲛ̅ⲥⲉⲧⲙ̅ϭⲛⲧ̅.
Proverbs	1	29	 ⲁⲩⲙⲉⲥⲧⲉ ϯⲥⲟⲫⲓⲁ ⲅⲁⲣ ⲟⲩⲟϩ ϯϩⲟϯ ⲛ̀ⲧⲉ ⲡϭⲟⲓⲥ ⲙ̀ⲡⲟⲩⲥⲟⲧⲡⲥ ⲛⲱⲟⲩ							 ἐµίσησαν γὰρ σοφίαν, τὸν δὲ φόβον τοῦ κυρίου οὐ προείλαντο	 For they hated wisdom, and did not choose the word of the Lord:	 ⲁⲩⲙⲉⲥⲧⲉ ⲧⲥⲟⲫⲓⲁ ⲅⲁⲣ ⲁⲩⲱ ⲙ̅ⲡⲟⲩⲥⲱⲧⲡ̅ ⲛⲁⲩ ⲛ̅ⲧⲙⲛ̅ⲧⲙⲁⲓⲛⲟⲩⲧⲉ.
Proverbs	1	30	 ⲟⲩⲇⲉ ⲛⲁⲩⲟⲩⲱϣ ⲁⲛ ⲡⲉ ⲉ̀ϯϩⲑⲏⲟⲩ ⲉ̀ⲛⲁⲥⲟϭⲛⲓ ⲛⲁⲩⲉⲗⲕϣⲁⲓ ⲇⲉ ⲛ̀ⲥⲁ ⲛⲁⲥⲁϫⲓ							 οὐδὲ ἤθελον ἐµαῖς προσέχειν βουλαῖς, ἐµυκτήριζον δὲ ἐµοὺς ἐλέγχους.	 neither would they attend to my counsels, but derided my reproofs.	 ⲁⲩⲱ ⲙ̅ⲡⲟⲩⲉϣϯϩⲧⲏⲩ ⲉⲛⲁϣⲟϫⲛⲉ ⲁⲩⲗⲕϣⲁ ⲇⲉ ⲛ̅ⲥⲁ ⲛⲁϫⲡⲓⲟ.
Proverbs	1	31	 ⲉⲑⲃⲉⲫⲁⲓ ⲟⲩⲛ ⲉⲩⲉ̀ⲟⲩⲱⲙ ⲙ̀ⲡⲓⲟⲩⲧⲁϩ ⲛ̀ⲧⲉ ⲡⲟⲩⲙⲱⲓⲧ ⲟⲩⲟϩ ⲉⲩⲉ̀ⲥⲓ ⲛ̀ⲧⲟⲩⲙⲉⲧⲁⲥⲉⲃⲏⲥ							 τοιγαροῦν ἔδονται τῆς ἑαυτῶν ὁδοῦ τοὺς καρποὺς καὶ τῆς ἑαυτῶν ἀσεβείας πλησθήσονται·	 Therefore shall they eat the fruits of their own way, and shall be filled with their own ungodliness.	 ⲉⲧⲃⲉ ⲡⲁⲓ ϭⲉ ⲥⲉⲛⲁⲟⲩⲱⲙ ⲛ̅ⲛ̅ⲕⲁⲣⲡⲟⲥ ⲛ̅ⲧⲉⲩϩⲓⲏ ⲁⲩⲱ ⲥⲉⲛⲁⲥⲉⲓ ⲛ̅ⲧⲉⲩⲙⲛ̅ⲧϣⲁϥⲧⲉ.
Proverbs	1	32	 ⲉ̀ⲫⲙⲁ ⲅⲁⲣ ϫⲉ ⲛⲁⲩϭⲓ ⲛ̀ⲛⲓⲁⲗⲱⲟⲩⲓ ⲛ̀ϫⲟⲛⲥ ⲟⲩⲟϩ ⲉⲩⲉ̀ϧⲟⲑⲃⲟⲩ ⲟⲩϫⲉⲙⲡϣⲓⲛⲓ ⲉϥⲉ̀ⲧⲁⲕⲟ ⲛⲛⲓⲁⲥⲉⲃⲏⲥ							 ἀνθ’ ὧν γὰρ ἠδίκουν νηπίους, φονευθήσονται, καὶ ἐξετασµὸς ἀσεβεῖς ὀλεῖ.	 For because they wronged the simple, they shall be slain; and an inquisition shall ruin the ungodly.	 ⲉⲃⲟⲗ ⲅⲁⲣ ϫⲉ ⲁⲩϫⲓ ϩⲉⲛⲕⲟⲩⲓ̈ ⲛ̅ϭⲟⲛⲥ̅ ⲥⲉⲛⲁϩⲟⲧⲃⲟⲩ ⲁⲩⲱ ⲡⲉϫⲛⲟ ⲛⲁⲧⲁⲕⲉ ⲛ̅ⲁⲥⲉⲃⲏⲥ.
Proverbs	1	33	 ⲫⲏ ⲉⲧⲛⲁⲥⲱⲧⲉⲙ ⲛ̀ⲥⲱⲓ ⲉϥⲉ̀ϣⲱⲡⲓ ϧⲉⲛ ⲟⲩϩⲉⲗⲡⲓⲥ ⲟⲩⲟϩ ⲉϥⲉ̀ⲙⲧⲟⲛ ⲙ̀ⲙⲟϥ ϧⲉⲛ ⲟⲩⲙⲉⲧⲁⲧϩⲟϯ ⲉ̀ⲃⲟⲗ ϩⲁ ⲡⲉⲧϩⲱⲟⲩ ⲛⲓⲃⲉⲛ							 ὁ δὲ ἐµοῦ ἀκούων κατασκηνώσει ἐπ’ ἐλπίδι καὶ ἡσυχάσει ἀφόβως ἀπὸ παντὸς κακοῦ.	 But he that hearkens to me shall dwell in confidence, and shall rest securely from all evil.	 ⲡⲉⲧⲥⲱⲧⲙ̅ ⲇⲉ ⲉⲣⲟⲓ̈ ϥⲛⲁⲙ̅ⲧⲟⲛ ⲙ̅ⲙⲟϥ ϩⲛ̅ ⲟⲩⲉⲓⲣⲏⲛⲏ ⲉϥⲧⲁϫⲣⲏⲩ ⲁⲩⲱ ϥⲛⲁϭⲱ ⲁϫⲛ̅ ϩⲟⲧⲉ ⲉⲃⲟⲗ ⲙ̅ⲡⲉⲑⲟⲟⲩ ⲛⲓⲙ.
Proverbs	2	1	 ⲡⲁϣⲏⲣⲓ ⲉ̀ϣⲱⲡ ⲁⲕϣⲁⲛϭⲓ ⲛ̀ⲛⲁⲥⲁϫⲓ ⲛ̀ⲧⲉ ⲛⲁⲉⲛⲧⲟⲗⲏ ⲛ̀ⲧⲉⲕⲭⲟⲡⲟⲩ ⲛ̀ϧⲏⲧⲕ							 Υἱέ, ἐὰν δεξάµενος ῥῆσιν ἐµῆς ἐντολῆς κρύψῃς παρὰ σεαυτῷ,	 My son, if thou wilt receive the utterance of my commandment, and hide it with thee;	 ⲡⲁϣⲏⲣⲉ ⲉⲕϣⲁⲛϫⲓ ⲛ̅ⲛ̅ϣⲁϫⲉ ⲛ̅ⲧⲁⲉⲛⲧⲟⲗⲏ ⲛⲅ̅ϩⲟⲡⲟⲩ ϩⲁϩⲧⲏⲕ.
Proverbs	2	2	 ⲡⲉⲕⲙⲁϣϫ ⲉϥⲉ̀ⲥⲱⲧⲉⲙ ⲉ̀ⲟⲩⲥⲟⲫⲓⲁ ⲟⲩⲟϩ ⲉⲕⲉ̀ϯ ⲙ̀ⲡⲉⲕϩⲏⲧ ⲉ̀ⲟⲩⲕⲁϯ ⲟⲩⲟϩ ⲉⲕⲉ̀ⲧⲏⲓϥ ⲛ̀ⲥⲃⲱ ⲙ̀ⲡⲉⲕϣⲏⲣⲓ							 ὑπακούσεται σοφίας τὸ οὖς σου, καὶ παραβαλεῖς καρδίαν σου εἰς σύνεσιν, παραβαλεῖς δὲ αὐτὴν ἐπὶ νουθέτησιν τῷ υἱῷ σου.	 thine ear shall hearken to wisdom; thou shalt also apply thine heart to understanding, and shalt apply it to the instruction of thy son.	 ⲡⲉⲕⲙⲁⲁϫⲉ ⲛⲁⲥⲱⲧⲙ̅ ⲛ̅ⲥⲁ ⲧⲥⲟⲫⲓⲁ ⲡⲉ ⲁⲩⲱ ⲕⲛⲁϯ ⲙ̅ⲡⲉⲕϩⲏⲧ ⲉⲩⲙⲛ̅ⲧⲥⲁⲃⲉ ⲛⲅ̅ⲧⲁⲁⲥ ⲇⲉ ⲙ̅ⲡⲉⲕϣⲏⲣⲉ ⲛ̅ⲥⲃⲱ.
Proverbs	2	3	 ⲉ̀ϣⲱⲡ ⲇⲉ ⲁⲕϣⲁⲛⲧⲱⲃϩ ⲛ̀ⲥⲁ ϯⲥⲟⲫⲓⲁ ⲟⲩⲟϩ ⲛ̀ⲧⲉⲕϯ ⲙ̀ⲡⲉⲕϧⲣⲱⲟⲩ ϧⲉⲛ ⲟⲩⲕⲁϯ ⲟⲩⲟϩ ⲛ̀ⲧⲉⲕⲕⲱϯ ⲛ̀ⲥⲁ ϯⲉⲥⲑⲉⲥⲓⲥ ϧⲉⲛ ⲟⲩⲛⲓϣϯ ⲛ̀ⲥⲙⲏ							 ἐὰν γὰρ τὴν σοφίαν ἐπικαλέσῃ καὶ τῇ συνέσει δῷς φωνήν σου, τὴν δὲ αἴσθησιν ζητήσῃς µεγάλῃ τῇ φωνῇ,	 For it thou shalt call to wisdom, and utter thy voice for understanding;	 ⲉϣⲱⲡⲉ ⲅⲁⲣ ⲉⲣⲕϣⲁⲛⲙⲟⲩⲧⲉ ⲟⲩⲃⲉ ⲧⲥⲟⲫⲓⲁ ⲛⲅ̅ⲙⲟⲩⲧⲉ ⲇⲉ ⲉⲧⲁⲓⲥⲑⲏⲥⲓⲥ ϩⲛ̅ ⲟⲩⲛⲟϭ ⲛ̅ⲥⲙⲏ.
